20:21:46.731506 IP 192.168.1.30.33754 > 192.168.1.10.6633: Flags [.], seq 959917716:959919164, ack 1601796790, win 361, options [nop,nop,TS val 64253604 ecr 65614406], length 1448: OpenFlow
	version unknown (0x30), type 0x01, length 12289, xid 0x30013001 [|openflow]
20:21:46.734994 IP 192.168.1.10.6633 > 192.168.1.30.33754: Flags [.], ack 0, win 4355, options [nop,nop,TS val 65614446 ecr 64253571], length 0
20:21:46.735933 IP 192.168.1.30.33754 > 192.168.1.10.6633: Flags [.], seq 1448:2896, ack 1, win 361, options [nop,nop,TS val 64253604 ecr 65614446], length 1448: OpenFlow
	version unknown (0x30), type 0x01, length 12289, xid 0x30013001 [|openflow]
20:21:46.735953 IP 192.168.1.30.33754 > 192.168.1.10.6633: Flags [.], seq 2896:5792, ack 1, win 361, options [nop,nop,TS val 64253604 ecr 65614446], length 2896: OpenFlow
	version unknown (0x30), type 0x01, length 12289, xid 0x30013001 [|openflow]
20:21:46.735962 IP 192.168.1.30.33754 > 192.168.1.10.6633: Flags [.], seq 5792:8688, ack 1, win 361, options [nop,nop,TS val 64253604 ecr 65614446], length 2896: OpenFlow
	version unknown (0x30), type 0x01, length 12289, xid 0x30013001 [|openflow]
20:21:46.735983 IP 192.168.1.30.33754 > 192.168.1.10.6633: Flags [.], seq 8688:11584, ack 1, win 361, options [nop,nop,TS val 64253604 ecr 65614446], length 2896: OpenFlow
	version unknown (0x39), type 0x01, length 13569, xid 0x30016101 [|openflow]
20:21:46.735992 IP 192.168.1.30.33754 > 192.168.1.10.6633: Flags [.], seq 11584:14480, ack 1, win 361, options [nop,nop,TS val 64253604 ecr 65614446], length 2896: OpenFlow
	version unknown (0x66), type 0x01, length 26113, xid 0x61013001 [|openflow]
20:21:46.736011 IP 192.168.1.30.33754 > 192.168.1.10.6633: Flags [.], seq 14480:17376, ack 1, win 361, options [nop,nop,TS val 64253604 ecr 65614446], length 2896: OpenFlow
	version unknown (0x38), type 0x01, length 12289, xid 0x65016601 [|openflow]
20:21:46.736020 IP 192.168.1.30.33754 > 192.168.1.10.6633: Flags [.], seq 17376:20272, ack 1, win 361, options [nop,nop,TS val 64253604 ecr 65614446], length 2896: OpenFlow
	version unknown (0x62), type 0x01, length 12289, xid 0x38013301 [|openflow]
20:21:46.736041 IP 192.168.1.30.33754 > 192.168.1.10.6633: Flags [.], seq 20272:23168, ack 1, win 361, options [nop,nop,TS val 64253604 ecr 65614446], length 2896: OpenFlow
	version unknown (0x75), type 0xc0, length 14592, xid 0xff000101 [|openflow]
20:21:46.736049 IP 192.168.1.30.33754 > 192.168.1.10.6633: Flags [.], seq 23168:26064, ack 1, win 361, options [nop,nop,TS val 64253604 ecr 65614446], length 2896: OpenFlow
	version unknown (0x00), type 0x01, length 1653, xid 0x62756e74
	version unknown (0xff), type 0xff, length 65535, xid 0x01410100 [|openflow]
20:21:46.736070 IP 192.168.1.30.33754 > 192.168.1.10.6633: Flags [.], seq 26064:28960, ack 1, win 361, options [nop,nop,TS val 64253604 ecr 65614446], length 2896: OpenFlow
	version unknown (0x6c), type 0x6f, length 25441, xid 0x6c0000ff [|openflow]
20:21:46.736078 IP 192.168.1.30.33754 > 192.168.1.10.6633: Flags [.], seq 28960:31856, ack 1, win 361, options [nop,nop,TS val 64253604 ecr 65614446], length 2896: OpenFlow
	version unknown (0x6f), type 0x6e, length 1119, xid 0x74637005
	version 1.0, type ERROR, length 25089, xid 0x30013801 [|openflow]
20:21:46.736475 IP 192.168.1.10.6633 > 192.168.1.30.33754: Flags [.], ack 31856, win 4453, options [nop,nop,TS val 65614456 ecr 64253604], length 0
20:21:46.736599 IP 192.168.1.30.33754 > 192.168.1.10.6633: Flags [.], seq 31856:34752, ack 1, win 361, options [nop,nop,TS val 64253604 ecr 65614446], length 2896: OpenFlow
	version unknown (0x6f), type 0x72, length 27507, xid 0x74617469 [|openflow]
20:21:46.738007 IP 192.168.1.10.6633 > 192.168.1.30.33754: Flags [.], ack 34752, win 5120, options [nop,nop,TS val 65614456 ecr 64253604], length 0
20:21:46.738483 IP 192.168.1.30.33754 > 192.168.1.10.6633: Flags [.], seq 34752:37648, ack 1, win 361, options [nop,nop,TS val 64253604 ecr 65614456], length 2896: OpenFlow
	version unknown (0x38), type 0x3a, length 12386, xid 0x5d0c5f77 [|openflow]
20:21:46.738492 IP 192.168.1.30.33754 > 192.168.1.10.6633: Flags [.], seq 37648:40544, ack 1, win 361, options [nop,nop,TS val 64253604 ecr 65614456], length 2896: OpenFlow
	version unknown (0x3a), type 0x30, length 24890, xid 0x30383a33 [|openflow]
20:21:46.738516 IP 192.168.1.30.33754 > 192.168.1.10.6633: Flags [.], seq 40544:43440, ack 1, win 361, options [nop,nop,TS val 64253604 ecr 65614456], length 2896: OpenFlow
	version unknown (0x75), type 0x20, length 23393, xid 0x323a3539 [|openflow]
20:21:46.738525 IP 192.168.1.30.33754 > 192.168.1.10.6633: Flags [.], seq 43440:46336, ack 1, win 361, options [nop,nop,TS val 64253604 ecr 65614456], length 2896: OpenFlow
	version unknown (0x00), type 0x00, length 6773, xid 0x62756e74 [|openflow]
20:21:46.738546 IP 192.168.1.30.33754 > 192.168.1.10.6633: Flags [.], seq 46336:49232, ack 1, win 361, options [nop,nop,TS val 64253604 ecr 65614456], length 2896: OpenFlow
	version unknown (0x00), type 0x00, length 3, xid 0x00000005 (corrupt)
20:21:46.738554 IP 192.168.1.30.33754 > 192.168.1.10.6633: Flags [.], seq 49232:52128, ack 1, win 361, options [nop,nop,TS val 64253604 ecr 65614456], length 2896: OpenFlow
	version unknown (0x14), type 0xe9, length 267, xid 0xce240000
	version unknown (0x01), type 0x6b, length 0, xid 0x0000ffff (corrupt)
20:21:46.738576 IP 192.168.1.30.33754 > 192.168.1.10.6633: Flags [.], seq 52128:55024, ack 1, win 361, options [nop,nop,TS val 64253604 ecr 65614456], length 2896: OpenFlow
	version unknown (0x00), type 0x00, length 0, xid 0x00fb14e9 (corrupt)
20:21:46.738585 IP 192.168.1.30.33754 > 192.168.1.10.6633: Flags [.], seq 55024:57920, ack 1, win 361, options [nop,nop,TS val 64253604 ecr 65614456], length 2896: OpenFlow
	version unknown (0x00), type 0x00, length 0, xid 0x00000000 (corrupt)
20:21:46.738607 IP 192.168.1.30.33754 > 192.168.1.10.6633: Flags [.], seq 57920:60816, ack 1, win 361, options [nop,nop,TS val 64253604 ecr 65614456], length 2896: OpenFlow
	version unknown (0x0a), type 0xff, length 65032, xid 0x380bff02 [|openflow]
20:21:46.738616 IP 192.168.1.30.33754 > 192.168.1.10.6633: Flags [.], seq 60816:63712, ack 1, win 361, options [nop,nop,TS val 64253604 ecr 65614456], length 2896: OpenFlow
	version unknown (0x00), type 0x00, length 0, xid 0x0000a059 (corrupt)
20:21:46.738639 IP 192.168.1.30.33754 > 192.168.1.10.6633: Flags [.], seq 63712:66608, ack 1, win 361, options [nop,nop,TS val 64253604 ecr 65614456], length 2896: OpenFlow
	version unknown (0x00), type 0x00, length 267, xid 0x11fffe80
	version unknown (0x4c), type 0x49, length 20053, xid 0x58c00c00 [|openflow]
20:21:46.738739 IP 192.168.1.30.33754 > 192.168.1.10.6633: Flags [.], seq 66608:69504, ack 1, win 361, options [nop,nop,TS val 64253604 ecr 65614456], length 2896: OpenFlow
	version unknown (0x0a), type 0x08, length 14347, xid 0x86dd6000 [|openflow]
20:21:46.739411 IP 192.168.1.10.6633 > 192.168.1.30.33754: Flags [.], ack 40544, win 5784, options [nop,nop,TS val 65614456 ecr 64253604], length 0
20:21:46.739417 IP 192.168.1.30.33754 > 192.168.1.10.6633: Flags [.], seq 69504:72400, ack 1, win 361, options [nop,nop,TS val 64253604 ecr 65614456], length 2896: OpenFlow
	version unknown (0x33), type 0x33, length 0, xid 0x00fba259 (corrupt)
20:21:46.739426 IP 192.168.1.30.33754 > 192.168.1.10.6633: Flags [.], seq 72400:75296, ack 1, win 361, options [nop,nop,TS val 64253604 ecr 65614456], length 2896: OpenFlow
	version unknown (0x00), type 0x04, length 0, xid 0x00000000 (corrupt)
20:21:46.739460 IP 192.168.1.10.6633 > 192.168.1.30.33754: Flags [.], ack 52128, win 5784, options [nop,nop,TS val 65614456 ecr 64253604], length 0
20:21:46.739467 IP 192.168.1.30.33754 > 192.168.1.10.6633: Flags [.], seq 75296:78192, ack 1, win 361, options [nop,nop,TS val 64253604 ecr 65614456], length 2896: OpenFlow
	version unknown (0x00), type 0x0c, length 32768, xid 0x00040000 [|openflow]
20:21:46.739490 IP 192.168.1.30.33754 > 192.168.1.10.6633: Flags [.], seq 78192:81088, ack 1, win 361, options [nop,nop,TS val 64253604 ecr 65614456], length 2896: OpenFlow
	version unknown (0x00), type 0x00, length 0, xid 0x03ce0001 (corrupt)
20:21:46.739500 IP 192.168.1.30.33754 > 192.168.1.10.6633: Flags [.], seq 81088:83984, ack 1, win 361, options [nop,nop,TS val 64253604 ecr 65614456], length 2896: OpenFlow
	version unknown (0xff), type 0xff, length 321, xid 0x01002b00
	version unknown (0x0c), type 0x00, length 8448, xid 0x01000000 [|openflow]
20:21:46.739521 IP 192.168.1.30.33754 > 192.168.1.10.6633: Flags [.], seq 83984:86880, ack 1, win 361, options [nop,nop,TS val 64253604 ecr 65614456], length 2896: OpenFlow
	version unknown (0x01), type 0x6b, length 0, xid 0x0000ffff (corrupt)
20:21:46.739557 IP 192.168.1.10.6633 > 192.168.1.30.33754: Flags [.], ack 57920, win 5784, options [nop,nop,TS val 65614456 ecr 64253604], length 0
20:21:46.739907 IP 192.168.1.30.33754 > 192.168.1.10.6633: Flags [.], seq 86880:89776, ack 1, win 361, options [nop,nop,TS val 64253604 ecr 65614456], length 2896: OpenFlow
	version unknown (0x00), type 0x11, length 37888, xid 0x0100040a [|openflow]
20:21:46.739916 IP 192.168.1.30.33754 > 192.168.1.10.6633: Flags [.], seq 89776:92672, ack 1, win 361, options [nop,nop,TS val 64253604 ecr 65614456], length 2896: OpenFlow
	version unknown (0x44), type 0xc0, length 3072, xid 0x10000100 [|openflow]
20:21:46.743262 IP 192.168.1.30.33754 > 192.168.1.10.6633: Flags [.], seq 92672:94120, ack 1, win 361, options [nop,nop,TS val 64253607 ecr 65614456], length 1448: OpenFlow
	version unknown (0x08), type 0x00, length 0, xid 0x000009c0 (corrupt)
20:21:46.779466 IP 192.168.1.10.6633 > 192.168.1.30.33754: Flags [.], ack 94120, win 5614, options [nop,nop,TS val 65614466 ecr 64253604], length 0
20:21:46.779786 IP 192.168.1.30.33754 > 192.168.1.10.6633: Flags [.], seq 94120:95568, ack 1, win 361, options [nop,nop,TS val 64253616 ecr 65614466], length 1448: OpenFlow
	version unknown (0x00), type 0x00, length 30720, xid 0x08000000 [|openflow]
20:21:46.779794 IP 192.168.1.30.33754 > 192.168.1.10.6633: Flags [.], seq 95568:98464, ack 1, win 361, options [nop,nop,TS val 64253616 ecr 65614466], length 2896: OpenFlow
	version unknown (0x21), type 0x00, length 256, xid 0x00007800
	version unknown (0x30), type 0x01, length 12289, xid 0x30013001 [|openflow]
20:21:46.779815 IP 192.168.1.30.33754 > 192.168.1.10.6633: Flags [.], seq 98464:101360, ack 1, win 361, options [nop,nop,TS val 64253616 ecr 65614466], length 2896: OpenFlow
	version unknown (0x4c), type 0x49, length 20053, xid 0x58c00c00 [|openflow]
20:21:46.779824 IP 192.168.1.30.33754 > 192.168.1.10.6633: Flags [.], seq 101360:104256, ack 1, win 361, options [nop,nop,TS val 64253616 ecr 65614466], length 2896: OpenFlow
	version unknown (0x06), type 0x58, length 14390, xid 0x5f363405 [|openflow]
20:21:46.779844 IP 192.168.1.30.33754 > 192.168.1.10.6633: Flags [.], seq 104256:107152, ack 1, win 361, options [nop,nop,TS val 64253616 ecr 65614466], length 2896: OpenFlow
	version unknown (0x00), type 0x01, length 0, xid 0x0078000d (corrupt)
20:21:46.779852 IP 192.168.1.30.33754 > 192.168.1.10.6633: Flags [.], seq 107152:110048, ack 1, win 361, options [nop,nop,TS val 64253616 ecr 65614466], length 2896: OpenFlow
	version unknown (0x00), type 0x02, length 49220, xid 0xc044000d [|openflow]
20:21:46.779872 IP 192.168.1.30.33754 > 192.168.1.10.6633: Flags [.], seq 110048:112944, ack 1, win 361, options [nop,nop,TS val 64253616 ecr 65614466], length 2896: OpenFlow
	version unknown (0x00), type 0x0c, length 1, xid 0x00000078 (corrupt)
20:21:46.779881 IP 192.168.1.30.33754 > 192.168.1.10.6633: Flags [.], seq 112944:115840, ack 1, win 361, options [nop,nop,TS val 64253616 ecr 65614466], length 2896: OpenFlow
	version unknown (0x0a), type 0xff, length 65032, xid 0x380bc051 [|openflow]
20:21:46.779901 IP 192.168.1.30.33754 > 192.168.1.10.6633: Flags [.], seq 115840:118736, ack 1, win 361, options [nop,nop,TS val 64253616 ecr 65614466], length 2896: OpenFlow
	version unknown (0x00), type 0x00, length 0, xid 0x0000a059 (corrupt)
20:21:46.779909 IP 192.168.1.30.33754 > 192.168.1.10.6633: Flags [.], seq 118736:121632, ack 1, win 361, options [nop,nop,TS val 64253616 ecr 65614466], length 2896: OpenFlow
	version unknown (0x00), type 0x00, length 120, xid 0x0010fe80
	version unknown (0x00), type 0x0c, length 32768, xid 0x00040000 [|openflow]
20:21:46.779928 IP 192.168.1.30.33754 > 192.168.1.10.6633: Flags [.], seq 121632:124528, ack 1, win 361, options [nop,nop,TS val 64253616 ecr 65614466], length 2896: OpenFlow
	version unknown (0x00), type 0x01, length 49220, xid 0x001c0001 [|openflow]
20:21:46.779937 IP 192.168.1.30.33754 > 192.168.1.10.6633: Flags [.], seq 124528:127424, ack 1, win 361, options [nop,nop,TS val 64253616 ecr 65614466], length 2896: OpenFlow
	version unknown (0x04), type 0x61, length 29296, xid 0x610000ff [|openflow]
20:21:46.779957 IP 192.168.1.30.33754 > 192.168.1.10.6633: Flags [.], seq 127424:130320, ack 1, win 361, options [nop,nop,TS val 64253616 ecr 65614466], length 2896: OpenFlow
	version 1.0, type invalid (0x65), length 358, xid 0x03697036
	version unknown (0x30), type 0x01, length 12289, xid 0x38016501 [|openflow]
20:21:46.820827 IP 192.168.1.10.6633 > 192.168.1.30.33754: Flags [.], ack 130320, win 5426, options [nop,nop,TS val 65614476 ecr 64253616], length 0
20:21:46.820841 IP 192.168.1.30.33754 > 192.168.1.10.6633: Flags [.], seq 130320:133216, ack 1, win 361, options [nop,nop,TS val 64253626 ecr 65614476], length 2896: OpenFlow
	version 1.0, type invalid (0x30), length 304, xid 0x01300138
	version unknown (0x75), type 0xc0, length 14592, xid 0xff000101 [|openflow]
20:21:46.820850 IP 192.168.1.30.33754 > 192.168.1.10.6633: Flags [.], seq 133216:136112, ack 1, win 361, options [nop,nop,TS val 64253626 ecr 65614476], length 2896: OpenFlow
	version 1.0, type invalid (0x30), length 304, xid 0x01300130
	version unknown (0x00), type 0x01, length 1653, xid 0x62756e74
	version unknown (0xff), type 0xff, length 65535, xid 0x01410100 [|openflow]
20:21:46.820873 IP 192.168.1.30.33754 > 192.168.1.10.6633: Flags [.], seq 136112:139008, ack 1, win 361, options [nop,nop,TS val 64253626 ecr 65614476], length 2896: OpenFlow
	version 1.0, type invalid (0x30), length 304, xid 0x01300130
	version unknown (0x6c), type 0x6f, length 25441, xid 0x6c0000ff [|openflow]
20:21:46.820883 IP 192.168.1.30.33754 > 192.168.1.10.6633: Flags [.], seq 139008:141904, ack 1, win 361, options [nop,nop,TS val 64253626 ecr 65614476], length 2896: OpenFlow
	version 1.0, type invalid (0x30), length 353, xid 0x01300130
	version 1.0, type invalid (0x66), length 353, xid 0x01300139
	version 1.0, type invalid (0x38), length 304, xid 0x01650166
	version unknown (0x30), type 0x38, length 14899, xid 0x383a3062 [|openflow]
20:21:46.820908 IP 192.168.1.30.33754 > 192.168.1.10.6633: Flags [.], seq 141904:144800, ack 1, win 361, options [nop,nop,TS val 64253626 ecr 65614476], length 2896: OpenFlow
	version 1.0, type invalid (0x61), length 304, xid 0x01390135
	version unknown (0x6f), type 0x72, length 27507, xid 0x74617469 [|openflow]
20:21:46.820918 IP 192.168.1.30.33754 > 192.168.1.10.6633: Flags [.], seq 144800:147696, ack 1, win 361, options [nop,nop,TS val 64253626 ecr 65614476], length 2896: OpenFlow
	version 1.0, type invalid (0x65), length 358, xid 0x01660166
	version unknown (0x33), type 0x01, length 14337, xid 0x30016501 [|openflow]
20:21:46.820943 IP 192.168.1.30.33754 > 192.168.1.10.6633: Flags [.], seq 147696:150592, ack 1, win 361, options [nop,nop,TS val 64253626 ecr 65614476], length 2896: OpenFlow
	version 1.0, type invalid (0x38), length 307, xid 0x01380130
	version unknown (0x3a), type 0x30, length 14394, xid 0x33383a30 [|openflow]
20:21:46.820955 IP 192.168.1.30.33754 > 192.168.1.10.6633: Flags [.], seq 150592:153488, ack 1, win 361, options [nop,nop,TS val 64253626 ecr 65614476], length 2896: OpenFlow
	version unknown (0x00), type 0xff, length 1, xid 0x01620130 (corrupt)
20:21:46.820980 IP 192.168.1.30.33754 > 192.168.1.10.6633: Flags [.], seq 153488:156384, ack 1, win 361, options [nop,nop,TS val 64253626 ecr 65614476], length 2896: OpenFlow
	version unknown (0x75), type 0x62, length 30062, xid 0x7475c039 [|openflow]
20:21:46.820990 IP 192.168.1.30.33754 > 192.168.1.10.6633: Flags [.], seq 156384:159280, ack 1, win 361, options [nop,nop,TS val 64253626 ecr 65614476], length 2896: OpenFlow
	version unknown (0x61), type 0x6c, length 0, xid 0xff000106 (corrupt)
20:21:46.821014 IP 192.168.1.30.33754 > 192.168.1.10.6633: Flags [.], seq 159280:162176, ack 1, win 361, options [nop,nop,TS val 64253626 ecr 65614476], length 2896: OpenFlow
	version unknown (0x5f), type 0x74, length 25456, xid 0x056c6f63 [|openflow]
20:21:46.821024 IP 192.168.1.30.33754 > 192.168.1.10.6633: Flags [.], seq 162176:165072, ack 1, win 361, options [nop,nop,TS val 64253626 ecr 65614476], length 2896: OpenFlow
	version unknown (0x73), type 0x74, length 24948, xid 0x696f6e04 [|openflow]
20:21:46.865387 IP 192.168.1.10.6633 > 192.168.1.30.33754: Flags [.], ack 165072, win 5501, options [nop,nop,TS val 65614488 ecr 64253626], length 0
20:21:46.865403 IP 192.168.1.30.33754 > 192.168.1.10.6633: Flags [.], seq 165072:167968, ack 1, win 361, options [nop,nop,TS val 64253637 ecr 65614488], length 2896: OpenFlow
	version unknown (0x6e), type 0x74, length 29984, xid 0x5b61323a [|openflow]
20:21:46.865412 IP 192.168.1.30.33754 > 192.168.1.10.6633: Flags [.], seq 167968:170864, ack 1, win 361, options [nop,nop,TS val 64253637 ecr 65614488], length 2896: OpenFlow
	version unknown (0x00), type 0x05, length 0, xid 0x1a756275 (corrupt)
20:21:46.865442 IP 192.168.1.30.33754 > 192.168.1.10.6633: Flags [.], seq 170864:173760, ack 1, win 361, options [nop,nop,TS val 64253637 ecr 65614488], length 2896: OpenFlow
	version unknown (0x00), type 0x00, length 0, xid 0x00030000 (corrupt)
20:21:46.865451 IP 192.168.1.30.33754 > 192.168.1.10.6633: Flags [.], seq 173760:176656, ack 1, win 361, options [nop,nop,TS val 64253637 ecr 65614488], length 2896: OpenFlow
	version unknown (0x14), type 0xe9, length 5353, xid 0x010bce24 [|openflow]
20:21:46.865474 IP 192.168.1.30.33754 > 192.168.1.10.6633: Flags [.], seq 176656:179552, ack 1, win 361, options [nop,nop,TS val 64253637 ecr 65614488], length 2896: OpenFlow
	version unknown (0x00), type 0x00, length 0, xid 0x000000fb (corrupt)
20:21:46.865484 IP 192.168.1.30.33754 > 192.168.1.10.6633: Flags [.], seq 179552:182448, ack 1, win 361, options [nop,nop,TS val 64253637 ecr 65614488], length 2896: OpenFlow
	version unknown (0xff), type 0x02, length 0, xid 0x00000000 (corrupt)
20:21:46.865505 IP 192.168.1.30.33754 > 192.168.1.10.6633: Flags [.], seq 182448:185344, ack 1, win 361, options [nop,nop,TS val 64253637 ecr 65614488], length 2896: OpenFlow
	version unknown (0xa0), type 0x59, length 2815, xid 0xfe08380b
	version unknown (0x00), type 0x09, length 49220, xid 0xc00c0010 [|openflow]
20:21:46.865514 IP 192.168.1.30.33754 > 192.168.1.10.6633: Flags [.], seq 185344:188240, ack 1, win 361, options [nop,nop,TS val 64253637 ecr 65614488], length 2896: OpenFlow
	version unknown (0xfe), type 0x80, length 0, xid 0x00000000 (corrupt)
20:21:46.865538 IP 192.168.1.30.33754 > 192.168.1.10.6633: Flags [.], seq 188240:191136, ack 1, win 361, options [nop,nop,TS val 64253637 ecr 65614488], length 2896: OpenFlow
	version unknown (0x60), type 0x00, length 0, xid 0x010b11ff (corrupt)
20:21:46.865547 IP 192.168.1.30.33754 > 192.168.1.10.6633: Flags [.], seq 191136:194032, ack 1, win 361, options [nop,nop,TS val 64253637 ecr 65614488], length 2896: OpenFlow
	version unknown (0xa2), type 0x59, length 2568, xid 0x380b86dd
	version unknown (0xff), type 0xfe, length 2104, xid 0x0bff0200 [|openflow]
20:21:46.865753 IP 192.168.1.30.33754 > 192.168.1.10.6633: Flags [.], seq 194032:196928, ack 1, win 361, options [nop,nop,TS val 64253637 ecr 65614488], length 2896: OpenFlow
	version unknown (0x00), type 0x00, length 13107, xid 0x000000fb [|openflow]
20:21:46.865762 IP 192.168.1.30.33754 > 192.168.1.10.6633: Flags [.], seq 196928:199824, ack 1, win 361, options [nop,nop,TS val 64253637 ecr 65614488], length 2896: OpenFlow
	version unknown (0x00), type 0x00, length 1, xid 0x00000000 (corrupt)
20:21:46.866078 IP 192.168.1.10.6633 > 192.168.1.30.33754: Flags [.], ack 182448, win 5784, options [nop,nop,TS val 65614488 ecr 64253637], length 0
20:21:46.866088 IP 192.168.1.30.33754 > 192.168.1.10.6633: Flags [.], seq 199824:202720, ack 1, win 361, options [nop,nop,TS val 64253638 ecr 65614488], length 2896: OpenFlow
	version unknown (0x00), type 0x01, length 12, xid 0x80000004
	version unknown (0x00), type 0x00, length 0, xid 0x00003333 (corrupt)
20:21:46.866097 IP 192.168.1.30.33754 > 192.168.1.10.6633: Flags [.], seq 202720:205616, ack 1, win 361, options [nop,nop,TS val 64253638 ecr 65614488], length 2896: OpenFlow
	version unknown (0x2b), type 0x00, length 0, xid 0x000003cc (corrupt)
20:21:46.866119 IP 192.168.1.30.33754 > 192.168.1.10.6633: Flags [P.], seq 205616:208512, ack 1, win 361, options [nop,nop,TS val 64253638 ecr 65614488], length 2896: OpenFlow
	version unknown (0xff), type 0xff, length 65535, xid 0x01410100 [|openflow]
20:21:46.866128 IP 192.168.1.30.33754 > 192.168.1.10.6633: Flags [.], seq 208512:211408, ack 1, win 361, options [nop,nop,TS val 64253638 ecr 65614488], length 2896: OpenFlow
	version unknown (0x04), type 0x0a, length 363, xid 0x00000000
	version unknown (0x04), type 0x0a, length 363, xid 0x00000000
	version unknown (0x04), type 0x0a, length 363, xid 0x00000000
	version unknown (0x04), type 0x0a, length 363, xid 0x00000000
	version unknown (0x04), type 0x0a, length 363, xid 0x00000000
	version unknown (0x04), type 0x0a, length 363, xid 0x00000000
	version unknown (0x04), type 0x0a, length 363, xid 0x00000000
	version unknown (0x04), type 0x0a, length 363, xid 0x00000000 [|openflow]
20:21:46.866149 IP 192.168.1.30.33754 > 192.168.1.10.6633: Flags [.], seq 211408:214304, ack 1, win 361, options [nop,nop,TS val 64253638 ecr 65614488], length 2896: OpenFlow
	version 1.0, type HELLO, length 17, xid 0x94000100
	version unknown (0xff), type 0xff, length 65281, xid 0x4101002b [|openflow]
20:21:46.866158 IP 192.168.1.30.33754 > 192.168.1.10.6633: Flags [.], seq 214304:217200, ack 1, win 361, options [nop,nop,TS val 64253638 ecr 65614488], length 2896: OpenFlow
	version unknown (0x09), type 0xc0, length 17600, xid 0x0c001000 [|openflow]
20:21:46.866181 IP 192.168.1.10.6633 > 192.168.1.30.33754: Flags [.], ack 194032, win 5784, options [nop,nop,TS val 65614488 ecr 64253637], length 0
20:21:46.866188 IP 192.168.1.30.33754 > 192.168.1.10.6633: Flags [.], seq 217200:220096, ack 1, win 361, options [nop,nop,TS val 64253638 ecr 65614488], length 2896: OpenFlow
	version unknown (0x78), type 0x00, length 2048, xid 0x00000000
	version 1.0, type invalid (0x39), length 309, xid 0x01300161
	version unknown (0x6e), type 0x04, length 24436, xid 0x6370056c [|openflow]
20:21:46.866196 IP 192.168.1.30.33754 > 192.168.1.10.6633: Flags [.], seq 220096:222992, ack 1, win 361, options [nop,nop,TS val 64253638 ecr 65614488], length 2896: OpenFlow
	version unknown (0x0c), type 0x00, length 8448, xid 0x01000000 [|openflow]
20:21:46.866217 IP 192.168.1.30.33754 > 192.168.1.10.6633: Flags [.], seq 222992:225888, ack 1, win 361, options [nop,nop,TS val 64253638 ecr 65614488], length 2896: OpenFlow
	version unknown (0x34), type 0x05, length 19529, xid 0x4e5558c0 [|openflow]
20:21:46.866225 IP 192.168.1.30.33754 > 192.168.1.10.6633: Flags [.], seq 225888:228784, ack 1, win 361, options [nop,nop,TS val 64253638 ecr 65614488], length 2896: OpenFlow
	version unknown (0x00), type 0x0d, length 1624, xid 0x38365f36
	version unknown (0x5b), type 0x61, length 12858, xid 0x35393a30 [|openflow]
20:21:46.878014 IP 192.168.1.30.33754 > 192.168.1.10.6633: Flags [.], seq 228784:230232, ack 1, win 361, options [nop,nop,TS val 64253641 ecr 65614488], length 1448: OpenFlow
	version unknown (0x00), type 0x0d, length 1, xid 0x00000078 (corrupt)
20:21:46.902432 IP 192.168.1.10.6633 > 192.168.1.30.33754: Flags [.], ack 199824, win 5784, options [nop,nop,TS val 65614496 ecr 64253637], length 0
20:21:46.902448 IP 192.168.1.30.33754 > 192.168.1.10.6633: Flags [.], seq 230232:231680, ack 1, win 361, options [nop,nop,TS val 64253647 ecr 65614496], length 1448: OpenFlow
	version unknown (0xc0), type 0x44, length 49220, xid 0x000d0001 [|openflow]
20:21:46.902457 IP 192.168.1.30.33754 > 192.168.1.10.6633: Flags [.], seq 231680:234576, ack 1, win 361, options [nop,nop,TS val 64253647 ecr 65614496], length 2896: OpenFlow
	version unknown (0x00), type 0x78, length 2, xid 0xc044c044 (corrupt)
20:21:46.902480 IP 192.168.1.10.6633 > 192.168.1.30.33754: Flags [.], ack 208512, win 5784, options [nop,nop,TS val 65614496 ecr 64253638], length 0
20:21:46.902489 IP 192.168.1.30.33754 > 192.168.1.10.6633: Flags [.], seq 234576:237472, ack 1, win 361, options [nop,nop,TS val 64253647 ecr 65614496], length 2896: OpenFlow
	version unknown (0xc0), type 0x51, length 12, xid 0x00010000
	version unknown (0xc0), type 0x44, length 49220, xid 0x000d0001 [|openflow]
20:21:46.902497 IP 192.168.1.30.33754 > 192.168.1.10.6633: Flags [.], seq 237472:240368, ack 1, win 361, options [nop,nop,TS val 64253647 ecr 65614496], length 2896: OpenFlow
	version unknown (0xa0), type 0x59, length 2815, xid 0xfe08380b
	version unknown (0x38), type 0x01, length 12289, xid 0x65016601 [|openflow]
20:21:46.902520 IP 192.168.1.30.33754 > 192.168.1.10.6633: Flags [.], seq 240368:243264, ack 1, win 361, options [nop,nop,TS val 64253647 ecr 65614496], length 2896: OpenFlow
	version unknown (0xfe), type 0x80, length 0, xid 0x00000000 (corrupt)
20:21:46.902759 IP 192.168.1.10.6633 > 192.168.1.30.33754: Flags [.], ack 230232, win 5784, options [nop,nop,TS val 65614496 ecr 64253638], length 0
20:21:46.902768 IP 192.168.1.30.33754 > 192.168.1.10.6633: Flags [.], seq 243264:246160, ack 1, win 361, options [nop,nop,TS val 64253647 ecr 65614496], length 2896: OpenFlow
	version unknown (0x00), type 0x01, length 0, xid 0x00780010 (corrupt)
20:21:46.902777 IP 192.168.1.30.33754 > 192.168.1.10.6633: Flags [.], seq 246160:249056, ack 1, win 361, options [nop,nop,TS val 64253647 ecr 65614496], length 2896: OpenFlow
	version unknown (0x00), type 0xff, length 1, xid 0xc044001c (corrupt)
20:21:46.902800 IP 192.168.1.30.33754 > 192.168.1.10.6633: Flags [.], seq 249056:251952, ack 1, win 361, options [nop,nop,TS val 64253647 ecr 65614496], length 2896: OpenFlow
	version unknown (0x70), type 0x36, length 1121, xid 0x72706100
	version unknown (0xa0), type 0x59, length 2815, xid 0xfe08380b [|openflow]
20:21:46.902809 IP 192.168.1.30.33754 > 192.168.1.10.6633: Flags [.], seq 251952:254848, ack 1, win 361, options [nop,nop,TS val 64253647 ecr 65614496], length 2896: OpenFlow
	version 1.0, type invalid (0x38), length 357, xid 0x01660369
	version 1.0, type invalid (0x30), length 304, xid 0x01300138
	version unknown (0x75), type 0xc0, length 14592, xid 0xff000101 [|openflow]
20:21:46.902829 IP 192.168.1.30.33754 > 192.168.1.10.6633: Flags [.], seq 254848:257744, ack 1, win 361, options [nop,nop,TS val 64253647 ecr 65614496], length 2896: OpenFlow
	version 1.0, type invalid (0x30), length 304, xid 0x01300130
	version unknown (0x6e), type 0x74, length 30144, xid 0x3900ff00 [|openflow]
20:21:46.902839 IP 192.168.1.30.33754 > 192.168.1.10.6633: Flags [.], seq 257744:260640, ack 1, win 361, options [nop,nop,TS val 64253647 ecr 65614496], length 2896: OpenFlow
	version 1.0, type invalid (0x30), length 304, xid 0x01300130
	version unknown (0x00), type 0xff, length 1, xid 0x06756275 (corrupt)
20:21:46.902859 IP 192.168.1.30.33754 > 192.168.1.10.6633: Flags [.], seq 260640:263536, ack 1, win 361, options [nop,nop,TS val 64253647 ecr 65614496], length 2896: OpenFlow
	version 1.0, type invalid (0x30), length 304, xid 0x01300130
	version unknown (0x70), type 0x05, length 27759, xid 0x63616c00 [|openflow]
20:21:46.902869 IP 192.168.1.30.33754 > 192.168.1.10.6633: Flags [.], seq 263536:266432, ack 1, win 361, options [nop,nop,TS val 64253647 ecr 65614496], length 2896: OpenFlow
	version 1.0, type invalid (0x35), length 304, xid 0x01610130
	version unknown (0x74), type 0x69, length 28526, xid 0x045f7463 [|openflow]
20:21:46.904856 IP 192.168.1.10.6633 > 192.168.1.30.33754: Flags [.], ack 266432, win 5784, options [nop,nop,TS val 65614498 ecr 64253647], length 0
20:21:46.904868 IP 192.168.1.30.33754 > 192.168.1.10.6633: Flags [.], seq 266432:269328, ack 1, win 361, options [nop,nop,TS val 64253647 ecr 65614498], length 2896: OpenFlow
	version 1.0, type invalid (0x66), length 353, xid 0x01300139
	version 1.0, type invalid (0x38), length 304, xid 0x01650166
	version unknown (0x30), type 0x38, length 14899, xid 0x383a3062 [|openflow]
20:21:46.904876 IP 192.168.1.30.33754 > 192.168.1.10.6633: Flags [.], seq 269328:272224, ack 1, win 361, options [nop,nop,TS val 64253647 ecr 65614498], length 2896: OpenFlow
	version 1.0, type invalid (0x30), length 357, xid 0x01660166
	version 1.0, type invalid (0x38), length 307, xid 0x01380130
	version unknown (0x3a), type 0x30, length 14394, xid 0x33383a30 [|openflow]
20:21:46.904901 IP 192.168.1.30.33754 > 192.168.1.10.6633: Flags [.], seq 272224:275120, ack 1, win 361, options [nop,nop,TS val 64253647 ecr 65614498], length 2896: OpenFlow
	version 1.0, type invalid (0x30), length 312, xid 0x01330138
	version unknown (0x3a), type 0x33, length 14394, xid 0x30625d0c [|openflow]
20:21:46.904911 IP 192.168.1.30.33754 > 192.168.1.10.6633: Flags [.], seq 275120:278016, ack 1, win 361, options [nop,nop,TS val 64253647 ecr 65614498], length 2896: OpenFlow
	version unknown (0xc0), type 0x39, length 255, xid 0x00010162
	version unknown (0x00), type 0xa0, length 22794, xid 0xfffe0838 [|openflow]
20:21:46.904934 IP 192.168.1.30.33754 > 192.168.1.10.6633: Flags [.], seq 278016:280912, ack 1, win 361, options [nop,nop,TS val 64253647 ecr 65614498], length 2896: OpenFlow
	version 1.0, type FEATURES_REPLY, length 30050, xid 0x756e7475 [|openflow]
20:21:46.904943 IP 192.168.1.30.33754 > 192.168.1.10.6633: Flags [.], seq 280912:283808, ack 1, win 361, options [nop,nop,TS val 64253647 ecr 65614498], length 2896: OpenFlow
	version unknown (0x6f), type 0x63, length 24940, xid 0x0000ff00 [|openflow]
20:21:46.904966 IP 192.168.1.30.33754 > 192.168.1.10.6633: Flags [.], seq 283808:286704, ack 1, win 361, options [nop,nop,TS val 64253647 ecr 65614498], length 2896: OpenFlow
	version unknown (0x00), type 0x00, length 251, xid 0x14e914e9
	version unknown (0x00), type 0x00, length 0, xid 0x09c044c0 (corrupt)
20:21:46.904976 IP 192.168.1.30.33754 > 192.168.1.10.6633: Flags [.], seq 286704:289600, ack 1, win 361, options [nop,nop,TS val 64253647 ecr 65614498], length 2896: OpenFlow
	version unknown (0x00), type 0x00, length 0, xid 0x00000000 (corrupt)
20:21:46.904998 IP 192.168.1.30.33754 > 192.168.1.10.6633: Flags [.], seq 289600:292496, ack 1, win 361, options [nop,nop,TS val 64253647 ecr 65614498], length 2896: OpenFlow
	version unknown (0xfe), type 0x08, length 14347, xid 0xff020000 [|openflow]
20:21:46.905007 IP 192.168.1.30.33754 > 192.168.1.10.6633: Flags [.], seq 292496:295392, ack 1, win 361, options [nop,nop,TS val 64253647 ecr 65614498], length 2896: OpenFlow
	version unknown (0x00), type 0x00, length 0, xid 0xa0590aff (corrupt)
20:21:46.905030 IP 192.168.1.30.33754 > 192.168.1.10.6633: Flags [.], seq 295392:298288, ack 1, win 361, options [nop,nop,TS val 64253647 ecr 65614498], length 2896: OpenFlow
	version 1.0, type FLOW_REMOVED, length 4607, xid 0xfe800000 (corrupt) [|openflow]
20:21:46.905040 IP 192.168.1.30.33754 > 192.168.1.10.6633: Flags [.], seq 298288:301184, ack 1, win 361, options [nop,nop,TS val 64253647 ecr 65614498], length 2896: OpenFlow
	version unknown (0x38), type 0x0b, length 34525, xid 0x60000000 [|openflow]
20:21:46.905095 IP 192.168.1.10.6633 > 192.168.1.30.33754: Flags [.], ack 272224, win 5784, options [nop,nop,TS val 65614498 ecr 64253647], length 0
20:21:46.905099 IP 192.168.1.10.6633 > 192.168.1.30.33754: Flags [.], ack 278016, win 5784, options [nop,nop,TS val 65614498 ecr 64253647], length 0
20:21:46.905103 IP 192.168.1.10.6633 > 192.168.1.30.33754: Flags [.], ack 283808, win 5784, options [nop,nop,TS val 65614498 ecr 64253647], length 0
20:21:46.905106 IP 192.168.1.10.6633 > 192.168.1.30.33754: Flags [.], ack 289600, win 5784, options [nop,nop,TS val 65614498 ecr 64253647], length 0
20:21:46.905403 IP 192.168.1.30.33754 > 192.168.1.10.6633: Flags [.], seq 301184:304080, ack 1, win 361, options [nop,nop,TS val 64253647 ecr 65614498], length 2896: OpenFlow
	version unknown (0x00), type 0x00, length 251, xid 0xa2590a08
	version unknown (0x00), type 0x01, length 0, xid 0x00780002 (corrupt)
20:21:46.905425 IP 192.168.1.30.33754 > 192.168.1.10.6633: Flags [.], seq 304080:306976, ack 1, win 361, options [nop,nop,TS val 64253647 ecr 65614498], length 2896: OpenFlow
	version unknown (0x00), type 0x00, length 0, xid 0x00003333 (corrupt)
20:21:46.905433 IP 192.168.1.30.33754 > 192.168.1.10.6633: Flags [.], seq 306976:309872, ack 1, win 361, options [nop,nop,TS val 64253647 ecr 65614498], length 2896: OpenFlow
	version unknown (0x80), type 0x00, length 4, xid 0x00000002 (corrupt)
20:21:46.905455 IP 192.168.1.30.33754 > 192.168.1.10.6633: Flags [.], seq 309872:312768, ack 1, win 361, options [nop,nop,TS val 64253647 ecr 65614498], length 2896: OpenFlow
	version unknown (0x00), type 0x00, length 973, xid 0x0001000c
	version unknown (0x00), type 0x01, length 0, xid 0x00780010 (corrupt)
20:21:46.905463 IP 192.168.1.30.33754 > 192.168.1.10.6633: Flags [.], seq 312768:315664, ack 1, win 361, options [nop,nop,TS val 64253647 ecr 65614498], length 2896: OpenFlow
	version 1.0, type invalid (0x41), length 256, xid 0x2b000000
	version unknown (0x01), type 0x00, length 0, xid 0x780010fe (corrupt)
20:21:46.905484 IP 192.168.1.30.33754 > 192.168.1.10.6633: Flags [.], seq 315664:318560, ack 1, win 361, options [nop,nop,TS val 64253647 ecr 65614498], length 2896: OpenFlow
	version unknown (0x00), type 0x00, length 0, xid 0xffffffff (corrupt)
20:21:46.905492 IP 192.168.1.30.33754 > 192.168.1.10.6633: Flags [.], seq 318560:321456, ack 1, win 361, options [nop,nop,TS val 64253647 ecr 65614498], length 2896: OpenFlow
	version unknown (0x94), type 0x00, length 256, xid 0x040a016b
	version unknown (0x36), type 0x04, length 24946, xid 0x70610000 [|openflow]
20:21:46.905513 IP 192.168.1.30.33754 > 192.168.1.10.6633: Flags [.], seq 321456:324352, ack 1, win 361, options [nop,nop,TS val 64253647 ecr 65614498], length 2896: OpenFlow
	version unknown (0x0c), type 0x00, length 4096, xid 0x01000011 [|openflow]
20:21:46.905525 IP 192.168.1.10.6633 > 192.168.1.30.33754: Flags [.], ack 301184, win 5784, options [nop,nop,TS val 65614498 ecr 64253647], length 0
20:21:46.905533 IP 192.168.1.30.33754 > 192.168.1.10.6633: Flags [.], seq 324352:327248, ack 1, win 361, options [nop,nop,TS val 64253648 ecr 65614498], length 2896: OpenFlow
	version unknown (0x00), type 0x00, length 0, xid 0x09c044c0 (corrupt)
20:21:46.905562 IP 192.168.1.30.33754 > 192.168.1.10.6633: Flags [.], seq 327248:330144, ack 1, win 361, options [nop,nop,TS val 64253648 ecr 65614498], length 2896: OpenFlow
	version unknown (0x01), type 0x00, length 0, xid 0x78000800 (corrupt)
20:21:46.905572 IP 192.168.1.30.33754 > 192.168.1.10.6633: Flags [.], seq 330144:333040, ack 1, win 361, options [nop,nop,TS val 64253648 ecr 65614498], length 2896: OpenFlow
	version unknown (0x4e), type 0x55, length 22720, xid 0x0c002100 [|openflow]
20:21:46.905634 IP 192.168.1.30.33754 > 192.168.1.10.6633: Flags [.], seq 333040:335936, ack 1, win 361, options [nop,nop,TS val 64253648 ecr 65614498], length 2896: OpenFlow
	version unknown (0x38), type 0x36, length 24374, xid 0x34054c49 [|openflow]
20:21:46.905881 IP 192.168.1.10.6633 > 192.168.1.30.33754: Flags [.], ack 304080, win 5784, options [nop,nop,TS val 65614498 ecr 64253647], length 0
20:21:46.905904 IP 192.168.1.30.33754 > 192.168.1.10.6633: Flags [.], seq 335936:338832, ack 1, win 361, options [nop,nop,TS val 64253648 ecr 65614498], length 2896: OpenFlow
	version unknown (0x00), type 0x00, length 120, xid 0x000d0658
	version unknown (0x00), type 0x00, length 0, xid 0xa0590aff (corrupt)
20:21:46.905913 IP 192.168.1.10.6633 > 192.168.1.30.33754: Flags [.], ack 309872, win 5784, options [nop,nop,TS val 65614498 ecr 64253647], length 0
20:21:46.905933 IP 192.168.1.30.33754 > 192.168.1.10.6633: Flags [.], seq 338832:341728, ack 1, win 361, options [nop,nop,TS val 64253648 ecr 65614498], length 2896: OpenFlow
	version unknown (0xc0), type 0x44, length 49220, xid 0x000d0001 [|openflow]
20:21:46.905963 IP 192.168.1.30.33754 > 192.168.1.10.6633: Flags [.], seq 341728:344624, ack 1, win 361, options [nop,nop,TS val 64253648 ecr 65614498], length 2896: OpenFlow
	version unknown (0x00), type 0x01, length 0, xid 0x00780002 (corrupt)
20:21:46.905989 IP 192.168.1.10.6633 > 192.168.1.30.33754: Flags [.], ack 315664, win 5784, options [nop,nop,TS val 65614498 ecr 64253647], length 0
20:21:46.905994 IP 192.168.1.30.33754 > 192.168.1.10.6633: Flags [.], seq 344624:347520, ack 1, win 361, options [nop,nop,TS val 64253648 ecr 65614498], length 2896: OpenFlow
	version unknown (0xfe), type 0x08, length 14347, xid 0xc051000c [|openflow]
20:21:46.906033 IP 192.168.1.30.33754 > 192.168.1.10.6633: Flags [.], seq 347520:350416, ack 1, win 361, options [nop,nop,TS val 64253648 ecr 65614498], length 2896: OpenFlow
	version unknown (0x00), type 0x00, length 0, xid 0xa0590aff (corrupt)
20:21:46.906053 IP 192.168.1.10.6633 > 192.168.1.30.33754: Flags [.], ack 321456, win 5784, options [nop,nop,TS val 65614498 ecr 64253647], length 0
20:21:46.906069 IP 192.168.1.30.33754 > 192.168.1.10.6633: Flags [.], seq 350416:353312, ack 1, win 361, options [nop,nop,TS val 64253648 ecr 65614498], length 2896: OpenFlow
	version unknown (0x00), type 0x78, length 16, xid 0xfe800000
	version unknown (0xfe), type 0x08, length 14347, xid 0xc051000c [|openflow]
20:21:46.906110 IP 192.168.1.30.33754 > 192.168.1.10.6633: Flags [.], seq 353312:356208, ack 1, win 361, options [nop,nop,TS val 64253648 ecr 65614498], length 2896: OpenFlow
	version unknown (0xc0), type 0x44, length 28, xid 0x00010000
	version unknown (0xc0), type 0x51, length 12, xid 0x00010000
	version unknown (0xc0), type 0x44, length 49220, xid 0x000d0001 [|openflow]
20:21:46.906130 IP 192.168.1.10.6633 > 192.168.1.30.33754: Flags [.], ack 324352, win 5784, options [nop,nop,TS val 65614498 ecr 64253647], length 0
20:21:46.906134 IP 192.168.1.30.33754 > 192.168.1.10.6633: Flags [.], seq 356208:359104, ack 1, win 361, options [nop,nop,TS val 64253648 ecr 65614498], length 2896: OpenFlow
	version unknown (0x72), type 0x70, length 24832, xid 0x00ff0001 [|openflow]
20:21:46.906174 IP 192.168.1.10.6633 > 192.168.1.30.33754: Flags [.], ack 327248, win 5784, options [nop,nop,TS val 65614498 ecr 64253648], length 0
20:21:46.906190 IP 192.168.1.30.33754 > 192.168.1.10.6633: Flags [.], seq 359104:362000, ack 1, win 361, options [nop,nop,TS val 64253648 ecr 65614498], length 2896: OpenFlow
	version 1.0, type invalid (0x66), length 873, xid 0x70360461
	version unknown (0x04), type 0x00, length 0, xid 0x01000000 (corrupt)
20:21:46.906198 IP 192.168.1.10.6633 > 192.168.1.30.33754: Flags [.], ack 333040, win 5784, options [nop,nop,TS val 65614498 ecr 64253648], length 0
20:21:46.906218 IP 192.168.1.30.33754 > 192.168.1.10.6633: Flags [.], seq 362000:364896, ack 1, win 361, options [nop,nop,TS val 64253648 ecr 65614498], length 2896: OpenFlow
	version 1.0, type invalid (0x30), length 304, xid 0x01380165
	version unknown (0x39), type 0x00, length 65280, xid 0x01016201 [|openflow]
20:21:46.906241 IP 192.168.1.30.33754 > 192.168.1.10.6633: Flags [.], seq 364896:367792, ack 1, win 361, options [nop,nop,TS val 64253648 ecr 65614498], length 2896: OpenFlow
