20:21:46.666284 IP 192.168.1.30.33784 > 192.168.1.10.6633: Flags [.], seq 3887034217:3887035665, ack 1332438091, win 361, options [nop,nop,TS val 64253588 ecr 65614406], length 1448: OpenFlow
	version unknown (0x00), type 0x1a, length 30050, xid 0x756e7475 [|openflow]
20:21:46.734820 IP 192.168.1.10.6633 > 192.168.1.30.33784: Flags [.], ack 0, win 4738, options [nop,nop,TS val 65614446 ecr 64253571], length 0
20:21:46.734844 IP 192.168.1.30.33784 > 192.168.1.10.6633: Flags [.], seq 1448:2896, ack 1, win 361, options [nop,nop,TS val 64253604 ecr 65614446], length 1448: OpenFlow
	version unknown (0x00), type 0x00, length 1280, xid 0x001a7562
	version unknown (0x02), type 0xc0, length 17600, xid 0x44000d00 [|openflow]
20:21:46.734873 IP 192.168.1.30.33784 > 192.168.1.10.6633: Flags [.], seq 2896:5792, ack 1, win 361, options [nop,nop,TS val 64253604 ecr 65614446], length 2896: OpenFlow
	version unknown (0x00), type 0x00, length 768, xid 0x00000500
	version unknown (0x73), type 0x74, length 24948, xid 0x696f6e04 [|openflow]
20:21:46.734893 IP 192.168.1.30.33784 > 192.168.1.10.6633: Flags [.], seq 5792:8688, ack 1, win 361, options [nop,nop,TS val 64253604 ecr 65614446], length 2896: OpenFlow
	version unknown (0xe9), type 0x01, length 3022, xid 0x24000000 [|openflow]
20:21:46.734915 IP 192.168.1.30.33784 > 192.168.1.10.6633: Flags [.], seq 8688:11584, ack 1, win 361, options [nop,nop,TS val 64253604 ecr 65614446], length 2896: OpenFlow
	version unknown (0x00), type 0x00, length 0, xid 0xfb14e914 (corrupt)
20:21:46.735451 IP 192.168.1.30.33784 > 192.168.1.10.6633: Flags [.], seq 11584:14480, ack 1, win 361, options [nop,nop,TS val 64253604 ecr 65614446], length 2896: OpenFlow
	version unknown (0x00), type 0x00, length 0, xid 0x00000000 (corrupt)
20:21:46.735474 IP 192.168.1.30.33784 > 192.168.1.10.6633: Flags [.], seq 14480:17376, ack 1, win 361, options [nop,nop,TS val 64253604 ecr 65614446], length 2896: OpenFlow
	version unknown (0xff), type 0xfe, length 2104, xid 0x0bff0200
	version unknown (0x0a), type 0x01, length 27392, xid 0x000000ff [|openflow]
20:21:46.735499 IP 192.168.1.30.33784 > 192.168.1.10.6633: Flags [.], seq 17376:20272, ack 1, win 361, options [nop,nop,TS val 64253604 ecr 65614446], length 2896: OpenFlow
	version unknown (0x00), type 0x00, length 0, xid 0x00a0590a (corrupt)
20:21:46.735522 IP 192.168.1.30.33784 > 192.168.1.10.6633: Flags [.], seq 20272:23168, ack 1, win 361, options [nop,nop,TS val 64253604 ecr 65614446], length 2896: OpenFlow
	version unknown (0x00), type 0x01, length 2833, xid 0xfffe8000
	version unknown (0x0c), type 0x00, length 4096, xid 0x01000011 [|openflow]
20:21:46.735545 IP 192.168.1.30.33784 > 192.168.1.10.6633: Flags [.], seq 23168:26064, ack 1, win 361, options [nop,nop,TS val 64253604 ecr 65614446], length 2896: OpenFlow
	version unknown (0x08), type 0x38, length 2950, xid 0xdd600000 [|openflow]
20:21:46.735554 IP 192.168.1.30.33784 > 192.168.1.10.6633: Flags [.], seq 26064:28960, ack 1, win 361, options [nop,nop,TS val 64253604 ecr 65614446], length 2896: OpenFlow
	version unknown (0x33), type 0x00, length 0, xid 0xfba2590a (corrupt)
20:21:46.736415 IP 192.168.1.10.6633 > 192.168.1.30.33784: Flags [.], ack 8688, win 4692, options [nop,nop,TS val 65614455 ecr 64253588], length 0
20:21:46.737888 IP 192.168.1.30.33784 > 192.168.1.10.6633: Flags [.], seq 28960:31856, ack 1, win 361, options [nop,nop,TS val 64253604 ecr 65614455], length 2896: OpenFlow
	version unknown (0x02), type 0x00, length 0, xid 0x00000033 (corrupt)
20:21:46.737898 IP 192.168.1.30.33784 > 192.168.1.10.6633: Flags [.], seq 31856:34752, ack 1, win 361, options [nop,nop,TS val 64253604 ecr 65614455], length 2896: OpenFlow
	version unknown (0x0c), type 0x80, length 0, xid 0x04000000 (corrupt)
20:21:46.737920 IP 192.168.1.30.33784 > 192.168.1.10.6633: Flags [.], seq 34752:37648, ack 1, win 361, options [nop,nop,TS val 64253604 ecr 65614455], length 2896: OpenFlow
	version unknown (0x00), type 0x00, length 4, xid 0x0e000100 (corrupt)
20:21:46.737929 IP 192.168.1.30.33784 > 192.168.1.10.6633: Flags [.], seq 37648:40544, ack 1, win 361, options [nop,nop,TS val 64253604 ecr 65614455], length 2896: OpenFlow
	version unknown (0xff), type 0x01, length 16641, xid 0x002b0000 [|openflow]
20:21:46.779418 IP 192.168.1.10.6633 > 192.168.1.30.33784: Flags [.], ack 40544, win 4525, options [nop,nop,TS val 65614466 ecr 64253604], length 0
20:21:46.779447 IP 192.168.1.30.33784 > 192.168.1.10.6633: Flags [.], seq 40544:43440, ack 1, win 361, options [nop,nop,TS val 64253616 ecr 65614466], length 2896: OpenFlow
	version unknown (0x6b), type 0x00, length 0, xid 0x00ffffff (corrupt)
20:21:46.779456 IP 192.168.1.30.33784 > 192.168.1.10.6633: Flags [.], seq 43440:46336, ack 1, win 361, options [nop,nop,TS val 64253616 ecr 65614466], length 2896: OpenFlow
	version unknown (0x11), type 0x94, length 1, xid 0x00040a01 (corrupt)
20:21:46.779477 IP 192.168.1.30.33784 > 192.168.1.10.6633: Flags [.], seq 46336:49232, ack 1, win 361, options [nop,nop,TS val 64253616 ecr 65614466], length 2896: OpenFlow
	version unknown (0xc0), type 0x0c, length 16, xid 0x00010000
	version unknown (0x6b), type 0x00, length 0, xid 0x00ffffff (corrupt)
20:21:46.779486 IP 192.168.1.30.33784 > 192.168.1.10.6633: Flags [.], seq 49232:52128, ack 1, win 361, options [nop,nop,TS val 64253616 ecr 65614466], length 2896: OpenFlow
	version unknown (0x00), type 0x00, length 0, xid 0x0009c044 (corrupt)
20:21:46.779506 IP 192.168.1.30.33784 > 192.168.1.10.6633: Flags [.], seq 52128:55024, ack 1, win 361, options [nop,nop,TS val 64253616 ecr 65614466], length 2896: OpenFlow
	version unknown (0x00), type 0x01, length 0, xid 0x00780008 (corrupt)
20:21:46.779515 IP 192.168.1.30.33784 > 192.168.1.10.6633: Flags [.], seq 55024:57920, ack 1, win 361, options [nop,nop,TS val 64253616 ecr 65614466], length 2896: OpenFlow
	version unknown (0x49), type 0x4e, length 21848, xid 0xc00c0021 [|openflow]
20:21:46.779536 IP 192.168.1.30.33784 > 192.168.1.10.6633: Flags [.], seq 57920:60816, ack 1, win 361, options [nop,nop,TS val 64253616 ecr 65614466], length 2896: OpenFlow
	version unknown (0x58), type 0x38, length 13919, xid 0x3634054c [|openflow]
20:21:46.779550 IP 192.168.1.30.33784 > 192.168.1.10.6633: Flags [.], seq 60816:63712, ack 1, win 361, options [nop,nop,TS val 64253616 ecr 65614466], length 2896: OpenFlow
	version unknown (0x01), type 0x00, length 0, xid 0x78000d06 (corrupt)
20:21:46.779571 IP 192.168.1.30.33784 > 192.168.1.10.6633: Flags [.], seq 63712:66608, ack 1, win 361, options [nop,nop,TS val 64253616 ecr 65614466], length 2896: OpenFlow
	version unknown (0x69), type 0x6f, length 28164, xid 0x5f746370 [|openflow]
20:21:46.779579 IP 192.168.1.30.33784 > 192.168.1.10.6633: Flags [.], seq 66608:69504, ack 1, win 361, options [nop,nop,TS val 64253616 ecr 65614466], length 2896: OpenFlow
	version unknown (0x77), type 0x6f, length 29291, xid 0x73746174 [|openflow]
20:21:46.779601 IP 192.168.1.30.33784 > 192.168.1.10.6633: Flags [.], seq 69504:72400, ack 1, win 361, options [nop,nop,TS val 64253616 ecr 65614466], length 2896: OpenFlow
	version unknown (0x33), type 0x38, length 14896, xid 0x625d0c5f [|openflow]
20:21:46.820386 IP 192.168.1.10.6633 > 192.168.1.30.33784: Flags [.], ack 72400, win 4358, options [nop,nop,TS val 65614476 ecr 64253616], length 0
20:21:46.820409 IP 192.168.1.30.33784 > 192.168.1.10.6633: Flags [.], seq 72400:75296, ack 1, win 361, options [nop,nop,TS val 64253626 ecr 65614476], length 2896: OpenFlow
	version unknown (0x39), type 0x3a, length 12385, xid 0x3a30383a [|openflow]
20:21:46.820422 IP 192.168.1.30.33784 > 192.168.1.10.6633: Flags [.], seq 75296:78192, ack 1, win 361, options [nop,nop,TS val 64253626 ecr 65614476], length 2896: OpenFlow
	version unknown (0x01), type 0x00, length 0, xid 0x78000800 (corrupt)
20:21:46.820455 IP 192.168.1.30.33784 > 192.168.1.10.6633: Flags [.], seq 78192:81088, ack 1, win 361, options [nop,nop,TS val 64253626 ecr 65614476], length 2896: OpenFlow
	version unknown (0x4e), type 0x55, length 22720, xid 0x0c002100 [|openflow]
20:21:46.820466 IP 192.168.1.30.33784 > 192.168.1.10.6633: Flags [.], seq 81088:83984, ack 1, win 361, options [nop,nop,TS val 64253626 ecr 65614476], length 2896: OpenFlow
	version unknown (0x38), type 0x36, length 24374, xid 0x34054c49 [|openflow]
20:21:46.820495 IP 192.168.1.30.33784 > 192.168.1.10.6633: Flags [.], seq 83984:86880, ack 1, win 361, options [nop,nop,TS val 64253626 ecr 65614476], length 2896: OpenFlow
	version unknown (0x00), type 0x00, length 120, xid 0x000d0658
	version unknown (0x00), type 0x00, length 0, xid 0xa0590aff (corrupt)
20:21:46.820506 IP 192.168.1.30.33784 > 192.168.1.10.6633: Flags [.], seq 86880:89776, ack 1, win 361, options [nop,nop,TS val 64253626 ecr 65614476], length 2896: OpenFlow
	version unknown (0x6f), type 0x6e, length 1119, xid 0x74637005
	version 1.0, type ERROR, length 25089, xid 0x30013801 [|openflow]
20:21:46.820529 IP 192.168.1.30.33784 > 192.168.1.10.6633: Flags [.], seq 89776:92672, ack 1, win 361, options [nop,nop,TS val 64253626 ecr 65614476], length 2896: OpenFlow
	version unknown (0x6f), type 0x72, length 27507, xid 0x74617469 [|openflow]
20:21:46.820539 IP 192.168.1.30.33784 > 192.168.1.10.6633: Flags [.], seq 92672:95568, ack 1, win 361, options [nop,nop,TS val 64253626 ecr 65614476], length 2896: OpenFlow
	version unknown (0x38), type 0x3a, length 12386, xid 0x5d0c5f77 [|openflow]
20:21:46.820570 IP 192.168.1.30.33784 > 192.168.1.10.6633: Flags [.], seq 95568:98464, ack 1, win 361, options [nop,nop,TS val 64253626 ecr 65614476], length 2896: OpenFlow
	version unknown (0x3a), type 0x30, length 24890, xid 0x30383a33 [|openflow]
20:21:46.820579 IP 192.168.1.30.33784 > 192.168.1.10.6633: Flags [.], seq 98464:101360, ack 1, win 361, options [nop,nop,TS val 64253626 ecr 65614476], length 2896: OpenFlow
	version unknown (0x75), type 0x20, length 23393, xid 0x323a3539 [|openflow]
20:21:46.820603 IP 192.168.1.30.33784 > 192.168.1.10.6633: Flags [.], seq 101360:104256, ack 1, win 361, options [nop,nop,TS val 64253626 ecr 65614476], length 2896: OpenFlow
	version unknown (0x00), type 0x00, length 6773, xid 0x62756e74 [|openflow]
20:21:46.875969 IP 192.168.1.10.6633 > 192.168.1.30.33784: Flags [.], ack 104256, win 4191, options [nop,nop,TS val 65614490 ecr 64253626], length 0
20:21:46.876001 IP 192.168.1.30.33784 > 192.168.1.10.6633: Flags [.], seq 104256:107152, ack 1, win 361, options [nop,nop,TS val 64253640 ecr 65614490], length 2896: OpenFlow
	version unknown (0x00), type 0x00, length 3, xid 0x00000005 (corrupt)
20:21:46.876016 IP 192.168.1.30.33784 > 192.168.1.10.6633: Flags [.], seq 107152:110048, ack 1, win 361, options [nop,nop,TS val 64253640 ecr 65614490], length 2896: OpenFlow
	version unknown (0x14), type 0xe9, length 267, xid 0xce240000
	version unknown (0x01), type 0x6b, length 0, xid 0x0000ffff (corrupt)
20:21:46.876076 IP 192.168.1.30.33784 > 192.168.1.10.6633: Flags [.], seq 110048:112944, ack 1, win 361, options [nop,nop,TS val 64253640 ecr 65614490], length 2896: OpenFlow
	version unknown (0x00), type 0x00, length 0, xid 0x00fb14e9 (corrupt)
20:21:46.876091 IP 192.168.1.30.33784 > 192.168.1.10.6633: Flags [.], seq 112944:115840, ack 1, win 361, options [nop,nop,TS val 64253640 ecr 65614490], length 2896: OpenFlow
	version unknown (0x00), type 0x00, length 0, xid 0x00000000 (corrupt)
20:21:46.876117 IP 192.168.1.30.33784 > 192.168.1.10.6633: Flags [.], seq 115840:118736, ack 1, win 361, options [nop,nop,TS val 64253640 ecr 65614490], length 2896: OpenFlow
	version unknown (0x0a), type 0xff, length 65032, xid 0x380bff02 [|openflow]
20:21:46.876127 IP 192.168.1.30.33784 > 192.168.1.10.6633: Flags [.], seq 118736:121632, ack 1, win 361, options [nop,nop,TS val 64253640 ecr 65614490], length 2896: OpenFlow
	version unknown (0x00), type 0x00, length 0, xid 0x0000a059 (corrupt)
20:21:46.876164 IP 192.168.1.30.33784 > 192.168.1.10.6633: Flags [.], seq 121632:124528, ack 1, win 361, options [nop,nop,TS val 64253640 ecr 65614490], length 2896: OpenFlow
	version unknown (0x00), type 0x00, length 267, xid 0x11fffe80
	version unknown (0x4c), type 0x49, length 20053, xid 0x58c00c00 [|openflow]
20:21:46.876175 IP 192.168.1.30.33784 > 192.168.1.10.6633: Flags [.], seq 124528:127424, ack 1, win 361, options [nop,nop,TS val 64253640 ecr 65614490], length 2896: OpenFlow
	version unknown (0x0a), type 0x08, length 14347, xid 0x86dd6000 [|openflow]
20:21:46.876199 IP 192.168.1.30.33784 > 192.168.1.10.6633: Flags [.], seq 127424:130320, ack 1, win 361, options [nop,nop,TS val 64253640 ecr 65614490], length 2896: OpenFlow
	version unknown (0x33), type 0x33, length 0, xid 0x00fba259 (corrupt)
20:21:46.876208 IP 192.168.1.30.33784 > 192.168.1.10.6633: Flags [.], seq 130320:133216, ack 1, win 361, options [nop,nop,TS val 64253640 ecr 65614490], length 2896: OpenFlow
	version unknown (0x00), type 0x01, length 0, xid 0x00000000 (corrupt)
20:21:46.876242 IP 192.168.1.30.33784 > 192.168.1.10.6633: Flags [.], seq 133216:136112, ack 1, win 361, options [nop,nop,TS val 64253640 ecr 65614490], length 2896: OpenFlow
	version unknown (0x00), type 0x0c, length 32768, xid 0x00040000 [|openflow]
20:21:46.902895 IP 192.168.1.10.6633 > 192.168.1.30.33784: Flags [.], ack 136112, win 4390, options [nop,nop,TS val 65614497 ecr 64253640], length 0
20:21:46.902910 IP 192.168.1.30.33784 > 192.168.1.10.6633: Flags [.], seq 136112:139008, ack 1, win 361, options [nop,nop,TS val 64253647 ecr 65614497], length 2896: OpenFlow
	version unknown (0x00), type 0x00, length 0, xid 0x040c0001 (corrupt)
20:21:46.902919 IP 192.168.1.30.33784 > 192.168.1.10.6633: Flags [.], seq 139008:141904, ack 1, win 361, options [nop,nop,TS val 64253647 ecr 65614497], length 2896: OpenFlow
	version unknown (0xff), type 0xff, length 321, xid 0x01002b00
	version unknown (0x0c), type 0x00, length 8448, xid 0x01000000 [|openflow]
20:21:46.902944 IP 192.168.1.30.33784 > 192.168.1.10.6633: Flags [.], seq 141904:144800, ack 1, win 361, options [nop,nop,TS val 64253647 ecr 65614497], length 2896: OpenFlow
	version unknown (0x01), type 0x6b, length 0, xid 0x0000ffff (corrupt)
20:21:46.902953 IP 192.168.1.30.33784 > 192.168.1.10.6633: Flags [.], seq 144800:147696, ack 1, win 361, options [nop,nop,TS val 64253647 ecr 65614497], length 2896: OpenFlow
	version unknown (0x00), type 0x11, length 37888, xid 0x0100040a [|openflow]
20:21:46.902974 IP 192.168.1.30.33784 > 192.168.1.10.6633: Flags [.], seq 147696:150592, ack 1, win 361, options [nop,nop,TS val 64253647 ecr 65614497], length 2896: OpenFlow
	version unknown (0x44), type 0xc0, length 3072, xid 0x10000100 [|openflow]
20:21:46.902983 IP 192.168.1.30.33784 > 192.168.1.10.6633: Flags [.], seq 150592:153488, ack 1, win 361, options [nop,nop,TS val 64253647 ecr 65614497], length 2896: OpenFlow
	version unknown (0x08), type 0x00, length 0, xid 0x000009c0 (corrupt)
20:21:46.903004 IP 192.168.1.30.33784 > 192.168.1.10.6633: Flags [.], seq 153488:156384, ack 1, win 361, options [nop,nop,TS val 64253647 ecr 65614497], length 2896: OpenFlow
	version 1.0, type ERROR, length 25089, xid 0x30013801 [|openflow]
20:21:46.903013 IP 192.168.1.30.33784 > 192.168.1.10.6633: Flags [.], seq 156384:159280, ack 1, win 361, options [nop,nop,TS val 64253647 ecr 65614497], length 2896: OpenFlow
	version unknown (0x0c), type 0x80, length 0, xid 0x04000000 (corrupt)
20:21:46.903035 IP 192.168.1.30.33784 > 192.168.1.10.6633: Flags [.], seq 159280:162176, ack 1, win 361, options [nop,nop,TS val 64253647 ecr 65614497], length 2896: OpenFlow
	version 1.0, type invalid (0x30), length 304, xid 0x01300130
	version unknown (0x62), type 0x75, length 28276, xid 0x75c03900 [|openflow]
20:21:46.903161 IP 192.168.1.30.33784 > 192.168.1.10.6633: Flags [.], seq 162176:165072, ack 1, win 361, options [nop,nop,TS val 64253647 ecr 65614497], length 2896: OpenFlow
	version 1.0, type invalid (0x30), length 304, xid 0x01300130
	version unknown (0x6c), type 0x00, length 255, xid 0x00010675
	version unknown (0x00), type 0x00, length 267, xid 0x11fffe80
	version unknown (0x4c), type 0x49, length 20053, xid 0x58c00c00 [|openflow]
20:21:46.903210 IP 192.168.1.30.33784 > 192.168.1.10.6633: Flags [.], seq 165072:167968, ack 1, win 361, options [nop,nop,TS val 64253647 ecr 65614497], length 2896: OpenFlow
	version 1.0, type invalid (0x30), length 304, xid 0x01300130
	version unknown (0x74), type 0x63, length 28677, xid 0x6c6f6361 [|openflow]
20:21:46.904224 IP 192.168.1.10.6633 > 192.168.1.30.33784: Flags [.], ack 167968, win 5851, options [nop,nop,TS val 65614498 ecr 64253647], length 0
20:21:46.904239 IP 192.168.1.30.33784 > 192.168.1.10.6633: Flags [.], seq 167968:170864, ack 1, win 361, options [nop,nop,TS val 64253647 ecr 65614498], length 2896: OpenFlow
	version 1.0, type invalid (0x39), length 309, xid 0x01300161
	version unknown (0x6e), type 0x04, length 24436, xid 0x6370056c [|openflow]
20:21:46.904248 IP 192.168.1.30.33784 > 192.168.1.10.6633: Flags [.], seq 170864:173760, ack 1, win 361, options [nop,nop,TS val 64253647 ecr 65614498], length 2896: OpenFlow
	version 1.0, type invalid (0x66), length 358, xid 0x01610130
	version unknown (0x30), type 0x01, length 25857, xid 0x66016601 [|openflow]
20:21:46.904276 IP 192.168.1.30.33784 > 192.168.1.10.6633: Flags [.], seq 173760:176656, ack 1, win 361, options [nop,nop,TS val 64253647 ecr 65614498], length 2896: OpenFlow
	version 1.0, type invalid (0x38), length 304, xid 0x01650166
	version unknown (0x30), type 0x38, length 14899, xid 0x383a3062 [|openflow]
20:21:46.904286 IP 192.168.1.30.33784 > 192.168.1.10.6633: Flags [.], seq 176656:179552, ack 1, win 361, options [nop,nop,TS val 64253647 ecr 65614498], length 2896: OpenFlow
	version 1.0, type invalid (0x62), length 304, xid 0x01380133
	version unknown (0x32), type 0x3a, length 13625, xid 0x3a30613a [|openflow]
20:21:46.904310 IP 192.168.1.30.33784 > 192.168.1.10.6633: Flags [.], seq 179552:182448, ack 1, win 361, options [nop,nop,TS val 64253647 ecr 65614498], length 2896: OpenFlow
	version unknown (0x74), type 0x75, length 49209, xid 0x00ff0001 [|openflow]
20:21:46.904319 IP 192.168.1.30.33784 > 192.168.1.10.6633: Flags [.], seq 182448:185344, ack 1, win 361, options [nop,nop,TS val 64253647 ecr 65614498], length 2896: OpenFlow
	version unknown (0xff), type 0x00, length 262, xid 0x7562756e
	version unknown (0x00), type 0x00, length 0, xid 0xa0590aff (corrupt)
20:21:46.904341 IP 192.168.1.30.33784 > 192.168.1.10.6633: Flags [.], seq 185344:188240, ack 1, win 361, options [nop,nop,TS val 64253647 ecr 65614498], length 2896: OpenFlow
	version unknown (0x30), type 0x01, length 12289, xid 0x30013001 [|openflow]
20:21:46.904349 IP 192.168.1.30.33784 > 192.168.1.10.6633: Flags [.], seq 188240:191136, ack 1, win 361, options [nop,nop,TS val 64253647 ecr 65614498], length 2896: OpenFlow
	version unknown (0x30), type 0x01, length 12289, xid 0x30013001 [|openflow]
20:21:46.904373 IP 192.168.1.30.33784 > 192.168.1.10.6633: Flags [.], seq 191136:194032, ack 1, win 361, options [nop,nop,TS val 64253647 ecr 65614498], length 2896: OpenFlow
	version unknown (0x0b), type 0x11, length 65534, xid 0x80000000 [|openflow]
20:21:46.904382 IP 192.168.1.30.33784 > 192.168.1.10.6633: Flags [.], seq 194032:196928, ack 1, win 361, options [nop,nop,TS val 64253647 ecr 65614498], length 2896: OpenFlow
	version unknown (0x0b), type 0x86, length 56672, xid 0x00000001 [|openflow]
20:21:46.904405 IP 192.168.1.30.33784 > 192.168.1.10.6633: Flags [.], seq 196928:199824, ack 1, win 361, options [nop,nop,TS val 64253647 ecr 65614498], length 2896: OpenFlow
	version unknown (0x00), type 0x00, length 64418, xid 0x590a0838 [|openflow]
20:21:46.904640 IP 192.168.1.10.6633 > 192.168.1.30.33784: Flags [.], ack 173760, win 5880, options [nop,nop,TS val 65614498 ecr 64253647], length 0
20:21:46.904644 IP 192.168.1.30.33784 > 192.168.1.10.6633: Flags [.], seq 199824:202720, ack 1, win 361, options [nop,nop,TS val 64253647 ecr 65614498], length 2896: OpenFlow
	version unknown (0x00), type 0x00, length 0, xid 0x00333300 (corrupt)
20:21:46.904668 IP 192.168.1.30.33784 > 192.168.1.10.6633: Flags [.], seq 202720:205616, ack 1, win 361, options [nop,nop,TS val 64253647 ecr 65614498], length 2896: OpenFlow
	version unknown (0x00), type 0x00, length 1024, xid 0x00000300
	version unknown (0x4e), type 0x55, length 22720, xid 0x0c002100 [|openflow]
20:21:46.904678 IP 192.168.1.10.6633 > 192.168.1.30.33784: Flags [.], ack 179552, win 5880, options [nop,nop,TS val 65614498 ecr 64253647], length 0
20:21:46.904682 IP 192.168.1.30.33784 > 192.168.1.10.6633: Flags [.], seq 205616:208512, ack 1, win 361, options [nop,nop,TS val 64253647 ecr 65614498], length 2896: OpenFlow
	version unknown (0x00), type 0x04, length 3328, xid 0x01000c80 [|openflow]
20:21:46.904705 IP 192.168.1.30.33784 > 192.168.1.10.6633: Flags [.], seq 208512:211408, ack 1, win 361, options [nop,nop,TS val 64253647 ecr 65614498], length 2896: OpenFlow
	version unknown (0x41), type 0x01, length 43, xid 0x00000000
	version unknown (0x60), type 0x00, length 0, xid 0x010b11ff (corrupt)
20:21:46.904715 IP 192.168.1.10.6633 > 192.168.1.30.33784: Flags [.], ack 185344, win 5880, options [nop,nop,TS val 65614498 ecr 64253647], length 0
20:21:46.904719 IP 192.168.1.30.33784 > 192.168.1.10.6633: Flags [.], seq 211408:214304, ack 1, win 361, options [nop,nop,TS val 64253647 ecr 65614498], length 2896: OpenFlow
	version unknown (0x00), type 0x00, length 255, xid 0xffffff01
	version unknown (0xff), type 0x00, length 448, xid 0x44001c00
	version unknown (0x00), type 0x00, length 2496, xid 0x44c00c00 [|openflow]
20:21:46.904743 IP 192.168.1.30.33784 > 192.168.1.10.6633: Flags [.], seq 214304:217200, ack 1, win 361, options [nop,nop,TS val 64253647 ecr 65614498], length 2896: OpenFlow
	version unknown (0x00), type 0x01, length 4, xid 0x0a016b00 (corrupt)
20:21:46.904753 IP 192.168.1.10.6633 > 192.168.1.30.33784: Flags [.], ack 191136, win 5880, options [nop,nop,TS val 65614498 ecr 64253647], length 0
20:21:46.904757 IP 192.168.1.30.33784 > 192.168.1.10.6633: Flags [.], seq 217200:220096, ack 1, win 361, options [nop,nop,TS val 64253647 ecr 65614498], length 2896: OpenFlow
	version unknown (0x00), type 0x10, length 1, xid 0x00001194 (corrupt)
20:21:46.904781 IP 192.168.1.30.33784 > 192.168.1.10.6633: Flags [.], seq 220096:222992, ack 1, win 361, options [nop,nop,TS val 64253647 ecr 65614498], length 2896: OpenFlow
	version unknown (0x00), type 0x00, length 9, xid 0xc044c00c
	version unknown (0x10), type 0x00, length 256, xid 0x00119400
	version unknown (0x65), type 0x01, length 26115, xid 0x69703604 [|openflow]
20:21:46.904790 IP 192.168.1.10.6633 > 192.168.1.30.33784: Flags [.], ack 196928, win 5880, options [nop,nop,TS val 65614498 ecr 64253647], length 0
20:21:46.904795 IP 192.168.1.30.33784 > 192.168.1.10.6633: Flags [.], seq 222992:225888, ack 1, win 361, options [nop,nop,TS val 64253647 ecr 65614498], length 2896: OpenFlow
	version 1.0, type invalid (0x30), length 312, xid 0x01330138
	version unknown (0x3a), type 0x33, length 14394, xid 0x30625d0c [|openflow]
20:21:46.904818 IP 192.168.1.30.33784 > 192.168.1.10.6633: Flags [.], seq 225888:228784, ack 1, win 361, options [nop,nop,TS val 64253647 ecr 65614498], length 2896: OpenFlow
	version unknown (0xc0), type 0x39, length 255, xid 0x00010162
	version unknown (0x00), type 0xa0, length 22794, xid 0xfffe0838 [|openflow]
20:21:46.904828 IP 192.168.1.10.6633 > 192.168.1.30.33784: Flags [.], ack 199824, win 5880, options [nop,nop,TS val 65614498 ecr 64253647], length 0
20:21:46.904832 IP 192.168.1.30.33784 > 192.168.1.10.6633: Flags [.], seq 228784:231680, ack 1, win 361, options [nop,nop,TS val 64253647 ecr 65614498], length 2896: OpenFlow
	version unknown (0x04), type 0x0c, length 1, xid 0x000c8000 (corrupt)
20:21:46.905064 IP 192.168.1.10.6633 > 192.168.1.30.33784: Flags [.], ack 202720, win 5880, options [nop,nop,TS val 65614498 ecr 64253647], length 0
20:21:46.905077 IP 192.168.1.10.6633 > 192.168.1.30.33784: Flags [.], ack 208512, win 5880, options [nop,nop,TS val 65614498 ecr 64253647], length 0
20:21:46.905082 IP 192.168.1.10.6633 > 192.168.1.30.33784: Flags [.], ack 214304, win 5880, options [nop,nop,TS val 65614498 ecr 64253647], length 0
20:21:46.905086 IP 192.168.1.10.6633 > 192.168.1.30.33784: Flags [.], ack 220096, win 5880, options [nop,nop,TS val 65614498 ecr 64253647], length 0
20:21:46.905089 IP 192.168.1.10.6633 > 192.168.1.30.33784: Flags [.], ack 225888, win 5880, options [nop,nop,TS val 65614498 ecr 64253647], length 0
20:21:46.905092 IP 192.168.1.10.6633 > 192.168.1.30.33784: Flags [.], ack 231680, win 5880, options [nop,nop,TS val 65614498 ecr 64253647], length 0
20:21:46.905191 IP 192.168.1.30.33784 > 192.168.1.10.6633: Flags [.], seq 231680:234576, ack 1, win 361, options [nop,nop,TS val 64253647 ecr 65614498], length 2896: OpenFlow
	version 1.0, type HELLO, length 11008, xid 0x00000000 [|openflow]
20:21:46.905199 IP 192.168.1.30.33784 > 192.168.1.10.6633: Flags [.], seq 234576:237472, ack 1, win 361, options [nop,nop,TS val 64253647 ecr 65614498], length 2896: OpenFlow
	version unknown (0x30), type 0x01, length 12289, xid 0x30013001 [|openflow]
20:21:46.905246 IP 192.168.1.30.33784 > 192.168.1.10.6633: Flags [.], seq 237472:240368, ack 1, win 361, options [nop,nop,TS val 64253647 ecr 65614498], length 2896: OpenFlow
	version unknown (0x35), type 0x01, length 12289, xid 0x61013001 [|openflow]
20:21:46.905254 IP 192.168.1.30.33784 > 192.168.1.10.6633: Flags [.], seq 240368:243264, ack 1, win 361, options [nop,nop,TS val 64253647 ecr 65614498], length 2896: OpenFlow
	version unknown (0x66), type 0x01, length 24833, xid 0x30013901 [|openflow]
20:21:46.905276 IP 192.168.1.30.33784 > 192.168.1.10.6633: Flags [.], seq 243264:246160, ack 1, win 361, options [nop,nop,TS val 64253647 ecr 65614498], length 2896: OpenFlow
	version unknown (0x30), type 0x01, length 25857, xid 0x66016601 [|openflow]
20:21:46.905316 IP 192.168.1.30.33784 > 192.168.1.10.6633: Flags [.], seq 246160:249056, ack 1, win 361, options [nop,nop,TS val 64253647 ecr 65614498], length 2896: OpenFlow
	version unknown (0x30), type 0x01, length 14337, xid 0x33013801 [|openflow]
20:21:46.905340 IP 192.168.1.30.33784 > 192.168.1.10.6633: Flags [.], seq 249056:251952, ack 1, win 361, options [nop,nop,TS val 64253647 ecr 65614498], length 2896: OpenFlow
	version unknown (0x39), type 0x00, length 65280, xid 0x01016201 [|openflow]
20:21:46.905348 IP 192.168.1.30.33784 > 192.168.1.10.6633: Flags [.], seq 251952:254848, ack 1, win 361, options [nop,nop,TS val 64253647 ecr 65614498], length 2896: OpenFlow
	version unknown (0x06), type 0x75, length 25205, xid 0x6e7475c0 [|openflow]
20:21:46.905367 IP 192.168.1.30.33784 > 192.168.1.10.6633: Flags [.], seq 254848:257744, ack 1, win 361, options [nop,nop,TS val 64253647 ecr 65614498], length 2896: OpenFlow
	version unknown (0x63), type 0x61, length 27648, xid 0x00ff0001 [|openflow]
20:21:46.905375 IP 192.168.1.30.33784 > 192.168.1.10.6633: Flags [.], seq 257744:260640, ack 1, win 361, options [nop,nop,TS val 64253647 ecr 65614498], length 2896: OpenFlow
	version unknown (0x04), type 0x5f, length 29795, xid 0x70056c6f [|openflow]
20:21:46.905396 IP 192.168.1.30.33784 > 192.168.1.10.6633: Flags [.], seq 260640:263536, ack 1, win 361, options [nop,nop,TS val 64253647 ecr 65614498], length 2896: OpenFlow
	version unknown (0x6b), type 0x73, length 29793, xid 0x74696f6e [|openflow]
20:21:46.905660 IP 192.168.1.10.6633 > 192.168.1.30.33784: Flags [.], ack 237472, win 5880, options [nop,nop,TS val 65614498 ecr 64253647], length 0
20:21:46.905666 IP 192.168.1.30.33784 > 192.168.1.10.6633: Flags [.], seq 263536:266432, ack 1, win 361, options [nop,nop,TS val 64253648 ecr 65614498], length 2896: OpenFlow
	version unknown (0x30), type 0x62, length 23820, xid 0x5f776f72 [|openflow]
20:21:46.905689 IP 192.168.1.30.33784 > 192.168.1.10.6633: Flags [.], seq 266432:269328, ack 1, win 361, options [nop,nop,TS val 64253648 ecr 65614498], length 2896: OpenFlow
	version unknown (0x61), type 0x3a, length 12344, xid 0x3a33383a [|openflow]
20:21:46.905699 IP 192.168.1.10.6633 > 192.168.1.30.33784: Flags [.], ack 243264, win 5880, options [nop,nop,TS val 65614498 ecr 64253647], length 0
20:21:46.905704 IP 192.168.1.30.33784 > 192.168.1.10.6633: Flags [.], seq 269328:272224, ack 1, win 361, options [nop,nop,TS val 64253648 ecr 65614498], length 2896: OpenFlow
	version unknown (0x5b), type 0x61, length 12858, xid 0x35393a30 [|openflow]
20:21:46.905726 IP 192.168.1.30.33784 > 192.168.1.10.6633: Flags [.], seq 272224:275120, ack 1, win 361, options [nop,nop,TS val 64253648 ecr 65614498], length 2896: OpenFlow
	version unknown (0x1a), type 0x75, length 25205, xid 0x6e747520 [|openflow]
20:21:46.905736 IP 192.168.1.10.6633 > 192.168.1.30.33784: Flags [.], ack 249056, win 5880, options [nop,nop,TS val 65614498 ecr 64253647], length 0
20:21:46.905741 IP 192.168.1.30.33784 > 192.168.1.10.6633: Flags [.], seq 275120:278016, ack 1, win 361, options [nop,nop,TS val 64253648 ecr 65614498], length 2896: OpenFlow
	version unknown (0x00), type 0x03, length 0, xid 0x00050000 (corrupt)
20:21:46.905764 IP 192.168.1.30.33784 > 192.168.1.10.6633: Flags [.], seq 278016:280912, ack 1, win 361, options [nop,nop,TS val 64253648 ecr 65614498], length 2896: OpenFlow
	version 1.0, type FLOW_REMOVED, length 52772, xid 0x00000000 (corrupt) [|openflow]
20:21:46.905774 IP 192.168.1.10.6633 > 192.168.1.30.33784: Flags [.], ack 254848, win 5880, options [nop,nop,TS val 65614498 ecr 64253647], length 0
20:21:46.905779 IP 192.168.1.30.33784 > 192.168.1.10.6633: Flags [.], seq 280912:283808, ack 1, win 361, options [nop,nop,TS val 64253648 ecr 65614498], length 2896: OpenFlow
	version unknown (0x00), type 0x00, length 251, xid 0x14e914e9
	version unknown (0x00), type 0x00, length 0, xid 0x09c044c0 (corrupt)
20:21:46.905805 IP 192.168.1.30.33784 > 192.168.1.10.6633: Flags [.], seq 283808:286704, ack 1, win 361, options [nop,nop,TS val 64253648 ecr 65614498], length 2896: OpenFlow
	version unknown (0x00), type 0x00, length 30720, xid 0x02c044c0 [|openflow]
20:21:46.905816 IP 192.168.1.10.6633 > 192.168.1.30.33784: Flags [.], ack 260640, win 5880, options [nop,nop,TS val 65614498 ecr 64253647], length 0
20:21:46.905820 IP 192.168.1.30.33784 > 192.168.1.10.6633: Flags [.], seq 286704:289600, ack 1, win 361, options [nop,nop,TS val 64253648 ecr 65614498], length 2896: OpenFlow
	version unknown (0x0b), type 0xc0, length 20736, xid 0x0c000100 [|openflow]
20:21:46.905843 IP 192.168.1.30.33784 > 192.168.1.10.6633: Flags [.], seq 289600:292496, ack 1, win 361, options [nop,nop,TS val 64253648 ecr 65614498], length 2896: OpenFlow
	version unknown (0x00), type 0xa0, length 22794, xid 0xfffe0838 [|openflow]
20:21:46.905853 IP 192.168.1.10.6633 > 192.168.1.30.33784: Flags [.], ack 263536, win 5880, options [nop,nop,TS val 65614498 ecr 64253647], length 0
20:21:46.905858 IP 192.168.1.30.33784 > 192.168.1.10.6633: Flags [.], seq 292496:295392, ack 1, win 361, options [nop,nop,TS val 64253648 ecr 65614498], length 2896: OpenFlow
	version unknown (0x61), type 0x32, length 14901, xid 0x393a3061 [|openflow]
20:21:46.906294 IP 192.168.1.10.6633 > 192.168.1.30.33784: Flags [.], ack 266432, win 5926, options [nop,nop,TS val 65614498 ecr 64253648], length 0
20:21:46.906299 IP 192.168.1.30.33784 > 192.168.1.10.6633: Flags [.], seq 295392:298288, ack 1, win 361, options [nop,nop,TS val 64253648 ecr 65614498], length 2896: OpenFlow
	version unknown (0x75), type 0x62, length 30062, xid 0x7475205b [|openflow]
20:21:46.906313 IP 192.168.1.10.6633 > 192.168.1.30.33784: Flags [.], ack 272224, win 6016, options [nop,nop,TS val 65614498 ecr 64253648], length 0
20:21:46.906318 IP 192.168.1.30.33784 > 192.168.1.10.6633: Flags [.], seq 298288:301184, ack 1, win 361, options [nop,nop,TS val 64253648 ecr 65614498], length 2896: OpenFlow
	version unknown (0x03), type 0x00, length 0, xid 0x0500001a (corrupt)
20:21:46.906340 IP 192.168.1.30.33784 > 192.168.1.10.6633: Flags [.], seq 301184:304080, ack 1, win 361, options [nop,nop,TS val 64253648 ecr 65614498], length 2896: OpenFlow
	version unknown (0x0b), type 0xce, length 9216, xid 0x00000000 [|openflow]
20:21:46.906350 IP 192.168.1.10.6633 > 192.168.1.30.33784: Flags [.], ack 278016, win 6107, options [nop,nop,TS val 65614498 ecr 64253648], length 0
20:21:46.906355 IP 192.168.1.30.33784 > 192.168.1.10.6633: Flags [.], seq 304080:306976, ack 1, win 361, options [nop,nop,TS val 64253648 ecr 65614498], length 2896: OpenFlow
	version unknown (0x00), type 0x0d, length 1, xid 0x00000078 (corrupt)
20:21:46.906378 IP 192.168.1.30.33784 > 192.168.1.10.6633: Flags [.], seq 306976:309872, ack 1, win 361, options [nop,nop,TS val 64253648 ecr 65614498], length 2896: OpenFlow
	version unknown (0x00), type 0x78, length 2, xid 0xc044c044 (corrupt)
20:21:46.906388 IP 192.168.1.10.6633 > 192.168.1.30.33784: Flags [.], ack 283808, win 6197, options [nop,nop,TS val 65614498 ecr 64253648], length 0
20:21:46.906392 IP 192.168.1.30.33784 > 192.168.1.10.6633: Flags [.], seq 309872:312768, ack 1, win 361, options [nop,nop,TS val 64253648 ecr 65614498], length 2896: OpenFlow
	version unknown (0xc0), type 0x51, length 12, xid 0x00010000
	version unknown (0xc0), type 0x44, length 49220, xid 0x000d0001 [|openflow]
20:21:46.906415 IP 192.168.1.30.33784 > 192.168.1.10.6633: Flags [.], seq 312768:315664, ack 1, win 361, options [nop,nop,TS val 64253648 ecr 65614498], length 2896: OpenFlow
	version unknown (0xa0), type 0x59, length 2815, xid 0xfe08380b
	version unknown (0x38), type 0x01, length 12289, xid 0x65016601 [|openflow]
20:21:46.906425 IP 192.168.1.10.6633 > 192.168.1.30.33784: Flags [.], ack 289600, win 6288, options [nop,nop,TS val 65614498 ecr 64253648], length 0
20:21:46.906430 IP 192.168.1.30.33784 > 192.168.1.10.6633: Flags [.], seq 315664:318560, ack 1, win 361, options [nop,nop,TS val 64253648 ecr 65614498], length 2896: OpenFlow
	version unknown (0xfe), type 0x80, length 0, xid 0x00000000 (corrupt)
20:21:46.906453 IP 192.168.1.30.33784 > 192.168.1.10.6633: Flags [.], seq 318560:321456, ack 1, win 361, options [nop,nop,TS val 64253648 ecr 65614498], length 2896: OpenFlow
	version unknown (0x00), type 0x01, length 0, xid 0x00780010 (corrupt)
20:21:46.906463 IP 192.168.1.10.6633 > 192.168.1.30.33784: Flags [.], ack 295392, win 6378, options [nop,nop,TS val 65614498 ecr 64253648], length 0
20:21:46.906467 IP 192.168.1.30.33784 > 192.168.1.10.6633: Flags [.], seq 321456:324352, ack 1, win 361, options [nop,nop,TS val 64253648 ecr 65614498], length 2896: OpenFlow
	version unknown (0x00), type 0xff, length 1, xid 0xc044001c (corrupt)
20:21:46.906490 IP 192.168.1.30.33784 > 192.168.1.10.6633: Flags [.], seq 324352:327248, ack 1, win 361, options [nop,nop,TS val 64253648 ecr 65614498], length 2896: OpenFlow
	version unknown (0x70), type 0x36, length 1121, xid 0x72706100
	version unknown (0x0a), type 0x08, length 14347, xid 0x86dd6000 [|openflow]
20:21:46.906730 IP 192.168.1.10.6633 > 192.168.1.30.33784: Flags [.], ack 301184, win 6469, options [nop,nop,TS val 65614498 ecr 64253648], length 0
20:21:46.906735 IP 192.168.1.30.33784 > 192.168.1.10.6633: Flags [.], seq 327248:330144, ack 1, win 361, options [nop,nop,TS val 64253648 ecr 65614498], length 2896: OpenFlow
	version unknown (0xff), type 0xff, length 321, xid 0x01002b00
	version unknown (0x0c), type 0x00, length 8448, xid 0x01000000 [|openflow]
20:21:46.906756 IP 192.168.1.30.33784 > 192.168.1.10.6633: Flags [.], seq 330144:333040, ack 1, win 361, options [nop,nop,TS val 64253648 ecr 65614498], length 2896: OpenFlow
	version unknown (0x01), type 0x6b, length 0, xid 0x0000ffff (corrupt)
20:21:46.906766 IP 192.168.1.10.6633 > 192.168.1.30.33784: Flags [.], ack 306976, win 6559, options [nop,nop,TS val 65614498 ecr 64253648], length 0
20:21:46.906770 IP 192.168.1.30.33784 > 192.168.1.10.6633: Flags [.], seq 333040:335936, ack 1, win 361, options [nop,nop,TS val 64253648 ecr 65614498], length 2896: OpenFlow
	version unknown (0x00), type 0x11, length 37888, xid 0x0100040a [|openflow]
20:21:46.906795 IP 192.168.1.10.6633 > 192.168.1.30.33784: Flags [.], ack 312768, win 6650, options [nop,nop,TS val 65614498 ecr 64253648], length 0
20:21:46.906801 IP 192.168.1.10.6633 > 192.168.1.30.33784: Flags [.], ack 318560, win 6740, options [nop,nop,TS val 65614498 ecr 64253648], length 0
20:21:46.906804 IP 192.168.1.10.6633 > 192.168.1.30.33784: Flags [.], ack 324352, win 6831, options [nop,nop,TS val 65614498 ecr 64253648], length 0
20:21:46.906814 IP 192.168.1.10.6633 > 192.168.1.30.33784: Flags [.], ack 327248, win 6876, options [nop,nop,TS val 65614498 ecr 64253648], length 0
20:21:46.906855 IP 192.168.1.10.6633 > 192.168.1.30.33784: Flags [.], ack 330144, win 6921, options [nop,nop,TS val 65614498 ecr 64253648], length 0
20:21:46.906936 IP 192.168.1.10.6633 > 192.168.1.30.33784: Flags [.], ack 335936, win 7012, options [nop,nop,TS val 65614498 ecr 64253648], length 0
20:21:46.906941 IP 192.168.1.30.33784 > 192.168.1.10.6633: Flags [.], seq 335936:338832, ack 1, win 361, options [nop,nop,TS val 64253648 ecr 65614498], length 2896: OpenFlow
	version unknown (0x44), type 0xc0, length 3072, xid 0x10000100 [|openflow]
20:21:46.906961 IP 192.168.1.30.33784 > 192.168.1.10.6633: Flags [.], seq 338832:341728, ack 1, win 361, options [nop,nop,TS val 64253648 ecr 65614498], length 2896: OpenFlow
	version unknown (0x08), type 0x00, length 0, xid 0x000009c0 (corrupt)
20:21:46.906985 IP 192.168.1.30.33784 > 192.168.1.10.6633: Flags [.], seq 341728:344624, ack 1, win 361, options [nop,nop,TS val 64253648 ecr 65614498], length 2896: OpenFlow
	version unknown (0x21), type 0x00, length 256, xid 0x00007800
	version unknown (0x30), type 0x01, length 12289, xid 0x30013001 [|openflow]
20:21:46.906994 IP 192.168.1.30.33784 > 192.168.1.10.6633: Flags [.], seq 344624:347520, ack 1, win 361, options [nop,nop,TS val 64253648 ecr 65614498], length 2896: OpenFlow
	version unknown (0x4c), type 0x49, length 20053, xid 0x58c00c00 [|openflow]
20:21:46.907014 IP 192.168.1.30.33784 > 192.168.1.10.6633: Flags [.], seq 347520:350416, ack 1, win 361, options [nop,nop,TS val 64253648 ecr 65614498], length 2896: OpenFlow
	version unknown (0x06), type 0x58, length 14390, xid 0x5f363405 [|openflow]
20:21:46.907023 IP 192.168.1.30.33784 > 192.168.1.10.6633: Flags [.], seq 350416:353312, ack 1, win 361, options [nop,nop,TS val 64253648 ecr 65614498], length 2896: OpenFlow
	version unknown (0x00), type 0x01, length 0, xid 0x0078000d (corrupt)
20:21:46.907044 IP 192.168.1.30.33784 > 192.168.1.10.6633: Flags [.], seq 353312:356208, ack 1, win 361, options [nop,nop,TS val 64253648 ecr 65614498], length 2896: OpenFlow
	version unknown (0x00), type 0x02, length 49220, xid 0xc044000d [|openflow]
20:21:46.907053 IP 192.168.1.30.33784 > 192.168.1.10.6633: Flags [.], seq 356208:359104, ack 1, win 361, options [nop,nop,TS val 64253648 ecr 65614498], length 2896: OpenFlow
	version unknown (0x5f), type 0x77, length 28530, xid 0x6b737461 [|openflow]
20:21:46.907218 IP 192.168.1.30.33784 > 192.168.1.10.6633: Flags [.], seq 359104:362000, ack 1, win 361, options [nop,nop,TS val 64253648 ecr 65614498], length 2896: OpenFlow
	version unknown (0x3a), type 0x33, length 14394, xid 0x30625d0c [|openflow]
20:21:46.907226 IP 192.168.1.30.33784 > 192.168.1.10.6633: Flags [.], seq 362000:364896, ack 1, win 361, options [nop,nop,TS val 64253648 ecr 65614498], length 2896: OpenFlow
	version unknown (0x35), type 0x39, length 14896, xid 0x613a3038 [|openflow]
20:21:46.907248 IP 192.168.1.30.33784 > 192.168.1.10.6633: Flags [.], seq 364896:367792, ack 1, win 361, options [nop,nop,TS val 64253648 ecr 65614498], length 2896: OpenFlow
	version unknown (0x6e), type 0x74, length 29984, xid 0x5b61323a [|openflow]
20:21:46.907383 IP 192.168.1.10.6633 > 192.168.1.30.33784: Flags [.], ack 341728, win 7102, options [nop,nop,TS val 65614498 ecr 64253648], length 0
