14:21:05.530556 IP 192.168.1.10.6633 > 192.168.1.30.33603: Flags [.], ack 2762438705, win 12127, options [nop,nop,TS val 60204152 ecr 58843295], length 0
14:21:05.530583 IP 192.168.1.30.33603 > 192.168.1.10.6633: Flags [.], seq 1:2897, ack 0, win 361, options [nop,nop,TS val 58843304 ecr 60204152], length 2896: OpenFlow
	version unknown (0x00), type 0x00, length 0, xid 0x00000000 (corrupt)
14:21:05.530593 IP 192.168.1.30.33603 > 192.168.1.10.6633: Flags [.], seq 2897:5793, ack 0, win 361, options [nop,nop,TS val 58843304 ecr 60204152], length 2896: OpenFlow
	version unknown (0x32), type 0x48, length 44045, xid 0xee9b0000 [|openflow]
14:21:05.530634 IP 192.168.1.30.33603 > 192.168.1.10.6633: Flags [.], seq 5793:8689, ack 0, win 361, options [nop,nop,TS val 58843304 ecr 60204152], length 2896: OpenFlow
	version unknown (0x63), type 0x82, length 21347, xid 0x3501010c [|openflow]
14:21:05.530676 IP 192.168.1.30.33603 > 192.168.1.10.6633: Flags [.], seq 8689:11585, ack 0, win 361, options [nop,nop,TS val 58843304 ecr 60204152], length 2896: OpenFlow
	version unknown (0x00), type 0x00, length 0, xid 0x00000000 (corrupt)
14:21:05.530715 IP 192.168.1.30.33603 > 192.168.1.10.6633: Flags [.], seq 11585:14481, ack 0, win 361, options [nop,nop,TS val 58843304 ecr 60204152], length 2896: OpenFlow
	version unknown (0x21), type 0xfc, length 11007, xid 0x00000000 [|openflow]
14:21:05.530735 IP 192.168.1.30.33603 > 192.168.1.10.6633: Flags [P.], seq 14481:17377, ack 0, win 361, options [nop,nop,TS val 58843304 ecr 60204152], length 2896: OpenFlow
	version unknown (0x00), type 0x00, length 0, xid 0x00000000 (corrupt)
14:21:05.738081 IP 192.168.1.10.6633 > 192.168.1.30.33603: Flags [.], ack 17377, win 12127, options [nop,nop,TS val 60204182 ecr 58843304], length 0
14:21:05.738095 IP 192.168.1.30.33603 > 192.168.1.10.6633: Flags [.], seq 17377:20273, ack 0, win 361, options [nop,nop,TS val 58843356 ecr 60204182], length 2896: OpenFlow
	version unknown (0x04), type 0x0a, length 384, xid 0x00000000
	version unknown (0x04), type 0x0a, length 384, xid 0x00000000
	version unknown (0x04), type 0x0a, length 384, xid 0x00000000
	version unknown (0x04), type 0x0a, length 384, xid 0x00000000
	version unknown (0x04), type 0x0a, length 384, xid 0x00000000
	version unknown (0x04), type 0x0a, length 384, xid 0x00000000
	version unknown (0x04), type 0x0a, length 384, xid 0x00000000
	version unknown (0x04), type 0x0a, length 384, xid 0x00000000 [|openflow]
14:21:05.738122 IP 192.168.1.30.33603 > 192.168.1.10.6633: Flags [.], seq 20273:23169, ack 0, win 361, options [nop,nop,TS val 58843356 ecr 60204182], length 2896: OpenFlow
	version unknown (0x00), type 0x00, length 0, xid 0x00000000 (corrupt)
14:21:05.738146 IP 192.168.1.30.33603 > 192.168.1.10.6633: Flags [.], seq 23169:26065, ack 0, win 361, options [nop,nop,TS val 58843356 ecr 60204182], length 2896: OpenFlow
	version unknown (0x00), type 0x00, length 4, xid 0x00000000 (corrupt)
14:21:05.738169 IP 192.168.1.30.33603 > 192.168.1.10.6633: Flags [.], seq 26065:28961, ack 0, win 361, options [nop,nop,TS val 58843356 ecr 60204182], length 2896: OpenFlow
	version unknown (0x00), type 0x00, length 0, xid 0x00000000 (corrupt)
14:21:05.738191 IP 192.168.1.30.33603 > 192.168.1.10.6633: Flags [.], seq 28961:31857, ack 0, win 361, options [nop,nop,TS val 58843356 ecr 60204182], length 2896: OpenFlow
	version unknown (0x80), type 0x11, length 14742, xid 0x00000000 [|openflow]
14:21:05.738213 IP 192.168.1.30.33603 > 192.168.1.10.6633: Flags [.], seq 31857:34753, ack 0, win 361, options [nop,nop,TS val 58843356 ecr 60204182], length 2896: OpenFlow
	version unknown (0x00), type 0x00, length 0, xid 0x00000000 (corrupt)
14:21:05.739043 IP 192.168.1.10.6633 > 192.168.1.30.33603: Flags [.], ack 34753, win 12127, options [nop,nop,TS val 60204206 ecr 58843356], length 0
14:21:05.740491 IP 192.168.1.30.33603 > 192.168.1.10.6633: Flags [.], seq 34753:37649, ack 0, win 361, options [nop,nop,TS val 58843356 ecr 60204206], length 2896: OpenFlow
	version unknown (0x00), type 0x00, length 0, xid 0x00000000 (corrupt)
14:21:05.740518 IP 192.168.1.30.33603 > 192.168.1.10.6633: Flags [.], seq 37649:40545, ack 0, win 361, options [nop,nop,TS val 58843356 ecr 60204206], length 2896: OpenFlow
	version unknown (0x00), type 0x00, length 0, xid 0x00000000 (corrupt)
14:21:05.740539 IP 192.168.1.30.33603 > 192.168.1.10.6633: Flags [.], seq 40545:43441, ack 0, win 361, options [nop,nop,TS val 58843356 ecr 60204206], length 2896: OpenFlow
	version unknown (0x00), type 0x00, length 0, xid 0x00000000 (corrupt)
14:21:05.740558 IP 192.168.1.30.33603 > 192.168.1.10.6633: Flags [.], seq 43441:46337, ack 0, win 361, options [nop,nop,TS val 58843356 ecr 60204206], length 2896: OpenFlow
	version unknown (0x12), type 0x01, length 7170, xid 0x030f0677 [|openflow]
14:21:05.740578 IP 192.168.1.30.33603 > 192.168.1.10.6633: Flags [.], seq 46337:49233, ack 0, win 361, options [nop,nop,TS val 58843356 ecr 60204206], length 2896: OpenFlow
	version unknown (0x00), type 0x00, length 0, xid 0x00000000 (corrupt)
14:21:05.740603 IP 192.168.1.30.33603 > 192.168.1.10.6633: Flags [.], seq 49233:52129, ack 0, win 361, options [nop,nop,TS val 58843356 ecr 60204206], length 2896: OpenFlow
	version unknown (0x00), type 0x00, length 0, xid 0x00000000 (corrupt)
14:21:06.110137 IP 192.168.1.10.6633 > 192.168.1.30.33603: Flags [.], ack 52129, win 12127, options [nop,nop,TS val 60204218 ecr 58843356], length 0
14:21:06.111610 IP 192.168.1.30.33603 > 192.168.1.10.6633: Flags [.], seq 52129:55025, ack 0, win 361, options [nop,nop,TS val 58843449 ecr 60204218], length 2896: OpenFlow
	version unknown (0x00), type 0x00, length 0, xid 0x00000000 (corrupt)
14:21:06.111680 IP 192.168.1.30.33603 > 192.168.1.10.6633: Flags [.], seq 55025:57921, ack 0, win 361, options [nop,nop,TS val 58843449 ecr 60204218], length 2896: OpenFlow
	version unknown (0x2b), type 0x00, length 0, xid 0x00000373 (corrupt)
14:21:06.111746 IP 192.168.1.30.33603 > 192.168.1.10.6633: Flags [.], seq 57921:60817, ack 0, win 361, options [nop,nop,TS val 58843449 ecr 60204218], length 2896: OpenFlow
	version unknown (0x00), type 0x00, length 0, xid 0x00000000 (corrupt)
14:21:06.111795 IP 192.168.1.30.33603 > 192.168.1.10.6633: Flags [.], seq 60817:63713, ack 0, win 361, options [nop,nop,TS val 58843449 ecr 60204218], length 2896: OpenFlow
	version unknown (0x32), type 0x48, length 44045, xid 0xee9b0800 [|openflow]
14:21:06.111843 IP 192.168.1.30.33603 > 192.168.1.10.6633: Flags [.], seq 63713:66609, ack 0, win 361, options [nop,nop,TS val 58843449 ecr 60204218], length 2896: OpenFlow
	version unknown (0x00), type 0x00, length 0, xid 0x00000000 (corrupt)
14:21:06.111892 IP 192.168.1.30.33603 > 192.168.1.10.6633: Flags [.], seq 66609:69505, ack 0, win 361, options [nop,nop,TS val 58843449 ecr 60204218], length 2896: OpenFlow
	version 1.0, type invalid (0x34), length 20312, xid 0x01010600 [|openflow]
14:21:06.143327 IP 192.168.1.30.33603 > 192.168.1.10.6633: Flags [.], seq 69505:70953, ack 0, win 361, options [nop,nop,TS val 58843457 ecr 60204218], length 1448: OpenFlow
	version unknown (0x00), type 0x00, length 0, xid 0x00000000 (corrupt)
14:21:06.144626 IP 192.168.1.10.6633 > 192.168.1.30.33603: Flags [.], ack 69505, win 12127, options [nop,nop,TS val 60204308 ecr 58843449], length 0

