20:21:46.599103 IP 192.168.1.10.6633 > 192.168.1.30.33786: Flags [.], ack 510662285, win 6234, options [nop,nop,TS val 65614406 ecr 64253546], length 0
20:21:46.599113 IP 192.168.1.30.33786 > 192.168.1.10.6633: Flags [.], seq 1:2897, ack 0, win 58, options [nop,nop,TS val 64253571 ecr 65614406], length 2896: OpenFlow
	version 1.0, type HELLO, length 17, xid 0x94000100
	version unknown (0xff), type 0xff, length 65281, xid 0x4101002b [|openflow]
20:21:46.599132 IP 192.168.1.30.33786 > 192.168.1.10.6633: Flags [.], seq 2897:5793, ack 0, win 58, options [nop,nop,TS val 64253571 ecr 65614406], length 2896: OpenFlow
	version unknown (0x09), type 0xc0, length 17600, xid 0x0c001000 [|openflow]
20:21:46.599151 IP 192.168.1.30.33786 > 192.168.1.10.6633: Flags [.], seq 5793:8689, ack 0, win 58, options [nop,nop,TS val 64253571 ecr 65614406], length 2896: OpenFlow
	version unknown (0x78), type 0x00, length 2048, xid 0x00000000
	version 1.0, type invalid (0x39), length 309, xid 0x01300161
	version unknown (0x6e), type 0x04, length 24436, xid 0x6370056c [|openflow]
20:21:46.599169 IP 192.168.1.30.33786 > 192.168.1.10.6633: Flags [.], seq 8689:11585, ack 0, win 58, options [nop,nop,TS val 64253571 ecr 65614406], length 2896: OpenFlow
	version unknown (0x0c), type 0x00, length 8448, xid 0x01000000 [|openflow]
20:21:46.599407 IP 192.168.1.30.33786 > 192.168.1.10.6633: Flags [.], seq 11585:14481, ack 0, win 58, options [nop,nop,TS val 64253571 ecr 65614406], length 2896: OpenFlow
	version unknown (0x34), type 0x05, length 19529, xid 0x4e5558c0 [|openflow]
20:21:46.599451 IP 192.168.1.30.33786 > 192.168.1.10.6633: Flags [.], seq 14481:17377, ack 0, win 58, options [nop,nop,TS val 64253571 ecr 65614406], length 2896: OpenFlow
	version unknown (0x00), type 0x0d, length 1624, xid 0x38365f36
	version unknown (0x5b), type 0x61, length 12858, xid 0x35393a30 [|openflow]
20:21:46.599470 IP 192.168.1.30.33786 > 192.168.1.10.6633: Flags [.], seq 17377:20273, ack 0, win 58, options [nop,nop,TS val 64253571 ecr 65614406], length 2896: OpenFlow
	version unknown (0x00), type 0x0d, length 1, xid 0x00000078 (corrupt)
20:21:46.599488 IP 192.168.1.30.33786 > 192.168.1.10.6633: Flags [.], seq 20273:23169, ack 0, win 58, options [nop,nop,TS val 64253571 ecr 65614406], length 2896: OpenFlow
	version unknown (0x00), type 0x78, length 2, xid 0xc044c044 (corrupt)
20:21:46.605682 IP 192.168.1.30.33786 > 192.168.1.10.6633: Flags [.], seq 23169:24617, ack 0, win 58, options [nop,nop,TS val 64253573 ecr 65614406], length 1448: OpenFlow
	version unknown (0xc0), type 0x51, length 12, xid 0x00010000
	version unknown (0xc0), type 0x44, length 49220, xid 0x000d0001 [|openflow]
20:21:46.661754 IP 192.168.1.30.33786 > 192.168.1.10.6633: Flags [.], seq 24617:26065, ack 0, win 58, options [nop,nop,TS val 64253587 ecr 65614406], length 1448: OpenFlow
	version unknown (0xfe), type 0x08, length 14347, xid 0xc051000c [|openflow]
20:21:46.734975 IP 192.168.1.10.6633 > 192.168.1.30.33786: Flags [.], ack 24617, win 6106, options [nop,nop,TS val 65614446 ecr 64253571], length 0
20:21:46.735801 IP 192.168.1.30.33786 > 192.168.1.10.6633: Flags [.], seq 26065:28961, ack 0, win 58, options [nop,nop,TS val 64253604 ecr 65614446], length 2896: OpenFlow
	version unknown (0xa0), type 0x59, length 2815, xid 0xfe08380b
	version unknown (0x38), type 0x01, length 12289, xid 0x65016601 [|openflow]
20:21:46.735826 IP 192.168.1.30.33786 > 192.168.1.10.6633: Flags [.], seq 28961:31857, ack 0, win 58, options [nop,nop,TS val 64253604 ecr 65614446], length 2896: OpenFlow
	version unknown (0xfe), type 0x80, length 0, xid 0x00000000 (corrupt)
20:21:46.735834 IP 192.168.1.30.33786 > 192.168.1.10.6633: Flags [.], seq 31857:34753, ack 0, win 58, options [nop,nop,TS val 64253604 ecr 65614446], length 2896: OpenFlow
	version unknown (0x00), type 0x01, length 0, xid 0x00780010 (corrupt)
20:21:46.735857 IP 192.168.1.30.33786 > 192.168.1.10.6633: Flags [.], seq 34753:37649, ack 0, win 58, options [nop,nop,TS val 64253604 ecr 65614446], length 2896: OpenFlow
	version unknown (0x00), type 0xff, length 1, xid 0xc044001c (corrupt)
20:21:46.735865 IP 192.168.1.30.33786 > 192.168.1.10.6633: Flags [.], seq 37649:40545, ack 0, win 58, options [nop,nop,TS val 64253604 ecr 65614446], length 2896: OpenFlow
	version unknown (0x70), type 0x36, length 1121, xid 0x72706100
	version unknown (0xa0), type 0x59, length 2815, xid 0xfe08380b [|openflow]
20:21:46.735892 IP 192.168.1.30.33786 > 192.168.1.10.6633: Flags [.], seq 40545:43441, ack 0, win 58, options [nop,nop,TS val 64253604 ecr 65614446], length 2896: OpenFlow
	version 1.0, type invalid (0x38), length 357, xid 0x01660369
	version 1.0, type invalid (0x30), length 304, xid 0x01300138
	version unknown (0x75), type 0xc0, length 14592, xid 0xff000101 [|openflow]
20:21:46.735901 IP 192.168.1.30.33786 > 192.168.1.10.6633: Flags [.], seq 43441:46337, ack 0, win 58, options [nop,nop,TS val 64253604 ecr 65614446], length 2896: OpenFlow
	version 1.0, type invalid (0x30), length 304, xid 0x01300130
	version unknown (0x6e), type 0x74, length 30144, xid 0x3900ff00 [|openflow]
20:21:46.735924 IP 192.168.1.30.33786 > 192.168.1.10.6633: Flags [.], seq 46337:49233, ack 0, win 58, options [nop,nop,TS val 64253604 ecr 65614446], length 2896: OpenFlow
	version 1.0, type invalid (0x30), length 304, xid 0x01300130
	version unknown (0x00), type 0xff, length 1, xid 0x06756275 (corrupt)
20:21:46.736446 IP 192.168.1.10.6633 > 192.168.1.30.33786: Flags [.], ack 26065, win 8040, options [nop,nop,TS val 65614456 ecr 64253587], length 0
20:21:46.736457 IP 192.168.1.10.6633 > 192.168.1.30.33786: Flags [.], ack 28961, win 8040, options [nop,nop,TS val 65614456 ecr 64253604], length 0
20:21:46.736460 IP 192.168.1.10.6633 > 192.168.1.30.33786: Flags [.], ack 34753, win 8040, options [nop,nop,TS val 65614456 ecr 64253604], length 0
20:21:46.736464 IP 192.168.1.10.6633 > 192.168.1.30.33786: Flags [.], ack 40545, win 8040, options [nop,nop,TS val 65614456 ecr 64253604], length 0
20:21:46.736471 IP 192.168.1.10.6633 > 192.168.1.30.33786: Flags [.], ack 49233, win 8040, options [nop,nop,TS val 65614456 ecr 64253604], length 0
20:21:46.738306 IP 192.168.1.30.33786 > 192.168.1.10.6633: Flags [.], seq 49233:52129, ack 0, win 58, options [nop,nop,TS val 64253604 ecr 65614456], length 2896: OpenFlow
	version 1.0, type invalid (0x30), length 304, xid 0x01300130
	version unknown (0x70), type 0x05, length 27759, xid 0x63616c00 [|openflow]
20:21:46.738330 IP 192.168.1.30.33786 > 192.168.1.10.6633: Flags [.], seq 52129:55025, ack 0, win 58, options [nop,nop,TS val 64253604 ecr 65614456], length 2896: OpenFlow
	version 1.0, type invalid (0x35), length 304, xid 0x01610130
	version unknown (0x74), type 0x69, length 28526, xid 0x045f7463 [|openflow]
20:21:46.738339 IP 192.168.1.30.33786 > 192.168.1.10.6633: Flags [.], seq 55025:57921, ack 0, win 58, options [nop,nop,TS val 64253604 ecr 65614456], length 2896: OpenFlow
	version 1.0, type invalid (0x66), length 353, xid 0x01300139
	version 1.0, type invalid (0x38), length 304, xid 0x01650166
	version unknown (0x30), type 0x38, length 14899, xid 0x383a3062 [|openflow]
20:21:46.738363 IP 192.168.1.30.33786 > 192.168.1.10.6633: Flags [.], seq 57921:60817, ack 0, win 58, options [nop,nop,TS val 64253604 ecr 65614456], length 2896: OpenFlow
	version 1.0, type invalid (0x30), length 357, xid 0x01660166
	version 1.0, type invalid (0x38), length 307, xid 0x01380130
	version unknown (0x3a), type 0x30, length 14394, xid 0x33383a30 [|openflow]
20:21:46.738372 IP 192.168.1.30.33786 > 192.168.1.10.6633: Flags [.], seq 60817:63713, ack 0, win 58, options [nop,nop,TS val 64253604 ecr 65614456], length 2896: OpenFlow
	version 1.0, type invalid (0x30), length 312, xid 0x01330138
	version unknown (0x3a), type 0x33, length 14394, xid 0x30625d0c [|openflow]
20:21:46.738426 IP 192.168.1.30.33786 > 192.168.1.10.6633: Flags [.], seq 63713:66609, ack 0, win 58, options [nop,nop,TS val 64253604 ecr 65614456], length 2896: OpenFlow
	version unknown (0xc0), type 0x39, length 255, xid 0x00010162
	version unknown (0x00), type 0xa0, length 22794, xid 0xfffe0838 [|openflow]
20:21:46.738450 IP 192.168.1.30.33786 > 192.168.1.10.6633: Flags [.], seq 66609:69505, ack 0, win 58, options [nop,nop,TS val 64253604 ecr 65614456], length 2896: OpenFlow
	version 1.0, type FEATURES_REPLY, length 30050, xid 0x756e7475 [|openflow]
20:21:46.738459 IP 192.168.1.30.33786 > 192.168.1.10.6633: Flags [.], seq 69505:72401, ack 0, win 58, options [nop,nop,TS val 64253604 ecr 65614456], length 2896: OpenFlow
	version unknown (0x6f), type 0x63, length 24940, xid 0x0000ff00 [|openflow]
20:21:46.739205 IP 192.168.1.10.6633 > 192.168.1.30.33786: Flags [.], ack 63713, win 8040, options [nop,nop,TS val 65614456 ecr 64253604], length 0
20:21:46.739212 IP 192.168.1.30.33786 > 192.168.1.10.6633: Flags [.], seq 72401:75297, ack 0, win 58, options [nop,nop,TS val 64253604 ecr 65614456], length 2896: OpenFlow
	version unknown (0x6e), type 0x04, length 24436, xid 0x6370056c [|openflow]
20:21:46.739221 IP 192.168.1.30.33786 > 192.168.1.10.6633: Flags [.], seq 75297:78193, ack 0, win 58, options [nop,nop,TS val 64253604 ecr 65614456], length 2896: OpenFlow
	version unknown (0x72), type 0x6b, length 29556, xid 0x6174696f [|openflow]
20:21:46.739248 IP 192.168.1.30.33786 > 192.168.1.10.6633: Flags [.], seq 78193:81089, ack 0, win 58, options [nop,nop,TS val 64253604 ecr 65614456], length 2896: OpenFlow
	version unknown (0x3a), type 0x30, length 25181, xid 0x0c5f776f [|openflow]
20:21:46.739258 IP 192.168.1.30.33786 > 192.168.1.10.6633: Flags [.], seq 81089:83985, ack 0, win 58, options [nop,nop,TS val 64253604 ecr 65614456], length 2896: OpenFlow
	version unknown (0x30), type 0x61, length 14896, xid 0x383a3338 [|openflow]
20:21:46.739282 IP 192.168.1.30.33786 > 192.168.1.10.6633: Flags [.], seq 83985:86881, ack 0, win 58, options [nop,nop,TS val 64253604 ecr 65614456], length 2896: OpenFlow
	version unknown (0x20), type 0x5b, length 24882, xid 0x3a35393a [|openflow]
20:21:46.739348 IP 192.168.1.10.6633 > 192.168.1.30.33786: Flags [.], ack 72401, win 8040, options [nop,nop,TS val 65614456 ecr 64253604], length 0
20:21:46.739352 IP 192.168.1.30.33786 > 192.168.1.10.6633: Flags [.], seq 86881:89777, ack 0, win 58, options [nop,nop,TS val 64253604 ecr 65614456], length 2896: OpenFlow
	version unknown (0x00), type 0x1a, length 30050, xid 0x756e7475 [|openflow]
20:21:46.739377 IP 192.168.1.30.33786 > 192.168.1.10.6633: Flags [.], seq 89777:92673, ack 0, win 58, options [nop,nop,TS val 64253604 ecr 65614456], length 2896: OpenFlow
	version unknown (0x00), type 0x00, length 768, xid 0x00000500
	version unknown (0x73), type 0x74, length 24948, xid 0x696f6e04 [|openflow]
20:21:46.739387 IP 192.168.1.30.33786 > 192.168.1.10.6633: Flags [.], seq 92673:95569, ack 0, win 58, options [nop,nop,TS val 64253604 ecr 65614456], length 2896: OpenFlow
	version unknown (0xe9), type 0x01, length 3022, xid 0x24000000 [|openflow]
20:21:46.739739 IP 192.168.1.10.6633 > 192.168.1.30.33786: Flags [.], ack 78193, win 8040, options [nop,nop,TS val 65614457 ecr 64253604], length 0
20:21:46.739762 IP 192.168.1.10.6633 > 192.168.1.30.33786: Flags [.], ack 86881, win 8040, options [nop,nop,TS val 65614457 ecr 64253604], length 0
20:21:46.741322 IP 192.168.1.10.6633 > 192.168.1.30.33786: Flags [.], ack 95569, win 8040, options [nop,nop,TS val 65614457 ecr 64253604], length 0
20:21:46.741892 IP 192.168.1.30.33786 > 192.168.1.10.6633: Flags [.], seq 95569:98465, ack 0, win 58, options [nop,nop,TS val 64253606 ecr 65614457], length 2896: OpenFlow
	version unknown (0x00), type 0x00, length 0, xid 0xfb14e914 (corrupt)
20:21:46.741916 IP 192.168.1.30.33786 > 192.168.1.10.6633: Flags [.], seq 98465:101361, ack 0, win 58, options [nop,nop,TS val 64253606 ecr 65614457], length 2896: OpenFlow
	version unknown (0x00), type 0x00, length 0, xid 0x00000000 (corrupt)
20:21:46.741940 IP 192.168.1.30.33786 > 192.168.1.10.6633: Flags [.], seq 101361:104257, ack 0, win 58, options [nop,nop,TS val 64253606 ecr 65614457], length 2896: OpenFlow
	version unknown (0xff), type 0xfe, length 2104, xid 0x0bff0200
	version unknown (0x0a), type 0x01, length 27392, xid 0x000000ff [|openflow]
20:21:46.741964 IP 192.168.1.30.33786 > 192.168.1.10.6633: Flags [.], seq 104257:107153, ack 0, win 58, options [nop,nop,TS val 64253606 ecr 65614457], length 2896: OpenFlow
	version unknown (0x00), type 0x00, length 0, xid 0x00a0590a (corrupt)
20:21:46.741972 IP 192.168.1.30.33786 > 192.168.1.10.6633: Flags [.], seq 107153:110049, ack 0, win 58, options [nop,nop,TS val 64253606 ecr 65614457], length 2896: OpenFlow
	version unknown (0x00), type 0x01, length 2833, xid 0xfffe8000
	version unknown (0x0c), type 0x00, length 4096, xid 0x01000011 [|openflow]
20:21:46.742042 IP 192.168.1.30.33786 > 192.168.1.10.6633: Flags [.], seq 110049:112945, ack 0, win 58, options [nop,nop,TS val 64253607 ecr 65614457], length 2896: OpenFlow
	version unknown (0x08), type 0x38, length 2950, xid 0xdd600000 [|openflow]
20:21:46.742051 IP 192.168.1.30.33786 > 192.168.1.10.6633: Flags [.], seq 112945:115841, ack 0, win 58, options [nop,nop,TS val 64253607 ecr 65614457], length 2896: OpenFlow
	version unknown (0x33), type 0x00, length 0, xid 0xfba2590a (corrupt)
20:21:46.742078 IP 192.168.1.30.33786 > 192.168.1.10.6633: Flags [.], seq 115841:118737, ack 0, win 58, options [nop,nop,TS val 64253607 ecr 65614457], length 2896: OpenFlow
	version unknown (0x02), type 0x00, length 0, xid 0x00000033 (corrupt)
20:21:46.753770 IP 192.168.1.30.33786 > 192.168.1.10.6633: Flags [.], seq 118737:120185, ack 0, win 58, options [nop,nop,TS val 64253610 ecr 65614457], length 1448: OpenFlow
	version unknown (0x0c), type 0x80, length 0, xid 0x04000000 (corrupt)
20:21:46.758261 IP 192.168.1.10.6633 > 192.168.1.30.33786: Flags [.], ack 110049, win 8040, options [nop,nop,TS val 65614461 ecr 64253606], length 0
20:21:46.758276 IP 192.168.1.10.6633 > 192.168.1.30.33786: Flags [.], ack 112945, win 8040, options [nop,nop,TS val 65614461 ecr 64253607], length 0
20:21:46.758573 IP 192.168.1.30.33786 > 192.168.1.10.6633: Flags [.], seq 120185:121633, ack 0, win 58, options [nop,nop,TS val 64253611 ecr 65614461], length 1448: OpenFlow
	version unknown (0xe4), type 0x00, length 256, xid 0x0c800000
	version unknown (0x00), type 0x00, length 0, xid 0xa0590aff (corrupt)
20:21:46.758582 IP 192.168.1.30.33786 > 192.168.1.10.6633: Flags [.], seq 121633:124529, ack 0, win 58, options [nop,nop,TS val 64253611 ecr 65614461], length 2896: OpenFlow
	version unknown (0x00), type 0x00, length 3, xid 0xe4000100 (corrupt)
20:21:46.758604 IP 192.168.1.30.33786 > 192.168.1.10.6633: Flags [.], seq 124529:127425, ack 0, win 58, options [nop,nop,TS val 64253611 ecr 65614461], length 2896: OpenFlow
	version unknown (0xff), type 0x01, length 16641, xid 0x002b0000 [|openflow]
20:21:46.758612 IP 192.168.1.30.33786 > 192.168.1.10.6633: Flags [.], seq 127425:130321, ack 0, win 58, options [nop,nop,TS val 64253611 ecr 65614461], length 2896: OpenFlow
	version unknown (0x6b), type 0x00, length 0, xid 0x00ffffff (corrupt)
20:21:46.758636 IP 192.168.1.30.33786 > 192.168.1.10.6633: Flags [.], seq 130321:133217, ack 0, win 58, options [nop,nop,TS val 64253611 ecr 65614461], length 2896: OpenFlow
	version unknown (0x11), type 0x94, length 1, xid 0x00040a01 (corrupt)
20:21:46.758666 IP 192.168.1.30.33786 > 192.168.1.10.6633: Flags [.], seq 133217:136113, ack 0, win 58, options [nop,nop,TS val 64253611 ecr 65614461], length 2896: OpenFlow
	version unknown (0xc0), type 0x0c, length 16, xid 0x00010000
	version unknown (0x6b), type 0x00, length 0, xid 0x00ffffff (corrupt)
20:21:46.758677 IP 192.168.1.10.6633 > 192.168.1.30.33786: Flags [.], ack 118737, win 8040, options [nop,nop,TS val 65614461 ecr 64253607], length 0
20:21:46.758684 IP 192.168.1.30.33786 > 192.168.1.10.6633: Flags [.], seq 136113:139009, ack 0, win 58, options [nop,nop,TS val 64253611 ecr 65614461], length 2896: OpenFlow
	version unknown (0x00), type 0x00, length 0, xid 0x0009c044 (corrupt)
20:21:46.758708 IP 192.168.1.30.33786 > 192.168.1.10.6633: Flags [.], seq 139009:141905, ack 0, win 58, options [nop,nop,TS val 64253611 ecr 65614461], length 2896: OpenFlow
	version unknown (0x00), type 0x01, length 0, xid 0x00780008 (corrupt)
20:21:46.765381 IP 192.168.1.10.6633 > 192.168.1.30.33786: Flags [.], ack 141905, win 8379, options [nop,nop,TS val 65614463 ecr 64253610], length 0
20:21:46.768205 IP 192.168.1.30.33786 > 192.168.1.10.6633: Flags [.], seq 141905:144801, ack 0, win 58, options [nop,nop,TS val 64253613 ecr 65614463], length 2896: OpenFlow
	version unknown (0x49), type 0x4e, length 21848, xid 0xc00c0021 [|openflow]
20:21:46.768222 IP 192.168.1.30.33786 > 192.168.1.10.6633: Flags [.], seq 144801:147697, ack 0, win 58, options [nop,nop,TS val 64253613 ecr 65614463], length 2896: OpenFlow
	version unknown (0x58), type 0x38, length 13919, xid 0x3634054c [|openflow]
20:21:46.768301 IP 192.168.1.30.33786 > 192.168.1.10.6633: Flags [.], seq 147697:150593, ack 0, win 58, options [nop,nop,TS val 64253613 ecr 65614463], length 2896: OpenFlow
	version unknown (0x01), type 0x00, length 0, xid 0x78000d06 (corrupt)
20:21:46.768311 IP 192.168.1.30.33786 > 192.168.1.10.6633: Flags [.], seq 150593:153489, ack 0, win 58, options [nop,nop,TS val 64253613 ecr 65614463], length 2896: OpenFlow
	version unknown (0x02), type 0xc0, length 17600, xid 0x44000d00 [|openflow]
20:21:46.768377 IP 192.168.1.30.33786 > 192.168.1.10.6633: Flags [.], seq 153489:156385, ack 0, win 58, options [nop,nop,TS val 64253613 ecr 65614463], length 2896: OpenFlow
	version unknown (0x0c), type 0x00, length 256, xid 0x00007800
	version 1.0, type invalid (0x30), length 312, xid 0x01330138
	version unknown (0x3a), type 0x33, length 14394, xid 0x30625d0c [|openflow]
20:21:46.768386 IP 192.168.1.30.33786 > 192.168.1.10.6633: Flags [.], seq 156385:159281, ack 0, win 58, options [nop,nop,TS val 64253613 ecr 65614463], length 2896: OpenFlow
	version unknown (0xff), type 0xfe, length 2104, xid 0x0bc05100
	version unknown (0x35), type 0x01, length 12289, xid 0x61013001 [|openflow]
20:21:46.768395 IP 192.168.1.10.6633 > 192.168.1.30.33786: Flags [.], ack 144801, win 8424, options [nop,nop,TS val 65614464 ecr 64253613], length 0
20:21:46.768404 IP 192.168.1.10.6633 > 192.168.1.30.33786: Flags [.], ack 147697, win 8470, options [nop,nop,TS val 65614464 ecr 64253613], length 0
20:21:46.768470 IP 192.168.1.30.33786 > 192.168.1.10.6633: Flags [.], seq 159281:162177, ack 0, win 58, options [nop,nop,TS val 64253613 ecr 65614463], length 2896: OpenFlow
	version unknown (0x00), type 0x00, length 0, xid 0x00a0590a (corrupt)
20:21:46.768480 IP 192.168.1.30.33786 > 192.168.1.10.6633: Flags [.], seq 162177:165073, ack 0, win 58, options [nop,nop,TS val 64253613 ecr 65614463], length 2896: OpenFlow
	version unknown (0x00), type 0x00, length 30720, xid 0x10fe8000 [|openflow]
20:21:46.768560 IP 192.168.1.30.33786 > 192.168.1.10.6633: Flags [.], seq 165073:167969, ack 0, win 58, options [nop,nop,TS val 64253613 ecr 65614463], length 2896: OpenFlow
	version 1.0, type invalid (0xc0), length 17408, xid 0x1c000100 [|openflow]
20:21:46.768657 IP 192.168.1.10.6633 > 192.168.1.30.33786: Flags [.], ack 152041, win 8537, options [nop,nop,TS val 65614464 ecr 64253613], length 0
20:21:46.768667 IP 192.168.1.10.6633 > 192.168.1.30.33786: Flags [.], ack 153489, win 8560, options [nop,nop,TS val 65614464 ecr 64253613], length 0
20:21:46.768671 IP 192.168.1.10.6633 > 192.168.1.30.33786: Flags [.], ack 156385, win 8605, options [nop,nop,TS val 65614464 ecr 64253613], length 0
20:21:46.768675 IP 192.168.1.10.6633 > 192.168.1.30.33786: Flags [.], ack 157833, win 8628, options [nop,nop,TS val 65614464 ecr 64253613], length 0
20:21:46.768677 IP 192.168.1.10.6633 > 192.168.1.30.33786: Flags [.], ack 159281, win 8651, options [nop,nop,TS val 65614464 ecr 64253613], length 0
20:21:46.768680 IP 192.168.1.10.6633 > 192.168.1.30.33786: Flags [.], ack 162177, win 8696, options [nop,nop,TS val 65614464 ecr 64253613], length 0
20:21:46.768684 IP 192.168.1.10.6633 > 192.168.1.30.33786: Flags [.], ack 165073, win 8741, options [nop,nop,TS val 65614464 ecr 64253613], length 0
20:21:46.768688 IP 192.168.1.10.6633 > 192.168.1.30.33786: Flags [.], ack 167969, win 8786, options [nop,nop,TS val 65614464 ecr 64253613], length 0
20:21:46.770784 IP 192.168.1.30.33786 > 192.168.1.10.6633: Flags [.], seq 167969:170865, ack 0, win 58, options [nop,nop,TS val 64253613 ecr 65614464], length 2896: OpenFlow
	version unknown (0x61), type 0x72, length 28769, xid 0x0000ff00 [|openflow]
20:21:46.770795 IP 192.168.1.30.33786 > 192.168.1.10.6633: Flags [.], seq 170865:173761, ack 0, win 58, options [nop,nop,TS val 64253613 ecr 65614464], length 2896: OpenFlow
	version unknown (0x65), type 0x01, length 26115, xid 0x69703604 [|openflow]
20:21:46.770872 IP 192.168.1.30.33786 > 192.168.1.10.6633: Flags [.], seq 173761:176657, ack 0, win 58, options [nop,nop,TS val 64253613 ecr 65614464], length 2896: OpenFlow
	version unknown (0x30), type 0x01, length 12289, xid 0x30013801 [|openflow]
20:21:46.770881 IP 192.168.1.30.33786 > 192.168.1.10.6633: Flags [.], seq 176657:179553, ack 0, win 58, options [nop,nop,TS val 64253613 ecr 65614464], length 2896: OpenFlow
	version 1.0, type invalid (0x39), length 309, xid 0x01300161
	version unknown (0x6e), type 0x04, length 24436, xid 0x6370056c [|openflow]
20:21:46.770896 IP 192.168.1.10.6633 > 192.168.1.30.33786: Flags [.], ack 170865, win 8832, options [nop,nop,TS val 65614464 ecr 64253613], length 0
20:21:46.770962 IP 192.168.1.30.33786 > 192.168.1.10.6633: Flags [P.], seq 179553:182449, ack 0, win 58, options [nop,nop,TS val 64253613 ecr 65614464], length 2896: OpenFlow
	version 1.0, type invalid (0x66), length 358, xid 0x01610130
	version unknown (0x30), type 0x01, length 25857, xid 0x66016601 [|openflow]
20:21:46.770971 IP 192.168.1.30.33786 > 192.168.1.10.6633: Flags [.], seq 182449:185345, ack 0, win 58, options [nop,nop,TS val 64253613 ecr 65614464], length 2896: OpenFlow
	version 1.0, type invalid (0x38), length 304, xid 0x01650166
	version unknown (0x30), type 0x38, length 14899, xid 0x383a3062 [|openflow]
20:21:46.771059 IP 192.168.1.30.33786 > 192.168.1.10.6633: Flags [.], seq 185345:188241, ack 0, win 58, options [nop,nop,TS val 64253613 ecr 65614464], length 2896: OpenFlow
	version 1.0, type invalid (0x62), length 304, xid 0x01380133
	version unknown (0x32), type 0x3a, length 13625, xid 0x3a30613a [|openflow]
20:21:46.771068 IP 192.168.1.30.33786 > 192.168.1.10.6633: Flags [.], seq 188241:191137, ack 0, win 58, options [nop,nop,TS val 64253613 ecr 65614464], length 2896: OpenFlow
	version unknown (0x74), type 0x75, length 49209, xid 0x00ff0001 [|openflow]
20:21:46.771076 IP 192.168.1.10.6633 > 192.168.1.30.33786: Flags [.], ack 173761, win 8877, options [nop,nop,TS val 65614464 ecr 64253613], length 0
20:21:46.771082 IP 192.168.1.10.6633 > 192.168.1.30.33786: Flags [.], ack 176657, win 8922, options [nop,nop,TS val 65614464 ecr 64253613], length 0
20:21:46.771085 IP 192.168.1.10.6633 > 192.168.1.30.33786: Flags [.], ack 178105, win 8945, options [nop,nop,TS val 65614464 ecr 64253613], length 0
20:21:46.771088 IP 192.168.1.10.6633 > 192.168.1.30.33786: Flags [.], ack 179553, win 8967, options [nop,nop,TS val 65614464 ecr 64253613], length 0
20:21:46.771091 IP 192.168.1.10.6633 > 192.168.1.30.33786: Flags [.], ack 182449, win 9013, options [nop,nop,TS val 65614464 ecr 64253613], length 0
20:21:46.771094 IP 192.168.1.10.6633 > 192.168.1.30.33786: Flags [.], ack 183897, win 9035, options [nop,nop,TS val 65614464 ecr 64253613], length 0
20:21:46.771150 IP 192.168.1.30.33786 > 192.168.1.10.6633: Flags [.], seq 191137:194033, ack 0, win 58, options [nop,nop,TS val 64253613 ecr 65614464], length 2896: OpenFlow
	version unknown (0xff), type 0x00, length 262, xid 0x7562756e
	version unknown (0x00), type 0x00, length 0, xid 0xa0590aff (corrupt)
20:21:46.771249 IP 192.168.1.10.6633 > 192.168.1.30.33786: Flags [.], ack 185345, win 9058, options [nop,nop,TS val 65614464 ecr 64253613], length 0
20:21:46.771256 IP 192.168.1.10.6633 > 192.168.1.30.33786: Flags [.], ack 188241, win 9103, options [nop,nop,TS val 65614464 ecr 64253613], length 0
20:21:46.771259 IP 192.168.1.10.6633 > 192.168.1.30.33786: Flags [.], ack 189689, win 9126, options [nop,nop,TS val 65614464 ecr 64253613], length 0
20:21:46.771262 IP 192.168.1.10.6633 > 192.168.1.30.33786: Flags [.], ack 191137, win 9148, options [nop,nop,TS val 65614464 ecr 64253613], length 0
20:21:46.771264 IP 192.168.1.10.6633 > 192.168.1.30.33786: Flags [.], ack 194033, win 9194, options [nop,nop,TS val 65614464 ecr 64253613], length 0
20:21:46.774272 IP 192.168.1.30.33786 > 192.168.1.10.6633: Flags [.], seq 194033:196929, ack 0, win 58, options [nop,nop,TS val 64253614 ecr 65614464], length 2896: OpenFlow
	version unknown (0x05), type 0x6c, length 28515, xid 0x616c0000 [|openflow]
20:21:46.774416 IP 192.168.1.30.33786 > 192.168.1.10.6633: Flags [.], seq 196929:199825, ack 0, win 58, options [nop,nop,TS val 64253614 ecr 65614464], length 2896: OpenFlow
	version unknown (0x69), type 0x6f, length 28164, xid 0x5f746370 [|openflow]
20:21:46.774427 IP 192.168.1.30.33786 > 192.168.1.10.6633: Flags [.], seq 199825:202721, ack 0, win 58, options [nop,nop,TS val 64253614 ecr 65614464], length 2896: OpenFlow
	version unknown (0x77), type 0x6f, length 29291, xid 0x73746174 [|openflow]
20:21:46.774504 IP 192.168.1.30.33786 > 192.168.1.10.6633: Flags [.], seq 202721:205617, ack 0, win 58, options [nop,nop,TS val 64253614 ecr 65614464], length 2896: OpenFlow
	version unknown (0x1a), type 0x75, length 25205, xid 0x6e747520 [|openflow]
20:21:46.774541 IP 192.168.1.30.33786 > 192.168.1.10.6633: Flags [.], seq 205617:208513, ack 0, win 58, options [nop,nop,TS val 64253614 ecr 65614464], length 2896: OpenFlow
	version unknown (0x00), type 0x03, length 0, xid 0x00050000 (corrupt)
20:21:46.774573 IP 192.168.1.10.6633 > 192.168.1.30.33786: Flags [.], ack 195481, win 9216, options [nop,nop,TS val 65614465 ecr 64253614], length 0
20:21:46.774577 IP 192.168.1.10.6633 > 192.168.1.30.33786: Flags [.], ack 196929, win 9239, options [nop,nop,TS val 65614465 ecr 64253614], length 0
20:21:46.774580 IP 192.168.1.10.6633 > 192.168.1.30.33786: Flags [.], ack 198377, win 9261, options [nop,nop,TS val 65614465 ecr 64253614], length 0
20:21:46.774582 IP 192.168.1.10.6633 > 192.168.1.30.33786: Flags [.], ack 201273, win 9307, options [nop,nop,TS val 65614465 ecr 64253614], length 0
20:21:46.774585 IP 192.168.1.10.6633 > 192.168.1.30.33786: Flags [.], ack 202721, win 9329, options [nop,nop,TS val 65614465 ecr 64253614], length 0
20:21:46.774630 IP 192.168.1.30.33786 > 192.168.1.10.6633: Flags [.], seq 208513:211409, ack 0, win 58, options [nop,nop,TS val 64253614 ecr 65614464], length 2896: OpenFlow
	version 1.0, type FLOW_REMOVED, length 52772, xid 0x00000000 (corrupt) [|openflow]
20:21:46.774640 IP 192.168.1.30.33786 > 192.168.1.10.6633: Flags [.], seq 211409:214305, ack 0, win 58, options [nop,nop,TS val 64253614 ecr 65614464], length 2896: OpenFlow
	version unknown (0x00), type 0x00, length 251, xid 0x14e914e9
	version unknown (0x00), type 0x00, length 0, xid 0x09c044c0 (corrupt)
20:21:46.774668 IP 192.168.1.10.6633 > 192.168.1.30.33786: Flags [.], ack 204169, win 9352, options [nop,nop,TS val 65614465 ecr 64253614], length 0
20:21:46.774674 IP 192.168.1.10.6633 > 192.168.1.30.33786: Flags [.], ack 207065, win 9397, options [nop,nop,TS val 65614465 ecr 64253614], length 0
20:21:46.774675 IP 192.168.1.30.33786 > 192.168.1.10.6633: Flags [.], seq 214305:217201, ack 0, win 58, options [nop,nop,TS val 64253614 ecr 65614464], length 2896: OpenFlow
	version unknown (0x00), type 0x00, length 0, xid 0x00000000 (corrupt)
20:21:46.774677 IP 192.168.1.10.6633 > 192.168.1.30.33786: Flags [.], ack 208513, win 9420, options [nop,nop,TS val 65614465 ecr 64253614], length 0
20:21:46.774740 IP 192.168.1.30.33786 > 192.168.1.10.6633: Flags [.], seq 217201:220097, ack 0, win 58, options [nop,nop,TS val 64253614 ecr 65614464], length 2896: OpenFlow
	version unknown (0xfe), type 0xc7, length 9274, xid 0xff020000 [|openflow]
20:21:46.774840 IP 192.168.1.10.6633 > 192.168.1.30.33786: Flags [.], ack 211409, win 9465, options [nop,nop,TS val 65614465 ecr 64253614], length 0
20:21:46.774849 IP 192.168.1.10.6633 > 192.168.1.30.33786: Flags [.], ack 212857, win 9488, options [nop,nop,TS val 65614465 ecr 64253614], length 0
20:21:46.774852 IP 192.168.1.10.6633 > 192.168.1.30.33786: Flags [.], ack 215753, win 9533, options [nop,nop,TS val 65614465 ecr 64253614], length 0
20:21:46.774856 IP 192.168.1.10.6633 > 192.168.1.30.33786: Flags [.], ack 217201, win 9556, options [nop,nop,TS val 65614465 ecr 64253614], length 0
20:21:46.774859 IP 192.168.1.10.6633 > 192.168.1.30.33786: Flags [.], ack 218649, win 9578, options [nop,nop,TS val 65614465 ecr 64253614], length 0
20:21:46.774862 IP 192.168.1.10.6633 > 192.168.1.30.33786: Flags [.], ack 220097, win 9601, options [nop,nop,TS val 65614465 ecr 64253614], length 0
20:21:46.776394 IP 192.168.1.30.33786 > 192.168.1.10.6633: Flags [.], seq 220097:222993, ack 0, win 58, options [nop,nop,TS val 64253615 ecr 65614465], length 2896: OpenFlow
	version unknown (0x3a), type 0x30, length 14394, xid 0x33383a30 [|openflow]
20:21:46.776408 IP 192.168.1.30.33786 > 192.168.1.10.6633: Flags [.], seq 222993:225889, ack 0, win 58, options [nop,nop,TS val 64253615 ecr 65614465], length 2896: OpenFlow
	version unknown (0x61), type 0x32, length 14901, xid 0x393a3061 [|openflow]
20:21:46.776557 IP 192.168.1.30.33786 > 192.168.1.10.6633: Flags [.], seq 225889:228785, ack 0, win 58, options [nop,nop,TS val 64253615 ecr 65614465], length 2896: OpenFlow
	version unknown (0x0c), type 0x00, length 8448, xid 0x01000000 [|openflow]
20:21:46.776583 IP 192.168.1.10.6633 > 192.168.1.30.33786: Flags [.], ack 221545, win 9623, options [nop,nop,TS val 65614466 ecr 64253615], length 0
20:21:46.776589 IP 192.168.1.10.6633 > 192.168.1.30.33786: Flags [.], ack 224441, win 9669, options [nop,nop,TS val 65614466 ecr 64253615], length 0
20:21:46.776593 IP 192.168.1.10.6633 > 192.168.1.30.33786: Flags [.], ack 225889, win 9691, options [nop,nop,TS val 65614466 ecr 64253615], length 0
20:21:46.776617 IP 192.168.1.30.33786 > 192.168.1.10.6633: Flags [.], seq 228785:231681, ack 0, win 58, options [nop,nop,TS val 64253615 ecr 65614465], length 2896: OpenFlow
	version unknown (0x34), type 0x05, length 19529, xid 0x4e5558c0 [|openflow]
20:21:46.776781 IP 192.168.1.10.6633 > 192.168.1.30.33786: Flags [.], ack 227337, win 9714, options [nop,nop,TS val 65614466 ecr 64253615], length 0
20:21:46.776788 IP 192.168.1.10.6633 > 192.168.1.30.33786: Flags [.], ack 230233, win 9759, options [nop,nop,TS val 65614466 ecr 64253615], length 0
20:21:46.776793 IP 192.168.1.10.6633 > 192.168.1.30.33786: Flags [.], ack 231681, win 9782, options [nop,nop,TS val 65614466 ecr 64253615], length 0
20:21:46.776800 IP 192.168.1.30.33786 > 192.168.1.10.6633: Flags [.], seq 231681:234577, ack 0, win 58, options [nop,nop,TS val 64253615 ecr 65614465], length 2896: OpenFlow
	version unknown (0x00), type 0x0d, length 1624, xid 0x38365f36
	version unknown (0x5b), type 0x61, length 12858, xid 0x35393a30 [|openflow]
20:21:46.776813 IP 192.168.1.30.33786 > 192.168.1.10.6633: Flags [.], seq 234577:237473, ack 0, win 58, options [nop,nop,TS val 64253615 ecr 65614465], length 2896: OpenFlow
	version unknown (0x00), type 0x0d, length 1, xid 0x00000078 (corrupt)
20:21:46.776981 IP 192.168.1.10.6633 > 192.168.1.30.33786: Flags [.], ack 233129, win 9804, options [nop,nop,TS val 65614466 ecr 64253615], length 0
20:21:46.776987 IP 192.168.1.10.6633 > 192.168.1.30.33786: Flags [.], ack 236025, win 9850, options [nop,nop,TS val 65614466 ecr 64253615], length 0
20:21:46.776991 IP 192.168.1.30.33786 > 192.168.1.10.6633: Flags [.], seq 237473:240369, ack 0, win 58, options [nop,nop,TS val 64253615 ecr 65614465], length 2896: OpenFlow
	version unknown (0x00), type 0x78, length 2, xid 0xc044c044 (corrupt)
20:21:46.776998 IP 192.168.1.30.33786 > 192.168.1.10.6633: Flags [.], seq 240369:243265, ack 0, win 58, options [nop,nop,TS val 64253615 ecr 65614465], length 2896: OpenFlow
	version unknown (0xc0), type 0x51, length 12, xid 0x00010000
	version unknown (0xc0), type 0x44, length 49220, xid 0x000d0001 [|openflow]
20:21:46.777025 IP 192.168.1.30.33786 > 192.168.1.10.6633: Flags [.], seq 243265:246161, ack 0, win 58, options [nop,nop,TS val 64253615 ecr 65614465], length 2896: OpenFlow
	version unknown (0xa0), type 0x59, length 2815, xid 0xfe08380b
	version unknown (0x38), type 0x01, length 12289, xid 0x65016601 [|openflow]
20:21:46.777192 IP 192.168.1.30.33786 > 192.168.1.10.6633: Flags [.], seq 246161:249057, ack 0, win 58, options [nop,nop,TS val 64253615 ecr 65614466], length 2896: OpenFlow
	version unknown (0xfe), type 0x80, length 0, xid 0x00000000 (corrupt)
20:21:46.777201 IP 192.168.1.30.33786 > 192.168.1.10.6633: Flags [.], seq 249057:251953, ack 0, win 58, options [nop,nop,TS val 64253615 ecr 65614466], length 2896: OpenFlow
	version unknown (0x00), type 0x01, length 0, xid 0x00780010 (corrupt)
20:21:46.777221 IP 192.168.1.30.33786 > 192.168.1.10.6633: Flags [.], seq 251953:254849, ack 0, win 58, options [nop,nop,TS val 64253615 ecr 65614466], length 2896: OpenFlow
	version unknown (0x00), type 0xff, length 1, xid 0xc044001c (corrupt)
20:21:46.777229 IP 192.168.1.30.33786 > 192.168.1.10.6633: Flags [.], seq 254849:257745, ack 0, win 58, options [nop,nop,TS val 64253615 ecr 65614466], length 2896: OpenFlow
	version unknown (0x70), type 0x36, length 1121, xid 0x72706100
	version unknown (0xa0), type 0x59, length 2815, xid 0xfe08380b [|openflow]
20:21:46.777250 IP 192.168.1.30.33786 > 192.168.1.10.6633: Flags [.], seq 257745:260641, ack 0, win 58, options [nop,nop,TS val 64253615 ecr 65614466], length 2896: OpenFlow
	version 1.0, type invalid (0x38), length 357, xid 0x01660369
	version 1.0, type invalid (0x30), length 304, xid 0x01300138
	version unknown (0x75), type 0xc0, length 14592, xid 0xff000101 [|openflow]
20:21:46.777259 IP 192.168.1.10.6633 > 192.168.1.30.33786: Flags [.], ack 237473, win 9872, options [nop,nop,TS val 65614466 ecr 64253615], length 0
20:21:46.777265 IP 192.168.1.30.33786 > 192.168.1.10.6633: Flags [.], seq 260641:263537, ack 0, win 58, options [nop,nop,TS val 64253615 ecr 65614466], length 2896: OpenFlow
	version 1.0, type invalid (0x30), length 304, xid 0x01300130
	version unknown (0x6e), type 0x74, length 30144, xid 0x3900ff00 [|openflow]
20:21:46.777289 IP 192.168.1.10.6633 > 192.168.1.30.33786: Flags [.], ack 243265, win 9963, options [nop,nop,TS val 65614466 ecr 64253615], length 0
20:21:46.777294 IP 192.168.1.30.33786 > 192.168.1.10.6633: Flags [.], seq 263537:266433, ack 0, win 58, options [nop,nop,TS val 64253615 ecr 65614466], length 2896: OpenFlow
	version 1.0, type invalid (0x30), length 304, xid 0x01300130
	version unknown (0x00), type 0xff, length 1, xid 0x06756275 (corrupt)
20:21:46.777302 IP 192.168.1.30.33786 > 192.168.1.10.6633: Flags [.], seq 266433:269329, ack 0, win 58, options [nop,nop,TS val 64253615 ecr 65614466], length 2896: OpenFlow
	version 1.0, type invalid (0x30), length 304, xid 0x01300130
	version unknown (0x70), type 0x05, length 27759, xid 0x63616c00 [|openflow]
20:21:46.777327 IP 192.168.1.10.6633 > 192.168.1.30.33786: Flags [.], ack 246161, win 10008, options [nop,nop,TS val 65614466 ecr 64253615], length 0
20:21:46.777332 IP 192.168.1.30.33786 > 192.168.1.10.6633: Flags [.], seq 269329:272225, ack 0, win 58, options [nop,nop,TS val 64253615 ecr 65614466], length 2896: OpenFlow
	version 1.0, type invalid (0x35), length 304, xid 0x01610130
	version unknown (0x74), type 0x69, length 28526, xid 0x045f7463 [|openflow]
20:21:46.777529 IP 192.168.1.10.6633 > 192.168.1.30.33786: Flags [.], ack 251953, win 10099, options [nop,nop,TS val 65614466 ecr 64253615], length 0
20:21:46.777535 IP 192.168.1.30.33786 > 192.168.1.10.6633: Flags [.], seq 272225:275121, ack 0, win 58, options [nop,nop,TS val 64253616 ecr 65614466], length 2896: OpenFlow
	version 1.0, type invalid (0x66), length 353, xid 0x01300139
	version 1.0, type invalid (0x38), length 304, xid 0x01650166
	version unknown (0x30), type 0x38, length 14899, xid 0x383a3062 [|openflow]
20:21:46.777550 IP 192.168.1.30.33786 > 192.168.1.10.6633: Flags [.], seq 275121:278017, ack 0, win 58, options [nop,nop,TS val 64253616 ecr 65614466], length 2896: OpenFlow
	version 1.0, type invalid (0x30), length 357, xid 0x01660166
	version 1.0, type invalid (0x38), length 307, xid 0x01380130
	version unknown (0x3a), type 0x30, length 14394, xid 0x33383a30 [|openflow]
20:21:46.777575 IP 192.168.1.10.6633 > 192.168.1.30.33786: Flags [.], ack 257745, win 10189, options [nop,nop,TS val 65614466 ecr 64253615], length 0
20:21:46.777580 IP 192.168.1.30.33786 > 192.168.1.10.6633: Flags [.], seq 278017:280913, ack 0, win 58, options [nop,nop,TS val 64253616 ecr 65614466], length 2896: OpenFlow
	version 1.0, type invalid (0x30), length 312, xid 0x01330138
	version unknown (0x3a), type 0x33, length 14394, xid 0x30625d0c [|openflow]
20:21:46.777588 IP 192.168.1.30.33786 > 192.168.1.10.6633: Flags [.], seq 280913:283809, ack 0, win 58, options [nop,nop,TS val 64253616 ecr 65614466], length 2896: OpenFlow
	version unknown (0xc0), type 0x39, length 255, xid 0x00010162
	version unknown (0x00), type 0xa0, length 22794, xid 0xfffe0838 [|openflow]
20:21:46.777611 IP 192.168.1.10.6633 > 192.168.1.30.33786: Flags [.], ack 263537, win 10280, options [nop,nop,TS val 65614466 ecr 64253615], length 0
20:21:46.777616 IP 192.168.1.30.33786 > 192.168.1.10.6633: Flags [.], seq 283809:286705, ack 0, win 58, options [nop,nop,TS val 64253616 ecr 65614466], length 2896: OpenFlow
	version 1.0, type FEATURES_REPLY, length 30050, xid 0x756e7475 [|openflow]
20:21:46.777625 IP 192.168.1.10.6633 > 192.168.1.30.33786: Flags [.], ack 272225, win 10415, options [nop,nop,TS val 65614466 ecr 64253615], length 0
20:21:46.777717 IP 192.168.1.30.33786 > 192.168.1.10.6633: Flags [.], seq 286705:289601, ack 0, win 58, options [nop,nop,TS val 64253616 ecr 65614466], length 2896: OpenFlow
	version 1.0, type HELLO, length 11008, xid 0x00000000 [|openflow]
20:21:46.777764 IP 192.168.1.30.33786 > 192.168.1.10.6633: Flags [.], seq 289601:292497, ack 0, win 58, options [nop,nop,TS val 64253616 ecr 65614466], length 2896: OpenFlow
	version unknown (0x00), type 0x00, length 65535, xid 0xffff0141 [|openflow]
20:21:46.777772 IP 192.168.1.30.33786 > 192.168.1.10.6633: Flags [.], seq 292497:295393, ack 0, win 58, options [nop,nop,TS val 64253616 ecr 65614466], length 2896: OpenFlow
	version 1.0, type HELLO, length 1034, xid 0x016b0000
	version unknown (0x44), type 0x00, length 3328, xid 0x01000000 [|openflow]
20:21:46.777796 IP 192.168.1.30.33786 > 192.168.1.10.6633: Flags [.], seq 295393:298289, ack 0, win 58, options [nop,nop,TS val 64253616 ecr 65614466], length 2896: OpenFlow
	version unknown (0x10), type 0x00, length 256, xid 0x00119400
	version unknown (0x65), type 0x01, length 26115, xid 0x69703604 [|openflow]
20:21:46.777964 IP 192.168.1.10.6633 > 192.168.1.30.33786: Flags [.], ack 289601, win 10687, options [nop,nop,TS val 65614466 ecr 64253616], length 0
20:21:46.777973 IP 192.168.1.30.33786 > 192.168.1.10.6633: Flags [.], seq 298289:301185, ack 0, win 58, options [nop,nop,TS val 64253616 ecr 65614466], length 2896: OpenFlow
	version unknown (0x00), type 0x00, length 2496, xid 0x44c00c00
	version unknown (0x61), type 0x74, length 26991, xid 0x6e045f74 [|openflow]
20:21:46.777980 IP 192.168.1.30.33786 > 192.168.1.10.6633: Flags [.], seq 301185:304081, ack 0, win 58, options [nop,nop,TS val 64253616 ecr 65614466], length 2896: OpenFlow
	version unknown (0x30), type 0x01, length 14337, xid 0x33013801 [|openflow]
