20:23:45.111369 IP 192.168.1.30.33777 > 192.168.1.10.6633: Flags [P.], seq 2555405001:2555405364, ack 327208700, win 361, options [nop,nop,TS val 64283199 ecr 65644028], length 363: OpenFlow
	version unknown (0x04), type 0x0a, length 363, xid 0x00000000
20:23:45.111389 IP 192.168.1.30.33777 > 192.168.1.10.6633: Flags [P.], seq 363:726, ack 1, win 361, options [nop,nop,TS val 64283199 ecr 65644028], length 363: OpenFlow
	version unknown (0x04), type 0x0a, length 363, xid 0x00000000
20:23:45.111470 IP 192.168.1.30.33777 > 192.168.1.10.6633: Flags [P.], seq 726:1089, ack 1, win 361, options [nop,nop,TS val 64283199 ecr 65644028], length 363: OpenFlow
	version unknown (0x04), type 0x0a, length 363, xid 0x00000000
20:23:45.111486 IP 192.168.1.30.33777 > 192.168.1.10.6633: Flags [P.], seq 1089:1452, ack 1, win 361, options [nop,nop,TS val 64283199 ecr 65644028], length 363: OpenFlow
	version unknown (0x04), type 0x0a, length 363, xid 0x00000000
20:23:45.111534 IP 192.168.1.30.33777 > 192.168.1.10.6633: Flags [P.], seq 1452:1815, ack 1, win 361, options [nop,nop,TS val 64283199 ecr 65644028], length 363: OpenFlow
	version unknown (0x04), type 0x0a, length 363, xid 0x00000000
20:23:45.111548 IP 192.168.1.30.33777 > 192.168.1.10.6633: Flags [P.], seq 1815:2178, ack 1, win 361, options [nop,nop,TS val 64283199 ecr 65644028], length 363: OpenFlow
	version unknown (0x04), type 0x0a, length 363, xid 0x00000000
20:23:45.111588 IP 192.168.1.30.33777 > 192.168.1.10.6633: Flags [P.], seq 2178:2541, ack 1, win 361, options [nop,nop,TS val 64283199 ecr 65644028], length 363: OpenFlow
	version unknown (0x04), type 0x0a, length 363, xid 0x00000000
20:23:45.111602 IP 192.168.1.30.33777 > 192.168.1.10.6633: Flags [P.], seq 2541:2904, ack 1, win 361, options [nop,nop,TS val 64283199 ecr 65644028], length 363: OpenFlow
	version unknown (0x04), type 0x0a, length 363, xid 0x00000000
20:23:45.111643 IP 192.168.1.30.33777 > 192.168.1.10.6633: Flags [P.], seq 2904:3267, ack 1, win 361, options [nop,nop,TS val 64283199 ecr 65644028], length 363: OpenFlow
	version unknown (0x04), type 0x0a, length 363, xid 0x00000000
20:23:45.111656 IP 192.168.1.30.33777 > 192.168.1.10.6633: Flags [P.], seq 3267:3630, ack 1, win 361, options [nop,nop,TS val 64283199 ecr 65644028], length 363: OpenFlow
	version unknown (0x04), type 0x0a, length 363, xid 0x00000000
20:23:45.111697 IP 192.168.1.30.33777 > 192.168.1.10.6633: Flags [P.], seq 3630:3993, ack 1, win 361, options [nop,nop,TS val 64283199 ecr 65644028], length 363: OpenFlow
	version unknown (0x04), type 0x0a, length 363, xid 0x00000000
20:23:45.111710 IP 192.168.1.30.33777 > 192.168.1.10.6633: Flags [P.], seq 3993:4356, ack 1, win 361, options [nop,nop,TS val 64283199 ecr 65644028], length 363: OpenFlow
	version unknown (0x04), type 0x0a, length 363, xid 0x00000000
20:23:45.116310 IP 192.168.1.10.6633 > 192.168.1.30.33777: Flags [.], ack 363, win 6235, options [nop,nop,TS val 65644051 ecr 64283199], length 0
20:23:45.116536 IP 192.168.1.10.6633 > 192.168.1.30.33777: Flags [.], ack 726, win 6235, options [nop,nop,TS val 65644051 ecr 64283199], length 0
20:23:45.116543 IP 192.168.1.30.33777 > 192.168.1.10.6633: Flags [.], seq 4356:7252, ack 1, win 361, options [nop,nop,TS val 64283200 ecr 65644051], length 2896: OpenFlow
	version unknown (0x04), type 0x0a, length 363, xid 0x00000000
	version unknown (0x04), type 0x0a, length 363, xid 0x00000000
	version unknown (0x04), type 0x0a, length 363, xid 0x00000000
	version unknown (0x04), type 0x0a, length 363, xid 0x00000000
	version unknown (0x04), type 0x0a, length 363, xid 0x00000000
	version unknown (0x04), type 0x0a, length 363, xid 0x00000000
	version unknown (0x04), type 0x0a, length 363, xid 0x00000000
	version unknown (0x04), type 0x0a, length 363, xid 0x00000000 [|openflow]
20:23:45.116553 IP 192.168.1.10.6633 > 192.168.1.30.33777: Flags [.], ack 1089, win 6235, options [nop,nop,TS val 65644051 ecr 64283199], length 0
20:23:45.116558 IP 192.168.1.10.6633 > 192.168.1.30.33777: Flags [.], ack 1452, win 6235, options [nop,nop,TS val 65644051 ecr 64283199], length 0
20:23:45.116561 IP 192.168.1.30.33777 > 192.168.1.10.6633: Flags [.], seq 7252:10148, ack 1, win 361, options [nop,nop,TS val 64283200 ecr 65644051], length 2896: OpenFlow
	version 1.0, type HELLO, length 17, xid 0x94000100
	version unknown (0xff), type 0xff, length 65281, xid 0x4101002b [|openflow]
20:23:45.116593 IP 192.168.1.10.6633 > 192.168.1.30.33777: Flags [.], ack 2904, win 6235, options [nop,nop,TS val 65644051 ecr 64283199], length 0
20:23:45.116597 IP 192.168.1.30.33777 > 192.168.1.10.6633: Flags [.], seq 10148:13044, ack 1, win 361, options [nop,nop,TS val 64283200 ecr 65644051], length 2896: OpenFlow
	version unknown (0x09), type 0xc0, length 17600, xid 0x0c001000 [|openflow]
20:23:45.116606 IP 192.168.1.30.33777 > 192.168.1.10.6633: Flags [.], seq 13044:15940, ack 1, win 361, options [nop,nop,TS val 64283200 ecr 65644051], length 2896: OpenFlow
	version unknown (0x78), type 0x00, length 2048, xid 0x00000000
	version 1.0, type invalid (0x61), length 308, xid 0x01380162
	version unknown (0x6f), type 0x6e, length 1119, xid 0x74637005 [|openflow]
20:23:45.116629 IP 192.168.1.10.6633 > 192.168.1.30.33777: Flags [.], ack 4356, win 6235, options [nop,nop,TS val 65644051 ecr 64283199], length 0
20:23:45.116635 IP 192.168.1.30.33777 > 192.168.1.10.6633: Flags [.], seq 15940:18836, ack 1, win 361, options [nop,nop,TS val 64283200 ecr 65644051], length 2896: OpenFlow
	version unknown (0x0c), type 0x00, length 8448, xid 0x01000000 [|openflow]
20:23:45.116644 IP 192.168.1.30.33777 > 192.168.1.10.6633: Flags [.], seq 18836:21732, ack 1, win 361, options [nop,nop,TS val 64283200 ecr 65644051], length 2896: OpenFlow
	version unknown (0x34), type 0x05, length 19529, xid 0x4e5558c0 [|openflow]
20:23:45.116990 IP 192.168.1.10.6633 > 192.168.1.30.33777: Flags [.], ack 15940, win 6235, options [nop,nop,TS val 65644051 ecr 64283200], length 0
20:23:45.116996 IP 192.168.1.30.33777 > 192.168.1.10.6633: Flags [.], seq 21732:24628, ack 1, win 361, options [nop,nop,TS val 64283200 ecr 65644051], length 2896: OpenFlow
	version unknown (0x00), type 0x0d, length 1624, xid 0x38365f36
	version unknown (0x5b), type 0x62, length 24890, xid 0x34613a61 [|openflow]
20:23:45.117005 IP 192.168.1.30.33777 > 192.168.1.10.6633: Flags [.], seq 24628:27524, ack 1, win 361, options [nop,nop,TS val 64283200 ecr 65644051], length 2896: OpenFlow
	version unknown (0x00), type 0x0d, length 1, xid 0x00000078 (corrupt)
20:23:45.117029 IP 192.168.1.30.33777 > 192.168.1.10.6633: Flags [.], seq 27524:30420, ack 1, win 361, options [nop,nop,TS val 64283200 ecr 65644051], length 2896: OpenFlow
	version unknown (0x00), type 0x78, length 2, xid 0xc044c044 (corrupt)
20:23:45.117038 IP 192.168.1.30.33777 > 192.168.1.10.6633: Flags [.], seq 30420:33316, ack 1, win 361, options [nop,nop,TS val 64283200 ecr 65644051], length 2896: OpenFlow
	version unknown (0xc0), type 0x51, length 12, xid 0x00010000
	version unknown (0xc0), type 0x44, length 49220, xid 0x000d0001 [|openflow]
20:23:45.117060 IP 192.168.1.10.6633 > 192.168.1.30.33777: Flags [.], ack 21732, win 6235, options [nop,nop,TS val 65644051 ecr 64283200], length 0
20:23:45.117066 IP 192.168.1.30.33777 > 192.168.1.10.6633: Flags [.], seq 33316:36212, ack 1, win 361, options [nop,nop,TS val 64283200 ecr 65644051], length 2896: OpenFlow
	version unknown (0xb8), type 0x4a, length 43007, xid 0xfe3de132 [|openflow]
20:23:45.117074 IP 192.168.1.30.33777 > 192.168.1.10.6633: Flags [.], seq 36212:39108, ack 1, win 361, options [nop,nop,TS val 64283200 ecr 65644051], length 2896: OpenFlow
	version unknown (0xfe), type 0x80, length 0, xid 0x00000000 (corrupt)
20:23:45.117534 IP 192.168.1.10.6633 > 192.168.1.30.33777: Flags [.], ack 39108, win 6235, options [nop,nop,TS val 65644051 ecr 64283200], length 0
20:23:45.117544 IP 192.168.1.30.33777 > 192.168.1.10.6633: Flags [.], seq 39108:42004, ack 1, win 361, options [nop,nop,TS val 64283201 ecr 65644051], length 2896: OpenFlow
	version unknown (0x00), type 0x01, length 0, xid 0x00780010 (corrupt)
20:23:45.117553 IP 192.168.1.30.33777 > 192.168.1.10.6633: Flags [.], seq 42004:44900, ack 1, win 361, options [nop,nop,TS val 64283201 ecr 65644051], length 2896: OpenFlow
	version unknown (0x00), type 0xff, length 1, xid 0xc044001c (corrupt)
20:23:45.117576 IP 192.168.1.30.33777 > 192.168.1.10.6633: Flags [.], seq 44900:47796, ack 1, win 361, options [nop,nop,TS val 64283201 ecr 65644051], length 2896: OpenFlow
	version unknown (0x70), type 0x36, length 1121, xid 0x72706100
	version unknown (0xb8), type 0x4a, length 43007, xid 0xfe3de132 [|openflow]
20:23:45.117586 IP 192.168.1.30.33777 > 192.168.1.10.6633: Flags [.], seq 47796:50692, ack 1, win 361, options [nop,nop,TS val 64283201 ecr 65644051], length 2896: OpenFlow
	version 1.0, type invalid (0x38), length 357, xid 0x01660369
	version 1.0, type invalid (0x30), length 304, xid 0x01300138
	version unknown (0x75), type 0xc0, length 14592, xid 0xff000101 [|openflow]
20:23:45.117606 IP 192.168.1.30.33777 > 192.168.1.10.6633: Flags [.], seq 50692:53588, ack 1, win 361, options [nop,nop,TS val 64283201 ecr 65644051], length 2896: OpenFlow
	version 1.0, type invalid (0x30), length 304, xid 0x01300130
	version unknown (0x6e), type 0x74, length 30144, xid 0x3900ff00 [|openflow]
20:23:45.117616 IP 192.168.1.30.33777 > 192.168.1.10.6633: Flags [.], seq 53588:56484, ack 1, win 361, options [nop,nop,TS val 64283201 ecr 65644051], length 2896: OpenFlow
	version 1.0, type invalid (0x30), length 304, xid 0x01300130
	version unknown (0x00), type 0xff, length 1, xid 0x06756275 (corrupt)
20:23:45.158364 IP 192.168.1.30.33777 > 192.168.1.10.6633: Flags [.], seq 56484:57932, ack 1, win 361, options [nop,nop,TS val 64283210 ecr 65644051], length 1448: OpenFlow
	version 1.0, type invalid (0x30), length 304, xid 0x01300130
	version unknown (0x70), type 0x05, length 27759, xid 0x63616c00 [|openflow]
20:23:45.158852 IP 192.168.1.10.6633 > 192.168.1.30.33777: Flags [.], ack 56484, win 6235, options [nop,nop,TS val 65644058 ecr 64283201], length 0
20:23:45.158880 IP 192.168.1.30.33777 > 192.168.1.10.6633: Flags [.], seq 57932:59380, ack 1, win 361, options [nop,nop,TS val 64283211 ecr 65644058], length 1448: OpenFlow
	version 1.0, type invalid (0x62), length 304, xid 0x01300130
	version unknown (0x04), type 0x5f, length 29795, xid 0x70056c6f [|openflow]
20:23:45.158889 IP 192.168.1.30.33777 > 192.168.1.10.6633: Flags [.], seq 59380:62276, ack 1, win 361, options [nop,nop,TS val 64283211 ecr 65644058], length 2896: OpenFlow
	version 1.0, type invalid (0x34), length 312, xid 0x01620130
	version unknown (0x70), type 0x05, length 27759, xid 0x63616c00 [|openflow]
20:23:45.158911 IP 192.168.1.30.33777 > 192.168.1.10.6633: Flags [.], seq 62276:65172, ack 1, win 361, options [nop,nop,TS val 64283211 ecr 65644058], length 2896: OpenFlow
	version 1.0, type invalid (0x66), length 311, xid 0x01610161
	version unknown (0x61), type 0x74, length 26991, xid 0x6e045f74 [|openflow]
20:23:45.158922 IP 192.168.1.30.33777 > 192.168.1.10.6633: Flags [.], seq 65172:68068, ack 1, win 361, options [nop,nop,TS val 64283211 ecr 65644058], length 2896: OpenFlow
	version 1.0, type invalid (0x33), length 357, xid 0x01660166
	version 1.0, type invalid (0x31), length 357, xid 0x01640133
	version unknown (0x00), type 0x01, length 306, xid 0x01330131
	version unknown (0x61), type 0x3a, length 13409, xid 0x3a61373a [|openflow]
20:23:45.158944 IP 192.168.1.30.33777 > 192.168.1.10.6633: Flags [.], seq 68068:70964, ack 1, win 361, options [nop,nop,TS val 64283211 ecr 65644058], length 2896: OpenFlow
	version 1.0, type invalid (0x33), length 305, xid 0x01650164
	version unknown (0x61), type 0x3a, length 24887, xid 0x3a33643a [|openflow]
20:23:45.158954 IP 192.168.1.30.33777 > 192.168.1.10.6633: Flags [.], seq 70964:73860, ack 1, win 361, options [nop,nop,TS val 64283211 ecr 65644058], length 2896: OpenFlow
	version unknown (0xc0), type 0x39, length 255, xid 0x00010132
	version unknown (0x00), type 0xb8, length 19111, xid 0xfffe3de1 [|openflow]
20:23:45.182543 IP 192.168.1.10.6633 > 192.168.1.30.33777: Flags [.], ack 73860, win 6235, options [nop,nop,TS val 65644067 ecr 64283210], length 0
20:23:45.182568 IP 192.168.1.30.33777 > 192.168.1.10.6633: Flags [.], seq 73860:75308, ack 1, win 361, options [nop,nop,TS val 64283216 ecr 65644067], length 1448: OpenFlow
	version 1.0, type FEATURES_REPLY, length 30050, xid 0x756e7475 [|openflow]
20:23:45.182594 IP 192.168.1.30.33777 > 192.168.1.10.6633: Flags [P.], seq 75308:75867, ack 1, win 361, options [nop,nop,TS val 64283216 ecr 65644067], length 559: OpenFlow
	version unknown (0x00), type 0x00, length 65280, xid 0x01067562 [|openflow]
20:23:45.224700 IP 192.168.1.10.6633 > 192.168.1.30.33777: Flags [.], ack 75867, win 6235, options [nop,nop,TS val 65644067 ecr 64283216], length 0
20:23:45.225557 IP 192.168.1.30.33777 > 192.168.1.10.6633: Flags [P.], seq 75867:76230, ack 1, win 361, options [nop,nop,TS val 64283219 ecr 65644067], length 363: OpenFlow
	version unknown (0x04), type 0x0a, length 363, xid 0x00000000
20:23:45.225573 IP 192.168.1.30.33777 > 192.168.1.10.6633: Flags [P.], seq 76230:76593, ack 1, win 361, options [nop,nop,TS val 64283219 ecr 65644067], length 363: OpenFlow
	version unknown (0x04), type 0x0a, length 363, xid 0x00000000
20:23:45.225588 IP 192.168.1.30.33777 > 192.168.1.10.6633: Flags [P.], seq 76593:76956, ack 1, win 361, options [nop,nop,TS val 64283219 ecr 65644067], length 363: OpenFlow
	version unknown (0x04), type 0x0a, length 363, xid 0x00000000
20:23:45.225603 IP 192.168.1.30.33777 > 192.168.1.10.6633: Flags [P.], seq 76956:77319, ack 1, win 361, options [nop,nop,TS val 64283219 ecr 65644067], length 363: OpenFlow
	version unknown (0x04), type 0x0a, length 363, xid 0x00000000
20:23:45.225618 IP 192.168.1.30.33777 > 192.168.1.10.6633: Flags [P.], seq 77319:77682, ack 1, win 361, options [nop,nop,TS val 64283219 ecr 65644067], length 363: OpenFlow
	version unknown (0x04), type 0x0a, length 363, xid 0x00000000
20:23:45.225633 IP 192.168.1.30.33777 > 192.168.1.10.6633: Flags [P.], seq 77682:78045, ack 1, win 361, options [nop,nop,TS val 64283219 ecr 65644067], length 363: OpenFlow
	version unknown (0x04), type 0x0a, length 363, xid 0x00000000
20:23:45.225648 IP 192.168.1.30.33777 > 192.168.1.10.6633: Flags [P.], seq 78045:78408, ack 1, win 361, options [nop,nop,TS val 64283219 ecr 65644067], length 363: OpenFlow
	version unknown (0x04), type 0x0a, length 363, xid 0x00000000
20:23:45.225663 IP 192.168.1.30.33777 > 192.168.1.10.6633: Flags [P.], seq 78408:78771, ack 1, win 361, options [nop,nop,TS val 64283219 ecr 65644067], length 363: OpenFlow
	version unknown (0x04), type 0x0a, length 363, xid 0x00000000
20:23:45.225678 IP 192.168.1.30.33777 > 192.168.1.10.6633: Flags [P.], seq 78771:79134, ack 1, win 361, options [nop,nop,TS val 64283219 ecr 65644067], length 363: OpenFlow
	version unknown (0x04), type 0x0a, length 363, xid 0x00000000
20:23:45.225693 IP 192.168.1.30.33777 > 192.168.1.10.6633: Flags [P.], seq 79134:79497, ack 1, win 361, options [nop,nop,TS val 64283219 ecr 65644067], length 363: OpenFlow
	version unknown (0x04), type 0x0a, length 363, xid 0x00000000
20:23:45.225974 IP 192.168.1.30.33777 > 192.168.1.10.6633: Flags [.], seq 79497:80945, ack 1, win 361, options [nop,nop,TS val 64283227 ecr 65644067], length 1448: OpenFlow
	version unknown (0x04), type 0x0a, length 363, xid 0x00000000
	version unknown (0x04), type 0x0a, length 363, xid 0x00000000
	version unknown (0x04), type 0x0a, length 363, xid 0x00000000
	version unknown (0x04), type 0x0a, length 363, xid 0x00000000 [|openflow]
20:23:45.226279 IP 192.168.1.30.33777 > 192.168.1.10.6633: Flags [.], seq 80945:82393, ack 1, win 361, options [nop,nop,TS val 64283227 ecr 65644067], length 1448: OpenFlow
	version unknown (0x94), type 0x00, length 256, xid 0x040a016b
	version unknown (0x36), type 0x04, length 24946, xid 0x70610000 [|openflow]
20:23:45.230134 IP 192.168.1.10.6633 > 192.168.1.30.33777: Flags [.], ack 77319, win 6235, options [nop,nop,TS val 65644078 ecr 64283219], length 0
20:23:45.230156 IP 192.168.1.10.6633 > 192.168.1.30.33777: Flags [.], ack 78771, win 6235, options [nop,nop,TS val 65644078 ecr 64283219], length 0
20:23:45.230174 IP 192.168.1.10.6633 > 192.168.1.30.33777: Flags [.], ack 80945, win 6235, options [nop,nop,TS val 65644078 ecr 64283219], length 0
20:23:45.230957 IP 192.168.1.30.33777 > 192.168.1.10.6633: Flags [.], seq 82393:85289, ack 1, win 361, options [nop,nop,TS val 64283228 ecr 65644078], length 2896: OpenFlow
	version 1.0, type HELLO, length 17, xid 0x94000100
	version unknown (0xff), type 0xff, length 65281, xid 0x4101002b [|openflow]
20:23:45.230983 IP 192.168.1.30.33777 > 192.168.1.10.6633: Flags [.], seq 85289:88185, ack 1, win 361, options [nop,nop,TS val 64283228 ecr 65644078], length 2896: OpenFlow
	version unknown (0x09), type 0xc0, length 17600, xid 0x0c001000 [|openflow]
20:23:45.263658 IP 192.168.1.30.33777 > 192.168.1.10.6633: Flags [.], seq 88185:91081, ack 1, win 361, options [nop,nop,TS val 64283228 ecr 65644078], length 2896: OpenFlow
	version unknown (0x78), type 0x00, length 2048, xid 0x00000000
	version 1.0, type invalid (0x61), length 308, xid 0x01380162
	version unknown (0x6f), type 0x6e, length 1119, xid 0x74637005 [|openflow]

