20:21:46.655910 IP 192.168.1.30.35968 > 192.168.1.11.6633: Flags [P.], seq 3692412165:3692412528, ack 4197156302, win 361, options [nop,nop,TS val 64253585 ecr 68995339], length 363: OpenFlow
	version unknown (0x04), type 0x0a, length 363, xid 0x00000000
20:21:46.655940 IP 192.168.1.30.35968 > 192.168.1.11.6633: Flags [P.], seq 363:726, ack 1, win 361, options [nop,nop,TS val 64253585 ecr 68995339], length 363: OpenFlow
	version unknown (0x04), type 0x0a, length 363, xid 0x00000000
20:21:46.655971 IP 192.168.1.30.35968 > 192.168.1.11.6633: Flags [P.], seq 726:1089, ack 1, win 361, options [nop,nop,TS val 64253585 ecr 68995339], length 363: OpenFlow
	version unknown (0x04), type 0x0a, length 363, xid 0x00000000
20:21:46.655984 IP 192.168.1.30.35968 > 192.168.1.11.6633: Flags [P.], seq 1089:1452, ack 1, win 361, options [nop,nop,TS val 64253585 ecr 68995339], length 363: OpenFlow
	version unknown (0x04), type 0x0a, length 363, xid 0x00000000
20:21:46.656008 IP 192.168.1.30.35968 > 192.168.1.11.6633: Flags [P.], seq 1452:1815, ack 1, win 361, options [nop,nop,TS val 64253585 ecr 68995339], length 363: OpenFlow
	version unknown (0x04), type 0x0a, length 363, xid 0x00000000
20:21:46.656020 IP 192.168.1.30.35968 > 192.168.1.11.6633: Flags [P.], seq 1815:2178, ack 1, win 361, options [nop,nop,TS val 64253585 ecr 68995339], length 363: OpenFlow
	version unknown (0x04), type 0x0a, length 363, xid 0x00000000
20:21:46.656045 IP 192.168.1.30.35968 > 192.168.1.11.6633: Flags [P.], seq 2178:2541, ack 1, win 361, options [nop,nop,TS val 64253585 ecr 68995339], length 363: OpenFlow
	version unknown (0x04), type 0x0a, length 363, xid 0x00000000
20:21:46.656057 IP 192.168.1.30.35968 > 192.168.1.11.6633: Flags [P.], seq 2541:2904, ack 1, win 361, options [nop,nop,TS val 64253585 ecr 68995339], length 363: OpenFlow
	version unknown (0x04), type 0x0a, length 363, xid 0x00000000
20:21:46.656079 IP 192.168.1.30.35968 > 192.168.1.11.6633: Flags [P.], seq 2904:3267, ack 1, win 361, options [nop,nop,TS val 64253585 ecr 68995339], length 363: OpenFlow
	version unknown (0x04), type 0x0a, length 363, xid 0x00000000
20:21:46.656091 IP 192.168.1.30.35968 > 192.168.1.11.6633: Flags [P.], seq 3267:3630, ack 1, win 361, options [nop,nop,TS val 64253585 ecr 68995339], length 363: OpenFlow
	version unknown (0x04), type 0x0a, length 363, xid 0x00000000
20:21:46.656113 IP 192.168.1.30.35968 > 192.168.1.11.6633: Flags [P.], seq 3630:3993, ack 1, win 361, options [nop,nop,TS val 64253585 ecr 68995339], length 363: OpenFlow
	version unknown (0x04), type 0x0a, length 363, xid 0x00000000
20:21:46.656125 IP 192.168.1.30.35968 > 192.168.1.11.6633: Flags [P.], seq 3993:4356, ack 1, win 361, options [nop,nop,TS val 64253585 ecr 68995339], length 363: OpenFlow
	version unknown (0x04), type 0x0a, length 363, xid 0x00000000
20:21:46.656146 IP 192.168.1.30.35968 > 192.168.1.11.6633: Flags [P.], seq 4356:4719, ack 1, win 361, options [nop,nop,TS val 64253585 ecr 68995339], length 363: OpenFlow
	version unknown (0x04), type 0x0a, length 363, xid 0x00000000
20:21:46.656158 IP 192.168.1.30.35968 > 192.168.1.11.6633: Flags [P.], seq 4719:5082, ack 1, win 361, options [nop,nop,TS val 64253585 ecr 68995339], length 363: OpenFlow
	version unknown (0x04), type 0x0a, length 363, xid 0x00000000
20:21:46.656180 IP 192.168.1.30.35968 > 192.168.1.11.6633: Flags [P.], seq 5082:5445, ack 1, win 361, options [nop,nop,TS val 64253585 ecr 68995339], length 363: OpenFlow
	version unknown (0x04), type 0x0a, length 363, xid 0x00000000
20:21:46.656192 IP 192.168.1.30.35968 > 192.168.1.11.6633: Flags [P.], seq 5445:5808, ack 1, win 361, options [nop,nop,TS val 64253585 ecr 68995339], length 363: OpenFlow
	version unknown (0x04), type 0x0a, length 363, xid 0x00000000
20:21:46.656214 IP 192.168.1.30.35968 > 192.168.1.11.6633: Flags [P.], seq 5808:6171, ack 1, win 361, options [nop,nop,TS val 64253585 ecr 68995339], length 363: OpenFlow
	version unknown (0x04), type 0x0a, length 363, xid 0x00000000
20:21:46.656226 IP 192.168.1.30.35968 > 192.168.1.11.6633: Flags [P.], seq 6171:6534, ack 1, win 361, options [nop,nop,TS val 64253585 ecr 68995339], length 363: OpenFlow
	version unknown (0x04), type 0x0a, length 363, xid 0x00000000
20:21:46.656247 IP 192.168.1.30.35968 > 192.168.1.11.6633: Flags [P.], seq 6534:6897, ack 1, win 361, options [nop,nop,TS val 64253585 ecr 68995339], length 363: OpenFlow
	version unknown (0x04), type 0x0a, length 363, xid 0x00000000
20:21:46.656259 IP 192.168.1.30.35968 > 192.168.1.11.6633: Flags [P.], seq 6897:7260, ack 1, win 361, options [nop,nop,TS val 64253585 ecr 68995339], length 363: OpenFlow
	version unknown (0x04), type 0x0a, length 363, xid 0x00000000
20:21:46.656282 IP 192.168.1.30.35968 > 192.168.1.11.6633: Flags [P.], seq 7260:7623, ack 1, win 361, options [nop,nop,TS val 64253585 ecr 68995339], length 363: OpenFlow
	version unknown (0x04), type 0x0a, length 363, xid 0x00000000
20:21:46.656295 IP 192.168.1.30.35968 > 192.168.1.11.6633: Flags [P.], seq 7623:7986, ack 1, win 361, options [nop,nop,TS val 64253585 ecr 68995339], length 363: OpenFlow
	version unknown (0x04), type 0x0a, length 363, xid 0x00000000
20:21:46.656317 IP 192.168.1.30.35968 > 192.168.1.11.6633: Flags [P.], seq 7986:8349, ack 1, win 361, options [nop,nop,TS val 64253585 ecr 68995339], length 363: OpenFlow
	version unknown (0x04), type 0x0a, length 363, xid 0x00000000
20:21:46.656329 IP 192.168.1.30.35968 > 192.168.1.11.6633: Flags [P.], seq 8349:8712, ack 1, win 361, options [nop,nop,TS val 64253585 ecr 68995339], length 363: OpenFlow
	version unknown (0x04), type 0x0a, length 363, xid 0x00000000
20:21:46.660207 IP 192.168.1.11.6633 > 192.168.1.30.35968: Flags [.], ack 8712, win 24568, options [nop,nop,TS val 68995376 ecr 64253585], length 0
20:21:46.661401 IP 192.168.1.30.35968 > 192.168.1.11.6633: Flags [.], seq 8712:13056, ack 1, win 361, options [nop,nop,TS val 64253586 ecr 68995376], length 4344: OpenFlow
	version unknown (0x04), type 0x0a, length 363, xid 0x00000000
	version unknown (0x04), type 0x0a, length 363, xid 0x00000000
	version unknown (0x04), type 0x0a, length 363, xid 0x00000000
	version unknown (0x04), type 0x0a, length 363, xid 0x00000000
	version unknown (0x04), type 0x0a, length 363, xid 0x00000000
	version unknown (0x04), type 0x0a, length 363, xid 0x00000000
	version unknown (0x04), type 0x0a, length 363, xid 0x00000000
	version unknown (0x04), type 0x0a, length 363, xid 0x00000000
	version unknown (0x04), type 0x0a, length 363, xid 0x00000000
	version unknown (0x04), type 0x0a, length 363, xid 0x00000000
	version unknown (0x04), type 0x0a, length 363, xid 0x00000000
	version unknown (0x04), type 0x0a, length 363, xid 0x00000000 [|openflow]
20:21:46.661411 IP 192.168.1.30.35968 > 192.168.1.11.6633: Flags [.], seq 13056:17400, ack 1, win 361, options [nop,nop,TS val 64253586 ecr 68995376], length 4344: OpenFlow
	version unknown (0x0c), type 0x00, length 4096, xid 0x01000011
	version unknown (0x00), type 0x00, length 0, xid 0xfb14e914 (corrupt)
20:21:46.661434 IP 192.168.1.30.35968 > 192.168.1.11.6633: Flags [.], seq 17400:21744, ack 1, win 361, options [nop,nop,TS val 64253586 ecr 68995376], length 4344: OpenFlow
	version unknown (0x78), type 0x00, length 2048, xid 0x00000000
	version 1.0, type invalid (0x39), length 309, xid 0x01300161
	version unknown (0x6e), type 0x04, length 24436, xid 0x6370056c [|openflow]
20:21:46.661442 IP 192.168.1.30.35968 > 192.168.1.11.6633: Flags [.], seq 21744:26088, ack 1, win 361, options [nop,nop,TS val 64253586 ecr 68995376], length 4344: OpenFlow
	version 1.0, type invalid (0x38), length 357, xid 0x01660369
	version 1.0, type invalid (0x30), length 304, xid 0x01300138
	version unknown (0x75), type 0xc0, length 14592, xid 0xff000101 [|openflow]
20:21:46.661465 IP 192.168.1.30.35968 > 192.168.1.11.6633: Flags [.], seq 26088:30432, ack 1, win 361, options [nop,nop,TS val 64253586 ecr 68995376], length 4344: OpenFlow
	version unknown (0x00), type 0x00, length 0, xid 0x00000000 (corrupt)
20:21:46.661474 IP 192.168.1.30.35968 > 192.168.1.11.6633: Flags [.], seq 30432:34776, ack 1, win 361, options [nop,nop,TS val 64253586 ecr 68995376], length 4344: OpenFlow
	version unknown (0x00), type 0x00, length 41049, xid 0x0afffe08 [|openflow]
20:21:46.661497 IP 192.168.1.30.35968 > 192.168.1.11.6633: Flags [.], seq 34776:39120, ack 1, win 361, options [nop,nop,TS val 64253586 ecr 68995376], length 4344: OpenFlow
	version unknown (0x00), type 0x00, length 267, xid 0x11fffe80
	version unknown (0x4c), type 0x49, length 20053, xid 0x58c00c00 [|openflow]
20:21:46.661505 IP 192.168.1.30.35968 > 192.168.1.11.6633: Flags [.], seq 39120:43464, ack 1, win 361, options [nop,nop,TS val 64253586 ecr 68995376], length 4344: OpenFlow
	version unknown (0x00), type 0xfb, length 41561, xid 0x0a08380b [|openflow]
20:21:46.697459 IP 192.168.1.30.35968 > 192.168.1.11.6633: Flags [.], seq 43464:44912, ack 1, win 361, options [nop,nop,TS val 64253596 ecr 68995376], length 1448: OpenFlow
	version unknown (0x66), type 0x03, length 26992, xid 0x36046172 [|openflow]
20:21:46.917657 IP 192.168.1.30.35968 > 192.168.1.11.6633: Flags [.], seq 8712:10160, ack 1, win 361, options [nop,nop,TS val 64253651 ecr 68995376], length 1448: OpenFlow
	version unknown (0x04), type 0x0a, length 363, xid 0x00000000
	version unknown (0x04), type 0x0a, length 363, xid 0x00000000
	version unknown (0x04), type 0x0a, length 363, xid 0x00000000
	version unknown (0x04), type 0x0a, length 363, xid 0x00000000 [|openflow]
20:21:47.079262 IP 192.168.1.11.6633 > 192.168.1.30.35968: Flags [.], ack 43464, win 24394, options [nop,nop,TS val 68995481 ecr 64253586], length 0
20:21:47.079342 IP 192.168.1.11.6633 > 192.168.1.30.35968: Flags [.], ack 44912, win 24386, options [nop,nop,TS val 68995481 ecr 64253596], length 0
20:21:47.079379 IP 192.168.1.11.6633 > 192.168.1.30.35968: Flags [.], ack 44912, win 24386, options [nop,nop,TS val 68995481 ecr 64253596,nop,nop,sack 1 {8712:10160}], length 0
20:21:47.081420 IP 192.168.1.30.35968 > 192.168.1.11.6633: Flags [.], seq 44912:47808, ack 1, win 361, options [nop,nop,TS val 64253691 ecr 68995481], length 2896: OpenFlow
	version unknown (0x38), type 0x01, length 25857, xid 0x66036970 [|openflow]
20:21:47.081428 IP 192.168.1.30.35968 > 192.168.1.11.6633: Flags [.], seq 47808:52152, ack 1, win 361, options [nop,nop,TS val 64253691 ecr 68995481], length 4344: OpenFlow
	version unknown (0x30), type 0x01, length 12289, xid 0x30013001 [|openflow]
20:21:47.081450 IP 192.168.1.30.35968 > 192.168.1.11.6633: Flags [.], seq 52152:56496, ack 1, win 361, options [nop,nop,TS val 64253691 ecr 68995481], length 4344: OpenFlow
	version unknown (0xff), type 0xfe, length 2104, xid 0x0bff0200
	version unknown (0x0a), type 0x01, length 27392, xid 0x000000ff [|openflow]
20:21:47.081458 IP 192.168.1.30.35968 > 192.168.1.11.6633: Flags [.], seq 56496:60840, ack 1, win 361, options [nop,nop,TS val 64253691 ecr 68995481], length 4344: OpenFlow
	version unknown (0xff), type 0xfe, length 32768, xid 0x00000000 [|openflow]
20:21:47.081479 IP 192.168.1.30.35968 > 192.168.1.11.6633: Flags [.], seq 60840:65184, ack 1, win 361, options [nop,nop,TS val 64253691 ecr 68995481], length 4344: OpenFlow
	version unknown (0x08), type 0x38, length 2950, xid 0xdd600000
	version unknown (0xe9), type 0x14, length 59649, xid 0x0bce2400 [|openflow]
20:21:47.081487 IP 192.168.1.30.35968 > 192.168.1.11.6633: Flags [.], seq 65184:69528, ack 1, win 361, options [nop,nop,TS val 64253691 ecr 68995481], length 4344: OpenFlow
	version unknown (0x00), type 0x00, length 51, xid 0x33000000
	version unknown (0x00), type 0x00, length 0, xid 0x00fb14e9 (corrupt)
20:21:47.081510 IP 192.168.1.30.35968 > 192.168.1.11.6633: Flags [.], seq 69528:73872, ack 1, win 361, options [nop,nop,TS val 64253691 ecr 68995481], length 4344: OpenFlow
	version unknown (0x0c), type 0x80, length 0, xid 0x04000000 (corrupt)
20:21:47.081519 IP 192.168.1.30.35968 > 192.168.1.11.6633: Flags [.], seq 73872:78216, ack 1, win 361, options [nop,nop,TS val 64253691 ecr 68995481], length 4344: OpenFlow
	version unknown (0x00), type 0x2b, length 0, xid 0x00000003 (corrupt)
20:21:47.084688 IP 192.168.1.11.6633 > 192.168.1.30.35968: Flags [.], ack 78216, win 24402, options [nop,nop,TS val 68995483 ecr 64253691], length 0
20:21:47.085300 IP 192.168.1.30.35968 > 192.168.1.11.6633: Flags [.], seq 78216:82560, ack 1, win 361, options [nop,nop,TS val 64253692 ecr 68995483], length 4344: OpenFlow
	version unknown (0x6b), type 0x00, length 0, xid 0x00ffffff (corrupt)
20:21:47.085324 IP 192.168.1.30.35968 > 192.168.1.11.6633: Flags [.], seq 82560:86904, ack 1, win 361, options [nop,nop,TS val 64253692 ecr 68995483], length 4344: OpenFlow
	version unknown (0x00), type 0x01, length 0, xid 0x11940001 (corrupt)
20:21:47.085333 IP 192.168.1.30.35968 > 192.168.1.11.6633: Flags [.], seq 86904:91248, ack 1, win 361, options [nop,nop,TS val 64253692 ecr 68995483], length 4344: OpenFlow
	version unknown (0x00), type 0x00, length 65280, xid 0x01c04400 [|openflow]
20:21:47.085354 IP 192.168.1.30.35968 > 192.168.1.11.6633: Flags [.], seq 91248:95592, ack 1, win 361, options [nop,nop,TS val 64253692 ecr 68995483], length 4344: OpenFlow
	version unknown (0x65), type 0x01, length 26115, xid 0x69703604 [|openflow]
20:21:47.085363 IP 192.168.1.30.35968 > 192.168.1.11.6633: Flags [.], seq 95592:99936, ack 1, win 361, options [nop,nop,TS val 64253692 ecr 68995483], length 4344: OpenFlow
	version unknown (0x30), type 0x01, length 12289, xid 0x30013001 [|openflow]
20:21:47.085384 IP 192.168.1.30.35968 > 192.168.1.11.6633: Flags [.], seq 99936:104280, ack 1, win 361, options [nop,nop,TS val 64253692 ecr 68995483], length 4344: OpenFlow
	version unknown (0x30), type 0x01, length 12289, xid 0x30013001 [|openflow]
20:21:47.085393 IP 192.168.1.30.35968 > 192.168.1.11.6633: Flags [.], seq 104280:108624, ack 1, win 361, options [nop,nop,TS val 64253692 ecr 68995483], length 4344: OpenFlow
	version unknown (0x39), type 0x01, length 13569, xid 0x30016101 [|openflow]
20:21:47.085416 IP 192.168.1.30.35968 > 192.168.1.11.6633: Flags [.], seq 108624:112968, ack 1, win 361, options [nop,nop,TS val 64253692 ecr 68995483], length 4344: OpenFlow
	version unknown (0x65), type 0x01, length 26113, xid 0x66016601 [|openflow]
20:21:47.089465 IP 192.168.1.11.6633 > 192.168.1.30.35968: Flags [.], ack 112968, win 24394, options [nop,nop,TS val 68995484 ecr 64253692], length 0
20:21:47.090065 IP 192.168.1.30.35968 > 192.168.1.11.6633: Flags [.], seq 112968:117312, ack 1, win 361, options [nop,nop,TS val 64253694 ecr 68995484], length 4344: OpenFlow
	version unknown (0x62), type 0x01, length 12289, xid 0x38013301 [|openflow]
20:21:47.090090 IP 192.168.1.30.35968 > 192.168.1.11.6633: Flags [.], seq 117312:121656, ack 1, win 361, options [nop,nop,TS val 64253694 ecr 68995484], length 4344: OpenFlow
	version unknown (0x62), type 0x75, length 28276, xid 0x75c03900 [|openflow]
20:21:47.090098 IP 192.168.1.30.35968 > 192.168.1.11.6633: Flags [.], seq 121656:126000, ack 1, win 361, options [nop,nop,TS val 64253694 ecr 68995484], length 4344: OpenFlow
	version unknown (0x6c), type 0x6f, length 25441, xid 0x6c0000ff [|openflow]
20:21:47.090120 IP 192.168.1.30.35968 > 192.168.1.11.6633: Flags [.], seq 126000:130344, ack 1, win 361, options [nop,nop,TS val 64253694 ecr 68995484], length 4344: OpenFlow
	version unknown (0x74), type 0x61, length 29801, xid 0x6f6e045f [|openflow]
20:21:47.090128 IP 192.168.1.30.35968 > 192.168.1.11.6633: Flags [.], seq 130344:134688, ack 1, win 361, options [nop,nop,TS val 64253694 ecr 68995484], length 4344: OpenFlow
	version unknown (0x38), type 0x3a, length 12386, xid 0x5d0c5f77 [|openflow]
20:21:47.090150 IP 192.168.1.30.35968 > 192.168.1.11.6633: Flags [.], seq 134688:139032, ack 1, win 361, options [nop,nop,TS val 64253694 ecr 68995484], length 4344: OpenFlow
	version unknown (0x32), type 0x3a, length 13625, xid 0x3a30613a [|openflow]
20:21:47.090159 IP 192.168.1.30.35968 > 192.168.1.11.6633: Flags [.], seq 139032:143376, ack 1, win 361, options [nop,nop,TS val 64253694 ecr 68995484], length 4344: OpenFlow
	version unknown (0x00), type 0x00, length 6773, xid 0x62756e74 [|openflow]
20:21:47.090181 IP 192.168.1.30.35968 > 192.168.1.11.6633: Flags [.], seq 143376:147720, ack 1, win 361, options [nop,nop,TS val 64253694 ecr 68995484], length 4344: OpenFlow
	version unknown (0xce), type 0x24, length 0, xid 0x00000003 (corrupt)
20:21:47.094218 IP 192.168.1.11.6633 > 192.168.1.30.35968: Flags [.], ack 147720, win 24394, options [nop,nop,TS val 68995485 ecr 64253694], length 0
20:21:47.094723 IP 192.168.1.30.35968 > 192.168.1.11.6633: Flags [.], seq 147720:152064, ack 1, win 361, options [nop,nop,TS val 64253695 ecr 68995485], length 4344: OpenFlow
	version unknown (0x00), type 0x00, length 0, xid 0x00fb14e9 (corrupt)
20:21:47.094732 IP 192.168.1.30.35968 > 192.168.1.11.6633: Flags [.], seq 152064:156408, ack 1, win 361, options [nop,nop,TS val 64253695 ecr 68995485], length 4344: OpenFlow
	version unknown (0x38), type 0x0b, length 65282, xid 0x00000000 [|openflow]
20:21:47.094755 IP 192.168.1.30.35968 > 192.168.1.11.6633: Flags [.], seq 156408:160752, ack 1, win 361, options [nop,nop,TS val 64253695 ecr 68995485], length 4344: OpenFlow
	version unknown (0x00), type 0x00, length 0, xid 0x0000a059 (corrupt)
20:21:47.094764 IP 192.168.1.30.35968 > 192.168.1.11.6633: Flags [.], seq 160752:165096, ack 1, win 361, options [nop,nop,TS val 64253695 ecr 68995485], length 4344: OpenFlow
	version unknown (0x86), type 0xdd, length 24576, xid 0x0000010b [|openflow]
20:21:47.094786 IP 192.168.1.30.35968 > 192.168.1.11.6633: Flags [.], seq 165096:169440, ack 1, win 361, options [nop,nop,TS val 64253695 ecr 68995485], length 4344: OpenFlow
	version unknown (0x33), type 0x33, length 0, xid 0x00fba259 (corrupt)
20:21:47.094795 IP 192.168.1.30.35968 > 192.168.1.11.6633: Flags [.], seq 169440:173784, ack 1, win 361, options [nop,nop,TS val 64253695 ecr 68995485], length 4344: OpenFlow
	version unknown (0x00), type 0x04, length 0, xid 0x00020000 (corrupt)
20:21:47.094818 IP 192.168.1.30.35968 > 192.168.1.11.6633: Flags [.], seq 173784:178128, ack 1, win 361, options [nop,nop,TS val 64253695 ecr 68995485], length 4344: OpenFlow
	version unknown (0x00), type 0x00, length 0, xid 0x03d00001 (corrupt)
20:21:47.094827 IP 192.168.1.30.35968 > 192.168.1.11.6633: Flags [.], seq 178128:182472, ack 1, win 361, options [nop,nop,TS val 64253695 ecr 68995485], length 4344: OpenFlow
	version unknown (0x00), type 0x00, length 65535, xid 0xffff0141 [|openflow]
20:21:47.099038 IP 192.168.1.11.6633 > 192.168.1.30.35968: Flags [.], ack 182472, win 24394, options [nop,nop,TS val 68995486 ecr 64253695], length 0
20:21:47.099267 IP 192.168.1.30.35968 > 192.168.1.11.6633: Flags [.], seq 182472:186816, ack 1, win 361, options [nop,nop,TS val 64253696 ecr 68995486], length 4344: OpenFlow
	version unknown (0x00), type 0x11, length 37888, xid 0x0100040a [|openflow]
20:21:47.099290 IP 192.168.1.30.35968 > 192.168.1.11.6633: Flags [.], seq 186816:191160, ack 1, win 361, options [nop,nop,TS val 64253696 ecr 68995486], length 4344: OpenFlow
	version unknown (0x00), type 0x00, length 2496, xid 0x44c00c00
	version unknown (0x78), type 0x00, length 704, xid 0x44c04400
	version unknown (0x00), type 0x00, length 0, xid 0x00a0590a (corrupt)
20:21:47.099299 IP 192.168.1.30.35968 > 192.168.1.11.6633: Flags [.], seq 191160:195504, ack 1, win 361, options [nop,nop,TS val 64253696 ecr 68995486], length 4344: OpenFlow
	version unknown (0x21), type 0x00, length 256, xid 0x00007800
	version unknown (0x30), type 0x01, length 12289, xid 0x30013001 [|openflow]
20:21:47.099323 IP 192.168.1.30.35968 > 192.168.1.11.6633: Flags [.], seq 195504:199848, ack 1, win 361, options [nop,nop,TS val 64253696 ecr 68995486], length 4344: OpenFlow
	version unknown (0x5f), type 0x36, length 13317, xid 0x4c494e55 [|openflow]
20:21:47.099333 IP 192.168.1.30.35968 > 192.168.1.11.6633: Flags [.], seq 199848:204192, ack 1, win 361, options [nop,nop,TS val 64253696 ecr 68995486], length 4344: OpenFlow
	version unknown (0x00), type 0x01, length 0, xid 0x0078000d (corrupt)
20:21:47.099355 IP 192.168.1.30.35968 > 192.168.1.11.6633: Flags [.], seq 204192:208536, ack 1, win 361, options [nop,nop,TS val 64253696 ecr 68995486], length 4344: OpenFlow
	version unknown (0x00), type 0x00, length 120, xid 0x0002c044
	version unknown (0x86), type 0xdd, length 24576, xid 0x0000010b [|openflow]
20:21:47.099365 IP 192.168.1.30.35968 > 192.168.1.11.6633: Flags [.], seq 208536:212880, ack 1, win 361, options [nop,nop,TS val 64253696 ecr 68995486], length 4344: OpenFlow
	version unknown (0x0a), type 0xff, length 65032, xid 0x380bc051 [|openflow]
20:21:47.099390 IP 192.168.1.30.35968 > 192.168.1.11.6633: Flags [.], seq 212880:217224, ack 1, win 361, options [nop,nop,TS val 64253696 ecr 68995486], length 4344: OpenFlow
	version unknown (0x00), type 0x10, length 65152, xid 0x00000000 [|openflow]
20:21:47.101517 IP 192.168.1.11.6633 > 192.168.1.30.35968: Flags [.], ack 217224, win 24394, options [nop,nop,TS val 68995487 ecr 64253696], length 0
20:21:47.101529 IP 192.168.1.30.35968 > 192.168.1.11.6633: Flags [.], seq 217224:221568, ack 1, win 361, options [nop,nop,TS val 64253697 ecr 68995487], length 4344: OpenFlow
	version unknown (0x00), type 0x01, length 49220, xid 0x001c0001 [|openflow]
20:21:47.101539 IP 192.168.1.30.35968 > 192.168.1.11.6633: Flags [.], seq 221568:225912, ack 1, win 361, options [nop,nop,TS val 64253697 ecr 68995487], length 4344: OpenFlow
	version unknown (0x03), type 0x69, length 28726, xid 0x04617270 [|openflow]
20:21:47.101566 IP 192.168.1.30.35968 > 192.168.1.11.6633: Flags [.], seq 225912:230256, ack 1, win 361, options [nop,nop,TS val 64253697 ecr 68995487], length 4344: OpenFlow
	version 1.0, type invalid (0x30), length 304, xid 0x01300138
	version unknown (0x75), type 0xc0, length 14592, xid 0xff000101 [|openflow]
20:21:47.101577 IP 192.168.1.30.35968 > 192.168.1.11.6633: Flags [.], seq 230256:234600, ack 1, win 361, options [nop,nop,TS val 64253697 ecr 68995487], length 4344: OpenFlow
	version 1.0, type invalid (0x30), length 304, xid 0x01300130
	version unknown (0x6c), type 0x00, length 255, xid 0x00010675
	version unknown (0x00), type 0x00, length 267, xid 0x11fffe80
	version unknown (0x4c), type 0x49, length 20053, xid 0x58c00c00 [|openflow]
20:21:47.101609 IP 192.168.1.30.35968 > 192.168.1.11.6633: Flags [.], seq 234600:238944, ack 1, win 361, options [nop,nop,TS val 64253697 ecr 68995487], length 4344: OpenFlow
	version 1.0, type invalid (0x30), length 353, xid 0x01300130
	version 1.0, type invalid (0x66), length 353, xid 0x01300139
	version 1.0, type invalid (0x38), length 304, xid 0x01650166
	version unknown (0x30), type 0x38, length 14899, xid 0x383a3062 [|openflow]
20:21:47.101619 IP 192.168.1.30.35968 > 192.168.1.11.6633: Flags [.], seq 238944:243288, ack 1, win 361, options [nop,nop,TS val 64253697 ecr 68995487], length 4344: OpenFlow
	version 1.0, type invalid (0x66), length 358, xid 0x01610130
	version unknown (0x30), type 0x01, length 25857, xid 0x66016601 [|openflow]
20:21:47.101643 IP 192.168.1.30.35968 > 192.168.1.11.6633: Flags [.], seq 243288:247632, ack 1, win 361, options [nop,nop,TS val 64253697 ecr 68995487], length 4344: OpenFlow
	version 1.0, type invalid (0x38), length 307, xid 0x01380130
	version unknown (0x3a), type 0x30, length 14394, xid 0x33383a30 [|openflow]
20:21:47.101652 IP 192.168.1.30.35968 > 192.168.1.11.6633: Flags [.], seq 247632:251976, ack 1, win 361, options [nop,nop,TS val 64253697 ecr 68995487], length 4344: OpenFlow
	version unknown (0x74), type 0x75, length 49209, xid 0x00ff0001 [|openflow]
20:21:47.104328 IP 192.168.1.11.6633 > 192.168.1.30.35968: Flags [.], ack 251976, win 24394, options [nop,nop,TS val 68995487 ecr 64253697], length 0
20:21:47.104341 IP 192.168.1.30.35968 > 192.168.1.11.6633: Flags [.], seq 251976:256320, ack 1, win 361, options [nop,nop,TS val 64253697 ecr 68995487], length 4344: OpenFlow
	version unknown (0x61), type 0x6c, length 0, xid 0xff000106 (corrupt)
20:21:47.104350 IP 192.168.1.30.35968 > 192.168.1.11.6633: Flags [.], seq 256320:260664, ack 1, win 361, options [nop,nop,TS val 64253697 ecr 68995487], length 4344: OpenFlow
	version unknown (0x69), type 0x6f, length 28164, xid 0x5f746370 [|openflow]
20:21:47.104375 IP 192.168.1.30.35968 > 192.168.1.11.6633: Flags [.], seq 260664:265008, ack 1, win 361, options [nop,nop,TS val 64253697 ecr 68995487], length 4344: OpenFlow
	version unknown (0x62), type 0x5d, length 3167, xid 0x776f726b
	version unknown (0x00), type 0x33, length 13056, xid 0x0000fba2 [|openflow]
20:21:47.104385 IP 192.168.1.30.35968 > 192.168.1.11.6633: Flags [.], seq 265008:269352, ack 1, win 361, options [nop,nop,TS val 64253697 ecr 68995487], length 4344: OpenFlow
	version unknown (0x39), type 0x3a, length 12385, xid 0x3a30383a [|openflow]
20:21:47.104409 IP 192.168.1.30.35968 > 192.168.1.11.6633: Flags [.], seq 269352:273696, ack 1, win 361, options [nop,nop,TS val 64253697 ecr 68995487], length 4344: OpenFlow
	version unknown (0x75), type 0x62, length 30062, xid 0x7475205b [|openflow]
20:21:47.104419 IP 192.168.1.30.35968 > 192.168.1.11.6633: Flags [.], seq 273696:278040, ack 1, win 361, options [nop,nop,TS val 64253697 ecr 68995487], length 4344: OpenFlow
	version unknown (0x00), type 0x00, length 0, xid 0x03000000 (corrupt)
20:21:47.104445 IP 192.168.1.30.35968 > 192.168.1.11.6633: Flags [.], seq 278040:282384, ack 1, win 361, options [nop,nop,TS val 64253697 ecr 68995487], length 4344: OpenFlow
	version unknown (0x00), type 0x00, length 64276, xid 0xe914e901 [|openflow]
20:21:47.104455 IP 192.168.1.30.35968 > 192.168.1.11.6633: Flags [.], seq 282384:286728, ack 1, win 361, options [nop,nop,TS val 64253697 ecr 68995487], length 4344: OpenFlow
	version unknown (0x02), type 0x00, length 0, xid 0x00000000 (corrupt)
20:21:47.106179 IP 192.168.1.11.6633 > 192.168.1.30.35968: Flags [.], ack 269352, win 24485, options [nop,nop,TS val 68995488 ecr 64253697], length 0
20:21:47.106189 IP 192.168.1.30.35968 > 192.168.1.11.6633: Flags [.], seq 286728:291072, ack 1, win 361, options [nop,nop,TS val 64253698 ecr 68995488], length 4344: OpenFlow
	version unknown (0x00), type 0x00, length 160, xid 0x590afffe
	version 1.0, type invalid (0x30), length 304, xid 0x01300130
	version unknown (0x00), type 0x01, length 1653, xid 0x62756e74
	version unknown (0xff), type 0xff, length 65535, xid 0x01410100 [|openflow]
20:21:47.106213 IP 192.168.1.30.35968 > 192.168.1.11.6633: Flags [.], seq 291072:295416, ack 1, win 361, options [nop,nop,TS val 64253698 ecr 68995488], length 4344: OpenFlow
	version unknown (0x00), type 0x00, length 1, xid 0x0b11fffe (corrupt)
20:21:47.106221 IP 192.168.1.30.35968 > 192.168.1.11.6633: Flags [.], seq 295416:299760, ack 1, win 361, options [nop,nop,TS val 64253698 ecr 68995488], length 4344: OpenFlow
	version unknown (0x00), type 0x00, length 64418, xid 0x590a0838 [|openflow]
20:21:47.106244 IP 192.168.1.30.35968 > 192.168.1.11.6633: Flags [.], seq 299760:304104, ack 1, win 361, options [nop,nop,TS val 64253698 ecr 68995488], length 4344: OpenFlow
	version unknown (0x00), type 0x00, length 512, xid 0x00000000
	version unknown (0xff), type 0x00, length 257, xid 0x62013001
	version unknown (0xfe), type 0x08, length 14347, xid 0xff020000 [|openflow]
20:21:47.106282 IP 192.168.1.11.6633 > 192.168.1.30.35968: Flags [.], ack 286728, win 24394, options [nop,nop,TS val 68995488 ecr 64253697], length 0
20:21:47.106290 IP 192.168.1.30.35968 > 192.168.1.11.6633: Flags [.], seq 304104:308448, ack 1, win 361, options [nop,nop,TS val 64253698 ecr 68995488], length 4344: OpenFlow
	version unknown (0x00), type 0x03, length 53248, xid 0x01000c80 [|openflow]
20:21:47.106298 IP 192.168.1.30.35968 > 192.168.1.11.6633: Flags [.], seq 308448:312792, ack 1, win 361, options [nop,nop,TS val 64253698 ecr 68995488], length 4344: OpenFlow
	version unknown (0xff), type 0xff, length 65281, xid 0x4101002b [|openflow]
20:21:47.106320 IP 192.168.1.30.35968 > 192.168.1.11.6633: Flags [.], seq 312792:317136, ack 1, win 361, options [nop,nop,TS val 64253698 ecr 68995488], length 4344: OpenFlow
	version unknown (0x00), type 0x01, length 4, xid 0x0a016b00 (corrupt)
20:21:47.106329 IP 192.168.1.30.35968 > 192.168.1.11.6633: Flags [.], seq 317136:321480, ack 1, win 361, options [nop,nop,TS val 64253698 ecr 68995488], length 4344: OpenFlow
	version unknown (0xc0), type 0x44, length 49164, xid 0x00100001 [|openflow]
20:21:47.107370 IP 192.168.1.11.6633 > 192.168.1.30.35968: Flags [.], ack 321480, win 24394, options [nop,nop,TS val 68995489 ecr 64253698], length 0
20:21:47.108716 IP 192.168.1.30.35968 > 192.168.1.11.6633: Flags [.], seq 321480:325824, ack 1, win 361, options [nop,nop,TS val 64253698 ecr 68995489], length 4344: OpenFlow
	version unknown (0x00), type 0x00, length 120, xid 0x00080000
	version unknown (0x00), type 0x00, length 64276, xid 0xe914e901 [|openflow]
20:21:47.108803 IP 192.168.1.30.35968 > 192.168.1.11.6633: Flags [.], seq 325824:330168, ack 1, win 361, options [nop,nop,TS val 64253698 ecr 68995489], length 4344: OpenFlow
	version unknown (0x05), type 0x4c, length 18766, xid 0x5558c00c [|openflow]
20:21:47.108991 IP 192.168.1.30.35968 > 192.168.1.11.6633: Flags [.], seq 330168:334512, ack 1, win 361, options [nop,nop,TS val 64253698 ecr 68995489], length 4344: OpenFlow
	version unknown (0x00), type 0x00, length 30720, xid 0x0d065838 [|openflow]
20:21:47.109003 IP 192.168.1.30.35968 > 192.168.1.11.6633: Flags [.], seq 334512:338856, ack 1, win 361, options [nop,nop,TS val 64253698 ecr 68995489], length 4344: OpenFlow
	version unknown (0x78), type 0x00, length 704, xid 0x44c04400
	version unknown (0x00), type 0x00, length 0, xid 0x00a0590a (corrupt)
20:21:47.109064 IP 192.168.1.30.35968 > 192.168.1.11.6633: Flags [.], seq 338856:343200, ack 1, win 361, options [nop,nop,TS val 64253698 ecr 68995489], length 4344: OpenFlow
	version unknown (0x08), type 0x38, length 3008, xid 0x51000c00
	version unknown (0x00), type 0x00, length 1024, xid 0x00000200
	version unknown (0x4e), type 0x55, length 22720, xid 0x0c002100 [|openflow]
20:21:47.109368 IP 192.168.1.11.6633 > 192.168.1.30.35968: Flags [.], ack 324376, win 24560, options [nop,nop,TS val 68995489 ecr 64253698], length 0
20:21:47.109380 IP 192.168.1.30.35968 > 192.168.1.11.6633: Flags [.], seq 343200:347544, ack 1, win 361, options [nop,nop,TS val 64253698 ecr 68995489], length 4344: OpenFlow
	version unknown (0x80), type 0x00, length 0, xid 0x000000a0 (corrupt)
20:21:47.109380 IP 192.168.1.11.6633 > 192.168.1.30.35968: Flags [.], ack 325824, win 24568, options [nop,nop,TS val 68995489 ecr 64253698], length 0
20:21:47.109514 IP 192.168.1.30.35968 > 192.168.1.11.6633: Flags [.], seq 347544:351888, ack 1, win 361, options [nop,nop,TS val 64253698 ecr 68995489], length 4344: OpenFlow
	version unknown (0x44), type 0x00, length 7168, xid 0x01000000 [|openflow]

