11:37:52.377474 IP 192.168.1.30.35032 > 192.168.1.10.6633: Flags [P.], seq 3114778902:3114778910, ack 2066979408, win 58, options [nop,nop,TS val 77995016 ecr 79354896], length 8: OpenFlow
	version unknown (0x04), type 0x02, length 8, xid 0x00000000
11:37:52.377874 IP 192.168.1.10.6633 > 192.168.1.30.35032: Flags [.], ack 8, win 269, options [nop,nop,TS val 79355866 ecr 77995016], length 0
11:37:52.378381 IP 192.168.1.10.6633 > 192.168.1.30.35032: Flags [P.], seq 1:9, ack 8, win 269, options [nop,nop,TS val 79355866 ecr 77995016], length 8: OpenFlow
	version unknown (0x04), type 0x03, length 8, xid 0x00000000

