20:23:45.224870 IP 192.168.1.11.6633 > 192.168.1.30.36129: Flags [.], ack 1673239588, win 14518, options [nop,nop,TS val 69025010 ecr 64283148], length 0
20:23:45.224885 IP 192.168.1.11.6633 > 192.168.1.30.36129: Flags [.], ack 364, win 14518, options [nop,nop,TS val 69025010 ecr 64283148], length 0
20:23:45.224889 IP 192.168.1.11.6633 > 192.168.1.30.36129: Flags [.], ack 727, win 14518, options [nop,nop,TS val 69025010 ecr 64283148], length 0
20:23:45.224943 IP 192.168.1.11.6633 > 192.168.1.30.36129: Flags [.], ack 1090, win 14518, options [nop,nop,TS val 69025010 ecr 64283148], length 0
20:23:45.226299 IP 192.168.1.11.6633 > 192.168.1.30.36129: Flags [.], ack 1453, win 14518, options [nop,nop,TS val 69025010 ecr 64283148], length 0
20:23:45.226305 IP 192.168.1.11.6633 > 192.168.1.30.36129: Flags [.], ack 1816, win 14518, options [nop,nop,TS val 69025010 ecr 64283148], length 0
20:23:45.226748 IP 192.168.1.11.6633 > 192.168.1.30.36129: Flags [.], ack 2179, win 14518, options [nop,nop,TS val 69025010 ecr 64283148], length 0
20:23:45.226755 IP 192.168.1.11.6633 > 192.168.1.30.36129: Flags [.], ack 2542, win 14518, options [nop,nop,TS val 69025010 ecr 64283148], length 0
20:23:45.226759 IP 192.168.1.11.6633 > 192.168.1.30.36129: Flags [.], ack 2905, win 14518, options [nop,nop,TS val 69025010 ecr 64283148], length 0
20:23:45.226763 IP 192.168.1.11.6633 > 192.168.1.30.36129: Flags [.], ack 3268, win 14518, options [nop,nop,TS val 69025010 ecr 64283148], length 0
20:23:45.226766 IP 192.168.1.11.6633 > 192.168.1.30.36129: Flags [.], ack 3631, win 14518, options [nop,nop,TS val 69025010 ecr 64283148], length 0
20:23:45.226769 IP 192.168.1.11.6633 > 192.168.1.30.36129: Flags [.], ack 3994, win 14518, options [nop,nop,TS val 69025010 ecr 64283148], length 0
20:23:45.226773 IP 192.168.1.11.6633 > 192.168.1.30.36129: Flags [.], ack 4357, win 14518, options [nop,nop,TS val 69025010 ecr 64283148], length 0
20:23:45.226776 IP 192.168.1.11.6633 > 192.168.1.30.36129: Flags [.], ack 4720, win 14518, options [nop,nop,TS val 69025010 ecr 64283148], length 0
20:23:45.226779 IP 192.168.1.11.6633 > 192.168.1.30.36129: Flags [.], ack 5083, win 14518, options [nop,nop,TS val 69025010 ecr 64283148], length 0
20:23:45.228286 IP 192.168.1.30.36129 > 192.168.1.11.6633: Flags [.], seq 6531:7979, ack 0, win 361, options [nop,nop,TS val 64283227 ecr 69025010], length 1448: OpenFlow
	version unknown (0x94), type 0x00, length 256, xid 0x040a016b
	version unknown (0x36), type 0x04, length 24946, xid 0x70610000 [|openflow]
20:23:45.228304 IP 192.168.1.30.36129 > 192.168.1.11.6633: Flags [.], seq 7979:10875, ack 0, win 361, options [nop,nop,TS val 64283227 ecr 69025010], length 2896: OpenFlow
	version 1.0, type HELLO, length 17, xid 0x94000100
	version unknown (0xff), type 0xff, length 65281, xid 0x4101002b [|openflow]
20:23:45.228325 IP 192.168.1.30.36129 > 192.168.1.11.6633: Flags [.], seq 10875:13771, ack 0, win 361, options [nop,nop,TS val 64283227 ecr 69025010], length 2896: OpenFlow
	version unknown (0x09), type 0xc0, length 17600, xid 0x0c001000 [|openflow]
20:23:45.228345 IP 192.168.1.30.36129 > 192.168.1.11.6633: Flags [.], seq 13771:16667, ack 0, win 361, options [nop,nop,TS val 64283227 ecr 69025010], length 2896: OpenFlow
	version unknown (0x78), type 0x00, length 2048, xid 0x00000000
	version 1.0, type invalid (0x61), length 308, xid 0x01380162
	version unknown (0x6f), type 0x6e, length 1119, xid 0x74637005 [|openflow]
20:23:45.228364 IP 192.168.1.30.36129 > 192.168.1.11.6633: Flags [.], seq 16667:19563, ack 0, win 361, options [nop,nop,TS val 64283227 ecr 69025010], length 2896: OpenFlow
	version unknown (0x0c), type 0x00, length 8448, xid 0x01000000 [|openflow]
20:23:45.228384 IP 192.168.1.30.36129 > 192.168.1.11.6633: Flags [.], seq 19563:22459, ack 0, win 361, options [nop,nop,TS val 64283227 ecr 69025010], length 2896: OpenFlow
	version unknown (0x34), type 0x05, length 19529, xid 0x4e5558c0 [|openflow]
20:23:45.228403 IP 192.168.1.30.36129 > 192.168.1.11.6633: Flags [.], seq 22459:25355, ack 0, win 361, options [nop,nop,TS val 64283227 ecr 69025010], length 2896: OpenFlow
	version unknown (0x00), type 0x0d, length 1624, xid 0x38365f36
	version unknown (0x5b), type 0x62, length 24890, xid 0x34613a61 [|openflow]
20:23:45.263814 IP 192.168.1.11.6633 > 192.168.1.30.36129: Flags [.], ack 5083, win 14518, options [nop,nop,TS val 69025026 ecr 64283148,nop,nop,sack 1 {6531:25355}], length 0
20:23:45.265915 IP 192.168.1.30.36129 > 192.168.1.11.6633: Flags [.], seq 5083:6531, ack 0, win 361, options [nop,nop,TS val 64283237 ecr 69025026], length 1448: OpenFlow
	version unknown (0x04), type 0x0a, length 363, xid 0x00000000
	version unknown (0x04), type 0x0a, length 363, xid 0x00000000
	version unknown (0x04), type 0x0a, length 363, xid 0x00000000
	version unknown (0x04), type 0x0a, length 363, xid 0x00000000 [|openflow]
20:23:45.266212 IP 192.168.1.30.36129 > 192.168.1.11.6633: Flags [.], seq 25355:28251, ack 0, win 361, options [nop,nop,TS val 64283237 ecr 69025026], length 2896: OpenFlow
	version unknown (0x00), type 0x0d, length 1, xid 0x00000078 (corrupt)
20:23:45.266235 IP 192.168.1.30.36129 > 192.168.1.11.6633: Flags [.], seq 28251:31147, ack 0, win 361, options [nop,nop,TS val 64283237 ecr 69025026], length 2896: OpenFlow
	version unknown (0x00), type 0x78, length 2, xid 0xc044c044 (corrupt)
20:23:45.266430 IP 192.168.1.30.36129 > 192.168.1.11.6633: Flags [.], seq 31147:34043, ack 0, win 361, options [nop,nop,TS val 64283237 ecr 69025026], length 2896: OpenFlow
	version unknown (0xc0), type 0x51, length 12, xid 0x00010000
	version unknown (0xc0), type 0x44, length 49220, xid 0x000d0001 [|openflow]
20:23:45.266440 IP 192.168.1.11.6633 > 192.168.1.30.36129: Flags [.], ack 25355, win 14518, options [nop,nop,TS val 69025028 ecr 64283237], length 0
20:23:45.266449 IP 192.168.1.30.36129 > 192.168.1.11.6633: Flags [.], seq 34043:36939, ack 0, win 361, options [nop,nop,TS val 64283237 ecr 69025026], length 2896: OpenFlow
	version unknown (0x33), type 0x64, length 14949, xid 0x313a3332 [|openflow]
20:23:45.266476 IP 192.168.1.11.6633 > 192.168.1.30.36129: Flags [.], ack 31147, win 14518, options [nop,nop,TS val 69025028 ecr 64283237], length 0
20:23:45.266645 IP 192.168.1.30.36129 > 192.168.1.11.6633: Flags [.], seq 36939:38387, ack 0, win 361, options [nop,nop,TS val 64283237 ecr 69025026], length 1448: OpenFlow
	version unknown (0x61), type 0x3a, length 13409, xid 0x3a61373a [|openflow]
20:23:45.266856 IP 192.168.1.11.6633 > 192.168.1.30.36129: Flags [.], ack 36939, win 14518, options [nop,nop,TS val 69025029 ecr 64283237], length 0
20:23:45.267063 IP 192.168.1.11.6633 > 192.168.1.30.36129: Flags [.], ack 38387, win 14518, options [nop,nop,TS val 69025029 ecr 64283237], length 0
20:23:45.276040 IP 192.168.1.30.36129 > 192.168.1.11.6633: Flags [.], seq 38387:39835, ack 0, win 361, options [nop,nop,TS val 64283237 ecr 69025028], length 1448: OpenFlow
	version unknown (0x75), type 0x20, length 23394, xid 0x613a3461 [|openflow]
20:23:45.276069 IP 192.168.1.30.36129 > 192.168.1.11.6633: Flags [.], seq 39835:42731, ack 0, win 361, options [nop,nop,TS val 64283237 ecr 69025028], length 2896: OpenFlow
	version unknown (0x62), type 0x75, length 28276, xid 0x75205b62 [|openflow]
20:23:45.276298 IP 192.168.1.30.36129 > 192.168.1.11.6633: Flags [.], seq 42731:45627, ack 0, win 361, options [nop,nop,TS val 64283237 ecr 69025028], length 2896: OpenFlow
	version unknown (0x00), type 0x00, length 5, xid 0x00001a75 (corrupt)
20:23:45.276326 IP 192.168.1.30.36129 > 192.168.1.11.6633: Flags [.], seq 45627:48523, ack 0, win 361, options [nop,nop,TS val 64283237 ecr 69025029], length 2896: OpenFlow
	version unknown (0xb9), type 0xef, length 0, xid 0x00000003 (corrupt)
20:23:45.276493 IP 192.168.1.30.36129 > 192.168.1.11.6633: Flags [.], seq 48523:51419, ack 0, win 361, options [nop,nop,TS val 64283237 ecr 69025029], length 2896: OpenFlow
	version unknown (0x00), type 0xfb, length 5353, xid 0x14e9010b [|openflow]
20:23:45.276520 IP 192.168.1.30.36129 > 192.168.1.11.6633: Flags [.], seq 51419:54315, ack 0, win 361, options [nop,nop,TS val 64283237 ecr 69025029], length 2896: OpenFlow
	version unknown (0x00), type 0x00, length 0, xid 0x00000000 (corrupt)
20:23:45.278072 IP 192.168.1.11.6633 > 192.168.1.30.36129: Flags [.], ack 39835, win 14518, options [nop,nop,TS val 69025031 ecr 64283237], length 0
20:23:45.278105 IP 192.168.1.11.6633 > 192.168.1.30.36129: Flags [.], ack 45627, win 14518, options [nop,nop,TS val 69025031 ecr 64283237], length 0
20:23:45.278284 IP 192.168.1.11.6633 > 192.168.1.30.36129: Flags [.], ack 51419, win 14518, options [nop,nop,TS val 69025031 ecr 64283237], length 0
20:23:45.278428 IP 192.168.1.11.6633 > 192.168.1.30.36129: Flags [.], ack 54315, win 14518, options [nop,nop,TS val 69025031 ecr 64283237], length 0
20:23:45.284587 IP 192.168.1.30.36129 > 192.168.1.11.6633: Flags [.], seq 54315:57211, ack 0, win 361, options [nop,nop,TS val 64283237 ecr 69025031], length 2896: OpenFlow
	version unknown (0xe1), type 0x32, length 65282, xid 0x00000000 [|openflow]
20:23:45.284657 IP 192.168.1.30.36129 > 192.168.1.11.6633: Flags [.], seq 57211:60107, ack 0, win 361, options [nop,nop,TS val 64283237 ecr 69025031], length 2896: OpenFlow
	version unknown (0x00), type 0x00, length 47178, xid 0xa7fffe3d [|openflow]
20:23:45.284680 IP 192.168.1.30.36129 > 192.168.1.11.6633: Flags [.], seq 60107:63003, ack 0, win 361, options [nop,nop,TS val 64283237 ecr 69025031], length 2896: OpenFlow
	version unknown (0x08), type 0x00, length 0, xid 0x000009c0 (corrupt)
20:23:45.284814 IP 192.168.1.30.36129 > 192.168.1.11.6633: Flags [.], seq 63003:65899, ack 0, win 361, options [nop,nop,TS val 64283237 ecr 69025031], length 2896: OpenFlow
	version unknown (0x21), type 0x00, length 256, xid 0x00007800
	version unknown (0x30), type 0x01, length 12289, xid 0x30013001 [|openflow]
20:23:45.284840 IP 192.168.1.30.36129 > 192.168.1.11.6633: Flags [.], seq 65899:68795, ack 0, win 361, options [nop,nop,TS val 64283237 ecr 69025031], length 2896: OpenFlow
	version unknown (0x4c), type 0x49, length 20053, xid 0x58c00c00 [|openflow]
20:23:45.284997 IP 192.168.1.30.36129 > 192.168.1.11.6633: Flags [.], seq 68795:71691, ack 0, win 361, options [nop,nop,TS val 64283237 ecr 69025031], length 2896: OpenFlow
	version unknown (0x06), type 0x58, length 14390, xid 0x5f363405 [|openflow]
20:23:45.288222 IP 192.168.1.11.6633 > 192.168.1.30.36129: Flags [.], ack 60107, win 14518, options [nop,nop,TS val 69025033 ecr 64283237], length 0
20:23:45.288228 IP 192.168.1.11.6633 > 192.168.1.30.36129: Flags [.], ack 65899, win 14518, options [nop,nop,TS val 69025033 ecr 64283237], length 0
20:23:45.288238 IP 192.168.1.11.6633 > 192.168.1.30.36129: Flags [.], ack 71691, win 14518, options [nop,nop,TS val 69025033 ecr 64283237], length 0
20:23:45.290728 IP 192.168.1.30.36129 > 192.168.1.11.6633: Flags [.], seq 71691:74587, ack 0, win 361, options [nop,nop,TS val 64283237 ecr 69025033], length 2896: OpenFlow
	version unknown (0x00), type 0x01, length 0, xid 0x0078000d (corrupt)
20:23:45.290744 IP 192.168.1.30.36129 > 192.168.1.11.6633: Flags [.], seq 74587:77483, ack 0, win 361, options [nop,nop,TS val 64283237 ecr 69025033], length 2896: OpenFlow
	version unknown (0x00), type 0x02, length 49220, xid 0xc044000d [|openflow]
20:23:45.290889 IP 192.168.1.30.36129 > 192.168.1.11.6633: Flags [.], seq 77483:80379, ack 0, win 361, options [nop,nop,TS val 64283237 ecr 69025033], length 2896: OpenFlow
	version unknown (0x00), type 0x0c, length 1, xid 0x00000078 (corrupt)
20:23:45.290901 IP 192.168.1.30.36129 > 192.168.1.11.6633: Flags [.], seq 80379:83275, ack 0, win 361, options [nop,nop,TS val 64283237 ecr 69025033], length 2896: OpenFlow
	version unknown (0xa7), type 0xff, length 65085, xid 0xe132c051 [|openflow]
20:23:45.291046 IP 192.168.1.30.36129 > 192.168.1.11.6633: Flags [.], seq 83275:86171, ack 0, win 361, options [nop,nop,TS val 64283237 ecr 69025033], length 2896: OpenFlow
	version unknown (0x00), type 0x00, length 0, xid 0x0000b84a (corrupt)
20:23:45.291058 IP 192.168.1.30.36129 > 192.168.1.11.6633: Flags [.], seq 86171:89067, ack 0, win 361, options [nop,nop,TS val 64283237 ecr 69025033], length 2896: OpenFlow
	version unknown (0x00), type 0x00, length 120, xid 0x0010fe80
	version unknown (0x00), type 0x0c, length 32768, xid 0x00040000 [|openflow]
20:23:45.291468 IP 192.168.1.11.6633 > 192.168.1.30.36129: Flags [.], ack 77483, win 14518, options [nop,nop,TS val 69025035 ecr 64283237], length 0
20:23:45.291629 IP 192.168.1.11.6633 > 192.168.1.30.36129: Flags [.], ack 83275, win 14518, options [nop,nop,TS val 69025035 ecr 64283237], length 0
20:23:45.291789 IP 192.168.1.11.6633 > 192.168.1.30.36129: Flags [.], ack 89067, win 14518, options [nop,nop,TS val 69025035 ecr 64283237], length 0
20:23:45.296721 IP 192.168.1.30.36129 > 192.168.1.11.6633: Flags [.], seq 89067:91963, ack 0, win 361, options [nop,nop,TS val 64283237 ecr 69025035], length 2896: OpenFlow
	version unknown (0x74), type 0x75, length 49209, xid 0x00ff0001 [|openflow]
20:23:45.296739 IP 192.168.1.30.36129 > 192.168.1.11.6633: Flags [.], seq 91963:94859, ack 0, win 361, options [nop,nop,TS val 64283237 ecr 69025035], length 2896: OpenFlow
	version unknown (0xff), type 0x00, length 262, xid 0x7562756e
	version unknown (0x00), type 0x00, length 0, xid 0xb84aa7ff (corrupt)
20:23:45.296890 IP 192.168.1.30.36129 > 192.168.1.11.6633: Flags [.], seq 94859:97755, ack 0, win 361, options [nop,nop,TS val 64283237 ecr 69025035], length 2896: OpenFlow
	version unknown (0x05), type 0x6c, length 28515, xid 0x616c0000 [|openflow]
20:23:45.296901 IP 192.168.1.30.36129 > 192.168.1.11.6633: Flags [.], seq 97755:100651, ack 0, win 361, options [nop,nop,TS val 64283237 ecr 69025035], length 2896: OpenFlow
	version unknown (0x69), type 0x6f, length 28164, xid 0x5f746370 [|openflow]
20:23:45.297049 IP 192.168.1.30.36129 > 192.168.1.11.6633: Flags [.], seq 100651:103547, ack 0, win 361, options [nop,nop,TS val 64283237 ecr 69025035], length 2896: OpenFlow
	version unknown (0x77), type 0x6f, length 29291, xid 0x73746174 [|openflow]
20:23:45.297065 IP 192.168.1.30.36129 > 192.168.1.11.6633: Flags [.], seq 103547:106443, ack 0, win 361, options [nop,nop,TS val 64283237 ecr 69025035], length 2896: OpenFlow
	version unknown (0x65), type 0x31, length 14899, xid 0x325d0c5f [|openflow]
20:23:45.297284 IP 192.168.1.11.6633 > 192.168.1.30.36129: Flags [.], ack 94859, win 14518, options [nop,nop,TS val 69025036 ecr 64283237], length 0
20:23:45.300771 IP 192.168.1.11.6633 > 192.168.1.30.36129: Flags [.], ack 100651, win 14518, options [nop,nop,TS val 69025036 ecr 64283237], length 0
20:23:45.302707 IP 192.168.1.30.36129 > 192.168.1.11.6633: Flags [.], seq 106443:109339, ack 0, win 361, options [nop,nop,TS val 64283237 ecr 69025036], length 2896: OpenFlow
	version unknown (0x61), type 0x3a, length 24887, xid 0x3a33643a [|openflow]
20:23:45.302736 IP 192.168.1.30.36129 > 192.168.1.11.6633: Flags [.], seq 109339:112235, ack 0, win 361, options [nop,nop,TS val 64283237 ecr 69025036], length 2896: OpenFlow
	version unknown (0x74), type 0x75, length 8283, xid 0x62613a34 [|openflow]
20:23:45.302921 IP 192.168.1.30.36129 > 192.168.1.11.6633: Flags [.], seq 112235:115131, ack 0, win 361, options [nop,nop,TS val 64283237 ecr 69025036], length 2896: OpenFlow
	version unknown (0x05), type 0x00, length 26, xid 0x7562756e
	version unknown (0x3a), type 0x33, length 12893, xid 0x0c5f776f [|openflow]
20:23:45.302952 IP 192.168.1.30.36129 > 192.168.1.11.6633: Flags [.], seq 115131:118027, ack 0, win 361, options [nop,nop,TS val 64283237 ecr 69025036], length 2896: OpenFlow
	version unknown (0x00), type 0x00, length 0, xid 0x03000000 (corrupt)
20:23:45.303080 IP 192.168.1.11.6633 > 192.168.1.30.36129: Flags [.], ack 106443, win 14518, options [nop,nop,TS val 69025036 ecr 64283237], length 0
20:23:45.303092 IP 192.168.1.30.36129 > 192.168.1.11.6633: Flags [.], seq 118027:120923, ack 0, win 361, options [nop,nop,TS val 64283237 ecr 69025036], length 2896: OpenFlow
	version unknown (0xe9), type 0x14, length 59649, xid 0x0bb9ef00 [|openflow]
20:23:45.303116 IP 192.168.1.30.36129 > 192.168.1.11.6633: Flags [.], seq 120923:123819, ack 0, win 361, options [nop,nop,TS val 64283237 ecr 69025036], length 2896: OpenFlow
	version unknown (0x00), type 0x00, length 0, xid 0x0000fb14 (corrupt)
20:23:45.311141 IP 192.168.1.11.6633 > 192.168.1.30.36129: Flags [.], ack 109339, win 14518, options [nop,nop,TS val 69025038 ecr 64283237], length 0
20:23:45.311355 IP 192.168.1.11.6633 > 192.168.1.30.36129: Flags [.], ack 115131, win 14518, options [nop,nop,TS val 69025038 ecr 64283237], length 0
20:23:45.311592 IP 192.168.1.11.6633 > 192.168.1.30.36129: Flags [.], ack 120923, win 14518, options [nop,nop,TS val 69025038 ecr 64283237], length 0
20:23:45.311752 IP 192.168.1.11.6633 > 192.168.1.30.36129: Flags [.], ack 123819, win 14518, options [nop,nop,TS val 69025038 ecr 64283237], length 0
20:23:45.314237 IP 192.168.1.30.36129 > 192.168.1.11.6633: Flags [.], seq 123819:126715, ack 0, win 361, options [nop,nop,TS val 64283249 ecr 69025038], length 2896: OpenFlow
	version unknown (0x02), type 0x00, length 0, xid 0x00000000 (corrupt)
20:23:45.314262 IP 192.168.1.30.36129 > 192.168.1.11.6633: Flags [.], seq 126715:129611, ack 0, win 361, options [nop,nop,TS val 64283249 ecr 69025038], length 2896: OpenFlow
	version unknown (0x4a), type 0xa7, length 65534, xid 0x3de132ff [|openflow]
20:23:45.314283 IP 192.168.1.30.36129 > 192.168.1.11.6633: Flags [.], seq 129611:132507, ack 0, win 361, options [nop,nop,TS val 64283249 ecr 69025038], length 2896: OpenFlow
	version unknown (0x80), type 0x00, length 0, xid 0x000000b8 (corrupt)
20:23:45.314292 IP 192.168.1.30.36129 > 192.168.1.11.6633: Flags [.], seq 132507:135403, ack 0, win 361, options [nop,nop,TS val 64283249 ecr 69025038], length 2896: OpenFlow
	version unknown (0x00), type 0x00, length 1, xid 0x0b11fffe (corrupt)
20:23:45.314313 IP 192.168.1.30.36129 > 192.168.1.11.6633: Flags [.], seq 135403:138299, ack 0, win 361, options [nop,nop,TS val 64283249 ecr 69025038], length 2896: OpenFlow
	version unknown (0x4a), type 0xa7, length 15841, xid 0x3286dd60 [|openflow]
20:23:45.314322 IP 192.168.1.30.36129 > 192.168.1.11.6633: Flags [.], seq 138299:141195, ack 0, win 361, options [nop,nop,TS val 64283249 ecr 69025038], length 2896: OpenFlow
	version unknown (0x00), type 0x33, length 13056, xid 0x0000fbba [|openflow]
20:23:45.323683 IP 192.168.1.11.6633 > 192.168.1.30.36129: Flags [.], ack 141195, win 14518, options [nop,nop,TS val 69025043 ecr 64283249], length 0
20:23:45.323692 IP 192.168.1.30.36129 > 192.168.1.11.6633: Flags [.], seq 141195:144091, ack 0, win 361, options [nop,nop,TS val 64283252 ecr 69025043], length 2896: OpenFlow
	version unknown (0x00), type 0x00, length 512, xid 0x00000000
	version unknown (0xff), type 0x00, length 257, xid 0x32013301
	version unknown (0xfe), type 0x3d, length 57650, xid 0xff020000 [|openflow]
20:23:45.323701 IP 192.168.1.30.36129 > 192.168.1.11.6633: Flags [.], seq 144091:146987, ack 0, win 361, options [nop,nop,TS val 64283252 ecr 69025043], length 2896: OpenFlow
	version 1.0, type HELLO, length 3200, xid 0x00000400 [|openflow]
20:23:45.323726 IP 192.168.1.30.36129 > 192.168.1.11.6633: Flags [.], seq 146987:149883, ack 0, win 361, options [nop,nop,TS val 64283252 ecr 69025043], length 2896: OpenFlow
	version unknown (0x00), type 0x00, length 0, xid 0x00038100 (corrupt)
20:23:45.323736 IP 192.168.1.30.36129 > 192.168.1.11.6633: Flags [.], seq 149883:152779, ack 0, win 361, options [nop,nop,TS val 64283252 ecr 69025043], length 2896: OpenFlow
	version unknown (0xff), type 0xff, length 65281, xid 0x4101002b [|openflow]
20:23:45.323768 IP 192.168.1.30.36129 > 192.168.1.11.6633: Flags [.], seq 152779:155675, ack 0, win 361, options [nop,nop,TS val 64283252 ecr 69025043], length 2896: OpenFlow
	version unknown (0x0a), type 0x01, length 27392, xid 0x000000ff [|openflow]
20:23:45.323778 IP 192.168.1.30.36129 > 192.168.1.11.6633: Flags [.], seq 155675:158571, ack 0, win 361, options [nop,nop,TS val 64283252 ecr 69025043], length 2896: OpenFlow
	version unknown (0x00), type 0x00, length 4500, xid 0x00010004 [|openflow]
20:23:45.325463 IP 192.168.1.11.6633 > 192.168.1.30.36129: Flags [.], ack 158571, win 14518, options [nop,nop,TS val 69025043 ecr 64283252], length 0
20:23:45.325469 IP 192.168.1.30.36129 > 192.168.1.11.6633: Flags [.], seq 158571:161467, ack 0, win 361, options [nop,nop,TS val 64283253 ecr 69025043], length 2896: OpenFlow
	version unknown (0xc0), type 0x44, length 49164, xid 0x00100001 [|openflow]
20:23:45.325492 IP 192.168.1.30.36129 > 192.168.1.11.6633: Flags [.], seq 161467:164363, ack 0, win 361, options [nop,nop,TS val 64283253 ecr 69025043], length 2896: OpenFlow
	version unknown (0x00), type 0x08, length 0, xid 0x00000009 (corrupt)
20:23:45.325501 IP 192.168.1.30.36129 > 192.168.1.11.6633: Flags [.], seq 164363:167259, ack 0, win 361, options [nop,nop,TS val 64283253 ecr 69025043], length 2896: OpenFlow
	version unknown (0x00), type 0x21, length 1, xid 0x00000078 (corrupt)
20:23:45.325524 IP 192.168.1.30.36129 > 192.168.1.11.6633: Flags [.], seq 167259:170155, ack 0, win 361, options [nop,nop,TS val 64283253 ecr 69025043], length 2896: OpenFlow
	version unknown (0x05), type 0x4c, length 18766, xid 0x5558c00c [|openflow]
20:23:45.325533 IP 192.168.1.30.36129 > 192.168.1.11.6633: Flags [.], seq 170155:173051, ack 0, win 361, options [nop,nop,TS val 64283253 ecr 69025043], length 2896: OpenFlow
	version unknown (0x00), type 0x00, length 65280, xid 0x01067562 [|openflow]
20:23:45.325554 IP 192.168.1.30.36129 > 192.168.1.11.6633: Flags [.], seq 173051:175947, ack 0, win 361, options [nop,nop,TS val 64283253 ecr 69025043], length 2896: OpenFlow
	version unknown (0x63), type 0x70, length 1388, xid 0x6f63616c
	version unknown (0xfb), type 0x14, length 59668, xid 0xe9010bb9 [|openflow]
20:23:45.328911 IP 192.168.1.11.6633 > 192.168.1.30.36129: Flags [.], ack 175947, win 14518, options [nop,nop,TS val 69025043 ecr 64283253], length 0
20:23:45.328975 IP 192.168.1.30.36129 > 192.168.1.11.6633: Flags [.], seq 175947:178843, ack 0, win 361, options [nop,nop,TS val 64283253 ecr 69025043], length 2896: OpenFlow
	version unknown (0x61), type 0x74, length 26991, xid 0x6e045f74 [|openflow]
20:23:45.328990 IP 192.168.1.30.36129 > 192.168.1.11.6633: Flags [.], seq 178843:181739, ack 0, win 361, options [nop,nop,TS val 64283253 ecr 69025043], length 2896: OpenFlow
	version unknown (0x0c), type 0x5f, length 30575, xid 0x726b7374 [|openflow]
20:23:45.329077 IP 192.168.1.30.36129 > 192.168.1.11.6633: Flags [.], seq 181739:184635, ack 0, win 361, options [nop,nop,TS val 64283253 ecr 69025043], length 2896: OpenFlow
	version unknown (0x64), type 0x3a, length 25905, xid 0x3a33325d [|openflow]
20:23:45.329088 IP 192.168.1.30.36129 > 192.168.1.11.6633: Flags [.], seq 184635:187531, ack 0, win 361, options [nop,nop,TS val 64283253 ecr 69025043], length 2896: OpenFlow
	version unknown (0x3a), type 0x34, length 24890, xid 0x61373a33 [|openflow]
20:23:45.329110 IP 192.168.1.30.36129 > 192.168.1.11.6633: Flags [.], seq 187531:190427, ack 0, win 361, options [nop,nop,TS val 64283253 ecr 69025043], length 2896: OpenFlow
	version unknown (0x75), type 0x6e, length 29813, xid 0x205b6261 [|openflow]
20:23:45.329119 IP 192.168.1.30.36129 > 192.168.1.11.6633: Flags [.], seq 190427:193323, ack 0, win 361, options [nop,nop,TS val 64283253 ecr 69025043], length 2896: OpenFlow
	version unknown (0x00), type 0x00, length 1280, xid 0x001a7562
	version unknown (0x02), type 0xc0, length 17600, xid 0x44000d00 [|openflow]
20:23:45.331367 IP 192.168.1.11.6633 > 192.168.1.30.36129: Flags [.], ack 193323, win 14518, options [nop,nop,TS val 69025044 ecr 64283253], length 0
20:23:45.331379 IP 192.168.1.30.36129 > 192.168.1.11.6633: Flags [.], seq 193323:196219, ack 0, win 361, options [nop,nop,TS val 64283254 ecr 69025044], length 2896: OpenFlow
	version unknown (0xef), type 0x00, length 0, xid 0x00000300 (corrupt)
20:23:45.331389 IP 192.168.1.30.36129 > 192.168.1.11.6633: Flags [.], seq 196219:199115, ack 0, win 361, options [nop,nop,TS val 64283254 ecr 69025044], length 2896: OpenFlow
	version unknown (0xfb), type 0x14, length 59668, xid 0xe9010bb9 [|openflow]
20:23:45.331414 IP 192.168.1.30.36129 > 192.168.1.11.6633: Flags [.], seq 199115:202011, ack 0, win 361, options [nop,nop,TS val 64283254 ecr 69025044], length 2896: OpenFlow
	version unknown (0x00), type 0x00, length 0, xid 0x00000000 (corrupt)
20:23:45.331450 IP 192.168.1.30.36129 > 192.168.1.11.6633: Flags [.], seq 202011:204907, ack 0, win 361, options [nop,nop,TS val 64283254 ecr 69025044], length 2896: OpenFlow
	version unknown (0x32), type 0xff, length 512, xid 0x00000000
	version unknown (0x30), type 0x01, length 12289, xid 0x30013001 [|openflow]
20:23:45.331474 IP 192.168.1.30.36129 > 192.168.1.11.6633: Flags [.], seq 204907:207803, ack 0, win 361, options [nop,nop,TS val 64283254 ecr 69025044], length 2896: OpenFlow
	version unknown (0x00), type 0xb8, length 19111, xid 0xfffe3de1 [|openflow]
20:23:45.331483 IP 192.168.1.30.36129 > 192.168.1.11.6633: Flags [.], seq 207803:210699, ack 0, win 361, options [nop,nop,TS val 64283254 ecr 69025044], length 2896: OpenFlow
	version unknown (0xff), type 0xfe, length 32768, xid 0x00000000 [|openflow]
20:23:45.333175 IP 192.168.1.11.6633 > 192.168.1.30.36129: Flags [.], ack 210699, win 14518, options [nop,nop,TS val 69025045 ecr 64283254], length 0
20:23:45.333186 IP 192.168.1.30.36129 > 192.168.1.11.6633: Flags [.], seq 210699:213595, ack 0, win 361, options [nop,nop,TS val 64283254 ecr 69025045], length 2896: OpenFlow
	version unknown (0xdd), type 0x60, length 0, xid 0x00010b11 (corrupt)
20:23:45.333195 IP 192.168.1.30.36129 > 192.168.1.11.6633: Flags [.], seq 213595:216491, ack 0, win 361, options [nop,nop,TS val 64283254 ecr 69025045], length 2896: OpenFlow
	version unknown (0xfb), type 0xba, length 19111, xid 0x3de13286 [|openflow]
20:23:45.333218 IP 192.168.1.30.36129 > 192.168.1.11.6633: Flags [.], seq 216491:219387, ack 0, win 361, options [nop,nop,TS val 64283254 ecr 69025045], length 2896: OpenFlow
	version unknown (0x00), type 0x00, length 51, xid 0x33000000
	version unknown (0x00), type 0x00, length 0, xid 0x00fb14e9 (corrupt)
20:23:45.333228 IP 192.168.1.30.36129 > 192.168.1.11.6633: Flags [.], seq 219387:222283, ack 0, win 361, options [nop,nop,TS val 64283254 ecr 69025045], length 2896: OpenFlow
	version unknown (0x04), type 0x00, length 0, xid 0x02000000 (corrupt)
20:23:45.333249 IP 192.168.1.30.36129 > 192.168.1.11.6633: Flags [.], seq 222283:225179, ack 0, win 361, options [nop,nop,TS val 64283254 ecr 69025045], length 2896: OpenFlow
	version unknown (0x81), type 0x00, length 256, xid 0x0c800000
	version unknown (0x00), type 0x00, length 0, xid 0xb84aa7ff (corrupt)
20:23:45.333259 IP 192.168.1.30.36129 > 192.168.1.11.6633: Flags [.], seq 225179:228075, ack 0, win 361, options [nop,nop,TS val 64283254 ecr 69025045], length 2896: OpenFlow
	version unknown (0x00), type 0x2b, length 0, xid 0x00000003 (corrupt)
20:23:45.335600 IP 192.168.1.11.6633 > 192.168.1.30.36129: Flags [.], ack 228075, win 14518, options [nop,nop,TS val 69025046 ecr 64283254], length 0
20:23:45.335611 IP 192.168.1.30.36129 > 192.168.1.11.6633: Flags [.], seq 228075:230971, ack 0, win 361, options [nop,nop,TS val 64283255 ecr 69025046], length 2896: OpenFlow
	version unknown (0x00), type 0xff, length 65535, xid 0xff014101 [|openflow]
20:23:45.335620 IP 192.168.1.30.36129 > 192.168.1.11.6633: Flags [.], seq 230971:233867, ack 0, win 361, options [nop,nop,TS val 64283255 ecr 69025046], length 2896: OpenFlow
	version unknown (0x00), type 0x04, length 2561, xid 0x6b000000
	version unknown (0x00), type 0x00, length 3, xid 0x81000100 (corrupt)
20:23:45.335650 IP 192.168.1.30.36129 > 192.168.1.11.6633: Flags [.], seq 233867:236763, ack 0, win 361, options [nop,nop,TS val 64283255 ecr 69025046], length 2896: OpenFlow
	version unknown (0x00), type 0x01, length 0, xid 0x11940001 (corrupt)
20:23:45.335660 IP 192.168.1.30.36129 > 192.168.1.11.6633: Flags [.], seq 236763:239659, ack 0, win 361, options [nop,nop,TS val 64283255 ecr 69025046], length 2896: OpenFlow
	version unknown (0x00), type 0x09, length 49220, xid 0xc00c0010 [|openflow]
20:23:45.335685 IP 192.168.1.30.36129 > 192.168.1.11.6633: Flags [.], seq 239659:242555, ack 0, win 361, options [nop,nop,TS val 64283255 ecr 69025046], length 2896: OpenFlow
	version unknown (0x00), type 0x78, length 8, xid 0x00000000
	version unknown (0x00), type 0x09, length 49220, xid 0xc00c0010 [|openflow]
20:23:45.335695 IP 192.168.1.30.36129 > 192.168.1.11.6633: Flags [.], seq 242555:245451, ack 0, win 361, options [nop,nop,TS val 64283255 ecr 69025046], length 2896: OpenFlow
	version unknown (0xc0), type 0x0c, length 33, xid 0x00010000
	version unknown (0x04), type 0x0a, length 363, xid 0x00000000
	version unknown (0x04), type 0x0a, length 363, xid 0x00000000
	version unknown (0x04), type 0x0a, length 363, xid 0x00000000
	version unknown (0x04), type 0x0a, length 363, xid 0x00000000
	version unknown (0x04), type 0x0a, length 363, xid 0x00000000
	version unknown (0x04), type 0x0a, length 363, xid 0x00000000
	version unknown (0x04), type 0x0a, length 363, xid 0x00000000
	version unknown (0x04), type 0x0a, length 363, xid 0x00000000 [|openflow]
20:23:45.337221 IP 192.168.1.11.6633 > 192.168.1.30.36129: Flags [.], ack 245451, win 14518, options [nop,nop,TS val 69025046 ecr 64283255], length 0
20:23:45.337230 IP 192.168.1.30.36129 > 192.168.1.11.6633: Flags [.], seq 245451:248347, ack 0, win 361, options [nop,nop,TS val 64283255 ecr 69025046], length 2896: OpenFlow
	version unknown (0x36), type 0x34, length 1356, xid 0x494e5558
	version unknown (0x30), type 0x01, length 12289, xid 0x30013001 [|openflow]
20:23:45.337240 IP 192.168.1.30.36129 > 192.168.1.11.6633: Flags [.], seq 248347:251243, ack 0, win 361, options [nop,nop,TS val 64283255 ecr 69025046], length 2896: OpenFlow
	version unknown (0x78), type 0x00, length 3334, xid 0x5838365f [|openflow]
20:23:45.337265 IP 192.168.1.30.36129 > 192.168.1.11.6633: Flags [.], seq 251243:254139, ack 0, win 361, options [nop,nop,TS val 64283255 ecr 69025046], length 2896: OpenFlow
	version unknown (0x44), type 0x00, length 3328, xid 0x01000000 [|openflow]
20:23:45.337275 IP 192.168.1.30.36129 > 192.168.1.11.6633: Flags [.], seq 254139:257035, ack 0, win 361, options [nop,nop,TS val 64283255 ecr 69025046], length 2896: OpenFlow
	version unknown (0x00), type 0x00, length 30720, xid 0x02c044c0 [|openflow]
20:23:45.337296 IP 192.168.1.30.36129 > 192.168.1.11.6633: Flags [.], seq 257035:259931, ack 0, win 361, options [nop,nop,TS val 64283255 ecr 69025046], length 2896: OpenFlow
	version unknown (0x32), type 0xc0, length 20736, xid 0x0c000100 [|openflow]
20:23:45.337305 IP 192.168.1.30.36129 > 192.168.1.11.6633: Flags [.], seq 259931:262827, ack 0, win 361, options [nop,nop,TS val 64283255 ecr 69025046], length 2896: OpenFlow
	version unknown (0x00), type 0xb8, length 19111, xid 0xfffe3de1 [|openflow]
20:23:45.338463 IP 192.168.1.11.6633 > 192.168.1.30.36129: Flags [.], ack 262827, win 14518, options [nop,nop,TS val 69025046 ecr 64283255], length 0
20:23:45.338474 IP 192.168.1.30.36129 > 192.168.1.11.6633: Flags [.], seq 262827:265723, ack 0, win 361, options [nop,nop,TS val 64283256 ecr 69025046], length 2896: OpenFlow
	version unknown (0x10), type 0xfe, length 32768, xid 0x00000000 [|openflow]
20:23:45.338483 IP 192.168.1.30.36129 > 192.168.1.11.6633: Flags [.], seq 265723:268619, ack 0, win 361, options [nop,nop,TS val 64283256 ecr 69025046], length 2896: OpenFlow
	version unknown (0x1c), type 0x00, length 256, xid 0x00007800
	version unknown (0x63), type 0x70, length 1388, xid 0x6f63616c
	version unknown (0xfb), type 0x14, length 59668, xid 0xe9010bb9 [|openflow]
20:23:45.338512 IP 192.168.1.30.36129 > 192.168.1.11.6633: Flags [.], seq 268619:271515, ack 0, win 361, options [nop,nop,TS val 64283256 ecr 69025046], length 2896: OpenFlow
	version unknown (0x00), type 0x00, length 65280, xid 0x01c04400 [|openflow]
20:23:45.338521 IP 192.168.1.30.36129 > 192.168.1.11.6633: Flags [.], seq 271515:274411, ack 0, win 361, options [nop,nop,TS val 64283256 ecr 69025046], length 2896: OpenFlow
	version unknown (0x69), type 0x70, length 13828, xid 0x61727061 [|openflow]
20:23:45.338545 IP 192.168.1.30.36129 > 192.168.1.11.6633: Flags [.], seq 274411:277307, ack 0, win 361, options [nop,nop,TS val 64283256 ecr 69025046], length 2896: OpenFlow
	version unknown (0x30), type 0x01, length 14337, xid 0x65016603 [|openflow]
20:23:45.338554 IP 192.168.1.30.36129 > 192.168.1.11.6633: Flags [.], seq 277307:280203, ack 0, win 361, options [nop,nop,TS val 64283256 ecr 69025046], length 2896: OpenFlow
	version unknown (0x30), type 0x01, length 12289, xid 0x30013001 [|openflow]
20:23:45.339633 IP 192.168.1.11.6633 > 192.168.1.30.36129: Flags [.], ack 280203, win 14518, options [nop,nop,TS val 69025047 ecr 64283256], length 0
20:23:45.339645 IP 192.168.1.30.36129 > 192.168.1.11.6633: Flags [.], seq 280203:283099, ack 0, win 361, options [nop,nop,TS val 64283256 ecr 69025047], length 2896: OpenFlow
	version unknown (0x30), type 0x01, length 12289, xid 0x30013001 [|openflow]
20:23:45.339654 IP 192.168.1.30.36129 > 192.168.1.11.6633: Flags [.], seq 283099:285995, ack 0, win 361, options [nop,nop,TS val 64283256 ecr 69025047], length 2896: OpenFlow
	version unknown (0x30), type 0x01, length 12289, xid 0x30013001 [|openflow]
20:23:45.339682 IP 192.168.1.30.36129 > 192.168.1.11.6633: Flags [.], seq 285995:288891, ack 0, win 361, options [nop,nop,TS val 64283256 ecr 69025047], length 2896: OpenFlow
	version unknown (0x61), type 0x01, length 13313, xid 0x38016201 [|openflow]
20:23:45.339693 IP 192.168.1.30.36129 > 192.168.1.11.6633: Flags [.], seq 288891:291787, ack 0, win 361, options [nop,nop,TS val 64283256 ecr 69025047], length 2896: OpenFlow
	version unknown (0x66), type 0x01, length 26113, xid 0x37016101 [|openflow]
20:23:45.339716 IP 192.168.1.30.36129 > 192.168.1.11.6633: Flags [.], seq 291787:294683, ack 0, win 361, options [nop,nop,TS val 64283256 ecr 69025047], length 2896: OpenFlow
	version unknown (0x64), type 0x01, length 13057, xid 0x65016601 [|openflow]
20:23:45.339727 IP 192.168.1.30.36129 > 192.168.1.11.6633: Flags [.], seq 294683:297579, ack 0, win 361, options [nop,nop,TS val 64283256 ecr 69025047], length 2896: OpenFlow
	version unknown (0x32), type 0x01, length 13057, xid 0x31016501 [|openflow]
20:23:45.340601 IP 192.168.1.11.6633 > 192.168.1.30.36129: Flags [.], ack 297579, win 14518, options [nop,nop,TS val 69025047 ecr 64283256], length 0
20:23:45.340608 IP 192.168.1.30.36129 > 192.168.1.11.6633: Flags [.], seq 297579:300475, ack 0, win 361, options [nop,nop,TS val 64283256 ecr 69025047], length 2896: OpenFlow
	version unknown (0x75), type 0xc0, length 14592, xid 0xff000101 [|openflow]
20:23:45.340617 IP 192.168.1.30.36129 > 192.168.1.11.6633: Flags [.], seq 300475:303371, ack 0, win 361, options [nop,nop,TS val 64283256 ecr 69025047], length 2896: OpenFlow
	version unknown (0x00), type 0x01, length 1653, xid 0x62756e74
	version unknown (0xff), type 0xff, length 65535, xid 0x01410100 [|openflow]
20:23:45.340643 IP 192.168.1.30.36129 > 192.168.1.11.6633: Flags [.], seq 303371:306267, ack 0, win 361, options [nop,nop,TS val 64283256 ecr 69025047], length 2896: OpenFlow
	version unknown (0x6c), type 0x6f, length 25441, xid 0x6c0000ff [|openflow]
20:23:45.340653 IP 192.168.1.30.36129 > 192.168.1.11.6633: Flags [.], seq 306267:309163, ack 0, win 361, options [nop,nop,TS val 64283256 ecr 69025047], length 2896: OpenFlow
	version unknown (0x6f), type 0x6e, length 1119, xid 0x74637005
	version 1.0, type ERROR, length 12801, xid 0x33013101 [|openflow]
20:23:45.340678 IP 192.168.1.30.36129 > 192.168.1.11.6633: Flags [.], seq 309163:312059, ack 0, win 361, options [nop,nop,TS val 64283256 ecr 69025047], length 2896: OpenFlow
	version unknown (0x6f), type 0x72, length 27507, xid 0x74617469 [|openflow]
20:23:45.340688 IP 192.168.1.30.36129 > 192.168.1.11.6633: Flags [.], seq 312059:314955, ack 0, win 361, options [nop,nop,TS val 64283256 ecr 69025047], length 2896: OpenFlow
	version unknown (0x31), type 0x3a, length 13106, xid 0x5d0c5f77 [|openflow]
20:23:45.342310 IP 192.168.1.11.6633 > 192.168.1.30.36129: Flags [.], ack 314955, win 14518, options [nop,nop,TS val 69025047 ecr 64283256], length 0
20:23:45.342324 IP 192.168.1.30.36129 > 192.168.1.11.6633: Flags [.], seq 314955:317851, ack 0, win 361, options [nop,nop,TS val 64283257 ecr 69025047], length 2896: OpenFlow
	version unknown (0x3a), type 0x61, length 14138, xid 0x33643a65 [|openflow]
20:23:45.342333 IP 192.168.1.30.36129 > 192.168.1.11.6633: Flags [.], seq 317851:320747, ack 0, win 361, options [nop,nop,TS val 64283257 ecr 69025047], length 2896: OpenFlow
	version unknown (0x75), type 0x20, length 23394, xid 0x613a3461 [|openflow]
20:23:45.342362 IP 192.168.1.30.36129 > 192.168.1.11.6633: Flags [.], seq 320747:323643, ack 0, win 361, options [nop,nop,TS val 64283257 ecr 69025047], length 2896: OpenFlow
	version unknown (0x00), type 0x00, length 6773, xid 0x62756e74 [|openflow]
20:23:45.342372 IP 192.168.1.30.36129 > 192.168.1.11.6633: Flags [.], seq 323643:326539, ack 0, win 361, options [nop,nop,TS val 64283257 ecr 69025047], length 2896: OpenFlow
	version unknown (0x36), type 0x5f, length 13876, xid 0x054c494e [|openflow]
20:23:45.342395 IP 192.168.1.30.36129 > 192.168.1.11.6633: Flags [.], seq 326539:329435, ack 0, win 361, options [nop,nop,TS val 64283257 ecr 69025047], length 2896: OpenFlow
	version unknown (0x00), type 0x00, length 30720, xid 0x0d065838 [|openflow]
20:23:45.342405 IP 192.168.1.30.36129 > 192.168.1.11.6633: Flags [.], seq 329435:332331, ack 0, win 361, options [nop,nop,TS val 64283257 ecr 69025047], length 2896: OpenFlow
	version unknown (0x44), type 0xc0, length 17408, xid 0x0d000100 [|openflow]
20:23:45.343543 IP 192.168.1.11.6633 > 192.168.1.30.36129: Flags [.], ack 332331, win 14518, options [nop,nop,TS val 69025048 ecr 64283257], length 0
20:23:45.343554 IP 192.168.1.30.36129 > 192.168.1.11.6633: Flags [.], seq 332331:335227, ack 0, win 361, options [nop,nop,TS val 64283257 ecr 69025048], length 2896: OpenFlow
	version unknown (0x01), type 0x00, length 0, xid 0x780002c0 (corrupt)
20:23:45.343563 IP 192.168.1.30.36129 > 192.168.1.11.6633: Flags [P.], seq 335227:338123, ack 0, win 361, options [nop,nop,TS val 64283257 ecr 69025048], length 2896: OpenFlow
	version unknown (0x3d), type 0xe1, length 12992, xid 0x51000c00 [|openflow]
20:23:45.343592 IP 192.168.1.30.36129 > 192.168.1.11.6633: Flags [.], seq 338123:341019, ack 0, win 361, options [nop,nop,TS val 64283257 ecr 69025048], length 2896: OpenFlow
	version unknown (0x00), type 0x00, length 184, xid 0x4aa7fffe
	version unknown (0x0b), type 0xb9, length 61184, xid 0x00000000 [|openflow]
20:23:45.343602 IP 192.168.1.30.36129 > 192.168.1.11.6633: Flags [.], seq 341019:343915, ack 0, win 361, options [nop,nop,TS val 64283257 ecr 69025048], length 2896: OpenFlow
	version unknown (0x78), type 0x00, length 4350, xid 0x80000000 [|openflow]
20:23:45.343623 IP 192.168.1.30.36129 > 192.168.1.11.6633: Flags [.], seq 343915:346811, ack 0, win 361, options [nop,nop,TS val 64283257 ecr 69025048], length 2896: OpenFlow
	version unknown (0x44), type 0x00, length 7168, xid 0x01000000 [|openflow]
20:23:45.343633 IP 192.168.1.30.36129 > 192.168.1.11.6633: Flags [.], seq 346811:349707, ack 0, win 361, options [nop,nop,TS val 64283257 ecr 69025048], length 2896: OpenFlow
	version unknown (0x70), type 0x61, length 0, xid 0xff0001c0 (corrupt)
20:23:45.344310 IP 192.168.1.11.6633 > 192.168.1.30.36129: Flags [.], ack 338123, win 14518, options [nop,nop,TS val 69025048 ecr 64283257], length 0
20:23:45.344323 IP 192.168.1.30.36129 > 192.168.1.11.6633: Flags [.], seq 349707:352603, ack 0, win 361, options [nop,nop,TS val 64283257 ecr 69025048], length 2896: OpenFlow
	version unknown (0x66), type 0x03, length 26992, xid 0x36046172 [|openflow]
20:23:45.344332 IP 192.168.1.30.36129 > 192.168.1.11.6633: Flags [.], seq 352603:355499, ack 0, win 361, options [nop,nop,TS val 64283257 ecr 69025048], length 2896: OpenFlow
	version unknown (0x30), type 0x01, length 12289, xid 0x38016501 [|openflow]
20:23:45.344359 IP 192.168.1.11.6633 > 192.168.1.30.36129: Flags [.], ack 349707, win 14518, options [nop,nop,TS val 69025048 ecr 64283257], length 0
20:23:45.344367 IP 192.168.1.30.36129 > 192.168.1.11.6633: Flags [.], seq 355499:358395, ack 0, win 361, options [nop,nop,TS val 64283257 ecr 69025048], length 2896: OpenFlow
	version unknown (0x30), type 0x01, length 12289, xid 0x30013001 [|openflow]
20:23:45.344376 IP 192.168.1.30.36129 > 192.168.1.11.6633: Flags [.], seq 358395:361291, ack 0, win 361, options [nop,nop,TS val 64283257 ecr 69025048], length 2896: OpenFlow
	version unknown (0x30), type 0x01, length 12289, xid 0x30013001 [|openflow]
20:23:45.344399 IP 192.168.1.30.36129 > 192.168.1.11.6633: Flags [.], seq 361291:364187, ack 0, win 361, options [nop,nop,TS val 64283257 ecr 69025048], length 2896: OpenFlow
	version unknown (0x62), type 0x01, length 12289, xid 0x30013001 [|openflow]
20:23:45.344409 IP 192.168.1.30.36129 > 192.168.1.11.6633: Flags [.], seq 364187:367083, ack 0, win 361, options [nop,nop,TS val 64283257 ecr 69025048], length 2896: OpenFlow
	version unknown (0x61), type 0x01, length 24833, xid 0x34013801 [|openflow]
20:23:45.346668 IP 192.168.1.11.6633 > 192.168.1.30.36129: Flags [.], ack 367083, win 14518, options [nop,nop,TS val 69025048 ecr 64283257], length 0

