20:23:45.226999 IP 192.168.1.11.6633 > 192.168.1.30.36124: Flags [.], ack 1225682560, win 11534, options [nop,nop,TS val 69025011 ecr 64283151], length 0
20:23:45.227009 IP 192.168.1.11.6633 > 192.168.1.30.36124: Flags [.], ack 364, win 11534, options [nop,nop,TS val 69025011 ecr 64283151], length 0
20:23:45.228578 IP 192.168.1.11.6633 > 192.168.1.30.36124: Flags [.], ack 727, win 11534, options [nop,nop,TS val 69025011 ecr 64283151], length 0
20:23:45.228587 IP 192.168.1.11.6633 > 192.168.1.30.36124: Flags [.], ack 1090, win 11534, options [nop,nop,TS val 69025011 ecr 64283151], length 0
20:23:45.228592 IP 192.168.1.11.6633 > 192.168.1.30.36124: Flags [.], ack 1453, win 11534, options [nop,nop,TS val 69025011 ecr 64283151], length 0
20:23:45.228595 IP 192.168.1.11.6633 > 192.168.1.30.36124: Flags [.], ack 1816, win 11534, options [nop,nop,TS val 69025011 ecr 64283151], length 0
20:23:45.228599 IP 192.168.1.11.6633 > 192.168.1.30.36124: Flags [.], ack 2179, win 11534, options [nop,nop,TS val 69025011 ecr 64283151], length 0
20:23:45.228603 IP 192.168.1.11.6633 > 192.168.1.30.36124: Flags [.], ack 2542, win 11534, options [nop,nop,TS val 69025011 ecr 64283151], length 0
20:23:45.228606 IP 192.168.1.11.6633 > 192.168.1.30.36124: Flags [.], ack 2905, win 11534, options [nop,nop,TS val 69025011 ecr 64283151], length 0
20:23:45.228609 IP 192.168.1.11.6633 > 192.168.1.30.36124: Flags [.], ack 3268, win 11534, options [nop,nop,TS val 69025011 ecr 64283151], length 0
20:23:45.228613 IP 192.168.1.11.6633 > 192.168.1.30.36124: Flags [.], ack 3631, win 11534, options [nop,nop,TS val 69025011 ecr 64283151], length 0
20:23:45.228617 IP 192.168.1.11.6633 > 192.168.1.30.36124: Flags [.], ack 3994, win 11534, options [nop,nop,TS val 69025011 ecr 64283151], length 0
20:23:45.228620 IP 192.168.1.11.6633 > 192.168.1.30.36124: Flags [.], ack 4357, win 11534, options [nop,nop,TS val 69025011 ecr 64283151], length 0
20:23:45.228624 IP 192.168.1.11.6633 > 192.168.1.30.36124: Flags [.], ack 4720, win 11534, options [nop,nop,TS val 69025011 ecr 64283151], length 0
20:23:45.228628 IP 192.168.1.11.6633 > 192.168.1.30.36124: Flags [.], ack 5083, win 11534, options [nop,nop,TS val 69025011 ecr 64283151], length 0
20:23:45.228631 IP 192.168.1.11.6633 > 192.168.1.30.36124: Flags [.], ack 5446, win 11534, options [nop,nop,TS val 69025011 ecr 64283151], length 0
20:23:45.229253 IP 192.168.1.30.36124 > 192.168.1.11.6633: Flags [.], seq 7257:8705, ack 0, win 353, options [nop,nop,TS val 64283227 ecr 69025011], length 1448: OpenFlow
	version unknown (0x94), type 0x00, length 256, xid 0x040a016b
	version unknown (0x36), type 0x04, length 24946, xid 0x70610000 [|openflow]
20:23:45.229271 IP 192.168.1.30.36124 > 192.168.1.11.6633: Flags [.], seq 8705:11601, ack 0, win 353, options [nop,nop,TS val 64283228 ecr 69025011], length 2896: OpenFlow
	version 1.0, type HELLO, length 17, xid 0x94000100
	version unknown (0xff), type 0xff, length 65281, xid 0x4101002b [|openflow]
20:23:45.229321 IP 192.168.1.30.36124 > 192.168.1.11.6633: Flags [.], seq 11601:14497, ack 0, win 353, options [nop,nop,TS val 64283228 ecr 69025011], length 2896: OpenFlow
	version unknown (0x09), type 0xc0, length 17600, xid 0x0c001000 [|openflow]
20:23:45.229352 IP 192.168.1.30.36124 > 192.168.1.11.6633: Flags [.], seq 14497:17393, ack 0, win 353, options [nop,nop,TS val 64283228 ecr 69025011], length 2896: OpenFlow
	version unknown (0x78), type 0x00, length 2048, xid 0x00000000
	version 1.0, type invalid (0x61), length 308, xid 0x01380162
	version unknown (0x6f), type 0x6e, length 1119, xid 0x74637005 [|openflow]
20:23:45.229382 IP 192.168.1.30.36124 > 192.168.1.11.6633: Flags [.], seq 17393:20289, ack 0, win 353, options [nop,nop,TS val 64283228 ecr 69025011], length 2896: OpenFlow
	version unknown (0x0c), type 0x00, length 8448, xid 0x01000000 [|openflow]
20:23:45.229410 IP 192.168.1.30.36124 > 192.168.1.11.6633: Flags [.], seq 20289:23185, ack 0, win 353, options [nop,nop,TS val 64283228 ecr 69025011], length 2896: OpenFlow
	version unknown (0x34), type 0x05, length 19529, xid 0x4e5558c0 [|openflow]
20:23:45.229439 IP 192.168.1.30.36124 > 192.168.1.11.6633: Flags [.], seq 23185:26081, ack 0, win 353, options [nop,nop,TS val 64283228 ecr 69025011], length 2896: OpenFlow
	version unknown (0x00), type 0x0d, length 1624, xid 0x38365f36
	version unknown (0x5b), type 0x62, length 24890, xid 0x34613a61 [|openflow]
20:23:45.229467 IP 192.168.1.30.36124 > 192.168.1.11.6633: Flags [.], seq 26081:28977, ack 0, win 353, options [nop,nop,TS val 64283228 ecr 69025011], length 2896: OpenFlow
	version unknown (0x00), type 0x0d, length 1, xid 0x00000078 (corrupt)
20:23:45.229805 IP 192.168.1.11.6633 > 192.168.1.30.36124: Flags [.], ack 5809, win 11534, options [nop,nop,TS val 69025012 ecr 64283151], length 0
20:23:45.264256 IP 192.168.1.11.6633 > 192.168.1.30.36124: Flags [.], ack 5809, win 11534, options [nop,nop,TS val 69025026 ecr 64283151,nop,nop,sack 1 {7257:8705}], length 0
20:23:45.264306 IP 192.168.1.11.6633 > 192.168.1.30.36124: Flags [.], ack 5809, win 11534, options [nop,nop,TS val 69025026 ecr 64283151,nop,nop,sack 1 {7257:28977}], length 0
20:23:45.268560 IP 192.168.1.30.36124 > 192.168.1.11.6633: Flags [.], seq 28977:31873, ack 0, win 353, options [nop,nop,TS val 64283237 ecr 69025026], length 2896: OpenFlow
	version unknown (0x00), type 0x78, length 2, xid 0xc044c044 (corrupt)
20:23:45.268788 IP 192.168.1.30.36124 > 192.168.1.11.6633: Flags [.], seq 5809:7257, ack 0, win 353, options [nop,nop,TS val 64283237 ecr 69025026], length 1448: OpenFlow
	version unknown (0x04), type 0x0a, length 363, xid 0x00000000
	version unknown (0x04), type 0x0a, length 363, xid 0x00000000
	version unknown (0x04), type 0x0a, length 363, xid 0x00000000
	version unknown (0x04), type 0x0a, length 363, xid 0x00000000 [|openflow]
20:23:45.268955 IP 192.168.1.11.6633 > 192.168.1.30.36124: Flags [.], ack 5809, win 11534, options [nop,nop,TS val 69025029 ecr 64283151,nop,nop,sack 1 {7257:31873}], length 0
20:23:45.268960 IP 192.168.1.30.36124 > 192.168.1.11.6633: Flags [.], seq 31873:34769, ack 0, win 353, options [nop,nop,TS val 64283237 ecr 69025026], length 2896: OpenFlow
	version unknown (0xc0), type 0x51, length 12, xid 0x00010000
	version unknown (0xc0), type 0x44, length 49220, xid 0x000d0001 [|openflow]
20:23:45.269267 IP 192.168.1.30.36124 > 192.168.1.11.6633: Flags [.], seq 34769:37665, ack 0, win 353, options [nop,nop,TS val 64283237 ecr 69025026], length 2896: OpenFlow
	version unknown (0xb8), type 0x4a, length 43007, xid 0xfe3de132 [|openflow]
20:23:45.269276 IP 192.168.1.30.36124 > 192.168.1.11.6633: Flags [.], seq 37665:40561, ack 0, win 353, options [nop,nop,TS val 64283237 ecr 69025026], length 2896: OpenFlow
	version unknown (0xfe), type 0x80, length 0, xid 0x00000000 (corrupt)
20:23:45.269479 IP 192.168.1.11.6633 > 192.168.1.30.36124: Flags [.], ack 31873, win 11534, options [nop,nop,TS val 69025029 ecr 64283237], length 0
20:23:45.269490 IP 192.168.1.11.6633 > 192.168.1.30.36124: Flags [.], ack 34769, win 11534, options [nop,nop,TS val 69025029 ecr 64283237], length 0
20:23:45.269493 IP 192.168.1.30.36124 > 192.168.1.11.6633: Flags [.], seq 40561:43457, ack 0, win 353, options [nop,nop,TS val 64283237 ecr 69025026], length 2896: OpenFlow
	version unknown (0x00), type 0x01, length 0, xid 0x00780010 (corrupt)
20:23:45.269528 IP 192.168.1.11.6633 > 192.168.1.30.36124: Flags [.], ack 40561, win 11534, options [nop,nop,TS val 69025029 ecr 64283237], length 0
20:23:45.269972 IP 192.168.1.11.6633 > 192.168.1.30.36124: Flags [.], ack 43457, win 11534, options [nop,nop,TS val 69025029 ecr 64283237], length 0
20:23:45.278621 IP 192.168.1.30.36124 > 192.168.1.11.6633: Flags [.], seq 43457:46353, ack 0, win 353, options [nop,nop,TS val 64283237 ecr 69025029], length 2896: OpenFlow
	version unknown (0x00), type 0xff, length 1, xid 0xc044001c (corrupt)
20:23:45.279248 IP 192.168.1.30.36124 > 192.168.1.11.6633: Flags [.], seq 46353:49249, ack 0, win 353, options [nop,nop,TS val 64283237 ecr 69025029], length 2896: OpenFlow
	version unknown (0x70), type 0x36, length 1121, xid 0x72706100
	version unknown (0xb8), type 0x4a, length 43007, xid 0xfe3de132 [|openflow]
20:23:45.279259 IP 192.168.1.30.36124 > 192.168.1.11.6633: Flags [.], seq 49249:52145, ack 0, win 353, options [nop,nop,TS val 64283237 ecr 69025029], length 2896: OpenFlow
	version 1.0, type invalid (0x38), length 357, xid 0x01660369
	version 1.0, type invalid (0x30), length 304, xid 0x01300138
	version unknown (0x75), type 0xc0, length 14592, xid 0xff000101 [|openflow]
20:23:45.279459 IP 192.168.1.30.36124 > 192.168.1.11.6633: Flags [.], seq 52145:55041, ack 0, win 353, options [nop,nop,TS val 64283237 ecr 69025029], length 2896: OpenFlow
	version 1.0, type invalid (0x30), length 304, xid 0x01300130
	version unknown (0x6e), type 0x74, length 30144, xid 0x3900ff00 [|openflow]
20:23:45.279469 IP 192.168.1.30.36124 > 192.168.1.11.6633: Flags [.], seq 55041:57937, ack 0, win 353, options [nop,nop,TS val 64283237 ecr 69025029], length 2896: OpenFlow
	version 1.0, type invalid (0x30), length 304, xid 0x01300130
	version unknown (0x00), type 0xff, length 1, xid 0x06756275 (corrupt)
20:23:45.279665 IP 192.168.1.30.36124 > 192.168.1.11.6633: Flags [.], seq 57937:60833, ack 0, win 353, options [nop,nop,TS val 64283237 ecr 69025029], length 2896: OpenFlow
	version 1.0, type invalid (0x30), length 304, xid 0x01300130
	version unknown (0x70), type 0x05, length 27759, xid 0x63616c00 [|openflow]
20:23:45.281457 IP 192.168.1.11.6633 > 192.168.1.30.36124: Flags [.], ack 46353, win 11534, options [nop,nop,TS val 69025032 ecr 64283237], length 0
20:23:45.282040 IP 192.168.1.11.6633 > 192.168.1.30.36124: Flags [.], ack 52145, win 11534, options [nop,nop,TS val 69025032 ecr 64283237], length 0
20:23:45.282245 IP 192.168.1.11.6633 > 192.168.1.30.36124: Flags [.], ack 57937, win 11534, options [nop,nop,TS val 69025032 ecr 64283237], length 0
20:23:45.282384 IP 192.168.1.11.6633 > 192.168.1.30.36124: Flags [.], ack 60833, win 11534, options [nop,nop,TS val 69025032 ecr 64283237], length 0
20:23:45.286428 IP 192.168.1.30.36124 > 192.168.1.11.6633: Flags [.], seq 60833:63729, ack 0, win 353, options [nop,nop,TS val 64283237 ecr 69025032], length 2896: OpenFlow
	version 1.0, type invalid (0x34), length 312, xid 0x01620130
	version unknown (0x70), type 0x05, length 27759, xid 0x63616c00 [|openflow]
20:23:45.286808 IP 192.168.1.30.36124 > 192.168.1.11.6633: Flags [.], seq 63729:66625, ack 0, win 353, options [nop,nop,TS val 64283237 ecr 69025032], length 2896: OpenFlow
	version 1.0, type invalid (0x66), length 311, xid 0x01610161
	version unknown (0x61), type 0x74, length 26991, xid 0x6e045f74 [|openflow]
20:23:45.286836 IP 192.168.1.30.36124 > 192.168.1.11.6633: Flags [.], seq 66625:69521, ack 0, win 353, options [nop,nop,TS val 64283237 ecr 69025032], length 2896: OpenFlow
	version 1.0, type invalid (0x33), length 357, xid 0x01660166
	version 1.0, type invalid (0x31), length 357, xid 0x01640133
	version unknown (0x00), type 0x01, length 306, xid 0x01330131
	version unknown (0x61), type 0x3a, length 13409, xid 0x3a61373a [|openflow]
20:23:45.287011 IP 192.168.1.30.36124 > 192.168.1.11.6633: Flags [.], seq 69521:72417, ack 0, win 353, options [nop,nop,TS val 64283237 ecr 69025032], length 2896: OpenFlow
	version 1.0, type invalid (0x33), length 305, xid 0x01650164
	version unknown (0x61), type 0x3a, length 24887, xid 0x3a33643a [|openflow]
20:23:45.287038 IP 192.168.1.30.36124 > 192.168.1.11.6633: Flags [.], seq 72417:75313, ack 0, win 353, options [nop,nop,TS val 64283237 ecr 69025032], length 2896: OpenFlow
	version unknown (0xc0), type 0x39, length 255, xid 0x00010132
	version unknown (0x00), type 0xb8, length 19111, xid 0xfffe3de1 [|openflow]
20:23:45.287227 IP 192.168.1.30.36124 > 192.168.1.11.6633: Flags [.], seq 75313:78209, ack 0, win 353, options [nop,nop,TS val 64283237 ecr 69025032], length 2896: OpenFlow
	version 1.0, type FEATURES_REPLY, length 30050, xid 0x756e7475 [|openflow]
20:23:45.288299 IP 192.168.1.11.6633 > 192.168.1.30.36124: Flags [.], ack 63729, win 11534, options [nop,nop,TS val 69025034 ecr 64283237], length 0
20:23:45.288317 IP 192.168.1.11.6633 > 192.168.1.30.36124: Flags [.], ack 66625, win 11534, options [nop,nop,TS val 69025034 ecr 64283237], length 0
20:23:45.288321 IP 192.168.1.11.6633 > 192.168.1.30.36124: Flags [.], ack 72417, win 11534, options [nop,nop,TS val 69025034 ecr 64283237], length 0
20:23:45.288325 IP 192.168.1.11.6633 > 192.168.1.30.36124: Flags [.], ack 78209, win 11534, options [nop,nop,TS val 69025034 ecr 64283237], length 0
20:23:45.292821 IP 192.168.1.30.36124 > 192.168.1.11.6633: Flags [.], seq 78209:81105, ack 0, win 353, options [nop,nop,TS val 64283237 ecr 69025034], length 2896: OpenFlow
	version unknown (0x6f), type 0x63, length 24940, xid 0x0000ff00 [|openflow]
20:23:45.293170 IP 192.168.1.30.36124 > 192.168.1.11.6633: Flags [.], seq 81105:84001, ack 0, win 353, options [nop,nop,TS val 64283237 ecr 69025034], length 2896: OpenFlow
	version unknown (0x6e), type 0x04, length 24436, xid 0x6370056c [|openflow]
20:23:45.293403 IP 192.168.1.30.36124 > 192.168.1.11.6633: Flags [.], seq 84001:86897, ack 0, win 353, options [nop,nop,TS val 64283237 ecr 69025034], length 2896: OpenFlow
	version unknown (0x72), type 0x6b, length 29556, xid 0x6174696f [|openflow]
20:23:45.293412 IP 192.168.1.30.36124 > 192.168.1.11.6633: Flags [.], seq 86897:89793, ack 0, win 353, options [nop,nop,TS val 64283237 ecr 69025034], length 2896: OpenFlow
	version unknown (0x3a), type 0x33, length 12893, xid 0x0c5f776f [|openflow]
20:23:45.293440 IP 192.168.1.11.6633 > 192.168.1.30.36124: Flags [.], ack 81105, win 11534, options [nop,nop,TS val 69025035 ecr 64283237], length 0
20:23:45.293567 IP 192.168.1.30.36124 > 192.168.1.11.6633: Flags [.], seq 89793:92689, ack 0, win 353, options [nop,nop,TS val 64283237 ecr 69025034], length 2896: OpenFlow
	version unknown (0x61), type 0x37, length 14899, xid 0x643a6531 [|openflow]
20:23:45.293583 IP 192.168.1.30.36124 > 192.168.1.11.6633: Flags [.], seq 92689:95585, ack 0, win 353, options [nop,nop,TS val 64283237 ecr 69025034], length 2896: OpenFlow
	version unknown (0x20), type 0x5b, length 25185, xid 0x3a34613a [|openflow]
20:23:45.293740 IP 192.168.1.11.6633 > 192.168.1.30.36124: Flags [.], ack 84001, win 11534, options [nop,nop,TS val 69025035 ecr 64283237], length 0
20:23:45.293773 IP 192.168.1.11.6633 > 192.168.1.30.36124: Flags [.], ack 89793, win 11534, options [nop,nop,TS val 69025035 ecr 64283237], length 0
20:23:45.293938 IP 192.168.1.11.6633 > 192.168.1.30.36124: Flags [.], ack 95585, win 11534, options [nop,nop,TS val 69025035 ecr 64283237], length 0
20:23:45.298788 IP 192.168.1.30.36124 > 192.168.1.11.6633: Flags [.], seq 95585:98481, ack 0, win 353, options [nop,nop,TS val 64283237 ecr 69025035], length 2896: OpenFlow
	version unknown (0x00), type 0x1a, length 30050, xid 0x756e7475 [|openflow]
20:23:45.299024 IP 192.168.1.30.36124 > 192.168.1.11.6633: Flags [.], seq 98481:101377, ack 0, win 353, options [nop,nop,TS val 64283237 ecr 69025035], length 2896: OpenFlow
	version unknown (0x00), type 0x00, length 768, xid 0x00000500
	version unknown (0x73), type 0x74, length 24948, xid 0x696f6e04 [|openflow]
20:23:45.299193 IP 192.168.1.30.36124 > 192.168.1.11.6633: Flags [.], seq 101377:104273, ack 0, win 353, options [nop,nop,TS val 64283237 ecr 69025035], length 2896: OpenFlow
	version unknown (0xe9), type 0x01, length 3001, xid 0xef000000 [|openflow]
20:23:45.299218 IP 192.168.1.30.36124 > 192.168.1.11.6633: Flags [.], seq 104273:107169, ack 0, win 353, options [nop,nop,TS val 64283237 ecr 69025035], length 2896: OpenFlow
	version unknown (0x00), type 0x00, length 0, xid 0xfb14e914 (corrupt)
20:23:45.299375 IP 192.168.1.30.36124 > 192.168.1.11.6633: Flags [.], seq 107169:110065, ack 0, win 353, options [nop,nop,TS val 64283237 ecr 69025035], length 2896: OpenFlow
	version unknown (0x00), type 0x00, length 0, xid 0x00000000 (corrupt)
20:23:45.299403 IP 192.168.1.30.36124 > 192.168.1.11.6633: Flags [.], seq 110065:112961, ack 0, win 353, options [nop,nop,TS val 64283237 ecr 69025035], length 2896: OpenFlow
	version unknown (0xff), type 0xfe, length 15841, xid 0x32ff0200 [|openflow]
20:23:45.304552 IP 192.168.1.11.6633 > 192.168.1.30.36124: Flags [.], ack 98481, win 11534, options [nop,nop,TS val 69025037 ecr 64283237], length 0
20:23:45.304564 IP 192.168.1.11.6633 > 192.168.1.30.36124: Flags [.], ack 104273, win 11534, options [nop,nop,TS val 69025037 ecr 64283237], length 0
20:23:45.304584 IP 192.168.1.11.6633 > 192.168.1.30.36124: Flags [.], ack 112961, win 11534, options [nop,nop,TS val 69025037 ecr 64283237], length 0
20:23:45.311364 IP 192.168.1.30.36124 > 192.168.1.11.6633: Flags [.], seq 112961:115857, ack 0, win 353, options [nop,nop,TS val 64283237 ecr 69025037], length 2896: OpenFlow
	version unknown (0x00), type 0x00, length 0, xid 0x00b84aa7 (corrupt)
20:23:45.311625 IP 192.168.1.30.36124 > 192.168.1.11.6633: Flags [.], seq 115857:118753, ack 0, win 353, options [nop,nop,TS val 64283237 ecr 69025037], length 2896: OpenFlow
	version unknown (0x00), type 0x01, length 2833, xid 0xfffe8000
	version unknown (0x0c), type 0x00, length 4096, xid 0x01000011 [|openflow]
20:23:45.311970 IP 192.168.1.30.36124 > 192.168.1.11.6633: Flags [.], seq 118753:121649, ack 0, win 353, options [nop,nop,TS val 64283237 ecr 69025037], length 2896: OpenFlow
	version unknown (0x3d), type 0xe1, length 12934, xid 0xdd600000 [|openflow]
20:23:45.312343 IP 192.168.1.30.36124 > 192.168.1.11.6633: Flags [.], seq 121649:124545, ack 0, win 353, options [nop,nop,TS val 64283237 ecr 69025037], length 2896: OpenFlow
	version unknown (0x33), type 0x00, length 0, xid 0xfbba4aa7 (corrupt)
20:23:45.312385 IP 192.168.1.30.36124 > 192.168.1.11.6633: Flags [.], seq 124545:127441, ack 0, win 353, options [nop,nop,TS val 64283237 ecr 69025037], length 2896: OpenFlow
	version unknown (0x02), type 0x00, length 0, xid 0x00000033 (corrupt)
20:23:45.312413 IP 192.168.1.30.36124 > 192.168.1.11.6633: Flags [.], seq 127441:130337, ack 0, win 353, options [nop,nop,TS val 64283237 ecr 69025037], length 2896: OpenFlow
	version unknown (0x0c), type 0x80, length 0, xid 0x04000000 (corrupt)
20:23:45.312730 IP 192.168.1.11.6633 > 192.168.1.30.36124: Flags [.], ack 115857, win 11534, options [nop,nop,TS val 69025040 ecr 64283237], length 0
20:23:45.312745 IP 192.168.1.11.6633 > 192.168.1.30.36124: Flags [.], ack 121649, win 11534, options [nop,nop,TS val 69025040 ecr 64283237], length 0
20:23:45.315164 IP 192.168.1.30.36124 > 192.168.1.11.6633: Flags [.], seq 130337:133233, ack 0, win 353, options [nop,nop,TS val 64283249 ecr 69025040], length 2896: OpenFlow
	version unknown (0x00), type 0x00, length 3, xid 0x7f000100 (corrupt)
20:23:45.315213 IP 192.168.1.30.36124 > 192.168.1.11.6633: Flags [.], seq 133233:136129, ack 0, win 353, options [nop,nop,TS val 64283249 ecr 69025040], length 2896: OpenFlow
	version unknown (0xff), type 0x01, length 16641, xid 0x002b0000 [|openflow]
20:23:45.315221 IP 192.168.1.30.36124 > 192.168.1.11.6633: Flags [.], seq 136129:139025, ack 0, win 353, options [nop,nop,TS val 64283249 ecr 69025040], length 2896: OpenFlow
	version unknown (0x6b), type 0x00, length 0, xid 0x00ffffff (corrupt)
20:23:45.320699 IP 192.168.1.11.6633 > 192.168.1.30.36124: Flags [.], ack 130337, win 11534, options [nop,nop,TS val 69025042 ecr 64283237], length 0
20:23:45.320708 IP 192.168.1.30.36124 > 192.168.1.11.6633: Flags [.], seq 139025:141921, ack 0, win 353, options [nop,nop,TS val 64283251 ecr 69025042], length 2896: OpenFlow
	version unknown (0x11), type 0x94, length 1, xid 0x00040a01 (corrupt)
20:23:45.320717 IP 192.168.1.30.36124 > 192.168.1.11.6633: Flags [.], seq 141921:144817, ack 0, win 353, options [nop,nop,TS val 64283251 ecr 69025042], length 2896: OpenFlow
	version unknown (0xc0), type 0x0c, length 16, xid 0x00010000
	version unknown (0x6b), type 0x00, length 0, xid 0x00ffffff (corrupt)
20:23:45.320744 IP 192.168.1.30.36124 > 192.168.1.11.6633: Flags [.], seq 144817:147713, ack 0, win 353, options [nop,nop,TS val 64283251 ecr 69025042], length 2896: OpenFlow
	version unknown (0x00), type 0x00, length 0, xid 0x0009c044 (corrupt)
20:23:45.322999 IP 192.168.1.11.6633 > 192.168.1.30.36124: Flags [.], ack 139025, win 11534, options [nop,nop,TS val 69025042 ecr 64283249], length 0
20:23:45.323007 IP 192.168.1.30.36124 > 192.168.1.11.6633: Flags [.], seq 147713:150609, ack 0, win 353, options [nop,nop,TS val 64283252 ecr 69025042], length 2896: OpenFlow
	version unknown (0x00), type 0x01, length 0, xid 0x00780008 (corrupt)
20:23:45.323015 IP 192.168.1.30.36124 > 192.168.1.11.6633: Flags [.], seq 150609:153505, ack 0, win 353, options [nop,nop,TS val 64283252 ecr 69025042], length 2896: OpenFlow
	version unknown (0x49), type 0x4e, length 21848, xid 0xc00c0021 [|openflow]
20:23:45.323041 IP 192.168.1.30.36124 > 192.168.1.11.6633: Flags [.], seq 153505:156401, ack 0, win 353, options [nop,nop,TS val 64283252 ecr 69025042], length 2896: OpenFlow
	version unknown (0x58), type 0x38, length 13919, xid 0x3634054c [|openflow]
20:23:45.323839 IP 192.168.1.11.6633 > 192.168.1.30.36124: Flags [.], ack 146265, win 11534, options [nop,nop,TS val 69025043 ecr 64283251], length 0
20:23:45.323847 IP 192.168.1.30.36124 > 192.168.1.11.6633: Flags [.], seq 156401:159297, ack 0, win 353, options [nop,nop,TS val 64283252 ecr 69025043], length 2896: OpenFlow
	version unknown (0x01), type 0x00, length 0, xid 0x78000d06 (corrupt)
20:23:45.323856 IP 192.168.1.30.36124 > 192.168.1.11.6633: Flags [.], seq 159297:162193, ack 0, win 353, options [nop,nop,TS val 64283252 ecr 69025043], length 2896: OpenFlow
	version unknown (0x02), type 0xc0, length 17600, xid 0x44000d00 [|openflow]
20:23:45.323879 IP 192.168.1.30.36124 > 192.168.1.11.6633: Flags [.], seq 162193:165089, ack 0, win 353, options [nop,nop,TS val 64283252 ecr 69025043], length 2896: OpenFlow
	version unknown (0x0c), type 0x00, length 256, xid 0x00007800
	version 1.0, type invalid (0x33), length 305, xid 0x01650164
	version unknown (0x61), type 0x3a, length 24887, xid 0x3a33643a [|openflow]
20:23:45.325406 IP 192.168.1.11.6633 > 192.168.1.30.36124: Flags [.], ack 156401, win 11534, options [nop,nop,TS val 69025043 ecr 64283251], length 0
20:23:45.325417 IP 192.168.1.30.36124 > 192.168.1.11.6633: Flags [.], seq 165089:167985, ack 0, win 353, options [nop,nop,TS val 64283253 ecr 69025043], length 2896: OpenFlow
	version unknown (0xff), type 0xfe, length 15841, xid 0x32c05100 [|openflow]
20:23:45.325426 IP 192.168.1.30.36124 > 192.168.1.11.6633: Flags [.], seq 167985:170881, ack 0, win 353, options [nop,nop,TS val 64283253 ecr 69025043], length 2896: OpenFlow
	version unknown (0x00), type 0x00, length 0, xid 0x00b84aa7 (corrupt)
20:23:45.325452 IP 192.168.1.30.36124 > 192.168.1.11.6633: Flags [.], seq 170881:173777, ack 0, win 353, options [nop,nop,TS val 64283253 ecr 69025043], length 2896: OpenFlow
	version unknown (0x00), type 0x00, length 30720, xid 0x10fe8000 [|openflow]
20:23:45.325565 IP 192.168.1.11.6633 > 192.168.1.30.36124: Flags [.], ack 165089, win 11534, options [nop,nop,TS val 69025043 ecr 64283252], length 0
20:23:45.325570 IP 192.168.1.30.36124 > 192.168.1.11.6633: Flags [.], seq 173777:176673, ack 0, win 353, options [nop,nop,TS val 64283253 ecr 69025043], length 2896: OpenFlow
	version 1.0, type invalid (0xc0), length 17408, xid 0x1c000100 [|openflow]
20:23:45.325593 IP 192.168.1.30.36124 > 192.168.1.11.6633: Flags [.], seq 176673:179569, ack 0, win 353, options [nop,nop,TS val 64283253 ecr 69025043], length 2896: OpenFlow
	version unknown (0x61), type 0x72, length 28769, xid 0x0000ff00 [|openflow]
20:23:45.325603 IP 192.168.1.30.36124 > 192.168.1.11.6633: Flags [.], seq 179569:182465, ack 0, win 353, options [nop,nop,TS val 64283253 ecr 69025043], length 2896: OpenFlow
	version unknown (0x65), type 0x01, length 26115, xid 0x69703604 [|openflow]
20:23:45.329455 IP 192.168.1.11.6633 > 192.168.1.30.36124: Flags [.], ack 182465, win 11534, options [nop,nop,TS val 69025044 ecr 64283253], length 0
20:23:45.329468 IP 192.168.1.30.36124 > 192.168.1.11.6633: Flags [.], seq 182465:185361, ack 0, win 353, options [nop,nop,TS val 64283253 ecr 69025044], length 2896: OpenFlow
	version unknown (0x30), type 0x01, length 12289, xid 0x30013801 [|openflow]
20:23:45.329477 IP 192.168.1.30.36124 > 192.168.1.11.6633: Flags [.], seq 185361:188257, ack 0, win 353, options [nop,nop,TS val 64283253 ecr 69025044], length 2896: OpenFlow
	version unknown (0x30), type 0x01, length 12289, xid 0x30013001 [|openflow]
20:23:45.329499 IP 192.168.1.30.36124 > 192.168.1.11.6633: Flags [.], seq 188257:191153, ack 0, win 353, options [nop,nop,TS val 64283253 ecr 69025044], length 2896: OpenFlow
	version unknown (0x30), type 0x01, length 12289, xid 0x30013001 [|openflow]
20:23:45.329509 IP 192.168.1.30.36124 > 192.168.1.11.6633: Flags [.], seq 191153:194049, ack 0, win 353, options [nop,nop,TS val 64283253 ecr 69025044], length 2896: OpenFlow
	version unknown (0x38), type 0x01, length 25089, xid 0x30013001 [|openflow]
20:23:45.329532 IP 192.168.1.30.36124 > 192.168.1.11.6633: Flags [.], seq 194049:196945, ack 0, win 353, options [nop,nop,TS val 64283253 ecr 69025044], length 2896: OpenFlow
	version unknown (0x37), type 0x01, length 24833, xid 0x61013401 [|openflow]
20:23:45.329541 IP 192.168.1.30.36124 > 192.168.1.11.6633: Flags [.], seq 196945:199841, ack 0, win 353, options [nop,nop,TS val 64283253 ecr 69025044], length 2896: OpenFlow
	version unknown (0x65), type 0x01, length 26113, xid 0x66016601 [|openflow]
20:23:45.331862 IP 192.168.1.11.6633 > 192.168.1.30.36124: Flags [.], ack 199841, win 11534, options [nop,nop,TS val 69025044 ecr 64283253], length 0
20:23:45.331878 IP 192.168.1.30.36124 > 192.168.1.11.6633: Flags [.], seq 199841:202737, ack 0, win 353, options [nop,nop,TS val 64283254 ecr 69025044], length 2896: OpenFlow
	version unknown (0x31), type 0x01, length 25857, xid 0x64013301 [|openflow]
20:23:45.331889 IP 192.168.1.30.36124 > 192.168.1.11.6633: Flags [.], seq 202737:205633, ack 0, win 353, options [nop,nop,TS val 64283254 ecr 69025044], length 2896: OpenFlow
	version unknown (0xff), type 0x00, length 257, xid 0x32013301
	version unknown (0xfe), type 0x3d, length 57650, xid 0xff020000 [|openflow]
20:23:45.331916 IP 192.168.1.30.36124 > 192.168.1.11.6633: Flags [.], seq 205633:208529, ack 0, win 353, options [nop,nop,TS val 64283254 ecr 69025044], length 2896: OpenFlow
	version unknown (0x62), type 0x75, length 28276, xid 0x75c03900 [|openflow]
20:23:45.331925 IP 192.168.1.30.36124 > 192.168.1.11.6633: Flags [.], seq 208529:211425, ack 0, win 353, options [nop,nop,TS val 64283254 ecr 69025044], length 2896: OpenFlow
	version unknown (0x6c), type 0x00, length 255, xid 0x00010675
	version unknown (0x00), type 0x00, length 267, xid 0x11fffe80
	version unknown (0x4c), type 0x49, length 20053, xid 0x58c00c00 [|openflow]
20:23:45.331948 IP 192.168.1.30.36124 > 192.168.1.11.6633: Flags [.], seq 211425:214321, ack 0, win 353, options [nop,nop,TS val 64283254 ecr 69025044], length 2896: OpenFlow
	version unknown (0x74), type 0x63, length 28677, xid 0x6c6f6361 [|openflow]
20:23:45.331957 IP 192.168.1.30.36124 > 192.168.1.11.6633: Flags [.], seq 214321:217217, ack 0, win 353, options [nop,nop,TS val 64283254 ecr 69025044], length 2896: OpenFlow
	version unknown (0x74), type 0x61, length 29801, xid 0x6f6e045f [|openflow]
20:23:45.333296 IP 192.168.1.11.6633 > 192.168.1.30.36124: Flags [.], ack 217217, win 11534, options [nop,nop,TS val 69025045 ecr 64283254], length 0
20:23:45.333306 IP 192.168.1.30.36124 > 192.168.1.11.6633: Flags [.], seq 217217:220113, ack 0, win 353, options [nop,nop,TS val 64283254 ecr 69025045], length 2896: OpenFlow
	version unknown (0x5d), type 0x0c, length 24439, xid 0x6f726b73 [|openflow]
20:23:45.333315 IP 192.168.1.30.36124 > 192.168.1.11.6633: Flags [.], seq 220113:223009, ack 0, win 353, options [nop,nop,TS val 64283254 ecr 69025045], length 2896: OpenFlow
	version unknown (0x33), type 0x64, length 14949, xid 0x313a3332 [|openflow]
20:23:45.333340 IP 192.168.1.30.36124 > 192.168.1.11.6633: Flags [.], seq 223009:225905, ack 0, win 353, options [nop,nop,TS val 64283254 ecr 69025045], length 2896: OpenFlow
	version unknown (0x61), type 0x3a, length 13409, xid 0x3a61373a [|openflow]
20:23:45.333349 IP 192.168.1.30.36124 > 192.168.1.11.6633: Flags [.], seq 225905:228801, ack 0, win 353, options [nop,nop,TS val 64283254 ecr 69025045], length 2896: OpenFlow
	version unknown (0x62), type 0x75, length 28276, xid 0x75205b62 [|openflow]

