18:05:55.049489 IP 192.168.1.30.40484 > 192.168.1.10.6633: Flags [.], seq 1100089757:1100091205, ack 3979584852, win 361, options [nop,nop,TS val 3923614 ecr 349062], length 1448: OpenFlow
	version 1.0, type PACKET_IN, length 125, xid 0x00000000
	version 1.0, type PACKET_IN, length 125, xid 0x00000000
	version 1.0, type PACKET_IN, length 125, xid 0x00000000
	version 1.0, type PACKET_IN, length 125, xid 0x00000000
	version 1.0, type PACKET_IN, length 125, xid 0x00000000
	version 1.0, type PACKET_IN, length 125, xid 0x00000000
	version 1.0, type PACKET_IN, length 125, xid 0x00000000
	version 1.0, type PACKET_IN, length 125, xid 0x00000000
	version 1.0, type PACKET_IN, length 125, xid 0x00000000
	version 1.0, type PACKET_IN, length 125, xid 0x00000000
	version 1.0, type PACKET_IN, length 125, xid 0x00000000
	version 1.0, type PACKET_IN, length 125, xid 0x00000000 [|openflow]
18:05:55.082747 IP 192.168.1.10.6633 > 192.168.1.30.40484: Flags [.], ack 1448, win 9460, options [nop,nop,TS val 349080 ecr 3923606], length 0
18:05:55.082786 IP 192.168.1.30.40484 > 192.168.1.10.6633: Flags [.], seq 1448:2896, ack 1, win 361, options [nop,nop,TS val 3923622 ecr 349080], length 1448: OpenFlow
	version unknown (0xe9), type 0x14, length 59648, xid 0x35a58a00 [|openflow]
18:05:55.082799 IP 192.168.1.30.40484 > 192.168.1.10.6633: Flags [.], seq 2896:5792, ack 1, win 361, options [nop,nop,TS val 3923622 ecr 349080], length 2896: OpenFlow
	version unknown (0x00), type 0x00, length 64338, xid 0x69c7f318 [|openflow]
18:05:55.082811 IP 192.168.1.30.40484 > 192.168.1.10.6633: Flags [.], seq 5792:8688, ack 1, win 361, options [nop,nop,TS val 3923622 ecr 349080], length 2896: OpenFlow
	version unknown (0x00), type 0x00, length 0, xid 0x00005069 (corrupt)
18:05:55.082819 IP 192.168.1.30.40484 > 192.168.1.10.6633: Flags [.], seq 8688:11584, ack 1, win 361, options [nop,nop,TS val 3923622 ecr 349080], length 2896: OpenFlow
	version unknown (0x00), type 0x00, length 0, xid 0x00000000 (corrupt)
18:05:55.082830 IP 192.168.1.30.40484 > 192.168.1.10.6633: Flags [.], seq 11584:14480, ack 1, win 361, options [nop,nop,TS val 3923622 ecr 349080], length 2896: OpenFlow
	version unknown (0x00), type 0x02, length 0, xid 0x00000000 (corrupt)
18:05:55.082843 IP 192.168.1.30.40484 > 192.168.1.10.6633: Flags [.], seq 14480:17376, ack 1, win 361, options [nop,nop,TS val 3923622 ecr 349080], length 2896: OpenFlow
	version unknown (0x6f), type 0x63, length 24940, xid 0x00000c00 [|openflow]
18:05:55.082854 IP 192.168.1.30.40484 > 192.168.1.10.6633: Flags [P.], seq 17376:18125, ack 1, win 361, options [nop,nop,TS val 3923622 ecr 349080], length 749: OpenFlow
	version unknown (0x0a), type 0x00, length 32000, xid 0x000000ff [|openflow]
18:05:55.106827 IP 192.168.1.30.40484 > 192.168.1.10.6633: Flags [P.], seq 18125:18250, ack 1, win 361, options [nop,nop,TS val 3923628 ecr 349080], length 125: OpenFlow
	version 1.0, type PACKET_IN, length 125, xid 0x00000000
18:05:55.106866 IP 192.168.1.30.40484 > 192.168.1.10.6633: Flags [P.], seq 18250:18375, ack 1, win 361, options [nop,nop,TS val 3923628 ecr 349080], length 125: OpenFlow
	version 1.0, type PACKET_IN, length 125, xid 0x00000000
18:05:55.106892 IP 192.168.1.30.40484 > 192.168.1.10.6633: Flags [P.], seq 18375:18500, ack 1, win 361, options [nop,nop,TS val 3923628 ecr 349080], length 125: OpenFlow
	version 1.0, type PACKET_IN, length 125, xid 0x00000000
18:05:55.106918 IP 192.168.1.30.40484 > 192.168.1.10.6633: Flags [P.], seq 18500:18625, ack 1, win 361, options [nop,nop,TS val 3923628 ecr 349080], length 125: OpenFlow
	version 1.0, type PACKET_IN, length 125, xid 0x00000000
18:05:55.106943 IP 192.168.1.30.40484 > 192.168.1.10.6633: Flags [P.], seq 18625:18750, ack 1, win 361, options [nop,nop,TS val 3923628 ecr 349080], length 125: OpenFlow
	version 1.0, type PACKET_IN, length 125, xid 0x00000000
18:05:55.106984 IP 192.168.1.30.40484 > 192.168.1.10.6633: Flags [P.], seq 18750:18875, ack 1, win 361, options [nop,nop,TS val 3923628 ecr 349080], length 125: OpenFlow
	version 1.0, type PACKET_IN, length 125, xid 0x00000000
18:05:55.107013 IP 192.168.1.30.40484 > 192.168.1.10.6633: Flags [P.], seq 18875:19000, ack 1, win 361, options [nop,nop,TS val 3923628 ecr 349080], length 125: OpenFlow
	version 1.0, type PACKET_IN, length 125, xid 0x00000000
18:05:55.107044 IP 192.168.1.30.40484 > 192.168.1.10.6633: Flags [P.], seq 19000:19125, ack 1, win 361, options [nop,nop,TS val 3923628 ecr 349080], length 125: OpenFlow
	version 1.0, type PACKET_IN, length 125, xid 0x00000000
18:05:55.107070 IP 192.168.1.30.40484 > 192.168.1.10.6633: Flags [P.], seq 19125:19250, ack 1, win 361, options [nop,nop,TS val 3923628 ecr 349080], length 125: OpenFlow
	version 1.0, type PACKET_IN, length 125, xid 0x00000000
18:05:55.107096 IP 192.168.1.30.40484 > 192.168.1.10.6633: Flags [P.], seq 19250:19375, ack 1, win 361, options [nop,nop,TS val 3923628 ecr 349080], length 125: OpenFlow
	version 1.0, type PACKET_IN, length 125, xid 0x00000000
18:05:55.121524 IP 192.168.1.10.6633 > 192.168.1.30.40484: Flags [.], ack 19375, win 9346, options [nop,nop,TS val 349090 ecr 3923622], length 0
18:05:55.121563 IP 192.168.1.30.40484 > 192.168.1.10.6633: Flags [.], seq 19375:22271, ack 1, win 361, options [nop,nop,TS val 3923632 ecr 349090], length 2896: OpenFlow
	version 1.0, type PACKET_IN, length 125, xid 0x00000000
	version 1.0, type PACKET_IN, length 125, xid 0x00000000
	version 1.0, type PACKET_IN, length 125, xid 0x00000000
	version 1.0, type PACKET_IN, length 125, xid 0x00000000
	version 1.0, type PACKET_IN, length 125, xid 0x00000000
	version 1.0, type PACKET_IN, length 125, xid 0x00000000
	version 1.0, type PACKET_IN, length 125, xid 0x00000000
	version 1.0, type PACKET_IN, length 125, xid 0x00000000
	version 1.0, type PACKET_IN, length 125, xid 0x00000000
	version 1.0, type PACKET_IN, length 125, xid 0x00000000
	version 1.0, type PACKET_IN, length 125, xid 0x00000000
	version 1.0, type PACKET_IN, length 125, xid 0x00000000
	version 1.0, type PACKET_IN, length 125, xid 0x00000000
	version 1.0, type PACKET_IN, length 125, xid 0x00000000
	version 1.0, type PACKET_IN, length 125, xid 0x00000000
	version 1.0, type PACKET_IN, length 125, xid 0x00000000
	version 1.0, type PACKET_IN, length 125, xid 0x00000000
	version 1.0, type PACKET_IN, length 125, xid 0x00000000
	version 1.0, type PACKET_IN, length 125, xid 0x00000000
	version 1.0, type PACKET_IN, length 125, xid 0x00000000
	version 1.0, type PACKET_IN, length 125, xid 0x00000000
	version 1.0, type PACKET_IN, length 125, xid 0x00000000
	version 1.0, type PACKET_IN, length 125, xid 0x00000000
	version 1.0, type PACKET_IN, length 125, xid 0x00000000 [|openflow]
18:05:55.121582 IP 192.168.1.30.40484 > 192.168.1.10.6633: Flags [.], seq 22271:25167, ack 1, win 361, options [nop,nop,TS val 3923632 ecr 349090], length 2896: OpenFlow
	version unknown (0x00), type 0x00, length 64338, xid 0x69c7f318 [|openflow]
18:05:55.121599 IP 192.168.1.30.40484 > 192.168.1.10.6633: Flags [.], seq 25167:28063, ack 1, win 361, options [nop,nop,TS val 3923632 ecr 349090], length 2896: OpenFlow
	version unknown (0x00), type 0x00, length 0, xid 0x00005069 (corrupt)
18:05:55.121615 IP 192.168.1.30.40484 > 192.168.1.10.6633: Flags [.], seq 28063:30959, ack 1, win 361, options [nop,nop,TS val 3923632 ecr 349090], length 2896: OpenFlow
	version unknown (0x00), type 0x00, length 0, xid 0x00000000 (corrupt)
18:05:55.121631 IP 192.168.1.30.40484 > 192.168.1.10.6633: Flags [.], seq 30959:33855, ack 1, win 361, options [nop,nop,TS val 3923632 ecr 349090], length 2896: OpenFlow
	version unknown (0x00), type 0x02, length 0, xid 0x00000000 (corrupt)
18:05:55.121653 IP 192.168.1.30.40484 > 192.168.1.10.6633: Flags [.], seq 33855:36751, ack 1, win 361, options [nop,nop,TS val 3923632 ecr 349090], length 2896: OpenFlow
	version unknown (0x6f), type 0x63, length 24940, xid 0x00000c00 [|openflow]
18:05:55.121670 IP 192.168.1.30.40484 > 192.168.1.10.6633: Flags [.], seq 36751:39647, ack 1, win 361, options [nop,nop,TS val 3923632 ecr 349090], length 2896: OpenFlow
	version unknown (0x0a), type 0x00, length 32000, xid 0x000000ff [|openflow]
18:05:55.121686 IP 192.168.1.30.40484 > 192.168.1.10.6633: Flags [.], seq 39647:42543, ack 1, win 361, options [nop,nop,TS val 3923632 ecr 349090], length 2896: OpenFlow
	version unknown (0x00), type 0xfb, length 21097, xid 0xc7f318d1 [|openflow]
18:05:55.121702 IP 192.168.1.30.40484 > 192.168.1.10.6633: Flags [.], seq 42543:45439, ack 1, win 361, options [nop,nop,TS val 3923632 ecr 349090], length 2896: OpenFlow
	version unknown (0x00), type 0x00, length 0, xid 0x005069c7 (corrupt)
18:05:55.121730 IP 192.168.1.30.40484 > 192.168.1.10.6633: Flags [.], seq 45439:48335, ack 1, win 361, options [nop,nop,TS val 3923632 ecr 349090], length 2896: OpenFlow
	version unknown (0x00), type 0x00, length 0, xid 0x000000fb (corrupt)
18:05:55.121756 IP 192.168.1.30.40484 > 192.168.1.10.6633: Flags [.], seq 48335:51231, ack 1, win 361, options [nop,nop,TS val 3923632 ecr 349090], length 2896: OpenFlow
	version unknown (0x02), type 0x00, length 0, xid 0x00000005 (corrupt)
18:05:55.150234 IP 192.168.1.10.6633 > 192.168.1.30.40484: Flags [.], ack 51231, win 9488, options [nop,nop,TS val 349097 ecr 3923632], length 0
18:05:55.150507 IP 192.168.1.30.40484 > 192.168.1.10.6633: Flags [.], seq 51231:54127, ack 1, win 361, options [nop,nop,TS val 3923639 ecr 349097], length 2896: OpenFlow
	version unknown (0x63), type 0x61, length 27648, xid 0x000c0001 [|openflow]
18:05:55.150524 IP 192.168.1.30.40484 > 192.168.1.10.6633: Flags [.], seq 54127:57023, ack 1, win 361, options [nop,nop,TS val 3923639 ecr 349097], length 2896: OpenFlow
	version unknown (0x00), type 0x7d, length 0, xid 0x0000ffff (corrupt)
18:05:55.150533 IP 192.168.1.30.40484 > 192.168.1.10.6633: Flags [.], seq 57023:59919, ack 1, win 361, options [nop,nop,TS val 3923639 ecr 349097], length 2896: OpenFlow
	version unknown (0xfb), type 0x52, length 27079, xid 0xf318d186 [|openflow]
18:05:55.150548 IP 192.168.1.30.40484 > 192.168.1.10.6633: Flags [.], seq 59919:62815, ack 1, win 361, options [nop,nop,TS val 3923639 ecr 349097], length 2896: OpenFlow
	version unknown (0x00), type 0x00, length 0, xid 0x5069c7ff (corrupt)
18:05:55.150558 IP 192.168.1.30.40484 > 192.168.1.10.6633: Flags [.], seq 62815:65711, ack 1, win 361, options [nop,nop,TS val 3923639 ecr 349097], length 2896: OpenFlow
	version unknown (0x00), type 0x00, length 0, xid 0x0000fb14 (corrupt)
18:05:55.150568 IP 192.168.1.30.40484 > 192.168.1.10.6633: Flags [.], seq 65711:68607, ack 1, win 361, options [nop,nop,TS val 3923639 ecr 349097], length 2896: OpenFlow
	version unknown (0x00), type 0x00, length 0, xid 0x0000055f (corrupt)
18:05:55.150581 IP 192.168.1.30.40484 > 192.168.1.10.6633: Flags [.], seq 68607:71503, ack 1, win 361, options [nop,nop,TS val 3923639 ecr 349097], length 2896: OpenFlow
	version unknown (0x61), type 0x6c, length 0, xid 0x0c000104 (corrupt)
18:05:55.150592 IP 192.168.1.30.40484 > 192.168.1.10.6633: Flags [.], seq 71503:74399, ack 1, win 361, options [nop,nop,TS val 3923639 ecr 349097], length 2896: OpenFlow
	version unknown (0x7d), type 0x00, length 0, xid 0x00ffffff (corrupt)
18:05:55.150604 IP 192.168.1.30.40484 > 192.168.1.10.6633: Flags [.], seq 74399:77295, ack 1, win 361, options [nop,nop,TS val 3923639 ecr 349097], length 2896: OpenFlow
	version unknown (0x52), type 0x69, length 51187, xid 0x18d186dd [|openflow]
18:05:55.150619 IP 192.168.1.30.40484 > 192.168.1.10.6633: Flags [.], seq 77295:80191, ack 1, win 361, options [nop,nop,TS val 3923639 ecr 349097], length 2896: OpenFlow
	version unknown (0x00), type 0x00, length 80, xid 0x69c7fffe
	version 1.0, type PACKET_IN, length 125, xid 0x00000000
	version 1.0, type PACKET_IN, length 125, xid 0x00000000
	version 1.0, type PACKET_IN, length 125, xid 0x00000000
	version 1.0, type PACKET_IN, length 125, xid 0x00000000
	version 1.0, type PACKET_IN, length 125, xid 0x00000000
	version 1.0, type PACKET_IN, length 125, xid 0x00000000
	version 1.0, type PACKET_IN, length 125, xid 0x00000000
	version 1.0, type PACKET_IN, length 125, xid 0x00000000
	version 1.0, type PACKET_IN, length 125, xid 0x00000000
	version 1.0, type PACKET_IN, length 125, xid 0x00000000
	version 1.0, type PACKET_IN, length 125, xid 0x00000000
	version 1.0, type PACKET_IN, length 125, xid 0x00000000
	version 1.0, type PACKET_IN, length 125, xid 0x00000000
	version 1.0, type PACKET_IN, length 125, xid 0x00000000
	version 1.0, type PACKET_IN, length 125, xid 0x00000000
	version 1.0, type PACKET_IN, length 125, xid 0x00000000
	version 1.0, type PACKET_IN, length 125, xid 0x00000000
	version 1.0, type PACKET_IN, length 125, xid 0x00000000
	version 1.0, type PACKET_IN, length 125, xid 0x00000000
	version 1.0, type PACKET_IN, length 125, xid 0x00000000
	version 1.0, type PACKET_IN, length 125, xid 0x00000000
	version 1.0, type PACKET_IN, length 125, xid 0x00000000
	version 1.0, type PACKET_IN, length 125, xid 0x00000000 [|openflow]
18:05:55.150629 IP 192.168.1.30.40484 > 192.168.1.10.6633: Flags [.], seq 80191:83087, ack 1, win 361, options [nop,nop,TS val 3923639 ecr 349097], length 2896: OpenFlow
	version unknown (0x00), type 0x00, length 0, xid 0x00fb14e9 (corrupt)
18:05:55.155128 IP 192.168.1.10.6633 > 192.168.1.30.40484: Flags [.], ack 83087, win 9913, options [nop,nop,TS val 349098 ecr 3923639], length 0
18:05:55.155196 IP 192.168.1.30.40484 > 192.168.1.10.6633: Flags [.], seq 83087:85983, ack 1, win 361, options [nop,nop,TS val 3923640 ecr 349098], length 2896: OpenFlow
	version unknown (0x00), type 0x00, length 0, xid 0x00055f69 (corrupt)
18:05:55.155212 IP 192.168.1.30.40484 > 192.168.1.10.6633: Flags [.], seq 85983:87431, ack 1, win 361, options [nop,nop,TS val 3923640 ecr 349098], length 1448: OpenFlow
	version unknown (0x6c), type 0x00, length 12, xid 0x0001045f
	version unknown (0x12), type 0x00, length 3072, xid 0x01010a00 [|openflow]
18:05:55.155243 IP 192.168.1.30.40484 > 192.168.1.10.6633: Flags [P.], seq 87431:88375, ack 1, win 361, options [nop,nop,TS val 3923640 ecr 349098], length 944: OpenFlow
	version unknown (0xff), type 0x02, length 0, xid 0x00000000 (corrupt)
18:05:55.155588 IP 192.168.1.10.6633 > 192.168.1.30.40484: Flags [.], ack 85983, win 9913, options [nop,nop,TS val 349098 ecr 3923640], length 0
18:05:55.155607 IP 192.168.1.10.6633 > 192.168.1.30.40484: Flags [.], ack 88375, win 9913, options [nop,nop,TS val 349098 ecr 3923640], length 0
18:05:55.242142 IP 192.168.1.30.40484 > 192.168.1.10.6633: Flags [P.], seq 88375:88500, ack 1, win 361, options [nop,nop,TS val 3923662 ecr 349098], length 125: OpenFlow
	version 1.0, type PACKET_IN, length 125, xid 0x00000000
18:05:55.242193 IP 192.168.1.30.40484 > 192.168.1.10.6633: Flags [P.], seq 88500:88625, ack 1, win 361, options [nop,nop,TS val 3923662 ecr 349098], length 125: OpenFlow
	version 1.0, type PACKET_IN, length 125, xid 0x00000000
18:05:55.242230 IP 192.168.1.30.40484 > 192.168.1.10.6633: Flags [P.], seq 88625:88750, ack 1, win 361, options [nop,nop,TS val 3923662 ecr 349098], length 125: OpenFlow
	version 1.0, type PACKET_IN, length 125, xid 0x00000000
18:05:55.242266 IP 192.168.1.30.40484 > 192.168.1.10.6633: Flags [P.], seq 88750:88875, ack 1, win 361, options [nop,nop,TS val 3923662 ecr 349098], length 125: OpenFlow
	version 1.0, type PACKET_IN, length 125, xid 0x00000000
18:05:55.242305 IP 192.168.1.30.40484 > 192.168.1.10.6633: Flags [P.], seq 88875:89000, ack 1, win 361, options [nop,nop,TS val 3923662 ecr 349098], length 125: OpenFlow
	version 1.0, type PACKET_IN, length 125, xid 0x00000000
18:05:55.242341 IP 192.168.1.30.40484 > 192.168.1.10.6633: Flags [P.], seq 89000:89125, ack 1, win 361, options [nop,nop,TS val 3923662 ecr 349098], length 125: OpenFlow
	version 1.0, type PACKET_IN, length 125, xid 0x00000000
18:05:55.242387 IP 192.168.1.30.40484 > 192.168.1.10.6633: Flags [P.], seq 89125:89250, ack 1, win 361, options [nop,nop,TS val 3923662 ecr 349098], length 125: OpenFlow
	version 1.0, type PACKET_IN, length 125, xid 0x00000000
18:05:55.242471 IP 192.168.1.30.40484 > 192.168.1.10.6633: Flags [P.], seq 89250:89375, ack 1, win 361, options [nop,nop,TS val 3923662 ecr 349098], length 125: OpenFlow
	version 1.0, type PACKET_IN, length 125, xid 0x00000000
18:05:55.242489 IP 192.168.1.30.40484 > 192.168.1.10.6633: Flags [P.], seq 89375:89500, ack 1, win 361, options [nop,nop,TS val 3923662 ecr 349098], length 125: OpenFlow
	version 1.0, type PACKET_IN, length 125, xid 0x00000000
18:05:55.242505 IP 192.168.1.30.40484 > 192.168.1.10.6633: Flags [P.], seq 89500:89625, ack 1, win 361, options [nop,nop,TS val 3923662 ecr 349098], length 125: OpenFlow
	version 1.0, type PACKET_IN, length 125, xid 0x00000000
18:05:55.242522 IP 192.168.1.30.40484 > 192.168.1.10.6633: Flags [P.], seq 89625:89750, ack 1, win 361, options [nop,nop,TS val 3923662 ecr 349098], length 125: OpenFlow
	version 1.0, type PACKET_IN, length 125, xid 0x00000000
18:05:55.242543 IP 192.168.1.30.40484 > 192.168.1.10.6633: Flags [P.], seq 89750:89875, ack 1, win 361, options [nop,nop,TS val 3923662 ecr 349098], length 125: OpenFlow
	version 1.0, type PACKET_IN, length 125, xid 0x00000000
18:05:55.242560 IP 192.168.1.30.40484 > 192.168.1.10.6633: Flags [P.], seq 89875:90000, ack 1, win 361, options [nop,nop,TS val 3923662 ecr 349098], length 125: OpenFlow
	version 1.0, type PACKET_IN, length 125, xid 0x00000000
18:05:55.242577 IP 192.168.1.30.40484 > 192.168.1.10.6633: Flags [P.], seq 90000:90125, ack 1, win 361, options [nop,nop,TS val 3923662 ecr 349098], length 125: OpenFlow
	version 1.0, type PACKET_IN, length 125, xid 0x00000000
18:05:55.242592 IP 192.168.1.30.40484 > 192.168.1.10.6633: Flags [P.], seq 90125:90250, ack 1, win 361, options [nop,nop,TS val 3923662 ecr 349098], length 125: OpenFlow
	version 1.0, type PACKET_IN, length 125, xid 0x00000000
18:05:55.242609 IP 192.168.1.30.40484 > 192.168.1.10.6633: Flags [P.], seq 90250:90375, ack 1, win 361, options [nop,nop,TS val 3923662 ecr 349098], length 125: OpenFlow
	version 1.0, type PACKET_IN, length 125, xid 0x00000000
18:05:55.242625 IP 192.168.1.30.40484 > 192.168.1.10.6633: Flags [P.], seq 90375:90500, ack 1, win 361, options [nop,nop,TS val 3923662 ecr 349098], length 125: OpenFlow
	version 1.0, type PACKET_IN, length 125, xid 0x00000000
18:05:55.242642 IP 192.168.1.30.40484 > 192.168.1.10.6633: Flags [P.], seq 90500:90625, ack 1, win 361, options [nop,nop,TS val 3923662 ecr 349098], length 125: OpenFlow
	version 1.0, type PACKET_IN, length 125, xid 0x00000000
18:05:55.242658 IP 192.168.1.30.40484 > 192.168.1.10.6633: Flags [P.], seq 90625:90750, ack 1, win 361, options [nop,nop,TS val 3923662 ecr 349098], length 125: OpenFlow
	version 1.0, type PACKET_IN, length 125, xid 0x00000000
18:05:55.242675 IP 192.168.1.30.40484 > 192.168.1.10.6633: Flags [P.], seq 90750:90875, ack 1, win 361, options [nop,nop,TS val 3923662 ecr 349098], length 125: OpenFlow
	version 1.0, type PACKET_IN, length 125, xid 0x00000000
18:05:55.242691 IP 192.168.1.30.40484 > 192.168.1.10.6633: Flags [P.], seq 90875:91000, ack 1, win 361, options [nop,nop,TS val 3923662 ecr 349098], length 125: OpenFlow
	version 1.0, type PACKET_IN, length 125, xid 0x00000000
18:05:55.242705 IP 192.168.1.30.40484 > 192.168.1.10.6633: Flags [P.], seq 91000:91125, ack 1, win 361, options [nop,nop,TS val 3923662 ecr 349098], length 125: OpenFlow
	version 1.0, type PACKET_IN, length 125, xid 0x00000000
18:05:55.242891 IP 192.168.1.10.6633 > 192.168.1.30.40484: Flags [.], ack 89125, win 9913, options [nop,nop,TS val 349120 ecr 3923662], length 0
18:05:55.242906 IP 192.168.1.30.40484 > 192.168.1.10.6633: Flags [.], seq 91125:94021, ack 1, win 361, options [nop,nop,TS val 3923662 ecr 349120], length 2896: OpenFlow
	version 1.0, type PACKET_IN, length 125, xid 0x00000000
	version 1.0, type PACKET_IN, length 125, xid 0x00000000
	version 1.0, type PACKET_IN, length 125, xid 0x00000000
	version 1.0, type PACKET_IN, length 125, xid 0x00000000
	version 1.0, type PACKET_IN, length 125, xid 0x00000000
	version 1.0, type PACKET_IN, length 125, xid 0x00000000
	version 1.0, type PACKET_IN, length 125, xid 0x00000000
	version 1.0, type PACKET_IN, length 125, xid 0x00000000
	version 1.0, type PACKET_IN, length 125, xid 0x00000000
	version 1.0, type PACKET_IN, length 125, xid 0x00000000
	version 1.0, type PACKET_IN, length 125, xid 0x00000000
	version 1.0, type PACKET_IN, length 125, xid 0x00000000
	version 1.0, type PACKET_IN, length 125, xid 0x00000000
	version 1.0, type PACKET_IN, length 125, xid 0x00000000
	version 1.0, type PACKET_IN, length 125, xid 0x00000000
	version 1.0, type PACKET_IN, length 125, xid 0x00000000
	version 1.0, type PACKET_IN, length 125, xid 0x00000000
	version 1.0, type PACKET_IN, length 125, xid 0x00000000
	version 1.0, type PACKET_IN, length 125, xid 0x00000000
	version 1.0, type PACKET_IN, length 125, xid 0x00000000
	version 1.0, type PACKET_IN, length 125, xid 0x00000000
	version 1.0, type PACKET_IN, length 125, xid 0x00000000
	version 1.0, type PACKET_IN, length 125, xid 0x00000000
	version 1.0, type PACKET_IN, length 125, xid 0x00000000 [|openflow]
18:05:55.242921 IP 192.168.1.30.40484 > 192.168.1.10.6633: Flags [P.], seq 94021:95000, ack 1, win 361, options [nop,nop,TS val 3923662 ecr 349120], length 979: OpenFlow
	version unknown (0x00), type 0x00, length 64338, xid 0x69c7f318 [|openflow]
18:05:55.242959 IP 192.168.1.30.40484 > 192.168.1.10.6633: Flags [P.], seq 95000:95125, ack 1, win 361, options [nop,nop,TS val 3923662 ecr 349120], length 125: OpenFlow
	version 1.0, type PACKET_IN, length 125, xid 0x00000000
18:05:55.242981 IP 192.168.1.10.6633 > 192.168.1.30.40484: Flags [.], ack 90625, win 9913, options [nop,nop,TS val 349120 ecr 3923662], length 0
18:05:55.242996 IP 192.168.1.10.6633 > 192.168.1.30.40484: Flags [.], ack 91125, win 9913, options [nop,nop,TS val 349120 ecr 3923662], length 0
18:05:55.243047 IP 192.168.1.30.40484 > 192.168.1.10.6633: Flags [P.], seq 95125:95250, ack 1, win 361, options [nop,nop,TS val 3923662 ecr 349120], length 125: OpenFlow
	version 1.0, type PACKET_IN, length 125, xid 0x00000000
18:05:55.243051 IP 192.168.1.10.6633 > 192.168.1.30.40484: Flags [.], ack 94021, win 9913, options [nop,nop,TS val 349120 ecr 3923662], length 0
18:05:55.243080 IP 192.168.1.30.40484 > 192.168.1.10.6633: Flags [P.], seq 95250:95375, ack 1, win 361, options [nop,nop,TS val 3923662 ecr 349120], length 125: OpenFlow
	version 1.0, type PACKET_IN, length 125, xid 0x00000000
18:05:55.243109 IP 192.168.1.30.40484 > 192.168.1.10.6633: Flags [P.], seq 95375:95500, ack 1, win 361, options [nop,nop,TS val 3923662 ecr 349120], length 125: OpenFlow
	version 1.0, type PACKET_IN, length 125, xid 0x00000000
18:05:55.243139 IP 192.168.1.30.40484 > 192.168.1.10.6633: Flags [P.], seq 95500:95625, ack 1, win 361, options [nop,nop,TS val 3923662 ecr 349120], length 125: OpenFlow
	version 1.0, type PACKET_IN, length 125, xid 0x00000000
18:05:55.243167 IP 192.168.1.30.40484 > 192.168.1.10.6633: Flags [P.], seq 95625:95750, ack 1, win 361, options [nop,nop,TS val 3923662 ecr 349120], length 125: OpenFlow
	version 1.0, type PACKET_IN, length 125, xid 0x00000000
18:05:55.243198 IP 192.168.1.30.40484 > 192.168.1.10.6633: Flags [P.], seq 95750:95875, ack 1, win 361, options [nop,nop,TS val 3923662 ecr 349120], length 125: OpenFlow
	version 1.0, type PACKET_IN, length 125, xid 0x00000000
18:05:55.243274 IP 192.168.1.30.40484 > 192.168.1.10.6633: Flags [P.], seq 95875:96000, ack 1, win 361, options [nop,nop,TS val 3923662 ecr 349120], length 125: OpenFlow
	version 1.0, type PACKET_IN, length 125, xid 0x00000000
18:05:55.243304 IP 192.168.1.10.6633 > 192.168.1.30.40484: Flags [.], ack 95500, win 9913, options [nop,nop,TS val 349120 ecr 3923662], length 0
18:05:55.243311 IP 192.168.1.10.6633 > 192.168.1.30.40484: Flags [.], ack 95875, win 9913, options [nop,nop,TS val 349120 ecr 3923662], length 0
18:05:55.243429 IP 192.168.1.30.40484 > 192.168.1.10.6633: Flags [P.], seq 96000:96125, ack 1, win 361, options [nop,nop,TS val 3923662 ecr 349120], length 125: OpenFlow
	version 1.0, type PACKET_IN, length 125, xid 0x00000000
18:05:55.243458 IP 192.168.1.30.40484 > 192.168.1.10.6633: Flags [P.], seq 96125:96250, ack 1, win 361, options [nop,nop,TS val 3923662 ecr 349120], length 125: OpenFlow
	version 1.0, type PACKET_IN, length 125, xid 0x00000000
18:05:55.243486 IP 192.168.1.30.40484 > 192.168.1.10.6633: Flags [P.], seq 96250:96375, ack 1, win 361, options [nop,nop,TS val 3923662 ecr 349120], length 125: OpenFlow
	version 1.0, type PACKET_IN, length 125, xid 0x00000000
18:05:55.243515 IP 192.168.1.30.40484 > 192.168.1.10.6633: Flags [P.], seq 96375:96500, ack 1, win 361, options [nop,nop,TS val 3923662 ecr 349120], length 125: OpenFlow
	version 1.0, type PACKET_IN, length 125, xid 0x00000000
18:05:55.243545 IP 192.168.1.30.40484 > 192.168.1.10.6633: Flags [P.], seq 96500:96625, ack 1, win 361, options [nop,nop,TS val 3923662 ecr 349120], length 125: OpenFlow
	version 1.0, type PACKET_IN, length 125, xid 0x00000000
18:05:55.243562 IP 192.168.1.10.6633 > 192.168.1.30.40484: Flags [.], ack 96000, win 9913, options [nop,nop,TS val 349120 ecr 3923662], length 0
18:05:55.243575 IP 192.168.1.30.40484 > 192.168.1.10.6633: Flags [P.], seq 96625:96750, ack 1, win 361, options [nop,nop,TS val 3923662 ecr 349120], length 125: OpenFlow
	version 1.0, type PACKET_IN, length 125, xid 0x00000000
18:05:55.243617 IP 192.168.1.30.40484 > 192.168.1.10.6633: Flags [P.], seq 96750:96875, ack 1, win 361, options [nop,nop,TS val 3923662 ecr 349120], length 125: OpenFlow
	version 1.0, type PACKET_IN, length 125, xid 0x00000000
18:05:55.243690 IP 192.168.1.30.40484 > 192.168.1.10.6633: Flags [P.], seq 96875:97000, ack 1, win 361, options [nop,nop,TS val 3923662 ecr 349120], length 125: OpenFlow
	version 1.0, type PACKET_IN, length 125, xid 0x00000000
18:05:55.243719 IP 192.168.1.30.40484 > 192.168.1.10.6633: Flags [P.], seq 97000:97125, ack 1, win 361, options [nop,nop,TS val 3923662 ecr 349120], length 125: OpenFlow
	version 1.0, type PACKET_IN, length 125, xid 0x00000000
18:05:55.243748 IP 192.168.1.30.40484 > 192.168.1.10.6633: Flags [P.], seq 97125:97250, ack 1, win 361, options [nop,nop,TS val 3923662 ecr 349120], length 125: OpenFlow
	version 1.0, type PACKET_IN, length 125, xid 0x00000000
18:05:55.243776 IP 192.168.1.30.40484 > 192.168.1.10.6633: Flags [P.], seq 97250:97375, ack 1, win 361, options [nop,nop,TS val 3923662 ecr 349120], length 125: OpenFlow
	version 1.0, type PACKET_IN, length 125, xid 0x00000000
18:05:55.243806 IP 192.168.1.30.40484 > 192.168.1.10.6633: Flags [P.], seq 97375:97500, ack 1, win 361, options [nop,nop,TS val 3923662 ecr 349120], length 125: OpenFlow
	version 1.0, type PACKET_IN, length 125, xid 0x00000000
18:05:55.243833 IP 192.168.1.30.40484 > 192.168.1.10.6633: Flags [P.], seq 97500:97625, ack 1, win 361, options [nop,nop,TS val 3923662 ecr 349120], length 125: OpenFlow
	version 1.0, type PACKET_IN, length 125, xid 0x00000000
18:05:55.243843 IP 192.168.1.10.6633 > 192.168.1.30.40484: Flags [.], ack 96875, win 9913, options [nop,nop,TS val 349120 ecr 3923662], length 0
18:05:55.243862 IP 192.168.1.30.40484 > 192.168.1.10.6633: Flags [P.], seq 97625:97750, ack 1, win 361, options [nop,nop,TS val 3923662 ecr 349120], length 125: OpenFlow
	version 1.0, type PACKET_IN, length 125, xid 0x00000000
18:05:55.243909 IP 192.168.1.30.40484 > 192.168.1.10.6633: Flags [P.], seq 97750:97875, ack 1, win 361, options [nop,nop,TS val 3923662 ecr 349120], length 125: OpenFlow
	version 1.0, type PACKET_IN, length 125, xid 0x00000000
18:05:55.243938 IP 192.168.1.30.40484 > 192.168.1.10.6633: Flags [P.], seq 97875:98000, ack 1, win 361, options [nop,nop,TS val 3923662 ecr 349120], length 125: OpenFlow
	version 1.0, type PACKET_IN, length 125, xid 0x00000000
18:05:55.243967 IP 192.168.1.30.40484 > 192.168.1.10.6633: Flags [P.], seq 98000:98125, ack 1, win 361, options [nop,nop,TS val 3923662 ecr 349120], length 125: OpenFlow
	version 1.0, type PACKET_IN, length 125, xid 0x00000000
18:05:55.243995 IP 192.168.1.30.40484 > 192.168.1.10.6633: Flags [P.], seq 98125:98250, ack 1, win 361, options [nop,nop,TS val 3923662 ecr 349120], length 125: OpenFlow
	version 1.0, type PACKET_IN, length 125, xid 0x00000000
18:05:55.244026 IP 192.168.1.30.40484 > 192.168.1.10.6633: Flags [P.], seq 98250:98375, ack 1, win 361, options [nop,nop,TS val 3923662 ecr 349120], length 125: OpenFlow
	version 1.0, type PACKET_IN, length 125, xid 0x00000000
18:05:55.244068 IP 192.168.1.30.40484 > 192.168.1.10.6633: Flags [P.], seq 98375:98500, ack 1, win 361, options [nop,nop,TS val 3923662 ecr 349120], length 125: OpenFlow
	version 1.0, type PACKET_IN, length 125, xid 0x00000000
18:05:55.244096 IP 192.168.1.30.40484 > 192.168.1.10.6633: Flags [P.], seq 98500:98625, ack 1, win 361, options [nop,nop,TS val 3923662 ecr 349120], length 125: OpenFlow
	version 1.0, type PACKET_IN, length 125, xid 0x00000000
18:05:55.244125 IP 192.168.1.30.40484 > 192.168.1.10.6633: Flags [P.], seq 98625:98750, ack 1, win 361, options [nop,nop,TS val 3923662 ecr 349120], length 125: OpenFlow
	version 1.0, type PACKET_IN, length 125, xid 0x00000000
18:05:55.244154 IP 192.168.1.30.40484 > 192.168.1.10.6633: Flags [P.], seq 98750:98875, ack 1, win 361, options [nop,nop,TS val 3923662 ecr 349120], length 125: OpenFlow
	version 1.0, type PACKET_IN, length 125, xid 0x00000000
18:05:55.244183 IP 192.168.1.30.40484 > 192.168.1.10.6633: Flags [P.], seq 98875:99000, ack 1, win 361, options [nop,nop,TS val 3923662 ecr 349120], length 125: OpenFlow
	version 1.0, type PACKET_IN, length 125, xid 0x00000000
18:05:55.244212 IP 192.168.1.30.40484 > 192.168.1.10.6633: Flags [P.], seq 99000:99125, ack 1, win 361, options [nop,nop,TS val 3923662 ecr 349120], length 125: OpenFlow
	version 1.0, type PACKET_IN, length 125, xid 0x00000000
18:05:55.244239 IP 192.168.1.30.40484 > 192.168.1.10.6633: Flags [P.], seq 99125:99250, ack 1, win 361, options [nop,nop,TS val 3923662 ecr 349120], length 125: OpenFlow
	version 1.0, type PACKET_IN, length 125, xid 0x00000000
18:05:55.244268 IP 192.168.1.30.40484 > 192.168.1.10.6633: Flags [P.], seq 99250:99375, ack 1, win 361, options [nop,nop,TS val 3923662 ecr 349120], length 125: OpenFlow
	version 1.0, type PACKET_IN, length 125, xid 0x00000000
18:05:55.244297 IP 192.168.1.30.40484 > 192.168.1.10.6633: Flags [P.], seq 99375:99500, ack 1, win 361, options [nop,nop,TS val 3923662 ecr 349120], length 125: OpenFlow
	version 1.0, type PACKET_IN, length 125, xid 0x00000000
18:05:55.244326 IP 192.168.1.30.40484 > 192.168.1.10.6633: Flags [P.], seq 99500:99625, ack 1, win 361, options [nop,nop,TS val 3923662 ecr 349120], length 125: OpenFlow
	version 1.0, type PACKET_IN, length 125, xid 0x00000000
18:05:55.244325 IP 192.168.1.10.6633 > 192.168.1.30.40484: Flags [.], ack 98125, win 9913, options [nop,nop,TS val 349120 ecr 3923662], length 0
18:05:55.244378 IP 192.168.1.30.40484 > 192.168.1.10.6633: Flags [P.], seq 99625:99750, ack 1, win 361, options [nop,nop,TS val 3923662 ecr 349120], length 125: OpenFlow
	version 1.0, type PACKET_IN, length 125, xid 0x00000000
18:05:55.244414 IP 192.168.1.30.40484 > 192.168.1.10.6633: Flags [P.], seq 99750:99875, ack 1, win 361, options [nop,nop,TS val 3923662 ecr 349120], length 125: OpenFlow
	version 1.0, type PACKET_IN, length 125, xid 0x00000000
18:05:55.244444 IP 192.168.1.30.40484 > 192.168.1.10.6633: Flags [P.], seq 99875:100000, ack 1, win 361, options [nop,nop,TS val 3923662 ecr 349120], length 125: OpenFlow
	version 1.0, type PACKET_IN, length 125, xid 0x00000000
18:05:55.244473 IP 192.168.1.30.40484 > 192.168.1.10.6633: Flags [P.], seq 100000:100125, ack 1, win 361, options [nop,nop,TS val 3923662 ecr 349120], length 125: OpenFlow
	version 1.0, type PACKET_IN, length 125, xid 0x00000000
18:05:55.244502 IP 192.168.1.30.40484 > 192.168.1.10.6633: Flags [P.], seq 100125:100250, ack 1, win 361, options [nop,nop,TS val 3923662 ecr 349120], length 125: OpenFlow
	version 1.0, type PACKET_IN, length 125, xid 0x00000000
18:05:55.244530 IP 192.168.1.30.40484 > 192.168.1.10.6633: Flags [P.], seq 100250:100375, ack 1, win 361, options [nop,nop,TS val 3923662 ecr 349120], length 125: OpenFlow
	version 1.0, type PACKET_IN, length 125, xid 0x00000000
18:05:55.244550 IP 192.168.1.10.6633 > 192.168.1.30.40484: Flags [.], ack 99500, win 9913, options [nop,nop,TS val 349120 ecr 3923662], length 0
18:05:55.244566 IP 192.168.1.30.40484 > 192.168.1.10.6633: Flags [P.], seq 100375:100500, ack 1, win 361, options [nop,nop,TS val 3923662 ecr 349120], length 125: OpenFlow
	version 1.0, type PACKET_IN, length 125, xid 0x00000000
18:05:55.244595 IP 192.168.1.30.40484 > 192.168.1.10.6633: Flags [P.], seq 100500:100625, ack 1, win 361, options [nop,nop,TS val 3923662 ecr 349120], length 125: OpenFlow
	version 1.0, type PACKET_IN, length 125, xid 0x00000000
18:05:55.244626 IP 192.168.1.30.40484 > 192.168.1.10.6633: Flags [P.], seq 100625:100750, ack 1, win 361, options [nop,nop,TS val 3923662 ecr 349120], length 125: OpenFlow
	version 1.0, type PACKET_IN, length 125, xid 0x00000000
18:05:55.244655 IP 192.168.1.30.40484 > 192.168.1.10.6633: Flags [P.], seq 100750:100875, ack 1, win 361, options [nop,nop,TS val 3923662 ecr 349120], length 125: OpenFlow
	version 1.0, type PACKET_IN, length 125, xid 0x00000000
18:05:55.244683 IP 192.168.1.30.40484 > 192.168.1.10.6633: Flags [P.], seq 100875:101000, ack 1, win 361, options [nop,nop,TS val 3923662 ecr 349120], length 125: OpenFlow
	version 1.0, type PACKET_IN, length 125, xid 0x00000000
18:05:55.244713 IP 192.168.1.30.40484 > 192.168.1.10.6633: Flags [P.], seq 101000:101125, ack 1, win 361, options [nop,nop,TS val 3923662 ecr 349120], length 125: OpenFlow
	version 1.0, type PACKET_IN, length 125, xid 0x00000000
18:05:55.244741 IP 192.168.1.30.40484 > 192.168.1.10.6633: Flags [P.], seq 101125:101250, ack 1, win 361, options [nop,nop,TS val 3923662 ecr 349120], length 125: OpenFlow
	version 1.0, type PACKET_IN, length 125, xid 0x00000000
18:05:55.244770 IP 192.168.1.30.40484 > 192.168.1.10.6633: Flags [P.], seq 101250:101375, ack 1, win 361, options [nop,nop,TS val 3923662 ecr 349120], length 125: OpenFlow
	version 1.0, type PACKET_IN, length 125, xid 0x00000000
18:05:55.244799 IP 192.168.1.30.40484 > 192.168.1.10.6633: Flags [P.], seq 101375:101500, ack 1, win 361, options [nop,nop,TS val 3923662 ecr 349120], length 125: OpenFlow
	version 1.0, type PACKET_IN, length 125, xid 0x00000000
18:05:55.244838 IP 192.168.1.30.40484 > 192.168.1.10.6633: Flags [P.], seq 101500:101625, ack 1, win 361, options [nop,nop,TS val 3923662 ecr 349120], length 125: OpenFlow
	version 1.0, type PACKET_IN, length 125, xid 0x00000000
18:05:55.244857 IP 192.168.1.10.6633 > 192.168.1.30.40484: Flags [.], ack 100375, win 9913, options [nop,nop,TS val 349120 ecr 3923662], length 0
18:05:55.244874 IP 192.168.1.30.40484 > 192.168.1.10.6633: Flags [P.], seq 101625:101750, ack 1, win 361, options [nop,nop,TS val 3923662 ecr 349120], length 125: OpenFlow
	version 1.0, type PACKET_IN, length 125, xid 0x00000000
18:05:55.244905 IP 192.168.1.30.40484 > 192.168.1.10.6633: Flags [P.], seq 101750:101875, ack 1, win 361, options [nop,nop,TS val 3923662 ecr 349120], length 125: OpenFlow
	version 1.0, type PACKET_IN, length 125, xid 0x00000000
18:05:55.244935 IP 192.168.1.30.40484 > 192.168.1.10.6633: Flags [P.], seq 101875:102000, ack 1, win 361, options [nop,nop,TS val 3923662 ecr 349120], length 125: OpenFlow
	version 1.0, type PACKET_IN, length 125, xid 0x00000000
18:05:55.244965 IP 192.168.1.30.40484 > 192.168.1.10.6633: Flags [P.], seq 102000:102125, ack 1, win 361, options [nop,nop,TS val 3923662 ecr 349120], length 125: OpenFlow
	version 1.0, type PACKET_IN, length 125, xid 0x00000000
18:05:55.244994 IP 192.168.1.30.40484 > 192.168.1.10.6633: Flags [P.], seq 102125:102250, ack 1, win 361, options [nop,nop,TS val 3923662 ecr 349120], length 125: OpenFlow
	version 1.0, type PACKET_IN, length 125, xid 0x00000000
18:05:55.245023 IP 192.168.1.30.40484 > 192.168.1.10.6633: Flags [P.], seq 102250:102375, ack 1, win 361, options [nop,nop,TS val 3923662 ecr 349120], length 125: OpenFlow
	version 1.0, type PACKET_IN, length 125, xid 0x00000000
18:05:55.245091 IP 192.168.1.30.40484 > 192.168.1.10.6633: Flags [P.], seq 102375:102500, ack 1, win 361, options [nop,nop,TS val 3923662 ecr 349120], length 125: OpenFlow
	version 1.0, type PACKET_IN, length 125, xid 0x00000000
18:05:55.245102 IP 192.168.1.10.6633 > 192.168.1.30.40484: Flags [.], ack 101875, win 9913, options [nop,nop,TS val 349120 ecr 3923662], length 0
18:05:55.245121 IP 192.168.1.10.6633 > 192.168.1.30.40484: Flags [.], ack 102000, win 9913, options [nop,nop,TS val 349120 ecr 3923662], length 0
18:05:55.245124 IP 192.168.1.30.40484 > 192.168.1.10.6633: Flags [P.], seq 102500:102625, ack 1, win 361, options [nop,nop,TS val 3923662 ecr 349120], length 125: OpenFlow
	version 1.0, type PACKET_IN, length 125, xid 0x00000000
18:05:55.245160 IP 192.168.1.30.40484 > 192.168.1.10.6633: Flags [P.], seq 102625:102750, ack 1, win 361, options [nop,nop,TS val 3923662 ecr 349120], length 125: OpenFlow
	version 1.0, type PACKET_IN, length 125, xid 0x00000000
18:05:55.245189 IP 192.168.1.30.40484 > 192.168.1.10.6633: Flags [P.], seq 102750:102875, ack 1, win 361, options [nop,nop,TS val 3923662 ecr 349120], length 125: OpenFlow
	version 1.0, type PACKET_IN, length 125, xid 0x00000000
18:05:55.245219 IP 192.168.1.30.40484 > 192.168.1.10.6633: Flags [P.], seq 102875:103000, ack 1, win 361, options [nop,nop,TS val 3923662 ecr 349120], length 125: OpenFlow
	version 1.0, type PACKET_IN, length 125, xid 0x00000000
18:05:55.245249 IP 192.168.1.30.40484 > 192.168.1.10.6633: Flags [P.], seq 103000:103125, ack 1, win 361, options [nop,nop,TS val 3923662 ecr 349120], length 125: OpenFlow
	version 1.0, type PACKET_IN, length 125, xid 0x00000000
18:05:55.245278 IP 192.168.1.30.40484 > 192.168.1.10.6633: Flags [P.], seq 103125:103250, ack 1, win 361, options [nop,nop,TS val 3923662 ecr 349120], length 125: OpenFlow
	version 1.0, type PACKET_IN, length 125, xid 0x00000000
18:05:55.245306 IP 192.168.1.30.40484 > 192.168.1.10.6633: Flags [P.], seq 103250:103375, ack 1, win 361, options [nop,nop,TS val 3923662 ecr 349120], length 125: OpenFlow
	version 1.0, type PACKET_IN, length 125, xid 0x00000000
18:05:55.245334 IP 192.168.1.10.6633 > 192.168.1.30.40484: Flags [.], ack 102625, win 9913, options [nop,nop,TS val 349120 ecr 3923662], length 0
18:05:55.245358 IP 192.168.1.30.40484 > 192.168.1.10.6633: Flags [P.], seq 103375:103500, ack 1, win 361, options [nop,nop,TS val 3923662 ecr 349120], length 125: OpenFlow
	version 1.0, type PACKET_IN, length 125, xid 0x00000000
18:05:55.245392 IP 192.168.1.30.40484 > 192.168.1.10.6633: Flags [P.], seq 103500:103625, ack 1, win 361, options [nop,nop,TS val 3923662 ecr 349120], length 125: OpenFlow
	version 1.0, type PACKET_IN, length 125, xid 0x00000000
18:05:55.245422 IP 192.168.1.30.40484 > 192.168.1.10.6633: Flags [P.], seq 103625:103750, ack 1, win 361, options [nop,nop,TS val 3923662 ecr 349120], length 125: OpenFlow
	version 1.0, type PACKET_IN, length 125, xid 0x00000000
18:05:55.245450 IP 192.168.1.30.40484 > 192.168.1.10.6633: Flags [P.], seq 103750:103875, ack 1, win 361, options [nop,nop,TS val 3923662 ecr 349120], length 125: OpenFlow
	version 1.0, type PACKET_IN, length 125, xid 0x00000000
18:05:55.245502 IP 192.168.1.30.40484 > 192.168.1.10.6633: Flags [P.], seq 103875:104000, ack 1, win 361, options [nop,nop,TS val 3923663 ecr 349120], length 125: OpenFlow
	version 1.0, type PACKET_IN, length 125, xid 0x00000000
18:05:55.245548 IP 192.168.1.30.40484 > 192.168.1.10.6633: Flags [P.], seq 104000:104125, ack 1, win 361, options [nop,nop,TS val 3923663 ecr 349120], length 125: OpenFlow
	version 1.0, type PACKET_IN, length 125, xid 0x00000000
