17:49:11.113950 IP 192.168.1.30.40475 > 192.168.1.10.6633: Flags [P.], seq 1674801922:1674802282, ack 1850633221, win 117, options [nop,nop,TS val 3672630 ecr 97978], length 360: OpenFlow
	version 1.0, type PACKET_IN, length 360, xid 0x00000000
17:49:11.113974 IP 192.168.1.30.40475 > 192.168.1.10.6633: Flags [P.], seq 360:720, ack 1, win 117, options [nop,nop,TS val 3672630 ecr 97978], length 360: OpenFlow
	version 1.0, type PACKET_IN, length 360, xid 0x00000000
17:49:11.113987 IP 192.168.1.30.40475 > 192.168.1.10.6633: Flags [P.], seq 720:1080, ack 1, win 117, options [nop,nop,TS val 3672630 ecr 97978], length 360: OpenFlow
	version 1.0, type PACKET_IN, length 360, xid 0x00000000
17:49:11.114002 IP 192.168.1.30.40475 > 192.168.1.10.6633: Flags [P.], seq 1080:1440, ack 1, win 117, options [nop,nop,TS val 3672630 ecr 97978], length 360: OpenFlow
	version 1.0, type PACKET_IN, length 360, xid 0x00000000
17:49:11.114015 IP 192.168.1.30.40475 > 192.168.1.10.6633: Flags [P.], seq 1440:1800, ack 1, win 117, options [nop,nop,TS val 3672630 ecr 97978], length 360: OpenFlow
	version 1.0, type PACKET_IN, length 360, xid 0x00000000
17:49:11.114035 IP 192.168.1.30.40475 > 192.168.1.10.6633: Flags [P.], seq 1800:2160, ack 1, win 117, options [nop,nop,TS val 3672630 ecr 97978], length 360: OpenFlow
	version 1.0, type PACKET_IN, length 360, xid 0x00000000
17:49:11.114054 IP 192.168.1.30.40475 > 192.168.1.10.6633: Flags [P.], seq 2160:2520, ack 1, win 117, options [nop,nop,TS val 3672630 ecr 97978], length 360: OpenFlow
	version 1.0, type PACKET_IN, length 360, xid 0x00000000
17:49:11.114072 IP 192.168.1.30.40475 > 192.168.1.10.6633: Flags [P.], seq 2520:2880, ack 1, win 117, options [nop,nop,TS val 3672630 ecr 97978], length 360: OpenFlow
	version 1.0, type PACKET_IN, length 360, xid 0x00000000
17:49:11.114102 IP 192.168.1.30.40475 > 192.168.1.10.6633: Flags [P.], seq 2880:3240, ack 1, win 117, options [nop,nop,TS val 3672630 ecr 97978], length 360: OpenFlow
	version 1.0, type PACKET_IN, length 360, xid 0x00000000
17:49:11.114668 IP 192.168.1.10.6633 > 192.168.1.30.40475: Flags [.], ack 360, win 1452, options [nop,nop,TS val 98088 ecr 3672630], length 0
17:49:11.114679 IP 192.168.1.10.6633 > 192.168.1.30.40475: Flags [.], ack 720, win 1452, options [nop,nop,TS val 98088 ecr 3672630], length 0
17:49:11.114687 IP 192.168.1.10.6633 > 192.168.1.30.40475: Flags [.], ack 1080, win 1452, options [nop,nop,TS val 98088 ecr 3672630], length 0
17:49:11.114696 IP 192.168.1.10.6633 > 192.168.1.30.40475: Flags [.], ack 1440, win 1452, options [nop,nop,TS val 98088 ecr 3672630], length 0
17:49:11.114704 IP 192.168.1.10.6633 > 192.168.1.30.40475: Flags [.], ack 1800, win 1450, options [nop,nop,TS val 98088 ecr 3672630], length 0
17:49:11.114713 IP 192.168.1.10.6633 > 192.168.1.30.40475: Flags [.], ack 2160, win 1448, options [nop,nop,TS val 98088 ecr 3672630], length 0
17:49:11.114736 IP 192.168.1.10.6633 > 192.168.1.30.40475: Flags [.], ack 2520, win 1446, options [nop,nop,TS val 98088 ecr 3672630], length 0
17:49:11.114746 IP 192.168.1.10.6633 > 192.168.1.30.40475: Flags [.], ack 2880, win 1444, options [nop,nop,TS val 98088 ecr 3672630], length 0
17:49:11.114760 IP 192.168.1.10.6633 > 192.168.1.30.40475: Flags [.], ack 3240, win 1442, options [nop,nop,TS val 98088 ecr 3672630], length 0
17:49:11.115443 IP 192.168.1.30.40475 > 192.168.1.10.6633: Flags [P.], seq 3240:3600, ack 1, win 117, options [nop,nop,TS val 3672630 ecr 98088], length 360: OpenFlow
	version 1.0, type PACKET_IN, length 360, xid 0x00000000
17:49:11.115462 IP 192.168.1.30.40475 > 192.168.1.10.6633: Flags [P.], seq 3600:3960, ack 1, win 117, options [nop,nop,TS val 3672630 ecr 98088], length 360: OpenFlow
	version 1.0, type PACKET_IN, length 360, xid 0x00000000
17:49:11.115480 IP 192.168.1.30.40475 > 192.168.1.10.6633: Flags [P.], seq 3960:4320, ack 1, win 117, options [nop,nop,TS val 3672630 ecr 98088], length 360: OpenFlow
	version 1.0, type PACKET_IN, length 360, xid 0x00000000
17:49:11.115507 IP 192.168.1.30.40475 > 192.168.1.10.6633: Flags [P.], seq 4320:4680, ack 1, win 117, options [nop,nop,TS val 3672630 ecr 98088], length 360: OpenFlow
	version 1.0, type PACKET_IN, length 360, xid 0x00000000
17:49:11.115618 IP 192.168.1.30.40475 > 192.168.1.10.6633: Flags [P.], seq 4680:5040, ack 1, win 117, options [nop,nop,TS val 3672630 ecr 98088], length 360: OpenFlow
	version 1.0, type PACKET_IN, length 360, xid 0x00000000
17:49:11.115643 IP 192.168.1.30.40475 > 192.168.1.10.6633: Flags [P.], seq 5040:5400, ack 1, win 117, options [nop,nop,TS val 3672630 ecr 98088], length 360: OpenFlow
	version 1.0, type PACKET_IN, length 360, xid 0x00000000
17:49:11.115673 IP 192.168.1.30.40475 > 192.168.1.10.6633: Flags [P.], seq 5400:5760, ack 1, win 117, options [nop,nop,TS val 3672630 ecr 98088], length 360: OpenFlow
	version 1.0, type PACKET_IN, length 360, xid 0x00000000
17:49:11.115696 IP 192.168.1.30.40475 > 192.168.1.10.6633: Flags [P.], seq 5760:6120, ack 1, win 117, options [nop,nop,TS val 3672630 ecr 98088], length 360: OpenFlow
	version 1.0, type PACKET_IN, length 360, xid 0x00000000
17:49:11.115716 IP 192.168.1.30.40475 > 192.168.1.10.6633: Flags [P.], seq 6120:6480, ack 1, win 117, options [nop,nop,TS val 3672630 ecr 98088], length 360: OpenFlow
	version 1.0, type PACKET_IN, length 360, xid 0x00000000
17:49:11.115733 IP 192.168.1.30.40475 > 192.168.1.10.6633: Flags [P.], seq 6480:6840, ack 1, win 117, options [nop,nop,TS val 3672630 ecr 98088], length 360: OpenFlow
	version 1.0, type PACKET_IN, length 360, xid 0x00000000
17:49:11.115750 IP 192.168.1.30.40475 > 192.168.1.10.6633: Flags [P.], seq 6840:7200, ack 1, win 117, options [nop,nop,TS val 3672630 ecr 98088], length 360: OpenFlow
	version 1.0, type PACKET_IN, length 360, xid 0x00000000
17:49:11.115766 IP 192.168.1.30.40475 > 192.168.1.10.6633: Flags [P.], seq 7200:7560, ack 1, win 117, options [nop,nop,TS val 3672630 ecr 98088], length 360: OpenFlow
	version 1.0, type PACKET_IN, length 360, xid 0x00000000
17:49:11.115910 IP 192.168.1.10.6633 > 192.168.1.30.40475: Flags [.], ack 3600, win 1452, options [nop,nop,TS val 98088 ecr 3672630], length 0
17:49:11.115924 IP 192.168.1.30.40475 > 192.168.1.10.6633: Flags [.], seq 7560:10456, ack 1, win 117, options [nop,nop,TS val 3672630 ecr 98088], length 2896: OpenFlow
	version 1.0, type PACKET_IN, length 360, xid 0x00000000
	version 1.0, type PACKET_IN, length 360, xid 0x00000000
	version 1.0, type PACKET_IN, length 360, xid 0x00000000
	version 1.0, type PACKET_IN, length 360, xid 0x00000000
	version 1.0, type PACKET_IN, length 360, xid 0x00000000
	version 1.0, type PACKET_IN, length 360, xid 0x00000000
	version 1.0, type PACKET_IN, length 360, xid 0x00000000
	version 1.0, type PACKET_IN, length 360, xid 0x00000000
	version 1.0, type PACKET_IN, length 360, xid 0x00000000 [|openflow]
17:49:11.115938 IP 192.168.1.10.6633 > 192.168.1.30.40475: Flags [.], ack 3960, win 1452, options [nop,nop,TS val 98088 ecr 3672630], length 0
17:49:11.115950 IP 192.168.1.30.40475 > 192.168.1.10.6633: Flags [.], seq 10456:13352, ack 1, win 117, options [nop,nop,TS val 3672630 ecr 98088], length 2896: OpenFlow
	version unknown (0x00), type 0x00, length 65535, xid 0xffffffff [|openflow]
17:49:11.115965 IP 192.168.1.10.6633 > 192.168.1.30.40475: Flags [.], ack 4320, win 1452, options [nop,nop,TS val 98088 ecr 3672630], length 0
17:49:11.115976 IP 192.168.1.30.40475 > 192.168.1.10.6633: Flags [.], seq 13352:16248, ack 1, win 117, options [nop,nop,TS val 3672630 ecr 98088], length 2896: OpenFlow
	version unknown (0x45), type 0x10, length 328, xid 0x00000000
	version 1.0, type PACKET_IN, length 360, xid 0x00000000
	version 1.0, type PACKET_IN, length 360, xid 0x00000000
	version 1.0, type PACKET_IN, length 360, xid 0x00000000
	version 1.0, type PACKET_IN, length 360, xid 0x00000000
	version 1.0, type PACKET_IN, length 360, xid 0x00000000
	version 1.0, type PACKET_IN, length 360, xid 0x00000000
	version 1.0, type PACKET_IN, length 360, xid 0x00000000
	version 1.0, type PACKET_IN, length 360, xid 0x00000000 [|openflow]
17:49:11.116008 IP 192.168.1.10.6633 > 192.168.1.30.40475: Flags [.], ack 4680, win 1452, options [nop,nop,TS val 98088 ecr 3672630], length 0
17:49:11.116023 IP 192.168.1.30.40475 > 192.168.1.10.6633: Flags [.], seq 16248:17696, ack 1, win 117, options [nop,nop,TS val 3672630 ecr 98088], length 1448: OpenFlow
	version unknown (0xff), type 0xff, length 65535, xid 0x00440043 [|openflow]
17:49:11.116037 IP 192.168.1.30.40475 > 192.168.1.10.6633: Flags [P.], seq 17696:18360, ack 1, win 117, options [nop,nop,TS val 3672630 ecr 98088], length 664: OpenFlow
	version 1.0, type invalid (0x34), length 42276, xid 0x01010600 [|openflow]
17:49:11.116048 IP 192.168.1.10.6633 > 192.168.1.30.40475: Flags [.], ack 5040, win 1450, options [nop,nop,TS val 98088 ecr 3672630], length 0
17:49:11.116060 IP 192.168.1.10.6633 > 192.168.1.30.40475: Flags [.], ack 5400, win 1448, options [nop,nop,TS val 98088 ecr 3672630], length 0
17:49:11.116071 IP 192.168.1.10.6633 > 192.168.1.30.40475: Flags [.], ack 5760, win 1446, options [nop,nop,TS val 98088 ecr 3672630], length 0
17:49:11.116126 IP 192.168.1.30.40475 > 192.168.1.10.6633: Flags [P.], seq 18360:18720, ack 1, win 117, options [nop,nop,TS val 3672630 ecr 98088], length 360: OpenFlow
	version 1.0, type PACKET_IN, length 360, xid 0x00000000
17:49:11.116150 IP 192.168.1.30.40475 > 192.168.1.10.6633: Flags [P.], seq 18720:19080, ack 1, win 117, options [nop,nop,TS val 3672630 ecr 98088], length 360: OpenFlow
	version 1.0, type PACKET_IN, length 360, xid 0x00000000
17:49:11.116167 IP 192.168.1.30.40475 > 192.168.1.10.6633: Flags [P.], seq 19080:19440, ack 1, win 117, options [nop,nop,TS val 3672630 ecr 98088], length 360: OpenFlow
	version 1.0, type PACKET_IN, length 360, xid 0x00000000
17:49:11.116184 IP 192.168.1.30.40475 > 192.168.1.10.6633: Flags [P.], seq 19440:19800, ack 1, win 117, options [nop,nop,TS val 3672630 ecr 98088], length 360: OpenFlow
	version 1.0, type PACKET_IN, length 360, xid 0x00000000
17:49:11.116200 IP 192.168.1.30.40475 > 192.168.1.10.6633: Flags [P.], seq 19800:20160, ack 1, win 117, options [nop,nop,TS val 3672630 ecr 98088], length 360: OpenFlow
	version 1.0, type PACKET_IN, length 360, xid 0x00000000
17:49:11.116217 IP 192.168.1.30.40475 > 192.168.1.10.6633: Flags [P.], seq 20160:20520, ack 1, win 117, options [nop,nop,TS val 3672630 ecr 98088], length 360: OpenFlow
	version 1.0, type PACKET_IN, length 360, xid 0x00000000
17:49:11.117325 IP 192.168.1.10.6633 > 192.168.1.30.40475: Flags [.], ack 13352, win 1452, options [nop,nop,TS val 98088 ecr 3672630], length 0
17:49:11.117343 IP 192.168.1.30.40475 > 192.168.1.10.6633: Flags [.], seq 20520:23416, ack 1, win 117, options [nop,nop,TS val 3672630 ecr 98088], length 2896: OpenFlow
	version 1.0, type PACKET_IN, length 360, xid 0x00000000
	version 1.0, type PACKET_IN, length 360, xid 0x00000000
	version 1.0, type PACKET_IN, length 360, xid 0x00000000
	version 1.0, type PACKET_IN, length 360, xid 0x00000000
	version 1.0, type PACKET_IN, length 360, xid 0x00000000
	version 1.0, type PACKET_IN, length 360, xid 0x00000000
	version 1.0, type PACKET_IN, length 360, xid 0x00000000
	version 1.0, type PACKET_IN, length 360, xid 0x00000000
	version 1.0, type PACKET_IN, length 360, xid 0x00000000 [|openflow]
17:49:11.117356 IP 192.168.1.30.40475 > 192.168.1.10.6633: Flags [.], seq 23416:26312, ack 1, win 117, options [nop,nop,TS val 3672630 ecr 98088], length 2896: OpenFlow
	version unknown (0x00), type 0x00, length 65535, xid 0xffffffff [|openflow]
17:49:11.117368 IP 192.168.1.30.40475 > 192.168.1.10.6633: Flags [.], seq 26312:29208, ack 1, win 117, options [nop,nop,TS val 3672630 ecr 98088], length 2896: OpenFlow
	version unknown (0x45), type 0x10, length 328, xid 0x00000000
	version 1.0, type PACKET_IN, length 360, xid 0x00000000
	version 1.0, type PACKET_IN, length 360, xid 0x00000000
	version 1.0, type PACKET_IN, length 360, xid 0x00000000
	version 1.0, type PACKET_IN, length 360, xid 0x00000000
	version 1.0, type PACKET_IN, length 360, xid 0x00000000
	version 1.0, type PACKET_IN, length 360, xid 0x00000000
	version 1.0, type PACKET_IN, length 360, xid 0x00000000
	version 1.0, type PACKET_IN, length 360, xid 0x00000000 [|openflow]
17:49:11.117379 IP 192.168.1.30.40475 > 192.168.1.10.6633: Flags [.], seq 29208:32104, ack 1, win 117, options [nop,nop,TS val 3672630 ecr 98088], length 2896: OpenFlow
	version unknown (0xff), type 0xff, length 65535, xid 0x00440043 [|openflow]
17:49:11.117390 IP 192.168.1.30.40475 > 192.168.1.10.6633: Flags [.], seq 32104:35000, ack 1, win 117, options [nop,nop,TS val 3672630 ecr 98088], length 2896: OpenFlow
	version unknown (0x8a), type 0xe2, length 28022, xid 0x00080000 [|openflow]
17:49:11.117402 IP 192.168.1.30.40475 > 192.168.1.10.6633: Flags [.], seq 35000:37896, ack 1, win 117, options [nop,nop,TS val 3672630 ecr 98088], length 2896: OpenFlow
	version unknown (0x00), type 0x00, length 0, xid 0x00000000 (corrupt)
17:49:11.117414 IP 192.168.1.30.40475 > 192.168.1.10.6633: Flags [.], seq 37896:40792, ack 1, win 117, options [nop,nop,TS val 3672630 ecr 98088], length 2896: OpenFlow
	version unknown (0x00), type 0x00, length 0, xid 0x00000000 (corrupt)
17:49:11.117603 IP 192.168.1.10.6633 > 192.168.1.30.40475: Flags [.], ack 19440, win 1452, options [nop,nop,TS val 98088 ecr 3672630], length 0
17:49:11.117619 IP 192.168.1.30.40475 > 192.168.1.10.6633: Flags [.], seq 40792:43688, ack 1, win 117, options [nop,nop,TS val 3672631 ecr 98088], length 2896: OpenFlow
	version unknown (0x63), type 0x82, length 21347, xid 0x3501010c [|openflow]
17:49:11.117634 IP 192.168.1.30.40475 > 192.168.1.10.6633: Flags [.], seq 43688:46584, ack 1, win 117, options [nop,nop,TS val 3672631 ecr 98088], length 2896: OpenFlow
	version unknown (0x12), type 0x01, length 7170, xid 0x030f0677 [|openflow]
17:49:11.117647 IP 192.168.1.30.40475 > 192.168.1.10.6633: Flags [.], seq 46584:49480, ack 1, win 117, options [nop,nop,TS val 3672631 ecr 98088], length 2896: OpenFlow
	version unknown (0x21), type 0xfc, length 11007, xid 0x00000000 [|openflow]
17:49:11.117660 IP 192.168.1.30.40475 > 192.168.1.10.6633: Flags [P.], seq 49480:52376, ack 1, win 117, options [nop,nop,TS val 3672631 ecr 98088], length 2896: OpenFlow
	version unknown (0x00), type 0x00, length 0, xid 0x00000000 (corrupt)
17:49:11.117675 IP 192.168.1.10.6633 > 192.168.1.30.40475: Flags [.], ack 20520, win 1452, options [nop,nop,TS val 98088 ecr 3672630], length 0
17:49:11.117689 IP 192.168.1.30.40475 > 192.168.1.10.6633: Flags [.], seq 52376:55272, ack 1, win 117, options [nop,nop,TS val 3672631 ecr 98088], length 2896: OpenFlow
	version 1.0, type PACKET_IN, length 360, xid 0x00000000
	version 1.0, type PACKET_IN, length 360, xid 0x00000000
	version 1.0, type PACKET_IN, length 360, xid 0x00000000
	version 1.0, type PACKET_IN, length 360, xid 0x00000000
	version 1.0, type PACKET_IN, length 360, xid 0x00000000
	version 1.0, type PACKET_IN, length 360, xid 0x00000000
	version 1.0, type PACKET_IN, length 360, xid 0x00000000
	version 1.0, type PACKET_IN, length 360, xid 0x00000000
	version 1.0, type PACKET_IN, length 360, xid 0x00000000 [|openflow]
17:49:11.118094 IP 192.168.1.10.6633 > 192.168.1.30.40475: Flags [.], ack 52376, win 1296, options [nop,nop,TS val 98089 ecr 3672630], length 0
17:49:11.118115 IP 192.168.1.30.40475 > 192.168.1.10.6633: Flags [.], seq 55272:58168, ack 1, win 117, options [nop,nop,TS val 3672631 ecr 98089], length 2896: OpenFlow
	version unknown (0x00), type 0x00, length 65535, xid 0xffffffff [|openflow]
17:49:11.118129 IP 192.168.1.30.40475 > 192.168.1.10.6633: Flags [.], seq 58168:61064, ack 1, win 117, options [nop,nop,TS val 3672631 ecr 98089], length 2896: OpenFlow
	version unknown (0x45), type 0x10, length 328, xid 0x00000000
	version 1.0, type PACKET_IN, length 360, xid 0x00000000
	version 1.0, type PACKET_IN, length 360, xid 0x00000000
	version 1.0, type PACKET_IN, length 125, xid 0x00000000
	version 1.0, type PACKET_IN, length 360, xid 0x00000000
	version 1.0, type PACKET_IN, length 360, xid 0x00000000
	version 1.0, type PACKET_IN, length 360, xid 0x00000000
	version 1.0, type PACKET_IN, length 360, xid 0x00000000
	version 1.0, type PACKET_IN, length 360, xid 0x00000000 [|openflow]
17:49:11.118143 IP 192.168.1.30.40475 > 192.168.1.10.6633: Flags [.], seq 61064:63960, ack 1, win 117, options [nop,nop,TS val 3672631 ecr 98089], length 2896: OpenFlow
	version unknown (0x00), type 0x00, length 0, xid 0x00000000 (corrupt)
17:49:11.118156 IP 192.168.1.30.40475 > 192.168.1.10.6633: Flags [.], seq 63960:66856, ack 1, win 117, options [nop,nop,TS val 3672631 ecr 98089], length 2896: OpenFlow
	version unknown (0x63), type 0x35, length 257, xid 0x0c067562
	version unknown (0x00), type 0x00, length 0, xid 0x00000000 (corrupt)
17:49:11.118169 IP 192.168.1.30.40475 > 192.168.1.10.6633: Flags [.], seq 66856:69752, ack 1, win 117, options [nop,nop,TS val 3672631 ecr 98089], length 2896: OpenFlow
	version unknown (0x00), type 0x00, length 0, xid 0x00000000 (corrupt)
17:49:11.118183 IP 192.168.1.30.40475 > 192.168.1.10.6633: Flags [.], seq 69752:72648, ack 1, win 117, options [nop,nop,TS val 3672631 ecr 98089], length 2896: OpenFlow
	version unknown (0x00), type 0x00, length 0, xid 0x00000000 (corrupt)
17:49:11.118196 IP 192.168.1.30.40475 > 192.168.1.10.6633: Flags [.], seq 72648:75544, ack 1, win 117, options [nop,nop,TS val 3672631 ecr 98089], length 2896: OpenFlow
	version unknown (0x00), type 0x00, length 0, xid 0x00000000 (corrupt)
17:49:11.118210 IP 192.168.1.30.40475 > 192.168.1.10.6633: Flags [.], seq 75544:78440, ack 1, win 117, options [nop,nop,TS val 3672631 ecr 98089], length 2896: OpenFlow
	version unknown (0x00), type 0x00, length 0, xid 0x00000000 (corrupt)
17:49:11.118224 IP 192.168.1.30.40475 > 192.168.1.10.6633: Flags [.], seq 78440:81336, ack 1, win 117, options [nop,nop,TS val 3672631 ecr 98089], length 2896: OpenFlow
	version unknown (0x00), type 0x00, length 0, xid 0x00638253 (corrupt)
17:49:11.118238 IP 192.168.1.30.40475 > 192.168.1.10.6633: Flags [.], seq 81336:84232, ack 1, win 117, options [nop,nop,TS val 3672631 ecr 98089], length 2896: OpenFlow
	version unknown (0x75), type 0x6e, length 29813, xid 0x3712011c [|openflow]
17:49:11.118251 IP 192.168.1.30.40475 > 192.168.1.10.6633: Flags [.], seq 84232:87128, ack 1, win 117, options [nop,nop,TS val 3672631 ecr 98089], length 2896: OpenFlow
	version unknown (0x1a), type 0x79, length 10873, xid 0xf921fc2a [|openflow]
17:49:11.119005 IP 192.168.1.10.6633 > 192.168.1.30.40475: Flags [.], ack 87128, win 1220, options [nop,nop,TS val 98089 ecr 3672631], length 0
17:49:11.119031 IP 192.168.1.30.40475 > 192.168.1.10.6633: Flags [.], seq 87128:90024, ack 1, win 117, options [nop,nop,TS val 3672631 ecr 98089], length 2896: OpenFlow
	version unknown (0x00), type 0x00, length 0, xid 0x00000000 (corrupt)
17:49:11.119045 IP 192.168.1.30.40475 > 192.168.1.10.6633: Flags [.], seq 90024:92920, ack 1, win 117, options [nop,nop,TS val 3672631 ecr 98089], length 2896: OpenFlow
	version unknown (0x00), type 0x00, length 0, xid 0x00010a01 (corrupt)
17:49:11.119059 IP 192.168.1.30.40475 > 192.168.1.10.6633: Flags [.], seq 92920:95816, ack 1, win 117, options [nop,nop,TS val 3672631 ecr 98089], length 2896: OpenFlow
	version unknown (0xff), type 0x01, length 22016, xid 0x040000ff [|openflow]
17:49:11.119073 IP 192.168.1.30.40475 > 192.168.1.10.6633: Flags [.], seq 95816:98712, ack 1, win 117, options [nop,nop,TS val 3672631 ecr 98089], length 2896: OpenFlow
	version unknown (0x45), type 0x6e, length 33032, xid 0x00451001 [|openflow]
17:49:11.119086 IP 192.168.1.30.40475 > 192.168.1.10.6633: Flags [.], seq 98712:101608, ack 1, win 117, options [nop,nop,TS val 3672631 ecr 98089], length 2896: OpenFlow
	version unknown (0x96), type 0x00, length 0, xid 0x00ffffff (corrupt)
17:49:11.119099 IP 192.168.1.30.40475 > 192.168.1.10.6633: Flags [.], seq 101608:104504, ack 1, win 117, options [nop,nop,TS val 3672631 ecr 98089], length 2896: OpenFlow
	version unknown (0x81), type 0x01, length 262, xid 0x00f1baa6
	version unknown (0x2c), type 0x2f, length 6777, xid 0x2a79f921 [|openflow]
17:49:11.119113 IP 192.168.1.30.40475 > 192.168.1.10.6633: Flags [.], seq 104504:107400, ack 1, win 117, options [nop,nop,TS val 3672631 ecr 98089], length 2896: OpenFlow
	version unknown (0x00), type 0x00, length 0, xid 0x00000000 (corrupt)
17:49:11.119127 IP 192.168.1.30.40475 > 192.168.1.10.6633: Flags [.], seq 107400:110296, ack 1, win 117, options [nop,nop,TS val 3672631 ecr 98089], length 2896: OpenFlow
	version unknown (0x88), type 0x63, length 32256, xid 0x00000000 [|openflow]
17:49:11.119140 IP 192.168.1.30.40475 > 192.168.1.10.6633: Flags [.], seq 110296:113192, ack 1, win 117, options [nop,nop,TS val 3672631 ecr 98089], length 2896: OpenFlow
	version unknown (0x00), type 0x00, length 0, xid 0x00000000 (corrupt)
17:49:11.119154 IP 192.168.1.30.40475 > 192.168.1.10.6633: Flags [.], seq 113192:116088, ack 1, win 117, options [nop,nop,TS val 3672631 ecr 98089], length 2896: OpenFlow
	version unknown (0x00), type 0x00, length 0, xid 0x00000000 (corrupt)
17:49:11.119168 IP 192.168.1.30.40475 > 192.168.1.10.6633: Flags [.], seq 116088:118984, ack 1, win 117, options [nop,nop,TS val 3672631 ecr 98089], length 2896: OpenFlow
	version unknown (0x00), type 0x00, length 0, xid 0x00000000 (corrupt)
17:49:11.119182 IP 192.168.1.30.40475 > 192.168.1.10.6633: Flags [.], seq 118984:121880, ack 1, win 117, options [nop,nop,TS val 3672631 ecr 98089], length 2896: OpenFlow
	version 1.0, type PORT_STATUS, length 1653, xid 0x62756e74 (corrupt)
	version unknown (0x08), type 0x00, length 17680, xid 0x01480000 [|openflow]
17:49:11.119256 IP 192.168.1.10.6633 > 192.168.1.30.40475: Flags [.], ack 95816, win 1250, options [nop,nop,TS val 98089 ecr 3672631], length 0
17:49:11.119269 IP 192.168.1.30.40475 > 192.168.1.10.6633: Flags [.], seq 121880:124776, ack 1, win 117, options [nop,nop,TS val 3672631 ecr 98089], length 2896: OpenFlow
	version unknown (0x00), type 0x00, length 0, xid 0x00000000 (corrupt)
17:49:11.119282 IP 192.168.1.30.40475 > 192.168.1.10.6633: Flags [.], seq 124776:127672, ack 1, win 117, options [nop,nop,TS val 3672631 ecr 98089], length 2896: OpenFlow
	version unknown (0x00), type 0x00, length 0, xid 0x00000000 (corrupt)
17:49:11.119295 IP 192.168.1.30.40475 > 192.168.1.10.6633: Flags [.], seq 127672:130568, ack 1, win 117, options [nop,nop,TS val 3672631 ecr 98089], length 2896: OpenFlow
	version unknown (0x00), type 0x00, length 0, xid 0x00000000 (corrupt)
17:49:11.119307 IP 192.168.1.30.40475 > 192.168.1.10.6633: Flags [.], seq 130568:133464, ack 1, win 117, options [nop,nop,TS val 3672631 ecr 98089], length 2896: OpenFlow
	version unknown (0x00), type 0x00, length 0, xid 0x00000000 (corrupt)
17:49:11.119321 IP 192.168.1.10.6633 > 192.168.1.30.40475: Flags [.], ack 116088, win 1144, options [nop,nop,TS val 98089 ecr 3672631], length 0
17:49:11.119336 IP 192.168.1.30.40475 > 192.168.1.10.6633: Flags [.], seq 133464:137808, ack 1, win 117, options [nop,nop,TS val 3672631 ecr 98089], length 4344: OpenFlow
	version unknown (0x00), type 0x00, length 0, xid 0x00000000 (corrupt)
17:49:11.119352 IP 192.168.1.30.40475 > 192.168.1.10.6633: Flags [P.], seq 137808:138335, ack 1, win 117, options [nop,nop,TS val 3672631 ecr 98089], length 527: OpenFlow
	version unknown (0x00), type 0x00, length 0, xid 0x00000000 (corrupt)
17:49:11.119772 IP 192.168.1.10.6633 > 192.168.1.30.40475: Flags [.], ack 138335, win 1190, options [nop,nop,TS val 98089 ecr 3672631], length 0
17:49:11.476330 IP 192.168.1.30.40475 > 192.168.1.10.6633: Flags [P.], seq 138335:138695, ack 1, win 117, options [nop,nop,TS val 3672720 ecr 98089], length 360: OpenFlow
	version 1.0, type PACKET_IN, length 360, xid 0x00000000
17:49:11.476361 IP 192.168.1.30.40475 > 192.168.1.10.6633: Flags [P.], seq 138695:139055, ack 1, win 117, options [nop,nop,TS val 3672720 ecr 98089], length 360: OpenFlow
	version 1.0, type PACKET_IN, length 360, xid 0x00000000
17:49:11.476380 IP 192.168.1.30.40475 > 192.168.1.10.6633: Flags [P.], seq 139055:139415, ack 1, win 117, options [nop,nop,TS val 3672720 ecr 98089], length 360: OpenFlow
	version 1.0, type PACKET_IN, length 360, xid 0x00000000
17:49:11.476397 IP 192.168.1.30.40475 > 192.168.1.10.6633: Flags [P.], seq 139415:139775, ack 1, win 117, options [nop,nop,TS val 3672720 ecr 98089], length 360: OpenFlow
	version 1.0, type PACKET_IN, length 360, xid 0x00000000
17:49:11.476414 IP 192.168.1.30.40475 > 192.168.1.10.6633: Flags [P.], seq 139775:140135, ack 1, win 117, options [nop,nop,TS val 3672720 ecr 98089], length 360: OpenFlow
	version 1.0, type PACKET_IN, length 360, xid 0x00000000
17:49:11.476431 IP 192.168.1.30.40475 > 192.168.1.10.6633: Flags [P.], seq 140135:140495, ack 1, win 117, options [nop,nop,TS val 3672720 ecr 98089], length 360: OpenFlow
	version 1.0, type PACKET_IN, length 360, xid 0x00000000
17:49:11.476448 IP 192.168.1.30.40475 > 192.168.1.10.6633: Flags [P.], seq 140495:140855, ack 1, win 117, options [nop,nop,TS val 3672720 ecr 98089], length 360: OpenFlow
	version 1.0, type PACKET_IN, length 360, xid 0x00000000
17:49:11.476465 IP 192.168.1.30.40475 > 192.168.1.10.6633: Flags [P.], seq 140855:141215, ack 1, win 117, options [nop,nop,TS val 3672720 ecr 98089], length 360: OpenFlow
	version 1.0, type PACKET_IN, length 360, xid 0x00000000
17:49:11.476491 IP 192.168.1.30.40475 > 192.168.1.10.6633: Flags [P.], seq 141215:141575, ack 1, win 117, options [nop,nop,TS val 3672720 ecr 98089], length 360: OpenFlow
	version 1.0, type PACKET_IN, length 360, xid 0x00000000
17:49:11.476746 IP 192.168.1.10.6633 > 192.168.1.30.40475: Flags [.], ack 138695, win 1452, options [nop,nop,TS val 98178 ecr 3672720], length 0
17:49:11.476756 IP 192.168.1.10.6633 > 192.168.1.30.40475: Flags [.], ack 139055, win 1452, options [nop,nop,TS val 98178 ecr 3672720], length 0
17:49:11.476764 IP 192.168.1.10.6633 > 192.168.1.30.40475: Flags [.], ack 139415, win 1452, options [nop,nop,TS val 98178 ecr 3672720], length 0
17:49:11.476772 IP 192.168.1.10.6633 > 192.168.1.30.40475: Flags [.], ack 139775, win 1452, options [nop,nop,TS val 98178 ecr 3672720], length 0
17:49:11.476779 IP 192.168.1.10.6633 > 192.168.1.30.40475: Flags [.], ack 140135, win 1450, options [nop,nop,TS val 98178 ecr 3672720], length 0
17:49:11.476787 IP 192.168.1.10.6633 > 192.168.1.30.40475: Flags [.], ack 140495, win 1448, options [nop,nop,TS val 98178 ecr 3672720], length 0
17:49:11.476795 IP 192.168.1.10.6633 > 192.168.1.30.40475: Flags [.], ack 140855, win 1446, options [nop,nop,TS val 98178 ecr 3672720], length 0
17:49:11.476803 IP 192.168.1.10.6633 > 192.168.1.30.40475: Flags [.], ack 141215, win 1444, options [nop,nop,TS val 98178 ecr 3672720], length 0
17:49:11.476810 IP 192.168.1.10.6633 > 192.168.1.30.40475: Flags [.], ack 141575, win 1442, options [nop,nop,TS val 98178 ecr 3672720], length 0
17:49:11.476863 IP 192.168.1.30.40475 > 192.168.1.10.6633: Flags [P.], seq 141575:141935, ack 1, win 117, options [nop,nop,TS val 3672720 ecr 98178], length 360: OpenFlow
	version 1.0, type PACKET_IN, length 360, xid 0x00000000
17:49:11.476882 IP 192.168.1.30.40475 > 192.168.1.10.6633: Flags [P.], seq 141935:142295, ack 1, win 117, options [nop,nop,TS val 3672720 ecr 98178], length 360: OpenFlow
	version 1.0, type PACKET_IN, length 360, xid 0x00000000
17:49:11.476898 IP 192.168.1.30.40475 > 192.168.1.10.6633: Flags [P.], seq 142295:142655, ack 1, win 117, options [nop,nop,TS val 3672720 ecr 98178], length 360: OpenFlow
	version 1.0, type PACKET_IN, length 360, xid 0x00000000
17:49:11.476915 IP 192.168.1.30.40475 > 192.168.1.10.6633: Flags [P.], seq 142655:143015, ack 1, win 117, options [nop,nop,TS val 3672720 ecr 98178], length 360: OpenFlow
	version 1.0, type PACKET_IN, length 360, xid 0x00000000
17:49:11.476935 IP 192.168.1.30.40475 > 192.168.1.10.6633: Flags [P.], seq 143015:143375, ack 1, win 117, options [nop,nop,TS val 3672720 ecr 98178], length 360: OpenFlow
	version 1.0, type PACKET_IN, length 360, xid 0x00000000
17:49:11.476953 IP 192.168.1.30.40475 > 192.168.1.10.6633: Flags [P.], seq 143375:143735, ack 1, win 117, options [nop,nop,TS val 3672720 ecr 98178], length 360: OpenFlow
	version 1.0, type PACKET_IN, length 360, xid 0x00000000
17:49:11.476969 IP 192.168.1.30.40475 > 192.168.1.10.6633: Flags [P.], seq 143735:144095, ack 1, win 117, options [nop,nop,TS val 3672720 ecr 98178], length 360: OpenFlow
	version 1.0, type PACKET_IN, length 360, xid 0x00000000
17:49:11.476987 IP 192.168.1.30.40475 > 192.168.1.10.6633: Flags [P.], seq 144095:144455, ack 1, win 117, options [nop,nop,TS val 3672720 ecr 98178], length 360: OpenFlow
	version 1.0, type PACKET_IN, length 360, xid 0x00000000
17:49:11.477004 IP 192.168.1.30.40475 > 192.168.1.10.6633: Flags [P.], seq 144455:144815, ack 1, win 117, options [nop,nop,TS val 3672720 ecr 98178], length 360: OpenFlow
	version 1.0, type PACKET_IN, length 360, xid 0x00000000
17:49:11.477236 IP 192.168.1.10.6633 > 192.168.1.30.40475: Flags [.], ack 141935, win 1474, options [nop,nop,TS val 98178 ecr 3672720], length 0
17:49:11.477250 IP 192.168.1.10.6633 > 192.168.1.30.40475: Flags [.], ack 142295, win 1497, options [nop,nop,TS val 98178 ecr 3672720], length 0
17:49:11.477260 IP 192.168.1.10.6633 > 192.168.1.30.40475: Flags [.], ack 142655, win 1519, options [nop,nop,TS val 98178 ecr 3672720], length 0
17:49:11.477270 IP 192.168.1.10.6633 > 192.168.1.30.40475: Flags [.], ack 143015, win 1542, options [nop,nop,TS val 98178 ecr 3672720], length 0
17:49:11.477279 IP 192.168.1.10.6633 > 192.168.1.30.40475: Flags [.], ack 143375, win 1565, options [nop,nop,TS val 98178 ecr 3672720], length 0
17:49:11.477289 IP 192.168.1.10.6633 > 192.168.1.30.40475: Flags [.], ack 143735, win 1587, options [nop,nop,TS val 98178 ecr 3672720], length 0
17:49:11.477298 IP 192.168.1.10.6633 > 192.168.1.30.40475: Flags [.], ack 144095, win 1610, options [nop,nop,TS val 98178 ecr 3672720], length 0
17:49:11.477307 IP 192.168.1.10.6633 > 192.168.1.30.40475: Flags [.], ack 144455, win 1633, options [nop,nop,TS val 98178 ecr 3672720], length 0
17:49:11.477317 IP 192.168.1.10.6633 > 192.168.1.30.40475: Flags [.], ack 144815, win 1655, options [nop,nop,TS val 98178 ecr 3672720], length 0
17:49:11.477389 IP 192.168.1.30.40475 > 192.168.1.10.6633: Flags [P.], seq 144815:145175, ack 1, win 117, options [nop,nop,TS val 3672720 ecr 98178], length 360: OpenFlow
	version 1.0, type PACKET_IN, length 360, xid 0x00000000
17:49:11.477415 IP 192.168.1.30.40475 > 192.168.1.10.6633: Flags [P.], seq 145175:145535, ack 1, win 117, options [nop,nop,TS val 3672720 ecr 98178], length 360: OpenFlow
	version 1.0, type PACKET_IN, length 360, xid 0x00000000
17:49:11.477434 IP 192.168.1.30.40475 > 192.168.1.10.6633: Flags [P.], seq 145535:145895, ack 1, win 117, options [nop,nop,TS val 3672720 ecr 98178], length 360: OpenFlow
	version 1.0, type PACKET_IN, length 360, xid 0x00000000
17:49:11.477452 IP 192.168.1.30.40475 > 192.168.1.10.6633: Flags [P.], seq 145895:146255, ack 1, win 117, options [nop,nop,TS val 3672720 ecr 98178], length 360: OpenFlow
	version 1.0, type PACKET_IN, length 360, xid 0x00000000
17:49:11.477470 IP 192.168.1.30.40475 > 192.168.1.10.6633: Flags [P.], seq 146255:146615, ack 1, win 117, options [nop,nop,TS val 3672720 ecr 98178], length 360: OpenFlow
	version 1.0, type PACKET_IN, length 360, xid 0x00000000
17:49:11.477507 IP 192.168.1.30.40475 > 192.168.1.10.6633: Flags [P.], seq 146615:146975, ack 1, win 117, options [nop,nop,TS val 3672721 ecr 98178], length 360: OpenFlow
	version 1.0, type PACKET_IN, length 360, xid 0x00000000
17:49:11.477525 IP 192.168.1.30.40475 > 192.168.1.10.6633: Flags [P.], seq 146975:147335, ack 1, win 117, options [nop,nop,TS val 3672721 ecr 98178], length 360: OpenFlow
	version 1.0, type PACKET_IN, length 360, xid 0x00000000
17:49:11.477550 IP 192.168.1.30.40475 > 192.168.1.10.6633: Flags [P.], seq 147335:147695, ack 1, win 117, options [nop,nop,TS val 3672721 ecr 98178], length 360: OpenFlow
	version 1.0, type PACKET_IN, length 360, xid 0x00000000
17:49:11.477578 IP 192.168.1.30.40475 > 192.168.1.10.6633: Flags [P.], seq 147695:148055, ack 1, win 117, options [nop,nop,TS val 3672721 ecr 98178], length 360: OpenFlow
	version 1.0, type PACKET_IN, length 360, xid 0x00000000
17:49:11.477600 IP 192.168.1.30.40475 > 192.168.1.10.6633: Flags [P.], seq 148055:148415, ack 1, win 117, options [nop,nop,TS val 3672721 ecr 98178], length 360: OpenFlow
	version 1.0, type PACKET_IN, length 360, xid 0x00000000
17:49:11.477617 IP 192.168.1.30.40475 > 192.168.1.10.6633: Flags [P.], seq 148415:148775, ack 1, win 117, options [nop,nop,TS val 3672721 ecr 98178], length 360: OpenFlow
	version 1.0, type PACKET_IN, length 360, xid 0x00000000
17:49:11.477633 IP 192.168.1.30.40475 > 192.168.1.10.6633: Flags [P.], seq 148775:149135, ack 1, win 117, options [nop,nop,TS val 3672721 ecr 98178], length 360: OpenFlow
	version 1.0, type PACKET_IN, length 360, xid 0x00000000
17:49:11.477650 IP 192.168.1.30.40475 > 192.168.1.10.6633: Flags [P.], seq 149135:149495, ack 1, win 117, options [nop,nop,TS val 3672721 ecr 98178], length 360: OpenFlow
	version 1.0, type PACKET_IN, length 360, xid 0x00000000
17:49:11.477666 IP 192.168.1.30.40475 > 192.168.1.10.6633: Flags [P.], seq 149495:149855, ack 1, win 117, options [nop,nop,TS val 3672721 ecr 98178], length 360: OpenFlow
	version 1.0, type PACKET_IN, length 360, xid 0x00000000
17:49:11.478225 IP 192.168.1.10.6633 > 192.168.1.30.40475: Flags [.], ack 145175, win 1678, options [nop,nop,TS val 98179 ecr 3672720], length 0
17:49:11.478238 IP 192.168.1.30.40475 > 192.168.1.10.6633: Flags [.], seq 149855:152751, ack 1, win 117, options [nop,nop,TS val 3672721 ecr 98179], length 2896: OpenFlow
	version 1.0, type PACKET_IN, length 360, xid 0x00000000
	version 1.0, type PACKET_IN, length 360, xid 0x00000000
	version 1.0, type PACKET_IN, length 360, xid 0x00000000
	version 1.0, type PACKET_IN, length 360, xid 0x00000000
	version 1.0, type PACKET_IN, length 360, xid 0x00000000
	version 1.0, type PACKET_IN, length 360, xid 0x00000000
	version 1.0, type PACKET_IN, length 360, xid 0x00000000
	version 1.0, type PACKET_IN, length 360, xid 0x00000000
	version 1.0, type PACKET_IN, length 360, xid 0x00000000 [|openflow]
17:49:11.478254 IP 192.168.1.10.6633 > 192.168.1.30.40475: Flags [.], ack 145535, win 1700, options [nop,nop,TS val 98179 ecr 3672720], length 0
17:49:11.478265 IP 192.168.1.30.40475 > 192.168.1.10.6633: Flags [.], seq 152751:155647, ack 1, win 117, options [nop,nop,TS val 3672721 ecr 98179], length 2896: OpenFlow
	version unknown (0x00), type 0x00, length 65535, xid 0xffffffff [|openflow]
17:49:11.478278 IP 192.168.1.10.6633 > 192.168.1.30.40475: Flags [.], ack 145895, win 1723, options [nop,nop,TS val 98179 ecr 3672720], length 0
17:49:11.478290 IP 192.168.1.30.40475 > 192.168.1.10.6633: Flags [.], seq 155647:158543, ack 1, win 117, options [nop,nop,TS val 3672721 ecr 98179], length 2896: OpenFlow
	version unknown (0x45), type 0x10, length 328, xid 0x00000000
	version 1.0, type PACKET_IN, length 360, xid 0x00000000
	version 1.0, type PACKET_IN, length 360, xid 0x00000000
	version 1.0, type PACKET_IN, length 360, xid 0x00000000
	version 1.0, type PACKET_IN, length 360, xid 0x00000000
	version 1.0, type PACKET_IN, length 360, xid 0x00000000
	version 1.0, type PACKET_IN, length 360, xid 0x00000000
	version 1.0, type PACKET_IN, length 360, xid 0x00000000
	version 1.0, type PACKET_IN, length 360, xid 0x00000000 [|openflow]
17:49:11.478303 IP 192.168.1.10.6633 > 192.168.1.30.40475: Flags [.], ack 146255, win 1746, options [nop,nop,TS val 98179 ecr 3672720], length 0
17:49:11.478314 IP 192.168.1.30.40475 > 192.168.1.10.6633: Flags [.], seq 158543:161439, ack 1, win 117, options [nop,nop,TS val 3672721 ecr 98179], length 2896: OpenFlow
	version unknown (0xff), type 0xff, length 65535, xid 0x00440043 [|openflow]
17:49:11.478326 IP 192.168.1.10.6633 > 192.168.1.30.40475: Flags [.], ack 146615, win 1768, options [nop,nop,TS val 98179 ecr 3672720], length 0
17:49:11.478337 IP 192.168.1.30.40475 > 192.168.1.10.6633: Flags [.], seq 161439:164335, ack 1, win 117, options [nop,nop,TS val 3672721 ecr 98179], length 2896: OpenFlow
	version unknown (0x8a), type 0xe2, length 28022, xid 0x00080000 [|openflow]
17:49:11.478349 IP 192.168.1.10.6633 > 192.168.1.30.40475: Flags [.], ack 146975, win 1791, options [nop,nop,TS val 98179 ecr 3672721], length 0
17:49:11.478360 IP 192.168.1.30.40475 > 192.168.1.10.6633: Flags [.], seq 164335:167231, ack 1, win 117, options [nop,nop,TS val 3672721 ecr 98179], length 2896: OpenFlow
	version unknown (0x00), type 0x00, length 0, xid 0x00000000 (corrupt)
17:49:11.478372 IP 192.168.1.10.6633 > 192.168.1.30.40475: Flags [.], ack 147335, win 1814, options [nop,nop,TS val 98179 ecr 3672721], length 0
17:49:11.478382 IP 192.168.1.30.40475 > 192.168.1.10.6633: Flags [.], seq 167231:170127, ack 1, win 117, options [nop,nop,TS val 3672721 ecr 98179], length 2896: OpenFlow
	version unknown (0x00), type 0x00, length 0, xid 0x00000000 (corrupt)
17:49:11.478395 IP 192.168.1.10.6633 > 192.168.1.30.40475: Flags [.], ack 147695, win 1836, options [nop,nop,TS val 98179 ecr 3672721], length 0
17:49:11.478406 IP 192.168.1.30.40475 > 192.168.1.10.6633: Flags [.], seq 170127:173023, ack 1, win 117, options [nop,nop,TS val 3672721 ecr 98179], length 2896: OpenFlow
	version unknown (0x00), type 0x00, length 0, xid 0x00000000 (corrupt)
17:49:11.478417 IP 192.168.1.10.6633 > 192.168.1.30.40475: Flags [.], ack 148055, win 1859, options [nop,nop,TS val 98179 ecr 3672721], length 0
17:49:11.478429 IP 192.168.1.30.40475 > 192.168.1.10.6633: Flags [.], seq 173023:175919, ack 1, win 117, options [nop,nop,TS val 3672721 ecr 98179], length 2896: OpenFlow
	version unknown (0x00), type 0x00, length 0, xid 0x00000000 (corrupt)
17:49:11.478442 IP 192.168.1.10.6633 > 192.168.1.30.40475: Flags [.], ack 148415, win 1881, options [nop,nop,TS val 98179 ecr 3672721], length 0
17:49:11.478453 IP 192.168.1.30.40475 > 192.168.1.10.6633: Flags [.], seq 175919:178815, ack 1, win 117, options [nop,nop,TS val 3672721 ecr 98179], length 2896: OpenFlow
	version unknown (0x00), type 0x00, length 0, xid 0x00638253 (corrupt)
17:49:11.478471 IP 192.168.1.10.6633 > 192.168.1.30.40475: Flags [.], ack 148775, win 1904, options [nop,nop,TS val 98179 ecr 3672721], length 0
17:49:11.478482 IP 192.168.1.30.40475 > 192.168.1.10.6633: Flags [.], seq 178815:181711, ack 1, win 117, options [nop,nop,TS val 3672721 ecr 98179], length 2896: OpenFlow
	version unknown (0x00), type 0x00, length 0, xid 0x00000000 (corrupt)
17:49:11.478496 IP 192.168.1.10.6633 > 192.168.1.30.40475: Flags [.], ack 149135, win 1927, options [nop,nop,TS val 98179 ecr 3672721], length 0
17:49:11.478508 IP 192.168.1.30.40475 > 192.168.1.10.6633: Flags [P.], seq 181711:182233, ack 1, win 117, options [nop,nop,TS val 3672721 ecr 98179], length 522: OpenFlow
	version unknown (0x00), type 0x00, length 0, xid 0x00000000 (corrupt)
17:49:11.478519 IP 192.168.1.10.6633 > 192.168.1.30.40475: Flags [.], ack 149495, win 1949, options [nop,nop,TS val 98179 ecr 3672721], length 0
17:49:11.478530 IP 192.168.1.10.6633 > 192.168.1.30.40475: Flags [.], ack 149855, win 1972, options [nop,nop,TS val 98179 ecr 3672721], length 0
17:49:11.478649 IP 192.168.1.10.6633 > 192.168.1.30.40475: Flags [.], ack 155647, win 2062, options [nop,nop,TS val 98179 ecr 3672721], length 0
17:49:11.478707 IP 192.168.1.10.6633 > 192.168.1.30.40475: Flags [.], ack 182233, win 2478, options [nop,nop,TS val 98179 ecr 3672721], length 0
17:49:11.478753 IP 192.168.1.30.40475 > 192.168.1.10.6633: Flags [P.], seq 182233:182593, ack 1, win 117, options [nop,nop,TS val 3672721 ecr 98179], length 360: OpenFlow
	version 1.0, type PACKET_IN, length 360, xid 0x00000000
17:49:11.478773 IP 192.168.1.30.40475 > 192.168.1.10.6633: Flags [P.], seq 182593:182953, ack 1, win 117, options [nop,nop,TS val 3672721 ecr 98179], length 360: OpenFlow
	version 1.0, type PACKET_IN, length 360, xid 0x00000000
17:49:11.479219 IP 192.168.1.30.40475 > 192.168.1.10.6633: Flags [P.], seq 182953:183313, ack 1, win 117, options [nop,nop,TS val 3672721 ecr 98179], length 360: OpenFlow
	version 1.0, type PACKET_IN, length 360, xid 0x00000000
17:49:11.479242 IP 192.168.1.30.40475 > 192.168.1.10.6633: Flags [P.], seq 183313:183673, ack 1, win 117, options [nop,nop,TS val 3672721 ecr 98179], length 360: OpenFlow
	version 1.0, type PACKET_IN, length 360, xid 0x00000000
17:49:11.479260 IP 192.168.1.30.40475 > 192.168.1.10.6633: Flags [P.], seq 183673:184033, ack 1, win 117, options [nop,nop,TS val 3672721 ecr 98179], length 360: OpenFlow
	version 1.0, type PACKET_IN, length 360, xid 0x00000000
17:49:11.479278 IP 192.168.1.30.40475 > 192.168.1.10.6633: Flags [P.], seq 184033:184393, ack 1, win 117, options [nop,nop,TS val 3672721 ecr 98179], length 360: OpenFlow
	version 1.0, type PACKET_IN, length 360, xid 0x00000000
17:49:11.479295 IP 192.168.1.30.40475 > 192.168.1.10.6633: Flags [P.], seq 184393:184753, ack 1, win 117, options [nop,nop,TS val 3672721 ecr 98179], length 360: OpenFlow
	version 1.0, type PACKET_IN, length 360, xid 0x00000000
17:49:11.479313 IP 192.168.1.30.40475 > 192.168.1.10.6633: Flags [P.], seq 184753:185113, ack 1, win 117, options [nop,nop,TS val 3672721 ecr 98179], length 360: OpenFlow
	version 1.0, type PACKET_IN, length 360, xid 0x00000000
17:49:11.479331 IP 192.168.1.30.40475 > 192.168.1.10.6633: Flags [P.], seq 185113:185473, ack 1, win 117, options [nop,nop,TS val 3672721 ecr 98179], length 360: OpenFlow
	version 1.0, type PACKET_IN, length 360, xid 0x00000000
17:49:11.479349 IP 192.168.1.30.40475 > 192.168.1.10.6633: Flags [P.], seq 185473:185833, ack 1, win 117, options [nop,nop,TS val 3672721 ecr 98179], length 360: OpenFlow
	version 1.0, type PACKET_IN, length 360, xid 0x00000000
17:49:11.479376 IP 192.168.1.30.40475 > 192.168.1.10.6633: Flags [P.], seq 185833:186193, ack 1, win 117, options [nop,nop,TS val 3672721 ecr 98179], length 360: OpenFlow
	version 1.0, type PACKET_IN, length 360, xid 0x00000000
17:49:11.479398 IP 192.168.1.30.40475 > 192.168.1.10.6633: Flags [P.], seq 186193:186553, ack 1, win 117, options [nop,nop,TS val 3672721 ecr 98179], length 360: OpenFlow
	version 1.0, type PACKET_IN, length 360, xid 0x00000000
17:49:11.479415 IP 192.168.1.30.40475 > 192.168.1.10.6633: Flags [P.], seq 186553:186913, ack 1, win 117, options [nop,nop,TS val 3672721 ecr 98179], length 360: OpenFlow
	version 1.0, type PACKET_IN, length 360, xid 0x00000000
17:49:11.479431 IP 192.168.1.30.40475 > 192.168.1.10.6633: Flags [P.], seq 186913:187273, ack 1, win 117, options [nop,nop,TS val 3672721 ecr 98179], length 360: OpenFlow
	version 1.0, type PACKET_IN, length 360, xid 0x00000000
17:49:11.479449 IP 192.168.1.30.40475 > 192.168.1.10.6633: Flags [P.], seq 187273:187633, ack 1, win 117, options [nop,nop,TS val 3672721 ecr 98179], length 360: OpenFlow
	version 1.0, type PACKET_IN, length 360, xid 0x00000000
17:49:11.479467 IP 192.168.1.30.40475 > 192.168.1.10.6633: Flags [P.], seq 187633:187993, ack 1, win 117, options [nop,nop,TS val 3672721 ecr 98179], length 360: OpenFlow
	version 1.0, type PACKET_IN, length 360, xid 0x00000000
17:49:11.479493 IP 192.168.1.10.6633 > 192.168.1.30.40475: Flags [.], ack 182593, win 2500, options [nop,nop,TS val 98179 ecr 3672721], length 0
17:49:11.479503 IP 192.168.1.10.6633 > 192.168.1.30.40475: Flags [.], ack 182953, win 2523, options [nop,nop,TS val 98179 ecr 3672721], length 0
17:49:11.479544 IP 192.168.1.10.6633 > 192.168.1.30.40475: Flags [.], ack 183313, win 2546, options [nop,nop,TS val 98179 ecr 3672721], length 0
17:49:11.479554 IP 192.168.1.10.6633 > 192.168.1.30.40475: Flags [.], ack 183673, win 2568, options [nop,nop,TS val 98179 ecr 3672721], length 0
17:49:11.479562 IP 192.168.1.10.6633 > 192.168.1.30.40475: Flags [.], ack 184033, win 2591, options [nop,nop,TS val 98179 ecr 3672721], length 0
17:49:11.479570 IP 192.168.1.10.6633 > 192.168.1.30.40475: Flags [.], ack 184393, win 2614, options [nop,nop,TS val 98179 ecr 3672721], length 0
17:49:11.479609 IP 192.168.1.10.6633 > 192.168.1.30.40475: Flags [.], ack 184753, win 2636, options [nop,nop,TS val 98179 ecr 3672721], length 0
17:49:11.479618 IP 192.168.1.10.6633 > 192.168.1.30.40475: Flags [.], ack 185113, win 2659, options [nop,nop,TS val 98179 ecr 3672721], length 0
17:49:11.479626 IP 192.168.1.10.6633 > 192.168.1.30.40475: Flags [.], ack 185473, win 2681, options [nop,nop,TS val 98179 ecr 3672721], length 0
17:49:11.479635 IP 192.168.1.10.6633 > 192.168.1.30.40475: Flags [.], ack 185833, win 2704, options [nop,nop,TS val 98179 ecr 3672721], length 0
17:49:11.479713 IP 192.168.1.30.40475 > 192.168.1.10.6633: Flags [P.], seq 187993:188353, ack 1, win 117, options [nop,nop,TS val 3672721 ecr 98179], length 360: OpenFlow
	version 1.0, type PACKET_IN, length 360, xid 0x00000000
17:49:11.479733 IP 192.168.1.30.40475 > 192.168.1.10.6633: Flags [P.], seq 188353:188713, ack 1, win 117, options [nop,nop,TS val 3672721 ecr 98179], length 360: OpenFlow
	version 1.0, type PACKET_IN, length 360, xid 0x00000000
17:49:11.479750 IP 192.168.1.30.40475 > 192.168.1.10.6633: Flags [P.], seq 188713:189073, ack 1, win 117, options [nop,nop,TS val 3672721 ecr 98179], length 360: OpenFlow
	version 1.0, type PACKET_IN, length 360, xid 0x00000000
17:49:11.479767 IP 192.168.1.30.40475 > 192.168.1.10.6633: Flags [P.], seq 189073:189433, ack 1, win 117, options [nop,nop,TS val 3672721 ecr 98179], length 360: OpenFlow
	version 1.0, type PACKET_IN, length 360, xid 0x00000000
17:49:11.479784 IP 192.168.1.30.40475 > 192.168.1.10.6633: Flags [P.], seq 189433:189793, ack 1, win 117, options [nop,nop,TS val 3672721 ecr 98179], length 360: OpenFlow
	version 1.0, type PACKET_IN, length 360, xid 0x00000000
17:49:11.479800 IP 192.168.1.30.40475 > 192.168.1.10.6633: Flags [P.], seq 189793:190153, ack 1, win 117, options [nop,nop,TS val 3672721 ecr 98179], length 360: OpenFlow
	version 1.0, type PACKET_IN, length 360, xid 0x00000000
17:49:11.479818 IP 192.168.1.30.40475 > 192.168.1.10.6633: Flags [P.], seq 190153:190513, ack 1, win 117, options [nop,nop,TS val 3672721 ecr 98179], length 360: OpenFlow
	version 1.0, type PACKET_IN, length 360, xid 0x00000000
17:49:11.479835 IP 192.168.1.30.40475 > 192.168.1.10.6633: Flags [P.], seq 190513:190873, ack 1, win 117, options [nop,nop,TS val 3672721 ecr 98179], length 360: OpenFlow
	version 1.0, type PACKET_IN, length 360, xid 0x00000000
17:49:11.479875 IP 192.168.1.10.6633 > 192.168.1.30.40475: Flags [.], ack 186193, win 2727, options [nop,nop,TS val 98179 ecr 3672721], length 0
17:49:11.479885 IP 192.168.1.10.6633 > 192.168.1.30.40475: Flags [.], ack 186553, win 2749, options [nop,nop,TS val 98179 ecr 3672721], length 0
17:49:11.479893 IP 192.168.1.10.6633 > 192.168.1.30.40475: Flags [.], ack 186913, win 2772, options [nop,nop,TS val 98179 ecr 3672721], length 0
17:49:11.479901 IP 192.168.1.10.6633 > 192.168.1.30.40475: Flags [.], ack 187273, win 2795, options [nop,nop,TS val 98179 ecr 3672721], length 0
17:49:11.479908 IP 192.168.1.10.6633 > 192.168.1.30.40475: Flags [.], ack 187633, win 2817, options [nop,nop,TS val 98179 ecr 3672721], length 0
17:49:11.479917 IP 192.168.1.10.6633 > 192.168.1.30.40475: Flags [.], ack 187993, win 2840, options [nop,nop,TS val 98179 ecr 3672721], length 0
17:49:11.479929 IP 192.168.1.30.40475 > 192.168.1.10.6633: Flags [P.], seq 190873:191233, ack 1, win 117, options [nop,nop,TS val 3672721 ecr 98179], length 360: OpenFlow
	version 1.0, type PACKET_IN, length 360, xid 0x00000000
17:49:11.479957 IP 192.168.1.30.40475 > 192.168.1.10.6633: Flags [P.], seq 191233:191593, ack 1, win 117, options [nop,nop,TS val 3672721 ecr 98179], length 360: OpenFlow
	version 1.0, type PACKET_IN, length 360, xid 0x00000000
17:49:11.479974 IP 192.168.1.30.40475 > 192.168.1.10.6633: Flags [P.], seq 191593:191953, ack 1, win 117, options [nop,nop,TS val 3672721 ecr 98179], length 360: OpenFlow
	version 1.0, type PACKET_IN, length 360, xid 0x00000000
17:49:11.479998 IP 192.168.1.10.6633 > 192.168.1.30.40475: Flags [.], ack 188353, win 2862, options [nop,nop,TS val 98179 ecr 3672721], length 0
17:49:11.480007 IP 192.168.1.10.6633 > 192.168.1.30.40475: Flags [.], ack 188713, win 2885, options [nop,nop,TS val 98179 ecr 3672721], length 0
17:49:11.480015 IP 192.168.1.10.6633 > 192.168.1.30.40475: Flags [.], ack 189073, win 2908, options [nop,nop,TS val 98179 ecr 3672721], length 0
17:49:11.480023 IP 192.168.1.10.6633 > 192.168.1.30.40475: Flags [.], ack 189433, win 2930, options [nop,nop,TS val 98179 ecr 3672721], length 0
17:49:11.480031 IP 192.168.1.10.6633 > 192.168.1.30.40475: Flags [.], ack 189793, win 2953, options [nop,nop,TS val 98179 ecr 3672721], length 0
17:49:11.480039 IP 192.168.1.10.6633 > 192.168.1.30.40475: Flags [.], ack 190153, win 2976, options [nop,nop,TS val 98179 ecr 3672721], length 0
17:49:11.480047 IP 192.168.1.10.6633 > 192.168.1.30.40475: Flags [.], ack 190513, win 2998, options [nop,nop,TS val 98179 ecr 3672721], length 0
17:49:11.480055 IP 192.168.1.10.6633 > 192.168.1.30.40475: Flags [.], ack 190873, win 3021, options [nop,nop,TS val 98179 ecr 3672721], length 0
17:49:11.480062 IP 192.168.1.10.6633 > 192.168.1.30.40475: Flags [.], ack 191233, win 3043, options [nop,nop,TS val 98179 ecr 3672721], length 0
17:49:11.480070 IP 192.168.1.10.6633 > 192.168.1.30.40475: Flags [.], ack 191593, win 3066, options [nop,nop,TS val 98179 ecr 3672721], length 0
17:49:11.480079 IP 192.168.1.10.6633 > 192.168.1.30.40475: Flags [.], ack 191953, win 3089, options [nop,nop,TS val 98179 ecr 3672721], length 0
17:49:11.480127 IP 192.168.1.30.40475 > 192.168.1.10.6633: Flags [P.], seq 191953:192313, ack 1, win 117, options [nop,nop,TS val 3672721 ecr 98179], length 360: OpenFlow
	version 1.0, type PACKET_IN, length 360, xid 0x00000000
17:49:11.480145 IP 192.168.1.30.40475 > 192.168.1.10.6633: Flags [P.], seq 192313:192673, ack 1, win 117, options [nop,nop,TS val 3672721 ecr 98179], length 360: OpenFlow
	version 1.0, type PACKET_IN, length 360, xid 0x00000000
17:49:11.480162 IP 192.168.1.30.40475 > 192.168.1.10.6633: Flags [P.], seq 192673:193033, ack 1, win 117, options [nop,nop,TS val 3672721 ecr 98179], length 360: OpenFlow
	version 1.0, type PACKET_IN, length 360, xid 0x00000000
17:49:11.480179 IP 192.168.1.30.40475 > 192.168.1.10.6633: Flags [P.], seq 193033:193393, ack 1, win 117, options [nop,nop,TS val 3672721 ecr 98179], length 360: OpenFlow
	version 1.0, type PACKET_IN, length 360, xid 0x00000000
17:49:11.480195 IP 192.168.1.30.40475 > 192.168.1.10.6633: Flags [P.], seq 193393:193753, ack 1, win 117, options [nop,nop,TS val 3672721 ecr 98179], length 360: OpenFlow
	version 1.0, type PACKET_IN, length 360, xid 0x00000000
17:49:11.480212 IP 192.168.1.30.40475 > 192.168.1.10.6633: Flags [P.], seq 193753:194113, ack 1, win 117, options [nop,nop,TS val 3672721 ecr 98179], length 360: OpenFlow
	version 1.0, type PACKET_IN, length 360, xid 0x00000000
17:49:11.480229 IP 192.168.1.30.40475 > 192.168.1.10.6633: Flags [P.], seq 194113:194473, ack 1, win 117, options [nop,nop,TS val 3672721 ecr 98179], length 360: OpenFlow
	version 1.0, type PACKET_IN, length 360, xid 0x00000000
17:49:11.480246 IP 192.168.1.30.40475 > 192.168.1.10.6633: Flags [P.], seq 194473:194833, ack 1, win 117, options [nop,nop,TS val 3672721 ecr 98179], length 360: OpenFlow
	version 1.0, type PACKET_IN, length 360, xid 0x00000000
17:49:11.480270 IP 192.168.1.30.40475 > 192.168.1.10.6633: Flags [P.], seq 194833:195193, ack 1, win 117, options [nop,nop,TS val 3672721 ecr 98179], length 360: OpenFlow
	version 1.0, type PACKET_IN, length 360, xid 0x00000000
17:49:11.480287 IP 192.168.1.30.40475 > 192.168.1.10.6633: Flags [P.], seq 195193:195553, ack 1, win 117, options [nop,nop,TS val 3672721 ecr 98179], length 360: OpenFlow
	version 1.0, type PACKET_IN, length 360, xid 0x00000000
17:49:11.480305 IP 192.168.1.30.40475 > 192.168.1.10.6633: Flags [P.], seq 195553:195913, ack 1, win 117, options [nop,nop,TS val 3672721 ecr 98179], length 360: OpenFlow
	version 1.0, type PACKET_IN, length 360, xid 0x00000000
17:49:11.480323 IP 192.168.1.30.40475 > 192.168.1.10.6633: Flags [P.], seq 195913:196273, ack 1, win 117, options [nop,nop,TS val 3672721 ecr 98179], length 360: OpenFlow
	version 1.0, type PACKET_IN, length 360, xid 0x00000000
17:49:11.480353 IP 192.168.1.10.6633 > 192.168.1.30.40475: Flags [.], ack 192313, win 3111, options [nop,nop,TS val 98179 ecr 3672721], length 0
17:49:11.480363 IP 192.168.1.10.6633 > 192.168.1.30.40475: Flags [.], ack 192673, win 3134, options [nop,nop,TS val 98179 ecr 3672721], length 0
17:49:11.480370 IP 192.168.1.10.6633 > 192.168.1.30.40475: Flags [.], ack 193033, win 3157, options [nop,nop,TS val 98179 ecr 3672721], length 0
17:49:11.480384 IP 192.168.1.10.6633 > 192.168.1.30.40475: Flags [.], ack 193393, win 3179, options [nop,nop,TS val 98179 ecr 3672721], length 0
17:49:11.480392 IP 192.168.1.10.6633 > 192.168.1.30.40475: Flags [.], ack 193753, win 3202, options [nop,nop,TS val 98179 ecr 3672721], length 0
17:49:11.480400 IP 192.168.1.10.6633 > 192.168.1.30.40475: Flags [.], ack 194113, win 3224, options [nop,nop,TS val 98179 ecr 3672721], length 0
17:49:11.480408 IP 192.168.1.10.6633 > 192.168.1.30.40475: Flags [.], ack 194473, win 3247, options [nop,nop,TS val 98179 ecr 3672721], length 0
17:49:11.480416 IP 192.168.1.10.6633 > 192.168.1.30.40475: Flags [.], ack 194833, win 3270, options [nop,nop,TS val 98179 ecr 3672721], length 0
17:49:11.480424 IP 192.168.1.10.6633 > 192.168.1.30.40475: Flags [.], ack 195193, win 3292, options [nop,nop,TS val 98179 ecr 3672721], length 0
17:49:11.480431 IP 192.168.1.10.6633 > 192.168.1.30.40475: Flags [.], ack 195553, win 3315, options [nop,nop,TS val 98179 ecr 3672721], length 0
17:49:11.480439 IP 192.168.1.10.6633 > 192.168.1.30.40475: Flags [.], ack 195913, win 3338, options [nop,nop,TS val 98179 ecr 3672721], length 0
17:49:11.480465 IP 192.168.1.30.40475 > 192.168.1.10.6633: Flags [P.], seq 196273:196633, ack 1, win 117, options [nop,nop,TS val 3672721 ecr 98179], length 360: OpenFlow
	version 1.0, type PACKET_IN, length 360, xid 0x00000000
17:49:11.480497 IP 192.168.1.30.40475 > 192.168.1.10.6633: Flags [P.], seq 196633:196993, ack 1, win 117, options [nop,nop,TS val 3672721 ecr 98179], length 360: OpenFlow
	version 1.0, type PACKET_IN, length 360, xid 0x00000000
17:49:11.480515 IP 192.168.1.30.40475 > 192.168.1.10.6633: Flags [P.], seq 196993:197353, ack 1, win 117, options [nop,nop,TS val 3672721 ecr 98179], length 360: OpenFlow
	version 1.0, type PACKET_IN, length 360, xid 0x00000000
17:49:11.480532 IP 192.168.1.30.40475 > 192.168.1.10.6633: Flags [P.], seq 197353:197713, ack 1, win 117, options [nop,nop,TS val 3672721 ecr 98179], length 360: OpenFlow
	version 1.0, type PACKET_IN, length 360, xid 0x00000000
17:49:11.480549 IP 192.168.1.30.40475 > 192.168.1.10.6633: Flags [P.], seq 197713:198073, ack 1, win 117, options [nop,nop,TS val 3672721 ecr 98179], length 360: OpenFlow
	version 1.0, type PACKET_IN, length 360, xid 0x00000000
17:49:11.480567 IP 192.168.1.30.40475 > 192.168.1.10.6633: Flags [P.], seq 198073:198433, ack 1, win 117, options [nop,nop,TS val 3672721 ecr 98179], length 360: OpenFlow
	version 1.0, type PACKET_IN, length 360, xid 0x00000000
17:49:11.480584 IP 192.168.1.30.40475 > 192.168.1.10.6633: Flags [P.], seq 198433:198793, ack 1, win 117, options [nop,nop,TS val 3672721 ecr 98179], length 360: OpenFlow
	version 1.0, type PACKET_IN, length 360, xid 0x00000000
17:49:11.480602 IP 192.168.1.30.40475 > 192.168.1.10.6633: Flags [P.], seq 198793:199153, ack 1, win 117, options [nop,nop,TS val 3672721 ecr 98179], length 360: OpenFlow
	version 1.0, type PACKET_IN, length 360, xid 0x00000000
17:49:11.480620 IP 192.168.1.30.40475 > 192.168.1.10.6633: Flags [P.], seq 199153:199513, ack 1, win 117, options [nop,nop,TS val 3672721 ecr 98179], length 360: OpenFlow
	version 1.0, type PACKET_IN, length 360, xid 0x00000000
17:49:11.480637 IP 192.168.1.30.40475 > 192.168.1.10.6633: Flags [P.], seq 199513:199873, ack 1, win 117, options [nop,nop,TS val 3672721 ecr 98179], length 360: OpenFlow
	version 1.0, type PACKET_IN, length 360, xid 0x00000000
17:49:11.480655 IP 192.168.1.30.40475 > 192.168.1.10.6633: Flags [P.], seq 199873:200233, ack 1, win 117, options [nop,nop,TS val 3672721 ecr 98179], length 360: OpenFlow
	version 1.0, type PACKET_IN, length 360, xid 0x00000000
17:49:11.480681 IP 192.168.1.10.6633 > 192.168.1.30.40475: Flags [.], ack 196273, win 3360, options [nop,nop,TS val 98179 ecr 3672721], length 0
17:49:11.480694 IP 192.168.1.10.6633 > 192.168.1.30.40475: Flags [.], ack 196633, win 3383, options [nop,nop,TS val 98179 ecr 3672721], length 0
17:49:11.480704 IP 192.168.1.10.6633 > 192.168.1.30.40475: Flags [.], ack 196993, win 3405, options [nop,nop,TS val 98179 ecr 3672721], length 0
17:49:11.480715 IP 192.168.1.10.6633 > 192.168.1.30.40475: Flags [.], ack 197353, win 3428, options [nop,nop,TS val 98179 ecr 3672721], length 0
17:49:11.480724 IP 192.168.1.10.6633 > 192.168.1.30.40475: Flags [.], ack 197713, win 3451, options [nop,nop,TS val 98179 ecr 3672721], length 0
17:49:11.480734 IP 192.168.1.10.6633 > 192.168.1.30.40475: Flags [.], ack 198073, win 3473, options [nop,nop,TS val 98179 ecr 3672721], length 0
17:49:11.480744 IP 192.168.1.10.6633 > 192.168.1.30.40475: Flags [.], ack 198433, win 3496, options [nop,nop,TS val 98179 ecr 3672721], length 0
17:49:11.480754 IP 192.168.1.10.6633 > 192.168.1.30.40475: Flags [.], ack 198793, win 3519, options [nop,nop,TS val 98179 ecr 3672721], length 0
17:49:11.480763 IP 192.168.1.10.6633 > 192.168.1.30.40475: Flags [.], ack 199153, win 3541, options [nop,nop,TS val 98179 ecr 3672721], length 0
17:49:11.480773 IP 192.168.1.10.6633 > 192.168.1.30.40475: Flags [.], ack 199513, win 3564, options [nop,nop,TS val 98179 ecr 3672721], length 0
17:49:11.480782 IP 192.168.1.10.6633 > 192.168.1.30.40475: Flags [.], ack 199873, win 3586, options [nop,nop,TS val 98179 ecr 3672721], length 0
17:49:11.480815 IP 192.168.1.30.40475 > 192.168.1.10.6633: Flags [P.], seq 200233:200593, ack 1, win 117, options [nop,nop,TS val 3672721 ecr 98179], length 360: OpenFlow
	version 1.0, type PACKET_IN, length 360, xid 0x00000000
17:49:11.480834 IP 192.168.1.30.40475 > 192.168.1.10.6633: Flags [P.], seq 200593:200953, ack 1, win 117, options [nop,nop,TS val 3672721 ecr 98179], length 360: OpenFlow
	version 1.0, type PACKET_IN, length 360, xid 0x00000000
17:49:11.480851 IP 192.168.1.30.40475 > 192.168.1.10.6633: Flags [P.], seq 200953:201313, ack 1, win 117, options [nop,nop,TS val 3672721 ecr 98179], length 360: OpenFlow
	version 1.0, type PACKET_IN, length 360, xid 0x00000000
17:49:11.480867 IP 192.168.1.30.40475 > 192.168.1.10.6633: Flags [P.], seq 201313:201673, ack 1, win 117, options [nop,nop,TS val 3672721 ecr 98179], length 360: OpenFlow
	version 1.0, type PACKET_IN, length 360, xid 0x00000000
17:49:11.480883 IP 192.168.1.30.40475 > 192.168.1.10.6633: Flags [P.], seq 201673:202033, ack 1, win 117, options [nop,nop,TS val 3672721 ecr 98179], length 360: OpenFlow
	version 1.0, type PACKET_IN, length 360, xid 0x00000000
17:49:11.480900 IP 192.168.1.30.40475 > 192.168.1.10.6633: Flags [P.], seq 202033:202393, ack 1, win 117, options [nop,nop,TS val 3672721 ecr 98179], length 360: OpenFlow
	version 1.0, type PACKET_IN, length 360, xid 0x00000000
17:49:11.480919 IP 192.168.1.30.40475 > 192.168.1.10.6633: Flags [P.], seq 202393:202753, ack 1, win 117, options [nop,nop,TS val 3672721 ecr 98179], length 360: OpenFlow
	version 1.0, type PACKET_IN, length 360, xid 0x00000000
17:49:11.480937 IP 192.168.1.30.40475 > 192.168.1.10.6633: Flags [P.], seq 202753:203113, ack 1, win 117, options [nop,nop,TS val 3672721 ecr 98179], length 360: OpenFlow
	version 1.0, type PACKET_IN, length 360, xid 0x00000000
17:49:11.480964 IP 192.168.1.30.40475 > 192.168.1.10.6633: Flags [P.], seq 203113:203473, ack 1, win 117, options [nop,nop,TS val 3672721 ecr 98179], length 360: OpenFlow
	version 1.0, type PACKET_IN, length 360, xid 0x00000000
17:49:11.480982 IP 192.168.1.30.40475 > 192.168.1.10.6633: Flags [P.], seq 203473:203833, ack 1, win 117, options [nop,nop,TS val 3672721 ecr 98179], length 360: OpenFlow
	version 1.0, type PACKET_IN, length 360, xid 0x00000000
17:49:11.481001 IP 192.168.1.30.40475 > 192.168.1.10.6633: Flags [P.], seq 203833:204193, ack 1, win 117, options [nop,nop,TS val 3672721 ecr 98179], length 360: OpenFlow
	version 1.0, type PACKET_IN, length 360, xid 0x00000000
17:49:11.481019 IP 192.168.1.30.40475 > 192.168.1.10.6633: Flags [P.], seq 204193:204553, ack 1, win 117, options [nop,nop,TS val 3672721 ecr 98179], length 360: OpenFlow
	version 1.0, type PACKET_IN, length 360, xid 0x00000000
17:49:11.481047 IP 192.168.1.10.6633 > 192.168.1.30.40475: Flags [.], ack 200233, win 3609, options [nop,nop,TS val 98179 ecr 3672721], length 0
17:49:11.481057 IP 192.168.1.10.6633 > 192.168.1.30.40475: Flags [.], ack 200593, win 3632, options [nop,nop,TS val 98179 ecr 3672721], length 0
17:49:11.481066 IP 192.168.1.10.6633 > 192.168.1.30.40475: Flags [.], ack 200953, win 3633, options [nop,nop,TS val 98179 ecr 3672721], length 0
17:49:11.481074 IP 192.168.1.10.6633 > 192.168.1.30.40475: Flags [.], ack 201313, win 3633, options [nop,nop,TS val 98179 ecr 3672721], length 0
17:49:11.481082 IP 192.168.1.10.6633 > 192.168.1.30.40475: Flags [.], ack 201673, win 3633, options [nop,nop,TS val 98179 ecr 3672721], length 0
17:49:11.481091 IP 192.168.1.10.6633 > 192.168.1.30.40475: Flags [.], ack 202033, win 3633, options [nop,nop,TS val 98179 ecr 3672721], length 0
17:49:11.481099 IP 192.168.1.10.6633 > 192.168.1.30.40475: Flags [.], ack 202393, win 3633, options [nop,nop,TS val 98179 ecr 3672721], length 0
17:49:11.481107 IP 192.168.1.10.6633 > 192.168.1.30.40475: Flags [.], ack 202753, win 3633, options [nop,nop,TS val 98179 ecr 3672721], length 0
17:49:11.481115 IP 192.168.1.10.6633 > 192.168.1.30.40475: Flags [.], ack 203113, win 3633, options [nop,nop,TS val 98179 ecr 3672721], length 0
17:49:11.481161 IP 192.168.1.30.40475 > 192.168.1.10.6633: Flags [P.], seq 204553:204913, ack 1, win 117, options [nop,nop,TS val 3672721 ecr 98179], length 360: OpenFlow
	version 1.0, type PACKET_IN, length 360, xid 0x00000000
17:49:11.481181 IP 192.168.1.30.40475 > 192.168.1.10.6633: Flags [P.], seq 204913:205273, ack 1, win 117, options [nop,nop,TS val 3672721 ecr 98179], length 360: OpenFlow
	version 1.0, type PACKET_IN, length 360, xid 0x00000000
17:49:11.481199 IP 192.168.1.30.40475 > 192.168.1.10.6633: Flags [P.], seq 205273:205633, ack 1, win 117, options [nop,nop,TS val 3672721 ecr 98179], length 360: OpenFlow
	version 1.0, type PACKET_IN, length 360, xid 0x00000000

