17:59:51.307191 IP 192.168.1.30.40486 > 192.168.1.10.6633: Flags [P.], seq 356078129:356078472, ack 470731811, win 269, options [nop,nop,TS val 3832678 ecr 257999], length 343: OpenFlow
	version 1.0, type PACKET_IN, length 343, xid 0x00000000
17:59:51.307293 IP 192.168.1.30.40486 > 192.168.1.10.6633: Flags [P.], seq 343:686, ack 1, win 269, options [nop,nop,TS val 3832678 ecr 257999], length 343: OpenFlow
	version 1.0, type PACKET_IN, length 343, xid 0x00000000
17:59:51.307331 IP 192.168.1.30.40486 > 192.168.1.10.6633: Flags [P.], seq 686:1029, ack 1, win 269, options [nop,nop,TS val 3832678 ecr 257999], length 343: OpenFlow
	version 1.0, type PACKET_IN, length 343, xid 0x00000000
17:59:51.307422 IP 192.168.1.30.40486 > 192.168.1.10.6633: Flags [P.], seq 1029:1372, ack 1, win 269, options [nop,nop,TS val 3832678 ecr 257999], length 343: OpenFlow
	version 1.0, type PACKET_IN, length 343, xid 0x00000000
17:59:51.307458 IP 192.168.1.30.40486 > 192.168.1.10.6633: Flags [P.], seq 1372:1715, ack 1, win 269, options [nop,nop,TS val 3832678 ecr 257999], length 343: OpenFlow
	version 1.0, type PACKET_IN, length 343, xid 0x00000000
17:59:51.307489 IP 192.168.1.30.40486 > 192.168.1.10.6633: Flags [P.], seq 1715:2058, ack 1, win 269, options [nop,nop,TS val 3832678 ecr 257999], length 343: OpenFlow
	version 1.0, type PACKET_IN, length 343, xid 0x00000000
17:59:51.307567 IP 192.168.1.30.40486 > 192.168.1.10.6633: Flags [P.], seq 2058:2401, ack 1, win 269, options [nop,nop,TS val 3832678 ecr 257999], length 343: OpenFlow
	version 1.0, type PACKET_IN, length 343, xid 0x00000000
17:59:51.307656 IP 192.168.1.30.40486 > 192.168.1.10.6633: Flags [P.], seq 2401:2744, ack 1, win 269, options [nop,nop,TS val 3832678 ecr 257999], length 343: OpenFlow
	version 1.0, type PACKET_IN, length 343, xid 0x00000000
17:59:51.307692 IP 192.168.1.30.40486 > 192.168.1.10.6633: Flags [P.], seq 2744:3087, ack 1, win 269, options [nop,nop,TS val 3832678 ecr 257999], length 343: OpenFlow
	version 1.0, type PACKET_IN, length 343, xid 0x00000000
17:59:51.308421 IP 192.168.1.30.40486 > 192.168.1.10.6633: Flags [P.], seq 3087:3430, ack 1, win 269, options [nop,nop,TS val 3832678 ecr 257999], length 343: OpenFlow
	version 1.0, type PACKET_IN, length 343, xid 0x00000000
17:59:51.308463 IP 192.168.1.30.40486 > 192.168.1.10.6633: Flags [P.], seq 3430:3773, ack 1, win 269, options [nop,nop,TS val 3832678 ecr 257999], length 343: OpenFlow
	version 1.0, type PACKET_IN, length 343, xid 0x00000000
17:59:51.308494 IP 192.168.1.30.40486 > 192.168.1.10.6633: Flags [P.], seq 3773:4116, ack 1, win 269, options [nop,nop,TS val 3832678 ecr 257999], length 343: OpenFlow
	version 1.0, type PACKET_IN, length 343, xid 0x00000000
17:59:51.308587 IP 192.168.1.30.40486 > 192.168.1.10.6633: Flags [P.], seq 4116:4459, ack 1, win 269, options [nop,nop,TS val 3832678 ecr 257999], length 343: OpenFlow
	version 1.0, type PACKET_IN, length 343, xid 0x00000000
17:59:51.308622 IP 192.168.1.30.40486 > 192.168.1.10.6633: Flags [P.], seq 4459:4802, ack 1, win 269, options [nop,nop,TS val 3832678 ecr 257999], length 343: OpenFlow
	version 1.0, type PACKET_IN, length 343, xid 0x00000000
17:59:51.308664 IP 192.168.1.10.6633 > 192.168.1.30.40486: Flags [.], ack 343, win 5141, options [nop,nop,TS val 258136 ecr 3832678], length 0
17:59:51.308682 IP 192.168.1.10.6633 > 192.168.1.30.40486: Flags [.], ack 686, win 5141, options [nop,nop,TS val 258136 ecr 3832678], length 0
17:59:51.308695 IP 192.168.1.10.6633 > 192.168.1.30.40486: Flags [.], ack 1029, win 5141, options [nop,nop,TS val 258136 ecr 3832678], length 0
17:59:51.308718 IP 192.168.1.10.6633 > 192.168.1.30.40486: Flags [.], ack 1372, win 5141, options [nop,nop,TS val 258136 ecr 3832678], length 0
17:59:51.308736 IP 192.168.1.30.40486 > 192.168.1.10.6633: Flags [P.], seq 4802:5145, ack 1, win 269, options [nop,nop,TS val 3832678 ecr 258136], length 343: OpenFlow
	version 1.0, type PACKET_IN, length 343, xid 0x00000000
17:59:51.308741 IP 192.168.1.10.6633 > 192.168.1.30.40486: Flags [.], ack 1715, win 5141, options [nop,nop,TS val 258136 ecr 3832678], length 0
17:59:51.308751 IP 192.168.1.10.6633 > 192.168.1.30.40486: Flags [.], ack 2058, win 5141, options [nop,nop,TS val 258136 ecr 3832678], length 0
17:59:51.308773 IP 192.168.1.10.6633 > 192.168.1.30.40486: Flags [.], ack 2401, win 5141, options [nop,nop,TS val 258136 ecr 3832678], length 0
17:59:51.308785 IP 192.168.1.10.6633 > 192.168.1.30.40486: Flags [.], ack 2744, win 5141, options [nop,nop,TS val 258136 ecr 3832678], length 0
17:59:51.308797 IP 192.168.1.10.6633 > 192.168.1.30.40486: Flags [.], ack 3087, win 5141, options [nop,nop,TS val 258136 ecr 3832678], length 0
17:59:51.308807 IP 192.168.1.10.6633 > 192.168.1.30.40486: Flags [.], ack 3430, win 5141, options [nop,nop,TS val 258136 ecr 3832678], length 0
17:59:51.308826 IP 192.168.1.10.6633 > 192.168.1.30.40486: Flags [.], ack 3773, win 5141, options [nop,nop,TS val 258136 ecr 3832678], length 0
17:59:51.308828 IP 192.168.1.30.40486 > 192.168.1.10.6633: Flags [P.], seq 5145:5488, ack 1, win 269, options [nop,nop,TS val 3832678 ecr 258136], length 343: OpenFlow
	version 1.0, type PACKET_IN, length 343, xid 0x00000000
17:59:51.308849 IP 192.168.1.10.6633 > 192.168.1.30.40486: Flags [.], ack 4116, win 5141, options [nop,nop,TS val 258136 ecr 3832678], length 0
17:59:51.308862 IP 192.168.1.10.6633 > 192.168.1.30.40486: Flags [.], ack 4459, win 5141, options [nop,nop,TS val 258136 ecr 3832678], length 0
17:59:51.308873 IP 192.168.1.10.6633 > 192.168.1.30.40486: Flags [.], ack 4802, win 5141, options [nop,nop,TS val 258136 ecr 3832678], length 0
17:59:51.308875 IP 192.168.1.30.40486 > 192.168.1.10.6633: Flags [P.], seq 5488:5831, ack 1, win 269, options [nop,nop,TS val 3832678 ecr 258136], length 343: OpenFlow
	version 1.0, type PACKET_IN, length 343, xid 0x00000000
17:59:51.308884 IP 192.168.1.10.6633 > 192.168.1.30.40486: Flags [.], ack 5145, win 5141, options [nop,nop,TS val 258136 ecr 3832678], length 0
17:59:51.308971 IP 192.168.1.30.40486 > 192.168.1.10.6633: Flags [P.], seq 5831:6174, ack 1, win 269, options [nop,nop,TS val 3832678 ecr 258136], length 343: OpenFlow
	version 1.0, type PACKET_IN, length 343, xid 0x00000000
17:59:51.309007 IP 192.168.1.30.40486 > 192.168.1.10.6633: Flags [P.], seq 6174:6369, ack 1, win 269, options [nop,nop,TS val 3832678 ecr 258136], length 195: OpenFlow
	version 1.0, type PACKET_IN, length 195, xid 0x00000000
17:59:51.309090 IP 192.168.1.30.40486 > 192.168.1.10.6633: Flags [P.], seq 6369:6712, ack 1, win 269, options [nop,nop,TS val 3832678 ecr 258136], length 343: OpenFlow
	version 1.0, type PACKET_IN, length 343, xid 0x00000000
17:59:51.309150 IP 192.168.1.30.40486 > 192.168.1.10.6633: Flags [P.], seq 6712:6800, ack 1, win 269, options [nop,nop,TS val 3832678 ecr 258136], length 88: OpenFlow
	version 1.0, type PACKET_IN, length 88, xid 0x00000000
17:59:51.309181 IP 192.168.1.30.40486 > 192.168.1.10.6633: Flags [P.], seq 6800:6995, ack 1, win 269, options [nop,nop,TS val 3832678 ecr 258136], length 195: OpenFlow
	version 1.0, type PACKET_IN, length 195, xid 0x00000000
17:59:51.309259 IP 192.168.1.30.40486 > 192.168.1.10.6633: Flags [P.], seq 6995:7338, ack 1, win 269, options [nop,nop,TS val 3832678 ecr 258136], length 343: OpenFlow
	version 1.0, type PACKET_IN, length 343, xid 0x00000000
17:59:51.309263 IP 192.168.1.10.6633 > 192.168.1.30.40486: Flags [.], ack 5488, win 5141, options [nop,nop,TS val 258136 ecr 3832678], length 0
17:59:51.309300 IP 192.168.1.10.6633 > 192.168.1.30.40486: Flags [.], ack 6369, win 5141, options [nop,nop,TS val 258136 ecr 3832678], length 0
17:59:51.309324 IP 192.168.1.30.40486 > 192.168.1.10.6633: Flags [P.], seq 7338:7663, ack 1, win 269, options [nop,nop,TS val 3832678 ecr 258136], length 325: OpenFlow
	version 1.0, type PACKET_IN, length 325, xid 0x00000000
17:59:51.309381 IP 192.168.1.30.40486 > 192.168.1.10.6633: Flags [P.], seq 7663:8006, ack 1, win 269, options [nop,nop,TS val 3832678 ecr 258136], length 343: OpenFlow
	version 1.0, type PACKET_IN, length 343, xid 0x00000000
17:59:51.309411 IP 192.168.1.30.40486 > 192.168.1.10.6633: Flags [P.], seq 8006:8349, ack 1, win 269, options [nop,nop,TS val 3832678 ecr 258136], length 343: OpenFlow
	version 1.0, type PACKET_IN, length 343, xid 0x00000000
17:59:51.309525 IP 192.168.1.10.6633 > 192.168.1.30.40486: Flags [.], ack 7663, win 5141, options [nop,nop,TS val 258137 ecr 3832678], length 0
17:59:51.309529 IP 192.168.1.30.40486 > 192.168.1.10.6633: Flags [P.], seq 8349:8692, ack 1, win 269, options [nop,nop,TS val 3832679 ecr 258136], length 343: OpenFlow
	version 1.0, type PACKET_IN, length 343, xid 0x00000000
17:59:51.309583 IP 192.168.1.30.40486 > 192.168.1.10.6633: Flags [P.], seq 8692:9017, ack 1, win 269, options [nop,nop,TS val 3832679 ecr 258137], length 325: OpenFlow
	version 1.0, type PACKET_IN, length 325, xid 0x00000000
17:59:51.309665 IP 192.168.1.30.40486 > 192.168.1.10.6633: Flags [P.], seq 9017:9282, ack 1, win 269, options [nop,nop,TS val 3832679 ecr 258137], length 265: OpenFlow
	version 1.0, type PACKET_IN, length 265, xid 0x00000000
17:59:51.309741 IP 192.168.1.30.40486 > 192.168.1.10.6633: Flags [P.], seq 9282:9625, ack 1, win 269, options [nop,nop,TS val 3832679 ecr 258137], length 343: OpenFlow
	version 1.0, type PACKET_IN, length 343, xid 0x00000000
17:59:51.309747 IP 192.168.1.10.6633 > 192.168.1.30.40486: Flags [.], ack 9017, win 5141, options [nop,nop,TS val 258137 ecr 3832678], length 0
17:59:51.309830 IP 192.168.1.30.40486 > 192.168.1.10.6633: Flags [P.], seq 9625:9713, ack 1, win 269, options [nop,nop,TS val 3832679 ecr 258137], length 88: OpenFlow
	version 1.0, type PACKET_IN, length 88, xid 0x00000000
17:59:51.309926 IP 192.168.1.30.40486 > 192.168.1.10.6633: Flags [P.], seq 9713:9801, ack 1, win 269, options [nop,nop,TS val 3832679 ecr 258137], length 88: OpenFlow
	version 1.0, type PACKET_IN, length 88, xid 0x00000000
17:59:51.309932 IP 192.168.1.10.6633 > 192.168.1.30.40486: Flags [.], ack 9282, win 5141, options [nop,nop,TS val 258137 ecr 3832679], length 0
17:59:51.309954 IP 192.168.1.10.6633 > 192.168.1.30.40486: Flags [.], ack 9625, win 5141, options [nop,nop,TS val 258137 ecr 3832679], length 0
17:59:51.309999 IP 192.168.1.30.40486 > 192.168.1.10.6633: Flags [P.], seq 9801:10066, ack 1, win 269, options [nop,nop,TS val 3832679 ecr 258137], length 265: OpenFlow
	version 1.0, type PACKET_IN, length 265, xid 0x00000000
17:59:51.310042 IP 192.168.1.30.40486 > 192.168.1.10.6633: Flags [P.], seq 10066:10409, ack 1, win 269, options [nop,nop,TS val 3832679 ecr 258137], length 343: OpenFlow
	version 1.0, type PACKET_IN, length 343, xid 0x00000000
17:59:51.310127 IP 192.168.1.30.40486 > 192.168.1.10.6633: Flags [P.], seq 10409:10674, ack 1, win 269, options [nop,nop,TS val 3832679 ecr 258137], length 265: OpenFlow
	version 1.0, type PACKET_IN, length 265, xid 0x00000000
17:59:51.310132 IP 192.168.1.10.6633 > 192.168.1.30.40486: Flags [.], ack 9801, win 5141, options [nop,nop,TS val 258137 ecr 3832679], length 0
17:59:51.310176 IP 192.168.1.30.40486 > 192.168.1.10.6633: Flags [P.], seq 10674:10762, ack 1, win 269, options [nop,nop,TS val 3832679 ecr 258137], length 88: OpenFlow
	version 1.0, type PACKET_IN, length 88, xid 0x00000000
17:59:51.310279 IP 192.168.1.30.40486 > 192.168.1.10.6633: Flags [P.], seq 10762:11105, ack 1, win 269, options [nop,nop,TS val 3832679 ecr 258137], length 343: OpenFlow
	version 1.0, type PACKET_IN, length 343, xid 0x00000000
17:59:51.310350 IP 192.168.1.10.6633 > 192.168.1.30.40486: Flags [.], ack 10409, win 5141, options [nop,nop,TS val 258137 ecr 3832679], length 0
17:59:51.310360 IP 192.168.1.10.6633 > 192.168.1.30.40486: Flags [.], ack 10762, win 5141, options [nop,nop,TS val 258137 ecr 3832679], length 0
17:59:51.310356 IP 192.168.1.30.40486 > 192.168.1.10.6633: Flags [P.], seq 11105:11448, ack 1, win 269, options [nop,nop,TS val 3832679 ecr 258137], length 343: OpenFlow
	version 1.0, type PACKET_IN, length 343, xid 0x00000000
17:59:51.310433 IP 192.168.1.30.40486 > 192.168.1.10.6633: Flags [P.], seq 11448:11791, ack 1, win 269, options [nop,nop,TS val 3832679 ecr 258137], length 343: OpenFlow
	version 1.0, type PACKET_IN, length 343, xid 0x00000000
17:59:51.310518 IP 192.168.1.30.40486 > 192.168.1.10.6633: Flags [P.], seq 11791:12134, ack 1, win 269, options [nop,nop,TS val 3832679 ecr 258137], length 343: OpenFlow
	version 1.0, type PACKET_IN, length 343, xid 0x00000000
17:59:51.310592 IP 192.168.1.10.6633 > 192.168.1.30.40486: Flags [.], ack 11448, win 5141, options [nop,nop,TS val 258137 ecr 3832679], length 0
17:59:51.310613 IP 192.168.1.30.40486 > 192.168.1.10.6633: Flags [P.], seq 12134:12477, ack 1, win 269, options [nop,nop,TS val 3832679 ecr 258137], length 343: OpenFlow
	version 1.0, type PACKET_IN, length 343, xid 0x00000000
17:59:51.310689 IP 192.168.1.30.40486 > 192.168.1.10.6633: Flags [P.], seq 12477:12820, ack 1, win 269, options [nop,nop,TS val 3832679 ecr 258137], length 343: OpenFlow
	version 1.0, type PACKET_IN, length 343, xid 0x00000000
17:59:51.310738 IP 192.168.1.30.40486 > 192.168.1.10.6633: Flags [P.], seq 12820:13163, ack 1, win 269, options [nop,nop,TS val 3832679 ecr 258137], length 343: OpenFlow
	version 1.0, type PACKET_IN, length 343, xid 0x00000000
17:59:51.310781 IP 192.168.1.10.6633 > 192.168.1.30.40486: Flags [.], ack 12134, win 5141, options [nop,nop,TS val 258137 ecr 3832679], length 0
17:59:51.310825 IP 192.168.1.30.40486 > 192.168.1.10.6633: Flags [P.], seq 13163:13506, ack 1, win 269, options [nop,nop,TS val 3832679 ecr 258137], length 343: OpenFlow
	version 1.0, type PACKET_IN, length 343, xid 0x00000000
17:59:51.310911 IP 192.168.1.30.40486 > 192.168.1.10.6633: Flags [P.], seq 13506:13849, ack 1, win 269, options [nop,nop,TS val 3832679 ecr 258137], length 343: OpenFlow
	version 1.0, type PACKET_IN, length 343, xid 0x00000000
17:59:51.310982 IP 192.168.1.10.6633 > 192.168.1.30.40486: Flags [.], ack 12820, win 5141, options [nop,nop,TS val 258137 ecr 3832679], length 0
17:59:51.310986 IP 192.168.1.30.40486 > 192.168.1.10.6633: Flags [P.], seq 13849:14192, ack 1, win 269, options [nop,nop,TS val 3832679 ecr 258137], length 343: OpenFlow
	version 1.0, type PACKET_IN, length 343, xid 0x00000000
17:59:51.311003 IP 192.168.1.10.6633 > 192.168.1.30.40486: Flags [.], ack 13506, win 5141, options [nop,nop,TS val 258137 ecr 3832679], length 0
17:59:51.311075 IP 192.168.1.30.40486 > 192.168.1.10.6633: Flags [P.], seq 14192:14457, ack 1, win 269, options [nop,nop,TS val 3832679 ecr 258137], length 265: OpenFlow
	version 1.0, type PACKET_IN, length 265, xid 0x00000000
17:59:51.311154 IP 192.168.1.30.40486 > 192.168.1.10.6633: Flags [P.], seq 14457:14722, ack 1, win 269, options [nop,nop,TS val 3832679 ecr 258137], length 265: OpenFlow
	version 1.0, type PACKET_IN, length 265, xid 0x00000000
17:59:51.311240 IP 192.168.1.30.40486 > 192.168.1.10.6633: Flags [P.], seq 14722:15065, ack 1, win 269, options [nop,nop,TS val 3832679 ecr 258137], length 343: OpenFlow
	version 1.0, type PACKET_IN, length 343, xid 0x00000000
17:59:51.311241 IP 192.168.1.10.6633 > 192.168.1.30.40486: Flags [.], ack 14192, win 5141, options [nop,nop,TS val 258137 ecr 3832679], length 0
17:59:51.311322 IP 192.168.1.30.40486 > 192.168.1.10.6633: Flags [P.], seq 15065:15408, ack 1, win 269, options [nop,nop,TS val 3832679 ecr 258137], length 343: OpenFlow
	version 1.0, type PACKET_IN, length 343, xid 0x00000000
17:59:51.311369 IP 192.168.1.30.40486 > 192.168.1.10.6633: Flags [P.], seq 15408:15751, ack 1, win 269, options [nop,nop,TS val 3832679 ecr 258137], length 343: OpenFlow
	version 1.0, type PACKET_IN, length 343, xid 0x00000000
17:59:51.311431 IP 192.168.1.10.6633 > 192.168.1.30.40486: Flags [.], ack 14722, win 5141, options [nop,nop,TS val 258137 ecr 3832679], length 0
17:59:51.311482 IP 192.168.1.30.40486 > 192.168.1.10.6633: Flags [P.], seq 15751:16094, ack 1, win 269, options [nop,nop,TS val 3832679 ecr 258137], length 343: OpenFlow
	version 1.0, type PACKET_IN, length 343, xid 0x00000000
17:59:51.311565 IP 192.168.1.10.6633 > 192.168.1.30.40486: Flags [.], ack 15408, win 5141, options [nop,nop,TS val 258137 ecr 3832679], length 0
17:59:51.311569 IP 192.168.1.30.40486 > 192.168.1.10.6633: Flags [P.], seq 16094:16437, ack 1, win 269, options [nop,nop,TS val 3832679 ecr 258137], length 343: OpenFlow
	version 1.0, type PACKET_IN, length 343, xid 0x00000000
17:59:51.311662 IP 192.168.1.30.40486 > 192.168.1.10.6633: Flags [P.], seq 16437:16780, ack 1, win 269, options [nop,nop,TS val 3832679 ecr 258137], length 343: OpenFlow
	version 1.0, type PACKET_IN, length 343, xid 0x00000000
17:59:51.311746 IP 192.168.1.30.40486 > 192.168.1.10.6633: Flags [P.], seq 16780:16868, ack 1, win 269, options [nop,nop,TS val 3832679 ecr 258137], length 88: OpenFlow
	version 1.0, type PACKET_IN, length 88, xid 0x00000000
17:59:51.311749 IP 192.168.1.10.6633 > 192.168.1.30.40486: Flags [.], ack 16094, win 5141, options [nop,nop,TS val 258137 ecr 3832679], length 0
17:59:51.311798 IP 192.168.1.30.40486 > 192.168.1.10.6633: Flags [P.], seq 16868:17211, ack 1, win 269, options [nop,nop,TS val 3832679 ecr 258137], length 343: OpenFlow
	version 1.0, type PACKET_IN, length 343, xid 0x00000000
17:59:51.311875 IP 192.168.1.30.40486 > 192.168.1.10.6633: Flags [P.], seq 17211:17554, ack 1, win 269, options [nop,nop,TS val 3832679 ecr 258137], length 343: OpenFlow
	version 1.0, type PACKET_IN, length 343, xid 0x00000000
17:59:51.311931 IP 192.168.1.10.6633 > 192.168.1.30.40486: Flags [.], ack 16780, win 5141, options [nop,nop,TS val 258137 ecr 3832679], length 0
17:59:51.311967 IP 192.168.1.30.40486 > 192.168.1.10.6633: Flags [P.], seq 17554:17897, ack 1, win 269, options [nop,nop,TS val 3832679 ecr 258137], length 343: OpenFlow
	version 1.0, type PACKET_IN, length 343, xid 0x00000000
17:59:51.312049 IP 192.168.1.30.40486 > 192.168.1.10.6633: Flags [P.], seq 17897:18005, ack 1, win 269, options [nop,nop,TS val 3832679 ecr 258137], length 108: OpenFlow
	version 1.0, type PACKET_IN, length 108, xid 0x00000000
17:59:51.312130 IP 192.168.1.10.6633 > 192.168.1.30.40486: Flags [.], ack 17554, win 5141, options [nop,nop,TS val 258137 ecr 3832679], length 0
17:59:51.312131 IP 192.168.1.30.40486 > 192.168.1.10.6633: Flags [P.], seq 18005:18093, ack 1, win 269, options [nop,nop,TS val 3832679 ecr 258137], length 88: OpenFlow
	version 1.0, type PACKET_IN, length 88, xid 0x00000000
17:59:51.312234 IP 192.168.1.30.40486 > 192.168.1.10.6633: Flags [P.], seq 18093:18436, ack 1, win 269, options [nop,nop,TS val 3832679 ecr 258137], length 343: OpenFlow
	version 1.0, type PACKET_IN, length 343, xid 0x00000000
17:59:51.312305 IP 192.168.1.10.6633 > 192.168.1.30.40486: Flags [.], ack 18005, win 5141, options [nop,nop,TS val 258137 ecr 3832679], length 0
17:59:51.312313 IP 192.168.1.30.40486 > 192.168.1.10.6633: Flags [P.], seq 18436:18779, ack 1, win 269, options [nop,nop,TS val 3832679 ecr 258137], length 343: OpenFlow
	version 1.0, type PACKET_IN, length 343, xid 0x00000000
17:59:51.312368 IP 192.168.1.30.40486 > 192.168.1.10.6633: Flags [P.], seq 18779:19139, ack 1, win 269, options [nop,nop,TS val 3832679 ecr 258137], length 360: OpenFlow
	version 1.0, type PACKET_IN, length 360, xid 0x00000000
17:59:51.312475 IP 192.168.1.30.40486 > 192.168.1.10.6633: Flags [P.], seq 19139:19482, ack 1, win 269, options [nop,nop,TS val 3832679 ecr 258137], length 343: OpenFlow
	version 1.0, type PACKET_IN, length 343, xid 0x00000000
17:59:51.312524 IP 192.168.1.10.6633 > 192.168.1.30.40486: Flags [.], ack 18436, win 5141, options [nop,nop,TS val 258137 ecr 3832679], length 0
17:59:51.312545 IP 192.168.1.30.40486 > 192.168.1.10.6633: Flags [P.], seq 19482:19825, ack 1, win 269, options [nop,nop,TS val 3832679 ecr 258137], length 343: OpenFlow
	version 1.0, type PACKET_IN, length 343, xid 0x00000000
17:59:51.312588 IP 192.168.1.30.40486 > 192.168.1.10.6633: Flags [P.], seq 19825:19913, ack 1, win 269, options [nop,nop,TS val 3832679 ecr 258137], length 88: OpenFlow
	version 1.0, type PACKET_IN, length 88, xid 0x00000000
17:59:51.312693 IP 192.168.1.10.6633 > 192.168.1.30.40486: Flags [.], ack 19139, win 5141, options [nop,nop,TS val 258137 ecr 3832679], length 0
17:59:51.312697 IP 192.168.1.30.40486 > 192.168.1.10.6633: Flags [P.], seq 19913:20256, ack 1, win 269, options [nop,nop,TS val 3832679 ecr 258137], length 343: OpenFlow
	version 1.0, type PACKET_IN, length 343, xid 0x00000000
17:59:51.312773 IP 192.168.1.30.40486 > 192.168.1.10.6633: Flags [P.], seq 20256:20599, ack 1, win 269, options [nop,nop,TS val 3832679 ecr 258137], length 343: OpenFlow
	version 1.0, type PACKET_IN, length 343, xid 0x00000000
17:59:51.312824 IP 192.168.1.10.6633 > 192.168.1.30.40486: Flags [.], ack 19913, win 5141, options [nop,nop,TS val 258137 ecr 3832679], length 0
17:59:51.312853 IP 192.168.1.30.40486 > 192.168.1.10.6633: Flags [P.], seq 20599:20942, ack 1, win 269, options [nop,nop,TS val 3832679 ecr 258137], length 343: OpenFlow
	version 1.0, type PACKET_IN, length 343, xid 0x00000000
17:59:51.312954 IP 192.168.1.30.40486 > 192.168.1.10.6633: Flags [P.], seq 20942:21285, ack 1, win 269, options [nop,nop,TS val 3832679 ecr 258137], length 343: OpenFlow
	version 1.0, type PACKET_IN, length 343, xid 0x00000000
17:59:51.313002 IP 192.168.1.30.40486 > 192.168.1.10.6633: Flags [P.], seq 21285:21628, ack 1, win 269, options [nop,nop,TS val 3832679 ecr 258137], length 343: OpenFlow
	version 1.0, type PACKET_IN, length 343, xid 0x00000000
17:59:51.313047 IP 192.168.1.10.6633 > 192.168.1.30.40486: Flags [.], ack 20599, win 5141, options [nop,nop,TS val 258137 ecr 3832679], length 0
17:59:51.313088 IP 192.168.1.30.40486 > 192.168.1.10.6633: Flags [P.], seq 21628:21971, ack 1, win 269, options [nop,nop,TS val 3832679 ecr 258137], length 343: OpenFlow
	version 1.0, type PACKET_IN, length 343, xid 0x00000000
17:59:51.313170 IP 192.168.1.30.40486 > 192.168.1.10.6633: Flags [P.], seq 21971:22331, ack 1, win 269, options [nop,nop,TS val 3832679 ecr 258137], length 360: OpenFlow
	version 1.0, type PACKET_IN, length 360, xid 0x00000000
17:59:51.313251 IP 192.168.1.10.6633 > 192.168.1.30.40486: Flags [.], ack 21285, win 5141, options [nop,nop,TS val 258137 ecr 3832679], length 0
17:59:51.313260 IP 192.168.1.30.40486 > 192.168.1.10.6633: Flags [P.], seq 22331:22674, ack 1, win 269, options [nop,nop,TS val 3832679 ecr 258137], length 343: OpenFlow
	version 1.0, type PACKET_IN, length 343, xid 0x00000000
17:59:51.313348 IP 192.168.1.30.40486 > 192.168.1.10.6633: Flags [P.], seq 22674:22939, ack 1, win 269, options [nop,nop,TS val 3832679 ecr 258137], length 265: OpenFlow
	version 1.0, type PACKET_IN, length 265, xid 0x00000000
17:59:51.313424 IP 192.168.1.10.6633 > 192.168.1.30.40486: Flags [.], ack 22331, win 5141, options [nop,nop,TS val 258137 ecr 3832679], length 0
17:59:51.313436 IP 192.168.1.30.40486 > 192.168.1.10.6633: Flags [P.], seq 22939:23282, ack 1, win 269, options [nop,nop,TS val 3832679 ecr 258137], length 343: OpenFlow
	version 1.0, type PACKET_IN, length 343, xid 0x00000000
17:59:51.313560 IP 192.168.1.30.40486 > 192.168.1.10.6633: Flags [P.], seq 23282:23625, ack 1, win 269, options [nop,nop,TS val 3832680 ecr 258137], length 343: OpenFlow
	version 1.0, type PACKET_IN, length 343, xid 0x00000000
17:59:51.313602 IP 192.168.1.10.6633 > 192.168.1.30.40486: Flags [.], ack 22939, win 5141, options [nop,nop,TS val 258138 ecr 3832679], length 0
17:59:51.313648 IP 192.168.1.30.40486 > 192.168.1.10.6633: Flags [P.], seq 23625:23968, ack 1, win 269, options [nop,nop,TS val 3832680 ecr 258137], length 343: OpenFlow
	version 1.0, type PACKET_IN, length 343, xid 0x00000000
17:59:51.313737 IP 192.168.1.30.40486 > 192.168.1.10.6633: Flags [P.], seq 23968:24311, ack 1, win 269, options [nop,nop,TS val 3832680 ecr 258138], length 343: OpenFlow
	version 1.0, type PACKET_IN, length 343, xid 0x00000000
17:59:51.313786 IP 192.168.1.30.40486 > 192.168.1.10.6633: Flags [P.], seq 24311:24654, ack 1, win 269, options [nop,nop,TS val 3832680 ecr 258138], length 343: OpenFlow
	version 1.0, type PACKET_IN, length 343, xid 0x00000000
17:59:51.313861 IP 192.168.1.10.6633 > 192.168.1.30.40486: Flags [.], ack 23625, win 5141, options [nop,nop,TS val 258138 ecr 3832679], length 0
17:59:51.313877 IP 192.168.1.30.40486 > 192.168.1.10.6633: Flags [P.], seq 24654:24997, ack 1, win 269, options [nop,nop,TS val 3832680 ecr 258138], length 343: OpenFlow
	version 1.0, type PACKET_IN, length 343, xid 0x00000000
17:59:51.313924 IP 192.168.1.10.6633 > 192.168.1.30.40486: Flags [.], ack 24311, win 5141, options [nop,nop,TS val 258138 ecr 3832680], length 0
17:59:51.313984 IP 192.168.1.30.40486 > 192.168.1.10.6633: Flags [P.], seq 24997:25340, ack 1, win 269, options [nop,nop,TS val 3832680 ecr 258138], length 343: OpenFlow
	version 1.0, type PACKET_IN, length 343, xid 0x00000000
17:59:51.314073 IP 192.168.1.30.40486 > 192.168.1.10.6633: Flags [P.], seq 25340:25448, ack 1, win 269, options [nop,nop,TS val 3832680 ecr 258138], length 108: OpenFlow
	version 1.0, type PACKET_IN, length 108, xid 0x00000000
17:59:51.314145 IP 192.168.1.10.6633 > 192.168.1.30.40486: Flags [.], ack 24997, win 5141, options [nop,nop,TS val 258138 ecr 3832680], length 0
17:59:51.314192 IP 192.168.1.30.40486 > 192.168.1.10.6633: Flags [P.], seq 25448:25556, ack 1, win 269, options [nop,nop,TS val 3832680 ecr 258138], length 108: OpenFlow
	version 1.0, type PACKET_IN, length 108, xid 0x00000000
17:59:51.314655 IP 192.168.1.30.40486 > 192.168.1.10.6633: Flags [P.], seq 25556:25899, ack 1, win 269, options [nop,nop,TS val 3832680 ecr 258138], length 343: OpenFlow
	version 1.0, type PACKET_IN, length 343, xid 0x00000000
17:59:51.314680 IP 192.168.1.30.40486 > 192.168.1.10.6633: Flags [P.], seq 25899:26242, ack 1, win 269, options [nop,nop,TS val 3832680 ecr 258138], length 343: OpenFlow
	version 1.0, type PACKET_IN, length 343, xid 0x00000000
17:59:51.314754 IP 192.168.1.30.40486 > 192.168.1.10.6633: Flags [P.], seq 26242:26585, ack 1, win 269, options [nop,nop,TS val 3832680 ecr 258138], length 343: OpenFlow
	version 1.0, type PACKET_IN, length 343, xid 0x00000000
17:59:51.314772 IP 192.168.1.10.6633 > 192.168.1.30.40486: Flags [.], ack 25448, win 5141, options [nop,nop,TS val 258138 ecr 3832680], length 0
17:59:51.314800 IP 192.168.1.30.40486 > 192.168.1.10.6633: Flags [P.], seq 26585:26928, ack 1, win 269, options [nop,nop,TS val 3832680 ecr 258138], length 343: OpenFlow
	version 1.0, type PACKET_IN, length 343, xid 0x00000000
17:59:51.314886 IP 192.168.1.30.40486 > 192.168.1.10.6633: Flags [P.], seq 26928:27193, ack 1, win 269, options [nop,nop,TS val 3832680 ecr 258138], length 265: OpenFlow
	version 1.0, type PACKET_IN, length 265, xid 0x00000000
17:59:51.314934 IP 192.168.1.10.6633 > 192.168.1.30.40486: Flags [.], ack 26242, win 5141, options [nop,nop,TS val 258138 ecr 3832680], length 0
17:59:51.314962 IP 192.168.1.10.6633 > 192.168.1.30.40486: Flags [.], ack 26928, win 5141, options [nop,nop,TS val 258138 ecr 3832680], length 0
17:59:51.314970 IP 192.168.1.30.40486 > 192.168.1.10.6633: Flags [P.], seq 27193:27536, ack 1, win 269, options [nop,nop,TS val 3832680 ecr 258138], length 343: OpenFlow
	version 1.0, type PACKET_IN, length 343, xid 0x00000000
17:59:51.315047 IP 192.168.1.30.40486 > 192.168.1.10.6633: Flags [P.], seq 27536:27624, ack 1, win 269, options [nop,nop,TS val 3832680 ecr 258138], length 88: OpenFlow
	version 1.0, type PACKET_IN, length 88, xid 0x00000000
17:59:51.315142 IP 192.168.1.30.40486 > 192.168.1.10.6633: Flags [P.], seq 27624:27967, ack 1, win 269, options [nop,nop,TS val 3832680 ecr 258138], length 343: OpenFlow
	version 1.0, type PACKET_IN, length 343, xid 0x00000000
17:59:51.315223 IP 192.168.1.30.40486 > 192.168.1.10.6633: Flags [P.], seq 27967:28310, ack 1, win 269, options [nop,nop,TS val 3832680 ecr 258138], length 343: OpenFlow
	version 1.0, type PACKET_IN, length 343, xid 0x00000000
17:59:51.315306 IP 192.168.1.30.40486 > 192.168.1.10.6633: Flags [P.], seq 28310:28653, ack 1, win 269, options [nop,nop,TS val 3832680 ecr 258138], length 343: OpenFlow
	version 1.0, type PACKET_IN, length 343, xid 0x00000000
17:59:51.315391 IP 192.168.1.30.40486 > 192.168.1.10.6633: Flags [P.], seq 28653:28996, ack 1, win 269, options [nop,nop,TS val 3832680 ecr 258138], length 343: OpenFlow
	version 1.0, type PACKET_IN, length 343, xid 0x00000000
17:59:51.315530 IP 192.168.1.10.6633 > 192.168.1.30.40486: Flags [.], ack 28653, win 5141, options [nop,nop,TS val 258138 ecr 3832680], length 0
17:59:51.315877 IP 192.168.1.30.40486 > 192.168.1.10.6633: Flags [P.], seq 28996:29339, ack 1, win 269, options [nop,nop,TS val 3832680 ecr 258138], length 343: OpenFlow
	version 1.0, type PACKET_IN, length 343, xid 0x00000000
17:59:51.315908 IP 192.168.1.30.40486 > 192.168.1.10.6633: Flags [P.], seq 29339:29682, ack 1, win 269, options [nop,nop,TS val 3832680 ecr 258138], length 343: OpenFlow
	version 1.0, type PACKET_IN, length 343, xid 0x00000000
17:59:51.315931 IP 192.168.1.30.40486 > 192.168.1.10.6633: Flags [P.], seq 29682:30025, ack 1, win 269, options [nop,nop,TS val 3832680 ecr 258138], length 343: OpenFlow
	version 1.0, type PACKET_IN, length 343, xid 0x00000000
17:59:51.316000 IP 192.168.1.10.6633 > 192.168.1.30.40486: Flags [.], ack 28996, win 5141, options [nop,nop,TS val 258138 ecr 3832680], length 0
17:59:51.316019 IP 192.168.1.30.40486 > 192.168.1.10.6633: Flags [P.], seq 30025:30368, ack 1, win 269, options [nop,nop,TS val 3832680 ecr 258138], length 343: OpenFlow
	version 1.0, type PACKET_IN, length 343, xid 0x00000000
17:59:51.316063 IP 192.168.1.30.40486 > 192.168.1.10.6633: Flags [P.], seq 30368:30633, ack 1, win 269, options [nop,nop,TS val 3832680 ecr 258138], length 265: OpenFlow
	version 1.0, type PACKET_IN, length 265, xid 0x00000000
17:59:51.316152 IP 192.168.1.30.40486 > 192.168.1.10.6633: Flags [P.], seq 30633:30898, ack 1, win 269, options [nop,nop,TS val 3832680 ecr 258138], length 265: OpenFlow
	version 1.0, type PACKET_IN, length 265, xid 0x00000000
17:59:51.316166 IP 192.168.1.10.6633 > 192.168.1.30.40486: Flags [.], ack 30025, win 5141, options [nop,nop,TS val 258138 ecr 3832680], length 0
17:59:51.316197 IP 192.168.1.30.40486 > 192.168.1.10.6633: Flags [P.], seq 30898:31241, ack 1, win 269, options [nop,nop,TS val 3832680 ecr 258138], length 343: OpenFlow
	version 1.0, type PACKET_IN, length 343, xid 0x00000000
17:59:51.316278 IP 192.168.1.30.40486 > 192.168.1.10.6633: Flags [P.], seq 31241:31584, ack 1, win 269, options [nop,nop,TS val 3832680 ecr 258138], length 343: OpenFlow
	version 1.0, type PACKET_IN, length 343, xid 0x00000000
17:59:51.316335 IP 192.168.1.10.6633 > 192.168.1.30.40486: Flags [.], ack 30633, win 5141, options [nop,nop,TS val 258138 ecr 3832680], length 0
17:59:51.316364 IP 192.168.1.30.40486 > 192.168.1.10.6633: Flags [P.], seq 31584:31927, ack 1, win 269, options [nop,nop,TS val 3832680 ecr 258138], length 343: OpenFlow
	version 1.0, type PACKET_IN, length 343, xid 0x00000000
17:59:51.316448 IP 192.168.1.30.40486 > 192.168.1.10.6633: Flags [P.], seq 31927:32270, ack 1, win 269, options [nop,nop,TS val 3832680 ecr 258138], length 343: OpenFlow
	version 1.0, type PACKET_IN, length 343, xid 0x00000000
17:59:51.316515 IP 192.168.1.10.6633 > 192.168.1.30.40486: Flags [.], ack 31241, win 5141, options [nop,nop,TS val 258138 ecr 3832680], length 0
17:59:51.316534 IP 192.168.1.30.40486 > 192.168.1.10.6633: Flags [P.], seq 32270:32613, ack 1, win 269, options [nop,nop,TS val 3832680 ecr 258138], length 343: OpenFlow
	version 1.0, type PACKET_IN, length 343, xid 0x00000000
17:59:51.316579 IP 192.168.1.30.40486 > 192.168.1.10.6633: Flags [P.], seq 32613:32701, ack 1, win 269, options [nop,nop,TS val 3832680 ecr 258138], length 88: OpenFlow
	version 1.0, type PACKET_IN, length 88, xid 0x00000000
17:59:51.316671 IP 192.168.1.30.40486 > 192.168.1.10.6633: Flags [P.], seq 32701:33044, ack 1, win 269, options [nop,nop,TS val 3832680 ecr 258138], length 343: OpenFlow
	version 1.0, type PACKET_IN, length 343, xid 0x00000000
17:59:51.316711 IP 192.168.1.30.40486 > 192.168.1.10.6633: Flags [P.], seq 33044:33387, ack 1, win 269, options [nop,nop,TS val 3832680 ecr 258138], length 343: OpenFlow
	version 1.0, type PACKET_IN, length 343, xid 0x00000000
17:59:51.316766 IP 192.168.1.10.6633 > 192.168.1.30.40486: Flags [.], ack 32701, win 5141, options [nop,nop,TS val 258138 ecr 3832680], length 0
17:59:51.316790 IP 192.168.1.30.40486 > 192.168.1.10.6633: Flags [P.], seq 33387:33730, ack 1, win 269, options [nop,nop,TS val 3832680 ecr 258138], length 343: OpenFlow
	version 1.0, type PACKET_IN, length 343, xid 0x00000000
17:59:51.316868 IP 192.168.1.30.40486 > 192.168.1.10.6633: Flags [P.], seq 33730:34073, ack 1, win 269, options [nop,nop,TS val 3832680 ecr 258138], length 343: OpenFlow
	version 1.0, type PACKET_IN, length 343, xid 0x00000000
17:59:51.316913 IP 192.168.1.30.40486 > 192.168.1.10.6633: Flags [P.], seq 34073:34416, ack 1, win 269, options [nop,nop,TS val 3832680 ecr 258138], length 343: OpenFlow
	version 1.0, type PACKET_IN, length 343, xid 0x00000000
17:59:51.316977 IP 192.168.1.10.6633 > 192.168.1.30.40486: Flags [.], ack 33044, win 5141, options [nop,nop,TS val 258138 ecr 3832680], length 0
17:59:51.316989 IP 192.168.1.10.6633 > 192.168.1.30.40486: Flags [.], ack 33730, win 5141, options [nop,nop,TS val 258138 ecr 3832680], length 0
17:59:51.316993 IP 192.168.1.30.40486 > 192.168.1.10.6633: Flags [P.], seq 34416:34611, ack 1, win 269, options [nop,nop,TS val 3832680 ecr 258138], length 195: OpenFlow
	version 1.0, type PACKET_IN, length 195, xid 0x00000000
17:59:51.317045 IP 192.168.1.30.40486 > 192.168.1.10.6633: Flags [P.], seq 34611:34736, ack 1, win 269, options [nop,nop,TS val 3832680 ecr 258138], length 125: OpenFlow
	version 1.0, type PACKET_IN, length 125, xid 0x00000000
17:59:51.317120 IP 192.168.1.30.40486 > 192.168.1.10.6633: Flags [P.], seq 34736:35079, ack 1, win 269, options [nop,nop,TS val 3832680 ecr 258138], length 343: OpenFlow
	version 1.0, type PACKET_IN, length 343, xid 0x00000000
17:59:51.317170 IP 192.168.1.30.40486 > 192.168.1.10.6633: Flags [P.], seq 35079:35422, ack 1, win 269, options [nop,nop,TS val 3832680 ecr 258138], length 343: OpenFlow
	version 1.0, type PACKET_IN, length 343, xid 0x00000000
17:59:51.317250 IP 192.168.1.30.40486 > 192.168.1.10.6633: Flags [P.], seq 35422:35765, ack 1, win 269, options [nop,nop,TS val 3832680 ecr 258138], length 343: OpenFlow
	version 1.0, type PACKET_IN, length 343, xid 0x00000000
17:59:51.317260 IP 192.168.1.10.6633 > 192.168.1.30.40486: Flags [.], ack 34416, win 5141, options [nop,nop,TS val 258138 ecr 3832680], length 0
17:59:51.317274 IP 192.168.1.10.6633 > 192.168.1.30.40486: Flags [.], ack 34736, win 5141, options [nop,nop,TS val 258138 ecr 3832680], length 0
17:59:51.317295 IP 192.168.1.30.40486 > 192.168.1.10.6633: Flags [P.], seq 35765:36108, ack 1, win 269, options [nop,nop,TS val 3832680 ecr 258138], length 343: OpenFlow
	version 1.0, type PACKET_IN, length 343, xid 0x00000000
17:59:51.317366 IP 192.168.1.10.6633 > 192.168.1.30.40486: Flags [.], ack 35422, win 5141, options [nop,nop,TS val 258138 ecr 3832680], length 0
17:59:51.317369 IP 192.168.1.30.40486 > 192.168.1.10.6633: Flags [P.], seq 36108:36451, ack 1, win 269, options [nop,nop,TS val 3832680 ecr 258138], length 343: OpenFlow
	version 1.0, type PACKET_IN, length 343, xid 0x00000000
17:59:51.317420 IP 192.168.1.30.40486 > 192.168.1.10.6633: Flags [P.], seq 36451:36794, ack 1, win 269, options [nop,nop,TS val 3832680 ecr 258138], length 343: OpenFlow
	version 1.0, type PACKET_IN, length 343, xid 0x00000000
17:59:51.317461 IP 192.168.1.30.40486 > 192.168.1.10.6633: Flags [P.], seq 36794:37137, ack 1, win 269, options [nop,nop,TS val 3832680 ecr 258138], length 343: OpenFlow
	version 1.0, type PACKET_IN, length 343, xid 0x00000000
17:59:51.317547 IP 192.168.1.10.6633 > 192.168.1.30.40486: Flags [.], ack 36108, win 5141, options [nop,nop,TS val 258139 ecr 3832680], length 0
17:59:51.317566 IP 192.168.1.30.40486 > 192.168.1.10.6633: Flags [P.], seq 37137:37480, ack 1, win 269, options [nop,nop,TS val 3832681 ecr 258138], length 343: OpenFlow
	version 1.0, type PACKET_IN, length 343, xid 0x00000000
17:59:51.317610 IP 192.168.1.30.40486 > 192.168.1.10.6633: Flags [P.], seq 37480:37823, ack 1, win 269, options [nop,nop,TS val 3832681 ecr 258139], length 343: OpenFlow
	version 1.0, type PACKET_IN, length 343, xid 0x00000000
17:59:51.317719 IP 192.168.1.10.6633 > 192.168.1.30.40486: Flags [.], ack 37137, win 5141, options [nop,nop,TS val 258139 ecr 3832680], length 0
17:59:51.317748 IP 192.168.1.30.40486 > 192.168.1.10.6633: Flags [P.], seq 37823:38166, ack 1, win 269, options [nop,nop,TS val 3832681 ecr 258139], length 343: OpenFlow
	version 1.0, type PACKET_IN, length 343, xid 0x00000000
17:59:51.317794 IP 192.168.1.30.40486 > 192.168.1.10.6633: Flags [P.], seq 38166:38509, ack 1, win 269, options [nop,nop,TS val 3832681 ecr 258139], length 343: OpenFlow
	version 1.0, type PACKET_IN, length 343, xid 0x00000000
17:59:51.317873 IP 192.168.1.30.40486 > 192.168.1.10.6633: Flags [P.], seq 38509:38852, ack 1, win 269, options [nop,nop,TS val 3832681 ecr 258139], length 343: OpenFlow
	version 1.0, type PACKET_IN, length 343, xid 0x00000000
17:59:51.317916 IP 192.168.1.30.40486 > 192.168.1.10.6633: Flags [P.], seq 38852:39195, ack 1, win 269, options [nop,nop,TS val 3832681 ecr 258139], length 343: OpenFlow
	version 1.0, type PACKET_IN, length 343, xid 0x00000000
17:59:51.317956 IP 192.168.1.10.6633 > 192.168.1.30.40486: Flags [.], ack 37823, win 5141, options [nop,nop,TS val 258139 ecr 3832681], length 0
17:59:51.317957 IP 192.168.1.30.40486 > 192.168.1.10.6633: Flags [P.], seq 39195:39538, ack 1, win 269, options [nop,nop,TS val 3832681 ecr 258139], length 343: OpenFlow
	version 1.0, type PACKET_IN, length 343, xid 0x00000000
17:59:51.317969 IP 192.168.1.10.6633 > 192.168.1.30.40486: Flags [.], ack 38509, win 5141, options [nop,nop,TS val 258139 ecr 3832681], length 0
17:59:51.318000 IP 192.168.1.30.40486 > 192.168.1.10.6633: Flags [P.], seq 39538:39881, ack 1, win 269, options [nop,nop,TS val 3832681 ecr 258139], length 343: OpenFlow
	version 1.0, type PACKET_IN, length 343, xid 0x00000000
17:59:51.318051 IP 192.168.1.30.40486 > 192.168.1.10.6633: Flags [P.], seq 39881:40076, ack 1, win 269, options [nop,nop,TS val 3832681 ecr 258139], length 195: OpenFlow
	version 1.0, type PACKET_IN, length 195, xid 0x00000000
17:59:51.318094 IP 192.168.1.30.40486 > 192.168.1.10.6633: Flags [P.], seq 40076:40271, ack 1, win 269, options [nop,nop,TS val 3832681 ecr 258139], length 195: OpenFlow
	version 1.0, type PACKET_IN, length 195, xid 0x00000000
17:59:51.318104 IP 192.168.1.10.6633 > 192.168.1.30.40486: Flags [.], ack 39195, win 5141, options [nop,nop,TS val 258139 ecr 3832681], length 0
17:59:51.318120 IP 192.168.1.30.40486 > 192.168.1.10.6633: Flags [P.], seq 40271:40614, ack 1, win 269, options [nop,nop,TS val 3832681 ecr 258139], length 343: OpenFlow
	version 1.0, type PACKET_IN, length 343, xid 0x00000000
17:59:51.318144 IP 192.168.1.30.40486 > 192.168.1.10.6633: Flags [P.], seq 40614:40957, ack 1, win 269, options [nop,nop,TS val 3832681 ecr 258139], length 343: OpenFlow
	version 1.0, type PACKET_IN, length 343, xid 0x00000000
17:59:51.318171 IP 192.168.1.30.40486 > 192.168.1.10.6633: Flags [P.], seq 40957:41082, ack 1, win 269, options [nop,nop,TS val 3832681 ecr 258139], length 125: OpenFlow
	version 1.0, type PACKET_IN, length 125, xid 0x00000000
17:59:51.318200 IP 192.168.1.30.40486 > 192.168.1.10.6633: Flags [P.], seq 41082:41425, ack 1, win 269, options [nop,nop,TS val 3832681 ecr 258139], length 343: OpenFlow
	version 1.0, type PACKET_IN, length 343, xid 0x00000000
17:59:51.318207 IP 192.168.1.10.6633 > 192.168.1.30.40486: Flags [.], ack 40076, win 5141, options [nop,nop,TS val 258139 ecr 3832681], length 0
