17:59:51.286732 IP 192.168.1.30.40494 > 192.168.1.10.6633: Flags [P.], seq 409266579:409266922, ack 978363034, win 298, options [nop,nop,TS val 3832673 ecr 257981], length 343: OpenFlow
	version 1.0, type PACKET_IN, length 343, xid 0x00000000
17:59:51.286780 IP 192.168.1.30.40494 > 192.168.1.10.6633: Flags [P.], seq 343:686, ack 1, win 298, options [nop,nop,TS val 3832673 ecr 257981], length 343: OpenFlow
	version 1.0, type PACKET_IN, length 343, xid 0x00000000
17:59:51.286825 IP 192.168.1.30.40494 > 192.168.1.10.6633: Flags [P.], seq 686:1029, ack 1, win 298, options [nop,nop,TS val 3832673 ecr 257981], length 343: OpenFlow
	version 1.0, type PACKET_IN, length 343, xid 0x00000000
17:59:51.286863 IP 192.168.1.30.40494 > 192.168.1.10.6633: Flags [P.], seq 1029:1372, ack 1, win 298, options [nop,nop,TS val 3832673 ecr 257981], length 343: OpenFlow
	version 1.0, type PACKET_IN, length 343, xid 0x00000000
17:59:51.286896 IP 192.168.1.30.40494 > 192.168.1.10.6633: Flags [P.], seq 1372:1715, ack 1, win 298, options [nop,nop,TS val 3832673 ecr 257981], length 343: OpenFlow
	version 1.0, type PACKET_IN, length 343, xid 0x00000000
17:59:51.286954 IP 192.168.1.30.40494 > 192.168.1.10.6633: Flags [P.], seq 1715:2058, ack 1, win 298, options [nop,nop,TS val 3832673 ecr 257981], length 343: OpenFlow
	version 1.0, type PACKET_IN, length 343, xid 0x00000000
17:59:51.286974 IP 192.168.1.30.40494 > 192.168.1.10.6633: Flags [P.], seq 2058:2401, ack 1, win 298, options [nop,nop,TS val 3832673 ecr 257981], length 343: OpenFlow
	version 1.0, type PACKET_IN, length 343, xid 0x00000000
17:59:51.286993 IP 192.168.1.30.40494 > 192.168.1.10.6633: Flags [P.], seq 2401:2744, ack 1, win 298, options [nop,nop,TS val 3832673 ecr 257981], length 343: OpenFlow
	version 1.0, type PACKET_IN, length 343, xid 0x00000000
17:59:51.287011 IP 192.168.1.30.40494 > 192.168.1.10.6633: Flags [P.], seq 2744:3087, ack 1, win 298, options [nop,nop,TS val 3832673 ecr 257981], length 343: OpenFlow
	version 1.0, type PACKET_IN, length 343, xid 0x00000000
17:59:51.287036 IP 192.168.1.30.40494 > 192.168.1.10.6633: Flags [P.], seq 3087:3430, ack 1, win 298, options [nop,nop,TS val 3832673 ecr 257981], length 343: OpenFlow
	version 1.0, type PACKET_IN, length 343, xid 0x00000000
17:59:51.287057 IP 192.168.1.30.40494 > 192.168.1.10.6633: Flags [P.], seq 3430:3518, ack 1, win 298, options [nop,nop,TS val 3832673 ecr 257981], length 88: OpenFlow
	version 1.0, type PACKET_IN, length 88, xid 0x00000000
17:59:51.288341 IP 192.168.1.10.6633 > 192.168.1.30.40494: Flags [.], ack 1715, win 5386, options [nop,nop,TS val 258131 ecr 3832673], length 0
17:59:51.288363 IP 192.168.1.10.6633 > 192.168.1.30.40494: Flags [.], ack 3430, win 5386, options [nop,nop,TS val 258131 ecr 3832673], length 0
17:59:51.288838 IP 192.168.1.30.40494 > 192.168.1.10.6633: Flags [P.], seq 3518:10985, ack 1, win 298, options [nop,nop,TS val 3832673 ecr 258131], length 7467: OpenFlow
	version 1.0, type PACKET_IN, length 360, xid 0x00000000
	version 1.0, type PACKET_IN, length 265, xid 0x00000000
	version 1.0, type PACKET_IN, length 343, xid 0x00000000
	version 1.0, type PACKET_IN, length 343, xid 0x00000000
	version 1.0, type PACKET_IN, length 265, xid 0x00000000
	version 1.0, type PACKET_IN, length 265, xid 0x00000000
	version 1.0, type PACKET_IN, length 265, xid 0x00000000
	version 1.0, type PACKET_IN, length 343, xid 0x00000000
	version 1.0, type PACKET_IN, length 343, xid 0x00000000
	version 1.0, type PACKET_IN, length 343, xid 0x00000000
	version 1.0, type PACKET_IN, length 343, xid 0x00000000
	version 1.0, type PACKET_IN, length 108, xid 0x00000000
	version 1.0, type PACKET_IN, length 343, xid 0x00000000
	version 1.0, type PACKET_IN, length 343, xid 0x00000000
	version 1.0, type PACKET_IN, length 343, xid 0x00000000
	version 1.0, type PACKET_IN, length 343, xid 0x00000000
	version 1.0, type PACKET_IN, length 343, xid 0x00000000
	version 1.0, type PACKET_IN, length 343, xid 0x00000000
	version 1.0, type PACKET_IN, length 343, xid 0x00000000
	version 1.0, type PACKET_IN, length 108, xid 0x00000000
	version 1.0, type PACKET_IN, length 343, xid 0x00000000
	version 1.0, type PACKET_IN, length 343, xid 0x00000000
	version 1.0, type PACKET_IN, length 343, xid 0x00000000
	version 1.0, type PACKET_IN, length 343, xid 0x00000000
17:59:51.288862 IP 192.168.1.30.40494 > 192.168.1.10.6633: Flags [.], seq 10985:16777, ack 1, win 298, options [nop,nop,TS val 3832673 ecr 258131], length 5792: OpenFlow
	version 1.0, type PACKET_IN, length 108, xid 0x00000000
	version 1.0, type PACKET_IN, length 343, xid 0x00000000
	version 1.0, type PACKET_IN, length 343, xid 0x00000000
	version 1.0, type PACKET_IN, length 265, xid 0x00000000
	version 1.0, type PACKET_IN, length 88, xid 0x00000000
	version 1.0, type PACKET_IN, length 343, xid 0x00000000
	version 1.0, type PACKET_IN, length 343, xid 0x00000000
	version 1.0, type PACKET_IN, length 343, xid 0x00000000
	version 1.0, type PACKET_IN, length 343, xid 0x00000000
	version 1.0, type PACKET_IN, length 343, xid 0x00000000
	version 1.0, type PACKET_IN, length 343, xid 0x00000000
	version 1.0, type PACKET_IN, length 343, xid 0x00000000
	version 1.0, type PACKET_IN, length 343, xid 0x00000000
	version 1.0, type PACKET_IN, length 343, xid 0x00000000
	version 1.0, type PACKET_IN, length 343, xid 0x00000000
	version 1.0, type PACKET_IN, length 88, xid 0x00000000
	version 1.0, type PACKET_IN, length 343, xid 0x00000000
	version 1.0, type PACKET_IN, length 343, xid 0x00000000
	version 1.0, type PACKET_IN, length 343, xid 0x00000000
	version 1.0, type PACKET_IN, length 343, xid 0x00000000 [|openflow]
17:59:51.288879 IP 192.168.1.30.40494 > 192.168.1.10.6633: Flags [P.], seq 16777:18227, ack 1, win 298, options [nop,nop,TS val 3832673 ecr 258131], length 1450: OpenFlow
	version unknown (0x75), type 0x2d, length 13856, xid 0x5b62323a [|openflow]
17:59:51.288893 IP 192.168.1.30.40494 > 192.168.1.10.6633: Flags [.], seq 18227:26915, ack 1, win 298, options [nop,nop,TS val 3832673 ecr 258131], length 8688: OpenFlow
	version 1.0, type PACKET_IN, length 343, xid 0x00000000
	version 1.0, type PACKET_IN, length 343, xid 0x00000000
	version 1.0, type PACKET_IN, length 108, xid 0x00000000
	version 1.0, type PACKET_IN, length 343, xid 0x00000000
	version 1.0, type PACKET_IN, length 343, xid 0x00000000
	version 1.0, type PACKET_IN, length 360, xid 0x00000000
	version 1.0, type PACKET_IN, length 343, xid 0x00000000
	version 1.0, type PACKET_IN, length 343, xid 0x00000000
	version 1.0, type PACKET_IN, length 343, xid 0x00000000
	version 1.0, type PACKET_IN, length 343, xid 0x00000000
	version 1.0, type PACKET_IN, length 343, xid 0x00000000
	version 1.0, type PACKET_IN, length 195, xid 0x00000000
	version 1.0, type PACKET_IN, length 343, xid 0x00000000
	version 1.0, type PACKET_IN, length 343, xid 0x00000000
	version 1.0, type PACKET_IN, length 343, xid 0x00000000
	version 1.0, type PACKET_IN, length 343, xid 0x00000000
	version 1.0, type PACKET_IN, length 88, xid 0x00000000
	version 1.0, type PACKET_IN, length 343, xid 0x00000000
	version 1.0, type PACKET_IN, length 343, xid 0x00000000
	version 1.0, type PACKET_IN, length 343, xid 0x00000000
	version 1.0, type PACKET_IN, length 343, xid 0x00000000
	version 1.0, type PACKET_IN, length 265, xid 0x00000000
	version 1.0, type PACKET_IN, length 343, xid 0x00000000
	version 1.0, type PACKET_IN, length 343, xid 0x00000000
	version 1.0, type PACKET_IN, length 343, xid 0x00000000
	version 1.0, type PACKET_IN, length 343, xid 0x00000000
	version 1.0, type PACKET_IN, length 343, xid 0x00000000
	version 1.0, type PACKET_IN, length 343, xid 0x00000000 [|openflow]
17:59:51.288909 IP 192.168.1.30.40494 > 192.168.1.10.6633: Flags [.], seq 26915:29811, ack 1, win 298, options [nop,nop,TS val 3832673 ecr 258131], length 2896: OpenFlow
	version unknown (0x6b), type 0x73, length 29793, xid 0x74696f6e [|openflow]
17:59:51.289268 IP 192.168.1.10.6633 > 192.168.1.30.40494: Flags [.], ack 10985, win 5386, options [nop,nop,TS val 258131 ecr 3832673], length 0
17:59:51.289539 IP 192.168.1.30.40494 > 192.168.1.10.6633: Flags [.], seq 29811:35603, ack 1, win 298, options [nop,nop,TS val 3832673 ecr 258131], length 5792: OpenFlow
	version unknown (0x00), type 0x00, length 30720, xid 0x02c046c0 [|openflow]
17:59:51.289561 IP 192.168.1.30.40494 > 192.168.1.10.6633: Flags [P.], seq 35603:42642, ack 1, win 298, options [nop,nop,TS val 3832674 ecr 258131], length 7039: OpenFlow
	version unknown (0x73), type 0x65, length 29302, xid 0x69636573 [|openflow]
17:59:51.289584 IP 192.168.1.30.40494 > 192.168.1.10.6633: Flags [.], seq 42642:49882, ack 1, win 298, options [nop,nop,TS val 3832674 ecr 258131], length 7240: OpenFlow
	version 1.0, type PACKET_IN, length 343, xid 0x00000000
	version 1.0, type PACKET_IN, length 343, xid 0x00000000
	version 1.0, type PACKET_IN, length 343, xid 0x00000000
	version 1.0, type PACKET_IN, length 343, xid 0x00000000
	version 1.0, type PACKET_IN, length 343, xid 0x00000000
	version 1.0, type PACKET_IN, length 343, xid 0x00000000
	version 1.0, type PACKET_IN, length 343, xid 0x00000000
	version 1.0, type PACKET_IN, length 343, xid 0x00000000
	version 1.0, type PACKET_IN, length 195, xid 0x00000000
	version 1.0, type PACKET_IN, length 343, xid 0x00000000
	version 1.0, type PACKET_IN, length 343, xid 0x00000000
	version 1.0, type PACKET_IN, length 343, xid 0x00000000
	version 1.0, type PACKET_IN, length 343, xid 0x00000000
	version 1.0, type PACKET_IN, length 88, xid 0x00000000
	version 1.0, type PACKET_IN, length 343, xid 0x00000000
	version 1.0, type PACKET_IN, length 343, xid 0x00000000
	version 1.0, type PACKET_IN, length 343, xid 0x00000000
	version 1.0, type PACKET_IN, length 343, xid 0x00000000
	version 1.0, type PACKET_IN, length 343, xid 0x00000000
	version 1.0, type PACKET_IN, length 343, xid 0x00000000
	version 1.0, type PACKET_IN, length 343, xid 0x00000000
	version 1.0, type PACKET_IN, length 343, xid 0x00000000
	version 1.0, type PACKET_IN, length 343, xid 0x00000000 [|openflow]
17:59:51.289628 IP 192.168.1.10.6633 > 192.168.1.30.40494: Flags [.], ack 18227, win 5386, options [nop,nop,TS val 258131 ecr 3832673], length 0
17:59:51.289655 IP 192.168.1.30.40494 > 192.168.1.10.6633: Flags [P.], seq 49882:50471, ack 1, win 298, options [nop,nop,TS val 3832674 ecr 258131], length 589: OpenFlow
	version unknown (0x74), type 0x75, length 11574, xid 0x205b6232 [|openflow]
17:59:51.289676 IP 192.168.1.30.40494 > 192.168.1.10.6633: Flags [.], seq 50471:59159, ack 1, win 298, options [nop,nop,TS val 3832674 ecr 258131], length 8688: OpenFlow
	version 1.0, type PACKET_IN, length 343, xid 0x00000000
	version 1.0, type PACKET_IN, length 343, xid 0x00000000
	version 1.0, type PACKET_IN, length 343, xid 0x00000000
	version 1.0, type PACKET_IN, length 343, xid 0x00000000
	version 1.0, type PACKET_IN, length 128, xid 0x00000000
	version 1.0, type PACKET_IN, length 125, xid 0x00000000
	version 1.0, type PACKET_IN, length 343, xid 0x00000000
	version 1.0, type PACKET_IN, length 343, xid 0x00000000
	version 1.0, type PACKET_IN, length 343, xid 0x00000000
	version 1.0, type PACKET_IN, length 343, xid 0x00000000
	version 1.0, type PACKET_IN, length 343, xid 0x00000000
	version 1.0, type PACKET_IN, length 88, xid 0x00000000
	version 1.0, type PACKET_IN, length 343, xid 0x00000000
	version 1.0, type PACKET_IN, length 343, xid 0x00000000
	version 1.0, type PACKET_IN, length 343, xid 0x00000000
	version 1.0, type PACKET_IN, length 343, xid 0x00000000
	version 1.0, type PACKET_IN, length 343, xid 0x00000000
	version 1.0, type PACKET_IN, length 343, xid 0x00000000
	version 1.0, type PACKET_IN, length 343, xid 0x00000000
	version 1.0, type PACKET_IN, length 343, xid 0x00000000
	version 1.0, type PACKET_IN, length 360, xid 0x00000000
	version 1.0, type PACKET_IN, length 343, xid 0x00000000
	version 1.0, type PACKET_IN, length 343, xid 0x00000000
	version 1.0, type PACKET_IN, length 343, xid 0x00000000
	version 1.0, type PACKET_IN, length 360, xid 0x00000000
	version 1.0, type PACKET_IN, length 343, xid 0x00000000
	version 1.0, type PACKET_IN, length 343, xid 0x00000000
	version 1.0, type PACKET_IN, length 343, xid 0x00000000 [|openflow]
17:59:51.289700 IP 192.168.1.30.40494 > 192.168.1.10.6633: Flags [.], seq 59159:66399, ack 1, win 298, options [nop,nop,TS val 3832674 ecr 258131], length 7240: OpenFlow
	version unknown (0x00), type 0x00, length 0, xid 0x03000000 (corrupt)
17:59:51.289820 IP 192.168.1.10.6633 > 192.168.1.30.40494: Flags [.], ack 29811, win 5386, options [nop,nop,TS val 258132 ecr 3832673], length 0
17:59:51.289845 IP 192.168.1.30.40494 > 192.168.1.10.6633: Flags [.], seq 66399:67847, ack 1, win 298, options [nop,nop,TS val 3832674 ecr 258132], length 1448: OpenFlow
	version unknown (0x30), type 0x01, length 12289, xid 0x30013001 [|openflow]
17:59:51.289861 IP 192.168.1.30.40494 > 192.168.1.10.6633: Flags [P.], seq 67847:75893, ack 1, win 298, options [nop,nop,TS val 3832674 ecr 258132], length 8046: OpenFlow
	version unknown (0x0c), type 0x00, length 256, xid 0x00007800
	version 1.0, type invalid (0x38), length 304, xid 0x01370130
	version unknown (0x00), type 0x01, length 2165, xid 0x62756e74
	version unknown (0xfe), type 0x80, length 0, xid 0x00000000 (corrupt)
17:59:51.289880 IP 192.168.1.30.40494 > 192.168.1.10.6633: Flags [.], seq 75893:78789, ack 1, win 298, options [nop,nop,TS val 3832674 ecr 258132], length 2896: OpenFlow
	version 1.0, type PACKET_IN, length 343, xid 0x00000000
	version 1.0, type PACKET_IN, length 343, xid 0x00000000
	version 1.0, type PACKET_IN, length 343, xid 0x00000000
	version 1.0, type PACKET_IN, length 343, xid 0x00000000
	version 1.0, type PACKET_IN, length 128, xid 0x00000000
	version 1.0, type PACKET_IN, length 343, xid 0x00000000
	version 1.0, type PACKET_IN, length 343, xid 0x00000000
	version 1.0, type PACKET_IN, length 343, xid 0x00000000
	version 1.0, type PACKET_IN, length 343, xid 0x00000000
	version 1.0, type PACKET_IN, length 360, xid 0x00000000 [|openflow]
17:59:51.289907 IP 192.168.1.30.40494 > 192.168.1.10.6633: Flags [.], seq 78789:81685, ack 1, win 298, options [nop,nop,TS val 3832674 ecr 258132], length 2896: OpenFlow
	version unknown (0x3a), type 0xe3, length 3819, xid 0x8ec00800 [|openflow]
17:59:51.290127 IP 192.168.1.10.6633 > 192.168.1.30.40494: Flags [.], ack 35603, win 5386, options [nop,nop,TS val 258132 ecr 3832673], length 0
17:59:51.290151 IP 192.168.1.10.6633 > 192.168.1.30.40494: Flags [.], ack 42642, win 5386, options [nop,nop,TS val 258132 ecr 3832674], length 0
17:59:51.290155 IP 192.168.1.30.40494 > 192.168.1.10.6633: Flags [.], seq 81685:84581, ack 1, win 298, options [nop,nop,TS val 3832674 ecr 258132], length 2896: OpenFlow
	version unknown (0x63), type 0x61, length 27648, xid 0x00ff0001 [|openflow]
17:59:51.290168 IP 192.168.1.30.40494 > 192.168.1.10.6633: Flags [.], seq 84581:87477, ack 1, win 298, options [nop,nop,TS val 3832674 ecr 258132], length 2896: OpenFlow
	version unknown (0x78), type 0x00, length 3334, xid 0x5838365f [|openflow]
17:59:51.290181 IP 192.168.1.10.6633 > 192.168.1.30.40494: Flags [.], ack 50471, win 5386, options [nop,nop,TS val 258132 ecr 3832674], length 0
17:59:51.290184 IP 192.168.1.30.40494 > 192.168.1.10.6633: Flags [.], seq 87477:90373, ack 1, win 298, options [nop,nop,TS val 3832674 ecr 258132], length 2896: OpenFlow
	version 1.0, type invalid (0x66), length 358, xid 0x01330138
	version unknown (0x62), type 0x01, length 12289, xid 0x30013001 [|openflow]
17:59:51.290196 IP 192.168.1.30.40494 > 192.168.1.10.6633: Flags [.], seq 90373:93269, ack 1, win 298, options [nop,nop,TS val 3832674 ecr 258132], length 2896: OpenFlow
	version unknown (0x61), type 0x74, length 26991, xid 0x6e045f74 [|openflow]
17:59:51.290212 IP 192.168.1.30.40494 > 192.168.1.10.6633: Flags [.], seq 93269:96165, ack 1, win 298, options [nop,nop,TS val 3832674 ecr 258132], length 2896: OpenFlow
	version unknown (0x00), type 0x02, length 49222, xid 0xc046000d [|openflow]
17:59:51.290231 IP 192.168.1.30.40494 > 192.168.1.10.6633: Flags [.], seq 96165:101957, ack 1, win 298, options [nop,nop,TS val 3832674 ecr 258132], length 5792: OpenFlow
	version unknown (0x00), type 0x00, length 7285, xid 0x62756e74 [|openflow]
17:59:51.290261 IP 192.168.1.30.40494 > 192.168.1.10.6633: Flags [P.], seq 101957:102274, ack 1, win 298, options [nop,nop,TS val 3832674 ecr 258132], length 317: OpenFlow
	version unknown (0x83), type 0x20, length 13472, xid 0x86dd6000 [|openflow]
17:59:51.290293 IP 192.168.1.30.40494 > 192.168.1.10.6633: Flags [P.], seq 102274:102617, ack 1, win 298, options [nop,nop,TS val 3832674 ecr 258132], length 343: OpenFlow
	version 1.0, type PACKET_IN, length 343, xid 0x00000000
17:59:51.290334 IP 192.168.1.30.40494 > 192.168.1.10.6633: Flags [P.], seq 102617:102960, ack 1, win 298, options [nop,nop,TS val 3832674 ecr 258132], length 343: OpenFlow
	version 1.0, type PACKET_IN, length 343, xid 0x00000000
17:59:51.290702 IP 192.168.1.10.6633 > 192.168.1.30.40494: Flags [.], ack 102274, win 5239, options [nop,nop,TS val 258132 ecr 3832674], length 0
17:59:51.290734 IP 192.168.1.30.40494 > 192.168.1.10.6633: Flags [.], seq 102960:107304, ack 1, win 298, options [nop,nop,TS val 3832674 ecr 258132], length 4344: OpenFlow
	version 1.0, type PACKET_IN, length 343, xid 0x00000000
	version 1.0, type PACKET_IN, length 343, xid 0x00000000
	version 1.0, type PACKET_IN, length 343, xid 0x00000000
	version 1.0, type PACKET_IN, length 343, xid 0x00000000
	version 1.0, type PACKET_IN, length 343, xid 0x00000000
	version 1.0, type PACKET_IN, length 360, xid 0x00000000
	version 1.0, type PACKET_IN, length 343, xid 0x00000000
	version 1.0, type PACKET_IN, length 343, xid 0x00000000
	version 1.0, type PACKET_IN, length 343, xid 0x00000000
	version 1.0, type PACKET_IN, length 343, xid 0x00000000
	version 1.0, type PACKET_IN, length 343, xid 0x00000000
	version 1.0, type PACKET_IN, length 343, xid 0x00000000
	version 1.0, type PACKET_IN, length 343, xid 0x00000000 [|openflow]
17:59:51.290753 IP 192.168.1.30.40494 > 192.168.1.10.6633: Flags [P.], seq 107304:108465, ack 1, win 298, options [nop,nop,TS val 3832674 ecr 258132], length 1161: OpenFlow
	version 1.0, type invalid (0x30), length 304, xid 0x01300130
	version unknown (0x33), type 0x01, length 12289, xid 0x32016501 [|openflow]
17:59:51.290771 IP 192.168.1.30.40494 > 192.168.1.10.6633: Flags [P.], seq 108465:108808, ack 1, win 298, options [nop,nop,TS val 3832674 ecr 258132], length 343: OpenFlow
	version 1.0, type PACKET_IN, length 343, xid 0x00000000
17:59:51.290831 IP 192.168.1.30.40494 > 192.168.1.10.6633: Flags [P.], seq 108808:109151, ack 1, win 298, options [nop,nop,TS val 3832674 ecr 258132], length 343: OpenFlow
	version 1.0, type PACKET_IN, length 343, xid 0x00000000
17:59:51.290876 IP 192.168.1.30.40494 > 192.168.1.10.6633: Flags [P.], seq 109151:109494, ack 1, win 298, options [nop,nop,TS val 3832674 ecr 258132], length 343: OpenFlow
	version 1.0, type PACKET_IN, length 343, xid 0x00000000
17:59:51.290913 IP 192.168.1.30.40494 > 192.168.1.10.6633: Flags [P.], seq 109494:109837, ack 1, win 298, options [nop,nop,TS val 3832674 ecr 258132], length 343: OpenFlow
	version 1.0, type PACKET_IN, length 343, xid 0x00000000
17:59:51.290956 IP 192.168.1.30.40494 > 192.168.1.10.6633: Flags [P.], seq 109837:110180, ack 1, win 298, options [nop,nop,TS val 3832674 ecr 258132], length 343: OpenFlow
	version 1.0, type PACKET_IN, length 343, xid 0x00000000
17:59:51.291001 IP 192.168.1.30.40494 > 192.168.1.10.6633: Flags [P.], seq 110180:110523, ack 1, win 298, options [nop,nop,TS val 3832674 ecr 258132], length 343: OpenFlow
	version 1.0, type PACKET_IN, length 343, xid 0x00000000
17:59:51.291038 IP 192.168.1.30.40494 > 192.168.1.10.6633: Flags [P.], seq 110523:110866, ack 1, win 298, options [nop,nop,TS val 3832674 ecr 258132], length 343: OpenFlow
	version 1.0, type PACKET_IN, length 343, xid 0x00000000
17:59:51.291080 IP 192.168.1.30.40494 > 192.168.1.10.6633: Flags [P.], seq 110866:111209, ack 1, win 298, options [nop,nop,TS val 3832674 ecr 258132], length 343: OpenFlow
	version 1.0, type PACKET_IN, length 343, xid 0x00000000
17:59:51.291117 IP 192.168.1.30.40494 > 192.168.1.10.6633: Flags [P.], seq 111209:111552, ack 1, win 298, options [nop,nop,TS val 3832674 ecr 258132], length 343: OpenFlow
	version 1.0, type PACKET_IN, length 343, xid 0x00000000
17:59:51.291160 IP 192.168.1.30.40494 > 192.168.1.10.6633: Flags [P.], seq 111552:111895, ack 1, win 298, options [nop,nop,TS val 3832674 ecr 258132], length 343: OpenFlow
	version 1.0, type PACKET_IN, length 343, xid 0x00000000
17:59:51.291201 IP 192.168.1.30.40494 > 192.168.1.10.6633: Flags [P.], seq 111895:112238, ack 1, win 298, options [nop,nop,TS val 3832674 ecr 258132], length 343: OpenFlow
	version 1.0, type PACKET_IN, length 343, xid 0x00000000
17:59:51.291242 IP 192.168.1.30.40494 > 192.168.1.10.6633: Flags [P.], seq 112238:112581, ack 1, win 298, options [nop,nop,TS val 3832674 ecr 258132], length 343: OpenFlow
	version 1.0, type PACKET_IN, length 343, xid 0x00000000
17:59:51.291281 IP 192.168.1.30.40494 > 192.168.1.10.6633: Flags [P.], seq 112581:112924, ack 1, win 298, options [nop,nop,TS val 3832674 ecr 258132], length 343: OpenFlow
	version 1.0, type PACKET_IN, length 343, xid 0x00000000
17:59:51.291333 IP 192.168.1.30.40494 > 192.168.1.10.6633: Flags [P.], seq 112924:113267, ack 1, win 298, options [nop,nop,TS val 3832674 ecr 258132], length 343: OpenFlow
	version 1.0, type PACKET_IN, length 343, xid 0x00000000
17:59:51.291371 IP 192.168.1.30.40494 > 192.168.1.10.6633: Flags [P.], seq 113267:113610, ack 1, win 298, options [nop,nop,TS val 3832674 ecr 258132], length 343: OpenFlow
	version 1.0, type PACKET_IN, length 343, xid 0x00000000
17:59:51.291412 IP 192.168.1.30.40494 > 192.168.1.10.6633: Flags [P.], seq 113610:113953, ack 1, win 298, options [nop,nop,TS val 3832674 ecr 258132], length 343: OpenFlow
	version 1.0, type PACKET_IN, length 343, xid 0x00000000
17:59:51.291450 IP 192.168.1.30.40494 > 192.168.1.10.6633: Flags [P.], seq 113953:114296, ack 1, win 298, options [nop,nop,TS val 3832674 ecr 258132], length 343: OpenFlow
	version 1.0, type PACKET_IN, length 343, xid 0x00000000
17:59:51.292216 IP 192.168.1.30.40494 > 192.168.1.10.6633: Flags [P.], seq 114296:114639, ack 1, win 298, options [nop,nop,TS val 3832674 ecr 258132], length 343: OpenFlow
	version 1.0, type PACKET_IN, length 343, xid 0x00000000
17:59:51.292261 IP 192.168.1.30.40494 > 192.168.1.10.6633: Flags [P.], seq 114639:114727, ack 1, win 298, options [nop,nop,TS val 3832674 ecr 258132], length 88: OpenFlow
	version 1.0, type PACKET_IN, length 88, xid 0x00000000
17:59:51.292295 IP 192.168.1.30.40494 > 192.168.1.10.6633: Flags [P.], seq 114727:115070, ack 1, win 298, options [nop,nop,TS val 3832674 ecr 258132], length 343: OpenFlow
	version 1.0, type PACKET_IN, length 343, xid 0x00000000
17:59:51.292344 IP 192.168.1.30.40494 > 192.168.1.10.6633: Flags [P.], seq 115070:115413, ack 1, win 298, options [nop,nop,TS val 3832674 ecr 258132], length 343: OpenFlow
	version 1.0, type PACKET_IN, length 343, xid 0x00000000
17:59:51.292387 IP 192.168.1.30.40494 > 192.168.1.10.6633: Flags [P.], seq 115413:115756, ack 1, win 298, options [nop,nop,TS val 3832674 ecr 258132], length 343: OpenFlow
	version 1.0, type PACKET_IN, length 343, xid 0x00000000
17:59:51.292432 IP 192.168.1.30.40494 > 192.168.1.10.6633: Flags [P.], seq 115756:116099, ack 1, win 298, options [nop,nop,TS val 3832674 ecr 258132], length 343: OpenFlow
	version 1.0, type PACKET_IN, length 343, xid 0x00000000
17:59:51.292456 IP 192.168.1.10.6633 > 192.168.1.30.40494: Flags [.], ack 108465, win 5345, options [nop,nop,TS val 258132 ecr 3832674], length 0
17:59:51.292480 IP 192.168.1.30.40494 > 192.168.1.10.6633: Flags [P.], seq 116099:116227, ack 1, win 298, options [nop,nop,TS val 3832674 ecr 258132], length 128: OpenFlow
	version 1.0, type PACKET_IN, length 128, xid 0x00000000
17:59:51.292516 IP 192.168.1.30.40494 > 192.168.1.10.6633: Flags [P.], seq 116227:116570, ack 1, win 298, options [nop,nop,TS val 3832674 ecr 258132], length 343: OpenFlow
	version 1.0, type PACKET_IN, length 343, xid 0x00000000
17:59:51.292564 IP 192.168.1.30.40494 > 192.168.1.10.6633: Flags [P.], seq 116570:116913, ack 1, win 298, options [nop,nop,TS val 3832674 ecr 258132], length 343: OpenFlow
	version 1.0, type PACKET_IN, length 343, xid 0x00000000
17:59:51.292606 IP 192.168.1.30.40494 > 192.168.1.10.6633: Flags [P.], seq 116913:117256, ack 1, win 298, options [nop,nop,TS val 3832674 ecr 258132], length 343: OpenFlow
	version 1.0, type PACKET_IN, length 343, xid 0x00000000
17:59:51.292645 IP 192.168.1.30.40494 > 192.168.1.10.6633: Flags [P.], seq 117256:117599, ack 1, win 298, options [nop,nop,TS val 3832674 ecr 258132], length 343: OpenFlow
	version 1.0, type PACKET_IN, length 343, xid 0x00000000
17:59:51.292689 IP 192.168.1.30.40494 > 192.168.1.10.6633: Flags [P.], seq 117599:117942, ack 1, win 298, options [nop,nop,TS val 3832674 ecr 258132], length 343: OpenFlow
	version 1.0, type PACKET_IN, length 343, xid 0x00000000
17:59:51.292735 IP 192.168.1.30.40494 > 192.168.1.10.6633: Flags [P.], seq 117942:118285, ack 1, win 298, options [nop,nop,TS val 3832674 ecr 258132], length 343: OpenFlow
	version 1.0, type PACKET_IN, length 343, xid 0x00000000
17:59:51.292783 IP 192.168.1.30.40494 > 192.168.1.10.6633: Flags [P.], seq 118285:118628, ack 1, win 298, options [nop,nop,TS val 3832674 ecr 258132], length 343: OpenFlow
	version 1.0, type PACKET_IN, length 343, xid 0x00000000
17:59:51.292806 IP 192.168.1.10.6633 > 192.168.1.30.40494: Flags [.], ack 116913, win 5386, options [nop,nop,TS val 258132 ecr 3832674], length 0
17:59:51.292834 IP 192.168.1.30.40494 > 192.168.1.10.6633: Flags [P.], seq 118628:118971, ack 1, win 298, options [nop,nop,TS val 3832674 ecr 258132], length 343: OpenFlow
	version 1.0, type PACKET_IN, length 343, xid 0x00000000
17:59:51.292879 IP 192.168.1.30.40494 > 192.168.1.10.6633: Flags [P.], seq 118971:119314, ack 1, win 298, options [nop,nop,TS val 3832674 ecr 258132], length 343: OpenFlow
	version 1.0, type PACKET_IN, length 343, xid 0x00000000
17:59:51.292912 IP 192.168.1.30.40494 > 192.168.1.10.6633: Flags [P.], seq 119314:119657, ack 1, win 298, options [nop,nop,TS val 3832674 ecr 258132], length 343: OpenFlow
	version 1.0, type PACKET_IN, length 343, xid 0x00000000
17:59:51.292950 IP 192.168.1.30.40494 > 192.168.1.10.6633: Flags [P.], seq 119657:120000, ack 1, win 298, options [nop,nop,TS val 3832674 ecr 258132], length 343: OpenFlow
	version 1.0, type PACKET_IN, length 343, xid 0x00000000
17:59:51.292980 IP 192.168.1.30.40494 > 192.168.1.10.6633: Flags [P.], seq 120000:120343, ack 1, win 298, options [nop,nop,TS val 3832674 ecr 258132], length 343: OpenFlow
	version 1.0, type PACKET_IN, length 343, xid 0x00000000
17:59:51.293017 IP 192.168.1.30.40494 > 192.168.1.10.6633: Flags [P.], seq 120343:120686, ack 1, win 298, options [nop,nop,TS val 3832674 ecr 258132], length 343: OpenFlow
	version 1.0, type PACKET_IN, length 343, xid 0x00000000
17:59:51.293018 IP 192.168.1.10.6633 > 192.168.1.30.40494: Flags [.], ack 117942, win 5386, options [nop,nop,TS val 258132 ecr 3832674], length 0
17:59:51.293029 IP 192.168.1.10.6633 > 192.168.1.30.40494: Flags [.], ack 119314, win 5386, options [nop,nop,TS val 258132 ecr 3832674], length 0
17:59:51.293065 IP 192.168.1.30.40494 > 192.168.1.10.6633: Flags [P.], seq 120686:121029, ack 1, win 298, options [nop,nop,TS val 3832674 ecr 258132], length 343: OpenFlow
	version 1.0, type PACKET_IN, length 343, xid 0x00000000
17:59:51.293099 IP 192.168.1.30.40494 > 192.168.1.10.6633: Flags [P.], seq 121029:121372, ack 1, win 298, options [nop,nop,TS val 3832674 ecr 258132], length 343: OpenFlow
	version 1.0, type PACKET_IN, length 343, xid 0x00000000
17:59:51.293136 IP 192.168.1.30.40494 > 192.168.1.10.6633: Flags [P.], seq 121372:121715, ack 1, win 298, options [nop,nop,TS val 3832674 ecr 258132], length 343: OpenFlow
	version 1.0, type PACKET_IN, length 343, xid 0x00000000
17:59:51.293167 IP 192.168.1.30.40494 > 192.168.1.10.6633: Flags [P.], seq 121715:122058, ack 1, win 298, options [nop,nop,TS val 3832674 ecr 258132], length 343: OpenFlow
	version 1.0, type PACKET_IN, length 343, xid 0x00000000
17:59:51.293230 IP 192.168.1.10.6633 > 192.168.1.30.40494: Flags [.], ack 120686, win 5386, options [nop,nop,TS val 258132 ecr 3832674], length 0
17:59:51.293266 IP 192.168.1.30.40494 > 192.168.1.10.6633: Flags [P.], seq 122058:122401, ack 1, win 298, options [nop,nop,TS val 3832674 ecr 258132], length 343: OpenFlow
	version 1.0, type PACKET_IN, length 343, xid 0x00000000
17:59:51.293301 IP 192.168.1.30.40494 > 192.168.1.10.6633: Flags [P.], seq 122401:122744, ack 1, win 298, options [nop,nop,TS val 3832674 ecr 258132], length 343: OpenFlow
	version 1.0, type PACKET_IN, length 343, xid 0x00000000
17:59:51.293332 IP 192.168.1.30.40494 > 192.168.1.10.6633: Flags [P.], seq 122744:123104, ack 1, win 298, options [nop,nop,TS val 3832674 ecr 258132], length 360: OpenFlow
	version 1.0, type PACKET_IN, length 360, xid 0x00000000
17:59:51.293377 IP 192.168.1.30.40494 > 192.168.1.10.6633: Flags [P.], seq 123104:123447, ack 1, win 298, options [nop,nop,TS val 3832674 ecr 258132], length 343: OpenFlow
	version 1.0, type PACKET_IN, length 343, xid 0x00000000
17:59:51.293414 IP 192.168.1.30.40494 > 192.168.1.10.6633: Flags [P.], seq 123447:123790, ack 1, win 298, options [nop,nop,TS val 3832674 ecr 258132], length 343: OpenFlow
	version 1.0, type PACKET_IN, length 343, xid 0x00000000
17:59:51.293452 IP 192.168.1.30.40494 > 192.168.1.10.6633: Flags [P.], seq 123790:124133, ack 1, win 298, options [nop,nop,TS val 3832674 ecr 258132], length 343: OpenFlow
	version 1.0, type PACKET_IN, length 343, xid 0x00000000
17:59:51.293512 IP 192.168.1.30.40494 > 192.168.1.10.6633: Flags [P.], seq 124133:124476, ack 1, win 298, options [nop,nop,TS val 3832675 ecr 258132], length 343: OpenFlow
	version 1.0, type PACKET_IN, length 343, xid 0x00000000
17:59:51.293517 IP 192.168.1.10.6633 > 192.168.1.30.40494: Flags [.], ack 122058, win 5386, options [nop,nop,TS val 258133 ecr 3832674], length 0
17:59:51.293540 IP 192.168.1.10.6633 > 192.168.1.30.40494: Flags [.], ack 123104, win 5386, options [nop,nop,TS val 258133 ecr 3832674], length 0
17:59:51.293555 IP 192.168.1.30.40494 > 192.168.1.10.6633: Flags [P.], seq 124476:124819, ack 1, win 298, options [nop,nop,TS val 3832675 ecr 258133], length 343: OpenFlow
	version 1.0, type PACKET_IN, length 343, xid 0x00000000
17:59:51.293591 IP 192.168.1.30.40494 > 192.168.1.10.6633: Flags [P.], seq 124819:125162, ack 1, win 298, options [nop,nop,TS val 3832675 ecr 258133], length 343: OpenFlow
	version 1.0, type PACKET_IN, length 343, xid 0x00000000
17:59:51.293626 IP 192.168.1.30.40494 > 192.168.1.10.6633: Flags [P.], seq 125162:125505, ack 1, win 298, options [nop,nop,TS val 3832675 ecr 258133], length 343: OpenFlow
	version 1.0, type PACKET_IN, length 343, xid 0x00000000
17:59:51.293666 IP 192.168.1.30.40494 > 192.168.1.10.6633: Flags [P.], seq 125505:125848, ack 1, win 298, options [nop,nop,TS val 3832675 ecr 258133], length 343: OpenFlow
	version 1.0, type PACKET_IN, length 343, xid 0x00000000
17:59:51.293679 IP 192.168.1.10.6633 > 192.168.1.30.40494: Flags [.], ack 124133, win 5386, options [nop,nop,TS val 258133 ecr 3832674], length 0
17:59:51.293706 IP 192.168.1.30.40494 > 192.168.1.10.6633: Flags [P.], seq 125848:126043, ack 1, win 298, options [nop,nop,TS val 3832675 ecr 258133], length 195: OpenFlow
	version 1.0, type PACKET_IN, length 195, xid 0x00000000
17:59:51.293737 IP 192.168.1.30.40494 > 192.168.1.10.6633: Flags [P.], seq 126043:126386, ack 1, win 298, options [nop,nop,TS val 3832675 ecr 258133], length 343: OpenFlow
	version 1.0, type PACKET_IN, length 343, xid 0x00000000
17:59:51.293775 IP 192.168.1.30.40494 > 192.168.1.10.6633: Flags [P.], seq 126386:126729, ack 1, win 298, options [nop,nop,TS val 3832675 ecr 258133], length 343: OpenFlow
	version 1.0, type PACKET_IN, length 343, xid 0x00000000
17:59:51.293834 IP 192.168.1.10.6633 > 192.168.1.30.40494: Flags [.], ack 125505, win 5386, options [nop,nop,TS val 258133 ecr 3832675], length 0
17:59:51.293896 IP 192.168.1.10.6633 > 192.168.1.30.40494: Flags [.], ack 126729, win 5386, options [nop,nop,TS val 258133 ecr 3832675], length 0
17:59:51.293972 IP 192.168.1.30.40494 > 192.168.1.10.6633: Flags [P.], seq 126729:127072, ack 1, win 298, options [nop,nop,TS val 3832675 ecr 258133], length 343: OpenFlow
	version 1.0, type PACKET_IN, length 343, xid 0x00000000
17:59:51.294013 IP 192.168.1.30.40494 > 192.168.1.10.6633: Flags [P.], seq 127072:127415, ack 1, win 298, options [nop,nop,TS val 3832675 ecr 258133], length 343: OpenFlow
	version 1.0, type PACKET_IN, length 343, xid 0x00000000
17:59:51.294050 IP 192.168.1.30.40494 > 192.168.1.10.6633: Flags [P.], seq 127415:127758, ack 1, win 298, options [nop,nop,TS val 3832675 ecr 258133], length 343: OpenFlow
	version 1.0, type PACKET_IN, length 343, xid 0x00000000
17:59:51.294093 IP 192.168.1.30.40494 > 192.168.1.10.6633: Flags [P.], seq 127758:128101, ack 1, win 298, options [nop,nop,TS val 3832675 ecr 258133], length 343: OpenFlow
	version 1.0, type PACKET_IN, length 343, xid 0x00000000
17:59:51.294126 IP 192.168.1.30.40494 > 192.168.1.10.6633: Flags [P.], seq 128101:128444, ack 1, win 298, options [nop,nop,TS val 3832675 ecr 258133], length 343: OpenFlow
	version 1.0, type PACKET_IN, length 343, xid 0x00000000
17:59:51.294259 IP 192.168.1.10.6633 > 192.168.1.30.40494: Flags [.], ack 127758, win 5386, options [nop,nop,TS val 258133 ecr 3832675], length 0
17:59:51.294285 IP 192.168.1.30.40494 > 192.168.1.10.6633: Flags [P.], seq 128444:128787, ack 1, win 298, options [nop,nop,TS val 3832675 ecr 258133], length 343: OpenFlow
	version 1.0, type PACKET_IN, length 343, xid 0x00000000
17:59:51.294320 IP 192.168.1.30.40494 > 192.168.1.10.6633: Flags [P.], seq 128787:129130, ack 1, win 298, options [nop,nop,TS val 3832675 ecr 258133], length 343: OpenFlow
	version 1.0, type PACKET_IN, length 343, xid 0x00000000
17:59:51.294361 IP 192.168.1.30.40494 > 192.168.1.10.6633: Flags [P.], seq 129130:129473, ack 1, win 298, options [nop,nop,TS val 3832675 ecr 258133], length 343: OpenFlow
	version 1.0, type PACKET_IN, length 343, xid 0x00000000
17:59:51.294393 IP 192.168.1.30.40494 > 192.168.1.10.6633: Flags [P.], seq 129473:129816, ack 1, win 298, options [nop,nop,TS val 3832675 ecr 258133], length 343: OpenFlow
	version 1.0, type PACKET_IN, length 343, xid 0x00000000
17:59:51.294434 IP 192.168.1.30.40494 > 192.168.1.10.6633: Flags [P.], seq 129816:130159, ack 1, win 298, options [nop,nop,TS val 3832675 ecr 258133], length 343: OpenFlow
	version 1.0, type PACKET_IN, length 343, xid 0x00000000
17:59:51.294467 IP 192.168.1.30.40494 > 192.168.1.10.6633: Flags [P.], seq 130159:130502, ack 1, win 298, options [nop,nop,TS val 3832675 ecr 258133], length 343: OpenFlow
	version 1.0, type PACKET_IN, length 343, xid 0x00000000
17:59:51.294499 IP 192.168.1.30.40494 > 192.168.1.10.6633: Flags [P.], seq 130502:130845, ack 1, win 298, options [nop,nop,TS val 3832675 ecr 258133], length 343: OpenFlow
	version 1.0, type PACKET_IN, length 343, xid 0x00000000
17:59:51.294532 IP 192.168.1.30.40494 > 192.168.1.10.6633: Flags [P.], seq 130845:131188, ack 1, win 298, options [nop,nop,TS val 3832675 ecr 258133], length 343: OpenFlow
	version 1.0, type PACKET_IN, length 343, xid 0x00000000
17:59:51.294539 IP 192.168.1.10.6633 > 192.168.1.30.40494: Flags [.], ack 129130, win 5386, options [nop,nop,TS val 258133 ecr 3832675], length 0
17:59:51.294566 IP 192.168.1.10.6633 > 192.168.1.30.40494: Flags [.], ack 130502, win 5386, options [nop,nop,TS val 258133 ecr 3832675], length 0
17:59:51.294568 IP 192.168.1.30.40494 > 192.168.1.10.6633: Flags [P.], seq 131188:131276, ack 1, win 298, options [nop,nop,TS val 3832675 ecr 258133], length 88: OpenFlow
	version 1.0, type PACKET_IN, length 88, xid 0x00000000
17:59:51.294605 IP 192.168.1.30.40494 > 192.168.1.10.6633: Flags [P.], seq 131276:131619, ack 1, win 298, options [nop,nop,TS val 3832675 ecr 258133], length 343: OpenFlow
	version 1.0, type PACKET_IN, length 343, xid 0x00000000
17:59:51.294646 IP 192.168.1.30.40494 > 192.168.1.10.6633: Flags [P.], seq 131619:131962, ack 1, win 298, options [nop,nop,TS val 3832675 ecr 258133], length 343: OpenFlow
	version 1.0, type PACKET_IN, length 343, xid 0x00000000
17:59:51.294685 IP 192.168.1.30.40494 > 192.168.1.10.6633: Flags [P.], seq 131962:132305, ack 1, win 298, options [nop,nop,TS val 3832675 ecr 258133], length 343: OpenFlow
	version 1.0, type PACKET_IN, length 343, xid 0x00000000
17:59:51.294724 IP 192.168.1.30.40494 > 192.168.1.10.6633: Flags [P.], seq 132305:132648, ack 1, win 298, options [nop,nop,TS val 3832675 ecr 258133], length 343: OpenFlow
	version 1.0, type PACKET_IN, length 343, xid 0x00000000
17:59:51.294763 IP 192.168.1.30.40494 > 192.168.1.10.6633: Flags [P.], seq 132648:132991, ack 1, win 298, options [nop,nop,TS val 3832675 ecr 258133], length 343: OpenFlow
	version 1.0, type PACKET_IN, length 343, xid 0x00000000
17:59:51.294802 IP 192.168.1.30.40494 > 192.168.1.10.6633: Flags [P.], seq 132991:133334, ack 1, win 298, options [nop,nop,TS val 3832675 ecr 258133], length 343: OpenFlow
	version 1.0, type PACKET_IN, length 343, xid 0x00000000
17:59:51.294841 IP 192.168.1.30.40494 > 192.168.1.10.6633: Flags [P.], seq 133334:133677, ack 1, win 298, options [nop,nop,TS val 3832675 ecr 258133], length 343: OpenFlow
	version 1.0, type PACKET_IN, length 343, xid 0x00000000
17:59:51.294878 IP 192.168.1.30.40494 > 192.168.1.10.6633: Flags [P.], seq 133677:134020, ack 1, win 298, options [nop,nop,TS val 3832675 ecr 258133], length 343: OpenFlow
	version 1.0, type PACKET_IN, length 343, xid 0x00000000
17:59:51.294916 IP 192.168.1.30.40494 > 192.168.1.10.6633: Flags [P.], seq 134020:134215, ack 1, win 298, options [nop,nop,TS val 3832675 ecr 258133], length 195: OpenFlow
	version 1.0, type PACKET_IN, length 195, xid 0x00000000
17:59:51.294936 IP 192.168.1.10.6633 > 192.168.1.30.40494: Flags [.], ack 131962, win 5386, options [nop,nop,TS val 258133 ecr 3832675], length 0
17:59:51.295124 IP 192.168.1.30.40494 > 192.168.1.10.6633: Flags [P.], seq 134215:134558, ack 1, win 298, options [nop,nop,TS val 3832675 ecr 258133], length 343: OpenFlow
	version 1.0, type PACKET_IN, length 343, xid 0x00000000
17:59:51.295175 IP 192.168.1.30.40494 > 192.168.1.10.6633: Flags [P.], seq 134558:134901, ack 1, win 298, options [nop,nop,TS val 3832675 ecr 258133], length 343: OpenFlow
	version 1.0, type PACKET_IN, length 343, xid 0x00000000
17:59:51.295213 IP 192.168.1.30.40494 > 192.168.1.10.6633: Flags [P.], seq 134901:135244, ack 1, win 298, options [nop,nop,TS val 3832675 ecr 258133], length 343: OpenFlow
	version 1.0, type PACKET_IN, length 343, xid 0x00000000
17:59:51.295260 IP 192.168.1.30.40494 > 192.168.1.10.6633: Flags [P.], seq 135244:135587, ack 1, win 298, options [nop,nop,TS val 3832675 ecr 258133], length 343: OpenFlow
	version 1.0, type PACKET_IN, length 343, xid 0x00000000
17:59:51.295282 IP 192.168.1.10.6633 > 192.168.1.30.40494: Flags [.], ack 133677, win 5386, options [nop,nop,TS val 258133 ecr 3832675], length 0
17:59:51.295303 IP 192.168.1.10.6633 > 192.168.1.30.40494: Flags [.], ack 134215, win 5386, options [nop,nop,TS val 258133 ecr 3832675], length 0
17:59:51.295304 IP 192.168.1.30.40494 > 192.168.1.10.6633: Flags [P.], seq 135587:135930, ack 1, win 298, options [nop,nop,TS val 3832675 ecr 258133], length 343: OpenFlow
	version 1.0, type PACKET_IN, length 343, xid 0x00000000
17:59:51.295368 IP 192.168.1.30.40494 > 192.168.1.10.6633: Flags [P.], seq 135930:136273, ack 1, win 298, options [nop,nop,TS val 3832675 ecr 258133], length 343: OpenFlow
	version 1.0, type PACKET_IN, length 343, xid 0x00000000
17:59:51.295408 IP 192.168.1.30.40494 > 192.168.1.10.6633: Flags [P.], seq 136273:136616, ack 1, win 298, options [nop,nop,TS val 3832675 ecr 258133], length 343: OpenFlow
	version 1.0, type PACKET_IN, length 343, xid 0x00000000
17:59:51.295447 IP 192.168.1.30.40494 > 192.168.1.10.6633: Flags [P.], seq 136616:136704, ack 1, win 298, options [nop,nop,TS val 3832675 ecr 258133], length 88: OpenFlow
	version 1.0, type PACKET_IN, length 88, xid 0x00000000
17:59:51.295485 IP 192.168.1.30.40494 > 192.168.1.10.6633: Flags [P.], seq 136704:137047, ack 1, win 298, options [nop,nop,TS val 3832675 ecr 258133], length 343: OpenFlow
	version 1.0, type PACKET_IN, length 343, xid 0x00000000
17:59:51.295524 IP 192.168.1.30.40494 > 192.168.1.10.6633: Flags [P.], seq 137047:137390, ack 1, win 298, options [nop,nop,TS val 3832675 ecr 258133], length 343: OpenFlow
	version 1.0, type PACKET_IN, length 343, xid 0x00000000
17:59:51.295534 IP 192.168.1.10.6633 > 192.168.1.30.40494: Flags [.], ack 135244, win 5386, options [nop,nop,TS val 258133 ecr 3832675], length 0
17:59:51.295562 IP 192.168.1.10.6633 > 192.168.1.30.40494: Flags [.], ack 136616, win 5386, options [nop,nop,TS val 258133 ecr 3832675], length 0
17:59:51.295563 IP 192.168.1.30.40494 > 192.168.1.10.6633: Flags [P.], seq 137390:137733, ack 1, win 298, options [nop,nop,TS val 3832675 ecr 258133], length 343: OpenFlow
	version 1.0, type PACKET_IN, length 343, xid 0x00000000
17:59:51.295605 IP 192.168.1.30.40494 > 192.168.1.10.6633: Flags [P.], seq 137733:138076, ack 1, win 298, options [nop,nop,TS val 3832675 ecr 258133], length 343: OpenFlow
	version 1.0, type PACKET_IN, length 343, xid 0x00000000
17:59:51.295644 IP 192.168.1.30.40494 > 192.168.1.10.6633: Flags [P.], seq 138076:138419, ack 1, win 298, options [nop,nop,TS val 3832675 ecr 258133], length 343: OpenFlow
	version 1.0, type PACKET_IN, length 343, xid 0x00000000
17:59:51.295681 IP 192.168.1.30.40494 > 192.168.1.10.6633: Flags [P.], seq 138419:138762, ack 1, win 298, options [nop,nop,TS val 3832675 ecr 258133], length 343: OpenFlow
	version 1.0, type PACKET_IN, length 343, xid 0x00000000
17:59:51.295718 IP 192.168.1.30.40494 > 192.168.1.10.6633: Flags [P.], seq 138762:139105, ack 1, win 298, options [nop,nop,TS val 3832675 ecr 258133], length 343: OpenFlow
	version 1.0, type PACKET_IN, length 343, xid 0x00000000
17:59:51.295723 IP 192.168.1.10.6633 > 192.168.1.30.40494: Flags [.], ack 138076, win 5386, options [nop,nop,TS val 258133 ecr 3832675], length 0
17:59:51.295760 IP 192.168.1.30.40494 > 192.168.1.10.6633: Flags [P.], seq 139105:139448, ack 1, win 298, options [nop,nop,TS val 3832675 ecr 258133], length 343: OpenFlow
	version 1.0, type PACKET_IN, length 343, xid 0x00000000
17:59:51.295770 IP 192.168.1.10.6633 > 192.168.1.30.40494: Flags [.], ack 138762, win 5386, options [nop,nop,TS val 258133 ecr 3832675], length 0
17:59:51.295798 IP 192.168.1.30.40494 > 192.168.1.10.6633: Flags [P.], seq 139448:139791, ack 1, win 298, options [nop,nop,TS val 3832675 ecr 258133], length 343: OpenFlow
	version 1.0, type PACKET_IN, length 343, xid 0x00000000
17:59:51.295836 IP 192.168.1.30.40494 > 192.168.1.10.6633: Flags [P.], seq 139791:140134, ack 1, win 298, options [nop,nop,TS val 3832675 ecr 258133], length 343: OpenFlow
	version 1.0, type PACKET_IN, length 343, xid 0x00000000
17:59:51.295873 IP 192.168.1.30.40494 > 192.168.1.10.6633: Flags [P.], seq 140134:140477, ack 1, win 298, options [nop,nop,TS val 3832675 ecr 258133], length 343: OpenFlow
	version 1.0, type PACKET_IN, length 343, xid 0x00000000
17:59:51.295913 IP 192.168.1.30.40494 > 192.168.1.10.6633: Flags [P.], seq 140477:140820, ack 1, win 298, options [nop,nop,TS val 3832675 ecr 258133], length 343: OpenFlow
	version 1.0, type PACKET_IN, length 343, xid 0x00000000
17:59:51.295951 IP 192.168.1.30.40494 > 192.168.1.10.6633: Flags [P.], seq 140820:141163, ack 1, win 298, options [nop,nop,TS val 3832675 ecr 258133], length 343: OpenFlow
	version 1.0, type PACKET_IN, length 343, xid 0x00000000
17:59:51.295989 IP 192.168.1.30.40494 > 192.168.1.10.6633: Flags [P.], seq 141163:141506, ack 1, win 298, options [nop,nop,TS val 3832675 ecr 258133], length 343: OpenFlow
	version 1.0, type PACKET_IN, length 343, xid 0x00000000
17:59:51.296000 IP 192.168.1.10.6633 > 192.168.1.30.40494: Flags [.], ack 139448, win 5386, options [nop,nop,TS val 258133 ecr 3832675], length 0
17:59:51.296028 IP 192.168.1.30.40494 > 192.168.1.10.6633: Flags [P.], seq 141506:141849, ack 1, win 298, options [nop,nop,TS val 3832675 ecr 258133], length 343: OpenFlow
	version 1.0, type PACKET_IN, length 343, xid 0x00000000
17:59:51.296065 IP 192.168.1.30.40494 > 192.168.1.10.6633: Flags [P.], seq 141849:142192, ack 1, win 298, options [nop,nop,TS val 3832675 ecr 258133], length 343: OpenFlow
	version 1.0, type PACKET_IN, length 343, xid 0x00000000
17:59:51.296102 IP 192.168.1.30.40494 > 192.168.1.10.6633: Flags [P.], seq 142192:142535, ack 1, win 298, options [nop,nop,TS val 3832675 ecr 258133], length 343: OpenFlow
	version 1.0, type PACKET_IN, length 343, xid 0x00000000
17:59:51.296140 IP 192.168.1.30.40494 > 192.168.1.10.6633: Flags [P.], seq 142535:142643, ack 1, win 298, options [nop,nop,TS val 3832675 ecr 258133], length 108: OpenFlow
	version 1.0, type PACKET_IN, length 108, xid 0x00000000
17:59:51.296177 IP 192.168.1.30.40494 > 192.168.1.10.6633: Flags [P.], seq 142643:142986, ack 1, win 298, options [nop,nop,TS val 3832675 ecr 258133], length 343: OpenFlow
	version 1.0, type PACKET_IN, length 343, xid 0x00000000
17:59:51.296184 IP 192.168.1.10.6633 > 192.168.1.30.40494: Flags [.], ack 141163, win 5386, options [nop,nop,TS val 258133 ecr 3832675], length 0
17:59:51.296216 IP 192.168.1.30.40494 > 192.168.1.10.6633: Flags [P.], seq 142986:143329, ack 1, win 298, options [nop,nop,TS val 3832675 ecr 258133], length 343: OpenFlow
	version 1.0, type PACKET_IN, length 343, xid 0x00000000
17:59:51.296235 IP 192.168.1.10.6633 > 192.168.1.30.40494: Flags [.], ack 142643, win 5386, options [nop,nop,TS val 258133 ecr 3832675], length 0
17:59:51.296259 IP 192.168.1.30.40494 > 192.168.1.10.6633: Flags [P.], seq 143329:143672, ack 1, win 298, options [nop,nop,TS val 3832675 ecr 258133], length 343: OpenFlow
	version 1.0, type PACKET_IN, length 343, xid 0x00000000
17:59:51.296298 IP 192.168.1.30.40494 > 192.168.1.10.6633: Flags [P.], seq 143672:144015, ack 1, win 298, options [nop,nop,TS val 3832675 ecr 258133], length 343: OpenFlow
	version 1.0, type PACKET_IN, length 343, xid 0x00000000
17:59:51.296338 IP 192.168.1.30.40494 > 192.168.1.10.6633: Flags [P.], seq 144015:144358, ack 1, win 298, options [nop,nop,TS val 3832675 ecr 258133], length 343: OpenFlow
	version 1.0, type PACKET_IN, length 343, xid 0x00000000
17:59:51.296386 IP 192.168.1.30.40494 > 192.168.1.10.6633: Flags [P.], seq 144358:144701, ack 1, win 298, options [nop,nop,TS val 3832675 ecr 258133], length 343: OpenFlow
	version 1.0, type PACKET_IN, length 343, xid 0x00000000
17:59:51.296431 IP 192.168.1.30.40494 > 192.168.1.10.6633: Flags [P.], seq 144701:145044, ack 1, win 298, options [nop,nop,TS val 3832675 ecr 258133], length 343: OpenFlow
	version 1.0, type PACKET_IN, length 343, xid 0x00000000
17:59:51.296471 IP 192.168.1.30.40494 > 192.168.1.10.6633: Flags [P.], seq 145044:145387, ack 1, win 298, options [nop,nop,TS val 3832675 ecr 258133], length 343: OpenFlow
	version 1.0, type PACKET_IN, length 343, xid 0x00000000
17:59:51.296510 IP 192.168.1.30.40494 > 192.168.1.10.6633: Flags [P.], seq 145387:145730, ack 1, win 298, options [nop,nop,TS val 3832675 ecr 258133], length 343: OpenFlow
	version 1.0, type PACKET_IN, length 343, xid 0x00000000
17:59:51.296553 IP 192.168.1.30.40494 > 192.168.1.10.6633: Flags [P.], seq 145730:145858, ack 1, win 298, options [nop,nop,TS val 3832675 ecr 258133], length 128: OpenFlow
	version 1.0, type PACKET_IN, length 128, xid 0x00000000
17:59:51.296579 IP 192.168.1.10.6633 > 192.168.1.30.40494: Flags [.], ack 144358, win 5386, options [nop,nop,TS val 258133 ecr 3832675], length 0
17:59:51.296596 IP 192.168.1.30.40494 > 192.168.1.10.6633: Flags [P.], seq 145858:146201, ack 1, win 298, options [nop,nop,TS val 3832675 ecr 258133], length 343: OpenFlow
	version 1.0, type PACKET_IN, length 343, xid 0x00000000
17:59:51.296638 IP 192.168.1.30.40494 > 192.168.1.10.6633: Flags [P.], seq 146201:146544, ack 1, win 298, options [nop,nop,TS val 3832675 ecr 258133], length 343: OpenFlow
	version 1.0, type PACKET_IN, length 343, xid 0x00000000
17:59:51.296677 IP 192.168.1.30.40494 > 192.168.1.10.6633: Flags [P.], seq 146544:146887, ack 1, win 298, options [nop,nop,TS val 3832675 ecr 258133], length 343: OpenFlow
	version 1.0, type PACKET_IN, length 343, xid 0x00000000
17:59:51.296690 IP 192.168.1.10.6633 > 192.168.1.30.40494: Flags [.], ack 145044, win 5386, options [nop,nop,TS val 258133 ecr 3832675], length 0
17:59:51.296717 IP 192.168.1.30.40494 > 192.168.1.10.6633: Flags [P.], seq 146887:147230, ack 1, win 298, options [nop,nop,TS val 3832675 ecr 258133], length 343: OpenFlow
	version 1.0, type PACKET_IN, length 343, xid 0x00000000
17:59:51.296755 IP 192.168.1.30.40494 > 192.168.1.10.6633: Flags [P.], seq 147230:147573, ack 1, win 298, options [nop,nop,TS val 3832675 ecr 258133], length 343: OpenFlow
	version 1.0, type PACKET_IN, length 343, xid 0x00000000
17:59:51.296793 IP 192.168.1.30.40494 > 192.168.1.10.6633: Flags [P.], seq 147573:147916, ack 1, win 298, options [nop,nop,TS val 3832675 ecr 258133], length 343: OpenFlow
	version 1.0, type PACKET_IN, length 343, xid 0x00000000
17:59:51.296836 IP 192.168.1.10.6633 > 192.168.1.30.40494: Flags [.], ack 146544, win 5386, options [nop,nop,TS val 258133 ecr 3832675], length 0
17:59:51.296938 IP 192.168.1.30.40494 > 192.168.1.10.6633: Flags [P.], seq 147916:148259, ack 1, win 298, options [nop,nop,TS val 3832675 ecr 258133], length 343: OpenFlow
	version 1.0, type PACKET_IN, length 343, xid 0x00000000
17:59:51.296981 IP 192.168.1.30.40494 > 192.168.1.10.6633: Flags [P.], seq 148259:148602, ack 1, win 298, options [nop,nop,TS val 3832675 ecr 258133], length 343: OpenFlow
	version 1.0, type PACKET_IN, length 343, xid 0x00000000
17:59:51.297019 IP 192.168.1.30.40494 > 192.168.1.10.6633: Flags [P.], seq 148602:148945, ack 1, win 298, options [nop,nop,TS val 3832675 ecr 258133], length 343: OpenFlow
	version 1.0, type PACKET_IN, length 343, xid 0x00000000
17:59:51.297067 IP 192.168.1.30.40494 > 192.168.1.10.6633: Flags [P.], seq 148945:149140, ack 1, win 298, options [nop,nop,TS val 3832675 ecr 258133], length 195: OpenFlow
	version 1.0, type PACKET_IN, length 195, xid 0x00000000
17:59:51.297082 IP 192.168.1.10.6633 > 192.168.1.30.40494: Flags [.], ack 147916, win 5386, options [nop,nop,TS val 258133 ecr 3832675], length 0
17:59:51.297108 IP 192.168.1.30.40494 > 192.168.1.10.6633: Flags [P.], seq 149140:149483, ack 1, win 298, options [nop,nop,TS val 3832675 ecr 258133], length 343: OpenFlow
	version 1.0, type PACKET_IN, length 343, xid 0x00000000
17:59:51.297160 IP 192.168.1.30.40494 > 192.168.1.10.6633: Flags [P.], seq 149483:149826, ack 1, win 298, options [nop,nop,TS val 3832675 ecr 258133], length 343: OpenFlow
	version 1.0, type PACKET_IN, length 343, xid 0x00000000
17:59:51.297201 IP 192.168.1.30.40494 > 192.168.1.10.6633: Flags [P.], seq 149826:150169, ack 1, win 298, options [nop,nop,TS val 3832675 ecr 258133], length 343: OpenFlow
	version 1.0, type PACKET_IN, length 343, xid 0x00000000
17:59:51.297241 IP 192.168.1.30.40494 > 192.168.1.10.6633: Flags [P.], seq 150169:150512, ack 1, win 298, options [nop,nop,TS val 3832675 ecr 258133], length 343: OpenFlow
	version 1.0, type PACKET_IN, length 343, xid 0x00000000
17:59:51.297297 IP 192.168.1.30.40494 > 192.168.1.10.6633: Flags [P.], seq 150512:150855, ack 1, win 298, options [nop,nop,TS val 3832675 ecr 258133], length 343: OpenFlow
	version 1.0, type PACKET_IN, length 343, xid 0x00000000
17:59:51.297336 IP 192.168.1.30.40494 > 192.168.1.10.6633: Flags [P.], seq 150855:151198, ack 1, win 298, options [nop,nop,TS val 3832675 ecr 258133], length 343: OpenFlow
	version 1.0, type PACKET_IN, length 343, xid 0x00000000
17:59:51.297342 IP 192.168.1.10.6633 > 192.168.1.30.40494: Flags [.], ack 149483, win 5386, options [nop,nop,TS val 258133 ecr 3832675], length 0
17:59:51.297377 IP 192.168.1.30.40494 > 192.168.1.10.6633: Flags [P.], seq 151198:151541, ack 1, win 298, options [nop,nop,TS val 3832675 ecr 258133], length 343: OpenFlow
	version 1.0, type PACKET_IN, length 343, xid 0x00000000
17:59:51.297423 IP 192.168.1.30.40494 > 192.168.1.10.6633: Flags [P.], seq 151541:151884, ack 1, win 298, options [nop,nop,TS val 3832675 ecr 258133], length 343: OpenFlow
	version 1.0, type PACKET_IN, length 343, xid 0x00000000
17:59:51.297462 IP 192.168.1.30.40494 > 192.168.1.10.6633: Flags [P.], seq 151884:152227, ack 1, win 298, options [nop,nop,TS val 3832675 ecr 258133], length 343: OpenFlow
	version 1.0, type PACKET_IN, length 343, xid 0x00000000
17:59:51.297512 IP 192.168.1.10.6633 > 192.168.1.30.40494: Flags [.], ack 150855, win 5386, options [nop,nop,TS val 258134 ecr 3832675], length 0
17:59:51.297515 IP 192.168.1.30.40494 > 192.168.1.10.6633: Flags [P.], seq 152227:152570, ack 1, win 298, options [nop,nop,TS val 3832676 ecr 258133], length 343: OpenFlow
	version 1.0, type PACKET_IN, length 343, xid 0x00000000
17:59:51.297552 IP 192.168.1.30.40494 > 192.168.1.10.6633: Flags [P.], seq 152570:152913, ack 1, win 298, options [nop,nop,TS val 3832676 ecr 258134], length 343: OpenFlow
	version 1.0, type PACKET_IN, length 343, xid 0x00000000
17:59:51.297583 IP 192.168.1.30.40494 > 192.168.1.10.6633: Flags [P.], seq 152913:153256, ack 1, win 298, options [nop,nop,TS val 3832676 ecr 258134], length 343: OpenFlow
	version 1.0, type PACKET_IN, length 343, xid 0x00000000
17:59:51.297618 IP 192.168.1.30.40494 > 192.168.1.10.6633: Flags [P.], seq 153256:153599, ack 1, win 298, options [nop,nop,TS val 3832676 ecr 258134], length 343: OpenFlow
	version 1.0, type PACKET_IN, length 343, xid 0x00000000
17:59:51.297639 IP 192.168.1.10.6633 > 192.168.1.30.40494: Flags [.], ack 152570, win 5386, options [nop,nop,TS val 258134 ecr 3832675], length 0
17:59:51.297654 IP 192.168.1.30.40494 > 192.168.1.10.6633: Flags [P.], seq 153599:153942, ack 1, win 298, options [nop,nop,TS val 3832676 ecr 258134], length 343: OpenFlow
	version 1.0, type PACKET_IN, length 343, xid 0x00000000
17:59:51.297685 IP 192.168.1.30.40494 > 192.168.1.10.6633: Flags [P.], seq 153942:154285, ack 1, win 298, options [nop,nop,TS val 3832676 ecr 258134], length 343: OpenFlow
	version 1.0, type PACKET_IN, length 343, xid 0x00000000
17:59:51.297716 IP 192.168.1.30.40494 > 192.168.1.10.6633: Flags [P.], seq 154285:154628, ack 1, win 298, options [nop,nop,TS val 3832676 ecr 258134], length 343: OpenFlow
	version 1.0, type PACKET_IN, length 343, xid 0x00000000
17:59:51.297747 IP 192.168.1.30.40494 > 192.168.1.10.6633: Flags [P.], seq 154628:154971, ack 1, win 298, options [nop,nop,TS val 3832676 ecr 258134], length 343: OpenFlow
	version 1.0, type PACKET_IN, length 343, xid 0x00000000
17:59:51.297787 IP 192.168.1.30.40494 > 192.168.1.10.6633: Flags [P.], seq 154971:155314, ack 1, win 298, options [nop,nop,TS val 3832676 ecr 258134], length 343: OpenFlow
	version 1.0, type PACKET_IN, length 343, xid 0x00000000
17:59:51.297816 IP 192.168.1.10.6633 > 192.168.1.30.40494: Flags [.], ack 153599, win 5386, options [nop,nop,TS val 258134 ecr 3832676], length 0
17:59:51.297822 IP 192.168.1.30.40494 > 192.168.1.10.6633: Flags [P.], seq 155314:155657, ack 1, win 298, options [nop,nop,TS val 3832676 ecr 258134], length 343: OpenFlow
	version 1.0, type PACKET_IN, length 343, xid 0x00000000
17:59:51.297856 IP 192.168.1.30.40494 > 192.168.1.10.6633: Flags [P.], seq 155657:156000, ack 1, win 298, options [nop,nop,TS val 3832676 ecr 258134], length 343: OpenFlow
	version 1.0, type PACKET_IN, length 343, xid 0x00000000
17:59:51.297892 IP 192.168.1.30.40494 > 192.168.1.10.6633: Flags [P.], seq 156000:156360, ack 1, win 298, options [nop,nop,TS val 3832676 ecr 258134], length 360: OpenFlow
	version 1.0, type PACKET_IN, length 360, xid 0x00000000
17:59:51.297923 IP 192.168.1.30.40494 > 192.168.1.10.6633: Flags [P.], seq 156360:156703, ack 1, win 298, options [nop,nop,TS val 3832676 ecr 258134], length 343: OpenFlow
	version 1.0, type PACKET_IN, length 343, xid 0x00000000
17:59:51.297953 IP 192.168.1.30.40494 > 192.168.1.10.6633: Flags [P.], seq 156703:157046, ack 1, win 298, options [nop,nop,TS val 3832676 ecr 258134], length 343: OpenFlow
	version 1.0, type PACKET_IN, length 343, xid 0x00000000
17:59:51.297989 IP 192.168.1.30.40494 > 192.168.1.10.6633: Flags [P.], seq 157046:157134, ack 1, win 298, options [nop,nop,TS val 3832676 ecr 258134], length 88: OpenFlow
	version 1.0, type PACKET_IN, length 88, xid 0x00000000
17:59:51.298019 IP 192.168.1.30.40494 > 192.168.1.10.6633: Flags [P.], seq 157134:157477, ack 1, win 298, options [nop,nop,TS val 3832676 ecr 258134], length 343: OpenFlow
	version 1.0, type PACKET_IN, length 343, xid 0x00000000
17:59:51.298023 IP 192.168.1.10.6633 > 192.168.1.30.40494: Flags [.], ack 154285, win 5386, options [nop,nop,TS val 258134 ecr 3832676], length 0
17:59:51.298050 IP 192.168.1.30.40494 > 192.168.1.10.6633: Flags [P.], seq 157477:157820, ack 1, win 298, options [nop,nop,TS val 3832676 ecr 258134], length 343: OpenFlow
	version 1.0, type PACKET_IN, length 343, xid 0x00000000
17:59:51.298080 IP 192.168.1.30.40494 > 192.168.1.10.6633: Flags [P.], seq 157820:158163, ack 1, win 298, options [nop,nop,TS val 3832676 ecr 258134], length 343: OpenFlow
	version 1.0, type PACKET_IN, length 343, xid 0x00000000
17:59:51.298109 IP 192.168.1.30.40494 > 192.168.1.10.6633: Flags [P.], seq 158163:158506, ack 1, win 298, options [nop,nop,TS val 3832676 ecr 258134], length 343: OpenFlow
	version 1.0, type PACKET_IN, length 343, xid 0x00000000
17:59:51.298145 IP 192.168.1.30.40494 > 192.168.1.10.6633: Flags [P.], seq 158506:158849, ack 1, win 298, options [nop,nop,TS val 3832676 ecr 258134], length 343: OpenFlow
	version 1.0, type PACKET_IN, length 343, xid 0x00000000
17:59:51.298177 IP 192.168.1.30.40494 > 192.168.1.10.6633: Flags [P.], seq 158849:158937, ack 1, win 298, options [nop,nop,TS val 3832676 ecr 258134], length 88: OpenFlow
	version 1.0, type PACKET_IN, length 88, xid 0x00000000
17:59:51.298246 IP 192.168.1.30.40494 > 192.168.1.10.6633: Flags [P.], seq 158937:159280, ack 1, win 298, options [nop,nop,TS val 3832676 ecr 258134], length 343: OpenFlow
	version 1.0, type PACKET_IN, length 343, xid 0x00000000
17:59:51.298284 IP 192.168.1.30.40494 > 192.168.1.10.6633: Flags [P.], seq 159280:159545, ack 1, win 298, options [nop,nop,TS val 3832676 ecr 258134], length 265: OpenFlow
	version 1.0, type PACKET_IN, length 265, xid 0x00000000
17:59:51.298320 IP 192.168.1.30.40494 > 192.168.1.10.6633: Flags [P.], seq 159545:159888, ack 1, win 298, options [nop,nop,TS val 3832676 ecr 258134], length 343: OpenFlow
	version 1.0, type PACKET_IN, length 343, xid 0x00000000
17:59:51.298351 IP 192.168.1.30.40494 > 192.168.1.10.6633: Flags [P.], seq 159888:160231, ack 1, win 298, options [nop,nop,TS val 3832676 ecr 258134], length 343: OpenFlow
	version 1.0, type PACKET_IN, length 343, xid 0x00000000
17:59:51.298402 IP 192.168.1.30.40494 > 192.168.1.10.6633: Flags [P.], seq 160231:160574, ack 1, win 298, options [nop,nop,TS val 3832676 ecr 258134], length 343: OpenFlow
	version 1.0, type PACKET_IN, length 343, xid 0x00000000
17:59:51.298437 IP 192.168.1.30.40494 > 192.168.1.10.6633: Flags [P.], seq 160574:160917, ack 1, win 298, options [nop,nop,TS val 3832676 ecr 258134], length 343: OpenFlow
	version 1.0, type PACKET_IN, length 343, xid 0x00000000
17:59:51.298467 IP 192.168.1.30.40494 > 192.168.1.10.6633: Flags [P.], seq 160917:161260, ack 1, win 298, options [nop,nop,TS val 3832676 ecr 258134], length 343: OpenFlow
	version 1.0, type PACKET_IN, length 343, xid 0x00000000
17:59:51.298497 IP 192.168.1.30.40494 > 192.168.1.10.6633: Flags [P.], seq 161260:161603, ack 1, win 298, options [nop,nop,TS val 3832676 ecr 258134], length 343: OpenFlow
	version 1.0, type PACKET_IN, length 343, xid 0x00000000
17:59:51.298534 IP 192.168.1.30.40494 > 192.168.1.10.6633: Flags [P.], seq 161603:161946, ack 1, win 298, options [nop,nop,TS val 3832676 ecr 258134], length 343: OpenFlow
	version 1.0, type PACKET_IN, length 343, xid 0x00000000
17:59:51.298565 IP 192.168.1.30.40494 > 192.168.1.10.6633: Flags [P.], seq 161946:162289, ack 1, win 298, options [nop,nop,TS val 3832676 ecr 258134], length 343: OpenFlow
	version 1.0, type PACKET_IN, length 343, xid 0x00000000
17:59:51.298602 IP 192.168.1.30.40494 > 192.168.1.10.6633: Flags [P.], seq 162289:162632, ack 1, win 298, options [nop,nop,TS val 3832676 ecr 258134], length 343: OpenFlow
	version 1.0, type PACKET_IN, length 343, xid 0x00000000
17:59:51.298634 IP 192.168.1.30.40494 > 192.168.1.10.6633: Flags [P.], seq 162632:162827, ack 1, win 298, options [nop,nop,TS val 3832676 ecr 258134], length 195: OpenFlow
	version 1.0, type PACKET_IN, length 195, xid 0x00000000
17:59:51.298640 IP 192.168.1.10.6633 > 192.168.1.30.40494: Flags [.], ack 156000, win 5386, options [nop,nop,TS val 258134 ecr 3832676], length 0
17:59:51.298664 IP 192.168.1.30.40494 > 192.168.1.10.6633: Flags [P.], seq 162827:163170, ack 1, win 298, options [nop,nop,TS val 3832676 ecr 258134], length 343: OpenFlow
	version 1.0, type PACKET_IN, length 343, xid 0x00000000
17:59:51.298700 IP 192.168.1.30.40494 > 192.168.1.10.6633: Flags [P.], seq 163170:163513, ack 1, win 298, options [nop,nop,TS val 3832676 ecr 258134], length 343: OpenFlow
	version 1.0, type PACKET_IN, length 343, xid 0x00000000
17:59:51.298732 IP 192.168.1.30.40494 > 192.168.1.10.6633: Flags [P.], seq 163513:163856, ack 1, win 298, options [nop,nop,TS val 3832676 ecr 258134], length 343: OpenFlow
	version 1.0, type PACKET_IN, length 343, xid 0x00000000
17:59:51.298764 IP 192.168.1.30.40494 > 192.168.1.10.6633: Flags [P.], seq 163856:164199, ack 1, win 298, options [nop,nop,TS val 3832676 ecr 258134], length 343: OpenFlow
	version 1.0, type PACKET_IN, length 343, xid 0x00000000
17:59:51.298800 IP 192.168.1.30.40494 > 192.168.1.10.6633: Flags [P.], seq 164199:164542, ack 1, win 298, options [nop,nop,TS val 3832676 ecr 258134], length 343: OpenFlow
	version 1.0, type PACKET_IN, length 343, xid 0x00000000
17:59:51.298830 IP 192.168.1.30.40494 > 192.168.1.10.6633: Flags [P.], seq 164542:164885, ack 1, win 298, options [nop,nop,TS val 3832676 ecr 258134], length 343: OpenFlow
	version 1.0, type PACKET_IN, length 343, xid 0x00000000
17:59:51.298845 IP 192.168.1.10.6633 > 192.168.1.30.40494: Flags [.], ack 157477, win 5386, options [nop,nop,TS val 258134 ecr 3832676], length 0
17:59:51.298866 IP 192.168.1.30.40494 > 192.168.1.10.6633: Flags [P.], seq 164885:165228, ack 1, win 298, options [nop,nop,TS val 3832676 ecr 258134], length 343: OpenFlow
	version 1.0, type PACKET_IN, length 343, xid 0x00000000
17:59:51.298875 IP 192.168.1.10.6633 > 192.168.1.30.40494: Flags [.], ack 158937, win 5386, options [nop,nop,TS val 258134 ecr 3832676], length 0
17:59:51.298888 IP 192.168.1.10.6633 > 192.168.1.30.40494: Flags [.], ack 160574, win 5386, options [nop,nop,TS val 258134 ecr 3832676], length 0
17:59:51.298897 IP 192.168.1.30.40494 > 192.168.1.10.6633: Flags [P.], seq 165228:165553, ack 1, win 298, options [nop,nop,TS val 3832676 ecr 258134], length 325: OpenFlow
	version 1.0, type PACKET_IN, length 325, xid 0x00000000
17:59:51.298935 IP 192.168.1.30.40494 > 192.168.1.10.6633: Flags [P.], seq 165553:165896, ack 1, win 298, options [nop,nop,TS val 3832676 ecr 258134], length 343: OpenFlow
	version 1.0, type PACKET_IN, length 343, xid 0x00000000
17:59:51.298967 IP 192.168.1.30.40494 > 192.168.1.10.6633: Flags [P.], seq 165896:166004, ack 1, win 298, options [nop,nop,TS val 3832676 ecr 258134], length 108: OpenFlow
	version 1.0, type PACKET_IN, length 108, xid 0x00000000
17:59:51.299002 IP 192.168.1.30.40494 > 192.168.1.10.6633: Flags [P.], seq 166004:166347, ack 1, win 298, options [nop,nop,TS val 3832676 ecr 258134], length 343: OpenFlow
	version 1.0, type PACKET_IN, length 343, xid 0x00000000
17:59:51.299036 IP 192.168.1.30.40494 > 192.168.1.10.6633: Flags [P.], seq 166347:166690, ack 1, win 298, options [nop,nop,TS val 3832676 ecr 258134], length 343: OpenFlow
	version 1.0, type PACKET_IN, length 343, xid 0x00000000
17:59:51.299069 IP 192.168.1.30.40494 > 192.168.1.10.6633: Flags [P.], seq 166690:167033, ack 1, win 298, options [nop,nop,TS val 3832676 ecr 258134], length 343: OpenFlow
	version 1.0, type PACKET_IN, length 343, xid 0x00000000
17:59:51.299104 IP 192.168.1.30.40494 > 192.168.1.10.6633: Flags [P.], seq 167033:167376, ack 1, win 298, options [nop,nop,TS val 3832676 ecr 258134], length 343: OpenFlow
	version 1.0, type PACKET_IN, length 343, xid 0x00000000
17:59:51.299142 IP 192.168.1.30.40494 > 192.168.1.10.6633: Flags [P.], seq 167376:167719, ack 1, win 298, options [nop,nop,TS val 3832676 ecr 258134], length 343: OpenFlow
	version 1.0, type PACKET_IN, length 343, xid 0x00000000
17:59:51.299187 IP 192.168.1.30.40494 > 192.168.1.10.6633: Flags [P.], seq 167719:168062, ack 1, win 298, options [nop,nop,TS val 3832676 ecr 258134], length 343: OpenFlow
	version 1.0, type PACKET_IN, length 343, xid 0x00000000
17:59:51.299217 IP 192.168.1.30.40494 > 192.168.1.10.6633: Flags [P.], seq 168062:168405, ack 1, win 298, options [nop,nop,TS val 3832676 ecr 258134], length 343: OpenFlow
	version 1.0, type PACKET_IN, length 343, xid 0x00000000
17:59:51.299252 IP 192.168.1.30.40494 > 192.168.1.10.6633: Flags [P.], seq 168405:168748, ack 1, win 298, options [nop,nop,TS val 3832676 ecr 258134], length 343: OpenFlow
	version 1.0, type PACKET_IN, length 343, xid 0x00000000
17:59:51.299286 IP 192.168.1.30.40494 > 192.168.1.10.6633: Flags [P.], seq 168748:169091, ack 1, win 298, options [nop,nop,TS val 3832676 ecr 258134], length 343: OpenFlow
	version 1.0, type PACKET_IN, length 343, xid 0x00000000
17:59:51.299315 IP 192.168.1.30.40494 > 192.168.1.10.6633: Flags [P.], seq 169091:169434, ack 1, win 298, options [nop,nop,TS val 3832676 ecr 258134], length 343: OpenFlow
	version 1.0, type PACKET_IN, length 343, xid 0x00000000
17:59:51.299350 IP 192.168.1.30.40494 > 192.168.1.10.6633: Flags [P.], seq 169434:169777, ack 1, win 298, options [nop,nop,TS val 3832676 ecr 258134], length 343: OpenFlow
	version 1.0, type PACKET_IN, length 343, xid 0x00000000
17:59:51.299379 IP 192.168.1.30.40494 > 192.168.1.10.6633: Flags [P.], seq 169777:170120, ack 1, win 298, options [nop,nop,TS val 3832676 ecr 258134], length 343: OpenFlow
	version 1.0, type PACKET_IN, length 343, xid 0x00000000
17:59:51.299412 IP 192.168.1.30.40494 > 192.168.1.10.6633: Flags [P.], seq 170120:170463, ack 1, win 298, options [nop,nop,TS val 3832676 ecr 258134], length 343: OpenFlow
	version 1.0, type PACKET_IN, length 343, xid 0x00000000
17:59:51.299441 IP 192.168.1.30.40494 > 192.168.1.10.6633: Flags [P.], seq 170463:170806, ack 1, win 298, options [nop,nop,TS val 3832676 ecr 258134], length 343: OpenFlow
	version 1.0, type PACKET_IN, length 343, xid 0x00000000
17:59:51.299470 IP 192.168.1.30.40494 > 192.168.1.10.6633: Flags [P.], seq 170806:171149, ack 1, win 298, options [nop,nop,TS val 3832676 ecr 258134], length 343: OpenFlow
	version 1.0, type PACKET_IN, length 343, xid 0x00000000
17:59:51.299485 IP 192.168.1.10.6633 > 192.168.1.30.40494: Flags [.], ack 169434, win 5317, options [nop,nop,TS val 258134 ecr 3832676], length 0
17:59:51.299500 IP 192.168.1.30.40494 > 192.168.1.10.6633: Flags [P.], seq 171149:171492, ack 1, win 298, options [nop,nop,TS val 3832676 ecr 258134], length 343: OpenFlow
	version 1.0, type PACKET_IN, length 343, xid 0x00000000
17:59:51.299542 IP 192.168.1.30.40494 > 192.168.1.10.6633: Flags [P.], seq 171492:171835, ack 1, win 298, options [nop,nop,TS val 3832676 ecr 258134], length 343: OpenFlow
	version 1.0, type PACKET_IN, length 343, xid 0x00000000
17:59:51.299573 IP 192.168.1.30.40494 > 192.168.1.10.6633: Flags [P.], seq 171835:172178, ack 1, win 298, options [nop,nop,TS val 3832676 ecr 258134], length 343: OpenFlow
	version 1.0, type PACKET_IN, length 343, xid 0x00000000
17:59:51.299603 IP 192.168.1.30.40494 > 192.168.1.10.6633: Flags [P.], seq 172178:172521, ack 1, win 298, options [nop,nop,TS val 3832676 ecr 258134], length 343: OpenFlow
	version 1.0, type PACKET_IN, length 343, xid 0x00000000
17:59:51.299641 IP 192.168.1.30.40494 > 192.168.1.10.6633: Flags [P.], seq 172521:172864, ack 1, win 298, options [nop,nop,TS val 3832676 ecr 258134], length 343: OpenFlow
	version 1.0, type PACKET_IN, length 343, xid 0x00000000
17:59:51.299664 IP 192.168.1.10.6633 > 192.168.1.30.40494: Flags [.], ack 171149, win 5335, options [nop,nop,TS val 258134 ecr 3832676], length 0
17:59:51.299683 IP 192.168.1.30.40494 > 192.168.1.10.6633: Flags [P.], seq 172864:173207, ack 1, win 298, options [nop,nop,TS val 3832676 ecr 258134], length 343: OpenFlow
	version 1.0, type PACKET_IN, length 343, xid 0x00000000
17:59:51.299695 IP 192.168.1.10.6633 > 192.168.1.30.40494: Flags [.], ack 171835, win 5386, options [nop,nop,TS val 258134 ecr 3832676], length 0
17:59:51.299714 IP 192.168.1.30.40494 > 192.168.1.10.6633: Flags [P.], seq 173207:173550, ack 1, win 298, options [nop,nop,TS val 3832676 ecr 258134], length 343: OpenFlow
	version 1.0, type PACKET_IN, length 343, xid 0x00000000
17:59:51.299745 IP 192.168.1.30.40494 > 192.168.1.10.6633: Flags [P.], seq 173550:173893, ack 1, win 298, options [nop,nop,TS val 3832676 ecr 258134], length 343: OpenFlow
	version 1.0, type PACKET_IN, length 343, xid 0x00000000
17:59:51.299777 IP 192.168.1.30.40494 > 192.168.1.10.6633: Flags [P.], seq 173893:174236, ack 1, win 298, options [nop,nop,TS val 3832676 ecr 258134], length 343: OpenFlow
	version 1.0, type PACKET_IN, length 343, xid 0x00000000
17:59:51.299818 IP 192.168.1.30.40494 > 192.168.1.10.6633: Flags [P.], seq 174236:174579, ack 1, win 298, options [nop,nop,TS val 3832676 ecr 258134], length 343: OpenFlow
	version 1.0, type PACKET_IN, length 343, xid 0x00000000
17:59:51.299857 IP 192.168.1.30.40494 > 192.168.1.10.6633: Flags [P.], seq 174579:174922, ack 1, win 298, options [nop,nop,TS val 3832676 ecr 258134], length 343: OpenFlow
	version 1.0, type PACKET_IN, length 343, xid 0x00000000
17:59:51.299893 IP 192.168.1.30.40494 > 192.168.1.10.6633: Flags [P.], seq 174922:175265, ack 1, win 298, options [nop,nop,TS val 3832676 ecr 258134], length 343: OpenFlow
	version 1.0, type PACKET_IN, length 343, xid 0x00000000
17:59:51.299930 IP 192.168.1.30.40494 > 192.168.1.10.6633: Flags [P.], seq 175265:175608, ack 1, win 298, options [nop,nop,TS val 3832676 ecr 258134], length 343: OpenFlow
	version 1.0, type PACKET_IN, length 343, xid 0x00000000
17:59:51.299967 IP 192.168.1.30.40494 > 192.168.1.10.6633: Flags [P.], seq 175608:175951, ack 1, win 298, options [nop,nop,TS val 3832676 ecr 258134], length 343: OpenFlow
	version 1.0, type PACKET_IN, length 343, xid 0x00000000
17:59:51.300003 IP 192.168.1.30.40494 > 192.168.1.10.6633: Flags [P.], seq 175951:176294, ack 1, win 298, options [nop,nop,TS val 3832676 ecr 258134], length 343: OpenFlow
	version 1.0, type PACKET_IN, length 343, xid 0x00000000
17:59:51.300040 IP 192.168.1.30.40494 > 192.168.1.10.6633: Flags [P.], seq 176294:176637, ack 1, win 298, options [nop,nop,TS val 3832676 ecr 258134], length 343: OpenFlow
	version 1.0, type PACKET_IN, length 343, xid 0x00000000
17:59:51.300076 IP 192.168.1.30.40494 > 192.168.1.10.6633: Flags [P.], seq 176637:176980, ack 1, win 298, options [nop,nop,TS val 3832676 ecr 258134], length 343: OpenFlow
	version 1.0, type PACKET_IN, length 343, xid 0x00000000
17:59:51.300109 IP 192.168.1.10.6633 > 192.168.1.30.40494: Flags [.], ack 173550, win 5386, options [nop,nop,TS val 258134 ecr 3832676], length 0
17:59:51.300112 IP 192.168.1.30.40494 > 192.168.1.10.6633: Flags [P.], seq 176980:177323, ack 1, win 298, options [nop,nop,TS val 3832676 ecr 258134], length 343: OpenFlow
	version 1.0, type PACKET_IN, length 343, xid 0x00000000
17:59:51.300121 IP 192.168.1.10.6633 > 192.168.1.30.40494: Flags [.], ack 175265, win 5386, options [nop,nop,TS val 258134 ecr 3832676], length 0
17:59:51.300154 IP 192.168.1.30.40494 > 192.168.1.10.6633: Flags [P.], seq 177323:177666, ack 1, win 298, options [nop,nop,TS val 3832676 ecr 258134], length 343: OpenFlow
	version 1.0, type PACKET_IN, length 343, xid 0x00000000
17:59:51.300200 IP 192.168.1.30.40494 > 192.168.1.10.6633: Flags [P.], seq 177666:178009, ack 1, win 298, options [nop,nop,TS val 3832676 ecr 258134], length 343: OpenFlow
	version 1.0, type PACKET_IN, length 343, xid 0x00000000
17:59:51.300207 IP 192.168.1.10.6633 > 192.168.1.30.40494: Flags [.], ack 176980, win 5386, options [nop,nop,TS val 258134 ecr 3832676], length 0
17:59:51.300240 IP 192.168.1.30.40494 > 192.168.1.10.6633: Flags [P.], seq 178009:178352, ack 1, win 298, options [nop,nop,TS val 3832676 ecr 258134], length 343: OpenFlow
	version 1.0, type PACKET_IN, length 343, xid 0x00000000
17:59:51.300272 IP 192.168.1.30.40494 > 192.168.1.10.6633: Flags [P.], seq 178352:178695, ack 1, win 298, options [nop,nop,TS val 3832676 ecr 258134], length 343: OpenFlow
	version 1.0, type PACKET_IN, length 343, xid 0x00000000
17:59:51.300301 IP 192.168.1.30.40494 > 192.168.1.10.6633: Flags [P.], seq 178695:179038, ack 1, win 298, options [nop,nop,TS val 3832676 ecr 258134], length 343: OpenFlow
	version 1.0, type PACKET_IN, length 343, xid 0x00000000
17:59:51.300340 IP 192.168.1.30.40494 > 192.168.1.10.6633: Flags [P.], seq 179038:179381, ack 1, win 298, options [nop,nop,TS val 3832676 ecr 258134], length 343: OpenFlow
	version 1.0, type PACKET_IN, length 343, xid 0x00000000
17:59:51.300378 IP 192.168.1.30.40494 > 192.168.1.10.6633: Flags [P.], seq 179381:179724, ack 1, win 298, options [nop,nop,TS val 3832676 ecr 258134], length 343: OpenFlow
	version 1.0, type PACKET_IN, length 343, xid 0x00000000
17:59:51.300408 IP 192.168.1.30.40494 > 192.168.1.10.6633: Flags [P.], seq 179724:180067, ack 1, win 298, options [nop,nop,TS val 3832676 ecr 258134], length 343: OpenFlow
	version 1.0, type PACKET_IN, length 343, xid 0x00000000
17:59:51.300449 IP 192.168.1.30.40494 > 192.168.1.10.6633: Flags [P.], seq 180067:180410, ack 1, win 298, options [nop,nop,TS val 3832676 ecr 258134], length 343: OpenFlow
	version 1.0, type PACKET_IN, length 343, xid 0x00000000
17:59:51.300500 IP 192.168.1.30.40494 > 192.168.1.10.6633: Flags [P.], seq 180410:180753, ack 1, win 298, options [nop,nop,TS val 3832676 ecr 258134], length 343: OpenFlow
	version 1.0, type PACKET_IN, length 343, xid 0x00000000
17:59:51.300539 IP 192.168.1.30.40494 > 192.168.1.10.6633: Flags [P.], seq 180753:181096, ack 1, win 298, options [nop,nop,TS val 3832676 ecr 258134], length 343: OpenFlow
	version 1.0, type PACKET_IN, length 343, xid 0x00000000
17:59:51.300549 IP 192.168.1.10.6633 > 192.168.1.30.40494: Flags [.], ack 178695, win 5386, options [nop,nop,TS val 258134 ecr 3832676], length 0
17:59:51.300577 IP 192.168.1.30.40494 > 192.168.1.10.6633: Flags [P.], seq 181096:181439, ack 1, win 298, options [nop,nop,TS val 3832676 ecr 258134], length 343: OpenFlow
	version 1.0, type PACKET_IN, length 343, xid 0x00000000
17:59:51.300618 IP 192.168.1.30.40494 > 192.168.1.10.6633: Flags [P.], seq 181439:181799, ack 1, win 298, options [nop,nop,TS val 3832676 ecr 258134], length 360: OpenFlow
	version 1.0, type PACKET_IN, length 360, xid 0x00000000
17:59:51.300656 IP 192.168.1.30.40494 > 192.168.1.10.6633: Flags [P.], seq 181799:182142, ack 1, win 298, options [nop,nop,TS val 3832676 ecr 258134], length 343: OpenFlow
	version 1.0, type PACKET_IN, length 343, xid 0x00000000
17:59:51.300705 IP 192.168.1.30.40494 > 192.168.1.10.6633: Flags [P.], seq 182142:182485, ack 1, win 298, options [nop,nop,TS val 3832676 ecr 258134], length 343: OpenFlow
	version 1.0, type PACKET_IN, length 343, xid 0x00000000
17:59:51.300725 IP 192.168.1.10.6633 > 192.168.1.30.40494: Flags [.], ack 180753, win 5386, options [nop,nop,TS val 258134 ecr 3832676], length 0
17:59:51.300745 IP 192.168.1.30.40494 > 192.168.1.10.6633: Flags [P.], seq 182485:182828, ack 1, win 298, options [nop,nop,TS val 3832676 ecr 258134], length 343: OpenFlow
	version 1.0, type PACKET_IN, length 343, xid 0x00000000
17:59:51.300783 IP 192.168.1.30.40494 > 192.168.1.10.6633: Flags [P.], seq 182828:183171, ack 1, win 298, options [nop,nop,TS val 3832676 ecr 258134], length 343: OpenFlow
	version 1.0, type PACKET_IN, length 343, xid 0x00000000
17:59:51.300818 IP 192.168.1.30.40494 > 192.168.1.10.6633: Flags [P.], seq 183171:183514, ack 1, win 298, options [nop,nop,TS val 3832676 ecr 258134], length 343: OpenFlow
	version 1.0, type PACKET_IN, length 343, xid 0x00000000
17:59:51.300824 IP 192.168.1.10.6633 > 192.168.1.30.40494: Flags [.], ack 182142, win 5386, options [nop,nop,TS val 258134 ecr 3832676], length 0
17:59:51.300849 IP 192.168.1.30.40494 > 192.168.1.10.6633: Flags [P.], seq 183514:183857, ack 1, win 298, options [nop,nop,TS val 3832676 ecr 258134], length 343: OpenFlow
	version 1.0, type PACKET_IN, length 343, xid 0x00000000
17:59:51.300879 IP 192.168.1.30.40494 > 192.168.1.10.6633: Flags [P.], seq 183857:184200, ack 1, win 298, options [nop,nop,TS val 3832676 ecr 258134], length 343: OpenFlow
	version 1.0, type PACKET_IN, length 343, xid 0x00000000
17:59:51.300917 IP 192.168.1.30.40494 > 192.168.1.10.6633: Flags [P.], seq 184200:184543, ack 1, win 298, options [nop,nop,TS val 3832676 ecr 258134], length 343: OpenFlow
	version 1.0, type PACKET_IN, length 343, xid 0x00000000
17:59:51.300949 IP 192.168.1.30.40494 > 192.168.1.10.6633: Flags [P.], seq 184543:184886, ack 1, win 298, options [nop,nop,TS val 3832676 ecr 258134], length 343: OpenFlow
	version 1.0, type PACKET_IN, length 343, xid 0x00000000
17:59:51.300955 IP 192.168.1.10.6633 > 192.168.1.30.40494: Flags [.], ack 183514, win 5386, options [nop,nop,TS val 258134 ecr 3832676], length 0
17:59:51.300979 IP 192.168.1.30.40494 > 192.168.1.10.6633: Flags [P.], seq 184886:185229, ack 1, win 298, options [nop,nop,TS val 3832676 ecr 258134], length 343: OpenFlow
	version 1.0, type PACKET_IN, length 343, xid 0x00000000
17:59:51.301018 IP 192.168.1.30.40494 > 192.168.1.10.6633: Flags [P.], seq 185229:185572, ack 1, win 298, options [nop,nop,TS val 3832676 ecr 258134], length 343: OpenFlow
	version 1.0, type PACKET_IN, length 343, xid 0x00000000
17:59:51.301053 IP 192.168.1.30.40494 > 192.168.1.10.6633: Flags [P.], seq 185572:185915, ack 1, win 298, options [nop,nop,TS val 3832676 ecr 258134], length 343: OpenFlow
	version 1.0, type PACKET_IN, length 343, xid 0x00000000
17:59:51.301112 IP 192.168.1.30.40494 > 192.168.1.10.6633: Flags [P.], seq 185915:186275, ack 1, win 298, options [nop,nop,TS val 3832676 ecr 258134], length 360: OpenFlow
	version 1.0, type PACKET_IN, length 360, xid 0x00000000
17:59:51.301153 IP 192.168.1.30.40494 > 192.168.1.10.6633: Flags [P.], seq 186275:186618, ack 1, win 298, options [nop,nop,TS val 3832676 ecr 258134], length 343: OpenFlow
	version 1.0, type PACKET_IN, length 343, xid 0x00000000
17:59:51.301191 IP 192.168.1.30.40494 > 192.168.1.10.6633: Flags [P.], seq 186618:186961, ack 1, win 298, options [nop,nop,TS val 3832676 ecr 258134], length 343: OpenFlow
	version 1.0, type PACKET_IN, length 343, xid 0x00000000
17:59:51.301228 IP 192.168.1.30.40494 > 192.168.1.10.6633: Flags [P.], seq 186961:187304, ack 1, win 298, options [nop,nop,TS val 3832676 ecr 258134], length 343: OpenFlow
	version 1.0, type PACKET_IN, length 343, xid 0x00000000
17:59:51.301347 IP 192.168.1.30.40494 > 192.168.1.10.6633: Flags [P.], seq 187304:187647, ack 1, win 298, options [nop,nop,TS val 3832676 ecr 258134], length 343: OpenFlow
	version 1.0, type PACKET_IN, length 343, xid 0x00000000
17:59:51.301388 IP 192.168.1.30.40494 > 192.168.1.10.6633: Flags [P.], seq 187647:187990, ack 1, win 298, options [nop,nop,TS val 3832676 ecr 258134], length 343: OpenFlow
	version 1.0, type PACKET_IN, length 343, xid 0x00000000
17:59:51.301420 IP 192.168.1.30.40494 > 192.168.1.10.6633: Flags [P.], seq 187990:188333, ack 1, win 298, options [nop,nop,TS val 3832676 ecr 258134], length 343: OpenFlow
	version 1.0, type PACKET_IN, length 343, xid 0x00000000
17:59:51.301452 IP 192.168.1.30.40494 > 192.168.1.10.6633: Flags [P.], seq 188333:188676, ack 1, win 298, options [nop,nop,TS val 3832676 ecr 258134], length 343: OpenFlow
	version 1.0, type PACKET_IN, length 343, xid 0x00000000
17:59:51.301453 IP 192.168.1.10.6633 > 192.168.1.30.40494: Flags [.], ack 184200, win 5386, options [nop,nop,TS val 258134 ecr 3832676], length 0
17:59:51.301486 IP 192.168.1.10.6633 > 192.168.1.30.40494: Flags [.], ack 185915, win 5386, options [nop,nop,TS val 258134 ecr 3832676], length 0
17:59:51.301505 IP 192.168.1.30.40494 > 192.168.1.10.6633: Flags [P.], seq 188676:189019, ack 1, win 298, options [nop,nop,TS val 3832677 ecr 258134], length 343: OpenFlow
	version 1.0, type PACKET_IN, length 343, xid 0x00000000
17:59:51.301545 IP 192.168.1.30.40494 > 192.168.1.10.6633: Flags [P.], seq 189019:189362, ack 1, win 298, options [nop,nop,TS val 3832677 ecr 258134], length 343: OpenFlow
	version 1.0, type PACKET_IN, length 343, xid 0x00000000
17:59:51.301636 IP 192.168.1.10.6633 > 192.168.1.30.40494: Flags [.], ack 187647, win 5386, options [nop,nop,TS val 258135 ecr 3832676], length 0
17:59:51.301817 IP 192.168.1.30.40494 > 192.168.1.10.6633: Flags [P.], seq 189362:189705, ack 1, win 298, options [nop,nop,TS val 3832677 ecr 258135], length 343: OpenFlow
	version 1.0, type PACKET_IN, length 343, xid 0x00000000
17:59:51.301850 IP 192.168.1.30.40494 > 192.168.1.10.6633: Flags [P.], seq 189705:190048, ack 1, win 298, options [nop,nop,TS val 3832677 ecr 258135], length 343: OpenFlow
	version 1.0, type PACKET_IN, length 343, xid 0x00000000
17:59:51.301850 IP 192.168.1.10.6633 > 192.168.1.30.40494: Flags [.], ack 189362, win 5386, options [nop,nop,TS val 258135 ecr 3832676], length 0
17:59:51.301881 IP 192.168.1.30.40494 > 192.168.1.10.6633: Flags [P.], seq 190048:190391, ack 1, win 298, options [nop,nop,TS val 3832677 ecr 258135], length 343: OpenFlow
	version 1.0, type PACKET_IN, length 343, xid 0x00000000
17:59:51.301912 IP 192.168.1.30.40494 > 192.168.1.10.6633: Flags [P.], seq 190391:190734, ack 1, win 298, options [nop,nop,TS val 3832677 ecr 258135], length 343: OpenFlow
	version 1.0, type PACKET_IN, length 343, xid 0x00000000
17:59:51.302015 IP 192.168.1.30.40494 > 192.168.1.10.6633: Flags [P.], seq 190734:191077, ack 1, win 298, options [nop,nop,TS val 3832677 ecr 258135], length 343: OpenFlow
	version 1.0, type PACKET_IN, length 343, xid 0x00000000
17:59:51.302038 IP 192.168.1.10.6633 > 192.168.1.30.40494: Flags [.], ack 190048, win 5386, options [nop,nop,TS val 258135 ecr 3832677], length 0
17:59:51.302056 IP 192.168.1.30.40494 > 192.168.1.10.6633: Flags [P.], seq 191077:191420, ack 1, win 298, options [nop,nop,TS val 3832677 ecr 258135], length 343: OpenFlow
	version 1.0, type PACKET_IN, length 343, xid 0x00000000
17:59:51.302134 IP 192.168.1.30.40494 > 192.168.1.10.6633: Flags [P.], seq 191420:191763, ack 1, win 298, options [nop,nop,TS val 3832677 ecr 258135], length 343: OpenFlow
	version 1.0, type PACKET_IN, length 343, xid 0x00000000
17:59:51.302167 IP 192.168.1.30.40494 > 192.168.1.10.6633: Flags [P.], seq 191763:192106, ack 1, win 298, options [nop,nop,TS val 3832677 ecr 258135], length 343: OpenFlow
	version 1.0, type PACKET_IN, length 343, xid 0x00000000
17:59:51.302192 IP 192.168.1.10.6633 > 192.168.1.30.40494: Flags [.], ack 190734, win 5386, options [nop,nop,TS val 258135 ecr 3832677], length 0
17:59:51.302217 IP 192.168.1.10.6633 > 192.168.1.30.40494: Flags [.], ack 191420, win 5386, options [nop,nop,TS val 258135 ecr 3832677], length 0
17:59:51.302773 IP 192.168.1.30.40494 > 192.168.1.10.6633: Flags [P.], seq 192106:192449, ack 1, win 298, options [nop,nop,TS val 3832677 ecr 258135], length 343: OpenFlow
	version 1.0, type PACKET_IN, length 343, xid 0x00000000
17:59:51.302815 IP 192.168.1.30.40494 > 192.168.1.10.6633: Flags [P.], seq 192449:192792, ack 1, win 298, options [nop,nop,TS val 3832677 ecr 258135], length 343: OpenFlow
	version 1.0, type PACKET_IN, length 343, xid 0x00000000
17:59:51.302905 IP 192.168.1.30.40494 > 192.168.1.10.6633: Flags [P.], seq 192792:193135, ack 1, win 298, options [nop,nop,TS val 3832677 ecr 258135], length 343: OpenFlow
	version 1.0, type PACKET_IN, length 343, xid 0x00000000
17:59:51.302917 IP 192.168.1.10.6633 > 192.168.1.30.40494: Flags [.], ack 192106, win 5386, options [nop,nop,TS val 258135 ecr 3832677], length 0
17:59:51.302950 IP 192.168.1.30.40494 > 192.168.1.10.6633: Flags [P.], seq 193135:193478, ack 1, win 298, options [nop,nop,TS val 3832677 ecr 258135], length 343: OpenFlow
	version 1.0, type PACKET_IN, length 343, xid 0x00000000
17:59:51.303026 IP 192.168.1.30.40494 > 192.168.1.10.6633: Flags [P.], seq 193478:193821, ack 1, win 298, options [nop,nop,TS val 3832677 ecr 258135], length 343: OpenFlow
	version 1.0, type PACKET_IN, length 343, xid 0x00000000
17:59:51.303058 IP 192.168.1.30.40494 > 192.168.1.10.6633: Flags [P.], seq 193821:194164, ack 1, win 298, options [nop,nop,TS val 3832677 ecr 258135], length 343: OpenFlow
	version 1.0, type PACKET_IN, length 343, xid 0x00000000
17:59:51.303132 IP 192.168.1.30.40494 > 192.168.1.10.6633: Flags [P.], seq 194164:194507, ack 1, win 298, options [nop,nop,TS val 3832677 ecr 258135], length 343: OpenFlow
	version 1.0, type PACKET_IN, length 343, xid 0x00000000
17:59:51.303164 IP 192.168.1.30.40494 > 192.168.1.10.6633: Flags [P.], seq 194507:194850, ack 1, win 298, options [nop,nop,TS val 3832677 ecr 258135], length 343: OpenFlow
	version 1.0, type PACKET_IN, length 343, xid 0x00000000
17:59:51.303236 IP 192.168.1.30.40494 > 192.168.1.10.6633: Flags [P.], seq 194850:195193, ack 1, win 298, options [nop,nop,TS val 3832677 ecr 258135], length 343: OpenFlow
	version 1.0, type PACKET_IN, length 343, xid 0x00000000
17:59:51.303307 IP 192.168.1.30.40494 > 192.168.1.10.6633: Flags [P.], seq 195193:195536, ack 1, win 298, options [nop,nop,TS val 3832677 ecr 258135], length 343: OpenFlow
	version 1.0, type PACKET_IN, length 343, xid 0x00000000
17:59:51.303342 IP 192.168.1.30.40494 > 192.168.1.10.6633: Flags [P.], seq 195536:195879, ack 1, win 298, options [nop,nop,TS val 3832677 ecr 258135], length 343: OpenFlow
	version 1.0, type PACKET_IN, length 343, xid 0x00000000
17:59:51.303416 IP 192.168.1.30.40494 > 192.168.1.10.6633: Flags [P.], seq 195879:196222, ack 1, win 298, options [nop,nop,TS val 3832677 ecr 258135], length 343: OpenFlow
	version 1.0, type PACKET_IN, length 343, xid 0x00000000
17:59:51.303439 IP 192.168.1.10.6633 > 192.168.1.30.40494: Flags [.], ack 192792, win 5386, options [nop,nop,TS val 258135 ecr 3832677], length 0
17:59:51.303481 IP 192.168.1.30.40494 > 192.168.1.10.6633: Flags [P.], seq 196222:196565, ack 1, win 298, options [nop,nop,TS val 3832677 ecr 258135], length 343: OpenFlow
	version 1.0, type PACKET_IN, length 343, xid 0x00000000
17:59:51.303524 IP 192.168.1.30.40494 > 192.168.1.10.6633: Flags [P.], seq 196565:196908, ack 1, win 298, options [nop,nop,TS val 3832677 ecr 258135], length 343: OpenFlow
	version 1.0, type PACKET_IN, length 343, xid 0x00000000
17:59:51.303608 IP 192.168.1.30.40494 > 192.168.1.10.6633: Flags [P.], seq 196908:197251, ack 1, win 298, options [nop,nop,TS val 3832677 ecr 258135], length 343: OpenFlow
	version 1.0, type PACKET_IN, length 343, xid 0x00000000
17:59:51.303638 IP 192.168.1.10.6633 > 192.168.1.30.40494: Flags [.], ack 194507, win 5386, options [nop,nop,TS val 258135 ecr 3832677], length 0
17:59:51.303654 IP 192.168.1.10.6633 > 192.168.1.30.40494: Flags [.], ack 196222, win 5386, options [nop,nop,TS val 258135 ecr 3832677], length 0
17:59:51.303678 IP 192.168.1.30.40494 > 192.168.1.10.6633: Flags [P.], seq 197251:197594, ack 1, win 298, options [nop,nop,TS val 3832677 ecr 258135], length 343: OpenFlow
	version 1.0, type PACKET_IN, length 343, xid 0x00000000
17:59:51.303717 IP 192.168.1.30.40494 > 192.168.1.10.6633: Flags [P.], seq 197594:197702, ack 1, win 298, options [nop,nop,TS val 3832677 ecr 258135], length 108: OpenFlow
	version 1.0, type PACKET_IN, length 108, xid 0x00000000
17:59:51.303800 IP 192.168.1.10.6633 > 192.168.1.30.40494: Flags [.], ack 196908, win 5386, options [nop,nop,TS val 258135 ecr 3832677], length 0
17:59:51.303806 IP 192.168.1.30.40494 > 192.168.1.10.6633: Flags [P.], seq 197702:198045, ack 1, win 298, options [nop,nop,TS val 3832677 ecr 258135], length 343: OpenFlow
	version 1.0, type PACKET_IN, length 343, xid 0x00000000
17:59:51.303886 IP 192.168.1.30.40494 > 192.168.1.10.6633: Flags [P.], seq 198045:198388, ack 1, win 298, options [nop,nop,TS val 3832677 ecr 258135], length 343: OpenFlow
	version 1.0, type PACKET_IN, length 343, xid 0x00000000
17:59:51.303920 IP 192.168.1.30.40494 > 192.168.1.10.6633: Flags [P.], seq 198388:198731, ack 1, win 298, options [nop,nop,TS val 3832677 ecr 258135], length 343: OpenFlow
	version 1.0, type PACKET_IN, length 343, xid 0x00000000
17:59:51.303990 IP 192.168.1.30.40494 > 192.168.1.10.6633: Flags [P.], seq 198731:199074, ack 1, win 298, options [nop,nop,TS val 3832677 ecr 258135], length 343: OpenFlow
	version 1.0, type PACKET_IN, length 343, xid 0x00000000
17:59:51.304026 IP 192.168.1.30.40494 > 192.168.1.10.6633: Flags [P.], seq 199074:199417, ack 1, win 298, options [nop,nop,TS val 3832677 ecr 258135], length 343: OpenFlow
	version 1.0, type PACKET_IN, length 343, xid 0x00000000
17:59:51.304041 IP 192.168.1.10.6633 > 192.168.1.30.40494: Flags [.], ack 197702, win 5386, options [nop,nop,TS val 258135 ecr 3832677], length 0
17:59:51.304057 IP 192.168.1.30.40494 > 192.168.1.10.6633: Flags [P.], seq 199417:199760, ack 1, win 298, options [nop,nop,TS val 3832677 ecr 258135], length 343: OpenFlow
	version 1.0, type PACKET_IN, length 343, xid 0x00000000
17:59:51.304137 IP 192.168.1.30.40494 > 192.168.1.10.6633: Flags [P.], seq 199760:200103, ack 1, win 298, options [nop,nop,TS val 3832677 ecr 258135], length 343: OpenFlow
	version 1.0, type PACKET_IN, length 343, xid 0x00000000
17:59:51.304164 IP 192.168.1.10.6633 > 192.168.1.30.40494: Flags [.], ack 198731, win 5386, options [nop,nop,TS val 258135 ecr 3832677], length 0
17:59:51.304178 IP 192.168.1.10.6633 > 192.168.1.30.40494: Flags [.], ack 199760, win 5386, options [nop,nop,TS val 258135 ecr 3832677], length 0
17:59:51.304201 IP 192.168.1.30.40494 > 192.168.1.10.6633: Flags [P.], seq 200103:200191, ack 1, win 298, options [nop,nop,TS val 3832677 ecr 258135], length 88: OpenFlow
	version 1.0, type PACKET_IN, length 88, xid 0x00000000
17:59:51.304232 IP 192.168.1.30.40494 > 192.168.1.10.6633: Flags [P.], seq 200191:200299, ack 1, win 298, options [nop,nop,TS val 3832677 ecr 258135], length 108: OpenFlow
	version 1.0, type PACKET_IN, length 108, xid 0x00000000
17:59:51.304300 IP 192.168.1.30.40494 > 192.168.1.10.6633: Flags [P.], seq 200299:200642, ack 1, win 298, options [nop,nop,TS val 3832677 ecr 258135], length 343: OpenFlow
	version 1.0, type PACKET_IN, length 343, xid 0x00000000
17:59:51.304335 IP 192.168.1.30.40494 > 192.168.1.10.6633: Flags [P.], seq 200642:200985, ack 1, win 298, options [nop,nop,TS val 3832677 ecr 258135], length 343: OpenFlow
	version 1.0, type PACKET_IN, length 343, xid 0x00000000
17:59:51.304402 IP 192.168.1.30.40494 > 192.168.1.10.6633: Flags [P.], seq 200985:201328, ack 1, win 298, options [nop,nop,TS val 3832677 ecr 258135], length 343: OpenFlow
	version 1.0, type PACKET_IN, length 343, xid 0x00000000
17:59:51.304432 IP 192.168.1.30.40494 > 192.168.1.10.6633: Flags [P.], seq 201328:201671, ack 1, win 298, options [nop,nop,TS val 3832677 ecr 258135], length 343: OpenFlow
	version 1.0, type PACKET_IN, length 343, xid 0x00000000
17:59:51.304505 IP 192.168.1.30.40494 > 192.168.1.10.6633: Flags [P.], seq 201671:202014, ack 1, win 298, options [nop,nop,TS val 3832677 ecr 258135], length 343: OpenFlow
	version 1.0, type PACKET_IN, length 343, xid 0x00000000

