17:49:10.794902 IP 192.168.1.30.40485 > 192.168.1.10.6633: Flags [P.], seq 1626720366:1626720726, ack 1287085361, win 58, options [nop,nop,TS val 3672550 ecr 97953], length 360: OpenFlow
	version 1.0, type PACKET_IN, length 360, xid 0x00000000
17:49:10.795146 IP 192.168.1.30.40485 > 192.168.1.10.6633: Flags [P.], seq 360:720, ack 1, win 58, options [nop,nop,TS val 3672550 ecr 97953], length 360: OpenFlow
	version 1.0, type PACKET_IN, length 360, xid 0x00000000
17:49:10.795197 IP 192.168.1.30.40485 > 192.168.1.10.6633: Flags [P.], seq 720:1080, ack 1, win 58, options [nop,nop,TS val 3672550 ecr 97953], length 360: OpenFlow
	version 1.0, type PACKET_IN, length 360, xid 0x00000000
17:49:10.795228 IP 192.168.1.30.40485 > 192.168.1.10.6633: Flags [P.], seq 1080:1440, ack 1, win 58, options [nop,nop,TS val 3672550 ecr 97953], length 360: OpenFlow
	version 1.0, type PACKET_IN, length 360, xid 0x00000000
17:49:10.795338 IP 192.168.1.10.6633 > 192.168.1.30.40485: Flags [.], ack 360, win 1827, options [nop,nop,TS val 98008 ecr 3672550], length 0
17:49:10.795347 IP 192.168.1.10.6633 > 192.168.1.30.40485: Flags [.], ack 720, win 1827, options [nop,nop,TS val 98008 ecr 3672550], length 0
17:49:10.795356 IP 192.168.1.10.6633 > 192.168.1.30.40485: Flags [.], ack 1080, win 1827, options [nop,nop,TS val 98008 ecr 3672550], length 0
17:49:10.795365 IP 192.168.1.10.6633 > 192.168.1.30.40485: Flags [.], ack 1440, win 1827, options [nop,nop,TS val 98008 ecr 3672550], length 0
17:49:10.795612 IP 192.168.1.30.40485 > 192.168.1.10.6633: Flags [P.], seq 1440:1800, ack 1, win 58, options [nop,nop,TS val 3672550 ecr 98008], length 360: OpenFlow
	version 1.0, type PACKET_IN, length 360, xid 0x00000000
17:49:10.795647 IP 192.168.1.30.40485 > 192.168.1.10.6633: Flags [P.], seq 1800:2160, ack 1, win 58, options [nop,nop,TS val 3672550 ecr 98008], length 360: OpenFlow
	version 1.0, type PACKET_IN, length 360, xid 0x00000000
17:49:10.795686 IP 192.168.1.30.40485 > 192.168.1.10.6633: Flags [P.], seq 2160:2520, ack 1, win 58, options [nop,nop,TS val 3672550 ecr 98008], length 360: OpenFlow
	version 1.0, type PACKET_IN, length 360, xid 0x00000000
17:49:10.795715 IP 192.168.1.30.40485 > 192.168.1.10.6633: Flags [P.], seq 2520:2880, ack 1, win 58, options [nop,nop,TS val 3672550 ecr 98008], length 360: OpenFlow
	version 1.0, type PACKET_IN, length 360, xid 0x00000000
17:49:10.795763 IP 192.168.1.30.40485 > 192.168.1.10.6633: Flags [P.], seq 2880:3240, ack 1, win 58, options [nop,nop,TS val 3672550 ecr 98008], length 360: OpenFlow
	version 1.0, type PACKET_IN, length 360, xid 0x00000000
17:49:10.795795 IP 192.168.1.30.40485 > 192.168.1.10.6633: Flags [P.], seq 3240:3600, ack 1, win 58, options [nop,nop,TS val 3672550 ecr 98008], length 360: OpenFlow
	version 1.0, type PACKET_IN, length 360, xid 0x00000000
17:49:10.795856 IP 192.168.1.10.6633 > 192.168.1.30.40485: Flags [.], ack 1800, win 1827, options [nop,nop,TS val 98008 ecr 3672550], length 0
17:49:10.795864 IP 192.168.1.10.6633 > 192.168.1.30.40485: Flags [.], ack 2160, win 1827, options [nop,nop,TS val 98008 ecr 3672550], length 0
17:49:10.795872 IP 192.168.1.10.6633 > 192.168.1.30.40485: Flags [.], ack 2520, win 1827, options [nop,nop,TS val 98008 ecr 3672550], length 0
17:49:10.795879 IP 192.168.1.10.6633 > 192.168.1.30.40485: Flags [.], ack 2880, win 1827, options [nop,nop,TS val 98008 ecr 3672550], length 0
17:49:10.795886 IP 192.168.1.10.6633 > 192.168.1.30.40485: Flags [.], ack 3240, win 1827, options [nop,nop,TS val 98008 ecr 3672550], length 0
17:49:10.795893 IP 192.168.1.10.6633 > 192.168.1.30.40485: Flags [.], ack 3600, win 1827, options [nop,nop,TS val 98008 ecr 3672550], length 0
17:49:10.795947 IP 192.168.1.30.40485 > 192.168.1.10.6633: Flags [P.], seq 3600:3960, ack 1, win 58, options [nop,nop,TS val 3672550 ecr 98008], length 360: OpenFlow
	version 1.0, type PACKET_IN, length 360, xid 0x00000000
17:49:10.795993 IP 192.168.1.30.40485 > 192.168.1.10.6633: Flags [P.], seq 3960:4320, ack 1, win 58, options [nop,nop,TS val 3672550 ecr 98008], length 360: OpenFlow
	version 1.0, type PACKET_IN, length 360, xid 0x00000000
17:49:10.796022 IP 192.168.1.30.40485 > 192.168.1.10.6633: Flags [P.], seq 4320:4680, ack 1, win 58, options [nop,nop,TS val 3672550 ecr 98008], length 360: OpenFlow
	version 1.0, type PACKET_IN, length 360, xid 0x00000000
17:49:10.796052 IP 192.168.1.30.40485 > 192.168.1.10.6633: Flags [P.], seq 4680:5040, ack 1, win 58, options [nop,nop,TS val 3672550 ecr 98008], length 360: OpenFlow
	version 1.0, type PACKET_IN, length 360, xid 0x00000000
17:49:10.796088 IP 192.168.1.30.40485 > 192.168.1.10.6633: Flags [P.], seq 5040:5400, ack 1, win 58, options [nop,nop,TS val 3672550 ecr 98008], length 360: OpenFlow
	version 1.0, type PACKET_IN, length 360, xid 0x00000000
17:49:10.796165 IP 192.168.1.30.40485 > 192.168.1.10.6633: Flags [P.], seq 5400:5760, ack 1, win 58, options [nop,nop,TS val 3672550 ecr 98008], length 360: OpenFlow
	version 1.0, type PACKET_IN, length 360, xid 0x00000000
17:49:10.796199 IP 192.168.1.30.40485 > 192.168.1.10.6633: Flags [P.], seq 5760:6120, ack 1, win 58, options [nop,nop,TS val 3672550 ecr 98008], length 360: OpenFlow
	version 1.0, type PACKET_IN, length 360, xid 0x00000000
17:49:10.796226 IP 192.168.1.10.6633 > 192.168.1.30.40485: Flags [.], ack 3960, win 1827, options [nop,nop,TS val 98008 ecr 3672550], length 0
17:49:10.796582 IP 192.168.1.10.6633 > 192.168.1.30.40485: Flags [.], ack 4320, win 1827, options [nop,nop,TS val 98008 ecr 3672550], length 0
17:49:10.796600 IP 192.168.1.10.6633 > 192.168.1.30.40485: Flags [.], ack 4680, win 1827, options [nop,nop,TS val 98008 ecr 3672550], length 0
17:49:10.796610 IP 192.168.1.10.6633 > 192.168.1.30.40485: Flags [.], ack 5040, win 1827, options [nop,nop,TS val 98008 ecr 3672550], length 0
17:49:10.796619 IP 192.168.1.10.6633 > 192.168.1.30.40485: Flags [.], ack 5400, win 1827, options [nop,nop,TS val 98008 ecr 3672550], length 0
17:49:10.796628 IP 192.168.1.10.6633 > 192.168.1.30.40485: Flags [.], ack 5760, win 1827, options [nop,nop,TS val 98008 ecr 3672550], length 0
17:49:10.796670 IP 192.168.1.10.6633 > 192.168.1.30.40485: Flags [.], ack 6120, win 1827, options [nop,nop,TS val 98008 ecr 3672550], length 0
17:49:10.796896 IP 192.168.1.30.40485 > 192.168.1.10.6633: Flags [P.], seq 6120:6480, ack 1, win 58, options [nop,nop,TS val 3672550 ecr 98008], length 360: OpenFlow
	version 1.0, type PACKET_IN, length 360, xid 0x00000000
17:49:10.796934 IP 192.168.1.30.40485 > 192.168.1.10.6633: Flags [P.], seq 6480:6840, ack 1, win 58, options [nop,nop,TS val 3672550 ecr 98008], length 360: OpenFlow
	version 1.0, type PACKET_IN, length 360, xid 0x00000000
17:49:10.796972 IP 192.168.1.30.40485 > 192.168.1.10.6633: Flags [P.], seq 6840:7200, ack 1, win 58, options [nop,nop,TS val 3672550 ecr 98008], length 360: OpenFlow
	version 1.0, type PACKET_IN, length 360, xid 0x00000000
17:49:10.797010 IP 192.168.1.30.40485 > 192.168.1.10.6633: Flags [P.], seq 7200:7560, ack 1, win 58, options [nop,nop,TS val 3672550 ecr 98008], length 360: OpenFlow
	version 1.0, type PACKET_IN, length 360, xid 0x00000000
17:49:10.797057 IP 192.168.1.30.40485 > 192.168.1.10.6633: Flags [P.], seq 7560:7920, ack 1, win 58, options [nop,nop,TS val 3672550 ecr 98008], length 360: OpenFlow
	version 1.0, type PACKET_IN, length 360, xid 0x00000000
17:49:10.797171 IP 192.168.1.10.6633 > 192.168.1.30.40485: Flags [.], ack 7920, win 1827, options [nop,nop,TS val 98008 ecr 3672550], length 0
17:49:10.797751 IP 192.168.1.30.40485 > 192.168.1.10.6633: Flags [P.], seq 7920:8280, ack 1, win 58, options [nop,nop,TS val 3672551 ecr 98008], length 360: OpenFlow
	version 1.0, type PACKET_IN, length 360, xid 0x00000000
17:49:10.797796 IP 192.168.1.30.40485 > 192.168.1.10.6633: Flags [P.], seq 8280:8640, ack 1, win 58, options [nop,nop,TS val 3672551 ecr 98008], length 360: OpenFlow
	version 1.0, type PACKET_IN, length 360, xid 0x00000000
17:49:10.797828 IP 192.168.1.30.40485 > 192.168.1.10.6633: Flags [P.], seq 8640:9000, ack 1, win 58, options [nop,nop,TS val 3672551 ecr 98008], length 360: OpenFlow
	version 1.0, type PACKET_IN, length 360, xid 0x00000000
17:49:10.797864 IP 192.168.1.30.40485 > 192.168.1.10.6633: Flags [P.], seq 9000:9360, ack 1, win 58, options [nop,nop,TS val 3672551 ecr 98008], length 360: OpenFlow
	version 1.0, type PACKET_IN, length 360, xid 0x00000000
17:49:10.797910 IP 192.168.1.30.40485 > 192.168.1.10.6633: Flags [P.], seq 9360:9720, ack 1, win 58, options [nop,nop,TS val 3672551 ecr 98008], length 360: OpenFlow
	version 1.0, type PACKET_IN, length 360, xid 0x00000000
17:49:10.797987 IP 192.168.1.30.40485 > 192.168.1.10.6633: Flags [P.], seq 9720:10080, ack 1, win 58, options [nop,nop,TS val 3672551 ecr 98008], length 360: OpenFlow
	version 1.0, type PACKET_IN, length 360, xid 0x00000000
17:49:10.798026 IP 192.168.1.30.40485 > 192.168.1.10.6633: Flags [P.], seq 10080:10440, ack 1, win 58, options [nop,nop,TS val 3672551 ecr 98008], length 360: OpenFlow
	version 1.0, type PACKET_IN, length 360, xid 0x00000000
17:49:10.798066 IP 192.168.1.30.40485 > 192.168.1.10.6633: Flags [P.], seq 10440:10800, ack 1, win 58, options [nop,nop,TS val 3672551 ecr 98008], length 360: OpenFlow
	version 1.0, type PACKET_IN, length 360, xid 0x00000000
17:49:10.798155 IP 192.168.1.30.40485 > 192.168.1.10.6633: Flags [P.], seq 10800:11160, ack 1, win 58, options [nop,nop,TS val 3672551 ecr 98008], length 360: OpenFlow
	version 1.0, type PACKET_IN, length 360, xid 0x00000000
17:49:10.798195 IP 192.168.1.30.40485 > 192.168.1.10.6633: Flags [P.], seq 11160:11520, ack 1, win 58, options [nop,nop,TS val 3672551 ecr 98008], length 360: OpenFlow
	version 1.0, type PACKET_IN, length 360, xid 0x00000000
17:49:10.798251 IP 192.168.1.10.6633 > 192.168.1.30.40485: Flags [.], ack 9720, win 1827, options [nop,nop,TS val 98009 ecr 3672551], length 0
17:49:10.798268 IP 192.168.1.10.6633 > 192.168.1.30.40485: Flags [.], ack 10080, win 1827, options [nop,nop,TS val 98009 ecr 3672551], length 0
17:49:10.798305 IP 192.168.1.30.40485 > 192.168.1.10.6633: Flags [P.], seq 11520:11880, ack 1, win 58, options [nop,nop,TS val 3672551 ecr 98009], length 360: OpenFlow
	version 1.0, type PACKET_IN, length 360, xid 0x00000000
17:49:10.798348 IP 192.168.1.30.40485 > 192.168.1.10.6633: Flags [P.], seq 11880:12240, ack 1, win 58, options [nop,nop,TS val 3672551 ecr 98009], length 360: OpenFlow
	version 1.0, type PACKET_IN, length 360, xid 0x00000000
17:49:10.798384 IP 192.168.1.30.40485 > 192.168.1.10.6633: Flags [P.], seq 12240:12600, ack 1, win 58, options [nop,nop,TS val 3672551 ecr 98009], length 360: OpenFlow
	version 1.0, type PACKET_IN, length 360, xid 0x00000000
17:49:10.798423 IP 192.168.1.30.40485 > 192.168.1.10.6633: Flags [P.], seq 12600:12960, ack 1, win 58, options [nop,nop,TS val 3672551 ecr 98009], length 360: OpenFlow
	version 1.0, type PACKET_IN, length 360, xid 0x00000000
17:49:10.798484 IP 192.168.1.10.6633 > 192.168.1.30.40485: Flags [.], ack 11520, win 1827, options [nop,nop,TS val 98009 ecr 3672551], length 0
17:49:10.798520 IP 192.168.1.30.40485 > 192.168.1.10.6633: Flags [P.], seq 12960:13320, ack 1, win 58, options [nop,nop,TS val 3672551 ecr 98009], length 360: OpenFlow
	version 1.0, type PACKET_IN, length 360, xid 0x00000000
17:49:10.798570 IP 192.168.1.30.40485 > 192.168.1.10.6633: Flags [P.], seq 13320:13680, ack 1, win 58, options [nop,nop,TS val 3672551 ecr 98009], length 360: OpenFlow
	version 1.0, type PACKET_IN, length 360, xid 0x00000000
17:49:10.798611 IP 192.168.1.30.40485 > 192.168.1.10.6633: Flags [P.], seq 13680:14040, ack 1, win 58, options [nop,nop,TS val 3672551 ecr 98009], length 360: OpenFlow
	version 1.0, type PACKET_IN, length 360, xid 0x00000000
17:49:10.798627 IP 192.168.1.30.40485 > 192.168.1.10.6633: Flags [P.], seq 14040:14400, ack 1, win 58, options [nop,nop,TS val 3672551 ecr 98009], length 360: OpenFlow
	version 1.0, type PACKET_IN, length 360, xid 0x00000000
17:49:10.798640 IP 192.168.1.30.40485 > 192.168.1.10.6633: Flags [P.], seq 14400:14760, ack 1, win 58, options [nop,nop,TS val 3672551 ecr 98009], length 360: OpenFlow
	version 1.0, type PACKET_IN, length 360, xid 0x00000000
17:49:10.798653 IP 192.168.1.30.40485 > 192.168.1.10.6633: Flags [P.], seq 14760:15120, ack 1, win 58, options [nop,nop,TS val 3672551 ecr 98009], length 360: OpenFlow
	version 1.0, type PACKET_IN, length 360, xid 0x00000000
17:49:10.798667 IP 192.168.1.30.40485 > 192.168.1.10.6633: Flags [P.], seq 15120:15480, ack 1, win 58, options [nop,nop,TS val 3672551 ecr 98009], length 360: OpenFlow
	version 1.0, type PACKET_IN, length 360, xid 0x00000000
17:49:10.798687 IP 192.168.1.10.6633 > 192.168.1.30.40485: Flags [.], ack 12960, win 1827, options [nop,nop,TS val 98009 ecr 3672551], length 0
17:49:10.798696 IP 192.168.1.10.6633 > 192.168.1.30.40485: Flags [.], ack 13320, win 1827, options [nop,nop,TS val 98009 ecr 3672551], length 0
17:49:10.798727 IP 192.168.1.10.6633 > 192.168.1.30.40485: Flags [.], ack 15120, win 1827, options [nop,nop,TS val 98009 ecr 3672551], length 0
17:49:10.798759 IP 192.168.1.30.40485 > 192.168.1.10.6633: Flags [P.], seq 15480:15840, ack 1, win 58, options [nop,nop,TS val 3672551 ecr 98009], length 360: OpenFlow
	version 1.0, type PACKET_IN, length 360, xid 0x00000000
17:49:10.798774 IP 192.168.1.30.40485 > 192.168.1.10.6633: Flags [P.], seq 15840:16200, ack 1, win 58, options [nop,nop,TS val 3672551 ecr 98009], length 360: OpenFlow
	version 1.0, type PACKET_IN, length 360, xid 0x00000000
17:49:10.798787 IP 192.168.1.30.40485 > 192.168.1.10.6633: Flags [P.], seq 16200:16560, ack 1, win 58, options [nop,nop,TS val 3672551 ecr 98009], length 360: OpenFlow
	version 1.0, type PACKET_IN, length 360, xid 0x00000000
17:49:10.798800 IP 192.168.1.30.40485 > 192.168.1.10.6633: Flags [P.], seq 16560:16920, ack 1, win 58, options [nop,nop,TS val 3672551 ecr 98009], length 360: OpenFlow
	version 1.0, type PACKET_IN, length 360, xid 0x00000000
17:49:10.798814 IP 192.168.1.30.40485 > 192.168.1.10.6633: Flags [P.], seq 16920:17280, ack 1, win 58, options [nop,nop,TS val 3672551 ecr 98009], length 360: OpenFlow
	version 1.0, type PACKET_IN, length 360, xid 0x00000000
17:49:10.798827 IP 192.168.1.30.40485 > 192.168.1.10.6633: Flags [P.], seq 17280:17640, ack 1, win 58, options [nop,nop,TS val 3672551 ecr 98009], length 360: OpenFlow
	version 1.0, type PACKET_IN, length 360, xid 0x00000000
17:49:10.798839 IP 192.168.1.30.40485 > 192.168.1.10.6633: Flags [P.], seq 17640:18000, ack 1, win 58, options [nop,nop,TS val 3672551 ecr 98009], length 360: OpenFlow
	version 1.0, type PACKET_IN, length 360, xid 0x00000000
17:49:10.798852 IP 192.168.1.30.40485 > 192.168.1.10.6633: Flags [P.], seq 18000:18360, ack 1, win 58, options [nop,nop,TS val 3672551 ecr 98009], length 360: OpenFlow
	version 1.0, type PACKET_IN, length 360, xid 0x00000000
17:49:10.798865 IP 192.168.1.30.40485 > 192.168.1.10.6633: Flags [P.], seq 18360:18720, ack 1, win 58, options [nop,nop,TS val 3672551 ecr 98009], length 360: OpenFlow
	version 1.0, type PACKET_IN, length 360, xid 0x00000000
17:49:10.798887 IP 192.168.1.10.6633 > 192.168.1.30.40485: Flags [.], ack 15480, win 1827, options [nop,nop,TS val 98009 ecr 3672551], length 0
17:49:10.798895 IP 192.168.1.10.6633 > 192.168.1.30.40485: Flags [.], ack 16560, win 1827, options [nop,nop,TS val 98009 ecr 3672551], length 0
17:49:10.798905 IP 192.168.1.30.40485 > 192.168.1.10.6633: Flags [P.], seq 18720:19080, ack 1, win 58, options [nop,nop,TS val 3672551 ecr 98009], length 360: OpenFlow
	version 1.0, type PACKET_IN, length 360, xid 0x00000000
17:49:10.798922 IP 192.168.1.30.40485 > 192.168.1.10.6633: Flags [P.], seq 19080:19440, ack 1, win 58, options [nop,nop,TS val 3672551 ecr 98009], length 360: OpenFlow
	version 1.0, type PACKET_IN, length 360, xid 0x00000000
17:49:10.798935 IP 192.168.1.30.40485 > 192.168.1.10.6633: Flags [P.], seq 19440:19800, ack 1, win 58, options [nop,nop,TS val 3672551 ecr 98009], length 360: OpenFlow
	version 1.0, type PACKET_IN, length 360, xid 0x00000000
17:49:10.798949 IP 192.168.1.30.40485 > 192.168.1.10.6633: Flags [P.], seq 19800:20160, ack 1, win 58, options [nop,nop,TS val 3672551 ecr 98009], length 360: OpenFlow
	version 1.0, type PACKET_IN, length 360, xid 0x00000000
17:49:10.798962 IP 192.168.1.30.40485 > 192.168.1.10.6633: Flags [P.], seq 20160:20520, ack 1, win 58, options [nop,nop,TS val 3672551 ecr 98009], length 360: OpenFlow
	version 1.0, type PACKET_IN, length 360, xid 0x00000000
17:49:10.798980 IP 192.168.1.30.40485 > 192.168.1.10.6633: Flags [P.], seq 20520:20880, ack 1, win 58, options [nop,nop,TS val 3672551 ecr 98009], length 360: OpenFlow
	version 1.0, type PACKET_IN, length 360, xid 0x00000000
17:49:10.799003 IP 192.168.1.30.40485 > 192.168.1.10.6633: Flags [P.], seq 20880:21240, ack 1, win 58, options [nop,nop,TS val 3672551 ecr 98009], length 360: OpenFlow
	version 1.0, type PACKET_IN, length 360, xid 0x00000000
17:49:10.799026 IP 192.168.1.30.40485 > 192.168.1.10.6633: Flags [P.], seq 21240:21600, ack 1, win 58, options [nop,nop,TS val 3672551 ecr 98009], length 360: OpenFlow
	version 1.0, type PACKET_IN, length 360, xid 0x00000000
17:49:10.799050 IP 192.168.1.30.40485 > 192.168.1.10.6633: Flags [P.], seq 21600:21960, ack 1, win 58, options [nop,nop,TS val 3672551 ecr 98009], length 360: OpenFlow
	version 1.0, type PACKET_IN, length 360, xid 0x00000000
17:49:10.799073 IP 192.168.1.30.40485 > 192.168.1.10.6633: Flags [P.], seq 21960:22320, ack 1, win 58, options [nop,nop,TS val 3672551 ecr 98009], length 360: OpenFlow
	version 1.0, type PACKET_IN, length 360, xid 0x00000000
17:49:10.799095 IP 192.168.1.30.40485 > 192.168.1.10.6633: Flags [P.], seq 22320:22680, ack 1, win 58, options [nop,nop,TS val 3672551 ecr 98009], length 360: OpenFlow
	version 1.0, type PACKET_IN, length 360, xid 0x00000000
17:49:10.799116 IP 192.168.1.10.6633 > 192.168.1.30.40485: Flags [.], ack 18360, win 1827, options [nop,nop,TS val 98009 ecr 3672551], length 0
17:49:10.799124 IP 192.168.1.10.6633 > 192.168.1.30.40485: Flags [.], ack 19440, win 1827, options [nop,nop,TS val 98009 ecr 3672551], length 0
17:49:10.799144 IP 192.168.1.30.40485 > 192.168.1.10.6633: Flags [P.], seq 22680:23040, ack 1, win 58, options [nop,nop,TS val 3672551 ecr 98009], length 360: OpenFlow
	version 1.0, type PACKET_IN, length 360, xid 0x00000000
17:49:10.799158 IP 192.168.1.30.40485 > 192.168.1.10.6633: Flags [P.], seq 23040:23400, ack 1, win 58, options [nop,nop,TS val 3672551 ecr 98009], length 360: OpenFlow
	version 1.0, type PACKET_IN, length 360, xid 0x00000000
17:49:10.799171 IP 192.168.1.30.40485 > 192.168.1.10.6633: Flags [P.], seq 23400:23760, ack 1, win 58, options [nop,nop,TS val 3672551 ecr 98009], length 360: OpenFlow
	version 1.0, type PACKET_IN, length 360, xid 0x00000000
17:49:10.799184 IP 192.168.1.30.40485 > 192.168.1.10.6633: Flags [P.], seq 23760:24120, ack 1, win 58, options [nop,nop,TS val 3672551 ecr 98009], length 360: OpenFlow
	version 1.0, type PACKET_IN, length 360, xid 0x00000000
17:49:10.799197 IP 192.168.1.30.40485 > 192.168.1.10.6633: Flags [P.], seq 24120:24480, ack 1, win 58, options [nop,nop,TS val 3672551 ecr 98009], length 360: OpenFlow
	version 1.0, type PACKET_IN, length 360, xid 0x00000000
17:49:10.799210 IP 192.168.1.30.40485 > 192.168.1.10.6633: Flags [P.], seq 24480:24840, ack 1, win 58, options [nop,nop,TS val 3672551 ecr 98009], length 360: OpenFlow
	version 1.0, type PACKET_IN, length 360, xid 0x00000000
17:49:10.799223 IP 192.168.1.30.40485 > 192.168.1.10.6633: Flags [P.], seq 24840:25200, ack 1, win 58, options [nop,nop,TS val 3672551 ecr 98009], length 360: OpenFlow
	version 1.0, type PACKET_IN, length 360, xid 0x00000000
17:49:10.799236 IP 192.168.1.30.40485 > 192.168.1.10.6633: Flags [P.], seq 25200:25560, ack 1, win 58, options [nop,nop,TS val 3672551 ecr 98009], length 360: OpenFlow
	version 1.0, type PACKET_IN, length 360, xid 0x00000000
17:49:10.799249 IP 192.168.1.30.40485 > 192.168.1.10.6633: Flags [P.], seq 25560:25920, ack 1, win 58, options [nop,nop,TS val 3672551 ecr 98009], length 360: OpenFlow
	version 1.0, type PACKET_IN, length 360, xid 0x00000000
17:49:10.799262 IP 192.168.1.30.40485 > 192.168.1.10.6633: Flags [P.], seq 25920:26280, ack 1, win 58, options [nop,nop,TS val 3672551 ecr 98009], length 360: OpenFlow
	version 1.0, type PACKET_IN, length 360, xid 0x00000000
17:49:10.799283 IP 192.168.1.10.6633 > 192.168.1.30.40485: Flags [.], ack 21240, win 1827, options [nop,nop,TS val 98009 ecr 3672551], length 0
17:49:10.799293 IP 192.168.1.10.6633 > 192.168.1.30.40485: Flags [.], ack 22320, win 1827, options [nop,nop,TS val 98009 ecr 3672551], length 0
17:49:10.799300 IP 192.168.1.10.6633 > 192.168.1.30.40485: Flags [.], ack 23760, win 1827, options [nop,nop,TS val 98009 ecr 3672551], length 0
17:49:10.799314 IP 192.168.1.30.40485 > 192.168.1.10.6633: Flags [P.], seq 26280:26640, ack 1, win 58, options [nop,nop,TS val 3672551 ecr 98009], length 360: OpenFlow
	version 1.0, type PACKET_IN, length 360, xid 0x00000000
17:49:10.799328 IP 192.168.1.30.40485 > 192.168.1.10.6633: Flags [P.], seq 26640:27000, ack 1, win 58, options [nop,nop,TS val 3672551 ecr 98009], length 360: OpenFlow
	version 1.0, type PACKET_IN, length 360, xid 0x00000000
17:49:10.799341 IP 192.168.1.30.40485 > 192.168.1.10.6633: Flags [P.], seq 27000:27360, ack 1, win 58, options [nop,nop,TS val 3672551 ecr 98009], length 360: OpenFlow
	version 1.0, type PACKET_IN, length 360, xid 0x00000000
17:49:10.799354 IP 192.168.1.30.40485 > 192.168.1.10.6633: Flags [P.], seq 27360:27720, ack 1, win 58, options [nop,nop,TS val 3672551 ecr 98009], length 360: OpenFlow
	version 1.0, type PACKET_IN, length 360, xid 0x00000000
17:49:10.799366 IP 192.168.1.30.40485 > 192.168.1.10.6633: Flags [P.], seq 27720:28080, ack 1, win 58, options [nop,nop,TS val 3672551 ecr 98009], length 360: OpenFlow
	version 1.0, type PACKET_IN, length 360, xid 0x00000000
17:49:10.799380 IP 192.168.1.30.40485 > 192.168.1.10.6633: Flags [P.], seq 28080:28440, ack 1, win 58, options [nop,nop,TS val 3672551 ecr 98009], length 360: OpenFlow
	version 1.0, type PACKET_IN, length 360, xid 0x00000000
17:49:10.799393 IP 192.168.1.30.40485 > 192.168.1.10.6633: Flags [P.], seq 28440:28800, ack 1, win 58, options [nop,nop,TS val 3672551 ecr 98009], length 360: OpenFlow
	version 1.0, type PACKET_IN, length 360, xid 0x00000000
17:49:10.799406 IP 192.168.1.30.40485 > 192.168.1.10.6633: Flags [P.], seq 28800:29160, ack 1, win 58, options [nop,nop,TS val 3672551 ecr 98009], length 360: OpenFlow
	version 1.0, type PACKET_IN, length 360, xid 0x00000000
17:49:10.799418 IP 192.168.1.30.40485 > 192.168.1.10.6633: Flags [P.], seq 29160:29520, ack 1, win 58, options [nop,nop,TS val 3672551 ecr 98009], length 360: OpenFlow
	version 1.0, type PACKET_IN, length 360, xid 0x00000000
17:49:10.799435 IP 192.168.1.10.6633 > 192.168.1.30.40485: Flags [.], ack 25560, win 1827, options [nop,nop,TS val 98009 ecr 3672551], length 0
17:49:10.799445 IP 192.168.1.10.6633 > 192.168.1.30.40485: Flags [.], ack 25920, win 1827, options [nop,nop,TS val 98009 ecr 3672551], length 0
17:49:10.799452 IP 192.168.1.10.6633 > 192.168.1.30.40485: Flags [.], ack 27360, win 1827, options [nop,nop,TS val 98009 ecr 3672551], length 0
17:49:10.799467 IP 192.168.1.30.40485 > 192.168.1.10.6633: Flags [P.], seq 29520:29880, ack 1, win 58, options [nop,nop,TS val 3672551 ecr 98009], length 360: OpenFlow
	version 1.0, type PACKET_IN, length 360, xid 0x00000000
17:49:10.799481 IP 192.168.1.30.40485 > 192.168.1.10.6633: Flags [P.], seq 29880:30240, ack 1, win 58, options [nop,nop,TS val 3672551 ecr 98009], length 360: OpenFlow
	version 1.0, type PACKET_IN, length 360, xid 0x00000000
17:49:10.799494 IP 192.168.1.30.40485 > 192.168.1.10.6633: Flags [P.], seq 30240:30600, ack 1, win 58, options [nop,nop,TS val 3672551 ecr 98009], length 360: OpenFlow
	version 1.0, type PACKET_IN, length 360, xid 0x00000000
17:49:10.799507 IP 192.168.1.30.40485 > 192.168.1.10.6633: Flags [P.], seq 30600:30960, ack 1, win 58, options [nop,nop,TS val 3672551 ecr 98009], length 360: OpenFlow
	version 1.0, type PACKET_IN, length 360, xid 0x00000000
17:49:10.799520 IP 192.168.1.30.40485 > 192.168.1.10.6633: Flags [P.], seq 30960:31320, ack 1, win 58, options [nop,nop,TS val 3672551 ecr 98009], length 360: OpenFlow
	version 1.0, type PACKET_IN, length 360, xid 0x00000000
17:49:10.799533 IP 192.168.1.30.40485 > 192.168.1.10.6633: Flags [P.], seq 31320:31680, ack 1, win 58, options [nop,nop,TS val 3672551 ecr 98009], length 360: OpenFlow
	version 1.0, type PACKET_IN, length 360, xid 0x00000000
17:49:10.799546 IP 192.168.1.30.40485 > 192.168.1.10.6633: Flags [P.], seq 31680:32040, ack 1, win 58, options [nop,nop,TS val 3672551 ecr 98009], length 360: OpenFlow
	version 1.0, type PACKET_IN, length 360, xid 0x00000000
17:49:10.799559 IP 192.168.1.30.40485 > 192.168.1.10.6633: Flags [P.], seq 32040:32400, ack 1, win 58, options [nop,nop,TS val 3672551 ecr 98009], length 360: OpenFlow
	version 1.0, type PACKET_IN, length 360, xid 0x00000000
17:49:10.799581 IP 192.168.1.10.6633 > 192.168.1.30.40485: Flags [.], ack 29160, win 1827, options [nop,nop,TS val 98009 ecr 3672551], length 0
17:49:10.799589 IP 192.168.1.10.6633 > 192.168.1.30.40485: Flags [.], ack 29880, win 1827, options [nop,nop,TS val 98009 ecr 3672551], length 0
17:49:10.799597 IP 192.168.1.30.40485 > 192.168.1.10.6633: Flags [P.], seq 32400:32760, ack 1, win 58, options [nop,nop,TS val 3672551 ecr 98009], length 360: OpenFlow
	version 1.0, type PACKET_IN, length 360, xid 0x00000000
17:49:10.799615 IP 192.168.1.30.40485 > 192.168.1.10.6633: Flags [P.], seq 32760:33120, ack 1, win 58, options [nop,nop,TS val 3672551 ecr 98009], length 360: OpenFlow
	version 1.0, type PACKET_IN, length 360, xid 0x00000000
17:49:10.799633 IP 192.168.1.30.40485 > 192.168.1.10.6633: Flags [P.], seq 33120:33480, ack 1, win 58, options [nop,nop,TS val 3672551 ecr 98009], length 360: OpenFlow
	version 1.0, type PACKET_IN, length 360, xid 0x00000000
17:49:10.799656 IP 192.168.1.30.40485 > 192.168.1.10.6633: Flags [P.], seq 33480:33840, ack 1, win 58, options [nop,nop,TS val 3672551 ecr 98009], length 360: OpenFlow
	version 1.0, type PACKET_IN, length 360, xid 0x00000000
17:49:10.799678 IP 192.168.1.30.40485 > 192.168.1.10.6633: Flags [P.], seq 33840:34200, ack 1, win 58, options [nop,nop,TS val 3672551 ecr 98009], length 360: OpenFlow
	version 1.0, type PACKET_IN, length 360, xid 0x00000000
17:49:10.799707 IP 192.168.1.10.6633 > 192.168.1.30.40485: Flags [.], ack 31680, win 1827, options [nop,nop,TS val 98009 ecr 3672551], length 0
17:49:10.799717 IP 192.168.1.10.6633 > 192.168.1.30.40485: Flags [.], ack 32040, win 1827, options [nop,nop,TS val 98009 ecr 3672551], length 0
17:49:10.799726 IP 192.168.1.10.6633 > 192.168.1.30.40485: Flags [.], ack 33840, win 1827, options [nop,nop,TS val 98009 ecr 3672551], length 0
17:49:10.799770 IP 192.168.1.30.40485 > 192.168.1.10.6633: Flags [P.], seq 34200:34560, ack 1, win 58, options [nop,nop,TS val 3672551 ecr 98009], length 360: OpenFlow
	version 1.0, type PACKET_IN, length 360, xid 0x00000000
17:49:10.799794 IP 192.168.1.30.40485 > 192.168.1.10.6633: Flags [P.], seq 34560:34920, ack 1, win 58, options [nop,nop,TS val 3672551 ecr 98009], length 360: OpenFlow
	version 1.0, type PACKET_IN, length 360, xid 0x00000000
17:49:10.799811 IP 192.168.1.30.40485 > 192.168.1.10.6633: Flags [P.], seq 34920:35280, ack 1, win 58, options [nop,nop,TS val 3672551 ecr 98009], length 360: OpenFlow
	version 1.0, type PACKET_IN, length 360, xid 0x00000000
17:49:10.799824 IP 192.168.1.30.40485 > 192.168.1.10.6633: Flags [P.], seq 35280:35640, ack 1, win 58, options [nop,nop,TS val 3672551 ecr 98009], length 360: OpenFlow
	version 1.0, type PACKET_IN, length 360, xid 0x00000000
17:49:10.799837 IP 192.168.1.30.40485 > 192.168.1.10.6633: Flags [P.], seq 35640:36000, ack 1, win 58, options [nop,nop,TS val 3672551 ecr 98009], length 360: OpenFlow
	version 1.0, type PACKET_IN, length 360, xid 0x00000000
17:49:10.799850 IP 192.168.1.30.40485 > 192.168.1.10.6633: Flags [P.], seq 36000:36360, ack 1, win 58, options [nop,nop,TS val 3672551 ecr 98009], length 360: OpenFlow
	version 1.0, type PACKET_IN, length 360, xid 0x00000000
17:49:10.799863 IP 192.168.1.30.40485 > 192.168.1.10.6633: Flags [P.], seq 36360:36720, ack 1, win 58, options [nop,nop,TS val 3672551 ecr 98009], length 360: OpenFlow
	version 1.0, type PACKET_IN, length 360, xid 0x00000000
17:49:10.799876 IP 192.168.1.30.40485 > 192.168.1.10.6633: Flags [P.], seq 36720:37080, ack 1, win 58, options [nop,nop,TS val 3672551 ecr 98009], length 360: OpenFlow
	version 1.0, type PACKET_IN, length 360, xid 0x00000000
17:49:10.799889 IP 192.168.1.30.40485 > 192.168.1.10.6633: Flags [P.], seq 37080:37440, ack 1, win 58, options [nop,nop,TS val 3672551 ecr 98009], length 360: OpenFlow
	version 1.0, type PACKET_IN, length 360, xid 0x00000000
17:49:10.799903 IP 192.168.1.30.40485 > 192.168.1.10.6633: Flags [P.], seq 37440:37800, ack 1, win 58, options [nop,nop,TS val 3672551 ecr 98009], length 360: OpenFlow
	version 1.0, type PACKET_IN, length 360, xid 0x00000000
17:49:10.799924 IP 192.168.1.10.6633 > 192.168.1.30.40485: Flags [.], ack 34200, win 1827, options [nop,nop,TS val 98009 ecr 3672551], length 0
17:49:10.799934 IP 192.168.1.10.6633 > 192.168.1.30.40485: Flags [.], ack 35640, win 1827, options [nop,nop,TS val 98009 ecr 3672551], length 0
17:49:10.799951 IP 192.168.1.30.40485 > 192.168.1.10.6633: Flags [P.], seq 37800:38160, ack 1, win 58, options [nop,nop,TS val 3672551 ecr 98009], length 360: OpenFlow
	version 1.0, type PACKET_IN, length 360, xid 0x00000000
17:49:10.799964 IP 192.168.1.30.40485 > 192.168.1.10.6633: Flags [P.], seq 38160:38520, ack 1, win 58, options [nop,nop,TS val 3672551 ecr 98009], length 360: OpenFlow
	version 1.0, type PACKET_IN, length 360, xid 0x00000000
17:49:10.799977 IP 192.168.1.30.40485 > 192.168.1.10.6633: Flags [P.], seq 38520:38880, ack 1, win 58, options [nop,nop,TS val 3672551 ecr 98009], length 360: OpenFlow
	version 1.0, type PACKET_IN, length 360, xid 0x00000000
17:49:10.799990 IP 192.168.1.30.40485 > 192.168.1.10.6633: Flags [P.], seq 38880:39240, ack 1, win 58, options [nop,nop,TS val 3672551 ecr 98009], length 360: OpenFlow
	version 1.0, type PACKET_IN, length 360, xid 0x00000000
17:49:10.800003 IP 192.168.1.30.40485 > 192.168.1.10.6633: Flags [P.], seq 39240:39600, ack 1, win 58, options [nop,nop,TS val 3672551 ecr 98009], length 360: OpenFlow
	version 1.0, type PACKET_IN, length 360, xid 0x00000000
17:49:10.800015 IP 192.168.1.30.40485 > 192.168.1.10.6633: Flags [P.], seq 39600:39960, ack 1, win 58, options [nop,nop,TS val 3672551 ecr 98009], length 360: OpenFlow
	version 1.0, type PACKET_IN, length 360, xid 0x00000000
17:49:10.800028 IP 192.168.1.30.40485 > 192.168.1.10.6633: Flags [P.], seq 39960:40320, ack 1, win 58, options [nop,nop,TS val 3672551 ecr 98009], length 360: OpenFlow
	version 1.0, type PACKET_IN, length 360, xid 0x00000000
17:49:10.800041 IP 192.168.1.30.40485 > 192.168.1.10.6633: Flags [P.], seq 40320:40680, ack 1, win 58, options [nop,nop,TS val 3672551 ecr 98009], length 360: OpenFlow
	version 1.0, type PACKET_IN, length 360, xid 0x00000000
17:49:10.800054 IP 192.168.1.30.40485 > 192.168.1.10.6633: Flags [P.], seq 40680:41040, ack 1, win 58, options [nop,nop,TS val 3672551 ecr 98009], length 360: OpenFlow
	version 1.0, type PACKET_IN, length 360, xid 0x00000000
17:49:10.800083 IP 192.168.1.10.6633 > 192.168.1.30.40485: Flags [.], ack 37440, win 1827, options [nop,nop,TS val 98009 ecr 3672551], length 0
17:49:10.800091 IP 192.168.1.10.6633 > 192.168.1.30.40485: Flags [.], ack 38160, win 1827, options [nop,nop,TS val 98009 ecr 3672551], length 0
17:49:10.800100 IP 192.168.1.30.40485 > 192.168.1.10.6633: Flags [P.], seq 41040:41400, ack 1, win 58, options [nop,nop,TS val 3672551 ecr 98009], length 360: OpenFlow
	version 1.0, type PACKET_IN, length 360, xid 0x00000000
17:49:10.800118 IP 192.168.1.30.40485 > 192.168.1.10.6633: Flags [P.], seq 41400:41760, ack 1, win 58, options [nop,nop,TS val 3672551 ecr 98009], length 360: OpenFlow
	version 1.0, type PACKET_IN, length 360, xid 0x00000000
17:49:10.800134 IP 192.168.1.30.40485 > 192.168.1.10.6633: Flags [P.], seq 41760:42120, ack 1, win 58, options [nop,nop,TS val 3672551 ecr 98009], length 360: OpenFlow
	version 1.0, type PACKET_IN, length 360, xid 0x00000000
17:49:10.800157 IP 192.168.1.30.40485 > 192.168.1.10.6633: Flags [P.], seq 42120:42480, ack 1, win 58, options [nop,nop,TS val 3672551 ecr 98009], length 360: OpenFlow
	version 1.0, type PACKET_IN, length 360, xid 0x00000000
17:49:10.800179 IP 192.168.1.30.40485 > 192.168.1.10.6633: Flags [P.], seq 42480:42840, ack 1, win 58, options [nop,nop,TS val 3672551 ecr 98009], length 360: OpenFlow
	version 1.0, type PACKET_IN, length 360, xid 0x00000000
17:49:10.800202 IP 192.168.1.30.40485 > 192.168.1.10.6633: Flags [P.], seq 42840:43200, ack 1, win 58, options [nop,nop,TS val 3672551 ecr 98009], length 360: OpenFlow
	version 1.0, type PACKET_IN, length 360, xid 0x00000000
17:49:10.800223 IP 192.168.1.30.40485 > 192.168.1.10.6633: Flags [P.], seq 43200:43560, ack 1, win 58, options [nop,nop,TS val 3672551 ecr 98009], length 360: OpenFlow
	version 1.0, type PACKET_IN, length 360, xid 0x00000000
17:49:10.800237 IP 192.168.1.30.40485 > 192.168.1.10.6633: Flags [P.], seq 43560:43920, ack 1, win 58, options [nop,nop,TS val 3672551 ecr 98009], length 360: OpenFlow
	version 1.0, type PACKET_IN, length 360, xid 0x00000000
17:49:10.800256 IP 192.168.1.10.6633 > 192.168.1.30.40485: Flags [.], ack 39960, win 1827, options [nop,nop,TS val 98009 ecr 3672551], length 0
17:49:10.800265 IP 192.168.1.10.6633 > 192.168.1.30.40485: Flags [.], ack 41040, win 1827, options [nop,nop,TS val 98009 ecr 3672551], length 0
17:49:10.800270 IP 192.168.1.10.6633 > 192.168.1.30.40485: Flags [.], ack 42120, win 1827, options [nop,nop,TS val 98009 ecr 3672551], length 0
17:49:10.800291 IP 192.168.1.30.40485 > 192.168.1.10.6633: Flags [P.], seq 43920:44280, ack 1, win 58, options [nop,nop,TS val 3672551 ecr 98009], length 360: OpenFlow
	version 1.0, type PACKET_IN, length 360, xid 0x00000000
17:49:10.800305 IP 192.168.1.30.40485 > 192.168.1.10.6633: Flags [P.], seq 44280:44640, ack 1, win 58, options [nop,nop,TS val 3672551 ecr 98009], length 360: OpenFlow
	version 1.0, type PACKET_IN, length 360, xid 0x00000000
17:49:10.800318 IP 192.168.1.30.40485 > 192.168.1.10.6633: Flags [P.], seq 44640:45000, ack 1, win 58, options [nop,nop,TS val 3672551 ecr 98009], length 360: OpenFlow
	version 1.0, type PACKET_IN, length 360, xid 0x00000000
17:49:10.800331 IP 192.168.1.30.40485 > 192.168.1.10.6633: Flags [P.], seq 45000:45360, ack 1, win 58, options [nop,nop,TS val 3672551 ecr 98009], length 360: OpenFlow
	version 1.0, type PACKET_IN, length 360, xid 0x00000000
17:49:10.800344 IP 192.168.1.30.40485 > 192.168.1.10.6633: Flags [P.], seq 45360:45720, ack 1, win 58, options [nop,nop,TS val 3672551 ecr 98009], length 360: OpenFlow
	version 1.0, type PACKET_IN, length 360, xid 0x00000000
17:49:10.800358 IP 192.168.1.30.40485 > 192.168.1.10.6633: Flags [P.], seq 45720:46080, ack 1, win 58, options [nop,nop,TS val 3672551 ecr 98009], length 360: OpenFlow
	version 1.0, type PACKET_IN, length 360, xid 0x00000000
17:49:10.800370 IP 192.168.1.30.40485 > 192.168.1.10.6633: Flags [P.], seq 46080:46440, ack 1, win 58, options [nop,nop,TS val 3672551 ecr 98009], length 360: OpenFlow
	version 1.0, type PACKET_IN, length 360, xid 0x00000000
17:49:10.800384 IP 192.168.1.30.40485 > 192.168.1.10.6633: Flags [P.], seq 46440:46800, ack 1, win 58, options [nop,nop,TS val 3672551 ecr 98009], length 360: OpenFlow
	version 1.0, type PACKET_IN, length 360, xid 0x00000000
17:49:10.800403 IP 192.168.1.30.40485 > 192.168.1.10.6633: Flags [P.], seq 46800:47160, ack 1, win 58, options [nop,nop,TS val 3672551 ecr 98009], length 360: OpenFlow
	version 1.0, type PACKET_IN, length 360, xid 0x00000000
17:49:10.800414 IP 192.168.1.10.6633 > 192.168.1.30.40485: Flags [.], ack 43560, win 1827, options [nop,nop,TS val 98009 ecr 3672551], length 0
17:49:10.800421 IP 192.168.1.10.6633 > 192.168.1.30.40485: Flags [.], ack 44640, win 1827, options [nop,nop,TS val 98009 ecr 3672551], length 0
17:49:10.800439 IP 192.168.1.30.40485 > 192.168.1.10.6633: Flags [P.], seq 47160:47520, ack 1, win 58, options [nop,nop,TS val 3672551 ecr 98009], length 360: OpenFlow
	version 1.0, type PACKET_IN, length 360, xid 0x00000000
17:49:10.800453 IP 192.168.1.30.40485 > 192.168.1.10.6633: Flags [P.], seq 47520:47880, ack 1, win 58, options [nop,nop,TS val 3672551 ecr 98009], length 360: OpenFlow
	version 1.0, type PACKET_IN, length 360, xid 0x00000000
17:49:10.800466 IP 192.168.1.30.40485 > 192.168.1.10.6633: Flags [P.], seq 47880:48240, ack 1, win 58, options [nop,nop,TS val 3672551 ecr 98009], length 360: OpenFlow
	version 1.0, type PACKET_IN, length 360, xid 0x00000000
17:49:10.800487 IP 192.168.1.30.40485 > 192.168.1.10.6633: Flags [P.], seq 48240:48600, ack 1, win 58, options [nop,nop,TS val 3672551 ecr 98009], length 360: OpenFlow
	version 1.0, type PACKET_IN, length 360, xid 0x00000000
17:49:10.800511 IP 192.168.1.30.40485 > 192.168.1.10.6633: Flags [P.], seq 48600:48960, ack 1, win 58, options [nop,nop,TS val 3672551 ecr 98009], length 360: OpenFlow
	version 1.0, type PACKET_IN, length 360, xid 0x00000000
17:49:10.800532 IP 192.168.1.30.40485 > 192.168.1.10.6633: Flags [P.], seq 48960:49320, ack 1, win 58, options [nop,nop,TS val 3672551 ecr 98009], length 360: OpenFlow
	version 1.0, type PACKET_IN, length 360, xid 0x00000000
17:49:10.800559 IP 192.168.1.10.6633 > 192.168.1.30.40485: Flags [.], ack 46440, win 1827, options [nop,nop,TS val 98009 ecr 3672551], length 0
17:49:10.800570 IP 192.168.1.10.6633 > 192.168.1.30.40485: Flags [.], ack 47520, win 1827, options [nop,nop,TS val 98009 ecr 3672551], length 0
17:49:10.800599 IP 192.168.1.30.40485 > 192.168.1.10.6633: Flags [P.], seq 49320:49680, ack 1, win 58, options [nop,nop,TS val 3672551 ecr 98009], length 360: OpenFlow
	version 1.0, type PACKET_IN, length 360, xid 0x00000000
17:49:10.800621 IP 192.168.1.30.40485 > 192.168.1.10.6633: Flags [P.], seq 49680:50040, ack 1, win 58, options [nop,nop,TS val 3672551 ecr 98009], length 360: OpenFlow
	version 1.0, type PACKET_IN, length 360, xid 0x00000000
17:49:10.800644 IP 192.168.1.30.40485 > 192.168.1.10.6633: Flags [P.], seq 50040:50400, ack 1, win 58, options [nop,nop,TS val 3672551 ecr 98009], length 360: OpenFlow
	version 1.0, type PACKET_IN, length 360, xid 0x00000000
17:49:10.800667 IP 192.168.1.30.40485 > 192.168.1.10.6633: Flags [P.], seq 50400:50760, ack 1, win 58, options [nop,nop,TS val 3672551 ecr 98009], length 360: OpenFlow
	version 1.0, type PACKET_IN, length 360, xid 0x00000000
17:49:10.800691 IP 192.168.1.30.40485 > 192.168.1.10.6633: Flags [P.], seq 50760:51120, ack 1, win 58, options [nop,nop,TS val 3672551 ecr 98009], length 360: OpenFlow
	version 1.0, type PACKET_IN, length 360, xid 0x00000000
17:49:10.800719 IP 192.168.1.10.6633 > 192.168.1.30.40485: Flags [.], ack 48960, win 1827, options [nop,nop,TS val 98009 ecr 3672551], length 0
17:49:10.800758 IP 192.168.1.10.6633 > 192.168.1.30.40485: Flags [.], ack 49320, win 1827, options [nop,nop,TS val 98009 ecr 3672551], length 0
17:49:10.800985 IP 192.168.1.10.6633 > 192.168.1.30.40485: Flags [.], ack 50760, win 1827, options [nop,nop,TS val 98009 ecr 3672551], length 0
17:49:10.801157 IP 192.168.1.10.6633 > 192.168.1.30.40485: Flags [.], ack 51120, win 1827, options [nop,nop,TS val 98009 ecr 3672551], length 0
17:49:10.801350 IP 192.168.1.30.40485 > 192.168.1.10.6633: Flags [P.], seq 51120:51480, ack 1, win 58, options [nop,nop,TS val 3672551 ecr 98009], length 360: OpenFlow
	version 1.0, type PACKET_IN, length 360, xid 0x00000000
