17:49:10.816313 IP 192.168.1.30.40481 > 192.168.1.10.6633: Flags [P.], seq 1598239897:1598240257, ack 1735797588, win 58, options [nop,nop,TS val 3672555 ecr 97953], length 360: OpenFlow
	version 1.0, type PACKET_IN, length 360, xid 0x00000000
17:49:10.816355 IP 192.168.1.30.40481 > 192.168.1.10.6633: Flags [P.], seq 360:720, ack 1, win 58, options [nop,nop,TS val 3672555 ecr 97953], length 360: OpenFlow
	version 1.0, type PACKET_IN, length 360, xid 0x00000000
17:49:10.816386 IP 192.168.1.30.40481 > 192.168.1.10.6633: Flags [P.], seq 720:1080, ack 1, win 58, options [nop,nop,TS val 3672555 ecr 97953], length 360: OpenFlow
	version 1.0, type PACKET_IN, length 360, xid 0x00000000
17:49:10.816416 IP 192.168.1.30.40481 > 192.168.1.10.6633: Flags [P.], seq 1080:1440, ack 1, win 58, options [nop,nop,TS val 3672555 ecr 97953], length 360: OpenFlow
	version 1.0, type PACKET_IN, length 360, xid 0x00000000
17:49:10.816448 IP 192.168.1.30.40481 > 192.168.1.10.6633: Flags [P.], seq 1440:1800, ack 1, win 58, options [nop,nop,TS val 3672555 ecr 97953], length 360: OpenFlow
	version 1.0, type PACKET_IN, length 360, xid 0x00000000
17:49:10.816480 IP 192.168.1.30.40481 > 192.168.1.10.6633: Flags [P.], seq 1800:2160, ack 1, win 58, options [nop,nop,TS val 3672555 ecr 97953], length 360: OpenFlow
	version 1.0, type PACKET_IN, length 360, xid 0x00000000
17:49:10.816514 IP 192.168.1.30.40481 > 192.168.1.10.6633: Flags [P.], seq 2160:2520, ack 1, win 58, options [nop,nop,TS val 3672555 ecr 97953], length 360: OpenFlow
	version 1.0, type PACKET_IN, length 360, xid 0x00000000
17:49:10.816544 IP 192.168.1.30.40481 > 192.168.1.10.6633: Flags [P.], seq 2520:2880, ack 1, win 58, options [nop,nop,TS val 3672555 ecr 97953], length 360: OpenFlow
	version 1.0, type PACKET_IN, length 360, xid 0x00000000
17:49:10.816576 IP 192.168.1.30.40481 > 192.168.1.10.6633: Flags [P.], seq 2880:3240, ack 1, win 58, options [nop,nop,TS val 3672555 ecr 97953], length 360: OpenFlow
	version 1.0, type PACKET_IN, length 360, xid 0x00000000
17:49:10.816609 IP 192.168.1.30.40481 > 192.168.1.10.6633: Flags [P.], seq 3240:3600, ack 1, win 58, options [nop,nop,TS val 3672555 ecr 97953], length 360: OpenFlow
	version 1.0, type PACKET_IN, length 360, xid 0x00000000
17:49:10.816639 IP 192.168.1.30.40481 > 192.168.1.10.6633: Flags [P.], seq 3600:3960, ack 1, win 58, options [nop,nop,TS val 3672555 ecr 97953], length 360: OpenFlow
	version 1.0, type PACKET_IN, length 360, xid 0x00000000
17:49:10.816671 IP 192.168.1.30.40481 > 192.168.1.10.6633: Flags [P.], seq 3960:4320, ack 1, win 58, options [nop,nop,TS val 3672555 ecr 97953], length 360: OpenFlow
	version 1.0, type PACKET_IN, length 360, xid 0x00000000
17:49:10.816863 IP 192.168.1.10.6633 > 192.168.1.30.40481: Flags [.], ack 360, win 2263, options [nop,nop,TS val 98013 ecr 3672555], length 0
17:49:10.816880 IP 192.168.1.10.6633 > 192.168.1.30.40481: Flags [.], ack 720, win 2263, options [nop,nop,TS val 98013 ecr 3672555], length 0
17:49:10.816889 IP 192.168.1.10.6633 > 192.168.1.30.40481: Flags [.], ack 1080, win 2263, options [nop,nop,TS val 98013 ecr 3672555], length 0
17:49:10.816898 IP 192.168.1.10.6633 > 192.168.1.30.40481: Flags [.], ack 1440, win 2263, options [nop,nop,TS val 98013 ecr 3672555], length 0
17:49:10.816960 IP 192.168.1.10.6633 > 192.168.1.30.40481: Flags [.], ack 1800, win 2263, options [nop,nop,TS val 98013 ecr 3672555], length 0
17:49:10.816969 IP 192.168.1.10.6633 > 192.168.1.30.40481: Flags [.], ack 2160, win 2263, options [nop,nop,TS val 98013 ecr 3672555], length 0
17:49:10.816977 IP 192.168.1.10.6633 > 192.168.1.30.40481: Flags [.], ack 2520, win 2286, options [nop,nop,TS val 98013 ecr 3672555], length 0
17:49:10.816994 IP 192.168.1.10.6633 > 192.168.1.30.40481: Flags [.], ack 2880, win 2308, options [nop,nop,TS val 98013 ecr 3672555], length 0
17:49:10.817003 IP 192.168.1.10.6633 > 192.168.1.30.40481: Flags [.], ack 3240, win 2331, options [nop,nop,TS val 98013 ecr 3672555], length 0
17:49:10.817085 IP 192.168.1.30.40481 > 192.168.1.10.6633: Flags [P.], seq 4320:4680, ack 1, win 58, options [nop,nop,TS val 3672555 ecr 98013], length 360: OpenFlow
	version 1.0, type PACKET_IN, length 360, xid 0x00000000
17:49:10.817122 IP 192.168.1.30.40481 > 192.168.1.10.6633: Flags [P.], seq 4680:5040, ack 1, win 58, options [nop,nop,TS val 3672555 ecr 98013], length 360: OpenFlow
	version 1.0, type PACKET_IN, length 360, xid 0x00000000
17:49:10.817158 IP 192.168.1.30.40481 > 192.168.1.10.6633: Flags [P.], seq 5040:5400, ack 1, win 58, options [nop,nop,TS val 3672555 ecr 98013], length 360: OpenFlow
	version 1.0, type PACKET_IN, length 360, xid 0x00000000
17:49:10.817188 IP 192.168.1.30.40481 > 192.168.1.10.6633: Flags [P.], seq 5400:5760, ack 1, win 58, options [nop,nop,TS val 3672555 ecr 98013], length 360: OpenFlow
	version 1.0, type PACKET_IN, length 360, xid 0x00000000
17:49:10.817241 IP 192.168.1.30.40481 > 192.168.1.10.6633: Flags [P.], seq 5760:6120, ack 1, win 58, options [nop,nop,TS val 3672555 ecr 98013], length 360: OpenFlow
	version 1.0, type PACKET_IN, length 360, xid 0x00000000
17:49:10.817271 IP 192.168.1.30.40481 > 192.168.1.10.6633: Flags [P.], seq 6120:6480, ack 1, win 58, options [nop,nop,TS val 3672555 ecr 98013], length 360: OpenFlow
	version 1.0, type PACKET_IN, length 360, xid 0x00000000
17:49:10.817392 IP 192.168.1.30.40481 > 192.168.1.10.6633: Flags [P.], seq 6480:6840, ack 1, win 58, options [nop,nop,TS val 3672555 ecr 98013], length 360: OpenFlow
	version 1.0, type PACKET_IN, length 360, xid 0x00000000
17:49:10.817423 IP 192.168.1.30.40481 > 192.168.1.10.6633: Flags [P.], seq 6840:7200, ack 1, win 58, options [nop,nop,TS val 3672555 ecr 98013], length 360: OpenFlow
	version 1.0, type PACKET_IN, length 360, xid 0x00000000
17:49:10.817452 IP 192.168.1.30.40481 > 192.168.1.10.6633: Flags [P.], seq 7200:7560, ack 1, win 58, options [nop,nop,TS val 3672555 ecr 98013], length 360: OpenFlow
	version 1.0, type PACKET_IN, length 360, xid 0x00000000
17:49:10.817500 IP 192.168.1.30.40481 > 192.168.1.10.6633: Flags [P.], seq 7560:7920, ack 1, win 58, options [nop,nop,TS val 3672556 ecr 98013], length 360: OpenFlow
	version 1.0, type PACKET_IN, length 360, xid 0x00000000
17:49:10.817542 IP 192.168.1.30.40481 > 192.168.1.10.6633: Flags [P.], seq 7920:8280, ack 1, win 58, options [nop,nop,TS val 3672556 ecr 98013], length 360: OpenFlow
	version 1.0, type PACKET_IN, length 360, xid 0x00000000
17:49:10.817576 IP 192.168.1.30.40481 > 192.168.1.10.6633: Flags [P.], seq 8280:8640, ack 1, win 58, options [nop,nop,TS val 3672556 ecr 98013], length 360: OpenFlow
	version 1.0, type PACKET_IN, length 360, xid 0x00000000
17:49:10.817615 IP 192.168.1.30.40481 > 192.168.1.10.6633: Flags [P.], seq 8640:9000, ack 1, win 58, options [nop,nop,TS val 3672556 ecr 98013], length 360: OpenFlow
	version 1.0, type PACKET_IN, length 360, xid 0x00000000
17:49:10.817646 IP 192.168.1.10.6633 > 192.168.1.30.40481: Flags [.], ack 3600, win 2354, options [nop,nop,TS val 98014 ecr 3672555], length 0
17:49:10.817661 IP 192.168.1.10.6633 > 192.168.1.30.40481: Flags [.], ack 3960, win 2376, options [nop,nop,TS val 98014 ecr 3672555], length 0
17:49:10.817669 IP 192.168.1.10.6633 > 192.168.1.30.40481: Flags [.], ack 4320, win 2399, options [nop,nop,TS val 98014 ecr 3672555], length 0
17:49:10.817678 IP 192.168.1.10.6633 > 192.168.1.30.40481: Flags [.], ack 4680, win 2422, options [nop,nop,TS val 98014 ecr 3672555], length 0
17:49:10.817687 IP 192.168.1.10.6633 > 192.168.1.30.40481: Flags [.], ack 5040, win 2444, options [nop,nop,TS val 98014 ecr 3672555], length 0
17:49:10.817695 IP 192.168.1.10.6633 > 192.168.1.30.40481: Flags [.], ack 5400, win 2467, options [nop,nop,TS val 98014 ecr 3672555], length 0
17:49:10.817704 IP 192.168.1.10.6633 > 192.168.1.30.40481: Flags [.], ack 5760, win 2489, options [nop,nop,TS val 98014 ecr 3672555], length 0
17:49:10.817711 IP 192.168.1.10.6633 > 192.168.1.30.40481: Flags [.], ack 6120, win 2512, options [nop,nop,TS val 98014 ecr 3672555], length 0
17:49:10.817719 IP 192.168.1.10.6633 > 192.168.1.30.40481: Flags [.], ack 6480, win 2535, options [nop,nop,TS val 98014 ecr 3672555], length 0
17:49:10.817727 IP 192.168.1.10.6633 > 192.168.1.30.40481: Flags [.], ack 6840, win 2557, options [nop,nop,TS val 98014 ecr 3672555], length 0
17:49:10.817735 IP 192.168.1.10.6633 > 192.168.1.30.40481: Flags [.], ack 7200, win 2580, options [nop,nop,TS val 98014 ecr 3672555], length 0
17:49:10.817743 IP 192.168.1.10.6633 > 192.168.1.30.40481: Flags [.], ack 7560, win 2603, options [nop,nop,TS val 98014 ecr 3672555], length 0
17:49:10.817750 IP 192.168.1.10.6633 > 192.168.1.30.40481: Flags [.], ack 7920, win 2625, options [nop,nop,TS val 98014 ecr 3672556], length 0
17:49:10.817758 IP 192.168.1.10.6633 > 192.168.1.30.40481: Flags [.], ack 8280, win 2648, options [nop,nop,TS val 98014 ecr 3672556], length 0
17:49:10.817765 IP 192.168.1.10.6633 > 192.168.1.30.40481: Flags [.], ack 8640, win 2670, options [nop,nop,TS val 98014 ecr 3672556], length 0
17:49:10.817774 IP 192.168.1.10.6633 > 192.168.1.30.40481: Flags [.], ack 9000, win 2693, options [nop,nop,TS val 98014 ecr 3672556], length 0
17:49:10.818156 IP 192.168.1.30.40481 > 192.168.1.10.6633: Flags [P.], seq 9000:9360, ack 1, win 58, options [nop,nop,TS val 3672556 ecr 98014], length 360: OpenFlow
	version 1.0, type PACKET_IN, length 360, xid 0x00000000
17:49:10.818196 IP 192.168.1.30.40481 > 192.168.1.10.6633: Flags [P.], seq 9360:9720, ack 1, win 58, options [nop,nop,TS val 3672556 ecr 98014], length 360: OpenFlow
	version 1.0, type PACKET_IN, length 360, xid 0x00000000
17:49:10.818233 IP 192.168.1.30.40481 > 192.168.1.10.6633: Flags [P.], seq 9720:10080, ack 1, win 58, options [nop,nop,TS val 3672556 ecr 98014], length 360: OpenFlow
	version 1.0, type PACKET_IN, length 360, xid 0x00000000
17:49:10.818270 IP 192.168.1.30.40481 > 192.168.1.10.6633: Flags [P.], seq 10080:10440, ack 1, win 58, options [nop,nop,TS val 3672556 ecr 98014], length 360: OpenFlow
	version 1.0, type PACKET_IN, length 360, xid 0x00000000
17:49:10.818332 IP 192.168.1.30.40481 > 192.168.1.10.6633: Flags [P.], seq 10440:10800, ack 1, win 58, options [nop,nop,TS val 3672556 ecr 98014], length 360: OpenFlow
	version 1.0, type PACKET_IN, length 360, xid 0x00000000
17:49:10.818502 IP 192.168.1.30.40481 > 192.168.1.10.6633: Flags [P.], seq 10800:11160, ack 1, win 58, options [nop,nop,TS val 3672556 ecr 98014], length 360: OpenFlow
	version 1.0, type PACKET_IN, length 360, xid 0x00000000
17:49:10.818541 IP 192.168.1.30.40481 > 192.168.1.10.6633: Flags [P.], seq 11160:11520, ack 1, win 58, options [nop,nop,TS val 3672556 ecr 98014], length 360: OpenFlow
	version 1.0, type PACKET_IN, length 360, xid 0x00000000
17:49:10.818577 IP 192.168.1.30.40481 > 192.168.1.10.6633: Flags [P.], seq 11520:11880, ack 1, win 58, options [nop,nop,TS val 3672556 ecr 98014], length 360: OpenFlow
	version 1.0, type PACKET_IN, length 360, xid 0x00000000
17:49:10.818623 IP 192.168.1.30.40481 > 192.168.1.10.6633: Flags [P.], seq 11880:12240, ack 1, win 58, options [nop,nop,TS val 3672556 ecr 98014], length 360: OpenFlow
	version 1.0, type PACKET_IN, length 360, xid 0x00000000
17:49:10.818654 IP 192.168.1.10.6633 > 192.168.1.30.40481: Flags [.], ack 9360, win 2716, options [nop,nop,TS val 98014 ecr 3672556], length 0
17:49:10.818668 IP 192.168.1.10.6633 > 192.168.1.30.40481: Flags [.], ack 9720, win 2738, options [nop,nop,TS val 98014 ecr 3672556], length 0
17:49:10.818778 IP 192.168.1.10.6633 > 192.168.1.30.40481: Flags [.], ack 10080, win 2761, options [nop,nop,TS val 98014 ecr 3672556], length 0
17:49:10.818817 IP 192.168.1.10.6633 > 192.168.1.30.40481: Flags [.], ack 10440, win 2778, options [nop,nop,TS val 98014 ecr 3672556], length 0
17:49:10.818831 IP 192.168.1.10.6633 > 192.168.1.30.40481: Flags [.], ack 10800, win 2778, options [nop,nop,TS val 98014 ecr 3672556], length 0
17:49:10.818840 IP 192.168.1.10.6633 > 192.168.1.30.40481: Flags [.], ack 11160, win 2778, options [nop,nop,TS val 98014 ecr 3672556], length 0
17:49:10.818988 IP 192.168.1.10.6633 > 192.168.1.30.40481: Flags [.], ack 11520, win 2778, options [nop,nop,TS val 98014 ecr 3672556], length 0
17:49:10.819002 IP 192.168.1.10.6633 > 192.168.1.30.40481: Flags [.], ack 11880, win 2778, options [nop,nop,TS val 98014 ecr 3672556], length 0
17:49:10.819071 IP 192.168.1.30.40481 > 192.168.1.10.6633: Flags [P.], seq 12240:12600, ack 1, win 58, options [nop,nop,TS val 3672556 ecr 98014], length 360: OpenFlow
	version 1.0, type PACKET_IN, length 360, xid 0x00000000
17:49:10.819109 IP 192.168.1.30.40481 > 192.168.1.10.6633: Flags [P.], seq 12600:12960, ack 1, win 58, options [nop,nop,TS val 3672556 ecr 98014], length 360: OpenFlow
	version 1.0, type PACKET_IN, length 360, xid 0x00000000
17:49:10.819146 IP 192.168.1.30.40481 > 192.168.1.10.6633: Flags [P.], seq 12960:13320, ack 1, win 58, options [nop,nop,TS val 3672556 ecr 98014], length 360: OpenFlow
	version 1.0, type PACKET_IN, length 360, xid 0x00000000
17:49:10.819183 IP 192.168.1.30.40481 > 192.168.1.10.6633: Flags [P.], seq 13320:13680, ack 1, win 58, options [nop,nop,TS val 3672556 ecr 98014], length 360: OpenFlow
	version 1.0, type PACKET_IN, length 360, xid 0x00000000
17:49:10.819229 IP 192.168.1.30.40481 > 192.168.1.10.6633: Flags [P.], seq 13680:14040, ack 1, win 58, options [nop,nop,TS val 3672556 ecr 98014], length 360: OpenFlow
	version 1.0, type PACKET_IN, length 360, xid 0x00000000
17:49:10.819290 IP 192.168.1.10.6633 > 192.168.1.30.40481: Flags [.], ack 12240, win 2778, options [nop,nop,TS val 98014 ecr 3672556], length 0
17:49:10.819305 IP 192.168.1.10.6633 > 192.168.1.30.40481: Flags [.], ack 12600, win 2778, options [nop,nop,TS val 98014 ecr 3672556], length 0
17:49:10.819410 IP 192.168.1.10.6633 > 192.168.1.30.40481: Flags [.], ack 12960, win 2778, options [nop,nop,TS val 98014 ecr 3672556], length 0
17:49:10.819426 IP 192.168.1.10.6633 > 192.168.1.30.40481: Flags [.], ack 13320, win 2778, options [nop,nop,TS val 98014 ecr 3672556], length 0
17:49:10.819435 IP 192.168.1.10.6633 > 192.168.1.30.40481: Flags [.], ack 13680, win 2778, options [nop,nop,TS val 98014 ecr 3672556], length 0
17:49:10.819447 IP 192.168.1.10.6633 > 192.168.1.30.40481: Flags [.], ack 14040, win 2778, options [nop,nop,TS val 98014 ecr 3672556], length 0
17:49:10.819707 IP 192.168.1.30.40481 > 192.168.1.10.6633: Flags [P.], seq 14040:14400, ack 1, win 58, options [nop,nop,TS val 3672556 ecr 98014], length 360: OpenFlow
	version 1.0, type PACKET_IN, length 360, xid 0x00000000
17:49:10.819757 IP 192.168.1.30.40481 > 192.168.1.10.6633: Flags [P.], seq 14400:14760, ack 1, win 58, options [nop,nop,TS val 3672556 ecr 98014], length 360: OpenFlow
	version 1.0, type PACKET_IN, length 360, xid 0x00000000
17:49:10.819892 IP 192.168.1.30.40481 > 192.168.1.10.6633: Flags [P.], seq 14760:15120, ack 1, win 58, options [nop,nop,TS val 3672556 ecr 98014], length 360: OpenFlow
	version 1.0, type PACKET_IN, length 360, xid 0x00000000
17:49:10.819933 IP 192.168.1.30.40481 > 192.168.1.10.6633: Flags [P.], seq 15120:15480, ack 1, win 58, options [nop,nop,TS val 3672556 ecr 98014], length 360: OpenFlow
	version 1.0, type PACKET_IN, length 360, xid 0x00000000
17:49:10.819983 IP 192.168.1.30.40481 > 192.168.1.10.6633: Flags [P.], seq 15480:15840, ack 1, win 58, options [nop,nop,TS val 3672556 ecr 98014], length 360: OpenFlow
	version 1.0, type PACKET_IN, length 360, xid 0x00000000
17:49:10.820028 IP 192.168.1.30.40481 > 192.168.1.10.6633: Flags [P.], seq 15840:16200, ack 1, win 58, options [nop,nop,TS val 3672556 ecr 98014], length 360: OpenFlow
	version 1.0, type PACKET_IN, length 360, xid 0x00000000
17:49:10.820072 IP 192.168.1.30.40481 > 192.168.1.10.6633: Flags [P.], seq 16200:16560, ack 1, win 58, options [nop,nop,TS val 3672556 ecr 98014], length 360: OpenFlow
	version 1.0, type PACKET_IN, length 360, xid 0x00000000
17:49:10.820167 IP 192.168.1.30.40481 > 192.168.1.10.6633: Flags [P.], seq 16560:16920, ack 1, win 58, options [nop,nop,TS val 3672556 ecr 98014], length 360: OpenFlow
	version 1.0, type PACKET_IN, length 360, xid 0x00000000
17:49:10.820210 IP 192.168.1.30.40481 > 192.168.1.10.6633: Flags [P.], seq 16920:17280, ack 1, win 58, options [nop,nop,TS val 3672556 ecr 98014], length 360: OpenFlow
	version 1.0, type PACKET_IN, length 360, xid 0x00000000
17:49:10.820256 IP 192.168.1.30.40481 > 192.168.1.10.6633: Flags [P.], seq 17280:17640, ack 1, win 58, options [nop,nop,TS val 3672556 ecr 98014], length 360: OpenFlow
	version 1.0, type PACKET_IN, length 360, xid 0x00000000
17:49:10.820290 IP 192.168.1.10.6633 > 192.168.1.30.40481: Flags [.], ack 15840, win 2778, options [nop,nop,TS val 98014 ecr 3672556], length 0
17:49:10.820307 IP 192.168.1.10.6633 > 192.168.1.30.40481: Flags [.], ack 16200, win 2778, options [nop,nop,TS val 98014 ecr 3672556], length 0
17:49:10.820371 IP 192.168.1.30.40481 > 192.168.1.10.6633: Flags [P.], seq 17640:18000, ack 1, win 58, options [nop,nop,TS val 3672556 ecr 98014], length 360: OpenFlow
	version 1.0, type PACKET_IN, length 360, xid 0x00000000
17:49:10.820412 IP 192.168.1.30.40481 > 192.168.1.10.6633: Flags [P.], seq 18000:18360, ack 1, win 58, options [nop,nop,TS val 3672556 ecr 98014], length 360: OpenFlow
	version 1.0, type PACKET_IN, length 360, xid 0x00000000
17:49:10.820452 IP 192.168.1.30.40481 > 192.168.1.10.6633: Flags [P.], seq 18360:18720, ack 1, win 58, options [nop,nop,TS val 3672556 ecr 98014], length 360: OpenFlow
	version 1.0, type PACKET_IN, length 360, xid 0x00000000
17:49:10.820511 IP 192.168.1.30.40481 > 192.168.1.10.6633: Flags [P.], seq 18720:19080, ack 1, win 58, options [nop,nop,TS val 3672556 ecr 98014], length 360: OpenFlow
	version 1.0, type PACKET_IN, length 360, xid 0x00000000
17:49:10.820600 IP 192.168.1.10.6633 > 192.168.1.30.40481: Flags [.], ack 18000, win 2778, options [nop,nop,TS val 98014 ecr 3672556], length 0
17:49:10.820624 IP 192.168.1.10.6633 > 192.168.1.30.40481: Flags [.], ack 19080, win 2778, options [nop,nop,TS val 98014 ecr 3672556], length 0
17:49:10.820651 IP 192.168.1.30.40481 > 192.168.1.10.6633: Flags [P.], seq 19080:19440, ack 1, win 58, options [nop,nop,TS val 3672556 ecr 98014], length 360: OpenFlow
	version 1.0, type PACKET_IN, length 360, xid 0x00000000
17:49:10.820698 IP 192.168.1.30.40481 > 192.168.1.10.6633: Flags [P.], seq 19440:19800, ack 1, win 58, options [nop,nop,TS val 3672556 ecr 98014], length 360: OpenFlow
	version 1.0, type PACKET_IN, length 360, xid 0x00000000
17:49:10.820742 IP 192.168.1.30.40481 > 192.168.1.10.6633: Flags [P.], seq 19800:20160, ack 1, win 58, options [nop,nop,TS val 3672556 ecr 98014], length 360: OpenFlow
	version 1.0, type PACKET_IN, length 360, xid 0x00000000
17:49:10.820782 IP 192.168.1.30.40481 > 192.168.1.10.6633: Flags [P.], seq 20160:20520, ack 1, win 58, options [nop,nop,TS val 3672556 ecr 98014], length 360: OpenFlow
	version 1.0, type PACKET_IN, length 360, xid 0x00000000
17:49:10.820852 IP 192.168.1.30.40481 > 192.168.1.10.6633: Flags [P.], seq 20520:20880, ack 1, win 58, options [nop,nop,TS val 3672556 ecr 98014], length 360: OpenFlow
	version 1.0, type PACKET_IN, length 360, xid 0x00000000
17:49:10.820895 IP 192.168.1.30.40481 > 192.168.1.10.6633: Flags [P.], seq 20880:21240, ack 1, win 58, options [nop,nop,TS val 3672556 ecr 98014], length 360: OpenFlow
	version 1.0, type PACKET_IN, length 360, xid 0x00000000
17:49:10.820927 IP 192.168.1.30.40481 > 192.168.1.10.6633: Flags [P.], seq 21240:21600, ack 1, win 58, options [nop,nop,TS val 3672556 ecr 98014], length 360: OpenFlow
	version 1.0, type PACKET_IN, length 360, xid 0x00000000
17:49:10.820959 IP 192.168.1.30.40481 > 192.168.1.10.6633: Flags [P.], seq 21600:21960, ack 1, win 58, options [nop,nop,TS val 3672556 ecr 98014], length 360: OpenFlow
	version 1.0, type PACKET_IN, length 360, xid 0x00000000
17:49:10.820991 IP 192.168.1.30.40481 > 192.168.1.10.6633: Flags [P.], seq 21960:22320, ack 1, win 58, options [nop,nop,TS val 3672556 ecr 98014], length 360: OpenFlow
	version 1.0, type PACKET_IN, length 360, xid 0x00000000
17:49:10.821045 IP 192.168.1.10.6633 > 192.168.1.30.40481: Flags [.], ack 20520, win 2778, options [nop,nop,TS val 98014 ecr 3672556], length 0
17:49:10.821061 IP 192.168.1.10.6633 > 192.168.1.30.40481: Flags [.], ack 21240, win 2778, options [nop,nop,TS val 98014 ecr 3672556], length 0
17:49:10.821088 IP 192.168.1.30.40481 > 192.168.1.10.6633: Flags [P.], seq 22320:22680, ack 1, win 58, options [nop,nop,TS val 3672556 ecr 98014], length 360: OpenFlow
	version 1.0, type PACKET_IN, length 360, xid 0x00000000
17:49:10.821125 IP 192.168.1.30.40481 > 192.168.1.10.6633: Flags [P.], seq 22680:23040, ack 1, win 58, options [nop,nop,TS val 3672556 ecr 98014], length 360: OpenFlow
	version 1.0, type PACKET_IN, length 360, xid 0x00000000
17:49:10.821161 IP 192.168.1.30.40481 > 192.168.1.10.6633: Flags [P.], seq 23040:23400, ack 1, win 58, options [nop,nop,TS val 3672556 ecr 98014], length 360: OpenFlow
	version 1.0, type PACKET_IN, length 360, xid 0x00000000
17:49:10.821196 IP 192.168.1.30.40481 > 192.168.1.10.6633: Flags [P.], seq 23400:23760, ack 1, win 58, options [nop,nop,TS val 3672556 ecr 98014], length 360: OpenFlow
	version 1.0, type PACKET_IN, length 360, xid 0x00000000
17:49:10.821231 IP 192.168.1.30.40481 > 192.168.1.10.6633: Flags [P.], seq 23760:24120, ack 1, win 58, options [nop,nop,TS val 3672556 ecr 98014], length 360: OpenFlow
	version 1.0, type PACKET_IN, length 360, xid 0x00000000
17:49:10.821267 IP 192.168.1.10.6633 > 192.168.1.30.40481: Flags [.], ack 22320, win 2778, options [nop,nop,TS val 98014 ecr 3672556], length 0
17:49:10.821282 IP 192.168.1.10.6633 > 192.168.1.30.40481: Flags [.], ack 22680, win 2778, options [nop,nop,TS val 98014 ecr 3672556], length 0
17:49:10.821320 IP 192.168.1.30.40481 > 192.168.1.10.6633: Flags [P.], seq 24120:24480, ack 1, win 58, options [nop,nop,TS val 3672556 ecr 98014], length 360: OpenFlow
	version 1.0, type PACKET_IN, length 360, xid 0x00000000
17:49:10.821362 IP 192.168.1.30.40481 > 192.168.1.10.6633: Flags [P.], seq 24480:24840, ack 1, win 58, options [nop,nop,TS val 3672556 ecr 98014], length 360: OpenFlow
	version 1.0, type PACKET_IN, length 360, xid 0x00000000
17:49:10.821401 IP 192.168.1.30.40481 > 192.168.1.10.6633: Flags [P.], seq 24840:25200, ack 1, win 58, options [nop,nop,TS val 3672556 ecr 98014], length 360: OpenFlow
	version 1.0, type PACKET_IN, length 360, xid 0x00000000
17:49:10.821440 IP 192.168.1.30.40481 > 192.168.1.10.6633: Flags [P.], seq 25200:25560, ack 1, win 58, options [nop,nop,TS val 3672556 ecr 98014], length 360: OpenFlow
	version 1.0, type PACKET_IN, length 360, xid 0x00000000
17:49:10.821498 IP 192.168.1.10.6633 > 192.168.1.30.40481: Flags [.], ack 24120, win 2778, options [nop,nop,TS val 98014 ecr 3672556], length 0
17:49:10.821513 IP 192.168.1.10.6633 > 192.168.1.30.40481: Flags [.], ack 24480, win 2778, options [nop,nop,TS val 98015 ecr 3672556], length 0
17:49:10.821540 IP 192.168.1.30.40481 > 192.168.1.10.6633: Flags [P.], seq 25560:25920, ack 1, win 58, options [nop,nop,TS val 3672557 ecr 98015], length 360: OpenFlow
	version 1.0, type PACKET_IN, length 360, xid 0x00000000
17:49:10.821586 IP 192.168.1.30.40481 > 192.168.1.10.6633: Flags [P.], seq 25920:26280, ack 1, win 58, options [nop,nop,TS val 3672557 ecr 98015], length 360: OpenFlow
	version 1.0, type PACKET_IN, length 360, xid 0x00000000
17:49:10.821624 IP 192.168.1.30.40481 > 192.168.1.10.6633: Flags [P.], seq 26280:26640, ack 1, win 58, options [nop,nop,TS val 3672557 ecr 98015], length 360: OpenFlow
	version 1.0, type PACKET_IN, length 360, xid 0x00000000
17:49:10.821668 IP 192.168.1.30.40481 > 192.168.1.10.6633: Flags [P.], seq 26640:27000, ack 1, win 58, options [nop,nop,TS val 3672557 ecr 98015], length 360: OpenFlow
	version 1.0, type PACKET_IN, length 360, xid 0x00000000
17:49:10.821708 IP 192.168.1.30.40481 > 192.168.1.10.6633: Flags [P.], seq 27000:27360, ack 1, win 58, options [nop,nop,TS val 3672557 ecr 98015], length 360: OpenFlow
	version 1.0, type PACKET_IN, length 360, xid 0x00000000
17:49:10.821758 IP 192.168.1.10.6633 > 192.168.1.30.40481: Flags [.], ack 25560, win 2778, options [nop,nop,TS val 98015 ecr 3672556], length 0
17:49:10.821773 IP 192.168.1.10.6633 > 192.168.1.30.40481: Flags [.], ack 25920, win 2778, options [nop,nop,TS val 98015 ecr 3672557], length 0
17:49:10.821784 IP 192.168.1.10.6633 > 192.168.1.30.40481: Flags [.], ack 26640, win 2778, options [nop,nop,TS val 98015 ecr 3672557], length 0
17:49:10.821906 IP 192.168.1.10.6633 > 192.168.1.30.40481: Flags [.], ack 27360, win 2778, options [nop,nop,TS val 98015 ecr 3672557], length 0
17:49:10.821966 IP 192.168.1.30.40481 > 192.168.1.10.6633: Flags [P.], seq 27360:27720, ack 1, win 58, options [nop,nop,TS val 3672557 ecr 98015], length 360: OpenFlow
	version 1.0, type PACKET_IN, length 360, xid 0x00000000
17:49:10.823836 IP 192.168.1.30.40481 > 192.168.1.10.6633: Flags [P.], seq 27720:28080, ack 1, win 58, options [nop,nop,TS val 3672557 ecr 98015], length 360: OpenFlow
	version 1.0, type PACKET_IN, length 360, xid 0x00000000
17:49:10.823868 IP 192.168.1.30.40481 > 192.168.1.10.6633: Flags [P.], seq 28080:28440, ack 1, win 58, options [nop,nop,TS val 3672557 ecr 98015], length 360: OpenFlow
	version 1.0, type PACKET_IN, length 360, xid 0x00000000
17:49:10.823894 IP 192.168.1.30.40481 > 192.168.1.10.6633: Flags [P.], seq 28440:28800, ack 1, win 58, options [nop,nop,TS val 3672557 ecr 98015], length 360: OpenFlow
	version 1.0, type PACKET_IN, length 360, xid 0x00000000
17:49:10.823920 IP 192.168.1.30.40481 > 192.168.1.10.6633: Flags [P.], seq 28800:29160, ack 1, win 58, options [nop,nop,TS val 3672557 ecr 98015], length 360: OpenFlow
	version 1.0, type PACKET_IN, length 360, xid 0x00000000
17:49:10.823945 IP 192.168.1.30.40481 > 192.168.1.10.6633: Flags [P.], seq 29160:29520, ack 1, win 58, options [nop,nop,TS val 3672557 ecr 98015], length 360: OpenFlow
	version 1.0, type PACKET_IN, length 360, xid 0x00000000
17:49:10.823970 IP 192.168.1.30.40481 > 192.168.1.10.6633: Flags [P.], seq 29520:29880, ack 1, win 58, options [nop,nop,TS val 3672557 ecr 98015], length 360: OpenFlow
	version 1.0, type PACKET_IN, length 360, xid 0x00000000
17:49:10.824132 IP 192.168.1.10.6633 > 192.168.1.30.40481: Flags [.], ack 27720, win 2778, options [nop,nop,TS val 98015 ecr 3672557], length 0
17:49:10.824163 IP 192.168.1.10.6633 > 192.168.1.30.40481: Flags [.], ack 29520, win 2778, options [nop,nop,TS val 98015 ecr 3672557], length 0
17:49:10.824188 IP 192.168.1.10.6633 > 192.168.1.30.40481: Flags [.], ack 29880, win 2778, options [nop,nop,TS val 98015 ecr 3672557], length 0
17:49:10.824246 IP 192.168.1.30.40481 > 192.168.1.10.6633: Flags [P.], seq 29880:30240, ack 1, win 58, options [nop,nop,TS val 3672557 ecr 98015], length 360: OpenFlow
	version 1.0, type PACKET_IN, length 360, xid 0x00000000
17:49:10.824290 IP 192.168.1.30.40481 > 192.168.1.10.6633: Flags [P.], seq 30240:30600, ack 1, win 58, options [nop,nop,TS val 3672557 ecr 98015], length 360: OpenFlow
	version 1.0, type PACKET_IN, length 360, xid 0x00000000
17:49:10.824334 IP 192.168.1.30.40481 > 192.168.1.10.6633: Flags [P.], seq 30600:30960, ack 1, win 58, options [nop,nop,TS val 3672557 ecr 98015], length 360: OpenFlow
	version 1.0, type PACKET_IN, length 360, xid 0x00000000
17:49:10.824380 IP 192.168.1.30.40481 > 192.168.1.10.6633: Flags [P.], seq 30960:31320, ack 1, win 58, options [nop,nop,TS val 3672557 ecr 98015], length 360: OpenFlow
	version 1.0, type PACKET_IN, length 360, xid 0x00000000
17:49:10.824464 IP 192.168.1.30.40481 > 192.168.1.10.6633: Flags [P.], seq 31320:31680, ack 1, win 58, options [nop,nop,TS val 3672557 ecr 98015], length 360: OpenFlow
	version 1.0, type PACKET_IN, length 360, xid 0x00000000
17:49:10.824503 IP 192.168.1.30.40481 > 192.168.1.10.6633: Flags [P.], seq 31680:32040, ack 1, win 58, options [nop,nop,TS val 3672557 ecr 98015], length 360: OpenFlow
	version 1.0, type PACKET_IN, length 360, xid 0x00000000
17:49:10.824540 IP 192.168.1.30.40481 > 192.168.1.10.6633: Flags [P.], seq 32040:32400, ack 1, win 58, options [nop,nop,TS val 3672557 ecr 98015], length 360: OpenFlow
	version 1.0, type PACKET_IN, length 360, xid 0x00000000
17:49:10.824577 IP 192.168.1.30.40481 > 192.168.1.10.6633: Flags [P.], seq 32400:32760, ack 1, win 58, options [nop,nop,TS val 3672557 ecr 98015], length 360: OpenFlow
	version 1.0, type PACKET_IN, length 360, xid 0x00000000
17:49:10.824616 IP 192.168.1.30.40481 > 192.168.1.10.6633: Flags [P.], seq 32760:33120, ack 1, win 58, options [nop,nop,TS val 3672557 ecr 98015], length 360: OpenFlow
	version 1.0, type PACKET_IN, length 360, xid 0x00000000
17:49:10.824658 IP 192.168.1.10.6633 > 192.168.1.30.40481: Flags [.], ack 31320, win 2778, options [nop,nop,TS val 98015 ecr 3672557], length 0
17:49:10.824730 IP 192.168.1.30.40481 > 192.168.1.10.6633: Flags [P.], seq 33120:33480, ack 1, win 58, options [nop,nop,TS val 3672557 ecr 98015], length 360: OpenFlow
	version 1.0, type PACKET_IN, length 360, xid 0x00000000
17:49:10.824769 IP 192.168.1.30.40481 > 192.168.1.10.6633: Flags [P.], seq 33480:33840, ack 1, win 58, options [nop,nop,TS val 3672557 ecr 98015], length 360: OpenFlow
	version 1.0, type PACKET_IN, length 360, xid 0x00000000
17:49:10.824804 IP 192.168.1.30.40481 > 192.168.1.10.6633: Flags [P.], seq 33840:34200, ack 1, win 58, options [nop,nop,TS val 3672557 ecr 98015], length 360: OpenFlow
	version 1.0, type PACKET_IN, length 360, xid 0x00000000
17:49:10.824851 IP 192.168.1.30.40481 > 192.168.1.10.6633: Flags [P.], seq 34200:34560, ack 1, win 58, options [nop,nop,TS val 3672557 ecr 98015], length 360: OpenFlow
	version 1.0, type PACKET_IN, length 360, xid 0x00000000
17:49:10.824881 IP 192.168.1.10.6633 > 192.168.1.30.40481: Flags [.], ack 33120, win 2778, options [nop,nop,TS val 98015 ecr 3672557], length 0
17:49:10.824952 IP 192.168.1.30.40481 > 192.168.1.10.6633: Flags [P.], seq 34560:34920, ack 1, win 58, options [nop,nop,TS val 3672557 ecr 98015], length 360: OpenFlow
	version 1.0, type PACKET_IN, length 360, xid 0x00000000
17:49:10.824990 IP 192.168.1.30.40481 > 192.168.1.10.6633: Flags [P.], seq 34920:35280, ack 1, win 58, options [nop,nop,TS val 3672557 ecr 98015], length 360: OpenFlow
	version 1.0, type PACKET_IN, length 360, xid 0x00000000
17:49:10.825027 IP 192.168.1.30.40481 > 192.168.1.10.6633: Flags [P.], seq 35280:35640, ack 1, win 58, options [nop,nop,TS val 3672557 ecr 98015], length 360: OpenFlow
	version 1.0, type PACKET_IN, length 360, xid 0x00000000
17:49:10.825066 IP 192.168.1.30.40481 > 192.168.1.10.6633: Flags [P.], seq 35640:36000, ack 1, win 58, options [nop,nop,TS val 3672557 ecr 98015], length 360: OpenFlow
	version 1.0, type PACKET_IN, length 360, xid 0x00000000
17:49:10.825104 IP 192.168.1.30.40481 > 192.168.1.10.6633: Flags [P.], seq 36000:36360, ack 1, win 58, options [nop,nop,TS val 3672557 ecr 98015], length 360: OpenFlow
	version 1.0, type PACKET_IN, length 360, xid 0x00000000
17:49:10.825148 IP 192.168.1.10.6633 > 192.168.1.30.40481: Flags [.], ack 34920, win 2778, options [nop,nop,TS val 98015 ecr 3672557], length 0
17:49:10.825193 IP 192.168.1.30.40481 > 192.168.1.10.6633: Flags [P.], seq 36360:36720, ack 1, win 58, options [nop,nop,TS val 3672557 ecr 98015], length 360: OpenFlow
	version 1.0, type PACKET_IN, length 360, xid 0x00000000
17:49:10.825232 IP 192.168.1.30.40481 > 192.168.1.10.6633: Flags [P.], seq 36720:37080, ack 1, win 58, options [nop,nop,TS val 3672557 ecr 98015], length 360: OpenFlow
	version 1.0, type PACKET_IN, length 360, xid 0x00000000
17:49:10.825270 IP 192.168.1.30.40481 > 192.168.1.10.6633: Flags [P.], seq 37080:37440, ack 1, win 58, options [nop,nop,TS val 3672557 ecr 98015], length 360: OpenFlow
	version 1.0, type PACKET_IN, length 360, xid 0x00000000
17:49:10.825307 IP 192.168.1.30.40481 > 192.168.1.10.6633: Flags [P.], seq 37440:37800, ack 1, win 58, options [nop,nop,TS val 3672557 ecr 98015], length 360: OpenFlow
	version 1.0, type PACKET_IN, length 360, xid 0x00000000
17:49:10.825400 IP 192.168.1.30.40481 > 192.168.1.10.6633: Flags [P.], seq 37800:38160, ack 1, win 58, options [nop,nop,TS val 3672557 ecr 98015], length 360: OpenFlow
	version 1.0, type PACKET_IN, length 360, xid 0x00000000
17:49:10.825449 IP 192.168.1.30.40481 > 192.168.1.10.6633: Flags [P.], seq 38160:38520, ack 1, win 58, options [nop,nop,TS val 3672557 ecr 98015], length 360: OpenFlow
	version 1.0, type PACKET_IN, length 360, xid 0x00000000
17:49:10.825531 IP 192.168.1.30.40481 > 192.168.1.10.6633: Flags [P.], seq 38520:38880, ack 1, win 58, options [nop,nop,TS val 3672558 ecr 98015], length 360: OpenFlow
	version 1.0, type PACKET_IN, length 360, xid 0x00000000
17:49:10.825597 IP 192.168.1.10.6633 > 192.168.1.30.40481: Flags [.], ack 36720, win 2778, options [nop,nop,TS val 98016 ecr 3672557], length 0
17:49:10.825616 IP 192.168.1.10.6633 > 192.168.1.30.40481: Flags [.], ack 38520, win 2778, options [nop,nop,TS val 98016 ecr 3672557], length 0
17:49:10.825680 IP 192.168.1.30.40481 > 192.168.1.10.6633: Flags [P.], seq 38880:39240, ack 1, win 58, options [nop,nop,TS val 3672558 ecr 98016], length 360: OpenFlow
	version 1.0, type PACKET_IN, length 360, xid 0x00000000
17:49:10.825728 IP 192.168.1.30.40481 > 192.168.1.10.6633: Flags [P.], seq 39240:39600, ack 1, win 58, options [nop,nop,TS val 3672558 ecr 98016], length 360: OpenFlow
	version 1.0, type PACKET_IN, length 360, xid 0x00000000
17:49:10.825768 IP 192.168.1.30.40481 > 192.168.1.10.6633: Flags [P.], seq 39600:39960, ack 1, win 58, options [nop,nop,TS val 3672558 ecr 98016], length 360: OpenFlow
	version 1.0, type PACKET_IN, length 360, xid 0x00000000
17:49:10.825810 IP 192.168.1.30.40481 > 192.168.1.10.6633: Flags [P.], seq 39960:40320, ack 1, win 58, options [nop,nop,TS val 3672558 ecr 98016], length 360: OpenFlow
	version 1.0, type PACKET_IN, length 360, xid 0x00000000
17:49:10.825952 IP 192.168.1.30.40481 > 192.168.1.10.6633: Flags [P.], seq 40320:40680, ack 1, win 58, options [nop,nop,TS val 3672558 ecr 98016], length 360: OpenFlow
	version 1.0, type PACKET_IN, length 360, xid 0x00000000
17:49:10.826044 IP 192.168.1.30.40481 > 192.168.1.10.6633: Flags [P.], seq 40680:41040, ack 1, win 58, options [nop,nop,TS val 3672558 ecr 98016], length 360: OpenFlow
	version 1.0, type PACKET_IN, length 360, xid 0x00000000
17:49:10.826086 IP 192.168.1.30.40481 > 192.168.1.10.6633: Flags [P.], seq 41040:41400, ack 1, win 58, options [nop,nop,TS val 3672558 ecr 98016], length 360: OpenFlow
	version 1.0, type PACKET_IN, length 360, xid 0x00000000
17:49:10.826125 IP 192.168.1.30.40481 > 192.168.1.10.6633: Flags [P.], seq 41400:41760, ack 1, win 58, options [nop,nop,TS val 3672558 ecr 98016], length 360: OpenFlow
	version 1.0, type PACKET_IN, length 360, xid 0x00000000
17:49:10.826169 IP 192.168.1.30.40481 > 192.168.1.10.6633: Flags [P.], seq 41760:42120, ack 1, win 58, options [nop,nop,TS val 3672558 ecr 98016], length 360: OpenFlow
	version 1.0, type PACKET_IN, length 360, xid 0x00000000
17:49:10.826200 IP 192.168.1.10.6633 > 192.168.1.30.40481: Flags [.], ack 39600, win 2778, options [nop,nop,TS val 98016 ecr 3672558], length 0
17:49:10.826269 IP 192.168.1.30.40481 > 192.168.1.10.6633: Flags [P.], seq 42120:42480, ack 1, win 58, options [nop,nop,TS val 3672558 ecr 98016], length 360: OpenFlow
	version 1.0, type PACKET_IN, length 360, xid 0x00000000
17:49:10.826314 IP 192.168.1.30.40481 > 192.168.1.10.6633: Flags [P.], seq 42480:42840, ack 1, win 58, options [nop,nop,TS val 3672558 ecr 98016], length 360: OpenFlow
	version 1.0, type PACKET_IN, length 360, xid 0x00000000
17:49:10.826359 IP 192.168.1.30.40481 > 192.168.1.10.6633: Flags [P.], seq 42840:43200, ack 1, win 58, options [nop,nop,TS val 3672558 ecr 98016], length 360: OpenFlow
	version 1.0, type PACKET_IN, length 360, xid 0x00000000
17:49:10.826418 IP 192.168.1.10.6633 > 192.168.1.30.40481: Flags [.], ack 41400, win 2778, options [nop,nop,TS val 98016 ecr 3672558], length 0
17:49:10.826433 IP 192.168.1.10.6633 > 192.168.1.30.40481: Flags [.], ack 42120, win 2778, options [nop,nop,TS val 98016 ecr 3672558], length 0
17:49:10.826458 IP 192.168.1.30.40481 > 192.168.1.10.6633: Flags [P.], seq 43200:43560, ack 1, win 58, options [nop,nop,TS val 3672558 ecr 98016], length 360: OpenFlow
	version 1.0, type PACKET_IN, length 360, xid 0x00000000
17:49:10.826490 IP 192.168.1.30.40481 > 192.168.1.10.6633: Flags [P.], seq 43560:43920, ack 1, win 58, options [nop,nop,TS val 3672558 ecr 98016], length 360: OpenFlow
	version 1.0, type PACKET_IN, length 360, xid 0x00000000
17:49:10.826519 IP 192.168.1.30.40481 > 192.168.1.10.6633: Flags [P.], seq 43920:44280, ack 1, win 58, options [nop,nop,TS val 3672558 ecr 98016], length 360: OpenFlow
	version 1.0, type PACKET_IN, length 360, xid 0x00000000
17:49:10.826547 IP 192.168.1.30.40481 > 192.168.1.10.6633: Flags [P.], seq 44280:44640, ack 1, win 58, options [nop,nop,TS val 3672558 ecr 98016], length 360: OpenFlow
	version 1.0, type PACKET_IN, length 360, xid 0x00000000
17:49:10.826583 IP 192.168.1.10.6633 > 192.168.1.30.40481: Flags [.], ack 43200, win 2778, options [nop,nop,TS val 98016 ecr 3672558], length 0
17:49:10.826603 IP 192.168.1.30.40481 > 192.168.1.10.6633: Flags [P.], seq 44640:45000, ack 1, win 58, options [nop,nop,TS val 3672558 ecr 98016], length 360: OpenFlow
	version 1.0, type PACKET_IN, length 360, xid 0x00000000
17:49:10.826629 IP 192.168.1.30.40481 > 192.168.1.10.6633: Flags [P.], seq 45000:45360, ack 1, win 58, options [nop,nop,TS val 3672558 ecr 98016], length 360: OpenFlow
	version 1.0, type PACKET_IN, length 360, xid 0x00000000
17:49:10.826655 IP 192.168.1.30.40481 > 192.168.1.10.6633: Flags [P.], seq 45360:45720, ack 1, win 58, options [nop,nop,TS val 3672558 ecr 98016], length 360: OpenFlow
	version 1.0, type PACKET_IN, length 360, xid 0x00000000
17:49:10.826685 IP 192.168.1.30.40481 > 192.168.1.10.6633: Flags [P.], seq 45720:46080, ack 1, win 58, options [nop,nop,TS val 3672558 ecr 98016], length 360: OpenFlow
	version 1.0, type PACKET_IN, length 360, xid 0x00000000
17:49:10.826722 IP 192.168.1.10.6633 > 192.168.1.30.40481: Flags [.], ack 44640, win 2778, options [nop,nop,TS val 98016 ecr 3672558], length 0
17:49:10.826759 IP 192.168.1.30.40481 > 192.168.1.10.6633: Flags [P.], seq 46080:46440, ack 1, win 58, options [nop,nop,TS val 3672558 ecr 98016], length 360: OpenFlow
	version 1.0, type PACKET_IN, length 360, xid 0x00000000
17:49:10.826789 IP 192.168.1.30.40481 > 192.168.1.10.6633: Flags [P.], seq 46440:46800, ack 1, win 58, options [nop,nop,TS val 3672558 ecr 98016], length 360: OpenFlow
	version 1.0, type PACKET_IN, length 360, xid 0x00000000
17:49:10.826818 IP 192.168.1.30.40481 > 192.168.1.10.6633: Flags [P.], seq 46800:47160, ack 1, win 58, options [nop,nop,TS val 3672558 ecr 98016], length 360: OpenFlow
	version 1.0, type PACKET_IN, length 360, xid 0x00000000
17:49:10.826848 IP 192.168.1.30.40481 > 192.168.1.10.6633: Flags [P.], seq 47160:47520, ack 1, win 58, options [nop,nop,TS val 3672558 ecr 98016], length 360: OpenFlow
	version 1.0, type PACKET_IN, length 360, xid 0x00000000
17:49:10.826878 IP 192.168.1.30.40481 > 192.168.1.10.6633: Flags [P.], seq 47520:47880, ack 1, win 58, options [nop,nop,TS val 3672558 ecr 98016], length 360: OpenFlow
	version 1.0, type PACKET_IN, length 360, xid 0x00000000
17:49:10.826908 IP 192.168.1.30.40481 > 192.168.1.10.6633: Flags [P.], seq 47880:48240, ack 1, win 58, options [nop,nop,TS val 3672558 ecr 98016], length 360: OpenFlow
	version 1.0, type PACKET_IN, length 360, xid 0x00000000
17:49:10.826937 IP 192.168.1.30.40481 > 192.168.1.10.6633: Flags [P.], seq 48240:48600, ack 1, win 58, options [nop,nop,TS val 3672558 ecr 98016], length 360: OpenFlow
	version 1.0, type PACKET_IN, length 360, xid 0x00000000
17:49:10.826973 IP 192.168.1.30.40481 > 192.168.1.10.6633: Flags [P.], seq 48600:48960, ack 1, win 58, options [nop,nop,TS val 3672558 ecr 98016], length 360: OpenFlow
