18:05:55.023084 IP 192.168.1.10.6633 > 192.168.1.30.40478: Flags [.], ack 2297316456, win 11092, options [nop,nop,TS val 349065 ecr 3923594], length 0
18:05:55.023122 IP 192.168.1.30.40478 > 192.168.1.10.6633: Flags [P.], seq 1:580, ack 0, win 361, options [nop,nop,TS val 3923607 ecr 349065], length 579: OpenFlow
	version unknown (0x00), type 0x00, length 20585, xid 0xc7fffef3 [|openflow]
18:05:55.040682 IP 192.168.1.30.40478 > 192.168.1.10.6633: Flags [P.], seq 580:705, ack 0, win 361, options [nop,nop,TS val 3923611 ecr 349065], length 125: OpenFlow
	version 1.0, type PACKET_IN, length 125, xid 0x00000000
18:05:55.040794 IP 192.168.1.30.40478 > 192.168.1.10.6633: Flags [P.], seq 705:830, ack 0, win 361, options [nop,nop,TS val 3923611 ecr 349065], length 125: OpenFlow
	version 1.0, type PACKET_IN, length 125, xid 0x00000000
18:05:55.040817 IP 192.168.1.30.40478 > 192.168.1.10.6633: Flags [P.], seq 830:955, ack 0, win 361, options [nop,nop,TS val 3923611 ecr 349065], length 125: OpenFlow
	version 1.0, type PACKET_IN, length 125, xid 0x00000000
18:05:55.040830 IP 192.168.1.30.40478 > 192.168.1.10.6633: Flags [P.], seq 955:1080, ack 0, win 361, options [nop,nop,TS val 3923611 ecr 349065], length 125: OpenFlow
	version 1.0, type PACKET_IN, length 125, xid 0x00000000
18:05:55.040843 IP 192.168.1.30.40478 > 192.168.1.10.6633: Flags [P.], seq 1080:1205, ack 0, win 361, options [nop,nop,TS val 3923611 ecr 349065], length 125: OpenFlow
	version 1.0, type PACKET_IN, length 125, xid 0x00000000
18:05:55.040886 IP 192.168.1.30.40478 > 192.168.1.10.6633: Flags [P.], seq 1205:1330, ack 0, win 361, options [nop,nop,TS val 3923611 ecr 349065], length 125: OpenFlow
	version 1.0, type PACKET_IN, length 125, xid 0x00000000
18:05:55.040955 IP 192.168.1.30.40478 > 192.168.1.10.6633: Flags [P.], seq 1330:1455, ack 0, win 361, options [nop,nop,TS val 3923611 ecr 349065], length 125: OpenFlow
	version 1.0, type PACKET_IN, length 125, xid 0x00000000
18:05:55.040976 IP 192.168.1.30.40478 > 192.168.1.10.6633: Flags [P.], seq 1455:1580, ack 0, win 361, options [nop,nop,TS val 3923611 ecr 349065], length 125: OpenFlow
	version 1.0, type PACKET_IN, length 125, xid 0x00000000
18:05:55.040989 IP 192.168.1.30.40478 > 192.168.1.10.6633: Flags [P.], seq 1580:1705, ack 0, win 361, options [nop,nop,TS val 3923611 ecr 349065], length 125: OpenFlow
	version 1.0, type PACKET_IN, length 125, xid 0x00000000
18:05:55.041064 IP 192.168.1.30.40478 > 192.168.1.10.6633: Flags [P.], seq 1705:1830, ack 0, win 361, options [nop,nop,TS val 3923611 ecr 349065], length 125: OpenFlow
	version 1.0, type PACKET_IN, length 125, xid 0x00000000
18:05:55.041103 IP 192.168.1.30.40478 > 192.168.1.10.6633: Flags [P.], seq 1830:1955, ack 0, win 361, options [nop,nop,TS val 3923611 ecr 349065], length 125: OpenFlow
	version 1.0, type PACKET_IN, length 125, xid 0x00000000
18:05:55.041285 IP 192.168.1.30.40478 > 192.168.1.10.6633: Flags [P.], seq 1955:2080, ack 0, win 361, options [nop,nop,TS val 3923611 ecr 349065], length 125: OpenFlow
	version 1.0, type PACKET_IN, length 125, xid 0x00000000
18:05:55.041299 IP 192.168.1.30.40478 > 192.168.1.10.6633: Flags [P.], seq 2080:2205, ack 0, win 361, options [nop,nop,TS val 3923611 ecr 349065], length 125: OpenFlow
	version 1.0, type PACKET_IN, length 125, xid 0x00000000
18:05:55.041313 IP 192.168.1.30.40478 > 192.168.1.10.6633: Flags [P.], seq 2205:2330, ack 0, win 361, options [nop,nop,TS val 3923611 ecr 349065], length 125: OpenFlow
	version 1.0, type PACKET_IN, length 125, xid 0x00000000
18:05:55.041326 IP 192.168.1.30.40478 > 192.168.1.10.6633: Flags [P.], seq 2330:2455, ack 0, win 361, options [nop,nop,TS val 3923611 ecr 349065], length 125: OpenFlow
	version 1.0, type PACKET_IN, length 125, xid 0x00000000
18:05:55.041339 IP 192.168.1.30.40478 > 192.168.1.10.6633: Flags [P.], seq 2455:2580, ack 0, win 361, options [nop,nop,TS val 3923611 ecr 349065], length 125: OpenFlow
	version 1.0, type PACKET_IN, length 125, xid 0x00000000
18:05:55.041373 IP 192.168.1.30.40478 > 192.168.1.10.6633: Flags [P.], seq 2580:2705, ack 0, win 361, options [nop,nop,TS val 3923611 ecr 349065], length 125: OpenFlow
	version 1.0, type PACKET_IN, length 125, xid 0x00000000
18:05:55.041386 IP 192.168.1.30.40478 > 192.168.1.10.6633: Flags [P.], seq 2705:2830, ack 0, win 361, options [nop,nop,TS val 3923611 ecr 349065], length 125: OpenFlow
	version 1.0, type PACKET_IN, length 125, xid 0x00000000
18:05:55.041400 IP 192.168.1.30.40478 > 192.168.1.10.6633: Flags [P.], seq 2830:2955, ack 0, win 361, options [nop,nop,TS val 3923611 ecr 349065], length 125: OpenFlow
	version 1.0, type PACKET_IN, length 125, xid 0x00000000
18:05:55.041413 IP 192.168.1.30.40478 > 192.168.1.10.6633: Flags [P.], seq 2955:3080, ack 0, win 361, options [nop,nop,TS val 3923611 ecr 349065], length 125: OpenFlow
	version 1.0, type PACKET_IN, length 125, xid 0x00000000
18:05:55.041426 IP 192.168.1.30.40478 > 192.168.1.10.6633: Flags [P.], seq 3080:3205, ack 0, win 361, options [nop,nop,TS val 3923611 ecr 349065], length 125: OpenFlow
	version 1.0, type PACKET_IN, length 125, xid 0x00000000
18:05:55.041452 IP 192.168.1.30.40478 > 192.168.1.10.6633: Flags [P.], seq 3205:3330, ack 0, win 361, options [nop,nop,TS val 3923611 ecr 349065], length 125: OpenFlow
	version 1.0, type PACKET_IN, length 125, xid 0x00000000
18:05:55.041466 IP 192.168.1.30.40478 > 192.168.1.10.6633: Flags [P.], seq 3330:3455, ack 0, win 361, options [nop,nop,TS val 3923611 ecr 349065], length 125: OpenFlow
	version 1.0, type PACKET_IN, length 125, xid 0x00000000
18:05:55.041578 IP 192.168.1.30.40478 > 192.168.1.10.6633: Flags [P.], seq 3455:3580, ack 0, win 361, options [nop,nop,TS val 3923612 ecr 349065], length 125: OpenFlow
	version 1.0, type PACKET_IN, length 125, xid 0x00000000
18:05:55.041622 IP 192.168.1.30.40478 > 192.168.1.10.6633: Flags [P.], seq 3580:3705, ack 0, win 361, options [nop,nop,TS val 3923612 ecr 349065], length 125: OpenFlow
	version 1.0, type PACKET_IN, length 125, xid 0x00000000
18:05:55.041652 IP 192.168.1.30.40478 > 192.168.1.10.6633: Flags [P.], seq 3705:3830, ack 0, win 361, options [nop,nop,TS val 3923612 ecr 349065], length 125: OpenFlow
	version 1.0, type PACKET_IN, length 125, xid 0x00000000
18:05:55.041678 IP 192.168.1.30.40478 > 192.168.1.10.6633: Flags [P.], seq 3830:3955, ack 0, win 361, options [nop,nop,TS val 3923612 ecr 349065], length 125: OpenFlow
	version 1.0, type PACKET_IN, length 125, xid 0x00000000
18:05:55.065489 IP 192.168.1.30.40478 > 192.168.1.10.6633: Flags [.], seq 3955:5403, ack 0, win 361, options [nop,nop,TS val 3923618 ecr 349065], length 1448: OpenFlow
	version 1.0, type PACKET_IN, length 125, xid 0x00000000
	version 1.0, type PACKET_IN, length 125, xid 0x00000000
	version 1.0, type PACKET_IN, length 125, xid 0x00000000
	version 1.0, type PACKET_IN, length 125, xid 0x00000000
	version 1.0, type PACKET_IN, length 125, xid 0x00000000
	version 1.0, type PACKET_IN, length 125, xid 0x00000000
	version 1.0, type PACKET_IN, length 125, xid 0x00000000
	version 1.0, type PACKET_IN, length 125, xid 0x00000000
	version 1.0, type PACKET_IN, length 125, xid 0x00000000
	version 1.0, type PACKET_IN, length 125, xid 0x00000000
	version 1.0, type PACKET_IN, length 125, xid 0x00000000
	version 1.0, type PACKET_IN, length 125, xid 0x00000000 [|openflow]
18:05:55.071775 IP 192.168.1.10.6633 > 192.168.1.30.40478: Flags [.], ack 5403, win 11050, options [nop,nop,TS val 349073 ecr 3923607], length 0
18:05:55.071814 IP 192.168.1.30.40478 > 192.168.1.10.6633: Flags [.], seq 5403:6851, ack 0, win 361, options [nop,nop,TS val 3923619 ecr 349073], length 1448: OpenFlow
	version unknown (0xe9), type 0x14, length 59648, xid 0x35a58a00 [|openflow]
18:05:55.071822 IP 192.168.1.30.40478 > 192.168.1.10.6633: Flags [.], seq 6851:9747, ack 0, win 361, options [nop,nop,TS val 3923619 ecr 349073], length 2896: OpenFlow
	version unknown (0x00), type 0x00, length 64338, xid 0x69c7f318 [|openflow]
18:05:55.071831 IP 192.168.1.30.40478 > 192.168.1.10.6633: Flags [.], seq 9747:12643, ack 0, win 361, options [nop,nop,TS val 3923619 ecr 349073], length 2896: OpenFlow
	version unknown (0x00), type 0x00, length 0, xid 0x00005069 (corrupt)
18:05:55.071840 IP 192.168.1.30.40478 > 192.168.1.10.6633: Flags [.], seq 12643:15539, ack 0, win 361, options [nop,nop,TS val 3923619 ecr 349073], length 2896: OpenFlow
	version unknown (0x00), type 0x00, length 0, xid 0x00000000 (corrupt)
18:05:55.071848 IP 192.168.1.30.40478 > 192.168.1.10.6633: Flags [.], seq 15539:18435, ack 0, win 361, options [nop,nop,TS val 3923619 ecr 349073], length 2896: OpenFlow
	version unknown (0x00), type 0x02, length 0, xid 0x00000000 (corrupt)
18:05:55.071857 IP 192.168.1.30.40478 > 192.168.1.10.6633: Flags [.], seq 18435:21331, ack 0, win 361, options [nop,nop,TS val 3923619 ecr 349073], length 2896: OpenFlow
	version unknown (0x6f), type 0x63, length 24940, xid 0x00000c00 [|openflow]
18:05:55.071866 IP 192.168.1.30.40478 > 192.168.1.10.6633: Flags [.], seq 21331:24227, ack 0, win 361, options [nop,nop,TS val 3923619 ecr 349073], length 2896: OpenFlow
	version unknown (0x0a), type 0x00, length 32000, xid 0x000000ff [|openflow]
18:05:55.071874 IP 192.168.1.30.40478 > 192.168.1.10.6633: Flags [.], seq 24227:27123, ack 0, win 361, options [nop,nop,TS val 3923619 ecr 349073], length 2896: OpenFlow
	version unknown (0x00), type 0xfb, length 21097, xid 0xc7f318d1 [|openflow]
18:05:55.071883 IP 192.168.1.30.40478 > 192.168.1.10.6633: Flags [.], seq 27123:30019, ack 0, win 361, options [nop,nop,TS val 3923619 ecr 349073], length 2896: OpenFlow
	version unknown (0x00), type 0x00, length 0, xid 0x005069c7 (corrupt)
18:05:55.071893 IP 192.168.1.30.40478 > 192.168.1.10.6633: Flags [.], seq 30019:32915, ack 0, win 361, options [nop,nop,TS val 3923619 ecr 349073], length 2896: OpenFlow
	version unknown (0x00), type 0x00, length 0, xid 0x000000fb (corrupt)
18:05:55.071901 IP 192.168.1.30.40478 > 192.168.1.10.6633: Flags [.], seq 32915:35811, ack 0, win 361, options [nop,nop,TS val 3923619 ecr 349073], length 2896: OpenFlow
	version unknown (0x02), type 0x00, length 0, xid 0x00000005 (corrupt)
18:05:55.071910 IP 192.168.1.30.40478 > 192.168.1.10.6633: Flags [.], seq 35811:38707, ack 0, win 361, options [nop,nop,TS val 3923619 ecr 349073], length 2896: OpenFlow
	version unknown (0x63), type 0x61, length 27648, xid 0x000c0001 [|openflow]
18:05:55.071919 IP 192.168.1.30.40478 > 192.168.1.10.6633: Flags [.], seq 38707:41603, ack 0, win 361, options [nop,nop,TS val 3923619 ecr 349073], length 2896: OpenFlow
	version unknown (0x00), type 0x7d, length 0, xid 0x0000ffff (corrupt)
18:05:55.071927 IP 192.168.1.30.40478 > 192.168.1.10.6633: Flags [.], seq 41603:44499, ack 0, win 361, options [nop,nop,TS val 3923619 ecr 349073], length 2896: OpenFlow
	version unknown (0xfb), type 0x52, length 27079, xid 0xf318d186 [|openflow]
18:05:55.098225 IP 192.168.1.10.6633 > 192.168.1.30.40478: Flags [.], ack 44499, win 10811, options [nop,nop,TS val 349083 ecr 3923619], length 0
18:05:55.098997 IP 192.168.1.30.40478 > 192.168.1.10.6633: Flags [.], seq 44499:47395, ack 0, win 361, options [nop,nop,TS val 3923626 ecr 349083], length 2896: OpenFlow
	version unknown (0x00), type 0x00, length 0, xid 0x5069c7ff (corrupt)
18:05:55.099006 IP 192.168.1.30.40478 > 192.168.1.10.6633: Flags [.], seq 47395:50291, ack 0, win 361, options [nop,nop,TS val 3923626 ecr 349083], length 2896: OpenFlow
	version unknown (0x00), type 0x00, length 0, xid 0x0000fb14 (corrupt)
18:05:55.099015 IP 192.168.1.30.40478 > 192.168.1.10.6633: Flags [.], seq 50291:53187, ack 0, win 361, options [nop,nop,TS val 3923626 ecr 349083], length 2896: OpenFlow
	version unknown (0x00), type 0x00, length 0, xid 0x0000055f (corrupt)
18:05:55.099023 IP 192.168.1.30.40478 > 192.168.1.10.6633: Flags [.], seq 53187:56083, ack 0, win 361, options [nop,nop,TS val 3923626 ecr 349083], length 2896: OpenFlow
	version unknown (0x61), type 0x6c, length 0, xid 0x0c000104 (corrupt)
18:05:55.099031 IP 192.168.1.30.40478 > 192.168.1.10.6633: Flags [.], seq 56083:58979, ack 0, win 361, options [nop,nop,TS val 3923626 ecr 349083], length 2896: OpenFlow
	version unknown (0x7d), type 0x00, length 0, xid 0x00ffffff (corrupt)
18:05:55.099039 IP 192.168.1.30.40478 > 192.168.1.10.6633: Flags [.], seq 58979:61875, ack 0, win 361, options [nop,nop,TS val 3923626 ecr 349083], length 2896: OpenFlow
	version unknown (0x52), type 0x69, length 51187, xid 0x18d186dd [|openflow]
18:05:55.099047 IP 192.168.1.30.40478 > 192.168.1.10.6633: Flags [.], seq 61875:64771, ack 0, win 361, options [nop,nop,TS val 3923626 ecr 349083], length 2896: OpenFlow
	version unknown (0x00), type 0x00, length 80, xid 0x69c7fffe
	version 1.0, type PACKET_IN, length 125, xid 0x00000000
	version 1.0, type PACKET_IN, length 125, xid 0x00000000
	version 1.0, type PACKET_IN, length 125, xid 0x00000000
	version 1.0, type PACKET_IN, length 125, xid 0x00000000
	version 1.0, type PACKET_IN, length 125, xid 0x00000000
	version 1.0, type PACKET_IN, length 125, xid 0x00000000
	version 1.0, type PACKET_IN, length 125, xid 0x00000000
	version 1.0, type PACKET_IN, length 125, xid 0x00000000
	version 1.0, type PACKET_IN, length 125, xid 0x00000000
	version 1.0, type PACKET_IN, length 125, xid 0x00000000
	version 1.0, type PACKET_IN, length 125, xid 0x00000000
	version 1.0, type PACKET_IN, length 125, xid 0x00000000
	version 1.0, type PACKET_IN, length 125, xid 0x00000000
	version 1.0, type PACKET_IN, length 125, xid 0x00000000
	version 1.0, type PACKET_IN, length 125, xid 0x00000000
	version 1.0, type PACKET_IN, length 125, xid 0x00000000
	version 1.0, type PACKET_IN, length 125, xid 0x00000000
	version 1.0, type PACKET_IN, length 125, xid 0x00000000
	version 1.0, type PACKET_IN, length 125, xid 0x00000000
	version 1.0, type PACKET_IN, length 125, xid 0x00000000
	version 1.0, type PACKET_IN, length 125, xid 0x00000000
	version 1.0, type PACKET_IN, length 125, xid 0x00000000
	version 1.0, type PACKET_IN, length 125, xid 0x00000000 [|openflow]
18:05:55.099056 IP 192.168.1.30.40478 > 192.168.1.10.6633: Flags [.], seq 64771:66219, ack 0, win 361, options [nop,nop,TS val 3923626 ecr 349083], length 1448: OpenFlow
	version unknown (0x00), type 0x00, length 0, xid 0x00fb14e9 (corrupt)
18:05:55.099063 IP 192.168.1.30.40478 > 192.168.1.10.6633: Flags [P.], seq 66219:67455, ack 0, win 361, options [nop,nop,TS val 3923626 ecr 349083], length 1236: OpenFlow
	version unknown (0x00), type 0x01, length 256, xid 0x33330000
	version unknown (0x00), type 0x00, length 251, xid 0x5269c7f3
	version unknown (0x00), type 0x00, length 64338, xid 0x69c7f318 [|openflow]
18:05:55.137553 IP 192.168.1.30.40478 > 192.168.1.10.6633: Flags [P.], seq 66219:67455, ack 0, win 361, options [nop,nop,TS val 3923636 ecr 349083], length 1236: OpenFlow
	version unknown (0x00), type 0x01, length 256, xid 0x33330000
	version unknown (0x00), type 0x00, length 251, xid 0x5269c7f3
	version unknown (0x00), type 0x00, length 64338, xid 0x69c7f318 [|openflow]
18:05:55.138820 IP 192.168.1.10.6633 > 192.168.1.30.40478: Flags [.], ack 67455, win 10690, options [nop,nop,TS val 349094 ecr 3923626,nop,nop,sack 1 {66219:67455}], length 0
18:05:55.147511 IP 192.168.1.30.40478 > 192.168.1.10.6633: Flags [P.], seq 67455:67580, ack 0, win 361, options [nop,nop,TS val 3923638 ecr 349094], length 125: OpenFlow
	version 1.0, type PACKET_IN, length 125, xid 0x00000000
18:05:55.147562 IP 192.168.1.30.40478 > 192.168.1.10.6633: Flags [P.], seq 67580:67705, ack 0, win 361, options [nop,nop,TS val 3923638 ecr 349094], length 125: OpenFlow
	version 1.0, type PACKET_IN, length 125, xid 0x00000000
18:05:55.147589 IP 192.168.1.30.40478 > 192.168.1.10.6633: Flags [P.], seq 67705:67830, ack 0, win 361, options [nop,nop,TS val 3923638 ecr 349094], length 125: OpenFlow
	version 1.0, type PACKET_IN, length 125, xid 0x00000000
18:05:55.147616 IP 192.168.1.30.40478 > 192.168.1.10.6633: Flags [P.], seq 67830:67955, ack 0, win 361, options [nop,nop,TS val 3923638 ecr 349094], length 125: OpenFlow
	version 1.0, type PACKET_IN, length 125, xid 0x00000000
18:05:55.147642 IP 192.168.1.30.40478 > 192.168.1.10.6633: Flags [P.], seq 67955:68080, ack 0, win 361, options [nop,nop,TS val 3923638 ecr 349094], length 125: OpenFlow
	version 1.0, type PACKET_IN, length 125, xid 0x00000000
18:05:55.147740 IP 192.168.1.30.40478 > 192.168.1.10.6633: Flags [P.], seq 68080:68205, ack 0, win 361, options [nop,nop,TS val 3923638 ecr 349094], length 125: OpenFlow
	version 1.0, type PACKET_IN, length 125, xid 0x00000000
18:05:55.147772 IP 192.168.1.30.40478 > 192.168.1.10.6633: Flags [P.], seq 68205:68330, ack 0, win 361, options [nop,nop,TS val 3923638 ecr 349094], length 125: OpenFlow
	version 1.0, type PACKET_IN, length 125, xid 0x00000000
18:05:55.147803 IP 192.168.1.30.40478 > 192.168.1.10.6633: Flags [P.], seq 68330:68455, ack 0, win 361, options [nop,nop,TS val 3923638 ecr 349094], length 125: OpenFlow
	version 1.0, type PACKET_IN, length 125, xid 0x00000000
18:05:55.148064 IP 192.168.1.30.40478 > 192.168.1.10.6633: Flags [P.], seq 68455:68580, ack 0, win 361, options [nop,nop,TS val 3923638 ecr 349094], length 125: OpenFlow
	version 1.0, type PACKET_IN, length 125, xid 0x00000000
18:05:55.148252 IP 192.168.1.30.40478 > 192.168.1.10.6633: Flags [P.], seq 68580:68705, ack 0, win 361, options [nop,nop,TS val 3923638 ecr 349094], length 125: OpenFlow
	version 1.0, type PACKET_IN, length 125, xid 0x00000000
18:05:55.148672 IP 192.168.1.10.6633 > 192.168.1.30.40478: Flags [.], ack 67580, win 10690, options [nop,nop,TS val 349096 ecr 3923638], length 0
18:05:55.148684 IP 192.168.1.10.6633 > 192.168.1.30.40478: Flags [.], ack 67705, win 10690, options [nop,nop,TS val 349096 ecr 3923638], length 0
18:05:55.148692 IP 192.168.1.10.6633 > 192.168.1.30.40478: Flags [.], ack 67830, win 10690, options [nop,nop,TS val 349096 ecr 3923638], length 0
18:05:55.148700 IP 192.168.1.10.6633 > 192.168.1.30.40478: Flags [.], ack 67955, win 10690, options [nop,nop,TS val 349096 ecr 3923638], length 0
18:05:55.148709 IP 192.168.1.10.6633 > 192.168.1.30.40478: Flags [.], ack 68080, win 10690, options [nop,nop,TS val 349096 ecr 3923638], length 0
18:05:55.148818 IP 192.168.1.10.6633 > 192.168.1.30.40478: Flags [.], ack 68205, win 10690, options [nop,nop,TS val 349096 ecr 3923638], length 0
18:05:55.148827 IP 192.168.1.10.6633 > 192.168.1.30.40478: Flags [.], ack 68330, win 10690, options [nop,nop,TS val 349096 ecr 3923638], length 0
18:05:55.148847 IP 192.168.1.10.6633 > 192.168.1.30.40478: Flags [.], ack 68455, win 10690, options [nop,nop,TS val 349096 ecr 3923638], length 0
18:05:55.148862 IP 192.168.1.10.6633 > 192.168.1.30.40478: Flags [.], ack 68580, win 10690, options [nop,nop,TS val 349096 ecr 3923638], length 0
18:05:55.148985 IP 192.168.1.30.40478 > 192.168.1.10.6633: Flags [P.], seq 68705:68830, ack 0, win 361, options [nop,nop,TS val 3923638 ecr 349096], length 125: OpenFlow
	version 1.0, type PACKET_IN, length 125, xid 0x00000000
18:05:55.149000 IP 192.168.1.30.40478 > 192.168.1.10.6633: Flags [P.], seq 68830:68955, ack 0, win 361, options [nop,nop,TS val 3923638 ecr 349096], length 125: OpenFlow
	version 1.0, type PACKET_IN, length 125, xid 0x00000000
18:05:55.149031 IP 192.168.1.30.40478 > 192.168.1.10.6633: Flags [P.], seq 68955:69080, ack 0, win 361, options [nop,nop,TS val 3923638 ecr 349096], length 125: OpenFlow
	version 1.0, type PACKET_IN, length 125, xid 0x00000000
18:05:55.149059 IP 192.168.1.30.40478 > 192.168.1.10.6633: Flags [P.], seq 69080:69205, ack 0, win 361, options [nop,nop,TS val 3923638 ecr 349096], length 125: OpenFlow
	version 1.0, type PACKET_IN, length 125, xid 0x00000000
18:05:55.149089 IP 192.168.1.30.40478 > 192.168.1.10.6633: Flags [P.], seq 69205:69330, ack 0, win 361, options [nop,nop,TS val 3923638 ecr 349096], length 125: OpenFlow
	version 1.0, type PACKET_IN, length 125, xid 0x00000000
18:05:55.149119 IP 192.168.1.30.40478 > 192.168.1.10.6633: Flags [P.], seq 69330:69455, ack 0, win 361, options [nop,nop,TS val 3923638 ecr 349096], length 125: OpenFlow
	version 1.0, type PACKET_IN, length 125, xid 0x00000000
18:05:55.149146 IP 192.168.1.30.40478 > 192.168.1.10.6633: Flags [P.], seq 69455:69580, ack 0, win 361, options [nop,nop,TS val 3923638 ecr 349096], length 125: OpenFlow
	version 1.0, type PACKET_IN, length 125, xid 0x00000000
18:05:55.149172 IP 192.168.1.30.40478 > 192.168.1.10.6633: Flags [P.], seq 69580:69705, ack 0, win 361, options [nop,nop,TS val 3923638 ecr 349096], length 125: OpenFlow
	version 1.0, type PACKET_IN, length 125, xid 0x00000000
18:05:55.149199 IP 192.168.1.30.40478 > 192.168.1.10.6633: Flags [P.], seq 69705:69830, ack 0, win 361, options [nop,nop,TS val 3923638 ecr 349096], length 125: OpenFlow
	version 1.0, type PACKET_IN, length 125, xid 0x00000000
18:05:55.149226 IP 192.168.1.30.40478 > 192.168.1.10.6633: Flags [P.], seq 69830:69955, ack 0, win 361, options [nop,nop,TS val 3923638 ecr 349096], length 125: OpenFlow
	version 1.0, type PACKET_IN, length 125, xid 0x00000000
18:05:55.149253 IP 192.168.1.30.40478 > 192.168.1.10.6633: Flags [P.], seq 69955:70080, ack 0, win 361, options [nop,nop,TS val 3923638 ecr 349096], length 125: OpenFlow
	version 1.0, type PACKET_IN, length 125, xid 0x00000000
18:05:55.149279 IP 192.168.1.30.40478 > 192.168.1.10.6633: Flags [P.], seq 70080:70205, ack 0, win 361, options [nop,nop,TS val 3923638 ecr 349096], length 125: OpenFlow
	version 1.0, type PACKET_IN, length 125, xid 0x00000000
18:05:55.149305 IP 192.168.1.30.40478 > 192.168.1.10.6633: Flags [P.], seq 70205:70330, ack 0, win 361, options [nop,nop,TS val 3923638 ecr 349096], length 125: OpenFlow
	version 1.0, type PACKET_IN, length 125, xid 0x00000000
18:05:55.149333 IP 192.168.1.30.40478 > 192.168.1.10.6633: Flags [P.], seq 70330:70455, ack 0, win 361, options [nop,nop,TS val 3923638 ecr 349096], length 125: OpenFlow
	version 1.0, type PACKET_IN, length 125, xid 0x00000000
18:05:55.149359 IP 192.168.1.30.40478 > 192.168.1.10.6633: Flags [P.], seq 70455:70580, ack 0, win 361, options [nop,nop,TS val 3923638 ecr 349096], length 125: OpenFlow
	version 1.0, type PACKET_IN, length 125, xid 0x00000000
18:05:55.149385 IP 192.168.1.30.40478 > 192.168.1.10.6633: Flags [P.], seq 70580:70705, ack 0, win 361, options [nop,nop,TS val 3923638 ecr 349096], length 125: OpenFlow
	version 1.0, type PACKET_IN, length 125, xid 0x00000000
18:05:55.149414 IP 192.168.1.30.40478 > 192.168.1.10.6633: Flags [P.], seq 70705:70830, ack 0, win 361, options [nop,nop,TS val 3923638 ecr 349096], length 125: OpenFlow
	version 1.0, type PACKET_IN, length 125, xid 0x00000000
18:05:55.149444 IP 192.168.1.30.40478 > 192.168.1.10.6633: Flags [P.], seq 70830:70955, ack 0, win 361, options [nop,nop,TS val 3923638 ecr 349096], length 125: OpenFlow
	version 1.0, type PACKET_IN, length 125, xid 0x00000000
18:05:55.150042 IP 192.168.1.10.6633 > 192.168.1.30.40478: Flags [.], ack 68705, win 10690, options [nop,nop,TS val 349096 ecr 3923638], length 0
18:05:55.150055 IP 192.168.1.30.40478 > 192.168.1.10.6633: Flags [.], seq 70955:73851, ack 0, win 361, options [nop,nop,TS val 3923639 ecr 349096], length 2896: OpenFlow
	version 1.0, type PACKET_IN, length 125, xid 0x00000000
	version 1.0, type PACKET_IN, length 125, xid 0x00000000
	version 1.0, type PACKET_IN, length 125, xid 0x00000000
	version 1.0, type PACKET_IN, length 125, xid 0x00000000
	version 1.0, type PACKET_IN, length 125, xid 0x00000000
	version 1.0, type PACKET_IN, length 125, xid 0x00000000
	version 1.0, type PACKET_IN, length 125, xid 0x00000000
	version 1.0, type PACKET_IN, length 125, xid 0x00000000
	version 1.0, type PACKET_IN, length 125, xid 0x00000000
	version 1.0, type PACKET_IN, length 125, xid 0x00000000
	version 1.0, type PACKET_IN, length 125, xid 0x00000000
	version 1.0, type PACKET_IN, length 125, xid 0x00000000
	version 1.0, type PACKET_IN, length 125, xid 0x00000000
	version 1.0, type PACKET_IN, length 125, xid 0x00000000
	version 1.0, type PACKET_IN, length 125, xid 0x00000000
	version 1.0, type PACKET_IN, length 125, xid 0x00000000
	version 1.0, type PACKET_IN, length 125, xid 0x00000000
	version 1.0, type PACKET_IN, length 125, xid 0x00000000
	version 1.0, type PACKET_IN, length 125, xid 0x00000000
	version 1.0, type PACKET_IN, length 125, xid 0x00000000
	version 1.0, type PACKET_IN, length 125, xid 0x00000000
	version 1.0, type PACKET_IN, length 125, xid 0x00000000
	version 1.0, type PACKET_IN, length 125, xid 0x00000000
	version 1.0, type PACKET_IN, length 125, xid 0x00000000 [|openflow]
18:05:55.150162 IP 192.168.1.10.6633 > 192.168.1.30.40478: Flags [.], ack 68830, win 10690, options [nop,nop,TS val 349096 ecr 3923638], length 0
18:05:55.150172 IP 192.168.1.10.6633 > 192.168.1.30.40478: Flags [.], ack 68955, win 10690, options [nop,nop,TS val 349096 ecr 3923638], length 0
18:05:55.150181 IP 192.168.1.10.6633 > 192.168.1.30.40478: Flags [.], ack 69080, win 10690, options [nop,nop,TS val 349096 ecr 3923638], length 0
18:05:55.150190 IP 192.168.1.10.6633 > 192.168.1.30.40478: Flags [.], ack 69205, win 10690, options [nop,nop,TS val 349096 ecr 3923638], length 0
18:05:55.150196 IP 192.168.1.10.6633 > 192.168.1.30.40478: Flags [.], ack 69330, win 10690, options [nop,nop,TS val 349096 ecr 3923638], length 0
18:05:55.150400 IP 192.168.1.30.40478 > 192.168.1.10.6633: Flags [.], seq 73851:76747, ack 0, win 361, options [nop,nop,TS val 3923639 ecr 349096], length 2896: OpenFlow
	version unknown (0x00), type 0x00, length 64338, xid 0x69c7f318 [|openflow]
18:05:55.150411 IP 192.168.1.30.40478 > 192.168.1.10.6633: Flags [.], seq 76747:79643, ack 0, win 361, options [nop,nop,TS val 3923639 ecr 349096], length 2896: OpenFlow
	version unknown (0x00), type 0x00, length 0, xid 0x00005069 (corrupt)
18:05:55.150420 IP 192.168.1.30.40478 > 192.168.1.10.6633: Flags [P.], seq 79643:80705, ack 0, win 361, options [nop,nop,TS val 3923639 ecr 349096], length 1062: OpenFlow
	version unknown (0x00), type 0x00, length 0, xid 0x00000000 (corrupt)
18:05:55.150428 IP 192.168.1.30.40478 > 192.168.1.10.6633: Flags [P.], seq 80705:80830, ack 0, win 361, options [nop,nop,TS val 3923639 ecr 349096], length 125: OpenFlow
	version 1.0, type PACKET_IN, length 125, xid 0x00000000
18:05:55.165654 IP 192.168.1.30.40478 > 192.168.1.10.6633: Flags [.], seq 80830:82278, ack 0, win 361, options [nop,nop,TS val 3923643 ecr 349096], length 1448: OpenFlow
	version 1.0, type PACKET_IN, length 125, xid 0x00000000
	version 1.0, type PACKET_IN, length 125, xid 0x00000000
	version 1.0, type PACKET_IN, length 125, xid 0x00000000
	version 1.0, type PACKET_IN, length 125, xid 0x00000000
	version 1.0, type PACKET_IN, length 125, xid 0x00000000
	version 1.0, type PACKET_IN, length 125, xid 0x00000000
	version 1.0, type PACKET_IN, length 125, xid 0x00000000
	version 1.0, type PACKET_IN, length 125, xid 0x00000000
	version 1.0, type PACKET_IN, length 125, xid 0x00000000
	version 1.0, type PACKET_IN, length 125, xid 0x00000000
	version 1.0, type PACKET_IN, length 125, xid 0x00000000
	version 1.0, type PACKET_IN, length 125, xid 0x00000000 [|openflow]
18:05:55.176784 IP 192.168.1.10.6633 > 192.168.1.30.40478: Flags [.], ack 82278, win 10623, options [nop,nop,TS val 349103 ecr 3923638], length 0
18:05:55.176823 IP 192.168.1.30.40478 > 192.168.1.10.6633: Flags [.], seq 82278:83726, ack 0, win 361, options [nop,nop,TS val 3923645 ecr 349103], length 1448: OpenFlow
	version unknown (0xe9), type 0x14, length 59648, xid 0x35a58a00 [|openflow]
18:05:55.176832 IP 192.168.1.30.40478 > 192.168.1.10.6633: Flags [.], seq 83726:86622, ack 0, win 361, options [nop,nop,TS val 3923645 ecr 349103], length 2896: OpenFlow
	version unknown (0x00), type 0x00, length 64338, xid 0x69c7f318 [|openflow]
18:05:55.176840 IP 192.168.1.30.40478 > 192.168.1.10.6633: Flags [.], seq 86622:89518, ack 0, win 361, options [nop,nop,TS val 3923645 ecr 349103], length 2896: OpenFlow
	version unknown (0x00), type 0x00, length 0, xid 0x00005069 (corrupt)
18:05:55.176849 IP 192.168.1.30.40478 > 192.168.1.10.6633: Flags [.], seq 89518:92414, ack 0, win 361, options [nop,nop,TS val 3923645 ecr 349103], length 2896: OpenFlow
	version unknown (0x00), type 0x00, length 0, xid 0x00000000 (corrupt)
18:05:55.176858 IP 192.168.1.30.40478 > 192.168.1.10.6633: Flags [.], seq 92414:95310, ack 0, win 361, options [nop,nop,TS val 3923645 ecr 349103], length 2896: OpenFlow
	version unknown (0x00), type 0x02, length 0, xid 0x00000000 (corrupt)
18:05:55.176867 IP 192.168.1.30.40478 > 192.168.1.10.6633: Flags [.], seq 95310:98206, ack 0, win 361, options [nop,nop,TS val 3923645 ecr 349103], length 2896: OpenFlow
	version unknown (0x6f), type 0x63, length 24940, xid 0x00000c00 [|openflow]
18:05:55.176875 IP 192.168.1.30.40478 > 192.168.1.10.6633: Flags [.], seq 98206:101102, ack 0, win 361, options [nop,nop,TS val 3923645 ecr 349103], length 2896: OpenFlow
	version unknown (0x0a), type 0x00, length 32000, xid 0x000000ff [|openflow]
18:05:55.176883 IP 192.168.1.30.40478 > 192.168.1.10.6633: Flags [.], seq 101102:103998, ack 0, win 361, options [nop,nop,TS val 3923645 ecr 349103], length 2896: OpenFlow
	version unknown (0x00), type 0xfb, length 21097, xid 0xc7f318d1 [|openflow]
18:05:55.176892 IP 192.168.1.30.40478 > 192.168.1.10.6633: Flags [.], seq 103998:106894, ack 0, win 361, options [nop,nop,TS val 3923645 ecr 349103], length 2896: OpenFlow
	version unknown (0x00), type 0x00, length 0, xid 0x005069c7 (corrupt)
18:05:55.176912 IP 192.168.1.30.40478 > 192.168.1.10.6633: Flags [.], seq 106894:109790, ack 0, win 361, options [nop,nop,TS val 3923645 ecr 349103], length 2896: OpenFlow
	version unknown (0x00), type 0x00, length 0, xid 0x000000fb (corrupt)
18:05:55.176919 IP 192.168.1.30.40478 > 192.168.1.10.6633: Flags [.], seq 109790:112686, ack 0, win 361, options [nop,nop,TS val 3923645 ecr 349103], length 2896: OpenFlow
	version unknown (0x02), type 0x00, length 0, xid 0x00000005 (corrupt)
18:05:55.177585 IP 192.168.1.10.6633 > 192.168.1.30.40478: Flags [.], ack 112686, win 10646, options [nop,nop,TS val 349104 ecr 3923645], length 0
18:05:55.177611 IP 192.168.1.30.40478 > 192.168.1.10.6633: Flags [.], seq 112686:115582, ack 0, win 361, options [nop,nop,TS val 3923646 ecr 349104], length 2896: OpenFlow
	version unknown (0x63), type 0x61, length 27648, xid 0x000c0001 [|openflow]
18:05:55.177770 IP 192.168.1.30.40478 > 192.168.1.10.6633: Flags [.], seq 115582:118478, ack 0, win 361, options [nop,nop,TS val 3923646 ecr 349104], length 2896: OpenFlow
	version unknown (0x00), type 0x7d, length 0, xid 0x0000ffff (corrupt)
18:05:55.177781 IP 192.168.1.30.40478 > 192.168.1.10.6633: Flags [.], seq 118478:121374, ack 0, win 361, options [nop,nop,TS val 3923646 ecr 349104], length 2896: OpenFlow
	version unknown (0xfb), type 0x52, length 27079, xid 0xf318d186 [|openflow]
18:05:55.177791 IP 192.168.1.30.40478 > 192.168.1.10.6633: Flags [.], seq 121374:124270, ack 0, win 361, options [nop,nop,TS val 3923646 ecr 349104], length 2896: OpenFlow
	version unknown (0x00), type 0x00, length 0, xid 0x5069c7ff (corrupt)
18:05:55.177801 IP 192.168.1.30.40478 > 192.168.1.10.6633: Flags [.], seq 124270:127166, ack 0, win 361, options [nop,nop,TS val 3923646 ecr 349104], length 2896: OpenFlow
	version unknown (0x00), type 0x00, length 0, xid 0x0000fb14 (corrupt)
18:05:55.177818 IP 192.168.1.30.40478 > 192.168.1.10.6633: Flags [.], seq 127166:130062, ack 0, win 361, options [nop,nop,TS val 3923646 ecr 349104], length 2896: OpenFlow
	version unknown (0x00), type 0x00, length 0, xid 0x0000055f (corrupt)
18:05:55.177829 IP 192.168.1.30.40478 > 192.168.1.10.6633: Flags [.], seq 130062:132958, ack 0, win 361, options [nop,nop,TS val 3923646 ecr 349104], length 2896: OpenFlow
	version unknown (0x61), type 0x6c, length 0, xid 0x0c000104 (corrupt)
18:05:55.177840 IP 192.168.1.30.40478 > 192.168.1.10.6633: Flags [.], seq 132958:135854, ack 0, win 361, options [nop,nop,TS val 3923646 ecr 349104], length 2896: OpenFlow
	version unknown (0x7d), type 0x00, length 0, xid 0x00ffffff (corrupt)
18:05:55.177851 IP 192.168.1.30.40478 > 192.168.1.10.6633: Flags [.], seq 135854:138750, ack 0, win 361, options [nop,nop,TS val 3923646 ecr 349104], length 2896: OpenFlow
	version unknown (0x52), type 0x69, length 51187, xid 0x18d186dd [|openflow]
18:05:55.177863 IP 192.168.1.30.40478 > 192.168.1.10.6633: Flags [.], seq 138750:141646, ack 0, win 361, options [nop,nop,TS val 3923646 ecr 349104], length 2896: OpenFlow
	version unknown (0x00), type 0x00, length 80, xid 0x69c7fffe
	version 1.0, type PACKET_IN, length 125, xid 0x00000000
	version 1.0, type PACKET_IN, length 125, xid 0x00000000
	version 1.0, type PACKET_IN, length 125, xid 0x00000000
	version 1.0, type PACKET_IN, length 125, xid 0x00000000
	version 1.0, type PACKET_IN, length 125, xid 0x00000000
	version 1.0, type PACKET_IN, length 125, xid 0x00000000
	version 1.0, type PACKET_IN, length 125, xid 0x00000000
	version 1.0, type PACKET_IN, length 125, xid 0x00000000
	version 1.0, type PACKET_IN, length 125, xid 0x00000000
	version 1.0, type PACKET_IN, length 125, xid 0x00000000
	version 1.0, type PACKET_IN, length 125, xid 0x00000000
	version 1.0, type PACKET_IN, length 125, xid 0x00000000
	version 1.0, type PACKET_IN, length 125, xid 0x00000000
	version 1.0, type PACKET_IN, length 125, xid 0x00000000
	version 1.0, type PACKET_IN, length 125, xid 0x00000000
	version 1.0, type PACKET_IN, length 125, xid 0x00000000
	version 1.0, type PACKET_IN, length 125, xid 0x00000000
	version 1.0, type PACKET_IN, length 125, xid 0x00000000
	version 1.0, type PACKET_IN, length 125, xid 0x00000000
	version 1.0, type PACKET_IN, length 125, xid 0x00000000
	version 1.0, type PACKET_IN, length 125, xid 0x00000000
	version 1.0, type PACKET_IN, length 125, xid 0x00000000
	version 1.0, type PACKET_IN, length 125, xid 0x00000000 [|openflow]
18:05:55.179611 IP 192.168.1.10.6633 > 192.168.1.30.40478: Flags [.], ack 141646, win 10785, options [nop,nop,TS val 349104 ecr 3923646], length 0
18:05:55.179638 IP 192.168.1.30.40478 > 192.168.1.10.6633: Flags [.], seq 141646:144542, ack 0, win 361, options [nop,nop,TS val 3923646 ecr 349104], length 2896: OpenFlow
	version unknown (0x00), type 0x00, length 0, xid 0x00fb14e9 (corrupt)
18:05:55.179652 IP 192.168.1.30.40478 > 192.168.1.10.6633: Flags [.], seq 144542:147438, ack 0, win 361, options [nop,nop,TS val 3923646 ecr 349104], length 2896: OpenFlow
	version unknown (0x00), type 0x00, length 0, xid 0x00055f69 (corrupt)
18:05:55.179663 IP 192.168.1.30.40478 > 192.168.1.10.6633: Flags [.], seq 147438:150334, ack 0, win 361, options [nop,nop,TS val 3923646 ecr 349104], length 2896: OpenFlow
	version unknown (0x6c), type 0x00, length 12, xid 0x0001045f
	version unknown (0x12), type 0x00, length 3072, xid 0x01010a00 [|openflow]
18:05:55.179674 IP 192.168.1.30.40478 > 192.168.1.10.6633: Flags [.], seq 150334:153230, ack 0, win 361, options [nop,nop,TS val 3923646 ecr 349104], length 2896: OpenFlow
	version unknown (0x00), type 0x00, length 0, xid 0xffffffff (corrupt)
18:05:55.179684 IP 192.168.1.30.40478 > 192.168.1.10.6633: Flags [.], seq 153230:156126, ack 0, win 361, options [nop,nop,TS val 3923646 ecr 349104], length 2896: OpenFlow
	version unknown (0x69), type 0xc7, length 62232, xid 0xd186dd60 [|openflow]
18:05:55.179695 IP 192.168.1.30.40478 > 192.168.1.10.6633: Flags [.], seq 156126:159022, ack 0, win 361, options [nop,nop,TS val 3923646 ecr 349104], length 2896: OpenFlow
	version unknown (0x00), type 0x00, length 20585, xid 0xc7fffef3 [|openflow]
18:05:55.179706 IP 192.168.1.30.40478 > 192.168.1.10.6633: Flags [.], seq 159022:161918, ack 0, win 361, options [nop,nop,TS val 3923646 ecr 349104], length 2896: OpenFlow
	version unknown (0x00), type 0x00, length 0, xid 0xfb14e914 (corrupt)
18:05:55.179717 IP 192.168.1.30.40478 > 192.168.1.10.6633: Flags [.], seq 161918:164814, ack 0, win 361, options [nop,nop,TS val 3923646 ecr 349104], length 2896: OpenFlow
	version unknown (0x00), type 0x00, length 0, xid 0x055f6970 (corrupt)
18:05:55.179727 IP 192.168.1.30.40478 > 192.168.1.10.6633: Flags [.], seq 164814:167710, ack 0, win 361, options [nop,nop,TS val 3923646 ecr 349104], length 2896: OpenFlow
	version unknown (0x00), type 0x00, length 3072, xid 0x01045f69 [|openflow]
18:05:55.179737 IP 192.168.1.30.40478 > 192.168.1.10.6633: Flags [.], seq 167710:170606, ack 0, win 361, options [nop,nop,TS val 3923646 ecr 349104], length 2896: OpenFlow
	version unknown (0x00), type 0x00, length 255, xid 0xffffff00
	version unknown (0xff), type 0xff, length 107, xid 0x00010100
	version unknown (0x70), type 0x70, length 49170, xid 0x000c0001 [|openflow]
18:05:55.180252 IP 192.168.1.10.6633 > 192.168.1.30.40478: Flags [.], ack 170606, win 10837, options [nop,nop,TS val 349104 ecr 3923646], length 0
18:05:55.180328 IP 192.168.1.30.40478 > 192.168.1.10.6633: Flags [.], seq 170606:173502, ack 0, win 361, options [nop,nop,TS val 3923646 ecr 349104], length 2896: OpenFlow
	version unknown (0xc7), type 0xf3, length 6353, xid 0x86dd6000 [|openflow]
18:05:55.180341 IP 192.168.1.30.40478 > 192.168.1.10.6633: Flags [P.], seq 173502:174330, ack 0, win 361, options [nop,nop,TS val 3923646 ecr 349104], length 828: OpenFlow
	version unknown (0x00), type 0x50, length 27079, xid 0xfffef318 [|openflow]
18:05:55.180771 IP 192.168.1.10.6633 > 192.168.1.30.40478: Flags [.], ack 174330, win 11062, options [nop,nop,TS val 349104 ecr 3923646], length 0
18:05:55.345444 IP 192.168.1.30.40478 > 192.168.1.10.6633: Flags [P.], seq 174330:174455, ack 0, win 361, options [nop,nop,TS val 3923687 ecr 349104], length 125: OpenFlow
	version 1.0, type PACKET_IN, length 125, xid 0x00000000
18:05:55.345492 IP 192.168.1.30.40478 > 192.168.1.10.6633: Flags [P.], seq 174455:174580, ack 0, win 361, options [nop,nop,TS val 3923688 ecr 349104], length 125: OpenFlow
	version 1.0, type PACKET_IN, length 125, xid 0x00000000
18:05:55.345522 IP 192.168.1.30.40478 > 192.168.1.10.6633: Flags [P.], seq 174580:174705, ack 0, win 361, options [nop,nop,TS val 3923688 ecr 349104], length 125: OpenFlow
	version 1.0, type PACKET_IN, length 125, xid 0x00000000
18:05:55.345551 IP 192.168.1.30.40478 > 192.168.1.10.6633: Flags [P.], seq 174705:174830, ack 0, win 361, options [nop,nop,TS val 3923688 ecr 349104], length 125: OpenFlow
	version 1.0, type PACKET_IN, length 125, xid 0x00000000
18:05:55.345580 IP 192.168.1.30.40478 > 192.168.1.10.6633: Flags [P.], seq 174830:174955, ack 0, win 361, options [nop,nop,TS val 3923688 ecr 349104], length 125: OpenFlow
	version 1.0, type PACKET_IN, length 125, xid 0x00000000
18:05:55.345609 IP 192.168.1.30.40478 > 192.168.1.10.6633: Flags [P.], seq 174955:175080, ack 0, win 361, options [nop,nop,TS val 3923688 ecr 349104], length 125: OpenFlow
	version 1.0, type PACKET_IN, length 125, xid 0x00000000
18:05:55.345638 IP 192.168.1.30.40478 > 192.168.1.10.6633: Flags [P.], seq 175080:175205, ack 0, win 361, options [nop,nop,TS val 3923688 ecr 349104], length 125: OpenFlow
	version 1.0, type PACKET_IN, length 125, xid 0x00000000
18:05:55.345666 IP 192.168.1.30.40478 > 192.168.1.10.6633: Flags [P.], seq 175205:175330, ack 0, win 361, options [nop,nop,TS val 3923688 ecr 349104], length 125: OpenFlow
	version 1.0, type PACKET_IN, length 125, xid 0x00000000
18:05:55.345686 IP 192.168.1.10.6633 > 192.168.1.30.40478: Flags [.], ack 174455, win 11268, options [nop,nop,TS val 349146 ecr 3923687], length 0
18:05:55.345695 IP 192.168.1.30.40478 > 192.168.1.10.6633: Flags [P.], seq 175330:175455, ack 0, win 361, options [nop,nop,TS val 3923688 ecr 349104], length 125: OpenFlow
	version 1.0, type PACKET_IN, length 125, xid 0x00000000
18:05:55.345725 IP 192.168.1.30.40478 > 192.168.1.10.6633: Flags [P.], seq 175455:175580, ack 0, win 361, options [nop,nop,TS val 3923688 ecr 349146], length 125: OpenFlow
	version 1.0, type PACKET_IN, length 125, xid 0x00000000
