18:05:54.997796 IP 192.168.1.30.40493 > 192.168.1.10.6633: Flags [P.], seq 2268346679:2268346804, ack 2084104389, win 361, options [nop,nop,TS val 3923601 ecr 349036], length 125: OpenFlow
	version 1.0, type PACKET_IN, length 125, xid 0x00000000
18:05:54.997840 IP 192.168.1.30.40493 > 192.168.1.10.6633: Flags [P.], seq 125:250, ack 1, win 361, options [nop,nop,TS val 3923601 ecr 349036], length 125: OpenFlow
	version 1.0, type PACKET_IN, length 125, xid 0x00000000
18:05:54.997863 IP 192.168.1.30.40493 > 192.168.1.10.6633: Flags [P.], seq 250:375, ack 1, win 361, options [nop,nop,TS val 3923601 ecr 349036], length 125: OpenFlow
	version 1.0, type PACKET_IN, length 125, xid 0x00000000
18:05:54.997881 IP 192.168.1.30.40493 > 192.168.1.10.6633: Flags [P.], seq 375:500, ack 1, win 361, options [nop,nop,TS val 3923601 ecr 349036], length 125: OpenFlow
	version 1.0, type PACKET_IN, length 125, xid 0x00000000
18:05:54.997899 IP 192.168.1.30.40493 > 192.168.1.10.6633: Flags [P.], seq 500:625, ack 1, win 361, options [nop,nop,TS val 3923601 ecr 349036], length 125: OpenFlow
	version 1.0, type PACKET_IN, length 125, xid 0x00000000
18:05:54.997918 IP 192.168.1.30.40493 > 192.168.1.10.6633: Flags [P.], seq 625:750, ack 1, win 361, options [nop,nop,TS val 3923601 ecr 349036], length 125: OpenFlow
	version 1.0, type PACKET_IN, length 125, xid 0x00000000
18:05:54.997936 IP 192.168.1.30.40493 > 192.168.1.10.6633: Flags [P.], seq 750:875, ack 1, win 361, options [nop,nop,TS val 3923601 ecr 349036], length 125: OpenFlow
	version 1.0, type PACKET_IN, length 125, xid 0x00000000
18:05:54.997954 IP 192.168.1.30.40493 > 192.168.1.10.6633: Flags [P.], seq 875:1000, ack 1, win 361, options [nop,nop,TS val 3923601 ecr 349036], length 125: OpenFlow
	version 1.0, type PACKET_IN, length 125, xid 0x00000000
18:05:54.997989 IP 192.168.1.30.40493 > 192.168.1.10.6633: Flags [P.], seq 1000:1125, ack 1, win 361, options [nop,nop,TS val 3923601 ecr 349036], length 125: OpenFlow
	version 1.0, type PACKET_IN, length 125, xid 0x00000000
18:05:54.998008 IP 192.168.1.30.40493 > 192.168.1.10.6633: Flags [P.], seq 1125:1250, ack 1, win 361, options [nop,nop,TS val 3923601 ecr 349036], length 125: OpenFlow
	version 1.0, type PACKET_IN, length 125, xid 0x00000000
18:05:54.998028 IP 192.168.1.30.40493 > 192.168.1.10.6633: Flags [P.], seq 1250:1375, ack 1, win 361, options [nop,nop,TS val 3923601 ecr 349036], length 125: OpenFlow
	version 1.0, type PACKET_IN, length 125, xid 0x00000000
18:05:54.998047 IP 192.168.1.30.40493 > 192.168.1.10.6633: Flags [P.], seq 1375:1500, ack 1, win 361, options [nop,nop,TS val 3923601 ecr 349036], length 125: OpenFlow
	version 1.0, type PACKET_IN, length 125, xid 0x00000000
18:05:54.998067 IP 192.168.1.30.40493 > 192.168.1.10.6633: Flags [P.], seq 1500:1625, ack 1, win 361, options [nop,nop,TS val 3923601 ecr 349036], length 125: OpenFlow
	version 1.0, type PACKET_IN, length 125, xid 0x00000000
18:05:54.998177 IP 192.168.1.30.40493 > 192.168.1.10.6633: Flags [P.], seq 1625:1750, ack 1, win 361, options [nop,nop,TS val 3923601 ecr 349036], length 125: OpenFlow
	version 1.0, type PACKET_IN, length 125, xid 0x00000000
18:05:54.998197 IP 192.168.1.30.40493 > 192.168.1.10.6633: Flags [P.], seq 1750:1875, ack 1, win 361, options [nop,nop,TS val 3923601 ecr 349036], length 125: OpenFlow
	version 1.0, type PACKET_IN, length 125, xid 0x00000000
18:05:54.998217 IP 192.168.1.30.40493 > 192.168.1.10.6633: Flags [P.], seq 1875:2000, ack 1, win 361, options [nop,nop,TS val 3923601 ecr 349036], length 125: OpenFlow
	version 1.0, type PACKET_IN, length 125, xid 0x00000000
18:05:54.998237 IP 192.168.1.30.40493 > 192.168.1.10.6633: Flags [P.], seq 2000:2125, ack 1, win 361, options [nop,nop,TS val 3923601 ecr 349036], length 125: OpenFlow
	version 1.0, type PACKET_IN, length 125, xid 0x00000000
18:05:54.998257 IP 192.168.1.30.40493 > 192.168.1.10.6633: Flags [P.], seq 2125:2250, ack 1, win 361, options [nop,nop,TS val 3923601 ecr 349036], length 125: OpenFlow
	version 1.0, type PACKET_IN, length 125, xid 0x00000000
18:05:54.998279 IP 192.168.1.30.40493 > 192.168.1.10.6633: Flags [P.], seq 2250:2375, ack 1, win 361, options [nop,nop,TS val 3923601 ecr 349036], length 125: OpenFlow
	version 1.0, type PACKET_IN, length 125, xid 0x00000000
18:05:54.998298 IP 192.168.1.30.40493 > 192.168.1.10.6633: Flags [P.], seq 2375:2500, ack 1, win 361, options [nop,nop,TS val 3923601 ecr 349036], length 125: OpenFlow
	version 1.0, type PACKET_IN, length 125, xid 0x00000000
18:05:54.998317 IP 192.168.1.30.40493 > 192.168.1.10.6633: Flags [P.], seq 2500:2625, ack 1, win 361, options [nop,nop,TS val 3923601 ecr 349036], length 125: OpenFlow
	version 1.0, type PACKET_IN, length 125, xid 0x00000000
18:05:54.998337 IP 192.168.1.30.40493 > 192.168.1.10.6633: Flags [P.], seq 2625:2750, ack 1, win 361, options [nop,nop,TS val 3923601 ecr 349036], length 125: OpenFlow
	version 1.0, type PACKET_IN, length 125, xid 0x00000000
18:05:54.998358 IP 192.168.1.30.40493 > 192.168.1.10.6633: Flags [P.], seq 2750:2875, ack 1, win 361, options [nop,nop,TS val 3923601 ecr 349036], length 125: OpenFlow
	version 1.0, type PACKET_IN, length 125, xid 0x00000000
18:05:54.998395 IP 192.168.1.30.40493 > 192.168.1.10.6633: Flags [P.], seq 2875:3000, ack 1, win 361, options [nop,nop,TS val 3923601 ecr 349036], length 125: OpenFlow
	version 1.0, type PACKET_IN, length 125, xid 0x00000000
18:05:54.998418 IP 192.168.1.30.40493 > 192.168.1.10.6633: Flags [P.], seq 3000:3125, ack 1, win 361, options [nop,nop,TS val 3923601 ecr 349036], length 125: OpenFlow
	version 1.0, type PACKET_IN, length 125, xid 0x00000000
18:05:54.998437 IP 192.168.1.30.40493 > 192.168.1.10.6633: Flags [P.], seq 3125:3250, ack 1, win 361, options [nop,nop,TS val 3923601 ecr 349036], length 125: OpenFlow
	version 1.0, type PACKET_IN, length 125, xid 0x00000000
18:05:54.998456 IP 192.168.1.30.40493 > 192.168.1.10.6633: Flags [P.], seq 3250:3375, ack 1, win 361, options [nop,nop,TS val 3923601 ecr 349036], length 125: OpenFlow
	version 1.0, type PACKET_IN, length 125, xid 0x00000000
18:05:54.998476 IP 192.168.1.30.40493 > 192.168.1.10.6633: Flags [P.], seq 3375:3500, ack 1, win 361, options [nop,nop,TS val 3923601 ecr 349036], length 125: OpenFlow
	version 1.0, type PACKET_IN, length 125, xid 0x00000000
18:05:54.998498 IP 192.168.1.30.40493 > 192.168.1.10.6633: Flags [P.], seq 3500:3625, ack 1, win 361, options [nop,nop,TS val 3923601 ecr 349036], length 125: OpenFlow
	version 1.0, type PACKET_IN, length 125, xid 0x00000000
18:05:55.006240 IP 192.168.1.10.6633 > 192.168.1.30.40493: Flags [.], ack 1500, win 9693, options [nop,nop,TS val 349061 ecr 3923601], length 0
18:05:55.006260 IP 192.168.1.30.40493 > 192.168.1.10.6633: Flags [.], seq 3625:6521, ack 1, win 361, options [nop,nop,TS val 3923603 ecr 349061], length 2896: OpenFlow
	version 1.0, type PACKET_IN, length 125, xid 0x00000000
	version 1.0, type PACKET_IN, length 125, xid 0x00000000
	version 1.0, type PACKET_IN, length 125, xid 0x00000000
	version 1.0, type PACKET_IN, length 125, xid 0x00000000
	version 1.0, type PACKET_IN, length 125, xid 0x00000000
	version 1.0, type PACKET_IN, length 125, xid 0x00000000
	version 1.0, type PACKET_IN, length 125, xid 0x00000000
	version 1.0, type PACKET_IN, length 125, xid 0x00000000
	version 1.0, type PACKET_IN, length 125, xid 0x00000000
	version 1.0, type PACKET_IN, length 125, xid 0x00000000
	version 1.0, type PACKET_IN, length 125, xid 0x00000000
	version 1.0, type PACKET_IN, length 125, xid 0x00000000
	version 1.0, type PACKET_IN, length 125, xid 0x00000000
	version 1.0, type PACKET_IN, length 125, xid 0x00000000
	version 1.0, type PACKET_IN, length 125, xid 0x00000000
	version 1.0, type PACKET_IN, length 125, xid 0x00000000
	version 1.0, type PACKET_IN, length 125, xid 0x00000000
	version 1.0, type PACKET_IN, length 125, xid 0x00000000
	version 1.0, type PACKET_IN, length 125, xid 0x00000000
	version 1.0, type PACKET_IN, length 125, xid 0x00000000
	version 1.0, type PACKET_IN, length 125, xid 0x00000000
	version 1.0, type PACKET_IN, length 125, xid 0x00000000
	version 1.0, type PACKET_IN, length 125, xid 0x00000000
	version 1.0, type PACKET_IN, length 125, xid 0x00000000 [|openflow]
18:05:55.006269 IP 192.168.1.30.40493 > 192.168.1.10.6633: Flags [.], seq 6521:9417, ack 1, win 361, options [nop,nop,TS val 3923603 ecr 349061], length 2896: OpenFlow
	version unknown (0x00), type 0x00, length 64338, xid 0x69c7f318 [|openflow]
18:05:55.006277 IP 192.168.1.30.40493 > 192.168.1.10.6633: Flags [.], seq 9417:12313, ack 1, win 361, options [nop,nop,TS val 3923603 ecr 349061], length 2896: OpenFlow
	version unknown (0x00), type 0x00, length 0, xid 0x00005069 (corrupt)
18:05:55.006283 IP 192.168.1.30.40493 > 192.168.1.10.6633: Flags [.], seq 12313:15209, ack 1, win 361, options [nop,nop,TS val 3923603 ecr 349061], length 2896: OpenFlow
	version unknown (0x00), type 0x00, length 0, xid 0x00000000 (corrupt)
18:05:55.006289 IP 192.168.1.30.40493 > 192.168.1.10.6633: Flags [.], seq 15209:18105, ack 1, win 361, options [nop,nop,TS val 3923603 ecr 349061], length 2896: OpenFlow
	version unknown (0x00), type 0x02, length 0, xid 0x00000000 (corrupt)
18:05:55.006296 IP 192.168.1.30.40493 > 192.168.1.10.6633: Flags [.], seq 18105:21001, ack 1, win 361, options [nop,nop,TS val 3923603 ecr 349061], length 2896: OpenFlow
	version unknown (0x6f), type 0x63, length 24940, xid 0x00000c00 [|openflow]
18:05:55.021547 IP 192.168.1.30.40493 > 192.168.1.10.6633: Flags [.], seq 21001:22449, ack 1, win 361, options [nop,nop,TS val 3923607 ecr 349061], length 1448: OpenFlow
	version unknown (0x0a), type 0x00, length 32000, xid 0x000000ff [|openflow]
18:05:55.055100 IP 192.168.1.10.6633 > 192.168.1.30.40493: Flags [.], ack 22449, win 9568, options [nop,nop,TS val 349072 ecr 3923601], length 0
18:05:55.055135 IP 192.168.1.30.40493 > 192.168.1.10.6633: Flags [.], seq 22449:23897, ack 1, win 361, options [nop,nop,TS val 3923615 ecr 349072], length 1448: OpenFlow
	version unknown (0x14), type 0xe9, length 53, xid 0xa58a0000
	version unknown (0x00), type 0x7d, length 0, xid 0x0000ffff (corrupt)
18:05:55.055148 IP 192.168.1.30.40493 > 192.168.1.10.6633: Flags [.], seq 23897:26793, ack 1, win 361, options [nop,nop,TS val 3923615 ecr 349072], length 2896: OpenFlow
	version unknown (0x00), type 0xfb, length 21097, xid 0xc7f318d1 [|openflow]
18:05:55.055159 IP 192.168.1.30.40493 > 192.168.1.10.6633: Flags [.], seq 26793:29689, ack 1, win 361, options [nop,nop,TS val 3923615 ecr 349072], length 2896: OpenFlow
	version unknown (0x00), type 0x00, length 0, xid 0x005069c7 (corrupt)
18:05:55.055169 IP 192.168.1.30.40493 > 192.168.1.10.6633: Flags [.], seq 29689:32585, ack 1, win 361, options [nop,nop,TS val 3923615 ecr 349072], length 2896: OpenFlow
	version unknown (0x00), type 0x00, length 0, xid 0x000000fb (corrupt)
18:05:55.055181 IP 192.168.1.30.40493 > 192.168.1.10.6633: Flags [.], seq 32585:35481, ack 1, win 361, options [nop,nop,TS val 3923615 ecr 349072], length 2896: OpenFlow
	version unknown (0x02), type 0x00, length 0, xid 0x00000005 (corrupt)
18:05:55.055193 IP 192.168.1.30.40493 > 192.168.1.10.6633: Flags [P.], seq 35481:36875, ack 1, win 361, options [nop,nop,TS val 3923615 ecr 349072], length 1394: OpenFlow
	version unknown (0x63), type 0x61, length 27648, xid 0x000c0001 [|openflow]
18:05:55.090022 IP 192.168.1.30.40493 > 192.168.1.10.6633: Flags [P.], seq 36875:37000, ack 1, win 361, options [nop,nop,TS val 3923623 ecr 349072], length 125: OpenFlow
	version 1.0, type PACKET_IN, length 125, xid 0x00000000
18:05:55.090048 IP 192.168.1.30.40493 > 192.168.1.10.6633: Flags [P.], seq 37000:37125, ack 1, win 361, options [nop,nop,TS val 3923623 ecr 349072], length 125: OpenFlow
	version 1.0, type PACKET_IN, length 125, xid 0x00000000
18:05:55.090070 IP 192.168.1.30.40493 > 192.168.1.10.6633: Flags [P.], seq 37125:37250, ack 1, win 361, options [nop,nop,TS val 3923623 ecr 349072], length 125: OpenFlow
	version 1.0, type PACKET_IN, length 125, xid 0x00000000
18:05:55.090090 IP 192.168.1.30.40493 > 192.168.1.10.6633: Flags [P.], seq 37250:37375, ack 1, win 361, options [nop,nop,TS val 3923623 ecr 349072], length 125: OpenFlow
	version 1.0, type PACKET_IN, length 125, xid 0x00000000
18:05:55.090125 IP 192.168.1.30.40493 > 192.168.1.10.6633: Flags [P.], seq 37375:37500, ack 1, win 361, options [nop,nop,TS val 3923623 ecr 349072], length 125: OpenFlow
	version 1.0, type PACKET_IN, length 125, xid 0x00000000
18:05:55.090146 IP 192.168.1.30.40493 > 192.168.1.10.6633: Flags [P.], seq 37500:37625, ack 1, win 361, options [nop,nop,TS val 3923623 ecr 349072], length 125: OpenFlow
	version 1.0, type PACKET_IN, length 125, xid 0x00000000
18:05:55.090172 IP 192.168.1.30.40493 > 192.168.1.10.6633: Flags [P.], seq 37625:37750, ack 1, win 361, options [nop,nop,TS val 3923623 ecr 349072], length 125: OpenFlow
	version 1.0, type PACKET_IN, length 125, xid 0x00000000
18:05:55.090186 IP 192.168.1.30.40493 > 192.168.1.10.6633: Flags [P.], seq 37750:37875, ack 1, win 361, options [nop,nop,TS val 3923623 ecr 349072], length 125: OpenFlow
	version 1.0, type PACKET_IN, length 125, xid 0x00000000
18:05:55.090209 IP 192.168.1.30.40493 > 192.168.1.10.6633: Flags [P.], seq 37875:38000, ack 1, win 361, options [nop,nop,TS val 3923623 ecr 349072], length 125: OpenFlow
	version 1.0, type PACKET_IN, length 125, xid 0x00000000
18:05:55.090223 IP 192.168.1.30.40493 > 192.168.1.10.6633: Flags [P.], seq 38000:38125, ack 1, win 361, options [nop,nop,TS val 3923623 ecr 349072], length 125: OpenFlow
	version 1.0, type PACKET_IN, length 125, xid 0x00000000
18:05:55.090236 IP 192.168.1.30.40493 > 192.168.1.10.6633: Flags [P.], seq 38125:38250, ack 1, win 361, options [nop,nop,TS val 3923623 ecr 349072], length 125: OpenFlow
	version 1.0, type PACKET_IN, length 125, xid 0x00000000
18:05:55.090254 IP 192.168.1.30.40493 > 192.168.1.10.6633: Flags [P.], seq 38250:38375, ack 1, win 361, options [nop,nop,TS val 3923623 ecr 349072], length 125: OpenFlow
	version 1.0, type PACKET_IN, length 125, xid 0x00000000
18:05:55.090267 IP 192.168.1.30.40493 > 192.168.1.10.6633: Flags [P.], seq 38375:38500, ack 1, win 361, options [nop,nop,TS val 3923623 ecr 349072], length 125: OpenFlow
	version 1.0, type PACKET_IN, length 125, xid 0x00000000
18:05:55.090280 IP 192.168.1.30.40493 > 192.168.1.10.6633: Flags [P.], seq 38500:38625, ack 1, win 361, options [nop,nop,TS val 3923623 ecr 349072], length 125: OpenFlow
	version 1.0, type PACKET_IN, length 125, xid 0x00000000
18:05:55.090293 IP 192.168.1.30.40493 > 192.168.1.10.6633: Flags [P.], seq 38625:38750, ack 1, win 361, options [nop,nop,TS val 3923623 ecr 349072], length 125: OpenFlow
	version 1.0, type PACKET_IN, length 125, xid 0x00000000
18:05:55.090336 IP 192.168.1.30.40493 > 192.168.1.10.6633: Flags [P.], seq 38750:38875, ack 1, win 361, options [nop,nop,TS val 3923623 ecr 349072], length 125: OpenFlow
	version 1.0, type PACKET_IN, length 125, xid 0x00000000
18:05:55.090350 IP 192.168.1.30.40493 > 192.168.1.10.6633: Flags [P.], seq 38875:39000, ack 1, win 361, options [nop,nop,TS val 3923623 ecr 349072], length 125: OpenFlow
	version 1.0, type PACKET_IN, length 125, xid 0x00000000
18:05:55.090371 IP 192.168.1.30.40493 > 192.168.1.10.6633: Flags [P.], seq 39000:39125, ack 1, win 361, options [nop,nop,TS val 3923623 ecr 349072], length 125: OpenFlow
	version 1.0, type PACKET_IN, length 125, xid 0x00000000
18:05:55.090385 IP 192.168.1.30.40493 > 192.168.1.10.6633: Flags [P.], seq 39125:39250, ack 1, win 361, options [nop,nop,TS val 3923623 ecr 349072], length 125: OpenFlow
	version 1.0, type PACKET_IN, length 125, xid 0x00000000
18:05:55.090483 IP 192.168.1.10.6633 > 192.168.1.30.40493: Flags [.], ack 37000, win 9490, options [nop,nop,TS val 349081 ecr 3923615], length 0
18:05:55.091062 IP 192.168.1.30.40493 > 192.168.1.10.6633: Flags [.], seq 39250:42146, ack 1, win 361, options [nop,nop,TS val 3923624 ecr 349081], length 2896: OpenFlow
	version 1.0, type PACKET_IN, length 125, xid 0x00000000
	version 1.0, type PACKET_IN, length 125, xid 0x00000000
	version 1.0, type PACKET_IN, length 125, xid 0x00000000
	version 1.0, type PACKET_IN, length 125, xid 0x00000000
	version 1.0, type PACKET_IN, length 125, xid 0x00000000
	version 1.0, type PACKET_IN, length 125, xid 0x00000000
	version 1.0, type PACKET_IN, length 125, xid 0x00000000
	version 1.0, type PACKET_IN, length 125, xid 0x00000000
	version 1.0, type PACKET_IN, length 125, xid 0x00000000
	version 1.0, type PACKET_IN, length 125, xid 0x00000000
	version 1.0, type PACKET_IN, length 125, xid 0x00000000
	version 1.0, type PACKET_IN, length 125, xid 0x00000000
	version 1.0, type PACKET_IN, length 125, xid 0x00000000
	version 1.0, type PACKET_IN, length 125, xid 0x00000000
	version 1.0, type PACKET_IN, length 125, xid 0x00000000
	version 1.0, type PACKET_IN, length 125, xid 0x00000000
	version 1.0, type PACKET_IN, length 125, xid 0x00000000
	version 1.0, type PACKET_IN, length 125, xid 0x00000000
	version 1.0, type PACKET_IN, length 125, xid 0x00000000
	version 1.0, type PACKET_IN, length 125, xid 0x00000000
	version 1.0, type PACKET_IN, length 125, xid 0x00000000
	version 1.0, type PACKET_IN, length 125, xid 0x00000000
	version 1.0, type PACKET_IN, length 125, xid 0x00000000
	version 1.0, type PACKET_IN, length 125, xid 0x00000000 [|openflow]
18:05:55.091102 IP 192.168.1.30.40493 > 192.168.1.10.6633: Flags [.], seq 42146:45042, ack 1, win 361, options [nop,nop,TS val 3923624 ecr 349081], length 2896: OpenFlow
	version unknown (0x00), type 0x00, length 64338, xid 0x69c7f318 [|openflow]
18:05:55.091115 IP 192.168.1.30.40493 > 192.168.1.10.6633: Flags [.], seq 45042:47938, ack 1, win 361, options [nop,nop,TS val 3923624 ecr 349081], length 2896: OpenFlow
	version unknown (0x00), type 0x00, length 0, xid 0x00005069 (corrupt)
18:05:55.091127 IP 192.168.1.30.40493 > 192.168.1.10.6633: Flags [.], seq 47938:50834, ack 1, win 361, options [nop,nop,TS val 3923624 ecr 349081], length 2896: OpenFlow
	version unknown (0x00), type 0x00, length 0, xid 0x00000000 (corrupt)
18:05:55.091138 IP 192.168.1.30.40493 > 192.168.1.10.6633: Flags [.], seq 50834:53730, ack 1, win 361, options [nop,nop,TS val 3923624 ecr 349081], length 2896: OpenFlow
	version unknown (0x00), type 0x02, length 0, xid 0x00000000 (corrupt)
18:05:55.125585 IP 192.168.1.10.6633 > 192.168.1.30.40493: Flags [.], ack 53730, win 9373, options [nop,nop,TS val 349091 ecr 3923623], length 0
18:05:55.125851 IP 192.168.1.30.40493 > 192.168.1.10.6633: Flags [.], seq 53730:56626, ack 1, win 361, options [nop,nop,TS val 3923633 ecr 349091], length 2896: OpenFlow
	version unknown (0x6f), type 0x63, length 24940, xid 0x00000c00 [|openflow]
18:05:55.125866 IP 192.168.1.30.40493 > 192.168.1.10.6633: Flags [.], seq 56626:59522, ack 1, win 361, options [nop,nop,TS val 3923633 ecr 349091], length 2896: OpenFlow
	version unknown (0x0a), type 0x00, length 32000, xid 0x000000ff [|openflow]
18:05:55.125875 IP 192.168.1.30.40493 > 192.168.1.10.6633: Flags [.], seq 59522:62418, ack 1, win 361, options [nop,nop,TS val 3923633 ecr 349091], length 2896: OpenFlow
	version unknown (0x00), type 0xfb, length 21097, xid 0xc7f318d1 [|openflow]
18:05:55.125885 IP 192.168.1.30.40493 > 192.168.1.10.6633: Flags [.], seq 62418:65314, ack 1, win 361, options [nop,nop,TS val 3923633 ecr 349091], length 2896: OpenFlow
	version unknown (0x00), type 0x00, length 0, xid 0x005069c7 (corrupt)
18:05:55.125894 IP 192.168.1.30.40493 > 192.168.1.10.6633: Flags [.], seq 65314:68210, ack 1, win 361, options [nop,nop,TS val 3923633 ecr 349091], length 2896: OpenFlow
	version unknown (0x00), type 0x00, length 0, xid 0x000000fb (corrupt)
18:05:55.125991 IP 192.168.1.30.40493 > 192.168.1.10.6633: Flags [.], seq 68210:71106, ack 1, win 361, options [nop,nop,TS val 3923633 ecr 349091], length 2896: OpenFlow
	version unknown (0x02), type 0x00, length 0, xid 0x00000005 (corrupt)
18:05:55.126016 IP 192.168.1.30.40493 > 192.168.1.10.6633: Flags [.], seq 71106:74002, ack 1, win 361, options [nop,nop,TS val 3923633 ecr 349091], length 2896: OpenFlow
	version unknown (0x63), type 0x61, length 27648, xid 0x000c0001 [|openflow]
18:05:55.126026 IP 192.168.1.30.40493 > 192.168.1.10.6633: Flags [.], seq 74002:76898, ack 1, win 361, options [nop,nop,TS val 3923633 ecr 349091], length 2896: OpenFlow
	version unknown (0x00), type 0x7d, length 0, xid 0x0000ffff (corrupt)
18:05:55.126066 IP 192.168.1.30.40493 > 192.168.1.10.6633: Flags [.], seq 76898:79794, ack 1, win 361, options [nop,nop,TS val 3923633 ecr 349091], length 2896: OpenFlow
	version unknown (0xfb), type 0x52, length 27079, xid 0xf318d186 [|openflow]
18:05:55.126076 IP 192.168.1.30.40493 > 192.168.1.10.6633: Flags [P.], seq 79794:80750, ack 1, win 361, options [nop,nop,TS val 3923633 ecr 349091], length 956: OpenFlow
	version unknown (0x00), type 0x00, length 0, xid 0x5069c7ff (corrupt)
18:05:55.165518 IP 192.168.1.10.6633 > 192.168.1.30.40493: Flags [.], ack 80750, win 9228, options [nop,nop,TS val 349101 ecr 3923633], length 0
18:05:55.202382 IP 192.168.1.30.40493 > 192.168.1.10.6633: Flags [P.], seq 80750:80875, ack 1, win 361, options [nop,nop,TS val 3923652 ecr 349101], length 125: OpenFlow
	version 1.0, type PACKET_IN, length 125, xid 0x00000000
18:05:55.202424 IP 192.168.1.30.40493 > 192.168.1.10.6633: Flags [P.], seq 80875:81000, ack 1, win 361, options [nop,nop,TS val 3923652 ecr 349101], length 125: OpenFlow
	version 1.0, type PACKET_IN, length 125, xid 0x00000000
18:05:55.202452 IP 192.168.1.30.40493 > 192.168.1.10.6633: Flags [P.], seq 81000:81125, ack 1, win 361, options [nop,nop,TS val 3923652 ecr 349101], length 125: OpenFlow
	version 1.0, type PACKET_IN, length 125, xid 0x00000000
18:05:55.202480 IP 192.168.1.30.40493 > 192.168.1.10.6633: Flags [P.], seq 81125:81250, ack 1, win 361, options [nop,nop,TS val 3923652 ecr 349101], length 125: OpenFlow
	version 1.0, type PACKET_IN, length 125, xid 0x00000000
18:05:55.202507 IP 192.168.1.30.40493 > 192.168.1.10.6633: Flags [P.], seq 81250:81375, ack 1, win 361, options [nop,nop,TS val 3923652 ecr 349101], length 125: OpenFlow
	version 1.0, type PACKET_IN, length 125, xid 0x00000000
18:05:55.202534 IP 192.168.1.30.40493 > 192.168.1.10.6633: Flags [P.], seq 81375:81500, ack 1, win 361, options [nop,nop,TS val 3923652 ecr 349101], length 125: OpenFlow
	version 1.0, type PACKET_IN, length 125, xid 0x00000000
18:05:55.202560 IP 192.168.1.30.40493 > 192.168.1.10.6633: Flags [P.], seq 81500:81625, ack 1, win 361, options [nop,nop,TS val 3923652 ecr 349101], length 125: OpenFlow
	version 1.0, type PACKET_IN, length 125, xid 0x00000000
18:05:55.202590 IP 192.168.1.30.40493 > 192.168.1.10.6633: Flags [P.], seq 81625:81750, ack 1, win 361, options [nop,nop,TS val 3923652 ecr 349101], length 125: OpenFlow
	version 1.0, type PACKET_IN, length 125, xid 0x00000000
18:05:55.202631 IP 192.168.1.30.40493 > 192.168.1.10.6633: Flags [P.], seq 81750:81875, ack 1, win 361, options [nop,nop,TS val 3923652 ecr 349101], length 125: OpenFlow
	version 1.0, type PACKET_IN, length 125, xid 0x00000000
18:05:55.202671 IP 192.168.1.30.40493 > 192.168.1.10.6633: Flags [P.], seq 81875:82000, ack 1, win 361, options [nop,nop,TS val 3923652 ecr 349101], length 125: OpenFlow
	version 1.0, type PACKET_IN, length 125, xid 0x00000000
18:05:55.202702 IP 192.168.1.30.40493 > 192.168.1.10.6633: Flags [P.], seq 82000:82125, ack 1, win 361, options [nop,nop,TS val 3923652 ecr 349101], length 125: OpenFlow
	version 1.0, type PACKET_IN, length 125, xid 0x00000000
18:05:55.202729 IP 192.168.1.30.40493 > 192.168.1.10.6633: Flags [P.], seq 82125:82250, ack 1, win 361, options [nop,nop,TS val 3923652 ecr 349101], length 125: OpenFlow
	version 1.0, type PACKET_IN, length 125, xid 0x00000000
18:05:55.202730 IP 192.168.1.10.6633 > 192.168.1.30.40493: Flags [.], ack 80875, win 9693, options [nop,nop,TS val 349110 ecr 3923652], length 0
18:05:55.202756 IP 192.168.1.30.40493 > 192.168.1.10.6633: Flags [P.], seq 82250:82375, ack 1, win 361, options [nop,nop,TS val 3923652 ecr 349110], length 125: OpenFlow
	version 1.0, type PACKET_IN, length 125, xid 0x00000000
18:05:55.202842 IP 192.168.1.30.40493 > 192.168.1.10.6633: Flags [P.], seq 82375:82500, ack 1, win 361, options [nop,nop,TS val 3923652 ecr 349110], length 125: OpenFlow
	version 1.0, type PACKET_IN, length 125, xid 0x00000000
18:05:55.202869 IP 192.168.1.30.40493 > 192.168.1.10.6633: Flags [P.], seq 82500:82625, ack 1, win 361, options [nop,nop,TS val 3923652 ecr 349110], length 125: OpenFlow
	version 1.0, type PACKET_IN, length 125, xid 0x00000000
18:05:55.202895 IP 192.168.1.30.40493 > 192.168.1.10.6633: Flags [P.], seq 82625:82750, ack 1, win 361, options [nop,nop,TS val 3923652 ecr 349110], length 125: OpenFlow
	version 1.0, type PACKET_IN, length 125, xid 0x00000000
18:05:55.202922 IP 192.168.1.30.40493 > 192.168.1.10.6633: Flags [P.], seq 82750:82875, ack 1, win 361, options [nop,nop,TS val 3923652 ecr 349110], length 125: OpenFlow
	version 1.0, type PACKET_IN, length 125, xid 0x00000000
18:05:55.202965 IP 192.168.1.30.40493 > 192.168.1.10.6633: Flags [P.], seq 82875:83000, ack 1, win 361, options [nop,nop,TS val 3923652 ecr 349110], length 125: OpenFlow
	version 1.0, type PACKET_IN, length 125, xid 0x00000000
18:05:55.203013 IP 192.168.1.30.40493 > 192.168.1.10.6633: Flags [P.], seq 83000:83125, ack 1, win 361, options [nop,nop,TS val 3923652 ecr 349110], length 125: OpenFlow
	version 1.0, type PACKET_IN, length 125, xid 0x00000000
18:05:55.203059 IP 192.168.1.30.40493 > 192.168.1.10.6633: Flags [P.], seq 83125:83250, ack 1, win 361, options [nop,nop,TS val 3923652 ecr 349110], length 125: OpenFlow
	version 1.0, type PACKET_IN, length 125, xid 0x00000000
18:05:55.203080 IP 192.168.1.30.40493 > 192.168.1.10.6633: Flags [P.], seq 83250:83375, ack 1, win 361, options [nop,nop,TS val 3923652 ecr 349110], length 125: OpenFlow
	version 1.0, type PACKET_IN, length 125, xid 0x00000000
18:05:55.203098 IP 192.168.1.30.40493 > 192.168.1.10.6633: Flags [P.], seq 83375:83500, ack 1, win 361, options [nop,nop,TS val 3923652 ecr 349110], length 125: OpenFlow
	version 1.0, type PACKET_IN, length 125, xid 0x00000000
18:05:55.203110 IP 192.168.1.10.6633 > 192.168.1.30.40493: Flags [.], ack 82375, win 9693, options [nop,nop,TS val 349110 ecr 3923652], length 0
18:05:55.203135 IP 192.168.1.10.6633 > 192.168.1.30.40493: Flags [.], ack 82750, win 9693, options [nop,nop,TS val 349110 ecr 3923652], length 0
18:05:55.203138 IP 192.168.1.30.40493 > 192.168.1.10.6633: Flags [P.], seq 83500:83625, ack 1, win 361, options [nop,nop,TS val 3923652 ecr 349110], length 125: OpenFlow
	version 1.0, type PACKET_IN, length 125, xid 0x00000000
18:05:55.203154 IP 192.168.1.10.6633 > 192.168.1.30.40493: Flags [.], ack 83000, win 9693, options [nop,nop,TS val 349110 ecr 3923652], length 0
18:05:55.203199 IP 192.168.1.30.40493 > 192.168.1.10.6633: Flags [P.], seq 83625:83750, ack 1, win 361, options [nop,nop,TS val 3923652 ecr 349110], length 125: OpenFlow
	version 1.0, type PACKET_IN, length 125, xid 0x00000000
18:05:55.203227 IP 192.168.1.30.40493 > 192.168.1.10.6633: Flags [P.], seq 83750:83875, ack 1, win 361, options [nop,nop,TS val 3923652 ecr 349110], length 125: OpenFlow
	version 1.0, type PACKET_IN, length 125, xid 0x00000000
18:05:55.203254 IP 192.168.1.30.40493 > 192.168.1.10.6633: Flags [P.], seq 83875:84000, ack 1, win 361, options [nop,nop,TS val 3923652 ecr 349110], length 125: OpenFlow
	version 1.0, type PACKET_IN, length 125, xid 0x00000000
18:05:55.203280 IP 192.168.1.30.40493 > 192.168.1.10.6633: Flags [P.], seq 84000:84125, ack 1, win 361, options [nop,nop,TS val 3923652 ecr 349110], length 125: OpenFlow
	version 1.0, type PACKET_IN, length 125, xid 0x00000000
18:05:55.203313 IP 192.168.1.30.40493 > 192.168.1.10.6633: Flags [P.], seq 84125:84250, ack 1, win 361, options [nop,nop,TS val 3923652 ecr 349110], length 125: OpenFlow
	version 1.0, type PACKET_IN, length 125, xid 0x00000000
18:05:55.203360 IP 192.168.1.30.40493 > 192.168.1.10.6633: Flags [P.], seq 84250:84375, ack 1, win 361, options [nop,nop,TS val 3923652 ecr 349110], length 125: OpenFlow
	version 1.0, type PACKET_IN, length 125, xid 0x00000000
18:05:55.203397 IP 192.168.1.30.40493 > 192.168.1.10.6633: Flags [P.], seq 84375:84500, ack 1, win 361, options [nop,nop,TS val 3923652 ecr 349110], length 125: OpenFlow
	version 1.0, type PACKET_IN, length 125, xid 0x00000000
18:05:55.203441 IP 192.168.1.30.40493 > 192.168.1.10.6633: Flags [P.], seq 84500:84625, ack 1, win 361, options [nop,nop,TS val 3923652 ecr 349110], length 125: OpenFlow
	version 1.0, type PACKET_IN, length 125, xid 0x00000000
18:05:55.203482 IP 192.168.1.30.40493 > 192.168.1.10.6633: Flags [P.], seq 84625:84750, ack 1, win 361, options [nop,nop,TS val 3923652 ecr 349110], length 125: OpenFlow
	version 1.0, type PACKET_IN, length 125, xid 0x00000000
18:05:55.203510 IP 192.168.1.30.40493 > 192.168.1.10.6633: Flags [P.], seq 84750:84875, ack 1, win 361, options [nop,nop,TS val 3923652 ecr 349110], length 125: OpenFlow
	version 1.0, type PACKET_IN, length 125, xid 0x00000000
18:05:55.203537 IP 192.168.1.30.40493 > 192.168.1.10.6633: Flags [P.], seq 84875:85000, ack 1, win 361, options [nop,nop,TS val 3923652 ecr 349110], length 125: OpenFlow
	version 1.0, type PACKET_IN, length 125, xid 0x00000000
18:05:55.203564 IP 192.168.1.30.40493 > 192.168.1.10.6633: Flags [P.], seq 85000:85125, ack 1, win 361, options [nop,nop,TS val 3923652 ecr 349110], length 125: OpenFlow
	version 1.0, type PACKET_IN, length 125, xid 0x00000000
18:05:55.203591 IP 192.168.1.30.40493 > 192.168.1.10.6633: Flags [P.], seq 85125:85250, ack 1, win 361, options [nop,nop,TS val 3923652 ecr 349110], length 125: OpenFlow
	version 1.0, type PACKET_IN, length 125, xid 0x00000000
18:05:55.203628 IP 192.168.1.30.40493 > 192.168.1.10.6633: Flags [P.], seq 85250:85375, ack 1, win 361, options [nop,nop,TS val 3923652 ecr 349110], length 125: OpenFlow
	version 1.0, type PACKET_IN, length 125, xid 0x00000000
18:05:55.203659 IP 192.168.1.30.40493 > 192.168.1.10.6633: Flags [P.], seq 85375:85500, ack 1, win 361, options [nop,nop,TS val 3923652 ecr 349110], length 125: OpenFlow
	version 1.0, type PACKET_IN, length 125, xid 0x00000000
18:05:55.203713 IP 192.168.1.30.40493 > 192.168.1.10.6633: Flags [P.], seq 85500:85625, ack 1, win 361, options [nop,nop,TS val 3923652 ecr 349110], length 125: OpenFlow
	version 1.0, type PACKET_IN, length 125, xid 0x00000000
18:05:55.203756 IP 192.168.1.30.40493 > 192.168.1.10.6633: Flags [P.], seq 85625:85750, ack 1, win 361, options [nop,nop,TS val 3923652 ecr 349110], length 125: OpenFlow
	version 1.0, type PACKET_IN, length 125, xid 0x00000000
18:05:55.203762 IP 192.168.1.10.6633 > 192.168.1.30.40493: Flags [.], ack 84500, win 9693, options [nop,nop,TS val 349110 ecr 3923652], length 0
18:05:55.203817 IP 192.168.1.30.40493 > 192.168.1.10.6633: Flags [P.], seq 85750:85875, ack 1, win 361, options [nop,nop,TS val 3923652 ecr 349110], length 125: OpenFlow
	version 1.0, type PACKET_IN, length 125, xid 0x00000000
18:05:55.203866 IP 192.168.1.30.40493 > 192.168.1.10.6633: Flags [P.], seq 85875:86000, ack 1, win 361, options [nop,nop,TS val 3923652 ecr 349110], length 125: OpenFlow
	version 1.0, type PACKET_IN, length 125, xid 0x00000000
18:05:55.203912 IP 192.168.1.30.40493 > 192.168.1.10.6633: Flags [P.], seq 86000:86125, ack 1, win 361, options [nop,nop,TS val 3923652 ecr 349110], length 125: OpenFlow
	version 1.0, type PACKET_IN, length 125, xid 0x00000000
18:05:55.203959 IP 192.168.1.30.40493 > 192.168.1.10.6633: Flags [P.], seq 86125:86250, ack 1, win 361, options [nop,nop,TS val 3923652 ecr 349110], length 125: OpenFlow
	version 1.0, type PACKET_IN, length 125, xid 0x00000000
18:05:55.204001 IP 192.168.1.30.40493 > 192.168.1.10.6633: Flags [P.], seq 86250:86375, ack 1, win 361, options [nop,nop,TS val 3923652 ecr 349110], length 125: OpenFlow
	version 1.0, type PACKET_IN, length 125, xid 0x00000000
18:05:55.204042 IP 192.168.1.30.40493 > 192.168.1.10.6633: Flags [P.], seq 86375:86500, ack 1, win 361, options [nop,nop,TS val 3923652 ecr 349110], length 125: OpenFlow
	version 1.0, type PACKET_IN, length 125, xid 0x00000000
18:05:55.204084 IP 192.168.1.30.40493 > 192.168.1.10.6633: Flags [P.], seq 86500:86625, ack 1, win 361, options [nop,nop,TS val 3923652 ecr 349110], length 125: OpenFlow
	version 1.0, type PACKET_IN, length 125, xid 0x00000000
18:05:55.204124 IP 192.168.1.30.40493 > 192.168.1.10.6633: Flags [P.], seq 86625:86750, ack 1, win 361, options [nop,nop,TS val 3923652 ecr 349110], length 125: OpenFlow
	version 1.0, type PACKET_IN, length 125, xid 0x00000000
18:05:55.204176 IP 192.168.1.30.40493 > 192.168.1.10.6633: Flags [P.], seq 86750:86875, ack 1, win 361, options [nop,nop,TS val 3923652 ecr 349110], length 125: OpenFlow
	version 1.0, type PACKET_IN, length 125, xid 0x00000000
18:05:55.204222 IP 192.168.1.30.40493 > 192.168.1.10.6633: Flags [P.], seq 86875:87000, ack 1, win 361, options [nop,nop,TS val 3923652 ecr 349110], length 125: OpenFlow
	version 1.0, type PACKET_IN, length 125, xid 0x00000000
18:05:55.204272 IP 192.168.1.30.40493 > 192.168.1.10.6633: Flags [P.], seq 87000:87125, ack 1, win 361, options [nop,nop,TS val 3923652 ecr 349110], length 125: OpenFlow
	version 1.0, type PACKET_IN, length 125, xid 0x00000000
18:05:55.204320 IP 192.168.1.30.40493 > 192.168.1.10.6633: Flags [P.], seq 87125:87250, ack 1, win 361, options [nop,nop,TS val 3923652 ecr 349110], length 125: OpenFlow
	version 1.0, type PACKET_IN, length 125, xid 0x00000000
18:05:55.204366 IP 192.168.1.30.40493 > 192.168.1.10.6633: Flags [P.], seq 87250:87375, ack 1, win 361, options [nop,nop,TS val 3923652 ecr 349110], length 125: OpenFlow
	version 1.0, type PACKET_IN, length 125, xid 0x00000000
18:05:55.204414 IP 192.168.1.30.40493 > 192.168.1.10.6633: Flags [P.], seq 87375:87500, ack 1, win 361, options [nop,nop,TS val 3923652 ecr 349110], length 125: OpenFlow
	version 1.0, type PACKET_IN, length 125, xid 0x00000000
18:05:55.204465 IP 192.168.1.30.40493 > 192.168.1.10.6633: Flags [P.], seq 87500:87625, ack 1, win 361, options [nop,nop,TS val 3923652 ecr 349110], length 125: OpenFlow
	version 1.0, type PACKET_IN, length 125, xid 0x00000000
18:05:55.204516 IP 192.168.1.30.40493 > 192.168.1.10.6633: Flags [P.], seq 87625:87750, ack 1, win 361, options [nop,nop,TS val 3923652 ecr 349110], length 125: OpenFlow
	version 1.0, type PACKET_IN, length 125, xid 0x00000000
18:05:55.204567 IP 192.168.1.30.40493 > 192.168.1.10.6633: Flags [P.], seq 87750:87875, ack 1, win 361, options [nop,nop,TS val 3923652 ecr 349110], length 125: OpenFlow
	version 1.0, type PACKET_IN, length 125, xid 0x00000000
18:05:55.204600 IP 192.168.1.10.6633 > 192.168.1.30.40493: Flags [.], ack 86000, win 9693, options [nop,nop,TS val 349110 ecr 3923652], length 0
18:05:55.204632 IP 192.168.1.30.40493 > 192.168.1.10.6633: Flags [P.], seq 87875:88000, ack 1, win 361, options [nop,nop,TS val 3923652 ecr 349110], length 125: OpenFlow
	version 1.0, type PACKET_IN, length 125, xid 0x00000000
18:05:55.204678 IP 192.168.1.30.40493 > 192.168.1.10.6633: Flags [P.], seq 88000:88125, ack 1, win 361, options [nop,nop,TS val 3923652 ecr 349110], length 125: OpenFlow
	version 1.0, type PACKET_IN, length 125, xid 0x00000000
18:05:55.204723 IP 192.168.1.30.40493 > 192.168.1.10.6633: Flags [P.], seq 88125:88250, ack 1, win 361, options [nop,nop,TS val 3923652 ecr 349110], length 125: OpenFlow
	version 1.0, type PACKET_IN, length 125, xid 0x00000000
18:05:55.204769 IP 192.168.1.30.40493 > 192.168.1.10.6633: Flags [P.], seq 88250:88375, ack 1, win 361, options [nop,nop,TS val 3923652 ecr 349110], length 125: OpenFlow
	version 1.0, type PACKET_IN, length 125, xid 0x00000000
18:05:55.204814 IP 192.168.1.30.40493 > 192.168.1.10.6633: Flags [P.], seq 88375:88500, ack 1, win 361, options [nop,nop,TS val 3923652 ecr 349110], length 125: OpenFlow
	version 1.0, type PACKET_IN, length 125, xid 0x00000000
18:05:55.204860 IP 192.168.1.30.40493 > 192.168.1.10.6633: Flags [P.], seq 88500:88625, ack 1, win 361, options [nop,nop,TS val 3923652 ecr 349110], length 125: OpenFlow
	version 1.0, type PACKET_IN, length 125, xid 0x00000000
18:05:55.204908 IP 192.168.1.30.40493 > 192.168.1.10.6633: Flags [P.], seq 88625:88750, ack 1, win 361, options [nop,nop,TS val 3923652 ecr 349110], length 125: OpenFlow
	version 1.0, type PACKET_IN, length 125, xid 0x00000000
18:05:55.204935 IP 192.168.1.10.6633 > 192.168.1.30.40493: Flags [.], ack 87500, win 9693, options [nop,nop,TS val 349110 ecr 3923652], length 0
18:05:55.204973 IP 192.168.1.30.40493 > 192.168.1.10.6633: Flags [P.], seq 88750:88875, ack 1, win 361, options [nop,nop,TS val 3923652 ecr 349110], length 125: OpenFlow
	version 1.0, type PACKET_IN, length 125, xid 0x00000000
18:05:55.205019 IP 192.168.1.30.40493 > 192.168.1.10.6633: Flags [P.], seq 88875:89000, ack 1, win 361, options [nop,nop,TS val 3923652 ecr 349110], length 125: OpenFlow
	version 1.0, type PACKET_IN, length 125, xid 0x00000000
18:05:55.205063 IP 192.168.1.30.40493 > 192.168.1.10.6633: Flags [P.], seq 89000:89125, ack 1, win 361, options [nop,nop,TS val 3923652 ecr 349110], length 125: OpenFlow
	version 1.0, type PACKET_IN, length 125, xid 0x00000000
18:05:55.205105 IP 192.168.1.30.40493 > 192.168.1.10.6633: Flags [P.], seq 89125:89250, ack 1, win 361, options [nop,nop,TS val 3923652 ecr 349110], length 125: OpenFlow
	version 1.0, type PACKET_IN, length 125, xid 0x00000000
18:05:55.205149 IP 192.168.1.30.40493 > 192.168.1.10.6633: Flags [P.], seq 89250:89375, ack 1, win 361, options [nop,nop,TS val 3923652 ecr 349110], length 125: OpenFlow
	version 1.0, type PACKET_IN, length 125, xid 0x00000000
18:05:55.205194 IP 192.168.1.30.40493 > 192.168.1.10.6633: Flags [P.], seq 89375:89500, ack 1, win 361, options [nop,nop,TS val 3923652 ecr 349110], length 125: OpenFlow
	version 1.0, type PACKET_IN, length 125, xid 0x00000000
18:05:55.205236 IP 192.168.1.30.40493 > 192.168.1.10.6633: Flags [P.], seq 89500:89625, ack 1, win 361, options [nop,nop,TS val 3923652 ecr 349110], length 125: OpenFlow
	version 1.0, type PACKET_IN, length 125, xid 0x00000000
18:05:55.205281 IP 192.168.1.30.40493 > 192.168.1.10.6633: Flags [P.], seq 89625:89750, ack 1, win 361, options [nop,nop,TS val 3923652 ecr 349110], length 125: OpenFlow
	version 1.0, type PACKET_IN, length 125, xid 0x00000000
18:05:55.205306 IP 192.168.1.10.6633 > 192.168.1.30.40493: Flags [.], ack 88000, win 9693, options [nop,nop,TS val 349110 ecr 3923652], length 0
18:05:55.205340 IP 192.168.1.30.40493 > 192.168.1.10.6633: Flags [P.], seq 89750:89875, ack 1, win 361, options [nop,nop,TS val 3923652 ecr 349110], length 125: OpenFlow
	version 1.0, type PACKET_IN, length 125, xid 0x00000000
18:05:55.205384 IP 192.168.1.30.40493 > 192.168.1.10.6633: Flags [P.], seq 89875:90000, ack 1, win 361, options [nop,nop,TS val 3923652 ecr 349110], length 125: OpenFlow
	version 1.0, type PACKET_IN, length 125, xid 0x00000000
18:05:55.205430 IP 192.168.1.30.40493 > 192.168.1.10.6633: Flags [P.], seq 90000:90125, ack 1, win 361, options [nop,nop,TS val 3923652 ecr 349110], length 125: OpenFlow
	version 1.0, type PACKET_IN, length 125, xid 0x00000000
18:05:55.205487 IP 192.168.1.30.40493 > 192.168.1.10.6633: Flags [P.], seq 90125:90250, ack 1, win 361, options [nop,nop,TS val 3923653 ecr 349110], length 125: OpenFlow
	version 1.0, type PACKET_IN, length 125, xid 0x00000000
18:05:55.205539 IP 192.168.1.30.40493 > 192.168.1.10.6633: Flags [P.], seq 90250:90375, ack 1, win 361, options [nop,nop,TS val 3923653 ecr 349110], length 125: OpenFlow
	version 1.0, type PACKET_IN, length 125, xid 0x00000000
18:05:55.205584 IP 192.168.1.30.40493 > 192.168.1.10.6633: Flags [P.], seq 90375:90500, ack 1, win 361, options [nop,nop,TS val 3923653 ecr 349110], length 125: OpenFlow
	version 1.0, type PACKET_IN, length 125, xid 0x00000000
