17:49:10.874649 IP 192.168.1.30.40492 > 192.168.1.10.6633: Flags [P.], seq 244867071:244867431, ack 3679764986, win 139, options [nop,nop,TS val 3672570 ecr 97958], length 360: OpenFlow
	version 1.0, type PACKET_IN, length 360, xid 0x00000000
17:49:10.874706 IP 192.168.1.30.40492 > 192.168.1.10.6633: Flags [P.], seq 360:720, ack 1, win 139, options [nop,nop,TS val 3672570 ecr 97958], length 360: OpenFlow
	version 1.0, type PACKET_IN, length 360, xid 0x00000000
17:49:10.874739 IP 192.168.1.30.40492 > 192.168.1.10.6633: Flags [P.], seq 720:1080, ack 1, win 139, options [nop,nop,TS val 3672570 ecr 97958], length 360: OpenFlow
	version 1.0, type PACKET_IN, length 360, xid 0x00000000
17:49:10.874836 IP 192.168.1.30.40492 > 192.168.1.10.6633: Flags [P.], seq 1080:1440, ack 1, win 139, options [nop,nop,TS val 3672570 ecr 97958], length 360: OpenFlow
	version 1.0, type PACKET_IN, length 360, xid 0x00000000
17:49:10.874874 IP 192.168.1.30.40492 > 192.168.1.10.6633: Flags [P.], seq 1440:1800, ack 1, win 139, options [nop,nop,TS val 3672570 ecr 97958], length 360: OpenFlow
	version 1.0, type PACKET_IN, length 360, xid 0x00000000
17:49:10.874908 IP 192.168.1.10.6633 > 192.168.1.30.40492: Flags [.], ack 360, win 2027, options [nop,nop,TS val 98028 ecr 3672570], length 0
17:49:10.874925 IP 192.168.1.10.6633 > 192.168.1.30.40492: Flags [.], ack 720, win 2027, options [nop,nop,TS val 98028 ecr 3672570], length 0
17:49:10.874953 IP 192.168.1.10.6633 > 192.168.1.30.40492: Flags [.], ack 1080, win 2027, options [nop,nop,TS val 98028 ecr 3672570], length 0
17:49:10.874966 IP 192.168.1.10.6633 > 192.168.1.30.40492: Flags [.], ack 1440, win 2027, options [nop,nop,TS val 98028 ecr 3672570], length 0
17:49:10.874991 IP 192.168.1.10.6633 > 192.168.1.30.40492: Flags [.], ack 1800, win 2027, options [nop,nop,TS val 98028 ecr 3672570], length 0
17:49:10.875040 IP 192.168.1.30.40492 > 192.168.1.10.6633: Flags [P.], seq 1800:2160, ack 1, win 139, options [nop,nop,TS val 3672570 ecr 98028], length 360: OpenFlow
	version 1.0, type PACKET_IN, length 360, xid 0x00000000
17:49:10.875071 IP 192.168.1.30.40492 > 192.168.1.10.6633: Flags [P.], seq 2160:2520, ack 1, win 139, options [nop,nop,TS val 3672570 ecr 98028], length 360: OpenFlow
	version 1.0, type PACKET_IN, length 360, xid 0x00000000
17:49:10.875102 IP 192.168.1.30.40492 > 192.168.1.10.6633: Flags [P.], seq 2520:2880, ack 1, win 139, options [nop,nop,TS val 3672570 ecr 98028], length 360: OpenFlow
	version 1.0, type PACKET_IN, length 360, xid 0x00000000
17:49:10.875135 IP 192.168.1.30.40492 > 192.168.1.10.6633: Flags [P.], seq 2880:3240, ack 1, win 139, options [nop,nop,TS val 3672570 ecr 98028], length 360: OpenFlow
	version 1.0, type PACKET_IN, length 360, xid 0x00000000
17:49:10.875196 IP 192.168.1.30.40492 > 192.168.1.10.6633: Flags [P.], seq 3240:3600, ack 1, win 139, options [nop,nop,TS val 3672570 ecr 98028], length 360: OpenFlow
	version 1.0, type PACKET_IN, length 360, xid 0x00000000
17:49:10.875228 IP 192.168.1.30.40492 > 192.168.1.10.6633: Flags [P.], seq 3600:3960, ack 1, win 139, options [nop,nop,TS val 3672570 ecr 98028], length 360: OpenFlow
	version 1.0, type PACKET_IN, length 360, xid 0x00000000
17:49:10.875258 IP 192.168.1.30.40492 > 192.168.1.10.6633: Flags [P.], seq 3960:4320, ack 1, win 139, options [nop,nop,TS val 3672570 ecr 98028], length 360: OpenFlow
	version 1.0, type PACKET_IN, length 360, xid 0x00000000
17:49:10.875296 IP 192.168.1.10.6633 > 192.168.1.30.40492: Flags [.], ack 2160, win 2027, options [nop,nop,TS val 98028 ecr 3672570], length 0
17:49:10.875336 IP 192.168.1.10.6633 > 192.168.1.30.40492: Flags [.], ack 2520, win 2027, options [nop,nop,TS val 98028 ecr 3672570], length 0
17:49:10.875348 IP 192.168.1.10.6633 > 192.168.1.30.40492: Flags [.], ack 2880, win 2027, options [nop,nop,TS val 98028 ecr 3672570], length 0
17:49:10.875356 IP 192.168.1.10.6633 > 192.168.1.30.40492: Flags [.], ack 3240, win 2027, options [nop,nop,TS val 98028 ecr 3672570], length 0
17:49:10.875381 IP 192.168.1.10.6633 > 192.168.1.30.40492: Flags [.], ack 3600, win 2027, options [nop,nop,TS val 98028 ecr 3672570], length 0
17:49:10.875389 IP 192.168.1.10.6633 > 192.168.1.30.40492: Flags [.], ack 3960, win 2027, options [nop,nop,TS val 98028 ecr 3672570], length 0
17:49:10.875397 IP 192.168.1.10.6633 > 192.168.1.30.40492: Flags [.], ack 4320, win 2027, options [nop,nop,TS val 98028 ecr 3672570], length 0
17:49:10.875456 IP 192.168.1.30.40492 > 192.168.1.10.6633: Flags [P.], seq 4320:4680, ack 1, win 139, options [nop,nop,TS val 3672570 ecr 98028], length 360: OpenFlow
	version 1.0, type PACKET_IN, length 360, xid 0x00000000
17:49:10.875486 IP 192.168.1.30.40492 > 192.168.1.10.6633: Flags [P.], seq 4680:5040, ack 1, win 139, options [nop,nop,TS val 3672570 ecr 98028], length 360: OpenFlow
	version 1.0, type PACKET_IN, length 360, xid 0x00000000
17:49:10.875519 IP 192.168.1.30.40492 > 192.168.1.10.6633: Flags [P.], seq 5040:5400, ack 1, win 139, options [nop,nop,TS val 3672570 ecr 98028], length 360: OpenFlow
	version 1.0, type PACKET_IN, length 360, xid 0x00000000
17:49:10.875556 IP 192.168.1.30.40492 > 192.168.1.10.6633: Flags [P.], seq 5400:5760, ack 1, win 139, options [nop,nop,TS val 3672570 ecr 98028], length 360: OpenFlow
	version 1.0, type PACKET_IN, length 360, xid 0x00000000
17:49:10.875607 IP 192.168.1.10.6633 > 192.168.1.30.40492: Flags [.], ack 4680, win 2027, options [nop,nop,TS val 98028 ecr 3672570], length 0
17:49:10.875647 IP 192.168.1.10.6633 > 192.168.1.30.40492: Flags [.], ack 5040, win 2027, options [nop,nop,TS val 98028 ecr 3672570], length 0
17:49:10.875662 IP 192.168.1.10.6633 > 192.168.1.30.40492: Flags [.], ack 5400, win 2027, options [nop,nop,TS val 98028 ecr 3672570], length 0
17:49:10.875685 IP 192.168.1.10.6633 > 192.168.1.30.40492: Flags [.], ack 5760, win 2027, options [nop,nop,TS val 98028 ecr 3672570], length 0
17:49:10.875722 IP 192.168.1.30.40492 > 192.168.1.10.6633: Flags [P.], seq 5760:6120, ack 1, win 139, options [nop,nop,TS val 3672570 ecr 98028], length 360: OpenFlow
	version 1.0, type PACKET_IN, length 360, xid 0x00000000
17:49:10.875755 IP 192.168.1.30.40492 > 192.168.1.10.6633: Flags [P.], seq 6120:6480, ack 1, win 139, options [nop,nop,TS val 3672570 ecr 98028], length 360: OpenFlow
	version 1.0, type PACKET_IN, length 360, xid 0x00000000
17:49:10.875785 IP 192.168.1.30.40492 > 192.168.1.10.6633: Flags [P.], seq 6480:6840, ack 1, win 139, options [nop,nop,TS val 3672570 ecr 98028], length 360: OpenFlow
	version 1.0, type PACKET_IN, length 360, xid 0x00000000
17:49:10.875816 IP 192.168.1.30.40492 > 192.168.1.10.6633: Flags [P.], seq 6840:7200, ack 1, win 139, options [nop,nop,TS val 3672570 ecr 98028], length 360: OpenFlow
	version 1.0, type PACKET_IN, length 360, xid 0x00000000
17:49:10.875856 IP 192.168.1.30.40492 > 192.168.1.10.6633: Flags [P.], seq 7200:7560, ack 1, win 139, options [nop,nop,TS val 3672570 ecr 98028], length 360: OpenFlow
	version 1.0, type PACKET_IN, length 360, xid 0x00000000
17:49:10.875949 IP 192.168.1.30.40492 > 192.168.1.10.6633: Flags [P.], seq 7560:7920, ack 1, win 139, options [nop,nop,TS val 3672570 ecr 98028], length 360: OpenFlow
	version 1.0, type PACKET_IN, length 360, xid 0x00000000
17:49:10.875988 IP 192.168.1.30.40492 > 192.168.1.10.6633: Flags [P.], seq 7920:8280, ack 1, win 139, options [nop,nop,TS val 3672570 ecr 98028], length 360: OpenFlow
	version 1.0, type PACKET_IN, length 360, xid 0x00000000
17:49:10.876018 IP 192.168.1.30.40492 > 192.168.1.10.6633: Flags [P.], seq 8280:8640, ack 1, win 139, options [nop,nop,TS val 3672570 ecr 98028], length 360: OpenFlow
	version 1.0, type PACKET_IN, length 360, xid 0x00000000
17:49:10.876049 IP 192.168.1.30.40492 > 192.168.1.10.6633: Flags [P.], seq 8640:9000, ack 1, win 139, options [nop,nop,TS val 3672570 ecr 98028], length 360: OpenFlow
	version 1.0, type PACKET_IN, length 360, xid 0x00000000
17:49:10.876090 IP 192.168.1.10.6633 > 192.168.1.30.40492: Flags [.], ack 7200, win 2027, options [nop,nop,TS val 98028 ecr 3672570], length 0
17:49:10.876115 IP 192.168.1.10.6633 > 192.168.1.30.40492: Flags [.], ack 7560, win 2027, options [nop,nop,TS val 98028 ecr 3672570], length 0
17:49:10.876134 IP 192.168.1.10.6633 > 192.168.1.30.40492: Flags [.], ack 8280, win 2027, options [nop,nop,TS val 98028 ecr 3672570], length 0
17:49:10.876165 IP 192.168.1.30.40492 > 192.168.1.10.6633: Flags [P.], seq 9000:9360, ack 1, win 139, options [nop,nop,TS val 3672570 ecr 98028], length 360: OpenFlow
	version 1.0, type PACKET_IN, length 360, xid 0x00000000
17:49:10.876202 IP 192.168.1.30.40492 > 192.168.1.10.6633: Flags [P.], seq 9360:9720, ack 1, win 139, options [nop,nop,TS val 3672570 ecr 98028], length 360: OpenFlow
	version 1.0, type PACKET_IN, length 360, xid 0x00000000
17:49:10.876235 IP 192.168.1.30.40492 > 192.168.1.10.6633: Flags [P.], seq 9720:10080, ack 1, win 139, options [nop,nop,TS val 3672570 ecr 98028], length 360: OpenFlow
	version 1.0, type PACKET_IN, length 360, xid 0x00000000
17:49:10.876267 IP 192.168.1.30.40492 > 192.168.1.10.6633: Flags [P.], seq 10080:10440, ack 1, win 139, options [nop,nop,TS val 3672570 ecr 98028], length 360: OpenFlow
	version 1.0, type PACKET_IN, length 360, xid 0x00000000
17:49:10.876299 IP 192.168.1.30.40492 > 192.168.1.10.6633: Flags [P.], seq 10440:10800, ack 1, win 139, options [nop,nop,TS val 3672570 ecr 98028], length 360: OpenFlow
	version 1.0, type PACKET_IN, length 360, xid 0x00000000
17:49:10.876325 IP 192.168.1.10.6633 > 192.168.1.30.40492: Flags [.], ack 9000, win 2027, options [nop,nop,TS val 98028 ecr 3672570], length 0
17:49:10.876360 IP 192.168.1.10.6633 > 192.168.1.30.40492: Flags [.], ack 9720, win 2027, options [nop,nop,TS val 98028 ecr 3672570], length 0
17:49:10.876494 IP 192.168.1.10.6633 > 192.168.1.30.40492: Flags [.], ack 10800, win 2027, options [nop,nop,TS val 98028 ecr 3672570], length 0
17:49:10.876564 IP 192.168.1.30.40492 > 192.168.1.10.6633: Flags [P.], seq 10800:11160, ack 1, win 139, options [nop,nop,TS val 3672570 ecr 98028], length 360: OpenFlow
	version 1.0, type PACKET_IN, length 360, xid 0x00000000
17:49:10.876602 IP 192.168.1.30.40492 > 192.168.1.10.6633: Flags [P.], seq 11160:11520, ack 1, win 139, options [nop,nop,TS val 3672570 ecr 98028], length 360: OpenFlow
	version 1.0, type PACKET_IN, length 360, xid 0x00000000
17:49:10.876637 IP 192.168.1.30.40492 > 192.168.1.10.6633: Flags [P.], seq 11520:11880, ack 1, win 139, options [nop,nop,TS val 3672570 ecr 98028], length 360: OpenFlow
	version 1.0, type PACKET_IN, length 360, xid 0x00000000
17:49:10.876670 IP 192.168.1.30.40492 > 192.168.1.10.6633: Flags [P.], seq 11880:12240, ack 1, win 139, options [nop,nop,TS val 3672570 ecr 98028], length 360: OpenFlow
	version 1.0, type PACKET_IN, length 360, xid 0x00000000
17:49:10.876716 IP 192.168.1.30.40492 > 192.168.1.10.6633: Flags [P.], seq 12240:12600, ack 1, win 139, options [nop,nop,TS val 3672570 ecr 98028], length 360: OpenFlow
	version 1.0, type PACKET_IN, length 360, xid 0x00000000
17:49:10.876752 IP 192.168.1.30.40492 > 192.168.1.10.6633: Flags [P.], seq 12600:12960, ack 1, win 139, options [nop,nop,TS val 3672570 ecr 98028], length 360: OpenFlow
	version 1.0, type PACKET_IN, length 360, xid 0x00000000
17:49:10.876812 IP 192.168.1.10.6633 > 192.168.1.30.40492: Flags [.], ack 12240, win 2027, options [nop,nop,TS val 98028 ecr 3672570], length 0
17:49:10.876850 IP 192.168.1.30.40492 > 192.168.1.10.6633: Flags [P.], seq 12960:13320, ack 1, win 139, options [nop,nop,TS val 3672570 ecr 98028], length 360: OpenFlow
	version 1.0, type PACKET_IN, length 360, xid 0x00000000
17:49:10.876888 IP 192.168.1.30.40492 > 192.168.1.10.6633: Flags [P.], seq 13320:13680, ack 1, win 139, options [nop,nop,TS val 3672570 ecr 98028], length 360: OpenFlow
	version 1.0, type PACKET_IN, length 360, xid 0x00000000
17:49:10.876918 IP 192.168.1.30.40492 > 192.168.1.10.6633: Flags [P.], seq 13680:14040, ack 1, win 139, options [nop,nop,TS val 3672570 ecr 98028], length 360: OpenFlow
	version 1.0, type PACKET_IN, length 360, xid 0x00000000
17:49:10.876949 IP 192.168.1.30.40492 > 192.168.1.10.6633: Flags [P.], seq 14040:14400, ack 1, win 139, options [nop,nop,TS val 3672570 ecr 98028], length 360: OpenFlow
	version 1.0, type PACKET_IN, length 360, xid 0x00000000
17:49:10.877001 IP 192.168.1.10.6633 > 192.168.1.30.40492: Flags [.], ack 12960, win 2027, options [nop,nop,TS val 98028 ecr 3672570], length 0
17:49:10.877021 IP 192.168.1.10.6633 > 192.168.1.30.40492: Flags [.], ack 13320, win 2027, options [nop,nop,TS val 98028 ecr 3672570], length 0
17:49:10.877057 IP 192.168.1.30.40492 > 192.168.1.10.6633: Flags [P.], seq 14400:14760, ack 1, win 139, options [nop,nop,TS val 3672570 ecr 98028], length 360: OpenFlow
	version 1.0, type PACKET_IN, length 360, xid 0x00000000
17:49:10.877103 IP 192.168.1.30.40492 > 192.168.1.10.6633: Flags [P.], seq 14760:15120, ack 1, win 139, options [nop,nop,TS val 3672570 ecr 98028], length 360: OpenFlow
	version 1.0, type PACKET_IN, length 360, xid 0x00000000
17:49:10.877138 IP 192.168.1.30.40492 > 192.168.1.10.6633: Flags [P.], seq 15120:15480, ack 1, win 139, options [nop,nop,TS val 3672570 ecr 98028], length 360: OpenFlow
	version 1.0, type PACKET_IN, length 360, xid 0x00000000
17:49:10.877172 IP 192.168.1.30.40492 > 192.168.1.10.6633: Flags [P.], seq 15480:15840, ack 1, win 139, options [nop,nop,TS val 3672570 ecr 98028], length 360: OpenFlow
	version 1.0, type PACKET_IN, length 360, xid 0x00000000
17:49:10.877206 IP 192.168.1.30.40492 > 192.168.1.10.6633: Flags [P.], seq 15840:16200, ack 1, win 139, options [nop,nop,TS val 3672570 ecr 98028], length 360: OpenFlow
	version 1.0, type PACKET_IN, length 360, xid 0x00000000
17:49:10.877248 IP 192.168.1.10.6633 > 192.168.1.30.40492: Flags [.], ack 14400, win 2027, options [nop,nop,TS val 98028 ecr 3672570], length 0
17:49:10.877267 IP 192.168.1.10.6633 > 192.168.1.30.40492: Flags [.], ack 15120, win 2027, options [nop,nop,TS val 98028 ecr 3672570], length 0
17:49:10.877317 IP 192.168.1.10.6633 > 192.168.1.30.40492: Flags [.], ack 15840, win 2027, options [nop,nop,TS val 98028 ecr 3672570], length 0
17:49:10.877360 IP 192.168.1.30.40492 > 192.168.1.10.6633: Flags [P.], seq 16200:16560, ack 1, win 139, options [nop,nop,TS val 3672570 ecr 98028], length 360: OpenFlow
	version 1.0, type PACKET_IN, length 360, xid 0x00000000
17:49:10.877391 IP 192.168.1.30.40492 > 192.168.1.10.6633: Flags [P.], seq 16560:16920, ack 1, win 139, options [nop,nop,TS val 3672570 ecr 98028], length 360: OpenFlow
	version 1.0, type PACKET_IN, length 360, xid 0x00000000
17:49:10.877432 IP 192.168.1.30.40492 > 192.168.1.10.6633: Flags [P.], seq 16920:17280, ack 1, win 139, options [nop,nop,TS val 3672570 ecr 98028], length 360: OpenFlow
	version 1.0, type PACKET_IN, length 360, xid 0x00000000
17:49:10.877482 IP 192.168.1.10.6633 > 192.168.1.30.40492: Flags [.], ack 16200, win 2027, options [nop,nop,TS val 98028 ecr 3672570], length 0
17:49:10.877501 IP 192.168.1.10.6633 > 192.168.1.30.40492: Flags [.], ack 16560, win 2027, options [nop,nop,TS val 98029 ecr 3672570], length 0
17:49:10.877536 IP 192.168.1.10.6633 > 192.168.1.30.40492: Flags [.], ack 17280, win 2027, options [nop,nop,TS val 98029 ecr 3672570], length 0
17:49:10.877587 IP 192.168.1.30.40492 > 192.168.1.10.6633: Flags [P.], seq 17280:17640, ack 1, win 139, options [nop,nop,TS val 3672571 ecr 98029], length 360: OpenFlow
	version 1.0, type PACKET_IN, length 360, xid 0x00000000
17:49:10.877626 IP 192.168.1.30.40492 > 192.168.1.10.6633: Flags [P.], seq 17640:18000, ack 1, win 139, options [nop,nop,TS val 3672571 ecr 98029], length 360: OpenFlow
	version 1.0, type PACKET_IN, length 360, xid 0x00000000
17:49:10.877656 IP 192.168.1.30.40492 > 192.168.1.10.6633: Flags [P.], seq 18000:18360, ack 1, win 139, options [nop,nop,TS val 3672571 ecr 98029], length 360: OpenFlow
	version 1.0, type PACKET_IN, length 360, xid 0x00000000
17:49:10.877687 IP 192.168.1.30.40492 > 192.168.1.10.6633: Flags [P.], seq 18360:18720, ack 1, win 139, options [nop,nop,TS val 3672571 ecr 98029], length 360: OpenFlow
	version 1.0, type PACKET_IN, length 360, xid 0x00000000
17:49:10.877766 IP 192.168.1.30.40492 > 192.168.1.10.6633: Flags [P.], seq 18720:19080, ack 1, win 139, options [nop,nop,TS val 3672571 ecr 98029], length 360: OpenFlow
	version 1.0, type PACKET_IN, length 360, xid 0x00000000
17:49:10.877804 IP 192.168.1.30.40492 > 192.168.1.10.6633: Flags [P.], seq 19080:19440, ack 1, win 139, options [nop,nop,TS val 3672571 ecr 98029], length 360: OpenFlow
	version 1.0, type PACKET_IN, length 360, xid 0x00000000
17:49:10.877839 IP 192.168.1.30.40492 > 192.168.1.10.6633: Flags [P.], seq 19440:19800, ack 1, win 139, options [nop,nop,TS val 3672571 ecr 98029], length 360: OpenFlow
	version 1.0, type PACKET_IN, length 360, xid 0x00000000
17:49:10.877875 IP 192.168.1.30.40492 > 192.168.1.10.6633: Flags [P.], seq 19800:20160, ack 1, win 139, options [nop,nop,TS val 3672571 ecr 98029], length 360: OpenFlow
	version 1.0, type PACKET_IN, length 360, xid 0x00000000
17:49:10.877915 IP 192.168.1.10.6633 > 192.168.1.30.40492: Flags [.], ack 18720, win 2027, options [nop,nop,TS val 98029 ecr 3672571], length 0
17:49:10.877963 IP 192.168.1.30.40492 > 192.168.1.10.6633: Flags [P.], seq 20160:20520, ack 1, win 139, options [nop,nop,TS val 3672571 ecr 98029], length 360: OpenFlow
	version 1.0, type PACKET_IN, length 360, xid 0x00000000
17:49:10.877994 IP 192.168.1.30.40492 > 192.168.1.10.6633: Flags [P.], seq 20520:20880, ack 1, win 139, options [nop,nop,TS val 3672571 ecr 98029], length 360: OpenFlow
	version 1.0, type PACKET_IN, length 360, xid 0x00000000
17:49:10.878024 IP 192.168.1.30.40492 > 192.168.1.10.6633: Flags [P.], seq 20880:21240, ack 1, win 139, options [nop,nop,TS val 3672571 ecr 98029], length 360: OpenFlow
	version 1.0, type PACKET_IN, length 360, xid 0x00000000
17:49:10.878077 IP 192.168.1.10.6633 > 192.168.1.30.40492: Flags [.], ack 19800, win 2027, options [nop,nop,TS val 98029 ecr 3672571], length 0
17:49:10.878093 IP 192.168.1.10.6633 > 192.168.1.30.40492: Flags [.], ack 20160, win 2027, options [nop,nop,TS val 98029 ecr 3672571], length 0
17:49:10.878116 IP 192.168.1.30.40492 > 192.168.1.10.6633: Flags [P.], seq 21240:21600, ack 1, win 139, options [nop,nop,TS val 3672571 ecr 98029], length 360: OpenFlow
	version 1.0, type PACKET_IN, length 360, xid 0x00000000
17:49:10.878152 IP 192.168.1.30.40492 > 192.168.1.10.6633: Flags [P.], seq 21600:21960, ack 1, win 139, options [nop,nop,TS val 3672571 ecr 98029], length 360: OpenFlow
	version 1.0, type PACKET_IN, length 360, xid 0x00000000
17:49:10.878189 IP 192.168.1.30.40492 > 192.168.1.10.6633: Flags [P.], seq 21960:22320, ack 1, win 139, options [nop,nop,TS val 3672571 ecr 98029], length 360: OpenFlow
	version 1.0, type PACKET_IN, length 360, xid 0x00000000
17:49:10.878244 IP 192.168.1.10.6633 > 192.168.1.30.40492: Flags [.], ack 21240, win 2027, options [nop,nop,TS val 98029 ecr 3672571], length 0
17:49:10.878268 IP 192.168.1.10.6633 > 192.168.1.30.40492: Flags [.], ack 21600, win 2027, options [nop,nop,TS val 98029 ecr 3672571], length 0
17:49:10.878303 IP 192.168.1.10.6633 > 192.168.1.30.40492: Flags [.], ack 22320, win 2027, options [nop,nop,TS val 98029 ecr 3672571], length 0
17:49:10.878338 IP 192.168.1.30.40492 > 192.168.1.10.6633: Flags [P.], seq 22320:22680, ack 1, win 139, options [nop,nop,TS val 3672571 ecr 98029], length 360: OpenFlow
	version 1.0, type PACKET_IN, length 360, xid 0x00000000
17:49:10.878377 IP 192.168.1.30.40492 > 192.168.1.10.6633: Flags [P.], seq 22680:23040, ack 1, win 139, options [nop,nop,TS val 3672571 ecr 98029], length 360: OpenFlow
	version 1.0, type PACKET_IN, length 360, xid 0x00000000
17:49:10.878414 IP 192.168.1.30.40492 > 192.168.1.10.6633: Flags [P.], seq 23040:23400, ack 1, win 139, options [nop,nop,TS val 3672571 ecr 98029], length 360: OpenFlow
	version 1.0, type PACKET_IN, length 360, xid 0x00000000
17:49:10.878450 IP 192.168.1.30.40492 > 192.168.1.10.6633: Flags [P.], seq 23400:23760, ack 1, win 139, options [nop,nop,TS val 3672571 ecr 98029], length 360: OpenFlow
	version 1.0, type PACKET_IN, length 360, xid 0x00000000
17:49:10.878495 IP 192.168.1.30.40492 > 192.168.1.10.6633: Flags [P.], seq 23760:24120, ack 1, win 139, options [nop,nop,TS val 3672571 ecr 98029], length 360: OpenFlow
	version 1.0, type PACKET_IN, length 360, xid 0x00000000
17:49:10.878569 IP 192.168.1.30.40492 > 192.168.1.10.6633: Flags [P.], seq 24120:24480, ack 1, win 139, options [nop,nop,TS val 3672571 ecr 98029], length 360: OpenFlow
	version 1.0, type PACKET_IN, length 360, xid 0x00000000
17:49:10.878605 IP 192.168.1.30.40492 > 192.168.1.10.6633: Flags [P.], seq 24480:24840, ack 1, win 139, options [nop,nop,TS val 3672571 ecr 98029], length 360: OpenFlow
	version 1.0, type PACKET_IN, length 360, xid 0x00000000
17:49:10.878640 IP 192.168.1.30.40492 > 192.168.1.10.6633: Flags [P.], seq 24840:25200, ack 1, win 139, options [nop,nop,TS val 3672571 ecr 98029], length 360: OpenFlow
	version 1.0, type PACKET_IN, length 360, xid 0x00000000
17:49:10.878675 IP 192.168.1.30.40492 > 192.168.1.10.6633: Flags [P.], seq 25200:25560, ack 1, win 139, options [nop,nop,TS val 3672571 ecr 98029], length 360: OpenFlow
	version 1.0, type PACKET_IN, length 360, xid 0x00000000
17:49:10.878710 IP 192.168.1.30.40492 > 192.168.1.10.6633: Flags [P.], seq 25560:25920, ack 1, win 139, options [nop,nop,TS val 3672571 ecr 98029], length 360: OpenFlow
	version 1.0, type PACKET_IN, length 360, xid 0x00000000
17:49:10.878739 IP 192.168.1.10.6633 > 192.168.1.30.40492: Flags [.], ack 23760, win 2027, options [nop,nop,TS val 98029 ecr 3672571], length 0
17:49:10.878751 IP 192.168.1.10.6633 > 192.168.1.30.40492: Flags [.], ack 24480, win 2027, options [nop,nop,TS val 98029 ecr 3672571], length 0
17:49:10.878763 IP 192.168.1.10.6633 > 192.168.1.30.40492: Flags [.], ack 24840, win 2027, options [nop,nop,TS val 98029 ecr 3672571], length 0
17:49:10.878775 IP 192.168.1.10.6633 > 192.168.1.30.40492: Flags [.], ack 25560, win 2027, options [nop,nop,TS val 98029 ecr 3672571], length 0
17:49:10.878834 IP 192.168.1.30.40492 > 192.168.1.10.6633: Flags [P.], seq 25920:26280, ack 1, win 139, options [nop,nop,TS val 3672571 ecr 98029], length 360: OpenFlow
	version 1.0, type PACKET_IN, length 360, xid 0x00000000
17:49:10.878867 IP 192.168.1.30.40492 > 192.168.1.10.6633: Flags [P.], seq 26280:26640, ack 1, win 139, options [nop,nop,TS val 3672571 ecr 98029], length 360: OpenFlow
	version 1.0, type PACKET_IN, length 360, xid 0x00000000
17:49:10.878898 IP 192.168.1.30.40492 > 192.168.1.10.6633: Flags [P.], seq 26640:27000, ack 1, win 139, options [nop,nop,TS val 3672571 ecr 98029], length 360: OpenFlow
	version 1.0, type PACKET_IN, length 360, xid 0x00000000
17:49:10.878929 IP 192.168.1.30.40492 > 192.168.1.10.6633: Flags [P.], seq 27000:27360, ack 1, win 139, options [nop,nop,TS val 3672571 ecr 98029], length 360: OpenFlow
	version 1.0, type PACKET_IN, length 360, xid 0x00000000
17:49:10.878971 IP 192.168.1.30.40492 > 192.168.1.10.6633: Flags [P.], seq 27360:27720, ack 1, win 139, options [nop,nop,TS val 3672571 ecr 98029], length 360: OpenFlow
	version 1.0, type PACKET_IN, length 360, xid 0x00000000
17:49:10.879001 IP 192.168.1.10.6633 > 192.168.1.30.40492: Flags [.], ack 25920, win 2027, options [nop,nop,TS val 98029 ecr 3672571], length 0
17:49:10.879044 IP 192.168.1.30.40492 > 192.168.1.10.6633: Flags [P.], seq 27720:28080, ack 1, win 139, options [nop,nop,TS val 3672571 ecr 98029], length 360: OpenFlow
	version 1.0, type PACKET_IN, length 360, xid 0x00000000
17:49:10.879079 IP 192.168.1.30.40492 > 192.168.1.10.6633: Flags [P.], seq 28080:28440, ack 1, win 139, options [nop,nop,TS val 3672571 ecr 98029], length 360: OpenFlow
	version 1.0, type PACKET_IN, length 360, xid 0x00000000
17:49:10.879114 IP 192.168.1.30.40492 > 192.168.1.10.6633: Flags [P.], seq 28440:28800, ack 1, win 139, options [nop,nop,TS val 3672571 ecr 98029], length 360: OpenFlow
	version 1.0, type PACKET_IN, length 360, xid 0x00000000
17:49:10.879149 IP 192.168.1.30.40492 > 192.168.1.10.6633: Flags [P.], seq 28800:29160, ack 1, win 139, options [nop,nop,TS val 3672571 ecr 98029], length 360: OpenFlow
	version 1.0, type PACKET_IN, length 360, xid 0x00000000
17:49:10.879174 IP 192.168.1.30.40492 > 192.168.1.10.6633: Flags [P.], seq 29160:29520, ack 1, win 139, options [nop,nop,TS val 3672571 ecr 98029], length 360: OpenFlow
	version 1.0, type PACKET_IN, length 360, xid 0x00000000
17:49:10.879202 IP 192.168.1.10.6633 > 192.168.1.30.40492: Flags [.], ack 27360, win 2027, options [nop,nop,TS val 98029 ecr 3672571], length 0
17:49:10.879216 IP 192.168.1.10.6633 > 192.168.1.30.40492: Flags [.], ack 28080, win 2027, options [nop,nop,TS val 98029 ecr 3672571], length 0
17:49:10.879227 IP 192.168.1.10.6633 > 192.168.1.30.40492: Flags [.], ack 28440, win 2027, options [nop,nop,TS val 98029 ecr 3672571], length 0
17:49:10.879250 IP 192.168.1.10.6633 > 192.168.1.30.40492: Flags [.], ack 29160, win 2027, options [nop,nop,TS val 98029 ecr 3672571], length 0
17:49:10.879293 IP 192.168.1.30.40492 > 192.168.1.10.6633: Flags [P.], seq 29520:29880, ack 1, win 139, options [nop,nop,TS val 3672571 ecr 98029], length 360: OpenFlow
	version 1.0, type PACKET_IN, length 360, xid 0x00000000
17:49:10.879318 IP 192.168.1.30.40492 > 192.168.1.10.6633: Flags [P.], seq 29880:30240, ack 1, win 139, options [nop,nop,TS val 3672571 ecr 98029], length 360: OpenFlow
	version 1.0, type PACKET_IN, length 360, xid 0x00000000
17:49:10.879342 IP 192.168.1.30.40492 > 192.168.1.10.6633: Flags [P.], seq 30240:30600, ack 1, win 139, options [nop,nop,TS val 3672571 ecr 98029], length 360: OpenFlow
	version 1.0, type PACKET_IN, length 360, xid 0x00000000
17:49:10.879365 IP 192.168.1.30.40492 > 192.168.1.10.6633: Flags [P.], seq 30600:30960, ack 1, win 139, options [nop,nop,TS val 3672571 ecr 98029], length 360: OpenFlow
	version 1.0, type PACKET_IN, length 360, xid 0x00000000
17:49:10.879389 IP 192.168.1.30.40492 > 192.168.1.10.6633: Flags [P.], seq 30960:31320, ack 1, win 139, options [nop,nop,TS val 3672571 ecr 98029], length 360: OpenFlow
	version 1.0, type PACKET_IN, length 360, xid 0x00000000
17:49:10.879412 IP 192.168.1.30.40492 > 192.168.1.10.6633: Flags [P.], seq 31320:31680, ack 1, win 139, options [nop,nop,TS val 3672571 ecr 98029], length 360: OpenFlow
	version 1.0, type PACKET_IN, length 360, xid 0x00000000
17:49:10.879435 IP 192.168.1.30.40492 > 192.168.1.10.6633: Flags [P.], seq 31680:32040, ack 1, win 139, options [nop,nop,TS val 3672571 ecr 98029], length 360: OpenFlow
	version 1.0, type PACKET_IN, length 360, xid 0x00000000
17:49:10.879458 IP 192.168.1.30.40492 > 192.168.1.10.6633: Flags [P.], seq 32040:32400, ack 1, win 139, options [nop,nop,TS val 3672571 ecr 98029], length 360: OpenFlow
	version 1.0, type PACKET_IN, length 360, xid 0x00000000
17:49:10.879488 IP 192.168.1.30.40492 > 192.168.1.10.6633: Flags [P.], seq 32400:32760, ack 1, win 139, options [nop,nop,TS val 3672571 ecr 98029], length 360: OpenFlow
	version 1.0, type PACKET_IN, length 360, xid 0x00000000
17:49:10.879517 IP 192.168.1.10.6633 > 192.168.1.30.40492: Flags [.], ack 29520, win 2027, options [nop,nop,TS val 98029 ecr 3672571], length 0
17:49:10.879545 IP 192.168.1.30.40492 > 192.168.1.10.6633: Flags [P.], seq 32760:33120, ack 1, win 139, options [nop,nop,TS val 3672571 ecr 98029], length 360: OpenFlow
	version 1.0, type PACKET_IN, length 360, xid 0x00000000
17:49:10.879570 IP 192.168.1.30.40492 > 192.168.1.10.6633: Flags [P.], seq 33120:33480, ack 1, win 139, options [nop,nop,TS val 3672571 ecr 98029], length 360: OpenFlow
	version 1.0, type PACKET_IN, length 360, xid 0x00000000
17:49:10.879595 IP 192.168.1.30.40492 > 192.168.1.10.6633: Flags [P.], seq 33480:33840, ack 1, win 139, options [nop,nop,TS val 3672571 ecr 98029], length 360: OpenFlow
	version 1.0, type PACKET_IN, length 360, xid 0x00000000
17:49:10.879622 IP 192.168.1.10.6633 > 192.168.1.30.40492: Flags [.], ack 31320, win 2027, options [nop,nop,TS val 98029 ecr 3672571], length 0
17:49:10.879636 IP 192.168.1.10.6633 > 192.168.1.30.40492: Flags [.], ack 32400, win 2027, options [nop,nop,TS val 98029 ecr 3672571], length 0
17:49:10.879676 IP 192.168.1.30.40492 > 192.168.1.10.6633: Flags [P.], seq 33840:34200, ack 1, win 139, options [nop,nop,TS val 3672571 ecr 98029], length 360: OpenFlow
	version 1.0, type PACKET_IN, length 360, xid 0x00000000
17:49:10.879701 IP 192.168.1.30.40492 > 192.168.1.10.6633: Flags [P.], seq 34200:34560, ack 1, win 139, options [nop,nop,TS val 3672571 ecr 98029], length 360: OpenFlow
	version 1.0, type PACKET_IN, length 360, xid 0x00000000
17:49:10.879725 IP 192.168.1.30.40492 > 192.168.1.10.6633: Flags [P.], seq 34560:34920, ack 1, win 139, options [nop,nop,TS val 3672571 ecr 98029], length 360: OpenFlow
	version 1.0, type PACKET_IN, length 360, xid 0x00000000
17:49:10.879750 IP 192.168.1.30.40492 > 192.168.1.10.6633: Flags [P.], seq 34920:35280, ack 1, win 139, options [nop,nop,TS val 3672571 ecr 98029], length 360: OpenFlow
	version 1.0, type PACKET_IN, length 360, xid 0x00000000
17:49:10.879773 IP 192.168.1.30.40492 > 192.168.1.10.6633: Flags [P.], seq 35280:35640, ack 1, win 139, options [nop,nop,TS val 3672571 ecr 98029], length 360: OpenFlow
	version 1.0, type PACKET_IN, length 360, xid 0x00000000
17:49:10.879807 IP 192.168.1.10.6633 > 192.168.1.30.40492: Flags [.], ack 33480, win 2027, options [nop,nop,TS val 98029 ecr 3672571], length 0
17:49:10.879824 IP 192.168.1.10.6633 > 192.168.1.30.40492: Flags [.], ack 33840, win 2027, options [nop,nop,TS val 98029 ecr 3672571], length 0
17:49:10.879844 IP 192.168.1.30.40492 > 192.168.1.10.6633: Flags [P.], seq 35640:36000, ack 1, win 139, options [nop,nop,TS val 3672571 ecr 98029], length 360: OpenFlow
	version 1.0, type PACKET_IN, length 360, xid 0x00000000
17:49:10.879869 IP 192.168.1.30.40492 > 192.168.1.10.6633: Flags [P.], seq 36000:36360, ack 1, win 139, options [nop,nop,TS val 3672571 ecr 98029], length 360: OpenFlow
	version 1.0, type PACKET_IN, length 360, xid 0x00000000
17:49:10.879893 IP 192.168.1.30.40492 > 192.168.1.10.6633: Flags [P.], seq 36360:36720, ack 1, win 139, options [nop,nop,TS val 3672571 ecr 98029], length 360: OpenFlow
	version 1.0, type PACKET_IN, length 360, xid 0x00000000
17:49:10.879917 IP 192.168.1.30.40492 > 192.168.1.10.6633: Flags [P.], seq 36720:37080, ack 1, win 139, options [nop,nop,TS val 3672571 ecr 98029], length 360: OpenFlow
	version 1.0, type PACKET_IN, length 360, xid 0x00000000
17:49:10.879938 IP 192.168.1.30.40492 > 192.168.1.10.6633: Flags [P.], seq 37080:37440, ack 1, win 139, options [nop,nop,TS val 3672571 ecr 98029], length 360: OpenFlow
	version 1.0, type PACKET_IN, length 360, xid 0x00000000
17:49:10.879962 IP 192.168.1.30.40492 > 192.168.1.10.6633: Flags [P.], seq 37440:37800, ack 1, win 139, options [nop,nop,TS val 3672571 ecr 98029], length 360: OpenFlow
	version 1.0, type PACKET_IN, length 360, xid 0x00000000
17:49:10.879986 IP 192.168.1.30.40492 > 192.168.1.10.6633: Flags [P.], seq 37800:38160, ack 1, win 139, options [nop,nop,TS val 3672571 ecr 98029], length 360: OpenFlow
	version 1.0, type PACKET_IN, length 360, xid 0x00000000
17:49:10.880010 IP 192.168.1.30.40492 > 192.168.1.10.6633: Flags [P.], seq 38160:38520, ack 1, win 139, options [nop,nop,TS val 3672571 ecr 98029], length 360: OpenFlow
	version 1.0, type PACKET_IN, length 360, xid 0x00000000
17:49:10.880053 IP 192.168.1.10.6633 > 192.168.1.30.40492: Flags [.], ack 35640, win 2027, options [nop,nop,TS val 98029 ecr 3672571], length 0
17:49:10.880064 IP 192.168.1.10.6633 > 192.168.1.30.40492: Flags [.], ack 36000, win 2027, options [nop,nop,TS val 98029 ecr 3672571], length 0
17:49:10.880073 IP 192.168.1.10.6633 > 192.168.1.30.40492: Flags [.], ack 37440, win 2027, options [nop,nop,TS val 98029 ecr 3672571], length 0
17:49:10.880094 IP 192.168.1.10.6633 > 192.168.1.30.40492: Flags [.], ack 38160, win 2027, options [nop,nop,TS val 98029 ecr 3672571], length 0
17:49:10.880138 IP 192.168.1.30.40492 > 192.168.1.10.6633: Flags [P.], seq 38520:38880, ack 1, win 139, options [nop,nop,TS val 3672571 ecr 98029], length 360: OpenFlow
	version 1.0, type PACKET_IN, length 360, xid 0x00000000
17:49:10.880160 IP 192.168.1.30.40492 > 192.168.1.10.6633: Flags [P.], seq 38880:39240, ack 1, win 139, options [nop,nop,TS val 3672571 ecr 98029], length 360: OpenFlow
	version 1.0, type PACKET_IN, length 360, xid 0x00000000
17:49:10.880181 IP 192.168.1.30.40492 > 192.168.1.10.6633: Flags [P.], seq 39240:39600, ack 1, win 139, options [nop,nop,TS val 3672571 ecr 98029], length 360: OpenFlow
	version 1.0, type PACKET_IN, length 360, xid 0x00000000
17:49:10.880200 IP 192.168.1.30.40492 > 192.168.1.10.6633: Flags [P.], seq 39600:39960, ack 1, win 139, options [nop,nop,TS val 3672571 ecr 98029], length 360: OpenFlow
	version 1.0, type PACKET_IN, length 360, xid 0x00000000
17:49:10.880220 IP 192.168.1.30.40492 > 192.168.1.10.6633: Flags [P.], seq 39960:40320, ack 1, win 139, options [nop,nop,TS val 3672571 ecr 98029], length 360: OpenFlow
	version 1.0, type PACKET_IN, length 360, xid 0x00000000
17:49:10.880241 IP 192.168.1.30.40492 > 192.168.1.10.6633: Flags [P.], seq 40320:40680, ack 1, win 139, options [nop,nop,TS val 3672571 ecr 98029], length 360: OpenFlow
	version 1.0, type PACKET_IN, length 360, xid 0x00000000
17:49:10.880263 IP 192.168.1.30.40492 > 192.168.1.10.6633: Flags [P.], seq 40680:41040, ack 1, win 139, options [nop,nop,TS val 3672571 ecr 98029], length 360: OpenFlow
	version 1.0, type PACKET_IN, length 360, xid 0x00000000
17:49:10.880284 IP 192.168.1.30.40492 > 192.168.1.10.6633: Flags [P.], seq 41040:41400, ack 1, win 139, options [nop,nop,TS val 3672571 ecr 98029], length 360: OpenFlow
	version 1.0, type PACKET_IN, length 360, xid 0x00000000
17:49:10.880310 IP 192.168.1.30.40492 > 192.168.1.10.6633: Flags [P.], seq 41400:41760, ack 1, win 139, options [nop,nop,TS val 3672571 ecr 98029], length 360: OpenFlow
	version 1.0, type PACKET_IN, length 360, xid 0x00000000
17:49:10.880390 IP 192.168.1.10.6633 > 192.168.1.30.40492: Flags [.], ack 38520, win 2027, options [nop,nop,TS val 98029 ecr 3672571], length 0
17:49:10.880403 IP 192.168.1.10.6633 > 192.168.1.30.40492: Flags [.], ack 40320, win 2027, options [nop,nop,TS val 98029 ecr 3672571], length 0
17:49:10.880456 IP 192.168.1.30.40492 > 192.168.1.10.6633: Flags [P.], seq 41760:42120, ack 1, win 139, options [nop,nop,TS val 3672571 ecr 98029], length 360: OpenFlow
	version 1.0, type PACKET_IN, length 360, xid 0x00000000
17:49:10.880481 IP 192.168.1.30.40492 > 192.168.1.10.6633: Flags [P.], seq 42120:42480, ack 1, win 139, options [nop,nop,TS val 3672571 ecr 98029], length 360: OpenFlow
	version 1.0, type PACKET_IN, length 360, xid 0x00000000
17:49:10.880505 IP 192.168.1.30.40492 > 192.168.1.10.6633: Flags [P.], seq 42480:42840, ack 1, win 139, options [nop,nop,TS val 3672571 ecr 98029], length 360: OpenFlow
	version 1.0, type PACKET_IN, length 360, xid 0x00000000
17:49:10.880528 IP 192.168.1.30.40492 > 192.168.1.10.6633: Flags [P.], seq 42840:43200, ack 1, win 139, options [nop,nop,TS val 3672571 ecr 98029], length 360: OpenFlow
	version 1.0, type PACKET_IN, length 360, xid 0x00000000
17:49:10.880552 IP 192.168.1.30.40492 > 192.168.1.10.6633: Flags [P.], seq 43200:43560, ack 1, win 139, options [nop,nop,TS val 3672571 ecr 98029], length 360: OpenFlow
	version 1.0, type PACKET_IN, length 360, xid 0x00000000
17:49:10.880575 IP 192.168.1.30.40492 > 192.168.1.10.6633: Flags [P.], seq 43560:43920, ack 1, win 139, options [nop,nop,TS val 3672571 ecr 98029], length 360: OpenFlow
	version 1.0, type PACKET_IN, length 360, xid 0x00000000
17:49:10.880597 IP 192.168.1.30.40492 > 192.168.1.10.6633: Flags [P.], seq 43920:44280, ack 1, win 139, options [nop,nop,TS val 3672571 ecr 98029], length 360: OpenFlow
	version 1.0, type PACKET_IN, length 360, xid 0x00000000
17:49:10.880632 IP 192.168.1.10.6633 > 192.168.1.30.40492: Flags [.], ack 41400, win 2027, options [nop,nop,TS val 98029 ecr 3672571], length 0
17:49:10.880647 IP 192.168.1.10.6633 > 192.168.1.30.40492: Flags [.], ack 41760, win 2027, options [nop,nop,TS val 98029 ecr 3672571], length 0
17:49:10.880659 IP 192.168.1.10.6633 > 192.168.1.30.40492: Flags [.], ack 42480, win 2027, options [nop,nop,TS val 98029 ecr 3672571], length 0
17:49:10.880670 IP 192.168.1.10.6633 > 192.168.1.30.40492: Flags [.], ack 43200, win 2027, options [nop,nop,TS val 98029 ecr 3672571], length 0
17:49:10.880681 IP 192.168.1.10.6633 > 192.168.1.30.40492: Flags [.], ack 44280, win 2027, options [nop,nop,TS val 98029 ecr 3672571], length 0
17:49:10.880708 IP 192.168.1.30.40492 > 192.168.1.10.6633: Flags [P.], seq 44280:44640, ack 1, win 139, options [nop,nop,TS val 3672571 ecr 98029], length 360: OpenFlow
	version 1.0, type PACKET_IN, length 360, xid 0x00000000
17:49:10.880743 IP 192.168.1.30.40492 > 192.168.1.10.6633: Flags [P.], seq 44640:45000, ack 1, win 139, options [nop,nop,TS val 3672571 ecr 98029], length 360: OpenFlow
	version 1.0, type PACKET_IN, length 360, xid 0x00000000
17:49:10.880767 IP 192.168.1.30.40492 > 192.168.1.10.6633: Flags [P.], seq 45000:45360, ack 1, win 139, options [nop,nop,TS val 3672571 ecr 98029], length 360: OpenFlow
	version 1.0, type PACKET_IN, length 360, xid 0x00000000
17:49:10.880789 IP 192.168.1.30.40492 > 192.168.1.10.6633: Flags [P.], seq 45360:45720, ack 1, win 139, options [nop,nop,TS val 3672571 ecr 98029], length 360: OpenFlow
	version 1.0, type PACKET_IN, length 360, xid 0x00000000
17:49:10.880811 IP 192.168.1.30.40492 > 192.168.1.10.6633: Flags [P.], seq 45720:46080, ack 1, win 139, options [nop,nop,TS val 3672571 ecr 98029], length 360: OpenFlow
	version 1.0, type PACKET_IN, length 360, xid 0x00000000
17:49:10.880836 IP 192.168.1.30.40492 > 192.168.1.10.6633: Flags [P.], seq 46080:46440, ack 1, win 139, options [nop,nop,TS val 3672571 ecr 98029], length 360: OpenFlow
	version 1.0, type PACKET_IN, length 360, xid 0x00000000
17:49:10.880859 IP 192.168.1.30.40492 > 192.168.1.10.6633: Flags [P.], seq 46440:46800, ack 1, win 139, options [nop,nop,TS val 3672571 ecr 98029], length 360: OpenFlow
	version 1.0, type PACKET_IN, length 360, xid 0x00000000
17:49:10.880882 IP 192.168.1.30.40492 > 192.168.1.10.6633: Flags [P.], seq 46800:47160, ack 1, win 139, options [nop,nop,TS val 3672571 ecr 98029], length 360: OpenFlow
	version 1.0, type PACKET_IN, length 360, xid 0x00000000
17:49:10.880912 IP 192.168.1.30.40492 > 192.168.1.10.6633: Flags [P.], seq 47160:47520, ack 1, win 139, options [nop,nop,TS val 3672571 ecr 98029], length 360: OpenFlow
	version 1.0, type PACKET_IN, length 360, xid 0x00000000
17:49:10.880936 IP 192.168.1.30.40492 > 192.168.1.10.6633: Flags [P.], seq 47520:47880, ack 1, win 139, options [nop,nop,TS val 3672571 ecr 98029], length 360: OpenFlow
	version 1.0, type PACKET_IN, length 360, xid 0x00000000
17:49:10.880958 IP 192.168.1.30.40492 > 192.168.1.10.6633: Flags [P.], seq 47880:48240, ack 1, win 139, options [nop,nop,TS val 3672571 ecr 98029], length 360: OpenFlow
	version 1.0, type PACKET_IN, length 360, xid 0x00000000
17:49:10.880980 IP 192.168.1.30.40492 > 192.168.1.10.6633: Flags [P.], seq 48240:48600, ack 1, win 139, options [nop,nop,TS val 3672571 ecr 98029], length 360: OpenFlow
	version 1.0, type PACKET_IN, length 360, xid 0x00000000
17:49:10.881010 IP 192.168.1.10.6633 > 192.168.1.30.40492: Flags [.], ack 46080, win 2027, options [nop,nop,TS val 98029 ecr 3672571], length 0
17:49:10.881041 IP 192.168.1.30.40492 > 192.168.1.10.6633: Flags [P.], seq 48600:48960, ack 1, win 139, options [nop,nop,TS val 3672571 ecr 98029], length 360: OpenFlow
	version 1.0, type PACKET_IN, length 360, xid 0x00000000
17:49:10.881065 IP 192.168.1.30.40492 > 192.168.1.10.6633: Flags [P.], seq 48960:49320, ack 1, win 139, options [nop,nop,TS val 3672571 ecr 98029], length 360: OpenFlow
	version 1.0, type PACKET_IN, length 360, xid 0x00000000
