17:49:10.763458 IP 192.168.1.30.40490 > 192.168.1.10.6633: Flags [P.], seq 3871155772:3871156132, ack 3849680784, win 58, options [nop,nop,TS val 3672542 ecr 97950], length 360: OpenFlow
	version 1.0, type PACKET_IN, length 360, xid 0x00000000
17:49:10.763509 IP 192.168.1.30.40490 > 192.168.1.10.6633: Flags [P.], seq 360:720, ack 1, win 58, options [nop,nop,TS val 3672542 ecr 97950], length 360: OpenFlow
	version 1.0, type PACKET_IN, length 360, xid 0x00000000
17:49:10.763548 IP 192.168.1.30.40490 > 192.168.1.10.6633: Flags [P.], seq 720:1080, ack 1, win 58, options [nop,nop,TS val 3672542 ecr 97950], length 360: OpenFlow
	version 1.0, type PACKET_IN, length 360, xid 0x00000000
17:49:10.763588 IP 192.168.1.30.40490 > 192.168.1.10.6633: Flags [P.], seq 1080:1440, ack 1, win 58, options [nop,nop,TS val 3672542 ecr 97950], length 360: OpenFlow
	version 1.0, type PACKET_IN, length 360, xid 0x00000000
17:49:10.763638 IP 192.168.1.30.40490 > 192.168.1.10.6633: Flags [P.], seq 1440:1800, ack 1, win 58, options [nop,nop,TS val 3672542 ecr 97950], length 360: OpenFlow
	version 1.0, type PACKET_IN, length 360, xid 0x00000000
17:49:10.763877 IP 192.168.1.10.6633 > 192.168.1.30.40490: Flags [.], ack 1800, win 1452, options [nop,nop,TS val 98000 ecr 3672542], length 0
17:49:10.764055 IP 192.168.1.30.40490 > 192.168.1.10.6633: Flags [P.], seq 1800:2160, ack 1, win 58, options [nop,nop,TS val 3672542 ecr 98000], length 360: OpenFlow
	version 1.0, type PACKET_IN, length 360, xid 0x00000000
17:49:10.764104 IP 192.168.1.30.40490 > 192.168.1.10.6633: Flags [P.], seq 2160:2520, ack 1, win 58, options [nop,nop,TS val 3672542 ecr 98000], length 360: OpenFlow
	version 1.0, type PACKET_IN, length 360, xid 0x00000000
17:49:10.764145 IP 192.168.1.30.40490 > 192.168.1.10.6633: Flags [P.], seq 2520:2880, ack 1, win 58, options [nop,nop,TS val 3672542 ecr 98000], length 360: OpenFlow
	version 1.0, type PACKET_IN, length 360, xid 0x00000000
17:49:10.764336 IP 192.168.1.10.6633 > 192.168.1.30.40490: Flags [.], ack 2880, win 1452, options [nop,nop,TS val 98000 ecr 3672542], length 0
17:49:10.764385 IP 192.168.1.30.40490 > 192.168.1.10.6633: Flags [P.], seq 2880:3240, ack 1, win 58, options [nop,nop,TS val 3672542 ecr 98000], length 360: OpenFlow
	version 1.0, type PACKET_IN, length 360, xid 0x00000000
17:49:10.764428 IP 192.168.1.30.40490 > 192.168.1.10.6633: Flags [P.], seq 3240:3600, ack 1, win 58, options [nop,nop,TS val 3672542 ecr 98000], length 360: OpenFlow
	version 1.0, type PACKET_IN, length 360, xid 0x00000000
17:49:10.764468 IP 192.168.1.30.40490 > 192.168.1.10.6633: Flags [P.], seq 3600:3960, ack 1, win 58, options [nop,nop,TS val 3672542 ecr 98000], length 360: OpenFlow
	version 1.0, type PACKET_IN, length 360, xid 0x00000000
17:49:10.764519 IP 192.168.1.30.40490 > 192.168.1.10.6633: Flags [P.], seq 3960:4320, ack 1, win 58, options [nop,nop,TS val 3672542 ecr 98000], length 360: OpenFlow
	version 1.0, type PACKET_IN, length 360, xid 0x00000000
17:49:10.764560 IP 192.168.1.30.40490 > 192.168.1.10.6633: Flags [P.], seq 4320:4680, ack 1, win 58, options [nop,nop,TS val 3672542 ecr 98000], length 360: OpenFlow
	version 1.0, type PACKET_IN, length 360, xid 0x00000000
17:49:10.764609 IP 192.168.1.30.40490 > 192.168.1.10.6633: Flags [P.], seq 4680:5040, ack 1, win 58, options [nop,nop,TS val 3672542 ecr 98000], length 360: OpenFlow
	version 1.0, type PACKET_IN, length 360, xid 0x00000000
17:49:10.764754 IP 192.168.1.10.6633 > 192.168.1.30.40490: Flags [.], ack 3240, win 1452, options [nop,nop,TS val 98000 ecr 3672542], length 0
17:49:10.764850 IP 192.168.1.30.40490 > 192.168.1.10.6633: Flags [P.], seq 5040:5400, ack 1, win 58, options [nop,nop,TS val 3672542 ecr 98000], length 360: OpenFlow
	version 1.0, type PACKET_IN, length 360, xid 0x00000000
17:49:10.764890 IP 192.168.1.30.40490 > 192.168.1.10.6633: Flags [P.], seq 5400:5760, ack 1, win 58, options [nop,nop,TS val 3672542 ecr 98000], length 360: OpenFlow
	version 1.0, type PACKET_IN, length 360, xid 0x00000000
17:49:10.764929 IP 192.168.1.30.40490 > 192.168.1.10.6633: Flags [P.], seq 5760:6120, ack 1, win 58, options [nop,nop,TS val 3672542 ecr 98000], length 360: OpenFlow
	version 1.0, type PACKET_IN, length 360, xid 0x00000000
17:49:10.764979 IP 192.168.1.10.6633 > 192.168.1.30.40490: Flags [.], ack 5040, win 1452, options [nop,nop,TS val 98000 ecr 3672542], length 0
17:49:10.765044 IP 192.168.1.30.40490 > 192.168.1.10.6633: Flags [P.], seq 6120:6480, ack 1, win 58, options [nop,nop,TS val 3672542 ecr 98000], length 360: OpenFlow
	version 1.0, type PACKET_IN, length 360, xid 0x00000000
17:49:10.765086 IP 192.168.1.30.40490 > 192.168.1.10.6633: Flags [P.], seq 6480:6840, ack 1, win 58, options [nop,nop,TS val 3672542 ecr 98000], length 360: OpenFlow
	version 1.0, type PACKET_IN, length 360, xid 0x00000000
17:49:10.765126 IP 192.168.1.30.40490 > 192.168.1.10.6633: Flags [P.], seq 6840:7200, ack 1, win 58, options [nop,nop,TS val 3672542 ecr 98000], length 360: OpenFlow
	version 1.0, type PACKET_IN, length 360, xid 0x00000000
17:49:10.765167 IP 192.168.1.30.40490 > 192.168.1.10.6633: Flags [P.], seq 7200:7560, ack 1, win 58, options [nop,nop,TS val 3672542 ecr 98000], length 360: OpenFlow
	version 1.0, type PACKET_IN, length 360, xid 0x00000000
17:49:10.765207 IP 192.168.1.30.40490 > 192.168.1.10.6633: Flags [P.], seq 7560:7920, ack 1, win 58, options [nop,nop,TS val 3672542 ecr 98000], length 360: OpenFlow
	version 1.0, type PACKET_IN, length 360, xid 0x00000000
17:49:10.765316 IP 192.168.1.30.40490 > 192.168.1.10.6633: Flags [P.], seq 7920:8280, ack 1, win 58, options [nop,nop,TS val 3672542 ecr 98000], length 360: OpenFlow
	version 1.0, type PACKET_IN, length 360, xid 0x00000000
17:49:10.765362 IP 192.168.1.30.40490 > 192.168.1.10.6633: Flags [P.], seq 8280:8640, ack 1, win 58, options [nop,nop,TS val 3672542 ecr 98000], length 360: OpenFlow
	version 1.0, type PACKET_IN, length 360, xid 0x00000000
17:49:10.765403 IP 192.168.1.30.40490 > 192.168.1.10.6633: Flags [P.], seq 8640:9000, ack 1, win 58, options [nop,nop,TS val 3672542 ecr 98000], length 360: OpenFlow
	version 1.0, type PACKET_IN, length 360, xid 0x00000000
17:49:10.765443 IP 192.168.1.30.40490 > 192.168.1.10.6633: Flags [P.], seq 9000:9360, ack 1, win 58, options [nop,nop,TS val 3672542 ecr 98000], length 360: OpenFlow
	version 1.0, type PACKET_IN, length 360, xid 0x00000000
17:49:10.765498 IP 192.168.1.30.40490 > 192.168.1.10.6633: Flags [P.], seq 9360:9720, ack 1, win 58, options [nop,nop,TS val 3672543 ecr 98000], length 360: OpenFlow
	version 1.0, type PACKET_IN, length 360, xid 0x00000000
17:49:10.765539 IP 192.168.1.30.40490 > 192.168.1.10.6633: Flags [P.], seq 9720:10080, ack 1, win 58, options [nop,nop,TS val 3672543 ecr 98000], length 360: OpenFlow
	version 1.0, type PACKET_IN, length 360, xid 0x00000000
17:49:10.765570 IP 192.168.1.10.6633 > 192.168.1.30.40490: Flags [.], ack 6480, win 1452, options [nop,nop,TS val 98000 ecr 3672542], length 0
17:49:10.765665 IP 192.168.1.30.40490 > 192.168.1.10.6633: Flags [P.], seq 10080:10440, ack 1, win 58, options [nop,nop,TS val 3672543 ecr 98000], length 360: OpenFlow
	version 1.0, type PACKET_IN, length 360, xid 0x00000000
17:49:10.765705 IP 192.168.1.30.40490 > 192.168.1.10.6633: Flags [P.], seq 10440:10800, ack 1, win 58, options [nop,nop,TS val 3672543 ecr 98000], length 360: OpenFlow
	version 1.0, type PACKET_IN, length 360, xid 0x00000000
17:49:10.765745 IP 192.168.1.30.40490 > 192.168.1.10.6633: Flags [P.], seq 10800:11160, ack 1, win 58, options [nop,nop,TS val 3672543 ecr 98000], length 360: OpenFlow
	version 1.0, type PACKET_IN, length 360, xid 0x00000000
17:49:10.765786 IP 192.168.1.30.40490 > 192.168.1.10.6633: Flags [P.], seq 11160:11520, ack 1, win 58, options [nop,nop,TS val 3672543 ecr 98000], length 360: OpenFlow
	version 1.0, type PACKET_IN, length 360, xid 0x00000000
17:49:10.765838 IP 192.168.1.30.40490 > 192.168.1.10.6633: Flags [P.], seq 11520:11880, ack 1, win 58, options [nop,nop,TS val 3672543 ecr 98000], length 360: OpenFlow
	version 1.0, type PACKET_IN, length 360, xid 0x00000000
17:49:10.765890 IP 192.168.1.10.6633 > 192.168.1.30.40490: Flags [.], ack 6840, win 1452, options [nop,nop,TS val 98001 ecr 3672542], length 0
17:49:10.765905 IP 192.168.1.10.6633 > 192.168.1.30.40490: Flags [.], ack 8640, win 1452, options [nop,nop,TS val 98001 ecr 3672542], length 0
17:49:10.765911 IP 192.168.1.10.6633 > 192.168.1.30.40490: Flags [.], ack 10800, win 1452, options [nop,nop,TS val 98001 ecr 3672542], length 0
17:49:10.766002 IP 192.168.1.30.40490 > 192.168.1.10.6633: Flags [P.], seq 11880:12240, ack 1, win 58, options [nop,nop,TS val 3672543 ecr 98001], length 360: OpenFlow
	version 1.0, type PACKET_IN, length 360, xid 0x00000000
17:49:10.766034 IP 192.168.1.30.40490 > 192.168.1.10.6633: Flags [P.], seq 12240:12600, ack 1, win 58, options [nop,nop,TS val 3672543 ecr 98001], length 360: OpenFlow
	version 1.0, type PACKET_IN, length 360, xid 0x00000000
17:49:10.766056 IP 192.168.1.30.40490 > 192.168.1.10.6633: Flags [P.], seq 12600:12960, ack 1, win 58, options [nop,nop,TS val 3672543 ecr 98001], length 360: OpenFlow
	version 1.0, type PACKET_IN, length 360, xid 0x00000000
17:49:10.766078 IP 192.168.1.30.40490 > 192.168.1.10.6633: Flags [P.], seq 12960:13320, ack 1, win 58, options [nop,nop,TS val 3672543 ecr 98001], length 360: OpenFlow
	version 1.0, type PACKET_IN, length 360, xid 0x00000000
17:49:10.766108 IP 192.168.1.30.40490 > 192.168.1.10.6633: Flags [P.], seq 13320:13680, ack 1, win 58, options [nop,nop,TS val 3672543 ecr 98001], length 360: OpenFlow
	version 1.0, type PACKET_IN, length 360, xid 0x00000000
17:49:10.766144 IP 192.168.1.30.40490 > 192.168.1.10.6633: Flags [P.], seq 13680:14040, ack 1, win 58, options [nop,nop,TS val 3672543 ecr 98001], length 360: OpenFlow
	version 1.0, type PACKET_IN, length 360, xid 0x00000000
17:49:10.766166 IP 192.168.1.30.40490 > 192.168.1.10.6633: Flags [P.], seq 14040:14400, ack 1, win 58, options [nop,nop,TS val 3672543 ecr 98001], length 360: OpenFlow
	version 1.0, type PACKET_IN, length 360, xid 0x00000000
17:49:10.766192 IP 192.168.1.30.40490 > 192.168.1.10.6633: Flags [P.], seq 14400:14760, ack 1, win 58, options [nop,nop,TS val 3672543 ecr 98001], length 360: OpenFlow
	version 1.0, type PACKET_IN, length 360, xid 0x00000000
17:49:10.766230 IP 192.168.1.30.40490 > 192.168.1.10.6633: Flags [P.], seq 14760:15120, ack 1, win 58, options [nop,nop,TS val 3672543 ecr 98001], length 360: OpenFlow
	version 1.0, type PACKET_IN, length 360, xid 0x00000000
17:49:10.766269 IP 192.168.1.30.40490 > 192.168.1.10.6633: Flags [P.], seq 15120:15480, ack 1, win 58, options [nop,nop,TS val 3672543 ecr 98001], length 360: OpenFlow
	version 1.0, type PACKET_IN, length 360, xid 0x00000000
17:49:10.766303 IP 192.168.1.10.6633 > 192.168.1.30.40490: Flags [.], ack 11880, win 1452, options [nop,nop,TS val 98001 ecr 3672543], length 0
17:49:10.766327 IP 192.168.1.10.6633 > 192.168.1.30.40490: Flags [.], ack 13680, win 1452, options [nop,nop,TS val 98001 ecr 3672543], length 0
17:49:10.766385 IP 192.168.1.30.40490 > 192.168.1.10.6633: Flags [P.], seq 15480:15840, ack 1, win 58, options [nop,nop,TS val 3672543 ecr 98001], length 360: OpenFlow
	version 1.0, type PACKET_IN, length 360, xid 0x00000000
17:49:10.766429 IP 192.168.1.30.40490 > 192.168.1.10.6633: Flags [P.], seq 15840:16200, ack 1, win 58, options [nop,nop,TS val 3672543 ecr 98001], length 360: OpenFlow
	version 1.0, type PACKET_IN, length 360, xid 0x00000000
17:49:10.766473 IP 192.168.1.30.40490 > 192.168.1.10.6633: Flags [P.], seq 16200:16560, ack 1, win 58, options [nop,nop,TS val 3672543 ecr 98001], length 360: OpenFlow
	version 1.0, type PACKET_IN, length 360, xid 0x00000000
17:49:10.766535 IP 192.168.1.10.6633 > 192.168.1.30.40490: Flags [.], ack 15120, win 1452, options [nop,nop,TS val 98001 ecr 3672543], length 0
17:49:10.766566 IP 192.168.1.30.40490 > 192.168.1.10.6633: Flags [P.], seq 16560:16920, ack 1, win 58, options [nop,nop,TS val 3672543 ecr 98001], length 360: OpenFlow
	version 1.0, type PACKET_IN, length 360, xid 0x00000000
17:49:10.766603 IP 192.168.1.30.40490 > 192.168.1.10.6633: Flags [P.], seq 16920:17280, ack 1, win 58, options [nop,nop,TS val 3672543 ecr 98001], length 360: OpenFlow
	version 1.0, type PACKET_IN, length 360, xid 0x00000000
17:49:10.766629 IP 192.168.1.30.40490 > 192.168.1.10.6633: Flags [P.], seq 17280:17640, ack 1, win 58, options [nop,nop,TS val 3672543 ecr 98001], length 360: OpenFlow
	version 1.0, type PACKET_IN, length 360, xid 0x00000000
17:49:10.766668 IP 192.168.1.30.40490 > 192.168.1.10.6633: Flags [P.], seq 17640:18000, ack 1, win 58, options [nop,nop,TS val 3672543 ecr 98001], length 360: OpenFlow
	version 1.0, type PACKET_IN, length 360, xid 0x00000000
17:49:10.766709 IP 192.168.1.30.40490 > 192.168.1.10.6633: Flags [P.], seq 18000:18360, ack 1, win 58, options [nop,nop,TS val 3672543 ecr 98001], length 360: OpenFlow
	version 1.0, type PACKET_IN, length 360, xid 0x00000000
17:49:10.766767 IP 192.168.1.10.6633 > 192.168.1.30.40490: Flags [.], ack 16560, win 1452, options [nop,nop,TS val 98001 ecr 3672543], length 0
17:49:10.766788 IP 192.168.1.10.6633 > 192.168.1.30.40490: Flags [.], ack 17280, win 1452, options [nop,nop,TS val 98001 ecr 3672543], length 0
17:49:10.766827 IP 192.168.1.30.40490 > 192.168.1.10.6633: Flags [P.], seq 18360:18720, ack 1, win 58, options [nop,nop,TS val 3672543 ecr 98001], length 360: OpenFlow
	version 1.0, type PACKET_IN, length 360, xid 0x00000000
17:49:10.766874 IP 192.168.1.30.40490 > 192.168.1.10.6633: Flags [P.], seq 18720:19080, ack 1, win 58, options [nop,nop,TS val 3672543 ecr 98001], length 360: OpenFlow
	version 1.0, type PACKET_IN, length 360, xid 0x00000000
17:49:10.766920 IP 192.168.1.30.40490 > 192.168.1.10.6633: Flags [P.], seq 19080:19440, ack 1, win 58, options [nop,nop,TS val 3672543 ecr 98001], length 360: OpenFlow
	version 1.0, type PACKET_IN, length 360, xid 0x00000000
17:49:10.766962 IP 192.168.1.30.40490 > 192.168.1.10.6633: Flags [P.], seq 19440:19800, ack 1, win 58, options [nop,nop,TS val 3672543 ecr 98001], length 360: OpenFlow
	version 1.0, type PACKET_IN, length 360, xid 0x00000000
17:49:10.767013 IP 192.168.1.30.40490 > 192.168.1.10.6633: Flags [P.], seq 19800:20160, ack 1, win 58, options [nop,nop,TS val 3672543 ecr 98001], length 360: OpenFlow
	version 1.0, type PACKET_IN, length 360, xid 0x00000000
17:49:10.767046 IP 192.168.1.10.6633 > 192.168.1.30.40490: Flags [.], ack 18360, win 1452, options [nop,nop,TS val 98001 ecr 3672543], length 0
17:49:10.767101 IP 192.168.1.30.40490 > 192.168.1.10.6633: Flags [P.], seq 20160:20520, ack 1, win 58, options [nop,nop,TS val 3672543 ecr 98001], length 360: OpenFlow
	version 1.0, type PACKET_IN, length 360, xid 0x00000000
17:49:10.767140 IP 192.168.1.30.40490 > 192.168.1.10.6633: Flags [P.], seq 20520:20880, ack 1, win 58, options [nop,nop,TS val 3672543 ecr 98001], length 360: OpenFlow
	version 1.0, type PACKET_IN, length 360, xid 0x00000000
17:49:10.767178 IP 192.168.1.30.40490 > 192.168.1.10.6633: Flags [P.], seq 20880:21240, ack 1, win 58, options [nop,nop,TS val 3672543 ecr 98001], length 360: OpenFlow
	version 1.0, type PACKET_IN, length 360, xid 0x00000000
17:49:10.767211 IP 192.168.1.30.40490 > 192.168.1.10.6633: Flags [P.], seq 21240:21600, ack 1, win 58, options [nop,nop,TS val 3672543 ecr 98001], length 360: OpenFlow
	version 1.0, type PACKET_IN, length 360, xid 0x00000000
17:49:10.767249 IP 192.168.1.30.40490 > 192.168.1.10.6633: Flags [P.], seq 21600:21960, ack 1, win 58, options [nop,nop,TS val 3672543 ecr 98001], length 360: OpenFlow
	version 1.0, type PACKET_IN, length 360, xid 0x00000000
17:49:10.767286 IP 192.168.1.30.40490 > 192.168.1.10.6633: Flags [P.], seq 21960:22320, ack 1, win 58, options [nop,nop,TS val 3672543 ecr 98001], length 360: OpenFlow
	version 1.0, type PACKET_IN, length 360, xid 0x00000000
17:49:10.767328 IP 192.168.1.10.6633 > 192.168.1.30.40490: Flags [.], ack 20160, win 1452, options [nop,nop,TS val 98001 ecr 3672543], length 0
17:49:10.767352 IP 192.168.1.10.6633 > 192.168.1.30.40490: Flags [.], ack 20880, win 1452, options [nop,nop,TS val 98001 ecr 3672543], length 0
17:49:10.767418 IP 192.168.1.30.40490 > 192.168.1.10.6633: Flags [P.], seq 22320:22680, ack 1, win 58, options [nop,nop,TS val 3672543 ecr 98001], length 360: OpenFlow
	version 1.0, type PACKET_IN, length 360, xid 0x00000000
17:49:10.767464 IP 192.168.1.30.40490 > 192.168.1.10.6633: Flags [P.], seq 22680:23040, ack 1, win 58, options [nop,nop,TS val 3672543 ecr 98001], length 360: OpenFlow
	version 1.0, type PACKET_IN, length 360, xid 0x00000000
17:49:10.767508 IP 192.168.1.30.40490 > 192.168.1.10.6633: Flags [P.], seq 23040:23400, ack 1, win 58, options [nop,nop,TS val 3672543 ecr 98001], length 360: OpenFlow
	version 1.0, type PACKET_IN, length 360, xid 0x00000000
17:49:10.767553 IP 192.168.1.30.40490 > 192.168.1.10.6633: Flags [P.], seq 23400:23760, ack 1, win 58, options [nop,nop,TS val 3672543 ecr 98001], length 360: OpenFlow
	version 1.0, type PACKET_IN, length 360, xid 0x00000000
17:49:10.767629 IP 192.168.1.10.6633 > 192.168.1.30.40490: Flags [.], ack 22320, win 1452, options [nop,nop,TS val 98001 ecr 3672543], length 0
17:49:10.767644 IP 192.168.1.10.6633 > 192.168.1.30.40490: Flags [.], ack 22680, win 1452, options [nop,nop,TS val 98001 ecr 3672543], length 0
17:49:10.767661 IP 192.168.1.10.6633 > 192.168.1.30.40490: Flags [.], ack 23040, win 1452, options [nop,nop,TS val 98001 ecr 3672543], length 0
17:49:10.767690 IP 192.168.1.10.6633 > 192.168.1.30.40490: Flags [.], ack 23760, win 1452, options [nop,nop,TS val 98001 ecr 3672543], length 0
17:49:10.767710 IP 192.168.1.30.40490 > 192.168.1.10.6633: Flags [P.], seq 23760:24120, ack 1, win 58, options [nop,nop,TS val 3672543 ecr 98001], length 360: OpenFlow
	version 1.0, type PACKET_IN, length 360, xid 0x00000000
17:49:10.767759 IP 192.168.1.30.40490 > 192.168.1.10.6633: Flags [P.], seq 24120:24480, ack 1, win 58, options [nop,nop,TS val 3672543 ecr 98001], length 360: OpenFlow
	version 1.0, type PACKET_IN, length 360, xid 0x00000000
17:49:10.767797 IP 192.168.1.30.40490 > 192.168.1.10.6633: Flags [P.], seq 24480:24840, ack 1, win 58, options [nop,nop,TS val 3672543 ecr 98001], length 360: OpenFlow
	version 1.0, type PACKET_IN, length 360, xid 0x00000000
17:49:10.767840 IP 192.168.1.30.40490 > 192.168.1.10.6633: Flags [P.], seq 24840:25200, ack 1, win 58, options [nop,nop,TS val 3672543 ecr 98001], length 360: OpenFlow
	version 1.0, type PACKET_IN, length 360, xid 0x00000000
17:49:10.767889 IP 192.168.1.30.40490 > 192.168.1.10.6633: Flags [P.], seq 25200:25560, ack 1, win 58, options [nop,nop,TS val 3672543 ecr 98001], length 360: OpenFlow
	version 1.0, type PACKET_IN, length 360, xid 0x00000000
17:49:10.767949 IP 192.168.1.30.40490 > 192.168.1.10.6633: Flags [P.], seq 25560:25920, ack 1, win 58, options [nop,nop,TS val 3672543 ecr 98001], length 360: OpenFlow
	version 1.0, type PACKET_IN, length 360, xid 0x00000000
17:49:10.767988 IP 192.168.1.30.40490 > 192.168.1.10.6633: Flags [P.], seq 25920:26280, ack 1, win 58, options [nop,nop,TS val 3672543 ecr 98001], length 360: OpenFlow
	version 1.0, type PACKET_IN, length 360, xid 0x00000000
17:49:10.768025 IP 192.168.1.30.40490 > 192.168.1.10.6633: Flags [P.], seq 26280:26640, ack 1, win 58, options [nop,nop,TS val 3672543 ecr 98001], length 360: OpenFlow
	version 1.0, type PACKET_IN, length 360, xid 0x00000000
17:49:10.768063 IP 192.168.1.30.40490 > 192.168.1.10.6633: Flags [P.], seq 26640:27000, ack 1, win 58, options [nop,nop,TS val 3672543 ecr 98001], length 360: OpenFlow
	version 1.0, type PACKET_IN, length 360, xid 0x00000000
17:49:10.768088 IP 192.168.1.10.6633 > 192.168.1.30.40490: Flags [.], ack 25200, win 1452, options [nop,nop,TS val 98001 ecr 3672543], length 0
17:49:10.768137 IP 192.168.1.10.6633 > 192.168.1.30.40490: Flags [.], ack 26640, win 1452, options [nop,nop,TS val 98001 ecr 3672543], length 0
17:49:10.768217 IP 192.168.1.30.40490 > 192.168.1.10.6633: Flags [P.], seq 27000:27360, ack 1, win 58, options [nop,nop,TS val 3672543 ecr 98001], length 360: OpenFlow
	version 1.0, type PACKET_IN, length 360, xid 0x00000000
17:49:10.768257 IP 192.168.1.30.40490 > 192.168.1.10.6633: Flags [P.], seq 27360:27720, ack 1, win 58, options [nop,nop,TS val 3672543 ecr 98001], length 360: OpenFlow
	version 1.0, type PACKET_IN, length 360, xid 0x00000000
17:49:10.768294 IP 192.168.1.30.40490 > 192.168.1.10.6633: Flags [P.], seq 27720:28080, ack 1, win 58, options [nop,nop,TS val 3672543 ecr 98001], length 360: OpenFlow
	version 1.0, type PACKET_IN, length 360, xid 0x00000000
17:49:10.768332 IP 192.168.1.30.40490 > 192.168.1.10.6633: Flags [P.], seq 28080:28440, ack 1, win 58, options [nop,nop,TS val 3672543 ecr 98001], length 360: OpenFlow
	version 1.0, type PACKET_IN, length 360, xid 0x00000000
17:49:10.768384 IP 192.168.1.10.6633 > 192.168.1.30.40490: Flags [.], ack 27000, win 1452, options [nop,nop,TS val 98001 ecr 3672543], length 0
17:49:10.768449 IP 192.168.1.30.40490 > 192.168.1.10.6633: Flags [P.], seq 28440:28800, ack 1, win 58, options [nop,nop,TS val 3672543 ecr 98001], length 360: OpenFlow
	version 1.0, type PACKET_IN, length 360, xid 0x00000000
17:49:10.768490 IP 192.168.1.30.40490 > 192.168.1.10.6633: Flags [P.], seq 28800:29160, ack 1, win 58, options [nop,nop,TS val 3672543 ecr 98001], length 360: OpenFlow
	version 1.0, type PACKET_IN, length 360, xid 0x00000000
17:49:10.768530 IP 192.168.1.30.40490 > 192.168.1.10.6633: Flags [P.], seq 29160:29520, ack 1, win 58, options [nop,nop,TS val 3672543 ecr 98001], length 360: OpenFlow
	version 1.0, type PACKET_IN, length 360, xid 0x00000000
17:49:10.768567 IP 192.168.1.30.40490 > 192.168.1.10.6633: Flags [P.], seq 29520:29880, ack 1, win 58, options [nop,nop,TS val 3672543 ecr 98001], length 360: OpenFlow
	version 1.0, type PACKET_IN, length 360, xid 0x00000000
17:49:10.768603 IP 192.168.1.30.40490 > 192.168.1.10.6633: Flags [P.], seq 29880:30240, ack 1, win 58, options [nop,nop,TS val 3672543 ecr 98001], length 360: OpenFlow
	version 1.0, type PACKET_IN, length 360, xid 0x00000000
17:49:10.768641 IP 192.168.1.30.40490 > 192.168.1.10.6633: Flags [P.], seq 30240:30600, ack 1, win 58, options [nop,nop,TS val 3672543 ecr 98001], length 360: OpenFlow
	version 1.0, type PACKET_IN, length 360, xid 0x00000000
17:49:10.768693 IP 192.168.1.10.6633 > 192.168.1.30.40490: Flags [.], ack 28440, win 1452, options [nop,nop,TS val 98001 ecr 3672543], length 0
17:49:10.768713 IP 192.168.1.10.6633 > 192.168.1.30.40490: Flags [.], ack 29520, win 1452, options [nop,nop,TS val 98001 ecr 3672543], length 0
17:49:10.768754 IP 192.168.1.30.40490 > 192.168.1.10.6633: Flags [P.], seq 30600:30960, ack 1, win 58, options [nop,nop,TS val 3672543 ecr 98001], length 360: OpenFlow
	version 1.0, type PACKET_IN, length 360, xid 0x00000000
17:49:10.768802 IP 192.168.1.30.40490 > 192.168.1.10.6633: Flags [P.], seq 30960:31320, ack 1, win 58, options [nop,nop,TS val 3672543 ecr 98001], length 360: OpenFlow
	version 1.0, type PACKET_IN, length 360, xid 0x00000000
17:49:10.768845 IP 192.168.1.30.40490 > 192.168.1.10.6633: Flags [P.], seq 31320:31680, ack 1, win 58, options [nop,nop,TS val 3672543 ecr 98001], length 360: OpenFlow
	version 1.0, type PACKET_IN, length 360, xid 0x00000000
17:49:10.768900 IP 192.168.1.10.6633 > 192.168.1.30.40490: Flags [.], ack 30600, win 1452, options [nop,nop,TS val 98001 ecr 3672543], length 0
17:49:10.768931 IP 192.168.1.10.6633 > 192.168.1.30.40490: Flags [.], ack 30960, win 1452, options [nop,nop,TS val 98001 ecr 3672543], length 0
17:49:10.768954 IP 192.168.1.30.40490 > 192.168.1.10.6633: Flags [P.], seq 31680:32040, ack 1, win 58, options [nop,nop,TS val 3672543 ecr 98001], length 360: OpenFlow
	version 1.0, type PACKET_IN, length 360, xid 0x00000000
17:49:10.769027 IP 192.168.1.30.40490 > 192.168.1.10.6633: Flags [P.], seq 32040:32400, ack 1, win 58, options [nop,nop,TS val 3672543 ecr 98001], length 360: OpenFlow
	version 1.0, type PACKET_IN, length 360, xid 0x00000000
17:49:10.769069 IP 192.168.1.30.40490 > 192.168.1.10.6633: Flags [P.], seq 32400:32760, ack 1, win 58, options [nop,nop,TS val 3672543 ecr 98001], length 360: OpenFlow
	version 1.0, type PACKET_IN, length 360, xid 0x00000000
17:49:10.769107 IP 192.168.1.30.40490 > 192.168.1.10.6633: Flags [P.], seq 32760:33120, ack 1, win 58, options [nop,nop,TS val 3672543 ecr 98001], length 360: OpenFlow
	version 1.0, type PACKET_IN, length 360, xid 0x00000000
17:49:10.769141 IP 192.168.1.30.40490 > 192.168.1.10.6633: Flags [P.], seq 33120:33480, ack 1, win 58, options [nop,nop,TS val 3672543 ecr 98001], length 360: OpenFlow
	version 1.0, type PACKET_IN, length 360, xid 0x00000000
17:49:10.769180 IP 192.168.1.30.40490 > 192.168.1.10.6633: Flags [P.], seq 33480:33840, ack 1, win 58, options [nop,nop,TS val 3672543 ecr 98001], length 360: OpenFlow
	version 1.0, type PACKET_IN, length 360, xid 0x00000000
17:49:10.769227 IP 192.168.1.10.6633 > 192.168.1.30.40490: Flags [.], ack 31680, win 1452, options [nop,nop,TS val 98001 ecr 3672543], length 0
17:49:10.769251 IP 192.168.1.10.6633 > 192.168.1.30.40490: Flags [.], ack 32040, win 1452, options [nop,nop,TS val 98001 ecr 3672543], length 0
17:49:10.769296 IP 192.168.1.30.40490 > 192.168.1.10.6633: Flags [P.], seq 33840:34200, ack 1, win 58, options [nop,nop,TS val 3672543 ecr 98001], length 360: OpenFlow
	version 1.0, type PACKET_IN, length 360, xid 0x00000000
17:49:10.769389 IP 192.168.1.30.40490 > 192.168.1.10.6633: Flags [P.], seq 34200:34560, ack 1, win 58, options [nop,nop,TS val 3672543 ecr 98001], length 360: OpenFlow
	version 1.0, type PACKET_IN, length 360, xid 0x00000000
17:49:10.769424 IP 192.168.1.30.40490 > 192.168.1.10.6633: Flags [P.], seq 34560:34920, ack 1, win 58, options [nop,nop,TS val 3672543 ecr 98001], length 360: OpenFlow
	version 1.0, type PACKET_IN, length 360, xid 0x00000000
17:49:10.769462 IP 192.168.1.30.40490 > 192.168.1.10.6633: Flags [P.], seq 34920:35280, ack 1, win 58, options [nop,nop,TS val 3672543 ecr 98001], length 360: OpenFlow
	version 1.0, type PACKET_IN, length 360, xid 0x00000000
17:49:10.769524 IP 192.168.1.30.40490 > 192.168.1.10.6633: Flags [P.], seq 35280:35640, ack 1, win 58, options [nop,nop,TS val 3672544 ecr 98001], length 360: OpenFlow
	version 1.0, type PACKET_IN, length 360, xid 0x00000000
17:49:10.769562 IP 192.168.1.30.40490 > 192.168.1.10.6633: Flags [P.], seq 35640:36000, ack 1, win 58, options [nop,nop,TS val 3672544 ecr 98001], length 360: OpenFlow
	version 1.0, type PACKET_IN, length 360, xid 0x00000000
17:49:10.769590 IP 192.168.1.10.6633 > 192.168.1.30.40490: Flags [.], ack 33840, win 1452, options [nop,nop,TS val 98001 ecr 3672543], length 0
17:49:10.769605 IP 192.168.1.10.6633 > 192.168.1.30.40490: Flags [.], ack 34200, win 1452, options [nop,nop,TS val 98002 ecr 3672543], length 0
17:49:10.769616 IP 192.168.1.10.6633 > 192.168.1.30.40490: Flags [.], ack 35280, win 1452, options [nop,nop,TS val 98002 ecr 3672543], length 0
17:49:10.769672 IP 192.168.1.30.40490 > 192.168.1.10.6633: Flags [P.], seq 36000:36360, ack 1, win 58, options [nop,nop,TS val 3672544 ecr 98002], length 360: OpenFlow
	version 1.0, type PACKET_IN, length 360, xid 0x00000000
17:49:10.769707 IP 192.168.1.30.40490 > 192.168.1.10.6633: Flags [P.], seq 36360:36720, ack 1, win 58, options [nop,nop,TS val 3672544 ecr 98002], length 360: OpenFlow
	version 1.0, type PACKET_IN, length 360, xid 0x00000000
17:49:10.769745 IP 192.168.1.30.40490 > 192.168.1.10.6633: Flags [P.], seq 36720:37080, ack 1, win 58, options [nop,nop,TS val 3672544 ecr 98002], length 360: OpenFlow
	version 1.0, type PACKET_IN, length 360, xid 0x00000000
17:49:10.769778 IP 192.168.1.30.40490 > 192.168.1.10.6633: Flags [P.], seq 37080:37440, ack 1, win 58, options [nop,nop,TS val 3672544 ecr 98002], length 360: OpenFlow
	version 1.0, type PACKET_IN, length 360, xid 0x00000000
17:49:10.769821 IP 192.168.1.10.6633 > 192.168.1.30.40490: Flags [.], ack 36000, win 1452, options [nop,nop,TS val 98002 ecr 3672544], length 0
17:49:10.769832 IP 192.168.1.10.6633 > 192.168.1.30.40490: Flags [.], ack 36360, win 1452, options [nop,nop,TS val 98002 ecr 3672544], length 0
17:49:10.769868 IP 192.168.1.30.40490 > 192.168.1.10.6633: Flags [P.], seq 37440:37800, ack 1, win 58, options [nop,nop,TS val 3672544 ecr 98002], length 360: OpenFlow
	version 1.0, type PACKET_IN, length 360, xid 0x00000000
17:49:10.769903 IP 192.168.1.30.40490 > 192.168.1.10.6633: Flags [P.], seq 37800:38160, ack 1, win 58, options [nop,nop,TS val 3672544 ecr 98002], length 360: OpenFlow
	version 1.0, type PACKET_IN, length 360, xid 0x00000000
17:49:10.769937 IP 192.168.1.30.40490 > 192.168.1.10.6633: Flags [P.], seq 38160:38520, ack 1, win 58, options [nop,nop,TS val 3672544 ecr 98002], length 360: OpenFlow
	version 1.0, type PACKET_IN, length 360, xid 0x00000000
17:49:10.769972 IP 192.168.1.30.40490 > 192.168.1.10.6633: Flags [P.], seq 38520:38880, ack 1, win 58, options [nop,nop,TS val 3672544 ecr 98002], length 360: OpenFlow
	version 1.0, type PACKET_IN, length 360, xid 0x00000000
17:49:10.770006 IP 192.168.1.30.40490 > 192.168.1.10.6633: Flags [P.], seq 38880:39240, ack 1, win 58, options [nop,nop,TS val 3672544 ecr 98002], length 360: OpenFlow
	version 1.0, type PACKET_IN, length 360, xid 0x00000000
17:49:10.770039 IP 192.168.1.30.40490 > 192.168.1.10.6633: Flags [P.], seq 39240:39600, ack 1, win 58, options [nop,nop,TS val 3672544 ecr 98002], length 360: OpenFlow
	version 1.0, type PACKET_IN, length 360, xid 0x00000000
17:49:10.770092 IP 192.168.1.10.6633 > 192.168.1.30.40490: Flags [.], ack 38160, win 1452, options [nop,nop,TS val 98002 ecr 3672544], length 0
17:49:10.770135 IP 192.168.1.30.40490 > 192.168.1.10.6633: Flags [P.], seq 39600:39960, ack 1, win 58, options [nop,nop,TS val 3672544 ecr 98002], length 360: OpenFlow
	version 1.0, type PACKET_IN, length 360, xid 0x00000000
17:49:10.770173 IP 192.168.1.30.40490 > 192.168.1.10.6633: Flags [P.], seq 39960:40320, ack 1, win 58, options [nop,nop,TS val 3672544 ecr 98002], length 360: OpenFlow
	version 1.0, type PACKET_IN, length 360, xid 0x00000000
17:49:10.770210 IP 192.168.1.30.40490 > 192.168.1.10.6633: Flags [P.], seq 40320:40680, ack 1, win 58, options [nop,nop,TS val 3672544 ecr 98002], length 360: OpenFlow
	version 1.0, type PACKET_IN, length 360, xid 0x00000000
17:49:10.770246 IP 192.168.1.30.40490 > 192.168.1.10.6633: Flags [P.], seq 40680:41040, ack 1, win 58, options [nop,nop,TS val 3672544 ecr 98002], length 360: OpenFlow
	version 1.0, type PACKET_IN, length 360, xid 0x00000000
17:49:10.770280 IP 192.168.1.30.40490 > 192.168.1.10.6633: Flags [P.], seq 41040:41400, ack 1, win 58, options [nop,nop,TS val 3672544 ecr 98002], length 360: OpenFlow
	version 1.0, type PACKET_IN, length 360, xid 0x00000000
17:49:10.770313 IP 192.168.1.30.40490 > 192.168.1.10.6633: Flags [P.], seq 41400:41760, ack 1, win 58, options [nop,nop,TS val 3672544 ecr 98002], length 360: OpenFlow
	version 1.0, type PACKET_IN, length 360, xid 0x00000000
17:49:10.770393 IP 192.168.1.30.40490 > 192.168.1.10.6633: Flags [P.], seq 41760:42120, ack 1, win 58, options [nop,nop,TS val 3672544 ecr 98002], length 360: OpenFlow
	version 1.0, type PACKET_IN, length 360, xid 0x00000000
17:49:10.770433 IP 192.168.1.30.40490 > 192.168.1.10.6633: Flags [P.], seq 42120:42480, ack 1, win 58, options [nop,nop,TS val 3672544 ecr 98002], length 360: OpenFlow
	version 1.0, type PACKET_IN, length 360, xid 0x00000000
17:49:10.770470 IP 192.168.1.30.40490 > 192.168.1.10.6633: Flags [P.], seq 42480:42840, ack 1, win 58, options [nop,nop,TS val 3672544 ecr 98002], length 360: OpenFlow
	version 1.0, type PACKET_IN, length 360, xid 0x00000000
17:49:10.770509 IP 192.168.1.30.40490 > 192.168.1.10.6633: Flags [P.], seq 42840:43200, ack 1, win 58, options [nop,nop,TS val 3672544 ecr 98002], length 360: OpenFlow
	version 1.0, type PACKET_IN, length 360, xid 0x00000000
17:49:10.770548 IP 192.168.1.30.40490 > 192.168.1.10.6633: Flags [P.], seq 43200:43560, ack 1, win 58, options [nop,nop,TS val 3672544 ecr 98002], length 360: OpenFlow
	version 1.0, type PACKET_IN, length 360, xid 0x00000000
17:49:10.770588 IP 192.168.1.30.40490 > 192.168.1.10.6633: Flags [P.], seq 43560:43920, ack 1, win 58, options [nop,nop,TS val 3672544 ecr 98002], length 360: OpenFlow
	version 1.0, type PACKET_IN, length 360, xid 0x00000000
17:49:10.770676 IP 192.168.1.30.40490 > 192.168.1.10.6633: Flags [P.], seq 43920:44280, ack 1, win 58, options [nop,nop,TS val 3672544 ecr 98002], length 360: OpenFlow
	version 1.0, type PACKET_IN, length 360, xid 0x00000000
17:49:10.770719 IP 192.168.1.30.40490 > 192.168.1.10.6633: Flags [P.], seq 44280:44640, ack 1, win 58, options [nop,nop,TS val 3672544 ecr 98002], length 360: OpenFlow
	version 1.0, type PACKET_IN, length 360, xid 0x00000000
17:49:10.770758 IP 192.168.1.30.40490 > 192.168.1.10.6633: Flags [P.], seq 44640:45000, ack 1, win 58, options [nop,nop,TS val 3672544 ecr 98002], length 360: OpenFlow
	version 1.0, type PACKET_IN, length 360, xid 0x00000000
17:49:10.770799 IP 192.168.1.30.40490 > 192.168.1.10.6633: Flags [P.], seq 45000:45360, ack 1, win 58, options [nop,nop,TS val 3672544 ecr 98002], length 360: OpenFlow
	version 1.0, type PACKET_IN, length 360, xid 0x00000000
17:49:10.770830 IP 192.168.1.30.40490 > 192.168.1.10.6633: Flags [P.], seq 45360:45720, ack 1, win 58, options [nop,nop,TS val 3672544 ecr 98002], length 360: OpenFlow
	version 1.0, type PACKET_IN, length 360, xid 0x00000000
17:49:10.770862 IP 192.168.1.30.40490 > 192.168.1.10.6633: Flags [P.], seq 45720:46080, ack 1, win 58, options [nop,nop,TS val 3672544 ecr 98002], length 360: OpenFlow
	version 1.0, type PACKET_IN, length 360, xid 0x00000000
17:49:10.770898 IP 192.168.1.30.40490 > 192.168.1.10.6633: Flags [P.], seq 46080:46440, ack 1, win 58, options [nop,nop,TS val 3672544 ecr 98002], length 360: OpenFlow
	version 1.0, type PACKET_IN, length 360, xid 0x00000000
17:49:10.770974 IP 192.168.1.30.40490 > 192.168.1.10.6633: Flags [P.], seq 46440:46800, ack 1, win 58, options [nop,nop,TS val 3672544 ecr 98002], length 360: OpenFlow
	version 1.0, type PACKET_IN, length 360, xid 0x00000000
17:49:10.771004 IP 192.168.1.30.40490 > 192.168.1.10.6633: Flags [P.], seq 46800:47160, ack 1, win 58, options [nop,nop,TS val 3672544 ecr 98002], length 360: OpenFlow
	version 1.0, type PACKET_IN, length 360, xid 0x00000000
17:49:10.771033 IP 192.168.1.30.40490 > 192.168.1.10.6633: Flags [P.], seq 47160:47520, ack 1, win 58, options [nop,nop,TS val 3672544 ecr 98002], length 360: OpenFlow
	version 1.0, type PACKET_IN, length 360, xid 0x00000000
17:49:10.771068 IP 192.168.1.30.40490 > 192.168.1.10.6633: Flags [P.], seq 47520:47880, ack 1, win 58, options [nop,nop,TS val 3672544 ecr 98002], length 360: OpenFlow
	version 1.0, type PACKET_IN, length 360, xid 0x00000000
17:49:10.771151 IP 192.168.1.30.40490 > 192.168.1.10.6633: Flags [P.], seq 47880:48240, ack 1, win 58, options [nop,nop,TS val 3672544 ecr 98002], length 360: OpenFlow
	version 1.0, type PACKET_IN, length 360, xid 0x00000000
17:49:10.771184 IP 192.168.1.30.40490 > 192.168.1.10.6633: Flags [P.], seq 48240:48600, ack 1, win 58, options [nop,nop,TS val 3672544 ecr 98002], length 360: OpenFlow
	version 1.0, type PACKET_IN, length 360, xid 0x00000000
17:49:10.771213 IP 192.168.1.30.40490 > 192.168.1.10.6633: Flags [P.], seq 48600:48960, ack 1, win 58, options [nop,nop,TS val 3672544 ecr 98002], length 360: OpenFlow
	version 1.0, type PACKET_IN, length 360, xid 0x00000000
17:49:10.776498 IP 192.168.1.10.6633 > 192.168.1.30.40490: Flags [.], ack 39960, win 1452, options [nop,nop,TS val 98003 ecr 3672544], length 0
17:49:10.776509 IP 192.168.1.30.40490 > 192.168.1.10.6633: Flags [.], seq 48960:54752, ack 1, win 58, options [nop,nop,TS val 3672545 ecr 98003], length 5792: OpenFlow
	version 1.0, type PACKET_IN, length 360, xid 0x00000000
	version 1.0, type PACKET_IN, length 360, xid 0x00000000
	version 1.0, type PACKET_IN, length 360, xid 0x00000000
	version 1.0, type PACKET_IN, length 360, xid 0x00000000
	version 1.0, type PACKET_IN, length 360, xid 0x00000000
	version 1.0, type PACKET_IN, length 360, xid 0x00000000
	version 1.0, type PACKET_IN, length 360, xid 0x00000000
	version 1.0, type PACKET_IN, length 360, xid 0x00000000
	version 1.0, type PACKET_IN, length 360, xid 0x00000000
	version 1.0, type PACKET_IN, length 360, xid 0x00000000
	version 1.0, type PACKET_IN, length 360, xid 0x00000000
	version 1.0, type PACKET_IN, length 360, xid 0x00000000
	version 1.0, type PACKET_IN, length 360, xid 0x00000000
	version 1.0, type PACKET_IN, length 360, xid 0x00000000
	version 1.0, type PACKET_IN, length 360, xid 0x00000000
	version 1.0, type PACKET_IN, length 360, xid 0x00000000
	version 1.0, type PACKET_IN, length 360, xid 0x00000000 [|openflow]
17:49:10.776565 IP 192.168.1.10.6633 > 192.168.1.30.40490: Flags [.], ack 48960, win 1382, options [nop,nop,TS val 98003 ecr 3672544], length 0
17:49:10.776582 IP 192.168.1.30.40490 > 192.168.1.10.6633: Flags [.], seq 54752:60544, ack 1, win 58, options [nop,nop,TS val 3672545 ecr 98003], length 5792: OpenFlow
	version unknown (0x45), type 0x10, length 328, xid 0x00000000
	version 1.0, type PACKET_IN, length 360, xid 0x00000000
	version 1.0, type PACKET_IN, length 360, xid 0x00000000
	version 1.0, type PACKET_IN, length 360, xid 0x00000000
	version 1.0, type PACKET_IN, length 360, xid 0x00000000
	version 1.0, type PACKET_IN, length 360, xid 0x00000000
	version 1.0, type PACKET_IN, length 360, xid 0x00000000
	version 1.0, type PACKET_IN, length 360, xid 0x00000000
	version 1.0, type PACKET_IN, length 360, xid 0x00000000
	version 1.0, type PACKET_IN, length 360, xid 0x00000000
	version 1.0, type PACKET_IN, length 360, xid 0x00000000
	version 1.0, type PACKET_IN, length 360, xid 0x00000000
	version 1.0, type PACKET_IN, length 360, xid 0x00000000
	version 1.0, type PACKET_IN, length 360, xid 0x00000000
	version 1.0, type PACKET_IN, length 360, xid 0x00000000
	version 1.0, type PACKET_IN, length 360, xid 0x00000000
	version 1.0, type PACKET_IN, length 360, xid 0x00000000 [|openflow]
17:49:10.776596 IP 192.168.1.30.40490 > 192.168.1.10.6633: Flags [.], seq 60544:66336, ack 1, win 58, options [nop,nop,TS val 3672545 ecr 98003], length 5792: OpenFlow
	version unknown (0x8a), type 0xe2, length 28022, xid 0x00080000 [|openflow]
17:49:10.776610 IP 192.168.1.30.40490 > 192.168.1.10.6633: Flags [.], seq 66336:72128, ack 1, win 58, options [nop,nop,TS val 3672545 ecr 98003], length 5792: OpenFlow
	version unknown (0x00), type 0x00, length 0, xid 0x00000000 (corrupt)
17:49:10.776623 IP 192.168.1.30.40490 > 192.168.1.10.6633: Flags [.], seq 72128:77920, ack 1, win 58, options [nop,nop,TS val 3672545 ecr 98003], length 5792: OpenFlow
	version unknown (0x00), type 0x00, length 0, xid 0x00000000 (corrupt)
17:49:10.776635 IP 192.168.1.30.40490 > 192.168.1.10.6633: Flags [.], seq 77920:83712, ack 1, win 58, options [nop,nop,TS val 3672545 ecr 98003], length 5792: OpenFlow
	version unknown (0x00), type 0x00, length 0, xid 0x00000000 (corrupt)
17:49:10.776657 IP 192.168.1.30.40490 > 192.168.1.10.6633: Flags [.], seq 83712:89504, ack 1, win 58, options [nop,nop,TS val 3672545 ecr 98003], length 5792: OpenFlow
	version unknown (0x00), type 0x00, length 0, xid 0x00000000 (corrupt)
17:49:10.778071 IP 192.168.1.10.6633 > 192.168.1.30.40490: Flags [.], ack 89504, win 1261, options [nop,nop,TS val 98004 ecr 3672545], length 0
17:49:10.778096 IP 192.168.1.30.40490 > 192.168.1.10.6633: Flags [.], seq 89504:95296, ack 1, win 58, options [nop,nop,TS val 3672546 ecr 98004], length 5792: OpenFlow
	version unknown (0x00), type 0x00, length 0, xid 0x00000000 (corrupt)
17:49:10.778118 IP 192.168.1.30.40490 > 192.168.1.10.6633: Flags [.], seq 95296:101088, ack 1, win 58, options [nop,nop,TS val 3672546 ecr 98004], length 5792: OpenFlow
