17:49:10.668251 IP 192.168.1.30.40480 > 192.168.1.10.6633: Flags [P.], seq 1200471457:1200471497, ack 2078217729, win 58, options [nop,nop,TS val 3672518 ecr 97949], length 40: OpenFlow
	version unknown (0x0c), type 0x2c, length 12058, xid 0x792a79f9 [|openflow]
17:49:10.668281 IP 192.168.1.30.40480 > 192.168.1.10.6633: Flags [P.], seq 40:400, ack 1, win 58, options [nop,nop,TS val 3672518 ecr 97949], length 360: OpenFlow
	version 1.0, type PACKET_IN, length 360, xid 0x00000000
17:49:10.668295 IP 192.168.1.30.40480 > 192.168.1.10.6633: Flags [P.], seq 400:760, ack 1, win 58, options [nop,nop,TS val 3672518 ecr 97949], length 360: OpenFlow
	version 1.0, type PACKET_IN, length 360, xid 0x00000000
17:49:10.668310 IP 192.168.1.30.40480 > 192.168.1.10.6633: Flags [P.], seq 760:1120, ack 1, win 58, options [nop,nop,TS val 3672518 ecr 97949], length 360: OpenFlow
	version 1.0, type PACKET_IN, length 360, xid 0x00000000
17:49:10.668324 IP 192.168.1.30.40480 > 192.168.1.10.6633: Flags [P.], seq 1120:1480, ack 1, win 58, options [nop,nop,TS val 3672518 ecr 97949], length 360: OpenFlow
	version 1.0, type PACKET_IN, length 360, xid 0x00000000
17:49:10.668337 IP 192.168.1.30.40480 > 192.168.1.10.6633: Flags [P.], seq 1480:1840, ack 1, win 58, options [nop,nop,TS val 3672518 ecr 97949], length 360: OpenFlow
	version 1.0, type PACKET_IN, length 360, xid 0x00000000
17:49:10.668351 IP 192.168.1.30.40480 > 192.168.1.10.6633: Flags [P.], seq 1840:2200, ack 1, win 58, options [nop,nop,TS val 3672518 ecr 97949], length 360: OpenFlow
	version 1.0, type PACKET_IN, length 360, xid 0x00000000
17:49:10.669063 IP 192.168.1.30.40480 > 192.168.1.10.6633: Flags [P.], seq 2200:2560, ack 1, win 58, options [nop,nop,TS val 3672518 ecr 97949], length 360: OpenFlow
	version 1.0, type PACKET_IN, length 360, xid 0x00000000
17:49:10.669065 IP 192.168.1.10.6633 > 192.168.1.30.40480: Flags [.], ack 1480, win 1829, options [nop,nop,TS val 97976 ecr 3672518], length 0
17:49:10.669082 IP 192.168.1.30.40480 > 192.168.1.10.6633: Flags [P.], seq 2560:2920, ack 1, win 58, options [nop,nop,TS val 3672518 ecr 97949], length 360: OpenFlow
	version 1.0, type PACKET_IN, length 360, xid 0x00000000
17:49:10.669091 IP 192.168.1.30.40480 > 192.168.1.10.6633: Flags [P.], seq 2920:3280, ack 1, win 58, options [nop,nop,TS val 3672518 ecr 97949], length 360: OpenFlow
	version 1.0, type PACKET_IN, length 360, xid 0x00000000
17:49:10.669092 IP 192.168.1.10.6633 > 192.168.1.30.40480: Flags [.], ack 2200, win 1829, options [nop,nop,TS val 97976 ecr 3672518], length 0
17:49:10.669099 IP 192.168.1.30.40480 > 192.168.1.10.6633: Flags [P.], seq 3280:3640, ack 1, win 58, options [nop,nop,TS val 3672518 ecr 97949], length 360: OpenFlow
	version 1.0, type PACKET_IN, length 360, xid 0x00000000
17:49:10.669108 IP 192.168.1.30.40480 > 192.168.1.10.6633: Flags [P.], seq 3640:4000, ack 1, win 58, options [nop,nop,TS val 3672518 ecr 97949], length 360: OpenFlow
	version 1.0, type PACKET_IN, length 360, xid 0x00000000
17:49:10.669115 IP 192.168.1.30.40480 > 192.168.1.10.6633: Flags [P.], seq 4000:4360, ack 1, win 58, options [nop,nop,TS val 3672518 ecr 97949], length 360: OpenFlow
	version 1.0, type PACKET_IN, length 360, xid 0x00000000
17:49:10.669122 IP 192.168.1.30.40480 > 192.168.1.10.6633: Flags [P.], seq 4360:4720, ack 1, win 58, options [nop,nop,TS val 3672518 ecr 97949], length 360: OpenFlow
	version 1.0, type PACKET_IN, length 360, xid 0x00000000
17:49:10.669130 IP 192.168.1.30.40480 > 192.168.1.10.6633: Flags [P.], seq 4720:5080, ack 1, win 58, options [nop,nop,TS val 3672518 ecr 97949], length 360: OpenFlow
	version 1.0, type PACKET_IN, length 360, xid 0x00000000
17:49:10.669138 IP 192.168.1.30.40480 > 192.168.1.10.6633: Flags [P.], seq 5080:5440, ack 1, win 58, options [nop,nop,TS val 3672518 ecr 97949], length 360: OpenFlow
	version 1.0, type PACKET_IN, length 360, xid 0x00000000
17:49:10.669172 IP 192.168.1.30.40480 > 192.168.1.10.6633: Flags [P.], seq 5440:5800, ack 1, win 58, options [nop,nop,TS val 3672518 ecr 97949], length 360: OpenFlow
	version 1.0, type PACKET_IN, length 360, xid 0x00000000
17:49:10.669183 IP 192.168.1.30.40480 > 192.168.1.10.6633: Flags [P.], seq 5800:6160, ack 1, win 58, options [nop,nop,TS val 3672518 ecr 97949], length 360: OpenFlow
	version 1.0, type PACKET_IN, length 360, xid 0x00000000
17:49:10.669202 IP 192.168.1.30.40480 > 192.168.1.10.6633: Flags [P.], seq 6160:6520, ack 1, win 58, options [nop,nop,TS val 3672518 ecr 97949], length 360: OpenFlow
	version 1.0, type PACKET_IN, length 360, xid 0x00000000
17:49:10.669210 IP 192.168.1.30.40480 > 192.168.1.10.6633: Flags [P.], seq 6520:6880, ack 1, win 58, options [nop,nop,TS val 3672518 ecr 97949], length 360: OpenFlow
	version 1.0, type PACKET_IN, length 360, xid 0x00000000
17:49:10.669218 IP 192.168.1.30.40480 > 192.168.1.10.6633: Flags [P.], seq 6880:7240, ack 1, win 58, options [nop,nop,TS val 3672518 ecr 97949], length 360: OpenFlow
	version 1.0, type PACKET_IN, length 360, xid 0x00000000
17:49:10.669226 IP 192.168.1.30.40480 > 192.168.1.10.6633: Flags [P.], seq 7240:7600, ack 1, win 58, options [nop,nop,TS val 3672518 ecr 97949], length 360: OpenFlow
	version 1.0, type PACKET_IN, length 360, xid 0x00000000
17:49:10.669234 IP 192.168.1.30.40480 > 192.168.1.10.6633: Flags [P.], seq 7600:7960, ack 1, win 58, options [nop,nop,TS val 3672518 ecr 97949], length 360: OpenFlow
	version 1.0, type PACKET_IN, length 360, xid 0x00000000
17:49:10.669242 IP 192.168.1.30.40480 > 192.168.1.10.6633: Flags [P.], seq 7960:8320, ack 1, win 58, options [nop,nop,TS val 3672518 ecr 97949], length 360: OpenFlow
	version 1.0, type PACKET_IN, length 360, xid 0x00000000
17:49:10.669249 IP 192.168.1.30.40480 > 192.168.1.10.6633: Flags [P.], seq 8320:8680, ack 1, win 58, options [nop,nop,TS val 3672518 ecr 97949], length 360: OpenFlow
	version 1.0, type PACKET_IN, length 360, xid 0x00000000
17:49:10.669258 IP 192.168.1.30.40480 > 192.168.1.10.6633: Flags [P.], seq 8680:9040, ack 1, win 58, options [nop,nop,TS val 3672518 ecr 97949], length 360: OpenFlow
	version 1.0, type PACKET_IN, length 360, xid 0x00000000
17:49:10.669266 IP 192.168.1.30.40480 > 192.168.1.10.6633: Flags [P.], seq 9040:9400, ack 1, win 58, options [nop,nop,TS val 3672518 ecr 97949], length 360: OpenFlow
	version 1.0, type PACKET_IN, length 360, xid 0x00000000
17:49:10.669274 IP 192.168.1.30.40480 > 192.168.1.10.6633: Flags [P.], seq 9400:9760, ack 1, win 58, options [nop,nop,TS val 3672518 ecr 97949], length 360: OpenFlow
	version 1.0, type PACKET_IN, length 360, xid 0x00000000
17:49:10.669281 IP 192.168.1.10.6633 > 192.168.1.30.40480: Flags [.], ack 4000, win 1829, options [nop,nop,TS val 97976 ecr 3672518], length 0
17:49:10.669282 IP 192.168.1.30.40480 > 192.168.1.10.6633: Flags [P.], seq 9760:10120, ack 1, win 58, options [nop,nop,TS val 3672518 ecr 97949], length 360: OpenFlow
	version 1.0, type PACKET_IN, length 360, xid 0x00000000
17:49:10.669291 IP 192.168.1.30.40480 > 192.168.1.10.6633: Flags [P.], seq 10120:10480, ack 1, win 58, options [nop,nop,TS val 3672518 ecr 97949], length 360: OpenFlow
	version 1.0, type PACKET_IN, length 360, xid 0x00000000
17:49:10.669311 IP 192.168.1.30.40480 > 192.168.1.10.6633: Flags [P.], seq 10480:10840, ack 1, win 58, options [nop,nop,TS val 3672518 ecr 97949], length 360: OpenFlow
	version 1.0, type PACKET_IN, length 360, xid 0x00000000
17:49:10.669319 IP 192.168.1.30.40480 > 192.168.1.10.6633: Flags [P.], seq 10840:11200, ack 1, win 58, options [nop,nop,TS val 3672518 ecr 97949], length 360: OpenFlow
	version 1.0, type PACKET_IN, length 360, xid 0x00000000
17:49:10.669326 IP 192.168.1.30.40480 > 192.168.1.10.6633: Flags [P.], seq 11200:11560, ack 1, win 58, options [nop,nop,TS val 3672518 ecr 97949], length 360: OpenFlow
	version 1.0, type PACKET_IN, length 360, xid 0x00000000
17:49:10.669339 IP 192.168.1.30.40480 > 192.168.1.10.6633: Flags [P.], seq 11560:11920, ack 1, win 58, options [nop,nop,TS val 3672518 ecr 97949], length 360: OpenFlow
	version 1.0, type PACKET_IN, length 360, xid 0x00000000
17:49:10.669348 IP 192.168.1.30.40480 > 192.168.1.10.6633: Flags [P.], seq 11920:12280, ack 1, win 58, options [nop,nop,TS val 3672518 ecr 97949], length 360: OpenFlow
	version 1.0, type PACKET_IN, length 360, xid 0x00000000
17:49:10.669355 IP 192.168.1.30.40480 > 192.168.1.10.6633: Flags [P.], seq 12280:12640, ack 1, win 58, options [nop,nop,TS val 3672518 ecr 97949], length 360: OpenFlow
	version 1.0, type PACKET_IN, length 360, xid 0x00000000
17:49:10.669372 IP 192.168.1.30.40480 > 192.168.1.10.6633: Flags [P.], seq 12640:13000, ack 1, win 58, options [nop,nop,TS val 3672518 ecr 97949], length 360: OpenFlow
	version 1.0, type PACKET_IN, length 360, xid 0x00000000
17:49:10.669381 IP 192.168.1.30.40480 > 192.168.1.10.6633: Flags [P.], seq 13000:13360, ack 1, win 58, options [nop,nop,TS val 3672518 ecr 97949], length 360: OpenFlow
	version 1.0, type PACKET_IN, length 360, xid 0x00000000
17:49:10.669389 IP 192.168.1.30.40480 > 192.168.1.10.6633: Flags [P.], seq 13360:13720, ack 1, win 58, options [nop,nop,TS val 3672518 ecr 97949], length 360: OpenFlow
	version 1.0, type PACKET_IN, length 360, xid 0x00000000
17:49:10.669403 IP 192.168.1.30.40480 > 192.168.1.10.6633: Flags [.], seq 13720:19512, ack 1, win 58, options [nop,nop,TS val 3672518 ecr 97976], length 5792: OpenFlow
	version 1.0, type PACKET_IN, length 360, xid 0x00000000
	version 1.0, type PACKET_IN, length 360, xid 0x00000000
	version 1.0, type PACKET_IN, length 360, xid 0x00000000
	version 1.0, type PACKET_IN, length 360, xid 0x00000000
	version 1.0, type PACKET_IN, length 360, xid 0x00000000
	version 1.0, type PACKET_IN, length 360, xid 0x00000000
	version 1.0, type PACKET_IN, length 360, xid 0x00000000
	version 1.0, type PACKET_IN, length 360, xid 0x00000000
	version 1.0, type PACKET_IN, length 360, xid 0x00000000
	version 1.0, type PACKET_IN, length 360, xid 0x00000000
	version 1.0, type PACKET_IN, length 360, xid 0x00000000
	version 1.0, type PACKET_IN, length 360, xid 0x00000000
	version 1.0, type PACKET_IN, length 360, xid 0x00000000
	version 1.0, type PACKET_IN, length 360, xid 0x00000000
	version 1.0, type PACKET_IN, length 360, xid 0x00000000
	version 1.0, type PACKET_IN, length 360, xid 0x00000000
	version 1.0, type PACKET_IN, length 360, xid 0x00000000 [|openflow]
17:49:10.669535 IP 192.168.1.10.6633 > 192.168.1.30.40480: Flags [.], ack 12640, win 1829, options [nop,nop,TS val 97977 ecr 3672518], length 0
17:49:10.669683 IP 192.168.1.30.40480 > 192.168.1.10.6633: Flags [.], seq 19512:25304, ack 1, win 58, options [nop,nop,TS val 3672518 ecr 97976], length 5792: OpenFlow
	version unknown (0x45), type 0x10, length 328, xid 0x00000000
	version 1.0, type PACKET_IN, length 360, xid 0x00000000
	version 1.0, type PACKET_IN, length 360, xid 0x00000000
	version 1.0, type PACKET_IN, length 360, xid 0x00000000
	version 1.0, type PACKET_IN, length 360, xid 0x00000000
	version 1.0, type PACKET_IN, length 360, xid 0x00000000
	version 1.0, type PACKET_IN, length 360, xid 0x00000000
	version 1.0, type PACKET_IN, length 360, xid 0x00000000
	version 1.0, type PACKET_IN, length 360, xid 0x00000000
	version 1.0, type PACKET_IN, length 360, xid 0x00000000
	version 1.0, type PACKET_IN, length 360, xid 0x00000000
	version 1.0, type PACKET_IN, length 360, xid 0x00000000
	version 1.0, type PACKET_IN, length 360, xid 0x00000000
	version 1.0, type PACKET_IN, length 360, xid 0x00000000
	version 1.0, type PACKET_IN, length 360, xid 0x00000000
	version 1.0, type PACKET_IN, length 360, xid 0x00000000
	version 1.0, type PACKET_IN, length 360, xid 0x00000000 [|openflow]
17:49:10.669694 IP 192.168.1.30.40480 > 192.168.1.10.6633: Flags [.], seq 25304:31096, ack 1, win 58, options [nop,nop,TS val 3672518 ecr 97976], length 5792: OpenFlow
	version unknown (0x8a), type 0xe2, length 28022, xid 0x00080000 [|openflow]
17:49:10.669698 IP 192.168.1.10.6633 > 192.168.1.30.40480: Flags [.], ack 13720, win 1829, options [nop,nop,TS val 97977 ecr 3672518], length 0
17:49:10.669705 IP 192.168.1.30.40480 > 192.168.1.10.6633: Flags [.], seq 31096:35440, ack 1, win 58, options [nop,nop,TS val 3672519 ecr 97977], length 4344: OpenFlow
	version unknown (0x00), type 0x00, length 0, xid 0x00000000 (corrupt)
17:49:10.669716 IP 192.168.1.30.40480 > 192.168.1.10.6633: Flags [P.], seq 35440:36040, ack 1, win 58, options [nop,nop,TS val 3672519 ecr 97977], length 600: OpenFlow
	version unknown (0x00), type 0x00, length 0, xid 0x00000000 (corrupt)
17:49:10.669773 IP 192.168.1.10.6633 > 192.168.1.30.40480: Flags [.], ack 19512, win 1829, options [nop,nop,TS val 97977 ecr 3672518], length 0
17:49:10.671669 IP 192.168.1.10.6633 > 192.168.1.30.40480: Flags [.], ack 36040, win 1829, options [nop,nop,TS val 97977 ecr 3672518], length 0
17:49:11.080926 IP 192.168.1.30.40480 > 192.168.1.10.6633: Flags [P.], seq 36040:36400, ack 1, win 58, options [nop,nop,TS val 3672621 ecr 97977], length 360: OpenFlow
	version 1.0, type PACKET_IN, length 360, xid 0x00000000
17:49:11.080977 IP 192.168.1.30.40480 > 192.168.1.10.6633: Flags [P.], seq 36400:36760, ack 1, win 58, options [nop,nop,TS val 3672621 ecr 97977], length 360: OpenFlow
	version 1.0, type PACKET_IN, length 360, xid 0x00000000
17:49:11.081009 IP 192.168.1.30.40480 > 192.168.1.10.6633: Flags [P.], seq 36760:37120, ack 1, win 58, options [nop,nop,TS val 3672621 ecr 97977], length 360: OpenFlow
	version 1.0, type PACKET_IN, length 360, xid 0x00000000
17:49:11.081041 IP 192.168.1.30.40480 > 192.168.1.10.6633: Flags [P.], seq 37120:37480, ack 1, win 58, options [nop,nop,TS val 3672621 ecr 97977], length 360: OpenFlow
	version 1.0, type PACKET_IN, length 360, xid 0x00000000
17:49:11.081084 IP 192.168.1.30.40480 > 192.168.1.10.6633: Flags [P.], seq 37480:37840, ack 1, win 58, options [nop,nop,TS val 3672621 ecr 97977], length 360: OpenFlow
	version 1.0, type PACKET_IN, length 360, xid 0x00000000
17:49:11.081169 IP 192.168.1.30.40480 > 192.168.1.10.6633: Flags [P.], seq 37840:38200, ack 1, win 58, options [nop,nop,TS val 3672621 ecr 97977], length 360: OpenFlow
	version 1.0, type PACKET_IN, length 360, xid 0x00000000
17:49:11.081202 IP 192.168.1.30.40480 > 192.168.1.10.6633: Flags [P.], seq 38200:38560, ack 1, win 58, options [nop,nop,TS val 3672621 ecr 97977], length 360: OpenFlow
	version 1.0, type PACKET_IN, length 360, xid 0x00000000
17:49:11.081235 IP 192.168.1.30.40480 > 192.168.1.10.6633: Flags [P.], seq 38560:38920, ack 1, win 58, options [nop,nop,TS val 3672621 ecr 97977], length 360: OpenFlow
	version 1.0, type PACKET_IN, length 360, xid 0x00000000
17:49:11.081267 IP 192.168.1.30.40480 > 192.168.1.10.6633: Flags [P.], seq 38920:39280, ack 1, win 58, options [nop,nop,TS val 3672621 ecr 97977], length 360: OpenFlow
	version 1.0, type PACKET_IN, length 360, xid 0x00000000
17:49:11.081454 IP 192.168.1.30.40480 > 192.168.1.10.6633: Flags [P.], seq 39280:39640, ack 1, win 58, options [nop,nop,TS val 3672621 ecr 97977], length 360: OpenFlow
	version 1.0, type PACKET_IN, length 360, xid 0x00000000
17:49:11.081503 IP 192.168.1.30.40480 > 192.168.1.10.6633: Flags [P.], seq 39640:40000, ack 1, win 58, options [nop,nop,TS val 3672622 ecr 97977], length 360: OpenFlow
	version 1.0, type PACKET_IN, length 360, xid 0x00000000
17:49:11.081538 IP 192.168.1.30.40480 > 192.168.1.10.6633: Flags [P.], seq 40000:40360, ack 1, win 58, options [nop,nop,TS val 3672622 ecr 97977], length 360: OpenFlow
	version 1.0, type PACKET_IN, length 360, xid 0x00000000
17:49:11.081589 IP 192.168.1.30.40480 > 192.168.1.10.6633: Flags [P.], seq 40360:40720, ack 1, win 58, options [nop,nop,TS val 3672622 ecr 97977], length 360: OpenFlow
	version 1.0, type PACKET_IN, length 360, xid 0x00000000
17:49:11.081619 IP 192.168.1.10.6633 > 192.168.1.30.40480: Flags [.], ack 36400, win 1829, options [nop,nop,TS val 98079 ecr 3672621], length 0
17:49:11.081630 IP 192.168.1.10.6633 > 192.168.1.30.40480: Flags [.], ack 36760, win 1829, options [nop,nop,TS val 98079 ecr 3672621], length 0
17:49:11.081638 IP 192.168.1.10.6633 > 192.168.1.30.40480: Flags [.], ack 37120, win 1829, options [nop,nop,TS val 98079 ecr 3672621], length 0
17:49:11.081651 IP 192.168.1.10.6633 > 192.168.1.30.40480: Flags [.], ack 37480, win 1829, options [nop,nop,TS val 98079 ecr 3672621], length 0
17:49:11.081663 IP 192.168.1.10.6633 > 192.168.1.30.40480: Flags [.], ack 37840, win 1829, options [nop,nop,TS val 98079 ecr 3672621], length 0
17:49:11.081676 IP 192.168.1.10.6633 > 192.168.1.30.40480: Flags [.], ack 38200, win 1829, options [nop,nop,TS val 98079 ecr 3672621], length 0
17:49:11.081687 IP 192.168.1.10.6633 > 192.168.1.30.40480: Flags [.], ack 38560, win 1829, options [nop,nop,TS val 98079 ecr 3672621], length 0
17:49:11.081696 IP 192.168.1.10.6633 > 192.168.1.30.40480: Flags [.], ack 38920, win 1829, options [nop,nop,TS val 98079 ecr 3672621], length 0
17:49:11.081704 IP 192.168.1.10.6633 > 192.168.1.30.40480: Flags [.], ack 39280, win 1829, options [nop,nop,TS val 98079 ecr 3672621], length 0
17:49:11.081838 IP 192.168.1.30.40480 > 192.168.1.10.6633: Flags [P.], seq 40720:41080, ack 1, win 58, options [nop,nop,TS val 3672622 ecr 98079], length 360: OpenFlow
	version 1.0, type PACKET_IN, length 360, xid 0x00000000
17:49:11.081878 IP 192.168.1.30.40480 > 192.168.1.10.6633: Flags [P.], seq 41080:41440, ack 1, win 58, options [nop,nop,TS val 3672622 ecr 98079], length 360: OpenFlow
	version 1.0, type PACKET_IN, length 360, xid 0x00000000
17:49:11.081911 IP 192.168.1.30.40480 > 192.168.1.10.6633: Flags [P.], seq 41440:41800, ack 1, win 58, options [nop,nop,TS val 3672622 ecr 98079], length 360: OpenFlow
	version 1.0, type PACKET_IN, length 360, xid 0x00000000
17:49:11.081951 IP 192.168.1.30.40480 > 192.168.1.10.6633: Flags [P.], seq 41800:42160, ack 1, win 58, options [nop,nop,TS val 3672622 ecr 98079], length 360: OpenFlow
	version 1.0, type PACKET_IN, length 360, xid 0x00000000
17:49:11.081991 IP 192.168.1.30.40480 > 192.168.1.10.6633: Flags [P.], seq 42160:42520, ack 1, win 58, options [nop,nop,TS val 3672622 ecr 98079], length 360: OpenFlow
	version 1.0, type PACKET_IN, length 360, xid 0x00000000
17:49:11.082046 IP 192.168.1.10.6633 > 192.168.1.30.40480: Flags [.], ack 39640, win 1829, options [nop,nop,TS val 98080 ecr 3672621], length 0
17:49:11.082063 IP 192.168.1.10.6633 > 192.168.1.30.40480: Flags [.], ack 40000, win 1829, options [nop,nop,TS val 98080 ecr 3672622], length 0
17:49:11.082074 IP 192.168.1.10.6633 > 192.168.1.30.40480: Flags [.], ack 40360, win 1829, options [nop,nop,TS val 98080 ecr 3672622], length 0
17:49:11.082087 IP 192.168.1.10.6633 > 192.168.1.30.40480: Flags [.], ack 40720, win 1829, options [nop,nop,TS val 98080 ecr 3672622], length 0
17:49:11.082176 IP 192.168.1.30.40480 > 192.168.1.10.6633: Flags [P.], seq 42520:42880, ack 1, win 58, options [nop,nop,TS val 3672622 ecr 98080], length 360: OpenFlow
	version 1.0, type PACKET_IN, length 360, xid 0x00000000
17:49:11.082217 IP 192.168.1.30.40480 > 192.168.1.10.6633: Flags [P.], seq 42880:43240, ack 1, win 58, options [nop,nop,TS val 3672622 ecr 98080], length 360: OpenFlow
	version 1.0, type PACKET_IN, length 360, xid 0x00000000
17:49:11.082255 IP 192.168.1.30.40480 > 192.168.1.10.6633: Flags [P.], seq 43240:43600, ack 1, win 58, options [nop,nop,TS val 3672622 ecr 98080], length 360: OpenFlow
	version 1.0, type PACKET_IN, length 360, xid 0x00000000
17:49:11.082289 IP 192.168.1.30.40480 > 192.168.1.10.6633: Flags [P.], seq 43600:43960, ack 1, win 58, options [nop,nop,TS val 3672622 ecr 98080], length 360: OpenFlow
	version 1.0, type PACKET_IN, length 360, xid 0x00000000
17:49:11.082336 IP 192.168.1.30.40480 > 192.168.1.10.6633: Flags [P.], seq 43960:44320, ack 1, win 58, options [nop,nop,TS val 3672622 ecr 98080], length 360: OpenFlow
	version 1.0, type PACKET_IN, length 360, xid 0x00000000
17:49:11.082375 IP 192.168.1.30.40480 > 192.168.1.10.6633: Flags [P.], seq 44320:44680, ack 1, win 58, options [nop,nop,TS val 3672622 ecr 98080], length 360: OpenFlow
	version 1.0, type PACKET_IN, length 360, xid 0x00000000
17:49:11.082412 IP 192.168.1.30.40480 > 192.168.1.10.6633: Flags [P.], seq 44680:45040, ack 1, win 58, options [nop,nop,TS val 3672622 ecr 98080], length 360: OpenFlow
	version 1.0, type PACKET_IN, length 360, xid 0x00000000
17:49:11.082451 IP 192.168.1.30.40480 > 192.168.1.10.6633: Flags [P.], seq 45040:45400, ack 1, win 58, options [nop,nop,TS val 3672622 ecr 98080], length 360: OpenFlow
	version 1.0, type PACKET_IN, length 360, xid 0x00000000
17:49:11.082527 IP 192.168.1.30.40480 > 192.168.1.10.6633: Flags [P.], seq 45400:45760, ack 1, win 58, options [nop,nop,TS val 3672622 ecr 98080], length 360: OpenFlow
	version 1.0, type PACKET_IN, length 360, xid 0x00000000
17:49:11.082566 IP 192.168.1.30.40480 > 192.168.1.10.6633: Flags [P.], seq 45760:46120, ack 1, win 58, options [nop,nop,TS val 3672622 ecr 98080], length 360: OpenFlow
	version 1.0, type PACKET_IN, length 360, xid 0x00000000
17:49:11.082603 IP 192.168.1.30.40480 > 192.168.1.10.6633: Flags [P.], seq 46120:46480, ack 1, win 58, options [nop,nop,TS val 3672622 ecr 98080], length 360: OpenFlow
	version 1.0, type PACKET_IN, length 360, xid 0x00000000
17:49:11.082646 IP 192.168.1.30.40480 > 192.168.1.10.6633: Flags [P.], seq 46480:46840, ack 1, win 58, options [nop,nop,TS val 3672622 ecr 98080], length 360: OpenFlow
	version 1.0, type PACKET_IN, length 360, xid 0x00000000
17:49:11.082722 IP 192.168.1.30.40480 > 192.168.1.10.6633: Flags [P.], seq 46840:47200, ack 1, win 58, options [nop,nop,TS val 3672622 ecr 98080], length 360: OpenFlow
	version 1.0, type PACKET_IN, length 360, xid 0x00000000
17:49:11.082755 IP 192.168.1.30.40480 > 192.168.1.10.6633: Flags [P.], seq 47200:47560, ack 1, win 58, options [nop,nop,TS val 3672622 ecr 98080], length 360: OpenFlow
	version 1.0, type PACKET_IN, length 360, xid 0x00000000
17:49:11.082789 IP 192.168.1.30.40480 > 192.168.1.10.6633: Flags [P.], seq 47560:47920, ack 1, win 58, options [nop,nop,TS val 3672622 ecr 98080], length 360: OpenFlow
	version 1.0, type PACKET_IN, length 360, xid 0x00000000
17:49:11.084110 IP 192.168.1.10.6633 > 192.168.1.30.40480: Flags [.], ack 41080, win 1829, options [nop,nop,TS val 98080 ecr 3672622], length 0
17:49:11.084132 IP 192.168.1.10.6633 > 192.168.1.30.40480: Flags [.], ack 41440, win 1829, options [nop,nop,TS val 98080 ecr 3672622], length 0
17:49:11.084144 IP 192.168.1.10.6633 > 192.168.1.30.40480: Flags [.], ack 41800, win 1829, options [nop,nop,TS val 98080 ecr 3672622], length 0
17:49:11.084163 IP 192.168.1.30.40480 > 192.168.1.10.6633: Flags [.], seq 47920:52264, ack 1, win 58, options [nop,nop,TS val 3672622 ecr 98080], length 4344: OpenFlow
	version 1.0, type PACKET_IN, length 360, xid 0x00000000
	version 1.0, type PACKET_IN, length 360, xid 0x00000000
	version 1.0, type PACKET_IN, length 360, xid 0x00000000
	version 1.0, type PACKET_IN, length 360, xid 0x00000000
	version 1.0, type PACKET_IN, length 360, xid 0x00000000
	version 1.0, type PACKET_IN, length 360, xid 0x00000000
	version 1.0, type PACKET_IN, length 360, xid 0x00000000
	version 1.0, type PACKET_IN, length 360, xid 0x00000000
	version 1.0, type PACKET_IN, length 360, xid 0x00000000
	version 1.0, type PACKET_IN, length 360, xid 0x00000000
	version 1.0, type PACKET_IN, length 360, xid 0x00000000
	version 1.0, type PACKET_IN, length 360, xid 0x00000000
	version 1.0, type PACKET_IN, length 360, xid 0x00000000 [|openflow]
17:49:11.084182 IP 192.168.1.30.40480 > 192.168.1.10.6633: Flags [P.], seq 52264:53680, ack 1, win 58, options [nop,nop,TS val 3672622 ecr 98080], length 1416: OpenFlow
	version unknown (0x2a), type 0x3a, length 54085, xid 0x6e810800 [|openflow]
17:49:11.084196 IP 192.168.1.10.6633 > 192.168.1.30.40480: Flags [.], ack 42520, win 1829, options [nop,nop,TS val 98080 ecr 3672622], length 0
17:49:11.084209 IP 192.168.1.10.6633 > 192.168.1.30.40480: Flags [.], ack 43960, win 1829, options [nop,nop,TS val 98080 ecr 3672622], length 0
17:49:11.084452 IP 192.168.1.10.6633 > 192.168.1.30.40480: Flags [.], ack 45400, win 1829, options [nop,nop,TS val 98080 ecr 3672622], length 0
17:49:11.084472 IP 192.168.1.10.6633 > 192.168.1.30.40480: Flags [.], ack 47200, win 1829, options [nop,nop,TS val 98080 ecr 3672622], length 0
17:49:11.084484 IP 192.168.1.10.6633 > 192.168.1.30.40480: Flags [.], ack 47920, win 1829, options [nop,nop,TS val 98080 ecr 3672622], length 0
17:49:11.084552 IP 192.168.1.30.40480 > 192.168.1.10.6633: Flags [P.], seq 53680:54040, ack 1, win 58, options [nop,nop,TS val 3672622 ecr 98080], length 360: OpenFlow
	version 1.0, type PACKET_IN, length 360, xid 0x00000000
17:49:11.085171 IP 192.168.1.30.40480 > 192.168.1.10.6633: Flags [P.], seq 54040:54400, ack 1, win 58, options [nop,nop,TS val 3672622 ecr 98080], length 360: OpenFlow
	version 1.0, type PACKET_IN, length 360, xid 0x00000000
17:49:11.085213 IP 192.168.1.30.40480 > 192.168.1.10.6633: Flags [P.], seq 54400:54760, ack 1, win 58, options [nop,nop,TS val 3672622 ecr 98080], length 360: OpenFlow
	version 1.0, type PACKET_IN, length 360, xid 0x00000000
17:49:11.085262 IP 192.168.1.30.40480 > 192.168.1.10.6633: Flags [P.], seq 54760:55120, ack 1, win 58, options [nop,nop,TS val 3672622 ecr 98080], length 360: OpenFlow
	version 1.0, type PACKET_IN, length 360, xid 0x00000000
17:49:11.085307 IP 192.168.1.30.40480 > 192.168.1.10.6633: Flags [P.], seq 55120:55480, ack 1, win 58, options [nop,nop,TS val 3672622 ecr 98080], length 360: OpenFlow
	version 1.0, type PACKET_IN, length 360, xid 0x00000000
17:49:11.085349 IP 192.168.1.30.40480 > 192.168.1.10.6633: Flags [P.], seq 55480:55840, ack 1, win 58, options [nop,nop,TS val 3672622 ecr 98080], length 360: OpenFlow
	version 1.0, type PACKET_IN, length 360, xid 0x00000000
17:49:11.085385 IP 192.168.1.30.40480 > 192.168.1.10.6633: Flags [P.], seq 55840:56200, ack 1, win 58, options [nop,nop,TS val 3672622 ecr 98080], length 360: OpenFlow
	version 1.0, type PACKET_IN, length 360, xid 0x00000000
17:49:11.085469 IP 192.168.1.30.40480 > 192.168.1.10.6633: Flags [P.], seq 56200:56560, ack 1, win 58, options [nop,nop,TS val 3672622 ecr 98080], length 360: OpenFlow
	version 1.0, type PACKET_IN, length 360, xid 0x00000000
17:49:11.085529 IP 192.168.1.30.40480 > 192.168.1.10.6633: Flags [P.], seq 56560:56920, ack 1, win 58, options [nop,nop,TS val 3672623 ecr 98080], length 360: OpenFlow
	version 1.0, type PACKET_IN, length 360, xid 0x00000000
17:49:11.085572 IP 192.168.1.30.40480 > 192.168.1.10.6633: Flags [P.], seq 56920:57280, ack 1, win 58, options [nop,nop,TS val 3672623 ecr 98080], length 360: OpenFlow
	version 1.0, type PACKET_IN, length 360, xid 0x00000000
17:49:11.085616 IP 192.168.1.30.40480 > 192.168.1.10.6633: Flags [P.], seq 57280:57640, ack 1, win 58, options [nop,nop,TS val 3672623 ecr 98080], length 360: OpenFlow
	version 1.0, type PACKET_IN, length 360, xid 0x00000000
17:49:11.085663 IP 192.168.1.10.6633 > 192.168.1.30.40480: Flags [.], ack 52264, win 1829, options [nop,nop,TS val 98081 ecr 3672622], length 0
17:49:11.085702 IP 192.168.1.10.6633 > 192.168.1.30.40480: Flags [.], ack 54040, win 1829, options [nop,nop,TS val 98081 ecr 3672622], length 0
17:49:11.085720 IP 192.168.1.10.6633 > 192.168.1.30.40480: Flags [.], ack 56920, win 1807, options [nop,nop,TS val 98081 ecr 3672622], length 0
17:49:11.085817 IP 192.168.1.30.40480 > 192.168.1.10.6633: Flags [P.], seq 57640:58000, ack 1, win 58, options [nop,nop,TS val 3672623 ecr 98081], length 360: OpenFlow
	version 1.0, type PACKET_IN, length 360, xid 0x00000000
17:49:11.085864 IP 192.168.1.30.40480 > 192.168.1.10.6633: Flags [P.], seq 58000:58360, ack 1, win 58, options [nop,nop,TS val 3672623 ecr 98081], length 360: OpenFlow
	version 1.0, type PACKET_IN, length 360, xid 0x00000000
17:49:11.085906 IP 192.168.1.30.40480 > 192.168.1.10.6633: Flags [P.], seq 58360:58720, ack 1, win 58, options [nop,nop,TS val 3672623 ecr 98081], length 360: OpenFlow
	version 1.0, type PACKET_IN, length 360, xid 0x00000000
17:49:11.085950 IP 192.168.1.30.40480 > 192.168.1.10.6633: Flags [P.], seq 58720:59080, ack 1, win 58, options [nop,nop,TS val 3672623 ecr 98081], length 360: OpenFlow
	version 1.0, type PACKET_IN, length 360, xid 0x00000000
17:49:11.085992 IP 192.168.1.30.40480 > 192.168.1.10.6633: Flags [P.], seq 59080:59440, ack 1, win 58, options [nop,nop,TS val 3672623 ecr 98081], length 360: OpenFlow
	version 1.0, type PACKET_IN, length 360, xid 0x00000000
17:49:11.086035 IP 192.168.1.10.6633 > 192.168.1.30.40480: Flags [.], ack 57640, win 1829, options [nop,nop,TS val 98081 ecr 3672623], length 0
17:49:11.086096 IP 192.168.1.30.40480 > 192.168.1.10.6633: Flags [P.], seq 59440:59800, ack 1, win 58, options [nop,nop,TS val 3672623 ecr 98081], length 360: OpenFlow
	version 1.0, type PACKET_IN, length 360, xid 0x00000000
17:49:11.086566 IP 192.168.1.30.40480 > 192.168.1.10.6633: Flags [P.], seq 59800:60160, ack 1, win 58, options [nop,nop,TS val 3672623 ecr 98081], length 360: OpenFlow
	version 1.0, type PACKET_IN, length 360, xid 0x00000000
17:49:11.086597 IP 192.168.1.30.40480 > 192.168.1.10.6633: Flags [P.], seq 60160:60520, ack 1, win 58, options [nop,nop,TS val 3672623 ecr 98081], length 360: OpenFlow
	version 1.0, type PACKET_IN, length 360, xid 0x00000000
17:49:11.086622 IP 192.168.1.30.40480 > 192.168.1.10.6633: Flags [P.], seq 60520:60880, ack 1, win 58, options [nop,nop,TS val 3672623 ecr 98081], length 360: OpenFlow
	version 1.0, type PACKET_IN, length 360, xid 0x00000000
17:49:11.086652 IP 192.168.1.30.40480 > 192.168.1.10.6633: Flags [P.], seq 60880:61240, ack 1, win 58, options [nop,nop,TS val 3672623 ecr 98081], length 360: OpenFlow
	version 1.0, type PACKET_IN, length 360, xid 0x00000000
17:49:11.086677 IP 192.168.1.10.6633 > 192.168.1.30.40480: Flags [.], ack 59080, win 1829, options [nop,nop,TS val 98081 ecr 3672623], length 0
17:49:11.086726 IP 192.168.1.30.40480 > 192.168.1.10.6633: Flags [P.], seq 61240:61600, ack 1, win 58, options [nop,nop,TS val 3672623 ecr 98081], length 360: OpenFlow
	version 1.0, type PACKET_IN, length 360, xid 0x00000000
17:49:11.086754 IP 192.168.1.30.40480 > 192.168.1.10.6633: Flags [P.], seq 61600:61960, ack 1, win 58, options [nop,nop,TS val 3672623 ecr 98081], length 360: OpenFlow
	version 1.0, type PACKET_IN, length 360, xid 0x00000000
17:49:11.086781 IP 192.168.1.30.40480 > 192.168.1.10.6633: Flags [P.], seq 61960:62320, ack 1, win 58, options [nop,nop,TS val 3672623 ecr 98081], length 360: OpenFlow
	version 1.0, type PACKET_IN, length 360, xid 0x00000000
17:49:11.086804 IP 192.168.1.30.40480 > 192.168.1.10.6633: Flags [P.], seq 62320:62680, ack 1, win 58, options [nop,nop,TS val 3672623 ecr 98081], length 360: OpenFlow
	version 1.0, type PACKET_IN, length 360, xid 0x00000000
17:49:11.086856 IP 192.168.1.10.6633 > 192.168.1.30.40480: Flags [.], ack 60880, win 1829, options [nop,nop,TS val 98081 ecr 3672623], length 0
17:49:11.086877 IP 192.168.1.30.40480 > 192.168.1.10.6633: Flags [P.], seq 62680:63040, ack 1, win 58, options [nop,nop,TS val 3672623 ecr 98081], length 360: OpenFlow
	version 1.0, type PACKET_IN, length 360, xid 0x00000000
17:49:11.086918 IP 192.168.1.30.40480 > 192.168.1.10.6633: Flags [P.], seq 63040:63400, ack 1, win 58, options [nop,nop,TS val 3672623 ecr 98081], length 360: OpenFlow
	version 1.0, type PACKET_IN, length 360, xid 0x00000000
17:49:11.086952 IP 192.168.1.30.40480 > 192.168.1.10.6633: Flags [P.], seq 63400:63760, ack 1, win 58, options [nop,nop,TS val 3672623 ecr 98081], length 360: OpenFlow
	version 1.0, type PACKET_IN, length 360, xid 0x00000000
17:49:11.086986 IP 192.168.1.30.40480 > 192.168.1.10.6633: Flags [P.], seq 63760:64120, ack 1, win 58, options [nop,nop,TS val 3672623 ecr 98081], length 360: OpenFlow
	version 1.0, type PACKET_IN, length 360, xid 0x00000000
17:49:11.087020 IP 192.168.1.30.40480 > 192.168.1.10.6633: Flags [P.], seq 64120:64480, ack 1, win 58, options [nop,nop,TS val 3672623 ecr 98081], length 360: OpenFlow
	version 1.0, type PACKET_IN, length 360, xid 0x00000000
17:49:11.087043 IP 192.168.1.30.40480 > 192.168.1.10.6633: Flags [P.], seq 64480:64840, ack 1, win 58, options [nop,nop,TS val 3672623 ecr 98081], length 360: OpenFlow
	version 1.0, type PACKET_IN, length 360, xid 0x00000000
17:49:11.087070 IP 192.168.1.10.6633 > 192.168.1.30.40480: Flags [.], ack 62680, win 1829, options [nop,nop,TS val 98081 ecr 3672623], length 0
17:49:11.087083 IP 192.168.1.10.6633 > 192.168.1.30.40480: Flags [.], ack 63040, win 1829, options [nop,nop,TS val 98081 ecr 3672623], length 0
17:49:11.087116 IP 192.168.1.30.40480 > 192.168.1.10.6633: Flags [P.], seq 64840:65200, ack 1, win 58, options [nop,nop,TS val 3672623 ecr 98081], length 360: OpenFlow
	version 1.0, type PACKET_IN, length 360, xid 0x00000000
17:49:11.087141 IP 192.168.1.30.40480 > 192.168.1.10.6633: Flags [P.], seq 65200:65560, ack 1, win 58, options [nop,nop,TS val 3672623 ecr 98081], length 360: OpenFlow
	version 1.0, type PACKET_IN, length 360, xid 0x00000000
17:49:11.087163 IP 192.168.1.30.40480 > 192.168.1.10.6633: Flags [P.], seq 65560:65920, ack 1, win 58, options [nop,nop,TS val 3672623 ecr 98081], length 360: OpenFlow
	version 1.0, type PACKET_IN, length 360, xid 0x00000000
17:49:11.087185 IP 192.168.1.30.40480 > 192.168.1.10.6633: Flags [P.], seq 65920:66280, ack 1, win 58, options [nop,nop,TS val 3672623 ecr 98081], length 360: OpenFlow
	version 1.0, type PACKET_IN, length 360, xid 0x00000000
17:49:11.087207 IP 192.168.1.30.40480 > 192.168.1.10.6633: Flags [P.], seq 66280:66640, ack 1, win 58, options [nop,nop,TS val 3672623 ecr 98081], length 360: OpenFlow
	version 1.0, type PACKET_IN, length 360, xid 0x00000000
17:49:11.087231 IP 192.168.1.30.40480 > 192.168.1.10.6633: Flags [P.], seq 66640:67000, ack 1, win 58, options [nop,nop,TS val 3672623 ecr 98081], length 360: OpenFlow
	version 1.0, type PACKET_IN, length 360, xid 0x00000000
17:49:11.087254 IP 192.168.1.30.40480 > 192.168.1.10.6633: Flags [P.], seq 67000:67360, ack 1, win 58, options [nop,nop,TS val 3672623 ecr 98081], length 360: OpenFlow
	version 1.0, type PACKET_IN, length 360, xid 0x00000000
17:49:11.087277 IP 192.168.1.30.40480 > 192.168.1.10.6633: Flags [P.], seq 67360:67720, ack 1, win 58, options [nop,nop,TS val 3672623 ecr 98081], length 360: OpenFlow
	version 1.0, type PACKET_IN, length 360, xid 0x00000000
17:49:11.087299 IP 192.168.1.30.40480 > 192.168.1.10.6633: Flags [P.], seq 67720:68080, ack 1, win 58, options [nop,nop,TS val 3672623 ecr 98081], length 360: OpenFlow
	version 1.0, type PACKET_IN, length 360, xid 0x00000000
17:49:11.087325 IP 192.168.1.10.6633 > 192.168.1.30.40480: Flags [.], ack 64480, win 1829, options [nop,nop,TS val 98081 ecr 3672623], length 0
17:49:11.087338 IP 192.168.1.10.6633 > 192.168.1.30.40480: Flags [.], ack 65200, win 1829, options [nop,nop,TS val 98081 ecr 3672623], length 0
17:49:11.087349 IP 192.168.1.10.6633 > 192.168.1.30.40480: Flags [.], ack 66280, win 1829, options [nop,nop,TS val 98081 ecr 3672623], length 0
17:49:11.087383 IP 192.168.1.30.40480 > 192.168.1.10.6633: Flags [P.], seq 68080:68440, ack 1, win 58, options [nop,nop,TS val 3672623 ecr 98081], length 360: OpenFlow
	version 1.0, type PACKET_IN, length 360, xid 0x00000000
17:49:11.087413 IP 192.168.1.30.40480 > 192.168.1.10.6633: Flags [P.], seq 68440:68800, ack 1, win 58, options [nop,nop,TS val 3672623 ecr 98081], length 360: OpenFlow
	version 1.0, type PACKET_IN, length 360, xid 0x00000000
17:49:11.087442 IP 192.168.1.30.40480 > 192.168.1.10.6633: Flags [P.], seq 68800:69160, ack 1, win 58, options [nop,nop,TS val 3672623 ecr 98081], length 360: OpenFlow
	version 1.0, type PACKET_IN, length 360, xid 0x00000000
17:49:11.087470 IP 192.168.1.30.40480 > 192.168.1.10.6633: Flags [P.], seq 69160:69520, ack 1, win 58, options [nop,nop,TS val 3672623 ecr 98081], length 360: OpenFlow
	version 1.0, type PACKET_IN, length 360, xid 0x00000000
17:49:11.087497 IP 192.168.1.30.40480 > 192.168.1.10.6633: Flags [P.], seq 69520:69880, ack 1, win 58, options [nop,nop,TS val 3672623 ecr 98081], length 360: OpenFlow
	version 1.0, type PACKET_IN, length 360, xid 0x00000000
17:49:11.087523 IP 192.168.1.30.40480 > 192.168.1.10.6633: Flags [P.], seq 69880:70240, ack 1, win 58, options [nop,nop,TS val 3672623 ecr 98081], length 360: OpenFlow
	version 1.0, type PACKET_IN, length 360, xid 0x00000000
17:49:11.087546 IP 192.168.1.30.40480 > 192.168.1.10.6633: Flags [P.], seq 70240:70600, ack 1, win 58, options [nop,nop,TS val 3672623 ecr 98081], length 360: OpenFlow
	version 1.0, type PACKET_IN, length 360, xid 0x00000000
17:49:11.087567 IP 192.168.1.30.40480 > 192.168.1.10.6633: Flags [P.], seq 70600:70960, ack 1, win 58, options [nop,nop,TS val 3672623 ecr 98081], length 360: OpenFlow
	version 1.0, type PACKET_IN, length 360, xid 0x00000000
17:49:11.087593 IP 192.168.1.30.40480 > 192.168.1.10.6633: Flags [P.], seq 70960:71320, ack 1, win 58, options [nop,nop,TS val 3672623 ecr 98081], length 360: OpenFlow
	version 1.0, type PACKET_IN, length 360, xid 0x00000000
17:49:11.087628 IP 192.168.1.10.6633 > 192.168.1.30.40480: Flags [.], ack 67720, win 1829, options [nop,nop,TS val 98081 ecr 3672623], length 0
17:49:11.087650 IP 192.168.1.10.6633 > 192.168.1.30.40480: Flags [.], ack 68440, win 1829, options [nop,nop,TS val 98081 ecr 3672623], length 0
17:49:11.087740 IP 192.168.1.10.6633 > 192.168.1.30.40480: Flags [.], ack 70240, win 1829, options [nop,nop,TS val 98081 ecr 3672623], length 0
17:49:11.087813 IP 192.168.1.10.6633 > 192.168.1.30.40480: Flags [.], ack 71320, win 1829, options [nop,nop,TS val 98081 ecr 3672623], length 0
17:49:11.087849 IP 192.168.1.30.40480 > 192.168.1.10.6633: Flags [P.], seq 71320:71680, ack 1, win 58, options [nop,nop,TS val 3672623 ecr 98081], length 360: OpenFlow
	version 1.0, type PACKET_IN, length 360, xid 0x00000000
17:49:11.087884 IP 192.168.1.30.40480 > 192.168.1.10.6633: Flags [P.], seq 71680:72040, ack 1, win 58, options [nop,nop,TS val 3672623 ecr 98081], length 360: OpenFlow
	version 1.0, type PACKET_IN, length 360, xid 0x00000000
17:49:11.087921 IP 192.168.1.30.40480 > 192.168.1.10.6633: Flags [P.], seq 72040:72400, ack 1, win 58, options [nop,nop,TS val 3672623 ecr 98081], length 360: OpenFlow
	version 1.0, type PACKET_IN, length 360, xid 0x00000000
17:49:11.087955 IP 192.168.1.30.40480 > 192.168.1.10.6633: Flags [P.], seq 72400:72760, ack 1, win 58, options [nop,nop,TS val 3672623 ecr 98081], length 360: OpenFlow
	version 1.0, type PACKET_IN, length 360, xid 0x00000000
17:49:11.087995 IP 192.168.1.30.40480 > 192.168.1.10.6633: Flags [P.], seq 72760:73120, ack 1, win 58, options [nop,nop,TS val 3672623 ecr 98081], length 360: OpenFlow
	version 1.0, type PACKET_IN, length 360, xid 0x00000000
17:49:11.088031 IP 192.168.1.30.40480 > 192.168.1.10.6633: Flags [P.], seq 73120:73480, ack 1, win 58, options [nop,nop,TS val 3672623 ecr 98081], length 360: OpenFlow
	version 1.0, type PACKET_IN, length 360, xid 0x00000000
17:49:11.088067 IP 192.168.1.30.40480 > 192.168.1.10.6633: Flags [P.], seq 73480:73840, ack 1, win 58, options [nop,nop,TS val 3672623 ecr 98081], length 360: OpenFlow
	version 1.0, type PACKET_IN, length 360, xid 0x00000000
17:49:11.088101 IP 192.168.1.30.40480 > 192.168.1.10.6633: Flags [P.], seq 73840:74200, ack 1, win 58, options [nop,nop,TS val 3672623 ecr 98081], length 360: OpenFlow
	version 1.0, type PACKET_IN, length 360, xid 0x00000000
17:49:11.088142 IP 192.168.1.30.40480 > 192.168.1.10.6633: Flags [P.], seq 74200:74560, ack 1, win 58, options [nop,nop,TS val 3672623 ecr 98081], length 360: OpenFlow
	version 1.0, type PACKET_IN, length 360, xid 0x00000000
17:49:11.088172 IP 192.168.1.10.6633 > 192.168.1.30.40480: Flags [.], ack 72760, win 1829, options [nop,nop,TS val 98081 ecr 3672623], length 0
17:49:11.088215 IP 192.168.1.30.40480 > 192.168.1.10.6633: Flags [P.], seq 74560:74648, ack 1, win 58, options [nop,nop,TS val 3672623 ecr 98081], length 88: OpenFlow
	version 1.0, type PACKET_IN, length 88, xid 0x00000000
