18:05:55.031118 IP 192.168.1.30.40491 > 192.168.1.10.6633: Flags [P.], seq 3543499274:3543499399, ack 681785117, win 361, options [nop,nop,TS val 3923609 ecr 349065], length 125: OpenFlow
	version 1.0, type PACKET_IN, length 125, xid 0x00000000
18:05:55.031142 IP 192.168.1.30.40491 > 192.168.1.10.6633: Flags [P.], seq 125:250, ack 1, win 361, options [nop,nop,TS val 3923609 ecr 349065], length 125: OpenFlow
	version 1.0, type PACKET_IN, length 125, xid 0x00000000
18:05:55.031165 IP 192.168.1.30.40491 > 192.168.1.10.6633: Flags [P.], seq 250:375, ack 1, win 361, options [nop,nop,TS val 3923609 ecr 349065], length 125: OpenFlow
	version 1.0, type PACKET_IN, length 125, xid 0x00000000
18:05:55.031188 IP 192.168.1.30.40491 > 192.168.1.10.6633: Flags [P.], seq 375:500, ack 1, win 361, options [nop,nop,TS val 3923609 ecr 349065], length 125: OpenFlow
	version 1.0, type PACKET_IN, length 125, xid 0x00000000
18:05:55.031211 IP 192.168.1.30.40491 > 192.168.1.10.6633: Flags [P.], seq 500:625, ack 1, win 361, options [nop,nop,TS val 3923609 ecr 349065], length 125: OpenFlow
	version 1.0, type PACKET_IN, length 125, xid 0x00000000
18:05:55.031241 IP 192.168.1.30.40491 > 192.168.1.10.6633: Flags [P.], seq 625:750, ack 1, win 361, options [nop,nop,TS val 3923609 ecr 349065], length 125: OpenFlow
	version 1.0, type PACKET_IN, length 125, xid 0x00000000
18:05:55.031264 IP 192.168.1.30.40491 > 192.168.1.10.6633: Flags [P.], seq 750:875, ack 1, win 361, options [nop,nop,TS val 3923609 ecr 349065], length 125: OpenFlow
	version 1.0, type PACKET_IN, length 125, xid 0x00000000
18:05:55.031286 IP 192.168.1.30.40491 > 192.168.1.10.6633: Flags [P.], seq 875:1000, ack 1, win 361, options [nop,nop,TS val 3923609 ecr 349065], length 125: OpenFlow
	version 1.0, type PACKET_IN, length 125, xid 0x00000000
18:05:55.031309 IP 192.168.1.30.40491 > 192.168.1.10.6633: Flags [P.], seq 1000:1125, ack 1, win 361, options [nop,nop,TS val 3923609 ecr 349065], length 125: OpenFlow
	version 1.0, type PACKET_IN, length 125, xid 0x00000000
18:05:55.031332 IP 192.168.1.30.40491 > 192.168.1.10.6633: Flags [P.], seq 1125:1250, ack 1, win 361, options [nop,nop,TS val 3923609 ecr 349065], length 125: OpenFlow
	version 1.0, type PACKET_IN, length 125, xid 0x00000000
18:05:55.031355 IP 192.168.1.30.40491 > 192.168.1.10.6633: Flags [P.], seq 1250:1375, ack 1, win 361, options [nop,nop,TS val 3923609 ecr 349065], length 125: OpenFlow
	version 1.0, type PACKET_IN, length 125, xid 0x00000000
18:05:55.031378 IP 192.168.1.30.40491 > 192.168.1.10.6633: Flags [P.], seq 1375:1500, ack 1, win 361, options [nop,nop,TS val 3923609 ecr 349065], length 125: OpenFlow
	version 1.0, type PACKET_IN, length 125, xid 0x00000000
18:05:55.031400 IP 192.168.1.30.40491 > 192.168.1.10.6633: Flags [P.], seq 1500:1625, ack 1, win 361, options [nop,nop,TS val 3923609 ecr 349065], length 125: OpenFlow
	version 1.0, type PACKET_IN, length 125, xid 0x00000000
18:05:55.031427 IP 192.168.1.30.40491 > 192.168.1.10.6633: Flags [P.], seq 1625:1750, ack 1, win 361, options [nop,nop,TS val 3923609 ecr 349065], length 125: OpenFlow
	version 1.0, type PACKET_IN, length 125, xid 0x00000000
18:05:55.031451 IP 192.168.1.30.40491 > 192.168.1.10.6633: Flags [P.], seq 1750:1875, ack 1, win 361, options [nop,nop,TS val 3923609 ecr 349065], length 125: OpenFlow
	version 1.0, type PACKET_IN, length 125, xid 0x00000000
18:05:55.031473 IP 192.168.1.30.40491 > 192.168.1.10.6633: Flags [P.], seq 1875:2000, ack 1, win 361, options [nop,nop,TS val 3923609 ecr 349065], length 125: OpenFlow
	version 1.0, type PACKET_IN, length 125, xid 0x00000000
18:05:55.031496 IP 192.168.1.30.40491 > 192.168.1.10.6633: Flags [P.], seq 2000:2125, ack 1, win 361, options [nop,nop,TS val 3923609 ecr 349065], length 125: OpenFlow
	version 1.0, type PACKET_IN, length 125, xid 0x00000000
18:05:55.031519 IP 192.168.1.30.40491 > 192.168.1.10.6633: Flags [P.], seq 2125:2250, ack 1, win 361, options [nop,nop,TS val 3923609 ecr 349065], length 125: OpenFlow
	version 1.0, type PACKET_IN, length 125, xid 0x00000000
18:05:55.031542 IP 192.168.1.30.40491 > 192.168.1.10.6633: Flags [P.], seq 2250:2375, ack 1, win 361, options [nop,nop,TS val 3923609 ecr 349065], length 125: OpenFlow
	version 1.0, type PACKET_IN, length 125, xid 0x00000000
18:05:55.031574 IP 192.168.1.30.40491 > 192.168.1.10.6633: Flags [P.], seq 2375:2500, ack 1, win 361, options [nop,nop,TS val 3923609 ecr 349065], length 125: OpenFlow
	version 1.0, type PACKET_IN, length 125, xid 0x00000000
18:05:55.031598 IP 192.168.1.30.40491 > 192.168.1.10.6633: Flags [P.], seq 2500:2625, ack 1, win 361, options [nop,nop,TS val 3923609 ecr 349065], length 125: OpenFlow
	version 1.0, type PACKET_IN, length 125, xid 0x00000000
18:05:55.031622 IP 192.168.1.30.40491 > 192.168.1.10.6633: Flags [P.], seq 2625:2750, ack 1, win 361, options [nop,nop,TS val 3923609 ecr 349065], length 125: OpenFlow
	version 1.0, type PACKET_IN, length 125, xid 0x00000000
18:05:55.031644 IP 192.168.1.30.40491 > 192.168.1.10.6633: Flags [P.], seq 2750:2875, ack 1, win 361, options [nop,nop,TS val 3923609 ecr 349065], length 125: OpenFlow
	version 1.0, type PACKET_IN, length 125, xid 0x00000000
18:05:55.031667 IP 192.168.1.30.40491 > 192.168.1.10.6633: Flags [P.], seq 2875:3000, ack 1, win 361, options [nop,nop,TS val 3923609 ecr 349065], length 125: OpenFlow
	version 1.0, type PACKET_IN, length 125, xid 0x00000000
18:05:55.031690 IP 192.168.1.30.40491 > 192.168.1.10.6633: Flags [P.], seq 3000:3125, ack 1, win 361, options [nop,nop,TS val 3923609 ecr 349065], length 125: OpenFlow
	version 1.0, type PACKET_IN, length 125, xid 0x00000000
18:05:55.031714 IP 192.168.1.30.40491 > 192.168.1.10.6633: Flags [P.], seq 3125:3250, ack 1, win 361, options [nop,nop,TS val 3923609 ecr 349065], length 125: OpenFlow
	version 1.0, type PACKET_IN, length 125, xid 0x00000000
18:05:55.031736 IP 192.168.1.30.40491 > 192.168.1.10.6633: Flags [P.], seq 3250:3375, ack 1, win 361, options [nop,nop,TS val 3923609 ecr 349065], length 125: OpenFlow
	version 1.0, type PACKET_IN, length 125, xid 0x00000000
18:05:55.031759 IP 192.168.1.30.40491 > 192.168.1.10.6633: Flags [P.], seq 3375:3500, ack 1, win 361, options [nop,nop,TS val 3923609 ecr 349065], length 125: OpenFlow
	version 1.0, type PACKET_IN, length 125, xid 0x00000000
18:05:55.032518 IP 192.168.1.10.6633 > 192.168.1.30.40491: Flags [.], ack 0, win 7638, options [nop,nop,TS val 349067 ecr 3923609], length 0
18:05:55.032530 IP 192.168.1.10.6633 > 192.168.1.30.40491: Flags [.], ack 125, win 7638, options [nop,nop,TS val 349067 ecr 3923609], length 0
18:05:55.032536 IP 192.168.1.10.6633 > 192.168.1.30.40491: Flags [.], ack 250, win 7638, options [nop,nop,TS val 349067 ecr 3923609], length 0
18:05:55.032542 IP 192.168.1.10.6633 > 192.168.1.30.40491: Flags [.], ack 375, win 7638, options [nop,nop,TS val 349067 ecr 3923609], length 0
18:05:55.032546 IP 192.168.1.10.6633 > 192.168.1.30.40491: Flags [.], ack 500, win 7638, options [nop,nop,TS val 349067 ecr 3923609], length 0
18:05:55.032551 IP 192.168.1.10.6633 > 192.168.1.30.40491: Flags [.], ack 625, win 7638, options [nop,nop,TS val 349067 ecr 3923609], length 0
18:05:55.032556 IP 192.168.1.10.6633 > 192.168.1.30.40491: Flags [.], ack 750, win 7638, options [nop,nop,TS val 349067 ecr 3923609], length 0
18:05:55.032564 IP 192.168.1.10.6633 > 192.168.1.30.40491: Flags [.], ack 875, win 7638, options [nop,nop,TS val 349067 ecr 3923609], length 0
18:05:55.032568 IP 192.168.1.10.6633 > 192.168.1.30.40491: Flags [.], ack 1000, win 7638, options [nop,nop,TS val 349067 ecr 3923609], length 0
18:05:55.032573 IP 192.168.1.30.40491 > 192.168.1.10.6633: Flags [.], seq 3500:6396, ack 1, win 361, options [nop,nop,TS val 3923609 ecr 349067], length 2896: OpenFlow
	version 1.0, type PACKET_IN, length 125, xid 0x00000000
	version 1.0, type PACKET_IN, length 125, xid 0x00000000
	version 1.0, type PACKET_IN, length 125, xid 0x00000000
	version 1.0, type PACKET_IN, length 125, xid 0x00000000
	version 1.0, type PACKET_IN, length 125, xid 0x00000000
	version 1.0, type PACKET_IN, length 125, xid 0x00000000
	version 1.0, type PACKET_IN, length 125, xid 0x00000000
	version 1.0, type PACKET_IN, length 125, xid 0x00000000
	version 1.0, type PACKET_IN, length 125, xid 0x00000000
	version 1.0, type PACKET_IN, length 125, xid 0x00000000
	version 1.0, type PACKET_IN, length 125, xid 0x00000000
	version 1.0, type PACKET_IN, length 125, xid 0x00000000
	version 1.0, type PACKET_IN, length 125, xid 0x00000000
	version 1.0, type PACKET_IN, length 125, xid 0x00000000
	version 1.0, type PACKET_IN, length 125, xid 0x00000000
	version 1.0, type PACKET_IN, length 125, xid 0x00000000
	version 1.0, type PACKET_IN, length 125, xid 0x00000000
	version 1.0, type PACKET_IN, length 125, xid 0x00000000
	version 1.0, type PACKET_IN, length 125, xid 0x00000000
	version 1.0, type PACKET_IN, length 125, xid 0x00000000
	version 1.0, type PACKET_IN, length 125, xid 0x00000000
	version 1.0, type PACKET_IN, length 125, xid 0x00000000
	version 1.0, type PACKET_IN, length 125, xid 0x00000000
	version 1.0, type PACKET_IN, length 125, xid 0x00000000 [|openflow]
18:05:55.032588 IP 192.168.1.10.6633 > 192.168.1.30.40491: Flags [.], ack 1125, win 7638, options [nop,nop,TS val 349067 ecr 3923609], length 0
18:05:55.032598 IP 192.168.1.10.6633 > 192.168.1.30.40491: Flags [.], ack 1250, win 7638, options [nop,nop,TS val 349067 ecr 3923609], length 0
18:05:55.032607 IP 192.168.1.10.6633 > 192.168.1.30.40491: Flags [.], ack 1375, win 7638, options [nop,nop,TS val 349067 ecr 3923609], length 0
18:05:55.032610 IP 192.168.1.30.40491 > 192.168.1.10.6633: Flags [.], seq 6396:9292, ack 1, win 361, options [nop,nop,TS val 3923609 ecr 349067], length 2896: OpenFlow
	version unknown (0x00), type 0x00, length 64338, xid 0x69c7f318 [|openflow]
18:05:55.032613 IP 192.168.1.10.6633 > 192.168.1.30.40491: Flags [.], ack 1500, win 7638, options [nop,nop,TS val 349067 ecr 3923609], length 0
18:05:55.032623 IP 192.168.1.30.40491 > 192.168.1.10.6633: Flags [.], seq 9292:10740, ack 1, win 361, options [nop,nop,TS val 3923609 ecr 349067], length 1448: OpenFlow
	version unknown (0x00), type 0x00, length 0, xid 0x00005069 (corrupt)
18:05:55.032632 IP 192.168.1.30.40491 > 192.168.1.10.6633: Flags [P.], seq 10740:11000, ack 1, win 361, options [nop,nop,TS val 3923609 ecr 349067], length 260: OpenFlow
	version unknown (0x5f), type 0x69, length 28784, xid 0xc012000c [|openflow]
18:05:55.032642 IP 192.168.1.10.6633 > 192.168.1.30.40491: Flags [.], ack 1625, win 7638, options [nop,nop,TS val 349067 ecr 3923609], length 0
18:05:55.032653 IP 192.168.1.30.40491 > 192.168.1.10.6633: Flags [P.], seq 11000:11125, ack 1, win 361, options [nop,nop,TS val 3923609 ecr 349067], length 125: OpenFlow
	version 1.0, type PACKET_IN, length 125, xid 0x00000000
18:05:55.032654 IP 192.168.1.10.6633 > 192.168.1.30.40491: Flags [.], ack 1750, win 7638, options [nop,nop,TS val 349067 ecr 3923609], length 0
18:05:55.032666 IP 192.168.1.30.40491 > 192.168.1.10.6633: Flags [P.], seq 11125:11250, ack 1, win 361, options [nop,nop,TS val 3923609 ecr 349067], length 125: OpenFlow
	version 1.0, type PACKET_IN, length 125, xid 0x00000000
18:05:55.041516 IP 192.168.1.30.40491 > 192.168.1.10.6633: Flags [.], seq 11250:12698, ack 1, win 361, options [nop,nop,TS val 3923612 ecr 349067], length 1448: OpenFlow
	version 1.0, type PACKET_IN, length 125, xid 0x00000000
	version 1.0, type PACKET_IN, length 125, xid 0x00000000
	version 1.0, type PACKET_IN, length 125, xid 0x00000000
	version 1.0, type PACKET_IN, length 125, xid 0x00000000
	version 1.0, type PACKET_IN, length 125, xid 0x00000000
	version 1.0, type PACKET_IN, length 125, xid 0x00000000
	version 1.0, type PACKET_IN, length 125, xid 0x00000000
	version 1.0, type PACKET_IN, length 125, xid 0x00000000
	version 1.0, type PACKET_IN, length 125, xid 0x00000000
	version 1.0, type PACKET_IN, length 125, xid 0x00000000
	version 1.0, type PACKET_IN, length 125, xid 0x00000000
	version 1.0, type PACKET_IN, length 125, xid 0x00000000 [|openflow]
18:05:55.082808 IP 192.168.1.10.6633 > 192.168.1.30.40491: Flags [.], ack 12698, win 7553, options [nop,nop,TS val 349080 ecr 3923609], length 0
18:05:55.082885 IP 192.168.1.30.40491 > 192.168.1.10.6633: Flags [.], seq 12698:14146, ack 1, win 361, options [nop,nop,TS val 3923622 ecr 349080], length 1448: OpenFlow
	version unknown (0xe9), type 0x14, length 59648, xid 0x35a58a00 [|openflow]
18:05:55.082893 IP 192.168.1.30.40491 > 192.168.1.10.6633: Flags [.], seq 14146:17042, ack 1, win 361, options [nop,nop,TS val 3923622 ecr 349080], length 2896: OpenFlow
	version unknown (0x00), type 0x00, length 64338, xid 0x69c7f318 [|openflow]
18:05:55.082904 IP 192.168.1.30.40491 > 192.168.1.10.6633: Flags [.], seq 17042:19938, ack 1, win 361, options [nop,nop,TS val 3923622 ecr 349080], length 2896: OpenFlow
	version unknown (0x00), type 0x00, length 0, xid 0x00005069 (corrupt)
18:05:55.082914 IP 192.168.1.30.40491 > 192.168.1.10.6633: Flags [.], seq 19938:22834, ack 1, win 361, options [nop,nop,TS val 3923622 ecr 349080], length 2896: OpenFlow
	version unknown (0x00), type 0x00, length 0, xid 0x00000000 (corrupt)
18:05:55.082924 IP 192.168.1.30.40491 > 192.168.1.10.6633: Flags [.], seq 22834:25730, ack 1, win 361, options [nop,nop,TS val 3923622 ecr 349080], length 2896: OpenFlow
	version unknown (0x00), type 0x02, length 0, xid 0x00000000 (corrupt)
18:05:55.082933 IP 192.168.1.30.40491 > 192.168.1.10.6633: Flags [.], seq 25730:28626, ack 1, win 361, options [nop,nop,TS val 3923622 ecr 349080], length 2896: OpenFlow
	version unknown (0x6f), type 0x63, length 24940, xid 0x00000c00 [|openflow]
18:05:55.082944 IP 192.168.1.30.40491 > 192.168.1.10.6633: Flags [.], seq 28626:31522, ack 1, win 361, options [nop,nop,TS val 3923622 ecr 349080], length 2896: OpenFlow
	version unknown (0x0a), type 0x00, length 32000, xid 0x000000ff [|openflow]
18:05:55.082953 IP 192.168.1.30.40491 > 192.168.1.10.6633: Flags [.], seq 31522:34418, ack 1, win 361, options [nop,nop,TS val 3923622 ecr 349080], length 2896: OpenFlow
	version unknown (0x00), type 0xfb, length 21097, xid 0xc7f318d1 [|openflow]
18:05:55.083204 IP 192.168.1.30.40491 > 192.168.1.10.6633: Flags [.], seq 34418:37314, ack 1, win 361, options [nop,nop,TS val 3923622 ecr 349080], length 2896: OpenFlow
	version unknown (0x00), type 0x00, length 0, xid 0x005069c7 (corrupt)
18:05:55.083223 IP 192.168.1.30.40491 > 192.168.1.10.6633: Flags [.], seq 37314:40210, ack 1, win 361, options [nop,nop,TS val 3923622 ecr 349080], length 2896: OpenFlow
	version unknown (0x00), type 0x00, length 0, xid 0x000000fb (corrupt)
18:05:55.083233 IP 192.168.1.30.40491 > 192.168.1.10.6633: Flags [.], seq 40210:43106, ack 1, win 361, options [nop,nop,TS val 3923622 ecr 349080], length 2896: OpenFlow
	version unknown (0x02), type 0x00, length 0, xid 0x00000005 (corrupt)
18:05:55.121775 IP 192.168.1.10.6633 > 192.168.1.30.40491: Flags [.], ack 43106, win 7354, options [nop,nop,TS val 349090 ecr 3923622], length 0
18:05:55.121809 IP 192.168.1.30.40491 > 192.168.1.10.6633: Flags [.], seq 43106:46002, ack 1, win 361, options [nop,nop,TS val 3923632 ecr 349090], length 2896: OpenFlow
	version unknown (0x63), type 0x61, length 27648, xid 0x000c0001 [|openflow]
18:05:55.121820 IP 192.168.1.30.40491 > 192.168.1.10.6633: Flags [.], seq 46002:48898, ack 1, win 361, options [nop,nop,TS val 3923632 ecr 349090], length 2896: OpenFlow
	version unknown (0x00), type 0x7d, length 0, xid 0x0000ffff (corrupt)
18:05:55.121830 IP 192.168.1.30.40491 > 192.168.1.10.6633: Flags [.], seq 48898:51794, ack 1, win 361, options [nop,nop,TS val 3923632 ecr 349090], length 2896: OpenFlow
	version unknown (0xfb), type 0x52, length 27079, xid 0xf318d186 [|openflow]
18:05:55.121840 IP 192.168.1.30.40491 > 192.168.1.10.6633: Flags [.], seq 51794:54690, ack 1, win 361, options [nop,nop,TS val 3923632 ecr 349090], length 2896: OpenFlow
	version unknown (0x00), type 0x00, length 0, xid 0x5069c7ff (corrupt)
18:05:55.121864 IP 192.168.1.30.40491 > 192.168.1.10.6633: Flags [.], seq 54690:57586, ack 1, win 361, options [nop,nop,TS val 3923632 ecr 349090], length 2896: OpenFlow
	version unknown (0x00), type 0x00, length 0, xid 0x0000fb14 (corrupt)
18:05:55.121874 IP 192.168.1.30.40491 > 192.168.1.10.6633: Flags [.], seq 57586:59034, ack 1, win 361, options [nop,nop,TS val 3923632 ecr 349090], length 1448: OpenFlow
	version unknown (0x00), type 0x00, length 0, xid 0x0000055f (corrupt)
18:05:55.121882 IP 192.168.1.30.40491 > 192.168.1.10.6633: Flags [P.], seq 59034:60000, ack 1, win 361, options [nop,nop,TS val 3923632 ecr 349090], length 966: OpenFlow
	version unknown (0x00), type 0x00, length 53, xid 0x11fffe80
	version unknown (0x00), type 0x00, length 0, xid 0x00055f69 (corrupt)
18:05:55.136834 IP 192.168.1.30.40491 > 192.168.1.10.6633: Flags [P.], seq 60000:60125, ack 1, win 361, options [nop,nop,TS val 3923635 ecr 349090], length 125: OpenFlow
	version 1.0, type PACKET_IN, length 125, xid 0x00000000
18:05:55.136883 IP 192.168.1.30.40491 > 192.168.1.10.6633: Flags [P.], seq 60125:60250, ack 1, win 361, options [nop,nop,TS val 3923635 ecr 349090], length 125: OpenFlow
	version 1.0, type PACKET_IN, length 125, xid 0x00000000
18:05:55.136915 IP 192.168.1.30.40491 > 192.168.1.10.6633: Flags [P.], seq 60250:60375, ack 1, win 361, options [nop,nop,TS val 3923635 ecr 349090], length 125: OpenFlow
	version 1.0, type PACKET_IN, length 125, xid 0x00000000
18:05:55.136945 IP 192.168.1.30.40491 > 192.168.1.10.6633: Flags [P.], seq 60375:60500, ack 1, win 361, options [nop,nop,TS val 3923635 ecr 349090], length 125: OpenFlow
	version 1.0, type PACKET_IN, length 125, xid 0x00000000
18:05:55.136974 IP 192.168.1.30.40491 > 192.168.1.10.6633: Flags [P.], seq 60500:60625, ack 1, win 361, options [nop,nop,TS val 3923635 ecr 349090], length 125: OpenFlow
	version 1.0, type PACKET_IN, length 125, xid 0x00000000
18:05:55.137003 IP 192.168.1.30.40491 > 192.168.1.10.6633: Flags [P.], seq 60625:60750, ack 1, win 361, options [nop,nop,TS val 3923635 ecr 349090], length 125: OpenFlow
	version 1.0, type PACKET_IN, length 125, xid 0x00000000
18:05:55.137033 IP 192.168.1.30.40491 > 192.168.1.10.6633: Flags [P.], seq 60750:60875, ack 1, win 361, options [nop,nop,TS val 3923635 ecr 349090], length 125: OpenFlow
	version 1.0, type PACKET_IN, length 125, xid 0x00000000
18:05:55.137062 IP 192.168.1.30.40491 > 192.168.1.10.6633: Flags [P.], seq 60875:61000, ack 1, win 361, options [nop,nop,TS val 3923635 ecr 349090], length 125: OpenFlow
	version 1.0, type PACKET_IN, length 125, xid 0x00000000
18:05:55.137098 IP 192.168.1.30.40491 > 192.168.1.10.6633: Flags [P.], seq 61000:61125, ack 1, win 361, options [nop,nop,TS val 3923635 ecr 349090], length 125: OpenFlow
	version 1.0, type PACKET_IN, length 125, xid 0x00000000
18:05:55.137127 IP 192.168.1.30.40491 > 192.168.1.10.6633: Flags [P.], seq 61125:61250, ack 1, win 361, options [nop,nop,TS val 3923635 ecr 349090], length 125: OpenFlow
	version 1.0, type PACKET_IN, length 125, xid 0x00000000
18:05:55.155035 IP 192.168.1.10.6633 > 192.168.1.30.40491: Flags [.], ack 61250, win 7308, options [nop,nop,TS val 349098 ecr 3923632], length 0
18:05:55.155070 IP 192.168.1.30.40491 > 192.168.1.10.6633: Flags [.], seq 61250:64146, ack 1, win 361, options [nop,nop,TS val 3923640 ecr 349098], length 2896: OpenFlow
	version 1.0, type PACKET_IN, length 125, xid 0x00000000
	version 1.0, type PACKET_IN, length 125, xid 0x00000000
	version 1.0, type PACKET_IN, length 125, xid 0x00000000
	version 1.0, type PACKET_IN, length 125, xid 0x00000000
	version 1.0, type PACKET_IN, length 125, xid 0x00000000
	version 1.0, type PACKET_IN, length 125, xid 0x00000000
	version 1.0, type PACKET_IN, length 125, xid 0x00000000
	version 1.0, type PACKET_IN, length 125, xid 0x00000000
	version 1.0, type PACKET_IN, length 125, xid 0x00000000
	version 1.0, type PACKET_IN, length 125, xid 0x00000000
	version 1.0, type PACKET_IN, length 125, xid 0x00000000
	version 1.0, type PACKET_IN, length 125, xid 0x00000000
	version 1.0, type PACKET_IN, length 125, xid 0x00000000
	version 1.0, type PACKET_IN, length 125, xid 0x00000000
	version 1.0, type PACKET_IN, length 125, xid 0x00000000
	version 1.0, type PACKET_IN, length 125, xid 0x00000000
	version 1.0, type PACKET_IN, length 125, xid 0x00000000
	version 1.0, type PACKET_IN, length 125, xid 0x00000000
	version 1.0, type PACKET_IN, length 125, xid 0x00000000
	version 1.0, type PACKET_IN, length 125, xid 0x00000000
	version 1.0, type PACKET_IN, length 125, xid 0x00000000
	version 1.0, type PACKET_IN, length 125, xid 0x00000000
	version 1.0, type PACKET_IN, length 125, xid 0x00000000
	version 1.0, type PACKET_IN, length 125, xid 0x00000000 [|openflow]
18:05:55.155091 IP 192.168.1.30.40491 > 192.168.1.10.6633: Flags [.], seq 64146:67042, ack 1, win 361, options [nop,nop,TS val 3923640 ecr 349098], length 2896: OpenFlow
	version unknown (0x00), type 0x00, length 64338, xid 0x69c7f318 [|openflow]
18:05:55.155102 IP 192.168.1.30.40491 > 192.168.1.10.6633: Flags [.], seq 67042:69938, ack 1, win 361, options [nop,nop,TS val 3923640 ecr 349098], length 2896: OpenFlow
	version unknown (0x00), type 0x00, length 0, xid 0x00005069 (corrupt)
18:05:55.155112 IP 192.168.1.30.40491 > 192.168.1.10.6633: Flags [.], seq 69938:72834, ack 1, win 361, options [nop,nop,TS val 3923640 ecr 349098], length 2896: OpenFlow
	version unknown (0x00), type 0x00, length 0, xid 0x00000000 (corrupt)
18:05:55.155123 IP 192.168.1.30.40491 > 192.168.1.10.6633: Flags [.], seq 72834:75730, ack 1, win 361, options [nop,nop,TS val 3923640 ecr 349098], length 2896: OpenFlow
	version unknown (0x00), type 0x02, length 0, xid 0x00000000 (corrupt)
18:05:55.155133 IP 192.168.1.30.40491 > 192.168.1.10.6633: Flags [.], seq 75730:78626, ack 1, win 361, options [nop,nop,TS val 3923640 ecr 349098], length 2896: OpenFlow
	version unknown (0x6f), type 0x63, length 24940, xid 0x00000c00 [|openflow]
18:05:55.155143 IP 192.168.1.30.40491 > 192.168.1.10.6633: Flags [.], seq 78626:81522, ack 1, win 361, options [nop,nop,TS val 3923640 ecr 349098], length 2896: OpenFlow
	version unknown (0x0a), type 0x00, length 32000, xid 0x000000ff [|openflow]
18:05:55.155153 IP 192.168.1.30.40491 > 192.168.1.10.6633: Flags [.], seq 81522:84418, ack 1, win 361, options [nop,nop,TS val 3923640 ecr 349098], length 2896: OpenFlow
	version unknown (0x00), type 0xfb, length 21097, xid 0xc7f318d1 [|openflow]
18:05:55.155163 IP 192.168.1.30.40491 > 192.168.1.10.6633: Flags [.], seq 84418:87314, ack 1, win 361, options [nop,nop,TS val 3923640 ecr 349098], length 2896: OpenFlow
	version unknown (0x00), type 0x00, length 0, xid 0x005069c7 (corrupt)
18:05:55.155173 IP 192.168.1.30.40491 > 192.168.1.10.6633: Flags [.], seq 87314:90210, ack 1, win 361, options [nop,nop,TS val 3923640 ecr 349098], length 2896: OpenFlow
	version unknown (0x00), type 0x00, length 0, xid 0x000000fb (corrupt)
18:05:55.155184 IP 192.168.1.30.40491 > 192.168.1.10.6633: Flags [.], seq 90210:93106, ack 1, win 361, options [nop,nop,TS val 3923640 ecr 349098], length 2896: OpenFlow
	version unknown (0x02), type 0x00, length 0, xid 0x00000005 (corrupt)
18:05:55.155403 IP 192.168.1.10.6633 > 192.168.1.30.40491: Flags [.], ack 75730, win 7834, options [nop,nop,TS val 349098 ecr 3923640], length 0
18:05:55.155420 IP 192.168.1.30.40491 > 192.168.1.10.6633: Flags [.], seq 93106:96002, ack 1, win 361, options [nop,nop,TS val 3923640 ecr 349098], length 2896: OpenFlow
	version unknown (0x63), type 0x61, length 27648, xid 0x000c0001 [|openflow]
18:05:55.155560 IP 192.168.1.30.40491 > 192.168.1.10.6633: Flags [.], seq 96002:98898, ack 1, win 361, options [nop,nop,TS val 3923640 ecr 349098], length 2896: OpenFlow
	version unknown (0x00), type 0x7d, length 0, xid 0x0000ffff (corrupt)
18:05:55.155567 IP 192.168.1.10.6633 > 192.168.1.30.40491: Flags [.], ack 93106, win 7834, options [nop,nop,TS val 349098 ecr 3923640], length 0
18:05:55.155570 IP 192.168.1.30.40491 > 192.168.1.10.6633: Flags [.], seq 98898:101794, ack 1, win 361, options [nop,nop,TS val 3923640 ecr 349098], length 2896: OpenFlow
	version unknown (0xfb), type 0x52, length 27079, xid 0xf318d186 [|openflow]
18:05:55.155580 IP 192.168.1.30.40491 > 192.168.1.10.6633: Flags [.], seq 101794:104690, ack 1, win 361, options [nop,nop,TS val 3923640 ecr 349098], length 2896: OpenFlow
	version unknown (0x00), type 0x00, length 0, xid 0x5069c7ff (corrupt)
18:05:55.155590 IP 192.168.1.30.40491 > 192.168.1.10.6633: Flags [.], seq 104690:107586, ack 1, win 361, options [nop,nop,TS val 3923640 ecr 349098], length 2896: OpenFlow
	version unknown (0x00), type 0x00, length 0, xid 0x0000fb14 (corrupt)
18:05:55.155679 IP 192.168.1.30.40491 > 192.168.1.10.6633: Flags [.], seq 107586:110482, ack 1, win 361, options [nop,nop,TS val 3923640 ecr 349098], length 2896: OpenFlow
	version unknown (0x00), type 0x00, length 0, xid 0x0000055f (corrupt)
18:05:55.155775 IP 192.168.1.30.40491 > 192.168.1.10.6633: Flags [.], seq 110482:113378, ack 1, win 361, options [nop,nop,TS val 3923640 ecr 349098], length 2896: OpenFlow
	version unknown (0x61), type 0x6c, length 0, xid 0x0c000104 (corrupt)
18:05:55.155787 IP 192.168.1.30.40491 > 192.168.1.10.6633: Flags [.], seq 113378:116274, ack 1, win 361, options [nop,nop,TS val 3923640 ecr 349098], length 2896: OpenFlow
	version unknown (0x7d), type 0x00, length 0, xid 0x00ffffff (corrupt)
18:05:55.155796 IP 192.168.1.30.40491 > 192.168.1.10.6633: Flags [.], seq 116274:119170, ack 1, win 361, options [nop,nop,TS val 3923640 ecr 349098], length 2896: OpenFlow
	version unknown (0x52), type 0x69, length 51187, xid 0x18d186dd [|openflow]
18:05:55.155806 IP 192.168.1.30.40491 > 192.168.1.10.6633: Flags [.], seq 119170:122066, ack 1, win 361, options [nop,nop,TS val 3923640 ecr 349098], length 2896: OpenFlow
	version unknown (0x00), type 0x00, length 80, xid 0x69c7fffe
	version 1.0, type PACKET_IN, length 125, xid 0x00000000
	version 1.0, type PACKET_IN, length 125, xid 0x00000000
	version 1.0, type PACKET_IN, length 125, xid 0x00000000
	version 1.0, type PACKET_IN, length 125, xid 0x00000000
	version 1.0, type PACKET_IN, length 125, xid 0x00000000
	version 1.0, type PACKET_IN, length 125, xid 0x00000000
	version 1.0, type PACKET_IN, length 125, xid 0x00000000
	version 1.0, type PACKET_IN, length 125, xid 0x00000000
	version 1.0, type PACKET_IN, length 125, xid 0x00000000
	version 1.0, type PACKET_IN, length 125, xid 0x00000000
	version 1.0, type PACKET_IN, length 125, xid 0x00000000
	version 1.0, type PACKET_IN, length 125, xid 0x00000000
	version 1.0, type PACKET_IN, length 125, xid 0x00000000
	version 1.0, type PACKET_IN, length 125, xid 0x00000000
	version 1.0, type PACKET_IN, length 125, xid 0x00000000
	version 1.0, type PACKET_IN, length 125, xid 0x00000000
	version 1.0, type PACKET_IN, length 125, xid 0x00000000
	version 1.0, type PACKET_IN, length 125, xid 0x00000000
	version 1.0, type PACKET_IN, length 125, xid 0x00000000
	version 1.0, type PACKET_IN, length 125, xid 0x00000000
	version 1.0, type PACKET_IN, length 125, xid 0x00000000
	version 1.0, type PACKET_IN, length 125, xid 0x00000000
	version 1.0, type PACKET_IN, length 125, xid 0x00000000 [|openflow]
18:05:55.155816 IP 192.168.1.30.40491 > 192.168.1.10.6633: Flags [.], seq 122066:124962, ack 1, win 361, options [nop,nop,TS val 3923640 ecr 349098], length 2896: OpenFlow
	version unknown (0x00), type 0x00, length 0, xid 0x00fb14e9 (corrupt)
18:05:55.162491 IP 192.168.1.10.6633 > 192.168.1.30.40491: Flags [.], ack 124962, win 7834, options [nop,nop,TS val 349099 ecr 3923640], length 0
18:05:55.162517 IP 192.168.1.30.40491 > 192.168.1.10.6633: Flags [.], seq 124962:127858, ack 1, win 361, options [nop,nop,TS val 3923642 ecr 349099], length 2896: OpenFlow
	version unknown (0x00), type 0x00, length 0, xid 0x00055f69 (corrupt)
18:05:55.162530 IP 192.168.1.30.40491 > 192.168.1.10.6633: Flags [.], seq 127858:130754, ack 1, win 361, options [nop,nop,TS val 3923642 ecr 349099], length 2896: OpenFlow
	version unknown (0x6c), type 0x00, length 12, xid 0x0001045f
	version unknown (0x12), type 0x00, length 3072, xid 0x01010a00 [|openflow]
18:05:55.162542 IP 192.168.1.30.40491 > 192.168.1.10.6633: Flags [.], seq 130754:133650, ack 1, win 361, options [nop,nop,TS val 3923642 ecr 349099], length 2896: OpenFlow
	version unknown (0x00), type 0x00, length 0, xid 0xffffffff (corrupt)
18:05:55.162669 IP 192.168.1.30.40491 > 192.168.1.10.6633: Flags [.], seq 133650:136546, ack 1, win 361, options [nop,nop,TS val 3923642 ecr 349099], length 2896: OpenFlow
	version unknown (0x69), type 0xc7, length 62232, xid 0xd186dd60 [|openflow]
18:05:55.162684 IP 192.168.1.30.40491 > 192.168.1.10.6633: Flags [P.], seq 136546:137000, ack 1, win 361, options [nop,nop,TS val 3923642 ecr 349099], length 454: OpenFlow
	version unknown (0x00), type 0x00, length 20585, xid 0xc7fffef3 [|openflow]
18:05:55.165376 IP 192.168.1.10.6633 > 192.168.1.30.40491: Flags [.], ack 136546, win 7834, options [nop,nop,TS val 349100 ecr 3923642], length 0
18:05:55.168549 IP 192.168.1.10.6633 > 192.168.1.30.40491: Flags [.], ack 137000, win 7834, options [nop,nop,TS val 349101 ecr 3923642], length 0
18:05:55.296313 IP 192.168.1.30.40491 > 192.168.1.10.6633: Flags [P.], seq 137000:137125, ack 1, win 361, options [nop,nop,TS val 3923675 ecr 349101], length 125: OpenFlow
	version 1.0, type PACKET_IN, length 125, xid 0x00000000
18:05:55.296353 IP 192.168.1.30.40491 > 192.168.1.10.6633: Flags [P.], seq 137125:137250, ack 1, win 361, options [nop,nop,TS val 3923675 ecr 349101], length 125: OpenFlow
	version 1.0, type PACKET_IN, length 125, xid 0x00000000
18:05:55.296382 IP 192.168.1.30.40491 > 192.168.1.10.6633: Flags [P.], seq 137250:137375, ack 1, win 361, options [nop,nop,TS val 3923675 ecr 349101], length 125: OpenFlow
	version 1.0, type PACKET_IN, length 125, xid 0x00000000
18:05:55.296411 IP 192.168.1.30.40491 > 192.168.1.10.6633: Flags [P.], seq 137375:137500, ack 1, win 361, options [nop,nop,TS val 3923675 ecr 349101], length 125: OpenFlow
	version 1.0, type PACKET_IN, length 125, xid 0x00000000
18:05:55.296440 IP 192.168.1.30.40491 > 192.168.1.10.6633: Flags [P.], seq 137500:137625, ack 1, win 361, options [nop,nop,TS val 3923675 ecr 349101], length 125: OpenFlow
	version 1.0, type PACKET_IN, length 125, xid 0x00000000
18:05:55.296471 IP 192.168.1.30.40491 > 192.168.1.10.6633: Flags [P.], seq 137625:137750, ack 1, win 361, options [nop,nop,TS val 3923675 ecr 349101], length 125: OpenFlow
	version 1.0, type PACKET_IN, length 125, xid 0x00000000
18:05:55.296509 IP 192.168.1.30.40491 > 192.168.1.10.6633: Flags [P.], seq 137750:137875, ack 1, win 361, options [nop,nop,TS val 3923675 ecr 349101], length 125: OpenFlow
	version 1.0, type PACKET_IN, length 125, xid 0x00000000
18:05:55.296537 IP 192.168.1.30.40491 > 192.168.1.10.6633: Flags [P.], seq 137875:138000, ack 1, win 361, options [nop,nop,TS val 3923675 ecr 349101], length 125: OpenFlow
	version 1.0, type PACKET_IN, length 125, xid 0x00000000
18:05:55.296566 IP 192.168.1.30.40491 > 192.168.1.10.6633: Flags [P.], seq 138000:138125, ack 1, win 361, options [nop,nop,TS val 3923675 ecr 349101], length 125: OpenFlow
	version 1.0, type PACKET_IN, length 125, xid 0x00000000
18:05:55.296595 IP 192.168.1.30.40491 > 192.168.1.10.6633: Flags [P.], seq 138125:138250, ack 1, win 361, options [nop,nop,TS val 3923675 ecr 349101], length 125: OpenFlow
	version 1.0, type PACKET_IN, length 125, xid 0x00000000
18:05:55.296624 IP 192.168.1.30.40491 > 192.168.1.10.6633: Flags [P.], seq 138250:138375, ack 1, win 361, options [nop,nop,TS val 3923675 ecr 349101], length 125: OpenFlow
	version 1.0, type PACKET_IN, length 125, xid 0x00000000
18:05:55.296653 IP 192.168.1.30.40491 > 192.168.1.10.6633: Flags [P.], seq 138375:138500, ack 1, win 361, options [nop,nop,TS val 3923675 ecr 349101], length 125: OpenFlow
	version 1.0, type PACKET_IN, length 125, xid 0x00000000
18:05:55.296688 IP 192.168.1.30.40491 > 192.168.1.10.6633: Flags [P.], seq 138500:138625, ack 1, win 361, options [nop,nop,TS val 3923675 ecr 349101], length 125: OpenFlow
	version 1.0, type PACKET_IN, length 125, xid 0x00000000
18:05:55.296720 IP 192.168.1.30.40491 > 192.168.1.10.6633: Flags [P.], seq 138625:138750, ack 1, win 361, options [nop,nop,TS val 3923675 ecr 349101], length 125: OpenFlow
	version 1.0, type PACKET_IN, length 125, xid 0x00000000
18:05:55.296750 IP 192.168.1.30.40491 > 192.168.1.10.6633: Flags [P.], seq 138750:138875, ack 1, win 361, options [nop,nop,TS val 3923675 ecr 349101], length 125: OpenFlow
	version 1.0, type PACKET_IN, length 125, xid 0x00000000
18:05:55.296779 IP 192.168.1.30.40491 > 192.168.1.10.6633: Flags [P.], seq 138875:139000, ack 1, win 361, options [nop,nop,TS val 3923675 ecr 349101], length 125: OpenFlow
	version 1.0, type PACKET_IN, length 125, xid 0x00000000
18:05:55.296807 IP 192.168.1.30.40491 > 192.168.1.10.6633: Flags [P.], seq 139000:139125, ack 1, win 361, options [nop,nop,TS val 3923675 ecr 349101], length 125: OpenFlow
	version 1.0, type PACKET_IN, length 125, xid 0x00000000
18:05:55.296836 IP 192.168.1.30.40491 > 192.168.1.10.6633: Flags [P.], seq 139125:139250, ack 1, win 361, options [nop,nop,TS val 3923675 ecr 349101], length 125: OpenFlow
	version 1.0, type PACKET_IN, length 125, xid 0x00000000
18:05:55.296869 IP 192.168.1.30.40491 > 192.168.1.10.6633: Flags [P.], seq 139250:139375, ack 1, win 361, options [nop,nop,TS val 3923675 ecr 349101], length 125: OpenFlow
	version 1.0, type PACKET_IN, length 125, xid 0x00000000
18:05:55.296899 IP 192.168.1.30.40491 > 192.168.1.10.6633: Flags [P.], seq 139375:139500, ack 1, win 361, options [nop,nop,TS val 3923675 ecr 349101], length 125: OpenFlow
	version 1.0, type PACKET_IN, length 125, xid 0x00000000
18:05:55.296932 IP 192.168.1.30.40491 > 192.168.1.10.6633: Flags [P.], seq 139500:139625, ack 1, win 361, options [nop,nop,TS val 3923675 ecr 349101], length 125: OpenFlow
	version 1.0, type PACKET_IN, length 125, xid 0x00000000
18:05:55.296963 IP 192.168.1.30.40491 > 192.168.1.10.6633: Flags [P.], seq 139625:139750, ack 1, win 361, options [nop,nop,TS val 3923675 ecr 349101], length 125: OpenFlow
	version 1.0, type PACKET_IN, length 125, xid 0x00000000
18:05:55.296996 IP 192.168.1.30.40491 > 192.168.1.10.6633: Flags [P.], seq 139750:139875, ack 1, win 361, options [nop,nop,TS val 3923675 ecr 349101], length 125: OpenFlow
	version 1.0, type PACKET_IN, length 125, xid 0x00000000
18:05:55.298510 IP 192.168.1.10.6633 > 192.168.1.30.40491: Flags [.], ack 138500, win 7834, options [nop,nop,TS val 349134 ecr 3923675], length 0
18:05:55.298530 IP 192.168.1.30.40491 > 192.168.1.10.6633: Flags [.], seq 139875:142771, ack 1, win 361, options [nop,nop,TS val 3923676 ecr 349134], length 2896: OpenFlow
	version 1.0, type PACKET_IN, length 125, xid 0x00000000
	version 1.0, type PACKET_IN, length 125, xid 0x00000000
	version 1.0, type PACKET_IN, length 125, xid 0x00000000
	version 1.0, type PACKET_IN, length 125, xid 0x00000000
	version 1.0, type PACKET_IN, length 125, xid 0x00000000
	version 1.0, type PACKET_IN, length 125, xid 0x00000000
	version 1.0, type PACKET_IN, length 125, xid 0x00000000
	version 1.0, type PACKET_IN, length 125, xid 0x00000000
	version 1.0, type PACKET_IN, length 125, xid 0x00000000
	version 1.0, type PACKET_IN, length 125, xid 0x00000000
	version 1.0, type PACKET_IN, length 125, xid 0x00000000
	version 1.0, type PACKET_IN, length 125, xid 0x00000000
	version 1.0, type PACKET_IN, length 125, xid 0x00000000
	version 1.0, type PACKET_IN, length 125, xid 0x00000000
	version 1.0, type PACKET_IN, length 125, xid 0x00000000
	version 1.0, type PACKET_IN, length 125, xid 0x00000000
	version 1.0, type PACKET_IN, length 125, xid 0x00000000
	version 1.0, type PACKET_IN, length 125, xid 0x00000000
	version 1.0, type PACKET_IN, length 125, xid 0x00000000
	version 1.0, type PACKET_IN, length 125, xid 0x00000000
	version 1.0, type PACKET_IN, length 125, xid 0x00000000
	version 1.0, type PACKET_IN, length 125, xid 0x00000000
	version 1.0, type PACKET_IN, length 125, xid 0x00000000
	version 1.0, type PACKET_IN, length 125, xid 0x00000000 [|openflow]
18:05:55.298542 IP 192.168.1.30.40491 > 192.168.1.10.6633: Flags [.], seq 142771:145667, ack 1, win 361, options [nop,nop,TS val 3923676 ecr 349134], length 2896: OpenFlow
	version unknown (0x00), type 0x00, length 64338, xid 0x69c7f318 [|openflow]
18:05:55.298552 IP 192.168.1.30.40491 > 192.168.1.10.6633: Flags [.], seq 145667:148563, ack 1, win 361, options [nop,nop,TS val 3923676 ecr 349134], length 2896: OpenFlow
	version unknown (0x00), type 0x00, length 0, xid 0x00005069 (corrupt)
18:05:55.298563 IP 192.168.1.30.40491 > 192.168.1.10.6633: Flags [.], seq 148563:151459, ack 1, win 361, options [nop,nop,TS val 3923676 ecr 349134], length 2896: OpenFlow
	version unknown (0x00), type 0x00, length 0, xid 0x00000000 (corrupt)
18:05:55.298574 IP 192.168.1.30.40491 > 192.168.1.10.6633: Flags [.], seq 151459:154355, ack 1, win 361, options [nop,nop,TS val 3923676 ecr 349134], length 2896: OpenFlow
	version unknown (0x00), type 0x02, length 0, xid 0x00000000 (corrupt)
18:05:55.298586 IP 192.168.1.30.40491 > 192.168.1.10.6633: Flags [.], seq 154355:157251, ack 1, win 361, options [nop,nop,TS val 3923676 ecr 349134], length 2896: OpenFlow
	version unknown (0x6f), type 0x63, length 24940, xid 0x00000c00 [|openflow]
18:05:55.298596 IP 192.168.1.30.40491 > 192.168.1.10.6633: Flags [P.], seq 157251:158375, ack 1, win 361, options [nop,nop,TS val 3923676 ecr 349134], length 1124: OpenFlow
	version unknown (0x0a), type 0x00, length 32000, xid 0x000000ff [|openflow]
18:05:55.298749 IP 192.168.1.10.6633 > 192.168.1.30.40491: Flags [.], ack 157251, win 7834, options [nop,nop,TS val 349134 ecr 3923675], length 0
18:05:55.298770 IP 192.168.1.30.40491 > 192.168.1.10.6633: Flags [P.], seq 158375:159625, ack 1, win 361, options [nop,nop,TS val 3923676 ecr 349134], length 1250: OpenFlow
	version 1.0, type PACKET_IN, length 125, xid 0x00000000
	version 1.0, type PACKET_IN, length 125, xid 0x00000000
	version 1.0, type PACKET_IN, length 125, xid 0x00000000
	version 1.0, type PACKET_IN, length 125, xid 0x00000000
	version 1.0, type PACKET_IN, length 125, xid 0x00000000
	version 1.0, type PACKET_IN, length 125, xid 0x00000000
	version 1.0, type PACKET_IN, length 125, xid 0x00000000
	version 1.0, type PACKET_IN, length 125, xid 0x00000000
	version 1.0, type PACKET_IN, length 125, xid 0x00000000
	version 1.0, type PACKET_IN, length 125, xid 0x00000000
18:05:55.298783 IP 192.168.1.30.40491 > 192.168.1.10.6633: Flags [P.], seq 159625:159750, ack 1, win 361, options [nop,nop,TS val 3923676 ecr 349134], length 125: OpenFlow
	version 1.0, type PACKET_IN, length 125, xid 0x00000000
18:05:55.298817 IP 192.168.1.30.40491 > 192.168.1.10.6633: Flags [P.], seq 159750:159875, ack 1, win 361, options [nop,nop,TS val 3923676 ecr 349134], length 125: OpenFlow
	version 1.0, type PACKET_IN, length 125, xid 0x00000000
18:05:55.298851 IP 192.168.1.30.40491 > 192.168.1.10.6633: Flags [P.], seq 159875:160000, ack 1, win 361, options [nop,nop,TS val 3923676 ecr 349134], length 125: OpenFlow
	version 1.0, type PACKET_IN, length 125, xid 0x00000000
18:05:55.298868 IP 192.168.1.30.40491 > 192.168.1.10.6633: Flags [P.], seq 160000:160125, ack 1, win 361, options [nop,nop,TS val 3923676 ecr 349134], length 125: OpenFlow
	version 1.0, type PACKET_IN, length 125, xid 0x00000000
18:05:55.298891 IP 192.168.1.30.40491 > 192.168.1.10.6633: Flags [P.], seq 160125:160250, ack 1, win 361, options [nop,nop,TS val 3923676 ecr 349134], length 125: OpenFlow
	version 1.0, type PACKET_IN, length 125, xid 0x00000000
18:05:55.298976 IP 192.168.1.30.40491 > 192.168.1.10.6633: Flags [P.], seq 160250:160375, ack 1, win 361, options [nop,nop,TS val 3923676 ecr 349134], length 125: OpenFlow
	version 1.0, type PACKET_IN, length 125, xid 0x00000000
