18:05:55.023503 IP 192.168.1.10.6633 > 192.168.1.30.41322: Flags [.], ack 2727827412, win 3199, options [nop,nop,TS val 349065 ecr 3923594], length 0
18:05:55.023529 IP 192.168.1.30.41322 > 192.168.1.10.6633: Flags [.], seq 1:1449, ack 0, win 58, options [nop,nop,TS val 3923607 ecr 349065], length 1448: OpenFlow
	version unknown (0x14), type 0xe9, length 53, xid 0xa58a0000
	version unknown (0x00), type 0x7d, length 0, xid 0x0000ffff (corrupt)
18:05:55.023536 IP 192.168.1.30.41322 > 192.168.1.10.6633: Flags [.], seq 1449:4345, ack 0, win 58, options [nop,nop,TS val 3923607 ecr 349065], length 2896: OpenFlow
	version unknown (0x00), type 0xfb, length 21097, xid 0xc7f318d1 [|openflow]
18:05:55.023547 IP 192.168.1.30.41322 > 192.168.1.10.6633: Flags [.], seq 4345:7241, ack 0, win 58, options [nop,nop,TS val 3923607 ecr 349065], length 2896: OpenFlow
	version unknown (0x00), type 0x00, length 0, xid 0x005069c7 (corrupt)
18:05:55.023556 IP 192.168.1.30.41322 > 192.168.1.10.6633: Flags [.], seq 7241:10137, ack 0, win 58, options [nop,nop,TS val 3923607 ecr 349065], length 2896: OpenFlow
	version unknown (0x00), type 0x00, length 0, xid 0x000000fb (corrupt)
18:05:55.023562 IP 192.168.1.30.41322 > 192.168.1.10.6633: Flags [.], seq 10137:13033, ack 0, win 58, options [nop,nop,TS val 3923607 ecr 349065], length 2896: OpenFlow
	version unknown (0x02), type 0x00, length 0, xid 0x00000005 (corrupt)
18:05:55.023569 IP 192.168.1.30.41322 > 192.168.1.10.6633: Flags [.], seq 13033:15929, ack 0, win 58, options [nop,nop,TS val 3923607 ecr 349065], length 2896: OpenFlow
	version unknown (0x63), type 0x61, length 27648, xid 0x000c0001 [|openflow]
18:05:55.023578 IP 192.168.1.30.41322 > 192.168.1.10.6633: Flags [.], seq 15929:18825, ack 0, win 58, options [nop,nop,TS val 3923607 ecr 349065], length 2896: OpenFlow
	version unknown (0x00), type 0x7d, length 0, xid 0x0000ffff (corrupt)
18:05:55.023584 IP 192.168.1.30.41322 > 192.168.1.10.6633: Flags [.], seq 18825:21721, ack 0, win 58, options [nop,nop,TS val 3923607 ecr 349065], length 2896: OpenFlow
	version unknown (0xfb), type 0x52, length 27079, xid 0xf318d186 [|openflow]
18:05:55.023591 IP 192.168.1.30.41322 > 192.168.1.10.6633: Flags [.], seq 21721:24617, ack 0, win 58, options [nop,nop,TS val 3923607 ecr 349065], length 2896: OpenFlow
	version unknown (0x00), type 0x00, length 0, xid 0x5069c7ff (corrupt)
18:05:55.067119 IP 192.168.1.30.41322 > 192.168.1.10.6633: Flags [.], seq 24617:26065, ack 0, win 58, options [nop,nop,TS val 3923618 ecr 349065], length 1448: OpenFlow
	version unknown (0x00), type 0x00, length 0, xid 0x0000fb14 (corrupt)
18:05:55.071829 IP 192.168.1.10.6633 > 192.168.1.30.41322: Flags [.], ack 26065, win 3063, options [nop,nop,TS val 349073 ecr 3923607], length 0
18:05:55.071935 IP 192.168.1.30.41322 > 192.168.1.10.6633: Flags [.], seq 26065:27513, ack 0, win 58, options [nop,nop,TS val 3923619 ecr 349073], length 1448: OpenFlow
	version unknown (0x6b), type 0x00, length 1025, xid 0x00333300
	version unknown (0x11), type 0xff, length 65152, xid 0x00000000 [|openflow]
18:05:55.071944 IP 192.168.1.30.41322 > 192.168.1.10.6633: Flags [.], seq 27513:30409, ack 0, win 58, options [nop,nop,TS val 3923619 ecr 349073], length 2896: OpenFlow
	version unknown (0x00), type 0x00, length 0, xid 0x0000055f (corrupt)
18:05:55.071955 IP 192.168.1.30.41322 > 192.168.1.10.6633: Flags [.], seq 30409:33305, ack 0, win 58, options [nop,nop,TS val 3923619 ecr 349073], length 2896: OpenFlow
	version unknown (0x61), type 0x6c, length 0, xid 0x0c000104 (corrupt)
18:05:55.071965 IP 192.168.1.30.41322 > 192.168.1.10.6633: Flags [.], seq 33305:36201, ack 0, win 58, options [nop,nop,TS val 3923619 ecr 349073], length 2896: OpenFlow
	version unknown (0x7d), type 0x00, length 0, xid 0x00ffffff (corrupt)
18:05:55.071975 IP 192.168.1.30.41322 > 192.168.1.10.6633: Flags [.], seq 36201:39097, ack 0, win 58, options [nop,nop,TS val 3923619 ecr 349073], length 2896: OpenFlow
	version unknown (0x52), type 0x69, length 51187, xid 0x18d186dd [|openflow]
18:05:55.071985 IP 192.168.1.30.41322 > 192.168.1.10.6633: Flags [.], seq 39097:41993, ack 0, win 58, options [nop,nop,TS val 3923619 ecr 349073], length 2896: OpenFlow
	version unknown (0x00), type 0x00, length 80, xid 0x69c7fffe
	version 1.0, type PACKET_IN, length 125, xid 0x00000000
	version 1.0, type PACKET_IN, length 125, xid 0x00000000
	version 1.0, type PACKET_IN, length 125, xid 0x00000000
	version 1.0, type PACKET_IN, length 125, xid 0x00000000
	version 1.0, type PACKET_IN, length 125, xid 0x00000000
	version 1.0, type PACKET_IN, length 125, xid 0x00000000
	version 1.0, type PACKET_IN, length 125, xid 0x00000000
	version 1.0, type PACKET_IN, length 125, xid 0x00000000
	version 1.0, type PACKET_IN, length 125, xid 0x00000000
	version 1.0, type PACKET_IN, length 125, xid 0x00000000
	version 1.0, type PACKET_IN, length 125, xid 0x00000000
	version 1.0, type PACKET_IN, length 125, xid 0x00000000
	version 1.0, type PACKET_IN, length 125, xid 0x00000000
	version 1.0, type PACKET_IN, length 125, xid 0x00000000
	version 1.0, type PACKET_IN, length 125, xid 0x00000000
	version 1.0, type PACKET_IN, length 125, xid 0x00000000
	version 1.0, type PACKET_IN, length 125, xid 0x00000000
	version 1.0, type PACKET_IN, length 125, xid 0x00000000
	version 1.0, type PACKET_IN, length 125, xid 0x00000000
	version 1.0, type PACKET_IN, length 125, xid 0x00000000
	version 1.0, type PACKET_IN, length 125, xid 0x00000000
	version 1.0, type PACKET_IN, length 125, xid 0x00000000
	version 1.0, type PACKET_IN, length 125, xid 0x00000000 [|openflow]
18:05:55.071994 IP 192.168.1.30.41322 > 192.168.1.10.6633: Flags [.], seq 41993:44889, ack 0, win 58, options [nop,nop,TS val 3923619 ecr 349073], length 2896: OpenFlow
	version unknown (0x00), type 0x00, length 0, xid 0x00fb14e9 (corrupt)
18:05:55.072003 IP 192.168.1.30.41322 > 192.168.1.10.6633: Flags [.], seq 44889:47785, ack 0, win 58, options [nop,nop,TS val 3923619 ecr 349073], length 2896: OpenFlow
	version unknown (0x00), type 0x00, length 0, xid 0x00055f69 (corrupt)
18:05:55.072011 IP 192.168.1.30.41322 > 192.168.1.10.6633: Flags [.], seq 47785:50681, ack 0, win 58, options [nop,nop,TS val 3923619 ecr 349073], length 2896: OpenFlow
	version unknown (0x6c), type 0x00, length 12, xid 0x0001045f
	version unknown (0x12), type 0x00, length 3072, xid 0x01010a00 [|openflow]
18:05:55.098106 IP 192.168.1.10.6633 > 192.168.1.30.41322: Flags [.], ack 50681, win 2935, options [nop,nop,TS val 349083 ecr 3923619], length 0
18:05:55.098636 IP 192.168.1.30.41322 > 192.168.1.10.6633: Flags [.], seq 50681:53577, ack 0, win 58, options [nop,nop,TS val 3923626 ecr 349083], length 2896: OpenFlow
	version unknown (0x00), type 0x00, length 0, xid 0xffffffff (corrupt)
18:05:55.098644 IP 192.168.1.30.41322 > 192.168.1.10.6633: Flags [.], seq 53577:56473, ack 0, win 58, options [nop,nop,TS val 3923626 ecr 349083], length 2896: OpenFlow
	version unknown (0x69), type 0xc7, length 62232, xid 0xd186dd60 [|openflow]
18:05:55.098876 IP 192.168.1.30.41322 > 192.168.1.10.6633: Flags [.], seq 56473:59369, ack 0, win 58, options [nop,nop,TS val 3923626 ecr 349083], length 2896: OpenFlow
	version unknown (0x00), type 0x00, length 20585, xid 0xc7fffef3 [|openflow]
18:05:55.098916 IP 192.168.1.30.41322 > 192.168.1.10.6633: Flags [.], seq 59369:62265, ack 0, win 58, options [nop,nop,TS val 3923626 ecr 349083], length 2896: OpenFlow
	version unknown (0x00), type 0x00, length 0, xid 0xfb14e914 (corrupt)
18:05:55.098930 IP 192.168.1.30.41322 > 192.168.1.10.6633: Flags [.], seq 62265:65161, ack 0, win 58, options [nop,nop,TS val 3923626 ecr 349083], length 2896: OpenFlow
	version unknown (0x00), type 0x00, length 0, xid 0x055f6970 (corrupt)
18:05:55.098942 IP 192.168.1.30.41322 > 192.168.1.10.6633: Flags [.], seq 65161:68057, ack 0, win 58, options [nop,nop,TS val 3923626 ecr 349083], length 2896: OpenFlow
	version unknown (0x00), type 0x00, length 3072, xid 0x01045f69 [|openflow]
18:05:55.098957 IP 192.168.1.30.41322 > 192.168.1.10.6633: Flags [.], seq 68057:70953, ack 0, win 58, options [nop,nop,TS val 3923626 ecr 349083], length 2896: OpenFlow
	version unknown (0x00), type 0x00, length 255, xid 0xffffff00
	version unknown (0xff), type 0xff, length 107, xid 0x00030100
	version unknown (0x70), type 0x70, length 49170, xid 0x000c0001 [|openflow]
18:05:55.098966 IP 192.168.1.30.41322 > 192.168.1.10.6633: Flags [.], seq 70953:73849, ack 0, win 58, options [nop,nop,TS val 3923626 ecr 349083], length 2896: OpenFlow
	version unknown (0xc7), type 0xf3, length 6353, xid 0x86dd6000 [|openflow]
18:05:55.098982 IP 192.168.1.30.41322 > 192.168.1.10.6633: Flags [.], seq 73849:76745, ack 0, win 58, options [nop,nop,TS val 3923626 ecr 349083], length 2896: OpenFlow
	version unknown (0x00), type 0x50, length 27079, xid 0xfffef318 [|openflow]
18:05:55.137488 IP 192.168.1.30.41322 > 192.168.1.10.6633: Flags [.], seq 76745:78193, ack 0, win 58, options [nop,nop,TS val 3923636 ecr 349083], length 1448: OpenFlow
	version unknown (0x00), type 0x00, length 251, xid 0x14e914e9
	version unknown (0x00), type 0x00, length 64276, xid 0xe914e900 [|openflow]
18:05:55.138843 IP 192.168.1.10.6633 > 192.168.1.30.41322: Flags [.], ack 78193, win 2790, options [nop,nop,TS val 349094 ecr 3923626], length 0
18:05:55.138866 IP 192.168.1.30.41322 > 192.168.1.10.6633: Flags [.], seq 78193:79641, ack 0, win 58, options [nop,nop,TS val 3923636 ecr 349094], length 1448: OpenFlow
	version 1.0, type HELLO, length 13107, xid 0x000000fb [|openflow]
18:05:55.138880 IP 192.168.1.30.41322 > 192.168.1.10.6633: Flags [.], seq 79641:82537, ack 0, win 58, options [nop,nop,TS val 3923636 ecr 349094], length 2896: OpenFlow
	version unknown (0x00), type 0x00, length 5, xid 0x5f697070 (corrupt)
18:05:55.138891 IP 192.168.1.30.41322 > 192.168.1.10.6633: Flags [.], seq 82537:85433, ack 0, win 58, options [nop,nop,TS val 3923636 ecr 349094], length 2896: OpenFlow
	version unknown (0x00), type 0x0c, length 1, xid 0x045f6970 (corrupt)
18:05:55.138901 IP 192.168.1.30.41322 > 192.168.1.10.6633: Flags [.], seq 85433:88329, ack 0, win 58, options [nop,nop,TS val 3923636 ecr 349094], length 2896: OpenFlow
	version unknown (0x00), type 0x00, length 65535, xid 0xffff006b [|openflow]
18:05:55.138911 IP 192.168.1.30.41322 > 192.168.1.10.6633: Flags [.], seq 88329:91225, ack 0, win 58, options [nop,nop,TS val 3923636 ecr 349094], length 2896: OpenFlow
	version unknown (0xf3), type 0x18, length 53638, xid 0xdd600000 [|openflow]
18:05:55.138922 IP 192.168.1.30.41322 > 192.168.1.10.6633: Flags [.], seq 91225:94121, ack 0, win 58, options [nop,nop,TS val 3923636 ecr 349094], length 2896: OpenFlow
	version unknown (0x50), type 0x69, length 51199, xid 0xfef318d1 [|openflow]
18:05:55.138932 IP 192.168.1.30.41322 > 192.168.1.10.6633: Flags [.], seq 94121:97017, ack 0, win 58, options [nop,nop,TS val 3923636 ecr 349094], length 2896: OpenFlow
	version unknown (0x00), type 0x00, length 64276, xid 0xe914e900 [|openflow]
18:05:55.138942 IP 192.168.1.30.41322 > 192.168.1.10.6633: Flags [.], seq 97017:99913, ack 0, win 58, options [nop,nop,TS val 3923636 ecr 349094], length 2896: OpenFlow
	version unknown (0x00), type 0x00, length 1375, xid 0x69707073
	version unknown (0x00), type 0x00, length 1375, xid 0x69707073
	version unknown (0x00), type 0x00, length 1375, xid 0x69707073 [|openflow]
18:05:55.138954 IP 192.168.1.30.41322 > 192.168.1.10.6633: Flags [.], seq 99913:101361, ack 0, win 58, options [nop,nop,TS val 3923636 ecr 349094], length 1448: OpenFlow
	version unknown (0x0c), type 0x00, length 260, xid 0x5f697070
	version unknown (0x00), type 0x0c, length 1, xid 0x010a007d (corrupt)
18:05:55.138962 IP 192.168.1.30.41322 > 192.168.1.10.6633: Flags [P.], seq 101361:102677, ack 0, win 58, options [nop,nop,TS val 3923636 ecr 349094], length 1316: OpenFlow
	version unknown (0x00), type 0x00, length 0, xid 0x00000000 (corrupt)
18:05:55.174203 IP 192.168.1.30.41322 > 192.168.1.10.6633: Flags [P.], seq 102677:102802, ack 0, win 58, options [nop,nop,TS val 3923645 ecr 349094], length 125: OpenFlow
	version 1.0, type PACKET_IN, length 125, xid 0x00000000
18:05:55.174500 IP 192.168.1.10.6633 > 192.168.1.30.41322: Flags [.], ack 102677, win 2810, options [nop,nop,TS val 349102 ecr 3923636], length 0
18:05:55.174534 IP 192.168.1.30.41322 > 192.168.1.10.6633: Flags [.], seq 102802:104250, ack 0, win 58, options [nop,nop,TS val 3923645 ecr 349102], length 1448: OpenFlow
	version 1.0, type PACKET_IN, length 125, xid 0x00000000
	version 1.0, type PACKET_IN, length 125, xid 0x00000000
	version 1.0, type PACKET_IN, length 125, xid 0x00000000
	version 1.0, type PACKET_IN, length 125, xid 0x00000000
	version 1.0, type PACKET_IN, length 125, xid 0x00000000
	version 1.0, type PACKET_IN, length 125, xid 0x00000000
	version 1.0, type PACKET_IN, length 125, xid 0x00000000
	version 1.0, type PACKET_IN, length 125, xid 0x00000000
	version 1.0, type PACKET_IN, length 125, xid 0x00000000
	version 1.0, type PACKET_IN, length 125, xid 0x00000000
	version 1.0, type PACKET_IN, length 125, xid 0x00000000
	version 1.0, type PACKET_IN, length 125, xid 0x00000000 [|openflow]
18:05:55.174544 IP 192.168.1.30.41322 > 192.168.1.10.6633: Flags [P.], seq 104250:104802, ack 0, win 58, options [nop,nop,TS val 3923645 ecr 349102], length 552: OpenFlow
	version unknown (0xe9), type 0x14, length 59648, xid 0x35a58a00 [|openflow]
18:05:55.174558 IP 192.168.1.30.41322 > 192.168.1.10.6633: Flags [P.], seq 104802:104927, ack 0, win 58, options [nop,nop,TS val 3923645 ecr 349102], length 125: OpenFlow
	version 1.0, type PACKET_IN, length 125, xid 0x00000000
18:05:55.174591 IP 192.168.1.30.41322 > 192.168.1.10.6633: Flags [P.], seq 104927:105052, ack 0, win 58, options [nop,nop,TS val 3923645 ecr 349102], length 125: OpenFlow
	version 1.0, type PACKET_IN, length 125, xid 0x00000000
18:05:55.174621 IP 192.168.1.30.41322 > 192.168.1.10.6633: Flags [P.], seq 105052:105177, ack 0, win 58, options [nop,nop,TS val 3923645 ecr 349102], length 125: OpenFlow
	version 1.0, type PACKET_IN, length 125, xid 0x00000000
18:05:55.174643 IP 192.168.1.30.41322 > 192.168.1.10.6633: Flags [P.], seq 105177:105302, ack 0, win 58, options [nop,nop,TS val 3923645 ecr 349102], length 125: OpenFlow
	version 1.0, type PACKET_IN, length 125, xid 0x00000000
18:05:55.174657 IP 192.168.1.30.41322 > 192.168.1.10.6633: Flags [P.], seq 105302:105427, ack 0, win 58, options [nop,nop,TS val 3923645 ecr 349102], length 125: OpenFlow
	version 1.0, type PACKET_IN, length 125, xid 0x00000000
18:05:55.175037 IP 192.168.1.30.41322 > 192.168.1.10.6633: Flags [P.], seq 105427:105552, ack 0, win 58, options [nop,nop,TS val 3923645 ecr 349102], length 125: OpenFlow
	version 1.0, type PACKET_IN, length 125, xid 0x00000000
18:05:55.175061 IP 192.168.1.30.41322 > 192.168.1.10.6633: Flags [P.], seq 105552:105677, ack 0, win 58, options [nop,nop,TS val 3923645 ecr 349102], length 125: OpenFlow
	version 1.0, type PACKET_IN, length 125, xid 0x00000000
18:05:55.175077 IP 192.168.1.30.41322 > 192.168.1.10.6633: Flags [P.], seq 105677:105802, ack 0, win 58, options [nop,nop,TS val 3923645 ecr 349102], length 125: OpenFlow
	version 1.0, type PACKET_IN, length 125, xid 0x00000000
18:05:55.175087 IP 192.168.1.10.6633 > 192.168.1.30.41322: Flags [.], ack 104802, win 3262, options [nop,nop,TS val 349103 ecr 3923645], length 0
18:05:55.175089 IP 192.168.1.30.41322 > 192.168.1.10.6633: Flags [P.], seq 105802:105927, ack 0, win 58, options [nop,nop,TS val 3923645 ecr 349102], length 125: OpenFlow
	version 1.0, type PACKET_IN, length 125, xid 0x00000000
18:05:55.175101 IP 192.168.1.30.41322 > 192.168.1.10.6633: Flags [P.], seq 105927:106052, ack 0, win 58, options [nop,nop,TS val 3923645 ecr 349102], length 125: OpenFlow
	version 1.0, type PACKET_IN, length 125, xid 0x00000000
18:05:55.175113 IP 192.168.1.30.41322 > 192.168.1.10.6633: Flags [P.], seq 106052:106177, ack 0, win 58, options [nop,nop,TS val 3923645 ecr 349102], length 125: OpenFlow
	version 1.0, type PACKET_IN, length 125, xid 0x00000000
18:05:55.175125 IP 192.168.1.30.41322 > 192.168.1.10.6633: Flags [P.], seq 106177:106302, ack 0, win 58, options [nop,nop,TS val 3923645 ecr 349102], length 125: OpenFlow
	version 1.0, type PACKET_IN, length 125, xid 0x00000000
18:05:55.175137 IP 192.168.1.30.41322 > 192.168.1.10.6633: Flags [P.], seq 106302:106427, ack 0, win 58, options [nop,nop,TS val 3923645 ecr 349102], length 125: OpenFlow
	version 1.0, type PACKET_IN, length 125, xid 0x00000000
18:05:55.175149 IP 192.168.1.30.41322 > 192.168.1.10.6633: Flags [P.], seq 106427:106552, ack 0, win 58, options [nop,nop,TS val 3923645 ecr 349102], length 125: OpenFlow
	version 1.0, type PACKET_IN, length 125, xid 0x00000000
18:05:55.175155 IP 192.168.1.30.41322 > 192.168.1.10.6633: Flags [P.], seq 106552:106677, ack 0, win 58, options [nop,nop,TS val 3923645 ecr 349102], length 125: OpenFlow
	version 1.0, type PACKET_IN, length 125, xid 0x00000000
18:05:55.175224 IP 192.168.1.30.41322 > 192.168.1.10.6633: Flags [.], seq 106677:109573, ack 0, win 58, options [nop,nop,TS val 3923645 ecr 349103], length 2896: OpenFlow
	version 1.0, type PACKET_IN, length 125, xid 0x00000000
	version 1.0, type PACKET_IN, length 125, xid 0x00000000
	version 1.0, type PACKET_IN, length 125, xid 0x00000000
	version 1.0, type PACKET_IN, length 125, xid 0x00000000
	version 1.0, type PACKET_IN, length 125, xid 0x00000000
	version 1.0, type PACKET_IN, length 125, xid 0x00000000
	version 1.0, type PACKET_IN, length 125, xid 0x00000000
	version 1.0, type PACKET_IN, length 125, xid 0x00000000
	version 1.0, type PACKET_IN, length 125, xid 0x00000000
	version 1.0, type PACKET_IN, length 125, xid 0x00000000
	version 1.0, type PACKET_IN, length 125, xid 0x00000000
	version 1.0, type PACKET_IN, length 125, xid 0x00000000
	version 1.0, type PACKET_IN, length 125, xid 0x00000000
	version 1.0, type PACKET_IN, length 125, xid 0x00000000
	version 1.0, type PACKET_IN, length 125, xid 0x00000000
	version 1.0, type PACKET_IN, length 125, xid 0x00000000
	version 1.0, type PACKET_IN, length 125, xid 0x00000000
	version 1.0, type PACKET_IN, length 125, xid 0x00000000
	version 1.0, type PACKET_IN, length 125, xid 0x00000000
	version 1.0, type PACKET_IN, length 125, xid 0x00000000
	version 1.0, type PACKET_IN, length 125, xid 0x00000000
	version 1.0, type PACKET_IN, length 125, xid 0x00000000
	version 1.0, type PACKET_IN, length 125, xid 0x00000000
	version 1.0, type PACKET_IN, length 125, xid 0x00000000 [|openflow]
18:05:55.175445 IP 192.168.1.30.41322 > 192.168.1.10.6633: Flags [.], seq 109573:111021, ack 0, win 58, options [nop,nop,TS val 3923645 ecr 349103], length 1448: OpenFlow
	version unknown (0x00), type 0x00, length 64338, xid 0x69c7f318 [|openflow]
18:05:55.175630 IP 192.168.1.10.6633 > 192.168.1.30.41322: Flags [.], ack 106302, win 3262, options [nop,nop,TS val 349103 ecr 3923645], length 0
18:05:55.175649 IP 192.168.1.30.41322 > 192.168.1.10.6633: Flags [.], seq 111021:113917, ack 0, win 58, options [nop,nop,TS val 3923645 ecr 349103], length 2896: OpenFlow
	version unknown (0x69), type 0x70, length 28787, xid 0x045f7463 [|openflow]
18:05:55.175664 IP 192.168.1.30.41322 > 192.168.1.10.6633: Flags [P.], seq 113917:114552, ack 0, win 58, options [nop,nop,TS val 3923645 ecr 349103], length 635: OpenFlow
	version unknown (0x5f), type 0x69, length 28784, xid 0xc012000c [|openflow]
18:05:55.175677 IP 192.168.1.30.41322 > 192.168.1.10.6633: Flags [P.], seq 114552:114677, ack 0, win 58, options [nop,nop,TS val 3923645 ecr 349103], length 125: OpenFlow
	version 1.0, type PACKET_IN, length 125, xid 0x00000000
18:05:55.175704 IP 192.168.1.30.41322 > 192.168.1.10.6633: Flags [P.], seq 114677:114802, ack 0, win 58, options [nop,nop,TS val 3923645 ecr 349103], length 125: OpenFlow
	version 1.0, type PACKET_IN, length 125, xid 0x00000000
18:05:55.175719 IP 192.168.1.30.41322 > 192.168.1.10.6633: Flags [P.], seq 114802:114927, ack 0, win 58, options [nop,nop,TS val 3923645 ecr 349103], length 125: OpenFlow
	version 1.0, type PACKET_IN, length 125, xid 0x00000000
18:05:55.175733 IP 192.168.1.30.41322 > 192.168.1.10.6633: Flags [P.], seq 114927:115052, ack 0, win 58, options [nop,nop,TS val 3923645 ecr 349103], length 125: OpenFlow
	version 1.0, type PACKET_IN, length 125, xid 0x00000000
18:05:55.175747 IP 192.168.1.30.41322 > 192.168.1.10.6633: Flags [P.], seq 115052:115177, ack 0, win 58, options [nop,nop,TS val 3923645 ecr 349103], length 125: OpenFlow
	version 1.0, type PACKET_IN, length 125, xid 0x00000000
18:05:55.175760 IP 192.168.1.30.41322 > 192.168.1.10.6633: Flags [P.], seq 115177:115302, ack 0, win 58, options [nop,nop,TS val 3923645 ecr 349103], length 125: OpenFlow
	version 1.0, type PACKET_IN, length 125, xid 0x00000000
18:05:55.175774 IP 192.168.1.30.41322 > 192.168.1.10.6633: Flags [P.], seq 115302:115427, ack 0, win 58, options [nop,nop,TS val 3923645 ecr 349103], length 125: OpenFlow
	version 1.0, type PACKET_IN, length 125, xid 0x00000000
18:05:55.175787 IP 192.168.1.30.41322 > 192.168.1.10.6633: Flags [P.], seq 115427:115552, ack 0, win 58, options [nop,nop,TS val 3923645 ecr 349103], length 125: OpenFlow
	version 1.0, type PACKET_IN, length 125, xid 0x00000000
18:05:55.175801 IP 192.168.1.30.41322 > 192.168.1.10.6633: Flags [P.], seq 115552:115677, ack 0, win 58, options [nop,nop,TS val 3923645 ecr 349103], length 125: OpenFlow
	version 1.0, type PACKET_IN, length 125, xid 0x00000000
18:05:55.175856 IP 192.168.1.10.6633 > 192.168.1.30.41322: Flags [.], ack 109573, win 3262, options [nop,nop,TS val 349103 ecr 3923645], length 0
18:05:55.175867 IP 192.168.1.30.41322 > 192.168.1.10.6633: Flags [.], seq 115677:117125, ack 0, win 58, options [nop,nop,TS val 3923645 ecr 349103], length 1448: OpenFlow
	version 1.0, type PACKET_IN, length 125, xid 0x00000000
	version 1.0, type PACKET_IN, length 125, xid 0x00000000
	version 1.0, type PACKET_IN, length 125, xid 0x00000000
	version 1.0, type PACKET_IN, length 125, xid 0x00000000
	version 1.0, type PACKET_IN, length 125, xid 0x00000000
	version 1.0, type PACKET_IN, length 125, xid 0x00000000
	version 1.0, type PACKET_IN, length 125, xid 0x00000000
	version 1.0, type PACKET_IN, length 125, xid 0x00000000
	version 1.0, type PACKET_IN, length 125, xid 0x00000000
	version 1.0, type PACKET_IN, length 125, xid 0x00000000
	version 1.0, type PACKET_IN, length 125, xid 0x00000000
	version 1.0, type PACKET_IN, length 125, xid 0x00000000 [|openflow]
18:05:55.175876 IP 192.168.1.30.41322 > 192.168.1.10.6633: Flags [P.], seq 117125:118177, ack 0, win 58, options [nop,nop,TS val 3923645 ecr 349103], length 1052: OpenFlow
	version unknown (0xe9), type 0x14, length 59648, xid 0x35a58a00 [|openflow]
18:05:55.175889 IP 192.168.1.30.41322 > 192.168.1.10.6633: Flags [P.], seq 118177:118302, ack 0, win 58, options [nop,nop,TS val 3923645 ecr 349103], length 125: OpenFlow
	version 1.0, type PACKET_IN, length 125, xid 0x00000000
18:05:55.175905 IP 192.168.1.30.41322 > 192.168.1.10.6633: Flags [P.], seq 118302:118427, ack 0, win 58, options [nop,nop,TS val 3923645 ecr 349103], length 125: OpenFlow
	version 1.0, type PACKET_IN, length 125, xid 0x00000000
18:05:55.175993 IP 192.168.1.30.41322 > 192.168.1.10.6633: Flags [P.], seq 118427:118552, ack 0, win 58, options [nop,nop,TS val 3923645 ecr 349103], length 125: OpenFlow
	version 1.0, type PACKET_IN, length 125, xid 0x00000000
18:05:55.176719 IP 192.168.1.10.6633 > 192.168.1.30.41322: Flags [.], ack 118552, win 3262, options [nop,nop,TS val 349103 ecr 3923645], length 0
18:05:55.176733 IP 192.168.1.30.41322 > 192.168.1.10.6633: Flags [.], seq 118552:121448, ack 0, win 58, options [nop,nop,TS val 3923645 ecr 349103], length 2896: OpenFlow
	version 1.0, type PACKET_IN, length 125, xid 0x00000000
	version 1.0, type PACKET_IN, length 125, xid 0x00000000
	version 1.0, type PACKET_IN, length 125, xid 0x00000000
	version 1.0, type PACKET_IN, length 125, xid 0x00000000
	version 1.0, type PACKET_IN, length 125, xid 0x00000000
	version 1.0, type PACKET_IN, length 125, xid 0x00000000
	version 1.0, type PACKET_IN, length 125, xid 0x00000000
	version 1.0, type PACKET_IN, length 125, xid 0x00000000
	version 1.0, type PACKET_IN, length 125, xid 0x00000000
	version 1.0, type PACKET_IN, length 125, xid 0x00000000
	version 1.0, type PACKET_IN, length 125, xid 0x00000000
	version 1.0, type PACKET_IN, length 125, xid 0x00000000
	version 1.0, type PACKET_IN, length 125, xid 0x00000000
	version 1.0, type PACKET_IN, length 125, xid 0x00000000
	version 1.0, type PACKET_IN, length 125, xid 0x00000000
	version 1.0, type PACKET_IN, length 125, xid 0x00000000
	version 1.0, type PACKET_IN, length 125, xid 0x00000000
	version 1.0, type PACKET_IN, length 125, xid 0x00000000
	version 1.0, type PACKET_IN, length 125, xid 0x00000000
	version 1.0, type PACKET_IN, length 125, xid 0x00000000
	version 1.0, type PACKET_IN, length 125, xid 0x00000000
	version 1.0, type PACKET_IN, length 125, xid 0x00000000
	version 1.0, type PACKET_IN, length 125, xid 0x00000000
	version 1.0, type PACKET_IN, length 125, xid 0x00000000 [|openflow]
18:05:55.176744 IP 192.168.1.30.41322 > 192.168.1.10.6633: Flags [.], seq 121448:124344, ack 0, win 58, options [nop,nop,TS val 3923645 ecr 349103], length 2896: OpenFlow
	version unknown (0x00), type 0x00, length 64338, xid 0x69c7f318 [|openflow]
18:05:55.176755 IP 192.168.1.30.41322 > 192.168.1.10.6633: Flags [.], seq 124344:127240, ack 0, win 58, options [nop,nop,TS val 3923645 ecr 349103], length 2896: OpenFlow
	version unknown (0x00), type 0x00, length 0, xid 0x00005069 (corrupt)
18:05:55.176765 IP 192.168.1.30.41322 > 192.168.1.10.6633: Flags [.], seq 127240:128688, ack 0, win 58, options [nop,nop,TS val 3923645 ecr 349103], length 1448: OpenFlow
	version unknown (0x00), type 0x00, length 0, xid 0x00000000 (corrupt)
18:05:55.176774 IP 192.168.1.30.41322 > 192.168.1.10.6633: Flags [P.], seq 128688:129677, ack 0, win 58, options [nop,nop,TS val 3923645 ecr 349103], length 989: OpenFlow
	version unknown (0xff), type 0x00, length 27392, xid 0x01010033 [|openflow]
18:05:55.176786 IP 192.168.1.30.41322 > 192.168.1.10.6633: Flags [P.], seq 129677:129802, ack 0, win 58, options [nop,nop,TS val 3923645 ecr 349103], length 125: OpenFlow
	version 1.0, type PACKET_IN, length 125, xid 0x00000000
18:05:55.176816 IP 192.168.1.30.41322 > 192.168.1.10.6633: Flags [P.], seq 129802:129927, ack 0, win 58, options [nop,nop,TS val 3923645 ecr 349103], length 125: OpenFlow
	version 1.0, type PACKET_IN, length 125, xid 0x00000000
18:05:55.176928 IP 192.168.1.10.6633 > 192.168.1.30.41322: Flags [.], ack 127240, win 3262, options [nop,nop,TS val 349103 ecr 3923645], length 0
18:05:55.176942 IP 192.168.1.10.6633 > 192.168.1.30.41322: Flags [.], ack 129677, win 3262, options [nop,nop,TS val 349103 ecr 3923645], length 0
18:05:55.176950 IP 192.168.1.30.41322 > 192.168.1.10.6633: Flags [P.], seq 129927:130052, ack 0, win 58, options [nop,nop,TS val 3923645 ecr 349103], length 125: OpenFlow
	version 1.0, type PACKET_IN, length 125, xid 0x00000000
18:05:55.176985 IP 192.168.1.30.41322 > 192.168.1.10.6633: Flags [P.], seq 130052:130177, ack 0, win 58, options [nop,nop,TS val 3923645 ecr 349103], length 125: OpenFlow
	version 1.0, type PACKET_IN, length 125, xid 0x00000000
18:05:55.177009 IP 192.168.1.30.41322 > 192.168.1.10.6633: Flags [P.], seq 130177:130302, ack 0, win 58, options [nop,nop,TS val 3923645 ecr 349103], length 125: OpenFlow
	version 1.0, type PACKET_IN, length 125, xid 0x00000000
18:05:55.177033 IP 192.168.1.30.41322 > 192.168.1.10.6633: Flags [P.], seq 130302:130427, ack 0, win 58, options [nop,nop,TS val 3923645 ecr 349103], length 125: OpenFlow
	version 1.0, type PACKET_IN, length 125, xid 0x00000000
18:05:55.177056 IP 192.168.1.30.41322 > 192.168.1.10.6633: Flags [P.], seq 130427:130552, ack 0, win 58, options [nop,nop,TS val 3923645 ecr 349103], length 125: OpenFlow
	version 1.0, type PACKET_IN, length 125, xid 0x00000000
18:05:55.177079 IP 192.168.1.30.41322 > 192.168.1.10.6633: Flags [P.], seq 130552:130677, ack 0, win 58, options [nop,nop,TS val 3923645 ecr 349103], length 125: OpenFlow
	version 1.0, type PACKET_IN, length 125, xid 0x00000000
18:05:55.177101 IP 192.168.1.30.41322 > 192.168.1.10.6633: Flags [P.], seq 130677:130802, ack 0, win 58, options [nop,nop,TS val 3923645 ecr 349103], length 125: OpenFlow
	version 1.0, type PACKET_IN, length 125, xid 0x00000000
18:05:55.177125 IP 192.168.1.30.41322 > 192.168.1.10.6633: Flags [P.], seq 130802:130927, ack 0, win 58, options [nop,nop,TS val 3923645 ecr 349103], length 125: OpenFlow
	version 1.0, type PACKET_IN, length 125, xid 0x00000000
18:05:55.177149 IP 192.168.1.30.41322 > 192.168.1.10.6633: Flags [P.], seq 130927:131052, ack 0, win 58, options [nop,nop,TS val 3923645 ecr 349103], length 125: OpenFlow
	version 1.0, type PACKET_IN, length 125, xid 0x00000000
18:05:55.177172 IP 192.168.1.30.41322 > 192.168.1.10.6633: Flags [P.], seq 131052:131177, ack 0, win 58, options [nop,nop,TS val 3923645 ecr 349103], length 125: OpenFlow
	version 1.0, type PACKET_IN, length 125, xid 0x00000000
18:05:55.177196 IP 192.168.1.30.41322 > 192.168.1.10.6633: Flags [P.], seq 131177:131302, ack 0, win 58, options [nop,nop,TS val 3923645 ecr 349103], length 125: OpenFlow
	version 1.0, type PACKET_IN, length 125, xid 0x00000000
18:05:55.177220 IP 192.168.1.30.41322 > 192.168.1.10.6633: Flags [P.], seq 131302:131427, ack 0, win 58, options [nop,nop,TS val 3923645 ecr 349103], length 125: OpenFlow
	version 1.0, type PACKET_IN, length 125, xid 0x00000000
18:05:55.177249 IP 192.168.1.30.41322 > 192.168.1.10.6633: Flags [P.], seq 131427:131552, ack 0, win 58, options [nop,nop,TS val 3923645 ecr 349103], length 125: OpenFlow
	version 1.0, type PACKET_IN, length 125, xid 0x00000000
18:05:55.177336 IP 192.168.1.30.41322 > 192.168.1.10.6633: Flags [P.], seq 131552:131677, ack 0, win 58, options [nop,nop,TS val 3923645 ecr 349103], length 125: OpenFlow
	version 1.0, type PACKET_IN, length 125, xid 0x00000000
18:05:55.177369 IP 192.168.1.30.41322 > 192.168.1.10.6633: Flags [P.], seq 131677:131802, ack 0, win 58, options [nop,nop,TS val 3923645 ecr 349103], length 125: OpenFlow
	version 1.0, type PACKET_IN, length 125, xid 0x00000000
18:05:55.177395 IP 192.168.1.30.41322 > 192.168.1.10.6633: Flags [P.], seq 131802:131927, ack 0, win 58, options [nop,nop,TS val 3923645 ecr 349103], length 125: OpenFlow
	version 1.0, type PACKET_IN, length 125, xid 0x00000000
18:05:55.177554 IP 192.168.1.10.6633 > 192.168.1.30.41322: Flags [.], ack 131177, win 3262, options [nop,nop,TS val 349103 ecr 3923645], length 0
18:05:55.177573 IP 192.168.1.30.41322 > 192.168.1.10.6633: Flags [P.], seq 131927:132802, ack 0, win 58, options [nop,nop,TS val 3923646 ecr 349103], length 875: OpenFlow
	version 1.0, type PACKET_IN, length 125, xid 0x00000000
	version 1.0, type PACKET_IN, length 125, xid 0x00000000
	version 1.0, type PACKET_IN, length 125, xid 0x00000000
	version 1.0, type PACKET_IN, length 125, xid 0x00000000
	version 1.0, type PACKET_IN, length 125, xid 0x00000000
	version 1.0, type PACKET_IN, length 125, xid 0x00000000
	version 1.0, type PACKET_IN, length 125, xid 0x00000000
18:05:55.177586 IP 192.168.1.30.41322 > 192.168.1.10.6633: Flags [P.], seq 132802:132927, ack 0, win 58, options [nop,nop,TS val 3923646 ecr 349103], length 125: OpenFlow
	version 1.0, type PACKET_IN, length 125, xid 0x00000000
18:05:55.177622 IP 192.168.1.30.41322 > 192.168.1.10.6633: Flags [P.], seq 132927:133052, ack 0, win 58, options [nop,nop,TS val 3923646 ecr 349103], length 125: OpenFlow
	version 1.0, type PACKET_IN, length 125, xid 0x00000000
18:05:55.177636 IP 192.168.1.30.41322 > 192.168.1.10.6633: Flags [P.], seq 133052:133177, ack 0, win 58, options [nop,nop,TS val 3923646 ecr 349103], length 125: OpenFlow
	version 1.0, type PACKET_IN, length 125, xid 0x00000000
18:05:55.177650 IP 192.168.1.30.41322 > 192.168.1.10.6633: Flags [P.], seq 133177:133302, ack 0, win 58, options [nop,nop,TS val 3923646 ecr 349103], length 125: OpenFlow
	version 1.0, type PACKET_IN, length 125, xid 0x00000000
18:05:55.177664 IP 192.168.1.30.41322 > 192.168.1.10.6633: Flags [P.], seq 133302:133427, ack 0, win 58, options [nop,nop,TS val 3923646 ecr 349103], length 125: OpenFlow
	version 1.0, type PACKET_IN, length 125, xid 0x00000000
18:05:55.177678 IP 192.168.1.30.41322 > 192.168.1.10.6633: Flags [P.], seq 133427:133552, ack 0, win 58, options [nop,nop,TS val 3923646 ecr 349103], length 125: OpenFlow
	version 1.0, type PACKET_IN, length 125, xid 0x00000000
18:05:55.177692 IP 192.168.1.30.41322 > 192.168.1.10.6633: Flags [P.], seq 133552:133677, ack 0, win 58, options [nop,nop,TS val 3923646 ecr 349103], length 125: OpenFlow
	version 1.0, type PACKET_IN, length 125, xid 0x00000000
18:05:55.177706 IP 192.168.1.30.41322 > 192.168.1.10.6633: Flags [P.], seq 133677:133802, ack 0, win 58, options [nop,nop,TS val 3923646 ecr 349103], length 125: OpenFlow
	version 1.0, type PACKET_IN, length 125, xid 0x00000000
18:05:55.177720 IP 192.168.1.30.41322 > 192.168.1.10.6633: Flags [P.], seq 133802:133927, ack 0, win 58, options [nop,nop,TS val 3923646 ecr 349103], length 125: OpenFlow
	version 1.0, type PACKET_IN, length 125, xid 0x00000000
18:05:55.177734 IP 192.168.1.30.41322 > 192.168.1.10.6633: Flags [P.], seq 133927:134052, ack 0, win 58, options [nop,nop,TS val 3923646 ecr 349103], length 125: OpenFlow
	version 1.0, type PACKET_IN, length 125, xid 0x00000000
18:05:55.177747 IP 192.168.1.30.41322 > 192.168.1.10.6633: Flags [P.], seq 134052:134177, ack 0, win 58, options [nop,nop,TS val 3923646 ecr 349103], length 125: OpenFlow
	version 1.0, type PACKET_IN, length 125, xid 0x00000000
18:05:55.177877 IP 192.168.1.10.6633 > 192.168.1.30.41322: Flags [.], ack 131552, win 3262, options [nop,nop,TS val 349104 ecr 3923645], length 0
18:05:55.177885 IP 192.168.1.10.6633 > 192.168.1.30.41322: Flags [.], ack 131927, win 3262, options [nop,nop,TS val 349104 ecr 3923645], length 0
18:05:55.177892 IP 192.168.1.30.41322 > 192.168.1.10.6633: Flags [.], seq 134177:137073, ack 0, win 58, options [nop,nop,TS val 3923646 ecr 349104], length 2896: OpenFlow
	version 1.0, type PACKET_IN, length 125, xid 0x00000000
	version 1.0, type PACKET_IN, length 125, xid 0x00000000
	version 1.0, type PACKET_IN, length 125, xid 0x00000000
	version 1.0, type PACKET_IN, length 125, xid 0x00000000
	version 1.0, type PACKET_IN, length 125, xid 0x00000000
	version 1.0, type PACKET_IN, length 125, xid 0x00000000
	version 1.0, type PACKET_IN, length 125, xid 0x00000000
	version 1.0, type PACKET_IN, length 125, xid 0x00000000
	version 1.0, type PACKET_IN, length 125, xid 0x00000000
	version 1.0, type PACKET_IN, length 125, xid 0x00000000
	version 1.0, type PACKET_IN, length 125, xid 0x00000000
	version 1.0, type PACKET_IN, length 125, xid 0x00000000
	version 1.0, type PACKET_IN, length 125, xid 0x00000000
	version 1.0, type PACKET_IN, length 125, xid 0x00000000
	version 1.0, type PACKET_IN, length 125, xid 0x00000000
	version 1.0, type PACKET_IN, length 125, xid 0x00000000
	version 1.0, type PACKET_IN, length 125, xid 0x00000000
	version 1.0, type PACKET_IN, length 125, xid 0x00000000
	version 1.0, type PACKET_IN, length 125, xid 0x00000000
	version 1.0, type PACKET_IN, length 125, xid 0x00000000
	version 1.0, type PACKET_IN, length 125, xid 0x00000000
	version 1.0, type PACKET_IN, length 125, xid 0x00000000
	version 1.0, type PACKET_IN, length 125, xid 0x00000000
	version 1.0, type PACKET_IN, length 125, xid 0x00000000 [|openflow]
18:05:55.177912 IP 192.168.1.30.41322 > 192.168.1.10.6633: Flags [.], seq 137073:138521, ack 0, win 58, options [nop,nop,TS val 3923646 ecr 349104], length 1448: OpenFlow
	version unknown (0x00), type 0x00, length 64338, xid 0x69c7f318 [|openflow]
18:05:55.177954 IP 192.168.1.10.6633 > 192.168.1.30.41322: Flags [.], ack 133427, win 3262, options [nop,nop,TS val 349104 ecr 3923646], length 0
18:05:55.178013 IP 192.168.1.10.6633 > 192.168.1.30.41322: Flags [.], ack 137073, win 3262, options [nop,nop,TS val 349104 ecr 3923646], length 0
18:05:55.178045 IP 192.168.1.30.41322 > 192.168.1.10.6633: Flags [P.], seq 138521:139802, ack 0, win 58, options [nop,nop,TS val 3923646 ecr 349104], length 1281: OpenFlow
	version unknown (0x69), type 0x70, length 28787, xid 0x045f7463 [|openflow]
18:05:55.178059 IP 192.168.1.30.41322 > 192.168.1.10.6633: Flags [P.], seq 139802:139927, ack 0, win 58, options [nop,nop,TS val 3923646 ecr 349104], length 125: OpenFlow
	version 1.0, type PACKET_IN, length 125, xid 0x00000000
18:05:55.178085 IP 192.168.1.30.41322 > 192.168.1.10.6633: Flags [P.], seq 139927:140052, ack 0, win 58, options [nop,nop,TS val 3923646 ecr 349104], length 125: OpenFlow
	version 1.0, type PACKET_IN, length 125, xid 0x00000000
18:05:55.178107 IP 192.168.1.30.41322 > 192.168.1.10.6633: Flags [P.], seq 140052:140177, ack 0, win 58, options [nop,nop,TS val 3923646 ecr 349104], length 125: OpenFlow
	version 1.0, type PACKET_IN, length 125, xid 0x00000000
18:05:55.178129 IP 192.168.1.30.41322 > 192.168.1.10.6633: Flags [P.], seq 140177:140302, ack 0, win 58, options [nop,nop,TS val 3923646 ecr 349104], length 125: OpenFlow
	version 1.0, type PACKET_IN, length 125, xid 0x00000000
18:05:55.178137 IP 192.168.1.10.6633 > 192.168.1.30.41322: Flags [.], ack 139802, win 3262, options [nop,nop,TS val 349104 ecr 3923646], length 0
18:05:55.178151 IP 192.168.1.30.41322 > 192.168.1.10.6633: Flags [P.], seq 140302:140427, ack 0, win 58, options [nop,nop,TS val 3923646 ecr 349104], length 125: OpenFlow
	version 1.0, type PACKET_IN, length 125, xid 0x00000000
18:05:55.178174 IP 192.168.1.30.41322 > 192.168.1.10.6633: Flags [P.], seq 140427:140552, ack 0, win 58, options [nop,nop,TS val 3923646 ecr 349104], length 125: OpenFlow
	version 1.0, type PACKET_IN, length 125, xid 0x00000000
18:05:55.178196 IP 192.168.1.30.41322 > 192.168.1.10.6633: Flags [P.], seq 140552:140677, ack 0, win 58, options [nop,nop,TS val 3923646 ecr 349104], length 125: OpenFlow
	version 1.0, type PACKET_IN, length 125, xid 0x00000000
18:05:55.178218 IP 192.168.1.30.41322 > 192.168.1.10.6633: Flags [P.], seq 140677:140802, ack 0, win 58, options [nop,nop,TS val 3923646 ecr 349104], length 125: OpenFlow
	version 1.0, type PACKET_IN, length 125, xid 0x00000000
18:05:55.178239 IP 192.168.1.30.41322 > 192.168.1.10.6633: Flags [P.], seq 140802:140927, ack 0, win 58, options [nop,nop,TS val 3923646 ecr 349104], length 125: OpenFlow
	version 1.0, type PACKET_IN, length 125, xid 0x00000000
18:05:55.178263 IP 192.168.1.30.41322 > 192.168.1.10.6633: Flags [P.], seq 140927:141052, ack 0, win 58, options [nop,nop,TS val 3923646 ecr 349104], length 125: OpenFlow
	version 1.0, type PACKET_IN, length 125, xid 0x00000000
18:05:55.178287 IP 192.168.1.30.41322 > 192.168.1.10.6633: Flags [P.], seq 141052:141177, ack 0, win 58, options [nop,nop,TS val 3923646 ecr 349104], length 125: OpenFlow
	version 1.0, type PACKET_IN, length 125, xid 0x00000000
18:05:55.178309 IP 192.168.1.30.41322 > 192.168.1.10.6633: Flags [P.], seq 141177:141302, ack 0, win 58, options [nop,nop,TS val 3923646 ecr 349104], length 125: OpenFlow
	version 1.0, type PACKET_IN, length 125, xid 0x00000000
18:05:55.178337 IP 192.168.1.30.41322 > 192.168.1.10.6633: Flags [P.], seq 141302:141427, ack 0, win 58, options [nop,nop,TS val 3923646 ecr 349104], length 125: OpenFlow
	version 1.0, type PACKET_IN, length 125, xid 0x00000000
18:05:55.178352 IP 192.168.1.30.41322 > 192.168.1.10.6633: Flags [P.], seq 141427:141552, ack 0, win 58, options [nop,nop,TS val 3923646 ecr 349104], length 125: OpenFlow
	version 1.0, type PACKET_IN, length 125, xid 0x00000000
18:05:55.178365 IP 192.168.1.30.41322 > 192.168.1.10.6633: Flags [P.], seq 141552:141677, ack 0, win 58, options [nop,nop,TS val 3923646 ecr 349104], length 125: OpenFlow
	version 1.0, type PACKET_IN, length 125, xid 0x00000000
