17:59:51.428994 IP 192.168.1.30.41018 > 192.168.1.10.6633: Flags [P.], seq 455286741:455287084, ack 72670865, win 125, options [nop,nop,TS val 3832708 ecr 257998], length 343: OpenFlow
	version 1.0, type PACKET_IN, length 343, xid 0x00000000
17:59:51.429062 IP 192.168.1.30.41018 > 192.168.1.10.6633: Flags [P.], seq 343:686, ack 1, win 125, options [nop,nop,TS val 3832708 ecr 257998], length 343: OpenFlow
	version 1.0, type PACKET_IN, length 343, xid 0x00000000
17:59:51.429132 IP 192.168.1.30.41018 > 192.168.1.10.6633: Flags [P.], seq 686:1029, ack 1, win 125, options [nop,nop,TS val 3832708 ecr 257998], length 343: OpenFlow
	version 1.0, type PACKET_IN, length 343, xid 0x00000000
17:59:51.429171 IP 192.168.1.30.41018 > 192.168.1.10.6633: Flags [P.], seq 1029:1372, ack 1, win 125, options [nop,nop,TS val 3832708 ecr 257998], length 343: OpenFlow
	version 1.0, type PACKET_IN, length 343, xid 0x00000000
17:59:51.429230 IP 192.168.1.30.41018 > 192.168.1.10.6633: Flags [P.], seq 1372:1715, ack 1, win 125, options [nop,nop,TS val 3832708 ecr 257998], length 343: OpenFlow
	version 1.0, type PACKET_IN, length 343, xid 0x00000000
17:59:51.429289 IP 192.168.1.30.41018 > 192.168.1.10.6633: Flags [P.], seq 1715:2058, ack 1, win 125, options [nop,nop,TS val 3832708 ecr 257998], length 343: OpenFlow
	version 1.0, type PACKET_IN, length 343, xid 0x00000000
17:59:51.429346 IP 192.168.1.30.41018 > 192.168.1.10.6633: Flags [P.], seq 2058:2401, ack 1, win 125, options [nop,nop,TS val 3832708 ecr 257998], length 343: OpenFlow
	version 1.0, type PACKET_IN, length 343, xid 0x00000000
17:59:51.429397 IP 192.168.1.30.41018 > 192.168.1.10.6633: Flags [P.], seq 2401:2744, ack 1, win 125, options [nop,nop,TS val 3832708 ecr 257998], length 343: OpenFlow
	version 1.0, type PACKET_IN, length 343, xid 0x00000000
17:59:51.429445 IP 192.168.1.30.41018 > 192.168.1.10.6633: Flags [P.], seq 2744:3087, ack 1, win 125, options [nop,nop,TS val 3832708 ecr 257998], length 343: OpenFlow
	version 1.0, type PACKET_IN, length 343, xid 0x00000000
17:59:51.429509 IP 192.168.1.10.6633 > 192.168.1.30.41018: Flags [.], ack 1715, win 4261, options [nop,nop,TS val 258166 ecr 3832708], length 0
17:59:51.429522 IP 192.168.1.10.6633 > 192.168.1.30.41018: Flags [.], ack 2401, win 4261, options [nop,nop,TS val 258167 ecr 3832708], length 0
17:59:51.429522 IP 192.168.1.30.41018 > 192.168.1.10.6633: Flags [P.], seq 3087:3430, ack 1, win 125, options [nop,nop,TS val 3832709 ecr 257998], length 343: OpenFlow
	version 1.0, type PACKET_IN, length 343, xid 0x00000000
17:59:51.429568 IP 192.168.1.30.41018 > 192.168.1.10.6633: Flags [P.], seq 3430:3773, ack 1, win 125, options [nop,nop,TS val 3832709 ecr 258167], length 343: OpenFlow
	version 1.0, type PACKET_IN, length 343, xid 0x00000000
17:59:51.429591 IP 192.168.1.30.41018 > 192.168.1.10.6633: Flags [P.], seq 3773:4116, ack 1, win 125, options [nop,nop,TS val 3832709 ecr 258167], length 343: OpenFlow
	version 1.0, type PACKET_IN, length 343, xid 0x00000000
17:59:51.429616 IP 192.168.1.30.41018 > 192.168.1.10.6633: Flags [P.], seq 4116:4459, ack 1, win 125, options [nop,nop,TS val 3832709 ecr 258167], length 343: OpenFlow
	version 1.0, type PACKET_IN, length 343, xid 0x00000000
17:59:51.429630 IP 192.168.1.10.6633 > 192.168.1.30.41018: Flags [.], ack 3087, win 4261, options [nop,nop,TS val 258167 ecr 3832708], length 0
17:59:51.429639 IP 192.168.1.30.41018 > 192.168.1.10.6633: Flags [P.], seq 4459:4802, ack 1, win 125, options [nop,nop,TS val 3832709 ecr 258167], length 343: OpenFlow
	version 1.0, type PACKET_IN, length 343, xid 0x00000000
17:59:51.429664 IP 192.168.1.30.41018 > 192.168.1.10.6633: Flags [P.], seq 4802:5145, ack 1, win 125, options [nop,nop,TS val 3832709 ecr 258167], length 343: OpenFlow
	version 1.0, type PACKET_IN, length 343, xid 0x00000000
17:59:51.429689 IP 192.168.1.30.41018 > 192.168.1.10.6633: Flags [P.], seq 5145:5488, ack 1, win 125, options [nop,nop,TS val 3832709 ecr 258167], length 343: OpenFlow
	version 1.0, type PACKET_IN, length 343, xid 0x00000000
17:59:51.429723 IP 192.168.1.30.41018 > 192.168.1.10.6633: Flags [P.], seq 5488:5831, ack 1, win 125, options [nop,nop,TS val 3832709 ecr 258167], length 343: OpenFlow
	version 1.0, type PACKET_IN, length 343, xid 0x00000000
17:59:51.429748 IP 192.168.1.30.41018 > 192.168.1.10.6633: Flags [P.], seq 5831:6174, ack 1, win 125, options [nop,nop,TS val 3832709 ecr 258167], length 343: OpenFlow
	version 1.0, type PACKET_IN, length 343, xid 0x00000000
17:59:51.429772 IP 192.168.1.30.41018 > 192.168.1.10.6633: Flags [P.], seq 6174:6369, ack 1, win 125, options [nop,nop,TS val 3832709 ecr 258167], length 195: OpenFlow
	version 1.0, type PACKET_IN, length 195, xid 0x00000000
17:59:51.429796 IP 192.168.1.30.41018 > 192.168.1.10.6633: Flags [P.], seq 6369:6712, ack 1, win 125, options [nop,nop,TS val 3832709 ecr 258167], length 343: OpenFlow
	version 1.0, type PACKET_IN, length 343, xid 0x00000000
17:59:51.429820 IP 192.168.1.30.41018 > 192.168.1.10.6633: Flags [P.], seq 6712:7055, ack 1, win 125, options [nop,nop,TS val 3832709 ecr 258167], length 343: OpenFlow
	version 1.0, type PACKET_IN, length 343, xid 0x00000000
17:59:51.429827 IP 192.168.1.10.6633 > 192.168.1.30.41018: Flags [.], ack 4802, win 4261, options [nop,nop,TS val 258167 ecr 3832709], length 0
17:59:51.429845 IP 192.168.1.10.6633 > 192.168.1.30.41018: Flags [.], ack 6369, win 4261, options [nop,nop,TS val 258167 ecr 3832709], length 0
17:59:51.429848 IP 192.168.1.30.41018 > 192.168.1.10.6633: Flags [P.], seq 7055:7398, ack 1, win 125, options [nop,nop,TS val 3832709 ecr 258167], length 343: OpenFlow
	version 1.0, type PACKET_IN, length 343, xid 0x00000000
17:59:51.429879 IP 192.168.1.30.41018 > 192.168.1.10.6633: Flags [P.], seq 7398:7741, ack 1, win 125, options [nop,nop,TS val 3832709 ecr 258167], length 343: OpenFlow
	version 1.0, type PACKET_IN, length 343, xid 0x00000000
17:59:51.429903 IP 192.168.1.30.41018 > 192.168.1.10.6633: Flags [P.], seq 7741:7829, ack 1, win 125, options [nop,nop,TS val 3832709 ecr 258167], length 88: OpenFlow
	version 1.0, type PACKET_IN, length 88, xid 0x00000000
17:59:51.429926 IP 192.168.1.30.41018 > 192.168.1.10.6633: Flags [P.], seq 7829:8172, ack 1, win 125, options [nop,nop,TS val 3832709 ecr 258167], length 343: OpenFlow
	version 1.0, type PACKET_IN, length 343, xid 0x00000000
17:59:51.429949 IP 192.168.1.30.41018 > 192.168.1.10.6633: Flags [P.], seq 8172:8515, ack 1, win 125, options [nop,nop,TS val 3832709 ecr 258167], length 343: OpenFlow
	version 1.0, type PACKET_IN, length 343, xid 0x00000000
17:59:51.429979 IP 192.168.1.30.41018 > 192.168.1.10.6633: Flags [P.], seq 8515:8875, ack 1, win 125, options [nop,nop,TS val 3832709 ecr 258167], length 360: OpenFlow
	version 1.0, type PACKET_IN, length 360, xid 0x00000000
17:59:51.430003 IP 192.168.1.30.41018 > 192.168.1.10.6633: Flags [P.], seq 8875:9218, ack 1, win 125, options [nop,nop,TS val 3832709 ecr 258167], length 343: OpenFlow
	version 1.0, type PACKET_IN, length 343, xid 0x00000000
17:59:51.430028 IP 192.168.1.30.41018 > 192.168.1.10.6633: Flags [P.], seq 9218:9561, ack 1, win 125, options [nop,nop,TS val 3832709 ecr 258167], length 343: OpenFlow
	version 1.0, type PACKET_IN, length 343, xid 0x00000000
17:59:51.430053 IP 192.168.1.30.41018 > 192.168.1.10.6633: Flags [P.], seq 9561:9904, ack 1, win 125, options [nop,nop,TS val 3832709 ecr 258167], length 343: OpenFlow
	version 1.0, type PACKET_IN, length 343, xid 0x00000000
17:59:51.430076 IP 192.168.1.30.41018 > 192.168.1.10.6633: Flags [P.], seq 9904:10099, ack 1, win 125, options [nop,nop,TS val 3832709 ecr 258167], length 195: OpenFlow
	version 1.0, type PACKET_IN, length 195, xid 0x00000000
17:59:51.430094 IP 192.168.1.10.6633 > 192.168.1.30.41018: Flags [.], ack 7829, win 4261, options [nop,nop,TS val 258167 ecr 3832709], length 0
17:59:51.430101 IP 192.168.1.30.41018 > 192.168.1.10.6633: Flags [P.], seq 10099:10187, ack 1, win 125, options [nop,nop,TS val 3832709 ecr 258167], length 88: OpenFlow
	version 1.0, type PACKET_IN, length 88, xid 0x00000000
17:59:51.430130 IP 192.168.1.30.41018 > 192.168.1.10.6633: Flags [P.], seq 10187:10382, ack 1, win 125, options [nop,nop,TS val 3832709 ecr 258167], length 195: OpenFlow
	version 1.0, type PACKET_IN, length 195, xid 0x00000000
17:59:51.430142 IP 192.168.1.10.6633 > 192.168.1.30.41018: Flags [.], ack 8515, win 4261, options [nop,nop,TS val 258167 ecr 3832709], length 0
17:59:51.430159 IP 192.168.1.30.41018 > 192.168.1.10.6633: Flags [P.], seq 10382:10725, ack 1, win 125, options [nop,nop,TS val 3832709 ecr 258167], length 343: OpenFlow
	version 1.0, type PACKET_IN, length 343, xid 0x00000000
17:59:51.430186 IP 192.168.1.30.41018 > 192.168.1.10.6633: Flags [P.], seq 10725:11068, ack 1, win 125, options [nop,nop,TS val 3832709 ecr 258167], length 343: OpenFlow
	version 1.0, type PACKET_IN, length 343, xid 0x00000000
17:59:51.430211 IP 192.168.1.30.41018 > 192.168.1.10.6633: Flags [P.], seq 11068:11411, ack 1, win 125, options [nop,nop,TS val 3832709 ecr 258167], length 343: OpenFlow
	version 1.0, type PACKET_IN, length 343, xid 0x00000000
17:59:51.430235 IP 192.168.1.30.41018 > 192.168.1.10.6633: Flags [P.], seq 11411:11754, ack 1, win 125, options [nop,nop,TS val 3832709 ecr 258167], length 343: OpenFlow
	version 1.0, type PACKET_IN, length 343, xid 0x00000000
17:59:51.430260 IP 192.168.1.30.41018 > 192.168.1.10.6633: Flags [P.], seq 11754:12097, ack 1, win 125, options [nop,nop,TS val 3832709 ecr 258167], length 343: OpenFlow
	version 1.0, type PACKET_IN, length 343, xid 0x00000000
17:59:51.430282 IP 192.168.1.30.41018 > 192.168.1.10.6633: Flags [P.], seq 12097:12440, ack 1, win 125, options [nop,nop,TS val 3832709 ecr 258167], length 343: OpenFlow
	version 1.0, type PACKET_IN, length 343, xid 0x00000000
17:59:51.430311 IP 192.168.1.30.41018 > 192.168.1.10.6633: Flags [P.], seq 12440:12783, ack 1, win 125, options [nop,nop,TS val 3832709 ecr 258167], length 343: OpenFlow
	version 1.0, type PACKET_IN, length 343, xid 0x00000000
17:59:51.430336 IP 192.168.1.30.41018 > 192.168.1.10.6633: Flags [P.], seq 12783:13126, ack 1, win 125, options [nop,nop,TS val 3832709 ecr 258167], length 343: OpenFlow
	version 1.0, type PACKET_IN, length 343, xid 0x00000000
17:59:51.430346 IP 192.168.1.10.6633 > 192.168.1.30.41018: Flags [.], ack 10099, win 4261, options [nop,nop,TS val 258167 ecr 3832709], length 0
17:59:51.430359 IP 192.168.1.10.6633 > 192.168.1.30.41018: Flags [.], ack 10725, win 4261, options [nop,nop,TS val 258167 ecr 3832709], length 0
17:59:51.430360 IP 192.168.1.30.41018 > 192.168.1.10.6633: Flags [P.], seq 13126:13469, ack 1, win 125, options [nop,nop,TS val 3832709 ecr 258167], length 343: OpenFlow
	version 1.0, type PACKET_IN, length 343, xid 0x00000000
17:59:51.430391 IP 192.168.1.30.41018 > 192.168.1.10.6633: Flags [P.], seq 13469:13812, ack 1, win 125, options [nop,nop,TS val 3832709 ecr 258167], length 343: OpenFlow
	version 1.0, type PACKET_IN, length 343, xid 0x00000000
17:59:51.430415 IP 192.168.1.30.41018 > 192.168.1.10.6633: Flags [P.], seq 13812:14155, ack 1, win 125, options [nop,nop,TS val 3832709 ecr 258167], length 343: OpenFlow
	version 1.0, type PACKET_IN, length 343, xid 0x00000000
17:59:51.430440 IP 192.168.1.30.41018 > 192.168.1.10.6633: Flags [P.], seq 14155:14498, ack 1, win 125, options [nop,nop,TS val 3832709 ecr 258167], length 343: OpenFlow
	version 1.0, type PACKET_IN, length 343, xid 0x00000000
17:59:51.430465 IP 192.168.1.30.41018 > 192.168.1.10.6633: Flags [P.], seq 14498:14841, ack 1, win 125, options [nop,nop,TS val 3832709 ecr 258167], length 343: OpenFlow
	version 1.0, type PACKET_IN, length 343, xid 0x00000000
17:59:51.430489 IP 192.168.1.30.41018 > 192.168.1.10.6633: Flags [P.], seq 14841:15184, ack 1, win 125, options [nop,nop,TS val 3832709 ecr 258167], length 343: OpenFlow
	version 1.0, type PACKET_IN, length 343, xid 0x00000000
17:59:51.430512 IP 192.168.1.30.41018 > 192.168.1.10.6633: Flags [P.], seq 15184:15509, ack 1, win 125, options [nop,nop,TS val 3832709 ecr 258167], length 325: OpenFlow
	version 1.0, type PACKET_IN, length 325, xid 0x00000000
17:59:51.430544 IP 192.168.1.30.41018 > 192.168.1.10.6633: Flags [P.], seq 15509:15597, ack 1, win 125, options [nop,nop,TS val 3832709 ecr 258167], length 88: OpenFlow
	version 1.0, type PACKET_IN, length 88, xid 0x00000000
17:59:51.430569 IP 192.168.1.30.41018 > 192.168.1.10.6633: Flags [P.], seq 15597:15940, ack 1, win 125, options [nop,nop,TS val 3832709 ecr 258167], length 343: OpenFlow
	version 1.0, type PACKET_IN, length 343, xid 0x00000000
17:59:51.430569 IP 192.168.1.10.6633 > 192.168.1.30.41018: Flags [.], ack 12440, win 4261, options [nop,nop,TS val 258167 ecr 3832709], length 0
17:59:51.430579 IP 192.168.1.10.6633 > 192.168.1.30.41018: Flags [.], ack 13812, win 4261, options [nop,nop,TS val 258167 ecr 3832709], length 0
17:59:51.430601 IP 192.168.1.30.41018 > 192.168.1.10.6633: Flags [P.], seq 15940:16283, ack 1, win 125, options [nop,nop,TS val 3832709 ecr 258167], length 343: OpenFlow
	version 1.0, type PACKET_IN, length 343, xid 0x00000000
17:59:51.430626 IP 192.168.1.30.41018 > 192.168.1.10.6633: Flags [P.], seq 16283:16626, ack 1, win 125, options [nop,nop,TS val 3832709 ecr 258167], length 343: OpenFlow
	version 1.0, type PACKET_IN, length 343, xid 0x00000000
17:59:51.430652 IP 192.168.1.30.41018 > 192.168.1.10.6633: Flags [P.], seq 16626:16969, ack 1, win 125, options [nop,nop,TS val 3832709 ecr 258167], length 343: OpenFlow
	version 1.0, type PACKET_IN, length 343, xid 0x00000000
17:59:51.430678 IP 192.168.1.30.41018 > 192.168.1.10.6633: Flags [P.], seq 16969:17312, ack 1, win 125, options [nop,nop,TS val 3832709 ecr 258167], length 343: OpenFlow
	version 1.0, type PACKET_IN, length 343, xid 0x00000000
17:59:51.430702 IP 192.168.1.30.41018 > 192.168.1.10.6633: Flags [P.], seq 17312:17655, ack 1, win 125, options [nop,nop,TS val 3832709 ecr 258167], length 343: OpenFlow
	version 1.0, type PACKET_IN, length 343, xid 0x00000000
17:59:51.430761 IP 192.168.1.10.6633 > 192.168.1.30.41018: Flags [.], ack 15509, win 4261, options [nop,nop,TS val 258167 ecr 3832709], length 0
17:59:51.430774 IP 192.168.1.10.6633 > 192.168.1.30.41018: Flags [.], ack 16626, win 4261, options [nop,nop,TS val 258167 ecr 3832709], length 0
17:59:51.431627 IP 192.168.1.10.6633 > 192.168.1.30.41018: Flags [.], ack 17655, win 4261, options [nop,nop,TS val 258167 ecr 3832709], length 0
17:59:51.432475 IP 192.168.1.30.41018 > 192.168.1.10.6633: Flags [P.], seq 17655:17998, ack 1, win 125, options [nop,nop,TS val 3832709 ecr 258167], length 343: OpenFlow
	version 1.0, type PACKET_IN, length 343, xid 0x00000000
17:59:51.432522 IP 192.168.1.30.41018 > 192.168.1.10.6633: Flags [P.], seq 17998:18341, ack 1, win 125, options [nop,nop,TS val 3832709 ecr 258167], length 343: OpenFlow
	version 1.0, type PACKET_IN, length 343, xid 0x00000000
17:59:51.432560 IP 192.168.1.30.41018 > 192.168.1.10.6633: Flags [P.], seq 18341:18684, ack 1, win 125, options [nop,nop,TS val 3832709 ecr 258167], length 343: OpenFlow
	version 1.0, type PACKET_IN, length 343, xid 0x00000000
17:59:51.432598 IP 192.168.1.30.41018 > 192.168.1.10.6633: Flags [P.], seq 18684:19027, ack 1, win 125, options [nop,nop,TS val 3832709 ecr 258167], length 343: OpenFlow
	version 1.0, type PACKET_IN, length 343, xid 0x00000000
17:59:51.432649 IP 192.168.1.30.41018 > 192.168.1.10.6633: Flags [P.], seq 19027:19370, ack 1, win 125, options [nop,nop,TS val 3832709 ecr 258167], length 343: OpenFlow
	version 1.0, type PACKET_IN, length 343, xid 0x00000000
17:59:51.432866 IP 192.168.1.30.41018 > 192.168.1.10.6633: Flags [P.], seq 19370:19713, ack 1, win 125, options [nop,nop,TS val 3832709 ecr 258167], length 343: OpenFlow
	version 1.0, type PACKET_IN, length 343, xid 0x00000000
17:59:51.432871 IP 192.168.1.10.6633 > 192.168.1.30.41018: Flags [.], ack 18684, win 4261, options [nop,nop,TS val 258167 ecr 3832709], length 0
17:59:51.433051 IP 192.168.1.10.6633 > 192.168.1.30.41018: Flags [.], ack 19370, win 4261, options [nop,nop,TS val 258167 ecr 3832709], length 0
17:59:51.433226 IP 192.168.1.30.41018 > 192.168.1.10.6633: Flags [P.], seq 19713:20056, ack 1, win 125, options [nop,nop,TS val 3832709 ecr 258167], length 343: OpenFlow
	version 1.0, type PACKET_IN, length 343, xid 0x00000000
17:59:51.433529 IP 192.168.1.30.41018 > 192.168.1.10.6633: Flags [P.], seq 20056:20399, ack 1, win 125, options [nop,nop,TS val 3832710 ecr 258167], length 343: OpenFlow
	version 1.0, type PACKET_IN, length 343, xid 0x00000000
17:59:51.433657 IP 192.168.1.30.41018 > 192.168.1.10.6633: Flags [P.], seq 20399:20742, ack 1, win 125, options [nop,nop,TS val 3832710 ecr 258167], length 343: OpenFlow
	version 1.0, type PACKET_IN, length 343, xid 0x00000000
17:59:51.433819 IP 192.168.1.10.6633 > 192.168.1.30.41018: Flags [.], ack 20056, win 4261, options [nop,nop,TS val 258167 ecr 3832709], length 0
17:59:51.433850 IP 192.168.1.30.41018 > 192.168.1.10.6633: Flags [P.], seq 20742:21102, ack 1, win 125, options [nop,nop,TS val 3832710 ecr 258167], length 360: OpenFlow
	version 1.0, type PACKET_IN, length 360, xid 0x00000000
17:59:51.433899 IP 192.168.1.30.41018 > 192.168.1.10.6633: Flags [P.], seq 21102:21445, ack 1, win 125, options [nop,nop,TS val 3832710 ecr 258167], length 343: OpenFlow
	version 1.0, type PACKET_IN, length 343, xid 0x00000000
17:59:51.433940 IP 192.168.1.30.41018 > 192.168.1.10.6633: Flags [P.], seq 21445:21788, ack 1, win 125, options [nop,nop,TS val 3832710 ecr 258167], length 343: OpenFlow
	version 1.0, type PACKET_IN, length 343, xid 0x00000000
17:59:51.433978 IP 192.168.1.30.41018 > 192.168.1.10.6633: Flags [P.], seq 21788:22131, ack 1, win 125, options [nop,nop,TS val 3832710 ecr 258167], length 343: OpenFlow
	version 1.0, type PACKET_IN, length 343, xid 0x00000000
17:59:51.434022 IP 192.168.1.30.41018 > 192.168.1.10.6633: Flags [P.], seq 22131:22474, ack 1, win 125, options [nop,nop,TS val 3832710 ecr 258167], length 343: OpenFlow
	version 1.0, type PACKET_IN, length 343, xid 0x00000000
17:59:51.434057 IP 192.168.1.10.6633 > 192.168.1.30.41018: Flags [.], ack 20742, win 4261, options [nop,nop,TS val 258168 ecr 3832710], length 0
17:59:51.434060 IP 192.168.1.30.41018 > 192.168.1.10.6633: Flags [P.], seq 22474:22817, ack 1, win 125, options [nop,nop,TS val 3832710 ecr 258167], length 343: OpenFlow
	version 1.0, type PACKET_IN, length 343, xid 0x00000000
17:59:51.434112 IP 192.168.1.30.41018 > 192.168.1.10.6633: Flags [P.], seq 22817:23082, ack 1, win 125, options [nop,nop,TS val 3832710 ecr 258168], length 265: OpenFlow
	version 1.0, type PACKET_IN, length 265, xid 0x00000000
17:59:51.434158 IP 192.168.1.30.41018 > 192.168.1.10.6633: Flags [P.], seq 23082:23442, ack 1, win 125, options [nop,nop,TS val 3832710 ecr 258168], length 360: OpenFlow
	version 1.0, type PACKET_IN, length 360, xid 0x00000000
17:59:51.434200 IP 192.168.1.30.41018 > 192.168.1.10.6633: Flags [P.], seq 23442:23785, ack 1, win 125, options [nop,nop,TS val 3832710 ecr 258168], length 343: OpenFlow
	version 1.0, type PACKET_IN, length 343, xid 0x00000000
17:59:51.434233 IP 192.168.1.10.6633 > 192.168.1.30.41018: Flags [.], ack 22131, win 4261, options [nop,nop,TS val 258168 ecr 3832710], length 0
17:59:51.434243 IP 192.168.1.30.41018 > 192.168.1.10.6633: Flags [P.], seq 23785:24128, ack 1, win 125, options [nop,nop,TS val 3832710 ecr 258168], length 343: OpenFlow
	version 1.0, type PACKET_IN, length 343, xid 0x00000000
17:59:51.434288 IP 192.168.1.30.41018 > 192.168.1.10.6633: Flags [P.], seq 24128:24471, ack 1, win 125, options [nop,nop,TS val 3832710 ecr 258168], length 343: OpenFlow
	version 1.0, type PACKET_IN, length 343, xid 0x00000000
17:59:51.434329 IP 192.168.1.30.41018 > 192.168.1.10.6633: Flags [P.], seq 24471:24814, ack 1, win 125, options [nop,nop,TS val 3832710 ecr 258168], length 343: OpenFlow
	version 1.0, type PACKET_IN, length 343, xid 0x00000000
17:59:51.434370 IP 192.168.1.30.41018 > 192.168.1.10.6633: Flags [P.], seq 24814:25157, ack 1, win 125, options [nop,nop,TS val 3832710 ecr 258168], length 343: OpenFlow
	version 1.0, type PACKET_IN, length 343, xid 0x00000000
17:59:51.434388 IP 192.168.1.10.6633 > 192.168.1.30.41018: Flags [.], ack 23785, win 4261, options [nop,nop,TS val 258168 ecr 3832710], length 0
17:59:51.434411 IP 192.168.1.30.41018 > 192.168.1.10.6633: Flags [P.], seq 25157:25500, ack 1, win 125, options [nop,nop,TS val 3832710 ecr 258168], length 343: OpenFlow
	version 1.0, type PACKET_IN, length 343, xid 0x00000000
17:59:51.434452 IP 192.168.1.30.41018 > 192.168.1.10.6633: Flags [P.], seq 25500:25843, ack 1, win 125, options [nop,nop,TS val 3832710 ecr 258168], length 343: OpenFlow
	version 1.0, type PACKET_IN, length 343, xid 0x00000000
17:59:51.434493 IP 192.168.1.30.41018 > 192.168.1.10.6633: Flags [P.], seq 25843:26186, ack 1, win 125, options [nop,nop,TS val 3832710 ecr 258168], length 343: OpenFlow
	version 1.0, type PACKET_IN, length 343, xid 0x00000000
17:59:51.434515 IP 192.168.1.10.6633 > 192.168.1.30.41018: Flags [.], ack 25500, win 4261, options [nop,nop,TS val 258168 ecr 3832710], length 0
17:59:51.434539 IP 192.168.1.30.41018 > 192.168.1.10.6633: Flags [P.], seq 26186:26529, ack 1, win 125, options [nop,nop,TS val 3832710 ecr 258168], length 343: OpenFlow
	version 1.0, type PACKET_IN, length 343, xid 0x00000000
17:59:51.434583 IP 192.168.1.30.41018 > 192.168.1.10.6633: Flags [P.], seq 26529:26872, ack 1, win 125, options [nop,nop,TS val 3832710 ecr 258168], length 343: OpenFlow
	version 1.0, type PACKET_IN, length 343, xid 0x00000000
17:59:51.434623 IP 192.168.1.30.41018 > 192.168.1.10.6633: Flags [P.], seq 26872:27215, ack 1, win 125, options [nop,nop,TS val 3832710 ecr 258168], length 343: OpenFlow
	version 1.0, type PACKET_IN, length 343, xid 0x00000000
17:59:51.434663 IP 192.168.1.30.41018 > 192.168.1.10.6633: Flags [P.], seq 27215:27558, ack 1, win 125, options [nop,nop,TS val 3832710 ecr 258168], length 343: OpenFlow
	version 1.0, type PACKET_IN, length 343, xid 0x00000000
17:59:51.434696 IP 192.168.1.30.41018 > 192.168.1.10.6633: Flags [P.], seq 27558:27646, ack 1, win 125, options [nop,nop,TS val 3832710 ecr 258168], length 88: OpenFlow
	version 1.0, type PACKET_IN, length 88, xid 0x00000000
17:59:51.434734 IP 192.168.1.30.41018 > 192.168.1.10.6633: Flags [P.], seq 27646:27989, ack 1, win 125, options [nop,nop,TS val 3832710 ecr 258168], length 343: OpenFlow
	version 1.0, type PACKET_IN, length 343, xid 0x00000000
17:59:51.434767 IP 192.168.1.10.6633 > 192.168.1.30.41018: Flags [.], ack 27215, win 4261, options [nop,nop,TS val 258168 ecr 3832710], length 0
17:59:51.434784 IP 192.168.1.30.41018 > 192.168.1.10.6633: Flags [P.], seq 27989:28332, ack 1, win 125, options [nop,nop,TS val 3832710 ecr 258168], length 343: OpenFlow
	version 1.0, type PACKET_IN, length 343, xid 0x00000000
17:59:51.434831 IP 192.168.1.30.41018 > 192.168.1.10.6633: Flags [P.], seq 28332:28675, ack 1, win 125, options [nop,nop,TS val 3832710 ecr 258168], length 343: OpenFlow
	version 1.0, type PACKET_IN, length 343, xid 0x00000000
17:59:51.434873 IP 192.168.1.10.6633 > 192.168.1.30.41018: Flags [.], ack 27989, win 4261, options [nop,nop,TS val 258168 ecr 3832710], length 0
17:59:51.434874 IP 192.168.1.30.41018 > 192.168.1.10.6633: Flags [P.], seq 28675:29018, ack 1, win 125, options [nop,nop,TS val 3832710 ecr 258168], length 343: OpenFlow
	version 1.0, type PACKET_IN, length 343, xid 0x00000000
17:59:51.434921 IP 192.168.1.30.41018 > 192.168.1.10.6633: Flags [P.], seq 29018:29361, ack 1, win 125, options [nop,nop,TS val 3832710 ecr 258168], length 343: OpenFlow
	version 1.0, type PACKET_IN, length 343, xid 0x00000000
17:59:51.434965 IP 192.168.1.30.41018 > 192.168.1.10.6633: Flags [P.], seq 29361:29469, ack 1, win 125, options [nop,nop,TS val 3832710 ecr 258168], length 108: OpenFlow
	version 1.0, type PACKET_IN, length 108, xid 0x00000000
17:59:51.435003 IP 192.168.1.30.41018 > 192.168.1.10.6633: Flags [P.], seq 29469:29812, ack 1, win 125, options [nop,nop,TS val 3832710 ecr 258168], length 343: OpenFlow
	version 1.0, type PACKET_IN, length 343, xid 0x00000000
17:59:51.435049 IP 192.168.1.30.41018 > 192.168.1.10.6633: Flags [P.], seq 29812:29920, ack 1, win 125, options [nop,nop,TS val 3832710 ecr 258168], length 108: OpenFlow
	version 1.0, type PACKET_IN, length 108, xid 0x00000000
17:59:51.435088 IP 192.168.1.30.41018 > 192.168.1.10.6633: Flags [P.], seq 29920:30263, ack 1, win 125, options [nop,nop,TS val 3832710 ecr 258168], length 343: OpenFlow
	version 1.0, type PACKET_IN, length 343, xid 0x00000000
17:59:51.435107 IP 192.168.1.10.6633 > 192.168.1.30.41018: Flags [.], ack 28675, win 4261, options [nop,nop,TS val 258168 ecr 3832710], length 0
17:59:51.435132 IP 192.168.1.30.41018 > 192.168.1.10.6633: Flags [P.], seq 30263:30606, ack 1, win 125, options [nop,nop,TS val 3832710 ecr 258168], length 343: OpenFlow
	version 1.0, type PACKET_IN, length 343, xid 0x00000000
17:59:51.435180 IP 192.168.1.30.41018 > 192.168.1.10.6633: Flags [P.], seq 30606:30949, ack 1, win 125, options [nop,nop,TS val 3832710 ecr 258168], length 343: OpenFlow
	version 1.0, type PACKET_IN, length 343, xid 0x00000000
17:59:51.435220 IP 192.168.1.30.41018 > 192.168.1.10.6633: Flags [P.], seq 30949:31292, ack 1, win 125, options [nop,nop,TS val 3832710 ecr 258168], length 343: OpenFlow
	version 1.0, type PACKET_IN, length 343, xid 0x00000000
17:59:51.435268 IP 192.168.1.30.41018 > 192.168.1.10.6633: Flags [P.], seq 31292:31635, ack 1, win 125, options [nop,nop,TS val 3832710 ecr 258168], length 343: OpenFlow
	version 1.0, type PACKET_IN, length 343, xid 0x00000000
17:59:51.435309 IP 192.168.1.30.41018 > 192.168.1.10.6633: Flags [P.], seq 31635:31978, ack 1, win 125, options [nop,nop,TS val 3832710 ecr 258168], length 343: OpenFlow
	version 1.0, type PACKET_IN, length 343, xid 0x00000000
17:59:51.435350 IP 192.168.1.30.41018 > 192.168.1.10.6633: Flags [P.], seq 31978:32321, ack 1, win 125, options [nop,nop,TS val 3832710 ecr 258168], length 343: OpenFlow
	version 1.0, type PACKET_IN, length 343, xid 0x00000000
17:59:51.435398 IP 192.168.1.30.41018 > 192.168.1.10.6633: Flags [P.], seq 32321:32664, ack 1, win 125, options [nop,nop,TS val 3832710 ecr 258168], length 343: OpenFlow
	version 1.0, type PACKET_IN, length 343, xid 0x00000000
17:59:51.435440 IP 192.168.1.30.41018 > 192.168.1.10.6633: Flags [P.], seq 32664:32929, ack 1, win 125, options [nop,nop,TS val 3832710 ecr 258168], length 265: OpenFlow
	version 1.0, type PACKET_IN, length 265, xid 0x00000000
17:59:51.435480 IP 192.168.1.30.41018 > 192.168.1.10.6633: Flags [P.], seq 32929:33272, ack 1, win 125, options [nop,nop,TS val 3832710 ecr 258168], length 343: OpenFlow
	version 1.0, type PACKET_IN, length 343, xid 0x00000000
17:59:51.435520 IP 192.168.1.30.41018 > 192.168.1.10.6633: Flags [P.], seq 33272:33615, ack 1, win 125, options [nop,nop,TS val 3832710 ecr 258168], length 343: OpenFlow
	version 1.0, type PACKET_IN, length 343, xid 0x00000000
17:59:51.435554 IP 192.168.1.30.41018 > 192.168.1.10.6633: Flags [P.], seq 33615:33958, ack 1, win 125, options [nop,nop,TS val 3832710 ecr 258168], length 343: OpenFlow
	version 1.0, type PACKET_IN, length 343, xid 0x00000000
17:59:51.435602 IP 192.168.1.30.41018 > 192.168.1.10.6633: Flags [P.], seq 33958:34301, ack 1, win 125, options [nop,nop,TS val 3832710 ecr 258168], length 343: OpenFlow
	version 1.0, type PACKET_IN, length 343, xid 0x00000000
17:59:51.435639 IP 192.168.1.30.41018 > 192.168.1.10.6633: Flags [P.], seq 34301:34644, ack 1, win 125, options [nop,nop,TS val 3832710 ecr 258168], length 343: OpenFlow
	version 1.0, type PACKET_IN, length 343, xid 0x00000000
17:59:51.435685 IP 192.168.1.30.41018 > 192.168.1.10.6633: Flags [P.], seq 34644:34987, ack 1, win 125, options [nop,nop,TS val 3832710 ecr 258168], length 343: OpenFlow
	version 1.0, type PACKET_IN, length 343, xid 0x00000000
17:59:51.435726 IP 192.168.1.30.41018 > 192.168.1.10.6633: Flags [P.], seq 34987:35330, ack 1, win 125, options [nop,nop,TS val 3832710 ecr 258168], length 343: OpenFlow
	version 1.0, type PACKET_IN, length 343, xid 0x00000000
17:59:51.435766 IP 192.168.1.30.41018 > 192.168.1.10.6633: Flags [P.], seq 35330:35673, ack 1, win 125, options [nop,nop,TS val 3832710 ecr 258168], length 343: OpenFlow
	version 1.0, type PACKET_IN, length 343, xid 0x00000000
17:59:51.435814 IP 192.168.1.30.41018 > 192.168.1.10.6633: Flags [P.], seq 35673:35781, ack 1, win 125, options [nop,nop,TS val 3832710 ecr 258168], length 108: OpenFlow
	version 1.0, type PACKET_IN, length 108, xid 0x00000000
17:59:51.435854 IP 192.168.1.30.41018 > 192.168.1.10.6633: Flags [P.], seq 35781:35889, ack 1, win 125, options [nop,nop,TS val 3832710 ecr 258168], length 108: OpenFlow
	version 1.0, type PACKET_IN, length 108, xid 0x00000000
17:59:51.435895 IP 192.168.1.30.41018 > 192.168.1.10.6633: Flags [P.], seq 35889:36232, ack 1, win 125, options [nop,nop,TS val 3832710 ecr 258168], length 343: OpenFlow
	version 1.0, type PACKET_IN, length 343, xid 0x00000000
17:59:51.435935 IP 192.168.1.10.6633 > 192.168.1.30.41018: Flags [.], ack 29361, win 4261, options [nop,nop,TS val 258168 ecr 3832710], length 0
17:59:51.435953 IP 192.168.1.30.41018 > 192.168.1.10.6633: Flags [P.], seq 36232:36575, ack 1, win 125, options [nop,nop,TS val 3832710 ecr 258168], length 343: OpenFlow
	version 1.0, type PACKET_IN, length 343, xid 0x00000000
17:59:51.435971 IP 192.168.1.30.41018 > 192.168.1.10.6633: Flags [P.], seq 36575:36918, ack 1, win 125, options [nop,nop,TS val 3832710 ecr 258168], length 343: OpenFlow
	version 1.0, type PACKET_IN, length 343, xid 0x00000000
17:59:51.436016 IP 192.168.1.30.41018 > 192.168.1.10.6633: Flags [P.], seq 36918:37261, ack 1, win 125, options [nop,nop,TS val 3832710 ecr 258168], length 343: OpenFlow
	version 1.0, type PACKET_IN, length 343, xid 0x00000000
17:59:51.436056 IP 192.168.1.30.41018 > 192.168.1.10.6633: Flags [P.], seq 37261:37604, ack 1, win 125, options [nop,nop,TS val 3832710 ecr 258168], length 343: OpenFlow
	version 1.0, type PACKET_IN, length 343, xid 0x00000000
17:59:51.436123 IP 192.168.1.10.6633 > 192.168.1.30.41018: Flags [.], ack 29920, win 4261, options [nop,nop,TS val 258168 ecr 3832710], length 0
17:59:51.436146 IP 192.168.1.30.41018 > 192.168.1.10.6633: Flags [P.], seq 37604:38290, ack 1, win 125, options [nop,nop,TS val 3832710 ecr 258168], length 686: OpenFlow
	version 1.0, type PACKET_IN, length 343, xid 0x00000000
	version 1.0, type PACKET_IN, length 343, xid 0x00000000
17:59:51.436166 IP 192.168.1.30.41018 > 192.168.1.10.6633: Flags [P.], seq 38290:38633, ack 1, win 125, options [nop,nop,TS val 3832710 ecr 258168], length 343: OpenFlow
	version 1.0, type PACKET_IN, length 343, xid 0x00000000
17:59:51.436194 IP 192.168.1.30.41018 > 192.168.1.10.6633: Flags [P.], seq 38633:38976, ack 1, win 125, options [nop,nop,TS val 3832710 ecr 258168], length 343: OpenFlow
	version 1.0, type PACKET_IN, length 343, xid 0x00000000
17:59:51.436218 IP 192.168.1.30.41018 > 192.168.1.10.6633: Flags [P.], seq 38976:39319, ack 1, win 125, options [nop,nop,TS val 3832710 ecr 258168], length 343: OpenFlow
	version 1.0, type PACKET_IN, length 343, xid 0x00000000
17:59:51.436241 IP 192.168.1.30.41018 > 192.168.1.10.6633: Flags [P.], seq 39319:39662, ack 1, win 125, options [nop,nop,TS val 3832710 ecr 258168], length 343: OpenFlow
	version 1.0, type PACKET_IN, length 343, xid 0x00000000
17:59:51.436262 IP 192.168.1.30.41018 > 192.168.1.10.6633: Flags [P.], seq 39662:40005, ack 1, win 125, options [nop,nop,TS val 3832710 ecr 258168], length 343: OpenFlow
	version 1.0, type PACKET_IN, length 343, xid 0x00000000
17:59:51.436837 IP 192.168.1.10.6633 > 192.168.1.30.41018: Flags [.], ack 31635, win 4261, options [nop,nop,TS val 258168 ecr 3832710], length 0
17:59:51.436855 IP 192.168.1.30.41018 > 192.168.1.10.6633: Flags [.], seq 40005:45797, ack 1, win 125, options [nop,nop,TS val 3832710 ecr 258168], length 5792: OpenFlow
	version 1.0, type PACKET_IN, length 195, xid 0x00000000
	version 1.0, type PACKET_IN, length 343, xid 0x00000000
	version 1.0, type PACKET_IN, length 343, xid 0x00000000
	version 1.0, type PACKET_IN, length 88, xid 0x00000000
	version 1.0, type PACKET_IN, length 195, xid 0x00000000
	version 1.0, type PACKET_IN, length 343, xid 0x00000000
	version 1.0, type PACKET_IN, length 343, xid 0x00000000
	version 1.0, type PACKET_IN, length 343, xid 0x00000000
	version 1.0, type PACKET_IN, length 125, xid 0x00000000
	version 1.0, type PACKET_IN, length 125, xid 0x00000000
	version 1.0, type PACKET_IN, length 88, xid 0x00000000
	version 1.0, type PACKET_IN, length 343, xid 0x00000000
	version 1.0, type PACKET_IN, length 343, xid 0x00000000
	version 1.0, type PACKET_IN, length 343, xid 0x00000000
	version 1.0, type PACKET_IN, length 108, xid 0x00000000
	version 1.0, type PACKET_IN, length 125, xid 0x00000000
	version 1.0, type PACKET_IN, length 125, xid 0x00000000
	version 1.0, type PACKET_IN, length 343, xid 0x00000000
	version 1.0, type PACKET_IN, length 343, xid 0x00000000
	version 1.0, type PACKET_IN, length 343, xid 0x00000000
	version 1.0, type PACKET_IN, length 343, xid 0x00000000
	version 1.0, type PACKET_IN, length 343, xid 0x00000000
	version 1.0, type PACKET_IN, length 343, xid 0x00000000 [|openflow]
17:59:51.436868 IP 192.168.1.30.41018 > 192.168.1.10.6633: Flags [.], seq 45797:51589, ack 1, win 125, options [nop,nop,TS val 3832710 ecr 258168], length 5792: OpenFlow
	version unknown (0xc0), type 0x3b, length 255, xid 0x00010130
	version unknown (0xfb), type 0x14, length 59668, xid 0xe9010f3b [|openflow]
17:59:51.436880 IP 192.168.1.10.6633 > 192.168.1.30.41018: Flags [.], ack 33272, win 4261, options [nop,nop,TS val 258168 ecr 3832710], length 0
17:59:51.436889 IP 192.168.1.30.41018 > 192.168.1.10.6633: Flags [.], seq 51589:57381, ack 1, win 125, options [nop,nop,TS val 3832710 ecr 258168], length 5792: OpenFlow
	version unknown (0x5d), type 0x0c, length 24439, xid 0x6f726b73 [|openflow]
17:59:51.436901 IP 192.168.1.30.41018 > 192.168.1.10.6633: Flags [.], seq 57381:63173, ack 1, win 125, options [nop,nop,TS val 3832710 ecr 258168], length 5792: OpenFlow
	version unknown (0x30), type 0x01, length 12289, xid 0x30013001 [|openflow]
17:59:51.436912 IP 192.168.1.30.41018 > 192.168.1.10.6633: Flags [.], seq 63173:68965, ack 1, win 125, options [nop,nop,TS val 3832710 ecr 258168], length 5792: OpenFlow
	version unknown (0x00), type 0x00, length 176, xid 0x7083fffe
	version unknown (0x75), type 0x62, length 30062, xid 0x74752d36 [|openflow]
17:59:51.436932 IP 192.168.1.10.6633 > 192.168.1.30.41018: Flags [.], ack 34987, win 4261, options [nop,nop,TS val 258168 ecr 3832710], length 0
17:59:51.436943 IP 192.168.1.30.41018 > 192.168.1.10.6633: Flags [.], seq 68965:74757, ack 1, win 125, options [nop,nop,TS val 3832710 ecr 258168], length 5792: OpenFlow
	version unknown (0x75), type 0x6e, length 29813, xid 0x2d36c03b [|openflow]
17:59:51.436955 IP 192.168.1.30.41018 > 192.168.1.10.6633: Flags [P.], seq 74757:76101, ack 1, win 125, options [nop,nop,TS val 3832710 ecr 258168], length 1344: OpenFlow
	version unknown (0x34), type 0xa0, length 34525, xid 0x60000000 [|openflow]
17:59:51.436968 IP 192.168.1.30.41018 > 192.168.1.10.6633: Flags [P.], seq 76101:76366, ack 1, win 125, options [nop,nop,TS val 3832710 ecr 258168], length 265: OpenFlow
	version 1.0, type PACKET_IN, length 265, xid 0x00000000
17:59:51.443865 IP 192.168.1.10.6633 > 192.168.1.30.41018: Flags [.], ack 76366, win 4108, options [nop,nop,TS val 258170 ecr 3832710], length 0
17:59:51.443906 IP 192.168.1.30.41018 > 192.168.1.10.6633: Flags [.], seq 76366:83606, ack 1, win 125, options [nop,nop,TS val 3832712 ecr 258170], length 7240: OpenFlow
	version 1.0, type PACKET_IN, length 343, xid 0x00000000
	version 1.0, type PACKET_IN, length 343, xid 0x00000000
	version 1.0, type PACKET_IN, length 265, xid 0x00000000
	version 1.0, type PACKET_IN, length 343, xid 0x00000000
	version 1.0, type PACKET_IN, length 343, xid 0x00000000
	version 1.0, type PACKET_IN, length 343, xid 0x00000000
	version 1.0, type PACKET_IN, length 265, xid 0x00000000
	version 1.0, type PACKET_IN, length 343, xid 0x00000000
	version 1.0, type PACKET_IN, length 195, xid 0x00000000
	version 1.0, type PACKET_IN, length 343, xid 0x00000000
	version 1.0, type PACKET_IN, length 343, xid 0x00000000
	version 1.0, type PACKET_IN, length 343, xid 0x00000000
	version 1.0, type PACKET_IN, length 343, xid 0x00000000
	version 1.0, type PACKET_IN, length 343, xid 0x00000000
	version 1.0, type PACKET_IN, length 343, xid 0x00000000
	version 1.0, type PACKET_IN, length 343, xid 0x00000000
	version 1.0, type PACKET_IN, length 343, xid 0x00000000
	version 1.0, type PACKET_IN, length 343, xid 0x00000000
	version 1.0, type PACKET_IN, length 343, xid 0x00000000
	version 1.0, type PACKET_IN, length 343, xid 0x00000000
	version 1.0, type PACKET_IN, length 343, xid 0x00000000
	version 1.0, type PACKET_IN, length 343, xid 0x00000000 [|openflow]
17:59:51.443925 IP 192.168.1.30.41018 > 192.168.1.10.6633: Flags [.], seq 83606:90846, ack 1, win 125, options [nop,nop,TS val 3832712 ecr 258170], length 7240: OpenFlow
	version 1.0, type HELLO, length 266, xid 0x01570000
	version unknown (0x70), type 0x83, length 65534, xid 0x2034a0c0 [|openflow]
17:59:51.443942 IP 192.168.1.30.41018 > 192.168.1.10.6633: Flags [.], seq 90846:98086, ack 1, win 125, options [nop,nop,TS val 3832712 ecr 258170], length 7240: OpenFlow
	version unknown (0x30), type 0x01, length 12289, xid 0x30013001 [|openflow]
17:59:51.443986 IP 192.168.1.30.41018 > 192.168.1.10.6633: Flags [.], seq 98086:105326, ack 1, win 125, options [nop,nop,TS val 3832712 ecr 258170], length 7240: OpenFlow
	version unknown (0x11), type 0xff, length 65152, xid 0x00000000 [|openflow]
17:59:51.444002 IP 192.168.1.30.41018 > 192.168.1.10.6633: Flags [.], seq 105326:112566, ack 1, win 125, options [nop,nop,TS val 3832712 ecr 258170], length 7240: OpenFlow
	version unknown (0x30), type 0x01, length 12289, xid 0x30013001 [|openflow]
17:59:51.444018 IP 192.168.1.30.41018 > 192.168.1.10.6633: Flags [.], seq 112566:119806, ack 1, win 125, options [nop,nop,TS val 3832712 ecr 258170], length 7240: OpenFlow
	version unknown (0x65), type 0x01, length 26115, xid 0x69703604 [|openflow]
17:59:51.444033 IP 192.168.1.30.41018 > 192.168.1.10.6633: Flags [.], seq 119806:127046, ack 1, win 125, options [nop,nop,TS val 3832712 ecr 258170], length 7240: OpenFlow
	version unknown (0x74), type 0x75, length 11574, xid 0xc03b00ff [|openflow]
17:59:51.444047 IP 192.168.1.30.41018 > 192.168.1.10.6633: Flags [.], seq 127046:134286, ack 1, win 125, options [nop,nop,TS val 3832712 ecr 258170], length 7240: OpenFlow
	version unknown (0x86), type 0xdd, length 24576, xid 0x0000010f [|openflow]
17:59:51.455788 IP 192.168.1.10.6633 > 192.168.1.30.41018: Flags [.], ack 134286, win 4261, options [nop,nop,TS val 258173 ecr 3832712], length 0
17:59:51.455825 IP 192.168.1.30.41018 > 192.168.1.10.6633: Flags [.], seq 134286:141526, ack 1, win 125, options [nop,nop,TS val 3832715 ecr 258173], length 7240: OpenFlow
	version unknown (0x00), type 0x00, length 0, xid 0xfb14e914 (corrupt)
17:59:51.455846 IP 192.168.1.30.41018 > 192.168.1.10.6633: Flags [.], seq 141526:148766, ack 1, win 125, options [nop,nop,TS val 3832715 ecr 258173], length 7240: OpenFlow
	version unknown (0x00), type 0x00, length 1280, xid 0x001c7562
	version unknown (0x11), type 0x94, length 1, xid 0x00010a01 (corrupt)
17:59:51.455863 IP 192.168.1.30.41018 > 192.168.1.10.6633: Flags [.], seq 148766:156006, ack 1, win 125, options [nop,nop,TS val 3832715 ecr 258173], length 7240: OpenFlow
	version unknown (0x61), type 0x00, length 255, xid 0x0001c046
	version 1.0, type GET_CONFIG_REPLY, length 30050, xid 0x756e7475 (corrupt) [|openflow]
17:59:51.455879 IP 192.168.1.30.41018 > 192.168.1.10.6633: Flags [.], seq 156006:163246, ack 1, win 125, options [nop,nop,TS val 3832715 ecr 258173], length 7240: OpenFlow
	version unknown (0x00), type 0x00, length 0, xid 0x03000000 (corrupt)
17:59:51.455897 IP 192.168.1.30.41018 > 192.168.1.10.6633: Flags [P.], seq 163246:169881, ack 1, win 125, options [nop,nop,TS val 3832715 ecr 258173], length 6635: OpenFlow
	version 1.0, type invalid (0x65), length 358, xid 0x03697036
	version unknown (0xff), type 0x00, length 448, xid 0x46001c00
	version unknown (0x01), type 0x57, length 0, xid 0x0000ffff (corrupt)
17:59:51.455924 IP 192.168.1.30.41018 > 192.168.1.10.6633: Flags [.], seq 169881:177121, ack 1, win 125, options [nop,nop,TS val 3832715 ecr 258173], length 7240: OpenFlow
	version 1.0, type PACKET_IN, length 343, xid 0x00000000
	version 1.0, type PACKET_IN, length 343, xid 0x00000000
	version 1.0, type PACKET_IN, length 343, xid 0x00000000
	version 1.0, type PACKET_IN, length 343, xid 0x00000000
	version 1.0, type PACKET_IN, length 343, xid 0x00000000
	version 1.0, type PACKET_IN, length 343, xid 0x00000000
	version 1.0, type PACKET_IN, length 343, xid 0x00000000
	version 1.0, type PACKET_IN, length 343, xid 0x00000000
	version 1.0, type PACKET_IN, length 343, xid 0x00000000
	version 1.0, type PACKET_IN, length 343, xid 0x00000000
	version 1.0, type PACKET_IN, length 343, xid 0x00000000
	version 1.0, type PACKET_IN, length 343, xid 0x00000000
	version 1.0, type PACKET_IN, length 125, xid 0x00000000
	version 1.0, type PACKET_IN, length 343, xid 0x00000000
	version 1.0, type PACKET_IN, length 343, xid 0x00000000
	version 1.0, type PACKET_IN, length 343, xid 0x00000000
	version 1.0, type PACKET_IN, length 343, xid 0x00000000
	version 1.0, type PACKET_IN, length 343, xid 0x00000000
	version 1.0, type PACKET_IN, length 343, xid 0x00000000
	version 1.0, type PACKET_IN, length 343, xid 0x00000000
	version 1.0, type PACKET_IN, length 343, xid 0x00000000
	version 1.0, type PACKET_IN, length 343, xid 0x00000000 [|openflow]
17:59:51.455943 IP 192.168.1.30.41018 > 192.168.1.10.6633: Flags [.], seq 177121:184361, ack 1, win 125, options [nop,nop,TS val 3832715 ecr 258173], length 7240: OpenFlow
	version unknown (0xfe), type 0x80, length 0, xid 0x00000000 (corrupt)
17:59:51.455964 IP 192.168.1.30.41018 > 192.168.1.10.6633: Flags [.], seq 184361:191601, ack 1, win 125, options [nop,nop,TS val 3832715 ecr 258173], length 7240: OpenFlow
	version 1.0, type PORT_MOD, length 15280, xid 0x00000000 (corrupt) [|openflow]
17:59:51.464576 IP 192.168.1.10.6633 > 192.168.1.30.41018: Flags [.], ack 191601, win 4261, options [nop,nop,TS val 258175 ecr 3832715], length 0
17:59:51.465539 IP 192.168.1.30.41018 > 192.168.1.10.6633: Flags [.], seq 191601:198841, ack 1, win 125, options [nop,nop,TS val 3832717 ecr 258175], length 7240: OpenFlow
	version unknown (0x61), type 0x30, length 23820, xid 0x5f776f72 [|openflow]
17:59:51.465558 IP 192.168.1.30.41018 > 192.168.1.10.6633: Flags [.], seq 198841:206081, ack 1, win 125, options [nop,nop,TS val 3832717 ecr 258175], length 7240: OpenFlow
	version unknown (0x72), type 0x6b, length 29556, xid 0x6174696f [|openflow]
17:59:51.466006 IP 192.168.1.30.41018 > 192.168.1.10.6633: Flags [.], seq 206081:213321, ack 1, win 125, options [nop,nop,TS val 3832717 ecr 258175], length 7240: OpenFlow
	version unknown (0x61), type 0x30, length 23820, xid 0x5f776f72 [|openflow]
17:59:51.466122 IP 192.168.1.30.41018 > 192.168.1.10.6633: Flags [.], seq 213321:220561, ack 1, win 125, options [nop,nop,TS val 3832717 ecr 258175], length 7240: OpenFlow
	version unknown (0x00), type 0x00, length 1, xid 0x0f11fffe (corrupt)
17:59:51.466140 IP 192.168.1.30.41018 > 192.168.1.10.6633: Flags [.], seq 220561:227801, ack 1, win 125, options [nop,nop,TS val 3832717 ecr 258175], length 7240: OpenFlow
	version unknown (0x38), type 0x33, length 14898, xid 0x303a3334 [|openflow]

