18:05:55.011358 IP 192.168.1.10.6633 > 192.168.1.30.41314: Flags [.], ack 3898225020, win 3253, options [nop,nop,TS val 349062 ecr 3923596], length 0
18:05:55.011382 IP 192.168.1.30.41314 > 192.168.1.10.6633: Flags [.], seq 1:2897, ack 0, win 123, options [nop,nop,TS val 3923604 ecr 349062], length 2896: OpenFlow
	version unknown (0x61), type 0x6c, length 0, xid 0x0c000104 (corrupt)
18:05:55.011396 IP 192.168.1.30.41314 > 192.168.1.10.6633: Flags [.], seq 2897:5793, ack 0, win 123, options [nop,nop,TS val 3923604 ecr 349062], length 2896: OpenFlow
	version unknown (0x7d), type 0x00, length 0, xid 0x00ffffff (corrupt)
18:05:55.011407 IP 192.168.1.30.41314 > 192.168.1.10.6633: Flags [.], seq 5793:8689, ack 0, win 123, options [nop,nop,TS val 3923604 ecr 349062], length 2896: OpenFlow
	version unknown (0x52), type 0x69, length 51187, xid 0x18d186dd [|openflow]
18:05:55.011479 IP 192.168.1.30.41314 > 192.168.1.10.6633: Flags [.], seq 8689:11585, ack 0, win 123, options [nop,nop,TS val 3923604 ecr 349062], length 2896: OpenFlow
	version unknown (0x00), type 0x00, length 80, xid 0x69c7fffe
	version 1.0, type PACKET_IN, length 125, xid 0x00000000
	version 1.0, type PACKET_IN, length 125, xid 0x00000000
	version 1.0, type PACKET_IN, length 125, xid 0x00000000
	version 1.0, type PACKET_IN, length 125, xid 0x00000000
	version 1.0, type PACKET_IN, length 125, xid 0x00000000
	version 1.0, type PACKET_IN, length 125, xid 0x00000000
	version 1.0, type PACKET_IN, length 125, xid 0x00000000
	version 1.0, type PACKET_IN, length 125, xid 0x00000000
	version 1.0, type PACKET_IN, length 125, xid 0x00000000
	version 1.0, type PACKET_IN, length 125, xid 0x00000000
	version 1.0, type PACKET_IN, length 125, xid 0x00000000
	version 1.0, type PACKET_IN, length 125, xid 0x00000000
	version 1.0, type PACKET_IN, length 125, xid 0x00000000
	version 1.0, type PACKET_IN, length 125, xid 0x00000000
	version 1.0, type PACKET_IN, length 125, xid 0x00000000
	version 1.0, type PACKET_IN, length 125, xid 0x00000000
	version 1.0, type PACKET_IN, length 125, xid 0x00000000
	version 1.0, type PACKET_IN, length 125, xid 0x00000000
	version 1.0, type PACKET_IN, length 125, xid 0x00000000
	version 1.0, type PACKET_IN, length 125, xid 0x00000000
	version 1.0, type PACKET_IN, length 125, xid 0x00000000
	version 1.0, type PACKET_IN, length 125, xid 0x00000000
	version 1.0, type PACKET_IN, length 125, xid 0x00000000 [|openflow]
18:05:55.011497 IP 192.168.1.30.41314 > 192.168.1.10.6633: Flags [.], seq 11585:14481, ack 0, win 123, options [nop,nop,TS val 3923604 ecr 349062], length 2896: OpenFlow
	version unknown (0x00), type 0x00, length 0, xid 0x00fb14e9 (corrupt)
18:05:55.011505 IP 192.168.1.30.41314 > 192.168.1.10.6633: Flags [.], seq 14481:17377, ack 0, win 123, options [nop,nop,TS val 3923604 ecr 349062], length 2896: OpenFlow
	version unknown (0x00), type 0x00, length 0, xid 0x00055f69 (corrupt)
18:05:55.011512 IP 192.168.1.30.41314 > 192.168.1.10.6633: Flags [.], seq 17377:20273, ack 0, win 123, options [nop,nop,TS val 3923604 ecr 349062], length 2896: OpenFlow
	version unknown (0x6c), type 0x00, length 12, xid 0x0001045f
	version unknown (0x12), type 0x00, length 3072, xid 0x01010a00 [|openflow]
18:05:55.011518 IP 192.168.1.30.41314 > 192.168.1.10.6633: Flags [.], seq 20273:23169, ack 0, win 123, options [nop,nop,TS val 3923604 ecr 349062], length 2896: OpenFlow
	version unknown (0x00), type 0x00, length 0, xid 0xffffffff (corrupt)
18:05:55.011534 IP 192.168.1.30.41314 > 192.168.1.10.6633: Flags [.], seq 23169:26065, ack 0, win 123, options [nop,nop,TS val 3923604 ecr 349062], length 2896: OpenFlow
	version unknown (0x69), type 0xc7, length 62232, xid 0xd186dd60 [|openflow]
18:05:55.011543 IP 192.168.1.30.41314 > 192.168.1.10.6633: Flags [.], seq 26065:28961, ack 0, win 123, options [nop,nop,TS val 3923604 ecr 349062], length 2896: OpenFlow
	version unknown (0x00), type 0x00, length 20585, xid 0xc7fffef3 [|openflow]
18:05:55.011554 IP 192.168.1.30.41314 > 192.168.1.10.6633: Flags [.], seq 28961:31857, ack 0, win 123, options [nop,nop,TS val 3923604 ecr 349062], length 2896: OpenFlow
	version unknown (0x00), type 0x00, length 0, xid 0xfb14e914 (corrupt)
18:05:55.011569 IP 192.168.1.30.41314 > 192.168.1.10.6633: Flags [.], seq 31857:34753, ack 0, win 123, options [nop,nop,TS val 3923604 ecr 349062], length 2896: OpenFlow
	version unknown (0x00), type 0x00, length 0, xid 0x055f6970 (corrupt)
18:05:55.055419 IP 192.168.1.10.6633 > 192.168.1.30.41314: Flags [.], ack 34753, win 3071, options [nop,nop,TS val 349072 ecr 3923604], length 0
18:05:55.056005 IP 192.168.1.30.41314 > 192.168.1.10.6633: Flags [.], seq 34753:37649, ack 0, win 123, options [nop,nop,TS val 3923615 ecr 349072], length 2896: OpenFlow
	version unknown (0x00), type 0x00, length 3072, xid 0x01045f69 [|openflow]
18:05:55.056018 IP 192.168.1.30.41314 > 192.168.1.10.6633: Flags [.], seq 37649:40545, ack 0, win 123, options [nop,nop,TS val 3923615 ecr 349072], length 2896: OpenFlow
	version unknown (0x00), type 0x00, length 255, xid 0xffffff00
	version unknown (0xff), type 0xff, length 107, xid 0x00020100
	version unknown (0x70), type 0x70, length 49170, xid 0x000c0001 [|openflow]
18:05:55.056027 IP 192.168.1.30.41314 > 192.168.1.10.6633: Flags [.], seq 40545:43441, ack 0, win 123, options [nop,nop,TS val 3923615 ecr 349072], length 2896: OpenFlow
	version unknown (0xc7), type 0xf3, length 6353, xid 0x86dd6000 [|openflow]
18:05:55.056037 IP 192.168.1.30.41314 > 192.168.1.10.6633: Flags [.], seq 43441:46337, ack 0, win 123, options [nop,nop,TS val 3923615 ecr 349072], length 2896: OpenFlow
	version unknown (0x00), type 0x50, length 27079, xid 0xfffef318 [|openflow]
18:05:55.056046 IP 192.168.1.30.41314 > 192.168.1.10.6633: Flags [.], seq 46337:49233, ack 0, win 123, options [nop,nop,TS val 3923615 ecr 349072], length 2896: OpenFlow
	version unknown (0x00), type 0x00, length 251, xid 0x14e914e9
	version unknown (0x00), type 0x00, length 64276, xid 0xe914e900 [|openflow]
18:05:55.056056 IP 192.168.1.30.41314 > 192.168.1.10.6633: Flags [.], seq 49233:52129, ack 0, win 123, options [nop,nop,TS val 3923615 ecr 349072], length 2896: OpenFlow
	version unknown (0x00), type 0x00, length 5, xid 0x5f697070 (corrupt)
18:05:55.056067 IP 192.168.1.30.41314 > 192.168.1.10.6633: Flags [.], seq 52129:55025, ack 0, win 123, options [nop,nop,TS val 3923615 ecr 349072], length 2896: OpenFlow
	version unknown (0x00), type 0x0c, length 1, xid 0x045f6970 (corrupt)
18:05:55.056077 IP 192.168.1.30.41314 > 192.168.1.10.6633: Flags [.], seq 55025:57921, ack 0, win 123, options [nop,nop,TS val 3923615 ecr 349072], length 2896: OpenFlow
	version unknown (0x00), type 0x00, length 65535, xid 0xffff006b [|openflow]
18:05:55.056087 IP 192.168.1.30.41314 > 192.168.1.10.6633: Flags [.], seq 57921:60817, ack 0, win 123, options [nop,nop,TS val 3923615 ecr 349072], length 2896: OpenFlow
	version unknown (0xf3), type 0x18, length 53638, xid 0xdd600000 [|openflow]
18:05:55.056100 IP 192.168.1.30.41314 > 192.168.1.10.6633: Flags [.], seq 60817:63713, ack 0, win 123, options [nop,nop,TS val 3923615 ecr 349072], length 2896: OpenFlow
	version unknown (0x50), type 0x69, length 51199, xid 0xfef318d1 [|openflow]
18:05:55.056108 IP 192.168.1.30.41314 > 192.168.1.10.6633: Flags [.], seq 63713:66609, ack 0, win 123, options [nop,nop,TS val 3923615 ecr 349072], length 2896: OpenFlow
	version unknown (0x00), type 0x00, length 64276, xid 0xe914e900 [|openflow]
18:05:55.056118 IP 192.168.1.30.41314 > 192.168.1.10.6633: Flags [.], seq 66609:69505, ack 0, win 123, options [nop,nop,TS val 3923615 ecr 349072], length 2896: OpenFlow
	version unknown (0x00), type 0x00, length 1375, xid 0x69707073
	version unknown (0x00), type 0x00, length 1375, xid 0x69707073
	version unknown (0x00), type 0x00, length 1375, xid 0x69707073 [|openflow]
18:05:55.093383 IP 192.168.1.30.41314 > 192.168.1.10.6633: Flags [.], seq 69505:70953, ack 0, win 123, options [nop,nop,TS val 3923624 ecr 349072], length 1448: OpenFlow
	version unknown (0x0c), type 0x00, length 260, xid 0x5f697070
	version unknown (0x00), type 0x0c, length 1, xid 0x010a007d (corrupt)
18:05:55.097796 IP 192.168.1.10.6633 > 192.168.1.30.41314: Flags [.], ack 69505, win 2889, options [nop,nop,TS val 349083 ecr 3923615], length 0
18:05:55.097818 IP 192.168.1.30.41314 > 192.168.1.10.6633: Flags [.], seq 70953:72401, ack 0, win 123, options [nop,nop,TS val 3923626 ecr 349083], length 1448: OpenFlow
	version unknown (0x00), type 0x00, length 0, xid 0x00000000 (corrupt)
18:05:55.098136 IP 192.168.1.30.41314 > 192.168.1.10.6633: Flags [.], seq 72401:75297, ack 0, win 123, options [nop,nop,TS val 3923626 ecr 349083], length 2896: OpenFlow
	version unknown (0x00), type 0xff, length 65535, xid 0xff006b00 [|openflow]
18:05:55.098154 IP 192.168.1.30.41314 > 192.168.1.10.6633: Flags [.], seq 75297:78193, ack 0, win 123, options [nop,nop,TS val 3923626 ecr 349083], length 2896: OpenFlow
	version unknown (0x18), type 0xd1, length 34525, xid 0x60000000 [|openflow]
18:05:55.098166 IP 192.168.1.30.41314 > 192.168.1.10.6633: Flags [.], seq 78193:81089, ack 0, win 123, options [nop,nop,TS val 3923626 ecr 349083], length 2896: OpenFlow
	version unknown (0x69), type 0xc7, length 65534, xid 0xf318d1ff [|openflow]
18:05:55.098174 IP 192.168.1.30.41314 > 192.168.1.10.6633: Flags [.], seq 81089:83985, ack 0, win 123, options [nop,nop,TS val 3923626 ecr 349083], length 2896: OpenFlow
	version unknown (0x00), type 0xfb, length 5353, xid 0x14e90035 [|openflow]
18:05:55.098182 IP 192.168.1.30.41314 > 192.168.1.10.6633: Flags [.], seq 83985:86881, ack 0, win 123, options [nop,nop,TS val 3923626 ecr 349083], length 2896: OpenFlow
	version unknown (0x00), type 0x05, length 24425, xid 0x70707304 [|openflow]
18:05:55.098190 IP 192.168.1.30.41314 > 192.168.1.10.6633: Flags [.], seq 86881:89777, ack 0, win 123, options [nop,nop,TS val 3923626 ecr 349083], length 2896: OpenFlow
	version unknown (0x00), type 0x01, length 1119, xid 0x697070c0
	version unknown (0x63), type 0x61, length 27648, xid 0x000c0001 [|openflow]
18:05:55.098198 IP 192.168.1.30.41314 > 192.168.1.10.6633: Flags [.], seq 89777:92673, ack 0, win 123, options [nop,nop,TS val 3923626 ecr 349083], length 2896: OpenFlow
	version unknown (0xff), type 0xff, length 65535, xid 0x006b0003 [|openflow]
18:05:55.098205 IP 192.168.1.30.41314 > 192.168.1.10.6633: Flags [.], seq 92673:95569, ack 0, win 123, options [nop,nop,TS val 3923626 ecr 349083], length 2896: OpenFlow
	version unknown (0xd1), type 0x86, length 56672, xid 0x00000000 [|openflow]
18:05:55.098213 IP 192.168.1.30.41314 > 192.168.1.10.6633: Flags [.], seq 95569:98465, ack 0, win 123, options [nop,nop,TS val 3923626 ecr 349083], length 2896: OpenFlow
	version unknown (0xc7), type 0xff, length 65267, xid 0x18d1ff02 [|openflow]
18:05:55.098253 IP 192.168.1.30.41314 > 192.168.1.10.6633: Flags [.], seq 98465:101361, ack 0, win 123, options [nop,nop,TS val 3923626 ecr 349083], length 2896: OpenFlow
	version unknown (0xfb), type 0x14, length 59668, xid 0xe90035a5 [|openflow]
18:05:55.098266 IP 192.168.1.30.41314 > 192.168.1.10.6633: Flags [.], seq 101361:104257, ack 0, win 123, options [nop,nop,TS val 3923626 ecr 349083], length 2896: OpenFlow
	version unknown (0x05), type 0x5f, length 26992, xid 0x7073045f [|openflow]
18:05:55.139050 IP 192.168.1.10.6633 > 192.168.1.30.41314: Flags [.], ack 104257, win 2707, options [nop,nop,TS val 349094 ecr 3923624], length 0
18:05:55.139072 IP 192.168.1.30.41314 > 192.168.1.10.6633: Flags [.], seq 104257:107153, ack 0, win 123, options [nop,nop,TS val 3923636 ecr 349094], length 2896: OpenFlow
	version 1.0, type VENDOR, length 24425, xid 0x7070c012 [|openflow]
18:05:55.139085 IP 192.168.1.30.41314 > 192.168.1.10.6633: Flags [.], seq 107153:110049, ack 0, win 123, options [nop,nop,TS val 3923636 ecr 349094], length 2896: OpenFlow
	version unknown (0xff), type 0xff, length 65280, xid 0x6b000201 [|openflow]
18:05:55.139108 IP 192.168.1.30.41314 > 192.168.1.10.6633: Flags [.], seq 110049:112945, ack 0, win 123, options [nop,nop,TS val 3923636 ecr 349094], length 2896: OpenFlow
	version unknown (0x86), type 0xdd, length 24576, xid 0x00000035 [|openflow]
18:05:55.139119 IP 192.168.1.30.41314 > 192.168.1.10.6633: Flags [.], seq 112945:115841, ack 0, win 123, options [nop,nop,TS val 3923636 ecr 349094], length 2896: OpenFlow
	version unknown (0xff), type 0xfe, length 62232, xid 0xd1ff0200 [|openflow]
18:05:55.139131 IP 192.168.1.30.41314 > 192.168.1.10.6633: Flags [.], seq 115841:118737, ack 0, win 123, options [nop,nop,TS val 3923636 ecr 349094], length 2896: OpenFlow
	version unknown (0x14), type 0xe9, length 5353, xid 0x0035a58a [|openflow]
18:05:55.139141 IP 192.168.1.30.41314 > 192.168.1.10.6633: Flags [.], seq 118737:121633, ack 0, win 123, options [nop,nop,TS val 3923636 ecr 349094], length 2896: OpenFlow
	version unknown (0x5f), type 0x69, length 28784, xid 0x73045f74 [|openflow]
18:05:55.139151 IP 192.168.1.30.41314 > 192.168.1.10.6633: Flags [.], seq 121633:124529, ack 0, win 123, options [nop,nop,TS val 3923636 ecr 349094], length 2896: OpenFlow
	version unknown (0x04), type 0x5f, length 26992, xid 0x70c01200 [|openflow]
18:05:55.139163 IP 192.168.1.30.41314 > 192.168.1.10.6633: Flags [.], seq 124529:127425, ack 0, win 123, options [nop,nop,TS val 3923636 ecr 349094], length 2896: OpenFlow
	version unknown (0xff), type 0xff, length 107, xid 0x00020100
	version unknown (0x70), type 0x70, length 49170, xid 0x000c0001 [|openflow]
18:05:55.139175 IP 192.168.1.30.41314 > 192.168.1.10.6633: Flags [.], seq 127425:130321, ack 0, win 123, options [nop,nop,TS val 3923636 ecr 349094], length 2896: OpenFlow
	version unknown (0xdd), type 0x60, length 0, xid 0x00003511 (corrupt)
18:05:55.139347 IP 192.168.1.30.41314 > 192.168.1.10.6633: Flags [.], seq 130321:133217, ack 0, win 123, options [nop,nop,TS val 3923636 ecr 349094], length 2896: OpenFlow
	version unknown (0xfe), type 0xf3, length 6353, xid 0xff020000 [|openflow]
18:05:55.139360 IP 192.168.1.30.41314 > 192.168.1.10.6633: Flags [.], seq 133217:136113, ack 0, win 123, options [nop,nop,TS val 3923636 ecr 349094], length 2896: OpenFlow
	version unknown (0xe9), type 0x14, length 59648, xid 0x35a58a00 [|openflow]
18:05:55.139370 IP 192.168.1.30.41314 > 192.168.1.10.6633: Flags [.], seq 136113:139009, ack 0, win 123, options [nop,nop,TS val 3923636 ecr 349094], length 2896: OpenFlow
	version unknown (0x69), type 0x70, length 28787, xid 0x045f7463 [|openflow]
18:05:55.168290 IP 192.168.1.10.6633 > 192.168.1.30.41314: Flags [.], ack 139009, win 2853, options [nop,nop,TS val 349101 ecr 3923636], length 0
18:05:55.168322 IP 192.168.1.30.41314 > 192.168.1.10.6633: Flags [.], seq 139009:141905, ack 0, win 123, options [nop,nop,TS val 3923643 ecr 349101], length 2896: OpenFlow
	version unknown (0x5f), type 0x69, length 28784, xid 0xc012000c [|openflow]
18:05:55.168362 IP 192.168.1.30.41314 > 192.168.1.10.6633: Flags [.], seq 141905:144801, ack 0, win 123, options [nop,nop,TS val 3923643 ecr 349101], length 2896: OpenFlow
	version unknown (0xff), type 0x00, length 27392, xid 0x01010033 [|openflow]
18:05:55.168373 IP 192.168.1.30.41314 > 192.168.1.10.6633: Flags [.], seq 144801:146249, ack 0, win 123, options [nop,nop,TS val 3923643 ecr 349101], length 1448: OpenFlow
	version unknown (0x60), type 0x00, length 0, xid 0x003511ff (corrupt)
18:05:55.168381 IP 192.168.1.30.41314 > 192.168.1.10.6633: Flags [P.], seq 146249:146894, ack 0, win 123, options [nop,nop,TS val 3923643 ecr 349101], length 645: OpenFlow
	version unknown (0x6f), type 0x63, length 24940, xid 0x00000c00 [|openflow]
18:05:55.170110 IP 192.168.1.10.6633 > 192.168.1.30.41314: Flags [.], ack 146894, win 3247, options [nop,nop,TS val 349102 ecr 3923643], length 0
18:05:55.227881 IP 192.168.1.30.41314 > 192.168.1.10.6633: Flags [P.], seq 146894:147019, ack 0, win 123, options [nop,nop,TS val 3923658 ecr 349102], length 125: OpenFlow
	version 1.0, type PACKET_IN, length 125, xid 0x00000000
18:05:55.227923 IP 192.168.1.30.41314 > 192.168.1.10.6633: Flags [P.], seq 147019:147144, ack 0, win 123, options [nop,nop,TS val 3923658 ecr 349102], length 125: OpenFlow
	version 1.0, type PACKET_IN, length 125, xid 0x00000000
18:05:55.227958 IP 192.168.1.30.41314 > 192.168.1.10.6633: Flags [P.], seq 147144:147269, ack 0, win 123, options [nop,nop,TS val 3923658 ecr 349102], length 125: OpenFlow
	version 1.0, type PACKET_IN, length 125, xid 0x00000000
18:05:55.227992 IP 192.168.1.30.41314 > 192.168.1.10.6633: Flags [P.], seq 147269:147394, ack 0, win 123, options [nop,nop,TS val 3923658 ecr 349102], length 125: OpenFlow
	version 1.0, type PACKET_IN, length 125, xid 0x00000000
18:05:55.228026 IP 192.168.1.30.41314 > 192.168.1.10.6633: Flags [P.], seq 147394:147519, ack 0, win 123, options [nop,nop,TS val 3923658 ecr 349102], length 125: OpenFlow
	version 1.0, type PACKET_IN, length 125, xid 0x00000000
18:05:55.228059 IP 192.168.1.30.41314 > 192.168.1.10.6633: Flags [P.], seq 147519:147644, ack 0, win 123, options [nop,nop,TS val 3923658 ecr 349102], length 125: OpenFlow
	version 1.0, type PACKET_IN, length 125, xid 0x00000000
18:05:55.228098 IP 192.168.1.30.41314 > 192.168.1.10.6633: Flags [P.], seq 147644:147769, ack 0, win 123, options [nop,nop,TS val 3923658 ecr 349102], length 125: OpenFlow
	version 1.0, type PACKET_IN, length 125, xid 0x00000000
18:05:55.228130 IP 192.168.1.30.41314 > 192.168.1.10.6633: Flags [P.], seq 147769:147894, ack 0, win 123, options [nop,nop,TS val 3923658 ecr 349102], length 125: OpenFlow
	version 1.0, type PACKET_IN, length 125, xid 0x00000000
18:05:55.228259 IP 192.168.1.30.41314 > 192.168.1.10.6633: Flags [P.], seq 147894:148019, ack 0, win 123, options [nop,nop,TS val 3923658 ecr 349102], length 125: OpenFlow
	version 1.0, type PACKET_IN, length 125, xid 0x00000000
18:05:55.228296 IP 192.168.1.30.41314 > 192.168.1.10.6633: Flags [P.], seq 148019:148144, ack 0, win 123, options [nop,nop,TS val 3923658 ecr 349102], length 125: OpenFlow
	version 1.0, type PACKET_IN, length 125, xid 0x00000000
18:05:55.228329 IP 192.168.1.30.41314 > 192.168.1.10.6633: Flags [P.], seq 148144:148269, ack 0, win 123, options [nop,nop,TS val 3923658 ecr 349102], length 125: OpenFlow
	version 1.0, type PACKET_IN, length 125, xid 0x00000000
18:05:55.228360 IP 192.168.1.30.41314 > 192.168.1.10.6633: Flags [P.], seq 148269:148394, ack 0, win 123, options [nop,nop,TS val 3923658 ecr 349102], length 125: OpenFlow
	version 1.0, type PACKET_IN, length 125, xid 0x00000000
18:05:55.228389 IP 192.168.1.30.41314 > 192.168.1.10.6633: Flags [P.], seq 148394:148519, ack 0, win 123, options [nop,nop,TS val 3923658 ecr 349102], length 125: OpenFlow
	version 1.0, type PACKET_IN, length 125, xid 0x00000000
18:05:55.228428 IP 192.168.1.30.41314 > 192.168.1.10.6633: Flags [P.], seq 148519:148644, ack 0, win 123, options [nop,nop,TS val 3923658 ecr 349102], length 125: OpenFlow
	version 1.0, type PACKET_IN, length 125, xid 0x00000000
18:05:55.228479 IP 192.168.1.30.41314 > 192.168.1.10.6633: Flags [P.], seq 148644:148769, ack 0, win 123, options [nop,nop,TS val 3923658 ecr 349102], length 125: OpenFlow
	version 1.0, type PACKET_IN, length 125, xid 0x00000000
18:05:55.228512 IP 192.168.1.30.41314 > 192.168.1.10.6633: Flags [P.], seq 148769:148894, ack 0, win 123, options [nop,nop,TS val 3923658 ecr 349102], length 125: OpenFlow
	version 1.0, type PACKET_IN, length 125, xid 0x00000000
18:05:55.228550 IP 192.168.1.30.41314 > 192.168.1.10.6633: Flags [P.], seq 148894:149019, ack 0, win 123, options [nop,nop,TS val 3923658 ecr 349102], length 125: OpenFlow
	version 1.0, type PACKET_IN, length 125, xid 0x00000000
18:05:55.228579 IP 192.168.1.30.41314 > 192.168.1.10.6633: Flags [P.], seq 149019:149144, ack 0, win 123, options [nop,nop,TS val 3923658 ecr 349102], length 125: OpenFlow
	version 1.0, type PACKET_IN, length 125, xid 0x00000000
18:05:55.228611 IP 192.168.1.30.41314 > 192.168.1.10.6633: Flags [P.], seq 149144:149269, ack 0, win 123, options [nop,nop,TS val 3923658 ecr 349102], length 125: OpenFlow
	version 1.0, type PACKET_IN, length 125, xid 0x00000000
18:05:55.228643 IP 192.168.1.30.41314 > 192.168.1.10.6633: Flags [P.], seq 149269:149394, ack 0, win 123, options [nop,nop,TS val 3923658 ecr 349102], length 125: OpenFlow
	version 1.0, type PACKET_IN, length 125, xid 0x00000000
18:05:55.228677 IP 192.168.1.30.41314 > 192.168.1.10.6633: Flags [P.], seq 149394:149519, ack 0, win 123, options [nop,nop,TS val 3923658 ecr 349102], length 125: OpenFlow
	version 1.0, type PACKET_IN, length 125, xid 0x00000000
18:05:55.228696 IP 192.168.1.30.41314 > 192.168.1.10.6633: Flags [P.], seq 149519:149644, ack 0, win 123, options [nop,nop,TS val 3923658 ecr 349102], length 125: OpenFlow
	version 1.0, type PACKET_IN, length 125, xid 0x00000000
18:05:55.228721 IP 192.168.1.30.41314 > 192.168.1.10.6633: Flags [P.], seq 149644:149769, ack 0, win 123, options [nop,nop,TS val 3923658 ecr 349102], length 125: OpenFlow
	version 1.0, type PACKET_IN, length 125, xid 0x00000000
18:05:55.228740 IP 192.168.1.30.41314 > 192.168.1.10.6633: Flags [P.], seq 149769:149894, ack 0, win 123, options [nop,nop,TS val 3923658 ecr 349102], length 125: OpenFlow
	version 1.0, type PACKET_IN, length 125, xid 0x00000000
18:05:55.228758 IP 192.168.1.30.41314 > 192.168.1.10.6633: Flags [P.], seq 149894:150019, ack 0, win 123, options [nop,nop,TS val 3923658 ecr 349102], length 125: OpenFlow
	version 1.0, type PACKET_IN, length 125, xid 0x00000000
18:05:55.233610 IP 192.168.1.10.6633 > 192.168.1.30.41314: Flags [.], ack 148394, win 3747, options [nop,nop,TS val 349117 ecr 3923658], length 0
18:05:55.233644 IP 192.168.1.30.41314 > 192.168.1.10.6633: Flags [.], seq 150019:152915, ack 0, win 123, options [nop,nop,TS val 3923660 ecr 349117], length 2896: OpenFlow
	version 1.0, type PACKET_IN, length 125, xid 0x00000000
	version 1.0, type PACKET_IN, length 125, xid 0x00000000
	version 1.0, type PACKET_IN, length 125, xid 0x00000000
	version 1.0, type PACKET_IN, length 125, xid 0x00000000
	version 1.0, type PACKET_IN, length 125, xid 0x00000000
	version 1.0, type PACKET_IN, length 125, xid 0x00000000
	version 1.0, type PACKET_IN, length 125, xid 0x00000000
	version 1.0, type PACKET_IN, length 125, xid 0x00000000
	version 1.0, type PACKET_IN, length 125, xid 0x00000000
	version 1.0, type PACKET_IN, length 125, xid 0x00000000
	version 1.0, type PACKET_IN, length 125, xid 0x00000000
	version 1.0, type PACKET_IN, length 125, xid 0x00000000
	version 1.0, type PACKET_IN, length 125, xid 0x00000000
	version 1.0, type PACKET_IN, length 125, xid 0x00000000
	version 1.0, type PACKET_IN, length 125, xid 0x00000000
	version 1.0, type PACKET_IN, length 125, xid 0x00000000
	version 1.0, type PACKET_IN, length 125, xid 0x00000000
	version 1.0, type PACKET_IN, length 125, xid 0x00000000
	version 1.0, type PACKET_IN, length 125, xid 0x00000000
	version 1.0, type PACKET_IN, length 125, xid 0x00000000
	version 1.0, type PACKET_IN, length 125, xid 0x00000000
	version 1.0, type PACKET_IN, length 125, xid 0x00000000
	version 1.0, type PACKET_IN, length 125, xid 0x00000000
	version 1.0, type PACKET_IN, length 125, xid 0x00000000 [|openflow]
18:05:55.233654 IP 192.168.1.30.41314 > 192.168.1.10.6633: Flags [.], seq 152915:155811, ack 0, win 123, options [nop,nop,TS val 3923660 ecr 349117], length 2896: OpenFlow
	version unknown (0x00), type 0x00, length 64338, xid 0x69c7f318 [|openflow]
18:05:55.233664 IP 192.168.1.30.41314 > 192.168.1.10.6633: Flags [.], seq 155811:158707, ack 0, win 123, options [nop,nop,TS val 3923660 ecr 349117], length 2896: OpenFlow
	version unknown (0x00), type 0x00, length 0, xid 0x00005069 (corrupt)
18:05:55.233674 IP 192.168.1.30.41314 > 192.168.1.10.6633: Flags [.], seq 158707:161603, ack 0, win 123, options [nop,nop,TS val 3923660 ecr 349117], length 2896: OpenFlow
	version unknown (0x00), type 0x00, length 0, xid 0x00000000 (corrupt)
18:05:55.233684 IP 192.168.1.10.6633 > 192.168.1.30.41314: Flags [.], ack 149894, win 3747, options [nop,nop,TS val 349117 ecr 3923658], length 0
18:05:55.233696 IP 192.168.1.30.41314 > 192.168.1.10.6633: Flags [.], seq 161603:164499, ack 0, win 123, options [nop,nop,TS val 3923660 ecr 349117], length 2896: OpenFlow
	version unknown (0x00), type 0x02, length 0, xid 0x00000000 (corrupt)
18:05:55.233706 IP 192.168.1.30.41314 > 192.168.1.10.6633: Flags [.], seq 164499:167395, ack 0, win 123, options [nop,nop,TS val 3923660 ecr 349117], length 2896: OpenFlow
	version unknown (0x6f), type 0x63, length 24940, xid 0x00000c00 [|openflow]
18:05:55.233720 IP 192.168.1.10.6633 > 192.168.1.30.41314: Flags [.], ack 150019, win 3747, options [nop,nop,TS val 349117 ecr 3923658], length 0
18:05:55.233791 IP 192.168.1.30.41314 > 192.168.1.10.6633: Flags [.], seq 167395:170291, ack 0, win 123, options [nop,nop,TS val 3923660 ecr 349117], length 2896: OpenFlow
	version unknown (0x0a), type 0x00, length 32000, xid 0x000000ff [|openflow]
18:05:55.233809 IP 192.168.1.30.41314 > 192.168.1.10.6633: Flags [.], seq 170291:173187, ack 0, win 123, options [nop,nop,TS val 3923660 ecr 349117], length 2896: OpenFlow
	version unknown (0x00), type 0xfb, length 21097, xid 0xc7f318d1 [|openflow]
18:05:55.233819 IP 192.168.1.30.41314 > 192.168.1.10.6633: Flags [.], seq 173187:176083, ack 0, win 123, options [nop,nop,TS val 3923660 ecr 349117], length 2896: OpenFlow
	version unknown (0x00), type 0x00, length 0, xid 0x005069c7 (corrupt)
18:05:55.233829 IP 192.168.1.30.41314 > 192.168.1.10.6633: Flags [.], seq 176083:178979, ack 0, win 123, options [nop,nop,TS val 3923660 ecr 349117], length 2896: OpenFlow
	version unknown (0x00), type 0x00, length 0, xid 0x000000fb (corrupt)
18:05:55.233844 IP 192.168.1.30.41314 > 192.168.1.10.6633: Flags [.], seq 178979:181875, ack 0, win 123, options [nop,nop,TS val 3923660 ecr 349117], length 2896: OpenFlow
	version unknown (0x02), type 0x00, length 0, xid 0x00000005 (corrupt)
18:05:55.233857 IP 192.168.1.30.41314 > 192.168.1.10.6633: Flags [.], seq 181875:184771, ack 0, win 123, options [nop,nop,TS val 3923660 ecr 349117], length 2896: OpenFlow
	version unknown (0x63), type 0x61, length 27648, xid 0x000c0001 [|openflow]
18:05:55.235973 IP 192.168.1.10.6633 > 192.168.1.30.41314: Flags [.], ack 184771, win 3747, options [nop,nop,TS val 349118 ecr 3923660], length 0
18:05:55.236309 IP 192.168.1.30.41314 > 192.168.1.10.6633: Flags [.], seq 184771:187667, ack 0, win 123, options [nop,nop,TS val 3923660 ecr 349118], length 2896: OpenFlow
	version unknown (0x00), type 0x7d, length 0, xid 0x0000ffff (corrupt)
18:05:55.236323 IP 192.168.1.30.41314 > 192.168.1.10.6633: Flags [.], seq 187667:190563, ack 0, win 123, options [nop,nop,TS val 3923660 ecr 349118], length 2896: OpenFlow
	version unknown (0xfb), type 0x52, length 27079, xid 0xf318d186 [|openflow]
18:05:55.236337 IP 192.168.1.30.41314 > 192.168.1.10.6633: Flags [.], seq 190563:193459, ack 0, win 123, options [nop,nop,TS val 3923660 ecr 349118], length 2896: OpenFlow
	version unknown (0x00), type 0x00, length 0, xid 0x5069c7ff (corrupt)
18:05:55.236357 IP 192.168.1.30.41314 > 192.168.1.10.6633: Flags [.], seq 193459:196355, ack 0, win 123, options [nop,nop,TS val 3923660 ecr 349118], length 2896: OpenFlow
	version unknown (0x00), type 0x00, length 0, xid 0x0000fb14 (corrupt)
18:05:55.236372 IP 192.168.1.30.41314 > 192.168.1.10.6633: Flags [.], seq 196355:199251, ack 0, win 123, options [nop,nop,TS val 3923660 ecr 349118], length 2896: OpenFlow
	version unknown (0x00), type 0x00, length 0, xid 0x0000055f (corrupt)
18:05:55.236385 IP 192.168.1.30.41314 > 192.168.1.10.6633: Flags [.], seq 199251:202147, ack 0, win 123, options [nop,nop,TS val 3923660 ecr 349118], length 2896: OpenFlow
	version unknown (0x61), type 0x6c, length 0, xid 0x0c000104 (corrupt)
18:05:55.236395 IP 192.168.1.30.41314 > 192.168.1.10.6633: Flags [.], seq 202147:205043, ack 0, win 123, options [nop,nop,TS val 3923660 ecr 349118], length 2896: OpenFlow
	version unknown (0x7d), type 0x00, length 0, xid 0x00ffffff (corrupt)
18:05:55.236405 IP 192.168.1.30.41314 > 192.168.1.10.6633: Flags [.], seq 205043:207939, ack 0, win 123, options [nop,nop,TS val 3923660 ecr 349118], length 2896: OpenFlow
	version unknown (0x52), type 0x69, length 51187, xid 0x18d186dd [|openflow]
18:05:55.236414 IP 192.168.1.30.41314 > 192.168.1.10.6633: Flags [.], seq 207939:210835, ack 0, win 123, options [nop,nop,TS val 3923660 ecr 349118], length 2896: OpenFlow
	version unknown (0x00), type 0x00, length 80, xid 0x69c7fffe
	version 1.0, type PACKET_IN, length 125, xid 0x00000000
	version 1.0, type PACKET_IN, length 125, xid 0x00000000
	version 1.0, type PACKET_IN, length 125, xid 0x00000000
	version 1.0, type PACKET_IN, length 125, xid 0x00000000
	version 1.0, type PACKET_IN, length 125, xid 0x00000000
	version 1.0, type PACKET_IN, length 125, xid 0x00000000
	version 1.0, type PACKET_IN, length 125, xid 0x00000000
	version 1.0, type PACKET_IN, length 125, xid 0x00000000
	version 1.0, type PACKET_IN, length 125, xid 0x00000000
	version 1.0, type PACKET_IN, length 125, xid 0x00000000
	version 1.0, type PACKET_IN, length 125, xid 0x00000000
	version 1.0, type PACKET_IN, length 125, xid 0x00000000
	version 1.0, type PACKET_IN, length 125, xid 0x00000000
	version 1.0, type PACKET_IN, length 125, xid 0x00000000
	version 1.0, type PACKET_IN, length 125, xid 0x00000000
	version 1.0, type PACKET_IN, length 125, xid 0x00000000
	version 1.0, type PACKET_IN, length 125, xid 0x00000000
	version 1.0, type PACKET_IN, length 125, xid 0x00000000
	version 1.0, type PACKET_IN, length 125, xid 0x00000000
	version 1.0, type PACKET_IN, length 125, xid 0x00000000
	version 1.0, type PACKET_IN, length 125, xid 0x00000000
	version 1.0, type PACKET_IN, length 125, xid 0x00000000
	version 1.0, type PACKET_IN, length 125, xid 0x00000000 [|openflow]
18:05:55.236424 IP 192.168.1.30.41314 > 192.168.1.10.6633: Flags [.], seq 210835:213731, ack 0, win 123, options [nop,nop,TS val 3923660 ecr 349118], length 2896: OpenFlow
	version unknown (0x00), type 0x00, length 0, xid 0x00fb14e9 (corrupt)
18:05:55.236433 IP 192.168.1.30.41314 > 192.168.1.10.6633: Flags [.], seq 213731:216627, ack 0, win 123, options [nop,nop,TS val 3923660 ecr 349118], length 2896: OpenFlow
	version unknown (0x00), type 0x00, length 0, xid 0x00055f69 (corrupt)
18:05:55.236443 IP 192.168.1.30.41314 > 192.168.1.10.6633: Flags [.], seq 216627:219523, ack 0, win 123, options [nop,nop,TS val 3923660 ecr 349118], length 2896: OpenFlow
	version unknown (0x6c), type 0x00, length 12, xid 0x0001045f
	version unknown (0x12), type 0x00, length 3072, xid 0x01010a00 [|openflow]
18:05:55.238896 IP 192.168.1.10.6633 > 192.168.1.30.41314: Flags [.], ack 219523, win 3747, options [nop,nop,TS val 349118 ecr 3923660], length 0
18:05:55.238919 IP 192.168.1.30.41314 > 192.168.1.10.6633: Flags [.], seq 219523:222419, ack 0, win 123, options [nop,nop,TS val 3923661 ecr 349118], length 2896: OpenFlow
	version unknown (0x00), type 0x00, length 0, xid 0xffffffff (corrupt)
18:05:55.238934 IP 192.168.1.30.41314 > 192.168.1.10.6633: Flags [.], seq 222419:225315, ack 0, win 123, options [nop,nop,TS val 3923661 ecr 349118], length 2896: OpenFlow
	version unknown (0x69), type 0xc7, length 62232, xid 0xd186dd60 [|openflow]
18:05:55.238948 IP 192.168.1.30.41314 > 192.168.1.10.6633: Flags [.], seq 225315:228211, ack 0, win 123, options [nop,nop,TS val 3923661 ecr 349118], length 2896: OpenFlow
	version unknown (0x00), type 0x00, length 20585, xid 0xc7fffef3 [|openflow]
18:05:55.238961 IP 192.168.1.30.41314 > 192.168.1.10.6633: Flags [.], seq 228211:231107, ack 0, win 123, options [nop,nop,TS val 3923661 ecr 349118], length 2896: OpenFlow
	version unknown (0x00), type 0x00, length 0, xid 0xfb14e914 (corrupt)
18:05:55.238974 IP 192.168.1.30.41314 > 192.168.1.10.6633: Flags [.], seq 231107:234003, ack 0, win 123, options [nop,nop,TS val 3923661 ecr 349118], length 2896: OpenFlow
	version unknown (0x00), type 0x00, length 0, xid 0x055f6970 (corrupt)
18:05:55.238988 IP 192.168.1.30.41314 > 192.168.1.10.6633: Flags [.], seq 234003:236899, ack 0, win 123, options [nop,nop,TS val 3923661 ecr 349118], length 2896: OpenFlow
	version unknown (0x00), type 0x00, length 3072, xid 0x01045f69 [|openflow]
18:05:55.239002 IP 192.168.1.30.41314 > 192.168.1.10.6633: Flags [.], seq 236899:239795, ack 0, win 123, options [nop,nop,TS val 3923661 ecr 349118], length 2896: OpenFlow
	version unknown (0x00), type 0x00, length 255, xid 0xffffff00
	version unknown (0xff), type 0xff, length 107, xid 0x00020100
	version unknown (0x70), type 0x70, length 49170, xid 0x000c0001 [|openflow]
18:05:55.239139 IP 192.168.1.10.6633 > 192.168.1.30.41314: Flags [.], ack 228211, win 3747, options [nop,nop,TS val 349119 ecr 3923661], length 0
18:05:55.239214 IP 192.168.1.30.41314 > 192.168.1.10.6633: Flags [.], seq 239795:242691, ack 0, win 123, options [nop,nop,TS val 3923661 ecr 349118], length 2896: OpenFlow
	version unknown (0xc7), type 0xf3, length 6353, xid 0x86dd6000 [|openflow]
18:05:55.239233 IP 192.168.1.30.41314 > 192.168.1.10.6633: Flags [.], seq 242691:245587, ack 0, win 123, options [nop,nop,TS val 3923661 ecr 349118], length 2896: OpenFlow
	version unknown (0x00), type 0x50, length 27079, xid 0xfffef318 [|openflow]
18:05:55.239247 IP 192.168.1.30.41314 > 192.168.1.10.6633: Flags [.], seq 245587:248483, ack 0, win 123, options [nop,nop,TS val 3923661 ecr 349118], length 2896: OpenFlow
	version unknown (0x00), type 0x00, length 251, xid 0x14e914e9
	version unknown (0x00), type 0x00, length 64276, xid 0xe914e900 [|openflow]
18:05:55.239263 IP 192.168.1.30.41314 > 192.168.1.10.6633: Flags [.], seq 248483:251379, ack 0, win 123, options [nop,nop,TS val 3923661 ecr 349118], length 2896: OpenFlow
	version unknown (0x00), type 0x00, length 5, xid 0x5f697070 (corrupt)
18:05:55.239274 IP 192.168.1.30.41314 > 192.168.1.10.6633: Flags [.], seq 251379:254275, ack 0, win 123, options [nop,nop,TS val 3923661 ecr 349118], length 2896: OpenFlow
	version unknown (0x00), type 0x0c, length 1, xid 0x045f6970 (corrupt)
18:05:55.239620 IP 192.168.1.30.41314 > 192.168.1.10.6633: Flags [.], seq 254275:257171, ack 0, win 123, options [nop,nop,TS val 3923661 ecr 349119], length 2896: OpenFlow
	version unknown (0x00), type 0x00, length 65535, xid 0xffff006b [|openflow]
18:05:55.239630 IP 192.168.1.30.41314 > 192.168.1.10.6633: Flags [.], seq 257171:260067, ack 0, win 123, options [nop,nop,TS val 3923661 ecr 349119], length 2896: OpenFlow
	version unknown (0xf3), type 0x18, length 53638, xid 0xdd600000 [|openflow]
18:05:55.239638 IP 192.168.1.30.41314 > 192.168.1.10.6633: Flags [.], seq 260067:262963, ack 0, win 123, options [nop,nop,TS val 3923661 ecr 349119], length 2896: OpenFlow
	version unknown (0x50), type 0x69, length 51199, xid 0xfef318d1 [|openflow]
18:05:55.239723 IP 192.168.1.10.6633 > 192.168.1.30.41314: Flags [.], ack 239795, win 3747, options [nop,nop,TS val 349119 ecr 3923661], length 0
18:05:55.239735 IP 192.168.1.30.41314 > 192.168.1.10.6633: Flags [.], seq 262963:265859, ack 0, win 123, options [nop,nop,TS val 3923661 ecr 349119], length 2896: OpenFlow
	version unknown (0x00), type 0x00, length 64276, xid 0xe914e900 [|openflow]
18:05:55.239746 IP 192.168.1.30.41314 > 192.168.1.10.6633: Flags [.], seq 265859:268755, ack 0, win 123, options [nop,nop,TS val 3923661 ecr 349119], length 2896: OpenFlow
	version unknown (0x00), type 0x00, length 1375, xid 0x69707073
	version unknown (0x00), type 0x00, length 1375, xid 0x69707073
	version unknown (0x00), type 0x00, length 1375, xid 0x69707073 [|openflow]
18:05:55.239756 IP 192.168.1.30.41314 > 192.168.1.10.6633: Flags [.], seq 268755:271651, ack 0, win 123, options [nop,nop,TS val 3923661 ecr 349119], length 2896: OpenFlow
	version unknown (0x0c), type 0x00, length 260, xid 0x5f697070
	version unknown (0x00), type 0x0c, length 1, xid 0x010a007d (corrupt)
18:05:55.239765 IP 192.168.1.30.41314 > 192.168.1.10.6633: Flags [.], seq 271651:274547, ack 0, win 123, options [nop,nop,TS val 3923661 ecr 349119], length 2896: OpenFlow
	version unknown (0x00), type 0xff, length 65535, xid 0xff006b00 [|openflow]
18:05:55.239776 IP 192.168.1.30.41314 > 192.168.1.10.6633: Flags [P.], seq 274547:274894, ack 0, win 123, options [nop,nop,TS val 3923661 ecr 349119], length 347: OpenFlow
	version unknown (0x18), type 0xd1, length 34525, xid 0x60000000 [|openflow]
18:05:55.239785 IP 192.168.1.10.6633 > 192.168.1.30.41314: Flags [.], ack 254275, win 3747, options [nop,nop,TS val 349119 ecr 3923661], length 0
18:05:55.240442 IP 192.168.1.10.6633 > 192.168.1.30.41314: Flags [.], ack 274894, win 3747, options [nop,nop,TS val 349119 ecr 3923661], length 0
18:05:55.463602 IP 192.168.1.30.41314 > 192.168.1.10.6633: Flags [P.], seq 274894:275019, ack 0, win 123, options [nop,nop,TS val 3923717 ecr 349119], length 125: OpenFlow
	version 1.0, type PACKET_IN, length 125, xid 0x00000000
18:05:55.463644 IP 192.168.1.30.41314 > 192.168.1.10.6633: Flags [P.], seq 275019:275144, ack 0, win 123, options [nop,nop,TS val 3923717 ecr 349119], length 125: OpenFlow
	version 1.0, type PACKET_IN, length 125, xid 0x00000000
18:05:55.463672 IP 192.168.1.30.41314 > 192.168.1.10.6633: Flags [P.], seq 275144:275269, ack 0, win 123, options [nop,nop,TS val 3923717 ecr 349119], length 125: OpenFlow
	version 1.0, type PACKET_IN, length 125, xid 0x00000000
18:05:55.463699 IP 192.168.1.30.41314 > 192.168.1.10.6633: Flags [P.], seq 275269:275394, ack 0, win 123, options [nop,nop,TS val 3923717 ecr 349119], length 125: OpenFlow
	version 1.0, type PACKET_IN, length 125, xid 0x00000000
18:05:55.463734 IP 192.168.1.30.41314 > 192.168.1.10.6633: Flags [P.], seq 275394:275519, ack 0, win 123, options [nop,nop,TS val 3923717 ecr 349119], length 125: OpenFlow
	version 1.0, type PACKET_IN, length 125, xid 0x00000000
18:05:55.463763 IP 192.168.1.30.41314 > 192.168.1.10.6633: Flags [P.], seq 275519:275644, ack 0, win 123, options [nop,nop,TS val 3923717 ecr 349119], length 125: OpenFlow
	version 1.0, type PACKET_IN, length 125, xid 0x00000000
18:05:55.463802 IP 192.168.1.30.41314 > 192.168.1.10.6633: Flags [P.], seq 275644:275769, ack 0, win 123, options [nop,nop,TS val 3923717 ecr 349119], length 125: OpenFlow
	version 1.0, type PACKET_IN, length 125, xid 0x00000000
18:05:55.463849 IP 192.168.1.30.41314 > 192.168.1.10.6633: Flags [P.], seq 275769:275894, ack 0, win 123, options [nop,nop,TS val 3923717 ecr 349119], length 125: OpenFlow
	version 1.0, type PACKET_IN, length 125, xid 0x00000000
18:05:55.463891 IP 192.168.1.30.41314 > 192.168.1.10.6633: Flags [P.], seq 275894:276019, ack 0, win 123, options [nop,nop,TS val 3923717 ecr 349119], length 125: OpenFlow
	version 1.0, type PACKET_IN, length 125, xid 0x00000000
18:05:55.463920 IP 192.168.1.30.41314 > 192.168.1.10.6633: Flags [P.], seq 276019:276144, ack 0, win 123, options [nop,nop,TS val 3923717 ecr 349119], length 125: OpenFlow
	version 1.0, type PACKET_IN, length 125, xid 0x00000000
18:05:55.463947 IP 192.168.1.30.41314 > 192.168.1.10.6633: Flags [P.], seq 276144:276269, ack 0, win 123, options [nop,nop,TS val 3923717 ecr 349119], length 125: OpenFlow
	version 1.0, type PACKET_IN, length 125, xid 0x00000000
18:05:55.463974 IP 192.168.1.30.41314 > 192.168.1.10.6633: Flags [P.], seq 276269:276394, ack 0, win 123, options [nop,nop,TS val 3923717 ecr 349119], length 125: OpenFlow
	version 1.0, type PACKET_IN, length 125, xid 0x00000000
18:05:55.464001 IP 192.168.1.30.41314 > 192.168.1.10.6633: Flags [P.], seq 276394:276519, ack 0, win 123, options [nop,nop,TS val 3923717 ecr 349119], length 125: OpenFlow
	version 1.0, type PACKET_IN, length 125, xid 0x00000000
18:05:55.464036 IP 192.168.1.30.41314 > 192.168.1.10.6633: Flags [P.], seq 276519:276644, ack 0, win 123, options [nop,nop,TS val 3923717 ecr 349119], length 125: OpenFlow
	version 1.0, type PACKET_IN, length 125, xid 0x00000000
18:05:55.464067 IP 192.168.1.30.41314 > 192.168.1.10.6633: Flags [P.], seq 276644:276769, ack 0, win 123, options [nop,nop,TS val 3923717 ecr 349119], length 125: OpenFlow
	version 1.0, type PACKET_IN, length 125, xid 0x00000000
18:05:55.464095 IP 192.168.1.30.41314 > 192.168.1.10.6633: Flags [P.], seq 276769:276894, ack 0, win 123, options [nop,nop,TS val 3923717 ecr 349119], length 125: OpenFlow
	version 1.0, type PACKET_IN, length 125, xid 0x00000000
18:05:55.464121 IP 192.168.1.30.41314 > 192.168.1.10.6633: Flags [P.], seq 276894:277019, ack 0, win 123, options [nop,nop,TS val 3923717 ecr 349119], length 125: OpenFlow
	version 1.0, type PACKET_IN, length 125, xid 0x00000000
18:05:55.464822 IP 192.168.1.10.6633 > 192.168.1.30.41314: Flags [.], ack 275019, win 3747, options [nop,nop,TS val 349175 ecr 3923717], length 0
18:05:55.464832 IP 192.168.1.30.41314 > 192.168.1.10.6633: Flags [.], seq 277019:279915, ack 0, win 123, options [nop,nop,TS val 3923717 ecr 349175], length 2896: OpenFlow
	version 1.0, type PACKET_IN, length 125, xid 0x00000000
	version 1.0, type PACKET_IN, length 125, xid 0x00000000
	version 1.0, type PACKET_IN, length 125, xid 0x00000000
	version 1.0, type PACKET_IN, length 125, xid 0x00000000
	version 1.0, type PACKET_IN, length 125, xid 0x00000000
	version 1.0, type PACKET_IN, length 125, xid 0x00000000
	version 1.0, type PACKET_IN, length 125, xid 0x00000000
	version 1.0, type PACKET_IN, length 125, xid 0x00000000
	version 1.0, type PACKET_IN, length 125, xid 0x00000000
	version 1.0, type PACKET_IN, length 125, xid 0x00000000
	version 1.0, type PACKET_IN, length 125, xid 0x00000000
	version 1.0, type PACKET_IN, length 125, xid 0x00000000
	version 1.0, type PACKET_IN, length 125, xid 0x00000000
	version 1.0, type PACKET_IN, length 125, xid 0x00000000
	version 1.0, type PACKET_IN, length 125, xid 0x00000000
	version 1.0, type PACKET_IN, length 125, xid 0x00000000
	version 1.0, type PACKET_IN, length 125, xid 0x00000000
	version 1.0, type PACKET_IN, length 125, xid 0x00000000
	version 1.0, type PACKET_IN, length 125, xid 0x00000000
	version 1.0, type PACKET_IN, length 125, xid 0x00000000
	version 1.0, type PACKET_IN, length 125, xid 0x00000000
	version 1.0, type PACKET_IN, length 125, xid 0x00000000
	version 1.0, type PACKET_IN, length 125, xid 0x00000000
	version 1.0, type PACKET_IN, length 125, xid 0x00000000 [|openflow]
18:05:55.464845 IP 192.168.1.10.6633 > 192.168.1.30.41314: Flags [.], ack 275144, win 3747, options [nop,nop,TS val 349175 ecr 3923717], length 0
18:05:55.464860 IP 192.168.1.30.41314 > 192.168.1.10.6633: Flags [.], seq 279915:282811, ack 0, win 123, options [nop,nop,TS val 3923717 ecr 349175], length 2896: OpenFlow
	version unknown (0x00), type 0x00, length 64338, xid 0x69c7f318 [|openflow]
18:05:55.464876 IP 192.168.1.10.6633 > 192.168.1.30.41314: Flags [.], ack 275269, win 3747, options [nop,nop,TS val 349175 ecr 3923717], length 0
18:05:55.464890 IP 192.168.1.30.41314 > 192.168.1.10.6633: Flags [.], seq 282811:285707, ack 0, win 123, options [nop,nop,TS val 3923717 ecr 349175], length 2896: OpenFlow
	version unknown (0x00), type 0x00, length 0, xid 0x00005069 (corrupt)
18:05:55.464907 IP 192.168.1.10.6633 > 192.168.1.30.41314: Flags [.], ack 275394, win 3747, options [nop,nop,TS val 349175 ecr 3923717], length 0
18:05:55.464921 IP 192.168.1.10.6633 > 192.168.1.30.41314: Flags [.], ack 275519, win 3747, options [nop,nop,TS val 349175 ecr 3923717], length 0
18:05:55.464932 IP 192.168.1.30.41314 > 192.168.1.10.6633: Flags [.], seq 285707:288603, ack 0, win 123, options [nop,nop,TS val 3923717 ecr 349175], length 2896: OpenFlow
	version unknown (0x00), type 0x00, length 0, xid 0x00000000 (corrupt)
18:05:55.464942 IP 192.168.1.10.6633 > 192.168.1.30.41314: Flags [.], ack 275644, win 3747, options [nop,nop,TS val 349175 ecr 3923717], length 0
18:05:55.464950 IP 192.168.1.30.41314 > 192.168.1.10.6633: Flags [.], seq 288603:291499, ack 0, win 123, options [nop,nop,TS val 3923717 ecr 349175], length 2896: OpenFlow
	version unknown (0x00), type 0x02, length 0, xid 0x00000000 (corrupt)
18:05:55.464960 IP 192.168.1.10.6633 > 192.168.1.30.41314: Flags [.], ack 275769, win 3747, options [nop,nop,TS val 349175 ecr 3923717], length 0
18:05:55.464969 IP 192.168.1.30.41314 > 192.168.1.10.6633: Flags [.], seq 291499:294395, ack 0, win 123, options [nop,nop,TS val 3923717 ecr 349175], length 2896: OpenFlow
	version unknown (0x6f), type 0x63, length 24940, xid 0x00000c00 [|openflow]
18:05:55.465009 IP 192.168.1.10.6633 > 192.168.1.30.41314: Flags [.], ack 275894, win 3747, options [nop,nop,TS val 349175 ecr 3923717], length 0
18:05:55.465021 IP 192.168.1.10.6633 > 192.168.1.30.41314: Flags [.], ack 276019, win 3747, options [nop,nop,TS val 349175 ecr 3923717], length 0
18:05:55.465030 IP 192.168.1.10.6633 > 192.168.1.30.41314: Flags [.], ack 276144, win 3747, options [nop,nop,TS val 349175 ecr 3923717], length 0
18:05:55.465039 IP 192.168.1.10.6633 > 192.168.1.30.41314: Flags [.], ack 276269, win 3747, options [nop,nop,TS val 349175 ecr 3923717], length 0
18:05:55.465048 IP 192.168.1.10.6633 > 192.168.1.30.41314: Flags [.], ack 276394, win 3747, options [nop,nop,TS val 349175 ecr 3923717], length 0
18:05:55.465056 IP 192.168.1.10.6633 > 192.168.1.30.41314: Flags [.], ack 276519, win 3747, options [nop,nop,TS val 349175 ecr 3923717], length 0
18:05:55.465066 IP 192.168.1.10.6633 > 192.168.1.30.41314: Flags [.], ack 276644, win 3747, options [nop,nop,TS val 349175 ecr 3923717], length 0
18:05:55.465075 IP 192.168.1.10.6633 > 192.168.1.30.41314: Flags [.], ack 276769, win 3747, options [nop,nop,TS val 349175 ecr 3923717], length 0
18:05:55.465084 IP 192.168.1.10.6633 > 192.168.1.30.41314: Flags [.], ack 276894, win 3747, options [nop,nop,TS val 349175 ecr 3923717], length 0
18:05:55.465123 IP 192.168.1.10.6633 > 192.168.1.30.41314: Flags [.], ack 285707, win 3747, options [nop,nop,TS val 349175 ecr 3923717], length 0
18:05:55.465214 IP 192.168.1.10.6633 > 192.168.1.30.41314: Flags [.], ack 294395, win 3747, options [nop,nop,TS val 349175 ecr 3923717], length 0
18:05:55.465234 IP 192.168.1.30.41314 > 192.168.1.10.6633: Flags [.], seq 294395:297291, ack 0, win 123, options [nop,nop,TS val 3923717 ecr 349175], length 2896: OpenFlow
	version unknown (0x0a), type 0x00, length 32000, xid 0x000000ff [|openflow]
18:05:55.465248 IP 192.168.1.30.41314 > 192.168.1.10.6633: Flags [.], seq 297291:300187, ack 0, win 123, options [nop,nop,TS val 3923717 ecr 349175], length 2896: OpenFlow
	version unknown (0x00), type 0xfb, length 21097, xid 0xc7f318d1 [|openflow]
18:05:55.465259 IP 192.168.1.30.41314 > 192.168.1.10.6633: Flags [.], seq 300187:303083, ack 0, win 123, options [nop,nop,TS val 3923717 ecr 349175], length 2896: OpenFlow
	version unknown (0x00), type 0x00, length 0, xid 0x005069c7 (corrupt)
18:05:55.465267 IP 192.168.1.30.41314 > 192.168.1.10.6633: Flags [.], seq 303083:304531, ack 0, win 123, options [nop,nop,TS val 3923717 ecr 349175], length 1448: OpenFlow
	version unknown (0x00), type 0x00, length 0, xid 0x000000fb (corrupt)
18:05:55.465273 IP 192.168.1.30.41314 > 192.168.1.10.6633: Flags [P.], seq 304531:305269, ack 0, win 123, options [nop,nop,TS val 3923717 ecr 349175], length 738: OpenFlow
	version unknown (0x00), type 0x6b, length 1, xid 0x01003333 (corrupt)
18:05:55.465278 IP 192.168.1.30.41314 > 192.168.1.10.6633: Flags [P.], seq 305269:305394, ack 0, win 123, options [nop,nop,TS val 3923717 ecr 349175], length 125: OpenFlow
	version 1.0, type PACKET_IN, length 125, xid 0x00000000
18:05:55.465323 IP 192.168.1.30.41314 > 192.168.1.10.6633: Flags [P.], seq 305394:305519, ack 0, win 123, options [nop,nop,TS val 3923717 ecr 349175], length 125: OpenFlow
	version 1.0, type PACKET_IN, length 125, xid 0x00000000
18:05:55.465588 IP 192.168.1.30.41314 > 192.168.1.10.6633: Flags [P.], seq 305519:305644, ack 0, win 123, options [nop,nop,TS val 3923717 ecr 349175], length 125: OpenFlow
	version 1.0, type PACKET_IN, length 125, xid 0x00000000
18:05:55.465630 IP 192.168.1.30.41314 > 192.168.1.10.6633: Flags [P.], seq 305644:305769, ack 0, win 123, options [nop,nop,TS val 3923717 ecr 349175], length 125: OpenFlow
	version 1.0, type PACKET_IN, length 125, xid 0x00000000
18:05:55.465643 IP 192.168.1.30.41314 > 192.168.1.10.6633: Flags [P.], seq 305769:305894, ack 0, win 123, options [nop,nop,TS val 3923717 ecr 349175], length 125: OpenFlow
	version 1.0, type PACKET_IN, length 125, xid 0x00000000
18:05:55.465651 IP 192.168.1.30.41314 > 192.168.1.10.6633: Flags [P.], seq 305894:306019, ack 0, win 123, options [nop,nop,TS val 3923717 ecr 349175], length 125: OpenFlow
	version 1.0, type PACKET_IN, length 125, xid 0x00000000
18:05:55.465658 IP 192.168.1.30.41314 > 192.168.1.10.6633: Flags [P.], seq 306019:306144, ack 0, win 123, options [nop,nop,TS val 3923717 ecr 349175], length 125: OpenFlow
	version 1.0, type PACKET_IN, length 125, xid 0x00000000
18:05:55.465672 IP 192.168.1.30.41314 > 192.168.1.10.6633: Flags [P.], seq 306144:306269, ack 0, win 123, options [nop,nop,TS val 3923717 ecr 349175], length 125: OpenFlow
	version 1.0, type PACKET_IN, length 125, xid 0x00000000
18:05:55.465679 IP 192.168.1.30.41314 > 192.168.1.10.6633: Flags [P.], seq 306269:306394, ack 0, win 123, options [nop,nop,TS val 3923717 ecr 349175], length 125: OpenFlow
	version 1.0, type PACKET_IN, length 125, xid 0x00000000
18:05:55.465687 IP 192.168.1.30.41314 > 192.168.1.10.6633: Flags [P.], seq 306394:306519, ack 0, win 123, options [nop,nop,TS val 3923717 ecr 349175], length 125: OpenFlow
	version 1.0, type PACKET_IN, length 125, xid 0x00000000
18:05:55.465694 IP 192.168.1.30.41314 > 192.168.1.10.6633: Flags [P.], seq 306519:306644, ack 0, win 123, options [nop,nop,TS val 3923717 ecr 349175], length 125: OpenFlow
	version 1.0, type PACKET_IN, length 125, xid 0x00000000
18:05:55.465707 IP 192.168.1.30.41314 > 192.168.1.10.6633: Flags [P.], seq 306644:306769, ack 0, win 123, options [nop,nop,TS val 3923717 ecr 349175], length 125: OpenFlow
	version 1.0, type PACKET_IN, length 125, xid 0x00000000
18:05:55.465715 IP 192.168.1.30.41314 > 192.168.1.10.6633: Flags [P.], seq 306769:306894, ack 0, win 123, options [nop,nop,TS val 3923717 ecr 349175], length 125: OpenFlow
	version 1.0, type PACKET_IN, length 125, xid 0x00000000
18:05:55.465723 IP 192.168.1.30.41314 > 192.168.1.10.6633: Flags [P.], seq 306894:307019, ack 0, win 123, options [nop,nop,TS val 3923717 ecr 349175], length 125: OpenFlow
	version 1.0, type PACKET_IN, length 125, xid 0x00000000
18:05:55.465730 IP 192.168.1.30.41314 > 192.168.1.10.6633: Flags [P.], seq 307019:307144, ack 0, win 123, options [nop,nop,TS val 3923717 ecr 349175], length 125: OpenFlow
	version 1.0, type PACKET_IN, length 125, xid 0x00000000
18:05:55.465736 IP 192.168.1.30.41314 > 192.168.1.10.6633: Flags [P.], seq 307144:307269, ack 0, win 123, options [nop,nop,TS val 3923717 ecr 349175], length 125: OpenFlow
	version 1.0, type PACKET_IN, length 125, xid 0x00000000
18:05:55.465743 IP 192.168.1.30.41314 > 192.168.1.10.6633: Flags [P.], seq 307269:307394, ack 0, win 123, options [nop,nop,TS val 3923717 ecr 349175], length 125: OpenFlow
	version 1.0, type PACKET_IN, length 125, xid 0x00000000
18:05:55.465750 IP 192.168.1.30.41314 > 192.168.1.10.6633: Flags [P.], seq 307394:307519, ack 0, win 123, options [nop,nop,TS val 3923717 ecr 349175], length 125: OpenFlow
	version 1.0, type PACKET_IN, length 125, xid 0x00000000
18:05:55.468580 IP 192.168.1.10.6633 > 192.168.1.30.41314: Flags [.], ack 303083, win 3747, options [nop,nop,TS val 349176 ecr 3923717], length 0
18:05:55.468610 IP 192.168.1.10.6633 > 192.168.1.30.41314: Flags [.], ack 305269, win 3747, options [nop,nop,TS val 349176 ecr 3923717], length 0
18:05:55.468616 IP 192.168.1.10.6633 > 192.168.1.30.41314: Flags [.], ack 306769, win 3747, options [nop,nop,TS val 349176 ecr 3923717], length 0
18:05:55.468770 IP 192.168.1.30.41314 > 192.168.1.10.6633: Flags [.], seq 307519:311863, ack 0, win 123, options [nop,nop,TS val 3923718 ecr 349176], length 4344: OpenFlow
	version 1.0, type PACKET_IN, length 125, xid 0x00000000
	version 1.0, type PACKET_IN, length 125, xid 0x00000000
	version 1.0, type PACKET_IN, length 125, xid 0x00000000
	version 1.0, type PACKET_IN, length 125, xid 0x00000000
	version 1.0, type PACKET_IN, length 125, xid 0x00000000
	version 1.0, type PACKET_IN, length 125, xid 0x00000000
	version 1.0, type PACKET_IN, length 125, xid 0x00000000
	version 1.0, type PACKET_IN, length 125, xid 0x00000000
	version 1.0, type PACKET_IN, length 125, xid 0x00000000
	version 1.0, type PACKET_IN, length 125, xid 0x00000000
	version 1.0, type PACKET_IN, length 125, xid 0x00000000
	version 1.0, type PACKET_IN, length 125, xid 0x00000000
	version 1.0, type PACKET_IN, length 125, xid 0x00000000
	version 1.0, type PACKET_IN, length 125, xid 0x00000000
	version 1.0, type PACKET_IN, length 125, xid 0x00000000
	version 1.0, type PACKET_IN, length 125, xid 0x00000000
	version 1.0, type PACKET_IN, length 125, xid 0x00000000
	version 1.0, type PACKET_IN, length 125, xid 0x00000000
	version 1.0, type PACKET_IN, length 125, xid 0x00000000
	version 1.0, type PACKET_IN, length 125, xid 0x00000000
	version 1.0, type PACKET_IN, length 125, xid 0x00000000
	version 1.0, type PACKET_IN, length 125, xid 0x00000000
	version 1.0, type PACKET_IN, length 125, xid 0x00000000
	version 1.0, type PACKET_IN, length 125, xid 0x00000000
	version 1.0, type PACKET_IN, length 125, xid 0x00000000
	version 1.0, type PACKET_IN, length 125, xid 0x00000000
	version 1.0, type PACKET_IN, length 125, xid 0x00000000
	version 1.0, type PACKET_IN, length 125, xid 0x00000000
	version 1.0, type PACKET_IN, length 125, xid 0x00000000
	version 1.0, type PACKET_IN, length 125, xid 0x00000000
	version 1.0, type PACKET_IN, length 125, xid 0x00000000
	version 1.0, type PACKET_IN, length 125, xid 0x00000000
	version 1.0, type PACKET_IN, length 125, xid 0x00000000
	version 1.0, type PACKET_IN, length 125, xid 0x00000000
	version 1.0, type PACKET_IN, length 125, xid 0x00000000 [|openflow]
18:05:55.468778 IP 192.168.1.30.41314 > 192.168.1.10.6633: Flags [.], seq 311863:316207, ack 0, win 123, options [nop,nop,TS val 3923718 ecr 349176], length 4344: OpenFlow
	version unknown (0x69), type 0x70, length 28787, xid 0x045f7463 [|openflow]
18:05:55.468785 IP 192.168.1.30.41314 > 192.168.1.10.6633: Flags [.], seq 316207:320551, ack 0, win 123, options [nop,nop,TS val 3923718 ecr 349176], length 4344: OpenFlow
	version unknown (0x00), type 0x00, length 0, xid 0x00000000 (corrupt)
18:05:55.468791 IP 192.168.1.30.41314 > 192.168.1.10.6633: Flags [.], seq 320551:324895, ack 0, win 123, options [nop,nop,TS val 3923718 ecr 349176], length 4344: OpenFlow
	version unknown (0x60), type 0x00, length 0, xid 0x003511ff (corrupt)
18:05:55.468799 IP 192.168.1.30.41314 > 192.168.1.10.6633: Flags [.], seq 324895:329239, ack 0, win 123, options [nop,nop,TS val 3923718 ecr 349176], length 4344: OpenFlow
	version unknown (0x0a), type 0x00, length 32000, xid 0x000000ff [|openflow]
18:05:55.468805 IP 192.168.1.30.41314 > 192.168.1.10.6633: Flags [.], seq 329239:333583, ack 0, win 123, options [nop,nop,TS val 3923718 ecr 349176], length 4344: OpenFlow
	version unknown (0x70), type 0x70, length 29444, xid 0x5f746370 [|openflow]
18:05:55.469120 IP 192.168.1.10.6633 > 192.168.1.30.41314: Flags [.], ack 333583, win 3747, options [nop,nop,TS val 349176 ecr 3923717], length 0
18:05:55.469464 IP 192.168.1.30.41314 > 192.168.1.10.6633: Flags [.], seq 333583:337927, ack 0, win 123, options [nop,nop,TS val 3923718 ecr 349176], length 4344: OpenFlow
	version unknown (0x00), type 0x00, length 0, xid 0x000000fb (corrupt)
18:05:55.469496 IP 192.168.1.30.41314 > 192.168.1.10.6633: Flags [.], seq 337927:342271, ack 0, win 123, options [nop,nop,TS val 3923718 ecr 349176], length 4344: OpenFlow
	version unknown (0x00), type 0x00, length 0, xid 0x3511fffe (corrupt)
18:05:55.469529 IP 192.168.1.30.41314 > 192.168.1.10.6633: Flags [.], seq 342271:346615, ack 0, win 123, options [nop,nop,TS val 3923718 ecr 349176], length 4344: OpenFlow
	version unknown (0x00), type 0x7d, length 0, xid 0x0000ffff (corrupt)
18:05:55.469544 IP 192.168.1.30.41314 > 192.168.1.10.6633: Flags [.], seq 346615:350959, ack 0, win 123, options [nop,nop,TS val 3923718 ecr 349176], length 4344: OpenFlow
	version unknown (0x70), type 0x73, length 1119, xid 0x74637005
	version unknown (0x00), type 0x00, length 1375, xid 0x69707073
	version unknown (0x00), type 0x00, length 1375, xid 0x69707073
	version unknown (0x00), type 0x00, length 1375, xid 0x69707073 [|openflow]
18:05:55.469555 IP 192.168.1.30.41314 > 192.168.1.10.6633: Flags [.], seq 350959:355303, ack 0, win 123, options [nop,nop,TS val 3923718 ecr 349176], length 4344: OpenFlow
	version unknown (0x00), type 0x00, length 0, xid 0x0000fb14 (corrupt)
18:05:55.469575 IP 192.168.1.30.41314 > 192.168.1.10.6633: Flags [.], seq 355303:359647, ack 0, win 123, options [nop,nop,TS val 3923718 ecr 349176], length 4344: OpenFlow
	version unknown (0x00), type 0x00, length 53, xid 0x11fffe80
	version unknown (0x00), type 0x00, length 0, xid 0x00055f69 (corrupt)
18:05:55.469585 IP 192.168.1.30.41314 > 192.168.1.10.6633: Flags [.], seq 359647:363991, ack 0, win 123, options [nop,nop,TS val 3923718 ecr 349176], length 4344: OpenFlow
	version unknown (0x7d), type 0x00, length 0, xid 0x00ffffff (corrupt)
18:05:55.469611 IP 192.168.1.30.41314 > 192.168.1.10.6633: Flags [.], seq 363991:368335, ack 0, win 123, options [nop,nop,TS val 3923718 ecr 349176], length 4344: OpenFlow
	version unknown (0x73), type 0x04, length 24436, xid 0x6370056c [|openflow]
18:05:55.470947 IP 192.168.1.10.6633 > 192.168.1.30.41314: Flags [.], ack 368335, win 3747, options [nop,nop,TS val 349177 ecr 3923718], length 0
18:05:55.470962 IP 192.168.1.30.41314 > 192.168.1.10.6633: Flags [.], seq 368335:372679, ack 0, win 123, options [nop,nop,TS val 3923719 ecr 349177], length 4344: OpenFlow
	version unknown (0x00), type 0x00, length 0, xid 0x00fb14e9 (corrupt)
18:05:55.470975 IP 192.168.1.30.41314 > 192.168.1.10.6633: Flags [.], seq 372679:377023, ack 0, win 123, options [nop,nop,TS val 3923719 ecr 349177], length 4344: OpenFlow
	version unknown (0x00), type 0x00, length 13585, xid 0xfffe8000 [|openflow]
18:05:55.470986 IP 192.168.1.30.41314 > 192.168.1.10.6633: Flags [.], seq 377023:381367, ack 0, win 123, options [nop,nop,TS val 3923719 ecr 349177], length 4344: OpenFlow
	version unknown (0x00), type 0x00, length 0, xid 0xffffffff (corrupt)
18:05:55.470996 IP 192.168.1.30.41314 > 192.168.1.10.6633: Flags [P.], seq 381367:384769, ack 0, win 123, options [nop,nop,TS val 3923719 ecr 349177], length 3402: OpenFlow
	version unknown (0x04), type 0x5f, length 29795, xid 0x70056c6f [|openflow]
18:05:55.471012 IP 192.168.1.30.41314 > 192.168.1.10.6633: Flags [.], seq 384769:389113, ack 0, win 123, options [nop,nop,TS val 3923719 ecr 349177], length 4344: OpenFlow
	version 1.0, type PACKET_IN, length 125, xid 0x00000000
	version 1.0, type PACKET_IN, length 125, xid 0x00000000
	version 1.0, type PACKET_IN, length 125, xid 0x00000000
	version 1.0, type PACKET_IN, length 125, xid 0x00000000
	version 1.0, type PACKET_IN, length 125, xid 0x00000000
	version 1.0, type PACKET_IN, length 125, xid 0x00000000
	version 1.0, type PACKET_IN, length 125, xid 0x00000000
	version 1.0, type PACKET_IN, length 125, xid 0x00000000
	version 1.0, type PACKET_IN, length 125, xid 0x00000000
	version 1.0, type PACKET_IN, length 125, xid 0x00000000
	version 1.0, type PACKET_IN, length 125, xid 0x00000000
	version 1.0, type PACKET_IN, length 125, xid 0x00000000
	version 1.0, type PACKET_IN, length 125, xid 0x00000000
	version 1.0, type PACKET_IN, length 125, xid 0x00000000
	version 1.0, type PACKET_IN, length 125, xid 0x00000000
	version 1.0, type PACKET_IN, length 125, xid 0x00000000
	version 1.0, type PACKET_IN, length 125, xid 0x00000000
	version 1.0, type PACKET_IN, length 125, xid 0x00000000
	version 1.0, type PACKET_IN, length 125, xid 0x00000000
	version 1.0, type PACKET_IN, length 125, xid 0x00000000
	version 1.0, type PACKET_IN, length 125, xid 0x00000000
	version 1.0, type PACKET_IN, length 125, xid 0x00000000
	version 1.0, type PACKET_IN, length 125, xid 0x00000000
	version 1.0, type PACKET_IN, length 125, xid 0x00000000
	version 1.0, type PACKET_IN, length 125, xid 0x00000000
	version 1.0, type PACKET_IN, length 125, xid 0x00000000
	version 1.0, type PACKET_IN, length 125, xid 0x00000000
	version 1.0, type PACKET_IN, length 125, xid 0x00000000
	version 1.0, type PACKET_IN, length 125, xid 0x00000000
	version 1.0, type PACKET_IN, length 125, xid 0x00000000
	version 1.0, type PACKET_IN, length 125, xid 0x00000000
	version 1.0, type PACKET_IN, length 125, xid 0x00000000
	version 1.0, type PACKET_IN, length 125, xid 0x00000000
	version 1.0, type PACKET_IN, length 125, xid 0x00000000
	version 1.0, type PACKET_IN, length 125, xid 0x00000000 [|openflow]
18:05:55.471025 IP 192.168.1.30.41314 > 192.168.1.10.6633: Flags [.], seq 389113:393457, ack 0, win 123, options [nop,nop,TS val 3923719 ecr 349177], length 4344: OpenFlow
	version unknown (0x69), type 0x70, length 28787, xid 0x045f7463 [|openflow]
18:05:55.471043 IP 192.168.1.30.41314 > 192.168.1.10.6633: Flags [.], seq 393457:397801, ack 0, win 123, options [nop,nop,TS val 3923719 ecr 349177], length 4344: OpenFlow
	version unknown (0x00), type 0x00, length 0, xid 0x00000000 (corrupt)
18:05:55.471055 IP 192.168.1.30.41314 > 192.168.1.10.6633: Flags [.], seq 397801:402145, ack 0, win 123, options [nop,nop,TS val 3923719 ecr 349177], length 4344: OpenFlow
	version unknown (0x60), type 0x00, length 0, xid 0x003511ff (corrupt)
18:05:55.471066 IP 192.168.1.30.41314 > 192.168.1.10.6633: Flags [P.], seq 402145:402894, ack 0, win 123, options [nop,nop,TS val 3923719 ecr 349177], length 749: OpenFlow
	version unknown (0x0a), type 0x00, length 32000, xid 0x000000ff [|openflow]
18:05:55.471891 IP 192.168.1.10.6633 > 192.168.1.30.41314: Flags [.], ack 384769, win 3747, options [nop,nop,TS val 349177 ecr 3923719], length 0
18:05:55.472094 IP 192.168.1.10.6633 > 192.168.1.30.41314: Flags [.], ack 402894, win 3747, options [nop,nop,TS val 349177 ecr 3923719], length 0
18:05:55.725413 IP 192.168.1.30.41314 > 192.168.1.10.6633: Flags [P.], seq 402894:403019, ack 0, win 123, options [nop,nop,TS val 3923782 ecr 349177], length 125: OpenFlow
	version 1.0, type PACKET_IN, length 125, xid 0x00000000
18:05:55.725459 IP 192.168.1.30.41314 > 192.168.1.10.6633: Flags [P.], seq 403019:403144, ack 0, win 123, options [nop,nop,TS val 3923782 ecr 349177], length 125: OpenFlow
	version 1.0, type PACKET_IN, length 125, xid 0x00000000
18:05:55.725585 IP 192.168.1.30.41314 > 192.168.1.10.6633: Flags [P.], seq 403144:403269, ack 0, win 123, options [nop,nop,TS val 3923783 ecr 349177], length 125: OpenFlow
	version 1.0, type PACKET_IN, length 125, xid 0x00000000
18:05:55.725625 IP 192.168.1.30.41314 > 192.168.1.10.6633: Flags [P.], seq 403269:403394, ack 0, win 123, options [nop,nop,TS val 3923783 ecr 349177], length 125: OpenFlow
	version 1.0, type PACKET_IN, length 125, xid 0x00000000
18:05:55.725660 IP 192.168.1.30.41314 > 192.168.1.10.6633: Flags [P.], seq 403394:403519, ack 0, win 123, options [nop,nop,TS val 3923783 ecr 349177], length 125: OpenFlow
	version 1.0, type PACKET_IN, length 125, xid 0x00000000
18:05:55.725696 IP 192.168.1.30.41314 > 192.168.1.10.6633: Flags [P.], seq 403519:403644, ack 0, win 123, options [nop,nop,TS val 3923783 ecr 349177], length 125: OpenFlow
	version 1.0, type PACKET_IN, length 125, xid 0x00000000
18:05:55.725732 IP 192.168.1.30.41314 > 192.168.1.10.6633: Flags [P.], seq 403644:403769, ack 0, win 123, options [nop,nop,TS val 3923783 ecr 349177], length 125: OpenFlow
	version 1.0, type PACKET_IN, length 125, xid 0x00000000
18:05:55.725906 IP 192.168.1.30.41314 > 192.168.1.10.6633: Flags [P.], seq 403769:403894, ack 0, win 123, options [nop,nop,TS val 3923783 ecr 349177], length 125: OpenFlow
	version 1.0, type PACKET_IN, length 125, xid 0x00000000
18:05:55.725944 IP 192.168.1.30.41314 > 192.168.1.10.6633: Flags [P.], seq 403894:404019, ack 0, win 123, options [nop,nop,TS val 3923783 ecr 349177], length 125: OpenFlow
	version 1.0, type PACKET_IN, length 125, xid 0x00000000
18:05:55.725979 IP 192.168.1.30.41314 > 192.168.1.10.6633: Flags [P.], seq 404019:404144, ack 0, win 123, options [nop,nop,TS val 3923783 ecr 349177], length 125: OpenFlow
	version 1.0, type PACKET_IN, length 125, xid 0x00000000
18:05:55.726014 IP 192.168.1.30.41314 > 192.168.1.10.6633: Flags [P.], seq 404144:404269, ack 0, win 123, options [nop,nop,TS val 3923783 ecr 349177], length 125: OpenFlow
	version 1.0, type PACKET_IN, length 125, xid 0x00000000
18:05:55.726049 IP 192.168.1.30.41314 > 192.168.1.10.6633: Flags [P.], seq 404269:404394, ack 0, win 123, options [nop,nop,TS val 3923783 ecr 349177], length 125: OpenFlow
	version 1.0, type PACKET_IN, length 125, xid 0x00000000
18:05:55.726084 IP 192.168.1.30.41314 > 192.168.1.10.6633: Flags [P.], seq 404394:404519, ack 0, win 123, options [nop,nop,TS val 3923783 ecr 349177], length 125: OpenFlow
	version 1.0, type PACKET_IN, length 125, xid 0x00000000
18:05:55.727794 IP 192.168.1.10.6633 > 192.168.1.30.41314: Flags [.], ack 403019, win 3747, options [nop,nop,TS val 349241 ecr 3923782], length 0
18:05:55.727808 IP 192.168.1.10.6633 > 192.168.1.30.41314: Flags [.], ack 403144, win 3747, options [nop,nop,TS val 349241 ecr 3923782], length 0
18:05:55.727817 IP 192.168.1.30.41314 > 192.168.1.10.6633: Flags [.], seq 404519:408863, ack 0, win 123, options [nop,nop,TS val 3923783 ecr 349241], length 4344: OpenFlow
	version 1.0, type PACKET_IN, length 125, xid 0x00000000
	version 1.0, type PACKET_IN, length 125, xid 0x00000000
	version 1.0, type PACKET_IN, length 125, xid 0x00000000
	version 1.0, type PACKET_IN, length 125, xid 0x00000000
	version 1.0, type PACKET_IN, length 125, xid 0x00000000
	version 1.0, type PACKET_IN, length 125, xid 0x00000000
	version 1.0, type PACKET_IN, length 125, xid 0x00000000
	version 1.0, type PACKET_IN, length 125, xid 0x00000000
	version 1.0, type PACKET_IN, length 125, xid 0x00000000
	version 1.0, type PACKET_IN, length 125, xid 0x00000000
	version 1.0, type PACKET_IN, length 125, xid 0x00000000
	version 1.0, type PACKET_IN, length 125, xid 0x00000000
	version 1.0, type PACKET_IN, length 125, xid 0x00000000
	version 1.0, type PACKET_IN, length 125, xid 0x00000000
	version 1.0, type PACKET_IN, length 125, xid 0x00000000
	version 1.0, type PACKET_IN, length 125, xid 0x00000000
	version 1.0, type PACKET_IN, length 125, xid 0x00000000
	version 1.0, type PACKET_IN, length 125, xid 0x00000000
	version 1.0, type PACKET_IN, length 125, xid 0x00000000
	version 1.0, type PACKET_IN, length 125, xid 0x00000000
	version 1.0, type PACKET_IN, length 125, xid 0x00000000
	version 1.0, type PACKET_IN, length 125, xid 0x00000000
	version 1.0, type PACKET_IN, length 125, xid 0x00000000
	version 1.0, type PACKET_IN, length 125, xid 0x00000000
	version 1.0, type PACKET_IN, length 125, xid 0x00000000
	version 1.0, type PACKET_IN, length 125, xid 0x00000000
	version 1.0, type PACKET_IN, length 125, xid 0x00000000
	version 1.0, type PACKET_IN, length 125, xid 0x00000000
	version 1.0, type PACKET_IN, length 125, xid 0x00000000
	version 1.0, type PACKET_IN, length 125, xid 0x00000000
	version 1.0, type PACKET_IN, length 125, xid 0x00000000
	version 1.0, type PACKET_IN, length 125, xid 0x00000000
	version 1.0, type PACKET_IN, length 125, xid 0x00000000
	version 1.0, type PACKET_IN, length 125, xid 0x00000000
	version 1.0, type PACKET_IN, length 125, xid 0x00000000 [|openflow]
18:05:55.727829 IP 192.168.1.10.6633 > 192.168.1.30.41314: Flags [.], ack 403269, win 3747, options [nop,nop,TS val 349241 ecr 3923783], length 0
18:05:55.727837 IP 192.168.1.30.41314 > 192.168.1.10.6633: Flags [.], seq 408863:413207, ack 0, win 123, options [nop,nop,TS val 3923783 ecr 349241], length 4344: OpenFlow
	version unknown (0x69), type 0x70, length 28787, xid 0x045f7463 [|openflow]
18:05:55.727856 IP 192.168.1.10.6633 > 192.168.1.30.41314: Flags [.], ack 403394, win 3747, options [nop,nop,TS val 349241 ecr 3923783], length 0
18:05:55.727864 IP 192.168.1.10.6633 > 192.168.1.30.41314: Flags [.], ack 403519, win 3747, options [nop,nop,TS val 349241 ecr 3923783], length 0
18:05:55.727872 IP 192.168.1.30.41314 > 192.168.1.10.6633: Flags [.], seq 413207:414655, ack 0, win 123, options [nop,nop,TS val 3923783 ecr 349241], length 1448: OpenFlow
	version unknown (0x00), type 0x00, length 0, xid 0x00000000 (corrupt)
18:05:55.727881 IP 192.168.1.30.41314 > 192.168.1.10.6633: Flags [P.], seq 414655:415769, ack 0, win 123, options [nop,nop,TS val 3923783 ecr 349241], length 1114: OpenFlow
	version unknown (0xff), type 0x00, length 27392, xid 0x01010033 [|openflow]
18:05:55.727891 IP 192.168.1.10.6633 > 192.168.1.30.41314: Flags [.], ack 403644, win 3747, options [nop,nop,TS val 349241 ecr 3923783], length 0
18:05:55.727899 IP 192.168.1.10.6633 > 192.168.1.30.41314: Flags [.], ack 403769, win 3747, options [nop,nop,TS val 349241 ecr 3923783], length 0
18:05:55.727906 IP 192.168.1.10.6633 > 192.168.1.30.41314: Flags [.], ack 403894, win 3747, options [nop,nop,TS val 349241 ecr 3923783], length 0
18:05:55.727914 IP 192.168.1.10.6633 > 192.168.1.30.41314: Flags [.], ack 404019, win 3747, options [nop,nop,TS val 349241 ecr 3923783], length 0
18:05:55.727921 IP 192.168.1.10.6633 > 192.168.1.30.41314: Flags [.], ack 404144, win 3747, options [nop,nop,TS val 349241 ecr 3923783], length 0
18:05:55.727928 IP 192.168.1.10.6633 > 192.168.1.30.41314: Flags [.], ack 404269, win 3747, options [nop,nop,TS val 349241 ecr 3923783], length 0
18:05:55.727942 IP 192.168.1.10.6633 > 192.168.1.30.41314: Flags [.], ack 404394, win 3747, options [nop,nop,TS val 349241 ecr 3923783], length 0
18:05:55.727949 IP 192.168.1.10.6633 > 192.168.1.30.41314: Flags [.], ack 404519, win 3747, options [nop,nop,TS val 349241 ecr 3923783], length 0
18:05:55.728045 IP 192.168.1.10.6633 > 192.168.1.30.41314: Flags [.], ack 413207, win 3747, options [nop,nop,TS val 349241 ecr 3923783], length 0
18:05:55.728054 IP 192.168.1.10.6633 > 192.168.1.30.41314: Flags [.], ack 415769, win 3747, options [nop,nop,TS val 349241 ecr 3923783], length 0
18:05:55.728130 IP 192.168.1.30.41314 > 192.168.1.10.6633: Flags [P.], seq 415769:415894, ack 0, win 123, options [nop,nop,TS val 3923783 ecr 349241], length 125: OpenFlow
	version 1.0, type PACKET_IN, length 125, xid 0x00000000
18:05:55.728175 IP 192.168.1.30.41314 > 192.168.1.10.6633: Flags [P.], seq 415894:416019, ack 0, win 123, options [nop,nop,TS val 3923783 ecr 349241], length 125: OpenFlow
	version 1.0, type PACKET_IN, length 125, xid 0x00000000
18:05:55.728212 IP 192.168.1.30.41314 > 192.168.1.10.6633: Flags [P.], seq 416019:416144, ack 0, win 123, options [nop,nop,TS val 3923783 ecr 349241], length 125: OpenFlow
	version 1.0, type PACKET_IN, length 125, xid 0x00000000
18:05:55.728262 IP 192.168.1.30.41314 > 192.168.1.10.6633: Flags [P.], seq 416144:416269, ack 0, win 123, options [nop,nop,TS val 3923783 ecr 349241], length 125: OpenFlow
	version 1.0, type PACKET_IN, length 125, xid 0x00000000
18:05:55.728303 IP 192.168.1.30.41314 > 192.168.1.10.6633: Flags [P.], seq 416269:416394, ack 0, win 123, options [nop,nop,TS val 3923783 ecr 349241], length 125: OpenFlow
	version 1.0, type PACKET_IN, length 125, xid 0x00000000
18:05:55.728351 IP 192.168.1.30.41314 > 192.168.1.10.6633: Flags [P.], seq 416394:416519, ack 0, win 123, options [nop,nop,TS val 3923783 ecr 349241], length 125: OpenFlow
	version 1.0, type PACKET_IN, length 125, xid 0x00000000
18:05:55.728433 IP 192.168.1.30.41314 > 192.168.1.10.6633: Flags [P.], seq 416519:416644, ack 0, win 123, options [nop,nop,TS val 3923783 ecr 349241], length 125: OpenFlow
	version 1.0, type PACKET_IN, length 125, xid 0x00000000
18:05:55.728478 IP 192.168.1.30.41314 > 192.168.1.10.6633: Flags [P.], seq 416644:416769, ack 0, win 123, options [nop,nop,TS val 3923783 ecr 349241], length 125: OpenFlow
	version 1.0, type PACKET_IN, length 125, xid 0x00000000
18:05:55.728514 IP 192.168.1.30.41314 > 192.168.1.10.6633: Flags [P.], seq 416769:416894, ack 0, win 123, options [nop,nop,TS val 3923783 ecr 349241], length 125: OpenFlow
	version 1.0, type PACKET_IN, length 125, xid 0x00000000
18:05:55.728549 IP 192.168.1.30.41314 > 192.168.1.10.6633: Flags [P.], seq 416894:417019, ack 0, win 123, options [nop,nop,TS val 3923783 ecr 349241], length 125: OpenFlow
	version 1.0, type PACKET_IN, length 125, xid 0x00000000
18:05:55.728582 IP 192.168.1.30.41314 > 192.168.1.10.6633: Flags [P.], seq 417019:417144, ack 0, win 123, options [nop,nop,TS val 3923783 ecr 349241], length 125: OpenFlow
	version 1.0, type PACKET_IN, length 125, xid 0x00000000
18:05:55.728616 IP 192.168.1.30.41314 > 192.168.1.10.6633: Flags [P.], seq 417144:417269, ack 0, win 123, options [nop,nop,TS val 3923783 ecr 349241], length 125: OpenFlow
	version 1.0, type PACKET_IN, length 125, xid 0x00000000
18:05:55.728766 IP 192.168.1.30.41314 > 192.168.1.10.6633: Flags [P.], seq 417269:417394, ack 0, win 123, options [nop,nop,TS val 3923783 ecr 349241], length 125: OpenFlow
	version 1.0, type PACKET_IN, length 125, xid 0x00000000
18:05:55.728805 IP 192.168.1.30.41314 > 192.168.1.10.6633: Flags [P.], seq 417394:417519, ack 0, win 123, options [nop,nop,TS val 3923783 ecr 349241], length 125: OpenFlow
	version 1.0, type PACKET_IN, length 125, xid 0x00000000
18:05:55.728849 IP 192.168.1.30.41314 > 192.168.1.10.6633: Flags [P.], seq 417519:417644, ack 0, win 123, options [nop,nop,TS val 3923783 ecr 349241], length 125: OpenFlow
	version 1.0, type PACKET_IN, length 125, xid 0x00000000
18:05:55.728891 IP 192.168.1.30.41314 > 192.168.1.10.6633: Flags [P.], seq 417644:417769, ack 0, win 123, options [nop,nop,TS val 3923783 ecr 349241], length 125: OpenFlow
	version 1.0, type PACKET_IN, length 125, xid 0x00000000
18:05:55.728929 IP 192.168.1.30.41314 > 192.168.1.10.6633: Flags [P.], seq 417769:417894, ack 0, win 123, options [nop,nop,TS val 3923783 ecr 349241], length 125: OpenFlow
	version 1.0, type PACKET_IN, length 125, xid 0x00000000
18:05:55.728968 IP 192.168.1.30.41314 > 192.168.1.10.6633: Flags [P.], seq 417894:418019, ack 0, win 123, options [nop,nop,TS val 3923783 ecr 349241], length 125: OpenFlow
	version 1.0, type PACKET_IN, length 125, xid 0x00000000
18:05:55.729012 IP 192.168.1.30.41314 > 192.168.1.10.6633: Flags [P.], seq 418019:418144, ack 0, win 123, options [nop,nop,TS val 3923783 ecr 349241], length 125: OpenFlow
	version 1.0, type PACKET_IN, length 125, xid 0x00000000
18:05:55.729043 IP 192.168.1.10.6633 > 192.168.1.30.41314: Flags [.], ack 415894, win 3747, options [nop,nop,TS val 349241 ecr 3923783], length 0
18:05:55.729182 IP 192.168.1.30.41314 > 192.168.1.10.6633: Flags [P.], seq 418144:418269, ack 0, win 123, options [nop,nop,TS val 3923783 ecr 349241], length 125: OpenFlow
	version 1.0, type PACKET_IN, length 125, xid 0x00000000
18:05:55.729229 IP 192.168.1.30.41314 > 192.168.1.10.6633: Flags [P.], seq 418269:418394, ack 0, win 123, options [nop,nop,TS val 3923783 ecr 349241], length 125: OpenFlow
	version 1.0, type PACKET_IN, length 125, xid 0x00000000
18:05:55.729275 IP 192.168.1.30.41314 > 192.168.1.10.6633: Flags [P.], seq 418394:418519, ack 0, win 123, options [nop,nop,TS val 3923783 ecr 349241], length 125: OpenFlow
	version 1.0, type PACKET_IN, length 125, xid 0x00000000
18:05:55.729517 IP 192.168.1.10.6633 > 192.168.1.30.41314: Flags [.], ack 417394, win 3747, options [nop,nop,TS val 349241 ecr 3923783], length 0
18:05:55.729614 IP 192.168.1.10.6633 > 192.168.1.30.41314: Flags [.], ack 418144, win 3747, options [nop,nop,TS val 349241 ecr 3923783], length 0
18:05:55.729620 IP 192.168.1.10.6633 > 192.168.1.30.41314: Flags [.], ack 418269, win 3747, options [nop,nop,TS val 349241 ecr 3923783], length 0
18:05:55.729637 IP 192.168.1.30.41314 > 192.168.1.10.6633: Flags [.], seq 418519:419967, ack 0, win 123, options [nop,nop,TS val 3923784 ecr 349241], length 1448: OpenFlow
	version 1.0, type PACKET_IN, length 125, xid 0x00000000
	version 1.0, type PACKET_IN, length 125, xid 0x00000000
	version 1.0, type PACKET_IN, length 125, xid 0x00000000
	version 1.0, type PACKET_IN, length 125, xid 0x00000000
	version 1.0, type PACKET_IN, length 125, xid 0x00000000
	version 1.0, type PACKET_IN, length 125, xid 0x00000000
	version 1.0, type PACKET_IN, length 125, xid 0x00000000
	version 1.0, type PACKET_IN, length 125, xid 0x00000000
	version 1.0, type PACKET_IN, length 125, xid 0x00000000
	version 1.0, type PACKET_IN, length 125, xid 0x00000000
	version 1.0, type PACKET_IN, length 125, xid 0x00000000
	version 1.0, type PACKET_IN, length 125, xid 0x00000000 [|openflow]
18:05:55.729647 IP 192.168.1.30.41314 > 192.168.1.10.6633: Flags [P.], seq 419967:420019, ack 0, win 123, options [nop,nop,TS val 3923784 ecr 349241], length 52: OpenFlow
	version unknown (0xe9), type 0x14, length 59648, xid 0x35a58a00 [|openflow]
18:05:55.729693 IP 192.168.1.30.41314 > 192.168.1.10.6633: Flags [P.], seq 420019:420144, ack 0, win 123, options [nop,nop,TS val 3923784 ecr 349241], length 125: OpenFlow
	version 1.0, type PACKET_IN, length 125, xid 0x00000000
18:05:55.729738 IP 192.168.1.30.41314 > 192.168.1.10.6633: Flags [P.], seq 420144:420269, ack 0, win 123, options [nop,nop,TS val 3923784 ecr 349241], length 125: OpenFlow
	version 1.0, type PACKET_IN, length 125, xid 0x00000000
18:05:55.729777 IP 192.168.1.30.41314 > 192.168.1.10.6633: Flags [P.], seq 420269:420394, ack 0, win 123, options [nop,nop,TS val 3923784 ecr 349241], length 125: OpenFlow
	version 1.0, type PACKET_IN, length 125, xid 0x00000000
18:05:55.729812 IP 192.168.1.30.41314 > 192.168.1.10.6633: Flags [P.], seq 420394:420519, ack 0, win 123, options [nop,nop,TS val 3923784 ecr 349241], length 125: OpenFlow
	version 1.0, type PACKET_IN, length 125, xid 0x00000000
18:05:55.729846 IP 192.168.1.30.41314 > 192.168.1.10.6633: Flags [P.], seq 420519:420644, ack 0, win 123, options [nop,nop,TS val 3923784 ecr 349241], length 125: OpenFlow
	version 1.0, type PACKET_IN, length 125, xid 0x00000000
18:05:55.729881 IP 192.168.1.30.41314 > 192.168.1.10.6633: Flags [P.], seq 420644:420769, ack 0, win 123, options [nop,nop,TS val 3923784 ecr 349241], length 125: OpenFlow
	version 1.0, type PACKET_IN, length 125, xid 0x00000000
18:05:55.729915 IP 192.168.1.30.41314 > 192.168.1.10.6633: Flags [P.], seq 420769:420894, ack 0, win 123, options [nop,nop,TS val 3923784 ecr 349241], length 125: OpenFlow
	version 1.0, type PACKET_IN, length 125, xid 0x00000000
18:05:55.729949 IP 192.168.1.30.41314 > 192.168.1.10.6633: Flags [P.], seq 420894:421019, ack 0, win 123, options [nop,nop,TS val 3923784 ecr 349241], length 125: OpenFlow
	version 1.0, type PACKET_IN, length 125, xid 0x00000000
18:05:55.729983 IP 192.168.1.30.41314 > 192.168.1.10.6633: Flags [P.], seq 421019:421144, ack 0, win 123, options [nop,nop,TS val 3923784 ecr 349241], length 125: OpenFlow
	version 1.0, type PACKET_IN, length 125, xid 0x00000000
18:05:55.730023 IP 192.168.1.30.41314 > 192.168.1.10.6633: Flags [P.], seq 421144:421269, ack 0, win 123, options [nop,nop,TS val 3923784 ecr 349241], length 125: OpenFlow
	version 1.0, type PACKET_IN, length 125, xid 0x00000000
18:05:55.730082 IP 192.168.1.30.41314 > 192.168.1.10.6633: Flags [P.], seq 421269:421394, ack 0, win 123, options [nop,nop,TS val 3923784 ecr 349241], length 125: OpenFlow
	version 1.0, type PACKET_IN, length 125, xid 0x00000000
18:05:55.730118 IP 192.168.1.30.41314 > 192.168.1.10.6633: Flags [P.], seq 421394:421519, ack 0, win 123, options [nop,nop,TS val 3923784 ecr 349241], length 125: OpenFlow
	version 1.0, type PACKET_IN, length 125, xid 0x00000000
18:05:55.730142 IP 192.168.1.30.41314 > 192.168.1.10.6633: Flags [P.], seq 421519:421644, ack 0, win 123, options [nop,nop,TS val 3923784 ecr 349241], length 125: OpenFlow
	version 1.0, type PACKET_IN, length 125, xid 0x00000000
18:05:55.730166 IP 192.168.1.30.41314 > 192.168.1.10.6633: Flags [P.], seq 421644:421769, ack 0, win 123, options [nop,nop,TS val 3923784 ecr 349241], length 125: OpenFlow
	version 1.0, type PACKET_IN, length 125, xid 0x00000000
18:05:55.730192 IP 192.168.1.30.41314 > 192.168.1.10.6633: Flags [P.], seq 421769:421894, ack 0, win 123, options [nop,nop,TS val 3923784 ecr 349241], length 125: OpenFlow
	version 1.0, type PACKET_IN, length 125, xid 0x00000000
18:05:55.730218 IP 192.168.1.30.41314 > 192.168.1.10.6633: Flags [P.], seq 421894:422019, ack 0, win 123, options [nop,nop,TS val 3923784 ecr 349241], length 125: OpenFlow
	version 1.0, type PACKET_IN, length 125, xid 0x00000000
18:05:55.730245 IP 192.168.1.30.41314 > 192.168.1.10.6633: Flags [P.], seq 422019:422144, ack 0, win 123, options [nop,nop,TS val 3923784 ecr 349241], length 125: OpenFlow
	version 1.0, type PACKET_IN, length 125, xid 0x00000000
18:05:55.730271 IP 192.168.1.30.41314 > 192.168.1.10.6633: Flags [P.], seq 422144:422269, ack 0, win 123, options [nop,nop,TS val 3923784 ecr 349241], length 125: OpenFlow
	version 1.0, type PACKET_IN, length 125, xid 0x00000000
18:05:55.732176 IP 192.168.1.10.6633 > 192.168.1.30.41314: Flags [.], ack 420019, win 3747, options [nop,nop,TS val 349242 ecr 3923783], length 0
18:05:55.732190 IP 192.168.1.10.6633 > 192.168.1.30.41314: Flags [.], ack 421519, win 3747, options [nop,nop,TS val 349242 ecr 3923784], length 0
18:05:55.732209 IP 192.168.1.30.41314 > 192.168.1.10.6633: Flags [.], seq 422269:425165, ack 0, win 123, options [nop,nop,TS val 3923784 ecr 349242], length 2896: OpenFlow
	version 1.0, type PACKET_IN, length 125, xid 0x00000000
	version 1.0, type PACKET_IN, length 125, xid 0x00000000
	version 1.0, type PACKET_IN, length 125, xid 0x00000000
	version 1.0, type PACKET_IN, length 125, xid 0x00000000
	version 1.0, type PACKET_IN, length 125, xid 0x00000000
	version 1.0, type PACKET_IN, length 125, xid 0x00000000
	version 1.0, type PACKET_IN, length 125, xid 0x00000000
	version 1.0, type PACKET_IN, length 125, xid 0x00000000
	version 1.0, type PACKET_IN, length 125, xid 0x00000000
	version 1.0, type PACKET_IN, length 125, xid 0x00000000
	version 1.0, type PACKET_IN, length 125, xid 0x00000000
	version 1.0, type PACKET_IN, length 125, xid 0x00000000
	version 1.0, type PACKET_IN, length 125, xid 0x00000000
	version 1.0, type PACKET_IN, length 125, xid 0x00000000
	version 1.0, type PACKET_IN, length 125, xid 0x00000000
	version 1.0, type PACKET_IN, length 125, xid 0x00000000
	version 1.0, type PACKET_IN, length 125, xid 0x00000000
	version 1.0, type PACKET_IN, length 125, xid 0x00000000
	version 1.0, type PACKET_IN, length 125, xid 0x00000000
	version 1.0, type PACKET_IN, length 125, xid 0x00000000
	version 1.0, type PACKET_IN, length 125, xid 0x00000000
	version 1.0, type PACKET_IN, length 125, xid 0x00000000
	version 1.0, type PACKET_IN, length 125, xid 0x00000000
	version 1.0, type PACKET_IN, length 125, xid 0x00000000 [|openflow]
18:05:55.732222 IP 192.168.1.30.41314 > 192.168.1.10.6633: Flags [.], seq 425165:428061, ack 0, win 123, options [nop,nop,TS val 3923784 ecr 349242], length 2896: OpenFlow
	version unknown (0x00), type 0x00, length 64338, xid 0x69c7f318 [|openflow]
18:05:55.732239 IP 192.168.1.30.41314 > 192.168.1.10.6633: Flags [.], seq 428061:430957, ack 0, win 123, options [nop,nop,TS val 3923784 ecr 349242], length 2896: OpenFlow
	version unknown (0x00), type 0x00, length 0, xid 0x00005069 (corrupt)
18:05:55.732250 IP 192.168.1.30.41314 > 192.168.1.10.6633: Flags [.], seq 430957:433853, ack 0, win 123, options [nop,nop,TS val 3923784 ecr 349242], length 2896: OpenFlow
	version unknown (0x00), type 0x00, length 0, xid 0x00000000 (corrupt)
18:05:55.732261 IP 192.168.1.30.41314 > 192.168.1.10.6633: Flags [.], seq 433853:436749, ack 0, win 123, options [nop,nop,TS val 3923784 ecr 349242], length 2896: OpenFlow
	version unknown (0x00), type 0x02, length 0, xid 0x00000000 (corrupt)
18:05:55.732271 IP 192.168.1.30.41314 > 192.168.1.10.6633: Flags [.], seq 436749:439645, ack 0, win 123, options [nop,nop,TS val 3923784 ecr 349242], length 2896: OpenFlow
	version unknown (0x6f), type 0x63, length 24940, xid 0x00000c00 [|openflow]
18:05:55.732281 IP 192.168.1.30.41314 > 192.168.1.10.6633: Flags [.], seq 439645:442541, ack 0, win 123, options [nop,nop,TS val 3923784 ecr 349242], length 2896: OpenFlow
	version unknown (0x0a), type 0x00, length 32000, xid 0x000000ff [|openflow]
18:05:55.732291 IP 192.168.1.30.41314 > 192.168.1.10.6633: Flags [.], seq 442541:445437, ack 0, win 123, options [nop,nop,TS val 3923784 ecr 349242], length 2896: OpenFlow
	version unknown (0x00), type 0xfb, length 21097, xid 0xc7f318d1 [|openflow]
18:05:55.734789 IP 192.168.1.10.6633 > 192.168.1.30.41314: Flags [.], ack 445437, win 3747, options [nop,nop,TS val 349242 ecr 3923784], length 0
18:05:55.734807 IP 192.168.1.30.41314 > 192.168.1.10.6633: Flags [.], seq 445437:448333, ack 0, win 123, options [nop,nop,TS val 3923785 ecr 349242], length 2896: OpenFlow
	version unknown (0x00), type 0x00, length 0, xid 0x005069c7 (corrupt)
18:05:55.734818 IP 192.168.1.30.41314 > 192.168.1.10.6633: Flags [.], seq 448333:451229, ack 0, win 123, options [nop,nop,TS val 3923785 ecr 349242], length 2896: OpenFlow
	version unknown (0x00), type 0x00, length 0, xid 0x000000fb (corrupt)
18:05:55.734829 IP 192.168.1.30.41314 > 192.168.1.10.6633: Flags [.], seq 451229:454125, ack 0, win 123, options [nop,nop,TS val 3923785 ecr 349242], length 2896: OpenFlow
	version unknown (0x02), type 0x00, length 0, xid 0x00000005 (corrupt)
18:05:55.734838 IP 192.168.1.30.41314 > 192.168.1.10.6633: Flags [.], seq 454125:457021, ack 0, win 123, options [nop,nop,TS val 3923785 ecr 349242], length 2896: OpenFlow
	version unknown (0x63), type 0x61, length 27648, xid 0x000c0001 [|openflow]
18:05:55.734860 IP 192.168.1.30.41314 > 192.168.1.10.6633: Flags [.], seq 457021:459917, ack 0, win 123, options [nop,nop,TS val 3923785 ecr 349242], length 2896: OpenFlow
	version unknown (0x00), type 0x7d, length 0, xid 0x0000ffff (corrupt)
18:05:55.734871 IP 192.168.1.30.41314 > 192.168.1.10.6633: Flags [.], seq 459917:462813, ack 0, win 123, options [nop,nop,TS val 3923785 ecr 349242], length 2896: OpenFlow
	version unknown (0xfb), type 0x52, length 27079, xid 0xf318d186 [|openflow]
18:05:55.734881 IP 192.168.1.30.41314 > 192.168.1.10.6633: Flags [.], seq 462813:465709, ack 0, win 123, options [nop,nop,TS val 3923785 ecr 349242], length 2896: OpenFlow
	version unknown (0x00), type 0x00, length 0, xid 0x5069c7ff (corrupt)
18:05:55.734891 IP 192.168.1.30.41314 > 192.168.1.10.6633: Flags [.], seq 465709:468605, ack 0, win 123, options [nop,nop,TS val 3923785 ecr 349242], length 2896: OpenFlow
	version unknown (0x00), type 0x00, length 0, xid 0x0000fb14 (corrupt)

