12:20:29.657676 IP 192.168.1.12.6633 > 192.168.1.30.41124: Flags [P.], seq 2292313503:2292313559, ack 3907402966, win 386, options [nop,nop,TS val 15666533 ecr 14635255], length 56: OpenFlow
	version unknown (0x04), type 0x12, length 56, xid 0x0000000f
12:20:29.657734 IP 192.168.1.30.41124 > 192.168.1.12.6633: Flags [.], ack 56, win 63, options [nop,nop,TS val 14635412 ecr 15666533], length 0
12:20:29.658055 IP 192.168.1.30.41124 > 192.168.1.12.6633: Flags [P.], seq 1:161, ack 56, win 63, options [nop,nop,TS val 14635412 ecr 15666533], length 160: OpenFlow
	version unknown (0x04), type 0x13, length 160, xid 0x0000000f
12:20:29.698316 IP 192.168.1.12.6633 > 192.168.1.30.41124: Flags [.], ack 161, win 403, options [nop,nop,TS val 15666544 ecr 14635412], length 0

