18:05:55.040135 IP 192.168.1.10.6633 > 192.168.1.30.41024: Flags [.], ack 1379213809, win 5701, options [nop,nop,TS val 349069 ecr 3923597], length 0
18:05:55.075466 IP 192.168.1.30.41024 > 192.168.1.10.6633: Flags [P.], seq 1:126, ack 0, win 351, options [nop,nop,TS val 3923620 ecr 349069], length 125: OpenFlow
	version 1.0, type PACKET_IN, length 125, xid 0x00000000
18:05:55.075509 IP 192.168.1.30.41024 > 192.168.1.10.6633: Flags [P.], seq 126:251, ack 0, win 351, options [nop,nop,TS val 3923620 ecr 349069], length 125: OpenFlow
	version 1.0, type PACKET_IN, length 125, xid 0x00000000
18:05:55.075535 IP 192.168.1.30.41024 > 192.168.1.10.6633: Flags [P.], seq 251:376, ack 0, win 351, options [nop,nop,TS val 3923620 ecr 349069], length 125: OpenFlow
	version 1.0, type PACKET_IN, length 125, xid 0x00000000
18:05:55.075563 IP 192.168.1.30.41024 > 192.168.1.10.6633: Flags [P.], seq 376:501, ack 0, win 351, options [nop,nop,TS val 3923620 ecr 349069], length 125: OpenFlow
	version 1.0, type PACKET_IN, length 125, xid 0x00000000
18:05:55.075590 IP 192.168.1.30.41024 > 192.168.1.10.6633: Flags [P.], seq 501:626, ack 0, win 351, options [nop,nop,TS val 3923620 ecr 349069], length 125: OpenFlow
	version 1.0, type PACKET_IN, length 125, xid 0x00000000
18:05:55.075616 IP 192.168.1.30.41024 > 192.168.1.10.6633: Flags [P.], seq 626:751, ack 0, win 351, options [nop,nop,TS val 3923620 ecr 349069], length 125: OpenFlow
	version 1.0, type PACKET_IN, length 125, xid 0x00000000
18:05:55.075642 IP 192.168.1.30.41024 > 192.168.1.10.6633: Flags [P.], seq 751:876, ack 0, win 351, options [nop,nop,TS val 3923620 ecr 349069], length 125: OpenFlow
	version 1.0, type PACKET_IN, length 125, xid 0x00000000
18:05:55.075668 IP 192.168.1.30.41024 > 192.168.1.10.6633: Flags [P.], seq 876:1001, ack 0, win 351, options [nop,nop,TS val 3923620 ecr 349069], length 125: OpenFlow
	version 1.0, type PACKET_IN, length 125, xid 0x00000000
18:05:55.075722 IP 192.168.1.30.41024 > 192.168.1.10.6633: Flags [P.], seq 1001:1126, ack 0, win 351, options [nop,nop,TS val 3923620 ecr 349069], length 125: OpenFlow
	version 1.0, type PACKET_IN, length 125, xid 0x00000000
18:05:55.075758 IP 192.168.1.30.41024 > 192.168.1.10.6633: Flags [P.], seq 1126:1251, ack 0, win 351, options [nop,nop,TS val 3923620 ecr 349069], length 125: OpenFlow
	version 1.0, type PACKET_IN, length 125, xid 0x00000000
18:05:55.075771 IP 192.168.1.30.41024 > 192.168.1.10.6633: Flags [P.], seq 1251:1376, ack 0, win 351, options [nop,nop,TS val 3923620 ecr 349069], length 125: OpenFlow
	version 1.0, type PACKET_IN, length 125, xid 0x00000000
18:05:55.075785 IP 192.168.1.30.41024 > 192.168.1.10.6633: Flags [P.], seq 1376:1501, ack 0, win 351, options [nop,nop,TS val 3923620 ecr 349069], length 125: OpenFlow
	version 1.0, type PACKET_IN, length 125, xid 0x00000000
18:05:55.075798 IP 192.168.1.30.41024 > 192.168.1.10.6633: Flags [P.], seq 1501:1626, ack 0, win 351, options [nop,nop,TS val 3923620 ecr 349069], length 125: OpenFlow
	version 1.0, type PACKET_IN, length 125, xid 0x00000000
18:05:55.075811 IP 192.168.1.30.41024 > 192.168.1.10.6633: Flags [P.], seq 1626:1751, ack 0, win 351, options [nop,nop,TS val 3923620 ecr 349069], length 125: OpenFlow
	version 1.0, type PACKET_IN, length 125, xid 0x00000000
18:05:55.075825 IP 192.168.1.30.41024 > 192.168.1.10.6633: Flags [P.], seq 1751:1876, ack 0, win 351, options [nop,nop,TS val 3923620 ecr 349069], length 125: OpenFlow
	version 1.0, type PACKET_IN, length 125, xid 0x00000000
18:05:55.075846 IP 192.168.1.30.41024 > 192.168.1.10.6633: Flags [P.], seq 1876:2001, ack 0, win 351, options [nop,nop,TS val 3923620 ecr 349069], length 125: OpenFlow
	version 1.0, type PACKET_IN, length 125, xid 0x00000000
18:05:55.075860 IP 192.168.1.30.41024 > 192.168.1.10.6633: Flags [P.], seq 2001:2126, ack 0, win 351, options [nop,nop,TS val 3923620 ecr 349069], length 125: OpenFlow
	version 1.0, type PACKET_IN, length 125, xid 0x00000000
18:05:55.075874 IP 192.168.1.30.41024 > 192.168.1.10.6633: Flags [P.], seq 2126:2251, ack 0, win 351, options [nop,nop,TS val 3923620 ecr 349069], length 125: OpenFlow
	version 1.0, type PACKET_IN, length 125, xid 0x00000000
18:05:55.097487 IP 192.168.1.30.41024 > 192.168.1.10.6633: Flags [.], seq 2251:3699, ack 0, win 351, options [nop,nop,TS val 3923626 ecr 349069], length 1448: OpenFlow
	version 1.0, type PACKET_IN, length 125, xid 0x00000000
	version 1.0, type PACKET_IN, length 125, xid 0x00000000
	version 1.0, type PACKET_IN, length 125, xid 0x00000000
	version 1.0, type PACKET_IN, length 125, xid 0x00000000
	version 1.0, type PACKET_IN, length 125, xid 0x00000000
	version 1.0, type PACKET_IN, length 125, xid 0x00000000
	version 1.0, type PACKET_IN, length 125, xid 0x00000000
	version 1.0, type PACKET_IN, length 125, xid 0x00000000
	version 1.0, type PACKET_IN, length 125, xid 0x00000000
	version 1.0, type PACKET_IN, length 125, xid 0x00000000
	version 1.0, type PACKET_IN, length 125, xid 0x00000000
	version 1.0, type PACKET_IN, length 125, xid 0x00000000 [|openflow]
18:05:55.098339 IP 192.168.1.10.6633 > 192.168.1.30.41024: Flags [.], ack 2251, win 5684, options [nop,nop,TS val 349083 ecr 3923620], length 0
18:05:55.099072 IP 192.168.1.30.41024 > 192.168.1.10.6633: Flags [.], seq 3699:5147, ack 0, win 351, options [nop,nop,TS val 3923626 ecr 349083], length 1448: OpenFlow
	version unknown (0xe9), type 0x14, length 59648, xid 0x35a58a00 [|openflow]
18:05:55.099085 IP 192.168.1.30.41024 > 192.168.1.10.6633: Flags [.], seq 5147:8043, ack 0, win 351, options [nop,nop,TS val 3923626 ecr 349083], length 2896: OpenFlow
	version unknown (0x00), type 0x00, length 64338, xid 0x69c7f318 [|openflow]
18:05:55.099095 IP 192.168.1.30.41024 > 192.168.1.10.6633: Flags [.], seq 8043:10939, ack 0, win 351, options [nop,nop,TS val 3923626 ecr 349083], length 2896: OpenFlow
	version unknown (0x00), type 0x00, length 0, xid 0x00005069 (corrupt)
18:05:55.099106 IP 192.168.1.30.41024 > 192.168.1.10.6633: Flags [.], seq 10939:13835, ack 0, win 351, options [nop,nop,TS val 3923626 ecr 349083], length 2896: OpenFlow
	version unknown (0x00), type 0x00, length 0, xid 0x00000000 (corrupt)
18:05:55.099119 IP 192.168.1.30.41024 > 192.168.1.10.6633: Flags [.], seq 13835:16731, ack 0, win 351, options [nop,nop,TS val 3923626 ecr 349083], length 2896: OpenFlow
	version unknown (0x00), type 0x02, length 0, xid 0x00000000 (corrupt)
18:05:55.099130 IP 192.168.1.30.41024 > 192.168.1.10.6633: Flags [.], seq 16731:19627, ack 0, win 351, options [nop,nop,TS val 3923626 ecr 349083], length 2896: OpenFlow
	version unknown (0x6f), type 0x63, length 24940, xid 0x00000c00 [|openflow]
18:05:55.099143 IP 192.168.1.30.41024 > 192.168.1.10.6633: Flags [.], seq 19627:22523, ack 0, win 351, options [nop,nop,TS val 3923626 ecr 349083], length 2896: OpenFlow
	version unknown (0x0a), type 0x00, length 32000, xid 0x000000ff [|openflow]
18:05:55.099155 IP 192.168.1.30.41024 > 192.168.1.10.6633: Flags [.], seq 22523:25419, ack 0, win 351, options [nop,nop,TS val 3923626 ecr 349083], length 2896: OpenFlow
	version unknown (0x00), type 0xfb, length 21097, xid 0xc7f318d1 [|openflow]
18:05:55.099168 IP 192.168.1.30.41024 > 192.168.1.10.6633: Flags [.], seq 25419:28315, ack 0, win 351, options [nop,nop,TS val 3923626 ecr 349083], length 2896: OpenFlow
	version unknown (0x00), type 0x00, length 0, xid 0x005069c7 (corrupt)
18:05:55.121506 IP 192.168.1.30.41024 > 192.168.1.10.6633: Flags [.], seq 28315:29763, ack 0, win 351, options [nop,nop,TS val 3923632 ecr 349083], length 1448: OpenFlow
	version unknown (0x00), type 0x00, length 0, xid 0x000000fb (corrupt)
18:05:55.139192 IP 192.168.1.10.6633 > 192.168.1.30.41024: Flags [.], ack 29763, win 5524, options [nop,nop,TS val 349094 ecr 3923626], length 0
18:05:55.139379 IP 192.168.1.30.41024 > 192.168.1.10.6633: Flags [.], seq 29763:31211, ack 0, win 351, options [nop,nop,TS val 3923636 ecr 349094], length 1448: OpenFlow
	version unknown (0x00), type 0x6b, length 3, xid 0x01003333 (corrupt)
18:05:55.139393 IP 192.168.1.30.41024 > 192.168.1.10.6633: Flags [.], seq 31211:34107, ack 0, win 351, options [nop,nop,TS val 3923636 ecr 349094], length 2896: OpenFlow
	version unknown (0x02), type 0x00, length 0, xid 0x00000005 (corrupt)
18:05:55.139406 IP 192.168.1.30.41024 > 192.168.1.10.6633: Flags [.], seq 34107:37003, ack 0, win 351, options [nop,nop,TS val 3923636 ecr 349094], length 2896: OpenFlow
	version unknown (0x63), type 0x61, length 27648, xid 0x000c0001 [|openflow]
18:05:55.139417 IP 192.168.1.30.41024 > 192.168.1.10.6633: Flags [.], seq 37003:38451, ack 0, win 351, options [nop,nop,TS val 3923636 ecr 349094], length 1448: OpenFlow
	version unknown (0x00), type 0x7d, length 0, xid 0x0000ffff (corrupt)
18:05:55.139428 IP 192.168.1.30.41024 > 192.168.1.10.6633: Flags [P.], seq 38451:38876, ack 0, win 351, options [nop,nop,TS val 3923636 ecr 349094], length 425: OpenFlow
	version unknown (0xe9), type 0x00, length 13733, xid 0x8a000000 [|openflow]
18:05:55.173486 IP 192.168.1.30.41024 > 192.168.1.10.6633: Flags [P.], seq 38451:38876, ack 0, win 351, options [nop,nop,TS val 3923645 ecr 349094], length 425: OpenFlow
	version unknown (0xe9), type 0x00, length 13733, xid 0x8a000000 [|openflow]
18:05:55.174709 IP 192.168.1.10.6633 > 192.168.1.30.41024: Flags [.], ack 38876, win 5471, options [nop,nop,TS val 349103 ecr 3923636,nop,nop,sack 1 {38451:38876}], length 0
18:05:55.188784 IP 192.168.1.30.41024 > 192.168.1.10.6633: Flags [P.], seq 38876:39001, ack 0, win 351, options [nop,nop,TS val 3923648 ecr 349103], length 125: OpenFlow
	version 1.0, type PACKET_IN, length 125, xid 0x00000000
18:05:55.188835 IP 192.168.1.30.41024 > 192.168.1.10.6633: Flags [P.], seq 39001:39126, ack 0, win 351, options [nop,nop,TS val 3923648 ecr 349103], length 125: OpenFlow
	version 1.0, type PACKET_IN, length 125, xid 0x00000000
18:05:55.188865 IP 192.168.1.30.41024 > 192.168.1.10.6633: Flags [P.], seq 39126:39251, ack 0, win 351, options [nop,nop,TS val 3923648 ecr 349103], length 125: OpenFlow
	version 1.0, type PACKET_IN, length 125, xid 0x00000000
18:05:55.188893 IP 192.168.1.30.41024 > 192.168.1.10.6633: Flags [P.], seq 39251:39376, ack 0, win 351, options [nop,nop,TS val 3923648 ecr 349103], length 125: OpenFlow
	version 1.0, type PACKET_IN, length 125, xid 0x00000000
18:05:55.188923 IP 192.168.1.30.41024 > 192.168.1.10.6633: Flags [P.], seq 39376:39501, ack 0, win 351, options [nop,nop,TS val 3923648 ecr 349103], length 125: OpenFlow
	version 1.0, type PACKET_IN, length 125, xid 0x00000000
18:05:55.188954 IP 192.168.1.30.41024 > 192.168.1.10.6633: Flags [P.], seq 39501:39626, ack 0, win 351, options [nop,nop,TS val 3923648 ecr 349103], length 125: OpenFlow
	version 1.0, type PACKET_IN, length 125, xid 0x00000000
18:05:55.188984 IP 192.168.1.30.41024 > 192.168.1.10.6633: Flags [P.], seq 39626:39751, ack 0, win 351, options [nop,nop,TS val 3923648 ecr 349103], length 125: OpenFlow
	version 1.0, type PACKET_IN, length 125, xid 0x00000000
18:05:55.189013 IP 192.168.1.30.41024 > 192.168.1.10.6633: Flags [P.], seq 39751:39876, ack 0, win 351, options [nop,nop,TS val 3923648 ecr 349103], length 125: OpenFlow
	version 1.0, type PACKET_IN, length 125, xid 0x00000000
18:05:55.189058 IP 192.168.1.30.41024 > 192.168.1.10.6633: Flags [P.], seq 39876:40001, ack 0, win 351, options [nop,nop,TS val 3923648 ecr 349103], length 125: OpenFlow
	version 1.0, type PACKET_IN, length 125, xid 0x00000000
18:05:55.189090 IP 192.168.1.30.41024 > 192.168.1.10.6633: Flags [P.], seq 40001:40126, ack 0, win 351, options [nop,nop,TS val 3923648 ecr 349103], length 125: OpenFlow
	version 1.0, type PACKET_IN, length 125, xid 0x00000000
18:05:55.189121 IP 192.168.1.30.41024 > 192.168.1.10.6633: Flags [P.], seq 40126:40251, ack 0, win 351, options [nop,nop,TS val 3923648 ecr 349103], length 125: OpenFlow
	version 1.0, type PACKET_IN, length 125, xid 0x00000000
18:05:55.189137 IP 192.168.1.30.41024 > 192.168.1.10.6633: Flags [P.], seq 40251:40376, ack 0, win 351, options [nop,nop,TS val 3923648 ecr 349103], length 125: OpenFlow
	version 1.0, type PACKET_IN, length 125, xid 0x00000000
18:05:55.189150 IP 192.168.1.30.41024 > 192.168.1.10.6633: Flags [P.], seq 40376:40501, ack 0, win 351, options [nop,nop,TS val 3923648 ecr 349103], length 125: OpenFlow
	version 1.0, type PACKET_IN, length 125, xid 0x00000000
18:05:55.189163 IP 192.168.1.30.41024 > 192.168.1.10.6633: Flags [P.], seq 40501:40626, ack 0, win 351, options [nop,nop,TS val 3923648 ecr 349103], length 125: OpenFlow
	version 1.0, type PACKET_IN, length 125, xid 0x00000000
18:05:55.189177 IP 192.168.1.30.41024 > 192.168.1.10.6633: Flags [P.], seq 40626:40751, ack 0, win 351, options [nop,nop,TS val 3923648 ecr 349103], length 125: OpenFlow
	version 1.0, type PACKET_IN, length 125, xid 0x00000000
18:05:55.189195 IP 192.168.1.30.41024 > 192.168.1.10.6633: Flags [P.], seq 40751:40876, ack 0, win 351, options [nop,nop,TS val 3923648 ecr 349103], length 125: OpenFlow
	version 1.0, type PACKET_IN, length 125, xid 0x00000000
18:05:55.189209 IP 192.168.1.30.41024 > 192.168.1.10.6633: Flags [P.], seq 40876:41001, ack 0, win 351, options [nop,nop,TS val 3923648 ecr 349103], length 125: OpenFlow
	version 1.0, type PACKET_IN, length 125, xid 0x00000000
18:05:55.189223 IP 192.168.1.30.41024 > 192.168.1.10.6633: Flags [P.], seq 41001:41126, ack 0, win 351, options [nop,nop,TS val 3923648 ecr 349103], length 125: OpenFlow
	version 1.0, type PACKET_IN, length 125, xid 0x00000000
18:05:55.189444 IP 192.168.1.10.6633 > 192.168.1.30.41024: Flags [.], ack 39001, win 5793, options [nop,nop,TS val 349106 ecr 3923648], length 0
18:05:55.189456 IP 192.168.1.10.6633 > 192.168.1.30.41024: Flags [.], ack 39126, win 5793, options [nop,nop,TS val 349106 ecr 3923648], length 0
18:05:55.189464 IP 192.168.1.10.6633 > 192.168.1.30.41024: Flags [.], ack 39251, win 5793, options [nop,nop,TS val 349106 ecr 3923648], length 0
18:05:55.189488 IP 192.168.1.10.6633 > 192.168.1.30.41024: Flags [.], ack 39376, win 5793, options [nop,nop,TS val 349106 ecr 3923648], length 0
18:05:55.189504 IP 192.168.1.10.6633 > 192.168.1.30.41024: Flags [.], ack 39501, win 5793, options [nop,nop,TS val 349106 ecr 3923648], length 0
18:05:55.189514 IP 192.168.1.10.6633 > 192.168.1.30.41024: Flags [.], ack 39626, win 5793, options [nop,nop,TS val 349106 ecr 3923648], length 0
18:05:55.189524 IP 192.168.1.10.6633 > 192.168.1.30.41024: Flags [.], ack 39751, win 5793, options [nop,nop,TS val 349106 ecr 3923648], length 0
18:05:55.189531 IP 192.168.1.10.6633 > 192.168.1.30.41024: Flags [.], ack 39876, win 5793, options [nop,nop,TS val 349106 ecr 3923648], length 0
18:05:55.189555 IP 192.168.1.10.6633 > 192.168.1.30.41024: Flags [.], ack 40001, win 5793, options [nop,nop,TS val 349106 ecr 3923648], length 0
18:05:55.189563 IP 192.168.1.10.6633 > 192.168.1.30.41024: Flags [.], ack 40126, win 5793, options [nop,nop,TS val 349106 ecr 3923648], length 0
18:05:55.189587 IP 192.168.1.10.6633 > 192.168.1.30.41024: Flags [.], ack 40251, win 5793, options [nop,nop,TS val 349106 ecr 3923648], length 0
18:05:55.189596 IP 192.168.1.10.6633 > 192.168.1.30.41024: Flags [.], ack 40376, win 5793, options [nop,nop,TS val 349106 ecr 3923648], length 0
18:05:55.189605 IP 192.168.1.10.6633 > 192.168.1.30.41024: Flags [.], ack 40501, win 5793, options [nop,nop,TS val 349106 ecr 3923648], length 0
18:05:55.189614 IP 192.168.1.10.6633 > 192.168.1.30.41024: Flags [.], ack 40626, win 5793, options [nop,nop,TS val 349106 ecr 3923648], length 0
18:05:55.189620 IP 192.168.1.10.6633 > 192.168.1.30.41024: Flags [.], ack 40751, win 5793, options [nop,nop,TS val 349106 ecr 3923648], length 0
18:05:55.189654 IP 192.168.1.10.6633 > 192.168.1.30.41024: Flags [.], ack 41126, win 5793, options [nop,nop,TS val 349107 ecr 3923648], length 0
18:05:55.189813 IP 192.168.1.30.41024 > 192.168.1.10.6633: Flags [.], seq 41126:44022, ack 0, win 351, options [nop,nop,TS val 3923649 ecr 349106], length 2896: OpenFlow
	version 1.0, type PACKET_IN, length 125, xid 0x00000000
	version 1.0, type PACKET_IN, length 125, xid 0x00000000
	version 1.0, type PACKET_IN, length 125, xid 0x00000000
	version 1.0, type PACKET_IN, length 125, xid 0x00000000
	version 1.0, type PACKET_IN, length 125, xid 0x00000000
	version 1.0, type PACKET_IN, length 125, xid 0x00000000
	version 1.0, type PACKET_IN, length 125, xid 0x00000000
	version 1.0, type PACKET_IN, length 125, xid 0x00000000
	version 1.0, type PACKET_IN, length 125, xid 0x00000000
	version 1.0, type PACKET_IN, length 125, xid 0x00000000
	version 1.0, type PACKET_IN, length 125, xid 0x00000000
	version 1.0, type PACKET_IN, length 125, xid 0x00000000
	version 1.0, type PACKET_IN, length 125, xid 0x00000000
	version 1.0, type PACKET_IN, length 125, xid 0x00000000
	version 1.0, type PACKET_IN, length 125, xid 0x00000000
	version 1.0, type PACKET_IN, length 125, xid 0x00000000
	version 1.0, type PACKET_IN, length 125, xid 0x00000000
	version 1.0, type PACKET_IN, length 125, xid 0x00000000
	version 1.0, type PACKET_IN, length 125, xid 0x00000000
	version 1.0, type PACKET_IN, length 125, xid 0x00000000
	version 1.0, type PACKET_IN, length 125, xid 0x00000000
	version 1.0, type PACKET_IN, length 125, xid 0x00000000
	version 1.0, type PACKET_IN, length 125, xid 0x00000000
	version 1.0, type PACKET_IN, length 125, xid 0x00000000 [|openflow]
18:05:55.189824 IP 192.168.1.30.41024 > 192.168.1.10.6633: Flags [.], seq 44022:46918, ack 0, win 351, options [nop,nop,TS val 3923649 ecr 349106], length 2896: OpenFlow
	version unknown (0x00), type 0x00, length 64338, xid 0x69c7f318 [|openflow]
18:05:55.189868 IP 192.168.1.30.41024 > 192.168.1.10.6633: Flags [.], seq 46918:48366, ack 0, win 351, options [nop,nop,TS val 3923649 ecr 349106], length 1448: OpenFlow
	version unknown (0x00), type 0x00, length 0, xid 0x00005069 (corrupt)
18:05:55.189884 IP 192.168.1.30.41024 > 192.168.1.10.6633: Flags [P.], seq 48366:48626, ack 0, win 351, options [nop,nop,TS val 3923649 ecr 349106], length 260: OpenFlow
	version unknown (0x5f), type 0x69, length 28784, xid 0xc012000c [|openflow]
18:05:55.189900 IP 192.168.1.30.41024 > 192.168.1.10.6633: Flags [P.], seq 48626:49126, ack 0, win 351, options [nop,nop,TS val 3923649 ecr 349106], length 500: OpenFlow
	version 1.0, type PACKET_IN, length 125, xid 0x00000000
	version 1.0, type PACKET_IN, length 125, xid 0x00000000
	version 1.0, type PACKET_IN, length 125, xid 0x00000000
	version 1.0, type PACKET_IN, length 125, xid 0x00000000
18:05:55.189907 IP 192.168.1.30.41024 > 192.168.1.10.6633: Flags [P.], seq 49126:49376, ack 0, win 351, options [nop,nop,TS val 3923649 ecr 349106], length 250: OpenFlow
	version 1.0, type PACKET_IN, length 125, xid 0x00000000
	version 1.0, type PACKET_IN, length 125, xid 0x00000000
18:05:55.189915 IP 192.168.1.30.41024 > 192.168.1.10.6633: Flags [P.], seq 49376:49501, ack 0, win 351, options [nop,nop,TS val 3923649 ecr 349106], length 125: OpenFlow
	version 1.0, type PACKET_IN, length 125, xid 0x00000000
18:05:55.189922 IP 192.168.1.30.41024 > 192.168.1.10.6633: Flags [P.], seq 49501:49751, ack 0, win 351, options [nop,nop,TS val 3923649 ecr 349106], length 250: OpenFlow
	version 1.0, type PACKET_IN, length 125, xid 0x00000000
	version 1.0, type PACKET_IN, length 125, xid 0x00000000
18:05:55.189930 IP 192.168.1.30.41024 > 192.168.1.10.6633: Flags [P.], seq 49751:49876, ack 0, win 351, options [nop,nop,TS val 3923649 ecr 349106], length 125: OpenFlow
	version 1.0, type PACKET_IN, length 125, xid 0x00000000
18:05:55.189970 IP 192.168.1.30.41024 > 192.168.1.10.6633: Flags [P.], seq 49876:50251, ack 0, win 351, options [nop,nop,TS val 3923649 ecr 349107], length 375: OpenFlow
	version 1.0, type PACKET_IN, length 125, xid 0x00000000
	version 1.0, type PACKET_IN, length 125, xid 0x00000000
	version 1.0, type PACKET_IN, length 125, xid 0x00000000
18:05:55.190163 IP 192.168.1.30.41024 > 192.168.1.10.6633: Flags [P.], seq 50251:50376, ack 0, win 351, options [nop,nop,TS val 3923649 ecr 349107], length 125: OpenFlow
	version 1.0, type PACKET_IN, length 125, xid 0x00000000
18:05:55.190197 IP 192.168.1.30.41024 > 192.168.1.10.6633: Flags [P.], seq 50376:50501, ack 0, win 351, options [nop,nop,TS val 3923649 ecr 349107], length 125: OpenFlow
	version 1.0, type PACKET_IN, length 125, xid 0x00000000
18:05:55.193003 IP 192.168.1.10.6633 > 192.168.1.30.41024: Flags [.], ack 46918, win 5793, options [nop,nop,TS val 349107 ecr 3923649], length 0
18:05:55.193020 IP 192.168.1.30.41024 > 192.168.1.10.6633: Flags [.], seq 50501:53397, ack 0, win 351, options [nop,nop,TS val 3923649 ecr 349107], length 2896: OpenFlow
	version 1.0, type PACKET_IN, length 125, xid 0x00000000
	version 1.0, type PACKET_IN, length 125, xid 0x00000000
	version 1.0, type PACKET_IN, length 125, xid 0x00000000
	version 1.0, type PACKET_IN, length 125, xid 0x00000000
	version 1.0, type PACKET_IN, length 125, xid 0x00000000
	version 1.0, type PACKET_IN, length 125, xid 0x00000000
	version 1.0, type PACKET_IN, length 125, xid 0x00000000
	version 1.0, type PACKET_IN, length 125, xid 0x00000000
	version 1.0, type PACKET_IN, length 125, xid 0x00000000
	version 1.0, type PACKET_IN, length 125, xid 0x00000000
	version 1.0, type PACKET_IN, length 125, xid 0x00000000
	version 1.0, type PACKET_IN, length 125, xid 0x00000000
	version 1.0, type PACKET_IN, length 125, xid 0x00000000
	version 1.0, type PACKET_IN, length 125, xid 0x00000000
	version 1.0, type PACKET_IN, length 125, xid 0x00000000
	version 1.0, type PACKET_IN, length 125, xid 0x00000000
	version 1.0, type PACKET_IN, length 125, xid 0x00000000
	version 1.0, type PACKET_IN, length 125, xid 0x00000000
	version 1.0, type PACKET_IN, length 125, xid 0x00000000
	version 1.0, type PACKET_IN, length 125, xid 0x00000000
	version 1.0, type PACKET_IN, length 125, xid 0x00000000
	version 1.0, type PACKET_IN, length 125, xid 0x00000000
	version 1.0, type PACKET_IN, length 125, xid 0x00000000
	version 1.0, type PACKET_IN, length 125, xid 0x00000000 [|openflow]
18:05:55.193094 IP 192.168.1.30.41024 > 192.168.1.10.6633: Flags [.], seq 53397:56293, ack 0, win 351, options [nop,nop,TS val 3923649 ecr 349107], length 2896: OpenFlow
	version unknown (0x00), type 0x00, length 64338, xid 0x69c7f318 [|openflow]
18:05:55.193112 IP 192.168.1.10.6633 > 192.168.1.30.41024: Flags [.], ack 48626, win 5793, options [nop,nop,TS val 349107 ecr 3923649], length 0
18:05:55.193124 IP 192.168.1.30.41024 > 192.168.1.10.6633: Flags [.], seq 56293:59189, ack 0, win 351, options [nop,nop,TS val 3923649 ecr 349107], length 2896: OpenFlow
	version unknown (0x00), type 0x00, length 0, xid 0x00005069 (corrupt)
18:05:55.193136 IP 192.168.1.10.6633 > 192.168.1.30.41024: Flags [.], ack 50251, win 5793, options [nop,nop,TS val 349107 ecr 3923649], length 0
18:05:55.193148 IP 192.168.1.30.41024 > 192.168.1.10.6633: Flags [.], seq 59189:62085, ack 0, win 351, options [nop,nop,TS val 3923649 ecr 349107], length 2896: OpenFlow
	version unknown (0x00), type 0x00, length 0, xid 0x00000000 (corrupt)
18:05:55.193159 IP 192.168.1.30.41024 > 192.168.1.10.6633: Flags [.], seq 62085:64981, ack 0, win 351, options [nop,nop,TS val 3923649 ecr 349107], length 2896: OpenFlow
	version unknown (0x00), type 0x02, length 0, xid 0x00000000 (corrupt)
18:05:55.193170 IP 192.168.1.30.41024 > 192.168.1.10.6633: Flags [.], seq 64981:67877, ack 0, win 351, options [nop,nop,TS val 3923649 ecr 349107], length 2896: OpenFlow
	version unknown (0x6f), type 0x63, length 24940, xid 0x00000c00 [|openflow]
18:05:55.193324 IP 192.168.1.10.6633 > 192.168.1.30.41024: Flags [.], ack 50376, win 5793, options [nop,nop,TS val 349107 ecr 3923649], length 0
18:05:55.193411 IP 192.168.1.10.6633 > 192.168.1.30.41024: Flags [.], ack 50501, win 5793, options [nop,nop,TS val 349107 ecr 3923649], length 0
18:05:55.193517 IP 192.168.1.10.6633 > 192.168.1.30.41024: Flags [.], ack 67877, win 5793, options [nop,nop,TS val 349107 ecr 3923649], length 0
18:05:55.193642 IP 192.168.1.30.41024 > 192.168.1.10.6633: Flags [.], seq 67877:70773, ack 0, win 351, options [nop,nop,TS val 3923649 ecr 349107], length 2896: OpenFlow
	version unknown (0x0a), type 0x00, length 32000, xid 0x000000ff [|openflow]
18:05:55.193715 IP 192.168.1.30.41024 > 192.168.1.10.6633: Flags [.], seq 70773:73669, ack 0, win 351, options [nop,nop,TS val 3923650 ecr 349107], length 2896: OpenFlow
	version unknown (0x00), type 0xfb, length 21097, xid 0xc7f318d1 [|openflow]
18:05:55.193725 IP 192.168.1.30.41024 > 192.168.1.10.6633: Flags [.], seq 73669:76565, ack 0, win 351, options [nop,nop,TS val 3923650 ecr 349107], length 2896: OpenFlow
	version unknown (0x00), type 0x00, length 0, xid 0x005069c7 (corrupt)
18:05:55.193735 IP 192.168.1.30.41024 > 192.168.1.10.6633: Flags [.], seq 76565:79461, ack 0, win 351, options [nop,nop,TS val 3923650 ecr 349107], length 2896: OpenFlow
	version unknown (0x00), type 0x00, length 0, xid 0x000000fb (corrupt)
18:05:55.193744 IP 192.168.1.30.41024 > 192.168.1.10.6633: Flags [.], seq 79461:82357, ack 0, win 351, options [nop,nop,TS val 3923650 ecr 349107], length 2896: OpenFlow
	version unknown (0x02), type 0x00, length 0, xid 0x00000005 (corrupt)
18:05:55.193752 IP 192.168.1.30.41024 > 192.168.1.10.6633: Flags [.], seq 82357:85253, ack 0, win 351, options [nop,nop,TS val 3923650 ecr 349107], length 2896: OpenFlow
	version unknown (0x63), type 0x61, length 27648, xid 0x000c0001 [|openflow]
18:05:55.193761 IP 192.168.1.30.41024 > 192.168.1.10.6633: Flags [.], seq 85253:88149, ack 0, win 351, options [nop,nop,TS val 3923650 ecr 349107], length 2896: OpenFlow
	version unknown (0x00), type 0x7d, length 0, xid 0x0000ffff (corrupt)
18:05:55.194159 IP 192.168.1.10.6633 > 192.168.1.30.41024: Flags [.], ack 70773, win 5793, options [nop,nop,TS val 349108 ecr 3923649], length 0
18:05:55.194176 IP 192.168.1.30.41024 > 192.168.1.10.6633: Flags [P.], seq 88149:89251, ack 0, win 351, options [nop,nop,TS val 3923650 ecr 349108], length 1102: OpenFlow
	version unknown (0xfb), type 0x52, length 27079, xid 0xf318d186 [|openflow]
18:05:55.194204 IP 192.168.1.10.6633 > 192.168.1.30.41024: Flags [.], ack 88149, win 5793, options [nop,nop,TS val 349108 ecr 3923650], length 0
18:05:55.196105 IP 192.168.1.10.6633 > 192.168.1.30.41024: Flags [.], ack 89251, win 5793, options [nop,nop,TS val 349108 ecr 3923650], length 0
18:05:55.397042 IP 192.168.1.30.41024 > 192.168.1.10.6633: Flags [P.], seq 89251:89376, ack 0, win 351, options [nop,nop,TS val 3923700 ecr 349108], length 125: OpenFlow
	version 1.0, type PACKET_IN, length 125, xid 0x00000000
18:05:55.397155 IP 192.168.1.30.41024 > 192.168.1.10.6633: Flags [P.], seq 89376:89501, ack 0, win 351, options [nop,nop,TS val 3923700 ecr 349108], length 125: OpenFlow
	version 1.0, type PACKET_IN, length 125, xid 0x00000000
18:05:55.397208 IP 192.168.1.30.41024 > 192.168.1.10.6633: Flags [P.], seq 89501:89626, ack 0, win 351, options [nop,nop,TS val 3923700 ecr 349108], length 125: OpenFlow
	version 1.0, type PACKET_IN, length 125, xid 0x00000000
18:05:55.397343 IP 192.168.1.30.41024 > 192.168.1.10.6633: Flags [P.], seq 89626:89751, ack 0, win 351, options [nop,nop,TS val 3923700 ecr 349108], length 125: OpenFlow
	version 1.0, type PACKET_IN, length 125, xid 0x00000000
18:05:55.397393 IP 192.168.1.30.41024 > 192.168.1.10.6633: Flags [P.], seq 89751:89876, ack 0, win 351, options [nop,nop,TS val 3923700 ecr 349108], length 125: OpenFlow
	version 1.0, type PACKET_IN, length 125, xid 0x00000000
18:05:55.397439 IP 192.168.1.30.41024 > 192.168.1.10.6633: Flags [P.], seq 89876:90001, ack 0, win 351, options [nop,nop,TS val 3923700 ecr 349108], length 125: OpenFlow
	version 1.0, type PACKET_IN, length 125, xid 0x00000000
18:05:55.397496 IP 192.168.1.30.41024 > 192.168.1.10.6633: Flags [P.], seq 90001:90126, ack 0, win 351, options [nop,nop,TS val 3923701 ecr 349108], length 125: OpenFlow
	version 1.0, type PACKET_IN, length 125, xid 0x00000000
18:05:55.397533 IP 192.168.1.30.41024 > 192.168.1.10.6633: Flags [P.], seq 90126:90251, ack 0, win 351, options [nop,nop,TS val 3923701 ecr 349108], length 125: OpenFlow
	version 1.0, type PACKET_IN, length 125, xid 0x00000000
18:05:55.397591 IP 192.168.1.30.41024 > 192.168.1.10.6633: Flags [P.], seq 90251:90376, ack 0, win 351, options [nop,nop,TS val 3923701 ecr 349108], length 125: OpenFlow
	version 1.0, type PACKET_IN, length 125, xid 0x00000000
18:05:55.397636 IP 192.168.1.30.41024 > 192.168.1.10.6633: Flags [P.], seq 90376:90501, ack 0, win 351, options [nop,nop,TS val 3923701 ecr 349108], length 125: OpenFlow
	version 1.0, type PACKET_IN, length 125, xid 0x00000000
18:05:55.397659 IP 192.168.1.30.41024 > 192.168.1.10.6633: Flags [P.], seq 90501:90626, ack 0, win 351, options [nop,nop,TS val 3923701 ecr 349108], length 125: OpenFlow
	version 1.0, type PACKET_IN, length 125, xid 0x00000000
18:05:55.397678 IP 192.168.1.30.41024 > 192.168.1.10.6633: Flags [P.], seq 90626:90751, ack 0, win 351, options [nop,nop,TS val 3923701 ecr 349108], length 125: OpenFlow
	version 1.0, type PACKET_IN, length 125, xid 0x00000000
18:05:55.397702 IP 192.168.1.30.41024 > 192.168.1.10.6633: Flags [P.], seq 90751:90876, ack 0, win 351, options [nop,nop,TS val 3923701 ecr 349108], length 125: OpenFlow
	version 1.0, type PACKET_IN, length 125, xid 0x00000000
18:05:55.397816 IP 192.168.1.30.41024 > 192.168.1.10.6633: Flags [P.], seq 90876:91001, ack 0, win 351, options [nop,nop,TS val 3923701 ecr 349108], length 125: OpenFlow
	version 1.0, type PACKET_IN, length 125, xid 0x00000000
18:05:55.397918 IP 192.168.1.10.6633 > 192.168.1.30.41024: Flags [.], ack 90751, win 5793, options [nop,nop,TS val 349159 ecr 3923700], length 0
18:05:55.397942 IP 192.168.1.30.41024 > 192.168.1.10.6633: Flags [P.], seq 91001:91626, ack 0, win 351, options [nop,nop,TS val 3923701 ecr 349159], length 625: OpenFlow
	version 1.0, type PACKET_IN, length 125, xid 0x00000000
	version 1.0, type PACKET_IN, length 125, xid 0x00000000
	version 1.0, type PACKET_IN, length 125, xid 0x00000000
	version 1.0, type PACKET_IN, length 125, xid 0x00000000
	version 1.0, type PACKET_IN, length 125, xid 0x00000000
18:05:55.397962 IP 192.168.1.30.41024 > 192.168.1.10.6633: Flags [P.], seq 91626:91751, ack 0, win 351, options [nop,nop,TS val 3923701 ecr 349159], length 125: OpenFlow
	version 1.0, type PACKET_IN, length 125, xid 0x00000000
18:05:55.397995 IP 192.168.1.30.41024 > 192.168.1.10.6633: Flags [P.], seq 91751:91876, ack 0, win 351, options [nop,nop,TS val 3923701 ecr 349159], length 125: OpenFlow
	version 1.0, type PACKET_IN, length 125, xid 0x00000000
18:05:55.398014 IP 192.168.1.30.41024 > 192.168.1.10.6633: Flags [P.], seq 91876:92001, ack 0, win 351, options [nop,nop,TS val 3923701 ecr 349159], length 125: OpenFlow
	version 1.0, type PACKET_IN, length 125, xid 0x00000000
18:05:55.398031 IP 192.168.1.30.41024 > 192.168.1.10.6633: Flags [P.], seq 92001:92126, ack 0, win 351, options [nop,nop,TS val 3923701 ecr 349159], length 125: OpenFlow
	version 1.0, type PACKET_IN, length 125, xid 0x00000000
18:05:55.398049 IP 192.168.1.30.41024 > 192.168.1.10.6633: Flags [P.], seq 92126:92251, ack 0, win 351, options [nop,nop,TS val 3923701 ecr 349159], length 125: OpenFlow
	version 1.0, type PACKET_IN, length 125, xid 0x00000000
18:05:55.398078 IP 192.168.1.30.41024 > 192.168.1.10.6633: Flags [P.], seq 92251:92376, ack 0, win 351, options [nop,nop,TS val 3923701 ecr 349159], length 125: OpenFlow
	version 1.0, type PACKET_IN, length 125, xid 0x00000000
18:05:55.398096 IP 192.168.1.30.41024 > 192.168.1.10.6633: Flags [P.], seq 92376:92501, ack 0, win 351, options [nop,nop,TS val 3923701 ecr 349159], length 125: OpenFlow
	version 1.0, type PACKET_IN, length 125, xid 0x00000000
18:05:55.398144 IP 192.168.1.30.41024 > 192.168.1.10.6633: Flags [P.], seq 92501:92626, ack 0, win 351, options [nop,nop,TS val 3923701 ecr 349159], length 125: OpenFlow
	version 1.0, type PACKET_IN, length 125, xid 0x00000000
18:05:55.398163 IP 192.168.1.30.41024 > 192.168.1.10.6633: Flags [P.], seq 92626:92751, ack 0, win 351, options [nop,nop,TS val 3923701 ecr 349159], length 125: OpenFlow
	version 1.0, type PACKET_IN, length 125, xid 0x00000000
18:05:55.398180 IP 192.168.1.30.41024 > 192.168.1.10.6633: Flags [P.], seq 92751:92876, ack 0, win 351, options [nop,nop,TS val 3923701 ecr 349159], length 125: OpenFlow
	version 1.0, type PACKET_IN, length 125, xid 0x00000000
18:05:55.398197 IP 192.168.1.30.41024 > 192.168.1.10.6633: Flags [P.], seq 92876:93001, ack 0, win 351, options [nop,nop,TS val 3923701 ecr 349159], length 125: OpenFlow
	version 1.0, type PACKET_IN, length 125, xid 0x00000000
18:05:55.398244 IP 192.168.1.30.41024 > 192.168.1.10.6633: Flags [P.], seq 93001:93126, ack 0, win 351, options [nop,nop,TS val 3923701 ecr 349159], length 125: OpenFlow
	version 1.0, type PACKET_IN, length 125, xid 0x00000000
18:05:55.398263 IP 192.168.1.10.6633 > 192.168.1.30.41024: Flags [.], ack 92251, win 5793, options [nop,nop,TS val 349159 ecr 3923701], length 0
18:05:55.398291 IP 192.168.1.30.41024 > 192.168.1.10.6633: Flags [P.], seq 93126:93251, ack 0, win 351, options [nop,nop,TS val 3923701 ecr 349159], length 125: OpenFlow
	version 1.0, type PACKET_IN, length 125, xid 0x00000000
18:05:55.398341 IP 192.168.1.30.41024 > 192.168.1.10.6633: Flags [P.], seq 93251:93376, ack 0, win 351, options [nop,nop,TS val 3923701 ecr 349159], length 125: OpenFlow
	version 1.0, type PACKET_IN, length 125, xid 0x00000000
18:05:55.398386 IP 192.168.1.30.41024 > 192.168.1.10.6633: Flags [P.], seq 93376:93501, ack 0, win 351, options [nop,nop,TS val 3923701 ecr 349159], length 125: OpenFlow
	version 1.0, type PACKET_IN, length 125, xid 0x00000000
18:05:55.398426 IP 192.168.1.30.41024 > 192.168.1.10.6633: Flags [P.], seq 93501:93626, ack 0, win 351, options [nop,nop,TS val 3923701 ecr 349159], length 125: OpenFlow
	version 1.0, type PACKET_IN, length 125, xid 0x00000000
18:05:55.398467 IP 192.168.1.30.41024 > 192.168.1.10.6633: Flags [P.], seq 93626:93751, ack 0, win 351, options [nop,nop,TS val 3923701 ecr 349159], length 125: OpenFlow
	version 1.0, type PACKET_IN, length 125, xid 0x00000000
18:05:55.398507 IP 192.168.1.30.41024 > 192.168.1.10.6633: Flags [P.], seq 93751:93876, ack 0, win 351, options [nop,nop,TS val 3923701 ecr 349159], length 125: OpenFlow
	version 1.0, type PACKET_IN, length 125, xid 0x00000000
18:05:55.398549 IP 192.168.1.30.41024 > 192.168.1.10.6633: Flags [P.], seq 93876:94001, ack 0, win 351, options [nop,nop,TS val 3923701 ecr 349159], length 125: OpenFlow
	version 1.0, type PACKET_IN, length 125, xid 0x00000000
18:05:55.398808 IP 192.168.1.30.41024 > 192.168.1.10.6633: Flags [P.], seq 94001:94126, ack 0, win 351, options [nop,nop,TS val 3923701 ecr 349159], length 125: OpenFlow
	version 1.0, type PACKET_IN, length 125, xid 0x00000000
18:05:55.399169 IP 192.168.1.10.6633 > 192.168.1.30.41024: Flags [.], ack 93751, win 5793, options [nop,nop,TS val 349159 ecr 3923701], length 0
18:05:55.399197 IP 192.168.1.30.41024 > 192.168.1.10.6633: Flags [.], seq 94126:95574, ack 0, win 351, options [nop,nop,TS val 3923701 ecr 349159], length 1448: OpenFlow
	version 1.0, type PACKET_IN, length 125, xid 0x00000000
	version 1.0, type PACKET_IN, length 125, xid 0x00000000
	version 1.0, type PACKET_IN, length 125, xid 0x00000000
	version 1.0, type PACKET_IN, length 125, xid 0x00000000
	version 1.0, type PACKET_IN, length 125, xid 0x00000000
	version 1.0, type PACKET_IN, length 125, xid 0x00000000
	version 1.0, type PACKET_IN, length 125, xid 0x00000000
	version 1.0, type PACKET_IN, length 125, xid 0x00000000
	version 1.0, type PACKET_IN, length 125, xid 0x00000000
	version 1.0, type PACKET_IN, length 125, xid 0x00000000
	version 1.0, type PACKET_IN, length 125, xid 0x00000000
	version 1.0, type PACKET_IN, length 125, xid 0x00000000 [|openflow]
18:05:55.399214 IP 192.168.1.30.41024 > 192.168.1.10.6633: Flags [P.], seq 95574:96126, ack 0, win 351, options [nop,nop,TS val 3923701 ecr 349159], length 552: OpenFlow
	version unknown (0xe9), type 0x14, length 59648, xid 0x35a58a00 [|openflow]
18:05:55.399247 IP 192.168.1.30.41024 > 192.168.1.10.6633: Flags [P.], seq 96126:96251, ack 0, win 351, options [nop,nop,TS val 3923701 ecr 349159], length 125: OpenFlow
	version 1.0, type PACKET_IN, length 125, xid 0x00000000
18:05:55.399304 IP 192.168.1.30.41024 > 192.168.1.10.6633: Flags [P.], seq 96251:96376, ack 0, win 351, options [nop,nop,TS val 3923701 ecr 349159], length 125: OpenFlow
	version 1.0, type PACKET_IN, length 125, xid 0x00000000
18:05:55.399347 IP 192.168.1.30.41024 > 192.168.1.10.6633: Flags [P.], seq 96376:96501, ack 0, win 351, options [nop,nop,TS val 3923701 ecr 349159], length 125: OpenFlow
	version 1.0, type PACKET_IN, length 125, xid 0x00000000
18:05:55.399390 IP 192.168.1.30.41024 > 192.168.1.10.6633: Flags [P.], seq 96501:96626, ack 0, win 351, options [nop,nop,TS val 3923701 ecr 349159], length 125: OpenFlow
	version 1.0, type PACKET_IN, length 125, xid 0x00000000
18:05:55.399482 IP 192.168.1.30.41024 > 192.168.1.10.6633: Flags [P.], seq 96626:96751, ack 0, win 351, options [nop,nop,TS val 3923701 ecr 349159], length 125: OpenFlow
	version 1.0, type PACKET_IN, length 125, xid 0x00000000
18:05:55.399527 IP 192.168.1.30.41024 > 192.168.1.10.6633: Flags [P.], seq 96751:96876, ack 0, win 351, options [nop,nop,TS val 3923701 ecr 349159], length 125: OpenFlow
	version 1.0, type PACKET_IN, length 125, xid 0x00000000
18:05:55.399572 IP 192.168.1.30.41024 > 192.168.1.10.6633: Flags [P.], seq 96876:97001, ack 0, win 351, options [nop,nop,TS val 3923701 ecr 349159], length 125: OpenFlow
	version 1.0, type PACKET_IN, length 125, xid 0x00000000
18:05:55.399615 IP 192.168.1.30.41024 > 192.168.1.10.6633: Flags [P.], seq 97001:97126, ack 0, win 351, options [nop,nop,TS val 3923701 ecr 349159], length 125: OpenFlow
	version 1.0, type PACKET_IN, length 125, xid 0x00000000
18:05:55.399657 IP 192.168.1.30.41024 > 192.168.1.10.6633: Flags [P.], seq 97126:97251, ack 0, win 351, options [nop,nop,TS val 3923701 ecr 349159], length 125: OpenFlow
	version 1.0, type PACKET_IN, length 125, xid 0x00000000
18:05:55.399699 IP 192.168.1.30.41024 > 192.168.1.10.6633: Flags [P.], seq 97251:97376, ack 0, win 351, options [nop,nop,TS val 3923701 ecr 349159], length 125: OpenFlow
	version 1.0, type PACKET_IN, length 125, xid 0x00000000
18:05:55.400953 IP 192.168.1.10.6633 > 192.168.1.30.41024: Flags [.], ack 94126, win 5793, options [nop,nop,TS val 349159 ecr 3923701], length 0
18:05:55.400973 IP 192.168.1.30.41024 > 192.168.1.10.6633: Flags [.], seq 97376:100272, ack 0, win 351, options [nop,nop,TS val 3923701 ecr 349159], length 2896: OpenFlow
	version 1.0, type PACKET_IN, length 125, xid 0x00000000
	version 1.0, type PACKET_IN, length 125, xid 0x00000000
	version 1.0, type PACKET_IN, length 125, xid 0x00000000
	version 1.0, type PACKET_IN, length 125, xid 0x00000000
	version 1.0, type PACKET_IN, length 125, xid 0x00000000
	version 1.0, type PACKET_IN, length 125, xid 0x00000000
	version 1.0, type PACKET_IN, length 125, xid 0x00000000
	version 1.0, type PACKET_IN, length 125, xid 0x00000000
	version 1.0, type PACKET_IN, length 125, xid 0x00000000
	version 1.0, type PACKET_IN, length 125, xid 0x00000000
	version 1.0, type PACKET_IN, length 125, xid 0x00000000
	version 1.0, type PACKET_IN, length 125, xid 0x00000000
	version 1.0, type PACKET_IN, length 125, xid 0x00000000
	version 1.0, type PACKET_IN, length 125, xid 0x00000000
	version 1.0, type PACKET_IN, length 125, xid 0x00000000
	version 1.0, type PACKET_IN, length 125, xid 0x00000000
	version 1.0, type PACKET_IN, length 125, xid 0x00000000
	version 1.0, type PACKET_IN, length 125, xid 0x00000000
	version 1.0, type PACKET_IN, length 125, xid 0x00000000
	version 1.0, type PACKET_IN, length 125, xid 0x00000000
	version 1.0, type PACKET_IN, length 125, xid 0x00000000
	version 1.0, type PACKET_IN, length 125, xid 0x00000000
	version 1.0, type PACKET_IN, length 125, xid 0x00000000
	version 1.0, type PACKET_IN, length 125, xid 0x00000000 [|openflow]
18:05:55.400984 IP 192.168.1.10.6633 > 192.168.1.30.41024: Flags [.], ack 96126, win 5793, options [nop,nop,TS val 349159 ecr 3923701], length 0
18:05:55.400993 IP 192.168.1.30.41024 > 192.168.1.10.6633: Flags [.], seq 100272:103168, ack 0, win 351, options [nop,nop,TS val 3923701 ecr 349159], length 2896: OpenFlow
	version unknown (0x00), type 0x00, length 64338, xid 0x69c7f318 [|openflow]
18:05:55.405804 IP 192.168.1.10.6633 > 192.168.1.30.41024: Flags [.], ack 96626, win 5793, options [nop,nop,TS val 349159 ecr 3923701], length 0
18:05:55.405830 IP 192.168.1.30.41024 > 192.168.1.10.6633: Flags [.], seq 103168:106064, ack 0, win 351, options [nop,nop,TS val 3923703 ecr 349159], length 2896: OpenFlow
	version unknown (0x00), type 0x00, length 0, xid 0x00005069 (corrupt)
18:05:55.405843 IP 192.168.1.30.41024 > 192.168.1.10.6633: Flags [.], seq 106064:108960, ack 0, win 351, options [nop,nop,TS val 3923703 ecr 349159], length 2896: OpenFlow
	version unknown (0x00), type 0x00, length 0, xid 0x00000000 (corrupt)
18:05:55.405853 IP 192.168.1.10.6633 > 192.168.1.30.41024: Flags [.], ack 103168, win 5793, options [nop,nop,TS val 349159 ecr 3923701], length 0
18:05:55.405870 IP 192.168.1.30.41024 > 192.168.1.10.6633: Flags [.], seq 108960:111856, ack 0, win 351, options [nop,nop,TS val 3923703 ecr 349159], length 2896: OpenFlow
	version unknown (0x00), type 0x02, length 0, xid 0x00000000 (corrupt)
18:05:55.405887 IP 192.168.1.30.41024 > 192.168.1.10.6633: Flags [.], seq 111856:114752, ack 0, win 351, options [nop,nop,TS val 3923703 ecr 349159], length 2896: OpenFlow
	version unknown (0x6f), type 0x63, length 24940, xid 0x00000c00 [|openflow]
18:05:55.405902 IP 192.168.1.30.41024 > 192.168.1.10.6633: Flags [.], seq 114752:117648, ack 0, win 351, options [nop,nop,TS val 3923703 ecr 349159], length 2896: OpenFlow
	version unknown (0x0a), type 0x00, length 32000, xid 0x000000ff [|openflow]
18:05:55.405918 IP 192.168.1.30.41024 > 192.168.1.10.6633: Flags [.], seq 117648:120544, ack 0, win 351, options [nop,nop,TS val 3923703 ecr 349159], length 2896: OpenFlow
	version unknown (0x00), type 0xfb, length 21097, xid 0xc7f318d1 [|openflow]
18:05:55.405934 IP 192.168.1.30.41024 > 192.168.1.10.6633: Flags [.], seq 120544:123440, ack 0, win 351, options [nop,nop,TS val 3923703 ecr 349159], length 2896: OpenFlow
	version unknown (0x00), type 0x00, length 0, xid 0x005069c7 (corrupt)
18:05:55.413016 IP 192.168.1.10.6633 > 192.168.1.30.41024: Flags [.], ack 123440, win 5793, options [nop,nop,TS val 349162 ecr 3923703], length 0
18:05:55.413032 IP 192.168.1.30.41024 > 192.168.1.10.6633: Flags [.], seq 123440:126336, ack 0, win 351, options [nop,nop,TS val 3923704 ecr 349162], length 2896: OpenFlow
	version unknown (0x00), type 0x00, length 0, xid 0x000000fb (corrupt)
18:05:55.413042 IP 192.168.1.30.41024 > 192.168.1.10.6633: Flags [.], seq 126336:129232, ack 0, win 351, options [nop,nop,TS val 3923704 ecr 349162], length 2896: OpenFlow
	version unknown (0x02), type 0x00, length 0, xid 0x00000005 (corrupt)
18:05:55.413054 IP 192.168.1.30.41024 > 192.168.1.10.6633: Flags [.], seq 129232:132128, ack 0, win 351, options [nop,nop,TS val 3923704 ecr 349162], length 2896: OpenFlow
	version unknown (0x63), type 0x61, length 27648, xid 0x000c0001 [|openflow]
18:05:55.413069 IP 192.168.1.30.41024 > 192.168.1.10.6633: Flags [.], seq 132128:135024, ack 0, win 351, options [nop,nop,TS val 3923704 ecr 349162], length 2896: OpenFlow
	version unknown (0x00), type 0x7d, length 0, xid 0x0000ffff (corrupt)
18:05:55.413080 IP 192.168.1.30.41024 > 192.168.1.10.6633: Flags [.], seq 135024:137920, ack 0, win 351, options [nop,nop,TS val 3923704 ecr 349162], length 2896: OpenFlow
	version unknown (0xfb), type 0x52, length 27079, xid 0xf318d186 [|openflow]
18:05:55.413091 IP 192.168.1.30.41024 > 192.168.1.10.6633: Flags [.], seq 137920:140816, ack 0, win 351, options [nop,nop,TS val 3923704 ecr 349162], length 2896: OpenFlow
	version unknown (0x00), type 0x00, length 0, xid 0x5069c7ff (corrupt)
18:05:55.413102 IP 192.168.1.30.41024 > 192.168.1.10.6633: Flags [.], seq 140816:143712, ack 0, win 351, options [nop,nop,TS val 3923704 ecr 349162], length 2896: OpenFlow
	version unknown (0x00), type 0x00, length 0, xid 0x0000fb14 (corrupt)
18:05:55.417001 IP 192.168.1.10.6633 > 192.168.1.30.41024: Flags [.], ack 143712, win 5793, options [nop,nop,TS val 349163 ecr 3923704], length 0
18:05:55.417026 IP 192.168.1.30.41024 > 192.168.1.10.6633: Flags [.], seq 143712:146608, ack 0, win 351, options [nop,nop,TS val 3923705 ecr 349163], length 2896: OpenFlow
	version unknown (0x00), type 0x00, length 0, xid 0x0000055f (corrupt)
18:05:55.417052 IP 192.168.1.30.41024 > 192.168.1.10.6633: Flags [.], seq 146608:149504, ack 0, win 351, options [nop,nop,TS val 3923705 ecr 349163], length 2896: OpenFlow
	version unknown (0x61), type 0x6c, length 0, xid 0x0c000104 (corrupt)
18:05:55.417075 IP 192.168.1.30.41024 > 192.168.1.10.6633: Flags [.], seq 149504:152400, ack 0, win 351, options [nop,nop,TS val 3923705 ecr 349163], length 2896: OpenFlow
	version unknown (0x7d), type 0x00, length 0, xid 0x00ffffff (corrupt)
18:05:55.417097 IP 192.168.1.30.41024 > 192.168.1.10.6633: Flags [.], seq 152400:155296, ack 0, win 351, options [nop,nop,TS val 3923705 ecr 349163], length 2896: OpenFlow
	version unknown (0x52), type 0x69, length 51187, xid 0x18d186dd [|openflow]
18:05:55.417112 IP 192.168.1.30.41024 > 192.168.1.10.6633: Flags [.], seq 155296:158192, ack 0, win 351, options [nop,nop,TS val 3923705 ecr 349163], length 2896: OpenFlow
	version unknown (0x00), type 0x00, length 80, xid 0x69c7fffe
	version 1.0, type PACKET_IN, length 125, xid 0x00000000
	version 1.0, type PACKET_IN, length 125, xid 0x00000000
	version 1.0, type PACKET_IN, length 125, xid 0x00000000
	version 1.0, type PACKET_IN, length 125, xid 0x00000000
	version 1.0, type PACKET_IN, length 125, xid 0x00000000
	version 1.0, type PACKET_IN, length 125, xid 0x00000000
	version 1.0, type PACKET_IN, length 125, xid 0x00000000
	version 1.0, type PACKET_IN, length 125, xid 0x00000000
	version 1.0, type PACKET_IN, length 125, xid 0x00000000
	version 1.0, type PACKET_IN, length 125, xid 0x00000000
	version 1.0, type PACKET_IN, length 125, xid 0x00000000
	version 1.0, type PACKET_IN, length 125, xid 0x00000000
	version 1.0, type PACKET_IN, length 125, xid 0x00000000
	version 1.0, type PACKET_IN, length 125, xid 0x00000000
	version 1.0, type PACKET_IN, length 125, xid 0x00000000
	version 1.0, type PACKET_IN, length 125, xid 0x00000000
	version 1.0, type PACKET_IN, length 125, xid 0x00000000
	version 1.0, type PACKET_IN, length 125, xid 0x00000000
	version 1.0, type PACKET_IN, length 125, xid 0x00000000
	version 1.0, type PACKET_IN, length 125, xid 0x00000000
	version 1.0, type PACKET_IN, length 125, xid 0x00000000
	version 1.0, type PACKET_IN, length 125, xid 0x00000000
	version 1.0, type PACKET_IN, length 125, xid 0x00000000 [|openflow]
18:05:55.417125 IP 192.168.1.30.41024 > 192.168.1.10.6633: Flags [.], seq 158192:161088, ack 0, win 351, options [nop,nop,TS val 3923705 ecr 349163], length 2896: OpenFlow
	version unknown (0x00), type 0x00, length 0, xid 0x00fb14e9 (corrupt)
18:05:55.417147 IP 192.168.1.30.41024 > 192.168.1.10.6633: Flags [.], seq 161088:163984, ack 0, win 351, options [nop,nop,TS val 3923705 ecr 349163], length 2896: OpenFlow
	version unknown (0x00), type 0x00, length 0, xid 0x00055f69 (corrupt)
18:05:55.417263 IP 192.168.1.10.6633 > 192.168.1.30.41024: Flags [.], ack 155296, win 5793, options [nop,nop,TS val 349163 ecr 3923705], length 0
18:05:55.417286 IP 192.168.1.30.41024 > 192.168.1.10.6633: Flags [.], seq 163984:166880, ack 0, win 351, options [nop,nop,TS val 3923705 ecr 349163], length 2896: OpenFlow
	version unknown (0x6c), type 0x00, length 12, xid 0x0001045f
	version unknown (0x12), type 0x00, length 3072, xid 0x01010a00 [|openflow]
18:05:55.417298 IP 192.168.1.30.41024 > 192.168.1.10.6633: Flags [.], seq 166880:169776, ack 0, win 351, options [nop,nop,TS val 3923705 ecr 349163], length 2896: OpenFlow
	version unknown (0x00), type 0x00, length 0, xid 0xffffffff (corrupt)
18:05:55.417312 IP 192.168.1.30.41024 > 192.168.1.10.6633: Flags [.], seq 169776:172672, ack 0, win 351, options [nop,nop,TS val 3923705 ecr 349163], length 2896: OpenFlow
	version unknown (0x69), type 0xc7, length 62232, xid 0xd186dd60 [|openflow]
18:05:55.417341 IP 192.168.1.30.41024 > 192.168.1.10.6633: Flags [.], seq 172672:175568, ack 0, win 351, options [nop,nop,TS val 3923705 ecr 349163], length 2896: OpenFlow
	version unknown (0x00), type 0x00, length 20585, xid 0xc7fffef3 [|openflow]
18:05:55.417352 IP 192.168.1.10.6633 > 192.168.1.30.41024: Flags [.], ack 163984, win 5793, options [nop,nop,TS val 349163 ecr 3923705], length 0
18:05:55.417372 IP 192.168.1.30.41024 > 192.168.1.10.6633: Flags [.], seq 175568:178464, ack 0, win 351, options [nop,nop,TS val 3923705 ecr 349163], length 2896: OpenFlow
	version unknown (0x00), type 0x00, length 0, xid 0xfb14e914 (corrupt)
18:05:55.417391 IP 192.168.1.10.6633 > 192.168.1.30.41024: Flags [.], ack 166880, win 5793, options [nop,nop,TS val 349163 ecr 3923705], length 0
18:05:55.417398 IP 192.168.1.30.41024 > 192.168.1.10.6633: Flags [.], seq 178464:181360, ack 0, win 351, options [nop,nop,TS val 3923705 ecr 349163], length 2896: OpenFlow
	version unknown (0x00), type 0x00, length 0, xid 0x055f6970 (corrupt)
18:05:55.417422 IP 192.168.1.30.41024 > 192.168.1.10.6633: Flags [.], seq 181360:184256, ack 0, win 351, options [nop,nop,TS val 3923705 ecr 349163], length 2896: OpenFlow
	version unknown (0x00), type 0x00, length 3072, xid 0x01045f69 [|openflow]
18:05:55.417436 IP 192.168.1.30.41024 > 192.168.1.10.6633: Flags [.], seq 184256:187152, ack 0, win 351, options [nop,nop,TS val 3923705 ecr 349163], length 2896: OpenFlow
	version unknown (0x00), type 0x00, length 255, xid 0xffffff00
	version unknown (0xff), type 0xff, length 107, xid 0x00030100
	version unknown (0x70), type 0x70, length 49170, xid 0x000c0001 [|openflow]
18:05:55.418034 IP 192.168.1.10.6633 > 192.168.1.30.41024: Flags [.], ack 175568, win 5793, options [nop,nop,TS val 349164 ecr 3923705], length 0
18:05:55.418051 IP 192.168.1.30.41024 > 192.168.1.10.6633: Flags [.], seq 187152:190048, ack 0, win 351, options [nop,nop,TS val 3923706 ecr 349164], length 2896: OpenFlow
	version unknown (0xc7), type 0xf3, length 6353, xid 0x86dd6000 [|openflow]
18:05:55.418069 IP 192.168.1.30.41024 > 192.168.1.10.6633: Flags [.], seq 190048:192944, ack 0, win 351, options [nop,nop,TS val 3923706 ecr 349164], length 2896: OpenFlow
	version unknown (0x00), type 0x50, length 27079, xid 0xfffef318 [|openflow]
18:05:55.418085 IP 192.168.1.30.41024 > 192.168.1.10.6633: Flags [P.], seq 192944:193001, ack 0, win 351, options [nop,nop,TS val 3923706 ecr 349164], length 57: OpenFlow
	version unknown (0x00), type 0x00, length 251, xid 0x14e914e9 [|openflow]
18:05:55.418789 IP 192.168.1.10.6633 > 192.168.1.30.41024: Flags [.], ack 187152, win 5793, options [nop,nop,TS val 349164 ecr 3923705], length 0
18:05:55.418809 IP 192.168.1.10.6633 > 192.168.1.30.41024: Flags [.], ack 192944, win 5793, options [nop,nop,TS val 349164 ecr 3923706], length 0
18:05:55.418819 IP 192.168.1.10.6633 > 192.168.1.30.41024: Flags [.], ack 193001, win 5793, options [nop,nop,TS val 349164 ecr 3923706], length 0
18:05:55.647643 IP 192.168.1.30.41024 > 192.168.1.10.6633: Flags [P.], seq 193001:193126, ack 0, win 351, options [nop,nop,TS val 3923763 ecr 349164], length 125: OpenFlow
	version 1.0, type PACKET_IN, length 125, xid 0x00000000
18:05:55.647681 IP 192.168.1.30.41024 > 192.168.1.10.6633: Flags [P.], seq 193126:193251, ack 0, win 351, options [nop,nop,TS val 3923763 ecr 349164], length 125: OpenFlow
	version 1.0, type PACKET_IN, length 125, xid 0x00000000
18:05:55.647711 IP 192.168.1.30.41024 > 192.168.1.10.6633: Flags [P.], seq 193251:193376, ack 0, win 351, options [nop,nop,TS val 3923763 ecr 349164], length 125: OpenFlow
	version 1.0, type PACKET_IN, length 125, xid 0x00000000
18:05:55.647739 IP 192.168.1.30.41024 > 192.168.1.10.6633: Flags [P.], seq 193376:193501, ack 0, win 351, options [nop,nop,TS val 3923763 ecr 349164], length 125: OpenFlow
	version 1.0, type PACKET_IN, length 125, xid 0x00000000
18:05:55.647868 IP 192.168.1.10.6633 > 192.168.1.30.41024: Flags [.], ack 193126, win 5793, options [nop,nop,TS val 349221 ecr 3923763], length 0
18:05:55.647879 IP 192.168.1.10.6633 > 192.168.1.30.41024: Flags [.], ack 193251, win 5793, options [nop,nop,TS val 349221 ecr 3923763], length 0
18:05:55.647885 IP 192.168.1.10.6633 > 192.168.1.30.41024: Flags [.], ack 193376, win 5793, options [nop,nop,TS val 349221 ecr 3923763], length 0
18:05:55.647915 IP 192.168.1.10.6633 > 192.168.1.30.41024: Flags [.], ack 193501, win 5793, options [nop,nop,TS val 349221 ecr 3923763], length 0
18:05:55.648114 IP 192.168.1.30.41024 > 192.168.1.10.6633: Flags [P.], seq 193501:193626, ack 0, win 351, options [nop,nop,TS val 3923763 ecr 349221], length 125: OpenFlow
	version 1.0, type PACKET_IN, length 125, xid 0x00000000
18:05:55.648144 IP 192.168.1.30.41024 > 192.168.1.10.6633: Flags [P.], seq 193626:193751, ack 0, win 351, options [nop,nop,TS val 3923763 ecr 349221], length 125: OpenFlow
	version 1.0, type PACKET_IN, length 125, xid 0x00000000
18:05:55.648172 IP 192.168.1.30.41024 > 192.168.1.10.6633: Flags [P.], seq 193751:193876, ack 0, win 351, options [nop,nop,TS val 3923763 ecr 349221], length 125: OpenFlow
	version 1.0, type PACKET_IN, length 125, xid 0x00000000
18:05:55.648200 IP 192.168.1.30.41024 > 192.168.1.10.6633: Flags [P.], seq 193876:194001, ack 0, win 351, options [nop,nop,TS val 3923763 ecr 349221], length 125: OpenFlow
	version 1.0, type PACKET_IN, length 125, xid 0x00000000
18:05:55.648227 IP 192.168.1.30.41024 > 192.168.1.10.6633: Flags [P.], seq 194001:194126, ack 0, win 351, options [nop,nop,TS val 3923763 ecr 349221], length 125: OpenFlow
	version 1.0, type PACKET_IN, length 125, xid 0x00000000
18:05:55.648255 IP 192.168.1.30.41024 > 192.168.1.10.6633: Flags [P.], seq 194126:194251, ack 0, win 351, options [nop,nop,TS val 3923763 ecr 349221], length 125: OpenFlow
	version 1.0, type PACKET_IN, length 125, xid 0x00000000
18:05:55.648293 IP 192.168.1.30.41024 > 192.168.1.10.6633: Flags [P.], seq 194251:194376, ack 0, win 351, options [nop,nop,TS val 3923763 ecr 349221], length 125: OpenFlow
	version 1.0, type PACKET_IN, length 125, xid 0x00000000
18:05:55.648323 IP 192.168.1.30.41024 > 192.168.1.10.6633: Flags [P.], seq 194376:194501, ack 0, win 351, options [nop,nop,TS val 3923763 ecr 349221], length 125: OpenFlow
	version 1.0, type PACKET_IN, length 125, xid 0x00000000
18:05:55.648351 IP 192.168.1.30.41024 > 192.168.1.10.6633: Flags [P.], seq 194501:194626, ack 0, win 351, options [nop,nop,TS val 3923763 ecr 349221], length 125: OpenFlow
	version 1.0, type PACKET_IN, length 125, xid 0x00000000
18:05:55.648545 IP 192.168.1.30.41024 > 192.168.1.10.6633: Flags [P.], seq 194626:194751, ack 0, win 351, options [nop,nop,TS val 3923763 ecr 349221], length 125: OpenFlow
	version 1.0, type PACKET_IN, length 125, xid 0x00000000
18:05:55.651760 IP 192.168.1.10.6633 > 192.168.1.30.41024: Flags [.], ack 193626, win 5793, options [nop,nop,TS val 349222 ecr 3923763], length 0
18:05:55.651775 IP 192.168.1.30.41024 > 192.168.1.10.6633: Flags [.], seq 194751:197647, ack 0, win 351, options [nop,nop,TS val 3923764 ecr 349222], length 2896: OpenFlow
	version 1.0, type PACKET_IN, length 125, xid 0x00000000
	version 1.0, type PACKET_IN, length 125, xid 0x00000000
	version 1.0, type PACKET_IN, length 125, xid 0x00000000
	version 1.0, type PACKET_IN, length 125, xid 0x00000000
	version 1.0, type PACKET_IN, length 125, xid 0x00000000
	version 1.0, type PACKET_IN, length 125, xid 0x00000000
	version 1.0, type PACKET_IN, length 125, xid 0x00000000
	version 1.0, type PACKET_IN, length 125, xid 0x00000000
	version 1.0, type PACKET_IN, length 125, xid 0x00000000
	version 1.0, type PACKET_IN, length 125, xid 0x00000000
	version 1.0, type PACKET_IN, length 125, xid 0x00000000
	version 1.0, type PACKET_IN, length 125, xid 0x00000000
	version 1.0, type PACKET_IN, length 125, xid 0x00000000
	version 1.0, type PACKET_IN, length 125, xid 0x00000000
	version 1.0, type PACKET_IN, length 125, xid 0x00000000
	version 1.0, type PACKET_IN, length 125, xid 0x00000000
	version 1.0, type PACKET_IN, length 125, xid 0x00000000
	version 1.0, type PACKET_IN, length 125, xid 0x00000000
	version 1.0, type PACKET_IN, length 125, xid 0x00000000
	version 1.0, type PACKET_IN, length 125, xid 0x00000000
	version 1.0, type PACKET_IN, length 125, xid 0x00000000
	version 1.0, type PACKET_IN, length 125, xid 0x00000000
	version 1.0, type PACKET_IN, length 125, xid 0x00000000
	version 1.0, type PACKET_IN, length 125, xid 0x00000000 [|openflow]
18:05:55.651786 IP 192.168.1.10.6633 > 192.168.1.30.41024: Flags [.], ack 193751, win 5793, options [nop,nop,TS val 349222 ecr 3923763], length 0
18:05:55.651799 IP 192.168.1.30.41024 > 192.168.1.10.6633: Flags [.], seq 197647:200543, ack 0, win 351, options [nop,nop,TS val 3923764 ecr 349222], length 2896: OpenFlow
	version unknown (0x00), type 0x00, length 64338, xid 0x69c7f318 [|openflow]
18:05:55.651813 IP 192.168.1.10.6633 > 192.168.1.30.41024: Flags [.], ack 193876, win 5793, options [nop,nop,TS val 349222 ecr 3923763], length 0
18:05:55.651826 IP 192.168.1.30.41024 > 192.168.1.10.6633: Flags [.], seq 200543:203439, ack 0, win 351, options [nop,nop,TS val 3923764 ecr 349222], length 2896: OpenFlow
	version unknown (0x00), type 0x00, length 0, xid 0x00005069 (corrupt)
18:05:55.651837 IP 192.168.1.10.6633 > 192.168.1.30.41024: Flags [.], ack 194001, win 5793, options [nop,nop,TS val 349222 ecr 3923763], length 0
18:05:55.651849 IP 192.168.1.30.41024 > 192.168.1.10.6633: Flags [.], seq 203439:206335, ack 0, win 351, options [nop,nop,TS val 3923764 ecr 349222], length 2896: OpenFlow
	version unknown (0x00), type 0x00, length 0, xid 0x00000000 (corrupt)
18:05:55.651859 IP 192.168.1.10.6633 > 192.168.1.30.41024: Flags [.], ack 194126, win 5793, options [nop,nop,TS val 349222 ecr 3923763], length 0
18:05:55.651873 IP 192.168.1.10.6633 > 192.168.1.30.41024: Flags [.], ack 194251, win 5793, options [nop,nop,TS val 349222 ecr 3923763], length 0
18:05:55.651889 IP 192.168.1.30.41024 > 192.168.1.10.6633: Flags [.], seq 206335:209231, ack 0, win 351, options [nop,nop,TS val 3923764 ecr 349222], length 2896: OpenFlow
	version unknown (0x00), type 0x02, length 0, xid 0x00000000 (corrupt)
18:05:55.651901 IP 192.168.1.10.6633 > 192.168.1.30.41024: Flags [.], ack 194376, win 5793, options [nop,nop,TS val 349222 ecr 3923763], length 0
18:05:55.651911 IP 192.168.1.30.41024 > 192.168.1.10.6633: Flags [.], seq 209231:212127, ack 0, win 351, options [nop,nop,TS val 3923764 ecr 349222], length 2896: OpenFlow
	version unknown (0x6f), type 0x63, length 24940, xid 0x00000c00 [|openflow]
18:05:55.651928 IP 192.168.1.10.6633 > 192.168.1.30.41024: Flags [.], ack 194501, win 5793, options [nop,nop,TS val 349222 ecr 3923763], length 0
18:05:55.651938 IP 192.168.1.10.6633 > 192.168.1.30.41024: Flags [.], ack 194626, win 5793, options [nop,nop,TS val 349222 ecr 3923763], length 0
18:05:55.651946 IP 192.168.1.30.41024 > 192.168.1.10.6633: Flags [.], seq 212127:215023, ack 0, win 351, options [nop,nop,TS val 3923764 ecr 349222], length 2896: OpenFlow
	version unknown (0x0a), type 0x00, length 32000, xid 0x000000ff [|openflow]
18:05:55.651964 IP 192.168.1.10.6633 > 192.168.1.30.41024: Flags [.], ack 194751, win 5793, options [nop,nop,TS val 349222 ecr 3923763], length 0
18:05:55.651974 IP 192.168.1.30.41024 > 192.168.1.10.6633: Flags [.], seq 215023:217919, ack 0, win 351, options [nop,nop,TS val 3923764 ecr 349222], length 2896: OpenFlow
	version unknown (0x00), type 0xfb, length 21097, xid 0xc7f318d1 [|openflow]
18:05:55.655896 IP 192.168.1.10.6633 > 192.168.1.30.41024: Flags [.], ack 217919, win 5793, options [nop,nop,TS val 349223 ecr 3923764], length 0
18:05:55.655914 IP 192.168.1.30.41024 > 192.168.1.10.6633: Flags [.], seq 217919:220815, ack 0, win 351, options [nop,nop,TS val 3923765 ecr 349223], length 2896: OpenFlow
	version unknown (0x00), type 0x00, length 0, xid 0x005069c7 (corrupt)
18:05:55.655928 IP 192.168.1.30.41024 > 192.168.1.10.6633: Flags [.], seq 220815:223711, ack 0, win 351, options [nop,nop,TS val 3923765 ecr 349223], length 2896: OpenFlow
	version unknown (0x00), type 0x00, length 0, xid 0x000000fb (corrupt)
18:05:55.655941 IP 192.168.1.30.41024 > 192.168.1.10.6633: Flags [.], seq 223711:226607, ack 0, win 351, options [nop,nop,TS val 3923765 ecr 349223], length 2896: OpenFlow
	version unknown (0x02), type 0x00, length 0, xid 0x00000005 (corrupt)
18:05:55.655954 IP 192.168.1.30.41024 > 192.168.1.10.6633: Flags [.], seq 226607:229503, ack 0, win 351, options [nop,nop,TS val 3923765 ecr 349223], length 2896: OpenFlow
	version unknown (0x63), type 0x61, length 27648, xid 0x000c0001 [|openflow]
18:05:55.655966 IP 192.168.1.30.41024 > 192.168.1.10.6633: Flags [.], seq 229503:232399, ack 0, win 351, options [nop,nop,TS val 3923765 ecr 349223], length 2896: OpenFlow
	version unknown (0x00), type 0x7d, length 0, xid 0x0000ffff (corrupt)
18:05:55.655979 IP 192.168.1.30.41024 > 192.168.1.10.6633: Flags [.], seq 232399:235295, ack 0, win 351, options [nop,nop,TS val 3923765 ecr 349223], length 2896: OpenFlow
	version unknown (0xfb), type 0x52, length 27079, xid 0xf318d186 [|openflow]
18:05:55.655992 IP 192.168.1.30.41024 > 192.168.1.10.6633: Flags [.], seq 235295:238191, ack 0, win 351, options [nop,nop,TS val 3923765 ecr 349223], length 2896: OpenFlow
	version unknown (0x00), type 0x00, length 0, xid 0x5069c7ff (corrupt)
18:05:55.656005 IP 192.168.1.30.41024 > 192.168.1.10.6633: Flags [.], seq 238191:241087, ack 0, win 351, options [nop,nop,TS val 3923765 ecr 349223], length 2896: OpenFlow
	version unknown (0x00), type 0x00, length 0, xid 0x0000fb14 (corrupt)
18:05:55.660291 IP 192.168.1.10.6633 > 192.168.1.30.41024: Flags [.], ack 241087, win 5793, options [nop,nop,TS val 349224 ecr 3923765], length 0
18:05:55.660313 IP 192.168.1.30.41024 > 192.168.1.10.6633: Flags [.], seq 241087:243983, ack 0, win 351, options [nop,nop,TS val 3923766 ecr 349224], length 2896: OpenFlow
	version unknown (0x00), type 0x00, length 0, xid 0x0000055f (corrupt)
18:05:55.660330 IP 192.168.1.30.41024 > 192.168.1.10.6633: Flags [.], seq 243983:246879, ack 0, win 351, options [nop,nop,TS val 3923766 ecr 349224], length 2896: OpenFlow
	version unknown (0x61), type 0x6c, length 0, xid 0x0c000104 (corrupt)

