18:05:55.009598 IP 192.168.1.30.41328 > 192.168.1.10.6633: Flags [.], seq 2727602082:2727603530, ack 965758998, win 58, options [nop,nop,TS val 3923604 ecr 349058], length 1448: OpenFlow
	version unknown (0x0a), type 0x00, length 32000, xid 0x000000ff [|openflow]
18:05:55.040373 IP 192.168.1.10.6633 > 192.168.1.30.41328: Flags [.], ack 1448, win 2418, options [nop,nop,TS val 349069 ecr 3923598], length 0
18:05:55.040398 IP 192.168.1.30.41328 > 192.168.1.10.6633: Flags [.], seq 1448:2896, ack 1, win 58, options [nop,nop,TS val 3923611 ecr 349069], length 1448: OpenFlow
	version unknown (0x14), type 0xe9, length 53, xid 0xa58a0000
	version unknown (0x00), type 0x7d, length 0, xid 0x0000ffff (corrupt)
18:05:55.040411 IP 192.168.1.30.41328 > 192.168.1.10.6633: Flags [.], seq 2896:5792, ack 1, win 58, options [nop,nop,TS val 3923611 ecr 349069], length 2896: OpenFlow
	version unknown (0x00), type 0xfb, length 21097, xid 0xc7f318d1 [|openflow]
18:05:55.040706 IP 192.168.1.30.41328 > 192.168.1.10.6633: Flags [.], seq 5792:8688, ack 1, win 58, options [nop,nop,TS val 3923611 ecr 349069], length 2896: OpenFlow
	version unknown (0x00), type 0x00, length 0, xid 0x005069c7 (corrupt)
18:05:55.040721 IP 192.168.1.30.41328 > 192.168.1.10.6633: Flags [.], seq 8688:11584, ack 1, win 58, options [nop,nop,TS val 3923611 ecr 349069], length 2896: OpenFlow
	version unknown (0x00), type 0x00, length 0, xid 0x000000fb (corrupt)
18:05:55.040732 IP 192.168.1.30.41328 > 192.168.1.10.6633: Flags [.], seq 11584:14480, ack 1, win 58, options [nop,nop,TS val 3923611 ecr 349069], length 2896: OpenFlow
	version unknown (0x02), type 0x00, length 0, xid 0x00000005 (corrupt)
18:05:55.040743 IP 192.168.1.30.41328 > 192.168.1.10.6633: Flags [.], seq 14480:17376, ack 1, win 58, options [nop,nop,TS val 3923611 ecr 349069], length 2896: OpenFlow
	version unknown (0x63), type 0x61, length 27648, xid 0x000c0001 [|openflow]
18:05:55.040758 IP 192.168.1.30.41328 > 192.168.1.10.6633: Flags [.], seq 17376:20272, ack 1, win 58, options [nop,nop,TS val 3923611 ecr 349069], length 2896: OpenFlow
	version unknown (0x00), type 0x7d, length 0, xid 0x0000ffff (corrupt)
18:05:55.040768 IP 192.168.1.30.41328 > 192.168.1.10.6633: Flags [.], seq 20272:23168, ack 1, win 58, options [nop,nop,TS val 3923611 ecr 349069], length 2896: OpenFlow
	version unknown (0xfb), type 0x52, length 27079, xid 0xf318d186 [|openflow]
18:05:55.040777 IP 192.168.1.30.41328 > 192.168.1.10.6633: Flags [.], seq 23168:26064, ack 1, win 58, options [nop,nop,TS val 3923611 ecr 349069], length 2896: OpenFlow
	version unknown (0x00), type 0x00, length 0, xid 0x5069c7ff (corrupt)
18:05:55.040786 IP 192.168.1.30.41328 > 192.168.1.10.6633: Flags [.], seq 26064:27512, ack 1, win 58, options [nop,nop,TS val 3923611 ecr 349069], length 1448: OpenFlow
	version unknown (0x00), type 0x00, length 0, xid 0x0000fb14 (corrupt)
18:05:55.040802 IP 192.168.1.30.41328 > 192.168.1.10.6633: Flags [P.], seq 27512:28624, ack 1, win 58, options [nop,nop,TS val 3923611 ecr 349069], length 1112: OpenFlow
	version unknown (0x6b), type 0x00, length 769, xid 0x00333300
	version unknown (0x60), type 0x00, length 0, xid 0x003511ff (corrupt)
18:05:55.061501 IP 192.168.1.30.41328 > 192.168.1.10.6633: Flags [P.], seq 27512:28624, ack 1, win 58, options [nop,nop,TS val 3923617 ecr 349069], length 1112: OpenFlow
	version unknown (0x6b), type 0x00, length 769, xid 0x00333300
	version unknown (0x60), type 0x00, length 0, xid 0x003511ff (corrupt)
18:05:55.071746 IP 192.168.1.10.6633 > 192.168.1.30.41328: Flags [.], ack 28624, win 2275, options [nop,nop,TS val 349073 ecr 3923611,nop,nop,sack 1 {27512:28624}], length 0
18:05:55.082547 IP 192.168.1.30.41328 > 192.168.1.10.6633: Flags [P.], seq 28624:28749, ack 1, win 58, options [nop,nop,TS val 3923622 ecr 349073], length 125: OpenFlow
	version 1.0, type PACKET_IN, length 125, xid 0x00000000
18:05:55.082586 IP 192.168.1.30.41328 > 192.168.1.10.6633: Flags [P.], seq 28749:28874, ack 1, win 58, options [nop,nop,TS val 3923622 ecr 349073], length 125: OpenFlow
	version 1.0, type PACKET_IN, length 125, xid 0x00000000
18:05:55.082611 IP 192.168.1.30.41328 > 192.168.1.10.6633: Flags [P.], seq 28874:28999, ack 1, win 58, options [nop,nop,TS val 3923622 ecr 349073], length 125: OpenFlow
	version 1.0, type PACKET_IN, length 125, xid 0x00000000
18:05:55.082638 IP 192.168.1.30.41328 > 192.168.1.10.6633: Flags [P.], seq 28999:29124, ack 1, win 58, options [nop,nop,TS val 3923622 ecr 349073], length 125: OpenFlow
	version 1.0, type PACKET_IN, length 125, xid 0x00000000
18:05:55.082669 IP 192.168.1.30.41328 > 192.168.1.10.6633: Flags [P.], seq 29124:29249, ack 1, win 58, options [nop,nop,TS val 3923622 ecr 349073], length 125: OpenFlow
	version 1.0, type PACKET_IN, length 125, xid 0x00000000
18:05:55.082699 IP 192.168.1.30.41328 > 192.168.1.10.6633: Flags [P.], seq 29249:29374, ack 1, win 58, options [nop,nop,TS val 3923622 ecr 349073], length 125: OpenFlow
	version 1.0, type PACKET_IN, length 125, xid 0x00000000
18:05:55.083096 IP 192.168.1.10.6633 > 192.168.1.30.41328: Flags [.], ack 28749, win 2275, options [nop,nop,TS val 349080 ecr 3923622], length 0
18:05:55.083106 IP 192.168.1.10.6633 > 192.168.1.30.41328: Flags [.], ack 28874, win 2275, options [nop,nop,TS val 349080 ecr 3923622], length 0
18:05:55.083118 IP 192.168.1.10.6633 > 192.168.1.30.41328: Flags [.], ack 28999, win 2275, options [nop,nop,TS val 349080 ecr 3923622], length 0
18:05:55.083126 IP 192.168.1.10.6633 > 192.168.1.30.41328: Flags [.], ack 29124, win 2275, options [nop,nop,TS val 349080 ecr 3923622], length 0
18:05:55.083136 IP 192.168.1.10.6633 > 192.168.1.30.41328: Flags [.], ack 29249, win 2275, options [nop,nop,TS val 349080 ecr 3923622], length 0
18:05:55.083162 IP 192.168.1.10.6633 > 192.168.1.30.41328: Flags [.], ack 29374, win 2275, options [nop,nop,TS val 349080 ecr 3923622], length 0
18:05:55.088800 IP 192.168.1.30.41328 > 192.168.1.10.6633: Flags [P.], seq 29374:29499, ack 1, win 58, options [nop,nop,TS val 3923622 ecr 349073], length 125: OpenFlow
	version 1.0, type PACKET_IN, length 125, xid 0x00000000
18:05:55.088813 IP 192.168.1.30.41328 > 192.168.1.10.6633: Flags [P.], seq 29499:29624, ack 1, win 58, options [nop,nop,TS val 3923622 ecr 349073], length 125: OpenFlow
	version 1.0, type PACKET_IN, length 125, xid 0x00000000
18:05:55.088868 IP 192.168.1.30.41328 > 192.168.1.10.6633: Flags [P.], seq 29624:29749, ack 1, win 58, options [nop,nop,TS val 3923622 ecr 349073], length 125: OpenFlow
	version 1.0, type PACKET_IN, length 125, xid 0x00000000
18:05:55.088892 IP 192.168.1.30.41328 > 192.168.1.10.6633: Flags [P.], seq 29749:29874, ack 1, win 58, options [nop,nop,TS val 3923622 ecr 349073], length 125: OpenFlow
	version 1.0, type PACKET_IN, length 125, xid 0x00000000
18:05:55.088902 IP 192.168.1.30.41328 > 192.168.1.10.6633: Flags [P.], seq 29874:29999, ack 1, win 58, options [nop,nop,TS val 3923622 ecr 349073], length 125: OpenFlow
	version 1.0, type PACKET_IN, length 125, xid 0x00000000
18:05:55.089167 IP 192.168.1.10.6633 > 192.168.1.30.41328: Flags [.], ack 29499, win 2275, options [nop,nop,TS val 349081 ecr 3923622], length 0
18:05:55.089185 IP 192.168.1.10.6633 > 192.168.1.30.41328: Flags [.], ack 29624, win 2275, options [nop,nop,TS val 349081 ecr 3923622], length 0
18:05:55.089220 IP 192.168.1.30.41328 > 192.168.1.10.6633: Flags [P.], seq 29999:30124, ack 1, win 58, options [nop,nop,TS val 3923622 ecr 349073], length 125: OpenFlow
	version 1.0, type PACKET_IN, length 125, xid 0x00000000
18:05:55.089258 IP 192.168.1.30.41328 > 192.168.1.10.6633: Flags [P.], seq 30124:30249, ack 1, win 58, options [nop,nop,TS val 3923622 ecr 349073], length 125: OpenFlow
	version 1.0, type PACKET_IN, length 125, xid 0x00000000
18:05:55.089274 IP 192.168.1.30.41328 > 192.168.1.10.6633: Flags [P.], seq 30249:30374, ack 1, win 58, options [nop,nop,TS val 3923622 ecr 349073], length 125: OpenFlow
	version 1.0, type PACKET_IN, length 125, xid 0x00000000
18:05:55.089289 IP 192.168.1.30.41328 > 192.168.1.10.6633: Flags [P.], seq 30374:30499, ack 1, win 58, options [nop,nop,TS val 3923622 ecr 349073], length 125: OpenFlow
	version 1.0, type PACKET_IN, length 125, xid 0x00000000
18:05:55.089302 IP 192.168.1.30.41328 > 192.168.1.10.6633: Flags [P.], seq 30499:30624, ack 1, win 58, options [nop,nop,TS val 3923622 ecr 349073], length 125: OpenFlow
	version 1.0, type PACKET_IN, length 125, xid 0x00000000
18:05:55.089316 IP 192.168.1.30.41328 > 192.168.1.10.6633: Flags [P.], seq 30624:30749, ack 1, win 58, options [nop,nop,TS val 3923622 ecr 349073], length 125: OpenFlow
	version 1.0, type PACKET_IN, length 125, xid 0x00000000
18:05:55.089330 IP 192.168.1.30.41328 > 192.168.1.10.6633: Flags [P.], seq 30749:30874, ack 1, win 58, options [nop,nop,TS val 3923622 ecr 349073], length 125: OpenFlow
	version 1.0, type PACKET_IN, length 125, xid 0x00000000
18:05:55.089388 IP 192.168.1.30.41328 > 192.168.1.10.6633: Flags [P.], seq 30874:30999, ack 1, win 58, options [nop,nop,TS val 3923622 ecr 349073], length 125: OpenFlow
	version 1.0, type PACKET_IN, length 125, xid 0x00000000
18:05:55.089430 IP 192.168.1.30.41328 > 192.168.1.10.6633: Flags [P.], seq 30999:31499, ack 1, win 58, options [nop,nop,TS val 3923622 ecr 349080], length 500: OpenFlow
	version 1.0, type PACKET_IN, length 125, xid 0x00000000
	version 1.0, type PACKET_IN, length 125, xid 0x00000000
	version 1.0, type PACKET_IN, length 125, xid 0x00000000
	version 1.0, type PACKET_IN, length 125, xid 0x00000000
18:05:55.089444 IP 192.168.1.30.41328 > 192.168.1.10.6633: Flags [P.], seq 31499:31624, ack 1, win 58, options [nop,nop,TS val 3923622 ecr 349080], length 125: OpenFlow
	version 1.0, type PACKET_IN, length 125, xid 0x00000000
18:05:55.089527 IP 192.168.1.10.6633 > 192.168.1.30.41328: Flags [.], ack 29749, win 2275, options [nop,nop,TS val 349081 ecr 3923622], length 0
18:05:55.089539 IP 192.168.1.10.6633 > 192.168.1.30.41328: Flags [.], ack 29874, win 2275, options [nop,nop,TS val 349081 ecr 3923622], length 0
18:05:55.089549 IP 192.168.1.10.6633 > 192.168.1.30.41328: Flags [.], ack 29999, win 2275, options [nop,nop,TS val 349081 ecr 3923622], length 0
18:05:55.089557 IP 192.168.1.10.6633 > 192.168.1.30.41328: Flags [.], ack 30124, win 2275, options [nop,nop,TS val 349081 ecr 3923622], length 0
18:05:55.089567 IP 192.168.1.10.6633 > 192.168.1.30.41328: Flags [.], ack 30249, win 2275, options [nop,nop,TS val 349081 ecr 3923622], length 0
18:05:55.089575 IP 192.168.1.10.6633 > 192.168.1.30.41328: Flags [.], ack 30374, win 2275, options [nop,nop,TS val 349081 ecr 3923622], length 0
18:05:55.089584 IP 192.168.1.10.6633 > 192.168.1.30.41328: Flags [.], ack 30499, win 2275, options [nop,nop,TS val 349081 ecr 3923622], length 0
18:05:55.089694 IP 192.168.1.30.41328 > 192.168.1.10.6633: Flags [P.], seq 31624:31999, ack 1, win 58, options [nop,nop,TS val 3923622 ecr 349080], length 375: OpenFlow
	version 1.0, type PACKET_IN, length 125, xid 0x00000000
	version 1.0, type PACKET_IN, length 125, xid 0x00000000
	version 1.0, type PACKET_IN, length 125, xid 0x00000000
18:05:55.090497 IP 192.168.1.30.41328 > 192.168.1.10.6633: Flags [.], seq 31999:34895, ack 1, win 58, options [nop,nop,TS val 3923623 ecr 349081], length 2896: OpenFlow
	version 1.0, type PACKET_IN, length 125, xid 0x00000000
	version 1.0, type PACKET_IN, length 125, xid 0x00000000
	version 1.0, type PACKET_IN, length 125, xid 0x00000000
	version 1.0, type PACKET_IN, length 125, xid 0x00000000
	version 1.0, type PACKET_IN, length 125, xid 0x00000000
	version 1.0, type PACKET_IN, length 125, xid 0x00000000
	version 1.0, type PACKET_IN, length 125, xid 0x00000000
	version 1.0, type PACKET_IN, length 125, xid 0x00000000
	version 1.0, type PACKET_IN, length 125, xid 0x00000000
	version 1.0, type PACKET_IN, length 125, xid 0x00000000
	version 1.0, type PACKET_IN, length 125, xid 0x00000000
	version 1.0, type PACKET_IN, length 125, xid 0x00000000
	version 1.0, type PACKET_IN, length 125, xid 0x00000000
	version 1.0, type PACKET_IN, length 125, xid 0x00000000
	version 1.0, type PACKET_IN, length 125, xid 0x00000000
	version 1.0, type PACKET_IN, length 125, xid 0x00000000
	version 1.0, type PACKET_IN, length 125, xid 0x00000000
	version 1.0, type PACKET_IN, length 125, xid 0x00000000
	version 1.0, type PACKET_IN, length 125, xid 0x00000000
	version 1.0, type PACKET_IN, length 125, xid 0x00000000
	version 1.0, type PACKET_IN, length 125, xid 0x00000000
	version 1.0, type PACKET_IN, length 125, xid 0x00000000
	version 1.0, type PACKET_IN, length 125, xid 0x00000000
	version 1.0, type PACKET_IN, length 125, xid 0x00000000 [|openflow]
18:05:55.090510 IP 192.168.1.30.41328 > 192.168.1.10.6633: Flags [.], seq 34895:37791, ack 1, win 58, options [nop,nop,TS val 3923624 ecr 349081], length 2896: OpenFlow
	version unknown (0x00), type 0x00, length 64338, xid 0x69c7f318 [|openflow]
18:05:55.090520 IP 192.168.1.30.41328 > 192.168.1.10.6633: Flags [.], seq 37791:40687, ack 1, win 58, options [nop,nop,TS val 3923624 ecr 349081], length 2896: OpenFlow
	version unknown (0x00), type 0x00, length 0, xid 0x00005069 (corrupt)
18:05:55.090529 IP 192.168.1.30.41328 > 192.168.1.10.6633: Flags [.], seq 40687:43583, ack 1, win 58, options [nop,nop,TS val 3923624 ecr 349081], length 2896: OpenFlow
	version unknown (0x00), type 0x00, length 0, xid 0x00000000 (corrupt)
18:05:55.125562 IP 192.168.1.10.6633 > 192.168.1.30.41328: Flags [.], ack 43583, win 2173, options [nop,nop,TS val 349091 ecr 3923622], length 0
18:05:55.125682 IP 192.168.1.30.41328 > 192.168.1.10.6633: Flags [.], seq 43583:46479, ack 1, win 58, options [nop,nop,TS val 3923633 ecr 349091], length 2896: OpenFlow
	version unknown (0x00), type 0x02, length 0, xid 0x00000000 (corrupt)
18:05:55.125692 IP 192.168.1.30.41328 > 192.168.1.10.6633: Flags [.], seq 46479:49375, ack 1, win 58, options [nop,nop,TS val 3923633 ecr 349091], length 2896: OpenFlow
	version unknown (0x6f), type 0x63, length 24940, xid 0x00000c00 [|openflow]
18:05:55.125780 IP 192.168.1.30.41328 > 192.168.1.10.6633: Flags [.], seq 49375:52271, ack 1, win 58, options [nop,nop,TS val 3923633 ecr 349091], length 2896: OpenFlow
	version unknown (0x0a), type 0x00, length 32000, xid 0x000000ff [|openflow]
18:05:55.125791 IP 192.168.1.30.41328 > 192.168.1.10.6633: Flags [.], seq 52271:55167, ack 1, win 58, options [nop,nop,TS val 3923633 ecr 349091], length 2896: OpenFlow
	version unknown (0x00), type 0xfb, length 21097, xid 0xc7f318d1 [|openflow]
18:05:55.125801 IP 192.168.1.30.41328 > 192.168.1.10.6633: Flags [.], seq 55167:58063, ack 1, win 58, options [nop,nop,TS val 3923633 ecr 349091], length 2896: OpenFlow
	version unknown (0x00), type 0x00, length 0, xid 0x005069c7 (corrupt)
18:05:55.125810 IP 192.168.1.30.41328 > 192.168.1.10.6633: Flags [.], seq 58063:60959, ack 1, win 58, options [nop,nop,TS val 3923633 ecr 349091], length 2896: OpenFlow
	version unknown (0x00), type 0x00, length 0, xid 0x000000fb (corrupt)
18:05:55.125820 IP 192.168.1.30.41328 > 192.168.1.10.6633: Flags [.], seq 60959:63855, ack 1, win 58, options [nop,nop,TS val 3923633 ecr 349091], length 2896: OpenFlow
	version unknown (0x02), type 0x00, length 0, xid 0x00000005 (corrupt)
18:05:55.125841 IP 192.168.1.30.41328 > 192.168.1.10.6633: Flags [.], seq 63855:66751, ack 1, win 58, options [nop,nop,TS val 3923633 ecr 349091], length 2896: OpenFlow
	version unknown (0x63), type 0x61, length 27648, xid 0x000c0001 [|openflow]
18:05:55.150980 IP 192.168.1.30.41328 > 192.168.1.10.6633: Flags [.], seq 66751:68199, ack 1, win 58, options [nop,nop,TS val 3923639 ecr 349091], length 1448: OpenFlow
	version unknown (0x00), type 0x7d, length 0, xid 0x0000ffff (corrupt)
18:05:55.154102 IP 192.168.1.10.6633 > 192.168.1.30.41328: Flags [.], ack 66751, win 2184, options [nop,nop,TS val 349097 ecr 3923633], length 0
18:05:55.154126 IP 192.168.1.30.41328 > 192.168.1.10.6633: Flags [.], seq 68199:69647, ack 1, win 58, options [nop,nop,TS val 3923640 ecr 349097], length 1448: OpenFlow
	version unknown (0xe9), type 0x00, length 13733, xid 0x8a000000 [|openflow]
18:05:55.154136 IP 192.168.1.30.41328 > 192.168.1.10.6633: Flags [.], seq 69647:72543, ack 1, win 58, options [nop,nop,TS val 3923640 ecr 349097], length 2896: OpenFlow
	version unknown (0xfb), type 0x52, length 27079, xid 0xf318d186 [|openflow]
18:05:55.154155 IP 192.168.1.30.41328 > 192.168.1.10.6633: Flags [.], seq 72543:75439, ack 1, win 58, options [nop,nop,TS val 3923640 ecr 349097], length 2896: OpenFlow
	version unknown (0x00), type 0x00, length 0, xid 0x5069c7ff (corrupt)
18:05:55.154178 IP 192.168.1.30.41328 > 192.168.1.10.6633: Flags [P.], seq 75439:76624, ack 1, win 58, options [nop,nop,TS val 3923640 ecr 349097], length 1185: OpenFlow
	version unknown (0x00), type 0x00, length 0, xid 0x0000fb14 (corrupt)
18:05:55.158089 IP 192.168.1.10.6633 > 192.168.1.30.41328: Flags [.], ack 76624, win 2308, options [nop,nop,TS val 349098 ecr 3923639], length 0
18:05:55.195848 IP 192.168.1.30.41328 > 192.168.1.10.6633: Flags [P.], seq 76624:76749, ack 1, win 58, options [nop,nop,TS val 3923650 ecr 349098], length 125: OpenFlow
	version 1.0, type PACKET_IN, length 125, xid 0x00000000
18:05:55.195882 IP 192.168.1.30.41328 > 192.168.1.10.6633: Flags [P.], seq 76749:76874, ack 1, win 58, options [nop,nop,TS val 3923650 ecr 349098], length 125: OpenFlow
	version 1.0, type PACKET_IN, length 125, xid 0x00000000
18:05:55.195904 IP 192.168.1.30.41328 > 192.168.1.10.6633: Flags [P.], seq 76874:76999, ack 1, win 58, options [nop,nop,TS val 3923650 ecr 349098], length 125: OpenFlow
	version 1.0, type PACKET_IN, length 125, xid 0x00000000
18:05:55.195924 IP 192.168.1.30.41328 > 192.168.1.10.6633: Flags [P.], seq 76999:77124, ack 1, win 58, options [nop,nop,TS val 3923650 ecr 349098], length 125: OpenFlow
	version 1.0, type PACKET_IN, length 125, xid 0x00000000
18:05:55.195945 IP 192.168.1.30.41328 > 192.168.1.10.6633: Flags [P.], seq 77124:77249, ack 1, win 58, options [nop,nop,TS val 3923650 ecr 349098], length 125: OpenFlow
	version 1.0, type PACKET_IN, length 125, xid 0x00000000
18:05:55.195966 IP 192.168.1.30.41328 > 192.168.1.10.6633: Flags [P.], seq 77249:77374, ack 1, win 58, options [nop,nop,TS val 3923650 ecr 349098], length 125: OpenFlow
	version 1.0, type PACKET_IN, length 125, xid 0x00000000
18:05:55.196019 IP 192.168.1.30.41328 > 192.168.1.10.6633: Flags [P.], seq 77374:77499, ack 1, win 58, options [nop,nop,TS val 3923650 ecr 349098], length 125: OpenFlow
	version 1.0, type PACKET_IN, length 125, xid 0x00000000
18:05:55.196042 IP 192.168.1.30.41328 > 192.168.1.10.6633: Flags [P.], seq 77499:77624, ack 1, win 58, options [nop,nop,TS val 3923650 ecr 349098], length 125: OpenFlow
	version 1.0, type PACKET_IN, length 125, xid 0x00000000
18:05:55.196071 IP 192.168.1.30.41328 > 192.168.1.10.6633: Flags [P.], seq 77624:77749, ack 1, win 58, options [nop,nop,TS val 3923650 ecr 349098], length 125: OpenFlow
	version 1.0, type PACKET_IN, length 125, xid 0x00000000
18:05:55.196094 IP 192.168.1.30.41328 > 192.168.1.10.6633: Flags [P.], seq 77749:77874, ack 1, win 58, options [nop,nop,TS val 3923650 ecr 349098], length 125: OpenFlow
	version 1.0, type PACKET_IN, length 125, xid 0x00000000
18:05:55.196113 IP 192.168.1.30.41328 > 192.168.1.10.6633: Flags [P.], seq 77874:77999, ack 1, win 58, options [nop,nop,TS val 3923650 ecr 349098], length 125: OpenFlow
	version 1.0, type PACKET_IN, length 125, xid 0x00000000
18:05:55.196154 IP 192.168.1.30.41328 > 192.168.1.10.6633: Flags [P.], seq 77999:78124, ack 1, win 58, options [nop,nop,TS val 3923650 ecr 349098], length 125: OpenFlow
	version 1.0, type PACKET_IN, length 125, xid 0x00000000
18:05:55.196165 IP 192.168.1.30.41328 > 192.168.1.10.6633: Flags [P.], seq 78124:78249, ack 1, win 58, options [nop,nop,TS val 3923650 ecr 349098], length 125: OpenFlow
	version 1.0, type PACKET_IN, length 125, xid 0x00000000
18:05:55.196175 IP 192.168.1.30.41328 > 192.168.1.10.6633: Flags [P.], seq 78249:78374, ack 1, win 58, options [nop,nop,TS val 3923650 ecr 349098], length 125: OpenFlow
	version 1.0, type PACKET_IN, length 125, xid 0x00000000
18:05:55.196258 IP 192.168.1.10.6633 > 192.168.1.30.41328: Flags [.], ack 77374, win 2506, options [nop,nop,TS val 349108 ecr 3923650], length 0
18:05:55.196276 IP 192.168.1.30.41328 > 192.168.1.10.6633: Flags [P.], seq 78374:78499, ack 1, win 58, options [nop,nop,TS val 3923650 ecr 349108], length 125: OpenFlow
	version 1.0, type PACKET_IN, length 125, xid 0x00000000
18:05:55.196302 IP 192.168.1.30.41328 > 192.168.1.10.6633: Flags [P.], seq 78499:78624, ack 1, win 58, options [nop,nop,TS val 3923650 ecr 349108], length 125: OpenFlow
	version 1.0, type PACKET_IN, length 125, xid 0x00000000
18:05:55.196317 IP 192.168.1.10.6633 > 192.168.1.30.41328: Flags [.], ack 78374, win 2506, options [nop,nop,TS val 349108 ecr 3923650], length 0
18:05:55.196331 IP 192.168.1.30.41328 > 192.168.1.10.6633: Flags [P.], seq 78624:78749, ack 1, win 58, options [nop,nop,TS val 3923650 ecr 349108], length 125: OpenFlow
	version 1.0, type PACKET_IN, length 125, xid 0x00000000
18:05:55.196359 IP 192.168.1.30.41328 > 192.168.1.10.6633: Flags [P.], seq 78749:78874, ack 1, win 58, options [nop,nop,TS val 3923650 ecr 349108], length 125: OpenFlow
	version 1.0, type PACKET_IN, length 125, xid 0x00000000
18:05:55.196378 IP 192.168.1.30.41328 > 192.168.1.10.6633: Flags [P.], seq 78874:78999, ack 1, win 58, options [nop,nop,TS val 3923650 ecr 349108], length 125: OpenFlow
	version 1.0, type PACKET_IN, length 125, xid 0x00000000
18:05:55.196431 IP 192.168.1.30.41328 > 192.168.1.10.6633: Flags [P.], seq 78999:79124, ack 1, win 58, options [nop,nop,TS val 3923650 ecr 349108], length 125: OpenFlow
	version 1.0, type PACKET_IN, length 125, xid 0x00000000
18:05:55.196453 IP 192.168.1.30.41328 > 192.168.1.10.6633: Flags [P.], seq 79124:79249, ack 1, win 58, options [nop,nop,TS val 3923650 ecr 349108], length 125: OpenFlow
	version 1.0, type PACKET_IN, length 125, xid 0x00000000
18:05:55.196473 IP 192.168.1.30.41328 > 192.168.1.10.6633: Flags [P.], seq 79249:79374, ack 1, win 58, options [nop,nop,TS val 3923650 ecr 349108], length 125: OpenFlow
	version 1.0, type PACKET_IN, length 125, xid 0x00000000
18:05:55.196492 IP 192.168.1.30.41328 > 192.168.1.10.6633: Flags [P.], seq 79374:79499, ack 1, win 58, options [nop,nop,TS val 3923650 ecr 349108], length 125: OpenFlow
	version 1.0, type PACKET_IN, length 125, xid 0x00000000
18:05:55.196529 IP 192.168.1.30.41328 > 192.168.1.10.6633: Flags [P.], seq 79499:79624, ack 1, win 58, options [nop,nop,TS val 3923650 ecr 349108], length 125: OpenFlow
	version 1.0, type PACKET_IN, length 125, xid 0x00000000
18:05:55.196550 IP 192.168.1.30.41328 > 192.168.1.10.6633: Flags [P.], seq 79624:79749, ack 1, win 58, options [nop,nop,TS val 3923650 ecr 349108], length 125: OpenFlow
	version 1.0, type PACKET_IN, length 125, xid 0x00000000
18:05:55.196571 IP 192.168.1.30.41328 > 192.168.1.10.6633: Flags [P.], seq 79749:79874, ack 1, win 58, options [nop,nop,TS val 3923650 ecr 349108], length 125: OpenFlow
	version 1.0, type PACKET_IN, length 125, xid 0x00000000
18:05:55.196592 IP 192.168.1.30.41328 > 192.168.1.10.6633: Flags [P.], seq 79874:79999, ack 1, win 58, options [nop,nop,TS val 3923650 ecr 349108], length 125: OpenFlow
	version 1.0, type PACKET_IN, length 125, xid 0x00000000
18:05:55.196610 IP 192.168.1.30.41328 > 192.168.1.10.6633: Flags [P.], seq 79999:80124, ack 1, win 58, options [nop,nop,TS val 3923650 ecr 349108], length 125: OpenFlow
	version 1.0, type PACKET_IN, length 125, xid 0x00000000
18:05:55.196616 IP 192.168.1.10.6633 > 192.168.1.30.41328: Flags [.], ack 78999, win 2506, options [nop,nop,TS val 349108 ecr 3923650], length 0
18:05:55.196632 IP 192.168.1.30.41328 > 192.168.1.10.6633: Flags [P.], seq 80124:80249, ack 1, win 58, options [nop,nop,TS val 3923650 ecr 349108], length 125: OpenFlow
	version 1.0, type PACKET_IN, length 125, xid 0x00000000
18:05:55.196650 IP 192.168.1.30.41328 > 192.168.1.10.6633: Flags [P.], seq 80249:80374, ack 1, win 58, options [nop,nop,TS val 3923650 ecr 349108], length 125: OpenFlow
	version 1.0, type PACKET_IN, length 125, xid 0x00000000
18:05:55.196719 IP 192.168.1.30.41328 > 192.168.1.10.6633: Flags [P.], seq 80374:80499, ack 1, win 58, options [nop,nop,TS val 3923650 ecr 349108], length 125: OpenFlow
	version 1.0, type PACKET_IN, length 125, xid 0x00000000
18:05:55.196749 IP 192.168.1.30.41328 > 192.168.1.10.6633: Flags [P.], seq 80499:80624, ack 1, win 58, options [nop,nop,TS val 3923650 ecr 349108], length 125: OpenFlow
	version 1.0, type PACKET_IN, length 125, xid 0x00000000
18:05:55.196787 IP 192.168.1.30.41328 > 192.168.1.10.6633: Flags [P.], seq 80624:80749, ack 1, win 58, options [nop,nop,TS val 3923650 ecr 349108], length 125: OpenFlow
	version 1.0, type PACKET_IN, length 125, xid 0x00000000
18:05:55.196816 IP 192.168.1.30.41328 > 192.168.1.10.6633: Flags [P.], seq 80749:80874, ack 1, win 58, options [nop,nop,TS val 3923650 ecr 349108], length 125: OpenFlow
	version 1.0, type PACKET_IN, length 125, xid 0x00000000
18:05:55.196841 IP 192.168.1.30.41328 > 192.168.1.10.6633: Flags [P.], seq 80874:80999, ack 1, win 58, options [nop,nop,TS val 3923650 ecr 349108], length 125: OpenFlow
	version 1.0, type PACKET_IN, length 125, xid 0x00000000
18:05:55.196846 IP 192.168.1.10.6633 > 192.168.1.30.41328: Flags [.], ack 79499, win 2506, options [nop,nop,TS val 349108 ecr 3923650], length 0
18:05:55.196862 IP 192.168.1.30.41328 > 192.168.1.10.6633: Flags [P.], seq 80999:81124, ack 1, win 58, options [nop,nop,TS val 3923650 ecr 349108], length 125: OpenFlow
	version 1.0, type PACKET_IN, length 125, xid 0x00000000
18:05:55.196861 IP 192.168.1.10.6633 > 192.168.1.30.41328: Flags [.], ack 80124, win 2506, options [nop,nop,TS val 349108 ecr 3923650], length 0
18:05:55.196954 IP 192.168.1.30.41328 > 192.168.1.10.6633: Flags [P.], seq 81124:81249, ack 1, win 58, options [nop,nop,TS val 3923650 ecr 349108], length 125: OpenFlow
	version 1.0, type PACKET_IN, length 125, xid 0x00000000
18:05:55.196971 IP 192.168.1.30.41328 > 192.168.1.10.6633: Flags [P.], seq 81249:81374, ack 1, win 58, options [nop,nop,TS val 3923650 ecr 349108], length 125: OpenFlow
	version 1.0, type PACKET_IN, length 125, xid 0x00000000
18:05:55.196985 IP 192.168.1.30.41328 > 192.168.1.10.6633: Flags [P.], seq 81374:81499, ack 1, win 58, options [nop,nop,TS val 3923650 ecr 349108], length 125: OpenFlow
	version 1.0, type PACKET_IN, length 125, xid 0x00000000
18:05:55.196999 IP 192.168.1.30.41328 > 192.168.1.10.6633: Flags [P.], seq 81499:81624, ack 1, win 58, options [nop,nop,TS val 3923650 ecr 349108], length 125: OpenFlow
	version 1.0, type PACKET_IN, length 125, xid 0x00000000
18:05:55.197012 IP 192.168.1.30.41328 > 192.168.1.10.6633: Flags [P.], seq 81624:81749, ack 1, win 58, options [nop,nop,TS val 3923650 ecr 349108], length 125: OpenFlow
	version 1.0, type PACKET_IN, length 125, xid 0x00000000
18:05:55.197026 IP 192.168.1.30.41328 > 192.168.1.10.6633: Flags [P.], seq 81749:81874, ack 1, win 58, options [nop,nop,TS val 3923650 ecr 349108], length 125: OpenFlow
	version 1.0, type PACKET_IN, length 125, xid 0x00000000
18:05:55.197039 IP 192.168.1.30.41328 > 192.168.1.10.6633: Flags [P.], seq 81874:81999, ack 1, win 58, options [nop,nop,TS val 3923650 ecr 349108], length 125: OpenFlow
	version 1.0, type PACKET_IN, length 125, xid 0x00000000
18:05:55.197053 IP 192.168.1.30.41328 > 192.168.1.10.6633: Flags [P.], seq 81999:82124, ack 1, win 58, options [nop,nop,TS val 3923650 ecr 349108], length 125: OpenFlow
	version 1.0, type PACKET_IN, length 125, xid 0x00000000
18:05:55.198289 IP 192.168.1.10.6633 > 192.168.1.30.41328: Flags [.], ack 80374, win 2506, options [nop,nop,TS val 349108 ecr 3923650], length 0
18:05:55.198305 IP 192.168.1.30.41328 > 192.168.1.10.6633: Flags [.], seq 82124:85020, ack 1, win 58, options [nop,nop,TS val 3923651 ecr 349108], length 2896: OpenFlow
	version 1.0, type PACKET_IN, length 125, xid 0x00000000
	version 1.0, type PACKET_IN, length 125, xid 0x00000000
	version 1.0, type PACKET_IN, length 125, xid 0x00000000
	version 1.0, type PACKET_IN, length 125, xid 0x00000000
	version 1.0, type PACKET_IN, length 125, xid 0x00000000
	version 1.0, type PACKET_IN, length 125, xid 0x00000000
	version 1.0, type PACKET_IN, length 125, xid 0x00000000
	version 1.0, type PACKET_IN, length 125, xid 0x00000000
	version 1.0, type PACKET_IN, length 125, xid 0x00000000
	version 1.0, type PACKET_IN, length 125, xid 0x00000000
	version 1.0, type PACKET_IN, length 125, xid 0x00000000
	version 1.0, type PACKET_IN, length 125, xid 0x00000000
	version 1.0, type PACKET_IN, length 125, xid 0x00000000
	version 1.0, type PACKET_IN, length 125, xid 0x00000000
	version 1.0, type PACKET_IN, length 125, xid 0x00000000
	version 1.0, type PACKET_IN, length 125, xid 0x00000000
	version 1.0, type PACKET_IN, length 125, xid 0x00000000
	version 1.0, type PACKET_IN, length 125, xid 0x00000000
	version 1.0, type PACKET_IN, length 125, xid 0x00000000
	version 1.0, type PACKET_IN, length 125, xid 0x00000000
	version 1.0, type PACKET_IN, length 125, xid 0x00000000
	version 1.0, type PACKET_IN, length 125, xid 0x00000000
	version 1.0, type PACKET_IN, length 125, xid 0x00000000
	version 1.0, type PACKET_IN, length 125, xid 0x00000000 [|openflow]
18:05:55.198317 IP 192.168.1.10.6633 > 192.168.1.30.41328: Flags [.], ack 80874, win 2506, options [nop,nop,TS val 349108 ecr 3923650], length 0
18:05:55.198327 IP 192.168.1.30.41328 > 192.168.1.10.6633: Flags [.], seq 85020:87916, ack 1, win 58, options [nop,nop,TS val 3923651 ecr 349108], length 2896: OpenFlow
	version unknown (0x00), type 0x00, length 64338, xid 0x69c7f318 [|openflow]
18:05:55.198356 IP 192.168.1.10.6633 > 192.168.1.30.41328: Flags [.], ack 81624, win 2506, options [nop,nop,TS val 349108 ecr 3923650], length 0
18:05:55.198368 IP 192.168.1.10.6633 > 192.168.1.30.41328: Flags [.], ack 81999, win 2506, options [nop,nop,TS val 349108 ecr 3923650], length 0
18:05:55.198378 IP 192.168.1.30.41328 > 192.168.1.10.6633: Flags [.], seq 87916:90812, ack 1, win 58, options [nop,nop,TS val 3923651 ecr 349108], length 2896: OpenFlow
	version unknown (0x00), type 0x00, length 0, xid 0x00005069 (corrupt)
18:05:55.198378 IP 192.168.1.10.6633 > 192.168.1.30.41328: Flags [.], ack 82124, win 2506, options [nop,nop,TS val 349109 ecr 3923650], length 0
18:05:55.198385 IP 192.168.1.30.41328 > 192.168.1.10.6633: Flags [.], seq 90812:93708, ack 1, win 58, options [nop,nop,TS val 3923651 ecr 349108], length 2896: OpenFlow
	version unknown (0x00), type 0x00, length 0, xid 0x00000000 (corrupt)
18:05:55.198392 IP 192.168.1.30.41328 > 192.168.1.10.6633: Flags [.], seq 93708:96604, ack 1, win 58, options [nop,nop,TS val 3923651 ecr 349108], length 2896: OpenFlow
	version unknown (0x00), type 0x02, length 0, xid 0x00000000 (corrupt)
18:05:55.198414 IP 192.168.1.30.41328 > 192.168.1.10.6633: Flags [.], seq 96604:99500, ack 1, win 58, options [nop,nop,TS val 3923651 ecr 349108], length 2896: OpenFlow
	version unknown (0x6f), type 0x63, length 24940, xid 0x00000c00 [|openflow]
18:05:55.198420 IP 192.168.1.30.41328 > 192.168.1.10.6633: Flags [.], seq 99500:102396, ack 1, win 58, options [nop,nop,TS val 3923651 ecr 349108], length 2896: OpenFlow
	version unknown (0x0a), type 0x00, length 32000, xid 0x000000ff [|openflow]
18:05:55.198427 IP 192.168.1.30.41328 > 192.168.1.10.6633: Flags [.], seq 102396:105292, ack 1, win 58, options [nop,nop,TS val 3923651 ecr 349109], length 2896: OpenFlow
	version unknown (0x00), type 0xfb, length 21097, xid 0xc7f318d1 [|openflow]
18:05:55.198612 IP 192.168.1.10.6633 > 192.168.1.30.41328: Flags [.], ack 105292, win 2442, options [nop,nop,TS val 349109 ecr 3923651], length 0
18:05:55.198635 IP 192.168.1.30.41328 > 192.168.1.10.6633: Flags [.], seq 105292:108188, ack 1, win 58, options [nop,nop,TS val 3923651 ecr 349109], length 2896: OpenFlow
	version unknown (0x00), type 0x00, length 0, xid 0x005069c7 (corrupt)
18:05:55.198689 IP 192.168.1.30.41328 > 192.168.1.10.6633: Flags [.], seq 108188:111084, ack 1, win 58, options [nop,nop,TS val 3923651 ecr 349109], length 2896: OpenFlow
	version unknown (0x00), type 0x00, length 0, xid 0x000000fb (corrupt)
18:05:55.198696 IP 192.168.1.30.41328 > 192.168.1.10.6633: Flags [.], seq 111084:113980, ack 1, win 58, options [nop,nop,TS val 3923651 ecr 349109], length 2896: OpenFlow
	version unknown (0x02), type 0x00, length 0, xid 0x00000005 (corrupt)
18:05:55.198717 IP 192.168.1.30.41328 > 192.168.1.10.6633: Flags [.], seq 113980:116876, ack 1, win 58, options [nop,nop,TS val 3923651 ecr 349109], length 2896: OpenFlow
	version unknown (0x63), type 0x61, length 27648, xid 0x000c0001 [|openflow]
18:05:55.198723 IP 192.168.1.30.41328 > 192.168.1.10.6633: Flags [.], seq 116876:119772, ack 1, win 58, options [nop,nop,TS val 3923651 ecr 349109], length 2896: OpenFlow
	version unknown (0x00), type 0x7d, length 0, xid 0x0000ffff (corrupt)
18:05:55.198730 IP 192.168.1.30.41328 > 192.168.1.10.6633: Flags [.], seq 119772:121220, ack 1, win 58, options [nop,nop,TS val 3923651 ecr 349109], length 1448: OpenFlow
	version unknown (0xfb), type 0x52, length 27079, xid 0xf318d186 [|openflow]
18:05:55.198736 IP 192.168.1.30.41328 > 192.168.1.10.6633: Flags [P.], seq 121220:122249, ack 1, win 58, options [nop,nop,TS val 3923651 ecr 349109], length 1029: OpenFlow
	version unknown (0x70), type 0x73, length 1119, xid 0x74637005 [|openflow]
18:05:55.198901 IP 192.168.1.10.6633 > 192.168.1.30.41328: Flags [.], ack 119772, win 2366, options [nop,nop,TS val 349109 ecr 3923651], length 0
18:05:55.198971 IP 192.168.1.10.6633 > 192.168.1.30.41328: Flags [.], ack 122249, win 2351, options [nop,nop,TS val 349109 ecr 3923651], length 0
18:05:55.409036 IP 192.168.1.30.41328 > 192.168.1.10.6633: Flags [P.], seq 122249:122374, ack 1, win 58, options [nop,nop,TS val 3923703 ecr 349109], length 125: OpenFlow
	version 1.0, type PACKET_IN, length 125, xid 0x00000000
18:05:55.409072 IP 192.168.1.30.41328 > 192.168.1.10.6633: Flags [P.], seq 122374:122499, ack 1, win 58, options [nop,nop,TS val 3923703 ecr 349109], length 125: OpenFlow
	version 1.0, type PACKET_IN, length 125, xid 0x00000000
18:05:55.409094 IP 192.168.1.30.41328 > 192.168.1.10.6633: Flags [P.], seq 122499:122624, ack 1, win 58, options [nop,nop,TS val 3923703 ecr 349109], length 125: OpenFlow
	version 1.0, type PACKET_IN, length 125, xid 0x00000000
18:05:55.409128 IP 192.168.1.30.41328 > 192.168.1.10.6633: Flags [P.], seq 122624:122749, ack 1, win 58, options [nop,nop,TS val 3923703 ecr 349109], length 125: OpenFlow
	version 1.0, type PACKET_IN, length 125, xid 0x00000000
18:05:55.409160 IP 192.168.1.30.41328 > 192.168.1.10.6633: Flags [P.], seq 122749:122874, ack 1, win 58, options [nop,nop,TS val 3923703 ecr 349109], length 125: OpenFlow
	version 1.0, type PACKET_IN, length 125, xid 0x00000000
18:05:55.409182 IP 192.168.1.30.41328 > 192.168.1.10.6633: Flags [P.], seq 122874:122999, ack 1, win 58, options [nop,nop,TS val 3923703 ecr 349109], length 125: OpenFlow
	version 1.0, type PACKET_IN, length 125, xid 0x00000000
18:05:55.409213 IP 192.168.1.30.41328 > 192.168.1.10.6633: Flags [P.], seq 122999:123124, ack 1, win 58, options [nop,nop,TS val 3923703 ecr 349109], length 125: OpenFlow
	version 1.0, type PACKET_IN, length 125, xid 0x00000000
18:05:55.409236 IP 192.168.1.30.41328 > 192.168.1.10.6633: Flags [P.], seq 123124:123249, ack 1, win 58, options [nop,nop,TS val 3923703 ecr 349109], length 125: OpenFlow
	version 1.0, type PACKET_IN, length 125, xid 0x00000000
18:05:55.409254 IP 192.168.1.30.41328 > 192.168.1.10.6633: Flags [P.], seq 123249:123374, ack 1, win 58, options [nop,nop,TS val 3923703 ecr 349109], length 125: OpenFlow
	version 1.0, type PACKET_IN, length 125, xid 0x00000000
18:05:55.409326 IP 192.168.1.30.41328 > 192.168.1.10.6633: Flags [P.], seq 123374:123499, ack 1, win 58, options [nop,nop,TS val 3923703 ecr 349109], length 125: OpenFlow
	version 1.0, type PACKET_IN, length 125, xid 0x00000000
18:05:55.413125 IP 192.168.1.10.6633 > 192.168.1.30.41328: Flags [.], ack 123499, win 2506, options [nop,nop,TS val 349162 ecr 3923703], length 0
18:05:55.413143 IP 192.168.1.30.41328 > 192.168.1.10.6633: Flags [.], seq 123499:126395, ack 1, win 58, options [nop,nop,TS val 3923704 ecr 349162], length 2896: OpenFlow
	version 1.0, type PACKET_IN, length 125, xid 0x00000000
	version 1.0, type PACKET_IN, length 125, xid 0x00000000
	version 1.0, type PACKET_IN, length 125, xid 0x00000000
	version 1.0, type PACKET_IN, length 125, xid 0x00000000
	version 1.0, type PACKET_IN, length 125, xid 0x00000000
	version 1.0, type PACKET_IN, length 125, xid 0x00000000
	version 1.0, type PACKET_IN, length 125, xid 0x00000000
	version 1.0, type PACKET_IN, length 125, xid 0x00000000
	version 1.0, type PACKET_IN, length 125, xid 0x00000000
	version 1.0, type PACKET_IN, length 125, xid 0x00000000
	version 1.0, type PACKET_IN, length 125, xid 0x00000000
	version 1.0, type PACKET_IN, length 125, xid 0x00000000
	version 1.0, type PACKET_IN, length 125, xid 0x00000000
	version 1.0, type PACKET_IN, length 125, xid 0x00000000
	version 1.0, type PACKET_IN, length 125, xid 0x00000000
	version 1.0, type PACKET_IN, length 125, xid 0x00000000
	version 1.0, type PACKET_IN, length 125, xid 0x00000000
	version 1.0, type PACKET_IN, length 125, xid 0x00000000
	version 1.0, type PACKET_IN, length 125, xid 0x00000000
	version 1.0, type PACKET_IN, length 125, xid 0x00000000
	version 1.0, type PACKET_IN, length 125, xid 0x00000000
	version 1.0, type PACKET_IN, length 125, xid 0x00000000
	version 1.0, type PACKET_IN, length 125, xid 0x00000000
	version 1.0, type PACKET_IN, length 125, xid 0x00000000 [|openflow]
18:05:55.413155 IP 192.168.1.30.41328 > 192.168.1.10.6633: Flags [.], seq 126395:129291, ack 1, win 58, options [nop,nop,TS val 3923704 ecr 349162], length 2896: OpenFlow
	version unknown (0x00), type 0x00, length 64338, xid 0x69c7f318 [|openflow]
18:05:55.413166 IP 192.168.1.30.41328 > 192.168.1.10.6633: Flags [.], seq 129291:132187, ack 1, win 58, options [nop,nop,TS val 3923704 ecr 349162], length 2896: OpenFlow
	version unknown (0x00), type 0x00, length 0, xid 0x00005069 (corrupt)
18:05:55.413176 IP 192.168.1.30.41328 > 192.168.1.10.6633: Flags [.], seq 132187:135083, ack 1, win 58, options [nop,nop,TS val 3923704 ecr 349162], length 2896: OpenFlow
	version unknown (0x00), type 0x00, length 0, xid 0x00000000 (corrupt)
18:05:55.413187 IP 192.168.1.30.41328 > 192.168.1.10.6633: Flags [.], seq 135083:137979, ack 1, win 58, options [nop,nop,TS val 3923704 ecr 349162], length 2896: OpenFlow
	version unknown (0x00), type 0x02, length 0, xid 0x00000000 (corrupt)
18:05:55.413198 IP 192.168.1.30.41328 > 192.168.1.10.6633: Flags [.], seq 137979:140875, ack 1, win 58, options [nop,nop,TS val 3923704 ecr 349162], length 2896: OpenFlow
	version unknown (0x6f), type 0x63, length 24940, xid 0x00000c00 [|openflow]
18:05:55.413208 IP 192.168.1.30.41328 > 192.168.1.10.6633: Flags [.], seq 140875:143771, ack 1, win 58, options [nop,nop,TS val 3923704 ecr 349162], length 2896: OpenFlow
	version unknown (0x0a), type 0x00, length 32000, xid 0x000000ff [|openflow]
18:05:55.413329 IP 192.168.1.10.6633 > 192.168.1.30.41328: Flags [.], ack 143771, win 2457, options [nop,nop,TS val 349162 ecr 3923704], length 0
18:05:55.413344 IP 192.168.1.30.41328 > 192.168.1.10.6633: Flags [.], seq 143771:146667, ack 1, win 58, options [nop,nop,TS val 3923704 ecr 349162], length 2896: OpenFlow
	version unknown (0x00), type 0xfb, length 21097, xid 0xc7f318d1 [|openflow]
18:05:55.413356 IP 192.168.1.30.41328 > 192.168.1.10.6633: Flags [.], seq 146667:149563, ack 1, win 58, options [nop,nop,TS val 3923704 ecr 349162], length 2896: OpenFlow
	version unknown (0x00), type 0x00, length 0, xid 0x005069c7 (corrupt)
