21:28:42.117416 IP 192.168.1.30.49371 > 192.168.1.10.6633: Flags [P.], seq 1772874023:1772874148, ack 3712607819, win 58, options [nop,nop,TS val 21917428 ecr 46590331], length 125: OpenFlow
	version 1.0, type PACKET_IN, length 125, xid 0x00000000
21:28:42.117438 IP 192.168.1.30.49371 > 192.168.1.10.6633: Flags [P.], seq 125:250, ack 1, win 58, options [nop,nop,TS val 21917428 ecr 46590331], length 125: OpenFlow
	version 1.0, type PACKET_IN, length 125, xid 0x00000000
21:28:42.117452 IP 192.168.1.30.49371 > 192.168.1.10.6633: Flags [P.], seq 250:375, ack 1, win 58, options [nop,nop,TS val 21917428 ecr 46590331], length 125: OpenFlow
	version 1.0, type PACKET_IN, length 125, xid 0x00000000
21:28:42.117466 IP 192.168.1.30.49371 > 192.168.1.10.6633: Flags [P.], seq 375:500, ack 1, win 58, options [nop,nop,TS val 21917428 ecr 46590331], length 125: OpenFlow
	version 1.0, type PACKET_IN, length 125, xid 0x00000000
21:28:42.117594 IP 192.168.1.30.49371 > 192.168.1.10.6633: Flags [P.], seq 500:625, ack 1, win 58, options [nop,nop,TS val 21917429 ecr 46590331], length 125: OpenFlow
	version 1.0, type PACKET_IN, length 125, xid 0x00000000
21:28:42.117632 IP 192.168.1.30.49371 > 192.168.1.10.6633: Flags [P.], seq 625:750, ack 1, win 58, options [nop,nop,TS val 21917429 ecr 46590331], length 125: OpenFlow
	version 1.0, type PACKET_IN, length 125, xid 0x00000000
21:28:42.117662 IP 192.168.1.30.49371 > 192.168.1.10.6633: Flags [P.], seq 750:875, ack 1, win 58, options [nop,nop,TS val 21917429 ecr 46590331], length 125: OpenFlow
	version 1.0, type PACKET_IN, length 125, xid 0x00000000
21:28:42.117693 IP 192.168.1.30.49371 > 192.168.1.10.6633: Flags [P.], seq 875:1000, ack 1, win 58, options [nop,nop,TS val 21917429 ecr 46590331], length 125: OpenFlow
	version 1.0, type PACKET_IN, length 125, xid 0x00000000
21:28:42.117723 IP 192.168.1.30.49371 > 192.168.1.10.6633: Flags [P.], seq 1000:1125, ack 1, win 58, options [nop,nop,TS val 21917429 ecr 46590331], length 125: OpenFlow
	version 1.0, type PACKET_IN, length 125, xid 0x00000000
21:28:42.117737 IP 192.168.1.10.6633 > 192.168.1.30.49371: Flags [.], ack 250, win 12683, options [nop,nop,TS val 46590340 ecr 21917428], length 0
21:28:42.117752 IP 192.168.1.30.49371 > 192.168.1.10.6633: Flags [P.], seq 1125:1250, ack 1, win 58, options [nop,nop,TS val 21917429 ecr 46590340], length 125: OpenFlow
	version 1.0, type PACKET_IN, length 125, xid 0x00000000
21:28:42.117779 IP 192.168.1.30.49371 > 192.168.1.10.6633: Flags [P.], seq 1250:1375, ack 1, win 58, options [nop,nop,TS val 21917429 ecr 46590340], length 125: OpenFlow
	version 1.0, type PACKET_IN, length 125, xid 0x00000000
21:28:42.117809 IP 192.168.1.30.49371 > 192.168.1.10.6633: Flags [P.], seq 1375:1500, ack 1, win 58, options [nop,nop,TS val 21917429 ecr 46590340], length 125: OpenFlow
	version 1.0, type PACKET_IN, length 125, xid 0x00000000
21:28:42.117839 IP 192.168.1.30.49371 > 192.168.1.10.6633: Flags [P.], seq 1500:1625, ack 1, win 58, options [nop,nop,TS val 21917429 ecr 46590340], length 125: OpenFlow
	version 1.0, type PACKET_IN, length 125, xid 0x00000000
21:28:42.117870 IP 192.168.1.30.49371 > 192.168.1.10.6633: Flags [P.], seq 1625:1750, ack 1, win 58, options [nop,nop,TS val 21917429 ecr 46590340], length 125: OpenFlow
	version 1.0, type PACKET_IN, length 125, xid 0x00000000
21:28:42.117913 IP 192.168.1.30.49371 > 192.168.1.10.6633: Flags [P.], seq 1750:1875, ack 1, win 58, options [nop,nop,TS val 21917429 ecr 46590340], length 125: OpenFlow
	version 1.0, type PACKET_IN, length 125, xid 0x00000000
21:28:42.117947 IP 192.168.1.30.49371 > 192.168.1.10.6633: Flags [P.], seq 1875:2000, ack 1, win 58, options [nop,nop,TS val 21917429 ecr 46590340], length 125: OpenFlow
	version 1.0, type PACKET_IN, length 125, xid 0x00000000
21:28:42.117979 IP 192.168.1.30.49371 > 192.168.1.10.6633: Flags [P.], seq 2000:2125, ack 1, win 58, options [nop,nop,TS val 21917429 ecr 46590340], length 125: OpenFlow
	version 1.0, type PACKET_IN, length 125, xid 0x00000000
21:28:42.118008 IP 192.168.1.30.49371 > 192.168.1.10.6633: Flags [P.], seq 2125:2250, ack 1, win 58, options [nop,nop,TS val 21917429 ecr 46590340], length 125: OpenFlow
	version 1.0, type PACKET_IN, length 125, xid 0x00000000
21:28:42.118037 IP 192.168.1.30.49371 > 192.168.1.10.6633: Flags [P.], seq 2250:2375, ack 1, win 58, options [nop,nop,TS val 21917429 ecr 46590340], length 125: OpenFlow
	version 1.0, type PACKET_IN, length 125, xid 0x00000000
21:28:42.118066 IP 192.168.1.30.49371 > 192.168.1.10.6633: Flags [P.], seq 2375:2500, ack 1, win 58, options [nop,nop,TS val 21917429 ecr 46590340], length 125: OpenFlow
	version 1.0, type PACKET_IN, length 125, xid 0x00000000
21:28:42.118095 IP 192.168.1.30.49371 > 192.168.1.10.6633: Flags [P.], seq 2500:2625, ack 1, win 58, options [nop,nop,TS val 21917429 ecr 46590340], length 125: OpenFlow
	version 1.0, type PACKET_IN, length 125, xid 0x00000000
21:28:42.118131 IP 192.168.1.30.49371 > 192.168.1.10.6633: Flags [P.], seq 2625:2750, ack 1, win 58, options [nop,nop,TS val 21917429 ecr 46590340], length 125: OpenFlow
	version 1.0, type PACKET_IN, length 125, xid 0x00000000
21:28:42.118165 IP 192.168.1.30.49371 > 192.168.1.10.6633: Flags [P.], seq 2750:2875, ack 1, win 58, options [nop,nop,TS val 21917429 ecr 46590340], length 125: OpenFlow
	version 1.0, type PACKET_IN, length 125, xid 0x00000000
21:28:42.118197 IP 192.168.1.30.49371 > 192.168.1.10.6633: Flags [P.], seq 2875:3000, ack 1, win 58, options [nop,nop,TS val 21917429 ecr 46590340], length 125: OpenFlow
	version 1.0, type PACKET_IN, length 125, xid 0x00000000
21:28:42.118228 IP 192.168.1.30.49371 > 192.168.1.10.6633: Flags [P.], seq 3000:3125, ack 1, win 58, options [nop,nop,TS val 21917429 ecr 46590340], length 125: OpenFlow
	version 1.0, type PACKET_IN, length 125, xid 0x00000000
21:28:42.118259 IP 192.168.1.30.49371 > 192.168.1.10.6633: Flags [P.], seq 3125:3250, ack 1, win 58, options [nop,nop,TS val 21917429 ecr 46590340], length 125: OpenFlow
	version 1.0, type PACKET_IN, length 125, xid 0x00000000
21:28:42.118292 IP 192.168.1.30.49371 > 192.168.1.10.6633: Flags [P.], seq 3250:3375, ack 1, win 58, options [nop,nop,TS val 21917429 ecr 46590340], length 125: OpenFlow
	version 1.0, type PACKET_IN, length 125, xid 0x00000000
21:28:42.118321 IP 192.168.1.30.49371 > 192.168.1.10.6633: Flags [P.], seq 3375:3500, ack 1, win 58, options [nop,nop,TS val 21917429 ecr 46590340], length 125: OpenFlow
	version 1.0, type PACKET_IN, length 125, xid 0x00000000
21:28:42.118357 IP 192.168.1.30.49371 > 192.168.1.10.6633: Flags [P.], seq 3500:3625, ack 1, win 58, options [nop,nop,TS val 21917429 ecr 46590340], length 125: OpenFlow
	version 1.0, type PACKET_IN, length 125, xid 0x00000000
21:28:42.118387 IP 192.168.1.30.49371 > 192.168.1.10.6633: Flags [P.], seq 3625:3750, ack 1, win 58, options [nop,nop,TS val 21917429 ecr 46590340], length 125: OpenFlow
	version 1.0, type PACKET_IN, length 125, xid 0x00000000
21:28:42.118416 IP 192.168.1.30.49371 > 192.168.1.10.6633: Flags [P.], seq 3750:3875, ack 1, win 58, options [nop,nop,TS val 21917429 ecr 46590340], length 125: OpenFlow
	version 1.0, type PACKET_IN, length 125, xid 0x00000000
21:28:42.118445 IP 192.168.1.30.49371 > 192.168.1.10.6633: Flags [P.], seq 3875:4000, ack 1, win 58, options [nop,nop,TS val 21917429 ecr 46590340], length 125: OpenFlow
	version 1.0, type PACKET_IN, length 125, xid 0x00000000
21:28:42.118475 IP 192.168.1.30.49371 > 192.168.1.10.6633: Flags [P.], seq 4000:4125, ack 1, win 58, options [nop,nop,TS val 21917429 ecr 46590340], length 125: OpenFlow
	version 1.0, type PACKET_IN, length 125, xid 0x00000000
21:28:42.118506 IP 192.168.1.30.49371 > 192.168.1.10.6633: Flags [P.], seq 4125:4250, ack 1, win 58, options [nop,nop,TS val 21917429 ecr 46590340], length 125: OpenFlow
	version 1.0, type PACKET_IN, length 125, xid 0x00000000
21:28:42.118538 IP 192.168.1.30.49371 > 192.168.1.10.6633: Flags [P.], seq 4250:4375, ack 1, win 58, options [nop,nop,TS val 21917429 ecr 46590340], length 125: OpenFlow
	version 1.0, type PACKET_IN, length 125, xid 0x00000000
21:28:42.118566 IP 192.168.1.30.49371 > 192.168.1.10.6633: Flags [P.], seq 4375:4500, ack 1, win 58, options [nop,nop,TS val 21917429 ecr 46590340], length 125: OpenFlow
	version 1.0, type PACKET_IN, length 125, xid 0x00000000
21:28:42.118594 IP 192.168.1.30.49371 > 192.168.1.10.6633: Flags [P.], seq 4500:4625, ack 1, win 58, options [nop,nop,TS val 21917429 ecr 46590340], length 125: OpenFlow
	version 1.0, type PACKET_IN, length 125, xid 0x00000000
21:28:42.118623 IP 192.168.1.30.49371 > 192.168.1.10.6633: Flags [P.], seq 4625:4750, ack 1, win 58, options [nop,nop,TS val 21917429 ecr 46590340], length 125: OpenFlow
	version 1.0, type PACKET_IN, length 125, xid 0x00000000
21:28:42.121025 IP 192.168.1.10.6633 > 192.168.1.30.49371: Flags [.], ack 500, win 12683, options [nop,nop,TS val 46590340 ecr 21917428], length 0
21:28:42.121372 IP 192.168.1.10.6633 > 192.168.1.30.49371: Flags [.], ack 750, win 12683, options [nop,nop,TS val 46590340 ecr 21917429], length 0
21:28:42.121393 IP 192.168.1.10.6633 > 192.168.1.30.49371: Flags [.], ack 2250, win 12683, options [nop,nop,TS val 46590340 ecr 21917429], length 0
21:28:42.121403 IP 192.168.1.10.6633 > 192.168.1.30.49371: Flags [.], ack 3750, win 12683, options [nop,nop,TS val 46590340 ecr 21917429], length 0
21:28:42.121439 IP 192.168.1.10.6633 > 192.168.1.30.49371: Flags [.], ack 4750, win 12683, options [nop,nop,TS val 46590340 ecr 21917429], length 0
21:28:42.130791 IP 192.168.1.30.49371 > 192.168.1.10.6633: Flags [.], seq 4750:9094, ack 1, win 58, options [nop,nop,TS val 21917430 ecr 46590340], length 4344: OpenFlow
	version 1.0, type PACKET_IN, length 125, xid 0x00000000
	version 1.0, type PACKET_IN, length 125, xid 0x00000000
	version 1.0, type PACKET_IN, length 125, xid 0x00000000
	version 1.0, type PACKET_IN, length 125, xid 0x00000000
	version 1.0, type PACKET_IN, length 125, xid 0x00000000
	version 1.0, type PACKET_IN, length 125, xid 0x00000000
	version 1.0, type PACKET_IN, length 125, xid 0x00000000
	version 1.0, type PACKET_IN, length 125, xid 0x00000000
	version 1.0, type PACKET_IN, length 125, xid 0x00000000
	version 1.0, type PACKET_IN, length 125, xid 0x00000000
	version 1.0, type PACKET_IN, length 125, xid 0x00000000
	version 1.0, type PACKET_IN, length 125, xid 0x00000000
	version 1.0, type PACKET_IN, length 125, xid 0x00000000
	version 1.0, type PACKET_IN, length 125, xid 0x00000000
	version 1.0, type PACKET_IN, length 125, xid 0x00000000
	version 1.0, type PACKET_IN, length 125, xid 0x00000000
	version 1.0, type PACKET_IN, length 125, xid 0x00000000
	version 1.0, type PACKET_IN, length 125, xid 0x00000000
	version 1.0, type PACKET_IN, length 265, xid 0x00000000
	version 1.0, type PACKET_IN, length 125, xid 0x00000000
	version 1.0, type PACKET_IN, length 125, xid 0x00000000
	version 1.0, type PACKET_IN, length 125, xid 0x00000000
	version 1.0, type PACKET_IN, length 125, xid 0x00000000
	version 1.0, type PACKET_IN, length 125, xid 0x00000000
	version 1.0, type PACKET_IN, length 125, xid 0x00000000
	version 1.0, type PACKET_IN, length 125, xid 0x00000000
	version 1.0, type PACKET_IN, length 125, xid 0x00000000
	version 1.0, type PACKET_IN, length 125, xid 0x00000000
	version 1.0, type PACKET_IN, length 125, xid 0x00000000
	version 1.0, type PACKET_IN, length 125, xid 0x00000000
	version 1.0, type PACKET_IN, length 125, xid 0x00000000
	version 1.0, type PACKET_IN, length 125, xid 0x00000000
	version 1.0, type PACKET_IN, length 125, xid 0x00000000
	version 1.0, type PACKET_IN, length 125, xid 0x00000000 [|openflow]
21:28:42.131177 IP 192.168.1.30.49371 > 192.168.1.10.6633: Flags [P.], seq 9094:9640, ack 1, win 58, options [nop,nop,TS val 21917430 ecr 46590340], length 546: OpenFlow
	version unknown (0xc6), type 0x00, length 0, xid 0x00000200 (corrupt)
21:28:42.131510 IP 192.168.1.10.6633 > 192.168.1.30.49371: Flags [.], ack 9640, win 12683, options [nop,nop,TS val 46590343 ecr 21917430], length 0
21:28:42.141942 IP 192.168.1.30.49371 > 192.168.1.10.6633: Flags [P.], seq 9640:9765, ack 1, win 58, options [nop,nop,TS val 21917432 ecr 46590343], length 125: OpenFlow
	version 1.0, type PACKET_IN, length 125, xid 0x00000000
21:28:42.141960 IP 192.168.1.30.49371 > 192.168.1.10.6633: Flags [P.], seq 9765:9890, ack 1, win 58, options [nop,nop,TS val 21917432 ecr 46590343], length 125: OpenFlow
	version 1.0, type PACKET_IN, length 125, xid 0x00000000
21:28:42.141978 IP 192.168.1.30.49371 > 192.168.1.10.6633: Flags [P.], seq 9890:10015, ack 1, win 58, options [nop,nop,TS val 21917432 ecr 46590343], length 125: OpenFlow
	version 1.0, type PACKET_IN, length 125, xid 0x00000000
21:28:42.141994 IP 192.168.1.30.49371 > 192.168.1.10.6633: Flags [P.], seq 10015:10140, ack 1, win 58, options [nop,nop,TS val 21917432 ecr 46590343], length 125: OpenFlow
	version 1.0, type PACKET_IN, length 125, xid 0x00000000
21:28:42.142009 IP 192.168.1.30.49371 > 192.168.1.10.6633: Flags [P.], seq 10140:10265, ack 1, win 58, options [nop,nop,TS val 21917432 ecr 46590343], length 125: OpenFlow
	version 1.0, type PACKET_IN, length 125, xid 0x00000000
21:28:42.142024 IP 192.168.1.30.49371 > 192.168.1.10.6633: Flags [P.], seq 10265:10390, ack 1, win 58, options [nop,nop,TS val 21917432 ecr 46590343], length 125: OpenFlow
	version 1.0, type PACKET_IN, length 125, xid 0x00000000
21:28:42.142043 IP 192.168.1.30.49371 > 192.168.1.10.6633: Flags [P.], seq 10390:10515, ack 1, win 58, options [nop,nop,TS val 21917432 ecr 46590343], length 125: OpenFlow
	version 1.0, type PACKET_IN, length 125, xid 0x00000000
21:28:42.142058 IP 192.168.1.30.49371 > 192.168.1.10.6633: Flags [P.], seq 10515:10640, ack 1, win 58, options [nop,nop,TS val 21917432 ecr 46590343], length 125: OpenFlow
	version 1.0, type PACKET_IN, length 125, xid 0x00000000
21:28:42.142073 IP 192.168.1.30.49371 > 192.168.1.10.6633: Flags [P.], seq 10640:10765, ack 1, win 58, options [nop,nop,TS val 21917432 ecr 46590343], length 125: OpenFlow
	version 1.0, type PACKET_IN, length 125, xid 0x00000000
21:28:42.142130 IP 192.168.1.30.49371 > 192.168.1.10.6633: Flags [P.], seq 10765:10890, ack 1, win 58, options [nop,nop,TS val 21917432 ecr 46590343], length 125: OpenFlow
	version 1.0, type PACKET_IN, length 125, xid 0x00000000
21:28:42.142156 IP 192.168.1.30.49371 > 192.168.1.10.6633: Flags [P.], seq 10890:11015, ack 1, win 58, options [nop,nop,TS val 21917432 ecr 46590343], length 125: OpenFlow
	version 1.0, type PACKET_IN, length 125, xid 0x00000000
21:28:42.142172 IP 192.168.1.30.49371 > 192.168.1.10.6633: Flags [P.], seq 11015:11140, ack 1, win 58, options [nop,nop,TS val 21917432 ecr 46590343], length 125: OpenFlow
	version 1.0, type PACKET_IN, length 125, xid 0x00000000
21:28:42.142187 IP 192.168.1.30.49371 > 192.168.1.10.6633: Flags [P.], seq 11140:11265, ack 1, win 58, options [nop,nop,TS val 21917432 ecr 46590343], length 125: OpenFlow
	version 1.0, type PACKET_IN, length 125, xid 0x00000000
21:28:42.142203 IP 192.168.1.30.49371 > 192.168.1.10.6633: Flags [P.], seq 11265:11390, ack 1, win 58, options [nop,nop,TS val 21917432 ecr 46590343], length 125: OpenFlow
	version 1.0, type PACKET_IN, length 125, xid 0x00000000
21:28:42.142219 IP 192.168.1.30.49371 > 192.168.1.10.6633: Flags [P.], seq 11390:11515, ack 1, win 58, options [nop,nop,TS val 21917432 ecr 46590343], length 125: OpenFlow
	version 1.0, type PACKET_IN, length 125, xid 0x00000000
21:28:42.142234 IP 192.168.1.30.49371 > 192.168.1.10.6633: Flags [P.], seq 11515:11640, ack 1, win 58, options [nop,nop,TS val 21917432 ecr 46590343], length 125: OpenFlow
	version 1.0, type PACKET_IN, length 125, xid 0x00000000
21:28:42.142249 IP 192.168.1.30.49371 > 192.168.1.10.6633: Flags [P.], seq 11640:11765, ack 1, win 58, options [nop,nop,TS val 21917432 ecr 46590343], length 125: OpenFlow
	version 1.0, type PACKET_IN, length 125, xid 0x00000000
21:28:42.142264 IP 192.168.1.30.49371 > 192.168.1.10.6633: Flags [P.], seq 11765:11890, ack 1, win 58, options [nop,nop,TS val 21917432 ecr 46590343], length 125: OpenFlow
	version 1.0, type PACKET_IN, length 125, xid 0x00000000
21:28:42.142280 IP 192.168.1.30.49371 > 192.168.1.10.6633: Flags [P.], seq 11890:12015, ack 1, win 58, options [nop,nop,TS val 21917432 ecr 46590343], length 125: OpenFlow
	version 1.0, type PACKET_IN, length 125, xid 0x00000000
21:28:42.142295 IP 192.168.1.30.49371 > 192.168.1.10.6633: Flags [P.], seq 12015:12140, ack 1, win 58, options [nop,nop,TS val 21917432 ecr 46590343], length 125: OpenFlow
	version 1.0, type PACKET_IN, length 125, xid 0x00000000
21:28:42.142310 IP 192.168.1.30.49371 > 192.168.1.10.6633: Flags [P.], seq 12140:12265, ack 1, win 58, options [nop,nop,TS val 21917432 ecr 46590343], length 125: OpenFlow
	version 1.0, type PACKET_IN, length 125, xid 0x00000000
21:28:42.142326 IP 192.168.1.30.49371 > 192.168.1.10.6633: Flags [P.], seq 12265:12390, ack 1, win 58, options [nop,nop,TS val 21917432 ecr 46590343], length 125: OpenFlow
	version 1.0, type PACKET_IN, length 125, xid 0x00000000
21:28:42.142341 IP 192.168.1.30.49371 > 192.168.1.10.6633: Flags [P.], seq 12390:12515, ack 1, win 58, options [nop,nop,TS val 21917432 ecr 46590343], length 125: OpenFlow
	version 1.0, type PACKET_IN, length 125, xid 0x00000000
21:28:42.142355 IP 192.168.1.30.49371 > 192.168.1.10.6633: Flags [P.], seq 12515:12640, ack 1, win 58, options [nop,nop,TS val 21917432 ecr 46590343], length 125: OpenFlow
	version 1.0, type PACKET_IN, length 125, xid 0x00000000
21:28:42.142371 IP 192.168.1.30.49371 > 192.168.1.10.6633: Flags [P.], seq 12640:12765, ack 1, win 58, options [nop,nop,TS val 21917432 ecr 46590343], length 125: OpenFlow
	version 1.0, type PACKET_IN, length 125, xid 0x00000000
21:28:42.142386 IP 192.168.1.30.49371 > 192.168.1.10.6633: Flags [P.], seq 12765:12890, ack 1, win 58, options [nop,nop,TS val 21917432 ecr 46590343], length 125: OpenFlow
	version 1.0, type PACKET_IN, length 125, xid 0x00000000
21:28:42.142402 IP 192.168.1.30.49371 > 192.168.1.10.6633: Flags [P.], seq 12890:13015, ack 1, win 58, options [nop,nop,TS val 21917432 ecr 46590343], length 125: OpenFlow
	version 1.0, type PACKET_IN, length 125, xid 0x00000000
21:28:42.143589 IP 192.168.1.10.6633 > 192.168.1.30.49371: Flags [.], ack 11140, win 12683, options [nop,nop,TS val 46590346 ecr 21917432], length 0
21:28:42.143610 IP 192.168.1.10.6633 > 192.168.1.30.49371: Flags [.], ack 12640, win 12683, options [nop,nop,TS val 46590346 ecr 21917432], length 0
21:28:42.144428 IP 192.168.1.10.6633 > 192.168.1.30.49371: Flags [.], ack 13015, win 12683, options [nop,nop,TS val 46590346 ecr 21917432], length 0
21:28:42.200143 IP 192.168.1.30.49371 > 192.168.1.10.6633: Flags [P.], seq 13015:13140, ack 1, win 58, options [nop,nop,TS val 21917449 ecr 46590346], length 125: OpenFlow
	version 1.0, type PACKET_IN, length 125, xid 0x00000000
21:28:42.200188 IP 192.168.1.30.49371 > 192.168.1.10.6633: Flags [P.], seq 13140:13265, ack 1, win 58, options [nop,nop,TS val 21917449 ecr 46590346], length 125: OpenFlow
	version 1.0, type PACKET_IN, length 125, xid 0x00000000
21:28:42.200220 IP 192.168.1.30.49371 > 192.168.1.10.6633: Flags [P.], seq 13265:13390, ack 1, win 58, options [nop,nop,TS val 21917449 ecr 46590346], length 125: OpenFlow
	version 1.0, type PACKET_IN, length 125, xid 0x00000000
21:28:42.200254 IP 192.168.1.30.49371 > 192.168.1.10.6633: Flags [P.], seq 13390:13515, ack 1, win 58, options [nop,nop,TS val 21917449 ecr 46590346], length 125: OpenFlow
	version 1.0, type PACKET_IN, length 125, xid 0x00000000
21:28:42.200286 IP 192.168.1.30.49371 > 192.168.1.10.6633: Flags [P.], seq 13515:13640, ack 1, win 58, options [nop,nop,TS val 21917449 ecr 46590346], length 125: OpenFlow
	version 1.0, type PACKET_IN, length 125, xid 0x00000000
21:28:42.200315 IP 192.168.1.30.49371 > 192.168.1.10.6633: Flags [P.], seq 13640:13765, ack 1, win 58, options [nop,nop,TS val 21917449 ecr 46590346], length 125: OpenFlow
	version 1.0, type PACKET_IN, length 125, xid 0x00000000
21:28:42.200330 IP 192.168.1.30.49371 > 192.168.1.10.6633: Flags [P.], seq 13765:13890, ack 1, win 58, options [nop,nop,TS val 21917449 ecr 46590346], length 125: OpenFlow
	version 1.0, type PACKET_IN, length 125, xid 0x00000000
21:28:42.200343 IP 192.168.1.30.49371 > 192.168.1.10.6633: Flags [P.], seq 13890:14015, ack 1, win 58, options [nop,nop,TS val 21917449 ecr 46590346], length 125: OpenFlow
	version 1.0, type PACKET_IN, length 125, xid 0x00000000
21:28:42.200357 IP 192.168.1.30.49371 > 192.168.1.10.6633: Flags [P.], seq 14015:14140, ack 1, win 58, options [nop,nop,TS val 21917449 ecr 46590346], length 125: OpenFlow
	version 1.0, type PACKET_IN, length 125, xid 0x00000000
21:28:42.200372 IP 192.168.1.30.49371 > 192.168.1.10.6633: Flags [P.], seq 14140:14265, ack 1, win 58, options [nop,nop,TS val 21917449 ecr 46590346], length 125: OpenFlow
	version 1.0, type PACKET_IN, length 125, xid 0x00000000
21:28:42.200393 IP 192.168.1.30.49371 > 192.168.1.10.6633: Flags [P.], seq 14265:14390, ack 1, win 58, options [nop,nop,TS val 21917449 ecr 46590346], length 125: OpenFlow
	version 1.0, type PACKET_IN, length 125, xid 0x00000000
21:28:42.200408 IP 192.168.1.30.49371 > 192.168.1.10.6633: Flags [P.], seq 14390:14515, ack 1, win 58, options [nop,nop,TS val 21917449 ecr 46590346], length 125: OpenFlow
	version 1.0, type PACKET_IN, length 125, xid 0x00000000
21:28:42.200423 IP 192.168.1.30.49371 > 192.168.1.10.6633: Flags [P.], seq 14515:14640, ack 1, win 58, options [nop,nop,TS val 21917449 ecr 46590346], length 125: OpenFlow
	version 1.0, type PACKET_IN, length 125, xid 0x00000000
21:28:42.200438 IP 192.168.1.30.49371 > 192.168.1.10.6633: Flags [P.], seq 14640:14765, ack 1, win 58, options [nop,nop,TS val 21917449 ecr 46590346], length 125: OpenFlow
	version 1.0, type PACKET_IN, length 125, xid 0x00000000
21:28:42.200452 IP 192.168.1.30.49371 > 192.168.1.10.6633: Flags [P.], seq 14765:14890, ack 1, win 58, options [nop,nop,TS val 21917449 ecr 46590346], length 125: OpenFlow
	version 1.0, type PACKET_IN, length 125, xid 0x00000000
21:28:42.200466 IP 192.168.1.30.49371 > 192.168.1.10.6633: Flags [P.], seq 14890:15015, ack 1, win 58, options [nop,nop,TS val 21917449 ecr 46590346], length 125: OpenFlow
	version 1.0, type PACKET_IN, length 125, xid 0x00000000
21:28:42.200481 IP 192.168.1.30.49371 > 192.168.1.10.6633: Flags [P.], seq 15015:15140, ack 1, win 58, options [nop,nop,TS val 21917449 ecr 46590346], length 125: OpenFlow
	version 1.0, type PACKET_IN, length 125, xid 0x00000000
21:28:42.200496 IP 192.168.1.30.49371 > 192.168.1.10.6633: Flags [P.], seq 15140:15265, ack 1, win 58, options [nop,nop,TS val 21917449 ecr 46590346], length 125: OpenFlow
	version 1.0, type PACKET_IN, length 125, xid 0x00000000
21:28:42.200510 IP 192.168.1.30.49371 > 192.168.1.10.6633: Flags [P.], seq 15265:15390, ack 1, win 58, options [nop,nop,TS val 21917449 ecr 46590346], length 125: OpenFlow
	version 1.0, type PACKET_IN, length 125, xid 0x00000000
21:28:42.200525 IP 192.168.1.30.49371 > 192.168.1.10.6633: Flags [P.], seq 15390:15515, ack 1, win 58, options [nop,nop,TS val 21917449 ecr 46590346], length 125: OpenFlow
	version 1.0, type PACKET_IN, length 125, xid 0x00000000
21:28:42.200539 IP 192.168.1.30.49371 > 192.168.1.10.6633: Flags [P.], seq 15515:15640, ack 1, win 58, options [nop,nop,TS val 21917449 ecr 46590346], length 125: OpenFlow
	version 1.0, type PACKET_IN, length 125, xid 0x00000000
21:28:42.200554 IP 192.168.1.30.49371 > 192.168.1.10.6633: Flags [P.], seq 15640:15765, ack 1, win 58, options [nop,nop,TS val 21917449 ecr 46590346], length 125: OpenFlow
	version 1.0, type PACKET_IN, length 125, xid 0x00000000
21:28:42.200569 IP 192.168.1.30.49371 > 192.168.1.10.6633: Flags [P.], seq 15765:15890, ack 1, win 58, options [nop,nop,TS val 21917449 ecr 46590346], length 125: OpenFlow
	version 1.0, type PACKET_IN, length 125, xid 0x00000000
21:28:42.200583 IP 192.168.1.30.49371 > 192.168.1.10.6633: Flags [P.], seq 15890:16015, ack 1, win 58, options [nop,nop,TS val 21917449 ecr 46590346], length 125: OpenFlow
	version 1.0, type PACKET_IN, length 125, xid 0x00000000
21:28:42.200598 IP 192.168.1.30.49371 > 192.168.1.10.6633: Flags [P.], seq 16015:16140, ack 1, win 58, options [nop,nop,TS val 21917449 ecr 46590346], length 125: OpenFlow
	version 1.0, type PACKET_IN, length 125, xid 0x00000000
21:28:42.200613 IP 192.168.1.30.49371 > 192.168.1.10.6633: Flags [P.], seq 16140:16265, ack 1, win 58, options [nop,nop,TS val 21917449 ecr 46590346], length 125: OpenFlow
	version 1.0, type PACKET_IN, length 125, xid 0x00000000
21:28:42.200628 IP 192.168.1.30.49371 > 192.168.1.10.6633: Flags [P.], seq 16265:16390, ack 1, win 58, options [nop,nop,TS val 21917449 ecr 46590346], length 125: OpenFlow
	version 1.0, type PACKET_IN, length 125, xid 0x00000000
21:28:42.200643 IP 192.168.1.30.49371 > 192.168.1.10.6633: Flags [P.], seq 16390:16515, ack 1, win 58, options [nop,nop,TS val 21917449 ecr 46590346], length 125: OpenFlow
	version 1.0, type PACKET_IN, length 125, xid 0x00000000
21:28:42.200658 IP 192.168.1.30.49371 > 192.168.1.10.6633: Flags [P.], seq 16515:16640, ack 1, win 58, options [nop,nop,TS val 21917449 ecr 46590346], length 125: OpenFlow
	version 1.0, type PACKET_IN, length 125, xid 0x00000000
21:28:42.200673 IP 192.168.1.30.49371 > 192.168.1.10.6633: Flags [P.], seq 16640:16765, ack 1, win 58, options [nop,nop,TS val 21917449 ecr 46590346], length 125: OpenFlow
	version 1.0, type PACKET_IN, length 125, xid 0x00000000
21:28:42.200688 IP 192.168.1.30.49371 > 192.168.1.10.6633: Flags [P.], seq 16765:16890, ack 1, win 58, options [nop,nop,TS val 21917449 ecr 46590346], length 125: OpenFlow
	version 1.0, type PACKET_IN, length 125, xid 0x00000000
21:28:42.200703 IP 192.168.1.30.49371 > 192.168.1.10.6633: Flags [P.], seq 16890:17015, ack 1, win 58, options [nop,nop,TS val 21917449 ecr 46590346], length 125: OpenFlow
	version 1.0, type PACKET_IN, length 125, xid 0x00000000
21:28:42.200717 IP 192.168.1.30.49371 > 192.168.1.10.6633: Flags [P.], seq 17015:17140, ack 1, win 58, options [nop,nop,TS val 21917449 ecr 46590346], length 125: OpenFlow
	version 1.0, type PACKET_IN, length 125, xid 0x00000000
21:28:42.200733 IP 192.168.1.30.49371 > 192.168.1.10.6633: Flags [P.], seq 17140:17265, ack 1, win 58, options [nop,nop,TS val 21917449 ecr 46590346], length 125: OpenFlow
	version 1.0, type PACKET_IN, length 125, xid 0x00000000
21:28:42.200747 IP 192.168.1.30.49371 > 192.168.1.10.6633: Flags [P.], seq 17265:17390, ack 1, win 58, options [nop,nop,TS val 21917449 ecr 46590346], length 125: OpenFlow
	version 1.0, type PACKET_IN, length 125, xid 0x00000000
21:28:42.200762 IP 192.168.1.30.49371 > 192.168.1.10.6633: Flags [P.], seq 17390:17515, ack 1, win 58, options [nop,nop,TS val 21917449 ecr 46590346], length 125: OpenFlow
	version 1.0, type PACKET_IN, length 125, xid 0x00000000
21:28:42.200777 IP 192.168.1.30.49371 > 192.168.1.10.6633: Flags [P.], seq 17515:17640, ack 1, win 58, options [nop,nop,TS val 21917449 ecr 46590346], length 125: OpenFlow
	version 1.0, type PACKET_IN, length 125, xid 0x00000000
21:28:42.201894 IP 192.168.1.10.6633 > 192.168.1.30.49371: Flags [.], ack 14515, win 12683, options [nop,nop,TS val 46590361 ecr 21917449], length 0
21:28:42.201913 IP 192.168.1.30.49371 > 192.168.1.10.6633: Flags [P.], seq 17640:21390, ack 1, win 58, options [nop,nop,TS val 21917450 ecr 46590361], length 3750: OpenFlow
	version 1.0, type PACKET_IN, length 125, xid 0x00000000
	version 1.0, type PACKET_IN, length 125, xid 0x00000000
	version 1.0, type PACKET_IN, length 125, xid 0x00000000
	version 1.0, type PACKET_IN, length 125, xid 0x00000000
	version 1.0, type PACKET_IN, length 125, xid 0x00000000
	version 1.0, type PACKET_IN, length 125, xid 0x00000000
	version 1.0, type PACKET_IN, length 125, xid 0x00000000
	version 1.0, type PACKET_IN, length 125, xid 0x00000000
	version 1.0, type PACKET_IN, length 125, xid 0x00000000
	version 1.0, type PACKET_IN, length 125, xid 0x00000000
	version 1.0, type PACKET_IN, length 125, xid 0x00000000
	version 1.0, type PACKET_IN, length 125, xid 0x00000000
	version 1.0, type PACKET_IN, length 125, xid 0x00000000
	version 1.0, type PACKET_IN, length 125, xid 0x00000000
	version 1.0, type PACKET_IN, length 125, xid 0x00000000
	version 1.0, type PACKET_IN, length 125, xid 0x00000000
	version 1.0, type PACKET_IN, length 125, xid 0x00000000
	version 1.0, type PACKET_IN, length 125, xid 0x00000000
	version 1.0, type PACKET_IN, length 125, xid 0x00000000
	version 1.0, type PACKET_IN, length 125, xid 0x00000000
	version 1.0, type PACKET_IN, length 125, xid 0x00000000
	version 1.0, type PACKET_IN, length 125, xid 0x00000000
	version 1.0, type PACKET_IN, length 125, xid 0x00000000
	version 1.0, type PACKET_IN, length 125, xid 0x00000000
	version 1.0, type PACKET_IN, length 125, xid 0x00000000
	version 1.0, type PACKET_IN, length 125, xid 0x00000000
	version 1.0, type PACKET_IN, length 125, xid 0x00000000
	version 1.0, type PACKET_IN, length 125, xid 0x00000000
	version 1.0, type PACKET_IN, length 125, xid 0x00000000
	version 1.0, type PACKET_IN, length 125, xid 0x00000000
21:28:42.201926 IP 192.168.1.30.49371 > 192.168.1.10.6633: Flags [.], seq 21390:25734, ack 1, win 58, options [nop,nop,TS val 21917450 ecr 46590361], length 4344: OpenFlow
	version 1.0, type PACKET_IN, length 125, xid 0x00000000
	version 1.0, type PACKET_IN, length 125, xid 0x00000000
	version 1.0, type PACKET_IN, length 125, xid 0x00000000
	version 1.0, type PACKET_IN, length 125, xid 0x00000000
	version 1.0, type PACKET_IN, length 125, xid 0x00000000
	version 1.0, type PACKET_IN, length 125, xid 0x00000000
	version 1.0, type PACKET_IN, length 125, xid 0x00000000
	version 1.0, type PACKET_IN, length 125, xid 0x00000000
	version 1.0, type PACKET_IN, length 125, xid 0x00000000
	version 1.0, type PACKET_IN, length 125, xid 0x00000000
	version 1.0, type PACKET_IN, length 125, xid 0x00000000
	version 1.0, type PACKET_IN, length 125, xid 0x00000000
	version 1.0, type PACKET_IN, length 125, xid 0x00000000
	version 1.0, type PACKET_IN, length 125, xid 0x00000000
	version 1.0, type PACKET_IN, length 125, xid 0x00000000
	version 1.0, type PACKET_IN, length 125, xid 0x00000000
	version 1.0, type PACKET_IN, length 125, xid 0x00000000
	version 1.0, type PACKET_IN, length 125, xid 0x00000000
	version 1.0, type PACKET_IN, length 125, xid 0x00000000
	version 1.0, type PACKET_IN, length 125, xid 0x00000000
	version 1.0, type PACKET_IN, length 125, xid 0x00000000
	version 1.0, type PACKET_IN, length 125, xid 0x00000000
	version 1.0, type PACKET_IN, length 125, xid 0x00000000
	version 1.0, type PACKET_IN, length 125, xid 0x00000000
	version 1.0, type PACKET_IN, length 125, xid 0x00000000
	version 1.0, type PACKET_IN, length 125, xid 0x00000000
	version 1.0, type PACKET_IN, length 125, xid 0x00000000
	version 1.0, type PACKET_IN, length 125, xid 0x00000000
	version 1.0, type PACKET_IN, length 125, xid 0x00000000
	version 1.0, type PACKET_IN, length 125, xid 0x00000000
	version 1.0, type PACKET_IN, length 125, xid 0x00000000
	version 1.0, type PACKET_IN, length 125, xid 0x00000000
	version 1.0, type PACKET_IN, length 125, xid 0x00000000
	version 1.0, type PACKET_IN, length 125, xid 0x00000000
	version 1.0, type PACKET_IN, length 88, xid 0x00000000 (corrupt)
21:28:42.201938 IP 192.168.1.30.49371 > 192.168.1.10.6633: Flags [.], seq 25734:30078, ack 1, win 58, options [nop,nop,TS val 21917450 ecr 46590361], length 4344: OpenFlow
	version unknown (0x00), type 0x00, length 65535, xid 0xffff006b [|openflow]
21:28:42.201951 IP 192.168.1.30.49371 > 192.168.1.10.6633: Flags [.], seq 30078:34422, ack 1, win 58, options [nop,nop,TS val 21917450 ecr 46590361], length 4344: OpenFlow
	version unknown (0x00), type 0x6b, length 4, xid 0x01003333 (corrupt)
21:28:42.201981 IP 192.168.1.10.6633 > 192.168.1.30.49371: Flags [.], ack 16015, win 12683, options [nop,nop,TS val 46590361 ecr 21917449], length 0
21:28:42.201995 IP 192.168.1.30.49371 > 192.168.1.10.6633: Flags [.], seq 34422:35870, ack 1, win 58, options [nop,nop,TS val 21917450 ecr 46590361], length 1448: OpenFlow
	version unknown (0x63), type 0x61, length 27648, xid 0x000c0001 [|openflow]
21:28:42.202006 IP 192.168.1.30.49371 > 192.168.1.10.6633: Flags [P.], seq 35870:36316, ack 1, win 58, options [nop,nop,TS val 21917450 ecr 46590361], length 446: OpenFlow
	version unknown (0x39), type 0x53, length 65282, xid 0x00000000 [|openflow]
21:28:42.202018 IP 192.168.1.30.49371 > 192.168.1.10.6633: Flags [P.], seq 36316:36441, ack 1, win 58, options [nop,nop,TS val 21917450 ecr 46590361], length 125: OpenFlow
	version 1.0, type PACKET_IN, length 125, xid 0x00000000
21:28:42.202033 IP 192.168.1.10.6633 > 192.168.1.30.49371: Flags [.], ack 17515, win 12683, options [nop,nop,TS val 46590361 ecr 21917449], length 0
21:28:42.202055 IP 192.168.1.30.49371 > 192.168.1.10.6633: Flags [P.], seq 36441:36566, ack 1, win 58, options [nop,nop,TS val 21917450 ecr 46590361], length 125: OpenFlow
	version 1.0, type PACKET_IN, length 125, xid 0x00000000
21:28:42.202065 IP 192.168.1.10.6633 > 192.168.1.30.49371: Flags [.], ack 21390, win 12683, options [nop,nop,TS val 46590361 ecr 21917449], length 0
21:28:42.202074 IP 192.168.1.10.6633 > 192.168.1.30.49371: Flags [.], ack 31526, win 12683, options [nop,nop,TS val 46590361 ecr 21917450], length 0
21:28:42.202083 IP 192.168.1.10.6633 > 192.168.1.30.49371: Flags [.], ack 35870, win 12683, options [nop,nop,TS val 46590361 ecr 21917450], length 0
21:28:42.202088 IP 192.168.1.30.49371 > 192.168.1.10.6633: Flags [P.], seq 36566:36691, ack 1, win 58, options [nop,nop,TS val 21917450 ecr 46590361], length 125: OpenFlow
	version 1.0, type PACKET_IN, length 125, xid 0x00000000
21:28:42.202208 IP 192.168.1.10.6633 > 192.168.1.30.49371: Flags [.], ack 36441, win 12683, options [nop,nop,TS val 46590361 ecr 21917450], length 0
21:28:42.202211 IP 192.168.1.30.49371 > 192.168.1.10.6633: Flags [P.], seq 36691:36816, ack 1, win 58, options [nop,nop,TS val 21917450 ecr 46590361], length 125: OpenFlow
	version 1.0, type PACKET_IN, length 125, xid 0x00000000
21:28:42.202264 IP 192.168.1.30.49371 > 192.168.1.10.6633: Flags [P.], seq 36816:36941, ack 1, win 58, options [nop,nop,TS val 21917450 ecr 46590361], length 125: OpenFlow
	version 1.0, type PACKET_IN, length 125, xid 0x00000000
21:28:42.202296 IP 192.168.1.30.49371 > 192.168.1.10.6633: Flags [P.], seq 36941:37066, ack 1, win 58, options [nop,nop,TS val 21917450 ecr 46590361], length 125: OpenFlow
	version 1.0, type PACKET_IN, length 125, xid 0x00000000
21:28:42.202324 IP 192.168.1.30.49371 > 192.168.1.10.6633: Flags [P.], seq 37066:37191, ack 1, win 58, options [nop,nop,TS val 21917450 ecr 46590361], length 125: OpenFlow
	version 1.0, type PACKET_IN, length 125, xid 0x00000000
21:28:42.202354 IP 192.168.1.30.49371 > 192.168.1.10.6633: Flags [P.], seq 37191:37316, ack 1, win 58, options [nop,nop,TS val 21917450 ecr 46590361], length 125: OpenFlow
	version 1.0, type PACKET_IN, length 125, xid 0x00000000
21:28:42.202384 IP 192.168.1.30.49371 > 192.168.1.10.6633: Flags [P.], seq 37316:37441, ack 1, win 58, options [nop,nop,TS val 21917450 ecr 46590361], length 125: OpenFlow
	version 1.0, type PACKET_IN, length 125, xid 0x00000000
21:28:42.202419 IP 192.168.1.30.49371 > 192.168.1.10.6633: Flags [P.], seq 37441:37566, ack 1, win 58, options [nop,nop,TS val 21917450 ecr 46590361], length 125: OpenFlow
	version 1.0, type PACKET_IN, length 125, xid 0x00000000
21:28:42.202454 IP 192.168.1.30.49371 > 192.168.1.10.6633: Flags [P.], seq 37566:37691, ack 1, win 58, options [nop,nop,TS val 21917450 ecr 46590361], length 125: OpenFlow
	version 1.0, type PACKET_IN, length 125, xid 0x00000000
21:28:42.202490 IP 192.168.1.30.49371 > 192.168.1.10.6633: Flags [P.], seq 37691:37816, ack 1, win 58, options [nop,nop,TS val 21917450 ecr 46590361], length 125: OpenFlow
	version 1.0, type PACKET_IN, length 125, xid 0x00000000
21:28:42.202525 IP 192.168.1.30.49371 > 192.168.1.10.6633: Flags [P.], seq 37816:37941, ack 1, win 58, options [nop,nop,TS val 21917450 ecr 46590361], length 125: OpenFlow
	version 1.0, type PACKET_IN, length 125, xid 0x00000000
21:28:42.202564 IP 192.168.1.30.49371 > 192.168.1.10.6633: Flags [P.], seq 37941:38066, ack 1, win 58, options [nop,nop,TS val 21917450 ecr 46590361], length 125: OpenFlow
	version 1.0, type PACKET_IN, length 125, xid 0x00000000
21:28:42.202604 IP 192.168.1.30.49371 > 192.168.1.10.6633: Flags [P.], seq 38066:38191, ack 1, win 58, options [nop,nop,TS val 21917450 ecr 46590361], length 125: OpenFlow
	version 1.0, type PACKET_IN, length 125, xid 0x00000000
21:28:42.202640 IP 192.168.1.30.49371 > 192.168.1.10.6633: Flags [P.], seq 38191:38316, ack 1, win 58, options [nop,nop,TS val 21917450 ecr 46590361], length 125: OpenFlow
	version 1.0, type PACKET_IN, length 125, xid 0x00000000
21:28:42.202675 IP 192.168.1.30.49371 > 192.168.1.10.6633: Flags [P.], seq 38316:38441, ack 1, win 58, options [nop,nop,TS val 21917450 ecr 46590361], length 125: OpenFlow
	version 1.0, type PACKET_IN, length 125, xid 0x00000000
21:28:42.202709 IP 192.168.1.30.49371 > 192.168.1.10.6633: Flags [P.], seq 38441:38566, ack 1, win 58, options [nop,nop,TS val 21917450 ecr 46590361], length 125: OpenFlow
	version 1.0, type PACKET_IN, length 125, xid 0x00000000
21:28:42.202746 IP 192.168.1.30.49371 > 192.168.1.10.6633: Flags [P.], seq 38566:38691, ack 1, win 58, options [nop,nop,TS val 21917450 ecr 46590361], length 125: OpenFlow
	version 1.0, type PACKET_IN, length 125, xid 0x00000000
21:28:42.202783 IP 192.168.1.30.49371 > 192.168.1.10.6633: Flags [P.], seq 38691:38816, ack 1, win 58, options [nop,nop,TS val 21917450 ecr 46590361], length 125: OpenFlow
	version 1.0, type PACKET_IN, length 125, xid 0x00000000
21:28:42.202820 IP 192.168.1.30.49371 > 192.168.1.10.6633: Flags [P.], seq 38816:38941, ack 1, win 58, options [nop,nop,TS val 21917450 ecr 46590361], length 125: OpenFlow
	version 1.0, type PACKET_IN, length 125, xid 0x00000000
21:28:42.202823 IP 192.168.1.10.6633 > 192.168.1.30.49371: Flags [.], ack 37941, win 12683, options [nop,nop,TS val 46590361 ecr 21917450], length 0
21:28:42.202842 IP 192.168.1.10.6633 > 192.168.1.30.49371: Flags [.], ack 38066, win 12683, options [nop,nop,TS val 46590361 ecr 21917450], length 0
21:28:42.202858 IP 192.168.1.30.49371 > 192.168.1.10.6633: Flags [P.], seq 38941:39066, ack 1, win 58, options [nop,nop,TS val 21917450 ecr 46590361], length 125: OpenFlow
	version 1.0, type PACKET_IN, length 125, xid 0x00000000
21:28:42.202900 IP 192.168.1.30.49371 > 192.168.1.10.6633: Flags [P.], seq 39066:39191, ack 1, win 58, options [nop,nop,TS val 21917450 ecr 46590361], length 125: OpenFlow
	version 1.0, type PACKET_IN, length 125, xid 0x00000000
21:28:42.202932 IP 192.168.1.30.49371 > 192.168.1.10.6633: Flags [P.], seq 39191:39316, ack 1, win 58, options [nop,nop,TS val 21917450 ecr 46590361], length 125: OpenFlow
	version 1.0, type PACKET_IN, length 125, xid 0x00000000
21:28:42.202969 IP 192.168.1.30.49371 > 192.168.1.10.6633: Flags [P.], seq 39316:39441, ack 1, win 58, options [nop,nop,TS val 21917450 ecr 46590361], length 125: OpenFlow
	version 1.0, type PACKET_IN, length 125, xid 0x00000000
21:28:42.203010 IP 192.168.1.30.49371 > 192.168.1.10.6633: Flags [P.], seq 39441:39566, ack 1, win 58, options [nop,nop,TS val 21917450 ecr 46590361], length 125: OpenFlow
	version 1.0, type PACKET_IN, length 125, xid 0x00000000
21:28:42.203048 IP 192.168.1.30.49371 > 192.168.1.10.6633: Flags [P.], seq 39566:39691, ack 1, win 58, options [nop,nop,TS val 21917450 ecr 46590361], length 125: OpenFlow
	version 1.0, type PACKET_IN, length 125, xid 0x00000000
21:28:42.203086 IP 192.168.1.30.49371 > 192.168.1.10.6633: Flags [P.], seq 39691:39816, ack 1, win 58, options [nop,nop,TS val 21917450 ecr 46590361], length 125: OpenFlow
	version 1.0, type PACKET_IN, length 125, xid 0x00000000
