21:28:42.064248 IP 192.168.1.30.49349 > 192.168.1.10.6633: Flags [P.], seq 780237278:780237403, ack 3218542220, win 58, options [nop,nop,TS val 21917414 ecr 46590318], length 125: OpenFlow
	version 1.0, type PACKET_IN, length 125, xid 0x00000000
21:28:42.064261 IP 192.168.1.30.49349 > 192.168.1.10.6633: Flags [P.], seq 125:250, ack 1, win 58, options [nop,nop,TS val 21917414 ecr 46590318], length 125: OpenFlow
	version 1.0, type PACKET_IN, length 125, xid 0x00000000
21:28:42.064274 IP 192.168.1.30.49349 > 192.168.1.10.6633: Flags [P.], seq 250:375, ack 1, win 58, options [nop,nop,TS val 21917414 ecr 46590318], length 125: OpenFlow
	version 1.0, type PACKET_IN, length 125, xid 0x00000000
21:28:42.064287 IP 192.168.1.30.49349 > 192.168.1.10.6633: Flags [P.], seq 375:500, ack 1, win 58, options [nop,nop,TS val 21917414 ecr 46590318], length 125: OpenFlow
	version 1.0, type PACKET_IN, length 125, xid 0x00000000
21:28:42.064300 IP 192.168.1.30.49349 > 192.168.1.10.6633: Flags [P.], seq 500:625, ack 1, win 58, options [nop,nop,TS val 21917414 ecr 46590318], length 125: OpenFlow
	version 1.0, type PACKET_IN, length 125, xid 0x00000000
21:28:42.064320 IP 192.168.1.30.49349 > 192.168.1.10.6633: Flags [P.], seq 625:750, ack 1, win 58, options [nop,nop,TS val 21917414 ecr 46590318], length 125: OpenFlow
	version 1.0, type PACKET_IN, length 125, xid 0x00000000
21:28:42.064335 IP 192.168.1.30.49349 > 192.168.1.10.6633: Flags [P.], seq 750:875, ack 1, win 58, options [nop,nop,TS val 21917414 ecr 46590318], length 125: OpenFlow
	version 1.0, type PACKET_IN, length 125, xid 0x00000000
21:28:42.064348 IP 192.168.1.30.49349 > 192.168.1.10.6633: Flags [P.], seq 875:1000, ack 1, win 58, options [nop,nop,TS val 21917414 ecr 46590318], length 125: OpenFlow
	version 1.0, type PACKET_IN, length 125, xid 0x00000000
21:28:42.064362 IP 192.168.1.30.49349 > 192.168.1.10.6633: Flags [P.], seq 1000:1125, ack 1, win 58, options [nop,nop,TS val 21917414 ecr 46590318], length 125: OpenFlow
	version 1.0, type PACKET_IN, length 125, xid 0x00000000
21:28:42.064375 IP 192.168.1.30.49349 > 192.168.1.10.6633: Flags [P.], seq 1125:1250, ack 1, win 58, options [nop,nop,TS val 21917414 ecr 46590318], length 125: OpenFlow
	version 1.0, type PACKET_IN, length 125, xid 0x00000000
21:28:42.064389 IP 192.168.1.30.49349 > 192.168.1.10.6633: Flags [P.], seq 1250:1375, ack 1, win 58, options [nop,nop,TS val 21917414 ecr 46590318], length 125: OpenFlow
	version 1.0, type PACKET_IN, length 125, xid 0x00000000
21:28:42.064404 IP 192.168.1.30.49349 > 192.168.1.10.6633: Flags [P.], seq 1375:1500, ack 1, win 58, options [nop,nop,TS val 21917414 ecr 46590318], length 125: OpenFlow
	version 1.0, type PACKET_IN, length 125, xid 0x00000000
21:28:42.064423 IP 192.168.1.30.49349 > 192.168.1.10.6633: Flags [P.], seq 1500:1625, ack 1, win 58, options [nop,nop,TS val 21917414 ecr 46590318], length 125: OpenFlow
	version 1.0, type PACKET_IN, length 125, xid 0x00000000
21:28:42.064436 IP 192.168.1.30.49349 > 192.168.1.10.6633: Flags [P.], seq 1625:1750, ack 1, win 58, options [nop,nop,TS val 21917414 ecr 46590318], length 125: OpenFlow
	version 1.0, type PACKET_IN, length 125, xid 0x00000000
21:28:42.064450 IP 192.168.1.30.49349 > 192.168.1.10.6633: Flags [P.], seq 1750:1875, ack 1, win 58, options [nop,nop,TS val 21917414 ecr 46590318], length 125: OpenFlow
	version 1.0, type PACKET_IN, length 125, xid 0x00000000
21:28:42.064464 IP 192.168.1.30.49349 > 192.168.1.10.6633: Flags [P.], seq 1875:1963, ack 1, win 58, options [nop,nop,TS val 21917414 ecr 46590318], length 88: OpenFlow
	version 1.0, type PACKET_IN, length 88, xid 0x00000000
21:28:42.064476 IP 192.168.1.30.49349 > 192.168.1.10.6633: Flags [P.], seq 1963:2088, ack 1, win 58, options [nop,nop,TS val 21917414 ecr 46590318], length 125: OpenFlow
	version 1.0, type PACKET_IN, length 125, xid 0x00000000
21:28:42.065060 IP 192.168.1.10.6633 > 192.168.1.30.49349: Flags [.], ack 1500, win 8864, options [nop,nop,TS val 46590326 ecr 21917414], length 0
21:28:42.065076 IP 192.168.1.10.6633 > 192.168.1.30.49349: Flags [.], ack 2088, win 8864, options [nop,nop,TS val 46590326 ecr 21917414], length 0
21:28:42.064490 IP 192.168.1.30.49349 > 192.168.1.10.6633: Flags [P.], seq 2088:2213, ack 1, win 58, options [nop,nop,TS val 21917414 ecr 46590318], length 125: OpenFlow
	version 1.0, type PACKET_IN, length 125, xid 0x00000000
21:28:42.065366 IP 192.168.1.30.49349 > 192.168.1.10.6633: Flags [P.], seq 2213:2338, ack 1, win 58, options [nop,nop,TS val 21917414 ecr 46590318], length 125: OpenFlow
	version 1.0, type PACKET_IN, length 125, xid 0x00000000
21:28:42.065375 IP 192.168.1.30.49349 > 192.168.1.10.6633: Flags [P.], seq 2338:2463, ack 1, win 58, options [nop,nop,TS val 21917414 ecr 46590318], length 125: OpenFlow
	version 1.0, type PACKET_IN, length 125, xid 0x00000000
21:28:42.065384 IP 192.168.1.30.49349 > 192.168.1.10.6633: Flags [P.], seq 2463:2588, ack 1, win 58, options [nop,nop,TS val 21917415 ecr 46590318], length 125: OpenFlow
	version 1.0, type PACKET_IN, length 125, xid 0x00000000
21:28:42.065394 IP 192.168.1.30.49349 > 192.168.1.10.6633: Flags [P.], seq 2588:2713, ack 1, win 58, options [nop,nop,TS val 21917415 ecr 46590318], length 125: OpenFlow
	version 1.0, type PACKET_IN, length 125, xid 0x00000000
21:28:42.065403 IP 192.168.1.30.49349 > 192.168.1.10.6633: Flags [P.], seq 2713:2838, ack 1, win 58, options [nop,nop,TS val 21917415 ecr 46590318], length 125: OpenFlow
	version 1.0, type PACKET_IN, length 125, xid 0x00000000
21:28:42.065412 IP 192.168.1.30.49349 > 192.168.1.10.6633: Flags [P.], seq 2838:2963, ack 1, win 58, options [nop,nop,TS val 21917415 ecr 46590318], length 125: OpenFlow
	version 1.0, type PACKET_IN, length 125, xid 0x00000000
21:28:42.065427 IP 192.168.1.30.49349 > 192.168.1.10.6633: Flags [P.], seq 2963:3088, ack 1, win 58, options [nop,nop,TS val 21917415 ecr 46590318], length 125: OpenFlow
	version 1.0, type PACKET_IN, length 125, xid 0x00000000
21:28:42.065432 IP 192.168.1.30.49349 > 192.168.1.10.6633: Flags [P.], seq 3088:3213, ack 1, win 58, options [nop,nop,TS val 21917415 ecr 46590318], length 125: OpenFlow
	version 1.0, type PACKET_IN, length 125, xid 0x00000000
21:28:42.065437 IP 192.168.1.30.49349 > 192.168.1.10.6633: Flags [P.], seq 3213:3338, ack 1, win 58, options [nop,nop,TS val 21917415 ecr 46590318], length 125: OpenFlow
	version 1.0, type PACKET_IN, length 125, xid 0x00000000
21:28:42.065442 IP 192.168.1.30.49349 > 192.168.1.10.6633: Flags [P.], seq 3338:3463, ack 1, win 58, options [nop,nop,TS val 21917415 ecr 46590318], length 125: OpenFlow
	version 1.0, type PACKET_IN, length 125, xid 0x00000000
21:28:42.065449 IP 192.168.1.30.49349 > 192.168.1.10.6633: Flags [P.], seq 3463:3588, ack 1, win 58, options [nop,nop,TS val 21917415 ecr 46590318], length 125: OpenFlow
	version 1.0, type PACKET_IN, length 125, xid 0x00000000
21:28:42.065456 IP 192.168.1.30.49349 > 192.168.1.10.6633: Flags [P.], seq 3588:3713, ack 1, win 58, options [nop,nop,TS val 21917415 ecr 46590318], length 125: OpenFlow
	version 1.0, type PACKET_IN, length 125, xid 0x00000000
21:28:42.065463 IP 192.168.1.30.49349 > 192.168.1.10.6633: Flags [P.], seq 3713:3838, ack 1, win 58, options [nop,nop,TS val 21917415 ecr 46590318], length 125: OpenFlow
	version 1.0, type PACKET_IN, length 125, xid 0x00000000
21:28:42.065470 IP 192.168.1.30.49349 > 192.168.1.10.6633: Flags [P.], seq 3838:3963, ack 1, win 58, options [nop,nop,TS val 21917415 ecr 46590318], length 125: OpenFlow
	version 1.0, type PACKET_IN, length 125, xid 0x00000000
21:28:42.065631 IP 192.168.1.30.49349 > 192.168.1.10.6633: Flags [P.], seq 3963:4088, ack 1, win 58, options [nop,nop,TS val 21917415 ecr 46590318], length 125: OpenFlow
	version 1.0, type PACKET_IN, length 125, xid 0x00000000
21:28:42.065908 IP 192.168.1.10.6633 > 192.168.1.30.49349: Flags [.], ack 3088, win 8864, options [nop,nop,TS val 46590327 ecr 21917414], length 0
21:28:42.065950 IP 192.168.1.30.49349 > 192.168.1.10.6633: Flags [P.], seq 4088:4213, ack 1, win 58, options [nop,nop,TS val 21917416 ecr 46590326], length 125: OpenFlow
	version 1.0, type PACKET_IN, length 125, xid 0x00000000
21:28:42.065964 IP 192.168.1.30.49349 > 192.168.1.10.6633: Flags [P.], seq 4213:4338, ack 1, win 58, options [nop,nop,TS val 21917416 ecr 46590326], length 125: OpenFlow
	version 1.0, type PACKET_IN, length 125, xid 0x00000000
21:28:42.065977 IP 192.168.1.30.49349 > 192.168.1.10.6633: Flags [P.], seq 4338:4463, ack 1, win 58, options [nop,nop,TS val 21917416 ecr 46590326], length 125: OpenFlow
	version 1.0, type PACKET_IN, length 125, xid 0x00000000
21:28:42.065990 IP 192.168.1.30.49349 > 192.168.1.10.6633: Flags [P.], seq 4463:4588, ack 1, win 58, options [nop,nop,TS val 21917416 ecr 46590326], length 125: OpenFlow
	version 1.0, type PACKET_IN, length 125, xid 0x00000000
21:28:42.066004 IP 192.168.1.30.49349 > 192.168.1.10.6633: Flags [P.], seq 4588:4713, ack 1, win 58, options [nop,nop,TS val 21917416 ecr 46590326], length 125: OpenFlow
	version 1.0, type PACKET_IN, length 125, xid 0x00000000
21:28:42.066017 IP 192.168.1.30.49349 > 192.168.1.10.6633: Flags [P.], seq 4713:4838, ack 1, win 58, options [nop,nop,TS val 21917416 ecr 46590326], length 125: OpenFlow
	version 1.0, type PACKET_IN, length 125, xid 0x00000000
21:28:42.066032 IP 192.168.1.30.49349 > 192.168.1.10.6633: Flags [P.], seq 4838:4963, ack 1, win 58, options [nop,nop,TS val 21917416 ecr 46590326], length 125: OpenFlow
	version 1.0, type PACKET_IN, length 125, xid 0x00000000
21:28:42.066044 IP 192.168.1.30.49349 > 192.168.1.10.6633: Flags [P.], seq 4963:5088, ack 1, win 58, options [nop,nop,TS val 21917416 ecr 46590326], length 125: OpenFlow
	version 1.0, type PACKET_IN, length 125, xid 0x00000000
21:28:42.066057 IP 192.168.1.30.49349 > 192.168.1.10.6633: Flags [P.], seq 5088:5213, ack 1, win 58, options [nop,nop,TS val 21917416 ecr 46590326], length 125: OpenFlow
	version 1.0, type PACKET_IN, length 125, xid 0x00000000
21:28:42.066069 IP 192.168.1.30.49349 > 192.168.1.10.6633: Flags [P.], seq 5213:5338, ack 1, win 58, options [nop,nop,TS val 21917416 ecr 46590326], length 125: OpenFlow
	version 1.0, type PACKET_IN, length 125, xid 0x00000000
21:28:42.066082 IP 192.168.1.30.49349 > 192.168.1.10.6633: Flags [P.], seq 5338:5463, ack 1, win 58, options [nop,nop,TS val 21917416 ecr 46590326], length 125: OpenFlow
	version 1.0, type PACKET_IN, length 125, xid 0x00000000
21:28:42.066095 IP 192.168.1.30.49349 > 192.168.1.10.6633: Flags [P.], seq 5463:5588, ack 1, win 58, options [nop,nop,TS val 21917416 ecr 46590326], length 125: OpenFlow
	version 1.0, type PACKET_IN, length 125, xid 0x00000000
21:28:42.066101 IP 192.168.1.30.49349 > 192.168.1.10.6633: Flags [P.], seq 5588:5713, ack 1, win 58, options [nop,nop,TS val 21917416 ecr 46590326], length 125: OpenFlow
	version 1.0, type PACKET_IN, length 125, xid 0x00000000
21:28:42.066108 IP 192.168.1.30.49349 > 192.168.1.10.6633: Flags [P.], seq 5713:5838, ack 1, win 58, options [nop,nop,TS val 21917416 ecr 46590326], length 125: OpenFlow
	version 1.0, type PACKET_IN, length 125, xid 0x00000000
21:28:42.066114 IP 192.168.1.30.49349 > 192.168.1.10.6633: Flags [P.], seq 5838:5963, ack 1, win 58, options [nop,nop,TS val 21917416 ecr 46590326], length 125: OpenFlow
	version 1.0, type PACKET_IN, length 125, xid 0x00000000
21:28:42.066145 IP 192.168.1.30.49349 > 192.168.1.10.6633: Flags [P.], seq 5963:6088, ack 1, win 58, options [nop,nop,TS val 21917416 ecr 46590327], length 125: OpenFlow
	version 1.0, type PACKET_IN, length 125, xid 0x00000000
21:28:42.066163 IP 192.168.1.30.49349 > 192.168.1.10.6633: Flags [P.], seq 6088:6213, ack 1, win 58, options [nop,nop,TS val 21917416 ecr 46590327], length 125: OpenFlow
	version 1.0, type PACKET_IN, length 125, xid 0x00000000
21:28:42.066182 IP 192.168.1.30.49349 > 192.168.1.10.6633: Flags [P.], seq 6213:6338, ack 1, win 58, options [nop,nop,TS val 21917416 ecr 46590327], length 125: OpenFlow
	version 1.0, type PACKET_IN, length 125, xid 0x00000000
21:28:42.066202 IP 192.168.1.30.49349 > 192.168.1.10.6633: Flags [P.], seq 6338:6463, ack 1, win 58, options [nop,nop,TS val 21917416 ecr 46590327], length 125: OpenFlow
	version 1.0, type PACKET_IN, length 125, xid 0x00000000
21:28:42.066221 IP 192.168.1.30.49349 > 192.168.1.10.6633: Flags [P.], seq 6463:6588, ack 1, win 58, options [nop,nop,TS val 21917416 ecr 46590327], length 125: OpenFlow
	version 1.0, type PACKET_IN, length 125, xid 0x00000000
21:28:42.066240 IP 192.168.1.30.49349 > 192.168.1.10.6633: Flags [P.], seq 6588:6713, ack 1, win 58, options [nop,nop,TS val 21917416 ecr 46590327], length 125: OpenFlow
	version 1.0, type PACKET_IN, length 125, xid 0x00000000
21:28:42.066260 IP 192.168.1.30.49349 > 192.168.1.10.6633: Flags [P.], seq 6713:6838, ack 1, win 58, options [nop,nop,TS val 21917416 ecr 46590327], length 125: OpenFlow
	version 1.0, type PACKET_IN, length 125, xid 0x00000000
21:28:42.066277 IP 192.168.1.30.49349 > 192.168.1.10.6633: Flags [P.], seq 6838:6963, ack 1, win 58, options [nop,nop,TS val 21917416 ecr 46590327], length 125: OpenFlow
	version 1.0, type PACKET_IN, length 125, xid 0x00000000
21:28:42.066293 IP 192.168.1.30.49349 > 192.168.1.10.6633: Flags [P.], seq 6963:7088, ack 1, win 58, options [nop,nop,TS val 21917416 ecr 46590327], length 125: OpenFlow
	version 1.0, type PACKET_IN, length 125, xid 0x00000000
21:28:42.066311 IP 192.168.1.30.49349 > 192.168.1.10.6633: Flags [P.], seq 7088:7213, ack 1, win 58, options [nop,nop,TS val 21917416 ecr 46590327], length 125: OpenFlow
	version 1.0, type PACKET_IN, length 125, xid 0x00000000
21:28:42.066329 IP 192.168.1.30.49349 > 192.168.1.10.6633: Flags [P.], seq 7213:7338, ack 1, win 58, options [nop,nop,TS val 21917416 ecr 46590327], length 125: OpenFlow
	version 1.0, type PACKET_IN, length 125, xid 0x00000000
21:28:42.066346 IP 192.168.1.30.49349 > 192.168.1.10.6633: Flags [P.], seq 7338:7463, ack 1, win 58, options [nop,nop,TS val 21917416 ecr 46590327], length 125: OpenFlow
	version 1.0, type PACKET_IN, length 125, xid 0x00000000
21:28:42.066362 IP 192.168.1.30.49349 > 192.168.1.10.6633: Flags [P.], seq 7463:7588, ack 1, win 58, options [nop,nop,TS val 21917416 ecr 46590327], length 125: OpenFlow
	version 1.0, type PACKET_IN, length 125, xid 0x00000000
21:28:42.066379 IP 192.168.1.30.49349 > 192.168.1.10.6633: Flags [P.], seq 7588:7713, ack 1, win 58, options [nop,nop,TS val 21917416 ecr 46590327], length 125: OpenFlow
	version 1.0, type PACKET_IN, length 125, xid 0x00000000
21:28:42.066396 IP 192.168.1.30.49349 > 192.168.1.10.6633: Flags [P.], seq 7713:7838, ack 1, win 58, options [nop,nop,TS val 21917416 ecr 46590327], length 125: OpenFlow
	version 1.0, type PACKET_IN, length 125, xid 0x00000000
21:28:42.066415 IP 192.168.1.30.49349 > 192.168.1.10.6633: Flags [P.], seq 7838:7963, ack 1, win 58, options [nop,nop,TS val 21917416 ecr 46590327], length 125: OpenFlow
	version 1.0, type PACKET_IN, length 125, xid 0x00000000
21:28:42.069806 IP 192.168.1.10.6633 > 192.168.1.30.49349: Flags [.], ack 4588, win 8864, options [nop,nop,TS val 46590327 ecr 21917415], length 0
21:28:42.069855 IP 192.168.1.10.6633 > 192.168.1.30.49349: Flags [.], ack 6088, win 8864, options [nop,nop,TS val 46590327 ecr 21917416], length 0
21:28:42.069892 IP 192.168.1.10.6633 > 192.168.1.30.49349: Flags [.], ack 6713, win 8864, options [nop,nop,TS val 46590327 ecr 21917416], length 0
21:28:42.069952 IP 192.168.1.10.6633 > 192.168.1.30.49349: Flags [.], ack 7963, win 8864, options [nop,nop,TS val 46590327 ecr 21917416], length 0
21:28:42.098518 IP 192.168.1.30.49349 > 192.168.1.10.6633: Flags [P.], seq 7963:8088, ack 1, win 58, options [nop,nop,TS val 21917424 ecr 46590327], length 125: OpenFlow
	version 1.0, type PACKET_IN, length 125, xid 0x00000000
21:28:42.098571 IP 192.168.1.30.49349 > 192.168.1.10.6633: Flags [P.], seq 8088:8213, ack 1, win 58, options [nop,nop,TS val 21917424 ecr 46590327], length 125: OpenFlow
	version 1.0, type PACKET_IN, length 125, xid 0x00000000
21:28:42.098604 IP 192.168.1.30.49349 > 192.168.1.10.6633: Flags [P.], seq 8213:8338, ack 1, win 58, options [nop,nop,TS val 21917424 ecr 46590327], length 125: OpenFlow
	version 1.0, type PACKET_IN, length 125, xid 0x00000000
21:28:42.098634 IP 192.168.1.30.49349 > 192.168.1.10.6633: Flags [P.], seq 8338:8463, ack 1, win 58, options [nop,nop,TS val 21917424 ecr 46590327], length 125: OpenFlow
	version 1.0, type PACKET_IN, length 125, xid 0x00000000
21:28:42.098792 IP 192.168.1.30.49349 > 192.168.1.10.6633: Flags [P.], seq 8463:8588, ack 1, win 58, options [nop,nop,TS val 21917424 ecr 46590327], length 125: OpenFlow
	version 1.0, type PACKET_IN, length 125, xid 0x00000000
21:28:42.098828 IP 192.168.1.30.49349 > 192.168.1.10.6633: Flags [P.], seq 8588:8713, ack 1, win 58, options [nop,nop,TS val 21917424 ecr 46590327], length 125: OpenFlow
	version 1.0, type PACKET_IN, length 125, xid 0x00000000
21:28:42.098857 IP 192.168.1.30.49349 > 192.168.1.10.6633: Flags [P.], seq 8713:8838, ack 1, win 58, options [nop,nop,TS val 21917424 ecr 46590327], length 125: OpenFlow
	version 1.0, type PACKET_IN, length 125, xid 0x00000000
21:28:42.098886 IP 192.168.1.30.49349 > 192.168.1.10.6633: Flags [P.], seq 8838:8963, ack 1, win 58, options [nop,nop,TS val 21917424 ecr 46590327], length 125: OpenFlow
	version 1.0, type PACKET_IN, length 125, xid 0x00000000
21:28:42.098919 IP 192.168.1.30.49349 > 192.168.1.10.6633: Flags [P.], seq 8963:9051, ack 1, win 58, options [nop,nop,TS val 21917424 ecr 46590327], length 88: OpenFlow
	version 1.0, type PACKET_IN, length 88, xid 0x00000000
21:28:42.098948 IP 192.168.1.30.49349 > 192.168.1.10.6633: Flags [P.], seq 9051:9176, ack 1, win 58, options [nop,nop,TS val 21917424 ecr 46590327], length 125: OpenFlow
	version 1.0, type PACKET_IN, length 125, xid 0x00000000
21:28:42.098980 IP 192.168.1.30.49349 > 192.168.1.10.6633: Flags [P.], seq 9176:9301, ack 1, win 58, options [nop,nop,TS val 21917424 ecr 46590327], length 125: OpenFlow
	version 1.0, type PACKET_IN, length 125, xid 0x00000000
21:28:42.099011 IP 192.168.1.30.49349 > 192.168.1.10.6633: Flags [P.], seq 9301:9426, ack 1, win 58, options [nop,nop,TS val 21917424 ecr 46590327], length 125: OpenFlow
	version 1.0, type PACKET_IN, length 125, xid 0x00000000
21:28:42.099044 IP 192.168.1.30.49349 > 192.168.1.10.6633: Flags [P.], seq 9426:9551, ack 1, win 58, options [nop,nop,TS val 21917424 ecr 46590327], length 125: OpenFlow
	version 1.0, type PACKET_IN, length 125, xid 0x00000000
21:28:42.099074 IP 192.168.1.30.49349 > 192.168.1.10.6633: Flags [P.], seq 9551:9676, ack 1, win 58, options [nop,nop,TS val 21917424 ecr 46590327], length 125: OpenFlow
	version 1.0, type PACKET_IN, length 125, xid 0x00000000
21:28:42.099102 IP 192.168.1.30.49349 > 192.168.1.10.6633: Flags [P.], seq 9676:9801, ack 1, win 58, options [nop,nop,TS val 21917424 ecr 46590327], length 125: OpenFlow
	version 1.0, type PACKET_IN, length 125, xid 0x00000000
21:28:42.099131 IP 192.168.1.30.49349 > 192.168.1.10.6633: Flags [P.], seq 9801:9926, ack 1, win 58, options [nop,nop,TS val 21917424 ecr 46590327], length 125: OpenFlow
	version 1.0, type PACKET_IN, length 125, xid 0x00000000
21:28:42.099153 IP 192.168.1.10.6633 > 192.168.1.30.49349: Flags [.], ack 8088, win 8864, options [nop,nop,TS val 46590335 ecr 21917424], length 0
21:28:42.099161 IP 192.168.1.30.49349 > 192.168.1.10.6633: Flags [P.], seq 9926:10051, ack 1, win 58, options [nop,nop,TS val 21917424 ecr 46590327], length 125: OpenFlow
	version 1.0, type PACKET_IN, length 125, xid 0x00000000
21:28:42.099163 IP 192.168.1.10.6633 > 192.168.1.30.49349: Flags [.], ack 8463, win 8864, options [nop,nop,TS val 46590335 ecr 21917424], length 0
21:28:42.099170 IP 192.168.1.10.6633 > 192.168.1.30.49349: Flags [.], ack 8713, win 8864, options [nop,nop,TS val 46590335 ecr 21917424], length 0
21:28:42.099181 IP 192.168.1.10.6633 > 192.168.1.30.49349: Flags [.], ack 9176, win 8864, options [nop,nop,TS val 46590335 ecr 21917424], length 0
21:28:42.099307 IP 192.168.1.10.6633 > 192.168.1.30.49349: Flags [.], ack 9801, win 8864, options [nop,nop,TS val 46590335 ecr 21917424], length 0
21:28:42.099311 IP 192.168.1.30.49349 > 192.168.1.10.6633: Flags [P.], seq 10051:10176, ack 1, win 58, options [nop,nop,TS val 21917424 ecr 46590335], length 125: OpenFlow
	version 1.0, type PACKET_IN, length 125, xid 0x00000000
21:28:42.099351 IP 192.168.1.30.49349 > 192.168.1.10.6633: Flags [P.], seq 10176:10301, ack 1, win 58, options [nop,nop,TS val 21917424 ecr 46590335], length 125: OpenFlow
	version 1.0, type PACKET_IN, length 125, xid 0x00000000
21:28:42.099383 IP 192.168.1.30.49349 > 192.168.1.10.6633: Flags [P.], seq 10301:10426, ack 1, win 58, options [nop,nop,TS val 21917424 ecr 46590335], length 125: OpenFlow
	version 1.0, type PACKET_IN, length 125, xid 0x00000000
21:28:42.099412 IP 192.168.1.30.49349 > 192.168.1.10.6633: Flags [P.], seq 10426:10551, ack 1, win 58, options [nop,nop,TS val 21917424 ecr 46590335], length 125: OpenFlow
	version 1.0, type PACKET_IN, length 125, xid 0x00000000
21:28:42.099442 IP 192.168.1.30.49349 > 192.168.1.10.6633: Flags [P.], seq 10551:10676, ack 1, win 58, options [nop,nop,TS val 21917424 ecr 46590335], length 125: OpenFlow
	version 1.0, type PACKET_IN, length 125, xid 0x00000000
21:28:42.099474 IP 192.168.1.30.49349 > 192.168.1.10.6633: Flags [P.], seq 10676:10801, ack 1, win 58, options [nop,nop,TS val 21917424 ecr 46590335], length 125: OpenFlow
	version 1.0, type PACKET_IN, length 125, xid 0x00000000
21:28:42.099507 IP 192.168.1.30.49349 > 192.168.1.10.6633: Flags [P.], seq 10801:10926, ack 1, win 58, options [nop,nop,TS val 21917424 ecr 46590335], length 125: OpenFlow
	version 1.0, type PACKET_IN, length 125, xid 0x00000000
21:28:42.099537 IP 192.168.1.30.49349 > 192.168.1.10.6633: Flags [P.], seq 10926:11051, ack 1, win 58, options [nop,nop,TS val 21917424 ecr 46590335], length 125: OpenFlow
	version 1.0, type PACKET_IN, length 125, xid 0x00000000
21:28:42.099458 IP 192.168.1.10.6633 > 192.168.1.30.49349: Flags [.], ack 10051, win 8864, options [nop,nop,TS val 46590335 ecr 21917424], length 0
21:28:42.099566 IP 192.168.1.30.49349 > 192.168.1.10.6633: Flags [P.], seq 11051:11176, ack 1, win 58, options [nop,nop,TS val 21917424 ecr 46590335], length 125: OpenFlow
	version 1.0, type PACKET_IN, length 125, xid 0x00000000
21:28:42.099575 IP 192.168.1.10.6633 > 192.168.1.30.49349: Flags [.], ack 10426, win 8864, options [nop,nop,TS val 46590335 ecr 21917424], length 0
21:28:42.099586 IP 192.168.1.30.49349 > 192.168.1.10.6633: Flags [P.], seq 11176:11301, ack 1, win 58, options [nop,nop,TS val 21917424 ecr 46590335], length 125: OpenFlow
	version 1.0, type PACKET_IN, length 125, xid 0x00000000
21:28:42.099607 IP 192.168.1.30.49349 > 192.168.1.10.6633: Flags [P.], seq 11301:11426, ack 1, win 58, options [nop,nop,TS val 21917424 ecr 46590335], length 125: OpenFlow
	version 1.0, type PACKET_IN, length 125, xid 0x00000000
21:28:42.099625 IP 192.168.1.30.49349 > 192.168.1.10.6633: Flags [P.], seq 11426:11551, ack 1, win 58, options [nop,nop,TS val 21917424 ecr 46590335], length 125: OpenFlow
	version 1.0, type PACKET_IN, length 125, xid 0x00000000
21:28:42.099643 IP 192.168.1.30.49349 > 192.168.1.10.6633: Flags [P.], seq 11551:11676, ack 1, win 58, options [nop,nop,TS val 21917424 ecr 46590335], length 125: OpenFlow
	version 1.0, type PACKET_IN, length 125, xid 0x00000000
21:28:42.099659 IP 192.168.1.30.49349 > 192.168.1.10.6633: Flags [P.], seq 11676:11801, ack 1, win 58, options [nop,nop,TS val 21917424 ecr 46590335], length 125: OpenFlow
	version 1.0, type PACKET_IN, length 125, xid 0x00000000
21:28:42.099678 IP 192.168.1.30.49349 > 192.168.1.10.6633: Flags [P.], seq 11801:11926, ack 1, win 58, options [nop,nop,TS val 21917424 ecr 46590335], length 125: OpenFlow
	version 1.0, type PACKET_IN, length 125, xid 0x00000000
21:28:42.099687 IP 192.168.1.10.6633 > 192.168.1.30.49349: Flags [.], ack 10926, win 8864, options [nop,nop,TS val 46590335 ecr 21917424], length 0
21:28:42.099696 IP 192.168.1.30.49349 > 192.168.1.10.6633: Flags [P.], seq 11926:12051, ack 1, win 58, options [nop,nop,TS val 21917424 ecr 46590335], length 125: OpenFlow
	version 1.0, type PACKET_IN, length 125, xid 0x00000000
21:28:42.099719 IP 192.168.1.30.49349 > 192.168.1.10.6633: Flags [P.], seq 12051:12176, ack 1, win 58, options [nop,nop,TS val 21917424 ecr 46590335], length 125: OpenFlow
	version 1.0, type PACKET_IN, length 125, xid 0x00000000
21:28:42.099740 IP 192.168.1.30.49349 > 192.168.1.10.6633: Flags [P.], seq 12176:12301, ack 1, win 58, options [nop,nop,TS val 21917424 ecr 46590335], length 125: OpenFlow
	version 1.0, type PACKET_IN, length 125, xid 0x00000000
21:28:42.099759 IP 192.168.1.30.49349 > 192.168.1.10.6633: Flags [P.], seq 12301:12426, ack 1, win 58, options [nop,nop,TS val 21917424 ecr 46590335], length 125: OpenFlow
	version 1.0, type PACKET_IN, length 125, xid 0x00000000
21:28:42.099778 IP 192.168.1.30.49349 > 192.168.1.10.6633: Flags [P.], seq 12426:12551, ack 1, win 58, options [nop,nop,TS val 21917424 ecr 46590335], length 125: OpenFlow
	version 1.0, type PACKET_IN, length 125, xid 0x00000000
21:28:42.099794 IP 192.168.1.10.6633 > 192.168.1.30.49349: Flags [.], ack 11551, win 8864, options [nop,nop,TS val 46590335 ecr 21917424], length 0
21:28:42.099796 IP 192.168.1.30.49349 > 192.168.1.10.6633: Flags [P.], seq 12551:12676, ack 1, win 58, options [nop,nop,TS val 21917424 ecr 46590335], length 125: OpenFlow
	version 1.0, type PACKET_IN, length 125, xid 0x00000000
21:28:42.099817 IP 192.168.1.30.49349 > 192.168.1.10.6633: Flags [P.], seq 12676:12801, ack 1, win 58, options [nop,nop,TS val 21917424 ecr 46590335], length 125: OpenFlow
	version 1.0, type PACKET_IN, length 125, xid 0x00000000
21:28:42.099834 IP 192.168.1.30.49349 > 192.168.1.10.6633: Flags [P.], seq 12801:12926, ack 1, win 58, options [nop,nop,TS val 21917424 ecr 46590335], length 125: OpenFlow
	version 1.0, type PACKET_IN, length 125, xid 0x00000000
21:28:42.099851 IP 192.168.1.30.49349 > 192.168.1.10.6633: Flags [P.], seq 12926:13051, ack 1, win 58, options [nop,nop,TS val 21917424 ecr 46590335], length 125: OpenFlow
	version 1.0, type PACKET_IN, length 125, xid 0x00000000
21:28:42.099869 IP 192.168.1.30.49349 > 192.168.1.10.6633: Flags [P.], seq 13051:13176, ack 1, win 58, options [nop,nop,TS val 21917424 ecr 46590335], length 125: OpenFlow
	version 1.0, type PACKET_IN, length 125, xid 0x00000000
21:28:42.099936 IP 192.168.1.10.6633 > 192.168.1.30.49349: Flags [.], ack 12301, win 8864, options [nop,nop,TS val 46590335 ecr 21917424], length 0
21:28:42.100032 IP 192.168.1.10.6633 > 192.168.1.30.49349: Flags [.], ack 12926, win 8864, options [nop,nop,TS val 46590335 ecr 21917424], length 0
21:28:42.100128 IP 192.168.1.10.6633 > 192.168.1.30.49349: Flags [.], ack 13176, win 8864, options [nop,nop,TS val 46590335 ecr 21917424], length 0
21:28:42.134611 IP 192.168.1.30.49349 > 192.168.1.10.6633: Flags [P.], seq 13176:13301, ack 1, win 58, options [nop,nop,TS val 21917430 ecr 46590335], length 125: OpenFlow
	version 1.0, type PACKET_IN, length 125, xid 0x00000000
21:28:42.134646 IP 192.168.1.30.49349 > 192.168.1.10.6633: Flags [P.], seq 13301:13426, ack 1, win 58, options [nop,nop,TS val 21917430 ecr 46590335], length 125: OpenFlow
	version 1.0, type PACKET_IN, length 125, xid 0x00000000
21:28:42.134668 IP 192.168.1.30.49349 > 192.168.1.10.6633: Flags [P.], seq 13426:13551, ack 1, win 58, options [nop,nop,TS val 21917430 ecr 46590335], length 125: OpenFlow
	version 1.0, type PACKET_IN, length 125, xid 0x00000000
21:28:42.134683 IP 192.168.1.30.49349 > 192.168.1.10.6633: Flags [P.], seq 13551:13676, ack 1, win 58, options [nop,nop,TS val 21917430 ecr 46590335], length 125: OpenFlow
	version 1.0, type PACKET_IN, length 125, xid 0x00000000
21:28:42.134698 IP 192.168.1.30.49349 > 192.168.1.10.6633: Flags [P.], seq 13676:13801, ack 1, win 58, options [nop,nop,TS val 21917430 ecr 46590335], length 125: OpenFlow
	version 1.0, type PACKET_IN, length 125, xid 0x00000000
21:28:42.134713 IP 192.168.1.30.49349 > 192.168.1.10.6633: Flags [P.], seq 13801:13926, ack 1, win 58, options [nop,nop,TS val 21917430 ecr 46590335], length 125: OpenFlow
	version 1.0, type PACKET_IN, length 125, xid 0x00000000
21:28:42.134728 IP 192.168.1.30.49349 > 192.168.1.10.6633: Flags [P.], seq 13926:14051, ack 1, win 58, options [nop,nop,TS val 21917430 ecr 46590335], length 125: OpenFlow
	version 1.0, type PACKET_IN, length 125, xid 0x00000000
21:28:42.134743 IP 192.168.1.30.49349 > 192.168.1.10.6633: Flags [P.], seq 14051:14176, ack 1, win 58, options [nop,nop,TS val 21917430 ecr 46590335], length 125: OpenFlow
	version 1.0, type PACKET_IN, length 125, xid 0x00000000
21:28:42.134758 IP 192.168.1.30.49349 > 192.168.1.10.6633: Flags [P.], seq 14176:14301, ack 1, win 58, options [nop,nop,TS val 21917430 ecr 46590335], length 125: OpenFlow
	version 1.0, type PACKET_IN, length 125, xid 0x00000000
21:28:42.134778 IP 192.168.1.30.49349 > 192.168.1.10.6633: Flags [P.], seq 14301:14426, ack 1, win 58, options [nop,nop,TS val 21917430 ecr 46590335], length 125: OpenFlow
	version 1.0, type PACKET_IN, length 125, xid 0x00000000
21:28:42.134794 IP 192.168.1.30.49349 > 192.168.1.10.6633: Flags [P.], seq 14426:14551, ack 1, win 58, options [nop,nop,TS val 21917430 ecr 46590335], length 125: OpenFlow
	version 1.0, type PACKET_IN, length 125, xid 0x00000000
21:28:42.134809 IP 192.168.1.30.49349 > 192.168.1.10.6633: Flags [P.], seq 14551:14676, ack 1, win 58, options [nop,nop,TS val 21917430 ecr 46590335], length 125: OpenFlow
	version 1.0, type PACKET_IN, length 125, xid 0x00000000
21:28:42.134824 IP 192.168.1.30.49349 > 192.168.1.10.6633: Flags [P.], seq 14676:14801, ack 1, win 58, options [nop,nop,TS val 21917430 ecr 46590335], length 125: OpenFlow
	version 1.0, type PACKET_IN, length 125, xid 0x00000000
21:28:42.134838 IP 192.168.1.30.49349 > 192.168.1.10.6633: Flags [P.], seq 14801:14926, ack 1, win 58, options [nop,nop,TS val 21917430 ecr 46590335], length 125: OpenFlow
	version 1.0, type PACKET_IN, length 125, xid 0x00000000
21:28:42.134853 IP 192.168.1.30.49349 > 192.168.1.10.6633: Flags [P.], seq 14926:15051, ack 1, win 58, options [nop,nop,TS val 21917430 ecr 46590335], length 125: OpenFlow
	version 1.0, type PACKET_IN, length 125, xid 0x00000000
21:28:42.134868 IP 192.168.1.30.49349 > 192.168.1.10.6633: Flags [P.], seq 15051:15176, ack 1, win 58, options [nop,nop,TS val 21917430 ecr 46590335], length 125: OpenFlow
	version 1.0, type PACKET_IN, length 125, xid 0x00000000
21:28:42.134888 IP 192.168.1.30.49349 > 192.168.1.10.6633: Flags [P.], seq 15176:15301, ack 1, win 58, options [nop,nop,TS val 21917430 ecr 46590335], length 125: OpenFlow
	version 1.0, type PACKET_IN, length 125, xid 0x00000000
21:28:42.134903 IP 192.168.1.30.49349 > 192.168.1.10.6633: Flags [P.], seq 15301:15426, ack 1, win 58, options [nop,nop,TS val 21917430 ecr 46590335], length 125: OpenFlow
	version 1.0, type PACKET_IN, length 125, xid 0x00000000
21:28:42.134919 IP 192.168.1.30.49349 > 192.168.1.10.6633: Flags [P.], seq 15426:15551, ack 1, win 58, options [nop,nop,TS val 21917430 ecr 46590335], length 125: OpenFlow
	version 1.0, type PACKET_IN, length 125, xid 0x00000000
21:28:42.134934 IP 192.168.1.30.49349 > 192.168.1.10.6633: Flags [P.], seq 15551:15676, ack 1, win 58, options [nop,nop,TS val 21917430 ecr 46590335], length 125: OpenFlow
	version 1.0, type PACKET_IN, length 125, xid 0x00000000
21:28:42.136772 IP 192.168.1.10.6633 > 192.168.1.30.49349: Flags [.], ack 14676, win 8864, options [nop,nop,TS val 46590344 ecr 21917430], length 0
21:28:42.137077 IP 192.168.1.10.6633 > 192.168.1.30.49349: Flags [.], ack 15676, win 8864, options [nop,nop,TS val 46590344 ecr 21917430], length 0
21:28:42.143325 IP 192.168.1.30.49349 > 192.168.1.10.6633: Flags [P.], seq 15551:15676, ack 1, win 58, options [nop,nop,TS val 21917433 ecr 46590335], length 125: OpenFlow
	version 1.0, type PACKET_IN, length 125, xid 0x00000000
21:28:42.144163 IP 192.168.1.10.6633 > 192.168.1.30.49349: Flags [.], ack 15676, win 8864, options [nop,nop,TS val 46590346 ecr 21917433,nop,nop,sack 1 {15551:15676}], length 0
21:28:42.152073 IP 192.168.1.30.49349 > 192.168.1.10.6633: Flags [P.], seq 15676:15801, ack 1, win 58, options [nop,nop,TS val 21917437 ecr 46590346], length 125: OpenFlow
	version 1.0, type PACKET_IN, length 125, xid 0x00000000
21:28:42.152102 IP 192.168.1.30.49349 > 192.168.1.10.6633: Flags [P.], seq 15801:15926, ack 1, win 58, options [nop,nop,TS val 21917437 ecr 46590346], length 125: OpenFlow
	version 1.0, type PACKET_IN, length 125, xid 0x00000000
21:28:42.152120 IP 192.168.1.30.49349 > 192.168.1.10.6633: Flags [P.], seq 15926:16051, ack 1, win 58, options [nop,nop,TS val 21917437 ecr 46590346], length 125: OpenFlow
	version 1.0, type PACKET_IN, length 125, xid 0x00000000
21:28:42.152138 IP 192.168.1.30.49349 > 192.168.1.10.6633: Flags [P.], seq 16051:16176, ack 1, win 58, options [nop,nop,TS val 21917437 ecr 46590346], length 125: OpenFlow
	version 1.0, type PACKET_IN, length 125, xid 0x00000000
21:28:42.152157 IP 192.168.1.30.49349 > 192.168.1.10.6633: Flags [P.], seq 16176:16264, ack 1, win 58, options [nop,nop,TS val 21917437 ecr 46590346], length 88: OpenFlow
	version 1.0, type PACKET_IN, length 88, xid 0x00000000
21:28:42.152181 IP 192.168.1.30.49349 > 192.168.1.10.6633: Flags [P.], seq 16264:16389, ack 1, win 58, options [nop,nop,TS val 21917437 ecr 46590346], length 125: OpenFlow
	version 1.0, type PACKET_IN, length 125, xid 0x00000000
21:28:42.152200 IP 192.168.1.30.49349 > 192.168.1.10.6633: Flags [P.], seq 16389:16514, ack 1, win 58, options [nop,nop,TS val 21917437 ecr 46590346], length 125: OpenFlow
	version 1.0, type PACKET_IN, length 125, xid 0x00000000
21:28:42.152219 IP 192.168.1.30.49349 > 192.168.1.10.6633: Flags [P.], seq 16514:16639, ack 1, win 58, options [nop,nop,TS val 21917437 ecr 46590346], length 125: OpenFlow
	version 1.0, type PACKET_IN, length 125, xid 0x00000000
21:28:42.152238 IP 192.168.1.30.49349 > 192.168.1.10.6633: Flags [P.], seq 16639:16764, ack 1, win 58, options [nop,nop,TS val 21917437 ecr 46590346], length 125: OpenFlow
	version 1.0, type PACKET_IN, length 125, xid 0x00000000
21:28:42.152262 IP 192.168.1.30.49349 > 192.168.1.10.6633: Flags [P.], seq 16764:16889, ack 1, win 58, options [nop,nop,TS val 21917437 ecr 46590346], length 125: OpenFlow
	version 1.0, type PACKET_IN, length 125, xid 0x00000000
21:28:42.152296 IP 192.168.1.30.49349 > 192.168.1.10.6633: Flags [P.], seq 16889:17014, ack 1, win 58, options [nop,nop,TS val 21917437 ecr 46590346], length 125: OpenFlow
	version 1.0, type PACKET_IN, length 125, xid 0x00000000
21:28:42.152330 IP 192.168.1.30.49349 > 192.168.1.10.6633: Flags [P.], seq 17014:17139, ack 1, win 58, options [nop,nop,TS val 21917437 ecr 46590346], length 125: OpenFlow
	version 1.0, type PACKET_IN, length 125, xid 0x00000000
21:28:42.152364 IP 192.168.1.30.49349 > 192.168.1.10.6633: Flags [P.], seq 17139:17264, ack 1, win 58, options [nop,nop,TS val 21917437 ecr 46590346], length 125: OpenFlow
	version 1.0, type PACKET_IN, length 125, xid 0x00000000
21:28:42.152396 IP 192.168.1.30.49349 > 192.168.1.10.6633: Flags [P.], seq 17264:17389, ack 1, win 58, options [nop,nop,TS val 21917437 ecr 46590346], length 125: OpenFlow
	version 1.0, type PACKET_IN, length 125, xid 0x00000000
21:28:42.152397 IP 192.168.1.10.6633 > 192.168.1.30.49349: Flags [.], ack 15801, win 8864, options [nop,nop,TS val 46590348 ecr 21917437], length 0
21:28:42.152412 IP 192.168.1.10.6633 > 192.168.1.30.49349: Flags [.], ack 15926, win 8864, options [nop,nop,TS val 46590348 ecr 21917437], length 0
21:28:42.152430 IP 192.168.1.30.49349 > 192.168.1.10.6633: Flags [P.], seq 17389:17514, ack 1, win 58, options [nop,nop,TS val 21917437 ecr 46590348], length 125: OpenFlow
	version 1.0, type PACKET_IN, length 125, xid 0x00000000
21:28:42.152446 IP 192.168.1.10.6633 > 192.168.1.30.49349: Flags [.], ack 16051, win 8864, options [nop,nop,TS val 46590348 ecr 21917437], length 0
21:28:42.152455 IP 192.168.1.10.6633 > 192.168.1.30.49349: Flags [.], ack 16176, win 8864, options [nop,nop,TS val 46590348 ecr 21917437], length 0
21:28:42.152459 IP 192.168.1.30.49349 > 192.168.1.10.6633: Flags [P.], seq 17514:17639, ack 1, win 58, options [nop,nop,TS val 21917437 ecr 46590348], length 125: OpenFlow
	version 1.0, type PACKET_IN, length 125, xid 0x00000000
21:28:42.152461 IP 192.168.1.10.6633 > 192.168.1.30.49349: Flags [.], ack 16264, win 8864, options [nop,nop,TS val 46590348 ecr 21917437], length 0
21:28:42.152467 IP 192.168.1.10.6633 > 192.168.1.30.49349: Flags [.], ack 16389, win 8864, options [nop,nop,TS val 46590348 ecr 21917437], length 0
21:28:42.152476 IP 192.168.1.10.6633 > 192.168.1.30.49349: Flags [.], ack 16514, win 8864, options [nop,nop,TS val 46590348 ecr 21917437], length 0
21:28:42.152484 IP 192.168.1.10.6633 > 192.168.1.30.49349: Flags [.], ack 16639, win 8864, options [nop,nop,TS val 46590348 ecr 21917437], length 0
21:28:42.152493 IP 192.168.1.10.6633 > 192.168.1.30.49349: Flags [.], ack 16764, win 8864, options [nop,nop,TS val 46590348 ecr 21917437], length 0
21:28:42.152498 IP 192.168.1.30.49349 > 192.168.1.10.6633: Flags [P.], seq 17639:17764, ack 1, win 58, options [nop,nop,TS val 21917437 ecr 46590348], length 125: OpenFlow
	version 1.0, type PACKET_IN, length 125, xid 0x00000000
21:28:42.152500 IP 192.168.1.10.6633 > 192.168.1.30.49349: Flags [.], ack 16889, win 8864, options [nop,nop,TS val 46590348 ecr 21917437], length 0
21:28:42.152506 IP 192.168.1.10.6633 > 192.168.1.30.49349: Flags [.], ack 17014, win 8864, options [nop,nop,TS val 46590348 ecr 21917437], length 0
21:28:42.152537 IP 192.168.1.30.49349 > 192.168.1.10.6633: Flags [P.], seq 17764:17889, ack 1, win 58, options [nop,nop,TS val 21917437 ecr 46590348], length 125: OpenFlow
	version 1.0, type PACKET_IN, length 125, xid 0x00000000
21:28:42.152568 IP 192.168.1.30.49349 > 192.168.1.10.6633: Flags [P.], seq 17889:18014, ack 1, win 58, options [nop,nop,TS val 21917437 ecr 46590348], length 125: OpenFlow
	version 1.0, type PACKET_IN, length 125, xid 0x00000000
21:28:42.152596 IP 192.168.1.30.49349 > 192.168.1.10.6633: Flags [P.], seq 18014:18139, ack 1, win 58, options [nop,nop,TS val 21917437 ecr 46590348], length 125: OpenFlow
	version 1.0, type PACKET_IN, length 125, xid 0x00000000
21:28:42.152625 IP 192.168.1.30.49349 > 192.168.1.10.6633: Flags [P.], seq 18139:18264, ack 1, win 58, options [nop,nop,TS val 21917437 ecr 46590348], length 125: OpenFlow
	version 1.0, type PACKET_IN, length 125, xid 0x00000000
21:28:42.152657 IP 192.168.1.30.49349 > 192.168.1.10.6633: Flags [P.], seq 18264:18389, ack 1, win 58, options [nop,nop,TS val 21917437 ecr 46590348], length 125: OpenFlow
	version 1.0, type PACKET_IN, length 125, xid 0x00000000
21:28:42.152690 IP 192.168.1.30.49349 > 192.168.1.10.6633: Flags [P.], seq 18389:18514, ack 1, win 58, options [nop,nop,TS val 21917437 ecr 46590348], length 125: OpenFlow
	version 1.0, type PACKET_IN, length 125, xid 0x00000000
21:28:42.152721 IP 192.168.1.30.49349 > 192.168.1.10.6633: Flags [P.], seq 18514:18639, ack 1, win 58, options [nop,nop,TS val 21917437 ecr 46590348], length 125: OpenFlow
	version 1.0, type PACKET_IN, length 125, xid 0x00000000
21:28:42.152728 IP 192.168.1.10.6633 > 192.168.1.30.49349: Flags [.], ack 17139, win 8864, options [nop,nop,TS val 46590348 ecr 21917437], length 0
21:28:42.152743 IP 192.168.1.10.6633 > 192.168.1.30.49349: Flags [.], ack 17264, win 8864, options [nop,nop,TS val 46590348 ecr 21917437], length 0
21:28:42.152752 IP 192.168.1.10.6633 > 192.168.1.30.49349: Flags [.], ack 17389, win 8864, options [nop,nop,TS val 46590348 ecr 21917437], length 0
21:28:42.152753 IP 192.168.1.30.49349 > 192.168.1.10.6633: Flags [P.], seq 18639:18764, ack 1, win 58, options [nop,nop,TS val 21917437 ecr 46590348], length 125: OpenFlow
	version 1.0, type PACKET_IN, length 125, xid 0x00000000
