21:28:42.052360 IP 192.168.1.30.49345 > 192.168.1.10.6633: Flags [P.], seq 2158715090:2158715215, ack 633325735, win 58, options [nop,nop,TS val 21917412 ecr 46590317], length 125: OpenFlow
	version 1.0, type PACKET_IN, length 125, xid 0x00000000
21:28:42.052389 IP 192.168.1.30.49345 > 192.168.1.10.6633: Flags [P.], seq 125:250, ack 1, win 58, options [nop,nop,TS val 21917412 ecr 46590317], length 125: OpenFlow
	version 1.0, type PACKET_IN, length 125, xid 0x00000000
21:28:42.052415 IP 192.168.1.30.49345 > 192.168.1.10.6633: Flags [P.], seq 250:375, ack 1, win 58, options [nop,nop,TS val 21917412 ecr 46590317], length 125: OpenFlow
	version 1.0, type PACKET_IN, length 125, xid 0x00000000
21:28:42.052440 IP 192.168.1.30.49345 > 192.168.1.10.6633: Flags [P.], seq 375:500, ack 1, win 58, options [nop,nop,TS val 21917412 ecr 46590317], length 125: OpenFlow
	version 1.0, type PACKET_IN, length 125, xid 0x00000000
21:28:42.052472 IP 192.168.1.30.49345 > 192.168.1.10.6633: Flags [P.], seq 500:625, ack 1, win 58, options [nop,nop,TS val 21917412 ecr 46590317], length 125: OpenFlow
	version 1.0, type PACKET_IN, length 125, xid 0x00000000
21:28:42.052499 IP 192.168.1.30.49345 > 192.168.1.10.6633: Flags [P.], seq 625:750, ack 1, win 58, options [nop,nop,TS val 21917412 ecr 46590317], length 125: OpenFlow
	version 1.0, type PACKET_IN, length 125, xid 0x00000000
21:28:42.052526 IP 192.168.1.30.49345 > 192.168.1.10.6633: Flags [P.], seq 750:875, ack 1, win 58, options [nop,nop,TS val 21917412 ecr 46590317], length 125: OpenFlow
	version 1.0, type PACKET_IN, length 125, xid 0x00000000
21:28:42.052552 IP 192.168.1.30.49345 > 192.168.1.10.6633: Flags [P.], seq 875:1000, ack 1, win 58, options [nop,nop,TS val 21917412 ecr 46590317], length 125: OpenFlow
	version 1.0, type PACKET_IN, length 125, xid 0x00000000
21:28:42.052576 IP 192.168.1.30.49345 > 192.168.1.10.6633: Flags [P.], seq 1000:1125, ack 1, win 58, options [nop,nop,TS val 21917412 ecr 46590317], length 125: OpenFlow
	version 1.0, type PACKET_IN, length 125, xid 0x00000000
21:28:42.052601 IP 192.168.1.30.49345 > 192.168.1.10.6633: Flags [P.], seq 1125:1250, ack 1, win 58, options [nop,nop,TS val 21917412 ecr 46590317], length 125: OpenFlow
	version 1.0, type PACKET_IN, length 125, xid 0x00000000
21:28:42.052627 IP 192.168.1.30.49345 > 192.168.1.10.6633: Flags [P.], seq 1250:1375, ack 1, win 58, options [nop,nop,TS val 21917412 ecr 46590317], length 125: OpenFlow
	version 1.0, type PACKET_IN, length 125, xid 0x00000000
21:28:42.052661 IP 192.168.1.30.49345 > 192.168.1.10.6633: Flags [P.], seq 1375:1463, ack 1, win 58, options [nop,nop,TS val 21917412 ecr 46590317], length 88: OpenFlow
	version 1.0, type PACKET_IN, length 88, xid 0x00000000
21:28:42.052686 IP 192.168.1.30.49345 > 192.168.1.10.6633: Flags [P.], seq 1463:1588, ack 1, win 58, options [nop,nop,TS val 21917412 ecr 46590317], length 125: OpenFlow
	version 1.0, type PACKET_IN, length 125, xid 0x00000000
21:28:42.054868 IP 192.168.1.10.6633 > 192.168.1.30.49345: Flags [.], ack 1463, win 16225, options [nop,nop,TS val 46590324 ecr 21917412], length 0
21:28:42.054881 IP 192.168.1.10.6633 > 192.168.1.30.49345: Flags [.], ack 1588, win 16225, options [nop,nop,TS val 46590324 ecr 21917412], length 0
21:28:42.056668 IP 192.168.1.30.49345 > 192.168.1.10.6633: Flags [P.], seq 1588:1713, ack 1, win 58, options [nop,nop,TS val 21917413 ecr 46590324], length 125: OpenFlow
	version 1.0, type PACKET_IN, length 125, xid 0x00000000
21:28:42.056715 IP 192.168.1.30.49345 > 192.168.1.10.6633: Flags [P.], seq 1713:1838, ack 1, win 58, options [nop,nop,TS val 21917413 ecr 46590324], length 125: OpenFlow
	version 1.0, type PACKET_IN, length 125, xid 0x00000000
21:28:42.056746 IP 192.168.1.30.49345 > 192.168.1.10.6633: Flags [P.], seq 1838:1963, ack 1, win 58, options [nop,nop,TS val 21917413 ecr 46590324], length 125: OpenFlow
	version 1.0, type PACKET_IN, length 125, xid 0x00000000
21:28:42.056779 IP 192.168.1.30.49345 > 192.168.1.10.6633: Flags [P.], seq 1963:2088, ack 1, win 58, options [nop,nop,TS val 21917413 ecr 46590324], length 125: OpenFlow
	version 1.0, type PACKET_IN, length 125, xid 0x00000000
21:28:42.056813 IP 192.168.1.30.49345 > 192.168.1.10.6633: Flags [P.], seq 2088:2213, ack 1, win 58, options [nop,nop,TS val 21917413 ecr 46590324], length 125: OpenFlow
	version 1.0, type PACKET_IN, length 125, xid 0x00000000
21:28:42.056846 IP 192.168.1.30.49345 > 192.168.1.10.6633: Flags [P.], seq 2213:2338, ack 1, win 58, options [nop,nop,TS val 21917413 ecr 46590324], length 125: OpenFlow
	version 1.0, type PACKET_IN, length 125, xid 0x00000000
21:28:42.056875 IP 192.168.1.30.49345 > 192.168.1.10.6633: Flags [P.], seq 2338:2463, ack 1, win 58, options [nop,nop,TS val 21917413 ecr 46590324], length 125: OpenFlow
	version 1.0, type PACKET_IN, length 125, xid 0x00000000
21:28:42.056917 IP 192.168.1.30.49345 > 192.168.1.10.6633: Flags [P.], seq 2463:2588, ack 1, win 58, options [nop,nop,TS val 21917413 ecr 46590324], length 125: OpenFlow
	version 1.0, type PACKET_IN, length 125, xid 0x00000000
21:28:42.056950 IP 192.168.1.30.49345 > 192.168.1.10.6633: Flags [P.], seq 2588:2713, ack 1, win 58, options [nop,nop,TS val 21917413 ecr 46590324], length 125: OpenFlow
	version 1.0, type PACKET_IN, length 125, xid 0x00000000
21:28:42.056982 IP 192.168.1.30.49345 > 192.168.1.10.6633: Flags [P.], seq 2713:2838, ack 1, win 58, options [nop,nop,TS val 21917413 ecr 46590324], length 125: OpenFlow
	version 1.0, type PACKET_IN, length 125, xid 0x00000000
21:28:42.057014 IP 192.168.1.30.49345 > 192.168.1.10.6633: Flags [P.], seq 2838:2963, ack 1, win 58, options [nop,nop,TS val 21917413 ecr 46590324], length 125: OpenFlow
	version 1.0, type PACKET_IN, length 125, xid 0x00000000
21:28:42.057047 IP 192.168.1.30.49345 > 192.168.1.10.6633: Flags [P.], seq 2963:3088, ack 1, win 58, options [nop,nop,TS val 21917413 ecr 46590324], length 125: OpenFlow
	version 1.0, type PACKET_IN, length 125, xid 0x00000000
21:28:42.057082 IP 192.168.1.30.49345 > 192.168.1.10.6633: Flags [P.], seq 3088:3213, ack 1, win 58, options [nop,nop,TS val 21917413 ecr 46590324], length 125: OpenFlow
	version 1.0, type PACKET_IN, length 125, xid 0x00000000
21:28:42.057113 IP 192.168.1.30.49345 > 192.168.1.10.6633: Flags [P.], seq 3213:3338, ack 1, win 58, options [nop,nop,TS val 21917413 ecr 46590324], length 125: OpenFlow
	version 1.0, type PACKET_IN, length 125, xid 0x00000000
21:28:42.057159 IP 192.168.1.30.49345 > 192.168.1.10.6633: Flags [P.], seq 3338:3463, ack 1, win 58, options [nop,nop,TS val 21917413 ecr 46590324], length 125: OpenFlow
	version 1.0, type PACKET_IN, length 125, xid 0x00000000
21:28:42.057214 IP 192.168.1.30.49345 > 192.168.1.10.6633: Flags [P.], seq 3463:3588, ack 1, win 58, options [nop,nop,TS val 21917413 ecr 46590324], length 125: OpenFlow
	version 1.0, type PACKET_IN, length 125, xid 0x00000000
21:28:42.057247 IP 192.168.1.30.49345 > 192.168.1.10.6633: Flags [P.], seq 3588:3713, ack 1, win 58, options [nop,nop,TS val 21917413 ecr 46590324], length 125: OpenFlow
	version 1.0, type PACKET_IN, length 125, xid 0x00000000
21:28:42.057279 IP 192.168.1.30.49345 > 192.168.1.10.6633: Flags [P.], seq 3713:3838, ack 1, win 58, options [nop,nop,TS val 21917414 ecr 46590324], length 125: OpenFlow
	version 1.0, type PACKET_IN, length 125, xid 0x00000000
21:28:42.057312 IP 192.168.1.10.6633 > 192.168.1.30.49345: Flags [.], ack 2463, win 16225, options [nop,nop,TS val 46590325 ecr 21917413], length 0
21:28:42.057315 IP 192.168.1.30.49345 > 192.168.1.10.6633: Flags [P.], seq 3838:3963, ack 1, win 58, options [nop,nop,TS val 21917414 ecr 46590324], length 125: OpenFlow
	version 1.0, type PACKET_IN, length 125, xid 0x00000000
21:28:42.057352 IP 192.168.1.30.49345 > 192.168.1.10.6633: Flags [P.], seq 3963:4088, ack 1, win 58, options [nop,nop,TS val 21917414 ecr 46590325], length 125: OpenFlow
	version 1.0, type PACKET_IN, length 125, xid 0x00000000
21:28:42.057381 IP 192.168.1.30.49345 > 192.168.1.10.6633: Flags [P.], seq 4088:4213, ack 1, win 58, options [nop,nop,TS val 21917414 ecr 46590325], length 125: OpenFlow
	version 1.0, type PACKET_IN, length 125, xid 0x00000000
21:28:42.057410 IP 192.168.1.30.49345 > 192.168.1.10.6633: Flags [P.], seq 4213:4338, ack 1, win 58, options [nop,nop,TS val 21917414 ecr 46590325], length 125: OpenFlow
	version 1.0, type PACKET_IN, length 125, xid 0x00000000
21:28:42.057440 IP 192.168.1.30.49345 > 192.168.1.10.6633: Flags [P.], seq 4338:4463, ack 1, win 58, options [nop,nop,TS val 21917414 ecr 46590325], length 125: OpenFlow
	version 1.0, type PACKET_IN, length 125, xid 0x00000000
21:28:42.057471 IP 192.168.1.30.49345 > 192.168.1.10.6633: Flags [P.], seq 4463:4588, ack 1, win 58, options [nop,nop,TS val 21917414 ecr 46590325], length 125: OpenFlow
	version 1.0, type PACKET_IN, length 125, xid 0x00000000
21:28:42.057503 IP 192.168.1.30.49345 > 192.168.1.10.6633: Flags [P.], seq 4588:4713, ack 1, win 58, options [nop,nop,TS val 21917414 ecr 46590325], length 125: OpenFlow
	version 1.0, type PACKET_IN, length 125, xid 0x00000000
21:28:42.057536 IP 192.168.1.30.49345 > 192.168.1.10.6633: Flags [P.], seq 4713:4838, ack 1, win 58, options [nop,nop,TS val 21917414 ecr 46590325], length 125: OpenFlow
	version 1.0, type PACKET_IN, length 125, xid 0x00000000
21:28:42.057569 IP 192.168.1.30.49345 > 192.168.1.10.6633: Flags [P.], seq 4838:4963, ack 1, win 58, options [nop,nop,TS val 21917414 ecr 46590325], length 125: OpenFlow
	version 1.0, type PACKET_IN, length 125, xid 0x00000000
21:28:42.057600 IP 192.168.1.30.49345 > 192.168.1.10.6633: Flags [P.], seq 4963:5088, ack 1, win 58, options [nop,nop,TS val 21917414 ecr 46590325], length 125: OpenFlow
	version 1.0, type PACKET_IN, length 125, xid 0x00000000
21:28:42.057620 IP 192.168.1.30.49345 > 192.168.1.10.6633: Flags [P.], seq 5088:5213, ack 1, win 58, options [nop,nop,TS val 21917414 ecr 46590325], length 125: OpenFlow
	version 1.0, type PACKET_IN, length 125, xid 0x00000000
21:28:42.057641 IP 192.168.1.30.49345 > 192.168.1.10.6633: Flags [P.], seq 5213:5338, ack 1, win 58, options [nop,nop,TS val 21917414 ecr 46590325], length 125: OpenFlow
	version 1.0, type PACKET_IN, length 125, xid 0x00000000
21:28:42.057660 IP 192.168.1.30.49345 > 192.168.1.10.6633: Flags [P.], seq 5338:5463, ack 1, win 58, options [nop,nop,TS val 21917414 ecr 46590325], length 125: OpenFlow
	version 1.0, type PACKET_IN, length 125, xid 0x00000000
21:28:42.057678 IP 192.168.1.30.49345 > 192.168.1.10.6633: Flags [P.], seq 5463:5588, ack 1, win 58, options [nop,nop,TS val 21917414 ecr 46590325], length 125: OpenFlow
	version 1.0, type PACKET_IN, length 125, xid 0x00000000
21:28:42.057696 IP 192.168.1.30.49345 > 192.168.1.10.6633: Flags [P.], seq 5588:5713, ack 1, win 58, options [nop,nop,TS val 21917414 ecr 46590325], length 125: OpenFlow
	version 1.0, type PACKET_IN, length 125, xid 0x00000000
21:28:42.057712 IP 192.168.1.30.49345 > 192.168.1.10.6633: Flags [P.], seq 5713:5838, ack 1, win 58, options [nop,nop,TS val 21917414 ecr 46590325], length 125: OpenFlow
	version 1.0, type PACKET_IN, length 125, xid 0x00000000
21:28:42.057729 IP 192.168.1.30.49345 > 192.168.1.10.6633: Flags [P.], seq 5838:5963, ack 1, win 58, options [nop,nop,TS val 21917414 ecr 46590325], length 125: OpenFlow
	version 1.0, type PACKET_IN, length 125, xid 0x00000000
21:28:42.057746 IP 192.168.1.30.49345 > 192.168.1.10.6633: Flags [P.], seq 5963:6088, ack 1, win 58, options [nop,nop,TS val 21917414 ecr 46590325], length 125: OpenFlow
	version 1.0, type PACKET_IN, length 125, xid 0x00000000
21:28:42.057764 IP 192.168.1.30.49345 > 192.168.1.10.6633: Flags [P.], seq 6088:6213, ack 1, win 58, options [nop,nop,TS val 21917414 ecr 46590325], length 125: OpenFlow
	version 1.0, type PACKET_IN, length 125, xid 0x00000000
21:28:42.057781 IP 192.168.1.30.49345 > 192.168.1.10.6633: Flags [P.], seq 6213:6338, ack 1, win 58, options [nop,nop,TS val 21917414 ecr 46590325], length 125: OpenFlow
	version 1.0, type PACKET_IN, length 125, xid 0x00000000
21:28:42.057800 IP 192.168.1.30.49345 > 192.168.1.10.6633: Flags [P.], seq 6338:6463, ack 1, win 58, options [nop,nop,TS val 21917414 ecr 46590325], length 125: OpenFlow
	version 1.0, type PACKET_IN, length 125, xid 0x00000000
21:28:42.057819 IP 192.168.1.30.49345 > 192.168.1.10.6633: Flags [P.], seq 6463:6588, ack 1, win 58, options [nop,nop,TS val 21917414 ecr 46590325], length 125: OpenFlow
	version 1.0, type PACKET_IN, length 125, xid 0x00000000
21:28:42.057838 IP 192.168.1.30.49345 > 192.168.1.10.6633: Flags [P.], seq 6588:6713, ack 1, win 58, options [nop,nop,TS val 21917414 ecr 46590325], length 125: OpenFlow
	version 1.0, type PACKET_IN, length 125, xid 0x00000000
21:28:42.057858 IP 192.168.1.30.49345 > 192.168.1.10.6633: Flags [P.], seq 6713:6838, ack 1, win 58, options [nop,nop,TS val 21917414 ecr 46590325], length 125: OpenFlow
	version 1.0, type PACKET_IN, length 125, xid 0x00000000
21:28:42.062124 IP 192.168.1.10.6633 > 192.168.1.30.49345: Flags [.], ack 3963, win 16225, options [nop,nop,TS val 46590325 ecr 21917413], length 0
21:28:42.062169 IP 192.168.1.10.6633 > 192.168.1.30.49345: Flags [.], ack 5463, win 16225, options [nop,nop,TS val 46590325 ecr 21917414], length 0
21:28:42.062204 IP 192.168.1.10.6633 > 192.168.1.30.49345: Flags [.], ack 6213, win 16225, options [nop,nop,TS val 46590325 ecr 21917414], length 0
21:28:42.062246 IP 192.168.1.10.6633 > 192.168.1.30.49345: Flags [.], ack 6838, win 16225, options [nop,nop,TS val 46590325 ecr 21917414], length 0
21:28:42.065478 IP 192.168.1.30.49345 > 192.168.1.10.6633: Flags [P.], seq 6838:11676, ack 1, win 58, options [nop,nop,TS val 21917415 ecr 46590325], length 4838: OpenFlow
	version 1.0, type PACKET_IN, length 125, xid 0x00000000
	version 1.0, type PACKET_IN, length 125, xid 0x00000000
	version 1.0, type PACKET_IN, length 125, xid 0x00000000
	version 1.0, type PACKET_IN, length 125, xid 0x00000000
	version 1.0, type PACKET_IN, length 125, xid 0x00000000
	version 1.0, type PACKET_IN, length 125, xid 0x00000000
	version 1.0, type PACKET_IN, length 125, xid 0x00000000
	version 1.0, type PACKET_IN, length 125, xid 0x00000000
	version 1.0, type PACKET_IN, length 125, xid 0x00000000
	version 1.0, type PACKET_IN, length 125, xid 0x00000000
	version 1.0, type PACKET_IN, length 125, xid 0x00000000
	version 1.0, type PACKET_IN, length 125, xid 0x00000000
	version 1.0, type PACKET_IN, length 125, xid 0x00000000
	version 1.0, type PACKET_IN, length 125, xid 0x00000000
	version 1.0, type PACKET_IN, length 125, xid 0x00000000
	version 1.0, type PACKET_IN, length 125, xid 0x00000000
	version 1.0, type PACKET_IN, length 125, xid 0x00000000
	version 1.0, type PACKET_IN, length 125, xid 0x00000000
	version 1.0, type PACKET_IN, length 125, xid 0x00000000
	version 1.0, type PACKET_IN, length 125, xid 0x00000000
	version 1.0, type PACKET_IN, length 125, xid 0x00000000
	version 1.0, type PACKET_IN, length 125, xid 0x00000000
	version 1.0, type PACKET_IN, length 125, xid 0x00000000
	version 1.0, type PACKET_IN, length 125, xid 0x00000000
	version 1.0, type PACKET_IN, length 125, xid 0x00000000
	version 1.0, type PACKET_IN, length 125, xid 0x00000000
	version 1.0, type PACKET_IN, length 125, xid 0x00000000
	version 1.0, type PACKET_IN, length 88, xid 0x00000000
	version 1.0, type PACKET_IN, length 125, xid 0x00000000
	version 1.0, type PACKET_IN, length 125, xid 0x00000000
	version 1.0, type PACKET_IN, length 125, xid 0x00000000
	version 1.0, type PACKET_IN, length 125, xid 0x00000000
	version 1.0, type PACKET_IN, length 125, xid 0x00000000
	version 1.0, type PACKET_IN, length 125, xid 0x00000000
	version 1.0, type PACKET_IN, length 125, xid 0x00000000
	version 1.0, type PACKET_IN, length 125, xid 0x00000000
	version 1.0, type PACKET_IN, length 125, xid 0x00000000
	version 1.0, type PACKET_IN, length 125, xid 0x00000000
	version 1.0, type PACKET_IN, length 125, xid 0x00000000
21:28:42.065499 IP 192.168.1.30.49345 > 192.168.1.10.6633: Flags [P.], seq 11676:12426, ack 1, win 58, options [nop,nop,TS val 21917415 ecr 46590325], length 750: OpenFlow
	version 1.0, type PACKET_IN, length 125, xid 0x00000000
	version 1.0, type PACKET_IN, length 125, xid 0x00000000
	version 1.0, type PACKET_IN, length 125, xid 0x00000000
	version 1.0, type PACKET_IN, length 125, xid 0x00000000
	version 1.0, type PACKET_IN, length 125, xid 0x00000000
	version 1.0, type PACKET_IN, length 125, xid 0x00000000
21:28:42.065914 IP 192.168.1.10.6633 > 192.168.1.30.49345: Flags [.], ack 11676, win 16225, options [nop,nop,TS val 46590327 ecr 21917415], length 0
21:28:42.069918 IP 192.168.1.10.6633 > 192.168.1.30.49345: Flags [.], ack 12426, win 16225, options [nop,nop,TS val 46590327 ecr 21917415], length 0
21:28:42.085083 IP 192.168.1.30.49345 > 192.168.1.10.6633: Flags [P.], seq 12426:12551, ack 1, win 58, options [nop,nop,TS val 21917420 ecr 46590327], length 125: OpenFlow
	version 1.0, type PACKET_IN, length 125, xid 0x00000000
21:28:42.085124 IP 192.168.1.30.49345 > 192.168.1.10.6633: Flags [P.], seq 12551:12676, ack 1, win 58, options [nop,nop,TS val 21917420 ecr 46590327], length 125: OpenFlow
	version 1.0, type PACKET_IN, length 125, xid 0x00000000
21:28:42.085154 IP 192.168.1.30.49345 > 192.168.1.10.6633: Flags [P.], seq 12676:12801, ack 1, win 58, options [nop,nop,TS val 21917420 ecr 46590327], length 125: OpenFlow
	version 1.0, type PACKET_IN, length 125, xid 0x00000000
21:28:42.085197 IP 192.168.1.30.49345 > 192.168.1.10.6633: Flags [P.], seq 12801:12926, ack 1, win 58, options [nop,nop,TS val 21917420 ecr 46590327], length 125: OpenFlow
	version 1.0, type PACKET_IN, length 125, xid 0x00000000
21:28:42.085230 IP 192.168.1.30.49345 > 192.168.1.10.6633: Flags [P.], seq 12926:13051, ack 1, win 58, options [nop,nop,TS val 21917420 ecr 46590327], length 125: OpenFlow
	version 1.0, type PACKET_IN, length 125, xid 0x00000000
21:28:42.085260 IP 192.168.1.30.49345 > 192.168.1.10.6633: Flags [P.], seq 13051:13176, ack 1, win 58, options [nop,nop,TS val 21917421 ecr 46590327], length 125: OpenFlow
	version 1.0, type PACKET_IN, length 125, xid 0x00000000
21:28:42.085290 IP 192.168.1.30.49345 > 192.168.1.10.6633: Flags [P.], seq 13176:13264, ack 1, win 58, options [nop,nop,TS val 21917421 ecr 46590327], length 88: OpenFlow
	version 1.0, type PACKET_IN, length 88, xid 0x00000000
21:28:42.085324 IP 192.168.1.30.49345 > 192.168.1.10.6633: Flags [P.], seq 13264:13389, ack 1, win 58, options [nop,nop,TS val 21917421 ecr 46590327], length 125: OpenFlow
	version 1.0, type PACKET_IN, length 125, xid 0x00000000
21:28:42.085352 IP 192.168.1.30.49345 > 192.168.1.10.6633: Flags [P.], seq 13389:13514, ack 1, win 58, options [nop,nop,TS val 21917421 ecr 46590327], length 125: OpenFlow
	version 1.0, type PACKET_IN, length 125, xid 0x00000000
21:28:42.085380 IP 192.168.1.30.49345 > 192.168.1.10.6633: Flags [P.], seq 13514:13639, ack 1, win 58, options [nop,nop,TS val 21917421 ecr 46590327], length 125: OpenFlow
	version 1.0, type PACKET_IN, length 125, xid 0x00000000
21:28:42.085407 IP 192.168.1.30.49345 > 192.168.1.10.6633: Flags [P.], seq 13639:13764, ack 1, win 58, options [nop,nop,TS val 21917421 ecr 46590327], length 125: OpenFlow
	version 1.0, type PACKET_IN, length 125, xid 0x00000000
21:28:42.085436 IP 192.168.1.30.49345 > 192.168.1.10.6633: Flags [P.], seq 13764:13889, ack 1, win 58, options [nop,nop,TS val 21917421 ecr 46590327], length 125: OpenFlow
	version 1.0, type PACKET_IN, length 125, xid 0x00000000
21:28:42.085464 IP 192.168.1.30.49345 > 192.168.1.10.6633: Flags [P.], seq 13889:14014, ack 1, win 58, options [nop,nop,TS val 21917421 ecr 46590327], length 125: OpenFlow
	version 1.0, type PACKET_IN, length 125, xid 0x00000000
21:28:42.085598 IP 192.168.1.30.49345 > 192.168.1.10.6633: Flags [P.], seq 14014:14139, ack 1, win 58, options [nop,nop,TS val 21917421 ecr 46590327], length 125: OpenFlow
	version 1.0, type PACKET_IN, length 125, xid 0x00000000
21:28:42.085633 IP 192.168.1.30.49345 > 192.168.1.10.6633: Flags [P.], seq 14139:14264, ack 1, win 58, options [nop,nop,TS val 21917421 ecr 46590327], length 125: OpenFlow
	version 1.0, type PACKET_IN, length 125, xid 0x00000000
21:28:42.085663 IP 192.168.1.30.49345 > 192.168.1.10.6633: Flags [P.], seq 14264:14389, ack 1, win 58, options [nop,nop,TS val 21917421 ecr 46590327], length 125: OpenFlow
	version 1.0, type PACKET_IN, length 125, xid 0x00000000
21:28:42.085693 IP 192.168.1.30.49345 > 192.168.1.10.6633: Flags [P.], seq 14389:14514, ack 1, win 58, options [nop,nop,TS val 21917421 ecr 46590327], length 125: OpenFlow
	version 1.0, type PACKET_IN, length 125, xid 0x00000000
21:28:42.085723 IP 192.168.1.30.49345 > 192.168.1.10.6633: Flags [P.], seq 14514:14639, ack 1, win 58, options [nop,nop,TS val 21917421 ecr 46590327], length 125: OpenFlow
	version 1.0, type PACKET_IN, length 125, xid 0x00000000
21:28:42.085752 IP 192.168.1.30.49345 > 192.168.1.10.6633: Flags [P.], seq 14639:14764, ack 1, win 58, options [nop,nop,TS val 21917421 ecr 46590327], length 125: OpenFlow
	version 1.0, type PACKET_IN, length 125, xid 0x00000000
21:28:42.085781 IP 192.168.1.30.49345 > 192.168.1.10.6633: Flags [P.], seq 14764:14889, ack 1, win 58, options [nop,nop,TS val 21917421 ecr 46590327], length 125: OpenFlow
	version 1.0, type PACKET_IN, length 125, xid 0x00000000
21:28:42.085810 IP 192.168.1.30.49345 > 192.168.1.10.6633: Flags [P.], seq 14889:15014, ack 1, win 58, options [nop,nop,TS val 21917421 ecr 46590327], length 125: OpenFlow
	version 1.0, type PACKET_IN, length 125, xid 0x00000000
21:28:42.085843 IP 192.168.1.30.49345 > 192.168.1.10.6633: Flags [P.], seq 15014:15139, ack 1, win 58, options [nop,nop,TS val 21917421 ecr 46590327], length 125: OpenFlow
	version 1.0, type PACKET_IN, length 125, xid 0x00000000
21:28:42.085873 IP 192.168.1.30.49345 > 192.168.1.10.6633: Flags [P.], seq 15139:15264, ack 1, win 58, options [nop,nop,TS val 21917421 ecr 46590327], length 125: OpenFlow
	version 1.0, type PACKET_IN, length 125, xid 0x00000000
21:28:42.085903 IP 192.168.1.30.49345 > 192.168.1.10.6633: Flags [P.], seq 15264:15389, ack 1, win 58, options [nop,nop,TS val 21917421 ecr 46590327], length 125: OpenFlow
	version 1.0, type PACKET_IN, length 125, xid 0x00000000
21:28:42.085933 IP 192.168.1.30.49345 > 192.168.1.10.6633: Flags [P.], seq 15389:15514, ack 1, win 58, options [nop,nop,TS val 21917421 ecr 46590327], length 125: OpenFlow
	version 1.0, type PACKET_IN, length 125, xid 0x00000000
21:28:42.085962 IP 192.168.1.30.49345 > 192.168.1.10.6633: Flags [P.], seq 15514:15639, ack 1, win 58, options [nop,nop,TS val 21917421 ecr 46590327], length 125: OpenFlow
	version 1.0, type PACKET_IN, length 125, xid 0x00000000
21:28:42.085991 IP 192.168.1.30.49345 > 192.168.1.10.6633: Flags [P.], seq 15639:15764, ack 1, win 58, options [nop,nop,TS val 21917421 ecr 46590327], length 125: OpenFlow
	version 1.0, type PACKET_IN, length 125, xid 0x00000000
21:28:42.086021 IP 192.168.1.30.49345 > 192.168.1.10.6633: Flags [P.], seq 15764:15889, ack 1, win 58, options [nop,nop,TS val 21917421 ecr 46590327], length 125: OpenFlow
	version 1.0, type PACKET_IN, length 125, xid 0x00000000
21:28:42.086041 IP 192.168.1.30.49345 > 192.168.1.10.6633: Flags [P.], seq 15889:16014, ack 1, win 58, options [nop,nop,TS val 21917421 ecr 46590327], length 125: OpenFlow
	version 1.0, type PACKET_IN, length 125, xid 0x00000000
21:28:42.086059 IP 192.168.1.30.49345 > 192.168.1.10.6633: Flags [P.], seq 16014:16139, ack 1, win 58, options [nop,nop,TS val 21917421 ecr 46590327], length 125: OpenFlow
	version 1.0, type PACKET_IN, length 125, xid 0x00000000
21:28:42.086076 IP 192.168.1.30.49345 > 192.168.1.10.6633: Flags [P.], seq 16139:16264, ack 1, win 58, options [nop,nop,TS val 21917421 ecr 46590327], length 125: OpenFlow
	version 1.0, type PACKET_IN, length 125, xid 0x00000000
21:28:42.086094 IP 192.168.1.30.49345 > 192.168.1.10.6633: Flags [P.], seq 16264:16389, ack 1, win 58, options [nop,nop,TS val 21917421 ecr 46590327], length 125: OpenFlow
	version 1.0, type PACKET_IN, length 125, xid 0x00000000
21:28:42.086111 IP 192.168.1.30.49345 > 192.168.1.10.6633: Flags [P.], seq 16389:16514, ack 1, win 58, options [nop,nop,TS val 21917421 ecr 46590327], length 125: OpenFlow
	version 1.0, type PACKET_IN, length 125, xid 0x00000000
21:28:42.086129 IP 192.168.1.30.49345 > 192.168.1.10.6633: Flags [P.], seq 16514:16639, ack 1, win 58, options [nop,nop,TS val 21917421 ecr 46590327], length 125: OpenFlow
	version 1.0, type PACKET_IN, length 125, xid 0x00000000
21:28:42.086146 IP 192.168.1.30.49345 > 192.168.1.10.6633: Flags [P.], seq 16639:16764, ack 1, win 58, options [nop,nop,TS val 21917421 ecr 46590327], length 125: OpenFlow
	version 1.0, type PACKET_IN, length 125, xid 0x00000000
21:28:42.086473 IP 192.168.1.10.6633 > 192.168.1.30.49345: Flags [.], ack 13264, win 16225, options [nop,nop,TS val 46590332 ecr 21917420], length 0
21:28:42.086482 IP 192.168.1.30.49345 > 192.168.1.10.6633: Flags [P.], seq 16764:21639, ack 1, win 58, options [nop,nop,TS val 21917421 ecr 46590332], length 4875: OpenFlow
	version 1.0, type PACKET_IN, length 125, xid 0x00000000
	version 1.0, type PACKET_IN, length 125, xid 0x00000000
	version 1.0, type PACKET_IN, length 125, xid 0x00000000
	version 1.0, type PACKET_IN, length 125, xid 0x00000000
	version 1.0, type PACKET_IN, length 125, xid 0x00000000
	version 1.0, type PACKET_IN, length 125, xid 0x00000000
	version 1.0, type PACKET_IN, length 125, xid 0x00000000
	version 1.0, type PACKET_IN, length 125, xid 0x00000000
	version 1.0, type PACKET_IN, length 125, xid 0x00000000
	version 1.0, type PACKET_IN, length 125, xid 0x00000000
	version 1.0, type PACKET_IN, length 125, xid 0x00000000
	version 1.0, type PACKET_IN, length 125, xid 0x00000000
	version 1.0, type PACKET_IN, length 125, xid 0x00000000
	version 1.0, type PACKET_IN, length 125, xid 0x00000000
	version 1.0, type PACKET_IN, length 125, xid 0x00000000
	version 1.0, type PACKET_IN, length 125, xid 0x00000000
	version 1.0, type PACKET_IN, length 125, xid 0x00000000
	version 1.0, type PACKET_IN, length 125, xid 0x00000000
	version 1.0, type PACKET_IN, length 125, xid 0x00000000
	version 1.0, type PACKET_IN, length 125, xid 0x00000000
	version 1.0, type PACKET_IN, length 125, xid 0x00000000
	version 1.0, type PACKET_IN, length 125, xid 0x00000000
	version 1.0, type PACKET_IN, length 125, xid 0x00000000
	version 1.0, type PACKET_IN, length 125, xid 0x00000000
	version 1.0, type PACKET_IN, length 125, xid 0x00000000
	version 1.0, type PACKET_IN, length 125, xid 0x00000000
	version 1.0, type PACKET_IN, length 125, xid 0x00000000
	version 1.0, type PACKET_IN, length 125, xid 0x00000000
	version 1.0, type PACKET_IN, length 125, xid 0x00000000
	version 1.0, type PACKET_IN, length 125, xid 0x00000000
	version 1.0, type PACKET_IN, length 125, xid 0x00000000
	version 1.0, type PACKET_IN, length 125, xid 0x00000000
	version 1.0, type PACKET_IN, length 125, xid 0x00000000
	version 1.0, type PACKET_IN, length 125, xid 0x00000000
	version 1.0, type PACKET_IN, length 125, xid 0x00000000
	version 1.0, type PACKET_IN, length 125, xid 0x00000000
	version 1.0, type PACKET_IN, length 125, xid 0x00000000
	version 1.0, type PACKET_IN, length 125, xid 0x00000000
	version 1.0, type PACKET_IN, length 125, xid 0x00000000
21:28:42.086497 IP 192.168.1.30.49345 > 192.168.1.10.6633: Flags [P.], seq 21639:22764, ack 1, win 58, options [nop,nop,TS val 21917421 ecr 46590332], length 1125: OpenFlow
	version 1.0, type PACKET_IN, length 125, xid 0x00000000
	version 1.0, type PACKET_IN, length 125, xid 0x00000000
	version 1.0, type PACKET_IN, length 125, xid 0x00000000
	version 1.0, type PACKET_IN, length 125, xid 0x00000000
	version 1.0, type PACKET_IN, length 125, xid 0x00000000
	version 1.0, type PACKET_IN, length 125, xid 0x00000000
	version 1.0, type PACKET_IN, length 125, xid 0x00000000
	version 1.0, type PACKET_IN, length 125, xid 0x00000000
	version 1.0, type PACKET_IN, length 125, xid 0x00000000
21:28:42.086508 IP 192.168.1.10.6633 > 192.168.1.30.49345: Flags [.], ack 14014, win 16225, options [nop,nop,TS val 46590332 ecr 21917421], length 0
21:28:42.086511 IP 192.168.1.30.49345 > 192.168.1.10.6633: Flags [P.], seq 22764:22889, ack 1, win 58, options [nop,nop,TS val 21917421 ecr 46590332], length 125: OpenFlow
	version 1.0, type PACKET_IN, length 125, xid 0x00000000
21:28:42.086525 IP 192.168.1.10.6633 > 192.168.1.30.49345: Flags [.], ack 14139, win 16225, options [nop,nop,TS val 46590332 ecr 21917421], length 0
21:28:42.086537 IP 192.168.1.10.6633 > 192.168.1.30.49345: Flags [.], ack 14514, win 16225, options [nop,nop,TS val 46590332 ecr 21917421], length 0
21:28:42.086542 IP 192.168.1.10.6633 > 192.168.1.30.49345: Flags [.], ack 14764, win 16225, options [nop,nop,TS val 46590332 ecr 21917421], length 0
21:28:42.086554 IP 192.168.1.10.6633 > 192.168.1.30.49345: Flags [.], ack 15389, win 16225, options [nop,nop,TS val 46590332 ecr 21917421], length 0
21:28:42.086559 IP 192.168.1.10.6633 > 192.168.1.30.49345: Flags [.], ack 16014, win 16225, options [nop,nop,TS val 46590332 ecr 21917421], length 0
21:28:42.086570 IP 192.168.1.10.6633 > 192.168.1.30.49345: Flags [.], ack 16764, win 16225, options [nop,nop,TS val 46590332 ecr 21917421], length 0
21:28:42.086593 IP 192.168.1.30.49345 > 192.168.1.10.6633: Flags [P.], seq 22889:23014, ack 1, win 58, options [nop,nop,TS val 21917421 ecr 46590332], length 125: OpenFlow
	version 1.0, type PACKET_IN, length 125, xid 0x00000000
21:28:42.086622 IP 192.168.1.30.49345 > 192.168.1.10.6633: Flags [P.], seq 23014:23139, ack 1, win 58, options [nop,nop,TS val 21917421 ecr 46590332], length 125: OpenFlow
	version 1.0, type PACKET_IN, length 125, xid 0x00000000
21:28:42.086650 IP 192.168.1.30.49345 > 192.168.1.10.6633: Flags [P.], seq 23139:23264, ack 1, win 58, options [nop,nop,TS val 21917421 ecr 46590332], length 125: OpenFlow
	version 1.0, type PACKET_IN, length 125, xid 0x00000000
21:28:42.086678 IP 192.168.1.30.49345 > 192.168.1.10.6633: Flags [P.], seq 23264:23389, ack 1, win 58, options [nop,nop,TS val 21917421 ecr 46590332], length 125: OpenFlow
	version 1.0, type PACKET_IN, length 125, xid 0x00000000
21:28:42.086717 IP 192.168.1.30.49345 > 192.168.1.10.6633: Flags [P.], seq 23389:23514, ack 1, win 58, options [nop,nop,TS val 21917421 ecr 46590332], length 125: OpenFlow
	version 1.0, type PACKET_IN, length 125, xid 0x00000000
21:28:42.086744 IP 192.168.1.30.49345 > 192.168.1.10.6633: Flags [P.], seq 23514:23639, ack 1, win 58, options [nop,nop,TS val 21917421 ecr 46590332], length 125: OpenFlow
	version 1.0, type PACKET_IN, length 125, xid 0x00000000
21:28:42.086777 IP 192.168.1.30.49345 > 192.168.1.10.6633: Flags [P.], seq 23639:23764, ack 1, win 58, options [nop,nop,TS val 21917421 ecr 46590332], length 125: OpenFlow
	version 1.0, type PACKET_IN, length 125, xid 0x00000000
21:28:42.086809 IP 192.168.1.30.49345 > 192.168.1.10.6633: Flags [P.], seq 23764:23889, ack 1, win 58, options [nop,nop,TS val 21917421 ecr 46590332], length 125: OpenFlow
	version 1.0, type PACKET_IN, length 125, xid 0x00000000
21:28:42.086839 IP 192.168.1.30.49345 > 192.168.1.10.6633: Flags [P.], seq 23889:24014, ack 1, win 58, options [nop,nop,TS val 21917421 ecr 46590332], length 125: OpenFlow
	version 1.0, type PACKET_IN, length 125, xid 0x00000000
21:28:42.086867 IP 192.168.1.30.49345 > 192.168.1.10.6633: Flags [P.], seq 24014:24139, ack 1, win 58, options [nop,nop,TS val 21917421 ecr 46590332], length 125: OpenFlow
	version 1.0, type PACKET_IN, length 125, xid 0x00000000
21:28:42.086897 IP 192.168.1.30.49345 > 192.168.1.10.6633: Flags [P.], seq 24139:24264, ack 1, win 58, options [nop,nop,TS val 21917421 ecr 46590332], length 125: OpenFlow
	version 1.0, type PACKET_IN, length 125, xid 0x00000000
21:28:42.086927 IP 192.168.1.30.49345 > 192.168.1.10.6633: Flags [P.], seq 24264:24389, ack 1, win 58, options [nop,nop,TS val 21917421 ecr 46590332], length 125: OpenFlow
	version 1.0, type PACKET_IN, length 125, xid 0x00000000
21:28:42.086958 IP 192.168.1.30.49345 > 192.168.1.10.6633: Flags [P.], seq 24389:24514, ack 1, win 58, options [nop,nop,TS val 21917421 ecr 46590332], length 125: OpenFlow
	version 1.0, type PACKET_IN, length 125, xid 0x00000000
21:28:42.086989 IP 192.168.1.30.49345 > 192.168.1.10.6633: Flags [P.], seq 24514:24639, ack 1, win 58, options [nop,nop,TS val 21917421 ecr 46590332], length 125: OpenFlow
	version 1.0, type PACKET_IN, length 125, xid 0x00000000
21:28:42.087103 IP 192.168.1.30.49345 > 192.168.1.10.6633: Flags [P.], seq 24639:24764, ack 1, win 58, options [nop,nop,TS val 21917421 ecr 46590332], length 125: OpenFlow
	version 1.0, type PACKET_IN, length 125, xid 0x00000000
21:28:42.087134 IP 192.168.1.30.49345 > 192.168.1.10.6633: Flags [P.], seq 24764:24889, ack 1, win 58, options [nop,nop,TS val 21917421 ecr 46590332], length 125: OpenFlow
	version 1.0, type PACKET_IN, length 125, xid 0x00000000
21:28:42.087164 IP 192.168.1.30.49345 > 192.168.1.10.6633: Flags [P.], seq 24889:25014, ack 1, win 58, options [nop,nop,TS val 21917421 ecr 46590332], length 125: OpenFlow
	version 1.0, type PACKET_IN, length 125, xid 0x00000000
21:28:42.087195 IP 192.168.1.30.49345 > 192.168.1.10.6633: Flags [P.], seq 25014:25139, ack 1, win 58, options [nop,nop,TS val 21917421 ecr 46590332], length 125: OpenFlow
	version 1.0, type PACKET_IN, length 125, xid 0x00000000
21:28:42.087210 IP 192.168.1.10.6633 > 192.168.1.30.49345: Flags [.], ack 21639, win 16225, options [nop,nop,TS val 46590332 ecr 21917421], length 0
21:28:42.087285 IP 192.168.1.10.6633 > 192.168.1.30.49345: Flags [.], ack 23139, win 16225, options [nop,nop,TS val 46590332 ecr 21917421], length 0
21:28:42.087311 IP 192.168.1.10.6633 > 192.168.1.30.49345: Flags [.], ack 24014, win 16225, options [nop,nop,TS val 46590332 ecr 21917421], length 0
21:28:42.087333 IP 192.168.1.10.6633 > 192.168.1.30.49345: Flags [.], ack 24639, win 16225, options [nop,nop,TS val 46590332 ecr 21917421], length 0
21:28:42.087342 IP 192.168.1.10.6633 > 192.168.1.30.49345: Flags [.], ack 24764, win 16225, options [nop,nop,TS val 46590332 ecr 21917421], length 0
21:28:42.087350 IP 192.168.1.10.6633 > 192.168.1.30.49345: Flags [.], ack 25139, win 16225, options [nop,nop,TS val 46590332 ecr 21917421], length 0
21:28:42.118929 IP 192.168.1.30.49345 > 192.168.1.10.6633: Flags [P.], seq 25139:25264, ack 1, win 58, options [nop,nop,TS val 21917429 ecr 46590332], length 125: OpenFlow
	version 1.0, type PACKET_IN, length 125, xid 0x00000000
21:28:42.118950 IP 192.168.1.30.49345 > 192.168.1.10.6633: Flags [P.], seq 25264:25389, ack 1, win 58, options [nop,nop,TS val 21917429 ecr 46590332], length 125: OpenFlow
	version 1.0, type PACKET_IN, length 125, xid 0x00000000
21:28:42.118979 IP 192.168.1.30.49345 > 192.168.1.10.6633: Flags [P.], seq 25389:25514, ack 1, win 58, options [nop,nop,TS val 21917429 ecr 46590332], length 125: OpenFlow
	version 1.0, type PACKET_IN, length 125, xid 0x00000000
21:28:42.118993 IP 192.168.1.30.49345 > 192.168.1.10.6633: Flags [P.], seq 25514:25639, ack 1, win 58, options [nop,nop,TS val 21917429 ecr 46590332], length 125: OpenFlow
	version 1.0, type PACKET_IN, length 125, xid 0x00000000
21:28:42.119007 IP 192.168.1.30.49345 > 192.168.1.10.6633: Flags [P.], seq 25639:25764, ack 1, win 58, options [nop,nop,TS val 21917429 ecr 46590332], length 125: OpenFlow
	version 1.0, type PACKET_IN, length 125, xid 0x00000000
21:28:42.119021 IP 192.168.1.30.49345 > 192.168.1.10.6633: Flags [P.], seq 25764:25889, ack 1, win 58, options [nop,nop,TS val 21917429 ecr 46590332], length 125: OpenFlow
	version 1.0, type PACKET_IN, length 125, xid 0x00000000
21:28:42.119036 IP 192.168.1.30.49345 > 192.168.1.10.6633: Flags [P.], seq 25889:26014, ack 1, win 58, options [nop,nop,TS val 21917429 ecr 46590332], length 125: OpenFlow
	version 1.0, type PACKET_IN, length 125, xid 0x00000000
21:28:42.119051 IP 192.168.1.30.49345 > 192.168.1.10.6633: Flags [P.], seq 26014:26139, ack 1, win 58, options [nop,nop,TS val 21917429 ecr 46590332], length 125: OpenFlow
	version 1.0, type PACKET_IN, length 125, xid 0x00000000
21:28:42.119065 IP 192.168.1.30.49345 > 192.168.1.10.6633: Flags [P.], seq 26139:26264, ack 1, win 58, options [nop,nop,TS val 21917429 ecr 46590332], length 125: OpenFlow
	version 1.0, type PACKET_IN, length 125, xid 0x00000000
21:28:42.119079 IP 192.168.1.30.49345 > 192.168.1.10.6633: Flags [P.], seq 26264:26389, ack 1, win 58, options [nop,nop,TS val 21917429 ecr 46590332], length 125: OpenFlow
	version 1.0, type PACKET_IN, length 125, xid 0x00000000
21:28:42.119093 IP 192.168.1.30.49345 > 192.168.1.10.6633: Flags [P.], seq 26389:26514, ack 1, win 58, options [nop,nop,TS val 21917429 ecr 46590332], length 125: OpenFlow
	version 1.0, type PACKET_IN, length 125, xid 0x00000000
21:28:42.119108 IP 192.168.1.30.49345 > 192.168.1.10.6633: Flags [P.], seq 26514:26639, ack 1, win 58, options [nop,nop,TS val 21917429 ecr 46590332], length 125: OpenFlow
	version 1.0, type PACKET_IN, length 125, xid 0x00000000
21:28:42.119122 IP 192.168.1.30.49345 > 192.168.1.10.6633: Flags [P.], seq 26639:26764, ack 1, win 58, options [nop,nop,TS val 21917429 ecr 46590332], length 125: OpenFlow
	version 1.0, type PACKET_IN, length 125, xid 0x00000000
21:28:42.119136 IP 192.168.1.30.49345 > 192.168.1.10.6633: Flags [P.], seq 26764:26889, ack 1, win 58, options [nop,nop,TS val 21917429 ecr 46590332], length 125: OpenFlow
	version 1.0, type PACKET_IN, length 125, xid 0x00000000
21:28:42.119151 IP 192.168.1.30.49345 > 192.168.1.10.6633: Flags [P.], seq 26889:27014, ack 1, win 58, options [nop,nop,TS val 21917429 ecr 46590332], length 125: OpenFlow
	version 1.0, type PACKET_IN, length 125, xid 0x00000000
21:28:42.119165 IP 192.168.1.30.49345 > 192.168.1.10.6633: Flags [P.], seq 27014:27102, ack 1, win 58, options [nop,nop,TS val 21917429 ecr 46590332], length 88: OpenFlow
	version 1.0, type PACKET_IN, length 88, xid 0x00000000
21:28:42.119178 IP 192.168.1.30.49345 > 192.168.1.10.6633: Flags [P.], seq 27102:27227, ack 1, win 58, options [nop,nop,TS val 21917429 ecr 46590332], length 125: OpenFlow
	version 1.0, type PACKET_IN, length 125, xid 0x00000000
21:28:42.120052 IP 192.168.1.30.49345 > 192.168.1.10.6633: Flags [P.], seq 27227:27352, ack 1, win 58, options [nop,nop,TS val 21917429 ecr 46590332], length 125: OpenFlow
	version 1.0, type PACKET_IN, length 125, xid 0x00000000
21:28:42.120075 IP 192.168.1.30.49345 > 192.168.1.10.6633: Flags [P.], seq 27352:27477, ack 1, win 58, options [nop,nop,TS val 21917429 ecr 46590332], length 125: OpenFlow
	version 1.0, type PACKET_IN, length 125, xid 0x00000000
21:28:42.120089 IP 192.168.1.30.49345 > 192.168.1.10.6633: Flags [P.], seq 27477:27602, ack 1, win 58, options [nop,nop,TS val 21917429 ecr 46590332], length 125: OpenFlow
	version 1.0, type PACKET_IN, length 125, xid 0x00000000
21:28:42.120103 IP 192.168.1.30.49345 > 192.168.1.10.6633: Flags [P.], seq 27602:27727, ack 1, win 58, options [nop,nop,TS val 21917429 ecr 46590332], length 125: OpenFlow
	version 1.0, type PACKET_IN, length 125, xid 0x00000000
21:28:42.120117 IP 192.168.1.30.49345 > 192.168.1.10.6633: Flags [P.], seq 27727:27852, ack 1, win 58, options [nop,nop,TS val 21917429 ecr 46590332], length 125: OpenFlow
	version 1.0, type PACKET_IN, length 125, xid 0x00000000
21:28:42.120130 IP 192.168.1.30.49345 > 192.168.1.10.6633: Flags [P.], seq 27852:27977, ack 1, win 58, options [nop,nop,TS val 21917429 ecr 46590332], length 125: OpenFlow
	version 1.0, type PACKET_IN, length 125, xid 0x00000000
21:28:42.120144 IP 192.168.1.30.49345 > 192.168.1.10.6633: Flags [P.], seq 27977:28102, ack 1, win 58, options [nop,nop,TS val 21917429 ecr 46590332], length 125: OpenFlow
	version 1.0, type PACKET_IN, length 125, xid 0x00000000
21:28:42.120162 IP 192.168.1.30.49345 > 192.168.1.10.6633: Flags [P.], seq 28102:28227, ack 1, win 58, options [nop,nop,TS val 21917429 ecr 46590332], length 125: OpenFlow
	version 1.0, type PACKET_IN, length 125, xid 0x00000000
