21:28:42.042659 IP 192.168.1.30.49361 > 192.168.1.10.6633: Flags [P.], seq 3211207436:3211207561, ack 3857554676, win 58, options [nop,nop,TS val 21917410 ecr 46590314], length 125: OpenFlow
	version 1.0, type PACKET_IN, length 125, xid 0x00000000
21:28:42.042668 IP 192.168.1.30.49361 > 192.168.1.10.6633: Flags [P.], seq 125:250, ack 1, win 58, options [nop,nop,TS val 21917410 ecr 46590314], length 125: OpenFlow
	version 1.0, type PACKET_IN, length 125, xid 0x00000000
21:28:42.042675 IP 192.168.1.30.49361 > 192.168.1.10.6633: Flags [P.], seq 250:375, ack 1, win 58, options [nop,nop,TS val 21917410 ecr 46590314], length 125: OpenFlow
	version 1.0, type PACKET_IN, length 125, xid 0x00000000
21:28:42.042683 IP 192.168.1.30.49361 > 192.168.1.10.6633: Flags [P.], seq 375:500, ack 1, win 58, options [nop,nop,TS val 21917410 ecr 46590314], length 125: OpenFlow
	version 1.0, type PACKET_IN, length 125, xid 0x00000000
21:28:42.042689 IP 192.168.1.30.49361 > 192.168.1.10.6633: Flags [P.], seq 500:625, ack 1, win 58, options [nop,nop,TS val 21917410 ecr 46590314], length 125: OpenFlow
	version 1.0, type PACKET_IN, length 125, xid 0x00000000
21:28:42.042696 IP 192.168.1.30.49361 > 192.168.1.10.6633: Flags [P.], seq 625:750, ack 1, win 58, options [nop,nop,TS val 21917410 ecr 46590314], length 125: OpenFlow
	version 1.0, type PACKET_IN, length 125, xid 0x00000000
21:28:42.042703 IP 192.168.1.30.49361 > 192.168.1.10.6633: Flags [P.], seq 750:875, ack 1, win 58, options [nop,nop,TS val 21917410 ecr 46590314], length 125: OpenFlow
	version 1.0, type PACKET_IN, length 125, xid 0x00000000
21:28:42.042711 IP 192.168.1.30.49361 > 192.168.1.10.6633: Flags [P.], seq 875:1000, ack 1, win 58, options [nop,nop,TS val 21917410 ecr 46590314], length 125: OpenFlow
	version 1.0, type PACKET_IN, length 125, xid 0x00000000
21:28:42.042718 IP 192.168.1.30.49361 > 192.168.1.10.6633: Flags [P.], seq 1000:1125, ack 1, win 58, options [nop,nop,TS val 21917410 ecr 46590314], length 125: OpenFlow
	version 1.0, type PACKET_IN, length 125, xid 0x00000000
21:28:42.042726 IP 192.168.1.30.49361 > 192.168.1.10.6633: Flags [P.], seq 1125:1250, ack 1, win 58, options [nop,nop,TS val 21917410 ecr 46590314], length 125: OpenFlow
	version 1.0, type PACKET_IN, length 125, xid 0x00000000
21:28:42.042732 IP 192.168.1.30.49361 > 192.168.1.10.6633: Flags [P.], seq 1250:1375, ack 1, win 58, options [nop,nop,TS val 21917410 ecr 46590314], length 125: OpenFlow
	version 1.0, type PACKET_IN, length 125, xid 0x00000000
21:28:42.042739 IP 192.168.1.30.49361 > 192.168.1.10.6633: Flags [P.], seq 1375:1500, ack 1, win 58, options [nop,nop,TS val 21917410 ecr 46590314], length 125: OpenFlow
	version 1.0, type PACKET_IN, length 125, xid 0x00000000
21:28:42.042762 IP 192.168.1.30.49361 > 192.168.1.10.6633: Flags [P.], seq 1500:1625, ack 1, win 58, options [nop,nop,TS val 21917410 ecr 46590314], length 125: OpenFlow
	version 1.0, type PACKET_IN, length 125, xid 0x00000000
21:28:42.042772 IP 192.168.1.30.49361 > 192.168.1.10.6633: Flags [P.], seq 1625:1750, ack 1, win 58, options [nop,nop,TS val 21917410 ecr 46590314], length 125: OpenFlow
	version 1.0, type PACKET_IN, length 125, xid 0x00000000
21:28:42.042789 IP 192.168.1.30.49361 > 192.168.1.10.6633: Flags [P.], seq 1750:1875, ack 1, win 58, options [nop,nop,TS val 21917410 ecr 46590314], length 125: OpenFlow
	version 1.0, type PACKET_IN, length 125, xid 0x00000000
21:28:42.042795 IP 192.168.1.30.49361 > 192.168.1.10.6633: Flags [P.], seq 1875:2000, ack 1, win 58, options [nop,nop,TS val 21917410 ecr 46590314], length 125: OpenFlow
	version 1.0, type PACKET_IN, length 125, xid 0x00000000
21:28:42.042822 IP 192.168.1.30.49361 > 192.168.1.10.6633: Flags [P.], seq 2000:2125, ack 1, win 58, options [nop,nop,TS val 21917410 ecr 46590314], length 125: OpenFlow
	version 1.0, type PACKET_IN, length 125, xid 0x00000000
21:28:42.042845 IP 192.168.1.30.49361 > 192.168.1.10.6633: Flags [P.], seq 2125:2250, ack 1, win 58, options [nop,nop,TS val 21917410 ecr 46590314], length 125: OpenFlow
	version 1.0, type PACKET_IN, length 125, xid 0x00000000
21:28:42.042853 IP 192.168.1.30.49361 > 192.168.1.10.6633: Flags [P.], seq 2250:2375, ack 1, win 58, options [nop,nop,TS val 21917410 ecr 46590314], length 125: OpenFlow
	version 1.0, type PACKET_IN, length 125, xid 0x00000000
21:28:42.043045 IP 192.168.1.30.49361 > 192.168.1.10.6633: Flags [P.], seq 2375:2500, ack 1, win 58, options [nop,nop,TS val 21917410 ecr 46590314], length 125: OpenFlow
	version 1.0, type PACKET_IN, length 125, xid 0x00000000
21:28:42.043054 IP 192.168.1.30.49361 > 192.168.1.10.6633: Flags [P.], seq 2500:2625, ack 1, win 58, options [nop,nop,TS val 21917410 ecr 46590314], length 125: OpenFlow
	version 1.0, type PACKET_IN, length 125, xid 0x00000000
21:28:42.043062 IP 192.168.1.30.49361 > 192.168.1.10.6633: Flags [P.], seq 2625:2750, ack 1, win 58, options [nop,nop,TS val 21917410 ecr 46590314], length 125: OpenFlow
	version 1.0, type PACKET_IN, length 125, xid 0x00000000
21:28:42.043069 IP 192.168.1.30.49361 > 192.168.1.10.6633: Flags [P.], seq 2750:2875, ack 1, win 58, options [nop,nop,TS val 21917410 ecr 46590314], length 125: OpenFlow
	version 1.0, type PACKET_IN, length 125, xid 0x00000000
21:28:42.043076 IP 192.168.1.30.49361 > 192.168.1.10.6633: Flags [P.], seq 2875:3000, ack 1, win 58, options [nop,nop,TS val 21917410 ecr 46590314], length 125: OpenFlow
	version 1.0, type PACKET_IN, length 125, xid 0x00000000
21:28:42.043084 IP 192.168.1.30.49361 > 192.168.1.10.6633: Flags [P.], seq 3000:3125, ack 1, win 58, options [nop,nop,TS val 21917410 ecr 46590314], length 125: OpenFlow
	version 1.0, type PACKET_IN, length 125, xid 0x00000000
21:28:42.043091 IP 192.168.1.30.49361 > 192.168.1.10.6633: Flags [P.], seq 3125:3250, ack 1, win 58, options [nop,nop,TS val 21917410 ecr 46590314], length 125: OpenFlow
	version 1.0, type PACKET_IN, length 125, xid 0x00000000
21:28:42.043103 IP 192.168.1.30.49361 > 192.168.1.10.6633: Flags [P.], seq 3250:3375, ack 1, win 58, options [nop,nop,TS val 21917410 ecr 46590314], length 125: OpenFlow
	version 1.0, type PACKET_IN, length 125, xid 0x00000000
21:28:42.043110 IP 192.168.1.30.49361 > 192.168.1.10.6633: Flags [P.], seq 3375:3500, ack 1, win 58, options [nop,nop,TS val 21917410 ecr 46590314], length 125: OpenFlow
	version 1.0, type PACKET_IN, length 125, xid 0x00000000
21:28:42.043117 IP 192.168.1.30.49361 > 192.168.1.10.6633: Flags [P.], seq 3500:3625, ack 1, win 58, options [nop,nop,TS val 21917410 ecr 46590314], length 125: OpenFlow
	version 1.0, type PACKET_IN, length 125, xid 0x00000000
21:28:42.043120 IP 192.168.1.30.49361 > 192.168.1.10.6633: Flags [P.], seq 3625:3750, ack 1, win 58, options [nop,nop,TS val 21917410 ecr 46590314], length 125: OpenFlow
	version 1.0, type PACKET_IN, length 125, xid 0x00000000
21:28:42.043124 IP 192.168.1.30.49361 > 192.168.1.10.6633: Flags [P.], seq 3750:3875, ack 1, win 58, options [nop,nop,TS val 21917410 ecr 46590314], length 125: OpenFlow
	version 1.0, type PACKET_IN, length 125, xid 0x00000000
21:28:42.043127 IP 192.168.1.30.49361 > 192.168.1.10.6633: Flags [P.], seq 3875:4000, ack 1, win 58, options [nop,nop,TS val 21917410 ecr 46590314], length 125: OpenFlow
	version 1.0, type PACKET_IN, length 125, xid 0x00000000
21:28:42.043131 IP 192.168.1.30.49361 > 192.168.1.10.6633: Flags [P.], seq 4000:4125, ack 1, win 58, options [nop,nop,TS val 21917410 ecr 46590314], length 125: OpenFlow
	version 1.0, type PACKET_IN, length 125, xid 0x00000000
21:28:42.043134 IP 192.168.1.30.49361 > 192.168.1.10.6633: Flags [P.], seq 4125:4250, ack 1, win 58, options [nop,nop,TS val 21917410 ecr 46590314], length 125: OpenFlow
	version 1.0, type PACKET_IN, length 125, xid 0x00000000
21:28:42.043138 IP 192.168.1.30.49361 > 192.168.1.10.6633: Flags [P.], seq 4250:4375, ack 1, win 58, options [nop,nop,TS val 21917410 ecr 46590314], length 125: OpenFlow
	version 1.0, type PACKET_IN, length 125, xid 0x00000000
21:28:42.043142 IP 192.168.1.30.49361 > 192.168.1.10.6633: Flags [P.], seq 4375:4500, ack 1, win 58, options [nop,nop,TS val 21917410 ecr 46590314], length 125: OpenFlow
	version 1.0, type PACKET_IN, length 125, xid 0x00000000
21:28:42.043146 IP 192.168.1.30.49361 > 192.168.1.10.6633: Flags [P.], seq 4500:4625, ack 1, win 58, options [nop,nop,TS val 21917410 ecr 46590314], length 125: OpenFlow
	version 1.0, type PACKET_IN, length 125, xid 0x00000000
21:28:42.043316 IP 192.168.1.30.49361 > 192.168.1.10.6633: Flags [P.], seq 4625:4750, ack 1, win 58, options [nop,nop,TS val 21917410 ecr 46590314], length 125: OpenFlow
	version 1.0, type PACKET_IN, length 125, xid 0x00000000
21:28:42.043688 IP 192.168.1.10.6633 > 192.168.1.30.49361: Flags [.], ack 1500, win 21148, options [nop,nop,TS val 46590321 ecr 21917410], length 0
21:28:42.043714 IP 192.168.1.10.6633 > 192.168.1.30.49361: Flags [.], ack 2375, win 21148, options [nop,nop,TS val 46590321 ecr 21917410], length 0
21:28:42.043727 IP 192.168.1.10.6633 > 192.168.1.30.49361: Flags [.], ack 3250, win 21148, options [nop,nop,TS val 46590321 ecr 21917410], length 0
21:28:42.043732 IP 192.168.1.10.6633 > 192.168.1.30.49361: Flags [.], ack 4625, win 21148, options [nop,nop,TS val 46590321 ecr 21917410], length 0
21:28:42.043765 IP 192.168.1.10.6633 > 192.168.1.30.49361: Flags [.], ack 4750, win 21148, options [nop,nop,TS val 46590321 ecr 21917410], length 0
21:28:42.044112 IP 192.168.1.30.49361 > 192.168.1.10.6633: Flags [P.], seq 4750:9625, ack 1, win 58, options [nop,nop,TS val 21917410 ecr 46590321], length 4875: OpenFlow
	version 1.0, type PACKET_IN, length 125, xid 0x00000000
	version 1.0, type PACKET_IN, length 125, xid 0x00000000
	version 1.0, type PACKET_IN, length 125, xid 0x00000000
	version 1.0, type PACKET_IN, length 125, xid 0x00000000
	version 1.0, type PACKET_IN, length 125, xid 0x00000000
	version 1.0, type PACKET_IN, length 125, xid 0x00000000
	version 1.0, type PACKET_IN, length 125, xid 0x00000000
	version 1.0, type PACKET_IN, length 125, xid 0x00000000
	version 1.0, type PACKET_IN, length 125, xid 0x00000000
	version 1.0, type PACKET_IN, length 125, xid 0x00000000
	version 1.0, type PACKET_IN, length 125, xid 0x00000000
	version 1.0, type PACKET_IN, length 125, xid 0x00000000
	version 1.0, type PACKET_IN, length 125, xid 0x00000000
	version 1.0, type PACKET_IN, length 125, xid 0x00000000
	version 1.0, type PACKET_IN, length 125, xid 0x00000000
	version 1.0, type PACKET_IN, length 125, xid 0x00000000
	version 1.0, type PACKET_IN, length 125, xid 0x00000000
	version 1.0, type PACKET_IN, length 125, xid 0x00000000
	version 1.0, type PACKET_IN, length 125, xid 0x00000000
	version 1.0, type PACKET_IN, length 125, xid 0x00000000
	version 1.0, type PACKET_IN, length 125, xid 0x00000000
	version 1.0, type PACKET_IN, length 125, xid 0x00000000
	version 1.0, type PACKET_IN, length 125, xid 0x00000000
	version 1.0, type PACKET_IN, length 125, xid 0x00000000
	version 1.0, type PACKET_IN, length 125, xid 0x00000000
	version 1.0, type PACKET_IN, length 125, xid 0x00000000
	version 1.0, type PACKET_IN, length 125, xid 0x00000000
	version 1.0, type PACKET_IN, length 125, xid 0x00000000
	version 1.0, type PACKET_IN, length 125, xid 0x00000000
	version 1.0, type PACKET_IN, length 125, xid 0x00000000
	version 1.0, type PACKET_IN, length 125, xid 0x00000000
	version 1.0, type PACKET_IN, length 125, xid 0x00000000
	version 1.0, type PACKET_IN, length 125, xid 0x00000000
	version 1.0, type PACKET_IN, length 125, xid 0x00000000
	version 1.0, type PACKET_IN, length 125, xid 0x00000000
	version 1.0, type PACKET_IN, length 125, xid 0x00000000
	version 1.0, type PACKET_IN, length 125, xid 0x00000000
	version 1.0, type PACKET_IN, length 125, xid 0x00000000
	version 1.0, type PACKET_IN, length 125, xid 0x00000000
21:28:42.044122 IP 192.168.1.30.49361 > 192.168.1.10.6633: Flags [P.], seq 9625:10750, ack 1, win 58, options [nop,nop,TS val 21917410 ecr 46590321], length 1125: OpenFlow
	version 1.0, type PACKET_IN, length 125, xid 0x00000000
	version 1.0, type PACKET_IN, length 125, xid 0x00000000
	version 1.0, type PACKET_IN, length 125, xid 0x00000000
	version 1.0, type PACKET_IN, length 125, xid 0x00000000
	version 1.0, type PACKET_IN, length 125, xid 0x00000000
	version 1.0, type PACKET_IN, length 125, xid 0x00000000
	version 1.0, type PACKET_IN, length 125, xid 0x00000000
	version 1.0, type PACKET_IN, length 125, xid 0x00000000
	version 1.0, type PACKET_IN, length 125, xid 0x00000000
21:28:42.044588 IP 192.168.1.10.6633 > 192.168.1.30.49361: Flags [.], ack 9625, win 21148, options [nop,nop,TS val 46590321 ecr 21917410], length 0
21:28:42.044607 IP 192.168.1.10.6633 > 192.168.1.30.49361: Flags [.], ack 10750, win 21148, options [nop,nop,TS val 46590321 ecr 21917410], length 0
21:28:42.080486 IP 192.168.1.30.49361 > 192.168.1.10.6633: Flags [P.], seq 10750:10875, ack 1, win 58, options [nop,nop,TS val 21917419 ecr 46590321], length 125: OpenFlow
	version 1.0, type PACKET_IN, length 125, xid 0x00000000
21:28:42.080502 IP 192.168.1.30.49361 > 192.168.1.10.6633: Flags [P.], seq 10875:11000, ack 1, win 58, options [nop,nop,TS val 21917419 ecr 46590321], length 125: OpenFlow
	version 1.0, type PACKET_IN, length 125, xid 0x00000000
21:28:42.080518 IP 192.168.1.30.49361 > 192.168.1.10.6633: Flags [P.], seq 11000:11125, ack 1, win 58, options [nop,nop,TS val 21917419 ecr 46590321], length 125: OpenFlow
	version 1.0, type PACKET_IN, length 125, xid 0x00000000
21:28:42.080533 IP 192.168.1.30.49361 > 192.168.1.10.6633: Flags [P.], seq 11125:11250, ack 1, win 58, options [nop,nop,TS val 21917419 ecr 46590321], length 125: OpenFlow
	version 1.0, type PACKET_IN, length 125, xid 0x00000000
21:28:42.080549 IP 192.168.1.30.49361 > 192.168.1.10.6633: Flags [P.], seq 11250:11375, ack 1, win 58, options [nop,nop,TS val 21917419 ecr 46590321], length 125: OpenFlow
	version 1.0, type PACKET_IN, length 125, xid 0x00000000
21:28:42.080565 IP 192.168.1.30.49361 > 192.168.1.10.6633: Flags [P.], seq 11375:11500, ack 1, win 58, options [nop,nop,TS val 21917419 ecr 46590321], length 125: OpenFlow
	version 1.0, type PACKET_IN, length 125, xid 0x00000000
21:28:42.080581 IP 192.168.1.30.49361 > 192.168.1.10.6633: Flags [P.], seq 11500:11625, ack 1, win 58, options [nop,nop,TS val 21917419 ecr 46590321], length 125: OpenFlow
	version 1.0, type PACKET_IN, length 125, xid 0x00000000
21:28:42.080596 IP 192.168.1.30.49361 > 192.168.1.10.6633: Flags [P.], seq 11625:11750, ack 1, win 58, options [nop,nop,TS val 21917419 ecr 46590321], length 125: OpenFlow
	version 1.0, type PACKET_IN, length 125, xid 0x00000000
21:28:42.080611 IP 192.168.1.30.49361 > 192.168.1.10.6633: Flags [P.], seq 11750:11875, ack 1, win 58, options [nop,nop,TS val 21917419 ecr 46590321], length 125: OpenFlow
	version 1.0, type PACKET_IN, length 125, xid 0x00000000
21:28:42.080635 IP 192.168.1.30.49361 > 192.168.1.10.6633: Flags [P.], seq 11875:12000, ack 1, win 58, options [nop,nop,TS val 21917419 ecr 46590321], length 125: OpenFlow
	version 1.0, type PACKET_IN, length 125, xid 0x00000000
21:28:42.080650 IP 192.168.1.30.49361 > 192.168.1.10.6633: Flags [P.], seq 12000:12125, ack 1, win 58, options [nop,nop,TS val 21917419 ecr 46590321], length 125: OpenFlow
	version 1.0, type PACKET_IN, length 125, xid 0x00000000
21:28:42.080665 IP 192.168.1.30.49361 > 192.168.1.10.6633: Flags [P.], seq 12125:12250, ack 1, win 58, options [nop,nop,TS val 21917419 ecr 46590321], length 125: OpenFlow
	version 1.0, type PACKET_IN, length 125, xid 0x00000000
21:28:42.080688 IP 192.168.1.30.49361 > 192.168.1.10.6633: Flags [P.], seq 12250:12375, ack 1, win 58, options [nop,nop,TS val 21917419 ecr 46590321], length 125: OpenFlow
	version 1.0, type PACKET_IN, length 125, xid 0x00000000
21:28:42.080710 IP 192.168.1.30.49361 > 192.168.1.10.6633: Flags [P.], seq 12375:12500, ack 1, win 58, options [nop,nop,TS val 21917419 ecr 46590321], length 125: OpenFlow
	version 1.0, type PACKET_IN, length 125, xid 0x00000000
21:28:42.080733 IP 192.168.1.30.49361 > 192.168.1.10.6633: Flags [P.], seq 12500:12625, ack 1, win 58, options [nop,nop,TS val 21917419 ecr 46590321], length 125: OpenFlow
	version 1.0, type PACKET_IN, length 125, xid 0x00000000
21:28:42.080748 IP 192.168.1.30.49361 > 192.168.1.10.6633: Flags [P.], seq 12625:12750, ack 1, win 58, options [nop,nop,TS val 21917419 ecr 46590321], length 125: OpenFlow
	version 1.0, type PACKET_IN, length 125, xid 0x00000000
21:28:42.080772 IP 192.168.1.30.49361 > 192.168.1.10.6633: Flags [P.], seq 12750:12875, ack 1, win 58, options [nop,nop,TS val 21917419 ecr 46590321], length 125: OpenFlow
	version 1.0, type PACKET_IN, length 125, xid 0x00000000
21:28:42.080798 IP 192.168.1.30.49361 > 192.168.1.10.6633: Flags [P.], seq 12875:13000, ack 1, win 58, options [nop,nop,TS val 21917419 ecr 46590321], length 125: OpenFlow
	version 1.0, type PACKET_IN, length 125, xid 0x00000000
21:28:42.080814 IP 192.168.1.30.49361 > 192.168.1.10.6633: Flags [P.], seq 13000:13125, ack 1, win 58, options [nop,nop,TS val 21917419 ecr 46590321], length 125: OpenFlow
	version 1.0, type PACKET_IN, length 125, xid 0x00000000
21:28:42.080830 IP 192.168.1.30.49361 > 192.168.1.10.6633: Flags [P.], seq 13125:13250, ack 1, win 58, options [nop,nop,TS val 21917419 ecr 46590321], length 125: OpenFlow
	version 1.0, type PACKET_IN, length 125, xid 0x00000000
21:28:42.080845 IP 192.168.1.30.49361 > 192.168.1.10.6633: Flags [P.], seq 13250:13375, ack 1, win 58, options [nop,nop,TS val 21917419 ecr 46590321], length 125: OpenFlow
	version 1.0, type PACKET_IN, length 125, xid 0x00000000
21:28:42.080861 IP 192.168.1.30.49361 > 192.168.1.10.6633: Flags [P.], seq 13375:13500, ack 1, win 58, options [nop,nop,TS val 21917419 ecr 46590321], length 125: OpenFlow
	version 1.0, type PACKET_IN, length 125, xid 0x00000000
21:28:42.080874 IP 192.168.1.10.6633 > 192.168.1.30.49361: Flags [.], ack 11750, win 21148, options [nop,nop,TS val 46590330 ecr 21917419], length 0
21:28:42.080877 IP 192.168.1.30.49361 > 192.168.1.10.6633: Flags [P.], seq 13500:13625, ack 1, win 58, options [nop,nop,TS val 21917419 ecr 46590321], length 125: OpenFlow
	version 1.0, type PACKET_IN, length 125, xid 0x00000000
21:28:42.080893 IP 192.168.1.30.49361 > 192.168.1.10.6633: Flags [P.], seq 13625:13750, ack 1, win 58, options [nop,nop,TS val 21917419 ecr 46590321], length 125: OpenFlow
	version 1.0, type PACKET_IN, length 125, xid 0x00000000
21:28:42.080927 IP 192.168.1.30.49361 > 192.168.1.10.6633: Flags [P.], seq 13750:13875, ack 1, win 58, options [nop,nop,TS val 21917419 ecr 46590321], length 125: OpenFlow
	version 1.0, type PACKET_IN, length 125, xid 0x00000000
21:28:42.080943 IP 192.168.1.30.49361 > 192.168.1.10.6633: Flags [P.], seq 13875:14000, ack 1, win 58, options [nop,nop,TS val 21917419 ecr 46590321], length 125: OpenFlow
	version 1.0, type PACKET_IN, length 125, xid 0x00000000
21:28:42.080959 IP 192.168.1.30.49361 > 192.168.1.10.6633: Flags [P.], seq 14000:14125, ack 1, win 58, options [nop,nop,TS val 21917419 ecr 46590321], length 125: OpenFlow
	version 1.0, type PACKET_IN, length 125, xid 0x00000000
21:28:42.080974 IP 192.168.1.30.49361 > 192.168.1.10.6633: Flags [P.], seq 14125:14250, ack 1, win 58, options [nop,nop,TS val 21917419 ecr 46590321], length 125: OpenFlow
	version 1.0, type PACKET_IN, length 125, xid 0x00000000
21:28:42.080989 IP 192.168.1.30.49361 > 192.168.1.10.6633: Flags [P.], seq 14250:14375, ack 1, win 58, options [nop,nop,TS val 21917419 ecr 46590321], length 125: OpenFlow
	version 1.0, type PACKET_IN, length 125, xid 0x00000000
21:28:42.080998 IP 192.168.1.30.49361 > 192.168.1.10.6633: Flags [P.], seq 14375:14500, ack 1, win 58, options [nop,nop,TS val 21917419 ecr 46590321], length 125: OpenFlow
	version 1.0, type PACKET_IN, length 125, xid 0x00000000
21:28:42.081006 IP 192.168.1.30.49361 > 192.168.1.10.6633: Flags [P.], seq 14500:14625, ack 1, win 58, options [nop,nop,TS val 21917419 ecr 46590321], length 125: OpenFlow
	version 1.0, type PACKET_IN, length 125, xid 0x00000000
21:28:42.081014 IP 192.168.1.30.49361 > 192.168.1.10.6633: Flags [P.], seq 14625:14750, ack 1, win 58, options [nop,nop,TS val 21917419 ecr 46590321], length 125: OpenFlow
	version 1.0, type PACKET_IN, length 125, xid 0x00000000
21:28:42.081022 IP 192.168.1.30.49361 > 192.168.1.10.6633: Flags [P.], seq 14750:14875, ack 1, win 58, options [nop,nop,TS val 21917419 ecr 46590321], length 125: OpenFlow
	version 1.0, type PACKET_IN, length 125, xid 0x00000000
21:28:42.081030 IP 192.168.1.30.49361 > 192.168.1.10.6633: Flags [P.], seq 14875:15000, ack 1, win 58, options [nop,nop,TS val 21917419 ecr 46590321], length 125: OpenFlow
	version 1.0, type PACKET_IN, length 125, xid 0x00000000
21:28:42.081038 IP 192.168.1.30.49361 > 192.168.1.10.6633: Flags [P.], seq 15000:15125, ack 1, win 58, options [nop,nop,TS val 21917419 ecr 46590321], length 125: OpenFlow
	version 1.0, type PACKET_IN, length 125, xid 0x00000000
21:28:42.081046 IP 192.168.1.30.49361 > 192.168.1.10.6633: Flags [P.], seq 15125:15250, ack 1, win 58, options [nop,nop,TS val 21917419 ecr 46590321], length 125: OpenFlow
	version 1.0, type PACKET_IN, length 125, xid 0x00000000
21:28:42.081054 IP 192.168.1.30.49361 > 192.168.1.10.6633: Flags [P.], seq 15250:15375, ack 1, win 58, options [nop,nop,TS val 21917419 ecr 46590321], length 125: OpenFlow
	version 1.0, type PACKET_IN, length 125, xid 0x00000000
21:28:42.081062 IP 192.168.1.30.49361 > 192.168.1.10.6633: Flags [P.], seq 15375:15500, ack 1, win 58, options [nop,nop,TS val 21917419 ecr 46590321], length 125: OpenFlow
	version 1.0, type PACKET_IN, length 125, xid 0x00000000
21:28:42.080910 IP 192.168.1.10.6633 > 192.168.1.30.49361: Flags [.], ack 12250, win 21148, options [nop,nop,TS val 46590330 ecr 21917419], length 0
21:28:42.081109 IP 192.168.1.10.6633 > 192.168.1.30.49361: Flags [.], ack 12375, win 21148, options [nop,nop,TS val 46590330 ecr 21917419], length 0
21:28:42.081300 IP 192.168.1.30.49361 > 192.168.1.10.6633: Flags [P.], seq 15500:20176, ack 1, win 58, options [nop,nop,TS val 21917419 ecr 46590330], length 4676: OpenFlow
	version 1.0, type PACKET_IN, length 125, xid 0x00000000
	version 1.0, type PACKET_IN, length 125, xid 0x00000000
	version 1.0, type PACKET_IN, length 125, xid 0x00000000
	version 1.0, type PACKET_IN, length 125, xid 0x00000000
	version 1.0, type PACKET_IN, length 125, xid 0x00000000
	version 1.0, type PACKET_IN, length 125, xid 0x00000000
	version 1.0, type PACKET_IN, length 125, xid 0x00000000
	version 1.0, type PACKET_IN, length 125, xid 0x00000000
	version 1.0, type PACKET_IN, length 125, xid 0x00000000
	version 1.0, type PACKET_IN, length 125, xid 0x00000000
	version 1.0, type PACKET_IN, length 88, xid 0x00000000
	version 1.0, type PACKET_IN, length 125, xid 0x00000000
	version 1.0, type PACKET_IN, length 125, xid 0x00000000
	version 1.0, type PACKET_IN, length 125, xid 0x00000000
	version 1.0, type PACKET_IN, length 125, xid 0x00000000
	version 1.0, type PACKET_IN, length 125, xid 0x00000000
	version 1.0, type PACKET_IN, length 125, xid 0x00000000
	version 1.0, type PACKET_IN, length 88, xid 0x00000000
	version 1.0, type PACKET_IN, length 125, xid 0x00000000
	version 1.0, type PACKET_IN, length 125, xid 0x00000000
	version 1.0, type PACKET_IN, length 125, xid 0x00000000
	version 1.0, type PACKET_IN, length 125, xid 0x00000000
	version 1.0, type PACKET_IN, length 125, xid 0x00000000
	version 1.0, type PACKET_IN, length 125, xid 0x00000000
	version 1.0, type PACKET_IN, length 125, xid 0x00000000
	version 1.0, type PACKET_IN, length 125, xid 0x00000000
	version 1.0, type PACKET_IN, length 125, xid 0x00000000
	version 1.0, type PACKET_IN, length 125, xid 0x00000000
	version 1.0, type PACKET_IN, length 125, xid 0x00000000
	version 1.0, type PACKET_IN, length 125, xid 0x00000000
	version 1.0, type PACKET_IN, length 125, xid 0x00000000
	version 1.0, type PACKET_IN, length 125, xid 0x00000000
	version 1.0, type PACKET_IN, length 125, xid 0x00000000
	version 1.0, type PACKET_IN, length 125, xid 0x00000000
	version 1.0, type PACKET_IN, length 125, xid 0x00000000
	version 1.0, type PACKET_IN, length 125, xid 0x00000000
	version 1.0, type PACKET_IN, length 125, xid 0x00000000
	version 1.0, type PACKET_IN, length 125, xid 0x00000000
21:28:42.081316 IP 192.168.1.30.49361 > 192.168.1.10.6633: Flags [P.], seq 20176:24941, ack 1, win 58, options [nop,nop,TS val 21917419 ecr 46590330], length 4765: OpenFlow
	version 1.0, type PACKET_IN, length 125, xid 0x00000000
	version 1.0, type PACKET_IN, length 125, xid 0x00000000
	version 1.0, type PACKET_IN, length 125, xid 0x00000000
	version 1.0, type PACKET_IN, length 125, xid 0x00000000
	version 1.0, type PACKET_IN, length 125, xid 0x00000000
	version 1.0, type PACKET_IN, length 125, xid 0x00000000
	version 1.0, type PACKET_IN, length 125, xid 0x00000000
	version 1.0, type PACKET_IN, length 125, xid 0x00000000
	version 1.0, type PACKET_IN, length 125, xid 0x00000000
	version 1.0, type PACKET_IN, length 125, xid 0x00000000
	version 1.0, type PACKET_IN, length 125, xid 0x00000000
	version 1.0, type PACKET_IN, length 125, xid 0x00000000
	version 1.0, type PACKET_IN, length 125, xid 0x00000000
	version 1.0, type PACKET_IN, length 125, xid 0x00000000
	version 1.0, type PACKET_IN, length 125, xid 0x00000000
	version 1.0, type PACKET_IN, length 125, xid 0x00000000
	version 1.0, type PACKET_IN, length 125, xid 0x00000000
	version 1.0, type PACKET_IN, length 125, xid 0x00000000
	version 1.0, type PACKET_IN, length 125, xid 0x00000000
	version 1.0, type PACKET_IN, length 125, xid 0x00000000
	version 1.0, type PACKET_IN, length 125, xid 0x00000000
	version 1.0, type PACKET_IN, length 125, xid 0x00000000
	version 1.0, type PACKET_IN, length 125, xid 0x00000000
	version 1.0, type PACKET_IN, length 125, xid 0x00000000
	version 1.0, type PACKET_IN, length 125, xid 0x00000000
	version 1.0, type PACKET_IN, length 125, xid 0x00000000
	version 1.0, type PACKET_IN, length 125, xid 0x00000000
	version 1.0, type PACKET_IN, length 125, xid 0x00000000
	version 1.0, type PACKET_IN, length 265, xid 0x00000000
	version 1.0, type PACKET_IN, length 125, xid 0x00000000
	version 1.0, type PACKET_IN, length 125, xid 0x00000000
	version 1.0, type PACKET_IN, length 125, xid 0x00000000
	version 1.0, type PACKET_IN, length 125, xid 0x00000000
	version 1.0, type PACKET_IN, length 125, xid 0x00000000
	version 1.0, type PACKET_IN, length 125, xid 0x00000000
	version 1.0, type PACKET_IN, length 125, xid 0x00000000
	version 1.0, type PACKET_IN, length 125, xid 0x00000000
21:28:42.081345 IP 192.168.1.30.49361 > 192.168.1.10.6633: Flags [.], seq 24941:26389, ack 1, win 58, options [nop,nop,TS val 21917419 ecr 46590330], length 1448: OpenFlow
	version 1.0, type PACKET_IN, length 125, xid 0x00000000
	version 1.0, type PACKET_IN, length 125, xid 0x00000000
	version 1.0, type PACKET_IN, length 125, xid 0x00000000
	version 1.0, type PACKET_IN, length 125, xid 0x00000000
	version 1.0, type PACKET_IN, length 125, xid 0x00000000
	version 1.0, type PACKET_IN, length 125, xid 0x00000000
	version 1.0, type PACKET_IN, length 125, xid 0x00000000
	version 1.0, type PACKET_IN, length 125, xid 0x00000000
	version 1.0, type PACKET_IN, length 125, xid 0x00000000
	version 1.0, type PACKET_IN, length 125, xid 0x00000000
	version 1.0, type PACKET_IN, length 125, xid 0x00000000
	version 1.0, type PACKET_IN, length 88, xid 0x00000000 [|openflow]
21:28:42.081356 IP 192.168.1.30.49361 > 192.168.1.10.6633: Flags [P.], seq 26389:26404, ack 1, win 58, options [nop,nop,TS val 21917419 ecr 46590330], length 15: OpenFlow
	version unknown (0x00), type 0x56, length 31744, xid 0x00000001 [|openflow]
21:28:42.081128 IP 192.168.1.10.6633 > 192.168.1.30.49361: Flags [.], ack 13750, win 21148, options [nop,nop,TS val 46590331 ecr 21917419], length 0
21:28:42.081561 IP 192.168.1.10.6633 > 192.168.1.30.49361: Flags [.], ack 14125, win 21148, options [nop,nop,TS val 46590331 ecr 21917419], length 0
21:28:42.081567 IP 192.168.1.10.6633 > 192.168.1.30.49361: Flags [.], ack 14625, win 21148, options [nop,nop,TS val 46590331 ecr 21917419], length 0
21:28:42.081572 IP 192.168.1.10.6633 > 192.168.1.30.49361: Flags [.], ack 15500, win 21148, options [nop,nop,TS val 46590331 ecr 21917419], length 0
21:28:42.081607 IP 192.168.1.10.6633 > 192.168.1.30.49361: Flags [.], ack 20176, win 21148, options [nop,nop,TS val 46590331 ecr 21917419], length 0
21:28:42.081620 IP 192.168.1.10.6633 > 192.168.1.30.49361: Flags [.], ack 24941, win 21148, options [nop,nop,TS val 46590331 ecr 21917419], length 0
21:28:42.081626 IP 192.168.1.10.6633 > 192.168.1.30.49361: Flags [.], ack 26404, win 21148, options [nop,nop,TS val 46590331 ecr 21917419], length 0
21:28:42.114752 IP 192.168.1.30.49361 > 192.168.1.10.6633: Flags [P.], seq 26404:26529, ack 1, win 58, options [nop,nop,TS val 21917428 ecr 46590331], length 125: OpenFlow
	version 1.0, type PACKET_IN, length 125, xid 0x00000000
21:28:42.114772 IP 192.168.1.30.49361 > 192.168.1.10.6633: Flags [P.], seq 26529:26654, ack 1, win 58, options [nop,nop,TS val 21917428 ecr 46590331], length 125: OpenFlow
	version 1.0, type PACKET_IN, length 125, xid 0x00000000
21:28:42.114785 IP 192.168.1.30.49361 > 192.168.1.10.6633: Flags [P.], seq 26654:26779, ack 1, win 58, options [nop,nop,TS val 21917428 ecr 46590331], length 125: OpenFlow
	version 1.0, type PACKET_IN, length 125, xid 0x00000000
21:28:42.115078 IP 192.168.1.30.49361 > 192.168.1.10.6633: Flags [P.], seq 26779:26904, ack 1, win 58, options [nop,nop,TS val 21917428 ecr 46590331], length 125: OpenFlow
	version 1.0, type PACKET_IN, length 125, xid 0x00000000
21:28:42.115095 IP 192.168.1.30.49361 > 192.168.1.10.6633: Flags [P.], seq 26904:27029, ack 1, win 58, options [nop,nop,TS val 21917428 ecr 46590331], length 125: OpenFlow
	version 1.0, type PACKET_IN, length 125, xid 0x00000000
21:28:42.115109 IP 192.168.1.30.49361 > 192.168.1.10.6633: Flags [P.], seq 27029:27154, ack 1, win 58, options [nop,nop,TS val 21917428 ecr 46590331], length 125: OpenFlow
	version 1.0, type PACKET_IN, length 125, xid 0x00000000
21:28:42.115130 IP 192.168.1.30.49361 > 192.168.1.10.6633: Flags [P.], seq 27154:27279, ack 1, win 58, options [nop,nop,TS val 21917428 ecr 46590331], length 125: OpenFlow
	version 1.0, type PACKET_IN, length 125, xid 0x00000000
21:28:42.115144 IP 192.168.1.30.49361 > 192.168.1.10.6633: Flags [P.], seq 27279:27404, ack 1, win 58, options [nop,nop,TS val 21917428 ecr 46590331], length 125: OpenFlow
	version 1.0, type PACKET_IN, length 125, xid 0x00000000
21:28:42.115158 IP 192.168.1.30.49361 > 192.168.1.10.6633: Flags [P.], seq 27404:27529, ack 1, win 58, options [nop,nop,TS val 21917428 ecr 46590331], length 125: OpenFlow
	version 1.0, type PACKET_IN, length 125, xid 0x00000000
21:28:42.115171 IP 192.168.1.30.49361 > 192.168.1.10.6633: Flags [P.], seq 27529:27654, ack 1, win 58, options [nop,nop,TS val 21917428 ecr 46590331], length 125: OpenFlow
	version 1.0, type PACKET_IN, length 125, xid 0x00000000
21:28:42.115282 IP 192.168.1.30.49361 > 192.168.1.10.6633: Flags [P.], seq 27654:27779, ack 1, win 58, options [nop,nop,TS val 21917428 ecr 46590331], length 125: OpenFlow
	version 1.0, type PACKET_IN, length 125, xid 0x00000000
21:28:42.115296 IP 192.168.1.30.49361 > 192.168.1.10.6633: Flags [P.], seq 27779:27904, ack 1, win 58, options [nop,nop,TS val 21917428 ecr 46590331], length 125: OpenFlow
	version 1.0, type PACKET_IN, length 125, xid 0x00000000
21:28:42.115310 IP 192.168.1.30.49361 > 192.168.1.10.6633: Flags [P.], seq 27904:28029, ack 1, win 58, options [nop,nop,TS val 21917428 ecr 46590331], length 125: OpenFlow
	version 1.0, type PACKET_IN, length 125, xid 0x00000000
21:28:42.115324 IP 192.168.1.30.49361 > 192.168.1.10.6633: Flags [P.], seq 28029:28154, ack 1, win 58, options [nop,nop,TS val 21917428 ecr 46590331], length 125: OpenFlow
	version 1.0, type PACKET_IN, length 125, xid 0x00000000
21:28:42.115350 IP 192.168.1.30.49361 > 192.168.1.10.6633: Flags [P.], seq 28154:28279, ack 1, win 58, options [nop,nop,TS val 21917428 ecr 46590331], length 125: OpenFlow
	version 1.0, type PACKET_IN, length 125, xid 0x00000000
21:28:42.115364 IP 192.168.1.30.49361 > 192.168.1.10.6633: Flags [P.], seq 28279:28404, ack 1, win 58, options [nop,nop,TS val 21917428 ecr 46590331], length 125: OpenFlow
	version 1.0, type PACKET_IN, length 125, xid 0x00000000
21:28:42.115377 IP 192.168.1.30.49361 > 192.168.1.10.6633: Flags [P.], seq 28404:28529, ack 1, win 58, options [nop,nop,TS val 21917428 ecr 46590331], length 125: OpenFlow
	version 1.0, type PACKET_IN, length 125, xid 0x00000000
21:28:42.115391 IP 192.168.1.30.49361 > 192.168.1.10.6633: Flags [P.], seq 28529:28654, ack 1, win 58, options [nop,nop,TS val 21917428 ecr 46590331], length 125: OpenFlow
	version 1.0, type PACKET_IN, length 125, xid 0x00000000
21:28:42.115488 IP 192.168.1.30.49361 > 192.168.1.10.6633: Flags [P.], seq 28654:28779, ack 1, win 58, options [nop,nop,TS val 21917428 ecr 46590331], length 125: OpenFlow
	version 1.0, type PACKET_IN, length 125, xid 0x00000000
21:28:42.115506 IP 192.168.1.30.49361 > 192.168.1.10.6633: Flags [P.], seq 28779:28904, ack 1, win 58, options [nop,nop,TS val 21917428 ecr 46590331], length 125: OpenFlow
	version 1.0, type PACKET_IN, length 125, xid 0x00000000
21:28:42.115520 IP 192.168.1.30.49361 > 192.168.1.10.6633: Flags [P.], seq 28904:29029, ack 1, win 58, options [nop,nop,TS val 21917428 ecr 46590331], length 125: OpenFlow
	version 1.0, type PACKET_IN, length 125, xid 0x00000000
21:28:42.115533 IP 192.168.1.30.49361 > 192.168.1.10.6633: Flags [P.], seq 29029:29154, ack 1, win 58, options [nop,nop,TS val 21917428 ecr 46590331], length 125: OpenFlow
	version 1.0, type PACKET_IN, length 125, xid 0x00000000
21:28:42.115547 IP 192.168.1.30.49361 > 192.168.1.10.6633: Flags [P.], seq 29154:29279, ack 1, win 58, options [nop,nop,TS val 21917428 ecr 46590331], length 125: OpenFlow
	version 1.0, type PACKET_IN, length 125, xid 0x00000000
21:28:42.115632 IP 192.168.1.30.49361 > 192.168.1.10.6633: Flags [P.], seq 29279:29404, ack 1, win 58, options [nop,nop,TS val 21917428 ecr 46590331], length 125: OpenFlow
	version 1.0, type PACKET_IN, length 125, xid 0x00000000
21:28:42.115646 IP 192.168.1.30.49361 > 192.168.1.10.6633: Flags [P.], seq 29404:29529, ack 1, win 58, options [nop,nop,TS val 21917428 ecr 46590331], length 125: OpenFlow
	version 1.0, type PACKET_IN, length 125, xid 0x00000000
21:28:42.115660 IP 192.168.1.30.49361 > 192.168.1.10.6633: Flags [P.], seq 29529:29654, ack 1, win 58, options [nop,nop,TS val 21917428 ecr 46590331], length 125: OpenFlow
	version 1.0, type PACKET_IN, length 125, xid 0x00000000
21:28:42.115673 IP 192.168.1.30.49361 > 192.168.1.10.6633: Flags [P.], seq 29654:29779, ack 1, win 58, options [nop,nop,TS val 21917428 ecr 46590331], length 125: OpenFlow
	version 1.0, type PACKET_IN, length 125, xid 0x00000000
21:28:42.115687 IP 192.168.1.30.49361 > 192.168.1.10.6633: Flags [P.], seq 29779:29904, ack 1, win 58, options [nop,nop,TS val 21917428 ecr 46590331], length 125: OpenFlow
	version 1.0, type PACKET_IN, length 125, xid 0x00000000
21:28:42.115701 IP 192.168.1.30.49361 > 192.168.1.10.6633: Flags [P.], seq 29904:30229, ack 1, win 58, options [nop,nop,TS val 21917428 ecr 46590331], length 325: OpenFlow
	version 1.0, type PACKET_IN, length 325, xid 0x00000000
21:28:42.115708 IP 192.168.1.30.49361 > 192.168.1.10.6633: Flags [P.], seq 30229:30354, ack 1, win 58, options [nop,nop,TS val 21917428 ecr 46590331], length 125: OpenFlow
	version 1.0, type PACKET_IN, length 125, xid 0x00000000
21:28:42.115715 IP 192.168.1.30.49361 > 192.168.1.10.6633: Flags [P.], seq 30354:30479, ack 1, win 58, options [nop,nop,TS val 21917428 ecr 46590331], length 125: OpenFlow
	version 1.0, type PACKET_IN, length 125, xid 0x00000000
21:28:42.115722 IP 192.168.1.30.49361 > 192.168.1.10.6633: Flags [P.], seq 30479:30604, ack 1, win 58, options [nop,nop,TS val 21917428 ecr 46590331], length 125: OpenFlow
	version 1.0, type PACKET_IN, length 125, xid 0x00000000
21:28:42.115729 IP 192.168.1.30.49361 > 192.168.1.10.6633: Flags [P.], seq 30604:30729, ack 1, win 58, options [nop,nop,TS val 21917428 ecr 46590331], length 125: OpenFlow
	version 1.0, type PACKET_IN, length 125, xid 0x00000000
21:28:42.115736 IP 192.168.1.30.49361 > 192.168.1.10.6633: Flags [P.], seq 30729:30854, ack 1, win 58, options [nop,nop,TS val 21917428 ecr 46590331], length 125: OpenFlow
	version 1.0, type PACKET_IN, length 125, xid 0x00000000
21:28:42.115743 IP 192.168.1.30.49361 > 192.168.1.10.6633: Flags [P.], seq 30854:30979, ack 1, win 58, options [nop,nop,TS val 21917428 ecr 46590331], length 125: OpenFlow
	version 1.0, type PACKET_IN, length 125, xid 0x00000000
21:28:42.115750 IP 192.168.1.30.49361 > 192.168.1.10.6633: Flags [P.], seq 30979:31104, ack 1, win 58, options [nop,nop,TS val 21917428 ecr 46590331], length 125: OpenFlow
	version 1.0, type PACKET_IN, length 125, xid 0x00000000
21:28:42.115764 IP 192.168.1.30.49361 > 192.168.1.10.6633: Flags [P.], seq 31104:31229, ack 1, win 58, options [nop,nop,TS val 21917428 ecr 46590331], length 125: OpenFlow
	version 1.0, type PACKET_IN, length 125, xid 0x00000000
21:28:42.115897 IP 192.168.1.30.49361 > 192.168.1.10.6633: Flags [P.], seq 31229:31354, ack 1, win 58, options [nop,nop,TS val 21917428 ecr 46590331], length 125: OpenFlow
	version 1.0, type PACKET_IN, length 125, xid 0x00000000
21:28:42.115905 IP 192.168.1.30.49361 > 192.168.1.10.6633: Flags [P.], seq 31354:31479, ack 1, win 58, options [nop,nop,TS val 21917428 ecr 46590331], length 125: OpenFlow
	version 1.0, type PACKET_IN, length 125, xid 0x00000000
21:28:42.115948 IP 192.168.1.10.6633 > 192.168.1.30.49361: Flags [.], ack 27154, win 21148, options [nop,nop,TS val 46590339 ecr 21917428], length 0
21:28:42.116040 IP 192.168.1.10.6633 > 192.168.1.30.49361: Flags [.], ack 27904, win 21148, options [nop,nop,TS val 46590339 ecr 21917428], length 0
21:28:42.116060 IP 192.168.1.10.6633 > 192.168.1.30.49361: Flags [.], ack 28654, win 21148, options [nop,nop,TS val 46590339 ecr 21917428], length 0
21:28:42.116071 IP 192.168.1.10.6633 > 192.168.1.30.49361: Flags [.], ack 28779, win 21148, options [nop,nop,TS val 46590339 ecr 21917428], length 0
21:28:42.116079 IP 192.168.1.10.6633 > 192.168.1.30.49361: Flags [.], ack 30229, win 21148, options [nop,nop,TS val 46590339 ecr 21917428], length 0
21:28:42.116772 IP 192.168.1.10.6633 > 192.168.1.30.49361: Flags [.], ack 31104, win 21148, options [nop,nop,TS val 46590339 ecr 21917428], length 0
21:28:42.116783 IP 192.168.1.10.6633 > 192.168.1.30.49361: Flags [.], ack 31479, win 21148, options [nop,nop,TS val 46590339 ecr 21917428], length 0
21:28:42.117473 IP 192.168.1.30.49361 > 192.168.1.10.6633: Flags [P.], seq 31479:36067, ack 1, win 58, options [nop,nop,TS val 21917428 ecr 46590339], length 4588: OpenFlow
	version 1.0, type PACKET_IN, length 125, xid 0x00000000
	version 1.0, type PACKET_IN, length 125, xid 0x00000000
	version 1.0, type PACKET_IN, length 125, xid 0x00000000
	version 1.0, type PACKET_IN, length 125, xid 0x00000000
	version 1.0, type PACKET_IN, length 125, xid 0x00000000
	version 1.0, type PACKET_IN, length 125, xid 0x00000000
	version 1.0, type PACKET_IN, length 125, xid 0x00000000
	version 1.0, type PACKET_IN, length 125, xid 0x00000000
	version 1.0, type PACKET_IN, length 125, xid 0x00000000
	version 1.0, type PACKET_IN, length 125, xid 0x00000000
	version 1.0, type PACKET_IN, length 125, xid 0x00000000
	version 1.0, type PACKET_IN, length 125, xid 0x00000000
	version 1.0, type PACKET_IN, length 125, xid 0x00000000
	version 1.0, type PACKET_IN, length 125, xid 0x00000000
	version 1.0, type PACKET_IN, length 125, xid 0x00000000
	version 1.0, type PACKET_IN, length 125, xid 0x00000000
	version 1.0, type PACKET_IN, length 125, xid 0x00000000
	version 1.0, type PACKET_IN, length 125, xid 0x00000000
	version 1.0, type PACKET_IN, length 125, xid 0x00000000
	version 1.0, type PACKET_IN, length 125, xid 0x00000000
