21:28:42.079133 IP 192.168.1.30.49360 > 192.168.1.10.6633: Flags [P.], seq 1217672200:1217672325, ack 2613171775, win 58, options [nop,nop,TS val 21917419 ecr 46590321], length 125: OpenFlow
	version 1.0, type PACKET_IN, length 125, xid 0x00000000
21:28:42.079178 IP 192.168.1.30.49360 > 192.168.1.10.6633: Flags [P.], seq 125:250, ack 1, win 58, options [nop,nop,TS val 21917419 ecr 46590321], length 125: OpenFlow
	version 1.0, type PACKET_IN, length 125, xid 0x00000000
21:28:42.079212 IP 192.168.1.30.49360 > 192.168.1.10.6633: Flags [P.], seq 250:375, ack 1, win 58, options [nop,nop,TS val 21917419 ecr 46590321], length 125: OpenFlow
	version 1.0, type PACKET_IN, length 125, xid 0x00000000
21:28:42.079255 IP 192.168.1.30.49360 > 192.168.1.10.6633: Flags [P.], seq 375:500, ack 1, win 58, options [nop,nop,TS val 21917419 ecr 46590321], length 125: OpenFlow
	version 1.0, type PACKET_IN, length 125, xid 0x00000000
21:28:42.079271 IP 192.168.1.30.49360 > 192.168.1.10.6633: Flags [P.], seq 500:625, ack 1, win 58, options [nop,nop,TS val 21917419 ecr 46590321], length 125: OpenFlow
	version 1.0, type PACKET_IN, length 125, xid 0x00000000
21:28:42.079285 IP 192.168.1.30.49360 > 192.168.1.10.6633: Flags [P.], seq 625:750, ack 1, win 58, options [nop,nop,TS val 21917419 ecr 46590321], length 125: OpenFlow
	version 1.0, type PACKET_IN, length 125, xid 0x00000000
21:28:42.079300 IP 192.168.1.30.49360 > 192.168.1.10.6633: Flags [P.], seq 750:875, ack 1, win 58, options [nop,nop,TS val 21917419 ecr 46590321], length 125: OpenFlow
	version 1.0, type PACKET_IN, length 125, xid 0x00000000
21:28:42.079314 IP 192.168.1.30.49360 > 192.168.1.10.6633: Flags [P.], seq 875:963, ack 1, win 58, options [nop,nop,TS val 21917419 ecr 46590321], length 88: OpenFlow
	version 1.0, type PACKET_IN, length 88, xid 0x00000000
21:28:42.079328 IP 192.168.1.30.49360 > 192.168.1.10.6633: Flags [P.], seq 963:1088, ack 1, win 58, options [nop,nop,TS val 21917419 ecr 46590321], length 125: OpenFlow
	version 1.0, type PACKET_IN, length 125, xid 0x00000000
21:28:42.079348 IP 192.168.1.30.49360 > 192.168.1.10.6633: Flags [P.], seq 1088:1213, ack 1, win 58, options [nop,nop,TS val 21917419 ecr 46590321], length 125: OpenFlow
	version 1.0, type PACKET_IN, length 125, xid 0x00000000
21:28:42.079364 IP 192.168.1.30.49360 > 192.168.1.10.6633: Flags [P.], seq 1213:1338, ack 1, win 58, options [nop,nop,TS val 21917419 ecr 46590321], length 125: OpenFlow
	version 1.0, type PACKET_IN, length 125, xid 0x00000000
21:28:42.079379 IP 192.168.1.30.49360 > 192.168.1.10.6633: Flags [P.], seq 1338:1463, ack 1, win 58, options [nop,nop,TS val 21917419 ecr 46590321], length 125: OpenFlow
	version 1.0, type PACKET_IN, length 125, xid 0x00000000
21:28:42.079393 IP 192.168.1.30.49360 > 192.168.1.10.6633: Flags [P.], seq 1463:1588, ack 1, win 58, options [nop,nop,TS val 21917419 ecr 46590321], length 125: OpenFlow
	version 1.0, type PACKET_IN, length 125, xid 0x00000000
21:28:42.079407 IP 192.168.1.30.49360 > 192.168.1.10.6633: Flags [P.], seq 1588:1713, ack 1, win 58, options [nop,nop,TS val 21917419 ecr 46590321], length 125: OpenFlow
	version 1.0, type PACKET_IN, length 125, xid 0x00000000
21:28:42.079421 IP 192.168.1.30.49360 > 192.168.1.10.6633: Flags [P.], seq 1713:1838, ack 1, win 58, options [nop,nop,TS val 21917419 ecr 46590321], length 125: OpenFlow
	version 1.0, type PACKET_IN, length 125, xid 0x00000000
21:28:42.079435 IP 192.168.1.30.49360 > 192.168.1.10.6633: Flags [P.], seq 1838:1963, ack 1, win 58, options [nop,nop,TS val 21917419 ecr 46590321], length 125: OpenFlow
	version 1.0, type PACKET_IN, length 125, xid 0x00000000
21:28:42.079471 IP 192.168.1.30.49360 > 192.168.1.10.6633: Flags [P.], seq 1963:2088, ack 1, win 58, options [nop,nop,TS val 21917419 ecr 46590321], length 125: OpenFlow
	version 1.0, type PACKET_IN, length 125, xid 0x00000000
21:28:42.079486 IP 192.168.1.30.49360 > 192.168.1.10.6633: Flags [P.], seq 2088:2213, ack 1, win 58, options [nop,nop,TS val 21917419 ecr 46590321], length 125: OpenFlow
	version 1.0, type PACKET_IN, length 125, xid 0x00000000
21:28:42.079502 IP 192.168.1.30.49360 > 192.168.1.10.6633: Flags [P.], seq 2213:2338, ack 1, win 58, options [nop,nop,TS val 21917419 ecr 46590321], length 125: OpenFlow
	version 1.0, type PACKET_IN, length 125, xid 0x00000000
21:28:42.079516 IP 192.168.1.30.49360 > 192.168.1.10.6633: Flags [P.], seq 2338:2463, ack 1, win 58, options [nop,nop,TS val 21917419 ecr 46590321], length 125: OpenFlow
	version 1.0, type PACKET_IN, length 125, xid 0x00000000
21:28:42.079530 IP 192.168.1.30.49360 > 192.168.1.10.6633: Flags [P.], seq 2463:2588, ack 1, win 58, options [nop,nop,TS val 21917419 ecr 46590321], length 125: OpenFlow
	version 1.0, type PACKET_IN, length 125, xid 0x00000000
21:28:42.079545 IP 192.168.1.30.49360 > 192.168.1.10.6633: Flags [P.], seq 2588:2713, ack 1, win 58, options [nop,nop,TS val 21917419 ecr 46590321], length 125: OpenFlow
	version 1.0, type PACKET_IN, length 125, xid 0x00000000
21:28:42.079559 IP 192.168.1.30.49360 > 192.168.1.10.6633: Flags [P.], seq 2713:2838, ack 1, win 58, options [nop,nop,TS val 21917419 ecr 46590321], length 125: OpenFlow
	version 1.0, type PACKET_IN, length 125, xid 0x00000000
21:28:42.079574 IP 192.168.1.30.49360 > 192.168.1.10.6633: Flags [P.], seq 2838:2963, ack 1, win 58, options [nop,nop,TS val 21917419 ecr 46590321], length 125: OpenFlow
	version 1.0, type PACKET_IN, length 125, xid 0x00000000
21:28:42.079589 IP 192.168.1.30.49360 > 192.168.1.10.6633: Flags [P.], seq 2963:3088, ack 1, win 58, options [nop,nop,TS val 21917419 ecr 46590321], length 125: OpenFlow
	version 1.0, type PACKET_IN, length 125, xid 0x00000000
21:28:42.079603 IP 192.168.1.30.49360 > 192.168.1.10.6633: Flags [P.], seq 3088:3213, ack 1, win 58, options [nop,nop,TS val 21917419 ecr 46590321], length 125: OpenFlow
	version 1.0, type PACKET_IN, length 125, xid 0x00000000
21:28:42.079619 IP 192.168.1.30.49360 > 192.168.1.10.6633: Flags [P.], seq 3213:3338, ack 1, win 58, options [nop,nop,TS val 21917419 ecr 46590321], length 125: OpenFlow
	version 1.0, type PACKET_IN, length 125, xid 0x00000000
21:28:42.079633 IP 192.168.1.30.49360 > 192.168.1.10.6633: Flags [P.], seq 3338:3463, ack 1, win 58, options [nop,nop,TS val 21917419 ecr 46590321], length 125: OpenFlow
	version 1.0, type PACKET_IN, length 125, xid 0x00000000
21:28:42.079647 IP 192.168.1.30.49360 > 192.168.1.10.6633: Flags [P.], seq 3463:3588, ack 1, win 58, options [nop,nop,TS val 21917419 ecr 46590321], length 125: OpenFlow
	version 1.0, type PACKET_IN, length 125, xid 0x00000000
21:28:42.079661 IP 192.168.1.30.49360 > 192.168.1.10.6633: Flags [P.], seq 3588:3713, ack 1, win 58, options [nop,nop,TS val 21917419 ecr 46590321], length 125: OpenFlow
	version 1.0, type PACKET_IN, length 125, xid 0x00000000
21:28:42.079675 IP 192.168.1.30.49360 > 192.168.1.10.6633: Flags [P.], seq 3713:3838, ack 1, win 58, options [nop,nop,TS val 21917419 ecr 46590321], length 125: OpenFlow
	version 1.0, type PACKET_IN, length 125, xid 0x00000000
21:28:42.079697 IP 192.168.1.30.49360 > 192.168.1.10.6633: Flags [P.], seq 3838:3963, ack 1, win 58, options [nop,nop,TS val 21917419 ecr 46590321], length 125: OpenFlow
	version 1.0, type PACKET_IN, length 125, xid 0x00000000
21:28:42.079711 IP 192.168.1.30.49360 > 192.168.1.10.6633: Flags [P.], seq 3963:4088, ack 1, win 58, options [nop,nop,TS val 21917419 ecr 46590321], length 125: OpenFlow
	version 1.0, type PACKET_IN, length 125, xid 0x00000000
21:28:42.079726 IP 192.168.1.30.49360 > 192.168.1.10.6633: Flags [P.], seq 4088:4213, ack 1, win 58, options [nop,nop,TS val 21917419 ecr 46590321], length 125: OpenFlow
	version 1.0, type PACKET_IN, length 125, xid 0x00000000
21:28:42.079740 IP 192.168.1.30.49360 > 192.168.1.10.6633: Flags [P.], seq 4213:4338, ack 1, win 58, options [nop,nop,TS val 21917419 ecr 46590321], length 125: OpenFlow
	version 1.0, type PACKET_IN, length 125, xid 0x00000000
21:28:42.079757 IP 192.168.1.30.49360 > 192.168.1.10.6633: Flags [P.], seq 4338:4463, ack 1, win 58, options [nop,nop,TS val 21917419 ecr 46590321], length 125: OpenFlow
	version 1.0, type PACKET_IN, length 125, xid 0x00000000
21:28:42.079772 IP 192.168.1.30.49360 > 192.168.1.10.6633: Flags [P.], seq 4463:4588, ack 1, win 58, options [nop,nop,TS val 21917419 ecr 46590321], length 125: OpenFlow
	version 1.0, type PACKET_IN, length 125, xid 0x00000000
21:28:42.079785 IP 192.168.1.30.49360 > 192.168.1.10.6633: Flags [P.], seq 4588:4713, ack 1, win 58, options [nop,nop,TS val 21917419 ecr 46590321], length 125: OpenFlow
	version 1.0, type PACKET_IN, length 125, xid 0x00000000
21:28:42.079805 IP 192.168.1.30.49360 > 192.168.1.10.6633: Flags [P.], seq 4713:4838, ack 1, win 58, options [nop,nop,TS val 21917419 ecr 46590321], length 125: OpenFlow
	version 1.0, type PACKET_IN, length 125, xid 0x00000000
21:28:42.079819 IP 192.168.1.30.49360 > 192.168.1.10.6633: Flags [P.], seq 4838:4963, ack 1, win 58, options [nop,nop,TS val 21917419 ecr 46590321], length 125: OpenFlow
	version 1.0, type PACKET_IN, length 125, xid 0x00000000
21:28:42.080096 IP 192.168.1.10.6633 > 192.168.1.30.49360: Flags [.], ack 375, win 10675, options [nop,nop,TS val 46590330 ecr 21917419], length 0
21:28:42.080108 IP 192.168.1.10.6633 > 192.168.1.30.49360: Flags [.], ack 1088, win 10675, options [nop,nop,TS val 46590330 ecr 21917419], length 0
21:28:42.080116 IP 192.168.1.10.6633 > 192.168.1.30.49360: Flags [.], ack 1838, win 10675, options [nop,nop,TS val 46590330 ecr 21917419], length 0
21:28:42.080124 IP 192.168.1.10.6633 > 192.168.1.30.49360: Flags [.], ack 2088, win 10675, options [nop,nop,TS val 46590330 ecr 21917419], length 0
21:28:42.080140 IP 192.168.1.10.6633 > 192.168.1.30.49360: Flags [.], ack 3588, win 10675, options [nop,nop,TS val 46590330 ecr 21917419], length 0
21:28:42.080149 IP 192.168.1.10.6633 > 192.168.1.30.49360: Flags [.], ack 4963, win 10675, options [nop,nop,TS val 46590330 ecr 21917419], length 0
21:28:42.080763 IP 192.168.1.30.49360 > 192.168.1.10.6633: Flags [P.], seq 4963:5713, ack 1, win 58, options [nop,nop,TS val 21917419 ecr 46590330], length 750: OpenFlow
	version 1.0, type PACKET_IN, length 125, xid 0x00000000
	version 1.0, type PACKET_IN, length 125, xid 0x00000000
	version 1.0, type PACKET_IN, length 125, xid 0x00000000
	version 1.0, type PACKET_IN, length 125, xid 0x00000000
	version 1.0, type PACKET_IN, length 125, xid 0x00000000
	version 1.0, type PACKET_IN, length 125, xid 0x00000000
21:28:42.081554 IP 192.168.1.10.6633 > 192.168.1.30.49360: Flags [.], ack 5713, win 10675, options [nop,nop,TS val 46590331 ecr 21917419], length 0
21:28:42.112444 IP 192.168.1.30.49360 > 192.168.1.10.6633: Flags [P.], seq 5713:5838, ack 1, win 58, options [nop,nop,TS val 21917427 ecr 46590331], length 125: OpenFlow
	version 1.0, type PACKET_IN, length 125, xid 0x00000000
21:28:42.112469 IP 192.168.1.30.49360 > 192.168.1.10.6633: Flags [P.], seq 5838:5963, ack 1, win 58, options [nop,nop,TS val 21917427 ecr 46590331], length 125: OpenFlow
	version 1.0, type PACKET_IN, length 125, xid 0x00000000
21:28:42.112494 IP 192.168.1.30.49360 > 192.168.1.10.6633: Flags [P.], seq 5963:6088, ack 1, win 58, options [nop,nop,TS val 21917427 ecr 46590331], length 125: OpenFlow
	version 1.0, type PACKET_IN, length 125, xid 0x00000000
21:28:42.112523 IP 192.168.1.30.49360 > 192.168.1.10.6633: Flags [P.], seq 6088:6213, ack 1, win 58, options [nop,nop,TS val 21917427 ecr 46590331], length 125: OpenFlow
	version 1.0, type PACKET_IN, length 125, xid 0x00000000
21:28:42.112538 IP 192.168.1.30.49360 > 192.168.1.10.6633: Flags [P.], seq 6213:6338, ack 1, win 58, options [nop,nop,TS val 21917427 ecr 46590331], length 125: OpenFlow
	version 1.0, type PACKET_IN, length 125, xid 0x00000000
21:28:42.112551 IP 192.168.1.30.49360 > 192.168.1.10.6633: Flags [P.], seq 6338:6463, ack 1, win 58, options [nop,nop,TS val 21917427 ecr 46590331], length 125: OpenFlow
	version 1.0, type PACKET_IN, length 125, xid 0x00000000
21:28:42.112566 IP 192.168.1.30.49360 > 192.168.1.10.6633: Flags [P.], seq 6463:6588, ack 1, win 58, options [nop,nop,TS val 21917427 ecr 46590331], length 125: OpenFlow
	version 1.0, type PACKET_IN, length 125, xid 0x00000000
21:28:42.112580 IP 192.168.1.30.49360 > 192.168.1.10.6633: Flags [P.], seq 6588:6713, ack 1, win 58, options [nop,nop,TS val 21917427 ecr 46590331], length 125: OpenFlow
	version 1.0, type PACKET_IN, length 125, xid 0x00000000
21:28:42.112600 IP 192.168.1.30.49360 > 192.168.1.10.6633: Flags [P.], seq 6713:6838, ack 1, win 58, options [nop,nop,TS val 21917427 ecr 46590331], length 125: OpenFlow
	version 1.0, type PACKET_IN, length 125, xid 0x00000000
21:28:42.112644 IP 192.168.1.30.49360 > 192.168.1.10.6633: Flags [P.], seq 6838:6963, ack 1, win 58, options [nop,nop,TS val 21917427 ecr 46590331], length 125: OpenFlow
	version 1.0, type PACKET_IN, length 125, xid 0x00000000
21:28:42.112683 IP 192.168.1.30.49360 > 192.168.1.10.6633: Flags [P.], seq 6963:7088, ack 1, win 58, options [nop,nop,TS val 21917427 ecr 46590331], length 125: OpenFlow
	version 1.0, type PACKET_IN, length 125, xid 0x00000000
21:28:42.112712 IP 192.168.1.30.49360 > 192.168.1.10.6633: Flags [P.], seq 7088:7213, ack 1, win 58, options [nop,nop,TS val 21917427 ecr 46590331], length 125: OpenFlow
	version 1.0, type PACKET_IN, length 125, xid 0x00000000
21:28:42.112741 IP 192.168.1.30.49360 > 192.168.1.10.6633: Flags [P.], seq 7213:7338, ack 1, win 58, options [nop,nop,TS val 21917427 ecr 46590331], length 125: OpenFlow
	version 1.0, type PACKET_IN, length 125, xid 0x00000000
21:28:42.112772 IP 192.168.1.30.49360 > 192.168.1.10.6633: Flags [P.], seq 7338:7463, ack 1, win 58, options [nop,nop,TS val 21917427 ecr 46590331], length 125: OpenFlow
	version 1.0, type PACKET_IN, length 125, xid 0x00000000
21:28:42.112800 IP 192.168.1.30.49360 > 192.168.1.10.6633: Flags [P.], seq 7463:7551, ack 1, win 58, options [nop,nop,TS val 21917427 ecr 46590331], length 88: OpenFlow
	version 1.0, type PACKET_IN, length 88, xid 0x00000000
21:28:42.112827 IP 192.168.1.30.49360 > 192.168.1.10.6633: Flags [P.], seq 7551:7676, ack 1, win 58, options [nop,nop,TS val 21917427 ecr 46590331], length 125: OpenFlow
	version 1.0, type PACKET_IN, length 125, xid 0x00000000
21:28:42.112855 IP 192.168.1.30.49360 > 192.168.1.10.6633: Flags [P.], seq 7676:7801, ack 1, win 58, options [nop,nop,TS val 21917427 ecr 46590331], length 125: OpenFlow
	version 1.0, type PACKET_IN, length 125, xid 0x00000000
21:28:42.112887 IP 192.168.1.30.49360 > 192.168.1.10.6633: Flags [P.], seq 7801:7926, ack 1, win 58, options [nop,nop,TS val 21917427 ecr 46590331], length 125: OpenFlow
	version 1.0, type PACKET_IN, length 125, xid 0x00000000
21:28:42.112915 IP 192.168.1.30.49360 > 192.168.1.10.6633: Flags [P.], seq 7926:8051, ack 1, win 58, options [nop,nop,TS val 21917427 ecr 46590331], length 125: OpenFlow
	version 1.0, type PACKET_IN, length 125, xid 0x00000000
21:28:42.112944 IP 192.168.1.30.49360 > 192.168.1.10.6633: Flags [P.], seq 8051:8176, ack 1, win 58, options [nop,nop,TS val 21917427 ecr 46590331], length 125: OpenFlow
	version 1.0, type PACKET_IN, length 125, xid 0x00000000
21:28:42.112976 IP 192.168.1.30.49360 > 192.168.1.10.6633: Flags [P.], seq 8176:8301, ack 1, win 58, options [nop,nop,TS val 21917427 ecr 46590331], length 125: OpenFlow
	version 1.0, type PACKET_IN, length 125, xid 0x00000000
21:28:42.113007 IP 192.168.1.30.49360 > 192.168.1.10.6633: Flags [P.], seq 8301:8426, ack 1, win 58, options [nop,nop,TS val 21917427 ecr 46590331], length 125: OpenFlow
	version 1.0, type PACKET_IN, length 125, xid 0x00000000
21:28:42.113072 IP 192.168.1.30.49360 > 192.168.1.10.6633: Flags [P.], seq 8426:8551, ack 1, win 58, options [nop,nop,TS val 21917427 ecr 46590331], length 125: OpenFlow
	version 1.0, type PACKET_IN, length 125, xid 0x00000000
21:28:42.113122 IP 192.168.1.10.6633 > 192.168.1.30.49360: Flags [.], ack 7088, win 10675, options [nop,nop,TS val 46590338 ecr 21917427], length 0
21:28:42.113140 IP 192.168.1.30.49360 > 192.168.1.10.6633: Flags [P.], seq 8551:8676, ack 1, win 58, options [nop,nop,TS val 21917427 ecr 46590338], length 125: OpenFlow
	version 1.0, type PACKET_IN, length 125, xid 0x00000000
21:28:42.113173 IP 192.168.1.30.49360 > 192.168.1.10.6633: Flags [P.], seq 8676:8801, ack 1, win 58, options [nop,nop,TS val 21917427 ecr 46590338], length 125: OpenFlow
	version 1.0, type PACKET_IN, length 125, xid 0x00000000
21:28:42.113205 IP 192.168.1.30.49360 > 192.168.1.10.6633: Flags [P.], seq 8801:8926, ack 1, win 58, options [nop,nop,TS val 21917427 ecr 46590338], length 125: OpenFlow
	version 1.0, type PACKET_IN, length 125, xid 0x00000000
21:28:42.113220 IP 192.168.1.30.49360 > 192.168.1.10.6633: Flags [P.], seq 8926:9051, ack 1, win 58, options [nop,nop,TS val 21917427 ecr 46590338], length 125: OpenFlow
	version 1.0, type PACKET_IN, length 125, xid 0x00000000
21:28:42.113234 IP 192.168.1.30.49360 > 192.168.1.10.6633: Flags [P.], seq 9051:9176, ack 1, win 58, options [nop,nop,TS val 21917428 ecr 46590338], length 125: OpenFlow
	version 1.0, type PACKET_IN, length 125, xid 0x00000000
21:28:42.113248 IP 192.168.1.30.49360 > 192.168.1.10.6633: Flags [P.], seq 9176:9301, ack 1, win 58, options [nop,nop,TS val 21917428 ecr 46590338], length 125: OpenFlow
	version 1.0, type PACKET_IN, length 125, xid 0x00000000
21:28:42.113535 IP 192.168.1.30.49360 > 192.168.1.10.6633: Flags [P.], seq 9301:9426, ack 1, win 58, options [nop,nop,TS val 21917428 ecr 46590338], length 125: OpenFlow
	version 1.0, type PACKET_IN, length 125, xid 0x00000000
21:28:42.113549 IP 192.168.1.30.49360 > 192.168.1.10.6633: Flags [P.], seq 9426:9551, ack 1, win 58, options [nop,nop,TS val 21917428 ecr 46590338], length 125: OpenFlow
	version 1.0, type PACKET_IN, length 125, xid 0x00000000
21:28:42.113563 IP 192.168.1.30.49360 > 192.168.1.10.6633: Flags [P.], seq 9551:9676, ack 1, win 58, options [nop,nop,TS val 21917428 ecr 46590338], length 125: OpenFlow
	version 1.0, type PACKET_IN, length 125, xid 0x00000000
21:28:42.113577 IP 192.168.1.30.49360 > 192.168.1.10.6633: Flags [P.], seq 9676:9801, ack 1, win 58, options [nop,nop,TS val 21917428 ecr 46590338], length 125: OpenFlow
	version 1.0, type PACKET_IN, length 125, xid 0x00000000
21:28:42.113590 IP 192.168.1.30.49360 > 192.168.1.10.6633: Flags [P.], seq 9801:9926, ack 1, win 58, options [nop,nop,TS val 21917428 ecr 46590338], length 125: OpenFlow
	version 1.0, type PACKET_IN, length 125, xid 0x00000000
21:28:42.113604 IP 192.168.1.30.49360 > 192.168.1.10.6633: Flags [P.], seq 9926:10051, ack 1, win 58, options [nop,nop,TS val 21917428 ecr 46590338], length 125: OpenFlow
	version 1.0, type PACKET_IN, length 125, xid 0x00000000
21:28:42.113618 IP 192.168.1.30.49360 > 192.168.1.10.6633: Flags [P.], seq 10051:10176, ack 1, win 58, options [nop,nop,TS val 21917428 ecr 46590338], length 125: OpenFlow
	version 1.0, type PACKET_IN, length 125, xid 0x00000000
21:28:42.113631 IP 192.168.1.30.49360 > 192.168.1.10.6633: Flags [P.], seq 10176:10301, ack 1, win 58, options [nop,nop,TS val 21917428 ecr 46590338], length 125: OpenFlow
	version 1.0, type PACKET_IN, length 125, xid 0x00000000
21:28:42.113751 IP 192.168.1.30.49360 > 192.168.1.10.6633: Flags [P.], seq 10301:10426, ack 1, win 58, options [nop,nop,TS val 21917428 ecr 46590338], length 125: OpenFlow
	version 1.0, type PACKET_IN, length 125, xid 0x00000000
21:28:42.113766 IP 192.168.1.30.49360 > 192.168.1.10.6633: Flags [P.], seq 10426:10551, ack 1, win 58, options [nop,nop,TS val 21917428 ecr 46590338], length 125: OpenFlow
	version 1.0, type PACKET_IN, length 125, xid 0x00000000
21:28:42.113883 IP 192.168.1.30.49360 > 192.168.1.10.6633: Flags [P.], seq 10551:10676, ack 1, win 58, options [nop,nop,TS val 21917428 ecr 46590338], length 125: OpenFlow
	version 1.0, type PACKET_IN, length 125, xid 0x00000000
21:28:42.113897 IP 192.168.1.30.49360 > 192.168.1.10.6633: Flags [P.], seq 10676:10801, ack 1, win 58, options [nop,nop,TS val 21917428 ecr 46590338], length 125: OpenFlow
	version 1.0, type PACKET_IN, length 125, xid 0x00000000
21:28:42.114006 IP 192.168.1.30.49360 > 192.168.1.10.6633: Flags [P.], seq 10801:10926, ack 1, win 58, options [nop,nop,TS val 21917428 ecr 46590338], length 125: OpenFlow
	version 1.0, type PACKET_IN, length 125, xid 0x00000000
21:28:42.114021 IP 192.168.1.30.49360 > 192.168.1.10.6633: Flags [P.], seq 10926:11051, ack 1, win 58, options [nop,nop,TS val 21917428 ecr 46590338], length 125: OpenFlow
	version 1.0, type PACKET_IN, length 125, xid 0x00000000
21:28:42.114128 IP 192.168.1.30.49360 > 192.168.1.10.6633: Flags [P.], seq 11051:11176, ack 1, win 58, options [nop,nop,TS val 21917428 ecr 46590338], length 125: OpenFlow
	version 1.0, type PACKET_IN, length 125, xid 0x00000000
21:28:42.114143 IP 192.168.1.30.49360 > 192.168.1.10.6633: Flags [P.], seq 11176:11301, ack 1, win 58, options [nop,nop,TS val 21917428 ecr 46590338], length 125: OpenFlow
	version 1.0, type PACKET_IN, length 125, xid 0x00000000
21:28:42.114855 IP 192.168.1.10.6633 > 192.168.1.30.49360: Flags [.], ack 8051, win 10675, options [nop,nop,TS val 46590339 ecr 21917427], length 0
21:28:42.114879 IP 192.168.1.10.6633 > 192.168.1.30.49360: Flags [.], ack 8426, win 10675, options [nop,nop,TS val 46590339 ecr 21917427], length 0
21:28:42.114887 IP 192.168.1.10.6633 > 192.168.1.30.49360: Flags [.], ack 9301, win 10675, options [nop,nop,TS val 46590339 ecr 21917427], length 0
21:28:42.114922 IP 192.168.1.10.6633 > 192.168.1.30.49360: Flags [.], ack 9426, win 10675, options [nop,nop,TS val 46590339 ecr 21917428], length 0
21:28:42.114929 IP 192.168.1.10.6633 > 192.168.1.30.49360: Flags [.], ack 10301, win 10675, options [nop,nop,TS val 46590339 ecr 21917428], length 0
21:28:42.114937 IP 192.168.1.10.6633 > 192.168.1.30.49360: Flags [.], ack 10426, win 10675, options [nop,nop,TS val 46590339 ecr 21917428], length 0
21:28:42.114944 IP 192.168.1.10.6633 > 192.168.1.30.49360: Flags [.], ack 10676, win 10675, options [nop,nop,TS val 46590339 ecr 21917428], length 0
21:28:42.114951 IP 192.168.1.10.6633 > 192.168.1.30.49360: Flags [.], ack 11051, win 10675, options [nop,nop,TS val 46590339 ecr 21917428], length 0
21:28:42.114959 IP 192.168.1.10.6633 > 192.168.1.30.49360: Flags [.], ack 11301, win 10675, options [nop,nop,TS val 46590339 ecr 21917428], length 0
21:28:42.139848 IP 192.168.1.30.49360 > 192.168.1.10.6633: Flags [P.], seq 11301:11426, ack 1, win 58, options [nop,nop,TS val 21917431 ecr 46590339], length 125: OpenFlow
	version 1.0, type PACKET_IN, length 125, xid 0x00000000
21:28:42.139867 IP 192.168.1.30.49360 > 192.168.1.10.6633: Flags [P.], seq 11426:11551, ack 1, win 58, options [nop,nop,TS val 21917431 ecr 46590339], length 125: OpenFlow
	version 1.0, type PACKET_IN, length 125, xid 0x00000000
21:28:42.139882 IP 192.168.1.30.49360 > 192.168.1.10.6633: Flags [P.], seq 11551:11676, ack 1, win 58, options [nop,nop,TS val 21917431 ecr 46590339], length 125: OpenFlow
	version 1.0, type PACKET_IN, length 125, xid 0x00000000
21:28:42.139896 IP 192.168.1.30.49360 > 192.168.1.10.6633: Flags [P.], seq 11676:11801, ack 1, win 58, options [nop,nop,TS val 21917431 ecr 46590339], length 125: OpenFlow
	version 1.0, type PACKET_IN, length 125, xid 0x00000000
21:28:42.139910 IP 192.168.1.30.49360 > 192.168.1.10.6633: Flags [P.], seq 11801:11926, ack 1, win 58, options [nop,nop,TS val 21917431 ecr 46590339], length 125: OpenFlow
	version 1.0, type PACKET_IN, length 125, xid 0x00000000
21:28:42.139924 IP 192.168.1.30.49360 > 192.168.1.10.6633: Flags [P.], seq 11926:12051, ack 1, win 58, options [nop,nop,TS val 21917431 ecr 46590339], length 125: OpenFlow
	version 1.0, type PACKET_IN, length 125, xid 0x00000000
21:28:42.139939 IP 192.168.1.30.49360 > 192.168.1.10.6633: Flags [P.], seq 12051:12176, ack 1, win 58, options [nop,nop,TS val 21917431 ecr 46590339], length 125: OpenFlow
	version 1.0, type PACKET_IN, length 125, xid 0x00000000
21:28:42.139960 IP 192.168.1.30.49360 > 192.168.1.10.6633: Flags [P.], seq 12176:12301, ack 1, win 58, options [nop,nop,TS val 21917431 ecr 46590339], length 125: OpenFlow
	version 1.0, type PACKET_IN, length 125, xid 0x00000000
21:28:42.139975 IP 192.168.1.30.49360 > 192.168.1.10.6633: Flags [P.], seq 12301:12426, ack 1, win 58, options [nop,nop,TS val 21917431 ecr 46590339], length 125: OpenFlow
	version 1.0, type PACKET_IN, length 125, xid 0x00000000
21:28:42.139991 IP 192.168.1.30.49360 > 192.168.1.10.6633: Flags [P.], seq 12426:12551, ack 1, win 58, options [nop,nop,TS val 21917431 ecr 46590339], length 125: OpenFlow
	version 1.0, type PACKET_IN, length 125, xid 0x00000000
21:28:42.140006 IP 192.168.1.30.49360 > 192.168.1.10.6633: Flags [P.], seq 12551:12676, ack 1, win 58, options [nop,nop,TS val 21917431 ecr 46590339], length 125: OpenFlow
	version 1.0, type PACKET_IN, length 125, xid 0x00000000
21:28:42.140020 IP 192.168.1.30.49360 > 192.168.1.10.6633: Flags [P.], seq 12676:12801, ack 1, win 58, options [nop,nop,TS val 21917431 ecr 46590339], length 125: OpenFlow
	version 1.0, type PACKET_IN, length 125, xid 0x00000000
21:28:42.140035 IP 192.168.1.30.49360 > 192.168.1.10.6633: Flags [P.], seq 12801:12926, ack 1, win 58, options [nop,nop,TS val 21917431 ecr 46590339], length 125: OpenFlow
	version 1.0, type PACKET_IN, length 125, xid 0x00000000
21:28:42.140051 IP 192.168.1.30.49360 > 192.168.1.10.6633: Flags [P.], seq 12926:13051, ack 1, win 58, options [nop,nop,TS val 21917431 ecr 46590339], length 125: OpenFlow
	version 1.0, type PACKET_IN, length 125, xid 0x00000000
21:28:42.140071 IP 192.168.1.30.49360 > 192.168.1.10.6633: Flags [P.], seq 13051:13176, ack 1, win 58, options [nop,nop,TS val 21917431 ecr 46590339], length 125: OpenFlow
	version 1.0, type PACKET_IN, length 125, xid 0x00000000
21:28:42.140088 IP 192.168.1.30.49360 > 192.168.1.10.6633: Flags [P.], seq 13176:13301, ack 1, win 58, options [nop,nop,TS val 21917431 ecr 46590339], length 125: OpenFlow
	version 1.0, type PACKET_IN, length 125, xid 0x00000000
21:28:42.140103 IP 192.168.1.30.49360 > 192.168.1.10.6633: Flags [P.], seq 13301:13426, ack 1, win 58, options [nop,nop,TS val 21917431 ecr 46590339], length 125: OpenFlow
	version 1.0, type PACKET_IN, length 125, xid 0x00000000
21:28:42.140118 IP 192.168.1.30.49360 > 192.168.1.10.6633: Flags [P.], seq 13426:13551, ack 1, win 58, options [nop,nop,TS val 21917431 ecr 46590339], length 125: OpenFlow
	version 1.0, type PACKET_IN, length 125, xid 0x00000000
21:28:42.140133 IP 192.168.1.30.49360 > 192.168.1.10.6633: Flags [P.], seq 13551:13676, ack 1, win 58, options [nop,nop,TS val 21917431 ecr 46590339], length 125: OpenFlow
	version 1.0, type PACKET_IN, length 125, xid 0x00000000
21:28:42.140416 IP 192.168.1.10.6633 > 192.168.1.30.49360: Flags [.], ack 12801, win 10675, options [nop,nop,TS val 46590345 ecr 21917431], length 0
21:28:42.142885 IP 192.168.1.10.6633 > 192.168.1.30.49360: Flags [.], ack 13676, win 10675, options [nop,nop,TS val 46590346 ecr 21917431], length 0
21:28:42.144829 IP 192.168.1.30.49360 > 192.168.1.10.6633: Flags [P.], seq 13551:13676, ack 1, win 58, options [nop,nop,TS val 21917434 ecr 46590339], length 125: OpenFlow
	version 1.0, type PACKET_IN, length 125, xid 0x00000000
21:28:42.145150 IP 192.168.1.10.6633 > 192.168.1.30.49360: Flags [.], ack 13676, win 10675, options [nop,nop,TS val 46590347 ecr 21917434,nop,nop,sack 1 {13551:13676}], length 0
21:28:42.183710 IP 192.168.1.30.49360 > 192.168.1.10.6633: Flags [P.], seq 13676:13801, ack 1, win 58, options [nop,nop,TS val 21917445 ecr 46590347], length 125: OpenFlow
	version 1.0, type PACKET_IN, length 125, xid 0x00000000
21:28:42.183748 IP 192.168.1.30.49360 > 192.168.1.10.6633: Flags [P.], seq 13801:13926, ack 1, win 58, options [nop,nop,TS val 21917445 ecr 46590347], length 125: OpenFlow
	version 1.0, type PACKET_IN, length 125, xid 0x00000000
21:28:42.183813 IP 192.168.1.30.49360 > 192.168.1.10.6633: Flags [P.], seq 13926:14051, ack 1, win 58, options [nop,nop,TS val 21917445 ecr 46590347], length 125: OpenFlow
	version 1.0, type PACKET_IN, length 125, xid 0x00000000
21:28:42.183887 IP 192.168.1.30.49360 > 192.168.1.10.6633: Flags [P.], seq 14051:14176, ack 1, win 58, options [nop,nop,TS val 21917445 ecr 46590347], length 125: OpenFlow
	version 1.0, type PACKET_IN, length 125, xid 0x00000000
21:28:42.183907 IP 192.168.1.10.6633 > 192.168.1.30.49360: Flags [.], ack 13801, win 10675, options [nop,nop,TS val 46590356 ecr 21917445], length 0
21:28:42.183923 IP 192.168.1.30.49360 > 192.168.1.10.6633: Flags [P.], seq 14176:14301, ack 1, win 58, options [nop,nop,TS val 21917445 ecr 46590356], length 125: OpenFlow
	version 1.0, type PACKET_IN, length 125, xid 0x00000000
21:28:42.183956 IP 192.168.1.30.49360 > 192.168.1.10.6633: Flags [P.], seq 14301:14426, ack 1, win 58, options [nop,nop,TS val 21917445 ecr 46590356], length 125: OpenFlow
	version 1.0, type PACKET_IN, length 125, xid 0x00000000
21:28:42.183989 IP 192.168.1.30.49360 > 192.168.1.10.6633: Flags [P.], seq 14426:14551, ack 1, win 58, options [nop,nop,TS val 21917445 ecr 46590356], length 125: OpenFlow
	version 1.0, type PACKET_IN, length 125, xid 0x00000000
21:28:42.184092 IP 192.168.1.30.49360 > 192.168.1.10.6633: Flags [P.], seq 14551:14676, ack 1, win 58, options [nop,nop,TS val 21917445 ecr 46590356], length 125: OpenFlow
	version 1.0, type PACKET_IN, length 125, xid 0x00000000
21:28:42.184158 IP 192.168.1.30.49360 > 192.168.1.10.6633: Flags [P.], seq 14676:14801, ack 1, win 58, options [nop,nop,TS val 21917445 ecr 46590356], length 125: OpenFlow
	version 1.0, type PACKET_IN, length 125, xid 0x00000000
21:28:42.184215 IP 192.168.1.30.49360 > 192.168.1.10.6633: Flags [P.], seq 14801:14926, ack 1, win 58, options [nop,nop,TS val 21917445 ecr 46590356], length 125: OpenFlow
	version 1.0, type PACKET_IN, length 125, xid 0x00000000
21:28:42.184248 IP 192.168.1.30.49360 > 192.168.1.10.6633: Flags [P.], seq 14926:15051, ack 1, win 58, options [nop,nop,TS val 21917445 ecr 46590356], length 125: OpenFlow
	version 1.0, type PACKET_IN, length 125, xid 0x00000000
21:28:42.184277 IP 192.168.1.30.49360 > 192.168.1.10.6633: Flags [P.], seq 15051:15176, ack 1, win 58, options [nop,nop,TS val 21917445 ecr 46590356], length 125: OpenFlow
	version 1.0, type PACKET_IN, length 125, xid 0x00000000
21:28:42.184296 IP 192.168.1.30.49360 > 192.168.1.10.6633: Flags [P.], seq 15176:15301, ack 1, win 58, options [nop,nop,TS val 21917445 ecr 46590356], length 125: OpenFlow
	version 1.0, type PACKET_IN, length 125, xid 0x00000000
21:28:42.184297 IP 192.168.1.10.6633 > 192.168.1.30.49360: Flags [.], ack 13926, win 10675, options [nop,nop,TS val 46590356 ecr 21917445], length 0
21:28:42.184314 IP 192.168.1.30.49360 > 192.168.1.10.6633: Flags [P.], seq 15301:15426, ack 1, win 58, options [nop,nop,TS val 21917445 ecr 46590356], length 125: OpenFlow
	version 1.0, type PACKET_IN, length 125, xid 0x00000000
21:28:42.184323 IP 192.168.1.10.6633 > 192.168.1.30.49360: Flags [.], ack 14051, win 10675, options [nop,nop,TS val 46590356 ecr 21917445], length 0
21:28:42.184335 IP 192.168.1.10.6633 > 192.168.1.30.49360: Flags [.], ack 14176, win 10675, options [nop,nop,TS val 46590356 ecr 21917445], length 0
21:28:42.184343 IP 192.168.1.10.6633 > 192.168.1.30.49360: Flags [.], ack 14301, win 10675, options [nop,nop,TS val 46590356 ecr 21917445], length 0
21:28:42.184348 IP 192.168.1.30.49360 > 192.168.1.10.6633: Flags [P.], seq 15426:15551, ack 1, win 58, options [nop,nop,TS val 21917445 ecr 46590356], length 125: OpenFlow
	version 1.0, type PACKET_IN, length 125, xid 0x00000000
21:28:42.184350 IP 192.168.1.10.6633 > 192.168.1.30.49360: Flags [.], ack 14426, win 10675, options [nop,nop,TS val 46590356 ecr 21917445], length 0
21:28:42.184356 IP 192.168.1.10.6633 > 192.168.1.30.49360: Flags [.], ack 14551, win 10675, options [nop,nop,TS val 46590356 ecr 21917445], length 0
21:28:42.184366 IP 192.168.1.10.6633 > 192.168.1.30.49360: Flags [.], ack 14676, win 10675, options [nop,nop,TS val 46590356 ecr 21917445], length 0
21:28:42.184447 IP 192.168.1.30.49360 > 192.168.1.10.6633: Flags [P.], seq 15551:15676, ack 1, win 58, options [nop,nop,TS val 21917445 ecr 46590356], length 125: OpenFlow
	version 1.0, type PACKET_IN, length 125, xid 0x00000000
21:28:42.184528 IP 192.168.1.30.49360 > 192.168.1.10.6633: Flags [P.], seq 15676:15801, ack 1, win 58, options [nop,nop,TS val 21917445 ecr 46590356], length 125: OpenFlow
	version 1.0, type PACKET_IN, length 125, xid 0x00000000
21:28:42.184552 IP 192.168.1.10.6633 > 192.168.1.30.49360: Flags [.], ack 14801, win 10675, options [nop,nop,TS val 46590356 ecr 21917445], length 0
21:28:42.184566 IP 192.168.1.10.6633 > 192.168.1.30.49360: Flags [.], ack 14926, win 10675, options [nop,nop,TS val 46590356 ecr 21917445], length 0
21:28:42.184569 IP 192.168.1.30.49360 > 192.168.1.10.6633: Flags [P.], seq 15801:15926, ack 1, win 58, options [nop,nop,TS val 21917445 ecr 46590356], length 125: OpenFlow
	version 1.0, type PACKET_IN, length 125, xid 0x00000000
21:28:42.184573 IP 192.168.1.10.6633 > 192.168.1.30.49360: Flags [.], ack 15051, win 10675, options [nop,nop,TS val 46590356 ecr 21917445], length 0
21:28:42.184579 IP 192.168.1.10.6633 > 192.168.1.30.49360: Flags [.], ack 15176, win 10675, options [nop,nop,TS val 46590356 ecr 21917445], length 0
21:28:42.184588 IP 192.168.1.10.6633 > 192.168.1.30.49360: Flags [.], ack 15301, win 10675, options [nop,nop,TS val 46590356 ecr 21917445], length 0
21:28:42.184596 IP 192.168.1.10.6633 > 192.168.1.30.49360: Flags [.], ack 15426, win 10675, options [nop,nop,TS val 46590356 ecr 21917445], length 0
21:28:42.184604 IP 192.168.1.10.6633 > 192.168.1.30.49360: Flags [.], ack 15551, win 10675, options [nop,nop,TS val 46590356 ecr 21917445], length 0
21:28:42.184611 IP 192.168.1.30.49360 > 192.168.1.10.6633: Flags [P.], seq 15926:16051, ack 1, win 58, options [nop,nop,TS val 21917445 ecr 46590356], length 125: OpenFlow
	version 1.0, type PACKET_IN, length 125, xid 0x00000000
21:28:42.184697 IP 192.168.1.10.6633 > 192.168.1.30.49360: Flags [.], ack 15676, win 10675, options [nop,nop,TS val 46590356 ecr 21917445], length 0
21:28:42.184707 IP 192.168.1.30.49360 > 192.168.1.10.6633: Flags [P.], seq 16051:16176, ack 1, win 58, options [nop,nop,TS val 21917445 ecr 46590356], length 125: OpenFlow
	version 1.0, type PACKET_IN, length 125, xid 0x00000000
21:28:42.184741 IP 192.168.1.30.49360 > 192.168.1.10.6633: Flags [P.], seq 16176:16301, ack 1, win 58, options [nop,nop,TS val 21917445 ecr 46590356], length 125: OpenFlow
	version 1.0, type PACKET_IN, length 125, xid 0x00000000
21:28:42.184818 IP 192.168.1.30.49360 > 192.168.1.10.6633: Flags [P.], seq 16301:16426, ack 1, win 58, options [nop,nop,TS val 21917445 ecr 46590356], length 125: OpenFlow
	version 1.0, type PACKET_IN, length 125, xid 0x00000000
21:28:42.184877 IP 192.168.1.30.49360 > 192.168.1.10.6633: Flags [P.], seq 16426:16551, ack 1, win 58, options [nop,nop,TS val 21917445 ecr 46590356], length 125: OpenFlow
	version 1.0, type PACKET_IN, length 125, xid 0x00000000
21:28:42.184917 IP 192.168.1.30.49360 > 192.168.1.10.6633: Flags [P.], seq 16551:16676, ack 1, win 58, options [nop,nop,TS val 21917445 ecr 46590356], length 125: OpenFlow
	version 1.0, type PACKET_IN, length 125, xid 0x00000000
21:28:42.184955 IP 192.168.1.10.6633 > 192.168.1.30.49360: Flags [.], ack 16051, win 10675, options [nop,nop,TS val 46590356 ecr 21917445], length 0
21:28:42.184964 IP 192.168.1.10.6633 > 192.168.1.30.49360: Flags [.], ack 16301, win 10675, options [nop,nop,TS val 46590356 ecr 21917445], length 0
21:28:42.185001 IP 192.168.1.30.49360 > 192.168.1.10.6633: Flags [P.], seq 16676:16801, ack 1, win 58, options [nop,nop,TS val 21917445 ecr 46590356], length 125: OpenFlow
	version 1.0, type PACKET_IN, length 125, xid 0x00000000
21:28:42.185037 IP 192.168.1.30.49360 > 192.168.1.10.6633: Flags [P.], seq 16801:16926, ack 1, win 58, options [nop,nop,TS val 21917445 ecr 46590356], length 125: OpenFlow
	version 1.0, type PACKET_IN, length 125, xid 0x00000000
21:28:42.185109 IP 192.168.1.30.49360 > 192.168.1.10.6633: Flags [P.], seq 16926:17051, ack 1, win 58, options [nop,nop,TS val 21917445 ecr 46590356], length 125: OpenFlow
	version 1.0, type PACKET_IN, length 125, xid 0x00000000
21:28:42.185137 IP 192.168.1.30.49360 > 192.168.1.10.6633: Flags [P.], seq 17051:17176, ack 1, win 58, options [nop,nop,TS val 21917445 ecr 46590356], length 125: OpenFlow
	version 1.0, type PACKET_IN, length 125, xid 0x00000000
21:28:42.185159 IP 192.168.1.30.49360 > 192.168.1.10.6633: Flags [P.], seq 17176:17301, ack 1, win 58, options [nop,nop,TS val 21917445 ecr 46590356], length 125: OpenFlow
	version 1.0, type PACKET_IN, length 125, xid 0x00000000
21:28:42.185182 IP 192.168.1.30.49360 > 192.168.1.10.6633: Flags [P.], seq 17301:17426, ack 1, win 58, options [nop,nop,TS val 21917445 ecr 46590356], length 125: OpenFlow
	version 1.0, type PACKET_IN, length 125, xid 0x00000000
21:28:42.185266 IP 192.168.1.10.6633 > 192.168.1.30.49360: Flags [.], ack 16676, win 10675, options [nop,nop,TS val 46590357 ecr 21917445], length 0
21:28:42.185286 IP 192.168.1.10.6633 > 192.168.1.30.49360: Flags [.], ack 16801, win 10675, options [nop,nop,TS val 46590357 ecr 21917445], length 0
21:28:42.185312 IP 192.168.1.30.49360 > 192.168.1.10.6633: Flags [P.], seq 17426:17551, ack 1, win 58, options [nop,nop,TS val 21917446 ecr 46590357], length 125: OpenFlow
	version 1.0, type PACKET_IN, length 125, xid 0x00000000
21:28:42.185341 IP 192.168.1.30.49360 > 192.168.1.10.6633: Flags [P.], seq 17551:17676, ack 1, win 58, options [nop,nop,TS val 21917446 ecr 46590357], length 125: OpenFlow
	version 1.0, type PACKET_IN, length 125, xid 0x00000000
21:28:42.185359 IP 192.168.1.30.49360 > 192.168.1.10.6633: Flags [P.], seq 17676:17801, ack 1, win 58, options [nop,nop,TS val 21917446 ecr 46590357], length 125: OpenFlow
	version 1.0, type PACKET_IN, length 125, xid 0x00000000
21:28:42.185426 IP 192.168.1.30.49360 > 192.168.1.10.6633: Flags [P.], seq 17801:17926, ack 1, win 58, options [nop,nop,TS val 21917446 ecr 46590357], length 125: OpenFlow
	version 1.0, type PACKET_IN, length 125, xid 0x00000000
21:28:42.185461 IP 192.168.1.30.49360 > 192.168.1.10.6633: Flags [P.], seq 17926:18051, ack 1, win 58, options [nop,nop,TS val 21917446 ecr 46590357], length 125: OpenFlow
	version 1.0, type PACKET_IN, length 125, xid 0x00000000
21:28:42.185495 IP 192.168.1.30.49360 > 192.168.1.10.6633: Flags [P.], seq 18051:18176, ack 1, win 58, options [nop,nop,TS val 21917446 ecr 46590357], length 125: OpenFlow
	version 1.0, type PACKET_IN, length 125, xid 0x00000000
21:28:42.185528 IP 192.168.1.30.49360 > 192.168.1.10.6633: Flags [P.], seq 18176:18301, ack 1, win 58, options [nop,nop,TS val 21917446 ecr 46590357], length 125: OpenFlow
	version 1.0, type PACKET_IN, length 125, xid 0x00000000
21:28:42.185611 IP 192.168.1.30.49360 > 192.168.1.10.6633: Flags [P.], seq 18301:18426, ack 1, win 58, options [nop,nop,TS val 21917446 ecr 46590357], length 125: OpenFlow
	version 1.0, type PACKET_IN, length 125, xid 0x00000000
21:28:42.185645 IP 192.168.1.30.49360 > 192.168.1.10.6633: Flags [P.], seq 18426:18551, ack 1, win 58, options [nop,nop,TS val 21917446 ecr 46590357], length 125: OpenFlow
	version 1.0, type PACKET_IN, length 125, xid 0x00000000
21:28:42.185679 IP 192.168.1.30.49360 > 192.168.1.10.6633: Flags [P.], seq 18551:18676, ack 1, win 58, options [nop,nop,TS val 21917446 ecr 46590357], length 125: OpenFlow
	version 1.0, type PACKET_IN, length 125, xid 0x00000000
21:28:42.185713 IP 192.168.1.30.49360 > 192.168.1.10.6633: Flags [P.], seq 18676:18801, ack 1, win 58, options [nop,nop,TS val 21917446 ecr 46590357], length 125: OpenFlow
	version 1.0, type PACKET_IN, length 125, xid 0x00000000
21:28:42.185760 IP 192.168.1.10.6633 > 192.168.1.30.49360: Flags [.], ack 17426, win 10675, options [nop,nop,TS val 46590357 ecr 21917445], length 0
