21:28:42.058715 IP 192.168.1.30.49346 > 192.168.1.10.6633: Flags [P.], seq 2474383820:2474383945, ack 2734508296, win 58, options [nop,nop,TS val 21917414 ecr 46590317], length 125: OpenFlow
	version 1.0, type PACKET_IN, length 125, xid 0x00000000
21:28:42.058759 IP 192.168.1.30.49346 > 192.168.1.10.6633: Flags [P.], seq 125:250, ack 1, win 58, options [nop,nop,TS val 21917414 ecr 46590317], length 125: OpenFlow
	version 1.0, type PACKET_IN, length 125, xid 0x00000000
21:28:42.058792 IP 192.168.1.30.49346 > 192.168.1.10.6633: Flags [P.], seq 250:375, ack 1, win 58, options [nop,nop,TS val 21917414 ecr 46590317], length 125: OpenFlow
	version 1.0, type PACKET_IN, length 125, xid 0x00000000
21:28:42.058824 IP 192.168.1.30.49346 > 192.168.1.10.6633: Flags [P.], seq 375:500, ack 1, win 58, options [nop,nop,TS val 21917414 ecr 46590317], length 125: OpenFlow
	version 1.0, type PACKET_IN, length 125, xid 0x00000000
21:28:42.058855 IP 192.168.1.30.49346 > 192.168.1.10.6633: Flags [P.], seq 500:625, ack 1, win 58, options [nop,nop,TS val 21917414 ecr 46590317], length 125: OpenFlow
	version 1.0, type PACKET_IN, length 125, xid 0x00000000
21:28:42.058888 IP 192.168.1.30.49346 > 192.168.1.10.6633: Flags [P.], seq 625:750, ack 1, win 58, options [nop,nop,TS val 21917414 ecr 46590317], length 125: OpenFlow
	version 1.0, type PACKET_IN, length 125, xid 0x00000000
21:28:42.058918 IP 192.168.1.30.49346 > 192.168.1.10.6633: Flags [P.], seq 750:875, ack 1, win 58, options [nop,nop,TS val 21917414 ecr 46590317], length 125: OpenFlow
	version 1.0, type PACKET_IN, length 125, xid 0x00000000
21:28:42.058947 IP 192.168.1.30.49346 > 192.168.1.10.6633: Flags [P.], seq 875:1000, ack 1, win 58, options [nop,nop,TS val 21917414 ecr 46590317], length 125: OpenFlow
	version 1.0, type PACKET_IN, length 125, xid 0x00000000
21:28:42.058979 IP 192.168.1.30.49346 > 192.168.1.10.6633: Flags [P.], seq 1000:1125, ack 1, win 58, options [nop,nop,TS val 21917414 ecr 46590317], length 125: OpenFlow
	version 1.0, type PACKET_IN, length 125, xid 0x00000000
21:28:42.059008 IP 192.168.1.30.49346 > 192.168.1.10.6633: Flags [P.], seq 1125:1250, ack 1, win 58, options [nop,nop,TS val 21917414 ecr 46590317], length 125: OpenFlow
	version 1.0, type PACKET_IN, length 125, xid 0x00000000
21:28:42.059037 IP 192.168.1.30.49346 > 192.168.1.10.6633: Flags [P.], seq 1250:1375, ack 1, win 58, options [nop,nop,TS val 21917414 ecr 46590317], length 125: OpenFlow
	version 1.0, type PACKET_IN, length 125, xid 0x00000000
21:28:42.059067 IP 192.168.1.30.49346 > 192.168.1.10.6633: Flags [P.], seq 1375:1500, ack 1, win 58, options [nop,nop,TS val 21917414 ecr 46590317], length 125: OpenFlow
	version 1.0, type PACKET_IN, length 125, xid 0x00000000
21:28:42.059103 IP 192.168.1.30.49346 > 192.168.1.10.6633: Flags [P.], seq 1500:1625, ack 1, win 58, options [nop,nop,TS val 21917414 ecr 46590317], length 125: OpenFlow
	version 1.0, type PACKET_IN, length 125, xid 0x00000000
21:28:42.062122 IP 192.168.1.30.49346 > 192.168.1.10.6633: Flags [P.], seq 1625:1750, ack 1, win 58, options [nop,nop,TS val 21917414 ecr 46590317], length 125: OpenFlow
	version 1.0, type PACKET_IN, length 125, xid 0x00000000
21:28:42.062161 IP 192.168.1.30.49346 > 192.168.1.10.6633: Flags [P.], seq 1750:1875, ack 1, win 58, options [nop,nop,TS val 21917414 ecr 46590317], length 125: OpenFlow
	version 1.0, type PACKET_IN, length 125, xid 0x00000000
21:28:42.062175 IP 192.168.1.30.49346 > 192.168.1.10.6633: Flags [P.], seq 1875:2000, ack 1, win 58, options [nop,nop,TS val 21917414 ecr 46590317], length 125: OpenFlow
	version 1.0, type PACKET_IN, length 125, xid 0x00000000
21:28:42.062189 IP 192.168.1.30.49346 > 192.168.1.10.6633: Flags [P.], seq 2000:2125, ack 1, win 58, options [nop,nop,TS val 21917414 ecr 46590317], length 125: OpenFlow
	version 1.0, type PACKET_IN, length 125, xid 0x00000000
21:28:42.062203 IP 192.168.1.30.49346 > 192.168.1.10.6633: Flags [P.], seq 2125:2250, ack 1, win 58, options [nop,nop,TS val 21917414 ecr 46590317], length 125: OpenFlow
	version 1.0, type PACKET_IN, length 125, xid 0x00000000
21:28:42.062213 IP 192.168.1.10.6633 > 192.168.1.30.49346: Flags [.], ack 1500, win 12680, options [nop,nop,TS val 46590325 ecr 21917414], length 0
21:28:42.062216 IP 192.168.1.30.49346 > 192.168.1.10.6633: Flags [P.], seq 2250:2375, ack 1, win 58, options [nop,nop,TS val 21917414 ecr 46590317], length 125: OpenFlow
	version 1.0, type PACKET_IN, length 125, xid 0x00000000
21:28:42.062230 IP 192.168.1.30.49346 > 192.168.1.10.6633: Flags [P.], seq 2375:2500, ack 1, win 58, options [nop,nop,TS val 21917414 ecr 46590317], length 125: OpenFlow
	version 1.0, type PACKET_IN, length 125, xid 0x00000000
21:28:42.062255 IP 192.168.1.10.6633 > 192.168.1.30.49346: Flags [.], ack 1625, win 12680, options [nop,nop,TS val 46590325 ecr 21917414], length 0
21:28:42.062257 IP 192.168.1.30.49346 > 192.168.1.10.6633: Flags [P.], seq 2500:2625, ack 1, win 58, options [nop,nop,TS val 21917414 ecr 46590317], length 125: OpenFlow
	version 1.0, type PACKET_IN, length 125, xid 0x00000000
21:28:42.062273 IP 192.168.1.30.49346 > 192.168.1.10.6633: Flags [P.], seq 2625:2750, ack 1, win 58, options [nop,nop,TS val 21917414 ecr 46590317], length 125: OpenFlow
	version 1.0, type PACKET_IN, length 125, xid 0x00000000
21:28:42.062287 IP 192.168.1.30.49346 > 192.168.1.10.6633: Flags [P.], seq 2750:2838, ack 1, win 58, options [nop,nop,TS val 21917414 ecr 46590317], length 88: OpenFlow
	version 1.0, type PACKET_IN, length 88, xid 0x00000000
21:28:42.062300 IP 192.168.1.30.49346 > 192.168.1.10.6633: Flags [P.], seq 2838:2963, ack 1, win 58, options [nop,nop,TS val 21917414 ecr 46590317], length 125: OpenFlow
	version 1.0, type PACKET_IN, length 125, xid 0x00000000
21:28:42.062314 IP 192.168.1.30.49346 > 192.168.1.10.6633: Flags [P.], seq 2963:3088, ack 1, win 58, options [nop,nop,TS val 21917414 ecr 46590317], length 125: OpenFlow
	version 1.0, type PACKET_IN, length 125, xid 0x00000000
21:28:42.062328 IP 192.168.1.30.49346 > 192.168.1.10.6633: Flags [P.], seq 3088:3213, ack 1, win 58, options [nop,nop,TS val 21917414 ecr 46590317], length 125: OpenFlow
	version 1.0, type PACKET_IN, length 125, xid 0x00000000
21:28:42.062341 IP 192.168.1.30.49346 > 192.168.1.10.6633: Flags [P.], seq 3213:3338, ack 1, win 58, options [nop,nop,TS val 21917414 ecr 46590317], length 125: OpenFlow
	version 1.0, type PACKET_IN, length 125, xid 0x00000000
21:28:42.062360 IP 192.168.1.30.49346 > 192.168.1.10.6633: Flags [P.], seq 3338:3463, ack 1, win 58, options [nop,nop,TS val 21917414 ecr 46590317], length 125: OpenFlow
	version 1.0, type PACKET_IN, length 125, xid 0x00000000
21:28:42.062374 IP 192.168.1.30.49346 > 192.168.1.10.6633: Flags [P.], seq 3463:3588, ack 1, win 58, options [nop,nop,TS val 21917414 ecr 46590317], length 125: OpenFlow
	version 1.0, type PACKET_IN, length 125, xid 0x00000000
21:28:42.062388 IP 192.168.1.30.49346 > 192.168.1.10.6633: Flags [P.], seq 3588:3713, ack 1, win 58, options [nop,nop,TS val 21917414 ecr 46590317], length 125: OpenFlow
	version 1.0, type PACKET_IN, length 125, xid 0x00000000
21:28:42.062401 IP 192.168.1.30.49346 > 192.168.1.10.6633: Flags [P.], seq 3713:3838, ack 1, win 58, options [nop,nop,TS val 21917414 ecr 46590317], length 125: OpenFlow
	version 1.0, type PACKET_IN, length 125, xid 0x00000000
21:28:42.062414 IP 192.168.1.30.49346 > 192.168.1.10.6633: Flags [P.], seq 3838:3963, ack 1, win 58, options [nop,nop,TS val 21917414 ecr 46590317], length 125: OpenFlow
	version 1.0, type PACKET_IN, length 125, xid 0x00000000
21:28:42.062428 IP 192.168.1.30.49346 > 192.168.1.10.6633: Flags [P.], seq 3963:4088, ack 1, win 58, options [nop,nop,TS val 21917414 ecr 46590317], length 125: OpenFlow
	version 1.0, type PACKET_IN, length 125, xid 0x00000000
21:28:42.062441 IP 192.168.1.30.49346 > 192.168.1.10.6633: Flags [P.], seq 4088:4213, ack 1, win 58, options [nop,nop,TS val 21917414 ecr 46590317], length 125: OpenFlow
	version 1.0, type PACKET_IN, length 125, xid 0x00000000
21:28:42.062455 IP 192.168.1.30.49346 > 192.168.1.10.6633: Flags [P.], seq 4213:4338, ack 1, win 58, options [nop,nop,TS val 21917414 ecr 46590317], length 125: OpenFlow
	version 1.0, type PACKET_IN, length 125, xid 0x00000000
21:28:42.062468 IP 192.168.1.30.49346 > 192.168.1.10.6633: Flags [P.], seq 4338:4463, ack 1, win 58, options [nop,nop,TS val 21917414 ecr 46590317], length 125: OpenFlow
	version 1.0, type PACKET_IN, length 125, xid 0x00000000
21:28:42.062481 IP 192.168.1.30.49346 > 192.168.1.10.6633: Flags [P.], seq 4463:4588, ack 1, win 58, options [nop,nop,TS val 21917414 ecr 46590317], length 125: OpenFlow
	version 1.0, type PACKET_IN, length 125, xid 0x00000000
21:28:42.062494 IP 192.168.1.30.49346 > 192.168.1.10.6633: Flags [P.], seq 4588:4713, ack 1, win 58, options [nop,nop,TS val 21917414 ecr 46590317], length 125: OpenFlow
	version 1.0, type PACKET_IN, length 125, xid 0x00000000
21:28:42.062508 IP 192.168.1.30.49346 > 192.168.1.10.6633: Flags [P.], seq 4713:4838, ack 1, win 58, options [nop,nop,TS val 21917414 ecr 46590317], length 125: OpenFlow
	version 1.0, type PACKET_IN, length 125, xid 0x00000000
21:28:42.063151 IP 192.168.1.10.6633 > 192.168.1.30.49346: Flags [.], ack 3088, win 12680, options [nop,nop,TS val 46590326 ecr 21917414], length 0
21:28:42.063190 IP 192.168.1.10.6633 > 192.168.1.30.49346: Flags [.], ack 3338, win 12680, options [nop,nop,TS val 46590326 ecr 21917414], length 0
21:28:42.063211 IP 192.168.1.10.6633 > 192.168.1.30.49346: Flags [.], ack 4838, win 12680, options [nop,nop,TS val 46590326 ecr 21917414], length 0
21:28:42.065524 IP 192.168.1.30.49346 > 192.168.1.10.6633: Flags [P.], seq 4838:8926, ack 1, win 58, options [nop,nop,TS val 21917415 ecr 46590325], length 4088: OpenFlow
	version 1.0, type PACKET_IN, length 125, xid 0x00000000
	version 1.0, type PACKET_IN, length 125, xid 0x00000000
	version 1.0, type PACKET_IN, length 125, xid 0x00000000
	version 1.0, type PACKET_IN, length 125, xid 0x00000000
	version 1.0, type PACKET_IN, length 125, xid 0x00000000
	version 1.0, type PACKET_IN, length 125, xid 0x00000000
	version 1.0, type PACKET_IN, length 125, xid 0x00000000
	version 1.0, type PACKET_IN, length 125, xid 0x00000000
	version 1.0, type PACKET_IN, length 125, xid 0x00000000
	version 1.0, type PACKET_IN, length 125, xid 0x00000000
	version 1.0, type PACKET_IN, length 125, xid 0x00000000
	version 1.0, type PACKET_IN, length 125, xid 0x00000000
	version 1.0, type PACKET_IN, length 125, xid 0x00000000
	version 1.0, type PACKET_IN, length 125, xid 0x00000000
	version 1.0, type PACKET_IN, length 125, xid 0x00000000
	version 1.0, type PACKET_IN, length 125, xid 0x00000000
	version 1.0, type PACKET_IN, length 125, xid 0x00000000
	version 1.0, type PACKET_IN, length 125, xid 0x00000000
	version 1.0, type PACKET_IN, length 125, xid 0x00000000
	version 1.0, type PACKET_IN, length 125, xid 0x00000000
	version 1.0, type PACKET_IN, length 125, xid 0x00000000
	version 1.0, type PACKET_IN, length 125, xid 0x00000000
	version 1.0, type PACKET_IN, length 125, xid 0x00000000
	version 1.0, type PACKET_IN, length 125, xid 0x00000000
	version 1.0, type PACKET_IN, length 125, xid 0x00000000
	version 1.0, type PACKET_IN, length 125, xid 0x00000000
	version 1.0, type PACKET_IN, length 125, xid 0x00000000
	version 1.0, type PACKET_IN, length 125, xid 0x00000000
	version 1.0, type PACKET_IN, length 88, xid 0x00000000
	version 1.0, type PACKET_IN, length 125, xid 0x00000000
	version 1.0, type PACKET_IN, length 125, xid 0x00000000
	version 1.0, type PACKET_IN, length 125, xid 0x00000000
	version 1.0, type PACKET_IN, length 125, xid 0x00000000
21:28:42.065541 IP 192.168.1.30.49346 > 192.168.1.10.6633: Flags [P.], seq 8926:13764, ack 1, win 58, options [nop,nop,TS val 21917415 ecr 46590325], length 4838: OpenFlow
	version 1.0, type PACKET_IN, length 125, xid 0x00000000
	version 1.0, type PACKET_IN, length 125, xid 0x00000000
	version 1.0, type PACKET_IN, length 125, xid 0x00000000
	version 1.0, type PACKET_IN, length 125, xid 0x00000000
	version 1.0, type PACKET_IN, length 125, xid 0x00000000
	version 1.0, type PACKET_IN, length 125, xid 0x00000000
	version 1.0, type PACKET_IN, length 125, xid 0x00000000
	version 1.0, type PACKET_IN, length 125, xid 0x00000000
	version 1.0, type PACKET_IN, length 125, xid 0x00000000
	version 1.0, type PACKET_IN, length 125, xid 0x00000000
	version 1.0, type PACKET_IN, length 125, xid 0x00000000
	version 1.0, type PACKET_IN, length 125, xid 0x00000000
	version 1.0, type PACKET_IN, length 125, xid 0x00000000
	version 1.0, type PACKET_IN, length 88, xid 0x00000000
	version 1.0, type PACKET_IN, length 125, xid 0x00000000
	version 1.0, type PACKET_IN, length 125, xid 0x00000000
	version 1.0, type PACKET_IN, length 125, xid 0x00000000
	version 1.0, type PACKET_IN, length 125, xid 0x00000000
	version 1.0, type PACKET_IN, length 125, xid 0x00000000
	version 1.0, type PACKET_IN, length 125, xid 0x00000000
	version 1.0, type PACKET_IN, length 125, xid 0x00000000
	version 1.0, type PACKET_IN, length 125, xid 0x00000000
	version 1.0, type PACKET_IN, length 125, xid 0x00000000
	version 1.0, type PACKET_IN, length 125, xid 0x00000000
	version 1.0, type PACKET_IN, length 125, xid 0x00000000
	version 1.0, type PACKET_IN, length 125, xid 0x00000000
	version 1.0, type PACKET_IN, length 125, xid 0x00000000
	version 1.0, type PACKET_IN, length 125, xid 0x00000000
	version 1.0, type PACKET_IN, length 125, xid 0x00000000
	version 1.0, type PACKET_IN, length 125, xid 0x00000000
	version 1.0, type PACKET_IN, length 125, xid 0x00000000
	version 1.0, type PACKET_IN, length 125, xid 0x00000000
	version 1.0, type PACKET_IN, length 125, xid 0x00000000
	version 1.0, type PACKET_IN, length 125, xid 0x00000000
	version 1.0, type PACKET_IN, length 125, xid 0x00000000
	version 1.0, type PACKET_IN, length 125, xid 0x00000000
	version 1.0, type PACKET_IN, length 125, xid 0x00000000
	version 1.0, type PACKET_IN, length 125, xid 0x00000000
	version 1.0, type PACKET_IN, length 125, xid 0x00000000
21:28:42.065559 IP 192.168.1.30.49346 > 192.168.1.10.6633: Flags [P.], seq 13764:18602, ack 1, win 58, options [nop,nop,TS val 21917415 ecr 46590325], length 4838: OpenFlow
	version 1.0, type PACKET_IN, length 125, xid 0x00000000
	version 1.0, type PACKET_IN, length 125, xid 0x00000000
	version 1.0, type PACKET_IN, length 88, xid 0x00000000
	version 1.0, type PACKET_IN, length 125, xid 0x00000000
	version 1.0, type PACKET_IN, length 125, xid 0x00000000
	version 1.0, type PACKET_IN, length 125, xid 0x00000000
	version 1.0, type PACKET_IN, length 125, xid 0x00000000
	version 1.0, type PACKET_IN, length 125, xid 0x00000000
	version 1.0, type PACKET_IN, length 125, xid 0x00000000
	version 1.0, type PACKET_IN, length 125, xid 0x00000000
	version 1.0, type PACKET_IN, length 125, xid 0x00000000
	version 1.0, type PACKET_IN, length 125, xid 0x00000000
	version 1.0, type PACKET_IN, length 125, xid 0x00000000
	version 1.0, type PACKET_IN, length 125, xid 0x00000000
	version 1.0, type PACKET_IN, length 125, xid 0x00000000
	version 1.0, type PACKET_IN, length 125, xid 0x00000000
	version 1.0, type PACKET_IN, length 125, xid 0x00000000
	version 1.0, type PACKET_IN, length 125, xid 0x00000000
	version 1.0, type PACKET_IN, length 125, xid 0x00000000
	version 1.0, type PACKET_IN, length 125, xid 0x00000000
	version 1.0, type PACKET_IN, length 125, xid 0x00000000
	version 1.0, type PACKET_IN, length 125, xid 0x00000000
	version 1.0, type PACKET_IN, length 125, xid 0x00000000
	version 1.0, type PACKET_IN, length 125, xid 0x00000000
	version 1.0, type PACKET_IN, length 125, xid 0x00000000
	version 1.0, type PACKET_IN, length 125, xid 0x00000000
	version 1.0, type PACKET_IN, length 125, xid 0x00000000
	version 1.0, type PACKET_IN, length 125, xid 0x00000000
	version 1.0, type PACKET_IN, length 125, xid 0x00000000
	version 1.0, type PACKET_IN, length 125, xid 0x00000000
	version 1.0, type PACKET_IN, length 125, xid 0x00000000
	version 1.0, type PACKET_IN, length 125, xid 0x00000000
	version 1.0, type PACKET_IN, length 125, xid 0x00000000
	version 1.0, type PACKET_IN, length 125, xid 0x00000000
	version 1.0, type PACKET_IN, length 125, xid 0x00000000
	version 1.0, type PACKET_IN, length 125, xid 0x00000000
	version 1.0, type PACKET_IN, length 125, xid 0x00000000
	version 1.0, type PACKET_IN, length 125, xid 0x00000000
	version 1.0, type PACKET_IN, length 125, xid 0x00000000
21:28:42.065574 IP 192.168.1.30.49346 > 192.168.1.10.6633: Flags [P.], seq 18602:19602, ack 1, win 58, options [nop,nop,TS val 21917415 ecr 46590325], length 1000: OpenFlow
	version 1.0, type PACKET_IN, length 125, xid 0x00000000
	version 1.0, type PACKET_IN, length 125, xid 0x00000000
	version 1.0, type PACKET_IN, length 125, xid 0x00000000
	version 1.0, type PACKET_IN, length 125, xid 0x00000000
	version 1.0, type PACKET_IN, length 125, xid 0x00000000
	version 1.0, type PACKET_IN, length 125, xid 0x00000000
	version 1.0, type PACKET_IN, length 125, xid 0x00000000
	version 1.0, type PACKET_IN, length 125, xid 0x00000000
21:28:42.065930 IP 192.168.1.10.6633 > 192.168.1.30.49346: Flags [.], ack 8926, win 12680, options [nop,nop,TS val 46590327 ecr 21917415], length 0
21:28:42.069656 IP 192.168.1.10.6633 > 192.168.1.30.49346: Flags [.], ack 13764, win 12680, options [nop,nop,TS val 46590327 ecr 21917415], length 0
21:28:42.069710 IP 192.168.1.10.6633 > 192.168.1.30.49346: Flags [.], ack 18602, win 12680, options [nop,nop,TS val 46590327 ecr 21917415], length 0
21:28:42.069783 IP 192.168.1.10.6633 > 192.168.1.30.49346: Flags [.], ack 19602, win 12680, options [nop,nop,TS val 46590327 ecr 21917415], length 0
21:28:42.087902 IP 192.168.1.30.49346 > 192.168.1.10.6633: Flags [P.], seq 19602:19727, ack 1, win 58, options [nop,nop,TS val 21917421 ecr 46590327], length 125: OpenFlow
	version 1.0, type PACKET_IN, length 125, xid 0x00000000
21:28:42.087963 IP 192.168.1.30.49346 > 192.168.1.10.6633: Flags [P.], seq 19727:19852, ack 1, win 58, options [nop,nop,TS val 21917421 ecr 46590327], length 125: OpenFlow
	version 1.0, type PACKET_IN, length 125, xid 0x00000000
21:28:42.087997 IP 192.168.1.30.49346 > 192.168.1.10.6633: Flags [P.], seq 19852:19977, ack 1, win 58, options [nop,nop,TS val 21917421 ecr 46590327], length 125: OpenFlow
	version 1.0, type PACKET_IN, length 125, xid 0x00000000
21:28:42.088026 IP 192.168.1.30.49346 > 192.168.1.10.6633: Flags [P.], seq 19977:20102, ack 1, win 58, options [nop,nop,TS val 21917421 ecr 46590327], length 125: OpenFlow
	version 1.0, type PACKET_IN, length 125, xid 0x00000000
21:28:42.088056 IP 192.168.1.30.49346 > 192.168.1.10.6633: Flags [P.], seq 20102:20227, ack 1, win 58, options [nop,nop,TS val 21917421 ecr 46590327], length 125: OpenFlow
	version 1.0, type PACKET_IN, length 125, xid 0x00000000
21:28:42.088088 IP 192.168.1.30.49346 > 192.168.1.10.6633: Flags [P.], seq 20227:20352, ack 1, win 58, options [nop,nop,TS val 21917421 ecr 46590327], length 125: OpenFlow
	version 1.0, type PACKET_IN, length 125, xid 0x00000000
21:28:42.088203 IP 192.168.1.10.6633 > 192.168.1.30.49346: Flags [.], ack 20102, win 12680, options [nop,nop,TS val 46590332 ecr 21917421], length 0
21:28:42.088220 IP 192.168.1.30.49346 > 192.168.1.10.6633: Flags [P.], seq 20352:20477, ack 1, win 58, options [nop,nop,TS val 21917421 ecr 46590332], length 125: OpenFlow
	version 1.0, type PACKET_IN, length 125, xid 0x00000000
21:28:42.088251 IP 192.168.1.30.49346 > 192.168.1.10.6633: Flags [P.], seq 20477:20602, ack 1, win 58, options [nop,nop,TS val 21917421 ecr 46590332], length 125: OpenFlow
	version 1.0, type PACKET_IN, length 125, xid 0x00000000
21:28:42.088279 IP 192.168.1.30.49346 > 192.168.1.10.6633: Flags [P.], seq 20602:20727, ack 1, win 58, options [nop,nop,TS val 21917421 ecr 46590332], length 125: OpenFlow
	version 1.0, type PACKET_IN, length 125, xid 0x00000000
21:28:42.088307 IP 192.168.1.30.49346 > 192.168.1.10.6633: Flags [P.], seq 20727:20852, ack 1, win 58, options [nop,nop,TS val 21917421 ecr 46590332], length 125: OpenFlow
	version 1.0, type PACKET_IN, length 125, xid 0x00000000
21:28:42.088336 IP 192.168.1.30.49346 > 192.168.1.10.6633: Flags [P.], seq 20852:20977, ack 1, win 58, options [nop,nop,TS val 21917421 ecr 46590332], length 125: OpenFlow
	version 1.0, type PACKET_IN, length 125, xid 0x00000000
21:28:42.088367 IP 192.168.1.30.49346 > 192.168.1.10.6633: Flags [P.], seq 20977:21102, ack 1, win 58, options [nop,nop,TS val 21917421 ecr 46590332], length 125: OpenFlow
	version 1.0, type PACKET_IN, length 125, xid 0x00000000
21:28:42.088397 IP 192.168.1.30.49346 > 192.168.1.10.6633: Flags [P.], seq 21102:21227, ack 1, win 58, options [nop,nop,TS val 21917421 ecr 46590332], length 125: OpenFlow
	version 1.0, type PACKET_IN, length 125, xid 0x00000000
21:28:42.088427 IP 192.168.1.30.49346 > 192.168.1.10.6633: Flags [P.], seq 21227:21352, ack 1, win 58, options [nop,nop,TS val 21917421 ecr 46590332], length 125: OpenFlow
	version 1.0, type PACKET_IN, length 125, xid 0x00000000
21:28:42.088456 IP 192.168.1.30.49346 > 192.168.1.10.6633: Flags [P.], seq 21352:21477, ack 1, win 58, options [nop,nop,TS val 21917421 ecr 46590332], length 125: OpenFlow
	version 1.0, type PACKET_IN, length 125, xid 0x00000000
21:28:42.088459 IP 192.168.1.10.6633 > 192.168.1.30.49346: Flags [.], ack 20352, win 12680, options [nop,nop,TS val 46590332 ecr 21917421], length 0
21:28:42.088483 IP 192.168.1.10.6633 > 192.168.1.30.49346: Flags [.], ack 20727, win 12680, options [nop,nop,TS val 46590332 ecr 21917421], length 0
21:28:42.088486 IP 192.168.1.30.49346 > 192.168.1.10.6633: Flags [P.], seq 21477:21602, ack 1, win 58, options [nop,nop,TS val 21917421 ecr 46590332], length 125: OpenFlow
	version 1.0, type PACKET_IN, length 125, xid 0x00000000
21:28:42.088519 IP 192.168.1.30.49346 > 192.168.1.10.6633: Flags [P.], seq 21602:21727, ack 1, win 58, options [nop,nop,TS val 21917421 ecr 46590332], length 125: OpenFlow
	version 1.0, type PACKET_IN, length 125, xid 0x00000000
21:28:42.088549 IP 192.168.1.30.49346 > 192.168.1.10.6633: Flags [P.], seq 21727:21852, ack 1, win 58, options [nop,nop,TS val 21917421 ecr 46590332], length 125: OpenFlow
	version 1.0, type PACKET_IN, length 125, xid 0x00000000
21:28:42.088578 IP 192.168.1.30.49346 > 192.168.1.10.6633: Flags [P.], seq 21852:21977, ack 1, win 58, options [nop,nop,TS val 21917421 ecr 46590332], length 125: OpenFlow
	version 1.0, type PACKET_IN, length 125, xid 0x00000000
21:28:42.088610 IP 192.168.1.30.49346 > 192.168.1.10.6633: Flags [P.], seq 21977:22102, ack 1, win 58, options [nop,nop,TS val 21917421 ecr 46590332], length 125: OpenFlow
	version 1.0, type PACKET_IN, length 125, xid 0x00000000
21:28:42.088639 IP 192.168.1.30.49346 > 192.168.1.10.6633: Flags [P.], seq 22102:22227, ack 1, win 58, options [nop,nop,TS val 21917421 ecr 46590332], length 125: OpenFlow
	version 1.0, type PACKET_IN, length 125, xid 0x00000000
21:28:42.088663 IP 192.168.1.10.6633 > 192.168.1.30.49346: Flags [.], ack 21227, win 12680, options [nop,nop,TS val 46590332 ecr 21917421], length 0
21:28:42.088669 IP 192.168.1.30.49346 > 192.168.1.10.6633: Flags [P.], seq 22227:22352, ack 1, win 58, options [nop,nop,TS val 21917421 ecr 46590332], length 125: OpenFlow
	version 1.0, type PACKET_IN, length 125, xid 0x00000000
21:28:42.088673 IP 192.168.1.10.6633 > 192.168.1.30.49346: Flags [.], ack 21602, win 12680, options [nop,nop,TS val 46590332 ecr 21917421], length 0
21:28:42.088706 IP 192.168.1.30.49346 > 192.168.1.10.6633: Flags [P.], seq 22352:22477, ack 1, win 58, options [nop,nop,TS val 21917421 ecr 46590332], length 125: OpenFlow
	version 1.0, type PACKET_IN, length 125, xid 0x00000000
21:28:42.088735 IP 192.168.1.30.49346 > 192.168.1.10.6633: Flags [P.], seq 22477:22602, ack 1, win 58, options [nop,nop,TS val 21917421 ecr 46590332], length 125: OpenFlow
	version 1.0, type PACKET_IN, length 125, xid 0x00000000
21:28:42.088765 IP 192.168.1.30.49346 > 192.168.1.10.6633: Flags [P.], seq 22602:22727, ack 1, win 58, options [nop,nop,TS val 21917421 ecr 46590332], length 125: OpenFlow
	version 1.0, type PACKET_IN, length 125, xid 0x00000000
21:28:42.088795 IP 192.168.1.30.49346 > 192.168.1.10.6633: Flags [P.], seq 22727:22852, ack 1, win 58, options [nop,nop,TS val 21917421 ecr 46590332], length 125: OpenFlow
	version 1.0, type PACKET_IN, length 125, xid 0x00000000
21:28:42.088825 IP 192.168.1.30.49346 > 192.168.1.10.6633: Flags [P.], seq 22852:22977, ack 1, win 58, options [nop,nop,TS val 21917421 ecr 46590332], length 125: OpenFlow
	version 1.0, type PACKET_IN, length 125, xid 0x00000000
21:28:42.088856 IP 192.168.1.30.49346 > 192.168.1.10.6633: Flags [P.], seq 22977:23102, ack 1, win 58, options [nop,nop,TS val 21917421 ecr 46590332], length 125: OpenFlow
	version 1.0, type PACKET_IN, length 125, xid 0x00000000
21:28:42.088864 IP 192.168.1.10.6633 > 192.168.1.30.49346: Flags [.], ack 21977, win 12680, options [nop,nop,TS val 46590332 ecr 21917421], length 0
21:28:42.088879 IP 192.168.1.10.6633 > 192.168.1.30.49346: Flags [.], ack 22477, win 12680, options [nop,nop,TS val 46590332 ecr 21917421], length 0
21:28:42.088885 IP 192.168.1.30.49346 > 192.168.1.10.6633: Flags [P.], seq 23102:23227, ack 1, win 58, options [nop,nop,TS val 21917421 ecr 46590332], length 125: OpenFlow
	version 1.0, type PACKET_IN, length 125, xid 0x00000000
21:28:42.088918 IP 192.168.1.30.49346 > 192.168.1.10.6633: Flags [P.], seq 23227:23352, ack 1, win 58, options [nop,nop,TS val 21917421 ecr 46590332], length 125: OpenFlow
	version 1.0, type PACKET_IN, length 125, xid 0x00000000
21:28:42.088946 IP 192.168.1.30.49346 > 192.168.1.10.6633: Flags [P.], seq 23352:23477, ack 1, win 58, options [nop,nop,TS val 21917421 ecr 46590332], length 125: OpenFlow
	version 1.0, type PACKET_IN, length 125, xid 0x00000000
21:28:42.088975 IP 192.168.1.30.49346 > 192.168.1.10.6633: Flags [P.], seq 23477:23565, ack 1, win 58, options [nop,nop,TS val 21917421 ecr 46590332], length 88: OpenFlow
	version 1.0, type PACKET_IN, length 88, xid 0x00000000
21:28:42.089002 IP 192.168.1.30.49346 > 192.168.1.10.6633: Flags [P.], seq 23565:23690, ack 1, win 58, options [nop,nop,TS val 21917421 ecr 46590332], length 125: OpenFlow
	version 1.0, type PACKET_IN, length 125, xid 0x00000000
21:28:42.089030 IP 192.168.1.30.49346 > 192.168.1.10.6633: Flags [P.], seq 23690:23815, ack 1, win 58, options [nop,nop,TS val 21917421 ecr 46590332], length 125: OpenFlow
	version 1.0, type PACKET_IN, length 125, xid 0x00000000
21:28:42.089058 IP 192.168.1.30.49346 > 192.168.1.10.6633: Flags [P.], seq 23815:23940, ack 1, win 58, options [nop,nop,TS val 21917421 ecr 46590332], length 125: OpenFlow
	version 1.0, type PACKET_IN, length 125, xid 0x00000000
21:28:42.089085 IP 192.168.1.30.49346 > 192.168.1.10.6633: Flags [P.], seq 23940:24065, ack 1, win 58, options [nop,nop,TS val 21917421 ecr 46590332], length 125: OpenFlow
	version 1.0, type PACKET_IN, length 125, xid 0x00000000
21:28:42.089113 IP 192.168.1.30.49346 > 192.168.1.10.6633: Flags [P.], seq 24065:24190, ack 1, win 58, options [nop,nop,TS val 21917421 ecr 46590332], length 125: OpenFlow
	version 1.0, type PACKET_IN, length 125, xid 0x00000000
21:28:42.089112 IP 192.168.1.10.6633 > 192.168.1.30.49346: Flags [.], ack 22852, win 12680, options [nop,nop,TS val 46590332 ecr 21917421], length 0
21:28:42.089123 IP 192.168.1.10.6633 > 192.168.1.30.49346: Flags [.], ack 23352, win 12680, options [nop,nop,TS val 46590333 ecr 21917421], length 0
21:28:42.089150 IP 192.168.1.30.49346 > 192.168.1.10.6633: Flags [P.], seq 24190:24315, ack 1, win 58, options [nop,nop,TS val 21917421 ecr 46590333], length 125: OpenFlow
	version 1.0, type PACKET_IN, length 125, xid 0x00000000
21:28:42.089180 IP 192.168.1.30.49346 > 192.168.1.10.6633: Flags [P.], seq 24315:24440, ack 1, win 58, options [nop,nop,TS val 21917421 ecr 46590333], length 125: OpenFlow
	version 1.0, type PACKET_IN, length 125, xid 0x00000000
21:28:42.089250 IP 192.168.1.30.49346 > 192.168.1.10.6633: Flags [P.], seq 24440:24565, ack 1, win 58, options [nop,nop,TS val 21917422 ecr 46590333], length 125: OpenFlow
	version 1.0, type PACKET_IN, length 125, xid 0x00000000
21:28:42.089280 IP 192.168.1.30.49346 > 192.168.1.10.6633: Flags [P.], seq 24565:24690, ack 1, win 58, options [nop,nop,TS val 21917422 ecr 46590333], length 125: OpenFlow
	version 1.0, type PACKET_IN, length 125, xid 0x00000000
21:28:42.089312 IP 192.168.1.30.49346 > 192.168.1.10.6633: Flags [P.], seq 24690:24815, ack 1, win 58, options [nop,nop,TS val 21917422 ecr 46590333], length 125: OpenFlow
	version 1.0, type PACKET_IN, length 125, xid 0x00000000
21:28:42.089337 IP 192.168.1.10.6633 > 192.168.1.30.49346: Flags [.], ack 23815, win 12680, options [nop,nop,TS val 46590333 ecr 21917421], length 0
21:28:42.089343 IP 192.168.1.30.49346 > 192.168.1.10.6633: Flags [P.], seq 24815:24940, ack 1, win 58, options [nop,nop,TS val 21917422 ecr 46590333], length 125: OpenFlow
	version 1.0, type PACKET_IN, length 125, xid 0x00000000
21:28:42.089391 IP 192.168.1.10.6633 > 192.168.1.30.49346: Flags [.], ack 24315, win 12680, options [nop,nop,TS val 46590333 ecr 21917421], length 0
21:28:42.089403 IP 192.168.1.10.6633 > 192.168.1.30.49346: Flags [.], ack 24565, win 12680, options [nop,nop,TS val 46590333 ecr 21917421], length 0
21:28:42.089417 IP 192.168.1.30.49346 > 192.168.1.10.6633: Flags [P.], seq 24940:25065, ack 1, win 58, options [nop,nop,TS val 21917422 ecr 46590333], length 125: OpenFlow
	version 1.0, type PACKET_IN, length 125, xid 0x00000000
21:28:42.089449 IP 192.168.1.30.49346 > 192.168.1.10.6633: Flags [P.], seq 25065:25190, ack 1, win 58, options [nop,nop,TS val 21917422 ecr 46590333], length 125: OpenFlow
	version 1.0, type PACKET_IN, length 125, xid 0x00000000
21:28:42.089467 IP 192.168.1.30.49346 > 192.168.1.10.6633: Flags [P.], seq 25190:25315, ack 1, win 58, options [nop,nop,TS val 21917422 ecr 46590333], length 125: OpenFlow
	version 1.0, type PACKET_IN, length 125, xid 0x00000000
21:28:42.089484 IP 192.168.1.30.49346 > 192.168.1.10.6633: Flags [P.], seq 25315:25440, ack 1, win 58, options [nop,nop,TS val 21917422 ecr 46590333], length 125: OpenFlow
	version 1.0, type PACKET_IN, length 125, xid 0x00000000
21:28:42.089502 IP 192.168.1.30.49346 > 192.168.1.10.6633: Flags [P.], seq 25440:25565, ack 1, win 58, options [nop,nop,TS val 21917422 ecr 46590333], length 125: OpenFlow
	version 1.0, type PACKET_IN, length 125, xid 0x00000000
21:28:42.089519 IP 192.168.1.30.49346 > 192.168.1.10.6633: Flags [P.], seq 25565:25690, ack 1, win 58, options [nop,nop,TS val 21917422 ecr 46590333], length 125: OpenFlow
	version 1.0, type PACKET_IN, length 125, xid 0x00000000
21:28:42.089537 IP 192.168.1.30.49346 > 192.168.1.10.6633: Flags [P.], seq 25690:25815, ack 1, win 58, options [nop,nop,TS val 21917422 ecr 46590333], length 125: OpenFlow
	version 1.0, type PACKET_IN, length 125, xid 0x00000000
21:28:42.089555 IP 192.168.1.30.49346 > 192.168.1.10.6633: Flags [P.], seq 25815:25940, ack 1, win 58, options [nop,nop,TS val 21917422 ecr 46590333], length 125: OpenFlow
	version 1.0, type PACKET_IN, length 125, xid 0x00000000
21:28:42.089573 IP 192.168.1.30.49346 > 192.168.1.10.6633: Flags [P.], seq 25940:26065, ack 1, win 58, options [nop,nop,TS val 21917422 ecr 46590333], length 125: OpenFlow
	version 1.0, type PACKET_IN, length 125, xid 0x00000000
21:28:42.089591 IP 192.168.1.30.49346 > 192.168.1.10.6633: Flags [P.], seq 26065:26190, ack 1, win 58, options [nop,nop,TS val 21917422 ecr 46590333], length 125: OpenFlow
	version 1.0, type PACKET_IN, length 125, xid 0x00000000
21:28:42.089609 IP 192.168.1.30.49346 > 192.168.1.10.6633: Flags [P.], seq 26190:26315, ack 1, win 58, options [nop,nop,TS val 21917422 ecr 46590333], length 125: OpenFlow
	version 1.0, type PACKET_IN, length 125, xid 0x00000000
21:28:42.089628 IP 192.168.1.30.49346 > 192.168.1.10.6633: Flags [P.], seq 26315:26440, ack 1, win 58, options [nop,nop,TS val 21917422 ecr 46590333], length 125: OpenFlow
	version 1.0, type PACKET_IN, length 125, xid 0x00000000
21:28:42.089646 IP 192.168.1.30.49346 > 192.168.1.10.6633: Flags [P.], seq 26440:26565, ack 1, win 58, options [nop,nop,TS val 21917422 ecr 46590333], length 125: OpenFlow
	version 1.0, type PACKET_IN, length 125, xid 0x00000000
21:28:42.089664 IP 192.168.1.30.49346 > 192.168.1.10.6633: Flags [P.], seq 26565:26690, ack 1, win 58, options [nop,nop,TS val 21917422 ecr 46590333], length 125: OpenFlow
	version 1.0, type PACKET_IN, length 125, xid 0x00000000
21:28:42.089682 IP 192.168.1.30.49346 > 192.168.1.10.6633: Flags [P.], seq 26690:26815, ack 1, win 58, options [nop,nop,TS val 21917422 ecr 46590333], length 125: OpenFlow
	version 1.0, type PACKET_IN, length 125, xid 0x00000000
21:28:42.089699 IP 192.168.1.30.49346 > 192.168.1.10.6633: Flags [P.], seq 26815:26940, ack 1, win 58, options [nop,nop,TS val 21917422 ecr 46590333], length 125: OpenFlow
	version 1.0, type PACKET_IN, length 125, xid 0x00000000
21:28:42.089701 IP 192.168.1.10.6633 > 192.168.1.30.49346: Flags [.], ack 24815, win 12680, options [nop,nop,TS val 46590333 ecr 21917422], length 0
21:28:42.089716 IP 192.168.1.10.6633 > 192.168.1.30.49346: Flags [.], ack 25190, win 12680, options [nop,nop,TS val 46590333 ecr 21917422], length 0
21:28:42.089718 IP 192.168.1.30.49346 > 192.168.1.10.6633: Flags [P.], seq 26940:27065, ack 1, win 58, options [nop,nop,TS val 21917422 ecr 46590333], length 125: OpenFlow
	version 1.0, type PACKET_IN, length 125, xid 0x00000000
21:28:42.089723 IP 192.168.1.10.6633 > 192.168.1.30.49346: Flags [.], ack 25815, win 12680, options [nop,nop,TS val 46590333 ecr 21917422], length 0
21:28:42.089742 IP 192.168.1.30.49346 > 192.168.1.10.6633: Flags [P.], seq 27065:27190, ack 1, win 58, options [nop,nop,TS val 21917422 ecr 46590333], length 125: OpenFlow
	version 1.0, type PACKET_IN, length 125, xid 0x00000000
21:28:42.089761 IP 192.168.1.30.49346 > 192.168.1.10.6633: Flags [P.], seq 27190:27315, ack 1, win 58, options [nop,nop,TS val 21917422 ecr 46590333], length 125: OpenFlow
	version 1.0, type PACKET_IN, length 125, xid 0x00000000
21:28:42.089779 IP 192.168.1.30.49346 > 192.168.1.10.6633: Flags [P.], seq 27315:27440, ack 1, win 58, options [nop,nop,TS val 21917422 ecr 46590333], length 125: OpenFlow
	version 1.0, type PACKET_IN, length 125, xid 0x00000000
21:28:42.089797 IP 192.168.1.30.49346 > 192.168.1.10.6633: Flags [P.], seq 27440:27565, ack 1, win 58, options [nop,nop,TS val 21917422 ecr 46590333], length 125: OpenFlow
	version 1.0, type PACKET_IN, length 125, xid 0x00000000
21:28:42.089816 IP 192.168.1.30.49346 > 192.168.1.10.6633: Flags [P.], seq 27565:27690, ack 1, win 58, options [nop,nop,TS val 21917422 ecr 46590333], length 125: OpenFlow
	version 1.0, type PACKET_IN, length 125, xid 0x00000000
21:28:42.089833 IP 192.168.1.30.49346 > 192.168.1.10.6633: Flags [P.], seq 27690:27815, ack 1, win 58, options [nop,nop,TS val 21917422 ecr 46590333], length 125: OpenFlow
	version 1.0, type PACKET_IN, length 125, xid 0x00000000
21:28:42.089852 IP 192.168.1.30.49346 > 192.168.1.10.6633: Flags [P.], seq 27815:27940, ack 1, win 58, options [nop,nop,TS val 21917422 ecr 46590333], length 125: OpenFlow
	version 1.0, type PACKET_IN, length 125, xid 0x00000000
21:28:42.089871 IP 192.168.1.30.49346 > 192.168.1.10.6633: Flags [P.], seq 27940:28065, ack 1, win 58, options [nop,nop,TS val 21917422 ecr 46590333], length 125: OpenFlow
	version 1.0, type PACKET_IN, length 125, xid 0x00000000
21:28:42.089889 IP 192.168.1.30.49346 > 192.168.1.10.6633: Flags [P.], seq 28065:28190, ack 1, win 58, options [nop,nop,TS val 21917422 ecr 46590333], length 125: OpenFlow
	version 1.0, type PACKET_IN, length 125, xid 0x00000000
21:28:42.089906 IP 192.168.1.30.49346 > 192.168.1.10.6633: Flags [P.], seq 28190:28315, ack 1, win 58, options [nop,nop,TS val 21917422 ecr 46590333], length 125: OpenFlow
	version 1.0, type PACKET_IN, length 125, xid 0x00000000
21:28:42.089924 IP 192.168.1.30.49346 > 192.168.1.10.6633: Flags [P.], seq 28315:28440, ack 1, win 58, options [nop,nop,TS val 21917422 ecr 46590333], length 125: OpenFlow
	version 1.0, type PACKET_IN, length 125, xid 0x00000000
21:28:42.089941 IP 192.168.1.30.49346 > 192.168.1.10.6633: Flags [P.], seq 28440:28565, ack 1, win 58, options [nop,nop,TS val 21917422 ecr 46590333], length 125: OpenFlow
	version 1.0, type PACKET_IN, length 125, xid 0x00000000
21:28:42.089959 IP 192.168.1.30.49346 > 192.168.1.10.6633: Flags [P.], seq 28565:28690, ack 1, win 58, options [nop,nop,TS val 21917422 ecr 46590333], length 125: OpenFlow
	version 1.0, type PACKET_IN, length 125, xid 0x00000000
21:28:42.089977 IP 192.168.1.30.49346 > 192.168.1.10.6633: Flags [P.], seq 28690:28815, ack 1, win 58, options [nop,nop,TS val 21917422 ecr 46590333], length 125: OpenFlow
	version 1.0, type PACKET_IN, length 125, xid 0x00000000
21:28:42.089993 IP 192.168.1.30.49346 > 192.168.1.10.6633: Flags [P.], seq 28815:28940, ack 1, win 58, options [nop,nop,TS val 21917422 ecr 46590333], length 125: OpenFlow
	version 1.0, type PACKET_IN, length 125, xid 0x00000000
21:28:42.090010 IP 192.168.1.30.49346 > 192.168.1.10.6633: Flags [P.], seq 28940:29065, ack 1, win 58, options [nop,nop,TS val 21917422 ecr 46590333], length 125: OpenFlow
	version 1.0, type PACKET_IN, length 125, xid 0x00000000
21:28:42.090027 IP 192.168.1.30.49346 > 192.168.1.10.6633: Flags [P.], seq 29065:29190, ack 1, win 58, options [nop,nop,TS val 21917422 ecr 46590333], length 125: OpenFlow
	version 1.0, type PACKET_IN, length 125, xid 0x00000000
21:28:42.090043 IP 192.168.1.30.49346 > 192.168.1.10.6633: Flags [P.], seq 29190:29315, ack 1, win 58, options [nop,nop,TS val 21917422 ecr 46590333], length 125: OpenFlow
	version 1.0, type PACKET_IN, length 125, xid 0x00000000
21:28:42.090060 IP 192.168.1.30.49346 > 192.168.1.10.6633: Flags [P.], seq 29315:29440, ack 1, win 58, options [nop,nop,TS val 21917422 ecr 46590333], length 125: OpenFlow
	version 1.0, type PACKET_IN, length 125, xid 0x00000000
21:28:42.090078 IP 192.168.1.30.49346 > 192.168.1.10.6633: Flags [P.], seq 29440:29565, ack 1, win 58, options [nop,nop,TS val 21917422 ecr 46590333], length 125: OpenFlow
	version 1.0, type PACKET_IN, length 125, xid 0x00000000
21:28:42.090094 IP 192.168.1.30.49346 > 192.168.1.10.6633: Flags [P.], seq 29565:29690, ack 1, win 58, options [nop,nop,TS val 21917422 ecr 46590333], length 125: OpenFlow
	version 1.0, type PACKET_IN, length 125, xid 0x00000000
21:28:42.090112 IP 192.168.1.30.49346 > 192.168.1.10.6633: Flags [P.], seq 29690:29815, ack 1, win 58, options [nop,nop,TS val 21917422 ecr 46590333], length 125: OpenFlow
	version 1.0, type PACKET_IN, length 125, xid 0x00000000
21:28:42.090129 IP 192.168.1.30.49346 > 192.168.1.10.6633: Flags [P.], seq 29815:29940, ack 1, win 58, options [nop,nop,TS val 21917422 ecr 46590333], length 125: OpenFlow
	version 1.0, type PACKET_IN, length 125, xid 0x00000000
21:28:42.090145 IP 192.168.1.30.49346 > 192.168.1.10.6633: Flags [P.], seq 29940:30065, ack 1, win 58, options [nop,nop,TS val 21917422 ecr 46590333], length 125: OpenFlow
	version 1.0, type PACKET_IN, length 125, xid 0x00000000
21:28:42.090162 IP 192.168.1.30.49346 > 192.168.1.10.6633: Flags [P.], seq 30065:30190, ack 1, win 58, options [nop,nop,TS val 21917422 ecr 46590333], length 125: OpenFlow
	version 1.0, type PACKET_IN, length 125, xid 0x00000000
21:28:42.090178 IP 192.168.1.30.49346 > 192.168.1.10.6633: Flags [P.], seq 30190:30315, ack 1, win 58, options [nop,nop,TS val 21917422 ecr 46590333], length 125: OpenFlow
	version 1.0, type PACKET_IN, length 125, xid 0x00000000
21:28:42.090196 IP 192.168.1.30.49346 > 192.168.1.10.6633: Flags [P.], seq 30315:30440, ack 1, win 58, options [nop,nop,TS val 21917422 ecr 46590333], length 125: OpenFlow
	version 1.0, type PACKET_IN, length 125, xid 0x00000000
21:28:42.090213 IP 192.168.1.30.49346 > 192.168.1.10.6633: Flags [P.], seq 30440:30565, ack 1, win 58, options [nop,nop,TS val 21917422 ecr 46590333], length 125: OpenFlow
