21:28:42.080158 IP 192.168.1.10.6633 > 192.168.1.30.49387: Flags [.], ack 645810936, win 24576, options [nop,nop,TS val 46590330 ecr 21917419], length 0
21:28:42.080680 IP 192.168.1.30.49387 > 192.168.1.10.6633: Flags [.], seq 1:1449, ack 0, win 58, options [nop,nop,TS val 21917419 ecr 46590330], length 1448: OpenFlow
	version 1.0, type PACKET_IN, length 125, xid 0x00000000
	version 1.0, type PACKET_IN, length 125, xid 0x00000000
	version 1.0, type PACKET_IN, length 125, xid 0x00000000
	version 1.0, type PACKET_IN, length 125, xid 0x00000000
	version 1.0, type PACKET_IN, length 125, xid 0x00000000
	version 1.0, type PACKET_IN, length 125, xid 0x00000000
	version 1.0, type PACKET_IN, length 125, xid 0x00000000
	version 1.0, type PACKET_IN, length 125, xid 0x00000000
	version 1.0, type PACKET_IN, length 125, xid 0x00000000
	version 1.0, type PACKET_IN, length 125, xid 0x00000000
	version 1.0, type PACKET_IN, length 125, xid 0x00000000
	version 1.0, type PACKET_IN, length 125, xid 0x00000000 [|openflow]
21:28:42.080696 IP 192.168.1.30.49387 > 192.168.1.10.6633: Flags [P.], seq 1449:1626, ack 0, win 58, options [nop,nop,TS val 21917419 ecr 46590330], length 177: OpenFlow
	version unknown (0xe9), type 0x14, length 59648, xid 0x354ac600 [|openflow]
21:28:42.081119 IP 192.168.1.10.6633 > 192.168.1.30.49387: Flags [.], ack 1626, win 24576, options [nop,nop,TS val 46590330 ecr 21917419], length 0
21:28:42.111711 IP 192.168.1.30.49387 > 192.168.1.10.6633: Flags [P.], seq 1626:1751, ack 0, win 58, options [nop,nop,TS val 21917427 ecr 46590330], length 125: OpenFlow
	version 1.0, type PACKET_IN, length 125, xid 0x00000000
21:28:42.111733 IP 192.168.1.30.49387 > 192.168.1.10.6633: Flags [P.], seq 1751:1876, ack 0, win 58, options [nop,nop,TS val 21917427 ecr 46590330], length 125: OpenFlow
	version 1.0, type PACKET_IN, length 125, xid 0x00000000
21:28:42.111747 IP 192.168.1.30.49387 > 192.168.1.10.6633: Flags [P.], seq 1876:2001, ack 0, win 58, options [nop,nop,TS val 21917427 ecr 46590330], length 125: OpenFlow
	version 1.0, type PACKET_IN, length 125, xid 0x00000000
21:28:42.111761 IP 192.168.1.30.49387 > 192.168.1.10.6633: Flags [P.], seq 2001:2126, ack 0, win 58, options [nop,nop,TS val 21917427 ecr 46590330], length 125: OpenFlow
	version 1.0, type PACKET_IN, length 125, xid 0x00000000
21:28:42.111775 IP 192.168.1.30.49387 > 192.168.1.10.6633: Flags [P.], seq 2126:2251, ack 0, win 58, options [nop,nop,TS val 21917427 ecr 46590330], length 125: OpenFlow
	version 1.0, type PACKET_IN, length 125, xid 0x00000000
21:28:42.111791 IP 192.168.1.30.49387 > 192.168.1.10.6633: Flags [P.], seq 2251:2376, ack 0, win 58, options [nop,nop,TS val 21917427 ecr 46590330], length 125: OpenFlow
	version 1.0, type PACKET_IN, length 125, xid 0x00000000
21:28:42.111804 IP 192.168.1.30.49387 > 192.168.1.10.6633: Flags [P.], seq 2376:2501, ack 0, win 58, options [nop,nop,TS val 21917427 ecr 46590330], length 125: OpenFlow
	version 1.0, type PACKET_IN, length 125, xid 0x00000000
21:28:42.111818 IP 192.168.1.30.49387 > 192.168.1.10.6633: Flags [P.], seq 2501:2626, ack 0, win 58, options [nop,nop,TS val 21917427 ecr 46590330], length 125: OpenFlow
	version 1.0, type PACKET_IN, length 125, xid 0x00000000
21:28:42.111832 IP 192.168.1.30.49387 > 192.168.1.10.6633: Flags [P.], seq 2626:2751, ack 0, win 58, options [nop,nop,TS val 21917427 ecr 46590330], length 125: OpenFlow
	version 1.0, type PACKET_IN, length 125, xid 0x00000000
21:28:42.111846 IP 192.168.1.30.49387 > 192.168.1.10.6633: Flags [P.], seq 2751:2876, ack 0, win 58, options [nop,nop,TS val 21917427 ecr 46590330], length 125: OpenFlow
	version 1.0, type PACKET_IN, length 125, xid 0x00000000
21:28:42.111860 IP 192.168.1.30.49387 > 192.168.1.10.6633: Flags [P.], seq 2876:3001, ack 0, win 58, options [nop,nop,TS val 21917427 ecr 46590330], length 125: OpenFlow
	version 1.0, type PACKET_IN, length 125, xid 0x00000000
21:28:42.111874 IP 192.168.1.30.49387 > 192.168.1.10.6633: Flags [P.], seq 3001:3126, ack 0, win 58, options [nop,nop,TS val 21917427 ecr 46590330], length 125: OpenFlow
	version 1.0, type PACKET_IN, length 125, xid 0x00000000
21:28:42.111895 IP 192.168.1.30.49387 > 192.168.1.10.6633: Flags [P.], seq 3126:3251, ack 0, win 58, options [nop,nop,TS val 21917427 ecr 46590330], length 125: OpenFlow
	version 1.0, type PACKET_IN, length 125, xid 0x00000000
21:28:42.111909 IP 192.168.1.30.49387 > 192.168.1.10.6633: Flags [P.], seq 3251:3376, ack 0, win 58, options [nop,nop,TS val 21917427 ecr 46590330], length 125: OpenFlow
	version 1.0, type PACKET_IN, length 125, xid 0x00000000
21:28:42.111923 IP 192.168.1.30.49387 > 192.168.1.10.6633: Flags [P.], seq 3376:3501, ack 0, win 58, options [nop,nop,TS val 21917427 ecr 46590330], length 125: OpenFlow
	version 1.0, type PACKET_IN, length 125, xid 0x00000000
21:28:42.111948 IP 192.168.1.30.49387 > 192.168.1.10.6633: Flags [P.], seq 3501:3626, ack 0, win 58, options [nop,nop,TS val 21917427 ecr 46590330], length 125: OpenFlow
	version 1.0, type PACKET_IN, length 125, xid 0x00000000
21:28:42.111961 IP 192.168.1.30.49387 > 192.168.1.10.6633: Flags [P.], seq 3626:3751, ack 0, win 58, options [nop,nop,TS val 21917427 ecr 46590330], length 125: OpenFlow
	version 1.0, type PACKET_IN, length 125, xid 0x00000000
21:28:42.111975 IP 192.168.1.30.49387 > 192.168.1.10.6633: Flags [P.], seq 3751:3876, ack 0, win 58, options [nop,nop,TS val 21917427 ecr 46590330], length 125: OpenFlow
	version 1.0, type PACKET_IN, length 125, xid 0x00000000
21:28:42.111988 IP 192.168.1.30.49387 > 192.168.1.10.6633: Flags [P.], seq 3876:4001, ack 0, win 58, options [nop,nop,TS val 21917427 ecr 46590330], length 125: OpenFlow
	version 1.0, type PACKET_IN, length 125, xid 0x00000000
21:28:42.112002 IP 192.168.1.30.49387 > 192.168.1.10.6633: Flags [P.], seq 4001:4126, ack 0, win 58, options [nop,nop,TS val 21917427 ecr 46590330], length 125: OpenFlow
	version 1.0, type PACKET_IN, length 125, xid 0x00000000
21:28:42.112269 IP 192.168.1.30.49387 > 192.168.1.10.6633: Flags [P.], seq 4126:4251, ack 0, win 58, options [nop,nop,TS val 21917427 ecr 46590330], length 125: OpenFlow
	version 1.0, type PACKET_IN, length 125, xid 0x00000000
21:28:42.112290 IP 192.168.1.30.49387 > 192.168.1.10.6633: Flags [P.], seq 4251:4516, ack 0, win 58, options [nop,nop,TS val 21917427 ecr 46590330], length 265: OpenFlow
	version 1.0, type PACKET_IN, length 265, xid 0x00000000
21:28:42.112304 IP 192.168.1.30.49387 > 192.168.1.10.6633: Flags [P.], seq 4516:4641, ack 0, win 58, options [nop,nop,TS val 21917427 ecr 46590330], length 125: OpenFlow
	version 1.0, type PACKET_IN, length 125, xid 0x00000000
21:28:42.113137 IP 192.168.1.10.6633 > 192.168.1.30.49387: Flags [.], ack 4641, win 24576, options [nop,nop,TS val 46590338 ecr 21917427], length 0
21:28:42.113154 IP 192.168.1.30.49387 > 192.168.1.10.6633: Flags [P.], seq 4641:8891, ack 0, win 58, options [nop,nop,TS val 21917427 ecr 46590338], length 4250: OpenFlow
	version 1.0, type PACKET_IN, length 125, xid 0x00000000
	version 1.0, type PACKET_IN, length 125, xid 0x00000000
	version 1.0, type PACKET_IN, length 125, xid 0x00000000
	version 1.0, type PACKET_IN, length 125, xid 0x00000000
	version 1.0, type PACKET_IN, length 125, xid 0x00000000
	version 1.0, type PACKET_IN, length 125, xid 0x00000000
	version 1.0, type PACKET_IN, length 125, xid 0x00000000
	version 1.0, type PACKET_IN, length 125, xid 0x00000000
	version 1.0, type PACKET_IN, length 125, xid 0x00000000
	version 1.0, type PACKET_IN, length 125, xid 0x00000000
	version 1.0, type PACKET_IN, length 125, xid 0x00000000
	version 1.0, type PACKET_IN, length 125, xid 0x00000000
	version 1.0, type PACKET_IN, length 125, xid 0x00000000
	version 1.0, type PACKET_IN, length 125, xid 0x00000000
	version 1.0, type PACKET_IN, length 125, xid 0x00000000
	version 1.0, type PACKET_IN, length 125, xid 0x00000000
	version 1.0, type PACKET_IN, length 125, xid 0x00000000
	version 1.0, type PACKET_IN, length 125, xid 0x00000000
	version 1.0, type PACKET_IN, length 125, xid 0x00000000
	version 1.0, type PACKET_IN, length 125, xid 0x00000000
	version 1.0, type PACKET_IN, length 125, xid 0x00000000
	version 1.0, type PACKET_IN, length 125, xid 0x00000000
	version 1.0, type PACKET_IN, length 125, xid 0x00000000
	version 1.0, type PACKET_IN, length 125, xid 0x00000000
	version 1.0, type PACKET_IN, length 125, xid 0x00000000
	version 1.0, type PACKET_IN, length 125, xid 0x00000000
	version 1.0, type PACKET_IN, length 125, xid 0x00000000
	version 1.0, type PACKET_IN, length 125, xid 0x00000000
	version 1.0, type PACKET_IN, length 125, xid 0x00000000
	version 1.0, type PACKET_IN, length 125, xid 0x00000000
	version 1.0, type PACKET_IN, length 125, xid 0x00000000
	version 1.0, type PACKET_IN, length 125, xid 0x00000000
	version 1.0, type PACKET_IN, length 125, xid 0x00000000
	version 1.0, type PACKET_IN, length 125, xid 0x00000000
21:28:42.114902 IP 192.168.1.10.6633 > 192.168.1.30.49387: Flags [.], ack 8891, win 24576, options [nop,nop,TS val 46590339 ecr 21917427], length 0
21:28:42.115912 IP 192.168.1.30.49387 > 192.168.1.10.6633: Flags [.], seq 8891:11787, ack 0, win 58, options [nop,nop,TS val 21917428 ecr 46590338], length 2896: OpenFlow
	version 1.0, type PACKET_IN, length 125, xid 0x00000000
	version 1.0, type PACKET_IN, length 125, xid 0x00000000
	version 1.0, type PACKET_IN, length 125, xid 0x00000000
	version 1.0, type PACKET_IN, length 125, xid 0x00000000
	version 1.0, type PACKET_IN, length 125, xid 0x00000000
	version 1.0, type PACKET_IN, length 125, xid 0x00000000
	version 1.0, type PACKET_IN, length 125, xid 0x00000000
	version 1.0, type PACKET_IN, length 125, xid 0x00000000
	version 1.0, type PACKET_IN, length 125, xid 0x00000000
	version 1.0, type PACKET_IN, length 125, xid 0x00000000
	version 1.0, type PACKET_IN, length 125, xid 0x00000000
	version 1.0, type PACKET_IN, length 125, xid 0x00000000
	version 1.0, type PACKET_IN, length 125, xid 0x00000000
	version 1.0, type PACKET_IN, length 125, xid 0x00000000
	version 1.0, type PACKET_IN, length 125, xid 0x00000000
	version 1.0, type PACKET_IN, length 125, xid 0x00000000
	version 1.0, type PACKET_IN, length 125, xid 0x00000000
	version 1.0, type PACKET_IN, length 125, xid 0x00000000
	version 1.0, type PACKET_IN, length 125, xid 0x00000000
	version 1.0, type PACKET_IN, length 125, xid 0x00000000
	version 1.0, type PACKET_IN, length 125, xid 0x00000000
	version 1.0, type PACKET_IN, length 125, xid 0x00000000
	version 1.0, type PACKET_IN, length 125, xid 0x00000000
	version 1.0, type PACKET_IN, length 125, xid 0x00000000 [|openflow]
21:28:42.116808 IP 192.168.1.10.6633 > 192.168.1.30.49387: Flags [.], ack 11787, win 24576, options [nop,nop,TS val 46590339 ecr 21917428], length 0
21:28:42.116906 IP 192.168.1.30.49387 > 192.168.1.10.6633: Flags [P.], seq 11787:12266, ack 0, win 58, options [nop,nop,TS val 21917428 ecr 46590338], length 479: OpenFlow
	version unknown (0x00), type 0x00, length 64370, xid 0x9be20339 [|openflow]
21:28:42.117486 IP 192.168.1.10.6633 > 192.168.1.30.49387: Flags [.], ack 12266, win 24576, options [nop,nop,TS val 46590340 ecr 21917428], length 0
21:28:42.138992 IP 192.168.1.30.49387 > 192.168.1.10.6633: Flags [P.], seq 12266:12391, ack 0, win 58, options [nop,nop,TS val 21917431 ecr 46590340], length 125: OpenFlow
	version 1.0, type PACKET_IN, length 125, xid 0x00000000
21:28:42.139108 IP 192.168.1.30.49387 > 192.168.1.10.6633: Flags [P.], seq 12391:12516, ack 0, win 58, options [nop,nop,TS val 21917431 ecr 46590340], length 125: OpenFlow
	version 1.0, type PACKET_IN, length 125, xid 0x00000000
21:28:42.139125 IP 192.168.1.30.49387 > 192.168.1.10.6633: Flags [P.], seq 12516:12641, ack 0, win 58, options [nop,nop,TS val 21917431 ecr 46590340], length 125: OpenFlow
	version 1.0, type PACKET_IN, length 125, xid 0x00000000
21:28:42.139298 IP 192.168.1.30.49387 > 192.168.1.10.6633: Flags [P.], seq 12641:12766, ack 0, win 58, options [nop,nop,TS val 21917431 ecr 46590340], length 125: OpenFlow
	version 1.0, type PACKET_IN, length 125, xid 0x00000000
21:28:42.139393 IP 192.168.1.30.49387 > 192.168.1.10.6633: Flags [P.], seq 12766:12854, ack 0, win 58, options [nop,nop,TS val 21917431 ecr 46590340], length 88: OpenFlow
	version 1.0, type PACKET_IN, length 88, xid 0x00000000
21:28:42.139409 IP 192.168.1.30.49387 > 192.168.1.10.6633: Flags [P.], seq 12854:12979, ack 0, win 58, options [nop,nop,TS val 21917431 ecr 46590340], length 125: OpenFlow
	version 1.0, type PACKET_IN, length 125, xid 0x00000000
21:28:42.139425 IP 192.168.1.30.49387 > 192.168.1.10.6633: Flags [P.], seq 12979:13104, ack 0, win 58, options [nop,nop,TS val 21917431 ecr 46590340], length 125: OpenFlow
	version 1.0, type PACKET_IN, length 125, xid 0x00000000
21:28:42.139439 IP 192.168.1.30.49387 > 192.168.1.10.6633: Flags [P.], seq 13104:13229, ack 0, win 58, options [nop,nop,TS val 21917431 ecr 46590340], length 125: OpenFlow
	version 1.0, type PACKET_IN, length 125, xid 0x00000000
21:28:42.139453 IP 192.168.1.30.49387 > 192.168.1.10.6633: Flags [P.], seq 13229:13354, ack 0, win 58, options [nop,nop,TS val 21917431 ecr 46590340], length 125: OpenFlow
	version 1.0, type PACKET_IN, length 125, xid 0x00000000
21:28:42.139467 IP 192.168.1.30.49387 > 192.168.1.10.6633: Flags [P.], seq 13354:13479, ack 0, win 58, options [nop,nop,TS val 21917431 ecr 46590340], length 125: OpenFlow
	version 1.0, type PACKET_IN, length 125, xid 0x00000000
21:28:42.139486 IP 192.168.1.30.49387 > 192.168.1.10.6633: Flags [P.], seq 13479:13604, ack 0, win 58, options [nop,nop,TS val 21917431 ecr 46590340], length 125: OpenFlow
	version 1.0, type PACKET_IN, length 125, xid 0x00000000
21:28:42.139500 IP 192.168.1.30.49387 > 192.168.1.10.6633: Flags [P.], seq 13604:13729, ack 0, win 58, options [nop,nop,TS val 21917431 ecr 46590340], length 125: OpenFlow
	version 1.0, type PACKET_IN, length 125, xid 0x00000000
21:28:42.139542 IP 192.168.1.10.6633 > 192.168.1.30.49387: Flags [.], ack 12391, win 24576, options [nop,nop,TS val 46590345 ecr 21917431], length 0
21:28:42.139632 IP 192.168.1.30.49387 > 192.168.1.10.6633: Flags [P.], seq 13729:13854, ack 0, win 58, options [nop,nop,TS val 21917431 ecr 46590340], length 125: OpenFlow
	version 1.0, type PACKET_IN, length 125, xid 0x00000000
21:28:42.139646 IP 192.168.1.30.49387 > 192.168.1.10.6633: Flags [P.], seq 13854:13979, ack 0, win 58, options [nop,nop,TS val 21917431 ecr 46590340], length 125: OpenFlow
	version 1.0, type PACKET_IN, length 125, xid 0x00000000
21:28:42.139660 IP 192.168.1.30.49387 > 192.168.1.10.6633: Flags [P.], seq 13979:14104, ack 0, win 58, options [nop,nop,TS val 21917431 ecr 46590340], length 125: OpenFlow
	version 1.0, type PACKET_IN, length 125, xid 0x00000000
21:28:42.139675 IP 192.168.1.30.49387 > 192.168.1.10.6633: Flags [P.], seq 14104:14229, ack 0, win 58, options [nop,nop,TS val 21917431 ecr 46590340], length 125: OpenFlow
	version 1.0, type PACKET_IN, length 125, xid 0x00000000
21:28:42.139689 IP 192.168.1.30.49387 > 192.168.1.10.6633: Flags [P.], seq 14229:14354, ack 0, win 58, options [nop,nop,TS val 21917431 ecr 46590340], length 125: OpenFlow
	version 1.0, type PACKET_IN, length 125, xid 0x00000000
21:28:42.139703 IP 192.168.1.30.49387 > 192.168.1.10.6633: Flags [P.], seq 14354:14479, ack 0, win 58, options [nop,nop,TS val 21917431 ecr 46590340], length 125: OpenFlow
	version 1.0, type PACKET_IN, length 125, xid 0x00000000
21:28:42.139717 IP 192.168.1.30.49387 > 192.168.1.10.6633: Flags [P.], seq 14479:14604, ack 0, win 58, options [nop,nop,TS val 21917431 ecr 46590340], length 125: OpenFlow
	version 1.0, type PACKET_IN, length 125, xid 0x00000000
21:28:42.139742 IP 192.168.1.30.49387 > 192.168.1.10.6633: Flags [P.], seq 14604:14729, ack 0, win 58, options [nop,nop,TS val 21917431 ecr 46590340], length 125: OpenFlow
	version 1.0, type PACKET_IN, length 125, xid 0x00000000
21:28:42.139757 IP 192.168.1.30.49387 > 192.168.1.10.6633: Flags [P.], seq 14729:14854, ack 0, win 58, options [nop,nop,TS val 21917431 ecr 46590340], length 125: OpenFlow
	version 1.0, type PACKET_IN, length 125, xid 0x00000000
21:28:42.139772 IP 192.168.1.30.49387 > 192.168.1.10.6633: Flags [P.], seq 14854:14979, ack 0, win 58, options [nop,nop,TS val 21917431 ecr 46590340], length 125: OpenFlow
	version 1.0, type PACKET_IN, length 125, xid 0x00000000
21:28:42.139771 IP 192.168.1.10.6633 > 192.168.1.30.49387: Flags [.], ack 13479, win 24576, options [nop,nop,TS val 46590345 ecr 21917431], length 0
21:28:42.139786 IP 192.168.1.30.49387 > 192.168.1.10.6633: Flags [P.], seq 14979:15104, ack 0, win 58, options [nop,nop,TS val 21917431 ecr 46590340], length 125: OpenFlow
	version 1.0, type PACKET_IN, length 125, xid 0x00000000
21:28:42.142820 IP 192.168.1.10.6633 > 192.168.1.30.49387: Flags [.], ack 15104, win 24576, options [nop,nop,TS val 46590346 ecr 21917431], length 0
21:28:42.144810 IP 192.168.1.30.49387 > 192.168.1.10.6633: Flags [P.], seq 15104:15979, ack 0, win 58, options [nop,nop,TS val 21917434 ecr 46590340], length 875: OpenFlow
	version 1.0, type PACKET_IN, length 125, xid 0x00000000
	version 1.0, type PACKET_IN, length 125, xid 0x00000000
	version 1.0, type PACKET_IN, length 125, xid 0x00000000
	version 1.0, type PACKET_IN, length 125, xid 0x00000000
	version 1.0, type PACKET_IN, length 125, xid 0x00000000
	version 1.0, type PACKET_IN, length 125, xid 0x00000000
	version 1.0, type PACKET_IN, length 125, xid 0x00000000
21:28:42.145159 IP 192.168.1.10.6633 > 192.168.1.30.49387: Flags [.], ack 15979, win 24576, options [nop,nop,TS val 46590347 ecr 21917434], length 0
21:28:42.177228 IP 192.168.1.30.49387 > 192.168.1.10.6633: Flags [P.], seq 15979:16104, ack 0, win 58, options [nop,nop,TS val 21917444 ecr 46590347], length 125: OpenFlow
	version 1.0, type PACKET_IN, length 125, xid 0x00000000
21:28:42.177306 IP 192.168.1.30.49387 > 192.168.1.10.6633: Flags [P.], seq 16104:16229, ack 0, win 58, options [nop,nop,TS val 21917444 ecr 46590347], length 125: OpenFlow
	version 1.0, type PACKET_IN, length 125, xid 0x00000000
21:28:42.177337 IP 192.168.1.30.49387 > 192.168.1.10.6633: Flags [P.], seq 16229:16354, ack 0, win 58, options [nop,nop,TS val 21917444 ecr 46590347], length 125: OpenFlow
	version 1.0, type PACKET_IN, length 125, xid 0x00000000
21:28:42.177366 IP 192.168.1.30.49387 > 192.168.1.10.6633: Flags [P.], seq 16354:16479, ack 0, win 58, options [nop,nop,TS val 21917444 ecr 46590347], length 125: OpenFlow
	version 1.0, type PACKET_IN, length 125, xid 0x00000000
21:28:42.177395 IP 192.168.1.30.49387 > 192.168.1.10.6633: Flags [P.], seq 16479:16604, ack 0, win 58, options [nop,nop,TS val 21917444 ecr 46590347], length 125: OpenFlow
	version 1.0, type PACKET_IN, length 125, xid 0x00000000
21:28:42.177483 IP 192.168.1.30.49387 > 192.168.1.10.6633: Flags [P.], seq 16604:16729, ack 0, win 58, options [nop,nop,TS val 21917444 ecr 46590347], length 125: OpenFlow
	version 1.0, type PACKET_IN, length 125, xid 0x00000000
21:28:42.177520 IP 192.168.1.30.49387 > 192.168.1.10.6633: Flags [P.], seq 16729:16854, ack 0, win 58, options [nop,nop,TS val 21917444 ecr 46590347], length 125: OpenFlow
	version 1.0, type PACKET_IN, length 125, xid 0x00000000
21:28:42.177555 IP 192.168.1.30.49387 > 192.168.1.10.6633: Flags [P.], seq 16854:16979, ack 0, win 58, options [nop,nop,TS val 21917444 ecr 46590347], length 125: OpenFlow
	version 1.0, type PACKET_IN, length 125, xid 0x00000000
21:28:42.177585 IP 192.168.1.30.49387 > 192.168.1.10.6633: Flags [P.], seq 16979:17104, ack 0, win 58, options [nop,nop,TS val 21917444 ecr 46590347], length 125: OpenFlow
	version 1.0, type PACKET_IN, length 125, xid 0x00000000
21:28:42.177625 IP 192.168.1.10.6633 > 192.168.1.30.49387: Flags [.], ack 16104, win 24576, options [nop,nop,TS val 46590355 ecr 21917444], length 0
21:28:42.177635 IP 192.168.1.10.6633 > 192.168.1.30.49387: Flags [.], ack 16604, win 24576, options [nop,nop,TS val 46590355 ecr 21917444], length 0
21:28:42.177676 IP 192.168.1.30.49387 > 192.168.1.10.6633: Flags [P.], seq 17104:17229, ack 0, win 58, options [nop,nop,TS val 21917444 ecr 46590355], length 125: OpenFlow
	version 1.0, type PACKET_IN, length 125, xid 0x00000000
21:28:42.177703 IP 192.168.1.30.49387 > 192.168.1.10.6633: Flags [P.], seq 17229:17354, ack 0, win 58, options [nop,nop,TS val 21917444 ecr 46590355], length 125: OpenFlow
	version 1.0, type PACKET_IN, length 125, xid 0x00000000
21:28:42.177764 IP 192.168.1.30.49387 > 192.168.1.10.6633: Flags [P.], seq 17354:17479, ack 0, win 58, options [nop,nop,TS val 21917444 ecr 46590355], length 125: OpenFlow
	version 1.0, type PACKET_IN, length 125, xid 0x00000000
21:28:42.177801 IP 192.168.1.30.49387 > 192.168.1.10.6633: Flags [P.], seq 17479:17604, ack 0, win 58, options [nop,nop,TS val 21917444 ecr 46590355], length 125: OpenFlow
	version 1.0, type PACKET_IN, length 125, xid 0x00000000
21:28:42.177821 IP 192.168.1.30.49387 > 192.168.1.10.6633: Flags [P.], seq 17604:17729, ack 0, win 58, options [nop,nop,TS val 21917444 ecr 46590355], length 125: OpenFlow
	version 1.0, type PACKET_IN, length 125, xid 0x00000000
21:28:42.177887 IP 192.168.1.30.49387 > 192.168.1.10.6633: Flags [P.], seq 17729:17854, ack 0, win 58, options [nop,nop,TS val 21917444 ecr 46590355], length 125: OpenFlow
	version 1.0, type PACKET_IN, length 125, xid 0x00000000
21:28:42.177921 IP 192.168.1.30.49387 > 192.168.1.10.6633: Flags [P.], seq 17854:17979, ack 0, win 58, options [nop,nop,TS val 21917444 ecr 46590355], length 125: OpenFlow
	version 1.0, type PACKET_IN, length 125, xid 0x00000000
21:28:42.177950 IP 192.168.1.30.49387 > 192.168.1.10.6633: Flags [P.], seq 17979:18104, ack 0, win 58, options [nop,nop,TS val 21917444 ecr 46590355], length 125: OpenFlow
	version 1.0, type PACKET_IN, length 125, xid 0x00000000
21:28:42.177986 IP 192.168.1.30.49387 > 192.168.1.10.6633: Flags [P.], seq 18104:18229, ack 0, win 58, options [nop,nop,TS val 21917444 ecr 46590355], length 125: OpenFlow
	version 1.0, type PACKET_IN, length 125, xid 0x00000000
21:28:42.178033 IP 192.168.1.10.6633 > 192.168.1.30.49387: Flags [.], ack 16979, win 24576, options [nop,nop,TS val 46590355 ecr 21917444], length 0
21:28:42.178044 IP 192.168.1.10.6633 > 192.168.1.30.49387: Flags [.], ack 17354, win 24576, options [nop,nop,TS val 46590355 ecr 21917444], length 0
21:28:42.178051 IP 192.168.1.10.6633 > 192.168.1.30.49387: Flags [.], ack 17604, win 24576, options [nop,nop,TS val 46590355 ecr 21917444], length 0
21:28:42.178090 IP 192.168.1.30.49387 > 192.168.1.10.6633: Flags [P.], seq 18229:18354, ack 0, win 58, options [nop,nop,TS val 21917444 ecr 46590355], length 125: OpenFlow
	version 1.0, type PACKET_IN, length 125, xid 0x00000000
21:28:42.178124 IP 192.168.1.30.49387 > 192.168.1.10.6633: Flags [P.], seq 18354:18479, ack 0, win 58, options [nop,nop,TS val 21917444 ecr 46590355], length 125: OpenFlow
	version 1.0, type PACKET_IN, length 125, xid 0x00000000
21:28:42.178159 IP 192.168.1.30.49387 > 192.168.1.10.6633: Flags [P.], seq 18479:18604, ack 0, win 58, options [nop,nop,TS val 21917444 ecr 46590355], length 125: OpenFlow
	version 1.0, type PACKET_IN, length 125, xid 0x00000000
21:28:42.178259 IP 192.168.1.30.49387 > 192.168.1.10.6633: Flags [P.], seq 18604:18729, ack 0, win 58, options [nop,nop,TS val 21917444 ecr 46590355], length 125: OpenFlow
	version 1.0, type PACKET_IN, length 125, xid 0x00000000
21:28:42.178285 IP 192.168.1.30.49387 > 192.168.1.10.6633: Flags [P.], seq 18729:18854, ack 0, win 58, options [nop,nop,TS val 21917444 ecr 46590355], length 125: OpenFlow
	version 1.0, type PACKET_IN, length 125, xid 0x00000000
21:28:42.178340 IP 192.168.1.10.6633 > 192.168.1.30.49387: Flags [.], ack 18104, win 24576, options [nop,nop,TS val 46590355 ecr 21917444], length 0
21:28:42.178311 IP 192.168.1.30.49387 > 192.168.1.10.6633: Flags [P.], seq 18854:18979, ack 0, win 58, options [nop,nop,TS val 21917444 ecr 46590355], length 125: OpenFlow
	version 1.0, type PACKET_IN, length 125, xid 0x00000000
21:28:42.178374 IP 192.168.1.10.6633 > 192.168.1.30.49387: Flags [.], ack 18604, win 24576, options [nop,nop,TS val 46590355 ecr 21917444], length 0
21:28:42.178396 IP 192.168.1.30.49387 > 192.168.1.10.6633: Flags [P.], seq 18979:19104, ack 0, win 58, options [nop,nop,TS val 21917444 ecr 46590355], length 125: OpenFlow
	version 1.0, type PACKET_IN, length 125, xid 0x00000000
21:28:42.178428 IP 192.168.1.30.49387 > 192.168.1.10.6633: Flags [P.], seq 19104:19229, ack 0, win 58, options [nop,nop,TS val 21917444 ecr 46590355], length 125: OpenFlow
	version 1.0, type PACKET_IN, length 125, xid 0x00000000
21:28:42.178460 IP 192.168.1.30.49387 > 192.168.1.10.6633: Flags [P.], seq 19229:19354, ack 0, win 58, options [nop,nop,TS val 21917444 ecr 46590355], length 125: OpenFlow
	version 1.0, type PACKET_IN, length 125, xid 0x00000000
21:28:42.178557 IP 192.168.1.30.49387 > 192.168.1.10.6633: Flags [P.], seq 19354:19479, ack 0, win 58, options [nop,nop,TS val 21917444 ecr 46590355], length 125: OpenFlow
	version 1.0, type PACKET_IN, length 125, xid 0x00000000
21:28:42.178589 IP 192.168.1.30.49387 > 192.168.1.10.6633: Flags [P.], seq 19479:19604, ack 0, win 58, options [nop,nop,TS val 21917444 ecr 46590355], length 125: OpenFlow
	version 1.0, type PACKET_IN, length 125, xid 0x00000000
21:28:42.178660 IP 192.168.1.30.49387 > 192.168.1.10.6633: Flags [P.], seq 19604:19729, ack 0, win 58, options [nop,nop,TS val 21917444 ecr 46590355], length 125: OpenFlow
	version 1.0, type PACKET_IN, length 125, xid 0x00000000
21:28:42.178699 IP 192.168.1.30.49387 > 192.168.1.10.6633: Flags [P.], seq 19729:19854, ack 0, win 58, options [nop,nop,TS val 21917444 ecr 46590355], length 125: OpenFlow
	version 1.0, type PACKET_IN, length 125, xid 0x00000000
21:28:42.178767 IP 192.168.1.30.49387 > 192.168.1.10.6633: Flags [P.], seq 19854:19979, ack 0, win 58, options [nop,nop,TS val 21917444 ecr 46590355], length 125: OpenFlow
	version 1.0, type PACKET_IN, length 125, xid 0x00000000
21:28:42.178795 IP 192.168.1.10.6633 > 192.168.1.30.49387: Flags [.], ack 19229, win 24576, options [nop,nop,TS val 46590355 ecr 21917444], length 0
21:28:42.178806 IP 192.168.1.10.6633 > 192.168.1.30.49387: Flags [.], ack 19604, win 24576, options [nop,nop,TS val 46590355 ecr 21917444], length 0
21:28:42.178814 IP 192.168.1.30.49387 > 192.168.1.10.6633: Flags [P.], seq 19979:20104, ack 0, win 58, options [nop,nop,TS val 21917444 ecr 46590355], length 125: OpenFlow
	version 1.0, type PACKET_IN, length 125, xid 0x00000000
21:28:42.178847 IP 192.168.1.30.49387 > 192.168.1.10.6633: Flags [P.], seq 20104:20229, ack 0, win 58, options [nop,nop,TS val 21917444 ecr 46590355], length 125: OpenFlow
	version 1.0, type PACKET_IN, length 125, xid 0x00000000
21:28:42.178878 IP 192.168.1.30.49387 > 192.168.1.10.6633: Flags [P.], seq 20229:20354, ack 0, win 58, options [nop,nop,TS val 21917444 ecr 46590355], length 125: OpenFlow
	version 1.0, type PACKET_IN, length 125, xid 0x00000000
21:28:42.178909 IP 192.168.1.30.49387 > 192.168.1.10.6633: Flags [P.], seq 20354:20479, ack 0, win 58, options [nop,nop,TS val 21917444 ecr 46590355], length 125: OpenFlow
	version 1.0, type PACKET_IN, length 125, xid 0x00000000
21:28:42.178940 IP 192.168.1.30.49387 > 192.168.1.10.6633: Flags [P.], seq 20479:20604, ack 0, win 58, options [nop,nop,TS val 21917444 ecr 46590355], length 125: OpenFlow
	version 1.0, type PACKET_IN, length 125, xid 0x00000000
21:28:42.178969 IP 192.168.1.30.49387 > 192.168.1.10.6633: Flags [P.], seq 20604:20729, ack 0, win 58, options [nop,nop,TS val 21917444 ecr 46590355], length 125: OpenFlow
	version 1.0, type PACKET_IN, length 125, xid 0x00000000
21:28:42.179072 IP 192.168.1.30.49387 > 192.168.1.10.6633: Flags [P.], seq 20729:20854, ack 0, win 58, options [nop,nop,TS val 21917444 ecr 46590355], length 125: OpenFlow
	version 1.0, type PACKET_IN, length 125, xid 0x00000000
21:28:42.179102 IP 192.168.1.30.49387 > 192.168.1.10.6633: Flags [P.], seq 20854:20979, ack 0, win 58, options [nop,nop,TS val 21917444 ecr 46590355], length 125: OpenFlow
	version 1.0, type PACKET_IN, length 125, xid 0x00000000
21:28:42.179130 IP 192.168.1.30.49387 > 192.168.1.10.6633: Flags [P.], seq 20979:21104, ack 0, win 58, options [nop,nop,TS val 21917444 ecr 46590355], length 125: OpenFlow
	version 1.0, type PACKET_IN, length 125, xid 0x00000000
21:28:42.179168 IP 192.168.1.30.49387 > 192.168.1.10.6633: Flags [P.], seq 21104:21229, ack 0, win 58, options [nop,nop,TS val 21917444 ecr 46590355], length 125: OpenFlow
	version 1.0, type PACKET_IN, length 125, xid 0x00000000
21:28:42.179239 IP 192.168.1.30.49387 > 192.168.1.10.6633: Flags [P.], seq 21229:21354, ack 0, win 58, options [nop,nop,TS val 21917444 ecr 46590355], length 125: OpenFlow
	version 1.0, type PACKET_IN, length 125, xid 0x00000000
21:28:42.179270 IP 192.168.1.30.49387 > 192.168.1.10.6633: Flags [P.], seq 21354:21479, ack 0, win 58, options [nop,nop,TS val 21917444 ecr 46590355], length 125: OpenFlow
	version 1.0, type PACKET_IN, length 125, xid 0x00000000
21:28:42.179351 IP 192.168.1.30.49387 > 192.168.1.10.6633: Flags [P.], seq 21479:21604, ack 0, win 58, options [nop,nop,TS val 21917444 ecr 46590355], length 125: OpenFlow
	version 1.0, type PACKET_IN, length 125, xid 0x00000000
21:28:42.179385 IP 192.168.1.30.49387 > 192.168.1.10.6633: Flags [P.], seq 21604:21729, ack 0, win 58, options [nop,nop,TS val 21917444 ecr 46590355], length 125: OpenFlow
	version 1.0, type PACKET_IN, length 125, xid 0x00000000
21:28:42.179411 IP 192.168.1.30.49387 > 192.168.1.10.6633: Flags [P.], seq 21729:21854, ack 0, win 58, options [nop,nop,TS val 21917444 ecr 46590355], length 125: OpenFlow
	version 1.0, type PACKET_IN, length 125, xid 0x00000000
21:28:42.179436 IP 192.168.1.30.49387 > 192.168.1.10.6633: Flags [P.], seq 21854:21979, ack 0, win 58, options [nop,nop,TS val 21917444 ecr 46590355], length 125: OpenFlow
	version 1.0, type PACKET_IN, length 125, xid 0x00000000
21:28:42.179461 IP 192.168.1.30.49387 > 192.168.1.10.6633: Flags [P.], seq 21979:22104, ack 0, win 58, options [nop,nop,TS val 21917444 ecr 46590355], length 125: OpenFlow
	version 1.0, type PACKET_IN, length 125, xid 0x00000000
21:28:42.179490 IP 192.168.1.30.49387 > 192.168.1.10.6633: Flags [P.], seq 22104:22229, ack 0, win 58, options [nop,nop,TS val 21917444 ecr 46590355], length 125: OpenFlow
	version 1.0, type PACKET_IN, length 125, xid 0x00000000
21:28:42.179518 IP 192.168.1.30.49387 > 192.168.1.10.6633: Flags [P.], seq 22229:22317, ack 0, win 58, options [nop,nop,TS val 21917444 ecr 46590355], length 88: OpenFlow
	version 1.0, type PACKET_IN, length 88, xid 0x00000000
21:28:42.179608 IP 192.168.1.30.49387 > 192.168.1.10.6633: Flags [P.], seq 22317:22442, ack 0, win 58, options [nop,nop,TS val 21917444 ecr 46590355], length 125: OpenFlow
	version 1.0, type PACKET_IN, length 125, xid 0x00000000
21:28:42.179610 IP 192.168.1.10.6633 > 192.168.1.30.49387: Flags [.], ack 21104, win 24576, options [nop,nop,TS val 46590355 ecr 21917444], length 0
21:28:42.179652 IP 192.168.1.30.49387 > 192.168.1.10.6633: Flags [P.], seq 22442:22567, ack 0, win 58, options [nop,nop,TS val 21917444 ecr 46590355], length 125: OpenFlow
	version 1.0, type PACKET_IN, length 125, xid 0x00000000
21:28:42.179680 IP 192.168.1.30.49387 > 192.168.1.10.6633: Flags [P.], seq 22567:22692, ack 0, win 58, options [nop,nop,TS val 21917444 ecr 46590355], length 125: OpenFlow
	version 1.0, type PACKET_IN, length 125, xid 0x00000000
21:28:42.179749 IP 192.168.1.30.49387 > 192.168.1.10.6633: Flags [P.], seq 22692:22817, ack 0, win 58, options [nop,nop,TS val 21917444 ecr 46590355], length 125: OpenFlow
	version 1.0, type PACKET_IN, length 125, xid 0x00000000
21:28:42.179781 IP 192.168.1.30.49387 > 192.168.1.10.6633: Flags [P.], seq 22817:22942, ack 0, win 58, options [nop,nop,TS val 21917444 ecr 46590355], length 125: OpenFlow
	version 1.0, type PACKET_IN, length 125, xid 0x00000000
21:28:42.179807 IP 192.168.1.30.49387 > 192.168.1.10.6633: Flags [P.], seq 22942:23067, ack 0, win 58, options [nop,nop,TS val 21917444 ecr 46590355], length 125: OpenFlow
	version 1.0, type PACKET_IN, length 125, xid 0x00000000
21:28:42.179837 IP 192.168.1.30.49387 > 192.168.1.10.6633: Flags [P.], seq 23067:23192, ack 0, win 58, options [nop,nop,TS val 21917444 ecr 46590355], length 125: OpenFlow
	version 1.0, type PACKET_IN, length 125, xid 0x00000000
21:28:42.179868 IP 192.168.1.30.49387 > 192.168.1.10.6633: Flags [P.], seq 23192:23317, ack 0, win 58, options [nop,nop,TS val 21917444 ecr 46590355], length 125: OpenFlow
	version 1.0, type PACKET_IN, length 125, xid 0x00000000
21:28:42.179897 IP 192.168.1.30.49387 > 192.168.1.10.6633: Flags [P.], seq 23317:23442, ack 0, win 58, options [nop,nop,TS val 21917444 ecr 46590355], length 125: OpenFlow
	version 1.0, type PACKET_IN, length 125, xid 0x00000000
21:28:42.179929 IP 192.168.1.30.49387 > 192.168.1.10.6633: Flags [P.], seq 23442:23567, ack 0, win 58, options [nop,nop,TS val 21917444 ecr 46590355], length 125: OpenFlow
	version 1.0, type PACKET_IN, length 125, xid 0x00000000
21:28:42.180013 IP 192.168.1.10.6633 > 192.168.1.30.49387: Flags [.], ack 22317, win 24576, options [nop,nop,TS val 46590355 ecr 21917444], length 0
21:28:42.180035 IP 192.168.1.30.49387 > 192.168.1.10.6633: Flags [P.], seq 23567:23692, ack 0, win 58, options [nop,nop,TS val 21917444 ecr 46590355], length 125: OpenFlow
	version 1.0, type PACKET_IN, length 125, xid 0x00000000
21:28:42.180068 IP 192.168.1.30.49387 > 192.168.1.10.6633: Flags [P.], seq 23692:23817, ack 0, win 58, options [nop,nop,TS val 21917444 ecr 46590355], length 125: OpenFlow
	version 1.0, type PACKET_IN, length 125, xid 0x00000000
21:28:42.180138 IP 192.168.1.30.49387 > 192.168.1.10.6633: Flags [P.], seq 23817:23942, ack 0, win 58, options [nop,nop,TS val 21917444 ecr 46590355], length 125: OpenFlow
	version 1.0, type PACKET_IN, length 125, xid 0x00000000
21:28:42.180170 IP 192.168.1.30.49387 > 192.168.1.10.6633: Flags [P.], seq 23942:24067, ack 0, win 58, options [nop,nop,TS val 21917444 ecr 46590355], length 125: OpenFlow
	version 1.0, type PACKET_IN, length 125, xid 0x00000000
21:28:42.180196 IP 192.168.1.30.49387 > 192.168.1.10.6633: Flags [P.], seq 24067:24192, ack 0, win 58, options [nop,nop,TS val 21917444 ecr 46590355], length 125: OpenFlow
	version 1.0, type PACKET_IN, length 125, xid 0x00000000
21:28:42.180221 IP 192.168.1.30.49387 > 192.168.1.10.6633: Flags [P.], seq 24192:24317, ack 0, win 58, options [nop,nop,TS val 21917444 ecr 46590355], length 125: OpenFlow
	version 1.0, type PACKET_IN, length 125, xid 0x00000000
21:28:42.180243 IP 192.168.1.30.49387 > 192.168.1.10.6633: Flags [P.], seq 24317:24442, ack 0, win 58, options [nop,nop,TS val 21917444 ecr 46590355], length 125: OpenFlow
	version 1.0, type PACKET_IN, length 125, xid 0x00000000
21:28:42.180262 IP 192.168.1.30.49387 > 192.168.1.10.6633: Flags [P.], seq 24442:24567, ack 0, win 58, options [nop,nop,TS val 21917444 ecr 46590355], length 125: OpenFlow
	version 1.0, type PACKET_IN, length 125, xid 0x00000000
21:28:42.180282 IP 192.168.1.30.49387 > 192.168.1.10.6633: Flags [P.], seq 24567:24692, ack 0, win 58, options [nop,nop,TS val 21917444 ecr 46590355], length 125: OpenFlow
	version 1.0, type PACKET_IN, length 125, xid 0x00000000
21:28:42.180302 IP 192.168.1.30.49387 > 192.168.1.10.6633: Flags [P.], seq 24692:24817, ack 0, win 58, options [nop,nop,TS val 21917444 ecr 46590355], length 125: OpenFlow
	version 1.0, type PACKET_IN, length 125, xid 0x00000000
21:28:42.180322 IP 192.168.1.30.49387 > 192.168.1.10.6633: Flags [P.], seq 24817:24942, ack 0, win 58, options [nop,nop,TS val 21917444 ecr 46590355], length 125: OpenFlow
	version 1.0, type PACKET_IN, length 125, xid 0x00000000
21:28:42.180341 IP 192.168.1.30.49387 > 192.168.1.10.6633: Flags [P.], seq 24942:25067, ack 0, win 58, options [nop,nop,TS val 21917444 ecr 46590355], length 125: OpenFlow
	version 1.0, type PACKET_IN, length 125, xid 0x00000000
21:28:42.180397 IP 192.168.1.10.6633 > 192.168.1.30.49387: Flags [.], ack 23567, win 24576, options [nop,nop,TS val 46590355 ecr 21917444], length 0
21:28:42.180436 IP 192.168.1.30.49387 > 192.168.1.10.6633: Flags [P.], seq 25067:25192, ack 0, win 58, options [nop,nop,TS val 21917444 ecr 46590355], length 125: OpenFlow
	version 1.0, type PACKET_IN, length 125, xid 0x00000000
21:28:42.180480 IP 192.168.1.30.49387 > 192.168.1.10.6633: Flags [P.], seq 25192:25317, ack 0, win 58, options [nop,nop,TS val 21917444 ecr 46590355], length 125: OpenFlow
	version 1.0, type PACKET_IN, length 125, xid 0x00000000
21:28:42.180555 IP 192.168.1.30.49387 > 192.168.1.10.6633: Flags [P.], seq 25317:25442, ack 0, win 58, options [nop,nop,TS val 21917444 ecr 46590355], length 125: OpenFlow
	version 1.0, type PACKET_IN, length 125, xid 0x00000000
21:28:42.180583 IP 192.168.1.30.49387 > 192.168.1.10.6633: Flags [P.], seq 25442:25567, ack 0, win 58, options [nop,nop,TS val 21917444 ecr 46590355], length 125: OpenFlow
	version 1.0, type PACKET_IN, length 125, xid 0x00000000
21:28:42.180611 IP 192.168.1.30.49387 > 192.168.1.10.6633: Flags [P.], seq 25567:25692, ack 0, win 58, options [nop,nop,TS val 21917444 ecr 46590355], length 125: OpenFlow
	version 1.0, type PACKET_IN, length 125, xid 0x00000000
21:28:42.180640 IP 192.168.1.30.49387 > 192.168.1.10.6633: Flags [P.], seq 25692:25817, ack 0, win 58, options [nop,nop,TS val 21917444 ecr 46590355], length 125: OpenFlow
	version 1.0, type PACKET_IN, length 125, xid 0x00000000
21:28:42.180670 IP 192.168.1.30.49387 > 192.168.1.10.6633: Flags [P.], seq 25817:25942, ack 0, win 58, options [nop,nop,TS val 21917444 ecr 46590355], length 125: OpenFlow
	version 1.0, type PACKET_IN, length 125, xid 0x00000000
21:28:42.180705 IP 192.168.1.10.6633 > 192.168.1.30.49387: Flags [.], ack 23817, win 24576, options [nop,nop,TS val 46590355 ecr 21917444], length 0
21:28:42.180719 IP 192.168.1.10.6633 > 192.168.1.30.49387: Flags [.], ack 25192, win 24576, options [nop,nop,TS val 46590355 ecr 21917444], length 0
21:28:42.180764 IP 192.168.1.30.49387 > 192.168.1.10.6633: Flags [P.], seq 25942:26067, ack 0, win 58, options [nop,nop,TS val 21917444 ecr 46590355], length 125: OpenFlow
	version 1.0, type PACKET_IN, length 125, xid 0x00000000
21:28:42.180797 IP 192.168.1.30.49387 > 192.168.1.10.6633: Flags [P.], seq 26067:26192, ack 0, win 58, options [nop,nop,TS val 21917444 ecr 46590355], length 125: OpenFlow
	version 1.0, type PACKET_IN, length 125, xid 0x00000000
21:28:42.180828 IP 192.168.1.30.49387 > 192.168.1.10.6633: Flags [P.], seq 26192:26317, ack 0, win 58, options [nop,nop,TS val 21917444 ecr 46590355], length 125: OpenFlow
	version 1.0, type PACKET_IN, length 125, xid 0x00000000
21:28:42.180910 IP 192.168.1.30.49387 > 192.168.1.10.6633: Flags [P.], seq 26317:26442, ack 0, win 58, options [nop,nop,TS val 21917444 ecr 46590355], length 125: OpenFlow
	version 1.0, type PACKET_IN, length 125, xid 0x00000000
21:28:42.180943 IP 192.168.1.30.49387 > 192.168.1.10.6633: Flags [P.], seq 26442:26567, ack 0, win 58, options [nop,nop,TS val 21917444 ecr 46590355], length 125: OpenFlow
	version 1.0, type PACKET_IN, length 125, xid 0x00000000
21:28:42.180978 IP 192.168.1.30.49387 > 192.168.1.10.6633: Flags [P.], seq 26567:26692, ack 0, win 58, options [nop,nop,TS val 21917444 ecr 46590355], length 125: OpenFlow
	version 1.0, type PACKET_IN, length 125, xid 0x00000000
21:28:42.181056 IP 192.168.1.30.49387 > 192.168.1.10.6633: Flags [P.], seq 26692:26817, ack 0, win 58, options [nop,nop,TS val 21917444 ecr 46590355], length 125: OpenFlow
	version 1.0, type PACKET_IN, length 125, xid 0x00000000
21:28:42.181089 IP 192.168.1.30.49387 > 192.168.1.10.6633: Flags [P.], seq 26817:26942, ack 0, win 58, options [nop,nop,TS val 21917444 ecr 46590355], length 125: OpenFlow
	version 1.0, type PACKET_IN, length 125, xid 0x00000000
21:28:42.181122 IP 192.168.1.30.49387 > 192.168.1.10.6633: Flags [P.], seq 26942:27067, ack 0, win 58, options [nop,nop,TS val 21917444 ecr 46590355], length 125: OpenFlow
