21:28:42.074684 IP 192.168.1.30.49386 > 192.168.1.10.6633: Flags [P.], seq 337492121:337492246, ack 2539381022, win 58, options [nop,nop,TS val 21917418 ecr 46590329], length 125: OpenFlow
	version 1.0, type PACKET_IN, length 125, xid 0x00000000
21:28:42.074748 IP 192.168.1.30.49386 > 192.168.1.10.6633: Flags [P.], seq 125:250, ack 1, win 58, options [nop,nop,TS val 21917418 ecr 46590329], length 125: OpenFlow
	version 1.0, type PACKET_IN, length 125, xid 0x00000000
21:28:42.074784 IP 192.168.1.30.49386 > 192.168.1.10.6633: Flags [P.], seq 250:375, ack 1, win 58, options [nop,nop,TS val 21917418 ecr 46590329], length 125: OpenFlow
	version 1.0, type PACKET_IN, length 125, xid 0x00000000
21:28:42.074817 IP 192.168.1.30.49386 > 192.168.1.10.6633: Flags [P.], seq 375:500, ack 1, win 58, options [nop,nop,TS val 21917418 ecr 46590329], length 125: OpenFlow
	version 1.0, type PACKET_IN, length 125, xid 0x00000000
21:28:42.074850 IP 192.168.1.30.49386 > 192.168.1.10.6633: Flags [P.], seq 500:625, ack 1, win 58, options [nop,nop,TS val 21917418 ecr 46590329], length 125: OpenFlow
	version 1.0, type PACKET_IN, length 125, xid 0x00000000
21:28:42.074886 IP 192.168.1.30.49386 > 192.168.1.10.6633: Flags [P.], seq 625:750, ack 1, win 58, options [nop,nop,TS val 21917418 ecr 46590329], length 125: OpenFlow
	version 1.0, type PACKET_IN, length 125, xid 0x00000000
21:28:42.074916 IP 192.168.1.30.49386 > 192.168.1.10.6633: Flags [P.], seq 750:875, ack 1, win 58, options [nop,nop,TS val 21917418 ecr 46590329], length 125: OpenFlow
	version 1.0, type PACKET_IN, length 125, xid 0x00000000
21:28:42.074948 IP 192.168.1.30.49386 > 192.168.1.10.6633: Flags [P.], seq 875:1000, ack 1, win 58, options [nop,nop,TS val 21917418 ecr 46590329], length 125: OpenFlow
	version 1.0, type PACKET_IN, length 125, xid 0x00000000
21:28:42.074979 IP 192.168.1.30.49386 > 192.168.1.10.6633: Flags [P.], seq 1000:1125, ack 1, win 58, options [nop,nop,TS val 21917418 ecr 46590329], length 125: OpenFlow
	version 1.0, type PACKET_IN, length 125, xid 0x00000000
21:28:42.075012 IP 192.168.1.30.49386 > 192.168.1.10.6633: Flags [P.], seq 1125:1250, ack 1, win 58, options [nop,nop,TS val 21917418 ecr 46590329], length 125: OpenFlow
	version 1.0, type PACKET_IN, length 125, xid 0x00000000
21:28:42.075046 IP 192.168.1.30.49386 > 192.168.1.10.6633: Flags [P.], seq 1250:1375, ack 1, win 58, options [nop,nop,TS val 21917418 ecr 46590329], length 125: OpenFlow
	version 1.0, type PACKET_IN, length 125, xid 0x00000000
21:28:42.075049 IP 192.168.1.10.6633 > 192.168.1.30.49386: Flags [.], ack 125, win 10796, options [nop,nop,TS val 46590329 ecr 21917418], length 0
21:28:42.075070 IP 192.168.1.10.6633 > 192.168.1.30.49386: Flags [.], ack 625, win 10796, options [nop,nop,TS val 46590329 ecr 21917418], length 0
21:28:42.075079 IP 192.168.1.30.49386 > 192.168.1.10.6633: Flags [P.], seq 1375:1500, ack 1, win 58, options [nop,nop,TS val 21917418 ecr 46590329], length 125: OpenFlow
	version 1.0, type PACKET_IN, length 125, xid 0x00000000
21:28:42.075117 IP 192.168.1.30.49386 > 192.168.1.10.6633: Flags [P.], seq 1500:1625, ack 1, win 58, options [nop,nop,TS val 21917418 ecr 46590329], length 125: OpenFlow
	version 1.0, type PACKET_IN, length 125, xid 0x00000000
21:28:42.075150 IP 192.168.1.30.49386 > 192.168.1.10.6633: Flags [P.], seq 1625:1713, ack 1, win 58, options [nop,nop,TS val 21917418 ecr 46590329], length 88: OpenFlow
	version 1.0, type PACKET_IN, length 88, xid 0x00000000
21:28:42.075181 IP 192.168.1.30.49386 > 192.168.1.10.6633: Flags [P.], seq 1713:1838, ack 1, win 58, options [nop,nop,TS val 21917418 ecr 46590329], length 125: OpenFlow
	version 1.0, type PACKET_IN, length 125, xid 0x00000000
21:28:42.075245 IP 192.168.1.30.49386 > 192.168.1.10.6633: Flags [P.], seq 1963:2088, ack 1, win 58, options [nop,nop,TS val 21917418 ecr 46590329], length 125: OpenFlow
	version 1.0, type PACKET_IN, length 125, xid 0x00000000
21:28:42.075278 IP 192.168.1.30.49386 > 192.168.1.10.6633: Flags [P.], seq 2088:2213, ack 1, win 58, options [nop,nop,TS val 21917418 ecr 46590329], length 125: OpenFlow
	version 1.0, type PACKET_IN, length 125, xid 0x00000000
21:28:42.075305 IP 192.168.1.10.6633 > 192.168.1.30.49386: Flags [.], ack 1250, win 10796, options [nop,nop,TS val 46590329 ecr 21917418], length 0
21:28:42.075333 IP 192.168.1.10.6633 > 192.168.1.30.49386: Flags [.], ack 1625, win 10796, options [nop,nop,TS val 46590329 ecr 21917418], length 0
21:28:42.075353 IP 192.168.1.30.49386 > 192.168.1.10.6633: Flags [P.], seq 2213:2338, ack 1, win 58, options [nop,nop,TS val 21917418 ecr 46590329], length 125: OpenFlow
	version 1.0, type PACKET_IN, length 125, xid 0x00000000
21:28:42.075391 IP 192.168.1.30.49386 > 192.168.1.10.6633: Flags [P.], seq 2338:2463, ack 1, win 58, options [nop,nop,TS val 21917418 ecr 46590329], length 125: OpenFlow
	version 1.0, type PACKET_IN, length 125, xid 0x00000000
21:28:42.075424 IP 192.168.1.30.49386 > 192.168.1.10.6633: Flags [P.], seq 2463:2588, ack 1, win 58, options [nop,nop,TS val 21917418 ecr 46590329], length 125: OpenFlow
	version 1.0, type PACKET_IN, length 125, xid 0x00000000
21:28:42.075459 IP 192.168.1.30.49386 > 192.168.1.10.6633: Flags [P.], seq 2588:2713, ack 1, win 58, options [nop,nop,TS val 21917418 ecr 46590329], length 125: OpenFlow
	version 1.0, type PACKET_IN, length 125, xid 0x00000000
21:28:42.075495 IP 192.168.1.30.49386 > 192.168.1.10.6633: Flags [P.], seq 2713:2838, ack 1, win 58, options [nop,nop,TS val 21917418 ecr 46590329], length 125: OpenFlow
	version 1.0, type PACKET_IN, length 125, xid 0x00000000
21:28:42.075531 IP 192.168.1.30.49386 > 192.168.1.10.6633: Flags [P.], seq 2838:2963, ack 1, win 58, options [nop,nop,TS val 21917418 ecr 46590329], length 125: OpenFlow
	version 1.0, type PACKET_IN, length 125, xid 0x00000000
21:28:42.075566 IP 192.168.1.30.49386 > 192.168.1.10.6633: Flags [P.], seq 2963:3088, ack 1, win 58, options [nop,nop,TS val 21917418 ecr 46590329], length 125: OpenFlow
	version 1.0, type PACKET_IN, length 125, xid 0x00000000
21:28:42.075602 IP 192.168.1.30.49386 > 192.168.1.10.6633: Flags [P.], seq 3088:3213, ack 1, win 58, options [nop,nop,TS val 21917418 ecr 46590329], length 125: OpenFlow
	version 1.0, type PACKET_IN, length 125, xid 0x00000000
21:28:42.075607 IP 192.168.1.10.6633 > 192.168.1.30.49386: Flags [.], ack 2213, win 10796, options [nop,nop,TS val 46590329 ecr 21917418], length 0
21:28:42.075643 IP 192.168.1.30.49386 > 192.168.1.10.6633: Flags [P.], seq 3213:3338, ack 1, win 58, options [nop,nop,TS val 21917418 ecr 46590329], length 125: OpenFlow
	version 1.0, type PACKET_IN, length 125, xid 0x00000000
21:28:42.075646 IP 192.168.1.10.6633 > 192.168.1.30.49386: Flags [.], ack 2338, win 10796, options [nop,nop,TS val 46590329 ecr 21917418], length 0
21:28:42.075661 IP 192.168.1.10.6633 > 192.168.1.30.49386: Flags [.], ack 2713, win 10796, options [nop,nop,TS val 46590329 ecr 21917418], length 0
21:28:42.075715 IP 192.168.1.10.6633 > 192.168.1.30.49386: Flags [.], ack 3088, win 10796, options [nop,nop,TS val 46590329 ecr 21917418], length 0
21:28:42.076055 IP 192.168.1.10.6633 > 192.168.1.30.49386: Flags [.], ack 3338, win 10796, options [nop,nop,TS val 46590329 ecr 21917418], length 0
21:28:42.108304 IP 192.168.1.30.49386 > 192.168.1.10.6633: Flags [P.], seq 3338:3463, ack 1, win 58, options [nop,nop,TS val 21917426 ecr 46590329], length 125: OpenFlow
	version 1.0, type PACKET_IN, length 125, xid 0x00000000
21:28:42.108347 IP 192.168.1.30.49386 > 192.168.1.10.6633: Flags [P.], seq 3463:3588, ack 1, win 58, options [nop,nop,TS val 21917426 ecr 46590329], length 125: OpenFlow
	version 1.0, type PACKET_IN, length 125, xid 0x00000000
21:28:42.108390 IP 192.168.1.30.49386 > 192.168.1.10.6633: Flags [P.], seq 3588:3713, ack 1, win 58, options [nop,nop,TS val 21917426 ecr 46590329], length 125: OpenFlow
	version 1.0, type PACKET_IN, length 125, xid 0x00000000
21:28:42.108423 IP 192.168.1.30.49386 > 192.168.1.10.6633: Flags [P.], seq 3713:3838, ack 1, win 58, options [nop,nop,TS val 21917426 ecr 46590329], length 125: OpenFlow
	version 1.0, type PACKET_IN, length 125, xid 0x00000000
21:28:42.108453 IP 192.168.1.30.49386 > 192.168.1.10.6633: Flags [P.], seq 3838:3963, ack 1, win 58, options [nop,nop,TS val 21917426 ecr 46590329], length 125: OpenFlow
	version 1.0, type PACKET_IN, length 125, xid 0x00000000
21:28:42.108484 IP 192.168.1.30.49386 > 192.168.1.10.6633: Flags [P.], seq 3963:4088, ack 1, win 58, options [nop,nop,TS val 21917426 ecr 46590329], length 125: OpenFlow
	version 1.0, type PACKET_IN, length 125, xid 0x00000000
21:28:42.108517 IP 192.168.1.30.49386 > 192.168.1.10.6633: Flags [P.], seq 4088:4213, ack 1, win 58, options [nop,nop,TS val 21917426 ecr 46590329], length 125: OpenFlow
	version 1.0, type PACKET_IN, length 125, xid 0x00000000
21:28:42.108546 IP 192.168.1.30.49386 > 192.168.1.10.6633: Flags [P.], seq 4213:4338, ack 1, win 58, options [nop,nop,TS val 21917426 ecr 46590329], length 125: OpenFlow
	version 1.0, type PACKET_IN, length 125, xid 0x00000000
21:28:42.108574 IP 192.168.1.30.49386 > 192.168.1.10.6633: Flags [P.], seq 4338:4463, ack 1, win 58, options [nop,nop,TS val 21917426 ecr 46590329], length 125: OpenFlow
	version 1.0, type PACKET_IN, length 125, xid 0x00000000
21:28:42.108603 IP 192.168.1.30.49386 > 192.168.1.10.6633: Flags [P.], seq 4463:4588, ack 1, win 58, options [nop,nop,TS val 21917426 ecr 46590329], length 125: OpenFlow
	version 1.0, type PACKET_IN, length 125, xid 0x00000000
21:28:42.108632 IP 192.168.1.30.49386 > 192.168.1.10.6633: Flags [P.], seq 4588:4713, ack 1, win 58, options [nop,nop,TS val 21917426 ecr 46590329], length 125: OpenFlow
	version 1.0, type PACKET_IN, length 125, xid 0x00000000
21:28:42.108661 IP 192.168.1.30.49386 > 192.168.1.10.6633: Flags [P.], seq 4713:4838, ack 1, win 58, options [nop,nop,TS val 21917426 ecr 46590329], length 125: OpenFlow
	version 1.0, type PACKET_IN, length 125, xid 0x00000000
21:28:42.108691 IP 192.168.1.30.49386 > 192.168.1.10.6633: Flags [P.], seq 4838:4963, ack 1, win 58, options [nop,nop,TS val 21917426 ecr 46590329], length 125: OpenFlow
	version 1.0, type PACKET_IN, length 125, xid 0x00000000
21:28:42.108722 IP 192.168.1.30.49386 > 192.168.1.10.6633: Flags [P.], seq 4963:5088, ack 1, win 58, options [nop,nop,TS val 21917426 ecr 46590329], length 125: OpenFlow
	version 1.0, type PACKET_IN, length 125, xid 0x00000000
21:28:42.108754 IP 192.168.1.30.49386 > 192.168.1.10.6633: Flags [P.], seq 5088:5213, ack 1, win 58, options [nop,nop,TS val 21917426 ecr 46590329], length 125: OpenFlow
	version 1.0, type PACKET_IN, length 125, xid 0x00000000
21:28:42.108784 IP 192.168.1.30.49386 > 192.168.1.10.6633: Flags [P.], seq 5213:5338, ack 1, win 58, options [nop,nop,TS val 21917426 ecr 46590329], length 125: OpenFlow
	version 1.0, type PACKET_IN, length 125, xid 0x00000000
21:28:42.108802 IP 192.168.1.10.6633 > 192.168.1.30.49386: Flags [.], ack 3838, win 10796, options [nop,nop,TS val 46590337 ecr 21917426], length 0
21:28:42.108817 IP 192.168.1.10.6633 > 192.168.1.30.49386: Flags [.], ack 4588, win 10796, options [nop,nop,TS val 46590337 ecr 21917426], length 0
21:28:42.108820 IP 192.168.1.30.49386 > 192.168.1.10.6633: Flags [P.], seq 5338:5463, ack 1, win 58, options [nop,nop,TS val 21917426 ecr 46590337], length 125: OpenFlow
	version 1.0, type PACKET_IN, length 125, xid 0x00000000
21:28:42.108858 IP 192.168.1.30.49386 > 192.168.1.10.6633: Flags [P.], seq 5463:5588, ack 1, win 58, options [nop,nop,TS val 21917426 ecr 46590337], length 125: OpenFlow
	version 1.0, type PACKET_IN, length 125, xid 0x00000000
21:28:42.108887 IP 192.168.1.30.49386 > 192.168.1.10.6633: Flags [P.], seq 5588:5713, ack 1, win 58, options [nop,nop,TS val 21917426 ecr 46590337], length 125: OpenFlow
	version 1.0, type PACKET_IN, length 125, xid 0x00000000
21:28:42.108915 IP 192.168.1.30.49386 > 192.168.1.10.6633: Flags [P.], seq 5713:5838, ack 1, win 58, options [nop,nop,TS val 21917426 ecr 46590337], length 125: OpenFlow
	version 1.0, type PACKET_IN, length 125, xid 0x00000000
21:28:42.108945 IP 192.168.1.30.49386 > 192.168.1.10.6633: Flags [P.], seq 5838:5963, ack 1, win 58, options [nop,nop,TS val 21917426 ecr 46590337], length 125: OpenFlow
	version 1.0, type PACKET_IN, length 125, xid 0x00000000
21:28:42.108974 IP 192.168.1.30.49386 > 192.168.1.10.6633: Flags [P.], seq 5963:6088, ack 1, win 58, options [nop,nop,TS val 21917426 ecr 46590337], length 125: OpenFlow
	version 1.0, type PACKET_IN, length 125, xid 0x00000000
21:28:42.109004 IP 192.168.1.30.49386 > 192.168.1.10.6633: Flags [P.], seq 6088:6213, ack 1, win 58, options [nop,nop,TS val 21917426 ecr 46590337], length 125: OpenFlow
	version 1.0, type PACKET_IN, length 125, xid 0x00000000
21:28:42.109034 IP 192.168.1.30.49386 > 192.168.1.10.6633: Flags [P.], seq 6213:6338, ack 1, win 58, options [nop,nop,TS val 21917426 ecr 46590337], length 125: OpenFlow
	version 1.0, type PACKET_IN, length 125, xid 0x00000000
21:28:42.109067 IP 192.168.1.30.49386 > 192.168.1.10.6633: Flags [P.], seq 6338:6463, ack 1, win 58, options [nop,nop,TS val 21917426 ecr 46590337], length 125: OpenFlow
	version 1.0, type PACKET_IN, length 125, xid 0x00000000
21:28:42.109081 IP 192.168.1.10.6633 > 192.168.1.30.49386: Flags [.], ack 5588, win 10796, options [nop,nop,TS val 46590337 ecr 21917426], length 0
21:28:42.109097 IP 192.168.1.30.49386 > 192.168.1.10.6633: Flags [P.], seq 6463:6588, ack 1, win 58, options [nop,nop,TS val 21917426 ecr 46590337], length 125: OpenFlow
	version 1.0, type PACKET_IN, length 125, xid 0x00000000
21:28:42.109126 IP 192.168.1.30.49386 > 192.168.1.10.6633: Flags [P.], seq 6588:6713, ack 1, win 58, options [nop,nop,TS val 21917426 ecr 46590337], length 125: OpenFlow
	version 1.0, type PACKET_IN, length 125, xid 0x00000000
21:28:42.109153 IP 192.168.1.30.49386 > 192.168.1.10.6633: Flags [P.], seq 6713:6838, ack 1, win 58, options [nop,nop,TS val 21917426 ecr 46590337], length 125: OpenFlow
	version 1.0, type PACKET_IN, length 125, xid 0x00000000
21:28:42.109202 IP 192.168.1.30.49386 > 192.168.1.10.6633: Flags [P.], seq 6838:6963, ack 1, win 58, options [nop,nop,TS val 21917426 ecr 46590337], length 125: OpenFlow
	version 1.0, type PACKET_IN, length 125, xid 0x00000000
21:28:42.109466 IP 192.168.1.10.6633 > 192.168.1.30.49386: Flags [.], ack 6213, win 10796, options [nop,nop,TS val 46590338 ecr 21917426], length 0
21:28:42.109484 IP 192.168.1.10.6633 > 192.168.1.30.49386: Flags [.], ack 6713, win 10796, options [nop,nop,TS val 46590338 ecr 21917426], length 0
21:28:42.109493 IP 192.168.1.10.6633 > 192.168.1.30.49386: Flags [.], ack 6963, win 10796, options [nop,nop,TS val 46590338 ecr 21917426], length 0
21:28:42.109509 IP 192.168.1.30.49386 > 192.168.1.10.6633: Flags [P.], seq 6963:7088, ack 1, win 58, options [nop,nop,TS val 21917427 ecr 46590338], length 125: OpenFlow
	version 1.0, type PACKET_IN, length 125, xid 0x00000000
21:28:42.109543 IP 192.168.1.30.49386 > 192.168.1.10.6633: Flags [P.], seq 7088:7213, ack 1, win 58, options [nop,nop,TS val 21917427 ecr 46590338], length 125: OpenFlow
	version 1.0, type PACKET_IN, length 125, xid 0x00000000
21:28:42.109572 IP 192.168.1.30.49386 > 192.168.1.10.6633: Flags [P.], seq 7213:7338, ack 1, win 58, options [nop,nop,TS val 21917427 ecr 46590338], length 125: OpenFlow
	version 1.0, type PACKET_IN, length 125, xid 0x00000000
21:28:42.109601 IP 192.168.1.30.49386 > 192.168.1.10.6633: Flags [P.], seq 7338:7463, ack 1, win 58, options [nop,nop,TS val 21917427 ecr 46590338], length 125: OpenFlow
	version 1.0, type PACKET_IN, length 125, xid 0x00000000
21:28:42.109632 IP 192.168.1.30.49386 > 192.168.1.10.6633: Flags [P.], seq 7463:7588, ack 1, win 58, options [nop,nop,TS val 21917427 ecr 46590338], length 125: OpenFlow
	version 1.0, type PACKET_IN, length 125, xid 0x00000000
21:28:42.109662 IP 192.168.1.30.49386 > 192.168.1.10.6633: Flags [P.], seq 7588:7713, ack 1, win 58, options [nop,nop,TS val 21917427 ecr 46590338], length 125: OpenFlow
	version 1.0, type PACKET_IN, length 125, xid 0x00000000
21:28:42.109692 IP 192.168.1.30.49386 > 192.168.1.10.6633: Flags [P.], seq 7713:7838, ack 1, win 58, options [nop,nop,TS val 21917427 ecr 46590338], length 125: OpenFlow
	version 1.0, type PACKET_IN, length 125, xid 0x00000000
21:28:42.109722 IP 192.168.1.30.49386 > 192.168.1.10.6633: Flags [P.], seq 7838:7963, ack 1, win 58, options [nop,nop,TS val 21917427 ecr 46590338], length 125: OpenFlow
	version 1.0, type PACKET_IN, length 125, xid 0x00000000
21:28:42.109753 IP 192.168.1.30.49386 > 192.168.1.10.6633: Flags [P.], seq 7963:8088, ack 1, win 58, options [nop,nop,TS val 21917427 ecr 46590338], length 125: OpenFlow
	version 1.0, type PACKET_IN, length 125, xid 0x00000000
21:28:42.109784 IP 192.168.1.30.49386 > 192.168.1.10.6633: Flags [P.], seq 8088:8213, ack 1, win 58, options [nop,nop,TS val 21917427 ecr 46590338], length 125: OpenFlow
	version 1.0, type PACKET_IN, length 125, xid 0x00000000
21:28:42.109816 IP 192.168.1.30.49386 > 192.168.1.10.6633: Flags [P.], seq 8213:8338, ack 1, win 58, options [nop,nop,TS val 21917427 ecr 46590338], length 125: OpenFlow
	version 1.0, type PACKET_IN, length 125, xid 0x00000000
21:28:42.109845 IP 192.168.1.30.49386 > 192.168.1.10.6633: Flags [P.], seq 8338:8463, ack 1, win 58, options [nop,nop,TS val 21917427 ecr 46590338], length 125: OpenFlow
	version 1.0, type PACKET_IN, length 125, xid 0x00000000
21:28:42.109874 IP 192.168.1.30.49386 > 192.168.1.10.6633: Flags [P.], seq 8463:8588, ack 1, win 58, options [nop,nop,TS val 21917427 ecr 46590338], length 125: OpenFlow
	version 1.0, type PACKET_IN, length 125, xid 0x00000000
21:28:42.109903 IP 192.168.1.30.49386 > 192.168.1.10.6633: Flags [P.], seq 8588:8713, ack 1, win 58, options [nop,nop,TS val 21917427 ecr 46590338], length 125: OpenFlow
	version 1.0, type PACKET_IN, length 125, xid 0x00000000
21:28:42.109946 IP 192.168.1.30.49386 > 192.168.1.10.6633: Flags [P.], seq 8713:8838, ack 1, win 58, options [nop,nop,TS val 21917427 ecr 46590338], length 125: OpenFlow
	version 1.0, type PACKET_IN, length 125, xid 0x00000000
21:28:42.109977 IP 192.168.1.30.49386 > 192.168.1.10.6633: Flags [P.], seq 8838:8963, ack 1, win 58, options [nop,nop,TS val 21917427 ecr 46590338], length 125: OpenFlow
	version 1.0, type PACKET_IN, length 125, xid 0x00000000
21:28:42.110008 IP 192.168.1.30.49386 > 192.168.1.10.6633: Flags [P.], seq 8963:9088, ack 1, win 58, options [nop,nop,TS val 21917427 ecr 46590338], length 125: OpenFlow
	version 1.0, type PACKET_IN, length 125, xid 0x00000000
21:28:42.110039 IP 192.168.1.30.49386 > 192.168.1.10.6633: Flags [P.], seq 9088:9213, ack 1, win 58, options [nop,nop,TS val 21917427 ecr 46590338], length 125: OpenFlow
	version 1.0, type PACKET_IN, length 125, xid 0x00000000
21:28:42.110069 IP 192.168.1.30.49386 > 192.168.1.10.6633: Flags [P.], seq 9213:9338, ack 1, win 58, options [nop,nop,TS val 21917427 ecr 46590338], length 125: OpenFlow
	version 1.0, type PACKET_IN, length 125, xid 0x00000000
21:28:42.110101 IP 192.168.1.30.49386 > 192.168.1.10.6633: Flags [P.], seq 9338:9463, ack 1, win 58, options [nop,nop,TS val 21917427 ecr 46590338], length 125: OpenFlow
	version 1.0, type PACKET_IN, length 125, xid 0x00000000
21:28:42.110134 IP 192.168.1.30.49386 > 192.168.1.10.6633: Flags [P.], seq 9463:9588, ack 1, win 58, options [nop,nop,TS val 21917427 ecr 46590338], length 125: OpenFlow
	version 1.0, type PACKET_IN, length 125, xid 0x00000000
21:28:42.110172 IP 192.168.1.30.49386 > 192.168.1.10.6633: Flags [P.], seq 9588:9713, ack 1, win 58, options [nop,nop,TS val 21917427 ecr 46590338], length 125: OpenFlow
	version 1.0, type PACKET_IN, length 125, xid 0x00000000
21:28:42.110202 IP 192.168.1.30.49386 > 192.168.1.10.6633: Flags [P.], seq 9713:9838, ack 1, win 58, options [nop,nop,TS val 21917427 ecr 46590338], length 125: OpenFlow
	version 1.0, type PACKET_IN, length 125, xid 0x00000000
21:28:42.110231 IP 192.168.1.30.49386 > 192.168.1.10.6633: Flags [P.], seq 9838:9963, ack 1, win 58, options [nop,nop,TS val 21917427 ecr 46590338], length 125: OpenFlow
	version 1.0, type PACKET_IN, length 125, xid 0x00000000
21:28:42.110261 IP 192.168.1.30.49386 > 192.168.1.10.6633: Flags [P.], seq 9963:10088, ack 1, win 58, options [nop,nop,TS val 21917427 ecr 46590338], length 125: OpenFlow
	version 1.0, type PACKET_IN, length 125, xid 0x00000000
21:28:42.110290 IP 192.168.1.30.49386 > 192.168.1.10.6633: Flags [P.], seq 10088:10213, ack 1, win 58, options [nop,nop,TS val 21917427 ecr 46590338], length 125: OpenFlow
	version 1.0, type PACKET_IN, length 125, xid 0x00000000
21:28:42.110320 IP 192.168.1.30.49386 > 192.168.1.10.6633: Flags [P.], seq 10213:10338, ack 1, win 58, options [nop,nop,TS val 21917427 ecr 46590338], length 125: OpenFlow
	version 1.0, type PACKET_IN, length 125, xid 0x00000000
21:28:42.110353 IP 192.168.1.30.49386 > 192.168.1.10.6633: Flags [P.], seq 10338:10463, ack 1, win 58, options [nop,nop,TS val 21917427 ecr 46590338], length 125: OpenFlow
	version 1.0, type PACKET_IN, length 125, xid 0x00000000
21:28:42.110386 IP 192.168.1.30.49386 > 192.168.1.10.6633: Flags [P.], seq 10463:10588, ack 1, win 58, options [nop,nop,TS val 21917427 ecr 46590338], length 125: OpenFlow
	version 1.0, type PACKET_IN, length 125, xid 0x00000000
21:28:42.111309 IP 192.168.1.10.6633 > 192.168.1.30.49386: Flags [.], ack 8463, win 10796, options [nop,nop,TS val 46590338 ecr 21917427], length 0
21:28:42.111330 IP 192.168.1.30.49386 > 192.168.1.10.6633: Flags [.], seq 10588:14932, ack 1, win 58, options [nop,nop,TS val 21917427 ecr 46590338], length 4344: OpenFlow
	version 1.0, type PACKET_IN, length 125, xid 0x00000000
	version 1.0, type PACKET_IN, length 125, xid 0x00000000
	version 1.0, type PACKET_IN, length 125, xid 0x00000000
	version 1.0, type PACKET_IN, length 125, xid 0x00000000
	version 1.0, type PACKET_IN, length 125, xid 0x00000000
	version 1.0, type PACKET_IN, length 125, xid 0x00000000
	version 1.0, type PACKET_IN, length 125, xid 0x00000000
	version 1.0, type PACKET_IN, length 125, xid 0x00000000
	version 1.0, type PACKET_IN, length 125, xid 0x00000000
	version 1.0, type PACKET_IN, length 125, xid 0x00000000
	version 1.0, type PACKET_IN, length 125, xid 0x00000000
	version 1.0, type PACKET_IN, length 125, xid 0x00000000
	version 1.0, type PACKET_IN, length 125, xid 0x00000000
	version 1.0, type PACKET_IN, length 125, xid 0x00000000
	version 1.0, type PACKET_IN, length 125, xid 0x00000000
	version 1.0, type PACKET_IN, length 125, xid 0x00000000
	version 1.0, type PACKET_IN, length 125, xid 0x00000000
	version 1.0, type PACKET_IN, length 125, xid 0x00000000
	version 1.0, type PACKET_IN, length 125, xid 0x00000000
	version 1.0, type PACKET_IN, length 125, xid 0x00000000
	version 1.0, type PACKET_IN, length 125, xid 0x00000000
	version 1.0, type PACKET_IN, length 125, xid 0x00000000
	version 1.0, type PACKET_IN, length 125, xid 0x00000000
	version 1.0, type PACKET_IN, length 125, xid 0x00000000
	version 1.0, type PACKET_IN, length 125, xid 0x00000000
	version 1.0, type PACKET_IN, length 125, xid 0x00000000
	version 1.0, type PACKET_IN, length 125, xid 0x00000000
	version 1.0, type PACKET_IN, length 125, xid 0x00000000
	version 1.0, type PACKET_IN, length 125, xid 0x00000000
	version 1.0, type PACKET_IN, length 125, xid 0x00000000
	version 1.0, type PACKET_IN, length 125, xid 0x00000000
	version 1.0, type PACKET_IN, length 125, xid 0x00000000
	version 1.0, type PACKET_IN, length 125, xid 0x00000000
	version 1.0, type PACKET_IN, length 125, xid 0x00000000
	version 1.0, type PACKET_IN, length 125, xid 0x00000000 [|openflow]
21:28:42.111930 IP 192.168.1.30.49386 > 192.168.1.10.6633: Flags [.], seq 14932:19276, ack 1, win 58, options [nop,nop,TS val 21917427 ecr 46590338], length 4344: OpenFlow
	version unknown (0x69), type 0x70, length 28787, xid 0x045f7463 [|openflow]
21:28:42.112021 IP 192.168.1.10.6633 > 192.168.1.30.49386: Flags [.], ack 9963, win 10796, options [nop,nop,TS val 46590338 ecr 21917427], length 0
21:28:42.112034 IP 192.168.1.10.6633 > 192.168.1.30.49386: Flags [.], ack 10588, win 10796, options [nop,nop,TS val 46590338 ecr 21917427], length 0
21:28:42.112119 IP 192.168.1.10.6633 > 192.168.1.30.49386: Flags [.], ack 14932, win 10796, options [nop,nop,TS val 46590338 ecr 21917427], length 0
21:28:42.112199 IP 192.168.1.10.6633 > 192.168.1.30.49386: Flags [.], ack 19276, win 10796, options [nop,nop,TS val 46590338 ecr 21917427], length 0
21:28:42.112360 IP 192.168.1.30.49386 > 192.168.1.10.6633: Flags [.], seq 19276:23620, ack 1, win 58, options [nop,nop,TS val 21917427 ecr 46590338], length 4344: OpenFlow
	version unknown (0x74), type 0x63, length 28677, xid 0x6c6f6361 [|openflow]
21:28:42.112372 IP 192.168.1.30.49386 > 192.168.1.10.6633: Flags [P.], seq 23620:24389, ack 1, win 58, options [nop,nop,TS val 21917427 ecr 46590338], length 769: OpenFlow
	version unknown (0x63), type 0x61, length 27648, xid 0x000c0001 [|openflow]
21:28:42.113024 IP 192.168.1.10.6633 > 192.168.1.30.49386: Flags [.], ack 23620, win 10796, options [nop,nop,TS val 46590338 ecr 21917427], length 0
21:28:42.113053 IP 192.168.1.10.6633 > 192.168.1.30.49386: Flags [.], ack 24389, win 10796, options [nop,nop,TS val 46590338 ecr 21917427], length 0
21:28:42.137334 IP 192.168.1.30.49386 > 192.168.1.10.6633: Flags [P.], seq 24389:24514, ack 1, win 58, options [nop,nop,TS val 21917431 ecr 46590338], length 125: OpenFlow
	version 1.0, type PACKET_IN, length 125, xid 0x00000000
21:28:42.137350 IP 192.168.1.30.49386 > 192.168.1.10.6633: Flags [P.], seq 24514:24639, ack 1, win 58, options [nop,nop,TS val 21917431 ecr 46590338], length 125: OpenFlow
	version 1.0, type PACKET_IN, length 125, xid 0x00000000
21:28:42.137365 IP 192.168.1.30.49386 > 192.168.1.10.6633: Flags [P.], seq 24639:24764, ack 1, win 58, options [nop,nop,TS val 21917431 ecr 46590338], length 125: OpenFlow
	version 1.0, type PACKET_IN, length 125, xid 0x00000000
21:28:42.137380 IP 192.168.1.30.49386 > 192.168.1.10.6633: Flags [P.], seq 24764:24889, ack 1, win 58, options [nop,nop,TS val 21917431 ecr 46590338], length 125: OpenFlow
	version 1.0, type PACKET_IN, length 125, xid 0x00000000
21:28:42.137394 IP 192.168.1.30.49386 > 192.168.1.10.6633: Flags [P.], seq 24889:25014, ack 1, win 58, options [nop,nop,TS val 21917431 ecr 46590338], length 125: OpenFlow
	version 1.0, type PACKET_IN, length 125, xid 0x00000000
21:28:42.137408 IP 192.168.1.30.49386 > 192.168.1.10.6633: Flags [P.], seq 25014:25139, ack 1, win 58, options [nop,nop,TS val 21917431 ecr 46590338], length 125: OpenFlow
	version 1.0, type PACKET_IN, length 125, xid 0x00000000
21:28:42.137422 IP 192.168.1.30.49386 > 192.168.1.10.6633: Flags [P.], seq 25139:25264, ack 1, win 58, options [nop,nop,TS val 21917431 ecr 46590338], length 125: OpenFlow
	version 1.0, type PACKET_IN, length 125, xid 0x00000000
21:28:42.137438 IP 192.168.1.30.49386 > 192.168.1.10.6633: Flags [P.], seq 25264:25389, ack 1, win 58, options [nop,nop,TS val 21917431 ecr 46590338], length 125: OpenFlow
	version 1.0, type PACKET_IN, length 125, xid 0x00000000
21:28:42.137453 IP 192.168.1.30.49386 > 192.168.1.10.6633: Flags [P.], seq 25389:25514, ack 1, win 58, options [nop,nop,TS val 21917431 ecr 46590338], length 125: OpenFlow
	version 1.0, type PACKET_IN, length 125, xid 0x00000000
21:28:42.137469 IP 192.168.1.30.49386 > 192.168.1.10.6633: Flags [P.], seq 25514:25639, ack 1, win 58, options [nop,nop,TS val 21917431 ecr 46590338], length 125: OpenFlow
	version 1.0, type PACKET_IN, length 125, xid 0x00000000
21:28:42.137484 IP 192.168.1.30.49386 > 192.168.1.10.6633: Flags [P.], seq 25639:25764, ack 1, win 58, options [nop,nop,TS val 21917431 ecr 46590338], length 125: OpenFlow
	version 1.0, type PACKET_IN, length 125, xid 0x00000000
21:28:42.137499 IP 192.168.1.30.49386 > 192.168.1.10.6633: Flags [P.], seq 25764:25889, ack 1, win 58, options [nop,nop,TS val 21917431 ecr 46590338], length 125: OpenFlow
	version 1.0, type PACKET_IN, length 125, xid 0x00000000
21:28:42.137514 IP 192.168.1.30.49386 > 192.168.1.10.6633: Flags [P.], seq 25889:26014, ack 1, win 58, options [nop,nop,TS val 21917431 ecr 46590338], length 125: OpenFlow
	version 1.0, type PACKET_IN, length 125, xid 0x00000000
21:28:42.137535 IP 192.168.1.30.49386 > 192.168.1.10.6633: Flags [P.], seq 26014:26139, ack 1, win 58, options [nop,nop,TS val 21917431 ecr 46590338], length 125: OpenFlow
	version 1.0, type PACKET_IN, length 125, xid 0x00000000
21:28:42.137551 IP 192.168.1.30.49386 > 192.168.1.10.6633: Flags [P.], seq 26139:26264, ack 1, win 58, options [nop,nop,TS val 21917431 ecr 46590338], length 125: OpenFlow
	version 1.0, type PACKET_IN, length 125, xid 0x00000000
21:28:42.137566 IP 192.168.1.30.49386 > 192.168.1.10.6633: Flags [P.], seq 26264:26389, ack 1, win 58, options [nop,nop,TS val 21917431 ecr 46590338], length 125: OpenFlow
	version 1.0, type PACKET_IN, length 125, xid 0x00000000
21:28:42.137582 IP 192.168.1.30.49386 > 192.168.1.10.6633: Flags [P.], seq 26389:26514, ack 1, win 58, options [nop,nop,TS val 21917431 ecr 46590338], length 125: OpenFlow
	version 1.0, type PACKET_IN, length 125, xid 0x00000000
21:28:42.137595 IP 192.168.1.10.6633 > 192.168.1.30.49386: Flags [.], ack 25139, win 10796, options [nop,nop,TS val 46590345 ecr 21917431], length 0
21:28:42.137597 IP 192.168.1.30.49386 > 192.168.1.10.6633: Flags [P.], seq 26514:26639, ack 1, win 58, options [nop,nop,TS val 21917431 ecr 46590338], length 125: OpenFlow
	version 1.0, type PACKET_IN, length 125, xid 0x00000000
21:28:42.137612 IP 192.168.1.30.49386 > 192.168.1.10.6633: Flags [P.], seq 26639:26764, ack 1, win 58, options [nop,nop,TS val 21917431 ecr 46590338], length 125: OpenFlow
	version 1.0, type PACKET_IN, length 125, xid 0x00000000
21:28:42.137627 IP 192.168.1.30.49386 > 192.168.1.10.6633: Flags [P.], seq 26764:26889, ack 1, win 58, options [nop,nop,TS val 21917431 ecr 46590338], length 125: OpenFlow
	version 1.0, type PACKET_IN, length 125, xid 0x00000000
21:28:42.137642 IP 192.168.1.30.49386 > 192.168.1.10.6633: Flags [P.], seq 26889:27014, ack 1, win 58, options [nop,nop,TS val 21917431 ecr 46590338], length 125: OpenFlow
	version 1.0, type PACKET_IN, length 125, xid 0x00000000
21:28:42.137656 IP 192.168.1.30.49386 > 192.168.1.10.6633: Flags [P.], seq 27014:27139, ack 1, win 58, options [nop,nop,TS val 21917431 ecr 46590338], length 125: OpenFlow
	version 1.0, type PACKET_IN, length 125, xid 0x00000000
21:28:42.137669 IP 192.168.1.30.49386 > 192.168.1.10.6633: Flags [P.], seq 27139:27264, ack 1, win 58, options [nop,nop,TS val 21917431 ecr 46590338], length 125: OpenFlow
	version 1.0, type PACKET_IN, length 125, xid 0x00000000
21:28:42.137678 IP 192.168.1.10.6633 > 192.168.1.30.49386: Flags [.], ack 26389, win 10796, options [nop,nop,TS val 46590345 ecr 21917431], length 0
21:28:42.137684 IP 192.168.1.30.49386 > 192.168.1.10.6633: Flags [P.], seq 27264:27389, ack 1, win 58, options [nop,nop,TS val 21917431 ecr 46590338], length 125: OpenFlow
	version 1.0, type PACKET_IN, length 125, xid 0x00000000
21:28:42.137699 IP 192.168.1.30.49386 > 192.168.1.10.6633: Flags [P.], seq 27389:27514, ack 1, win 58, options [nop,nop,TS val 21917431 ecr 46590338], length 125: OpenFlow
	version 1.0, type PACKET_IN, length 125, xid 0x00000000
21:28:42.137714 IP 192.168.1.30.49386 > 192.168.1.10.6633: Flags [P.], seq 27514:27639, ack 1, win 58, options [nop,nop,TS val 21917431 ecr 46590338], length 125: OpenFlow
	version 1.0, type PACKET_IN, length 125, xid 0x00000000
21:28:42.137902 IP 192.168.1.30.49386 > 192.168.1.10.6633: Flags [P.], seq 27639:27764, ack 1, win 58, options [nop,nop,TS val 21917431 ecr 46590338], length 125: OpenFlow
	version 1.0, type PACKET_IN, length 125, xid 0x00000000
21:28:42.137917 IP 192.168.1.30.49386 > 192.168.1.10.6633: Flags [P.], seq 27764:27889, ack 1, win 58, options [nop,nop,TS val 21917431 ecr 46590338], length 125: OpenFlow
	version 1.0, type PACKET_IN, length 125, xid 0x00000000
21:28:42.138227 IP 192.168.1.30.49386 > 192.168.1.10.6633: Flags [P.], seq 27889:28014, ack 1, win 58, options [nop,nop,TS val 21917431 ecr 46590338], length 125: OpenFlow
	version 1.0, type PACKET_IN, length 125, xid 0x00000000
21:28:42.138243 IP 192.168.1.30.49386 > 192.168.1.10.6633: Flags [P.], seq 28014:28139, ack 1, win 58, options [nop,nop,TS val 21917431 ecr 46590338], length 125: OpenFlow
	version 1.0, type PACKET_IN, length 125, xid 0x00000000
21:28:42.138385 IP 192.168.1.10.6633 > 192.168.1.30.49386: Flags [.], ack 27389, win 10796, options [nop,nop,TS val 46590345 ecr 21917431], length 0
21:28:42.138460 IP 192.168.1.10.6633 > 192.168.1.30.49386: Flags [.], ack 27764, win 10796, options [nop,nop,TS val 46590345 ecr 21917431], length 0
21:28:42.138469 IP 192.168.1.10.6633 > 192.168.1.30.49386: Flags [.], ack 28139, win 10796, options [nop,nop,TS val 46590345 ecr 21917431], length 0
21:28:42.144741 IP 192.168.1.30.49386 > 192.168.1.10.6633: Flags [P.], seq 28139:33889, ack 1, win 58, options [nop,nop,TS val 21917434 ecr 46590345], length 5750: OpenFlow
	version 1.0, type PACKET_IN, length 125, xid 0x00000000
	version 1.0, type PACKET_IN, length 125, xid 0x00000000
	version 1.0, type PACKET_IN, length 125, xid 0x00000000
	version 1.0, type PACKET_IN, length 125, xid 0x00000000
	version 1.0, type PACKET_IN, length 125, xid 0x00000000
	version 1.0, type PACKET_IN, length 125, xid 0x00000000
	version 1.0, type PACKET_IN, length 125, xid 0x00000000
	version 1.0, type PACKET_IN, length 125, xid 0x00000000
	version 1.0, type PACKET_IN, length 125, xid 0x00000000
	version 1.0, type PACKET_IN, length 125, xid 0x00000000
	version 1.0, type PACKET_IN, length 125, xid 0x00000000
	version 1.0, type PACKET_IN, length 125, xid 0x00000000
	version 1.0, type PACKET_IN, length 125, xid 0x00000000
	version 1.0, type PACKET_IN, length 125, xid 0x00000000
	version 1.0, type PACKET_IN, length 125, xid 0x00000000
	version 1.0, type PACKET_IN, length 125, xid 0x00000000
	version 1.0, type PACKET_IN, length 125, xid 0x00000000
	version 1.0, type PACKET_IN, length 125, xid 0x00000000
	version 1.0, type PACKET_IN, length 125, xid 0x00000000
	version 1.0, type PACKET_IN, length 125, xid 0x00000000
	version 1.0, type PACKET_IN, length 125, xid 0x00000000
	version 1.0, type PACKET_IN, length 125, xid 0x00000000
	version 1.0, type PACKET_IN, length 125, xid 0x00000000
	version 1.0, type PACKET_IN, length 125, xid 0x00000000
	version 1.0, type PACKET_IN, length 125, xid 0x00000000
	version 1.0, type PACKET_IN, length 125, xid 0x00000000
	version 1.0, type PACKET_IN, length 125, xid 0x00000000
	version 1.0, type PACKET_IN, length 125, xid 0x00000000
	version 1.0, type PACKET_IN, length 125, xid 0x00000000
	version 1.0, type PACKET_IN, length 125, xid 0x00000000
	version 1.0, type PACKET_IN, length 125, xid 0x00000000
	version 1.0, type PACKET_IN, length 125, xid 0x00000000
	version 1.0, type PACKET_IN, length 125, xid 0x00000000
	version 1.0, type PACKET_IN, length 125, xid 0x00000000
	version 1.0, type PACKET_IN, length 125, xid 0x00000000
	version 1.0, type PACKET_IN, length 125, xid 0x00000000
	version 1.0, type PACKET_IN, length 125, xid 0x00000000
	version 1.0, type PACKET_IN, length 125, xid 0x00000000
	version 1.0, type PACKET_IN, length 125, xid 0x00000000
	version 1.0, type PACKET_IN, length 125, xid 0x00000000
	version 1.0, type PACKET_IN, length 125, xid 0x00000000
	version 1.0, type PACKET_IN, length 125, xid 0x00000000
	version 1.0, type PACKET_IN, length 125, xid 0x00000000
	version 1.0, type PACKET_IN, length 125, xid 0x00000000
	version 1.0, type PACKET_IN, length 125, xid 0x00000000
	version 1.0, type PACKET_IN, length 125, xid 0x00000000
21:28:42.144753 IP 192.168.1.30.49386 > 192.168.1.10.6633: Flags [P.], seq 33889:34014, ack 1, win 58, options [nop,nop,TS val 21917434 ecr 46590345], length 125: OpenFlow
	version 1.0, type PACKET_IN, length 125, xid 0x00000000
21:28:42.145121 IP 192.168.1.10.6633 > 192.168.1.30.49386: Flags [.], ack 33889, win 10796, options [nop,nop,TS val 46590347 ecr 21917434], length 0
21:28:42.145290 IP 192.168.1.10.6633 > 192.168.1.30.49386: Flags [.], ack 34014, win 10796, options [nop,nop,TS val 46590347 ecr 21917434], length 0
21:28:42.165666 IP 192.168.1.30.49386 > 192.168.1.10.6633: Flags [P.], seq 34014:34139, ack 1, win 58, options [nop,nop,TS val 21917441 ecr 46590347], length 125: OpenFlow
	version 1.0, type PACKET_IN, length 125, xid 0x00000000
21:28:42.165740 IP 192.168.1.30.49386 > 192.168.1.10.6633: Flags [P.], seq 34139:34264, ack 1, win 58, options [nop,nop,TS val 21917441 ecr 46590347], length 125: OpenFlow
	version 1.0, type PACKET_IN, length 125, xid 0x00000000
21:28:42.165771 IP 192.168.1.30.49386 > 192.168.1.10.6633: Flags [P.], seq 34264:34389, ack 1, win 58, options [nop,nop,TS val 21917441 ecr 46590347], length 125: OpenFlow
	version 1.0, type PACKET_IN, length 125, xid 0x00000000
21:28:42.165863 IP 192.168.1.30.49386 > 192.168.1.10.6633: Flags [P.], seq 34389:34514, ack 1, win 58, options [nop,nop,TS val 21917441 ecr 46590347], length 125: OpenFlow
	version 1.0, type PACKET_IN, length 125, xid 0x00000000
21:28:42.165899 IP 192.168.1.30.49386 > 192.168.1.10.6633: Flags [P.], seq 34514:34639, ack 1, win 58, options [nop,nop,TS val 21917441 ecr 46590347], length 125: OpenFlow
	version 1.0, type PACKET_IN, length 125, xid 0x00000000
21:28:42.165941 IP 192.168.1.30.49386 > 192.168.1.10.6633: Flags [P.], seq 34639:34764, ack 1, win 58, options [nop,nop,TS val 21917441 ecr 46590347], length 125: OpenFlow
	version 1.0, type PACKET_IN, length 125, xid 0x00000000
21:28:42.166026 IP 192.168.1.30.49386 > 192.168.1.10.6633: Flags [P.], seq 34764:34889, ack 1, win 58, options [nop,nop,TS val 21917441 ecr 46590347], length 125: OpenFlow
	version 1.0, type PACKET_IN, length 125, xid 0x00000000
21:28:42.166065 IP 192.168.1.30.49386 > 192.168.1.10.6633: Flags [P.], seq 34889:35014, ack 1, win 58, options [nop,nop,TS val 21917441 ecr 46590347], length 125: OpenFlow
	version 1.0, type PACKET_IN, length 125, xid 0x00000000
21:28:42.166144 IP 192.168.1.30.49386 > 192.168.1.10.6633: Flags [P.], seq 35014:35139, ack 1, win 58, options [nop,nop,TS val 21917441 ecr 46590347], length 125: OpenFlow
	version 1.0, type PACKET_IN, length 125, xid 0x00000000
21:28:42.166183 IP 192.168.1.30.49386 > 192.168.1.10.6633: Flags [P.], seq 35139:35264, ack 1, win 58, options [nop,nop,TS val 21917441 ecr 46590347], length 125: OpenFlow
	version 1.0, type PACKET_IN, length 125, xid 0x00000000
21:28:42.166250 IP 192.168.1.10.6633 > 192.168.1.30.49386: Flags [.], ack 34389, win 10796, options [nop,nop,TS val 46590352 ecr 21917441], length 0
21:28:42.166262 IP 192.168.1.30.49386 > 192.168.1.10.6633: Flags [P.], seq 35264:35389, ack 1, win 58, options [nop,nop,TS val 21917441 ecr 46590347], length 125: OpenFlow
	version 1.0, type PACKET_IN, length 125, xid 0x00000000
21:28:42.166270 IP 192.168.1.10.6633 > 192.168.1.30.49386: Flags [.], ack 34764, win 10796, options [nop,nop,TS val 46590352 ecr 21917441], length 0
21:28:42.166278 IP 192.168.1.10.6633 > 192.168.1.30.49386: Flags [.], ack 35014, win 10796, options [nop,nop,TS val 46590352 ecr 21917441], length 0
21:28:42.166307 IP 192.168.1.30.49386 > 192.168.1.10.6633: Flags [P.], seq 35389:35514, ack 1, win 58, options [nop,nop,TS val 21917441 ecr 46590352], length 125: OpenFlow
	version 1.0, type PACKET_IN, length 125, xid 0x00000000
21:28:42.166354 IP 192.168.1.30.49386 > 192.168.1.10.6633: Flags [P.], seq 35514:35639, ack 1, win 58, options [nop,nop,TS val 21917441 ecr 46590352], length 125: OpenFlow
	version 1.0, type PACKET_IN, length 125, xid 0x00000000
21:28:42.166439 IP 192.168.1.30.49386 > 192.168.1.10.6633: Flags [P.], seq 35639:35764, ack 1, win 58, options [nop,nop,TS val 21917441 ecr 46590352], length 125: OpenFlow
	version 1.0, type PACKET_IN, length 125, xid 0x00000000
