21:28:42.063298 IP 192.168.1.30.49348 > 192.168.1.10.6633: Flags [P.], seq 267458913:267459038, ack 3213856043, win 58, options [nop,nop,TS val 21917414 ecr 46590318], length 125: OpenFlow
	version 1.0, type PACKET_IN, length 125, xid 0x00000000
21:28:42.063316 IP 192.168.1.30.49348 > 192.168.1.10.6633: Flags [P.], seq 125:250, ack 1, win 58, options [nop,nop,TS val 21917414 ecr 46590318], length 125: OpenFlow
	version 1.0, type PACKET_IN, length 125, xid 0x00000000
21:28:42.063329 IP 192.168.1.30.49348 > 192.168.1.10.6633: Flags [P.], seq 250:375, ack 1, win 58, options [nop,nop,TS val 21917414 ecr 46590318], length 125: OpenFlow
	version 1.0, type PACKET_IN, length 125, xid 0x00000000
21:28:42.063341 IP 192.168.1.30.49348 > 192.168.1.10.6633: Flags [P.], seq 375:500, ack 1, win 58, options [nop,nop,TS val 21917414 ecr 46590318], length 125: OpenFlow
	version 1.0, type PACKET_IN, length 125, xid 0x00000000
21:28:42.063353 IP 192.168.1.30.49348 > 192.168.1.10.6633: Flags [P.], seq 500:625, ack 1, win 58, options [nop,nop,TS val 21917414 ecr 46590318], length 125: OpenFlow
	version 1.0, type PACKET_IN, length 125, xid 0x00000000
21:28:42.063366 IP 192.168.1.30.49348 > 192.168.1.10.6633: Flags [P.], seq 625:750, ack 1, win 58, options [nop,nop,TS val 21917414 ecr 46590318], length 125: OpenFlow
	version 1.0, type PACKET_IN, length 125, xid 0x00000000
21:28:42.063385 IP 192.168.1.30.49348 > 192.168.1.10.6633: Flags [P.], seq 750:875, ack 1, win 58, options [nop,nop,TS val 21917414 ecr 46590318], length 125: OpenFlow
	version 1.0, type PACKET_IN, length 125, xid 0x00000000
21:28:42.063399 IP 192.168.1.30.49348 > 192.168.1.10.6633: Flags [P.], seq 875:1000, ack 1, win 58, options [nop,nop,TS val 21917414 ecr 46590318], length 125: OpenFlow
	version 1.0, type PACKET_IN, length 125, xid 0x00000000
21:28:42.063414 IP 192.168.1.30.49348 > 192.168.1.10.6633: Flags [P.], seq 1000:1125, ack 1, win 58, options [nop,nop,TS val 21917414 ecr 46590318], length 125: OpenFlow
	version 1.0, type PACKET_IN, length 125, xid 0x00000000
21:28:42.063427 IP 192.168.1.30.49348 > 192.168.1.10.6633: Flags [P.], seq 1125:1250, ack 1, win 58, options [nop,nop,TS val 21917414 ecr 46590318], length 125: OpenFlow
	version 1.0, type PACKET_IN, length 125, xid 0x00000000
21:28:42.063441 IP 192.168.1.30.49348 > 192.168.1.10.6633: Flags [P.], seq 1250:1375, ack 1, win 58, options [nop,nop,TS val 21917414 ecr 46590318], length 125: OpenFlow
	version 1.0, type PACKET_IN, length 125, xid 0x00000000
21:28:42.063455 IP 192.168.1.30.49348 > 192.168.1.10.6633: Flags [P.], seq 1375:1500, ack 1, win 58, options [nop,nop,TS val 21917414 ecr 46590318], length 125: OpenFlow
	version 1.0, type PACKET_IN, length 125, xid 0x00000000
21:28:42.063468 IP 192.168.1.30.49348 > 192.168.1.10.6633: Flags [P.], seq 1500:1625, ack 1, win 58, options [nop,nop,TS val 21917414 ecr 46590318], length 125: OpenFlow
	version 1.0, type PACKET_IN, length 125, xid 0x00000000
21:28:42.063487 IP 192.168.1.30.49348 > 192.168.1.10.6633: Flags [P.], seq 1625:1750, ack 1, win 58, options [nop,nop,TS val 21917414 ecr 46590318], length 125: OpenFlow
	version 1.0, type PACKET_IN, length 125, xid 0x00000000
21:28:42.063501 IP 192.168.1.30.49348 > 192.168.1.10.6633: Flags [P.], seq 1750:1875, ack 1, win 58, options [nop,nop,TS val 21917414 ecr 46590318], length 125: OpenFlow
	version 1.0, type PACKET_IN, length 125, xid 0x00000000
21:28:42.063515 IP 192.168.1.30.49348 > 192.168.1.10.6633: Flags [P.], seq 1875:2000, ack 1, win 58, options [nop,nop,TS val 21917414 ecr 46590318], length 125: OpenFlow
	version 1.0, type PACKET_IN, length 125, xid 0x00000000
21:28:42.063529 IP 192.168.1.30.49348 > 192.168.1.10.6633: Flags [P.], seq 2000:2125, ack 1, win 58, options [nop,nop,TS val 21917414 ecr 46590318], length 125: OpenFlow
	version 1.0, type PACKET_IN, length 125, xid 0x00000000
21:28:42.063543 IP 192.168.1.30.49348 > 192.168.1.10.6633: Flags [P.], seq 2125:2250, ack 1, win 58, options [nop,nop,TS val 21917414 ecr 46590318], length 125: OpenFlow
	version 1.0, type PACKET_IN, length 125, xid 0x00000000
21:28:42.063556 IP 192.168.1.30.49348 > 192.168.1.10.6633: Flags [P.], seq 2250:2375, ack 1, win 58, options [nop,nop,TS val 21917414 ecr 46590318], length 125: OpenFlow
	version 1.0, type PACKET_IN, length 125, xid 0x00000000
21:28:42.063569 IP 192.168.1.30.49348 > 192.168.1.10.6633: Flags [P.], seq 2375:2500, ack 1, win 58, options [nop,nop,TS val 21917414 ecr 46590318], length 125: OpenFlow
	version 1.0, type PACKET_IN, length 125, xid 0x00000000
21:28:42.063588 IP 192.168.1.30.49348 > 192.168.1.10.6633: Flags [P.], seq 2500:2625, ack 1, win 58, options [nop,nop,TS val 21917414 ecr 46590318], length 125: OpenFlow
	version 1.0, type PACKET_IN, length 125, xid 0x00000000
21:28:42.063602 IP 192.168.1.30.49348 > 192.168.1.10.6633: Flags [P.], seq 2625:2750, ack 1, win 58, options [nop,nop,TS val 21917414 ecr 46590318], length 125: OpenFlow
	version 1.0, type PACKET_IN, length 125, xid 0x00000000
21:28:42.063615 IP 192.168.1.30.49348 > 192.168.1.10.6633: Flags [P.], seq 2750:2875, ack 1, win 58, options [nop,nop,TS val 21917414 ecr 46590318], length 125: OpenFlow
	version 1.0, type PACKET_IN, length 125, xid 0x00000000
21:28:42.063628 IP 192.168.1.30.49348 > 192.168.1.10.6633: Flags [P.], seq 2875:3000, ack 1, win 58, options [nop,nop,TS val 21917414 ecr 46590318], length 125: OpenFlow
	version 1.0, type PACKET_IN, length 125, xid 0x00000000
21:28:42.063642 IP 192.168.1.30.49348 > 192.168.1.10.6633: Flags [P.], seq 3000:3125, ack 1, win 58, options [nop,nop,TS val 21917414 ecr 46590318], length 125: OpenFlow
	version 1.0, type PACKET_IN, length 125, xid 0x00000000
21:28:42.063655 IP 192.168.1.30.49348 > 192.168.1.10.6633: Flags [P.], seq 3125:3250, ack 1, win 58, options [nop,nop,TS val 21917414 ecr 46590318], length 125: OpenFlow
	version 1.0, type PACKET_IN, length 125, xid 0x00000000
21:28:42.063669 IP 192.168.1.30.49348 > 192.168.1.10.6633: Flags [P.], seq 3250:3375, ack 1, win 58, options [nop,nop,TS val 21917414 ecr 46590318], length 125: OpenFlow
	version 1.0, type PACKET_IN, length 125, xid 0x00000000
21:28:42.063689 IP 192.168.1.30.49348 > 192.168.1.10.6633: Flags [P.], seq 3375:3500, ack 1, win 58, options [nop,nop,TS val 21917414 ecr 46590318], length 125: OpenFlow
	version 1.0, type PACKET_IN, length 125, xid 0x00000000
21:28:42.063703 IP 192.168.1.30.49348 > 192.168.1.10.6633: Flags [P.], seq 3500:3625, ack 1, win 58, options [nop,nop,TS val 21917414 ecr 46590318], length 125: OpenFlow
	version 1.0, type PACKET_IN, length 125, xid 0x00000000
21:28:42.063716 IP 192.168.1.30.49348 > 192.168.1.10.6633: Flags [P.], seq 3625:3750, ack 1, win 58, options [nop,nop,TS val 21917414 ecr 46590318], length 125: OpenFlow
	version 1.0, type PACKET_IN, length 125, xid 0x00000000
21:28:42.063730 IP 192.168.1.30.49348 > 192.168.1.10.6633: Flags [P.], seq 3750:3875, ack 1, win 58, options [nop,nop,TS val 21917414 ecr 46590318], length 125: OpenFlow
	version 1.0, type PACKET_IN, length 125, xid 0x00000000
21:28:42.063744 IP 192.168.1.30.49348 > 192.168.1.10.6633: Flags [P.], seq 3875:4000, ack 1, win 58, options [nop,nop,TS val 21917414 ecr 46590318], length 125: OpenFlow
	version 1.0, type PACKET_IN, length 125, xid 0x00000000
21:28:42.063758 IP 192.168.1.30.49348 > 192.168.1.10.6633: Flags [P.], seq 4000:4125, ack 1, win 58, options [nop,nop,TS val 21917414 ecr 46590318], length 125: OpenFlow
	version 1.0, type PACKET_IN, length 125, xid 0x00000000
21:28:42.063771 IP 192.168.1.30.49348 > 192.168.1.10.6633: Flags [P.], seq 4125:4250, ack 1, win 58, options [nop,nop,TS val 21917414 ecr 46590318], length 125: OpenFlow
	version 1.0, type PACKET_IN, length 125, xid 0x00000000
21:28:42.063789 IP 192.168.1.30.49348 > 192.168.1.10.6633: Flags [P.], seq 4250:4375, ack 1, win 58, options [nop,nop,TS val 21917414 ecr 46590318], length 125: OpenFlow
	version 1.0, type PACKET_IN, length 125, xid 0x00000000
21:28:42.063802 IP 192.168.1.30.49348 > 192.168.1.10.6633: Flags [P.], seq 4375:4500, ack 1, win 58, options [nop,nop,TS val 21917414 ecr 46590318], length 125: OpenFlow
	version 1.0, type PACKET_IN, length 125, xid 0x00000000
21:28:42.063816 IP 192.168.1.30.49348 > 192.168.1.10.6633: Flags [P.], seq 4500:4625, ack 1, win 58, options [nop,nop,TS val 21917414 ecr 46590318], length 125: OpenFlow
	version 1.0, type PACKET_IN, length 125, xid 0x00000000
21:28:42.063829 IP 192.168.1.30.49348 > 192.168.1.10.6633: Flags [P.], seq 4625:4750, ack 1, win 58, options [nop,nop,TS val 21917414 ecr 46590318], length 125: OpenFlow
	version 1.0, type PACKET_IN, length 125, xid 0x00000000
21:28:42.063843 IP 192.168.1.30.49348 > 192.168.1.10.6633: Flags [P.], seq 4750:4875, ack 1, win 58, options [nop,nop,TS val 21917414 ecr 46590318], length 125: OpenFlow
	version 1.0, type PACKET_IN, length 125, xid 0x00000000
21:28:42.063857 IP 192.168.1.30.49348 > 192.168.1.10.6633: Flags [P.], seq 4875:5000, ack 1, win 58, options [nop,nop,TS val 21917414 ecr 46590318], length 125: OpenFlow
	version 1.0, type PACKET_IN, length 125, xid 0x00000000
21:28:42.063871 IP 192.168.1.30.49348 > 192.168.1.10.6633: Flags [P.], seq 5000:5125, ack 1, win 58, options [nop,nop,TS val 21917414 ecr 46590318], length 125: OpenFlow
	version 1.0, type PACKET_IN, length 125, xid 0x00000000
21:28:42.063890 IP 192.168.1.30.49348 > 192.168.1.10.6633: Flags [P.], seq 5125:5250, ack 1, win 58, options [nop,nop,TS val 21917414 ecr 46590318], length 125: OpenFlow
	version 1.0, type PACKET_IN, length 125, xid 0x00000000
21:28:42.064036 IP 192.168.1.30.49348 > 192.168.1.10.6633: Flags [P.], seq 5250:5375, ack 1, win 58, options [nop,nop,TS val 21917414 ecr 46590318], length 125: OpenFlow
	version 1.0, type PACKET_IN, length 125, xid 0x00000000
21:28:42.064051 IP 192.168.1.30.49348 > 192.168.1.10.6633: Flags [P.], seq 5375:5500, ack 1, win 58, options [nop,nop,TS val 21917414 ecr 46590318], length 125: OpenFlow
	version 1.0, type PACKET_IN, length 125, xid 0x00000000
21:28:42.064064 IP 192.168.1.30.49348 > 192.168.1.10.6633: Flags [P.], seq 5500:5625, ack 1, win 58, options [nop,nop,TS val 21917414 ecr 46590318], length 125: OpenFlow
	version 1.0, type PACKET_IN, length 125, xid 0x00000000
21:28:42.064077 IP 192.168.1.30.49348 > 192.168.1.10.6633: Flags [P.], seq 5625:5750, ack 1, win 58, options [nop,nop,TS val 21917414 ecr 46590318], length 125: OpenFlow
	version 1.0, type PACKET_IN, length 125, xid 0x00000000
21:28:42.064090 IP 192.168.1.30.49348 > 192.168.1.10.6633: Flags [P.], seq 5750:5875, ack 1, win 58, options [nop,nop,TS val 21917414 ecr 46590318], length 125: OpenFlow
	version 1.0, type PACKET_IN, length 125, xid 0x00000000
21:28:42.064104 IP 192.168.1.30.49348 > 192.168.1.10.6633: Flags [P.], seq 5875:6000, ack 1, win 58, options [nop,nop,TS val 21917414 ecr 46590318], length 125: OpenFlow
	version 1.0, type PACKET_IN, length 125, xid 0x00000000
21:28:42.064124 IP 192.168.1.30.49348 > 192.168.1.10.6633: Flags [P.], seq 6000:6125, ack 1, win 58, options [nop,nop,TS val 21917414 ecr 46590318], length 125: OpenFlow
	version 1.0, type PACKET_IN, length 125, xid 0x00000000
21:28:42.064137 IP 192.168.1.30.49348 > 192.168.1.10.6633: Flags [P.], seq 6125:6250, ack 1, win 58, options [nop,nop,TS val 21917414 ecr 46590318], length 125: OpenFlow
	version 1.0, type PACKET_IN, length 125, xid 0x00000000
21:28:42.064150 IP 192.168.1.30.49348 > 192.168.1.10.6633: Flags [P.], seq 6250:6375, ack 1, win 58, options [nop,nop,TS val 21917414 ecr 46590318], length 125: OpenFlow
	version 1.0, type PACKET_IN, length 125, xid 0x00000000
21:28:42.064163 IP 192.168.1.30.49348 > 192.168.1.10.6633: Flags [P.], seq 6375:6500, ack 1, win 58, options [nop,nop,TS val 21917414 ecr 46590318], length 125: OpenFlow
	version 1.0, type PACKET_IN, length 125, xid 0x00000000
21:28:42.064175 IP 192.168.1.30.49348 > 192.168.1.10.6633: Flags [P.], seq 6500:6625, ack 1, win 58, options [nop,nop,TS val 21917414 ecr 46590318], length 125: OpenFlow
	version 1.0, type PACKET_IN, length 125, xid 0x00000000
21:28:42.064188 IP 192.168.1.30.49348 > 192.168.1.10.6633: Flags [P.], seq 6625:6750, ack 1, win 58, options [nop,nop,TS val 21917414 ecr 46590318], length 125: OpenFlow
	version 1.0, type PACKET_IN, length 125, xid 0x00000000
21:28:42.064200 IP 192.168.1.30.49348 > 192.168.1.10.6633: Flags [P.], seq 6750:6875, ack 1, win 58, options [nop,nop,TS val 21917414 ecr 46590318], length 125: OpenFlow
	version 1.0, type PACKET_IN, length 125, xid 0x00000000
21:28:42.064220 IP 192.168.1.30.49348 > 192.168.1.10.6633: Flags [P.], seq 6875:7000, ack 1, win 58, options [nop,nop,TS val 21917414 ecr 46590318], length 125: OpenFlow
	version 1.0, type PACKET_IN, length 125, xid 0x00000000
21:28:42.064233 IP 192.168.1.30.49348 > 192.168.1.10.6633: Flags [P.], seq 7000:7125, ack 1, win 58, options [nop,nop,TS val 21917414 ecr 46590318], length 125: OpenFlow
	version 1.0, type PACKET_IN, length 125, xid 0x00000000
21:28:42.064870 IP 192.168.1.10.6633 > 192.168.1.30.49348: Flags [.], ack 1500, win 23325, options [nop,nop,TS val 46590326 ecr 21917414], length 0
21:28:42.064893 IP 192.168.1.10.6633 > 192.168.1.30.49348: Flags [.], ack 3000, win 23325, options [nop,nop,TS val 46590326 ecr 21917414], length 0
21:28:42.064906 IP 192.168.1.10.6633 > 192.168.1.30.49348: Flags [.], ack 3375, win 23325, options [nop,nop,TS val 46590326 ecr 21917414], length 0
21:28:42.064915 IP 192.168.1.10.6633 > 192.168.1.30.49348: Flags [.], ack 4875, win 23325, options [nop,nop,TS val 46590326 ecr 21917414], length 0
21:28:42.065046 IP 192.168.1.10.6633 > 192.168.1.30.49348: Flags [.], ack 6125, win 23325, options [nop,nop,TS val 46590326 ecr 21917414], length 0
21:28:42.065066 IP 192.168.1.10.6633 > 192.168.1.30.49348: Flags [.], ack 7125, win 23325, options [nop,nop,TS val 46590326 ecr 21917414], length 0
21:28:42.065690 IP 192.168.1.30.49348 > 192.168.1.10.6633: Flags [P.], seq 7125:10500, ack 1, win 58, options [nop,nop,TS val 21917415 ecr 46590318], length 3375: OpenFlow
	version 1.0, type PACKET_IN, length 125, xid 0x00000000
	version 1.0, type PACKET_IN, length 125, xid 0x00000000
	version 1.0, type PACKET_IN, length 125, xid 0x00000000
	version 1.0, type PACKET_IN, length 125, xid 0x00000000
	version 1.0, type PACKET_IN, length 125, xid 0x00000000
	version 1.0, type PACKET_IN, length 125, xid 0x00000000
	version 1.0, type PACKET_IN, length 125, xid 0x00000000
	version 1.0, type PACKET_IN, length 125, xid 0x00000000
	version 1.0, type PACKET_IN, length 125, xid 0x00000000
	version 1.0, type PACKET_IN, length 125, xid 0x00000000
	version 1.0, type PACKET_IN, length 125, xid 0x00000000
	version 1.0, type PACKET_IN, length 125, xid 0x00000000
	version 1.0, type PACKET_IN, length 125, xid 0x00000000
	version 1.0, type PACKET_IN, length 125, xid 0x00000000
	version 1.0, type PACKET_IN, length 125, xid 0x00000000
	version 1.0, type PACKET_IN, length 125, xid 0x00000000
	version 1.0, type PACKET_IN, length 125, xid 0x00000000
	version 1.0, type PACKET_IN, length 125, xid 0x00000000
	version 1.0, type PACKET_IN, length 125, xid 0x00000000
	version 1.0, type PACKET_IN, length 125, xid 0x00000000
	version 1.0, type PACKET_IN, length 125, xid 0x00000000
	version 1.0, type PACKET_IN, length 125, xid 0x00000000
	version 1.0, type PACKET_IN, length 125, xid 0x00000000
	version 1.0, type PACKET_IN, length 125, xid 0x00000000
	version 1.0, type PACKET_IN, length 125, xid 0x00000000
	version 1.0, type PACKET_IN, length 125, xid 0x00000000
	version 1.0, type PACKET_IN, length 125, xid 0x00000000
21:28:42.065702 IP 192.168.1.30.49348 > 192.168.1.10.6633: Flags [P.], seq 10500:15338, ack 1, win 58, options [nop,nop,TS val 21917415 ecr 46590318], length 4838: OpenFlow
	version 1.0, type PACKET_IN, length 125, xid 0x00000000
	version 1.0, type PACKET_IN, length 125, xid 0x00000000
	version 1.0, type PACKET_IN, length 125, xid 0x00000000
	version 1.0, type PACKET_IN, length 125, xid 0x00000000
	version 1.0, type PACKET_IN, length 125, xid 0x00000000
	version 1.0, type PACKET_IN, length 125, xid 0x00000000
	version 1.0, type PACKET_IN, length 125, xid 0x00000000
	version 1.0, type PACKET_IN, length 125, xid 0x00000000
	version 1.0, type PACKET_IN, length 125, xid 0x00000000
	version 1.0, type PACKET_IN, length 125, xid 0x00000000
	version 1.0, type PACKET_IN, length 125, xid 0x00000000
	version 1.0, type PACKET_IN, length 125, xid 0x00000000
	version 1.0, type PACKET_IN, length 125, xid 0x00000000
	version 1.0, type PACKET_IN, length 125, xid 0x00000000
	version 1.0, type PACKET_IN, length 125, xid 0x00000000
	version 1.0, type PACKET_IN, length 125, xid 0x00000000
	version 1.0, type PACKET_IN, length 125, xid 0x00000000
	version 1.0, type PACKET_IN, length 125, xid 0x00000000
	version 1.0, type PACKET_IN, length 125, xid 0x00000000
	version 1.0, type PACKET_IN, length 125, xid 0x00000000
	version 1.0, type PACKET_IN, length 125, xid 0x00000000
	version 1.0, type PACKET_IN, length 125, xid 0x00000000
	version 1.0, type PACKET_IN, length 125, xid 0x00000000
	version 1.0, type PACKET_IN, length 125, xid 0x00000000
	version 1.0, type PACKET_IN, length 125, xid 0x00000000
	version 1.0, type PACKET_IN, length 125, xid 0x00000000
	version 1.0, type PACKET_IN, length 125, xid 0x00000000
	version 1.0, type PACKET_IN, length 125, xid 0x00000000
	version 1.0, type PACKET_IN, length 88, xid 0x00000000
	version 1.0, type PACKET_IN, length 125, xid 0x00000000
	version 1.0, type PACKET_IN, length 125, xid 0x00000000
	version 1.0, type PACKET_IN, length 125, xid 0x00000000
	version 1.0, type PACKET_IN, length 125, xid 0x00000000
	version 1.0, type PACKET_IN, length 125, xid 0x00000000
	version 1.0, type PACKET_IN, length 125, xid 0x00000000
	version 1.0, type PACKET_IN, length 125, xid 0x00000000
	version 1.0, type PACKET_IN, length 125, xid 0x00000000
	version 1.0, type PACKET_IN, length 125, xid 0x00000000
	version 1.0, type PACKET_IN, length 125, xid 0x00000000
21:28:42.065895 IP 192.168.1.30.49348 > 192.168.1.10.6633: Flags [P.], seq 10500:15338, ack 1, win 58, options [nop,nop,TS val 21917415 ecr 46590318], length 4838: OpenFlow
	version 1.0, type PACKET_IN, length 125, xid 0x00000000
	version 1.0, type PACKET_IN, length 125, xid 0x00000000
	version 1.0, type PACKET_IN, length 125, xid 0x00000000
	version 1.0, type PACKET_IN, length 125, xid 0x00000000
	version 1.0, type PACKET_IN, length 125, xid 0x00000000
	version 1.0, type PACKET_IN, length 125, xid 0x00000000
	version 1.0, type PACKET_IN, length 125, xid 0x00000000
	version 1.0, type PACKET_IN, length 125, xid 0x00000000
	version 1.0, type PACKET_IN, length 125, xid 0x00000000
	version 1.0, type PACKET_IN, length 125, xid 0x00000000
	version 1.0, type PACKET_IN, length 125, xid 0x00000000
	version 1.0, type PACKET_IN, length 125, xid 0x00000000
	version 1.0, type PACKET_IN, length 125, xid 0x00000000
	version 1.0, type PACKET_IN, length 125, xid 0x00000000
	version 1.0, type PACKET_IN, length 125, xid 0x00000000
	version 1.0, type PACKET_IN, length 125, xid 0x00000000
	version 1.0, type PACKET_IN, length 125, xid 0x00000000
	version 1.0, type PACKET_IN, length 125, xid 0x00000000
	version 1.0, type PACKET_IN, length 125, xid 0x00000000
	version 1.0, type PACKET_IN, length 125, xid 0x00000000
	version 1.0, type PACKET_IN, length 125, xid 0x00000000
	version 1.0, type PACKET_IN, length 125, xid 0x00000000
	version 1.0, type PACKET_IN, length 125, xid 0x00000000
	version 1.0, type PACKET_IN, length 125, xid 0x00000000
	version 1.0, type PACKET_IN, length 125, xid 0x00000000
	version 1.0, type PACKET_IN, length 125, xid 0x00000000
	version 1.0, type PACKET_IN, length 125, xid 0x00000000
	version 1.0, type PACKET_IN, length 125, xid 0x00000000
	version 1.0, type PACKET_IN, length 88, xid 0x00000000
	version 1.0, type PACKET_IN, length 125, xid 0x00000000
	version 1.0, type PACKET_IN, length 125, xid 0x00000000
	version 1.0, type PACKET_IN, length 125, xid 0x00000000
	version 1.0, type PACKET_IN, length 125, xid 0x00000000
	version 1.0, type PACKET_IN, length 125, xid 0x00000000
	version 1.0, type PACKET_IN, length 125, xid 0x00000000
	version 1.0, type PACKET_IN, length 125, xid 0x00000000
	version 1.0, type PACKET_IN, length 125, xid 0x00000000
	version 1.0, type PACKET_IN, length 125, xid 0x00000000
	version 1.0, type PACKET_IN, length 125, xid 0x00000000
21:28:42.065916 IP 192.168.1.30.49348 > 192.168.1.10.6633: Flags [P.], seq 15338:15588, ack 1, win 58, options [nop,nop,TS val 21917415 ecr 46590318], length 250: OpenFlow
	version 1.0, type PACKET_IN, length 125, xid 0x00000000
	version 1.0, type PACKET_IN, length 125, xid 0x00000000
21:28:42.069730 IP 192.168.1.10.6633 > 192.168.1.30.49348: Flags [.], ack 10500, win 23325, options [nop,nop,TS val 46590327 ecr 21917415], length 0
21:28:42.069752 IP 192.168.1.10.6633 > 192.168.1.30.49348: Flags [.], ack 15338, win 23325, options [nop,nop,TS val 46590327 ecr 21917415], length 0
21:28:42.069932 IP 192.168.1.10.6633 > 192.168.1.30.49348: Flags [.], ack 15588, win 23325, options [nop,nop,TS val 46590327 ecr 21917415], length 0
21:28:42.091092 IP 192.168.1.30.49348 > 192.168.1.10.6633: Flags [P.], seq 15588:15713, ack 1, win 58, options [nop,nop,TS val 21917422 ecr 46590327], length 125: OpenFlow
	version 1.0, type PACKET_IN, length 125, xid 0x00000000
21:28:42.092760 IP 192.168.1.10.6633 > 192.168.1.30.49348: Flags [.], ack 15713, win 23325, options [nop,nop,TS val 46590333 ecr 21917422], length 0
21:28:42.093494 IP 192.168.1.30.49348 > 192.168.1.10.6633: Flags [P.], seq 15713:15838, ack 1, win 58, options [nop,nop,TS val 21917423 ecr 46590333], length 125: OpenFlow
	version 1.0, type PACKET_IN, length 125, xid 0x00000000
21:28:42.093535 IP 192.168.1.30.49348 > 192.168.1.10.6633: Flags [P.], seq 15838:15963, ack 1, win 58, options [nop,nop,TS val 21917423 ecr 46590333], length 125: OpenFlow
	version 1.0, type PACKET_IN, length 125, xid 0x00000000
21:28:42.093571 IP 192.168.1.30.49348 > 192.168.1.10.6633: Flags [P.], seq 15963:16088, ack 1, win 58, options [nop,nop,TS val 21917423 ecr 46590333], length 125: OpenFlow
	version 1.0, type PACKET_IN, length 125, xid 0x00000000
21:28:42.093605 IP 192.168.1.30.49348 > 192.168.1.10.6633: Flags [P.], seq 16088:16213, ack 1, win 58, options [nop,nop,TS val 21917423 ecr 46590333], length 125: OpenFlow
	version 1.0, type PACKET_IN, length 125, xid 0x00000000
21:28:42.093640 IP 192.168.1.30.49348 > 192.168.1.10.6633: Flags [P.], seq 16213:16338, ack 1, win 58, options [nop,nop,TS val 21917423 ecr 46590333], length 125: OpenFlow
	version 1.0, type PACKET_IN, length 125, xid 0x00000000
21:28:42.093673 IP 192.168.1.30.49348 > 192.168.1.10.6633: Flags [P.], seq 16338:16463, ack 1, win 58, options [nop,nop,TS val 21917423 ecr 46590333], length 125: OpenFlow
	version 1.0, type PACKET_IN, length 125, xid 0x00000000
21:28:42.093703 IP 192.168.1.30.49348 > 192.168.1.10.6633: Flags [P.], seq 16463:16588, ack 1, win 58, options [nop,nop,TS val 21917423 ecr 46590333], length 125: OpenFlow
	version 1.0, type PACKET_IN, length 125, xid 0x00000000
21:28:42.093758 IP 192.168.1.30.49348 > 192.168.1.10.6633: Flags [P.], seq 16588:16713, ack 1, win 58, options [nop,nop,TS val 21917423 ecr 46590333], length 125: OpenFlow
	version 1.0, type PACKET_IN, length 125, xid 0x00000000
21:28:42.093789 IP 192.168.1.30.49348 > 192.168.1.10.6633: Flags [P.], seq 16713:16838, ack 1, win 58, options [nop,nop,TS val 21917423 ecr 46590333], length 125: OpenFlow
	version 1.0, type PACKET_IN, length 125, xid 0x00000000
21:28:42.093822 IP 192.168.1.30.49348 > 192.168.1.10.6633: Flags [P.], seq 16838:16963, ack 1, win 58, options [nop,nop,TS val 21917423 ecr 46590333], length 125: OpenFlow
	version 1.0, type PACKET_IN, length 125, xid 0x00000000
21:28:42.094112 IP 192.168.1.30.49348 > 192.168.1.10.6633: Flags [P.], seq 16963:17088, ack 1, win 58, options [nop,nop,TS val 21917423 ecr 46590333], length 125: OpenFlow
	version 1.0, type PACKET_IN, length 125, xid 0x00000000
21:28:42.094157 IP 192.168.1.30.49348 > 192.168.1.10.6633: Flags [P.], seq 17088:17213, ack 1, win 58, options [nop,nop,TS val 21917423 ecr 46590333], length 125: OpenFlow
	version 1.0, type PACKET_IN, length 125, xid 0x00000000
21:28:42.094188 IP 192.168.1.30.49348 > 192.168.1.10.6633: Flags [P.], seq 17213:17338, ack 1, win 58, options [nop,nop,TS val 21917423 ecr 46590333], length 125: OpenFlow
	version 1.0, type PACKET_IN, length 125, xid 0x00000000
21:28:42.094218 IP 192.168.1.30.49348 > 192.168.1.10.6633: Flags [P.], seq 17338:17463, ack 1, win 58, options [nop,nop,TS val 21917423 ecr 46590333], length 125: OpenFlow
	version 1.0, type PACKET_IN, length 125, xid 0x00000000
21:28:42.094250 IP 192.168.1.30.49348 > 192.168.1.10.6633: Flags [P.], seq 17463:17588, ack 1, win 58, options [nop,nop,TS val 21917423 ecr 46590333], length 125: OpenFlow
	version 1.0, type PACKET_IN, length 125, xid 0x00000000
21:28:42.094280 IP 192.168.1.30.49348 > 192.168.1.10.6633: Flags [P.], seq 17588:17713, ack 1, win 58, options [nop,nop,TS val 21917423 ecr 46590333], length 125: OpenFlow
	version 1.0, type PACKET_IN, length 125, xid 0x00000000
21:28:42.094312 IP 192.168.1.30.49348 > 192.168.1.10.6633: Flags [P.], seq 17713:17838, ack 1, win 58, options [nop,nop,TS val 21917423 ecr 46590333], length 125: OpenFlow
	version 1.0, type PACKET_IN, length 125, xid 0x00000000
21:28:42.094346 IP 192.168.1.30.49348 > 192.168.1.10.6633: Flags [P.], seq 17838:17963, ack 1, win 58, options [nop,nop,TS val 21917423 ecr 46590333], length 125: OpenFlow
	version 1.0, type PACKET_IN, length 125, xid 0x00000000
21:28:42.094381 IP 192.168.1.10.6633 > 192.168.1.30.49348: Flags [.], ack 16588, win 23325, options [nop,nop,TS val 46590334 ecr 21917423], length 0
21:28:42.094400 IP 192.168.1.10.6633 > 192.168.1.30.49348: Flags [.], ack 16963, win 23325, options [nop,nop,TS val 46590334 ecr 21917423], length 0
21:28:42.094425 IP 192.168.1.10.6633 > 192.168.1.30.49348: Flags [.], ack 17588, win 23325, options [nop,nop,TS val 46590334 ecr 21917423], length 0
21:28:42.094738 IP 192.168.1.30.49348 > 192.168.1.10.6633: Flags [P.], seq 17963:18088, ack 1, win 58, options [nop,nop,TS val 21917423 ecr 46590334], length 125: OpenFlow
	version 1.0, type PACKET_IN, length 125, xid 0x00000000
21:28:42.094772 IP 192.168.1.30.49348 > 192.168.1.10.6633: Flags [P.], seq 18088:18213, ack 1, win 58, options [nop,nop,TS val 21917423 ecr 46590334], length 125: OpenFlow
	version 1.0, type PACKET_IN, length 125, xid 0x00000000
21:28:42.094804 IP 192.168.1.30.49348 > 192.168.1.10.6633: Flags [P.], seq 18213:18338, ack 1, win 58, options [nop,nop,TS val 21917423 ecr 46590334], length 125: OpenFlow
	version 1.0, type PACKET_IN, length 125, xid 0x00000000
21:28:42.094837 IP 192.168.1.30.49348 > 192.168.1.10.6633: Flags [P.], seq 18338:18463, ack 1, win 58, options [nop,nop,TS val 21917423 ecr 46590334], length 125: OpenFlow
	version 1.0, type PACKET_IN, length 125, xid 0x00000000
21:28:42.094873 IP 192.168.1.30.49348 > 192.168.1.10.6633: Flags [P.], seq 18463:18588, ack 1, win 58, options [nop,nop,TS val 21917423 ecr 46590334], length 125: OpenFlow
	version 1.0, type PACKET_IN, length 125, xid 0x00000000
21:28:42.094906 IP 192.168.1.30.49348 > 192.168.1.10.6633: Flags [P.], seq 18588:18713, ack 1, win 58, options [nop,nop,TS val 21917423 ecr 46590334], length 125: OpenFlow
	version 1.0, type PACKET_IN, length 125, xid 0x00000000
21:28:42.094936 IP 192.168.1.30.49348 > 192.168.1.10.6633: Flags [P.], seq 18713:18838, ack 1, win 58, options [nop,nop,TS val 21917423 ecr 46590334], length 125: OpenFlow
	version 1.0, type PACKET_IN, length 125, xid 0x00000000
21:28:42.094996 IP 192.168.1.30.49348 > 192.168.1.10.6633: Flags [P.], seq 18838:18963, ack 1, win 58, options [nop,nop,TS val 21917423 ecr 46590334], length 125: OpenFlow
	version 1.0, type PACKET_IN, length 125, xid 0x00000000
21:28:42.095015 IP 192.168.1.10.6633 > 192.168.1.30.49348: Flags [.], ack 17838, win 23325, options [nop,nop,TS val 46590334 ecr 21917423], length 0
21:28:42.095025 IP 192.168.1.10.6633 > 192.168.1.30.49348: Flags [.], ack 17963, win 23325, options [nop,nop,TS val 46590334 ecr 21917423], length 0
21:28:42.095033 IP 192.168.1.30.49348 > 192.168.1.10.6633: Flags [P.], seq 18963:19088, ack 1, win 58, options [nop,nop,TS val 21917423 ecr 46590334], length 125: OpenFlow
	version 1.0, type PACKET_IN, length 125, xid 0x00000000
21:28:42.095401 IP 192.168.1.30.49348 > 192.168.1.10.6633: Flags [P.], seq 19088:19213, ack 1, win 58, options [nop,nop,TS val 21917423 ecr 46590334], length 125: OpenFlow
	version 1.0, type PACKET_IN, length 125, xid 0x00000000
21:28:42.095442 IP 192.168.1.30.49348 > 192.168.1.10.6633: Flags [P.], seq 19213:19338, ack 1, win 58, options [nop,nop,TS val 21917423 ecr 46590334], length 125: OpenFlow
	version 1.0, type PACKET_IN, length 125, xid 0x00000000
21:28:42.095476 IP 192.168.1.30.49348 > 192.168.1.10.6633: Flags [P.], seq 19338:19463, ack 1, win 58, options [nop,nop,TS val 21917423 ecr 46590334], length 125: OpenFlow
	version 1.0, type PACKET_IN, length 125, xid 0x00000000
21:28:42.095506 IP 192.168.1.30.49348 > 192.168.1.10.6633: Flags [P.], seq 19463:19588, ack 1, win 58, options [nop,nop,TS val 21917423 ecr 46590334], length 125: OpenFlow
	version 1.0, type PACKET_IN, length 125, xid 0x00000000
21:28:42.095536 IP 192.168.1.30.49348 > 192.168.1.10.6633: Flags [P.], seq 19588:19713, ack 1, win 58, options [nop,nop,TS val 21917423 ecr 46590334], length 125: OpenFlow
	version 1.0, type PACKET_IN, length 125, xid 0x00000000
21:28:42.095566 IP 192.168.1.30.49348 > 192.168.1.10.6633: Flags [P.], seq 19713:19838, ack 1, win 58, options [nop,nop,TS val 21917423 ecr 46590334], length 125: OpenFlow
	version 1.0, type PACKET_IN, length 125, xid 0x00000000
21:28:42.095598 IP 192.168.1.30.49348 > 192.168.1.10.6633: Flags [P.], seq 19838:19963, ack 1, win 58, options [nop,nop,TS val 21917423 ecr 46590334], length 125: OpenFlow
	version 1.0, type PACKET_IN, length 125, xid 0x00000000
21:28:42.095640 IP 192.168.1.30.49348 > 192.168.1.10.6633: Flags [P.], seq 19963:20088, ack 1, win 58, options [nop,nop,TS val 21917423 ecr 46590334], length 125: OpenFlow
	version 1.0, type PACKET_IN, length 125, xid 0x00000000
21:28:42.095677 IP 192.168.1.30.49348 > 192.168.1.10.6633: Flags [P.], seq 20088:20213, ack 1, win 58, options [nop,nop,TS val 21917423 ecr 46590334], length 125: OpenFlow
	version 1.0, type PACKET_IN, length 125, xid 0x00000000
21:28:42.095686 IP 192.168.1.10.6633 > 192.168.1.30.49348: Flags [.], ack 18838, win 23325, options [nop,nop,TS val 46590334 ecr 21917423], length 0
21:28:42.095704 IP 192.168.1.10.6633 > 192.168.1.30.49348: Flags [.], ack 18963, win 23325, options [nop,nop,TS val 46590334 ecr 21917423], length 0
21:28:42.095712 IP 192.168.1.30.49348 > 192.168.1.10.6633: Flags [P.], seq 20213:20338, ack 1, win 58, options [nop,nop,TS val 21917423 ecr 46590334], length 125: OpenFlow
	version 1.0, type PACKET_IN, length 125, xid 0x00000000
21:28:42.095712 IP 192.168.1.10.6633 > 192.168.1.30.49348: Flags [.], ack 19088, win 23325, options [nop,nop,TS val 46590334 ecr 21917423], length 0
21:28:42.095988 IP 192.168.1.30.49348 > 192.168.1.10.6633: Flags [P.], seq 20338:20463, ack 1, win 58, options [nop,nop,TS val 21917423 ecr 46590334], length 125: OpenFlow
	version 1.0, type PACKET_IN, length 125, xid 0x00000000
21:28:42.096019 IP 192.168.1.30.49348 > 192.168.1.10.6633: Flags [P.], seq 20463:20551, ack 1, win 58, options [nop,nop,TS val 21917423 ecr 46590334], length 88: OpenFlow
	version 1.0, type PACKET_IN, length 88, xid 0x00000000
21:28:42.096050 IP 192.168.1.30.49348 > 192.168.1.10.6633: Flags [P.], seq 20551:20676, ack 1, win 58, options [nop,nop,TS val 21917423 ecr 46590334], length 125: OpenFlow
	version 1.0, type PACKET_IN, length 125, xid 0x00000000
21:28:42.096081 IP 192.168.1.30.49348 > 192.168.1.10.6633: Flags [P.], seq 20676:20801, ack 1, win 58, options [nop,nop,TS val 21917423 ecr 46590334], length 125: OpenFlow
	version 1.0, type PACKET_IN, length 125, xid 0x00000000
21:28:42.096112 IP 192.168.1.30.49348 > 192.168.1.10.6633: Flags [P.], seq 20801:20926, ack 1, win 58, options [nop,nop,TS val 21917423 ecr 46590334], length 125: OpenFlow
	version 1.0, type PACKET_IN, length 125, xid 0x00000000
21:28:42.096145 IP 192.168.1.30.49348 > 192.168.1.10.6633: Flags [P.], seq 20926:21051, ack 1, win 58, options [nop,nop,TS val 21917423 ecr 46590334], length 125: OpenFlow
	version 1.0, type PACKET_IN, length 125, xid 0x00000000
21:28:42.096179 IP 192.168.1.30.49348 > 192.168.1.10.6633: Flags [P.], seq 21051:21176, ack 1, win 58, options [nop,nop,TS val 21917423 ecr 46590334], length 125: OpenFlow
	version 1.0, type PACKET_IN, length 125, xid 0x00000000
21:28:42.096221 IP 192.168.1.30.49348 > 192.168.1.10.6633: Flags [P.], seq 21176:21301, ack 1, win 58, options [nop,nop,TS val 21917423 ecr 46590334], length 125: OpenFlow
	version 1.0, type PACKET_IN, length 125, xid 0x00000000
21:28:42.096240 IP 192.168.1.10.6633 > 192.168.1.30.49348: Flags [.], ack 19963, win 23325, options [nop,nop,TS val 46590334 ecr 21917423], length 0
21:28:42.096258 IP 192.168.1.30.49348 > 192.168.1.10.6633: Flags [P.], seq 21301:21426, ack 1, win 58, options [nop,nop,TS val 21917423 ecr 46590334], length 125: OpenFlow
	version 1.0, type PACKET_IN, length 125, xid 0x00000000
21:28:42.096272 IP 192.168.1.10.6633 > 192.168.1.30.49348: Flags [.], ack 20338, win 23325, options [nop,nop,TS val 46590334 ecr 21917423], length 0
21:28:42.096365 IP 192.168.1.10.6633 > 192.168.1.30.49348: Flags [.], ack 21176, win 23325, options [nop,nop,TS val 46590334 ecr 21917423], length 0
21:28:42.096565 IP 192.168.1.30.49348 > 192.168.1.10.6633: Flags [P.], seq 21426:21551, ack 1, win 58, options [nop,nop,TS val 21917423 ecr 46590334], length 125: OpenFlow
	version 1.0, type PACKET_IN, length 125, xid 0x00000000
21:28:42.096610 IP 192.168.1.30.49348 > 192.168.1.10.6633: Flags [P.], seq 21551:21676, ack 1, win 58, options [nop,nop,TS val 21917423 ecr 46590334], length 125: OpenFlow
	version 1.0, type PACKET_IN, length 125, xid 0x00000000
21:28:42.096643 IP 192.168.1.30.49348 > 192.168.1.10.6633: Flags [P.], seq 21676:21801, ack 1, win 58, options [nop,nop,TS val 21917423 ecr 46590334], length 125: OpenFlow
	version 1.0, type PACKET_IN, length 125, xid 0x00000000
21:28:42.096673 IP 192.168.1.30.49348 > 192.168.1.10.6633: Flags [P.], seq 21801:21926, ack 1, win 58, options [nop,nop,TS val 21917423 ecr 46590334], length 125: OpenFlow
	version 1.0, type PACKET_IN, length 125, xid 0x00000000
21:28:42.096704 IP 192.168.1.30.49348 > 192.168.1.10.6633: Flags [P.], seq 21926:22051, ack 1, win 58, options [nop,nop,TS val 21917423 ecr 46590334], length 125: OpenFlow
	version 1.0, type PACKET_IN, length 125, xid 0x00000000
21:28:42.096733 IP 192.168.1.30.49348 > 192.168.1.10.6633: Flags [P.], seq 22051:22176, ack 1, win 58, options [nop,nop,TS val 21917423 ecr 46590334], length 125: OpenFlow
	version 1.0, type PACKET_IN, length 125, xid 0x00000000
21:28:42.096764 IP 192.168.1.30.49348 > 192.168.1.10.6633: Flags [P.], seq 22176:22301, ack 1, win 58, options [nop,nop,TS val 21917423 ecr 46590334], length 125: OpenFlow
	version 1.0, type PACKET_IN, length 125, xid 0x00000000
21:28:42.096804 IP 192.168.1.30.49348 > 192.168.1.10.6633: Flags [P.], seq 22301:22426, ack 1, win 58, options [nop,nop,TS val 21917423 ecr 46590334], length 125: OpenFlow
	version 1.0, type PACKET_IN, length 125, xid 0x00000000
21:28:42.096834 IP 192.168.1.10.6633 > 192.168.1.30.49348: Flags [.], ack 21426, win 23325, options [nop,nop,TS val 46590334 ecr 21917423], length 0
21:28:42.096838 IP 192.168.1.30.49348 > 192.168.1.10.6633: Flags [P.], seq 22426:22551, ack 1, win 58, options [nop,nop,TS val 21917423 ecr 46590334], length 125: OpenFlow
	version 1.0, type PACKET_IN, length 125, xid 0x00000000
21:28:42.096875 IP 192.168.1.30.49348 > 192.168.1.10.6633: Flags [P.], seq 22551:22676, ack 1, win 58, options [nop,nop,TS val 21917423 ecr 46590334], length 125: OpenFlow
	version 1.0, type PACKET_IN, length 125, xid 0x00000000
21:28:42.097253 IP 192.168.1.10.6633 > 192.168.1.30.49348: Flags [.], ack 22301, win 23325, options [nop,nop,TS val 46590334 ecr 21917423], length 0
21:28:42.097269 IP 192.168.1.10.6633 > 192.168.1.30.49348: Flags [.], ack 22551, win 23325, options [nop,nop,TS val 46590335 ecr 21917423], length 0
21:28:42.097291 IP 192.168.1.10.6633 > 192.168.1.30.49348: Flags [.], ack 22676, win 23325, options [nop,nop,TS val 46590335 ecr 21917423], length 0
21:28:42.097313 IP 192.168.1.30.49348 > 192.168.1.10.6633: Flags [P.], seq 22676:22801, ack 1, win 58, options [nop,nop,TS val 21917424 ecr 46590335], length 125: OpenFlow
	version 1.0, type PACKET_IN, length 125, xid 0x00000000
21:28:42.097357 IP 192.168.1.30.49348 > 192.168.1.10.6633: Flags [P.], seq 22801:22926, ack 1, win 58, options [nop,nop,TS val 21917424 ecr 46590335], length 125: OpenFlow
	version 1.0, type PACKET_IN, length 125, xid 0x00000000
21:28:42.097392 IP 192.168.1.30.49348 > 192.168.1.10.6633: Flags [P.], seq 22926:23051, ack 1, win 58, options [nop,nop,TS val 21917424 ecr 46590335], length 125: OpenFlow
	version 1.0, type PACKET_IN, length 125, xid 0x00000000
21:28:42.097427 IP 192.168.1.30.49348 > 192.168.1.10.6633: Flags [P.], seq 23051:23176, ack 1, win 58, options [nop,nop,TS val 21917424 ecr 46590335], length 125: OpenFlow
	version 1.0, type PACKET_IN, length 125, xid 0x00000000
21:28:42.097458 IP 192.168.1.30.49348 > 192.168.1.10.6633: Flags [P.], seq 23176:23301, ack 1, win 58, options [nop,nop,TS val 21917424 ecr 46590335], length 125: OpenFlow
	version 1.0, type PACKET_IN, length 125, xid 0x00000000
21:28:42.097487 IP 192.168.1.30.49348 > 192.168.1.10.6633: Flags [P.], seq 23301:23426, ack 1, win 58, options [nop,nop,TS val 21917424 ecr 46590335], length 125: OpenFlow
	version 1.0, type PACKET_IN, length 125, xid 0x00000000
21:28:42.097515 IP 192.168.1.30.49348 > 192.168.1.10.6633: Flags [P.], seq 23426:23551, ack 1, win 58, options [nop,nop,TS val 21917424 ecr 46590335], length 125: OpenFlow
	version 1.0, type PACKET_IN, length 125, xid 0x00000000
21:28:42.097551 IP 192.168.1.30.49348 > 192.168.1.10.6633: Flags [P.], seq 23551:23676, ack 1, win 58, options [nop,nop,TS val 21917424 ecr 46590335], length 125: OpenFlow
	version 1.0, type PACKET_IN, length 125, xid 0x00000000
21:28:42.097691 IP 192.168.1.30.49348 > 192.168.1.10.6633: Flags [P.], seq 23676:23801, ack 1, win 58, options [nop,nop,TS val 21917424 ecr 46590335], length 125: OpenFlow
	version 1.0, type PACKET_IN, length 125, xid 0x00000000
21:28:42.097850 IP 192.168.1.30.49348 > 192.168.1.10.6633: Flags [P.], seq 23801:23926, ack 1, win 58, options [nop,nop,TS val 21917424 ecr 46590335], length 125: OpenFlow
	version 1.0, type PACKET_IN, length 125, xid 0x00000000
21:28:42.097884 IP 192.168.1.30.49348 > 192.168.1.10.6633: Flags [P.], seq 23926:24051, ack 1, win 58, options [nop,nop,TS val 21917424 ecr 46590335], length 125: OpenFlow
	version 1.0, type PACKET_IN, length 125, xid 0x00000000
21:28:42.098145 IP 192.168.1.30.49348 > 192.168.1.10.6633: Flags [P.], seq 24051:24176, ack 1, win 58, options [nop,nop,TS val 21917424 ecr 46590335], length 125: OpenFlow
	version 1.0, type PACKET_IN, length 125, xid 0x00000000
21:28:42.098271 IP 192.168.1.10.6633 > 192.168.1.30.49348: Flags [.], ack 23551, win 23325, options [nop,nop,TS val 46590335 ecr 21917424], length 0
21:28:42.098288 IP 192.168.1.10.6633 > 192.168.1.30.49348: Flags [.], ack 23676, win 23325, options [nop,nop,TS val 46590335 ecr 21917424], length 0
21:28:42.098293 IP 192.168.1.30.49348 > 192.168.1.10.6633: Flags [P.], seq 24176:24301, ack 1, win 58, options [nop,nop,TS val 21917424 ecr 46590335], length 125: OpenFlow
	version 1.0, type PACKET_IN, length 125, xid 0x00000000
21:28:42.098296 IP 192.168.1.10.6633 > 192.168.1.30.49348: Flags [.], ack 23926, win 23325, options [nop,nop,TS val 46590335 ecr 21917424], length 0
