21:28:42.070374 IP 192.168.1.30.49351 > 192.168.1.10.6633: Flags [P.], seq 3599740868:3599740956, ack 365968496, win 58, options [nop,nop,TS val 21917416 ecr 46590318], length 88: OpenFlow
	version 1.0, type PACKET_IN, length 88, xid 0x00000000
21:28:42.070384 IP 192.168.1.30.49351 > 192.168.1.10.6633: Flags [P.], seq 88:213, ack 1, win 58, options [nop,nop,TS val 21917416 ecr 46590318], length 125: OpenFlow
	version 1.0, type PACKET_IN, length 125, xid 0x00000000
21:28:42.070394 IP 192.168.1.30.49351 > 192.168.1.10.6633: Flags [P.], seq 213:338, ack 1, win 58, options [nop,nop,TS val 21917416 ecr 46590318], length 125: OpenFlow
	version 1.0, type PACKET_IN, length 125, xid 0x00000000
21:28:42.070404 IP 192.168.1.30.49351 > 192.168.1.10.6633: Flags [P.], seq 338:463, ack 1, win 58, options [nop,nop,TS val 21917416 ecr 46590318], length 125: OpenFlow
	version 1.0, type PACKET_IN, length 125, xid 0x00000000
21:28:42.070414 IP 192.168.1.30.49351 > 192.168.1.10.6633: Flags [P.], seq 463:588, ack 1, win 58, options [nop,nop,TS val 21917416 ecr 46590318], length 125: OpenFlow
	version 1.0, type PACKET_IN, length 125, xid 0x00000000
21:28:42.070429 IP 192.168.1.30.49351 > 192.168.1.10.6633: Flags [P.], seq 588:713, ack 1, win 58, options [nop,nop,TS val 21917416 ecr 46590318], length 125: OpenFlow
	version 1.0, type PACKET_IN, length 125, xid 0x00000000
21:28:42.070438 IP 192.168.1.30.49351 > 192.168.1.10.6633: Flags [P.], seq 713:838, ack 1, win 58, options [nop,nop,TS val 21917416 ecr 46590318], length 125: OpenFlow
	version 1.0, type PACKET_IN, length 125, xid 0x00000000
21:28:42.070449 IP 192.168.1.30.49351 > 192.168.1.10.6633: Flags [P.], seq 838:963, ack 1, win 58, options [nop,nop,TS val 21917416 ecr 46590318], length 125: OpenFlow
	version 1.0, type PACKET_IN, length 125, xid 0x00000000
21:28:42.070459 IP 192.168.1.30.49351 > 192.168.1.10.6633: Flags [P.], seq 963:1088, ack 1, win 58, options [nop,nop,TS val 21917416 ecr 46590318], length 125: OpenFlow
	version 1.0, type PACKET_IN, length 125, xid 0x00000000
21:28:42.070469 IP 192.168.1.30.49351 > 192.168.1.10.6633: Flags [P.], seq 1088:1213, ack 1, win 58, options [nop,nop,TS val 21917416 ecr 46590318], length 125: OpenFlow
	version 1.0, type PACKET_IN, length 125, xid 0x00000000
21:28:42.070492 IP 192.168.1.30.49351 > 192.168.1.10.6633: Flags [P.], seq 1213:1338, ack 1, win 58, options [nop,nop,TS val 21917416 ecr 46590318], length 125: OpenFlow
	version 1.0, type PACKET_IN, length 125, xid 0x00000000
21:28:42.070506 IP 192.168.1.30.49351 > 192.168.1.10.6633: Flags [P.], seq 1338:1463, ack 1, win 58, options [nop,nop,TS val 21917416 ecr 46590318], length 125: OpenFlow
	version 1.0, type PACKET_IN, length 125, xid 0x00000000
21:28:42.070526 IP 192.168.1.30.49351 > 192.168.1.10.6633: Flags [P.], seq 1463:1588, ack 1, win 58, options [nop,nop,TS val 21917416 ecr 46590318], length 125: OpenFlow
	version 1.0, type PACKET_IN, length 125, xid 0x00000000
21:28:42.070540 IP 192.168.1.30.49351 > 192.168.1.10.6633: Flags [P.], seq 1588:1713, ack 1, win 58, options [nop,nop,TS val 21917416 ecr 46590318], length 125: OpenFlow
	version 1.0, type PACKET_IN, length 125, xid 0x00000000
21:28:42.070554 IP 192.168.1.30.49351 > 192.168.1.10.6633: Flags [P.], seq 1713:1838, ack 1, win 58, options [nop,nop,TS val 21917416 ecr 46590318], length 125: OpenFlow
	version 1.0, type PACKET_IN, length 125, xid 0x00000000
21:28:42.070567 IP 192.168.1.30.49351 > 192.168.1.10.6633: Flags [P.], seq 1838:1963, ack 1, win 58, options [nop,nop,TS val 21917416 ecr 46590318], length 125: OpenFlow
	version 1.0, type PACKET_IN, length 125, xid 0x00000000
21:28:42.070581 IP 192.168.1.30.49351 > 192.168.1.10.6633: Flags [P.], seq 1963:2088, ack 1, win 58, options [nop,nop,TS val 21917416 ecr 46590318], length 125: OpenFlow
	version 1.0, type PACKET_IN, length 125, xid 0x00000000
21:28:42.070595 IP 192.168.1.30.49351 > 192.168.1.10.6633: Flags [P.], seq 2088:2213, ack 1, win 58, options [nop,nop,TS val 21917416 ecr 46590318], length 125: OpenFlow
	version 1.0, type PACKET_IN, length 125, xid 0x00000000
21:28:42.070608 IP 192.168.1.30.49351 > 192.168.1.10.6633: Flags [P.], seq 2213:2338, ack 1, win 58, options [nop,nop,TS val 21917416 ecr 46590318], length 125: OpenFlow
	version 1.0, type PACKET_IN, length 125, xid 0x00000000
21:28:42.070637 IP 192.168.1.30.49351 > 192.168.1.10.6633: Flags [P.], seq 2338:2463, ack 1, win 58, options [nop,nop,TS val 21917416 ecr 46590318], length 125: OpenFlow
	version 1.0, type PACKET_IN, length 125, xid 0x00000000
21:28:42.070644 IP 192.168.1.10.6633 > 192.168.1.30.49351: Flags [.], ack 1463, win 16533, options [nop,nop,TS val 46590328 ecr 21917416], length 0
21:28:42.070652 IP 192.168.1.30.49351 > 192.168.1.10.6633: Flags [P.], seq 2463:2588, ack 1, win 58, options [nop,nop,TS val 21917416 ecr 46590318], length 125: OpenFlow
	version 1.0, type PACKET_IN, length 125, xid 0x00000000
21:28:42.070680 IP 192.168.1.30.49351 > 192.168.1.10.6633: Flags [P.], seq 2588:2713, ack 1, win 58, options [nop,nop,TS val 21917416 ecr 46590318], length 125: OpenFlow
	version 1.0, type PACKET_IN, length 125, xid 0x00000000
21:28:42.070696 IP 192.168.1.30.49351 > 192.168.1.10.6633: Flags [P.], seq 2713:2838, ack 1, win 58, options [nop,nop,TS val 21917416 ecr 46590318], length 125: OpenFlow
	version 1.0, type PACKET_IN, length 125, xid 0x00000000
21:28:42.070711 IP 192.168.1.30.49351 > 192.168.1.10.6633: Flags [P.], seq 2838:2963, ack 1, win 58, options [nop,nop,TS val 21917416 ecr 46590318], length 125: OpenFlow
	version 1.0, type PACKET_IN, length 125, xid 0x00000000
21:28:42.070725 IP 192.168.1.30.49351 > 192.168.1.10.6633: Flags [P.], seq 2963:3088, ack 1, win 58, options [nop,nop,TS val 21917416 ecr 46590318], length 125: OpenFlow
	version 1.0, type PACKET_IN, length 125, xid 0x00000000
21:28:42.070740 IP 192.168.1.30.49351 > 192.168.1.10.6633: Flags [P.], seq 3088:3213, ack 1, win 58, options [nop,nop,TS val 21917416 ecr 46590318], length 125: OpenFlow
	version 1.0, type PACKET_IN, length 125, xid 0x00000000
21:28:42.070754 IP 192.168.1.30.49351 > 192.168.1.10.6633: Flags [P.], seq 3213:3338, ack 1, win 58, options [nop,nop,TS val 21917416 ecr 46590318], length 125: OpenFlow
	version 1.0, type PACKET_IN, length 125, xid 0x00000000
21:28:42.070768 IP 192.168.1.30.49351 > 192.168.1.10.6633: Flags [P.], seq 3338:3463, ack 1, win 58, options [nop,nop,TS val 21917416 ecr 46590318], length 125: OpenFlow
	version 1.0, type PACKET_IN, length 125, xid 0x00000000
21:28:42.070782 IP 192.168.1.30.49351 > 192.168.1.10.6633: Flags [P.], seq 3463:3588, ack 1, win 58, options [nop,nop,TS val 21917416 ecr 46590318], length 125: OpenFlow
	version 1.0, type PACKET_IN, length 125, xid 0x00000000
21:28:42.070796 IP 192.168.1.30.49351 > 192.168.1.10.6633: Flags [P.], seq 3588:3713, ack 1, win 58, options [nop,nop,TS val 21917416 ecr 46590318], length 125: OpenFlow
	version 1.0, type PACKET_IN, length 125, xid 0x00000000
21:28:42.070810 IP 192.168.1.30.49351 > 192.168.1.10.6633: Flags [P.], seq 3713:3838, ack 1, win 58, options [nop,nop,TS val 21917416 ecr 46590318], length 125: OpenFlow
	version 1.0, type PACKET_IN, length 125, xid 0x00000000
21:28:42.070824 IP 192.168.1.30.49351 > 192.168.1.10.6633: Flags [P.], seq 3838:3963, ack 1, win 58, options [nop,nop,TS val 21917416 ecr 46590318], length 125: OpenFlow
	version 1.0, type PACKET_IN, length 125, xid 0x00000000
21:28:42.070838 IP 192.168.1.30.49351 > 192.168.1.10.6633: Flags [P.], seq 3963:4088, ack 1, win 58, options [nop,nop,TS val 21917416 ecr 46590318], length 125: OpenFlow
	version 1.0, type PACKET_IN, length 125, xid 0x00000000
21:28:42.070859 IP 192.168.1.30.49351 > 192.168.1.10.6633: Flags [P.], seq 4088:4213, ack 1, win 58, options [nop,nop,TS val 21917416 ecr 46590318], length 125: OpenFlow
	version 1.0, type PACKET_IN, length 125, xid 0x00000000
21:28:42.070874 IP 192.168.1.30.49351 > 192.168.1.10.6633: Flags [P.], seq 4213:4338, ack 1, win 58, options [nop,nop,TS val 21917416 ecr 46590318], length 125: OpenFlow
	version 1.0, type PACKET_IN, length 125, xid 0x00000000
21:28:42.070889 IP 192.168.1.30.49351 > 192.168.1.10.6633: Flags [P.], seq 4338:4463, ack 1, win 58, options [nop,nop,TS val 21917416 ecr 46590318], length 125: OpenFlow
	version 1.0, type PACKET_IN, length 125, xid 0x00000000
21:28:42.070900 IP 192.168.1.10.6633 > 192.168.1.30.49351: Flags [.], ack 1838, win 16533, options [nop,nop,TS val 46590328 ecr 21917416], length 0
21:28:42.070903 IP 192.168.1.30.49351 > 192.168.1.10.6633: Flags [P.], seq 4463:4588, ack 1, win 58, options [nop,nop,TS val 21917416 ecr 46590318], length 125: OpenFlow
	version 1.0, type PACKET_IN, length 125, xid 0x00000000
21:28:42.070917 IP 192.168.1.30.49351 > 192.168.1.10.6633: Flags [P.], seq 4588:4713, ack 1, win 58, options [nop,nop,TS val 21917416 ecr 46590318], length 125: OpenFlow
	version 1.0, type PACKET_IN, length 125, xid 0x00000000
21:28:42.070932 IP 192.168.1.30.49351 > 192.168.1.10.6633: Flags [P.], seq 4713:4838, ack 1, win 58, options [nop,nop,TS val 21917416 ecr 46590318], length 125: OpenFlow
	version 1.0, type PACKET_IN, length 125, xid 0x00000000
21:28:42.070939 IP 192.168.1.30.49351 > 192.168.1.10.6633: Flags [P.], seq 4838:4963, ack 1, win 58, options [nop,nop,TS val 21917416 ecr 46590318], length 125: OpenFlow
	version 1.0, type PACKET_IN, length 125, xid 0x00000000
21:28:42.070946 IP 192.168.1.30.49351 > 192.168.1.10.6633: Flags [P.], seq 4963:5088, ack 1, win 58, options [nop,nop,TS val 21917416 ecr 46590318], length 125: OpenFlow
	version 1.0, type PACKET_IN, length 125, xid 0x00000000
21:28:42.070953 IP 192.168.1.30.49351 > 192.168.1.10.6633: Flags [P.], seq 5088:5213, ack 1, win 58, options [nop,nop,TS val 21917416 ecr 46590318], length 125: OpenFlow
	version 1.0, type PACKET_IN, length 125, xid 0x00000000
21:28:42.070959 IP 192.168.1.30.49351 > 192.168.1.10.6633: Flags [P.], seq 5213:5338, ack 1, win 58, options [nop,nop,TS val 21917416 ecr 46590318], length 125: OpenFlow
	version 1.0, type PACKET_IN, length 125, xid 0x00000000
21:28:42.070966 IP 192.168.1.30.49351 > 192.168.1.10.6633: Flags [P.], seq 5338:5463, ack 1, win 58, options [nop,nop,TS val 21917416 ecr 46590318], length 125: OpenFlow
	version 1.0, type PACKET_IN, length 125, xid 0x00000000
21:28:42.070973 IP 192.168.1.30.49351 > 192.168.1.10.6633: Flags [P.], seq 5463:5588, ack 1, win 58, options [nop,nop,TS val 21917416 ecr 46590318], length 125: OpenFlow
	version 1.0, type PACKET_IN, length 125, xid 0x00000000
21:28:42.070979 IP 192.168.1.30.49351 > 192.168.1.10.6633: Flags [P.], seq 5588:5713, ack 1, win 58, options [nop,nop,TS val 21917416 ecr 46590318], length 125: OpenFlow
	version 1.0, type PACKET_IN, length 125, xid 0x00000000
21:28:42.070986 IP 192.168.1.30.49351 > 192.168.1.10.6633: Flags [P.], seq 5713:5838, ack 1, win 58, options [nop,nop,TS val 21917416 ecr 46590318], length 125: OpenFlow
	version 1.0, type PACKET_IN, length 125, xid 0x00000000
21:28:42.070993 IP 192.168.1.30.49351 > 192.168.1.10.6633: Flags [P.], seq 5838:5963, ack 1, win 58, options [nop,nop,TS val 21917416 ecr 46590318], length 125: OpenFlow
	version 1.0, type PACKET_IN, length 125, xid 0x00000000
21:28:42.071000 IP 192.168.1.30.49351 > 192.168.1.10.6633: Flags [P.], seq 5963:6088, ack 1, win 58, options [nop,nop,TS val 21917416 ecr 46590318], length 125: OpenFlow
	version 1.0, type PACKET_IN, length 125, xid 0x00000000
21:28:42.071008 IP 192.168.1.30.49351 > 192.168.1.10.6633: Flags [P.], seq 6088:6213, ack 1, win 58, options [nop,nop,TS val 21917416 ecr 46590318], length 125: OpenFlow
	version 1.0, type PACKET_IN, length 125, xid 0x00000000
21:28:42.071020 IP 192.168.1.30.49351 > 192.168.1.10.6633: Flags [P.], seq 6213:6338, ack 1, win 58, options [nop,nop,TS val 21917416 ecr 46590318], length 125: OpenFlow
	version 1.0, type PACKET_IN, length 125, xid 0x00000000
21:28:42.071029 IP 192.168.1.30.49351 > 192.168.1.10.6633: Flags [P.], seq 6338:6463, ack 1, win 58, options [nop,nop,TS val 21917416 ecr 46590318], length 125: OpenFlow
	version 1.0, type PACKET_IN, length 125, xid 0x00000000
21:28:42.071036 IP 192.168.1.30.49351 > 192.168.1.10.6633: Flags [P.], seq 6463:6588, ack 1, win 58, options [nop,nop,TS val 21917416 ecr 46590318], length 125: OpenFlow
	version 1.0, type PACKET_IN, length 125, xid 0x00000000
21:28:42.071042 IP 192.168.1.30.49351 > 192.168.1.10.6633: Flags [P.], seq 6588:6713, ack 1, win 58, options [nop,nop,TS val 21917416 ecr 46590318], length 125: OpenFlow
	version 1.0, type PACKET_IN, length 125, xid 0x00000000
21:28:42.071049 IP 192.168.1.30.49351 > 192.168.1.10.6633: Flags [P.], seq 6713:6838, ack 1, win 58, options [nop,nop,TS val 21917416 ecr 46590318], length 125: OpenFlow
	version 1.0, type PACKET_IN, length 125, xid 0x00000000
21:28:42.071052 IP 192.168.1.10.6633 > 192.168.1.30.49351: Flags [.], ack 3338, win 16533, options [nop,nop,TS val 46590328 ecr 21917416], length 0
21:28:42.071056 IP 192.168.1.30.49351 > 192.168.1.10.6633: Flags [P.], seq 6838:6963, ack 1, win 58, options [nop,nop,TS val 21917416 ecr 46590318], length 125: OpenFlow
	version 1.0, type PACKET_IN, length 125, xid 0x00000000
21:28:42.071063 IP 192.168.1.30.49351 > 192.168.1.10.6633: Flags [P.], seq 6963:7088, ack 1, win 58, options [nop,nop,TS val 21917416 ecr 46590318], length 125: OpenFlow
	version 1.0, type PACKET_IN, length 125, xid 0x00000000
21:28:42.071067 IP 192.168.1.10.6633 > 192.168.1.30.49351: Flags [.], ack 4713, win 16533, options [nop,nop,TS val 46590328 ecr 21917416], length 0
21:28:42.071269 IP 192.168.1.10.6633 > 192.168.1.30.49351: Flags [.], ack 6213, win 16533, options [nop,nop,TS val 46590328 ecr 21917416], length 0
21:28:42.071406 IP 192.168.1.10.6633 > 192.168.1.30.49351: Flags [.], ack 7088, win 16533, options [nop,nop,TS val 46590328 ecr 21917416], length 0
21:28:42.072557 IP 192.168.1.30.49351 > 192.168.1.10.6633: Flags [P.], seq 7088:11926, ack 1, win 58, options [nop,nop,TS val 21917417 ecr 46590318], length 4838: OpenFlow
	version 1.0, type PACKET_IN, length 125, xid 0x00000000
	version 1.0, type PACKET_IN, length 125, xid 0x00000000
	version 1.0, type PACKET_IN, length 125, xid 0x00000000
	version 1.0, type PACKET_IN, length 125, xid 0x00000000
	version 1.0, type PACKET_IN, length 125, xid 0x00000000
	version 1.0, type PACKET_IN, length 125, xid 0x00000000
	version 1.0, type PACKET_IN, length 88, xid 0x00000000
	version 1.0, type PACKET_IN, length 125, xid 0x00000000
	version 1.0, type PACKET_IN, length 125, xid 0x00000000
	version 1.0, type PACKET_IN, length 125, xid 0x00000000
	version 1.0, type PACKET_IN, length 125, xid 0x00000000
	version 1.0, type PACKET_IN, length 125, xid 0x00000000
	version 1.0, type PACKET_IN, length 125, xid 0x00000000
	version 1.0, type PACKET_IN, length 125, xid 0x00000000
	version 1.0, type PACKET_IN, length 125, xid 0x00000000
	version 1.0, type PACKET_IN, length 125, xid 0x00000000
	version 1.0, type PACKET_IN, length 125, xid 0x00000000
	version 1.0, type PACKET_IN, length 125, xid 0x00000000
	version 1.0, type PACKET_IN, length 125, xid 0x00000000
	version 1.0, type PACKET_IN, length 125, xid 0x00000000
	version 1.0, type PACKET_IN, length 125, xid 0x00000000
	version 1.0, type PACKET_IN, length 125, xid 0x00000000
	version 1.0, type PACKET_IN, length 125, xid 0x00000000
	version 1.0, type PACKET_IN, length 125, xid 0x00000000
	version 1.0, type PACKET_IN, length 125, xid 0x00000000
	version 1.0, type PACKET_IN, length 125, xid 0x00000000
	version 1.0, type PACKET_IN, length 125, xid 0x00000000
	version 1.0, type PACKET_IN, length 125, xid 0x00000000
	version 1.0, type PACKET_IN, length 125, xid 0x00000000
	version 1.0, type PACKET_IN, length 125, xid 0x00000000
	version 1.0, type PACKET_IN, length 125, xid 0x00000000
	version 1.0, type PACKET_IN, length 125, xid 0x00000000
	version 1.0, type PACKET_IN, length 125, xid 0x00000000
	version 1.0, type PACKET_IN, length 125, xid 0x00000000
	version 1.0, type PACKET_IN, length 125, xid 0x00000000
	version 1.0, type PACKET_IN, length 125, xid 0x00000000
	version 1.0, type PACKET_IN, length 125, xid 0x00000000
	version 1.0, type PACKET_IN, length 125, xid 0x00000000
	version 1.0, type PACKET_IN, length 125, xid 0x00000000
21:28:42.072582 IP 192.168.1.30.49351 > 192.168.1.10.6633: Flags [P.], seq 11926:16764, ack 1, win 58, options [nop,nop,TS val 21917417 ecr 46590318], length 4838: OpenFlow
	version 1.0, type PACKET_IN, length 125, xid 0x00000000
	version 1.0, type PACKET_IN, length 125, xid 0x00000000
	version 1.0, type PACKET_IN, length 125, xid 0x00000000
	version 1.0, type PACKET_IN, length 125, xid 0x00000000
	version 1.0, type PACKET_IN, length 125, xid 0x00000000
	version 1.0, type PACKET_IN, length 125, xid 0x00000000
	version 1.0, type PACKET_IN, length 125, xid 0x00000000
	version 1.0, type PACKET_IN, length 125, xid 0x00000000
	version 1.0, type PACKET_IN, length 125, xid 0x00000000
	version 1.0, type PACKET_IN, length 125, xid 0x00000000
	version 1.0, type PACKET_IN, length 125, xid 0x00000000
	version 1.0, type PACKET_IN, length 125, xid 0x00000000
	version 1.0, type PACKET_IN, length 125, xid 0x00000000
	version 1.0, type PACKET_IN, length 125, xid 0x00000000
	version 1.0, type PACKET_IN, length 125, xid 0x00000000
	version 1.0, type PACKET_IN, length 125, xid 0x00000000
	version 1.0, type PACKET_IN, length 125, xid 0x00000000
	version 1.0, type PACKET_IN, length 125, xid 0x00000000
	version 1.0, type PACKET_IN, length 125, xid 0x00000000
	version 1.0, type PACKET_IN, length 88, xid 0x00000000
	version 1.0, type PACKET_IN, length 125, xid 0x00000000
	version 1.0, type PACKET_IN, length 125, xid 0x00000000
	version 1.0, type PACKET_IN, length 125, xid 0x00000000
	version 1.0, type PACKET_IN, length 125, xid 0x00000000
	version 1.0, type PACKET_IN, length 125, xid 0x00000000
	version 1.0, type PACKET_IN, length 125, xid 0x00000000
	version 1.0, type PACKET_IN, length 125, xid 0x00000000
	version 1.0, type PACKET_IN, length 125, xid 0x00000000
	version 1.0, type PACKET_IN, length 125, xid 0x00000000
	version 1.0, type PACKET_IN, length 125, xid 0x00000000
	version 1.0, type PACKET_IN, length 125, xid 0x00000000
	version 1.0, type PACKET_IN, length 125, xid 0x00000000
	version 1.0, type PACKET_IN, length 125, xid 0x00000000
	version 1.0, type PACKET_IN, length 125, xid 0x00000000
	version 1.0, type PACKET_IN, length 125, xid 0x00000000
	version 1.0, type PACKET_IN, length 125, xid 0x00000000
	version 1.0, type PACKET_IN, length 125, xid 0x00000000
	version 1.0, type PACKET_IN, length 125, xid 0x00000000
	version 1.0, type PACKET_IN, length 125, xid 0x00000000
21:28:42.072606 IP 192.168.1.30.49351 > 192.168.1.10.6633: Flags [P.], seq 16764:17514, ack 1, win 58, options [nop,nop,TS val 21917417 ecr 46590328], length 750: OpenFlow
	version 1.0, type PACKET_IN, length 125, xid 0x00000000
	version 1.0, type PACKET_IN, length 125, xid 0x00000000
	version 1.0, type PACKET_IN, length 125, xid 0x00000000
	version 1.0, type PACKET_IN, length 125, xid 0x00000000
	version 1.0, type PACKET_IN, length 125, xid 0x00000000
	version 1.0, type PACKET_IN, length 125, xid 0x00000000
21:28:42.073092 IP 192.168.1.10.6633 > 192.168.1.30.49351: Flags [.], ack 11926, win 16533, options [nop,nop,TS val 46590328 ecr 21917417], length 0
21:28:42.073147 IP 192.168.1.10.6633 > 192.168.1.30.49351: Flags [.], ack 16764, win 16533, options [nop,nop,TS val 46590328 ecr 21917417], length 0
21:28:42.073765 IP 192.168.1.10.6633 > 192.168.1.30.49351: Flags [.], ack 17514, win 16533, options [nop,nop,TS val 46590329 ecr 21917417], length 0
21:28:42.101961 IP 192.168.1.30.49351 > 192.168.1.10.6633: Flags [P.], seq 17514:17639, ack 1, win 58, options [nop,nop,TS val 21917425 ecr 46590329], length 125: OpenFlow
	version 1.0, type PACKET_IN, length 125, xid 0x00000000
21:28:42.102001 IP 192.168.1.30.49351 > 192.168.1.10.6633: Flags [P.], seq 17639:17764, ack 1, win 58, options [nop,nop,TS val 21917425 ecr 46590329], length 125: OpenFlow
	version 1.0, type PACKET_IN, length 125, xid 0x00000000
21:28:42.102030 IP 192.168.1.30.49351 > 192.168.1.10.6633: Flags [P.], seq 17764:17889, ack 1, win 58, options [nop,nop,TS val 21917425 ecr 46590329], length 125: OpenFlow
	version 1.0, type PACKET_IN, length 125, xid 0x00000000
21:28:42.102058 IP 192.168.1.30.49351 > 192.168.1.10.6633: Flags [P.], seq 17889:18014, ack 1, win 58, options [nop,nop,TS val 21917425 ecr 46590329], length 125: OpenFlow
	version 1.0, type PACKET_IN, length 125, xid 0x00000000
21:28:42.102087 IP 192.168.1.30.49351 > 192.168.1.10.6633: Flags [P.], seq 18014:18139, ack 1, win 58, options [nop,nop,TS val 21917425 ecr 46590329], length 125: OpenFlow
	version 1.0, type PACKET_IN, length 125, xid 0x00000000
21:28:42.102114 IP 192.168.1.30.49351 > 192.168.1.10.6633: Flags [P.], seq 18139:18264, ack 1, win 58, options [nop,nop,TS val 21917425 ecr 46590329], length 125: OpenFlow
	version 1.0, type PACKET_IN, length 125, xid 0x00000000
21:28:42.102142 IP 192.168.1.30.49351 > 192.168.1.10.6633: Flags [P.], seq 18264:18389, ack 1, win 58, options [nop,nop,TS val 21917425 ecr 46590329], length 125: OpenFlow
	version 1.0, type PACKET_IN, length 125, xid 0x00000000
21:28:42.102169 IP 192.168.1.30.49351 > 192.168.1.10.6633: Flags [P.], seq 18389:18514, ack 1, win 58, options [nop,nop,TS val 21917425 ecr 46590329], length 125: OpenFlow
	version 1.0, type PACKET_IN, length 125, xid 0x00000000
21:28:42.102197 IP 192.168.1.30.49351 > 192.168.1.10.6633: Flags [P.], seq 18514:18639, ack 1, win 58, options [nop,nop,TS val 21917425 ecr 46590329], length 125: OpenFlow
	version 1.0, type PACKET_IN, length 125, xid 0x00000000
21:28:42.102225 IP 192.168.1.30.49351 > 192.168.1.10.6633: Flags [P.], seq 18639:18764, ack 1, win 58, options [nop,nop,TS val 21917425 ecr 46590329], length 125: OpenFlow
	version 1.0, type PACKET_IN, length 125, xid 0x00000000
21:28:42.102253 IP 192.168.1.30.49351 > 192.168.1.10.6633: Flags [P.], seq 18764:18889, ack 1, win 58, options [nop,nop,TS val 21917425 ecr 46590329], length 125: OpenFlow
	version 1.0, type PACKET_IN, length 125, xid 0x00000000
21:28:42.102281 IP 192.168.1.30.49351 > 192.168.1.10.6633: Flags [P.], seq 18889:19014, ack 1, win 58, options [nop,nop,TS val 21917425 ecr 46590329], length 125: OpenFlow
	version 1.0, type PACKET_IN, length 125, xid 0x00000000
21:28:42.102310 IP 192.168.1.30.49351 > 192.168.1.10.6633: Flags [P.], seq 19014:19139, ack 1, win 58, options [nop,nop,TS val 21917425 ecr 46590329], length 125: OpenFlow
	version 1.0, type PACKET_IN, length 125, xid 0x00000000
21:28:42.102339 IP 192.168.1.30.49351 > 192.168.1.10.6633: Flags [P.], seq 19139:19264, ack 1, win 58, options [nop,nop,TS val 21917425 ecr 46590329], length 125: OpenFlow
	version 1.0, type PACKET_IN, length 125, xid 0x00000000
21:28:42.102366 IP 192.168.1.30.49351 > 192.168.1.10.6633: Flags [P.], seq 19264:19389, ack 1, win 58, options [nop,nop,TS val 21917425 ecr 46590329], length 125: OpenFlow
	version 1.0, type PACKET_IN, length 125, xid 0x00000000
21:28:42.102400 IP 192.168.1.30.49351 > 192.168.1.10.6633: Flags [P.], seq 19389:19514, ack 1, win 58, options [nop,nop,TS val 21917425 ecr 46590329], length 125: OpenFlow
	version 1.0, type PACKET_IN, length 125, xid 0x00000000
21:28:42.102427 IP 192.168.1.30.49351 > 192.168.1.10.6633: Flags [P.], seq 19514:19639, ack 1, win 58, options [nop,nop,TS val 21917425 ecr 46590329], length 125: OpenFlow
	version 1.0, type PACKET_IN, length 125, xid 0x00000000
21:28:42.102457 IP 192.168.1.30.49351 > 192.168.1.10.6633: Flags [P.], seq 19639:19764, ack 1, win 58, options [nop,nop,TS val 21917425 ecr 46590329], length 125: OpenFlow
	version 1.0, type PACKET_IN, length 125, xid 0x00000000
21:28:42.102484 IP 192.168.1.30.49351 > 192.168.1.10.6633: Flags [P.], seq 19764:19889, ack 1, win 58, options [nop,nop,TS val 21917425 ecr 46590329], length 125: OpenFlow
	version 1.0, type PACKET_IN, length 125, xid 0x00000000
21:28:42.102514 IP 192.168.1.30.49351 > 192.168.1.10.6633: Flags [P.], seq 19889:20014, ack 1, win 58, options [nop,nop,TS val 21917425 ecr 46590329], length 125: OpenFlow
	version 1.0, type PACKET_IN, length 125, xid 0x00000000
21:28:42.102543 IP 192.168.1.30.49351 > 192.168.1.10.6633: Flags [P.], seq 20014:20139, ack 1, win 58, options [nop,nop,TS val 21917425 ecr 46590329], length 125: OpenFlow
	version 1.0, type PACKET_IN, length 125, xid 0x00000000
21:28:42.102571 IP 192.168.1.30.49351 > 192.168.1.10.6633: Flags [P.], seq 20139:20264, ack 1, win 58, options [nop,nop,TS val 21917425 ecr 46590329], length 125: OpenFlow
	version 1.0, type PACKET_IN, length 125, xid 0x00000000
21:28:42.102599 IP 192.168.1.30.49351 > 192.168.1.10.6633: Flags [P.], seq 20264:20389, ack 1, win 58, options [nop,nop,TS val 21917425 ecr 46590329], length 125: OpenFlow
	version 1.0, type PACKET_IN, length 125, xid 0x00000000
21:28:42.102631 IP 192.168.1.30.49351 > 192.168.1.10.6633: Flags [P.], seq 20389:20514, ack 1, win 58, options [nop,nop,TS val 21917425 ecr 46590329], length 125: OpenFlow
	version 1.0, type PACKET_IN, length 125, xid 0x00000000
21:28:42.102659 IP 192.168.1.30.49351 > 192.168.1.10.6633: Flags [P.], seq 20514:20639, ack 1, win 58, options [nop,nop,TS val 21917425 ecr 46590329], length 125: OpenFlow
	version 1.0, type PACKET_IN, length 125, xid 0x00000000
21:28:42.102688 IP 192.168.1.30.49351 > 192.168.1.10.6633: Flags [P.], seq 20639:20764, ack 1, win 58, options [nop,nop,TS val 21917425 ecr 46590329], length 125: OpenFlow
	version 1.0, type PACKET_IN, length 125, xid 0x00000000
21:28:42.102716 IP 192.168.1.30.49351 > 192.168.1.10.6633: Flags [P.], seq 20764:20889, ack 1, win 58, options [nop,nop,TS val 21917425 ecr 46590329], length 125: OpenFlow
	version 1.0, type PACKET_IN, length 125, xid 0x00000000
21:28:42.102744 IP 192.168.1.30.49351 > 192.168.1.10.6633: Flags [P.], seq 20889:21014, ack 1, win 58, options [nop,nop,TS val 21917425 ecr 46590329], length 125: OpenFlow
	version 1.0, type PACKET_IN, length 125, xid 0x00000000
21:28:42.102772 IP 192.168.1.30.49351 > 192.168.1.10.6633: Flags [P.], seq 21014:21139, ack 1, win 58, options [nop,nop,TS val 21917425 ecr 46590329], length 125: OpenFlow
	version 1.0, type PACKET_IN, length 125, xid 0x00000000
21:28:42.102800 IP 192.168.1.30.49351 > 192.168.1.10.6633: Flags [P.], seq 21139:21264, ack 1, win 58, options [nop,nop,TS val 21917425 ecr 46590329], length 125: OpenFlow
	version 1.0, type PACKET_IN, length 125, xid 0x00000000
21:28:42.102829 IP 192.168.1.30.49351 > 192.168.1.10.6633: Flags [P.], seq 21264:21389, ack 1, win 58, options [nop,nop,TS val 21917425 ecr 46590329], length 125: OpenFlow
	version 1.0, type PACKET_IN, length 125, xid 0x00000000
21:28:42.102861 IP 192.168.1.30.49351 > 192.168.1.10.6633: Flags [P.], seq 21389:21514, ack 1, win 58, options [nop,nop,TS val 21917425 ecr 46590329], length 125: OpenFlow
	version 1.0, type PACKET_IN, length 125, xid 0x00000000
21:28:42.102889 IP 192.168.1.30.49351 > 192.168.1.10.6633: Flags [P.], seq 21514:21639, ack 1, win 58, options [nop,nop,TS val 21917425 ecr 46590329], length 125: OpenFlow
	version 1.0, type PACKET_IN, length 125, xid 0x00000000
21:28:42.102917 IP 192.168.1.30.49351 > 192.168.1.10.6633: Flags [P.], seq 21639:21764, ack 1, win 58, options [nop,nop,TS val 21917425 ecr 46590329], length 125: OpenFlow
	version 1.0, type PACKET_IN, length 125, xid 0x00000000
21:28:42.102945 IP 192.168.1.30.49351 > 192.168.1.10.6633: Flags [P.], seq 21764:21889, ack 1, win 58, options [nop,nop,TS val 21917425 ecr 46590329], length 125: OpenFlow
	version 1.0, type PACKET_IN, length 125, xid 0x00000000
21:28:42.102973 IP 192.168.1.30.49351 > 192.168.1.10.6633: Flags [P.], seq 21889:22014, ack 1, win 58, options [nop,nop,TS val 21917425 ecr 46590329], length 125: OpenFlow
	version 1.0, type PACKET_IN, length 125, xid 0x00000000
21:28:42.103001 IP 192.168.1.30.49351 > 192.168.1.10.6633: Flags [P.], seq 22014:22139, ack 1, win 58, options [nop,nop,TS val 21917425 ecr 46590329], length 125: OpenFlow
	version 1.0, type PACKET_IN, length 125, xid 0x00000000
21:28:42.103029 IP 192.168.1.30.49351 > 192.168.1.10.6633: Flags [P.], seq 22139:22264, ack 1, win 58, options [nop,nop,TS val 21917425 ecr 46590329], length 125: OpenFlow
	version 1.0, type PACKET_IN, length 125, xid 0x00000000
21:28:42.103058 IP 192.168.1.30.49351 > 192.168.1.10.6633: Flags [P.], seq 22264:22389, ack 1, win 58, options [nop,nop,TS val 21917425 ecr 46590329], length 125: OpenFlow
	version 1.0, type PACKET_IN, length 125, xid 0x00000000
21:28:42.103079 IP 192.168.1.30.49351 > 192.168.1.10.6633: Flags [P.], seq 22389:22514, ack 1, win 58, options [nop,nop,TS val 21917425 ecr 46590329], length 125: OpenFlow
	version 1.0, type PACKET_IN, length 125, xid 0x00000000
21:28:42.103097 IP 192.168.1.30.49351 > 192.168.1.10.6633: Flags [P.], seq 22514:22639, ack 1, win 58, options [nop,nop,TS val 21917425 ecr 46590329], length 125: OpenFlow
	version 1.0, type PACKET_IN, length 125, xid 0x00000000
21:28:42.103114 IP 192.168.1.30.49351 > 192.168.1.10.6633: Flags [P.], seq 22639:22764, ack 1, win 58, options [nop,nop,TS val 21917425 ecr 46590329], length 125: OpenFlow
	version 1.0, type PACKET_IN, length 125, xid 0x00000000
21:28:42.103131 IP 192.168.1.30.49351 > 192.168.1.10.6633: Flags [P.], seq 22764:22889, ack 1, win 58, options [nop,nop,TS val 21917425 ecr 46590329], length 125: OpenFlow
	version 1.0, type PACKET_IN, length 125, xid 0x00000000
21:28:42.103149 IP 192.168.1.30.49351 > 192.168.1.10.6633: Flags [P.], seq 22889:23014, ack 1, win 58, options [nop,nop,TS val 21917425 ecr 46590329], length 125: OpenFlow
	version 1.0, type PACKET_IN, length 125, xid 0x00000000
21:28:42.103166 IP 192.168.1.30.49351 > 192.168.1.10.6633: Flags [P.], seq 23014:23139, ack 1, win 58, options [nop,nop,TS val 21917425 ecr 46590329], length 125: OpenFlow
	version 1.0, type PACKET_IN, length 125, xid 0x00000000
21:28:42.103184 IP 192.168.1.30.49351 > 192.168.1.10.6633: Flags [P.], seq 23139:23264, ack 1, win 58, options [nop,nop,TS val 21917425 ecr 46590329], length 125: OpenFlow
	version 1.0, type PACKET_IN, length 125, xid 0x00000000
21:28:42.103201 IP 192.168.1.30.49351 > 192.168.1.10.6633: Flags [P.], seq 23264:23389, ack 1, win 58, options [nop,nop,TS val 21917425 ecr 46590329], length 125: OpenFlow
	version 1.0, type PACKET_IN, length 125, xid 0x00000000
21:28:42.103217 IP 192.168.1.30.49351 > 192.168.1.10.6633: Flags [P.], seq 23389:23514, ack 1, win 58, options [nop,nop,TS val 21917425 ecr 46590329], length 125: OpenFlow
	version 1.0, type PACKET_IN, length 125, xid 0x00000000
21:28:42.103234 IP 192.168.1.30.49351 > 192.168.1.10.6633: Flags [P.], seq 23514:23639, ack 1, win 58, options [nop,nop,TS val 21917425 ecr 46590329], length 125: OpenFlow
	version 1.0, type PACKET_IN, length 125, xid 0x00000000
21:28:42.103251 IP 192.168.1.30.49351 > 192.168.1.10.6633: Flags [P.], seq 23639:23764, ack 1, win 58, options [nop,nop,TS val 21917425 ecr 46590329], length 125: OpenFlow
	version 1.0, type PACKET_IN, length 125, xid 0x00000000
21:28:42.103269 IP 192.168.1.30.49351 > 192.168.1.10.6633: Flags [P.], seq 23764:23889, ack 1, win 58, options [nop,nop,TS val 21917425 ecr 46590329], length 125: OpenFlow
	version 1.0, type PACKET_IN, length 125, xid 0x00000000
21:28:42.103286 IP 192.168.1.30.49351 > 192.168.1.10.6633: Flags [P.], seq 23889:24014, ack 1, win 58, options [nop,nop,TS val 21917425 ecr 46590329], length 125: OpenFlow
	version 1.0, type PACKET_IN, length 125, xid 0x00000000
21:28:42.103304 IP 192.168.1.30.49351 > 192.168.1.10.6633: Flags [P.], seq 24014:24139, ack 1, win 58, options [nop,nop,TS val 21917425 ecr 46590329], length 125: OpenFlow
	version 1.0, type PACKET_IN, length 125, xid 0x00000000
21:28:42.103321 IP 192.168.1.30.49351 > 192.168.1.10.6633: Flags [P.], seq 24139:24264, ack 1, win 58, options [nop,nop,TS val 21917425 ecr 46590329], length 125: OpenFlow
	version 1.0, type PACKET_IN, length 125, xid 0x00000000
21:28:42.103343 IP 192.168.1.30.49351 > 192.168.1.10.6633: Flags [P.], seq 24264:24389, ack 1, win 58, options [nop,nop,TS val 21917425 ecr 46590329], length 125: OpenFlow
	version 1.0, type PACKET_IN, length 125, xid 0x00000000
21:28:42.103361 IP 192.168.1.30.49351 > 192.168.1.10.6633: Flags [P.], seq 24389:24514, ack 1, win 58, options [nop,nop,TS val 21917425 ecr 46590329], length 125: OpenFlow
	version 1.0, type PACKET_IN, length 125, xid 0x00000000
21:28:42.103379 IP 192.168.1.30.49351 > 192.168.1.10.6633: Flags [P.], seq 24514:24639, ack 1, win 58, options [nop,nop,TS val 21917425 ecr 46590329], length 125: OpenFlow
	version 1.0, type PACKET_IN, length 125, xid 0x00000000
21:28:42.103397 IP 192.168.1.30.49351 > 192.168.1.10.6633: Flags [P.], seq 24639:24764, ack 1, win 58, options [nop,nop,TS val 21917425 ecr 46590329], length 125: OpenFlow
	version 1.0, type PACKET_IN, length 125, xid 0x00000000
21:28:42.103414 IP 192.168.1.30.49351 > 192.168.1.10.6633: Flags [P.], seq 24764:24889, ack 1, win 58, options [nop,nop,TS val 21917425 ecr 46590329], length 125: OpenFlow
	version 1.0, type PACKET_IN, length 125, xid 0x00000000
21:28:42.103422 IP 192.168.1.10.6633 > 192.168.1.30.49351: Flags [.], ack 17764, win 16533, options [nop,nop,TS val 46590336 ecr 21917425], length 0
21:28:42.103435 IP 192.168.1.30.49351 > 192.168.1.10.6633: Flags [P.], seq 24889:25014, ack 1, win 58, options [nop,nop,TS val 21917425 ecr 46590336], length 125: OpenFlow
	version 1.0, type PACKET_IN, length 125, xid 0x00000000
21:28:42.103440 IP 192.168.1.10.6633 > 192.168.1.30.49351: Flags [.], ack 18639, win 16533, options [nop,nop,TS val 46590336 ecr 21917425], length 0
21:28:42.103449 IP 192.168.1.10.6633 > 192.168.1.30.49351: Flags [.], ack 19014, win 16533, options [nop,nop,TS val 46590336 ecr 21917425], length 0
21:28:42.103453 IP 192.168.1.30.49351 > 192.168.1.10.6633: Flags [P.], seq 25014:25139, ack 1, win 58, options [nop,nop,TS val 21917425 ecr 46590336], length 125: OpenFlow
	version 1.0, type PACKET_IN, length 125, xid 0x00000000
21:28:42.103456 IP 192.168.1.10.6633 > 192.168.1.30.49351: Flags [.], ack 19514, win 16533, options [nop,nop,TS val 46590336 ecr 21917425], length 0
21:28:42.103462 IP 192.168.1.10.6633 > 192.168.1.30.49351: Flags [.], ack 20014, win 16533, options [nop,nop,TS val 46590336 ecr 21917425], length 0
21:28:42.103469 IP 192.168.1.10.6633 > 192.168.1.30.49351: Flags [.], ack 20514, win 16533, options [nop,nop,TS val 46590336 ecr 21917425], length 0
21:28:42.103478 IP 192.168.1.10.6633 > 192.168.1.30.49351: Flags [.], ack 21139, win 16533, options [nop,nop,TS val 46590336 ecr 21917425], length 0
21:28:42.103480 IP 192.168.1.30.49351 > 192.168.1.10.6633: Flags [P.], seq 25139:25264, ack 1, win 58, options [nop,nop,TS val 21917425 ecr 46590336], length 125: OpenFlow
	version 1.0, type PACKET_IN, length 125, xid 0x00000000
21:28:42.103485 IP 192.168.1.10.6633 > 192.168.1.30.49351: Flags [.], ack 21514, win 16533, options [nop,nop,TS val 46590336 ecr 21917425], length 0
21:28:42.103492 IP 192.168.1.10.6633 > 192.168.1.30.49351: Flags [.], ack 22139, win 16533, options [nop,nop,TS val 46590336 ecr 21917425], length 0
21:28:42.103501 IP 192.168.1.10.6633 > 192.168.1.30.49351: Flags [.], ack 22764, win 16533, options [nop,nop,TS val 46590336 ecr 21917425], length 0
21:28:42.103505 IP 192.168.1.30.49351 > 192.168.1.10.6633: Flags [P.], seq 25264:25389, ack 1, win 58, options [nop,nop,TS val 21917425 ecr 46590336], length 125: OpenFlow
	version 1.0, type PACKET_IN, length 125, xid 0x00000000
21:28:42.103532 IP 192.168.1.30.49351 > 192.168.1.10.6633: Flags [P.], seq 25389:25514, ack 1, win 58, options [nop,nop,TS val 21917425 ecr 46590336], length 125: OpenFlow
	version 1.0, type PACKET_IN, length 125, xid 0x00000000
21:28:42.103541 IP 192.168.1.30.49351 > 192.168.1.10.6633: Flags [P.], seq 25514:25639, ack 1, win 58, options [nop,nop,TS val 21917425 ecr 46590336], length 125: OpenFlow
	version 1.0, type PACKET_IN, length 125, xid 0x00000000
21:28:42.103549 IP 192.168.1.30.49351 > 192.168.1.10.6633: Flags [P.], seq 25639:25764, ack 1, win 58, options [nop,nop,TS val 21917425 ecr 46590336], length 125: OpenFlow
	version 1.0, type PACKET_IN, length 125, xid 0x00000000
21:28:42.103557 IP 192.168.1.30.49351 > 192.168.1.10.6633: Flags [P.], seq 25764:25889, ack 1, win 58, options [nop,nop,TS val 21917425 ecr 46590336], length 125: OpenFlow
	version 1.0, type PACKET_IN, length 125, xid 0x00000000
21:28:42.103565 IP 192.168.1.30.49351 > 192.168.1.10.6633: Flags [P.], seq 25889:26014, ack 1, win 58, options [nop,nop,TS val 21917425 ecr 46590336], length 125: OpenFlow
	version 1.0, type PACKET_IN, length 125, xid 0x00000000
21:28:42.103573 IP 192.168.1.30.49351 > 192.168.1.10.6633: Flags [P.], seq 26014:26139, ack 1, win 58, options [nop,nop,TS val 21917425 ecr 46590336], length 125: OpenFlow
	version 1.0, type PACKET_IN, length 125, xid 0x00000000
21:28:42.103581 IP 192.168.1.30.49351 > 192.168.1.10.6633: Flags [P.], seq 26139:26264, ack 1, win 58, options [nop,nop,TS val 21917425 ecr 46590336], length 125: OpenFlow
	version 1.0, type PACKET_IN, length 125, xid 0x00000000
21:28:42.103589 IP 192.168.1.30.49351 > 192.168.1.10.6633: Flags [P.], seq 26264:26389, ack 1, win 58, options [nop,nop,TS val 21917425 ecr 46590336], length 125: OpenFlow
	version 1.0, type PACKET_IN, length 125, xid 0x00000000
21:28:42.103869 IP 192.168.1.10.6633 > 192.168.1.30.49351: Flags [.], ack 24014, win 16533, options [nop,nop,TS val 46590336 ecr 21917425], length 0
21:28:42.103894 IP 192.168.1.10.6633 > 192.168.1.30.49351: Flags [.], ack 25389, win 16533, options [nop,nop,TS val 46590336 ecr 21917425], length 0
21:28:42.103901 IP 192.168.1.10.6633 > 192.168.1.30.49351: Flags [.], ack 26264, win 16533, options [nop,nop,TS val 46590336 ecr 21917425], length 0
21:28:42.103905 IP 192.168.1.30.49351 > 192.168.1.10.6633: Flags [P.], seq 26389:26514, ack 1, win 58, options [nop,nop,TS val 21917425 ecr 46590336], length 125: OpenFlow
	version 1.0, type PACKET_IN, length 125, xid 0x00000000
21:28:42.103947 IP 192.168.1.30.49351 > 192.168.1.10.6633: Flags [P.], seq 26514:26639, ack 1, win 58, options [nop,nop,TS val 21917425 ecr 46590336], length 125: OpenFlow
	version 1.0, type PACKET_IN, length 125, xid 0x00000000
21:28:42.103976 IP 192.168.1.30.49351 > 192.168.1.10.6633: Flags [P.], seq 26639:26764, ack 1, win 58, options [nop,nop,TS val 21917425 ecr 46590336], length 125: OpenFlow
	version 1.0, type PACKET_IN, length 125, xid 0x00000000
21:28:42.104003 IP 192.168.1.30.49351 > 192.168.1.10.6633: Flags [P.], seq 26764:26889, ack 1, win 58, options [nop,nop,TS val 21917425 ecr 46590336], length 125: OpenFlow
	version 1.0, type PACKET_IN, length 125, xid 0x00000000
21:28:42.104030 IP 192.168.1.30.49351 > 192.168.1.10.6633: Flags [P.], seq 26889:27014, ack 1, win 58, options [nop,nop,TS val 21917425 ecr 46590336], length 125: OpenFlow
	version 1.0, type PACKET_IN, length 125, xid 0x00000000
21:28:42.104057 IP 192.168.1.30.49351 > 192.168.1.10.6633: Flags [P.], seq 27014:27139, ack 1, win 58, options [nop,nop,TS val 21917425 ecr 46590336], length 125: OpenFlow
	version 1.0, type PACKET_IN, length 125, xid 0x00000000
21:28:42.104086 IP 192.168.1.30.49351 > 192.168.1.10.6633: Flags [P.], seq 27139:27264, ack 1, win 58, options [nop,nop,TS val 21917425 ecr 46590336], length 125: OpenFlow
	version 1.0, type PACKET_IN, length 125, xid 0x00000000
21:28:42.104114 IP 192.168.1.30.49351 > 192.168.1.10.6633: Flags [P.], seq 27264:27389, ack 1, win 58, options [nop,nop,TS val 21917425 ecr 46590336], length 125: OpenFlow
	version 1.0, type PACKET_IN, length 125, xid 0x00000000
21:28:42.104143 IP 192.168.1.30.49351 > 192.168.1.10.6633: Flags [P.], seq 27389:27514, ack 1, win 58, options [nop,nop,TS val 21917425 ecr 46590336], length 125: OpenFlow
	version 1.0, type PACKET_IN, length 125, xid 0x00000000
21:28:42.104283 IP 192.168.1.10.6633 > 192.168.1.30.49351: Flags [.], ack 26389, win 16533, options [nop,nop,TS val 46590336 ecr 21917425], length 0
