15:38:04.639476 IP 192.168.1.30.59062 > 192.168.1.13.6633: Flags [P.], seq 1898652289:1898652414, ack 606462171, win 361, options [nop,nop,TS val 23306010 ecr 16997938], length 125: OpenFlow
	version 1.0, type PACKET_IN, length 125, xid 0x00000000
15:38:04.639503 IP 192.168.1.30.59062 > 192.168.1.13.6633: Flags [P.], seq 125:250, ack 1, win 361, options [nop,nop,TS val 23306010 ecr 16997938], length 125: OpenFlow
	version 1.0, type PACKET_IN, length 125, xid 0x00000000
15:38:04.639519 IP 192.168.1.30.59062 > 192.168.1.13.6633: Flags [P.], seq 250:375, ack 1, win 361, options [nop,nop,TS val 23306010 ecr 16997938], length 125: OpenFlow
	version 1.0, type PACKET_IN, length 125, xid 0x00000000
15:38:04.639535 IP 192.168.1.30.59062 > 192.168.1.13.6633: Flags [P.], seq 375:570, ack 1, win 361, options [nop,nop,TS val 23306010 ecr 16997938], length 195: OpenFlow
	version 1.0, type PACKET_IN, length 195, xid 0x00000000
15:38:04.639550 IP 192.168.1.30.59062 > 192.168.1.13.6633: Flags [P.], seq 570:695, ack 1, win 361, options [nop,nop,TS val 23306010 ecr 16997938], length 125: OpenFlow
	version 1.0, type PACKET_IN, length 125, xid 0x00000000
15:38:04.639574 IP 192.168.1.30.59062 > 192.168.1.13.6633: Flags [P.], seq 695:820, ack 1, win 361, options [nop,nop,TS val 23306010 ecr 16997938], length 125: OpenFlow
	version 1.0, type PACKET_IN, length 125, xid 0x00000000
15:38:04.639590 IP 192.168.1.30.59062 > 192.168.1.13.6633: Flags [P.], seq 820:945, ack 1, win 361, options [nop,nop,TS val 23306010 ecr 16997938], length 125: OpenFlow
	version 1.0, type PACKET_IN, length 125, xid 0x00000000
15:38:04.639605 IP 192.168.1.30.59062 > 192.168.1.13.6633: Flags [P.], seq 945:1070, ack 1, win 361, options [nop,nop,TS val 23306010 ecr 16997938], length 125: OpenFlow
	version 1.0, type PACKET_IN, length 125, xid 0x00000000
15:38:04.639621 IP 192.168.1.30.59062 > 192.168.1.13.6633: Flags [P.], seq 1070:1195, ack 1, win 361, options [nop,nop,TS val 23306010 ecr 16997938], length 125: OpenFlow
	version 1.0, type PACKET_IN, length 125, xid 0x00000000
15:38:04.639636 IP 192.168.1.30.59062 > 192.168.1.13.6633: Flags [P.], seq 1195:1320, ack 1, win 361, options [nop,nop,TS val 23306010 ecr 16997938], length 125: OpenFlow
	version 1.0, type PACKET_IN, length 125, xid 0x00000000
15:38:04.639652 IP 192.168.1.30.59062 > 192.168.1.13.6633: Flags [P.], seq 1320:1445, ack 1, win 361, options [nop,nop,TS val 23306010 ecr 16997938], length 125: OpenFlow
	version 1.0, type PACKET_IN, length 125, xid 0x00000000
15:38:04.639667 IP 192.168.1.30.59062 > 192.168.1.13.6633: Flags [P.], seq 1445:1570, ack 1, win 361, options [nop,nop,TS val 23306010 ecr 16997938], length 125: OpenFlow
	version 1.0, type PACKET_IN, length 125, xid 0x00000000
15:38:04.639687 IP 192.168.1.30.59062 > 192.168.1.13.6633: Flags [P.], seq 1570:1695, ack 1, win 361, options [nop,nop,TS val 23306010 ecr 16997938], length 125: OpenFlow
	version 1.0, type PACKET_IN, length 125, xid 0x00000000
15:38:04.639704 IP 192.168.1.30.59062 > 192.168.1.13.6633: Flags [P.], seq 1695:1823, ack 1, win 361, options [nop,nop,TS val 23306010 ecr 16997938], length 128: OpenFlow
	version 1.0, type PACKET_IN, length 128, xid 0x00000000
15:38:04.639719 IP 192.168.1.30.59062 > 192.168.1.13.6633: Flags [P.], seq 1823:1951, ack 1, win 361, options [nop,nop,TS val 23306010 ecr 16997938], length 128: OpenFlow
	version 1.0, type PACKET_IN, length 128, xid 0x00000000
15:38:04.639734 IP 192.168.1.30.59062 > 192.168.1.13.6633: Flags [P.], seq 1951:2079, ack 1, win 361, options [nop,nop,TS val 23306010 ecr 16997938], length 128: OpenFlow
	version 1.0, type PACKET_IN, length 128, xid 0x00000000
15:38:04.639749 IP 192.168.1.30.59062 > 192.168.1.13.6633: Flags [P.], seq 2079:2207, ack 1, win 361, options [nop,nop,TS val 23306010 ecr 16997938], length 128: OpenFlow
	version 1.0, type PACKET_IN, length 128, xid 0x00000000
15:38:04.639764 IP 192.168.1.30.59062 > 192.168.1.13.6633: Flags [P.], seq 2207:2335, ack 1, win 361, options [nop,nop,TS val 23306010 ecr 16997938], length 128: OpenFlow
	version 1.0, type PACKET_IN, length 128, xid 0x00000000
15:38:04.639778 IP 192.168.1.30.59062 > 192.168.1.13.6633: Flags [P.], seq 2335:2460, ack 1, win 361, options [nop,nop,TS val 23306010 ecr 16997938], length 125: OpenFlow
	version 1.0, type PACKET_IN, length 125, xid 0x00000000
15:38:04.639794 IP 192.168.1.30.59062 > 192.168.1.13.6633: Flags [P.], seq 2460:2585, ack 1, win 361, options [nop,nop,TS val 23306010 ecr 16997938], length 125: OpenFlow
	version 1.0, type PACKET_IN, length 125, xid 0x00000000
15:38:04.639809 IP 192.168.1.30.59062 > 192.168.1.13.6633: Flags [P.], seq 2585:2710, ack 1, win 361, options [nop,nop,TS val 23306010 ecr 16997938], length 125: OpenFlow
	version 1.0, type PACKET_IN, length 125, xid 0x00000000
15:38:04.639824 IP 192.168.1.30.59062 > 192.168.1.13.6633: Flags [P.], seq 2710:2835, ack 1, win 361, options [nop,nop,TS val 23306010 ecr 16997938], length 125: OpenFlow
	version 1.0, type PACKET_IN, length 125, xid 0x00000000
15:38:04.639839 IP 192.168.1.30.59062 > 192.168.1.13.6633: Flags [P.], seq 2835:2960, ack 1, win 361, options [nop,nop,TS val 23306010 ecr 16997938], length 125: OpenFlow
	version 1.0, type PACKET_IN, length 125, xid 0x00000000
15:38:04.639854 IP 192.168.1.30.59062 > 192.168.1.13.6633: Flags [P.], seq 2960:3085, ack 1, win 361, options [nop,nop,TS val 23306010 ecr 16997938], length 125: OpenFlow
	version 1.0, type PACKET_IN, length 125, xid 0x00000000
15:38:04.639874 IP 192.168.1.30.59062 > 192.168.1.13.6633: Flags [P.], seq 3085:3210, ack 1, win 361, options [nop,nop,TS val 23306010 ecr 16997938], length 125: OpenFlow
	version 1.0, type PACKET_IN, length 125, xid 0x00000000
15:38:04.639890 IP 192.168.1.30.59062 > 192.168.1.13.6633: Flags [P.], seq 3210:3335, ack 1, win 361, options [nop,nop,TS val 23306010 ecr 16997938], length 125: OpenFlow
	version 1.0, type PACKET_IN, length 125, xid 0x00000000
15:38:04.639904 IP 192.168.1.30.59062 > 192.168.1.13.6633: Flags [P.], seq 3335:3463, ack 1, win 361, options [nop,nop,TS val 23306010 ecr 16997938], length 128: OpenFlow
	version 1.0, type PACKET_IN, length 128, xid 0x00000000
15:38:04.639919 IP 192.168.1.30.59062 > 192.168.1.13.6633: Flags [P.], seq 3463:3591, ack 1, win 361, options [nop,nop,TS val 23306010 ecr 16997938], length 128: OpenFlow
	version 1.0, type PACKET_IN, length 128, xid 0x00000000
15:38:04.639934 IP 192.168.1.30.59062 > 192.168.1.13.6633: Flags [P.], seq 3591:3719, ack 1, win 361, options [nop,nop,TS val 23306010 ecr 16997938], length 128: OpenFlow
	version 1.0, type PACKET_IN, length 128, xid 0x00000000
15:38:04.639950 IP 192.168.1.30.59062 > 192.168.1.13.6633: Flags [P.], seq 3719:3847, ack 1, win 361, options [nop,nop,TS val 23306010 ecr 16997938], length 128: OpenFlow
	version 1.0, type PACKET_IN, length 128, xid 0x00000000
15:38:04.639966 IP 192.168.1.30.59062 > 192.168.1.13.6633: Flags [P.], seq 3847:3975, ack 1, win 361, options [nop,nop,TS val 23306010 ecr 16997938], length 128: OpenFlow
	version 1.0, type PACKET_IN, length 128, xid 0x00000000
15:38:04.639980 IP 192.168.1.30.59062 > 192.168.1.13.6633: Flags [P.], seq 3975:4103, ack 1, win 361, options [nop,nop,TS val 23306010 ecr 16997938], length 128: OpenFlow
	version 1.0, type PACKET_IN, length 128, xid 0x00000000
15:38:04.639996 IP 192.168.1.30.59062 > 192.168.1.13.6633: Flags [P.], seq 4103:4231, ack 1, win 361, options [nop,nop,TS val 23306010 ecr 16997938], length 128: OpenFlow
	version 1.0, type PACKET_IN, length 128, xid 0x00000000
15:38:04.640011 IP 192.168.1.30.59062 > 192.168.1.13.6633: Flags [P.], seq 4231:4359, ack 1, win 361, options [nop,nop,TS val 23306010 ecr 16997938], length 128: OpenFlow
	version 1.0, type PACKET_IN, length 128, xid 0x00000000
15:38:04.640025 IP 192.168.1.30.59062 > 192.168.1.13.6633: Flags [P.], seq 4359:4487, ack 1, win 361, options [nop,nop,TS val 23306010 ecr 16997938], length 128: OpenFlow
	version 1.0, type PACKET_IN, length 128, xid 0x00000000
15:38:04.640041 IP 192.168.1.30.59062 > 192.168.1.13.6633: Flags [P.], seq 4487:4612, ack 1, win 361, options [nop,nop,TS val 23306010 ecr 16997938], length 125: OpenFlow
	version 1.0, type PACKET_IN, length 125, xid 0x00000000
15:38:04.640061 IP 192.168.1.30.59062 > 192.168.1.13.6633: Flags [P.], seq 4612:4737, ack 1, win 361, options [nop,nop,TS val 23306010 ecr 16997938], length 125: OpenFlow
	version 1.0, type PACKET_IN, length 125, xid 0x00000000
15:38:04.640077 IP 192.168.1.30.59062 > 192.168.1.13.6633: Flags [P.], seq 4737:4862, ack 1, win 361, options [nop,nop,TS val 23306010 ecr 16997938], length 125: OpenFlow
	version 1.0, type PACKET_IN, length 125, xid 0x00000000
15:38:04.640093 IP 192.168.1.30.59062 > 192.168.1.13.6633: Flags [P.], seq 4862:4987, ack 1, win 361, options [nop,nop,TS val 23306010 ecr 16997938], length 125: OpenFlow
	version 1.0, type PACKET_IN, length 125, xid 0x00000000
15:38:04.640108 IP 192.168.1.30.59062 > 192.168.1.13.6633: Flags [P.], seq 4987:5083, ack 1, win 361, options [nop,nop,TS val 23306010 ecr 16997938], length 96: OpenFlow
	version 1.0, type PACKET_IN, length 96, xid 0x00000000
15:38:04.640122 IP 192.168.1.30.59062 > 192.168.1.13.6633: Flags [P.], seq 5083:5179, ack 1, win 361, options [nop,nop,TS val 23306010 ecr 16997938], length 96: OpenFlow
	version 1.0, type PACKET_IN, length 96, xid 0x00000000
15:38:04.640138 IP 192.168.1.30.59062 > 192.168.1.13.6633: Flags [P.], seq 5179:5304, ack 1, win 361, options [nop,nop,TS val 23306010 ecr 16997938], length 125: OpenFlow
	version 1.0, type PACKET_IN, length 125, xid 0x00000000
15:38:04.640153 IP 192.168.1.30.59062 > 192.168.1.13.6633: Flags [P.], seq 5304:5429, ack 1, win 361, options [nop,nop,TS val 23306010 ecr 16997938], length 125: OpenFlow
	version 1.0, type PACKET_IN, length 125, xid 0x00000000
15:38:04.640173 IP 192.168.1.30.59062 > 192.168.1.13.6633: Flags [P.], seq 5429:5554, ack 1, win 361, options [nop,nop,TS val 23306010 ecr 16997938], length 125: OpenFlow
	version 1.0, type PACKET_IN, length 125, xid 0x00000000
15:38:04.640189 IP 192.168.1.30.59062 > 192.168.1.13.6633: Flags [P.], seq 5554:5679, ack 1, win 361, options [nop,nop,TS val 23306010 ecr 16997938], length 125: OpenFlow
	version 1.0, type PACKET_IN, length 125, xid 0x00000000
15:38:04.640204 IP 192.168.1.30.59062 > 192.168.1.13.6633: Flags [P.], seq 5679:5804, ack 1, win 361, options [nop,nop,TS val 23306010 ecr 16997938], length 125: OpenFlow
	version 1.0, type PACKET_IN, length 125, xid 0x00000000
15:38:04.640219 IP 192.168.1.30.59062 > 192.168.1.13.6633: Flags [P.], seq 5804:5929, ack 1, win 361, options [nop,nop,TS val 23306010 ecr 16997938], length 125: OpenFlow
	version 1.0, type PACKET_IN, length 125, xid 0x00000000
15:38:04.640234 IP 192.168.1.30.59062 > 192.168.1.13.6633: Flags [P.], seq 5929:6054, ack 1, win 361, options [nop,nop,TS val 23306010 ecr 16997938], length 125: OpenFlow
	version 1.0, type PACKET_IN, length 125, xid 0x00000000
15:38:04.640248 IP 192.168.1.30.59062 > 192.168.1.13.6633: Flags [P.], seq 6054:6179, ack 1, win 361, options [nop,nop,TS val 23306010 ecr 16997938], length 125: OpenFlow
	version 1.0, type PACKET_IN, length 125, xid 0x00000000
15:38:04.640263 IP 192.168.1.30.59062 > 192.168.1.13.6633: Flags [P.], seq 6179:6307, ack 1, win 361, options [nop,nop,TS val 23306010 ecr 16997938], length 128: OpenFlow
	version 1.0, type PACKET_IN, length 128, xid 0x00000000
15:38:04.640283 IP 192.168.1.30.59062 > 192.168.1.13.6633: Flags [P.], seq 6307:6435, ack 1, win 361, options [nop,nop,TS val 23306010 ecr 16997938], length 128: OpenFlow
	version 1.0, type PACKET_IN, length 128, xid 0x00000000
15:38:04.640298 IP 192.168.1.30.59062 > 192.168.1.13.6633: Flags [P.], seq 6435:6778, ack 1, win 361, options [nop,nop,TS val 23306010 ecr 16997938], length 343: OpenFlow
	version 1.0, type PACKET_IN, length 343, xid 0x00000000
15:38:04.640314 IP 192.168.1.30.59062 > 192.168.1.13.6633: Flags [P.], seq 6778:6906, ack 1, win 361, options [nop,nop,TS val 23306010 ecr 16997938], length 128: OpenFlow
	version 1.0, type PACKET_IN, length 128, xid 0x00000000
15:38:04.640329 IP 192.168.1.30.59062 > 192.168.1.13.6633: Flags [P.], seq 6906:7031, ack 1, win 361, options [nop,nop,TS val 23306010 ecr 16997938], length 125: OpenFlow
	version 1.0, type PACKET_IN, length 125, xid 0x00000000
15:38:04.640345 IP 192.168.1.30.59062 > 192.168.1.13.6633: Flags [P.], seq 7031:7156, ack 1, win 361, options [nop,nop,TS val 23306010 ecr 16997938], length 125: OpenFlow
	version 1.0, type PACKET_IN, length 125, xid 0x00000000
15:38:04.640360 IP 192.168.1.30.59062 > 192.168.1.13.6633: Flags [P.], seq 7156:7281, ack 1, win 361, options [nop,nop,TS val 23306010 ecr 16997938], length 125: OpenFlow
	version 1.0, type PACKET_IN, length 125, xid 0x00000000
15:38:04.640375 IP 192.168.1.30.59062 > 192.168.1.13.6633: Flags [P.], seq 7281:7406, ack 1, win 361, options [nop,nop,TS val 23306010 ecr 16997938], length 125: OpenFlow
	version 1.0, type PACKET_IN, length 125, xid 0x00000000
15:38:04.641827 IP 192.168.1.13.6633 > 192.168.1.30.59062: Flags [.], ack 1570, win 4937, options [nop,nop,TS val 16997989 ecr 23306010], length 0
15:38:04.641835 IP 192.168.1.13.6633 > 192.168.1.30.59062: Flags [.], ack 3085, win 4937, options [nop,nop,TS val 16997989 ecr 23306010], length 0
15:38:04.641843 IP 192.168.1.13.6633 > 192.168.1.30.59062: Flags [.], ack 3719, win 4937, options [nop,nop,TS val 16997989 ecr 23306010], length 0
15:38:04.641850 IP 192.168.1.13.6633 > 192.168.1.30.59062: Flags [.], ack 4612, win 4937, options [nop,nop,TS val 16997989 ecr 23306010], length 0
15:38:04.641857 IP 192.168.1.13.6633 > 192.168.1.30.59062: Flags [.], ack 6179, win 4937, options [nop,nop,TS val 16997989 ecr 23306010], length 0
15:38:04.641962 IP 192.168.1.13.6633 > 192.168.1.30.59062: Flags [.], ack 7031, win 4937, options [nop,nop,TS val 16997989 ecr 23306010], length 0
15:38:04.641972 IP 192.168.1.13.6633 > 192.168.1.30.59062: Flags [.], ack 7406, win 4937, options [nop,nop,TS val 16997989 ecr 23306010], length 0
15:38:04.649286 IP 192.168.1.30.59062 > 192.168.1.13.6633: Flags [.], seq 7406:17542, ack 1, win 361, options [nop,nop,TS val 23306012 ecr 16997938], length 10136: OpenFlow
	version 1.0, type PACKET_IN, length 125, xid 0x00000000
	version 1.0, type PACKET_IN, length 125, xid 0x00000000
	version 1.0, type PACKET_IN, length 125, xid 0x00000000
	version 1.0, type PACKET_IN, length 125, xid 0x00000000
	version 1.0, type PACKET_IN, length 128, xid 0x00000000
	version 1.0, type PACKET_IN, length 128, xid 0x00000000
	version 1.0, type PACKET_IN, length 128, xid 0x00000000
	version 1.0, type PACKET_IN, length 128, xid 0x00000000
	version 1.0, type PACKET_IN, length 128, xid 0x00000000
	version 1.0, type PACKET_IN, length 128, xid 0x00000000
	version 1.0, type PACKET_IN, length 128, xid 0x00000000
	version 1.0, type PACKET_IN, length 128, xid 0x00000000
	version 1.0, type PACKET_IN, length 128, xid 0x00000000
	version 1.0, type PACKET_IN, length 125, xid 0x00000000
	version 1.0, type PACKET_IN, length 125, xid 0x00000000
	version 1.0, type PACKET_IN, length 125, xid 0x00000000
	version 1.0, type PACKET_IN, length 125, xid 0x00000000
	version 1.0, type PACKET_IN, length 125, xid 0x00000000
	version 1.0, type PACKET_IN, length 125, xid 0x00000000
	version 1.0, type PACKET_IN, length 125, xid 0x00000000
	version 1.0, type PACKET_IN, length 125, xid 0x00000000
	version 1.0, type PACKET_IN, length 125, xid 0x00000000
	version 1.0, type PACKET_IN, length 128, xid 0x00000000
	version 1.0, type PACKET_IN, length 128, xid 0x00000000
	version 1.0, type PACKET_IN, length 128, xid 0x00000000
	version 1.0, type PACKET_IN, length 128, xid 0x00000000
	version 1.0, type PACKET_IN, length 128, xid 0x00000000
	version 1.0, type PACKET_IN, length 125, xid 0x00000000
	version 1.0, type PACKET_IN, length 125, xid 0x00000000
	version 1.0, type PACKET_IN, length 125, xid 0x00000000
	version 1.0, type PACKET_IN, length 125, xid 0x00000000
	version 1.0, type PACKET_IN, length 125, xid 0x00000000
	version 1.0, type PACKET_IN, length 125, xid 0x00000000
	version 1.0, type PACKET_IN, length 128, xid 0x00000000
	version 1.0, type PACKET_IN, length 125, xid 0x00000000
	version 1.0, type PACKET_IN, length 125, xid 0x00000000
	version 1.0, type PACKET_IN, length 125, xid 0x00000000
	version 1.0, type PACKET_IN, length 125, xid 0x00000000
	version 1.0, type PACKET_IN, length 125, xid 0x00000000
	version 1.0, type PACKET_IN, length 125, xid 0x00000000
	version 1.0, type PACKET_IN, length 125, xid 0x00000000
	version 1.0, type PACKET_IN, length 125, xid 0x00000000
	version 1.0, type PACKET_IN, length 125, xid 0x00000000
	version 1.0, type PACKET_IN, length 125, xid 0x00000000
	version 1.0, type PACKET_IN, length 128, xid 0x00000000
	version 1.0, type PACKET_IN, length 128, xid 0x00000000
	version 1.0, type PACKET_IN, length 128, xid 0x00000000
	version 1.0, type PACKET_IN, length 125, xid 0x00000000
	version 1.0, type PACKET_IN, length 125, xid 0x00000000
	version 1.0, type PACKET_IN, length 128, xid 0x00000000
	version 1.0, type PACKET_IN, length 128, xid 0x00000000
	version 1.0, type PACKET_IN, length 128, xid 0x00000000
	version 1.0, type PACKET_IN, length 125, xid 0x00000000
	version 1.0, type PACKET_IN, length 125, xid 0x00000000
	version 1.0, type PACKET_IN, length 125, xid 0x00000000
	version 1.0, type PACKET_IN, length 128, xid 0x00000000
	version 1.0, type PACKET_IN, length 128, xid 0x00000000
	version 1.0, type PACKET_IN, length 128, xid 0x00000000
	version 1.0, type PACKET_IN, length 128, xid 0x00000000
	version 1.0, type PACKET_IN, length 128, xid 0x00000000
	version 1.0, type PACKET_IN, length 128, xid 0x00000000
	version 1.0, type PACKET_IN, length 128, xid 0x00000000
	version 1.0, type PACKET_IN, length 128, xid 0x00000000
	version 1.0, type PACKET_IN, length 125, xid 0x00000000
	version 1.0, type PACKET_IN, length 125, xid 0x00000000
	version 1.0, type PACKET_IN, length 125, xid 0x00000000
	version 1.0, type PACKET_IN, length 125, xid 0x00000000
	version 1.0, type PACKET_IN, length 128, xid 0x00000000
	version 1.0, type PACKET_IN, length 125, xid 0x00000000
	version 1.0, type PACKET_IN, length 125, xid 0x00000000
	version 1.0, type PACKET_IN, length 125, xid 0x00000000
	version 1.0, type PACKET_IN, length 125, xid 0x00000000
	version 1.0, type PACKET_IN, length 125, xid 0x00000000
	version 1.0, type PACKET_IN, length 125, xid 0x00000000
	version 1.0, type PACKET_IN, length 125, xid 0x00000000
	version 1.0, type PACKET_IN, length 125, xid 0x00000000
	version 1.0, type PACKET_IN, length 125, xid 0x00000000
	version 1.0, type PACKET_IN, length 125, xid 0x00000000
	version 1.0, type PACKET_IN, length 125, xid 0x00000000
	version 1.0, type PACKET_IN, length 125, xid 0x00000000
	version 1.0, type PACKET_IN, length 125, xid 0x00000000 [|openflow]
15:38:04.649332 IP 192.168.1.30.59062 > 192.168.1.13.6633: Flags [P.], seq 17542:17996, ack 1, win 361, options [nop,nop,TS val 23306012 ecr 16997938], length 454: OpenFlow
	version unknown (0x00), type 0x00, length 48237, xid 0x24fffe24 [|openflow]
15:38:04.655688 IP 192.168.1.13.6633 > 192.168.1.30.59062: Flags [.], ack 17996, win 4937, options [nop,nop,TS val 16997992 ecr 23306012], length 0
15:38:04.677901 IP 192.168.1.30.59062 > 192.168.1.13.6633: Flags [P.], seq 17996:18121, ack 1, win 361, options [nop,nop,TS val 23306021 ecr 16997992], length 125: OpenFlow
	version 1.0, type PACKET_IN, length 125, xid 0x00000000
15:38:04.677946 IP 192.168.1.30.59062 > 192.168.1.13.6633: Flags [P.], seq 18121:18249, ack 1, win 361, options [nop,nop,TS val 23306021 ecr 16997992], length 128: OpenFlow
	version 1.0, type PACKET_IN, length 128, xid 0x00000000
15:38:04.677972 IP 192.168.1.30.59062 > 192.168.1.13.6633: Flags [P.], seq 18249:18374, ack 1, win 361, options [nop,nop,TS val 23306021 ecr 16997992], length 125: OpenFlow
	version 1.0, type PACKET_IN, length 125, xid 0x00000000
15:38:04.677995 IP 192.168.1.30.59062 > 192.168.1.13.6633: Flags [P.], seq 18374:18499, ack 1, win 361, options [nop,nop,TS val 23306021 ecr 16997992], length 125: OpenFlow
	version 1.0, type PACKET_IN, length 125, xid 0x00000000
15:38:04.678011 IP 192.168.1.30.59062 > 192.168.1.13.6633: Flags [P.], seq 18499:18624, ack 1, win 361, options [nop,nop,TS val 23306021 ecr 16997992], length 125: OpenFlow
	version 1.0, type PACKET_IN, length 125, xid 0x00000000
15:38:04.678026 IP 192.168.1.30.59062 > 192.168.1.13.6633: Flags [P.], seq 18624:18749, ack 1, win 361, options [nop,nop,TS val 23306021 ecr 16997992], length 125: OpenFlow
	version 1.0, type PACKET_IN, length 125, xid 0x00000000
15:38:04.678041 IP 192.168.1.30.59062 > 192.168.1.13.6633: Flags [P.], seq 18749:18874, ack 1, win 361, options [nop,nop,TS val 23306021 ecr 16997992], length 125: OpenFlow
	version 1.0, type PACKET_IN, length 125, xid 0x00000000
15:38:04.678073 IP 192.168.1.30.59062 > 192.168.1.13.6633: Flags [P.], seq 18874:18999, ack 1, win 361, options [nop,nop,TS val 23306021 ecr 16997992], length 125: OpenFlow
	version 1.0, type PACKET_IN, length 125, xid 0x00000000
15:38:04.678089 IP 192.168.1.30.59062 > 192.168.1.13.6633: Flags [P.], seq 18999:19124, ack 1, win 361, options [nop,nop,TS val 23306021 ecr 16997992], length 125: OpenFlow
	version 1.0, type PACKET_IN, length 125, xid 0x00000000
15:38:04.678104 IP 192.168.1.30.59062 > 192.168.1.13.6633: Flags [P.], seq 19124:19252, ack 1, win 361, options [nop,nop,TS val 23306021 ecr 16997992], length 128: OpenFlow
	version 1.0, type PACKET_IN, length 128, xid 0x00000000
15:38:04.678118 IP 192.168.1.30.59062 > 192.168.1.13.6633: Flags [P.], seq 19252:19595, ack 1, win 361, options [nop,nop,TS val 23306021 ecr 16997992], length 343: OpenFlow
	version 1.0, type PACKET_IN, length 343, xid 0x00000000
15:38:04.678135 IP 192.168.1.30.59062 > 192.168.1.13.6633: Flags [P.], seq 19595:19720, ack 1, win 361, options [nop,nop,TS val 23306021 ecr 16997992], length 125: OpenFlow
	version 1.0, type PACKET_IN, length 125, xid 0x00000000
15:38:04.678159 IP 192.168.1.30.59062 > 192.168.1.13.6633: Flags [P.], seq 19720:19845, ack 1, win 361, options [nop,nop,TS val 23306021 ecr 16997992], length 125: OpenFlow
	version 1.0, type PACKET_IN, length 125, xid 0x00000000
15:38:04.678175 IP 192.168.1.30.59062 > 192.168.1.13.6633: Flags [P.], seq 19845:19970, ack 1, win 361, options [nop,nop,TS val 23306021 ecr 16997992], length 125: OpenFlow
	version 1.0, type PACKET_IN, length 125, xid 0x00000000
15:38:04.678198 IP 192.168.1.30.59062 > 192.168.1.13.6633: Flags [P.], seq 19970:20095, ack 1, win 361, options [nop,nop,TS val 23306021 ecr 16997992], length 125: OpenFlow
	version 1.0, type PACKET_IN, length 125, xid 0x00000000
15:38:04.678215 IP 192.168.1.30.59062 > 192.168.1.13.6633: Flags [P.], seq 20095:20220, ack 1, win 361, options [nop,nop,TS val 23306021 ecr 16997992], length 125: OpenFlow
	version 1.0, type PACKET_IN, length 125, xid 0x00000000
15:38:04.678232 IP 192.168.1.30.59062 > 192.168.1.13.6633: Flags [P.], seq 20220:20348, ack 1, win 361, options [nop,nop,TS val 23306021 ecr 16997992], length 128: OpenFlow
	version 1.0, type PACKET_IN, length 128, xid 0x00000000
15:38:04.678259 IP 192.168.1.30.59062 > 192.168.1.13.6633: Flags [P.], seq 20348:20476, ack 1, win 361, options [nop,nop,TS val 23306021 ecr 16997992], length 128: OpenFlow
	version 1.0, type PACKET_IN, length 128, xid 0x00000000
15:38:04.678275 IP 192.168.1.30.59062 > 192.168.1.13.6633: Flags [P.], seq 20476:20604, ack 1, win 361, options [nop,nop,TS val 23306021 ecr 16997992], length 128: OpenFlow
	version 1.0, type PACKET_IN, length 128, xid 0x00000000
15:38:04.678290 IP 192.168.1.30.59062 > 192.168.1.13.6633: Flags [P.], seq 20604:20729, ack 1, win 361, options [nop,nop,TS val 23306021 ecr 16997992], length 125: OpenFlow
	version 1.0, type PACKET_IN, length 125, xid 0x00000000
15:38:04.678305 IP 192.168.1.30.59062 > 192.168.1.13.6633: Flags [P.], seq 20729:20854, ack 1, win 361, options [nop,nop,TS val 23306021 ecr 16997992], length 125: OpenFlow
	version 1.0, type PACKET_IN, length 125, xid 0x00000000
15:38:04.678326 IP 192.168.1.30.59062 > 192.168.1.13.6633: Flags [P.], seq 20854:20979, ack 1, win 361, options [nop,nop,TS val 23306021 ecr 16997992], length 125: OpenFlow
	version 1.0, type PACKET_IN, length 125, xid 0x00000000
15:38:04.678344 IP 192.168.1.30.59062 > 192.168.1.13.6633: Flags [P.], seq 20979:21104, ack 1, win 361, options [nop,nop,TS val 23306021 ecr 16997992], length 125: OpenFlow
	version 1.0, type PACKET_IN, length 125, xid 0x00000000
15:38:04.678344 IP 192.168.1.13.6633 > 192.168.1.30.59062: Flags [.], ack 19595, win 4937, options [nop,nop,TS val 16997998 ecr 23306021], length 0
15:38:04.678369 IP 192.168.1.30.59062 > 192.168.1.13.6633: Flags [P.], seq 21104:21229, ack 1, win 361, options [nop,nop,TS val 23306021 ecr 16997998], length 125: OpenFlow
	version 1.0, type PACKET_IN, length 125, xid 0x00000000
15:38:04.678393 IP 192.168.1.30.59062 > 192.168.1.13.6633: Flags [P.], seq 21229:21357, ack 1, win 361, options [nop,nop,TS val 23306021 ecr 16997998], length 128: OpenFlow
	version 1.0, type PACKET_IN, length 128, xid 0x00000000
15:38:04.678409 IP 192.168.1.30.59062 > 192.168.1.13.6633: Flags [P.], seq 21357:21485, ack 1, win 361, options [nop,nop,TS val 23306021 ecr 16997998], length 128: OpenFlow
	version 1.0, type PACKET_IN, length 128, xid 0x00000000
15:38:04.678427 IP 192.168.1.30.59062 > 192.168.1.13.6633: Flags [P.], seq 21485:21613, ack 1, win 361, options [nop,nop,TS val 23306021 ecr 16997998], length 128: OpenFlow
	version 1.0, type PACKET_IN, length 128, xid 0x00000000
15:38:04.678450 IP 192.168.1.30.59062 > 192.168.1.13.6633: Flags [P.], seq 21613:21738, ack 1, win 361, options [nop,nop,TS val 23306021 ecr 16997998], length 125: OpenFlow
	version 1.0, type PACKET_IN, length 125, xid 0x00000000
15:38:04.678472 IP 192.168.1.30.59062 > 192.168.1.13.6633: Flags [P.], seq 21738:21863, ack 1, win 361, options [nop,nop,TS val 23306021 ecr 16997998], length 125: OpenFlow
	version 1.0, type PACKET_IN, length 125, xid 0x00000000
15:38:04.678489 IP 192.168.1.30.59062 > 192.168.1.13.6633: Flags [P.], seq 21863:21988, ack 1, win 361, options [nop,nop,TS val 23306021 ecr 16997998], length 125: OpenFlow
	version 1.0, type PACKET_IN, length 125, xid 0x00000000
15:38:04.678491 IP 192.168.1.13.6633 > 192.168.1.30.59062: Flags [.], ack 20854, win 4937, options [nop,nop,TS val 16997998 ecr 23306021], length 0
15:38:04.678509 IP 192.168.1.30.59062 > 192.168.1.13.6633: Flags [P.], seq 21988:22113, ack 1, win 361, options [nop,nop,TS val 23306021 ecr 16997998], length 125: OpenFlow
	version 1.0, type PACKET_IN, length 125, xid 0x00000000
15:38:04.681620 IP 192.168.1.13.6633 > 192.168.1.30.59062: Flags [.], ack 21988, win 4937, options [nop,nop,TS val 16997999 ecr 23306021], length 0
15:38:04.686626 IP 192.168.1.13.6633 > 192.168.1.30.59062: Flags [.], ack 22113, win 4937, options [nop,nop,TS val 16998000 ecr 23306021], length 0
15:38:04.699088 IP 192.168.1.30.59062 > 192.168.1.13.6633: Flags [P.], seq 22113:22238, ack 1, win 361, options [nop,nop,TS val 23306026 ecr 16998000], length 125: OpenFlow
	version 1.0, type PACKET_IN, length 125, xid 0x00000000
15:38:04.699148 IP 192.168.1.30.59062 > 192.168.1.13.6633: Flags [P.], seq 22238:22363, ack 1, win 361, options [nop,nop,TS val 23306026 ecr 16998000], length 125: OpenFlow
	version 1.0, type PACKET_IN, length 125, xid 0x00000000
15:38:04.699187 IP 192.168.1.30.59062 > 192.168.1.13.6633: Flags [P.], seq 22363:22488, ack 1, win 361, options [nop,nop,TS val 23306026 ecr 16998000], length 125: OpenFlow
	version 1.0, type PACKET_IN, length 125, xid 0x00000000
15:38:04.699222 IP 192.168.1.30.59062 > 192.168.1.13.6633: Flags [P.], seq 22488:22613, ack 1, win 361, options [nop,nop,TS val 23306026 ecr 16998000], length 125: OpenFlow
	version 1.0, type PACKET_IN, length 125, xid 0x00000000
15:38:04.699258 IP 192.168.1.30.59062 > 192.168.1.13.6633: Flags [P.], seq 22613:22738, ack 1, win 361, options [nop,nop,TS val 23306026 ecr 16998000], length 125: OpenFlow
	version 1.0, type PACKET_IN, length 125, xid 0x00000000
15:38:04.699295 IP 192.168.1.30.59062 > 192.168.1.13.6633: Flags [P.], seq 22738:22863, ack 1, win 361, options [nop,nop,TS val 23306026 ecr 16998000], length 125: OpenFlow
	version 1.0, type PACKET_IN, length 125, xid 0x00000000
15:38:04.699331 IP 192.168.1.30.59062 > 192.168.1.13.6633: Flags [P.], seq 22863:22991, ack 1, win 361, options [nop,nop,TS val 23306026 ecr 16998000], length 128: OpenFlow
	version 1.0, type PACKET_IN, length 128, xid 0x00000000
15:38:04.699379 IP 192.168.1.30.59062 > 192.168.1.13.6633: Flags [P.], seq 22991:23119, ack 1, win 361, options [nop,nop,TS val 23306026 ecr 16998000], length 128: OpenFlow
	version 1.0, type PACKET_IN, length 128, xid 0x00000000
15:38:04.699416 IP 192.168.1.30.59062 > 192.168.1.13.6633: Flags [P.], seq 23119:23247, ack 1, win 361, options [nop,nop,TS val 23306026 ecr 16998000], length 128: OpenFlow
	version 1.0, type PACKET_IN, length 128, xid 0x00000000
15:38:04.699451 IP 192.168.1.30.59062 > 192.168.1.13.6633: Flags [P.], seq 23247:23375, ack 1, win 361, options [nop,nop,TS val 23306026 ecr 16998000], length 128: OpenFlow
	version 1.0, type PACKET_IN, length 128, xid 0x00000000
15:38:04.699484 IP 192.168.1.30.59062 > 192.168.1.13.6633: Flags [P.], seq 23375:23503, ack 1, win 361, options [nop,nop,TS val 23306026 ecr 16998000], length 128: OpenFlow
	version 1.0, type PACKET_IN, length 128, xid 0x00000000
15:38:04.699515 IP 192.168.1.30.59062 > 192.168.1.13.6633: Flags [P.], seq 23503:23611, ack 1, win 361, options [nop,nop,TS val 23306026 ecr 16998000], length 108: OpenFlow
	version 1.0, type PACKET_IN, length 108, xid 0x00000000
15:38:04.699552 IP 192.168.1.30.59062 > 192.168.1.13.6633: Flags [P.], seq 23611:23739, ack 1, win 361, options [nop,nop,TS val 23306026 ecr 16998000], length 128: OpenFlow
	version 1.0, type PACKET_IN, length 128, xid 0x00000000
15:38:04.699584 IP 192.168.1.30.59062 > 192.168.1.13.6633: Flags [P.], seq 23739:23867, ack 1, win 361, options [nop,nop,TS val 23306026 ecr 16998000], length 128: OpenFlow
	version 1.0, type PACKET_IN, length 128, xid 0x00000000
15:38:04.699635 IP 192.168.1.30.59062 > 192.168.1.13.6633: Flags [P.], seq 23867:23992, ack 1, win 361, options [nop,nop,TS val 23306026 ecr 16998000], length 125: OpenFlow
	version 1.0, type PACKET_IN, length 125, xid 0x00000000
15:38:04.699671 IP 192.168.1.30.59062 > 192.168.1.13.6633: Flags [P.], seq 23992:24117, ack 1, win 361, options [nop,nop,TS val 23306026 ecr 16998000], length 125: OpenFlow
	version 1.0, type PACKET_IN, length 125, xid 0x00000000
15:38:04.699707 IP 192.168.1.30.59062 > 192.168.1.13.6633: Flags [P.], seq 24117:24242, ack 1, win 361, options [nop,nop,TS val 23306026 ecr 16998000], length 125: OpenFlow
	version 1.0, type PACKET_IN, length 125, xid 0x00000000
15:38:04.699740 IP 192.168.1.30.59062 > 192.168.1.13.6633: Flags [P.], seq 24242:24367, ack 1, win 361, options [nop,nop,TS val 23306026 ecr 16998000], length 125: OpenFlow
	version 1.0, type PACKET_IN, length 125, xid 0x00000000
15:38:04.699774 IP 192.168.1.30.59062 > 192.168.1.13.6633: Flags [P.], seq 24367:24492, ack 1, win 361, options [nop,nop,TS val 23306026 ecr 16998000], length 125: OpenFlow
	version 1.0, type PACKET_IN, length 125, xid 0x00000000
15:38:04.699806 IP 192.168.1.30.59062 > 192.168.1.13.6633: Flags [P.], seq 24492:24617, ack 1, win 361, options [nop,nop,TS val 23306026 ecr 16998000], length 125: OpenFlow
	version 1.0, type PACKET_IN, length 125, xid 0x00000000
15:38:04.699839 IP 192.168.1.30.59062 > 192.168.1.13.6633: Flags [P.], seq 24617:24742, ack 1, win 361, options [nop,nop,TS val 23306026 ecr 16998000], length 125: OpenFlow
	version 1.0, type PACKET_IN, length 125, xid 0x00000000
15:38:04.699872 IP 192.168.1.30.59062 > 192.168.1.13.6633: Flags [P.], seq 24742:24867, ack 1, win 361, options [nop,nop,TS val 23306026 ecr 16998000], length 125: OpenFlow
	version 1.0, type PACKET_IN, length 125, xid 0x00000000
15:38:04.699906 IP 192.168.1.30.59062 > 192.168.1.13.6633: Flags [P.], seq 24867:24992, ack 1, win 361, options [nop,nop,TS val 23306026 ecr 16998000], length 125: OpenFlow
	version 1.0, type PACKET_IN, length 125, xid 0x00000000
15:38:04.699941 IP 192.168.1.30.59062 > 192.168.1.13.6633: Flags [P.], seq 24992:25117, ack 1, win 361, options [nop,nop,TS val 23306026 ecr 16998000], length 125: OpenFlow
	version 1.0, type PACKET_IN, length 125, xid 0x00000000
15:38:04.699973 IP 192.168.1.30.59062 > 192.168.1.13.6633: Flags [P.], seq 25117:25242, ack 1, win 361, options [nop,nop,TS val 23306026 ecr 16998000], length 125: OpenFlow
	version 1.0, type PACKET_IN, length 125, xid 0x00000000
15:38:04.700008 IP 192.168.1.30.59062 > 192.168.1.13.6633: Flags [P.], seq 25242:25367, ack 1, win 361, options [nop,nop,TS val 23306026 ecr 16998000], length 125: OpenFlow
	version 1.0, type PACKET_IN, length 125, xid 0x00000000
15:38:04.700034 IP 192.168.1.13.6633 > 192.168.1.30.59062: Flags [.], ack 22991, win 4937, options [nop,nop,TS val 16998004 ecr 23306026], length 0
15:38:04.700050 IP 192.168.1.30.59062 > 192.168.1.13.6633: Flags [P.], seq 25367:25492, ack 1, win 361, options [nop,nop,TS val 23306026 ecr 16998000], length 125: OpenFlow
	version 1.0, type PACKET_IN, length 125, xid 0x00000000
15:38:04.700054 IP 192.168.1.13.6633 > 192.168.1.30.59062: Flags [.], ack 23992, win 4937, options [nop,nop,TS val 16998004 ecr 23306026], length 0
15:38:04.700063 IP 192.168.1.13.6633 > 192.168.1.30.59062: Flags [.], ack 24492, win 4937, options [nop,nop,TS val 16998004 ecr 23306026], length 0
15:38:04.700100 IP 192.168.1.30.59062 > 192.168.1.13.6633: Flags [P.], seq 25492:25617, ack 1, win 361, options [nop,nop,TS val 23306026 ecr 16998004], length 125: OpenFlow
	version 1.0, type PACKET_IN, length 125, xid 0x00000000
15:38:04.700136 IP 192.168.1.30.59062 > 192.168.1.13.6633: Flags [P.], seq 25617:25742, ack 1, win 361, options [nop,nop,TS val 23306026 ecr 16998004], length 125: OpenFlow
	version 1.0, type PACKET_IN, length 125, xid 0x00000000
15:38:04.700171 IP 192.168.1.30.59062 > 192.168.1.13.6633: Flags [P.], seq 25742:25867, ack 1, win 361, options [nop,nop,TS val 23306026 ecr 16998004], length 125: OpenFlow
	version 1.0, type PACKET_IN, length 125, xid 0x00000000
15:38:04.700205 IP 192.168.1.30.59062 > 192.168.1.13.6633: Flags [P.], seq 25867:25992, ack 1, win 361, options [nop,nop,TS val 23306026 ecr 16998004], length 125: OpenFlow
	version 1.0, type PACKET_IN, length 125, xid 0x00000000
15:38:04.700240 IP 192.168.1.30.59062 > 192.168.1.13.6633: Flags [P.], seq 25992:26117, ack 1, win 361, options [nop,nop,TS val 23306026 ecr 16998004], length 125: OpenFlow
	version 1.0, type PACKET_IN, length 125, xid 0x00000000
15:38:04.700268 IP 192.168.1.30.59062 > 192.168.1.13.6633: Flags [P.], seq 26117:26242, ack 1, win 361, options [nop,nop,TS val 23306026 ecr 16998004], length 125: OpenFlow
	version 1.0, type PACKET_IN, length 125, xid 0x00000000
15:38:04.700292 IP 192.168.1.13.6633 > 192.168.1.30.59062: Flags [.], ack 25242, win 4937, options [nop,nop,TS val 16998004 ecr 23306026], length 0
15:38:04.700296 IP 192.168.1.30.59062 > 192.168.1.13.6633: Flags [P.], seq 26242:26367, ack 1, win 361, options [nop,nop,TS val 23306026 ecr 16998004], length 125: OpenFlow
	version 1.0, type PACKET_IN, length 125, xid 0x00000000
15:38:04.700306 IP 192.168.1.13.6633 > 192.168.1.30.59062: Flags [.], ack 25617, win 4937, options [nop,nop,TS val 16998004 ecr 23306026], length 0
15:38:04.700315 IP 192.168.1.13.6633 > 192.168.1.30.59062: Flags [.], ack 25867, win 4937, options [nop,nop,TS val 16998004 ecr 23306026], length 0
15:38:04.700336 IP 192.168.1.13.6633 > 192.168.1.30.59062: Flags [.], ack 26117, win 4937, options [nop,nop,TS val 16998004 ecr 23306026], length 0
15:38:04.700339 IP 192.168.1.30.59062 > 192.168.1.13.6633: Flags [P.], seq 26367:26492, ack 1, win 361, options [nop,nop,TS val 23306026 ecr 16998004], length 125: OpenFlow
	version 1.0, type PACKET_IN, length 125, xid 0x00000000
15:38:04.700373 IP 192.168.1.30.59062 > 192.168.1.13.6633: Flags [P.], seq 26492:26617, ack 1, win 361, options [nop,nop,TS val 23306026 ecr 16998004], length 125: OpenFlow
	version 1.0, type PACKET_IN, length 125, xid 0x00000000
15:38:04.700400 IP 192.168.1.30.59062 > 192.168.1.13.6633: Flags [P.], seq 26617:26742, ack 1, win 361, options [nop,nop,TS val 23306026 ecr 16998004], length 125: OpenFlow
	version 1.0, type PACKET_IN, length 125, xid 0x00000000
15:38:04.700425 IP 192.168.1.30.59062 > 192.168.1.13.6633: Flags [P.], seq 26742:26867, ack 1, win 361, options [nop,nop,TS val 23306026 ecr 16998004], length 125: OpenFlow
	version 1.0, type PACKET_IN, length 125, xid 0x00000000
15:38:04.700453 IP 192.168.1.30.59062 > 192.168.1.13.6633: Flags [P.], seq 26867:26992, ack 1, win 361, options [nop,nop,TS val 23306026 ecr 16998004], length 125: OpenFlow
	version 1.0, type PACKET_IN, length 125, xid 0x00000000
15:38:04.700528 IP 192.168.1.13.6633 > 192.168.1.30.59062: Flags [.], ack 26367, win 4937, options [nop,nop,TS val 16998004 ecr 23306026], length 0
15:38:04.700549 IP 192.168.1.13.6633 > 192.168.1.30.59062: Flags [.], ack 26742, win 4937, options [nop,nop,TS val 16998004 ecr 23306026], length 0
15:38:04.700746 IP 192.168.1.13.6633 > 192.168.1.30.59062: Flags [.], ack 26992, win 4937, options [nop,nop,TS val 16998004 ecr 23306026], length 0
15:38:04.839173 IP 192.168.1.30.59062 > 192.168.1.13.6633: Flags [P.], seq 26992:27117, ack 1, win 361, options [nop,nop,TS val 23306061 ecr 16998004], length 125: OpenFlow
	version 1.0, type PACKET_IN, length 125, xid 0x00000000
15:38:04.839219 IP 192.168.1.30.59062 > 192.168.1.13.6633: Flags [P.], seq 27117:27242, ack 1, win 361, options [nop,nop,TS val 23306061 ecr 16998004], length 125: OpenFlow
	version 1.0, type PACKET_IN, length 125, xid 0x00000000
15:38:04.839247 IP 192.168.1.30.59062 > 192.168.1.13.6633: Flags [P.], seq 27242:27367, ack 1, win 361, options [nop,nop,TS val 23306061 ecr 16998004], length 125: OpenFlow
	version 1.0, type PACKET_IN, length 125, xid 0x00000000
15:38:04.839272 IP 192.168.1.30.59062 > 192.168.1.13.6633: Flags [P.], seq 27367:27492, ack 1, win 361, options [nop,nop,TS val 23306061 ecr 16998004], length 125: OpenFlow
	version 1.0, type PACKET_IN, length 125, xid 0x00000000
15:38:04.839300 IP 192.168.1.30.59062 > 192.168.1.13.6633: Flags [P.], seq 27492:27617, ack 1, win 361, options [nop,nop,TS val 23306061 ecr 16998004], length 125: OpenFlow
	version 1.0, type PACKET_IN, length 125, xid 0x00000000
15:38:04.839326 IP 192.168.1.30.59062 > 192.168.1.13.6633: Flags [P.], seq 27617:27742, ack 1, win 361, options [nop,nop,TS val 23306061 ecr 16998004], length 125: OpenFlow
	version 1.0, type PACKET_IN, length 125, xid 0x00000000
15:38:04.839365 IP 192.168.1.30.59062 > 192.168.1.13.6633: Flags [P.], seq 27742:27870, ack 1, win 361, options [nop,nop,TS val 23306061 ecr 16998004], length 128: OpenFlow
	version 1.0, type PACKET_IN, length 128, xid 0x00000000
15:38:04.839393 IP 192.168.1.30.59062 > 192.168.1.13.6633: Flags [P.], seq 27870:27995, ack 1, win 361, options [nop,nop,TS val 23306061 ecr 16998004], length 125: OpenFlow
	version 1.0, type PACKET_IN, length 125, xid 0x00000000
15:38:04.839418 IP 192.168.1.30.59062 > 192.168.1.13.6633: Flags [P.], seq 27995:28120, ack 1, win 361, options [nop,nop,TS val 23306061 ecr 16998004], length 125: OpenFlow
	version 1.0, type PACKET_IN, length 125, xid 0x00000000
15:38:04.839446 IP 192.168.1.30.59062 > 192.168.1.13.6633: Flags [P.], seq 28120:28248, ack 1, win 361, options [nop,nop,TS val 23306061 ecr 16998004], length 128: OpenFlow
	version 1.0, type PACKET_IN, length 128, xid 0x00000000
15:38:04.839472 IP 192.168.1.30.59062 > 192.168.1.13.6633: Flags [P.], seq 28248:28376, ack 1, win 361, options [nop,nop,TS val 23306061 ecr 16998004], length 128: OpenFlow
	version 1.0, type PACKET_IN, length 128, xid 0x00000000
