12:20:30.084514 IP 192.168.1.30.60675 > 192.168.1.10.6633: Flags [P.], seq 158937977:158937985, ack 766401208, win 62, options [nop,nop,TS val 14635519 ecr 15194833], length 8: OpenFlow
	version unknown (0x04), type 0x02, length 8, xid 0x00000000
12:20:30.084700 IP 192.168.1.10.6633 > 192.168.1.30.60675: Flags [.], ack 8, win 352, options [nop,nop,TS val 15195209 ecr 14635519], length 0
12:20:30.085495 IP 192.168.1.10.6633 > 192.168.1.30.60675: Flags [P.], seq 1:9, ack 8, win 352, options [nop,nop,TS val 15195209 ecr 14635519], length 8: OpenFlow
	version unknown (0x04), type 0x03, length 8, xid 0x00000000
12:20:30.122390 IP 192.168.1.30.60675 > 192.168.1.10.6633: Flags [.], ack 9, win 62, options [nop,nop,TS val 14635529 ecr 15195209], length 0

